
 Primary working directories    : /global/cscratch1/sd/aannabe
 Secondary working directories  : /global/cscratch1/sd/aannabe
 Wavefunction directory         : /global/homes/a/aannabe/wfu/
 Main file repository           : /global/cscratch1/sd/aannabe/

 SHA1      : 2873118e99aab1bc19f5b6fc1784693c06d15c95
 NAME      : 2015.1.8
 ARCHNAME  : linux/x86_64
 FC        : /opt/cray/pe/craype/2.5.5/bin/ftn
 BLASLIB   : -Wl,-_start-group /opt/intel/compilers_and_libraries_2016.3.210/linux/mkl/lib/intel64/libmkl_intel_ilp64.a /opt/intel/compilers_and_libraries_2016.3.210/linux/mkl/lib/intel64/libmkl_intel_thread.a /opt/intel/compilers_and_libraries_2016.3.210/linux/mkl/lib/intel64/libmkl_core.a -Wl,-_end-group
 id        : lbl

 Nodes     nprocs
 nid00469     1

 Using customized tuning parameters: mindgm=8; mindgv=16; mindgc=4; mindgr=1; noblas=0; minvec=7
 default implementation of scratch files=df  

 ***,Si
 memory,8,g
 gthresh,twoint=1.e-12
 
 gprint,basis,orbitals
 gexpec,ekin,pot
 
 angstrom
 geometry={
 1                                                                               ! Number of atoms
 Si 0.0 0.0 0.0
 }
 
 basis={
 Including file /global/homes/a/aannabe/docs/totals_bfd/pps/Si.pp
 Including file /global/homes/a/aannabe/docs/totals_bfd/basis/aug-cc-pVnZ/Si_dz.basis
 }
 
 {hf
 wf,4,6,2
 occ,1,1,0,0,1,0,0,0
                                                                                 !open,1.2,1.5
 closed,1,0,0,0,0,0,0,0
                                                                                 !sym,
 }
 scf(i)=energy
 
 _CC_NORM_MAX=2.0
  !NOTE: Perturbative MRCC works only with UHF reference. So, here we will trick MRCC by doing zero UHF iteration right after ROHF.
 
 {uhf
 wf,4,6,2
 occ,1,1,0,0,1,0,0,0
                                                                                 !open,1.2,1.5
 closed,1,0,0,0,0,0,0,0
                                                                                 !sym,
 maxit,0
 }
 scf(i)=energy
 
 {mrcc,method=CCSDT(Q)
 orbital,ignore_error=1                                                          !Ignore the fact that UHF WF is not converged
 maxit,100
 core
 }
 posthf(i)=energy
 
 table,scf,posthf,ekin,pot
 save,2.csv,new
 
 

 Variables initialized (889), CPU time= 0.01 sec
 Commands  initialized (702), CPU time= 0.01 sec, 572 directives.
 Default parameters read. Elapsed time= 0.26 sec

 Checking input...
 Passed
1


                                         ***  PROGRAM SYSTEM MOLPRO  ***
                                       Copyright, TTI GmbH Stuttgart, 2015
                                    Version 2015.1 linked Sep  7 2016 23:09:38


 **********************************************************************************************************************************
 LABEL *   Si                                                                            
  64 bit serial version                                                                  DATE: 22-Jun-18          TIME: 11:28:04  
 **********************************************************************************************************************************

 SHA1:             2873118e99aab1bc19f5b6fc1784693c06d15c95
 **********************************************************************************************************************************

 THRESHOLDS:

 ZERO    =  1.00D-12  ONEINT  =  1.00D-12  TWOINT  =  1.00D-12  PREFAC  =  1.00D-14  LOCALI  =  1.00D-09  EORDER  =  1.00D-04
 ENERGY  =  0.00D+00  ETEST   =  0.00D+00  EDENS   =  0.00D+00  THRDEDEF=  1.00D-06  GRADIENT=  1.00D-02  STEP    =  1.00D-03
 ORBITAL =  1.00D-05  CIVEC   =  1.00D-05  COEFF   =  1.00D-04  PRINTCI =  5.00D-02  PUNCHCI =  9.90D+01  OPTGRAD =  3.00D-04
 OPTENERG=  1.00D-06  OPTSTEP =  3.00D-04  THRGRAD =  1.00D-10  COMPRESS=  1.00D-11  VARMIN  =  1.00D-07  VARMAX  =  1.00D-03
 THRDOUB =  0.00D+00  THRDIV  =  1.00D-05  THRRED  =  1.00D-07  THRPSP  =  1.00D+00  THRDC   =  1.00D-10  THRCS   =  1.00D-10
 THRNRM  =  1.00D-08  THREQ   =  0.00D+00  THRDE   =  1.00D+00  THRREF  =  1.00D-05  SPARFAC =  1.00D+00  THRDLP  =  1.00D-07
 THRDIA  =  1.00D-10  THRDLS  =  1.00D-07  THRGPS  =  0.00D+00  THRKEX  =  0.00D+00  THRDIS  =  2.00D-01  THRVAR  =  1.00D-10
 THRLOC  =  1.00D-06  THRGAP  =  1.00D-06  THRLOCT = -1.00D+00  THRGAPT = -1.00D+00  THRORB  =  1.00D-06  THRMLTP =  0.00D+00
 THRCPQCI=  1.00D-10  KEXTA   =  0.00D+00  THRCOARS=  0.00D+00  SYMTOL  =  1.00D-06  GRADTOL =  1.00D-06  THROVL  =  1.00D-08
 THRORTH =  1.00D-08  GRID    =  1.00D-06  GRIDMAX =  1.00D-03  DTMAX   =  0.00D+00  THROCCDE=  1.00D-01  THROCCDE=  1.00D-01



 ZUNIT=ANG
 

Geometry recognized as XYZ


 Variable memory set to 8000000000 words,  buffer space   230000 words

 SETTING BASIS          =    USERDEF


 Recomputing integrals since basis changed


 Using spherical harmonics



 PROGRAM * SEWARD (Integral evaluation for generally contracted gaussian basis sets)     Author: Roland Lindh, 1990

 Geometry written to block  1 of record 700

 Orientation using atomic masses  
 Molecule type: Atom
 Symmetry elements: X,Y,Z
 Rotational constants:       0.0000000      0.0000000      0.0000000 GHz  (calculated with average atomic masses)

 Point group  D2h 



 ATOMIC COORDINATES

 NR  ATOM    CHARGE       X              Y              Z

   1  SI      4.00    0.000000000    0.000000000    0.000000000


          SI  CORE POTENTIAL

          d POTENTIAL

 POWERS             1              3              2
 EXPONENTIALS   1.807211       9.996331       2.500432    
 COEFFICIENTS   4.000000       7.228842      -13.06726    

          s - d POTENTIAL

 POWERS             2
 EXPONENTIALS   2.266864    
 COEFFICIENTS   21.20532    

          p - d POTENTIAL

 POWERS             2
 EXPONENTIALS   2.116597    
 COEFFICIENTS   15.43694    


 BASIS DATA

   Nr Sym  Nuc  Type         Exponents   Contraction coefficients

    1.1 Ag    1  1s           0.059887     0.167492
                              0.130108     0.532550
                              0.282668     0.464290
                              0.614115    -0.002322
                              1.334205    -0.268234
                              2.898645     0.031921
                              6.297493    -0.000106
                             13.681707    -0.000145
                             29.724387     0.000067
    2.1 Ag    1  1s           0.023921     1.000000
    3.1 Ag    1  1s           0.059803     1.000000
    4.1 Ag    1  3d0          0.113450     1.000000
    5.1 Ag    1  3d2+         0.113450     1.000000
    6.1 Ag    1  3d0          0.283626     1.000000
    7.1 Ag    1  3d2+         0.283626     1.000000
    1.2 B3u   1  2px          0.036525     0.078761
                              0.076137     0.308331
                              0.158712     0.417773
                              0.330843     0.281676
                              0.689658     0.069876
                              1.437625    -0.056306
                              2.996797     0.000744
                              6.246966    -0.000259
                             13.022097    -0.000022
    2.2 B3u   1  2px          0.032628     1.000000
    3.2 B3u   1  2px          0.081570     1.000000
    1.3 B2u   1  2py          0.036525     0.078761
                              0.076137     0.308331
                              0.158712     0.417773
                              0.330843     0.281676
                              0.689658     0.069876
                              1.437625    -0.056306
                              2.996797     0.000744
                              6.246966    -0.000259
                             13.022097    -0.000022
    2.3 B2u   1  2py          0.032628     1.000000
    3.3 B2u   1  2py          0.081570     1.000000
    1.4 B1g   1  3d2-         0.113450     1.000000
    2.4 B1g   1  3d2-         0.283626     1.000000
    1.5 B1u   1  2pz          0.036525     0.078761
                              0.076137     0.308331
                              0.158712     0.417773
                              0.330843     0.281676
                              0.689658     0.069876
                              1.437625    -0.056306
                              2.996797     0.000744
                              6.246966    -0.000259
                             13.022097    -0.000022
    2.5 B1u   1  2pz          0.032628     1.000000
    3.5 B1u   1  2pz          0.081570     1.000000
    1.6 B2g   1  3d1+         0.113450     1.000000
    2.6 B2g   1  3d1+         0.283626     1.000000
    1.7 B3g   1  3d1-         0.113450     1.000000
    2.7 B3g   1  3d1-         0.283626     1.000000

 NUCLEAR CHARGE:                    4
 NUMBER OF PRIMITIVE AOS:          56
 NUMBER OF SYMMETRY AOS:           54
 NUMBER OF CONTRACTIONS:           22   (   7Ag  +   3B3u +   3B2u +   2B1g +   3B1u +   2B2g +   2B3g +   0Au  )
 NUMBER OF CORE ORBITALS:           0   (   0Ag  +   0B3u +   0B2u +   0B1g +   0B1u +   0B2g +   0B3g +   0Au  )
 NUMBER OF VALENCE ORBITALS:        4   (   1Ag  +   1B3u +   1B2u +   0B1g +   1B1u +   0B2g +   0B3g +   0Au  )


 NUCLEAR REPULSION ENERGY    0.00000000

 EXTRA SYMMETRY OF AOS IN SYMMETRY 1:   1 1 1 2 3 2 3

 Eigenvalues of metric

         1 0.373E-01 0.299E+00 0.299E+00 0.380E+00 0.170E+01 0.170E+01 0.258E+01
         2 0.564E-01 0.409E+00 0.253E+01
         3 0.564E-01 0.409E+00 0.253E+01
         4 0.299E+00 0.170E+01
         5 0.564E-01 0.409E+00 0.253E+01
         6 0.299E+00 0.170E+01
         7 0.299E+00 0.170E+01


 Contracted 2-electron integrals neglected if value below      1.0D-12
 AO integral compression algorithm  1   Integral accuracy      1.0D-12

     0.262 MB (compressed) written to integral file (100.0%)


 NUMBER OF SORTED TWO-ELECTRON INTEGRALS:       5272.     BUFFER LENGTH:  32768
 NUMBER OF SEGMENTS:   1  SEGMENT LENGTH:       5272      RECORD LENGTH: 524288

 Memory used in sort:       0.56 MW

 SORT1 READ       12220. AND WROTE        4734. INTEGRALS IN      1 RECORDS. CPU TIME:     0.00 SEC, REAL TIME:     0.01 SEC
 SORT2 READ        4734. AND WROTE        5272. INTEGRALS IN      1 RECORDS. CPU TIME:     0.00 SEC, REAL TIME:     0.01 SEC

 FILE SIZES:   FILE 1:    19.3 MBYTE,  FILE 4:     4.2 MBYTE,   TOTAL:     23.6 MBYTE

 OPERATOR DM      FOR CENTER  0  COORDINATES:    0.000000    0.000000    0.000000
 OPERATOR EKIN    FOR CENTER  0  COORDINATES:    0.000000    0.000000    0.000000
 OPERATOR POT     FOR CENTER  0  COORDINATES:    0.000000    0.000000    0.000000


 **********************************************************************************************************************************
 DATASETS  * FILE   NREC   LENGTH (MB)   RECORD NAMES
              1      20       19.12       500      610      700      900      950      970     1000      129      960     1100   
                                          VAR    BASINP    GEOM    SYMINP    ZMAT    AOBASIS   BASIS     P2S    ABASIS      S 
                                         1400     1410     1420     1200     1210     1080     1600     1650     1300     1700   
                                         EKIN       V       ECP      H0       H01     AOSYM     SMH    MOLCAS    ERIS     OPER   

 PROGRAMS   *        TOTAL       INT
 CPU TIMES  *         2.26      2.11
 REAL TIME  *        14.87 SEC
 DISK USED  *        23.83 MB      
 **********************************************************************************************************************************


 PROGRAM * RHF-SCF (OPEN SHELL)       Authors: W. Meyer, H.-J. Werner


 NUMBER OF ELECTRONS:       3+    1-    SPACE SYMMETRY=6    SPIN SYMMETRY: Triplet 
 CONVERGENCE THRESHOLDS:    1.00E-05 (Density)    1.00E-07 (Energy)
 MAX. NUMBER OF ITERATIONS:       60
 INTERPOLATION TYPE:            DIIS
 INTERPOLATION STEPS:              2 (START)      1 (STEP)
 LEVEL SHIFTS:                 -0.60 (CLOSED) -0.30 (OPEN) 

 Number of closed-shell orbitals:    1 (   1   0   0   0   0   0   0 )
 Number of open-shell orbitals:      2 (   0   1   0   0   1   0   0 )



   Atom=SI basis=ECP10MWB_GUESS    lmin=0  lmax=1

 Orbital guess generated from atomic densities. Full valence occupancy:    1   1   1   0   1   0   0   0


 Molecular orbital dump at record        2100.2

 ITERATION    DDIFF          GRAD             ENERGY        2-EL.EN.            DIPOLE MOMENTS         DIIS   ORB.
    1      0.000D+00      0.000D+00        -3.66679642      3.787208    0.00000    0.00000    0.00000    0    start
    2      0.000D+00      0.109D-01        -3.67474037      3.891778    0.00000    0.00000    0.00000    1    diag,B
    3      0.312D-01      0.558D-02        -3.67825294      3.982157    0.00000    0.00000    0.00000    2    diag,B
    4      0.265D-01      0.195D-02        -3.67867032      4.006368    0.00000    0.00000    0.00000    3    diag,B
    5      0.123D-01      0.205D-03        -3.67867177      4.004574    0.00000    0.00000    0.00000    4    diag,B
    6      0.867D-03      0.885D-04        -3.67867214      4.004809    0.00000    0.00000    0.00000    5    diag,B
    7      0.402D-03      0.106D-04        -3.67867214      4.004753    0.00000    0.00000    0.00000    6    fixocc
    8      0.596D-04      0.219D-05        -3.67867214      4.004721    0.00000    0.00000    0.00000    7    diag,B
    9      0.923D-05      0.343D-06        -3.67867214      4.004719    0.00000    0.00000    0.00000    0    orth

 Final alpha occupancy:   1   1   0   0   1   0   0
 Final beta  occupancy:   1   0   0   0   0   0   0

 !RHF STATE 1.6 Energy                 -3.678672144989
 Nuclear energy                         0.00000000
 One-electron energy                   -5.68103166
 Two-electron energy                    2.00235951
 Virial quotient                       -2.83250595
 !RHF STATE 1.6 Dipole moment           0.00000000     0.00000000     0.00000000
 Dipole moment /Debye                   0.00000000     0.00000000     0.00000000
 

 !RHF expec          <1.6|EKIN|1.6>     1.298734126945
 
 !RHF expec           <1.6|POT|1.6>    -1.930220468426

 ELECTRON ORBITALS
 =================


   Orb  Occ    Energy  Couls-En    Coefficients

                                   1 1s      1 1s      1 1s      1 3d0     1 3d2+    1 3d0     1 3d2+ 

   1.1   2    -0.5411   -2.1419  1.000483  0.000955 -0.001247  0.004175  0.007231 -0.000451 -0.000781

                                   1 2px     1 2px     1 2px  

   1.2   +    -0.2970   -1.5368  0.999871  0.000056  0.000104

                                   1 2pz     1 2pz     1 2pz  

   1.5   +    -0.2970   -1.5368  0.999871  0.000056  0.000104

 HOMO      1.2    -0.297014 =      -8.0822eV
 LUMO      1.3    -0.016427 =      -0.4470eV
 LUMO-HOMO         0.280586 =       7.6351eV


 **********************************************************************************************************************************
 DATASETS  * FILE   NREC   LENGTH (MB)   RECORD NAMES
              1      20       19.12       500      610      700      900      950      970     1000      129      960     1100   
                                          VAR    BASINP    GEOM    SYMINP    ZMAT    AOBASIS   BASIS     P2S    ABASIS      S 
                                         1400     1410     1420     1200     1210     1080     1600     1650     1300     1700   
                                         EKIN       V       ECP      H0       H01     AOSYM     SMH    MOLCAS    ERIS     OPER   

              2       4        2.75       700     1000      520     2100   
                                         GEOM     BASIS   MCVARS     RHF  

 PROGRAMS   *        TOTAL        HF       INT
 CPU TIMES  *         2.31      0.06      2.11
 REAL TIME  *        15.05 SEC
 DISK USED  *        23.83 MB      
 **********************************************************************************************************************************
 SETTING SCF(I)         =        -3.67867214  AU                              
 SETTING _CC_NORM_MAX   =         2.00000000                                  


 PROGRAM * UHF-SCF       Authors: W. Meyer, H.-J. Werner


 NUMBER OF ELECTRONS:       3+    1-    SPACE SYMMETRY=6    SPIN SYMMETRY: Triplet 
 CONVERGENCE THRESHOLDS:    1.00E-05 (Density)    1.00E-07 (Energy)
 MAX. NUMBER OF ITERATIONS:        0
 INTERPOLATION TYPE:            DIIS
 INTERPOLATION STEPS:              2 (START)      1 (STEP)
 LEVEL SHIFTS:                  0.20 (ALPHA)   0.20 (BETA) 

 Number of closed-shell orbitals:    1 (   1   0   0   0   0   0   0 )
 Number of open-shell orbitals:      2 (   0   1   0   0   1   0   0 )


 Molecular orbitals read from record     2100.2  Type=RHF/CANONICAL (state 1.6)

 Molecular orbital dump at record        2200.2

 Initial alpha occupation   1   1   0   0   1   0   0
 Initial beta  occupation   1   0   0   0   0   0   0

 ITERATION    DDIFF          GRAD             ENERGY        2-EL.EN.            DIPOLE MOMENTS         DIIS
    1      0.000D+00      0.000D+00        -3.67867214      4.004719    0.00000    0.00000    0.00000    0
 
 Final alpha occupancy:   1   1   0   0   1   0   0
 Final beta  occupancy:   1   0   0   0   0   0   0

 !UHF STATE 1.6 Energy                 -3.678672144989
 Nuclear energy                         0.00000000
 One-electron energy                   -5.68103166
 Two-electron energy                    2.00235951
 Virial quotient                       -2.83250595
 !UHF STATE 1.6 Dipole moment           0.00000000     0.00000000     0.00000000
 Dipole moment /Debye                   0.00000000     0.00000000     0.00000000
 

 !UHF expec          <1.6|EKIN|1.6>     1.298734126945
 
 !UHF expec           <1.6|POT|1.6>    -1.930220468426

 ELECTRON ORBITALS FOR POSITIVE SPIN
 ===================================


   Orb  Occ    Energy  Couls-En    Coefficients

                                   1 1s      1 1s      1 1s      1 3d0     1 3d2+    1 3d0     1 3d2+ 

   1.1   +    -0.5411   -2.1419  1.000483  0.000955 -0.001247  0.004175  0.007231 -0.000451 -0.000781

                                   1 2px     1 2px     1 2px  

   1.2   +    -0.2970   -1.5368  0.999871  0.000056  0.000104

                                   1 2pz     1 2pz     1 2pz  

   1.5   +    -0.2970   -1.5368  0.999871  0.000056  0.000104

 ELECTRON ORBITALS FOR NEGATIVE SPIN
 ===================================


   Orb  Occ    Energy  Couls-En    Coefficients

                                   1 1s      1 1s      1 1s      1 3d0     1 3d2+    1 3d0     1 3d2+ 

   1.1   -    -0.5411   -2.1419  1.000483  0.000955 -0.001247  0.004175  0.007231 -0.000451 -0.000781

 HOMO      1.2    -0.297014 =      -8.0822eV
 LUMO     -1.2    -0.297014 =      -8.0822eV
 LUMO-HOMO         0.000000 =       0.0000eV

 EXPECTATION VALUE OF S**2:             2.00000000

 Occupation number threshold for canonical orbitals:  1.999000 (occupied),  0.001000 (virtual)

 Number of pseudo-canonical orbitals per symmetry:    1   0   0   0   0   0   0
 Number of active natural orbitals per symmetry:      0   1   0   0   1   0   0

 NATURAL CHARGE ORBITALS
 =======================


   Orb     Occ        Energy       Coefficients

                                   1 1s      1 1s      1 1s      1 3d0     1 3d2+    1 3d0     1 3d2+ 

   1.1  2.00000    -0.541142     1.000483  0.000955 -0.001247  0.004175  0.007231 -0.000451 -0.000781

                                   1 2px     1 2px     1 2px  

   1.2  1.00000    -0.108690     0.999871  0.000056  0.000104

                                   1 2pz     1 2pz     1 2pz  

   1.5  1.00000    -0.108690     0.999871  0.000056  0.000104

 Natural orbitals saved to record    2200.2 (Orbital set 3)

 Orbital spaces for UNO-CAS (Min. occupation: 0.020  Max. occupation: 1.980):

 Closed:        1   0   0   0   0   0   0
 Active:        0   1   0   0   1   0   0

 No convergence



 **********************************************************************************************************************************
 DATASETS  * FILE   NREC   LENGTH (MB)   RECORD NAMES
              1      20       19.12       500      610      700      900      950      970     1000      129      960     1100   
                                          VAR    BASINP    GEOM    SYMINP    ZMAT    AOBASIS   BASIS     P2S    ABASIS      S 
                                         1400     1410     1420     1200     1210     1080     1600     1650     1300     1700   
                                         EKIN       V       ECP      H0       H01     AOSYM     SMH    MOLCAS    ERIS     OPER   

              2       5        5.25       700     1000      520     2100     2200   
                                         GEOM     BASIS   MCVARS     RHF      UHF  

 PROGRAMS   *        TOTAL       UHF        HF       INT
 CPU TIMES  *         2.35      0.03      0.06      2.11
 REAL TIME  *        15.22 SEC
 DISK USED  *        24.44 MB      
 **********************************************************************************************************************************
 SETTING SCF(I)         =        -3.67867214  AU                              


 PROGRAM * MRCC (General Multireference Coupled Cluster)    Author: M. Kallay, 2000-2005

 ***  Initialisation ***

   0 Spin projections
 
 Molecular orbitals read from record     2200.2  Type=UHF/ALPHA (state 1.6)

 ?Warning: UHF not converged
 Molecular orbitals read from record     2200.2  Type=UHF/BETA (state 1.6)

 ?Warning: UHF not converged
 
 Frozen orbitals:              0 (  0  0  0  0  0  0  0  0)
 Active orbitals:             22 (  7  3  3  2  3  2  2  0)
 Active electrons:             4
 Spin quantum number:          1.0

 Transformed integrals will be written to file mrcc_64690/fort.55

 Load integrals                2.4 sec
 Transform integrals           2.4 sec
 Storage for integrals:          28961
 Remaining memory:           *********

 Core energy:               0.00000000
 
 MRCC Input:
     4     0     0     0     3     0     0     6     0     0     0     1     1     0     0     7     0     0   0.000     0   64000
  ex.lev,nsing,ntrip, rest,method,dens,conver,symm, diag, CS ,spatial, HF, ndoub,nacto,nactv, tol, maxex, sacc, freq,  dboc,   mem
  2  0  0  0  0  0  0  1  0  0  0  0  0  0  0  1  0  0  0  0  0  0
 MRCC Input end
 Variable memory released
 MRCC now being run, temporary output in /global/cscratch1/sd/aannabe/mrcc_64690/mrcc.out
 **********************************************************************
                          MRCC program system
 **********************************************************************

                              Written by
  Mihaly Kallay, Zoltan Rolik, Jozsef Csontos, Peter Nagy, Gyula Samu,
      David Mester, Jozsef Csoka, Bernat Szabo, Istvan Ladjanszki,
       Lorant Szegedy, Bence Ladoczki, Klara Petrov, Mate Farkas,
                    Pal D. Mezei, and Bence Hegely

        Department of Physical Chemistry and Materials Science
            Budapest University of Technology and Economics
                  Budapest P.O.Box 91, H-1521 Hungary

                              www.mrcc.hu

                       Release date: May 23, 2018

 ************************ 2018-06-22 11:28:21 *************************
 Executing goldstone...

 Generation of CC equations in terms of H and T...
 Generation of antisymmetrized Goldstone diagrams...
 Number of diagrams in T^1 equations:    15
 Number of diagrams in T^2 equations:    38
 Number of diagrams in T^3 equations:    49
 Number of diagrams in T^4 equations:     5
 Translation of diagrams to factorized equations...
 Optimizing intermediate calculation...
 Number of floating-point operations per iteration step:   1.0061E+07
 Probable CPU time per iteration step (hours):      0.00
 Required memory (Mbytes):      21.3
 Number of intermediates:                                  80
 Number of intermediates to be stored:                     32
 Length of intermediate file (Mbytes):       0.5

 ************************ 2018-06-22 11:28:21 *************************
 Executing xmrcc...

 **********************************************************************
 CC(3)(4) calculation


 Allocation of 100.0 Mbytes of memory...
 Number of spinorbitals:                    44
 Number of alpha electrons:                        3
 Number of beta electrons:                         1
 Spin multiplicity:                     2
 z-component of spin:  1.0
 Spatial symmetry:                      6
 Convergence criterion:  1.0E-07
 Construction of occupation graphs...
 Number of                     0 -fold excitations:                      1
 Number of                     1 -fold excitations:                     16
 Number of                     2 -fold excitations:                    237
 Number of                     3 -fold excitations:                   1446
 Total number of configurations:                   1700
 Calculation of coupling coefficients...
 Length of intermediate file (Mbytes):       0.7

 ======================================================================

 Spin case  1   Alpha:  3   Beta:  1
 Number of excitations:                   2524
 Number of                     4 -fold excitations:                   2524

 Memory requirements /Mbyte/:
               Minimal        Optimal
 Real*8:         13.8830        13.8869
 Integer:         3.7478
 Total:          17.6308        17.6347


 ************************ 2018-06-22 11:28:22 *************************
 Executing mrcc...

 **********************************************************************
 CCSDT(Q) calculation


 OpenMP parallel version is running.
 Number of CPUs:   1
 Allocation of   13.9 Mbytes of memory...
 Number of spinorbitals:  44
 Number of alpha electrons:  3
 Number of beta  electrons:  1
 Spin multiplicity: 2
 z-component of spin:  1.0
 Spatial symmetry: 6
 Convergence criterion:  1.0E-07
 Construction of occupation graphs...
 Number of 0-fold excitations: 1
 Number of 1-fold excitations: 16
 Number of 2-fold excitations: 237
 Number of 3-fold excitations: 1446
 Total number of determinants: 1700
 Calculation of coupling coefficients...
 Initial cluster amplitudes are generated.
 Length of intermediate file (Mbytes):       0.7
 Reading integral list from unit 55...
 Sorting integrals...
 Sorting integrals...
 Sorting integrals...
 Sorting integrals...
 Energy of reference determinant [au]:      -3.678672144989
 Calculation of MP denominators...

 Starting CC iteration...
 ======================================================================
 Norm of residual vector:     0.27574947
 CPU time [min]:     0.003                   Wall time [min]:     0.004

 Iteration  1  CC energy:    -3.73022696  Energy decrease:   0.05155482
 ======================================================================
 Norm of residual vector:     0.08603951
 CPU time [min]:     0.004                   Wall time [min]:     0.005

 Iteration  2  CC energy:    -3.74757081  Energy decrease:   0.01734385
 ======================================================================
 Norm of residual vector:     0.02404273
 CPU time [min]:     0.005                   Wall time [min]:     0.006

 Iteration  3  CC energy:    -3.75034012  Energy decrease:   0.00276931
 ======================================================================
 Norm of residual vector:     0.00597685
 CPU time [min]:     0.007                   Wall time [min]:     0.008

 Iteration  4  CC energy:    -3.75098329  Energy decrease:   0.00064317
 ======================================================================
 Norm of residual vector:     0.00172897
 CPU time [min]:     0.008                   Wall time [min]:     0.009

 Iteration  5  CC energy:    -3.75089128  Energy decrease:   0.00009200
 ======================================================================
 Norm of residual vector:     0.00048949
 CPU time [min]:     0.009                   Wall time [min]:     0.010

 Iteration  6  CC energy:    -3.75090174  Energy decrease:   0.00001046
 ======================================================================
 Norm of residual vector:     0.00013942
 CPU time [min]:     0.011                   Wall time [min]:     0.011

 Iteration  7  CC energy:    -3.75090482  Energy decrease:   0.00000307
 ======================================================================
 Norm of residual vector:     0.00004628
 CPU time [min]:     0.012                   Wall time [min]:     0.013

 Iteration  8  CC energy:    -3.75090318  Energy decrease:   0.00000164
 ======================================================================
 Norm of residual vector:     0.00001493
 CPU time [min]:     0.013                   Wall time [min]:     0.014

 Iteration  9  CC energy:    -3.75090368  Energy decrease:   0.00000051
 ======================================================================
 Norm of residual vector:     0.00000516
 CPU time [min]:     0.014                   Wall time [min]:     0.017

 Iteration 10  CC energy:    -3.75090358  Energy decrease:   0.00000011
 ======================================================================
 Norm of residual vector:     0.00000140
 CPU time [min]:     0.016                   Wall time [min]:     0.018

 Iteration 11  CC energy:    -3.75090355  Energy decrease:   0.00000003
 ======================================================================
 Norm of residual vector:     0.00000036
 CPU time [min]:     0.017                   Wall time [min]:     0.020

 Iteration 12  CC energy:    -3.75090358  Energy decrease:   0.00000002
 ======================================================================
 Norm of residual vector:     0.00000010
 CPU time [min]:     0.018                   Wall time [min]:     0.021

 Iteration 13  CC energy:    -3.75090357  Energy decrease:   1.8928E-09
 ======================================================================

 Iteration has converged in 13 steps.

 Final results:
 Total CCSDT energy [au]:             -3.750903573876
 Total MP2 energy [au]:               -3.730226961474

 Perturbative corrections are calculated...
 ======================================================================
 Spin case  1   Alpha:  3   Beta:  1
 Number of excitations:        2524
 CPU time [min]:     0.030                   Wall time [min]:     0.032
 ======================================================================
 Number of 4-fold excitations: 2524
 CPU time [min]:     0.030                   Wall time [min]:     0.032

 Total CCSDT[Q] energy [au]:          -3.750943773932
 Total CCSDT(Q) energy [au]:          -3.750949697464

 ************************ 2018-06-22 11:28:24 *************************
                      Normal termination of mrcc.
 **********************************************************************
 !CCSDT STATE 1.6 Energy               -3.750903573876
 !MP2 STATE 1.6 Energy                 -3.730226961474
 !CCSDT[Q] STATE 1.6 Energy            -3.750943773932
 !CCSDT(Q) STATE 1.6 Energy            -3.750949697464
 
 CPU-time for MRCC:              1.8 sec
 Elapsed-time for MRCC:          5.0 sec

 Variable memory set to 8000000000 words,  buffer space   230000 words



 **********************************************************************************************************************************
 DATASETS  * FILE   NREC   LENGTH (MB)   RECORD NAMES
              1      20       19.12       500      610      700      900      950      970     1000      129      960     1100   
                                          VAR    BASINP    GEOM    SYMINP    ZMAT    AOBASIS   BASIS     P2S    ABASIS      S 
                                         1400     1410     1420     1200     1210     1080     1600     1650     1300     1700   
                                         EKIN       V       ECP      H0       H01     AOSYM     SMH    MOLCAS    ERIS     OPER   

              2       5        5.25       700     1000      520     2100     2200   
                                         GEOM     BASIS   MCVARS     RHF      UHF  

 PROGRAMS   *        TOTAL      MRCC       UHF        HF       INT
 CPU TIMES  *         4.24      1.89      0.03      0.06      2.11
 REAL TIME  *        20.76 SEC
 DISK USED  *        24.44 MB      
 **********************************************************************************************************************************
 SETTING POSTHF(I)      =        -3.75094970  AU                              
                                                                                                                                                                                                                                                                

       SCF           POSTHF       EKIN          POT
    -3.67867214   -3.75094970   1.29873413   -1.93022047
                                                  

 CCSDT(Q)/USERDEF energy=     -3.750949697464

        CCSDT(Q)        HF-SCF  
     -3.75094970     -3.67867214
 **********************************************************************************************************************************
 Variable memory released
