
 Primary working directories    : /global/cscratch1/sd/aannabe
 Secondary working directories  : /global/cscratch1/sd/aannabe
 Wavefunction directory         : /global/homes/a/aannabe/wfu/
 Main file repository           : /global/cscratch1/sd/aannabe/

 SHA1      : 2873118e99aab1bc19f5b6fc1784693c06d15c95
 NAME      : 2015.1.8
 ARCHNAME  : linux/x86_64
 FC        : /opt/cray/pe/craype/2.5.5/bin/ftn
 BLASLIB   : -Wl,-_start-group /opt/intel/compilers_and_libraries_2016.3.210/linux/mkl/lib/intel64/libmkl_intel_ilp64.a /opt/intel/compilers_and_libraries_2016.3.210/linux/mkl/lib/intel64/libmkl_intel_thread.a /opt/intel/compilers_and_libraries_2016.3.210/linux/mkl/lib/intel64/libmkl_core.a -Wl,-_end-group
 id        : lbl

 Nodes     nprocs
 nid00469     1

 Using customized tuning parameters: mindgm=8; mindgv=16; mindgc=4; mindgr=1; noblas=0; minvec=7
 default implementation of scratch files=df  

 ***,Si
 memory,8,g
 gthresh,twoint=1.e-12
 
 gprint,basis,orbitals
 gexpec,ekin,pot
 
 angstrom
 geometry={
 1                                                                               ! Number of atoms
 Si 0.0 0.0 0.0
 }
 
 basis={
 Including file /global/homes/a/aannabe/docs/totals_bfd/pps/Si.pp
 Including file /global/homes/a/aannabe/docs/totals_bfd/basis/aug-cc-pVnZ/Si_5z.basis
 }
 
 {hf
 wf,4,6,2
 occ,1,1,0,0,1,0,0,0
                                                                                 !open,1.2,1.5
 closed,1,0,0,0,0,0,0,0
                                                                                 !sym,
 }
 scf(i)=energy
 
 _CC_NORM_MAX=2.0
  !NOTE: Perturbative MRCC works only with UHF reference. So, here we will trick MRCC by doing zero UHF iteration right after ROHF.
 
 {uhf
 wf,4,6,2
 occ,1,1,0,0,1,0,0,0
                                                                                 !open,1.2,1.5
 closed,1,0,0,0,0,0,0,0
                                                                                 !sym,
 maxit,0
 }
 scf(i)=energy
 
 {mrcc,method=CCSDT(Q)
 orbital,ignore_error=1                                                          !Ignore the fact that UHF WF is not converged
 maxit,100
 core
 }
 posthf(i)=energy
 
 table,scf,posthf,ekin,pot
 save,5.csv,new
 
 

 Variables initialized (889), CPU time= 0.00 sec
 Commands  initialized (702), CPU time= 0.02 sec, 572 directives.
 Default parameters read. Elapsed time= 0.15 sec

 Checking input...
 Passed
1


                                         ***  PROGRAM SYSTEM MOLPRO  ***
                                       Copyright, TTI GmbH Stuttgart, 2015
                                    Version 2015.1 linked Sep  7 2016 23:09:38


 **********************************************************************************************************************************
 LABEL *   Si                                                                            
  64 bit serial version                                                                  DATE: 22-Jun-18          TIME: 11:38:28  
 **********************************************************************************************************************************

 SHA1:             2873118e99aab1bc19f5b6fc1784693c06d15c95
 **********************************************************************************************************************************

 THRESHOLDS:

 ZERO    =  1.00D-12  ONEINT  =  1.00D-12  TWOINT  =  1.00D-12  PREFAC  =  1.00D-14  LOCALI  =  1.00D-09  EORDER  =  1.00D-04
 ENERGY  =  0.00D+00  ETEST   =  0.00D+00  EDENS   =  0.00D+00  THRDEDEF=  1.00D-06  GRADIENT=  1.00D-02  STEP    =  1.00D-03
 ORBITAL =  1.00D-05  CIVEC   =  1.00D-05  COEFF   =  1.00D-04  PRINTCI =  5.00D-02  PUNCHCI =  9.90D+01  OPTGRAD =  3.00D-04
 OPTENERG=  1.00D-06  OPTSTEP =  3.00D-04  THRGRAD =  1.00D-10  COMPRESS=  1.00D-11  VARMIN  =  1.00D-07  VARMAX  =  1.00D-03
 THRDOUB =  0.00D+00  THRDIV  =  1.00D-05  THRRED  =  1.00D-07  THRPSP  =  1.00D+00  THRDC   =  1.00D-10  THRCS   =  1.00D-10
 THRNRM  =  1.00D-08  THREQ   =  0.00D+00  THRDE   =  1.00D+00  THRREF  =  1.00D-05  SPARFAC =  1.00D+00  THRDLP  =  1.00D-07
 THRDIA  =  1.00D-10  THRDLS  =  1.00D-07  THRGPS  =  0.00D+00  THRKEX  =  0.00D+00  THRDIS  =  2.00D-01  THRVAR  =  1.00D-10
 THRLOC  =  1.00D-06  THRGAP  =  1.00D-06  THRLOCT = -1.00D+00  THRGAPT = -1.00D+00  THRORB  =  1.00D-06  THRMLTP =  0.00D+00
 THRCPQCI=  1.00D-10  KEXTA   =  0.00D+00  THRCOARS=  0.00D+00  SYMTOL  =  1.00D-06  GRADTOL =  1.00D-06  THROVL  =  1.00D-08
 THRORTH =  1.00D-08  GRID    =  1.00D-06  GRIDMAX =  1.00D-03  DTMAX   =  0.00D+00  THROCCDE=  1.00D-01  THROCCDE=  1.00D-01



 ZUNIT=ANG
 

Geometry recognized as XYZ


 Variable memory set to 8000000000 words,  buffer space   230000 words

 SETTING BASIS          =    USERDEF


 Recomputing integrals since basis changed


 Using spherical harmonics



 PROGRAM * SEWARD (Integral evaluation for generally contracted gaussian basis sets)     Author: Roland Lindh, 1990

 Geometry written to block  1 of record 700

 Orientation using atomic masses  
 Molecule type: Atom
 Symmetry elements: X,Y,Z
 Rotational constants:       0.0000000      0.0000000      0.0000000 GHz  (calculated with average atomic masses)

 Point group  D2h 



 ATOMIC COORDINATES

 NR  ATOM    CHARGE       X              Y              Z

   1  SI      4.00    0.000000000    0.000000000    0.000000000


          SI  CORE POTENTIAL

          d POTENTIAL

 POWERS             1              3              2
 EXPONENTIALS   1.807211       9.996331       2.500432    
 COEFFICIENTS   4.000000       7.228842      -13.06726    

          s - d POTENTIAL

 POWERS             2
 EXPONENTIALS   2.266864    
 COEFFICIENTS   21.20532    

          p - d POTENTIAL

 POWERS             2
 EXPONENTIALS   2.116597    
 COEFFICIENTS   15.43694    


 BASIS DATA

   Nr Sym  Nuc  Type         Exponents   Contraction coefficients

    1.1 Ag    1  1s           0.059887     0.167492
                              0.130108     0.532550
                              0.282668     0.464290
                              0.614115    -0.002322
                              1.334205    -0.268234
                              2.898645     0.031921
                              6.297493    -0.000106
                             13.681707    -0.000145
                             29.724387     0.000067
    2.1 Ag    1  1s           0.030200     1.000000
    3.1 Ag    1  1s           0.075500     1.000000
    4.1 Ag    1  1s           0.196459     1.000000
    5.1 Ag    1  1s           0.424036     1.000000
    6.1 Ag    1  1s           0.920486     1.000000
    7.1 Ag    1  3d0          0.051178     1.000000
    8.1 Ag    1  3d2+         0.051178     1.000000
    9.1 Ag    1  3d0          0.127945     1.000000
   10.1 Ag    1  3d2+         0.127945     1.000000
   11.1 Ag    1  3d0          0.353096     1.000000
   12.1 Ag    1  3d2+         0.353096     1.000000
   13.1 Ag    1  3d0          0.805426     1.000000
   14.1 Ag    1  3d2+         0.805426     1.000000
   15.1 Ag    1  3d0          1.247695     1.000000
   16.1 Ag    1  3d2+         1.247695     1.000000
   17.1 Ag    1  5g0          0.119954     1.000000
   18.1 Ag    1  5g4+         0.119954     1.000000
   19.1 Ag    1  5g2+         0.119954     1.000000
   20.1 Ag    1  5g0          0.299885     1.000000
   21.1 Ag    1  5g4+         0.299885     1.000000
   22.1 Ag    1  5g2+         0.299885     1.000000
   23.1 Ag    1  5g0          0.647054     1.000000
   24.1 Ag    1  5g4+         0.647054     1.000000
   25.1 Ag    1  5g2+         0.647054     1.000000
    1.2 B3u   1  2px          0.036525     0.078761
                              0.076137     0.308331
                              0.158712     0.417773
                              0.330843     0.281676
                              0.689658     0.069876
                              1.437625    -0.056306
                              2.996797     0.000744
                              6.246966    -0.000259
                             13.022097    -0.000022
    2.2 B3u   1  2px          0.019254     1.000000
    3.2 B3u   1  2px          0.048136     1.000000
    4.2 B3u   1  2px          0.115813     1.000000
    5.2 B3u   1  2px          0.238594     1.000000
    6.2 B3u   1  2px          0.496918     1.000000
    7.2 B3u   1  4f1+         0.069150     1.000000
    8.2 B3u   1  4f3+         0.069150     1.000000
    9.2 B3u   1  4f1+         0.172876     1.000000
   10.2 B3u   1  4f3+         0.172876     1.000000
   11.2 B3u   1  4f1+         0.402208     1.000000
   12.2 B3u   1  4f3+         0.402208     1.000000
   13.2 B3u   1  4f1+         0.833081     1.000000
   14.2 B3u   1  4f3+         0.833081     1.000000
   15.2 B3u   1  6h1+         0.223017     1.000000
   16.2 B3u   1  6h3+         0.223017     1.000000
   17.2 B3u   1  6h5+         0.223017     1.000000
   18.2 B3u   1  6h1+         0.557542     1.000000
   19.2 B3u   1  6h3+         0.557542     1.000000
   20.2 B3u   1  6h5+         0.557542     1.000000
    1.3 B2u   1  2py          0.036525     0.078761
                              0.076137     0.308331
                              0.158712     0.417773
                              0.330843     0.281676
                              0.689658     0.069876
                              1.437625    -0.056306
                              2.996797     0.000744
                              6.246966    -0.000259
                             13.022097    -0.000022
    2.3 B2u   1  2py          0.019254     1.000000
    3.3 B2u   1  2py          0.048136     1.000000
    4.3 B2u   1  2py          0.115813     1.000000
    5.3 B2u   1  2py          0.238594     1.000000
    6.3 B2u   1  2py          0.496918     1.000000
    7.3 B2u   1  4f1-         0.069150     1.000000
    8.3 B2u   1  4f3-         0.069150     1.000000
    9.3 B2u   1  4f1-         0.172876     1.000000
   10.3 B2u   1  4f3-         0.172876     1.000000
   11.3 B2u   1  4f1-         0.402208     1.000000
   12.3 B2u   1  4f3-         0.402208     1.000000
   13.3 B2u   1  4f1-         0.833081     1.000000
   14.3 B2u   1  4f3-         0.833081     1.000000
   15.3 B2u   1  6h1-         0.223017     1.000000
   16.3 B2u   1  6h3-         0.223017     1.000000
   17.3 B2u   1  6h5-         0.223017     1.000000
   18.3 B2u   1  6h1-         0.557542     1.000000
   19.3 B2u   1  6h3-         0.557542     1.000000
   20.3 B2u   1  6h5-         0.557542     1.000000
    1.4 B1g   1  3d2-         0.051178     1.000000
    2.4 B1g   1  3d2-         0.127945     1.000000
    3.4 B1g   1  3d2-         0.353096     1.000000
    4.4 B1g   1  3d2-         0.805426     1.000000
    5.4 B1g   1  3d2-         1.247695     1.000000
    6.4 B1g   1  5g2-         0.119954     1.000000
    7.4 B1g   1  5g4-         0.119954     1.000000
    8.4 B1g   1  5g2-         0.299885     1.000000
    9.4 B1g   1  5g4-         0.299885     1.000000
   10.4 B1g   1  5g2-         0.647054     1.000000
   11.4 B1g   1  5g4-         0.647054     1.000000
    1.5 B1u   1  2pz          0.036525     0.078761
                              0.076137     0.308331
                              0.158712     0.417773
                              0.330843     0.281676
                              0.689658     0.069876
                              1.437625    -0.056306
                              2.996797     0.000744
                              6.246966    -0.000259
                             13.022097    -0.000022
    2.5 B1u   1  2pz          0.019254     1.000000
    3.5 B1u   1  2pz          0.048136     1.000000
    4.5 B1u   1  2pz          0.115813     1.000000
    5.5 B1u   1  2pz          0.238594     1.000000
    6.5 B1u   1  2pz          0.496918     1.000000
    7.5 B1u   1  4f0          0.069150     1.000000
    8.5 B1u   1  4f2+         0.069150     1.000000
    9.5 B1u   1  4f0          0.172876     1.000000
   10.5 B1u   1  4f2+         0.172876     1.000000
   11.5 B1u   1  4f0          0.402208     1.000000
   12.5 B1u   1  4f2+         0.402208     1.000000
   13.5 B1u   1  4f0          0.833081     1.000000
   14.5 B1u   1  4f2+         0.833081     1.000000
   15.5 B1u   1  6h2+         0.223017     1.000000
   16.5 B1u   1  6h4+         0.223017     1.000000
   17.5 B1u   1  6h0          0.223017     1.000000
   18.5 B1u   1  6h2+         0.557542     1.000000
   19.5 B1u   1  6h4+         0.557542     1.000000
   20.5 B1u   1  6h0          0.557542     1.000000
    1.6 B2g   1  3d1+         0.051178     1.000000
    2.6 B2g   1  3d1+         0.127945     1.000000
    3.6 B2g   1  3d1+         0.353096     1.000000
    4.6 B2g   1  3d1+         0.805426     1.000000
    5.6 B2g   1  3d1+         1.247695     1.000000
    6.6 B2g   1  5g1+         0.119954     1.000000
    7.6 B2g   1  5g3+         0.119954     1.000000
    8.6 B2g   1  5g1+         0.299885     1.000000
    9.6 B2g   1  5g3+         0.299885     1.000000
   10.6 B2g   1  5g1+         0.647054     1.000000
   11.6 B2g   1  5g3+         0.647054     1.000000
    1.7 B3g   1  3d1-         0.051178     1.000000
    2.7 B3g   1  3d1-         0.127945     1.000000
    3.7 B3g   1  3d1-         0.353096     1.000000
    4.7 B3g   1  3d1-         0.805426     1.000000
    5.7 B3g   1  3d1-         1.247695     1.000000
    6.7 B3g   1  5g1-         0.119954     1.000000
    7.7 B3g   1  5g3-         0.119954     1.000000
    8.7 B3g   1  5g1-         0.299885     1.000000
    9.7 B3g   1  5g3-         0.299885     1.000000
   10.7 B3g   1  5g1-         0.647054     1.000000
   11.7 B3g   1  5g3-         0.647054     1.000000
    1.8 Au    1  4f2-         0.069150     1.000000
    2.8 Au    1  4f2-         0.172876     1.000000
    3.8 Au    1  4f2-         0.402208     1.000000
    4.8 Au    1  4f2-         0.833081     1.000000
    5.8 Au    1  6h4-         0.223017     1.000000
    6.8 Au    1  6h2-         0.223017     1.000000
    7.8 Au    1  6h4-         0.557542     1.000000
    8.8 Au    1  6h2-         0.557542     1.000000

 NUCLEAR CHARGE:                    4
 NUMBER OF PRIMITIVE AOS:         213
 NUMBER OF SYMMETRY AOS:          158
 NUMBER OF CONTRACTIONS:          126   (  25Ag  +  20B3u +  20B2u +  11B1g +  20B1u +  11B2g +  11B3g +   8Au  )
 NUMBER OF CORE ORBITALS:           0   (   0Ag  +   0B3u +   0B2u +   0B1g +   0B1u +   0B2g +   0B3g +   0Au  )
 NUMBER OF VALENCE ORBITALS:        4   (   1Ag  +   1B3u +   1B2u +   0B1g +   1B1u +   0B2g +   0B3g +   0Au  )


 NUCLEAR REPULSION ENERGY    0.00000000

 EXTRA SYMMETRY OF AOS IN SYMMETRY 1:   1 1 1 1 1 1 2 3 2 3   2 3 2 3 2 3 4 5 6 4   5 6 4 5 6
 EXTRA SYMMETRY OF AOS IN SYMMETRY 2:   1 1 1 1 1 1 2 3 2 3   2 3 2 3 4 5 6 4 5 6
 EXTRA SYMMETRY OF AOS IN SYMMETRY 3:   1 1 1 1 1 1 2 3 2 3   2 3 2 3 4 5 6 4 5 6
 EXTRA SYMMETRY OF AOS IN SYMMETRY 4:   1 1 1 1 1 2 3 2 3 2   3
 EXTRA SYMMETRY OF AOS IN SYMMETRY 5:   1 1 1 1 1 1 2 3 2 3   2 3 2 3 4 5 6 4 5 6
 EXTRA SYMMETRY OF AOS IN SYMMETRY 6:   1 1 1 1 1 2 3 2 3 2   3
 EXTRA SYMMETRY OF AOS IN SYMMETRY 7:   1 1 1 1 1 2 3 2 3 2   3
 EXTRA SYMMETRY OF AOS IN SYMMETRY 8:   1 1 1 1 2 3 2 3

 Eigenvalues of metric

         1 0.966E-04 0.589E-02 0.207E-01 0.207E-01 0.471E-01 0.137E+00 0.137E+00 0.198E+00
         2 0.508E-03 0.130E-01 0.853E-01 0.853E-01 0.919E-01 0.385E+00 0.385E+00 0.413E+00
         3 0.508E-03 0.130E-01 0.853E-01 0.853E-01 0.919E-01 0.385E+00 0.385E+00 0.413E+00
         4 0.207E-01 0.137E+00 0.198E+00 0.198E+00 0.503E+00 0.830E+00 0.830E+00 0.153E+01
         5 0.508E-03 0.130E-01 0.853E-01 0.853E-01 0.919E-01 0.385E+00 0.385E+00 0.413E+00
         6 0.207E-01 0.137E+00 0.198E+00 0.198E+00 0.503E+00 0.830E+00 0.830E+00 0.153E+01
         7 0.207E-01 0.137E+00 0.198E+00 0.198E+00 0.503E+00 0.830E+00 0.830E+00 0.153E+01
         8 0.853E-01 0.385E+00 0.483E+00 0.483E+00 0.117E+01 0.152E+01 0.152E+01 0.236E+01


 Contracted 2-electron integrals neglected if value below      1.0D-12
 AO integral compression algorithm  1   Integral accuracy      1.0D-12

     29.098 MB (compressed) written to integral file ( 52.5%)


 NUMBER OF SORTED TWO-ELECTRON INTEGRALS:    4156552.     BUFFER LENGTH:  32768
 NUMBER OF SEGMENTS:   1  SEGMENT LENGTH:    4156552      RECORD LENGTH: 524288

 Memory used in sort:       4.71 MW

 SORT1 READ     6989366. AND WROTE     2907704. INTEGRALS IN      9 RECORDS. CPU TIME:     0.23 SEC, REAL TIME:     0.34 SEC
 SORT2 READ     2907704. AND WROTE     4156552. INTEGRALS IN    111 RECORDS. CPU TIME:     0.20 SEC, REAL TIME:     0.42 SEC

 FILE SIZES:   FILE 1:    48.6 MBYTE,  FILE 4:    37.8 MBYTE,   TOTAL:     86.3 MBYTE

 OPERATOR DM      FOR CENTER  0  COORDINATES:    0.000000    0.000000    0.000000
 OPERATOR EKIN    FOR CENTER  0  COORDINATES:    0.000000    0.000000    0.000000
 OPERATOR POT     FOR CENTER  0  COORDINATES:    0.000000    0.000000    0.000000


 **********************************************************************************************************************************
 DATASETS  * FILE   NREC   LENGTH (MB)   RECORD NAMES
              1      20       37.06       500      610      700      900      950      970     1000      129      960     1100   
                                          VAR    BASINP    GEOM    SYMINP    ZMAT    AOBASIS   BASIS     P2S    ABASIS      S 
                                         1400     1410     1420     1200     1210     1080     1600     1650     1300     1700   
                                         EKIN       V       ECP      H0       H01     AOSYM     SMH    MOLCAS    ERIS     OPER   

 PROGRAMS   *        TOTAL       INT
 CPU TIMES  *         4.29      4.13
 REAL TIME  *        17.59 SEC
 DISK USED  *        86.64 MB      
 **********************************************************************************************************************************


 PROGRAM * RHF-SCF (OPEN SHELL)       Authors: W. Meyer, H.-J. Werner


 NUMBER OF ELECTRONS:       3+    1-    SPACE SYMMETRY=6    SPIN SYMMETRY: Triplet 
 CONVERGENCE THRESHOLDS:    1.00E-05 (Density)    1.00E-07 (Energy)
 MAX. NUMBER OF ITERATIONS:       60
 INTERPOLATION TYPE:            DIIS
 INTERPOLATION STEPS:              2 (START)      1 (STEP)
 LEVEL SHIFTS:                 -0.60 (CLOSED) -0.30 (OPEN) 

 Number of closed-shell orbitals:    1 (   1   0   0   0   0   0   0   0 )
 Number of open-shell orbitals:      2 (   0   1   0   0   1   0   0   0 )



   Atom=SI basis=ECP10MWB_GUESS    lmin=0  lmax=1

 Orbital guess generated from atomic densities. Full valence occupancy:    1   1   1   0   1   0   0   0


 Molecular orbital dump at record        2100.2

 ITERATION    DDIFF          GRAD             ENERGY        2-EL.EN.            DIPOLE MOMENTS         DIIS   ORB.
    1      0.000D+00      0.000D+00        -3.66684895      3.785616    0.00000    0.00000    0.00000    0    start
    2      0.000D+00      0.494D-02        -3.67492310      3.895852    0.00000    0.00000    0.00000    1    diag,B
    3      0.596D-02      0.221D-02        -3.67798180      3.972257    0.00000    0.00000    0.00000    2    diag,B
    4      0.383D-02      0.957D-03        -3.67864168      4.002540    0.00000    0.00000    0.00000    3    diag,B
    5      0.207D-02      0.271D-03        -3.67867364      4.004476    0.00000    0.00000    0.00000    4    diag,B
    6      0.614D-03      0.730D-04        -3.67867552      4.004923    0.00000    0.00000    0.00000    5    diag,B
    7      0.487D-03      0.143D-04        -3.67867557      4.004744    0.00000    0.00000    0.00000    6    fixocc
    8      0.120D-03      0.519D-05        -3.67867557      4.004774    0.00000    0.00000    0.00000    7    diag,B
    9      0.293D-04      0.101D-05        -3.67867557      4.004757    0.00000    0.00000    0.00000    8    diag,B
   10      0.772D-05      0.153D-06        -3.67867557      4.004757    0.00000    0.00000    0.00000    0    orth

 Final alpha occupancy:   1   1   0   0   1   0   0   0
 Final beta  occupancy:   1   0   0   0   0   0   0   0

 !RHF STATE 1.6 Energy                 -3.678675572492
 Nuclear energy                         0.00000000
 One-electron energy                   -5.68105387
 Two-electron energy                    2.00237830
 Virial quotient                       -2.83261489
 !RHF STATE 1.6 Dipole moment           0.00000000     0.00000000     0.00000000
 Dipole moment /Debye                   0.00000000     0.00000000     0.00000000
 

 !RHF expec          <1.6|EKIN|1.6>     1.298685389067
 
 !RHF expec           <1.6|POT|1.6>    -1.930266775508

 ELECTRON ORBITALS
 =================


   Orb  Occ    Energy  Couls-En    Coefficients

                                   1 1s      1 1s      1 1s      1 1s      1 1s      1 1s      1 3d0     1 3d2+    1 3d0     1 3d2+ 
                                   1 3d0     1 3d2+    1 3d0     1 3d2+    1 3d0     1 3d2+    1 5g0     1 5g4+    1 5g2+    1 5g0  
                                   1 5g4+    1 5g2+    1 5g0     1 5g4+    1 5g2+ 

   1.1   2    -0.5411   -2.1419  1.005238  0.001113 -0.003996 -0.001308 -0.002735  0.002212  0.001423  0.002465  0.003142  0.005442
                                -0.000392 -0.000678 -0.000101 -0.000175  0.000380  0.000657 -0.000025 -0.000050 -0.000038 -0.000016
                                -0.000031 -0.000024  0.000001  0.000001  0.000001

                                   1 2px     1 2px     1 2px     1 2px     1 2px     1 2px     1 4f1+    1 4f3+    1 4f1+    1 4f3+ 
                                   1 4f1+    1 4f3+    1 4f1+    1 4f3+    1 6h1+    1 6h3+    1 6h5+    1 6h1+    1 6h3+    1 6h5+ 


   1.2   +    -0.2970   -1.5368  1.000614  0.000827 -0.001200  0.000746 -0.000942  0.000139  0.000025  0.000095 -0.000006 -0.000023
                                -0.000026 -0.000100 -0.000001 -0.000002 -0.000000 -0.000001 -0.000001  0.000000  0.000000  0.000000

                                   1 2pz     1 2pz     1 2pz     1 2pz     1 2pz     1 2pz     1 4f0     1 4f2+    1 4f0     1 4f2+ 
                                   1 4f0     1 4f2+    1 4f0     1 4f2+    1 6h2+    1 6h4+    1 6h0     1 6h2+    1 6h4+    1 6h0  


   1.5   +    -0.2970   -1.5368  1.000614  0.000827 -0.001200  0.000746 -0.000942  0.000139  0.000060  0.000077 -0.000014 -0.000018
                                -0.000063 -0.000081 -0.000001 -0.000002 -0.000001 -0.000001 -0.000001  0.000000  0.000000  0.000000

 HOMO      1.2    -0.297008 =      -8.0820eV
 LUMO      1.3    -0.017105 =      -0.4654eV
 LUMO-HOMO         0.279903 =       7.6166eV


 **********************************************************************************************************************************
 DATASETS  * FILE   NREC   LENGTH (MB)   RECORD NAMES
              1      20       37.06       500      610      700      900      950      970     1000      129      960     1100   
                                          VAR    BASINP    GEOM    SYMINP    ZMAT    AOBASIS   BASIS     P2S    ABASIS      S 
                                         1400     1410     1420     1200     1210     1080     1600     1650     1300     1700   
                                         EKIN       V       ECP      H0       H01     AOSYM     SMH    MOLCAS    ERIS     OPER   

              2       4        2.83       700     1000      520     2100   
                                         GEOM     BASIS   MCVARS     RHF  

 PROGRAMS   *        TOTAL        HF       INT
 CPU TIMES  *         4.52      0.24      4.13
 REAL TIME  *        18.00 SEC
 DISK USED  *        86.64 MB      
 **********************************************************************************************************************************
 SETTING SCF(I)         =        -3.67867557  AU                              
 SETTING _CC_NORM_MAX   =         2.00000000                                  


 PROGRAM * UHF-SCF       Authors: W. Meyer, H.-J. Werner


 NUMBER OF ELECTRONS:       3+    1-    SPACE SYMMETRY=6    SPIN SYMMETRY: Triplet 
 CONVERGENCE THRESHOLDS:    1.00E-05 (Density)    1.00E-07 (Energy)
 MAX. NUMBER OF ITERATIONS:        0
 INTERPOLATION TYPE:            DIIS
 INTERPOLATION STEPS:              2 (START)      1 (STEP)
 LEVEL SHIFTS:                  0.20 (ALPHA)   0.20 (BETA) 

 Number of closed-shell orbitals:    1 (   1   0   0   0   0   0   0   0 )
 Number of open-shell orbitals:      2 (   0   1   0   0   1   0   0   0 )


 Molecular orbitals read from record     2100.2  Type=RHF/CANONICAL (state 1.6)

 Molecular orbital dump at record        2200.2

 Initial alpha occupation   1   1   0   0   1   0   0   0
 Initial beta  occupation   1   0   0   0   0   0   0   0

 ITERATION    DDIFF          GRAD             ENERGY        2-EL.EN.            DIPOLE MOMENTS         DIIS
    1      0.000D+00      0.000D+00        -3.67867557      4.004757    0.00000    0.00000    0.00000    0
 
 Final alpha occupancy:   1   1   0   0   1   0   0   0
 Final beta  occupancy:   1   0   0   0   0   0   0   0

 !UHF STATE 1.6 Energy                 -3.678675572492
 Nuclear energy                         0.00000000
 One-electron energy                   -5.68105387
 Two-electron energy                    2.00237830
 Virial quotient                       -2.83261489
 !UHF STATE 1.6 Dipole moment           0.00000000     0.00000000     0.00000000
 Dipole moment /Debye                   0.00000000     0.00000000     0.00000000
 

 !UHF expec          <1.6|EKIN|1.6>     1.298685389067
 
 !UHF expec           <1.6|POT|1.6>    -1.930266775508

 ELECTRON ORBITALS FOR POSITIVE SPIN
 ===================================


   Orb  Occ    Energy  Couls-En    Coefficients

                                   1 1s      1 1s      1 1s      1 1s      1 1s      1 1s      1 3d0     1 3d2+    1 3d0     1 3d2+ 
                                   1 3d0     1 3d2+    1 3d0     1 3d2+    1 3d0     1 3d2+    1 5g0     1 5g4+    1 5g2+    1 5g0  
                                   1 5g4+    1 5g2+    1 5g0     1 5g4+    1 5g2+ 

   1.1   +    -0.5411   -2.1419  1.005238  0.001113 -0.003996 -0.001308 -0.002735  0.002212  0.001423  0.002465  0.003142  0.005442
                                -0.000392 -0.000678 -0.000101 -0.000175  0.000380  0.000657 -0.000025 -0.000050 -0.000038 -0.000016
                                -0.000031 -0.000024  0.000001  0.000001  0.000001

                                   1 2px     1 2px     1 2px     1 2px     1 2px     1 2px     1 4f1+    1 4f3+    1 4f1+    1 4f3+ 
                                   1 4f1+    1 4f3+    1 4f1+    1 4f3+    1 6h1+    1 6h3+    1 6h5+    1 6h1+    1 6h3+    1 6h5+ 


   1.2   +    -0.2970   -1.5368  1.000614  0.000827 -0.001200  0.000746 -0.000942  0.000139  0.000025  0.000095 -0.000006 -0.000023
                                -0.000026 -0.000100 -0.000001 -0.000002 -0.000000 -0.000001 -0.000001  0.000000  0.000000  0.000000

                                   1 2pz     1 2pz     1 2pz     1 2pz     1 2pz     1 2pz     1 4f0     1 4f2+    1 4f0     1 4f2+ 
                                   1 4f0     1 4f2+    1 4f0     1 4f2+    1 6h2+    1 6h4+    1 6h0     1 6h2+    1 6h4+    1 6h0  


   1.5   +    -0.2970   -1.5368  1.000614  0.000827 -0.001200  0.000746 -0.000942  0.000139  0.000060  0.000077 -0.000014 -0.000018
                                -0.000063 -0.000081 -0.000001 -0.000002 -0.000001 -0.000001 -0.000001  0.000000  0.000000  0.000000

 ELECTRON ORBITALS FOR NEGATIVE SPIN
 ===================================


   Orb  Occ    Energy  Couls-En    Coefficients

                                   1 1s      1 1s      1 1s      1 1s      1 1s      1 1s      1 3d0     1 3d2+    1 3d0     1 3d2+ 
                                   1 3d0     1 3d2+    1 3d0     1 3d2+    1 3d0     1 3d2+    1 5g0     1 5g4+    1 5g2+    1 5g0  
                                   1 5g4+    1 5g2+    1 5g0     1 5g4+    1 5g2+ 

   1.1   -    -0.5411   -2.1419  1.005238  0.001113 -0.003996 -0.001308 -0.002735  0.002212  0.001423  0.002465  0.003142  0.005442
                                -0.000392 -0.000678 -0.000101 -0.000175  0.000380  0.000657 -0.000025 -0.000050 -0.000038 -0.000016
                                -0.000031 -0.000024  0.000001  0.000001  0.000001

 HOMO      1.2    -0.297008 =      -8.0820eV
 LUMO     -1.2    -0.297008 =      -8.0820eV
 LUMO-HOMO         0.000000 =       0.0000eV

 EXPECTATION VALUE OF S**2:             2.00000000

 Occupation number threshold for canonical orbitals:  1.999000 (occupied),  0.001000 (virtual)

 Number of pseudo-canonical orbitals per symmetry:    1   0   0   0   0   0   0   0
 Number of active natural orbitals per symmetry:      0   1   0   0   1   0   0   0

 NATURAL CHARGE ORBITALS
 =======================


   Orb     Occ        Energy       Coefficients

                                   1 1s      1 1s      1 1s      1 1s      1 1s      1 1s      1 3d0     1 3d2+    1 3d0     1 3d2+ 
                                   1 3d0     1 3d2+    1 3d0     1 3d2+    1 3d0     1 3d2+    1 5g0     1 5g4+    1 5g2+    1 5g0  
                                   1 5g4+    1 5g2+    1 5g0     1 5g4+    1 5g2+ 

   1.1  2.00000    -0.541140     1.005238  0.001113 -0.003996 -0.001308 -0.002735  0.002212  0.001423  0.002465  0.003142  0.005442
                                -0.000392 -0.000678 -0.000101 -0.000175  0.000380  0.000657 -0.000025 -0.000050 -0.000038 -0.000016
                                -0.000031 -0.000024  0.000001  0.000001  0.000001

                                   1 2px     1 2px     1 2px     1 2px     1 2px     1 2px     1 4f1+    1 4f3+    1 4f1+    1 4f3+ 
                                   1 4f1+    1 4f3+    1 4f1+    1 4f3+    1 6h1+    1 6h3+    1 6h5+    1 6h1+    1 6h3+    1 6h5+ 


   1.2  1.00000    -0.108691     1.000614  0.000827 -0.001200  0.000746 -0.000942  0.000139  0.000025  0.000095 -0.000006 -0.000023
                                -0.000026 -0.000100 -0.000001 -0.000002 -0.000000 -0.000001 -0.000001  0.000000  0.000000  0.000000

                                   1 2pz     1 2pz     1 2pz     1 2pz     1 2pz     1 2pz     1 4f0     1 4f2+    1 4f0     1 4f2+ 
                                   1 4f0     1 4f2+    1 4f0     1 4f2+    1 6h2+    1 6h4+    1 6h0     1 6h2+    1 6h4+    1 6h0  


   1.5  1.00000    -0.108691     1.000614  0.000827 -0.001200  0.000746 -0.000942  0.000139  0.000060  0.000077 -0.000014 -0.000018
                                -0.000063 -0.000081 -0.000001 -0.000002 -0.000001 -0.000001 -0.000001  0.000000  0.000000  0.000000

 Natural orbitals saved to record    2200.2 (Orbital set 3)

 Orbital spaces for UNO-CAS (Min. occupation: 0.020  Max. occupation: 1.980):

 Closed:        1   0   0   0   0   0   0   0
 Active:        0   1   0   0   1   0   0   0

 No convergence



 **********************************************************************************************************************************
 DATASETS  * FILE   NREC   LENGTH (MB)   RECORD NAMES
              1      20       37.06       500      610      700      900      950      970     1000      129      960     1100   
                                          VAR    BASINP    GEOM    SYMINP    ZMAT    AOBASIS   BASIS     P2S    ABASIS      S 
                                         1400     1410     1420     1200     1210     1080     1600     1650     1300     1700   
                                         EKIN       V       ECP      H0       H01     AOSYM     SMH    MOLCAS    ERIS     OPER   

              2       5        5.45       700     1000      520     2100     2200   
                                         GEOM     BASIS   MCVARS     RHF      UHF  

 PROGRAMS   *        TOTAL       UHF        HF       INT
 CPU TIMES  *         4.56      0.04      0.24      4.13
 REAL TIME  *        18.14 SEC
 DISK USED  *        86.64 MB      
 **********************************************************************************************************************************
 SETTING SCF(I)         =        -3.67867557  AU                              


 PROGRAM * MRCC (General Multireference Coupled Cluster)    Author: M. Kallay, 2000-2005

 ***  Initialisation ***

   0 Spin projections
 
 Molecular orbitals read from record     2200.2  Type=UHF/ALPHA (state 1.6)

 ?Warning: UHF not converged
 Molecular orbitals read from record     2200.2  Type=UHF/BETA (state 1.6)

 ?Warning: UHF not converged
 
 Frozen orbitals:              0 (  0  0  0  0  0  0  0  0)
 Active orbitals:            126 ( 25 20 20 11 20 11 11  8)
 Active electrons:             4
 Spin quantum number:          1.0

 Transformed integrals will be written to file mrcc_1520/fort.55

 Load integrals                4.6 sec
 Transform integrals           7.3 sec
 Storage for integrals:       24278327
 Remaining memory:           *********

 Core energy:               0.00000000
 
 MRCC Input:
     4     0     0     0     3     0     0     6     0     0     0     1     1     0     0     7     0     0   0.000     0   64000
  ex.lev,nsing,ntrip, rest,method,dens,conver,symm, diag, CS ,spatial, HF, ndoub,nacto,nactv, tol, maxex, sacc, freq,  dboc,   mem
  2  0  0  0  0  0  0  0  0  0  0  0  0  0  0  0  0  0  0  0  0  0  0  0  0  1  0  0  0  0  0  0  0  0  0  0  0  0  0  0  0  0  0  0  0  0  0  0  0  0  0  0  0  0  0  0  0  0  0  0  0  0  0  0  0  0  0  0  0  0  0  0  0  0  0  0  1  0  0  0  0  0  0  0  0  0  0  0  0  0  0  0  0  0  0  0  0  0  0  0  0  0  0  0  0  0  0  0  0  0  0  0  0  0  0  0  0  0  0  0  0  0  0  0  0  0
 MRCC Input end
 Variable memory released
 MRCC now being run, temporary output in /global/cscratch1/sd/aannabe/mrcc_1520/mrcc.out
 **********************************************************************
                          MRCC program system
 **********************************************************************

                              Written by
  Mihaly Kallay, Zoltan Rolik, Jozsef Csontos, Peter Nagy, Gyula Samu,
      David Mester, Jozsef Csoka, Bernat Szabo, Istvan Ladjanszki,
       Lorant Szegedy, Bence Ladoczki, Klara Petrov, Mate Farkas,
                    Pal D. Mezei, and Bence Hegely

        Department of Physical Chemistry and Materials Science
            Budapest University of Technology and Economics
                  Budapest P.O.Box 91, H-1521 Hungary

                              www.mrcc.hu

                       Release date: May 23, 2018

 ************************ 2018-06-22 11:45:26 *************************
 Executing goldstone...

 Generation of CC equations in terms of H and T...
 Generation of antisymmetrized Goldstone diagrams...
 Number of diagrams in T^1 equations:    15
 Number of diagrams in T^2 equations:    38
 Number of diagrams in T^3 equations:    49
 Number of diagrams in T^4 equations:     5
 Translation of diagrams to factorized equations...
 Optimizing intermediate calculation...
 Number of floating-point operations per iteration step:   7.6150E+10
 Probable CPU time per iteration step (hours):      0.76
 Required memory (Mbytes):   30783.6
 Number of intermediates:                                  80
 Number of intermediates to be stored:                     32
 Length of intermediate file (Mbytes):     492.9

 ************************ 2018-06-22 11:45:27 *************************
 Executing xmrcc...

 **********************************************************************
 CC(3)(4) calculation


 Allocation of****** Mbytes of memory...
 Number of spinorbitals:                   252
 Number of alpha electrons:                        3
 Number of beta electrons:                         1
 Spin multiplicity:                     2
 z-component of spin:  1.0
 Spatial symmetry:                      6
 Convergence criterion:  1.0E-07
 Construction of occupation graphs...
 Number of                     0 -fold excitations:                      1
 Number of                     1 -fold excitations:                     86
 Number of                     2 -fold excitations:                   8977
 Number of                     3 -fold excitations:                 389714
 Total number of configurations:                 398778
 Calculation of coupling coefficients...
 Length of intermediate file (Mbytes):     372.0

 ======================================================================

 Spin case  1   Alpha:  3   Beta:  1
 Number of excitations:                4723078
 Number of                     4 -fold excitations:                4723078

 Memory requirements /Mbyte/:
               Minimal        Optimal
 Real*8:        802.7682      1923.2150
 Integer:        80.1863
 Total:         882.9545      2003.4013


 ************************ 2018-06-22 11:45:35 *************************
 Executing mrcc...

 **********************************************************************
 CCSDT(Q) calculation


 OpenMP parallel version is running.
 Number of CPUs:   1
 Allocation of 1923.2 Mbytes of memory...
 Number of spinorbitals: 252
 Number of alpha electrons:  3
 Number of beta  electrons:  1
 Spin multiplicity: 2
 z-component of spin:  1.0
 Spatial symmetry: 6
 Convergence criterion:  1.0E-07
 Construction of occupation graphs...
 Number of 0-fold excitations: 1
 Number of 1-fold excitations: 86
 Number of 2-fold excitations: 8977
 Number of 3-fold excitations: 389714
 Total number of determinants: 398778
 Calculation of coupling coefficients...
 Initial cluster amplitudes are generated.
 Length of intermediate file (Mbytes):     372.0
 Reading integral list from unit 55...
 Sorting integrals...
 Sorting integrals...
 Sorting integrals...
 Sorting integrals...
 Energy of reference determinant [au]:      -3.678675572492
 Calculation of MP denominators...

 Starting CC iteration...
 ======================================================================
 Norm of residual vector:     0.38312454
 CPU time [min]:     1.323                   Wall time [min]:     1.327

 Iteration  1  CC energy:    -3.74981083  Energy decrease:   0.07113526
 ======================================================================
 Norm of residual vector:     0.12247037
 CPU time [min]:     1.842                   Wall time [min]:     1.853

 Iteration  2  CC energy:    -3.75978906  Energy decrease:   0.00997823
 ======================================================================
 Norm of residual vector:     0.03963341
 CPU time [min]:     2.367                   Wall time [min]:     2.383

 Iteration  3  CC energy:    -3.76741920  Energy decrease:   0.00763014
 ======================================================================
 Norm of residual vector:     0.01114940
 CPU time [min]:     2.888                   Wall time [min]:     2.913

 Iteration  4  CC energy:    -3.76755348  Energy decrease:   0.00013428
 ======================================================================
 Norm of residual vector:     0.00330787
 CPU time [min]:     3.405                   Wall time [min]:     3.440

 Iteration  5  CC energy:    -3.76773416  Energy decrease:   0.00018068
 ======================================================================
 Norm of residual vector:     0.00109806
 CPU time [min]:     3.930                   Wall time [min]:     3.971

 Iteration  6  CC energy:    -3.76773115  Energy decrease:   0.00000301
 ======================================================================
 Norm of residual vector:     0.00034916
 CPU time [min]:     4.452                   Wall time [min]:     4.499

 Iteration  7  CC energy:    -3.76771559  Energy decrease:   0.00001556
 ======================================================================
 Norm of residual vector:     0.00011560
 CPU time [min]:     4.976                   Wall time [min]:     5.028

 Iteration  8  CC energy:    -3.76771784  Energy decrease:   0.00000225
 ======================================================================
 Norm of residual vector:     0.00004054
 CPU time [min]:     5.502                   Wall time [min]:     5.557

 Iteration  9  CC energy:    -3.76771944  Energy decrease:   0.00000160
 ======================================================================
 Norm of residual vector:     0.00001502
 CPU time [min]:     6.029                   Wall time [min]:     6.088

 Iteration 10  CC energy:    -3.76771882  Energy decrease:   0.00000063
 ======================================================================
 Norm of residual vector:     0.00000526
 CPU time [min]:     6.535                   Wall time [min]:     6.598

 Iteration 11  CC energy:    -3.76771882  Energy decrease:   1.9715E-09
 ======================================================================
 Norm of residual vector:     0.00000189
 CPU time [min]:     7.054                   Wall time [min]:     7.122

 Iteration 12  CC energy:    -3.76771889  Energy decrease:   0.00000007
 ======================================================================
 Norm of residual vector:     0.00000067
 CPU time [min]:     7.584                   Wall time [min]:     7.657

 Iteration 13  CC energy:    -3.76771886  Energy decrease:   0.00000003
 ======================================================================
 Norm of residual vector:     0.00000020
 CPU time [min]:     8.120                   Wall time [min]:     8.197

 Iteration 14  CC energy:    -3.76771886  Energy decrease:   5.7221E-10
 ======================================================================
 Norm of residual vector:     0.00000006
 CPU time [min]:     8.644                   Wall time [min]:     8.724

 Iteration 15  CC energy:    -3.76771886  Energy decrease:   1.0237E-09
 ======================================================================

 Iteration has converged in 15 steps.

 Final results:
 Total CCSDT energy [au]:             -3.767718864224
 Total MP2 energy [au]:               -3.749810830541

 Perturbative corrections are calculated...
 ======================================================================
 Spin case  1   Alpha:  3   Beta:  1
 Number of excitations:        4723078
 CPU time [min]:    61.882                   Wall time [min]:    61.973
 ======================================================================
 Number of 4-fold excitations: 4723078
 CPU time [min]:    61.882                   Wall time [min]:    61.975

 Total CCSDT[Q] energy [au]:          -3.767748258160
 Total CCSDT(Q) energy [au]:          -3.767806351497

 ************************ 2018-06-22 12:47:35 *************************
                      Normal termination of mrcc.
 **********************************************************************
 !CCSDT STATE 1.6 Energy               -3.767718864224
 !MP2 STATE 1.6 Energy                 -3.749810830541
 !CCSDT[Q] STATE 1.6 Energy            -3.767748258160
 !CCSDT(Q) STATE 1.6 Energy            -3.767806351497
 
 CPU-time for MRCC:           3712.9 sec
 Elapsed-time for MRCC:       3730.8 sec

 Variable memory set to 8000000000 words,  buffer space   230000 words



 **********************************************************************************************************************************
 DATASETS  * FILE   NREC   LENGTH (MB)   RECORD NAMES
              1      20       37.06       500      610      700      900      950      970     1000      129      960     1100   
                                          VAR    BASINP    GEOM    SYMINP    ZMAT    AOBASIS   BASIS     P2S    ABASIS      S 
                                         1400     1410     1420     1200     1210     1080     1600     1650     1300     1700   
                                         EKIN       V       ECP      H0       H01     AOSYM     SMH    MOLCAS    ERIS     OPER   

              2       5        5.45       700     1000      520     2100     2200   
                                         GEOM     BASIS   MCVARS     RHF      UHF  

 PROGRAMS   *        TOTAL      MRCC       UHF        HF       INT
 CPU TIMES  *      3802.22   3797.66      0.04      0.24      4.13
 REAL TIME  *      4147.44 SEC
 DISK USED  *        86.64 MB      
 **********************************************************************************************************************************
 SETTING POSTHF(I)      =        -3.76780635  AU                              
                                                                                                                                                                                                                                                                

       SCF           POSTHF       EKIN          POT
    -3.67867557   -3.76780635   1.29868539   -1.93026678
                                                  

 CCSDT(Q)/USERDEF energy=     -3.767806351497

        CCSDT(Q)        UHF-SCF         HF-SCF  
     -3.76780635     -3.67867557     -3.67867557
 **********************************************************************************************************************************
 Variable memory released
