
 Primary working directories    : /global/cscratch1/sd/aannabe
 Secondary working directories  : /global/cscratch1/sd/aannabe
 Wavefunction directory         : /global/homes/a/aannabe/wfu/
 Main file repository           : /global/cscratch1/sd/aannabe/

 SHA1      : 19cd028119e0e09f93f0674bd8af7968d9b3eff6
 NAME      : 2015.1.36
 ARCHNAME  : linux/x86_64
 FC        : /opt/cray/pe/craype/2.5.14/bin/ftn
 BLASLIB   : -L/opt/intel/compilers_and_libraries_2018.1.163/linux/mkl/lib/intel64 -Wl,-_start-group -lmkl_intel_ilp64 -lmkl_intel_thread -lmkl_core -Wl,-_end-group -liomp5
 id        : lbl

 Nodes     nprocs
 nid00461     1

 Using customized tuning parameters: mindgm=7; mindgv=16; mindgc=1; mindgr=1; noblas=0; minvec=7
 default implementation of scratch files=df  

 ***,Ga
 memory,8,g
 gthresh,twoint=1.e-12
 
 gprint,basis,orbitals
 gexpec,ekin,pot
 
 angstrom
 geometry={
 1                                                                               ! Number of atoms
 Ga 0.0 0.0 0.0
 }
 
 basis={
 
 Including file /global/homes/a/aannabe/repos/pseudopotentiallibrary/recipes/Ga/ccECP/Ga.ccECP.molpro
 
                                   !include,/global/homes/a/aannabe/repos/pseudopotentiallibrary/recipes/Ga/ccECP/Ga.cc-pV5Z.molpro
                                  !include,/global/homes/a/aannabe/repos/pseudopotentiallibrary/recipes/Ga/ccECP/Ga.cc-pCV5Z.molpro
 Including file /global/homes/a/aannabe/repos/pseudopotentiallibrary/recipes/Ga/ccECP/Ga.aug-cc-pV5Z.molpro
 
 
 }
 
 
 {rhf
  start,atden
  wf,3,2,1
  occ,1,1,0,0,0,0,0,0
  open,1.2
  save,4202.2
 }
 {multi
  start,4202.2
  occ,1,1,1,0,1,0,0
  closed,1,0,0,0,0,0,0,0
  wf,3,2,1;state,1
  wf,3,3,1;state,1
  wf,3,5,1;state,1
  natorb,ci,print
  orbital,5202.2
 }
 {rhf,nitord=1,maxit=0
  start,5202.2
  wf,3,2,1
  occ,1,1,0,0,0,0,0,0
  open,1.2
 }
 
 scf(i)=energy
 
 _CC_NORM_MAX=2.0
  !NOTE: Perturbative MRCC works only with UHF reference. So, here we will trick MRCC by doing zero UHF iteration right after ROHF.
 
 {uhf
 maxit,0
 }
 scf(i)=energy
 
 {mrcc,method=CCSDT(Q)
 orbital,ignore_error=1                                                          !Ignore the fact that UHF WF is not converged
 maxit,100
 core
 }
 posthf(i)=energy
 
 table,scf,posthf,ekin,pot
 save,5.csv,new
 
 

 Variables initialized (889), CPU time= 0.00 sec
 Commands  initialized (702), CPU time= 0.01 sec, 572 directives.
 Default parameters read. Elapsed time= 0.11 sec

 Checking input...
 Passed
1


                                         ***  PROGRAM SYSTEM MOLPRO  ***
                                       Copyright, TTI GmbH Stuttgart, 2015
                                    Version 2015.1 linked Dec 29 2018 15:55:43


 **********************************************************************************************************************************
 LABEL *   Ga                                                                            
  64 bit serial version                                                                  DATE: 25-Jun-19          TIME: 12:31:42  
 **********************************************************************************************************************************

 SHA1:             19cd028119e0e09f93f0674bd8af7968d9b3eff6
 **********************************************************************************************************************************

 THRESHOLDS:

 ZERO    =  1.00D-12  ONEINT  =  1.00D-12  TWOINT  =  1.00D-12  PREFAC  =  1.00D-14  LOCALI  =  1.00D-09  EORDER  =  1.00D-04
 ENERGY  =  0.00D+00  ETEST   =  0.00D+00  EDENS   =  0.00D+00  THRDEDEF=  1.00D-06  GRADIENT=  1.00D-02  STEP    =  1.00D-03
 ORBITAL =  1.00D-05  CIVEC   =  1.00D-05  COEFF   =  1.00D-04  PRINTCI =  5.00D-02  PUNCHCI =  9.90D+01  OPTGRAD =  3.00D-04
 OPTENERG=  1.00D-06  OPTSTEP =  3.00D-04  THRGRAD =  1.00D-10  COMPRESS=  1.00D-11  VARMIN  =  1.00D-07  VARMAX  =  1.00D-03
 THRDOUB =  0.00D+00  THRDIV  =  1.00D-05  THRRED  =  1.00D-07  THRPSP  =  1.00D+00  THRDC   =  1.00D-10  THRCS   =  1.00D-10
 THRNRM  =  1.00D-08  THREQ   =  0.00D+00  THRDE   =  1.00D+00  THRREF  =  1.00D-05  SPARFAC =  1.00D+00  THRDLP  =  1.00D-07
 THRDIA  =  1.00D-10  THRDLS  =  1.00D-07  THRGPS  =  0.00D+00  THRKEX  =  0.00D+00  THRDIS  =  2.00D-01  THRVAR  =  1.00D-10
 THRLOC  =  1.00D-06  THRGAP  =  1.00D-06  THRLOCT = -1.00D+00  THRGAPT = -1.00D+00  THRORB  =  1.00D-06  THRMLTP =  0.00D+00
 THRCPQCI=  1.00D-10  KEXTA   =  0.00D+00  THRCOARS=  0.00D+00  SYMTOL  =  1.00D-06  GRADTOL =  1.00D-06  THROVL  =  1.00D-08
 THRORTH =  1.00D-08  GRID    =  1.00D-06  GRIDMAX =  1.00D-03  DTMAX   =  0.00D+00  THROCCDE=  1.00D-01  THROCCDE=  1.00D-01



 ZUNIT=ANG
 

Geometry recognized as XYZ


 Variable memory set to 8000000000 words,  buffer space   230000 words

 SETTING BASIS          =    USERDEF


 Recomputing integrals since basis changed


 Using spherical harmonics



 PROGRAM * SEWARD (Integral evaluation for generally contracted gaussian basis sets)     Author: Roland Lindh, 1990

 Geometry written to block  1 of record 700

 Orientation using atomic masses  
 Molecule type: Atom
 Symmetry elements: X,Y,Z
 Rotational constants:       0.0000000      0.0000000      0.0000000 GHz  (calculated with average atomic masses)

 Point group  D2h 



 ATOMIC COORDINATES

 NR  ATOM    CHARGE       X              Y              Z

   1  GA      3.00    0.000000000    0.000000000    0.000000000


          GA  CORE POTENTIAL

          f POTENTIAL

 POWERS             1              3              2              2
 EXPONENTIALS   17.00474       14.99962       11.99279       14.99282    
 COEFFICIENTS   3.000000       51.01422      -39.00063       35.44659    

          s - f POTENTIAL

 POWERS             2              2
 EXPONENTIALS   1.857811      0.9195059    
 COEFFICIENTS   21.78931      -2.866851    

          p - f POTENTIAL

 POWERS             2              2
 EXPONENTIALS   1.920302       1.008959    
 COEFFICIENTS   18.63986      -1.633697    

          d - f POTENTIAL

 POWERS             2              2
 EXPONENTIALS  0.6275088      0.3261903    
 COEFFICIENTS   2.035237     -8.5323757E-02


 BASIS DATA

   Nr Sym  Nuc  Type         Exponents   Contraction coefficients

    1.1 Ag    1  1s          31.011369    -0.000046
                             13.757663     0.000207
                              6.103352    -0.008282
                              2.707648     0.085722
                              1.201202    -0.350699
                              0.532893     0.004567
                              0.236409     0.452968
                              0.104879     0.558187
                              0.046528     0.163319
    2.1 Ag    1  1s           0.433600     1.000000
    3.1 Ag    1  1s           0.216864     1.000000
    4.1 Ag    1  1s           0.108464     1.000000
    5.1 Ag    1  1s           0.054248     1.000000
    6.1 Ag    1  1s           0.021699     1.000000
    7.1 Ag    1  3d0          0.782969     1.000000
    8.1 Ag    1  3d2+         0.782969     1.000000
    9.1 Ag    1  3d0          0.362956     1.000000
   10.1 Ag    1  3d2+         0.362956     1.000000
   11.1 Ag    1  3d0          0.168253     1.000000
   12.1 Ag    1  3d2+         0.168253     1.000000
   13.1 Ag    1  3d0          0.077996     1.000000
   14.1 Ag    1  3d2+         0.077996     1.000000
   15.1 Ag    1  3d0          0.031198     1.000000
   16.1 Ag    1  3d2+         0.031198     1.000000
   17.1 Ag    1  5g0          0.591927     1.000000
   18.1 Ag    1  5g4+         0.591927     1.000000
   19.1 Ag    1  5g2+         0.591927     1.000000
   20.1 Ag    1  5g0          0.292266     1.000000
   21.1 Ag    1  5g4+         0.292266     1.000000
   22.1 Ag    1  5g2+         0.292266     1.000000
   23.1 Ag    1  5g0          0.116906     1.000000
   24.1 Ag    1  5g4+         0.116906     1.000000
   25.1 Ag    1  5g2+         0.116906     1.000000
    1.2 B3u   1  2px         15.391968    -0.000120
                              6.919798    -0.000202
                              3.110948     0.008853
                              1.398595    -0.073708
                              0.628769     0.028260
                              0.282677     0.221463
                              0.127084     0.413320
                              0.057133     0.385686
                              0.025686     0.112292
    2.2 B3u   1  2px          0.518134     1.000000
    3.2 B3u   1  2px          0.209184     1.000000
    4.2 B3u   1  2px          0.084453     1.000000
    5.2 B3u   1  2px          0.034096     1.000000
    6.2 B3u   1  2px          0.013638     1.000000
    7.2 B3u   1  4f1+         0.603610     1.000000
    8.2 B3u   1  4f3+         0.603610     1.000000
    9.2 B3u   1  4f1+         0.311095     1.000000
   10.2 B3u   1  4f3+         0.311095     1.000000
   11.2 B3u   1  4f1+         0.160335     1.000000
   12.2 B3u   1  4f3+         0.160335     1.000000
   13.2 B3u   1  4f1+         0.064134     1.000000
   14.2 B3u   1  4f3+         0.064134     1.000000
   15.2 B3u   1  6h1+         0.525905     1.000000
   16.2 B3u   1  6h3+         0.525905     1.000000
   17.2 B3u   1  6h5+         0.525905     1.000000
   18.2 B3u   1  6h1+         0.210362     1.000000
   19.2 B3u   1  6h3+         0.210362     1.000000
   20.2 B3u   1  6h5+         0.210362     1.000000
    1.3 B2u   1  2py         15.391968    -0.000120
                              6.919798    -0.000202
                              3.110948     0.008853
                              1.398595    -0.073708
                              0.628769     0.028260
                              0.282677     0.221463
                              0.127084     0.413320
                              0.057133     0.385686
                              0.025686     0.112292
    2.3 B2u   1  2py          0.518134     1.000000
    3.3 B2u   1  2py          0.209184     1.000000
    4.3 B2u   1  2py          0.084453     1.000000
    5.3 B2u   1  2py          0.034096     1.000000
    6.3 B2u   1  2py          0.013638     1.000000
    7.3 B2u   1  4f1-         0.603610     1.000000
    8.3 B2u   1  4f3-         0.603610     1.000000
    9.3 B2u   1  4f1-         0.311095     1.000000
   10.3 B2u   1  4f3-         0.311095     1.000000
   11.3 B2u   1  4f1-         0.160335     1.000000
   12.3 B2u   1  4f3-         0.160335     1.000000
   13.3 B2u   1  4f1-         0.064134     1.000000
   14.3 B2u   1  4f3-         0.064134     1.000000
   15.3 B2u   1  6h1-         0.525905     1.000000
   16.3 B2u   1  6h3-         0.525905     1.000000
   17.3 B2u   1  6h5-         0.525905     1.000000
   18.3 B2u   1  6h1-         0.210362     1.000000
   19.3 B2u   1  6h3-         0.210362     1.000000
   20.3 B2u   1  6h5-         0.210362     1.000000
    1.4 B1g   1  3d2-         0.782969     1.000000
    2.4 B1g   1  3d2-         0.362956     1.000000
    3.4 B1g   1  3d2-         0.168253     1.000000
    4.4 B1g   1  3d2-         0.077996     1.000000
    5.4 B1g   1  3d2-         0.031198     1.000000
    6.4 B1g   1  5g2-         0.591927     1.000000
    7.4 B1g   1  5g4-         0.591927     1.000000
    8.4 B1g   1  5g2-         0.292266     1.000000
    9.4 B1g   1  5g4-         0.292266     1.000000
   10.4 B1g   1  5g2-         0.116906     1.000000
   11.4 B1g   1  5g4-         0.116906     1.000000
    1.5 B1u   1  2pz         15.391968    -0.000120
                              6.919798    -0.000202
                              3.110948     0.008853
                              1.398595    -0.073708
                              0.628769     0.028260
                              0.282677     0.221463
                              0.127084     0.413320
                              0.057133     0.385686
                              0.025686     0.112292
    2.5 B1u   1  2pz          0.518134     1.000000
    3.5 B1u   1  2pz          0.209184     1.000000
    4.5 B1u   1  2pz          0.084453     1.000000
    5.5 B1u   1  2pz          0.034096     1.000000
    6.5 B1u   1  2pz          0.013638     1.000000
    7.5 B1u   1  4f0          0.603610     1.000000
    8.5 B1u   1  4f2+         0.603610     1.000000
    9.5 B1u   1  4f0          0.311095     1.000000
   10.5 B1u   1  4f2+         0.311095     1.000000
   11.5 B1u   1  4f0          0.160335     1.000000
   12.5 B1u   1  4f2+         0.160335     1.000000
   13.5 B1u   1  4f0          0.064134     1.000000
   14.5 B1u   1  4f2+         0.064134     1.000000
   15.5 B1u   1  6h2+         0.525905     1.000000
   16.5 B1u   1  6h4+         0.525905     1.000000
   17.5 B1u   1  6h0          0.525905     1.000000
   18.5 B1u   1  6h2+         0.210362     1.000000
   19.5 B1u   1  6h4+         0.210362     1.000000
   20.5 B1u   1  6h0          0.210362     1.000000
    1.6 B2g   1  3d1+         0.782969     1.000000
    2.6 B2g   1  3d1+         0.362956     1.000000
    3.6 B2g   1  3d1+         0.168253     1.000000
    4.6 B2g   1  3d1+         0.077996     1.000000
    5.6 B2g   1  3d1+         0.031198     1.000000
    6.6 B2g   1  5g1+         0.591927     1.000000
    7.6 B2g   1  5g3+         0.591927     1.000000
    8.6 B2g   1  5g1+         0.292266     1.000000
    9.6 B2g   1  5g3+         0.292266     1.000000
   10.6 B2g   1  5g1+         0.116906     1.000000
   11.6 B2g   1  5g3+         0.116906     1.000000
    1.7 B3g   1  3d1-         0.782969     1.000000
    2.7 B3g   1  3d1-         0.362956     1.000000
    3.7 B3g   1  3d1-         0.168253     1.000000
    4.7 B3g   1  3d1-         0.077996     1.000000
    5.7 B3g   1  3d1-         0.031198     1.000000
    6.7 B3g   1  5g1-         0.591927     1.000000
    7.7 B3g   1  5g3-         0.591927     1.000000
    8.7 B3g   1  5g1-         0.292266     1.000000
    9.7 B3g   1  5g3-         0.292266     1.000000
   10.7 B3g   1  5g1-         0.116906     1.000000
   11.7 B3g   1  5g3-         0.116906     1.000000
    1.8 Au    1  4f2-         0.603610     1.000000
    2.8 Au    1  4f2-         0.311095     1.000000
    3.8 Au    1  4f2-         0.160335     1.000000
    4.8 Au    1  4f2-         0.064134     1.000000
    5.8 Au    1  6h4-         0.525905     1.000000
    6.8 Au    1  6h2-         0.525905     1.000000
    7.8 Au    1  6h4-         0.210362     1.000000
    8.8 Au    1  6h2-         0.210362     1.000000

 NUCLEAR CHARGE:                    3
 NUMBER OF PRIMITIVE AOS:         213
 NUMBER OF SYMMETRY AOS:          158
 NUMBER OF CONTRACTIONS:          126   (  25Ag  +  20B3u +  20B2u +  11B1g +  20B1u +  11B2g +  11B3g +   8Au  )
 NUMBER OF CORE ORBITALS:           0   (   0Ag  +   0B3u +   0B2u +   0B1g +   0B1u +   0B2g +   0B3g +   0Au  )
 NUMBER OF VALENCE ORBITALS:        4   (   1Ag  +   1B3u +   1B2u +   0B1g +   1B1u +   0B2g +   0B3g +   0Au  )


 NUCLEAR REPULSION ENERGY    0.00000000

 EXTRA SYMMETRY OF AOS IN SYMMETRY 1:   1 1 1 1 1 1 2 3 2 3   2 3 2 3 2 3 4 5 6 4   5 6 4 5 6
 EXTRA SYMMETRY OF AOS IN SYMMETRY 2:   1 1 1 1 1 1 2 3 2 3   2 3 2 3 4 5 6 4 5 6
 EXTRA SYMMETRY OF AOS IN SYMMETRY 3:   1 1 1 1 1 1 2 3 2 3   2 3 2 3 4 5 6 4 5 6
 EXTRA SYMMETRY OF AOS IN SYMMETRY 4:   1 1 1 1 1 2 3 2 3 2   3
 EXTRA SYMMETRY OF AOS IN SYMMETRY 5:   1 1 1 1 1 1 2 3 2 3   2 3 2 3 4 5 6 4 5 6
 EXTRA SYMMETRY OF AOS IN SYMMETRY 6:   1 1 1 1 1 2 3 2 3 2   3
 EXTRA SYMMETRY OF AOS IN SYMMETRY 7:   1 1 1 1 1 2 3 2 3 2   3
 EXTRA SYMMETRY OF AOS IN SYMMETRY 8:   1 1 1 1 2 3 2 3

 Eigenvalues of metric

         1 0.964E-03 0.533E-02 0.271E-01 0.271E-01 0.373E-01 0.151E+00 0.151E+00 0.173E+00
         2 0.821E-03 0.266E-01 0.470E-01 0.470E-01 0.130E+00 0.337E+00 0.337E+00 0.483E+00
         3 0.821E-03 0.266E-01 0.470E-01 0.470E-01 0.130E+00 0.337E+00 0.337E+00 0.483E+00
         4 0.271E-01 0.151E+00 0.173E+00 0.173E+00 0.546E+00 0.811E+00 0.811E+00 0.142E+01
         5 0.821E-03 0.266E-01 0.470E-01 0.470E-01 0.130E+00 0.337E+00 0.337E+00 0.483E+00
         6 0.271E-01 0.151E+00 0.173E+00 0.173E+00 0.546E+00 0.811E+00 0.811E+00 0.142E+01
         7 0.271E-01 0.151E+00 0.173E+00 0.173E+00 0.546E+00 0.811E+00 0.811E+00 0.142E+01
         8 0.470E-01 0.337E+00 0.483E+00 0.483E+00 0.107E+01 0.152E+01 0.152E+01 0.255E+01


 Contracted 2-electron integrals neglected if value below      1.0D-12
 AO integral compression algorithm  1   Integral accuracy      1.0D-12

     29.622 MB (compressed) written to integral file ( 52.5%)


 NUMBER OF SORTED TWO-ELECTRON INTEGRALS:    4156552.     BUFFER LENGTH:  32768
 NUMBER OF SEGMENTS:   1  SEGMENT LENGTH:    4156552      RECORD LENGTH: 524288

 Memory used in sort:       4.71 MW

 SORT1 READ     6989366. AND WROTE     2907704. INTEGRALS IN      9 RECORDS. CPU TIME:     0.19 SEC, REAL TIME:     0.28 SEC
 SORT2 READ     2907704. AND WROTE     4156552. INTEGRALS IN    113 RECORDS. CPU TIME:     0.21 SEC, REAL TIME:     0.34 SEC

 FILE SIZES:   FILE 1:    49.9 MBYTE,  FILE 4:    37.8 MBYTE,   TOTAL:     87.7 MBYTE

 OPERATOR DM      FOR CENTER  0  COORDINATES:    0.000000    0.000000    0.000000
 OPERATOR EKIN    FOR CENTER  0  COORDINATES:    0.000000    0.000000    0.000000
 OPERATOR POT     FOR CENTER  0  COORDINATES:    0.000000    0.000000    0.000000


 **********************************************************************************************************************************
 DATASETS  * FILE   NREC   LENGTH (MB)   RECORD NAMES
              1      20       38.07       500      610      700      900      950      970     1000      129      960     1100   
                                          VAR    BASINP    GEOM    SYMINP    ZMAT    AOBASIS   BASIS     P2S    ABASIS      S 
                                         1400     1410     1420     1200     1210     1080     1600     1650     1300     1700   
                                         EKIN       V       ECP      H0       H01     AOSYM     SMH    MOLCAS    ERIS     OPER   

 PROGRAMS   *        TOTAL       INT
 CPU TIMES  *         3.38      3.27
 REAL TIME  *        14.34 SEC
 DISK USED  *        87.97 MB      
 **********************************************************************************************************************************


 PROGRAM * RHF-SCF (OPEN SHELL)       Authors: W. Meyer, H.-J. Werner


 NUMBER OF ELECTRONS:       2+    1-    SPACE SYMMETRY=2    SPIN SYMMETRY: Doublet 
 CONVERGENCE THRESHOLDS:    1.00E-05 (Density)    1.00E-07 (Energy)
 MAX. NUMBER OF ITERATIONS:       60
 INTERPOLATION TYPE:            DIIS
 INTERPOLATION STEPS:              2 (START)      1 (STEP)
 LEVEL SHIFTS:                 -0.60 (CLOSED) -0.30 (OPEN) 


 Singly occupied orbitals:      1.2

   Atom=GA basis=ECP28MWB_GUESS    lmin=0  lmax=1

 Orbital guess generated from atomic densities. Full valence occupancy:    1   1   1   0   1   0   0   0


 Molecular orbital dump at record        4202.2

 ITERATION    DDIFF          GRAD             ENERGY        2-EL.EN.            DIPOLE MOMENTS         DIIS   ORB.
    1      0.000D+00      0.000D+00        -1.96390936      1.627001    0.00000    0.00000    0.00000    0    start
    2      0.000D+00      0.490D-02        -1.97274208      1.693814    0.00000    0.00000    0.00000    1    diag,B
    3      0.461D-02      0.307D-02        -1.97982198      1.761674    0.00000    0.00000    0.00000    2    diag,B
    4      0.505D-02      0.193D-02        -1.98363877      1.811884    0.00000    0.00000    0.00000    3    diag,B
    5      0.527D-02      0.874D-03        -1.98420074      1.825362    0.00000    0.00000    0.00000    4    diag,B
    6      0.295D-02      0.199D-03        -1.98421173      1.825450    0.00000    0.00000    0.00000    5    diag,B
    7      0.930D-03      0.457D-04        -1.98421221      1.825877    0.00000    0.00000    0.00000    6    fixocc
    8      0.200D-03      0.153D-04        -1.98421227      1.825728    0.00000    0.00000    0.00000    7    diag,B
    9      0.475D-04      0.468D-05        -1.98421228      1.825790    0.00000    0.00000    0.00000    8    diag,B
   10      0.367D-04      0.117D-05        -1.98421228      1.825795    0.00000    0.00000    0.00000    9    orth
   11      0.463D-05      0.246D-06        -1.98421228      1.825794    0.00000    0.00000    0.00000    0    orth

 Final alpha occupancy:   1   1   0   0   0   0   0   0
 Final beta  occupancy:   1   0   0   0   0   0   0   0

 !RHF STATE 1.2 Energy                 -1.984212279511
 Nuclear energy                         0.00000000
 One-electron energy                   -2.89710910
 Two-electron energy                    0.91289682
 Virial quotient                       -2.76813756
 !RHF STATE 1.2 Dipole moment           0.00000000     0.00000000     0.00000000
 Dipole moment /Debye                   0.00000000     0.00000000     0.00000000
 

 !RHF expec          <1.2|EKIN|1.2>     0.716804072987
 
 !RHF expec           <1.2|POT|1.2>    -1.287649777593

 ELECTRON ORBITALS
 =================


   Orb  Occ    Energy  Couls-En    Coefficients

                                   1 1s      1 1s      1 1s      1 1s      1 1s      1 1s      1 3d0     1 3d2+    1 3d0     1 3d2+ 
                                   1 3d0     1 3d2+    1 3d0     1 3d2+    1 3d0     1 3d2+    1 5g0     1 5g4+    1 5g2+    1 5g0  
                                   1 5g4+    1 5g2+    1 5g0     1 5g4+    1 5g2+ 

   1.1   2    -0.4319   -1.5040  1.000191  0.000257 -0.000994  0.002056 -0.002355  0.000909 -0.000247  0.000428  0.000964 -0.001670
                                -0.000048  0.000084 -0.004311  0.007467 -0.001115  0.001931  0.000002  0.000003 -0.000002 -0.000003
                                -0.000006  0.000005 -0.000047 -0.000093  0.000070

                                   1 2px     1 2px     1 2px     1 2px     1 2px     1 2px     1 4f1+    1 4f3+    1 4f1+    1 4f3+ 
                                   1 4f1+    1 4f3+    1 4f1+    1 4f3+    1 6h1+    1 6h3+    1 6h5+    1 6h1+    1 6h3+    1 6h5+ 


   1.2   +    -0.2076   -0.9605  1.000292  0.000145 -0.000688  0.000542 -0.000740  0.000606  0.000002 -0.000003  0.000059 -0.000076
                                 0.000036 -0.000046 -0.000140  0.000181  0.000000 -0.000000  0.000000 -0.000001  0.000001 -0.000002

 HOMO      1.2    -0.207605 =      -5.6492eV
 LUMO      1.3     0.009836 =       0.2677eV
 LUMO-HOMO         0.217442 =       5.9169eV


 **********************************************************************************************************************************
 DATASETS  * FILE   NREC   LENGTH (MB)   RECORD NAMES
              1      20       38.07       500      610      700      900      950      970     1000      129      960     1100   
                                          VAR    BASINP    GEOM    SYMINP    ZMAT    AOBASIS   BASIS     P2S    ABASIS      S 
                                         1400     1410     1420     1200     1210     1080     1600     1650     1300     1700   
                                         EKIN       V       ECP      H0       H01     AOSYM     SMH    MOLCAS    ERIS     OPER   

              2       4        2.83       700     1000      520     4202   
                                         GEOM     BASIS   MCVARS     RHF  

 PROGRAMS   *        TOTAL       RHF       INT
 CPU TIMES  *         3.60      0.22      3.27
 REAL TIME  *        14.77 SEC
 DISK USED  *        87.97 MB      
 **********************************************************************************************************************************


 PROGRAM * MULTI (Direct Multiconfiguration SCF)       Authors: P.J. Knowles, H.-J. Werner (1984)     S.T. Elbert (1988)


 Number of closed-shell orbitals:   1 (   1   0   0   0   0   0   0   0 )
 Number of active  orbitals:        3 (   0   1   1   0   1   0   0   0 )
 Number of external orbitals:     122 (  24  19  19  11  19  11  11   8 )

 State symmetry 1

 Number of electrons:     1    Spin symmetry=Doublet   Space symmetry=2
 Number of states:        1
 Number of CSFs:          1   (1 determinants, 3 intermediate states)

 State symmetry 2

 Number of electrons:     1    Spin symmetry=Doublet   Space symmetry=3
 Number of states:        1
 Number of CSFs:          1   (1 determinants, 3 intermediate states)

 State symmetry 3

 Number of electrons:     1    Spin symmetry=Doublet   Space symmetry=5
 Number of states:        1
 Number of CSFs:          1   (1 determinants, 3 intermediate states)

 Molecular orbitals read from record     4202.2  Type=RHF/CANONICAL (state 1.2)
 *** IN SYMMETRY 1 ORBITAL  1 SYMMETRY CONTAMINATION OF 0.180D-01 HAS BEEN REMOVED

 EXTRA SYMMETRY OF MOS IN SYMMETRY 1:   1 1 2 3 1 3 2 4 5 6   2 3 1 4 2 5 3 6 1 4   5 6 2 3 1
 *** IN SYMMETRY 2 ORBITAL  1 SYMMETRY CONTAMINATION OF 0.547D-03 HAS BEEN REMOVED
 EXTRA SYMMETRY OF MOS IN SYMMETRY 2:   1 1 1 2 3 1 2 3 5 6   4 2 3 1 2 3 5 6 4 1
 *** IN SYMMETRY 3 ORBITAL  1 SYMMETRY CONTAMINATION OF 0.989D-02 HAS BEEN REMOVED
 EXTRA SYMMETRY OF MOS IN SYMMETRY 3:   1 1 1 2 3 1 2 3 4 5   6 2 3 1 2 3 4 5 6 1
 EXTRA SYMMETRY OF MOS IN SYMMETRY 4:   1 1 2 3 1 2 1 3 2 3   1
 *** IN SYMMETRY 5 ORBITAL  1 SYMMETRY CONTAMINATION OF 0.114D-01 HAS BEEN REMOVED
 EXTRA SYMMETRY OF MOS IN SYMMETRY 5:   1 1 1 2 3 1 2 3 6 5   4 2 3 1 2 3 6 5 4 1
 EXTRA SYMMETRY OF MOS IN SYMMETRY 6:   1 1 3 2 1 3 1 2 3 2   1
 EXTRA SYMMETRY OF MOS IN SYMMETRY 7:   1 1 2 3 1 2 1 3 2 3   1
 EXTRA SYMMETRY OF MOS IN SYMMETRY 8:   1 1 3 2 1 1 3 2

 Wavefunction dump at record             5202.2

 Convergence thresholds  0.10E-01 (gradient)  0.10E-05 (energy)  0.10E-02 (step length)

 Weight factors for state symmetry  1:    0.33333
 Weight factors for state symmetry  2:    0.33333
 Weight factors for state symmetry  3:    0.33333

 Number of orbital rotations:       81   (     0 Core/Active     24 Core/Virtual   0 Active/Active     57 Active/Virtual)
 Total number of variables:         84


 ITER. MIC  NCI  NEG     ENERGY(VAR)     ENERGY(PROJ)   ENERGY CHANGE     GRAD(0)  GRAD(ORB)   GRAD(CI)     STEP       TIME

   1   29   12    0      -1.95233347      -1.98417170   -0.03183823    0.04598117 0.00000000 0.00000000  0.82D+00      0.05
   2   15   12    0      -1.98407476      -1.98412428   -0.00004952    0.00778947 0.00000000 0.00000000  0.78D-02      0.10
   3   15   12    0      -1.98412431      -1.98412431   -0.00000000    0.00001071 0.00000000 0.00000000  0.30D-04      0.14

 ** WVFN ****  CONVERGENCE REACHED, FINAL GRADIENT:  0.46D-10



 Results for state 1.2
 =====================

 !MCSCF STATE 1.2 Energy               -1.984124314297
 Nuclear energy                         0.00000000
 Kinetic energy                         0.71676642
 One electron energy                   -2.89722610
 Two electron energy                    0.91310178
 Virial ratio                           3.76816027

 !MCSCF STATE 1.2 Dipole moment         0.00000000     0.00000000     0.00000000
 Dipole moment /Debye                   0.00000000     0.00000000     0.00000000



 Results for state 1.3
 =====================

 !MCSCF STATE 1.3 Energy               -1.984124314297
 Nuclear energy                         0.00000000
 Kinetic energy                         0.71676642
 One electron energy                   -2.89722610
 Two electron energy                    0.91310178
 Virial ratio                           3.76816027

 !MCSCF STATE 1.3 Dipole moment         0.00000000     0.00000000     0.00000000
 Dipole moment /Debye                   0.00000000     0.00000000     0.00000000



 Results for state 1.5
 =====================

 !MCSCF STATE 1.5 Energy               -1.984124314297
 Nuclear energy                         0.00000000
 Kinetic energy                         0.71676642
 One electron energy                   -2.89722610
 Two electron energy                    0.91310178
 Virial ratio                           3.76816027

 !MCSCF STATE 1.5 Dipole moment         0.00000000     0.00000000     0.00000000
 Dipole moment /Debye                   0.00000000     0.00000000     0.00000000

 State-averaged charge density matrix saved on record  5202.2 (density set 1)

 !MCSCF expec        <1.2|EKIN|1.2>     0.716766415672
 !MCSCF expec        <1.3|EKIN|1.3>     0.716766415675
 !MCSCF expec        <1.5|EKIN|1.5>     0.716766415675

 !MCSCF expec         <1.2|POT|1.2>    -1.287672687284
 !MCSCF expec         <1.3|POT|1.3>    -1.287672687287
 !MCSCF expec         <1.5|POT|1.5>    -1.287672687287


 NATURAL ORBITALS (state averaged)
 =================================

   Orb     Occ        Energy       Coefficients

                                   1 1s      1 1s      1 1s      1 1s      1 1s      1 1s      1 3d0     1 3d2+    1 3d0     1 3d2+ 
                                   1 3d0     1 3d2+    1 3d0     1 3d2+    1 3d0     1 3d2+    1 5g0     1 5g4+    1 5g2+    1 5g0  
                                   1 5g4+    1 5g2+    1 5g0     1 5g4+    1 5g2+ 

   1.1  2.00000    -0.431791     1.000181  0.000357 -0.001206  0.001927 -0.002017  0.000908  0.000000  0.000000  0.000000  0.000000
                                 0.000000  0.000000  0.000000  0.000000  0.000000  0.000000  0.000000  0.000000  0.000000  0.000000
                                 0.000000  0.000000  0.000000  0.000000  0.000000

                                   1 2px     1 2px     1 2px     1 2px     1 2px     1 2px     1 4f1+    1 4f3+    1 4f1+    1 4f3+ 
                                   1 4f1+    1 4f3+    1 4f1+    1 4f3+    1 6h1+    1 6h3+    1 6h5+    1 6h1+    1 6h3+    1 6h5+ 


   1.2  0.33333     0.005142     1.000386  0.000099 -0.000465  0.000426 -0.000962  0.000662  0.000000  0.000000  0.000000  0.000000
                                 0.000000  0.000000  0.000000  0.000000  0.000000  0.000000  0.000000  0.000000  0.000000  0.000000

                                   1 2py     1 2py     1 2py     1 2py     1 2py     1 2py     1 4f1-    1 4f3-    1 4f1-    1 4f3- 
                                   1 4f1-    1 4f3-    1 4f1-    1 4f3-    1 6h1-    1 6h3-    1 6h5-    1 6h1-    1 6h3-    1 6h5- 


   1.3  0.33333     0.005142     1.000386  0.000099 -0.000465  0.000426 -0.000962  0.000662  0.000000  0.000000  0.000000  0.000000
                                 0.000000  0.000000  0.000000  0.000000  0.000000  0.000000  0.000000  0.000000  0.000000  0.000000

                                   1 2pz     1 2pz     1 2pz     1 2pz     1 2pz     1 2pz     1 4f0     1 4f2+    1 4f0     1 4f2+ 
                                   1 4f0     1 4f2+    1 4f0     1 4f2+    1 6h2+    1 6h4+    1 6h0     1 6h2+    1 6h4+    1 6h0  


   1.5  0.33333     0.005142     1.000386  0.000099 -0.000465  0.000426 -0.000962  0.000662  0.000000  0.000000  0.000000  0.000000
                                 0.000000  0.000000  0.000000  0.000000  0.000000  0.000000  0.000000  0.000000  0.000000  0.000000
 

 EXTRA SYMMETRY OF MOS IN SYMMETRY 1:   1 1 3 2 1 3 2 4 6 5   3 2 1 6 4 5 3 2 1 6   4 5 3 2 1
 EXTRA SYMMETRY OF MOS IN SYMMETRY 2:   1 1 1 2 3 1 2 3 5 4   6 2 3 1 2 3 5 4 6 1
 EXTRA SYMMETRY OF MOS IN SYMMETRY 3:   1 1 1 2 3 1 2 3 5 4   6 2 3 1 2 3 5 6 4 1
 EXTRA SYMMETRY OF MOS IN SYMMETRY 4:   1 1 2 3 1 2 3 1 2 3   1
 EXTRA SYMMETRY OF MOS IN SYMMETRY 5:   1 1 1 2 3 1 2 3 6 4   5 2 3 1 2 3 5 4 6 1
 EXTRA SYMMETRY OF MOS IN SYMMETRY 6:   1 1 3 2 1 3 2 1 3 2   1
 EXTRA SYMMETRY OF MOS IN SYMMETRY 7:   1 1 3 2 1 3 2 1 3 2   1
 EXTRA SYMMETRY OF MOS IN SYMMETRY 8:   1 1 3 2 1 1 2 3

 Natural orbital dump (state averaged) at molpro section  5202.2    (Orbital set 2)


 CI vector for state symmetry 1
 ==============================

 a 0 0           1.0000000

 TOTAL ENERGIES                        -1.98412431

 CI vector for state symmetry 2
 ==============================

 0 a 0           1.0000000

 TOTAL ENERGIES                        -1.98412431

 CI vector for state symmetry 3
 ==============================

 0 0 a           1.0000000

 TOTAL ENERGIES                        -1.98412431



 **********************************************************************************************************************************
 DATASETS  * FILE   NREC   LENGTH (MB)   RECORD NAMES
              1      21       38.36       500      610      700      900      950      970     1000      129      960     1100   
                                          VAR    BASINP    GEOM    SYMINP    ZMAT    AOBASIS   BASIS     P2S    ABASIS      S 
                                         1400     1410     1420     1200     1210     1080     1600     1650     1300     1700   
                                         EKIN       V       ECP      H0       H01     AOSYM     SMH    MOLCAS    ERIS     OPER   
                                         1380   
                                         JKOP   

              2       5        5.40       700     1000      520     4202     5202   
                                         GEOM     BASIS   MCVARS     RHF     MCSCF   

 PROGRAMS   *        TOTAL     MULTI       RHF       INT
 CPU TIMES  *         3.78      0.18      0.22      3.27
 REAL TIME  *        15.96 SEC
 DISK USED  *        87.97 MB      
 **********************************************************************************************************************************


 PROGRAM * RHF-SCF (OPEN SHELL)       Authors: W. Meyer, H.-J. Werner


 NUMBER OF ELECTRONS:       2+    1-    SPACE SYMMETRY=2    SPIN SYMMETRY: Doublet 
 CONVERGENCE THRESHOLDS:    1.00E-05 (Density)    1.00E-07 (Energy)
 MAX. NUMBER OF ITERATIONS:        0
 INTERPOLATION TYPE:            DIIS
 INTERPOLATION STEPS:              2 (START)      1 (STEP)
 LEVEL SHIFTS:                 -0.60 (CLOSED) -0.30 (OPEN) 


 Singly occupied orbitals:      1.2
 Molecular orbitals read from record     5202.2  Type=MCSCF/NATURAL (state averaged)

 Molecular orbital dump at record        2101.2

 ITERATION    DDIFF          GRAD             ENERGY        2-EL.EN.            DIPOLE MOMENTS         DIIS   ORB.
    1      0.000D+00      0.000D+00        -1.98412431      1.826204    0.00000    0.00000    0.00000    0    start

 Final alpha occupancy:   1   1   0   0   0   0   0   0
 Final beta  occupancy:   1   0   0   0   0   0   0   0

 !RHF STATE 1.2 Energy                 -1.984124314297
 Nuclear energy                         0.00000000
 One-electron energy                   -2.89722610
 Two-electron energy                    0.91310178
 Virial quotient                       -2.76816027
 !RHF STATE 1.2 Dipole moment           0.00000000     0.00000000     0.00000000
 Dipole moment /Debye                   0.00000000     0.00000000     0.00000000
 

 !RHF expec          <1.2|EKIN|1.2>     0.716766415672
 
 !RHF expec           <1.2|POT|1.2>    -1.287672687284

 ELECTRON ORBITALS
 =================


   Orb  Occ    Energy  Couls-En    Coefficients

                                   1 1s      1 1s      1 1s      1 1s      1 1s      1 1s      1 3d0     1 3d2+    1 3d0     1 3d2+ 
                                   1 3d0     1 3d2+    1 3d0     1 3d2+    1 3d0     1 3d2+    1 5g0     1 5g4+    1 5g2+    1 5g0  
                                   1 5g4+    1 5g2+    1 5g0     1 5g4+    1 5g2+ 

   1.1   2    -0.4318   -1.5039  1.000181  0.000357 -0.001206  0.001927 -0.002017  0.000908  0.000000  0.000000  0.000000  0.000000
                                 0.000000  0.000000  0.000000  0.000000  0.000000  0.000000  0.000000  0.000000  0.000000  0.000000
                                 0.000000  0.000000  0.000000  0.000000  0.000000

                                   1 2px     1 2px     1 2px     1 2px     1 2px     1 2px     1 4f1+    1 4f3+    1 4f1+    1 4f3+ 
                                   1 4f1+    1 4f3+    1 4f1+    1 4f3+    1 6h1+    1 6h3+    1 6h5+    1 6h1+    1 6h3+    1 6h5+ 


   1.2   +     0.0051   -0.7478  1.000386  0.000099 -0.000465  0.000426 -0.000962  0.000662  0.000000  0.000000  0.000000  0.000000
                                 0.000000  0.000000  0.000000  0.000000  0.000000  0.000000  0.000000  0.000000  0.000000  0.000000

 HOMO      1.2     0.005142 =       0.1399eV
 LUMO      1.3     0.005142 =       0.1399eV
 LUMO-HOMO         0.000000 =       0.0000eV


 **********************************************************************************************************************************
 DATASETS  * FILE   NREC   LENGTH (MB)   RECORD NAMES
              1      21       38.36       500      610      700      900      950      970     1000      129      960     1100   
                                          VAR    BASINP    GEOM    SYMINP    ZMAT    AOBASIS   BASIS     P2S    ABASIS      S 
                                         1400     1410     1420     1200     1210     1080     1600     1650     1300     1700   
                                         EKIN       V       ECP      H0       H01     AOSYM     SMH    MOLCAS    ERIS     OPER   
                                         1380   
                                         JKOP   

              2       6        8.00       700     1000      520     4202     5202     2101   
                                         GEOM     BASIS   MCVARS     RHF     MCSCF     RHF  

 PROGRAMS   *        TOTAL       RHF     MULTI       RHF       INT
 CPU TIMES  *         3.80      0.02      0.18      0.22      3.27
 REAL TIME  *        16.14 SEC
 DISK USED  *        87.97 MB      
 **********************************************************************************************************************************
 SETTING SCF(I)         =        -1.98412431  AU                              
 SETTING _CC_NORM_MAX   =         2.00000000                                  


 PROGRAM * UHF-SCF       Authors: W. Meyer, H.-J. Werner


 NUMBER OF ELECTRONS:       2+    1-    SPACE SYMMETRY=2    SPIN SYMMETRY: Doublet 
 CONVERGENCE THRESHOLDS:    1.00E-05 (Density)    1.00E-07 (Energy)
 MAX. NUMBER OF ITERATIONS:        0
 INTERPOLATION TYPE:            DIIS
 INTERPOLATION STEPS:              2 (START)      1 (STEP)
 LEVEL SHIFTS:                  0.20 (ALPHA)   0.20 (BETA) 



 Molecular orbitals read from record     2101.2  Type=RHF/CANONICAL (state 1.2)

 Molecular orbital dump at record        2200.2

 Initial alpha occupation   1   1   0   0   0   0   0   0
 Initial beta  occupation   1   0   0   0   0   0   0   0

 ITERATION    DDIFF          GRAD             ENERGY        2-EL.EN.            DIPOLE MOMENTS         DIIS
    1      0.000D+00      0.000D+00        -1.98412431      1.826204    0.00000    0.00000    0.00000    0
 
 Final alpha occupancy:   1   1   0   0   0   0   0   0
 Final beta  occupancy:   1   0   0   0   0   0   0   0

 !UHF STATE 1.2 Energy                 -1.984124314297
 Nuclear energy                         0.00000000
 One-electron energy                   -2.89722610
 Two-electron energy                    0.91310178
 Virial quotient                       -2.76816027
 !UHF STATE 1.2 Dipole moment           0.00000000     0.00000000     0.00000000
 Dipole moment /Debye                   0.00000000     0.00000000     0.00000000
 

 !UHF expec          <1.2|EKIN|1.2>     0.716766415672
 
 !UHF expec           <1.2|POT|1.2>    -1.287672687284

 ELECTRON ORBITALS FOR POSITIVE SPIN
 ===================================


   Orb  Occ    Energy  Couls-En    Coefficients

                                   1 1s      1 1s      1 1s      1 1s      1 1s      1 1s      1 3d0     1 3d2+    1 3d0     1 3d2+ 
                                   1 3d0     1 3d2+    1 3d0     1 3d2+    1 3d0     1 3d2+    1 5g0     1 5g4+    1 5g2+    1 5g0  
                                   1 5g4+    1 5g2+    1 5g0     1 5g4+    1 5g2+ 

   1.1   +    -0.4318   -1.5039  1.000181  0.000357 -0.001206  0.001927 -0.002017  0.000908  0.000000  0.000000  0.000000  0.000000
                                 0.000000  0.000000  0.000000  0.000000  0.000000  0.000000  0.000000  0.000000  0.000000  0.000000
                                 0.000000  0.000000  0.000000  0.000000  0.000000

                                   1 2px     1 2px     1 2px     1 2px     1 2px     1 2px     1 4f1+    1 4f3+    1 4f1+    1 4f3+ 
                                   1 4f1+    1 4f3+    1 4f1+    1 4f3+    1 6h1+    1 6h3+    1 6h5+    1 6h1+    1 6h3+    1 6h5+ 


   1.2   +     0.0051   -0.7478  1.000386  0.000099 -0.000465  0.000426 -0.000962  0.000662  0.000000  0.000000  0.000000  0.000000
                                 0.000000  0.000000  0.000000  0.000000  0.000000  0.000000  0.000000  0.000000  0.000000  0.000000

 ELECTRON ORBITALS FOR NEGATIVE SPIN
 ===================================


   Orb  Occ    Energy  Couls-En    Coefficients

                                   1 1s      1 1s      1 1s      1 1s      1 1s      1 1s      1 3d0     1 3d2+    1 3d0     1 3d2+ 
                                   1 3d0     1 3d2+    1 3d0     1 3d2+    1 3d0     1 3d2+    1 5g0     1 5g4+    1 5g2+    1 5g0  
                                   1 5g4+    1 5g2+    1 5g0     1 5g4+    1 5g2+ 

   1.1   -    -0.4318   -1.5039  1.000181  0.000357 -0.001206  0.001927 -0.002017  0.000908  0.000000  0.000000  0.000000  0.000000
                                 0.000000  0.000000  0.000000  0.000000  0.000000  0.000000  0.000000  0.000000  0.000000  0.000000
                                 0.000000  0.000000  0.000000  0.000000  0.000000

 HOMO      1.2     0.005142 =       0.1399eV
 LUMO      1.3     0.005142 =       0.1399eV
 LUMO-HOMO         0.000000 =       0.0000eV

 EXPECTATION VALUE OF S**2:             0.75000000

 Occupation number threshold for canonical orbitals:  1.999000 (occupied),  0.001000 (virtual)

 Number of pseudo-canonical orbitals per symmetry:    1   0   0   0   0   0   0   0
 Number of active natural orbitals per symmetry:      0   1   0   0   0   0   0   0

 NATURAL CHARGE ORBITALS
 =======================


   Orb     Occ        Energy       Coefficients

                                   1 1s      1 1s      1 1s      1 1s      1 1s      1 1s      1 3d0     1 3d2+    1 3d0     1 3d2+ 
                                   1 3d0     1 3d2+    1 3d0     1 3d2+    1 3d0     1 3d2+    1 5g0     1 5g4+    1 5g2+    1 5g0  
                                   1 5g4+    1 5g2+    1 5g0     1 5g4+    1 5g2+ 

   1.1  2.00000    -0.431791     1.000181  0.000357 -0.001206  0.001927 -0.002017  0.000908  0.000000  0.000000  0.000000  0.000000
                                 0.000000  0.000000  0.000000  0.000000  0.000000  0.000000  0.000000  0.000000  0.000000  0.000000
                                 0.000000  0.000000  0.000000  0.000000  0.000000

                                   1 2px     1 2px     1 2px     1 2px     1 2px     1 2px     1 4f1+    1 4f3+    1 4f1+    1 4f3+ 
                                   1 4f1+    1 4f3+    1 4f1+    1 4f3+    1 6h1+    1 6h3+    1 6h5+    1 6h1+    1 6h3+    1 6h5+ 


   1.2  1.00000    -0.063556     1.000386  0.000099 -0.000465  0.000426 -0.000962  0.000662  0.000000  0.000000  0.000000  0.000000
                                 0.000000  0.000000  0.000000  0.000000  0.000000  0.000000  0.000000  0.000000  0.000000  0.000000

 Natural orbitals saved to record    2200.2 (Orbital set 3)

 Orbital spaces for UNO-CAS (Min. occupation: 0.020  Max. occupation: 1.980):

 Closed:        1   0   0   0   0   0   0   0
 Active:        0   1   0   0   0   0   0   0

 No convergence



 **********************************************************************************************************************************
 DATASETS  * FILE   NREC   LENGTH (MB)   RECORD NAMES
              1      21       38.36       500      610      700      900      950      970     1000      129      960     1100   
                                          VAR    BASINP    GEOM    SYMINP    ZMAT    AOBASIS   BASIS     P2S    ABASIS      S 
                                         1400     1410     1420     1200     1210     1080     1600     1650     1300     1700   
                                         EKIN       V       ECP      H0       H01     AOSYM     SMH    MOLCAS    ERIS     OPER   
                                         1380   
                                         JKOP   

              2       7       10.62       700     1000      520     4202     5202     2101     2200   
                                         GEOM     BASIS   MCVARS     RHF     MCSCF     RHF      UHF  

 PROGRAMS   *        TOTAL       UHF       RHF     MULTI       RHF       INT
 CPU TIMES  *         3.83      0.03      0.02      0.18      0.22      3.27
 REAL TIME  *        16.43 SEC
 DISK USED  *        87.97 MB      
 **********************************************************************************************************************************
 SETTING SCF(I)         =        -1.98412431  AU                              


 PROGRAM * MRCC (General Multireference Coupled Cluster)    Author: M. Kallay, 2000-2005

 ***  Initialisation ***

   0 Spin projections
 
 Molecular orbitals read from record     2200.2  Type=UHF/ALPHA (state 1.2)

 ?Warning: UHF not converged
 Molecular orbitals read from record     2200.2  Type=UHF/BETA (state 1.2)

 ?Warning: UHF not converged
 
 Frozen orbitals:              0 (  0  0  0  0  0  0  0  0)
 Active orbitals:            126 ( 25 20 20 11 20 11 11  8)
 Active electrons:             3
 Spin quantum number:          0.5

 Transformed integrals will be written to file mrcc_22900/fort.55

 Load integrals                3.9 sec
 Transform integrals           6.2 sec
 Storage for integrals:       24278327
 Remaining memory:           *********

 Core energy:               0.00000000
 
 MRCC Input:
     4     0     0     0     3     0     0     2     0     0     0     1     1     0     0     7     0     0   0.000     0   64000
  ex.lev,nsing,ntrip, rest,method,dens,conver,symm, diag, CS ,spatial, HF, ndoub,nacto,nactv, tol, maxex, sacc, freq,  dboc,   mem
  2  0  0  0  0  0  0  0  0  0  0  0  0  0  0  0  0  0  0  0  0  0  0  0  0  1  0  0  0  0  0  0  0  0  0  0  0  0  0  0  0  0  0  0  0  0  0  0  0  0  0  0  0  0  0  0  0  0  0  0  0  0  0  0  0  0  0  0  0  0  0  0  0  0  0  0  0  0  0  0  0  0  0  0  0  0  0  0  0  0  0  0  0  0  0  0  0  0  0  0  0  0  0  0  0  0  0  0  0  0  0  0  0  0  0  0  0  0  0  0  0  0  0  0  0  0
 MRCC Input end
 Variable memory released
 MRCC now being run, temporary output in /global/cscratch1/sd/aannabe/mrcc_22900/mrcc.out
 **********************************************************************
                          MRCC program system
 **********************************************************************

                              Written by
  Mihaly Kallay, Zoltan Rolik, Jozsef Csontos, Peter Nagy, Gyula Samu,
      David Mester, Jozsef Csoka, Bernat Szabo, Istvan Ladjanszki,
       Lorant Szegedy, Bence Ladoczki, Klara Petrov, Mate Farkas,
                    Pal D. Mezei, and Bence Hegely

        Department of Physical Chemistry and Materials Science
            Budapest University of Technology and Economics
                  Budapest P.O.Box 91, H-1521 Hungary

                              www.mrcc.hu

                       Release date: May 23, 2018

 ************************ 2019-06-25 12:37:26 *************************
 Executing goldstone...

 Generation of CC equations in terms of H and T...
 Generation of antisymmetrized Goldstone diagrams...
 Number of diagrams in T^1 equations:    15
 Number of diagrams in T^2 equations:    33
 Number of diagrams in T^3 equations:     2
 Translation of diagrams to factorized equations...
 Optimizing intermediate calculation...
 Number of floating-point operations per iteration step:   2.5727E+08
 Probable CPU time per iteration step (hours):      0.00
 Required memory (Mbytes):   31251.9
 Number of intermediates:                                  48
 Number of intermediates to be stored:                     20
 Length of intermediate file (Mbytes):     477.2

 ************************ 2019-06-25 12:37:28 *************************
 Executing xmrcc...

 **********************************************************************
 CC(2)(3) calculation


 Allocation of****** Mbytes of memory...
 Number of spinorbitals:                   252
 Number of alpha electrons:                        2
 Number of beta electrons:                         1
 Spin multiplicity:                     2
 z-component of spin:  0.5
 Spatial symmetry:                      2
 Convergence criterion:  1.0E-07
 Construction of occupation graphs...
 Number of                     0 -fold excitations:                      1
 Number of                     1 -fold excitations:                     67
 Number of                     2 -fold excitations:                   5159
 Total number of configurations:                   5227
 Calculation of coupling coefficients...
 Length of intermediate file (Mbytes):     360.9

 ======================================================================

 Spin case  1   Alpha:  2   Beta:  1
 Number of excitations:                 119697
 Number of                     3 -fold excitations:                 119697

 Memory requirements /Mbyte/:
               Minimal        Optimal
 Real*8:        233.9746      1923.2150
 Integer:         5.3106
 Total:         239.2852      1928.5256


 ************************ 2019-06-25 12:37:32 *************************
 Executing mrcc...

 **********************************************************************
 CCSDT(T) calculation


 Allocation of 1923.2 Mbytes of memory...
 Number of spinorbitals: 252
 Number of alpha electrons:  2
 Number of beta  electrons:  1
 Spin multiplicity: 2
 z-component of spin:  0.5
 Spatial symmetry: 2
 Convergence criterion:  1.0E-07
 Construction of occupation graphs...
 Number of 0-fold excitations: 1
 Number of 1-fold excitations: 67
 Number of 2-fold excitations: 5159
 Total number of determinants: 5227
 Calculation of coupling coefficients...
 Initial cluster amplitudes are generated.
 Length of intermediate file (Mbytes):     360.9
 Reading integral list from unit 55...
 Sorting integrals...
 Sorting integrals...
 Sorting integrals...
 Sorting integrals...
 Energy of reference determinant [au]:      -1.984124314297
 Calculation of MP denominators...

 Starting CC iteration...
 ======================================================================
 Norm of residual vector:     0.28110547
 CPU time [min]:     0.849                   Wall time [min]:     0.890

 Iteration  1  CC energy:    -2.02891284  Energy decrease:   0.04478852
 ======================================================================
 Norm of residual vector:     0.06847366
 CPU time [min]:     1.110                   Wall time [min]:     1.223

 Iteration  2  CC energy:    -2.03521153  Energy decrease:   0.00629869
 ======================================================================
 Norm of residual vector:     0.01696187
 CPU time [min]:     1.373                   Wall time [min]:     1.534

 Iteration  3  CC energy:    -2.03796382  Energy decrease:   0.00275229
 ======================================================================
 Norm of residual vector:     0.00441077
 CPU time [min]:     1.632                   Wall time [min]:     1.848

 Iteration  4  CC energy:    -2.03798505  Energy decrease:   0.00002123
 ======================================================================
 Norm of residual vector:     0.00095401
 CPU time [min]:     1.895                   Wall time [min]:     2.142

 Iteration  5  CC energy:    -2.03805355  Energy decrease:   0.00006850
 ======================================================================
 Norm of residual vector:     0.00023516
 CPU time [min]:     2.157                   Wall time [min]:     2.410

 Iteration  6  CC energy:    -2.03804312  Energy decrease:   0.00001043
 ======================================================================
 Norm of residual vector:     0.00005521
 CPU time [min]:     2.414                   Wall time [min]:     2.678

 Iteration  7  CC energy:    -2.03804135  Energy decrease:   0.00000177
 ======================================================================
 Norm of residual vector:     0.00001478
 CPU time [min]:     2.676                   Wall time [min]:     2.942

 Iteration  8  CC energy:    -2.03804226  Energy decrease:   0.00000091
 ======================================================================
 Norm of residual vector:     0.00000388
 CPU time [min]:     2.937                   Wall time [min]:     3.207

 Iteration  9  CC energy:    -2.03804199  Energy decrease:   0.00000027
 ======================================================================
 Norm of residual vector:     0.00000102
 CPU time [min]:     3.195                   Wall time [min]:     3.471

 Iteration 10  CC energy:    -2.03804196  Energy decrease:   0.00000003
 ======================================================================
 Norm of residual vector:     0.00000026
 CPU time [min]:     3.456                   Wall time [min]:     3.734

 Iteration 11  CC energy:    -2.03804198  Energy decrease:   0.00000002
 ======================================================================
 Norm of residual vector:     0.00000006
 CPU time [min]:     3.717                   Wall time [min]:     3.998

 Iteration 12  CC energy:    -2.03804198  Energy decrease:   3.4958E-09
 ======================================================================

 Iteration has converged in 12 steps.

 Final results:
 Total CCSDT energy [au]:             -2.038041977305
 Total MP2 energy [au]:               -2.028912838089

 Perturbative corrections are calculated...
 ======================================================================
 Spin case  1   Alpha:  2   Beta:  1
 Number of excitations:        119697
 CPU time [min]:     3.779                   Wall time [min]:     4.137
 ======================================================================
 Number of 3-fold excitations: 119697
 CPU time [min]:     3.779                   Wall time [min]:     4.137

 Total CCSD[T] energy [au]:           -2.039247061610
 Total CCSD(T) energy [au]:           -2.039278240920

 ************************ 2019-06-25 12:41:42 *************************
                      Normal termination of mrcc.
 **********************************************************************
 !CCSDT STATE 1.2 Energy               -2.038041977305
 !MP2 STATE 1.2 Energy                 -2.028912838089
 !CCSD[T] STATE 1.2 Energy             -2.039247061610
 !CCSD(T) STATE 1.2 Energy             -2.039278240920
 
 CPU-time for MRCC:            226.7 sec
 Elapsed-time for MRCC:        259.5 sec

 Variable memory set to 8000000000 words,  buffer space   230000 words



 **********************************************************************************************************************************
 DATASETS  * FILE   NREC   LENGTH (MB)   RECORD NAMES
              1      21       38.36       500      610      700      900      950      970     1000      129      960     1100   
                                          VAR    BASINP    GEOM    SYMINP    ZMAT    AOBASIS   BASIS     P2S    ABASIS      S 
                                         1400     1410     1420     1200     1210     1080     1600     1650     1300     1700   
                                         EKIN       V       ECP      H0       H01     AOSYM     SMH    MOLCAS    ERIS     OPER   
                                         1380   
                                         JKOP   

              2       7       10.62       700     1000      520     4202     5202     2101     2200   
                                         GEOM     BASIS   MCVARS     RHF     MCSCF     RHF      UHF  

 PROGRAMS   *        TOTAL      MRCC       UHF       RHF     MULTI       RHF       INT
 CPU TIMES  *       289.87    286.04      0.03      0.02      0.18      0.22      3.27
 REAL TIME  *       601.86 SEC
 DISK USED  *        87.97 MB      
 **********************************************************************************************************************************
 SETTING POSTHF(I)      =        -2.03927824  AU                              
                                                                                                                                                                                                                                                                

       SCF           POSTHF       EKIN          POT
    -1.98412431   -2.03927824   0.71676642   -1.28767269
                                                  

 CCSD(T)/USERDEF energy=     -2.039278240920

        CCSD(T)         RHF-SCF         MULTI           RHF-SCF 
     -2.03927824     -1.98412431     -1.98412431     -1.98421228
 **********************************************************************************************************************************
 Molpro calculation terminated
 Variable memory released
