
 Primary working directories    : /global/cscratch1/sd/aannabe
 Secondary working directories  : /global/cscratch1/sd/aannabe
 Wavefunction directory         : /global/homes/a/aannabe/wfu/
 Main file repository           : /global/cscratch1/sd/aannabe/

 SHA1      : 2873118e99aab1bc19f5b6fc1784693c06d15c95
 NAME      : 2015.1.8
 ARCHNAME  : linux/x86_64
 FC        : /opt/cray/pe/craype/2.5.5/bin/ftn
 BLASLIB   : -Wl,-_start-group /opt/intel/compilers_and_libraries_2016.3.210/linux/mkl/lib/intel64/libmkl_intel_ilp64.a /opt/intel/compilers_and_libraries_2016.3.210/linux/mkl/lib/intel64/libmkl_intel_thread.a /opt/intel/compilers_and_libraries_2016.3.210/linux/mkl/lib/intel64/libmkl_core.a -Wl,-_end-group
 id        : lbl

 Nodes     nprocs
 nid00445     1

 Using customized tuning parameters: mindgm=8; mindgv=16; mindgc=4; mindgr=1; noblas=0; minvec=7
 default implementation of scratch files=df  

 ***,S
 memory,8,g
 gthresh,twoint=1.e-12
 
 gprint,basis,orbitals
 gexpec,ekin,pot
 
 angstrom
 geometry={
 1                                                                               ! Number of atoms
 S 0.0 0.0 0.0
 }
 
 basis={
 Including file /global/homes/a/aannabe/docs/totals/pps/S.pp
 Including file /global/homes/a/aannabe/docs/totals/basis/aug-cc-pVnZ/S_qz.basis
 }
 
 {hf
 wf,6,7,2
 occ,1,1,1,0,1,0,0,0
                                                                                 !open,1.3
 closed,1,1,0,0,0,0,0,0
                                                                                 !sym,
 }
 scf(i)=energy
 
 _CC_NORM_MAX=2.0
  !NOTE: Perturbative MRCC works only with UHF reference. So, here we will trick MRCC by doing zero UHF iteration right after ROHF.
 
 {uhf
 wf,6,7,2
 occ,1,1,1,0,1,0,0,0
                                                                                 !open,1.3
 closed,1,1,0,0,0,0,0,0
                                                                                 !sym,
 maxit,0
 }
 scf(i)=energy
 
 {mrcc,method=CCSDT(Q)
 orbital,ignore_error=1                                                          !Ignore the fact that UHF WF is not converged
 maxit,100
 core
 }
 posthf(i)=energy
 
 table,scf,posthf,ekin,pot
 save,4.csv,new
 
 

 Variables initialized (889), CPU time= 0.00 sec
 Commands  initialized (702), CPU time= 0.01 sec, 572 directives.
 Default parameters read. Elapsed time= 0.18 sec

 Checking input...
 Passed
1


                                         ***  PROGRAM SYSTEM MOLPRO  ***
                                       Copyright, TTI GmbH Stuttgart, 2015
                                    Version 2015.1 linked Sep  7 2016 23:09:38


 **********************************************************************************************************************************
 LABEL *   S                                                                             
  64 bit serial version                                                                  DATE: 05-Oct-18          TIME: 11:00:51  
 **********************************************************************************************************************************

 SHA1:             2873118e99aab1bc19f5b6fc1784693c06d15c95
 **********************************************************************************************************************************

 THRESHOLDS:

 ZERO    =  1.00D-12  ONEINT  =  1.00D-12  TWOINT  =  1.00D-12  PREFAC  =  1.00D-14  LOCALI  =  1.00D-09  EORDER  =  1.00D-04
 ENERGY  =  0.00D+00  ETEST   =  0.00D+00  EDENS   =  0.00D+00  THRDEDEF=  1.00D-06  GRADIENT=  1.00D-02  STEP    =  1.00D-03
 ORBITAL =  1.00D-05  CIVEC   =  1.00D-05  COEFF   =  1.00D-04  PRINTCI =  5.00D-02  PUNCHCI =  9.90D+01  OPTGRAD =  3.00D-04
 OPTENERG=  1.00D-06  OPTSTEP =  3.00D-04  THRGRAD =  1.00D-10  COMPRESS=  1.00D-11  VARMIN  =  1.00D-07  VARMAX  =  1.00D-03
 THRDOUB =  0.00D+00  THRDIV  =  1.00D-05  THRRED  =  1.00D-07  THRPSP  =  1.00D+00  THRDC   =  1.00D-10  THRCS   =  1.00D-10
 THRNRM  =  1.00D-08  THREQ   =  0.00D+00  THRDE   =  1.00D+00  THRREF  =  1.00D-05  SPARFAC =  1.00D+00  THRDLP  =  1.00D-07
 THRDIA  =  1.00D-10  THRDLS  =  1.00D-07  THRGPS  =  0.00D+00  THRKEX  =  0.00D+00  THRDIS  =  2.00D-01  THRVAR  =  1.00D-10
 THRLOC  =  1.00D-06  THRGAP  =  1.00D-06  THRLOCT = -1.00D+00  THRGAPT = -1.00D+00  THRORB  =  1.00D-06  THRMLTP =  0.00D+00
 THRCPQCI=  1.00D-10  KEXTA   =  0.00D+00  THRCOARS=  0.00D+00  SYMTOL  =  1.00D-06  GRADTOL =  1.00D-06  THROVL  =  1.00D-08
 THRORTH =  1.00D-08  GRID    =  1.00D-06  GRIDMAX =  1.00D-03  DTMAX   =  0.00D+00  THROCCDE=  1.00D-01  THROCCDE=  1.00D-01



 ZUNIT=ANG
 

Geometry recognized as XYZ


 Variable memory set to 8000000000 words,  buffer space   230000 words

 SETTING BASIS          =    USERDEF


 Recomputing integrals since basis changed


 Using spherical harmonics



 PROGRAM * SEWARD (Integral evaluation for generally contracted gaussian basis sets)     Author: Roland Lindh, 1990

 Geometry written to block  1 of record 700

 Orientation using atomic masses  
 Molecule type: Atom
 Symmetry elements: X,Y,Z
 Rotational constants:       0.0000000      0.0000000      0.0000000 GHz  (calculated with average atomic masses)

 Point group  D2h 



 ATOMIC COORDINATES

 NR  ATOM    CHARGE       X              Y              Z

   1  S       6.00    0.000000000    0.000000000    0.000000000


          S   CORE POTENTIAL

          d POTENTIAL

 POWERS             1              3              2
 EXPONENTIALS   6.151144       11.56157       5.390961    
 COEFFICIENTS   6.000000       36.90686      -19.81953    

          s - d POTENTIAL

 POWERS             2              2
 EXPONENTIALS   16.11769       3.608629    
 COEFFICIENTS   15.92575       38.51590    

          p - d POTENTIAL

 POWERS             2              2
 EXPONENTIALS   6.228956       2.978074    
 COEFFICIENTS   8.062221       18.73753    


 BASIS DATA

   Nr Sym  Nuc  Type         Exponents   Contraction coefficients

    1.1 Ag    1  1s          14.052570     0.002102
                              7.864913    -0.011042
                              4.401818     0.086618
                              2.463600    -0.271004
                              1.378823    -0.151274
                              0.771696     0.136044
                              0.431901     0.394360
                              0.241726     0.432098
                              0.135289     0.230974
                              0.075718     0.051205
    2.1 Ag    1  1s           0.818729     1.000000
    3.1 Ag    1  1s           0.332501     1.000000
    4.1 Ag    1  1s           0.135035     1.000000
    5.1 Ag    1  1s           0.064704     1.000000
    6.1 Ag    1  3d0          1.681890     1.000000
    7.1 Ag    1  3d2+         1.681890     1.000000
    8.1 Ag    1  3d0          0.613672     1.000000
    9.1 Ag    1  3d2+         0.613672     1.000000
   10.1 Ag    1  3d0          0.223911     1.000000
   11.1 Ag    1  3d2+         0.223911     1.000000
   12.1 Ag    1  3d0          0.088063     1.000000
   13.1 Ag    1  3d2+         0.088063     1.000000
   14.1 Ag    1  5g0          0.691446     1.000000
   15.1 Ag    1  5g4+         0.691446     1.000000
   16.1 Ag    1  5g2+         0.691446     1.000000
   17.1 Ag    1  5g0          0.300224     1.000000
   18.1 Ag    1  5g4+         0.300224     1.000000
   19.1 Ag    1  5g2+         0.300224     1.000000
    1.2 B3u   1  2px          6.808844    -0.003573
                              3.941560     0.001903
                              2.281723    -0.065016
                              1.320863     0.042305
                              0.764632     0.158772
                              0.442637     0.278172
                              0.256237     0.293821
                              0.148333     0.248015
                              0.085868     0.114905
                              0.049708     0.032934
    2.2 B3u   1  2px          2.088209     1.000000
    3.2 B3u   1  2px          0.838124     1.000000
    4.2 B3u   1  2px          0.336390     1.000000
    5.2 B3u   1  2px          0.159376     1.000000
    6.2 B3u   1  4f1+         0.898397     1.000000
    7.2 B3u   1  4f3+         0.898397     1.000000
    8.2 B3u   1  4f1+         0.339271     1.000000
    9.2 B3u   1  4f3+         0.339271     1.000000
   10.2 B3u   1  4f1+         0.145572     1.000000
   11.2 B3u   1  4f3+         0.145572     1.000000
    1.3 B2u   1  2py          6.808844    -0.003573
                              3.941560     0.001903
                              2.281723    -0.065016
                              1.320863     0.042305
                              0.764632     0.158772
                              0.442637     0.278172
                              0.256237     0.293821
                              0.148333     0.248015
                              0.085868     0.114905
                              0.049708     0.032934
    2.3 B2u   1  2py          2.088209     1.000000
    3.3 B2u   1  2py          0.838124     1.000000
    4.3 B2u   1  2py          0.336390     1.000000
    5.3 B2u   1  2py          0.159376     1.000000
    6.3 B2u   1  4f1-         0.898397     1.000000
    7.3 B2u   1  4f3-         0.898397     1.000000
    8.3 B2u   1  4f1-         0.339271     1.000000
    9.3 B2u   1  4f3-         0.339271     1.000000
   10.3 B2u   1  4f1-         0.145572     1.000000
   11.3 B2u   1  4f3-         0.145572     1.000000
    1.4 B1g   1  3d2-         1.681890     1.000000
    2.4 B1g   1  3d2-         0.613672     1.000000
    3.4 B1g   1  3d2-         0.223911     1.000000
    4.4 B1g   1  3d2-         0.088063     1.000000
    5.4 B1g   1  5g2-         0.691446     1.000000
    6.4 B1g   1  5g4-         0.691446     1.000000
    7.4 B1g   1  5g2-         0.300224     1.000000
    8.4 B1g   1  5g4-         0.300224     1.000000
    1.5 B1u   1  2pz          6.808844    -0.003573
                              3.941560     0.001903
                              2.281723    -0.065016
                              1.320863     0.042305
                              0.764632     0.158772
                              0.442637     0.278172
                              0.256237     0.293821
                              0.148333     0.248015
                              0.085868     0.114905
                              0.049708     0.032934
    2.5 B1u   1  2pz          2.088209     1.000000
    3.5 B1u   1  2pz          0.838124     1.000000
    4.5 B1u   1  2pz          0.336390     1.000000
    5.5 B1u   1  2pz          0.159376     1.000000
    6.5 B1u   1  4f0          0.898397     1.000000
    7.5 B1u   1  4f2+         0.898397     1.000000
    8.5 B1u   1  4f0          0.339271     1.000000
    9.5 B1u   1  4f2+         0.339271     1.000000
   10.5 B1u   1  4f0          0.145572     1.000000
   11.5 B1u   1  4f2+         0.145572     1.000000
    1.6 B2g   1  3d1+         1.681890     1.000000
    2.6 B2g   1  3d1+         0.613672     1.000000
    3.6 B2g   1  3d1+         0.223911     1.000000
    4.6 B2g   1  3d1+         0.088063     1.000000
    5.6 B2g   1  5g1+         0.691446     1.000000
    6.6 B2g   1  5g3+         0.691446     1.000000
    7.6 B2g   1  5g1+         0.300224     1.000000
    8.6 B2g   1  5g3+         0.300224     1.000000
    1.7 B3g   1  3d1-         1.681890     1.000000
    2.7 B3g   1  3d1-         0.613672     1.000000
    3.7 B3g   1  3d1-         0.223911     1.000000
    4.7 B3g   1  3d1-         0.088063     1.000000
    5.7 B3g   1  5g1-         0.691446     1.000000
    6.7 B3g   1  5g3-         0.691446     1.000000
    7.7 B3g   1  5g1-         0.300224     1.000000
    8.7 B3g   1  5g3-         0.300224     1.000000
    1.8 Au    1  4f2-         0.898397     1.000000
    2.8 Au    1  4f2-         0.339271     1.000000
    3.8 Au    1  4f2-         0.145572     1.000000

 NUCLEAR CHARGE:                    6
 NUMBER OF PRIMITIVE AOS:         140
 NUMBER OF SYMMETRY AOS:          115
 NUMBER OF CONTRACTIONS:           79   (  19Ag  +  11B3u +  11B2u +   8B1g +  11B1u +   8B2g +   8B3g +   3Au  )
 NUMBER OF CORE ORBITALS:           0   (   0Ag  +   0B3u +   0B2u +   0B1g +   0B1u +   0B2g +   0B3g +   0Au  )
 NUMBER OF VALENCE ORBITALS:        4   (   1Ag  +   1B3u +   1B2u +   0B1g +   1B1u +   0B2g +   0B3g +   0Au  )


 NUCLEAR REPULSION ENERGY    0.00000000

 EXTRA SYMMETRY OF AOS IN SYMMETRY 1:   1 1 1 1 1 2 3 2 3 2   3 2 3 4 5 6 4 5 6
 EXTRA SYMMETRY OF AOS IN SYMMETRY 2:   1 1 1 1 1 2 3 2 3 2   3
 EXTRA SYMMETRY OF AOS IN SYMMETRY 3:   1 1 1 1 1 2 3 2 3 2   3
 EXTRA SYMMETRY OF AOS IN SYMMETRY 4:   1 1 1 1 2 3 2 3
 EXTRA SYMMETRY OF AOS IN SYMMETRY 5:   1 1 1 1 1 2 3 2 3 2   3
 EXTRA SYMMETRY OF AOS IN SYMMETRY 6:   1 1 1 1 2 3 2 3
 EXTRA SYMMETRY OF AOS IN SYMMETRY 7:   1 1 1 1 2 3 2 3

 Eigenvalues of metric

         1 0.309E-02 0.173E-01 0.108E+00 0.108E+00 0.167E+00 0.372E+00 0.372E+00 0.372E+00
         2 0.199E-02 0.341E-01 0.187E+00 0.187E+00 0.210E+00 0.810E+00 0.810E+00 0.110E+01
         3 0.199E-02 0.341E-01 0.187E+00 0.187E+00 0.210E+00 0.810E+00 0.810E+00 0.110E+01
         4 0.108E+00 0.372E+00 0.372E+00 0.408E+00 0.118E+01 0.163E+01 0.163E+01 0.230E+01
         5 0.199E-02 0.341E-01 0.187E+00 0.187E+00 0.210E+00 0.810E+00 0.810E+00 0.110E+01
         6 0.108E+00 0.372E+00 0.372E+00 0.408E+00 0.118E+01 0.163E+01 0.163E+01 0.230E+01
         7 0.108E+00 0.372E+00 0.372E+00 0.408E+00 0.118E+01 0.163E+01 0.163E+01 0.230E+01
         8 0.187E+00 0.810E+00 0.200E+01


 Contracted 2-electron integrals neglected if value below      1.0D-12
 AO integral compression algorithm  1   Integral accuracy      1.0D-12

     6.291 MB (compressed) written to integral file ( 66.9%)


 NUMBER OF SORTED TWO-ELECTRON INTEGRALS:     665704.     BUFFER LENGTH:  32768
 NUMBER OF SEGMENTS:   1  SEGMENT LENGTH:     665704      RECORD LENGTH: 524288

 Memory used in sort:       1.22 MW

 SORT1 READ     1222209. AND WROTE      500866. INTEGRALS IN      2 RECORDS. CPU TIME:     0.02 SEC, REAL TIME:     0.05 SEC
 SORT2 READ      500866. AND WROTE      665704. INTEGRALS IN     24 RECORDS. CPU TIME:     0.04 SEC, REAL TIME:     0.11 SEC

 FILE SIZES:   FILE 1:    25.5 MBYTE,  FILE 4:     8.4 MBYTE,   TOTAL:     33.9 MBYTE

 OPERATOR DM      FOR CENTER  0  COORDINATES:    0.000000    0.000000    0.000000
 OPERATOR EKIN    FOR CENTER  0  COORDINATES:    0.000000    0.000000    0.000000
 OPERATOR POT     FOR CENTER  0  COORDINATES:    0.000000    0.000000    0.000000


 **********************************************************************************************************************************
 DATASETS  * FILE   NREC   LENGTH (MB)   RECORD NAMES
              1      20       22.69       500      610      700      900      950      970     1000      129      960     1100   
                                          VAR    BASINP    GEOM    SYMINP    ZMAT    AOBASIS   BASIS     P2S    ABASIS      S 
                                         1400     1410     1420     1200     1210     1080     1600     1650     1300     1700   
                                         EKIN       V       ECP      H0       H01     AOSYM     SMH    MOLCAS    ERIS     OPER   

 PROGRAMS   *        TOTAL       INT
 CPU TIMES  *         2.17      2.07
 REAL TIME  *        12.37 SEC
 DISK USED  *        34.23 MB      
 **********************************************************************************************************************************


 PROGRAM * RHF-SCF (OPEN SHELL)       Authors: W. Meyer, H.-J. Werner


 NUMBER OF ELECTRONS:       4+    2-    SPACE SYMMETRY=7    SPIN SYMMETRY: Triplet 
 CONVERGENCE THRESHOLDS:    1.00E-05 (Density)    1.00E-07 (Energy)
 MAX. NUMBER OF ITERATIONS:       60
 INTERPOLATION TYPE:            DIIS
 INTERPOLATION STEPS:              2 (START)      1 (STEP)
 LEVEL SHIFTS:                 -0.60 (CLOSED) -0.30 (OPEN) 

 Number of closed-shell orbitals:    2 (   1   1   0   0   0   0   0   0 )
 Number of open-shell orbitals:      2 (   0   0   1   0   1   0   0   0 )



   Atom=S  basis=ECP10MWB_GUESS    lmin=0  lmax=1

 Orbital guess generated from atomic densities. Full valence occupancy:    1   1   1   0   1   0   0   0


 Molecular orbital dump at record        2100.2

 ITERATION    DDIFF          GRAD             ENERGY        2-EL.EN.            DIPOLE MOMENTS         DIIS   ORB.
    1      0.000D+00      0.000D+00        -9.91267109     12.506535    0.00000    0.00000    0.00000    0    start
    2      0.000D+00      0.748D-02        -9.91946233     12.705720    0.00000    0.00000    0.00000    1    diag,B
    3      0.427D-01      0.225D-02        -9.92047629     12.777032    0.00000    0.00000    0.00000    2    diag,B
    4      0.236D-01      0.780D-03        -9.92060227     12.793855    0.00000    0.00000    0.00000    3    diag,B
    5      0.123D-01      0.151D-03        -9.92060586     12.794525    0.00000    0.00000    0.00000    4    diag,B
    6      0.223D-02      0.209D-04        -9.92060593     12.794435    0.00000    0.00000    0.00000    5    diag,B
    7      0.926D-04      0.790D-05        -9.92060594     12.794284    0.00000    0.00000    0.00000    6    fixocc
    8      0.166D-03      0.229D-05        -9.92060594     12.794281    0.00000    0.00000    0.00000    7    diag,B
    9      0.708D-04      0.609D-06        -9.92060594     12.794271    0.00000    0.00000    0.00000    8    diag,B
   10      0.194D-04      0.116D-06        -9.92060594     12.794271    0.00000    0.00000    0.00000    9    orth
   11      0.184D-05      0.247D-07        -9.92060594     12.794271    0.00000    0.00000    0.00000    0    orth

 Final alpha occupancy:   1   1   1   0   1   0   0   0
 Final beta  occupancy:   1   1   0   0   0   0   0   0

 !RHF STATE 1.7 Energy                 -9.920605941328
 Nuclear energy                         0.00000000
 One-electron energy                  -16.31774139
 Two-electron energy                    6.39713544
 Virial quotient                       -2.67839362
 !RHF STATE 1.7 Dipole moment           0.00000000     0.00000000     0.00000000
 Dipole moment /Debye                   0.00000000     0.00000000     0.00000000
 

 !RHF expec          <1.7|EKIN|1.7>     3.703938760083
 
 !RHF expec           <1.7|POT|1.7>    -3.636159545177

 ELECTRON ORBITALS
 =================


   Orb  Occ    Energy  Couls-En    Coefficients

                                   1 1s      1 1s      1 1s      1 1s      1 1s      1 3d0     1 3d2+    1 3d0     1 3d2+    1 3d0  
                                   1 3d2+    1 3d0     1 3d2+    1 5g0     1 5g4+    1 5g2+    1 5g0     1 5g4+    1 5g2+ 

   1.1   2    -0.8838   -3.9816  1.000009 -0.000074  0.000304 -0.000355  0.000085 -0.000556  0.000963  0.000117 -0.000203 -0.002238
                                 0.003876 -0.001393  0.002414  0.000002  0.000004 -0.000003 -0.000016 -0.000032  0.000024

                                   1 2px     1 2px     1 2px     1 2px     1 2px     1 4f1+    1 4f3+    1 4f1+    1 4f3+    1 4f1+ 
                                   1 4f3+ 

   1.2   2    -0.3962   -2.9089  1.169809  0.014077 -0.045842 -0.095471 -0.053067  0.001955 -0.002524  0.003746 -0.004835  0.001842
                                -0.002379

                                   1 2py     1 2py     1 2py     1 2py     1 2py     1 4f1-    1 4f3-    1 4f1-    1 4f3-    1 4f1- 
                                   1 4f3- 

   1.3   +    -0.4818   -3.0301  0.845069 -0.013078  0.041986  0.090561  0.044017  0.001522 -0.005894  0.002776 -0.010751  0.000990
                                -0.003836

                                   1 2pz     1 2pz     1 2pz     1 2pz     1 2pz     1 4f0     1 4f2+    1 4f0     1 4f2+    1 4f0  
                                   1 4f2+ 

   1.5   +    -0.4818   -3.0301  0.845069 -0.013078  0.041986  0.090561  0.044017  0.003728 -0.004813  0.006799 -0.008778  0.002426
                                -0.003132

 HOMO      1.2    -0.396162 =     -10.7801eV
 LUMO      2.1     0.120604 =       3.2818eV
 LUMO-HOMO         0.516766 =      14.0619eV


 **********************************************************************************************************************************
 DATASETS  * FILE   NREC   LENGTH (MB)   RECORD NAMES
              1      20       22.69       500      610      700      900      950      970     1000      129      960     1100   
                                          VAR    BASINP    GEOM    SYMINP    ZMAT    AOBASIS   BASIS     P2S    ABASIS      S 
                                         1400     1410     1420     1200     1210     1080     1600     1650     1300     1700   
                                         EKIN       V       ECP      H0       H01     AOSYM     SMH    MOLCAS    ERIS     OPER   

              2       4        2.78       700     1000      520     2100   
                                         GEOM     BASIS   MCVARS     RHF  

 PROGRAMS   *        TOTAL        HF       INT
 CPU TIMES  *         2.25      0.07      2.07
 REAL TIME  *        12.59 SEC
 DISK USED  *        34.23 MB      
 **********************************************************************************************************************************
 SETTING SCF(I)         =        -9.92060594  AU                              
 SETTING _CC_NORM_MAX   =         2.00000000                                  


 PROGRAM * UHF-SCF       Authors: W. Meyer, H.-J. Werner


 NUMBER OF ELECTRONS:       4+    2-    SPACE SYMMETRY=7    SPIN SYMMETRY: Triplet 
 CONVERGENCE THRESHOLDS:    1.00E-05 (Density)    1.00E-07 (Energy)
 MAX. NUMBER OF ITERATIONS:        0
 INTERPOLATION TYPE:            DIIS
 INTERPOLATION STEPS:              2 (START)      1 (STEP)
 LEVEL SHIFTS:                  0.20 (ALPHA)   0.20 (BETA) 

 Number of closed-shell orbitals:    2 (   1   1   0   0   0   0   0   0 )
 Number of open-shell orbitals:      2 (   0   0   1   0   1   0   0   0 )


 Molecular orbitals read from record     2100.2  Type=RHF/CANONICAL (state 1.7)

 Molecular orbital dump at record        2200.2

 Initial alpha occupation   1   1   1   0   1   0   0   0
 Initial beta  occupation   1   1   0   0   0   0   0   0

 ITERATION    DDIFF          GRAD             ENERGY        2-EL.EN.            DIPOLE MOMENTS         DIIS
    1      0.000D+00      0.000D+00        -9.92060594     12.794271    0.00000    0.00000    0.00000    0
 
 Final alpha occupancy:   1   1   1   0   1   0   0   0
 Final beta  occupancy:   1   1   0   0   0   0   0   0

 !UHF STATE 1.7 Energy                 -9.920605941328
 Nuclear energy                         0.00000000
 One-electron energy                  -16.31774139
 Two-electron energy                    6.39713544
 Virial quotient                       -2.67839362
 !UHF STATE 1.7 Dipole moment           0.00000000     0.00000000     0.00000000
 Dipole moment /Debye                   0.00000000     0.00000000     0.00000000
 

 !UHF expec          <1.7|EKIN|1.7>     3.703938760083
 
 !UHF expec           <1.7|POT|1.7>    -3.636159545177

 ELECTRON ORBITALS FOR POSITIVE SPIN
 ===================================


   Orb  Occ    Energy  Couls-En    Coefficients

                                   1 1s      1 1s      1 1s      1 1s      1 1s      1 3d0     1 3d2+    1 3d0     1 3d2+    1 3d0  
                                   1 3d2+    1 3d0     1 3d2+    1 5g0     1 5g4+    1 5g2+    1 5g0     1 5g4+    1 5g2+ 

   1.1   +    -0.8838   -3.9816  1.000009 -0.000074  0.000304 -0.000355  0.000085 -0.000556  0.000963  0.000117 -0.000203 -0.002238
                                 0.003876 -0.001393  0.002414  0.000002  0.000004 -0.000003 -0.000016 -0.000032  0.000024

                                   1 2px     1 2px     1 2px     1 2px     1 2px     1 4f1+    1 4f3+    1 4f1+    1 4f3+    1 4f1+ 
                                   1 4f3+ 

   1.2   +    -0.3962   -2.9089  1.169809  0.014077 -0.045842 -0.095471 -0.053067  0.001955 -0.002524  0.003746 -0.004835  0.001842
                                -0.002379

                                   1 2py     1 2py     1 2py     1 2py     1 2py     1 4f1-    1 4f3-    1 4f1-    1 4f3-    1 4f1- 
                                   1 4f3- 

   1.3   +    -0.4818   -3.0301  0.845069 -0.013078  0.041986  0.090561  0.044017  0.001522 -0.005894  0.002776 -0.010751  0.000990
                                -0.003836

                                   1 2pz     1 2pz     1 2pz     1 2pz     1 2pz     1 4f0     1 4f2+    1 4f0     1 4f2+    1 4f0  
                                   1 4f2+ 

   1.5   +    -0.4818   -3.0301  0.845069 -0.013078  0.041986  0.090561  0.044017  0.003728 -0.004813  0.006799 -0.008778  0.002426
                                -0.003132

 ELECTRON ORBITALS FOR NEGATIVE SPIN
 ===================================


   Orb  Occ    Energy  Couls-En    Coefficients

                                   1 1s      1 1s      1 1s      1 1s      1 1s      1 3d0     1 3d2+    1 3d0     1 3d2+    1 3d0  
                                   1 3d2+    1 3d0     1 3d2+    1 5g0     1 5g4+    1 5g2+    1 5g0     1 5g4+    1 5g2+ 

   1.1   -    -0.8838   -3.9816  1.000009 -0.000074  0.000304 -0.000355  0.000085 -0.000556  0.000963  0.000117 -0.000203 -0.002238
                                 0.003876 -0.001393  0.002414  0.000002  0.000004 -0.000003 -0.000016 -0.000032  0.000024

                                   1 2px     1 2px     1 2px     1 2px     1 2px     1 4f1+    1 4f3+    1 4f1+    1 4f3+    1 4f1+ 
                                   1 4f3+ 

   1.2   -    -0.3962   -2.9089  1.169809  0.014077 -0.045842 -0.095471 -0.053067  0.001955 -0.002524  0.003746 -0.004835  0.001842
                                -0.002379

 HOMO      1.2    -0.396162 =     -10.7801eV
 LUMO     -1.3    -0.481777 =     -13.1098eV
 LUMO-HOMO        -0.085615 =      -2.3297eV

 EXPECTATION VALUE OF S**2:             2.00000000

 Occupation number threshold for canonical orbitals:  1.999000 (occupied),  0.001000 (virtual)

 Number of pseudo-canonical orbitals per symmetry:    1   1   0   0   0   0   0   0
 Number of active natural orbitals per symmetry:      0   0   1   0   1   0   0   0

 NATURAL CHARGE ORBITALS
 =======================


   Orb     Occ        Energy       Coefficients

                                   1 1s      1 1s      1 1s      1 1s      1 1s      1 3d0     1 3d2+    1 3d0     1 3d2+    1 3d0  
                                   1 3d2+    1 3d0     1 3d2+    1 5g0     1 5g4+    1 5g2+    1 5g0     1 5g4+    1 5g2+ 

   1.1  2.00000    -0.883796     1.000009 -0.000074  0.000304 -0.000355  0.000085 -0.000556  0.000963  0.000117 -0.000203 -0.002238
                                 0.003876 -0.001393  0.002414  0.000002  0.000004 -0.000003 -0.000016 -0.000032  0.000024

                                   1 2px     1 2px     1 2px     1 2px     1 2px     1 4f1+    1 4f3+    1 4f1+    1 4f3+    1 4f1+ 
                                   1 4f3+ 

   1.2  2.00000    -0.396162     1.169809  0.014077 -0.045842 -0.095471 -0.053067  0.001955 -0.002524  0.003746 -0.004835  0.001842
                                -0.002379

                                   1 2py     1 2py     1 2py     1 2py     1 2py     1 4f1-    1 4f3-    1 4f1-    1 4f3-    1 4f1- 
                                   1 4f3- 

   1.3  1.00000    -0.225086     0.845069 -0.013078  0.041986  0.090561  0.044017  0.001522 -0.005894  0.002776 -0.010751  0.000990
                                -0.003836

                                   1 2pz     1 2pz     1 2pz     1 2pz     1 2pz     1 4f0     1 4f2+    1 4f0     1 4f2+    1 4f0  
                                   1 4f2+ 

   1.5  1.00000    -0.225086     0.845069 -0.013078  0.041986  0.090561  0.044017  0.003728 -0.004813  0.006799 -0.008778  0.002426
                                -0.003132

 Natural orbitals saved to record    2200.2 (Orbital set 3)

 Orbital spaces for UNO-CAS (Min. occupation: 0.020  Max. occupation: 1.980):

 Closed:        1   1   0   0   0   0   0   0
 Active:        0   0   1   0   1   0   0   0

 No convergence



 **********************************************************************************************************************************
 DATASETS  * FILE   NREC   LENGTH (MB)   RECORD NAMES
              1      20       22.69       500      610      700      900      950      970     1000      129      960     1100   
                                          VAR    BASINP    GEOM    SYMINP    ZMAT    AOBASIS   BASIS     P2S    ABASIS      S 
                                         1400     1410     1420     1200     1210     1080     1600     1650     1300     1700   
                                         EKIN       V       ECP      H0       H01     AOSYM     SMH    MOLCAS    ERIS     OPER   

              2       5        5.33       700     1000      520     2100     2200   
                                         GEOM     BASIS   MCVARS     RHF      UHF  

 PROGRAMS   *        TOTAL       UHF        HF       INT
 CPU TIMES  *         2.27      0.02      0.07      2.07
 REAL TIME  *        12.73 SEC
 DISK USED  *        34.23 MB      
 **********************************************************************************************************************************
 SETTING SCF(I)         =        -9.92060594  AU                              


 PROGRAM * MRCC (General Multireference Coupled Cluster)    Author: M. Kallay, 2000-2005

 ***  Initialisation ***

   0 Spin projections
 
 Molecular orbitals read from record     2200.2  Type=UHF/ALPHA (state 1.7)

 ?Warning: UHF not converged
 Molecular orbitals read from record     2200.2  Type=UHF/BETA (state 1.7)

 ?Warning: UHF not converged
 
 Frozen orbitals:              0 (  0  0  0  0  0  0  0  0)
 Active orbitals:             79 ( 19 11 11  8 11  8  8  3)
 Active electrons:             6
 Spin quantum number:          1.0

 Transformed integrals will be written to file mrcc_37328/fort.55

 Load integrals                2.3 sec
 Transform integrals           2.7 sec
 Storage for integrals:        3835052
 Remaining memory:           *********

 Core energy:               0.00000000
 
 MRCC Input:
     4     0     0     0     3     0     0     7     0     0     0     1     1     0     0     7     0     0   0.000     0   64000
  ex.lev,nsing,ntrip, rest,method,dens,conver,symm, diag, CS ,spatial, HF, ndoub,nacto,nactv, tol, maxex, sacc, freq,  dboc,   mem
  2  0  0  0  0  0  0  0  0  0  0  0  0  0  0  0  0  0  0  2  0  0  0  0  0  0  0  0  0  0  1  0  0  0  0  0  0  0  0  0  0  0  0  0  0  0  0  0  0  1  0  0  0  0  0  0  0  0  0  0  0  0  0  0  0  0  0  0  0  0  0  0  0  0  0  0  0  0  0
 MRCC Input end
 Variable memory released
 MRCC now being run, temporary output in /global/cscratch1/sd/aannabe/mrcc_37328/mrcc.out
 **********************************************************************
                          MRCC program system
 **********************************************************************

                              Written by
  Mihaly Kallay, Zoltan Rolik, Jozsef Csontos, Peter Nagy, Gyula Samu,
      David Mester, Jozsef Csoka, Bernat Szabo, Istvan Ladjanszki,
       Lorant Szegedy, Bence Ladoczki, Klara Petrov, Mate Farkas,
                    Pal D. Mezei, and Bence Hegely

        Department of Physical Chemistry and Materials Science
            Budapest University of Technology and Economics
                  Budapest P.O.Box 91, H-1521 Hungary

                              www.mrcc.hu

                       Release date: May 23, 2018

 ************************ 2018-10-05 11:01:54 *************************
 Executing goldstone...

 Generation of CC equations in terms of H and T...
 Generation of antisymmetrized Goldstone diagrams...
 Number of diagrams in T^1 equations:    15
 Number of diagrams in T^2 equations:    38
 Number of diagrams in T^3 equations:    49
 Number of diagrams in T^4 equations:     5
 Translation of diagrams to factorized equations...
 Optimizing intermediate calculation...
 Number of floating-point operations per iteration step:   4.7913E+10
 Probable CPU time per iteration step (hours):      0.48
 Required memory (Mbytes):    4369.9
 Number of intermediates:                                  79
 Number of intermediates to be stored:                     32
 Length of intermediate file (Mbytes):      80.5

 ************************ 2018-10-05 11:01:55 *************************
 Executing xmrcc...

 **********************************************************************
 CC(3)(4) calculation


 Allocation of4369.9 Mbytes of memory...
 Number of spinorbitals:                   158
 Number of alpha electrons:                        4
 Number of beta electrons:                         2
 Spin multiplicity:                     2
 z-component of spin:  1.0
 Spatial symmetry:                      7
 Convergence criterion:  1.0E-07
 Construction of occupation graphs...
 Number of                     0 -fold excitations:                      1
 Number of                     1 -fold excitations:                     76
 Number of                     2 -fold excitations:                   8550
 Number of                     3 -fold excitations:                 464089
 Total number of configurations:                 472716
 Calculation of coupling coefficients...
 Length of intermediate file (Mbytes):      61.4

 ======================================================================

 Spin case  1   Alpha:  2   Beta:  2
 Number of excitations:                6089985
 Spin case  2   Alpha:  3   Beta:  1
 Number of excitations:                5196246
 Spin case  3   Alpha:  4   Beta:  0
 Number of excitations:                 152628
 Number of                     4 -fold excitations:               11438859

 Memory requirements /Mbyte/:
               Minimal        Optimal
 Real*8:        127.6612       297.2647
 Integer:        21.4621
 Total:         149.1233       318.7268


 ************************ 2018-10-05 11:01:57 *************************
 Executing mrcc...

 **********************************************************************
 CCSDT(Q) calculation


 OpenMP parallel version is running.
 Number of CPUs:   1
 Allocation of  297.3 Mbytes of memory...
 Number of spinorbitals: 158
 Number of alpha electrons:  4
 Number of beta  electrons:  2
 Spin multiplicity: 2
 z-component of spin:  1.0
 Spatial symmetry: 7
 Convergence criterion:  1.0E-07
 Construction of occupation graphs...
 Number of 0-fold excitations: 1
 Number of 1-fold excitations: 76
 Number of 2-fold excitations: 8550
 Number of 3-fold excitations: 464089
 Total number of determinants: 472716
 Calculation of coupling coefficients...
 Initial cluster amplitudes are generated.
 Length of intermediate file (Mbytes):      61.4
 Reading integral list from unit 55...
 Sorting integrals...
 Sorting integrals...
 Sorting integrals...
 Sorting integrals...
 Energy of reference determinant [au]:      -9.920605941328
 Calculation of MP denominators...

 Starting CC iteration...
 ======================================================================
 Norm of residual vector:     0.66740135
 CPU time [min]:     0.241                   Wall time [min]:     0.253

 Iteration  1  CC energy:   -10.06590934  Energy decrease:   0.14530340
 ======================================================================
 Norm of residual vector:     0.19139650
 CPU time [min]:     0.379                   Wall time [min]:     0.406

 Iteration  2  CC energy:   -10.07970628  Energy decrease:   0.01379694
 ======================================================================
 Norm of residual vector:     0.05229750
 CPU time [min]:     0.523                   Wall time [min]:     0.554

 Iteration  3  CC energy:   -10.09053762  Energy decrease:   0.01083134
 ======================================================================
 Norm of residual vector:     0.01269033
 CPU time [min]:     0.656                   Wall time [min]:     0.689

 Iteration  4  CC energy:   -10.09092304  Energy decrease:   0.00038542
 ======================================================================
 Norm of residual vector:     0.00384945
 CPU time [min]:     0.791                   Wall time [min]:     0.823

 Iteration  5  CC energy:   -10.09098952  Energy decrease:   0.00006648
 ======================================================================
 Norm of residual vector:     0.00130595
 CPU time [min]:     0.926                   Wall time [min]:     0.958

 Iteration  6  CC energy:   -10.09099791  Energy decrease:   0.00000839
 ======================================================================
 Norm of residual vector:     0.00050660
 CPU time [min]:     1.060                   Wall time [min]:     1.093

 Iteration  7  CC energy:   -10.09098948  Energy decrease:   0.00000843
 ======================================================================
 Norm of residual vector:     0.00021326
 CPU time [min]:     1.200                   Wall time [min]:     1.232

 Iteration  8  CC energy:   -10.09099067  Energy decrease:   0.00000119
 ======================================================================
 Norm of residual vector:     0.00008051
 CPU time [min]:     1.339                   Wall time [min]:     1.373

 Iteration  9  CC energy:   -10.09099370  Energy decrease:   0.00000303
 ======================================================================
 Norm of residual vector:     0.00002764
 CPU time [min]:     1.480                   Wall time [min]:     1.518

 Iteration 10  CC energy:   -10.09099281  Energy decrease:   0.00000090
 ======================================================================
 Norm of residual vector:     0.00000868
 CPU time [min]:     1.619                   Wall time [min]:     1.660

 Iteration 11  CC energy:   -10.09099269  Energy decrease:   0.00000012
 ======================================================================
 Norm of residual vector:     0.00000275
 CPU time [min]:     1.758                   Wall time [min]:     1.801

 Iteration 12  CC energy:   -10.09099279  Energy decrease:   0.00000010
 ======================================================================
 Norm of residual vector:     0.00000088
 CPU time [min]:     1.910                   Wall time [min]:     1.955

 Iteration 13  CC energy:   -10.09099277  Energy decrease:   0.00000002
 ======================================================================
 Norm of residual vector:     0.00000026
 CPU time [min]:     2.046                   Wall time [min]:     2.091

 Iteration 14  CC energy:   -10.09099277  Energy decrease:   0.00000001
 ======================================================================
 Norm of residual vector:     0.00000008
 CPU time [min]:     2.176                   Wall time [min]:     2.222

 Iteration 15  CC energy:   -10.09099277  Energy decrease:   1.6045E-09
 ======================================================================

 Iteration has converged in 15 steps.

 Final results:
 Total CCSDT energy [au]:            -10.090992766723
 Total MP2 energy [au]:              -10.065909343913

 Perturbative corrections are calculated...
 ======================================================================
 Spin case  1   Alpha:  2   Beta:  2
 Number of excitations:        6089985
 CPU time [min]:    15.818                   Wall time [min]:    15.868
 ======================================================================
 Spin case  2   Alpha:  3   Beta:  1
 Number of excitations:        5196246
 CPU time [min]:    24.991                   Wall time [min]:    25.040
 ======================================================================
 Spin case  3   Alpha:  4   Beta:  0
 Number of excitations:        152628
 CPU time [min]:    25.957                   Wall time [min]:    26.007
 ======================================================================
 Number of 4-fold excitations: 11438859
 CPU time [min]:    25.957                   Wall time [min]:    26.007

 Total CCSDT[Q] energy [au]:         -10.090986496629
 Total CCSDT(Q) energy [au]:         -10.091217160175

 ************************ 2018-10-05 11:27:58 *************************
                      Normal termination of mrcc.
 **********************************************************************
 !CCSDT STATE 1.7 Energy              -10.090992766723
 !MP2 STATE 1.7 Energy                -10.065909343913
 !CCSDT[Q] STATE 1.7 Energy           -10.090986496629
 !CCSDT(Q) STATE 1.7 Energy           -10.091217160175
 
 CPU-time for MRCC:           1557.4 sec
 Elapsed-time for MRCC:       1565.6 sec

 Variable memory set to 8000000000 words,  buffer space   230000 words



 **********************************************************************************************************************************
 DATASETS  * FILE   NREC   LENGTH (MB)   RECORD NAMES
              1      20       22.69       500      610      700      900      950      970     1000      129      960     1100   
                                          VAR    BASINP    GEOM    SYMINP    ZMAT    AOBASIS   BASIS     P2S    ABASIS      S 
                                         1400     1410     1420     1200     1210     1080     1600     1650     1300     1700   
                                         EKIN       V       ECP      H0       H01     AOSYM     SMH    MOLCAS    ERIS     OPER   

              2       5        5.33       700     1000      520     2100     2200   
                                         GEOM     BASIS   MCVARS     RHF      UHF  

 PROGRAMS   *        TOTAL      MRCC       UHF        HF       INT
 CPU TIMES  *      1568.30   1566.04      0.02      0.07      2.07
 REAL TIME  *      1627.99 SEC
 DISK USED  *        34.23 MB      
 **********************************************************************************************************************************
 SETTING POSTHF(I)      =       -10.09121716  AU                              
                                                                                                                                                                                                                                                                

       SCF            POSTHF       EKIN          POT
    -9.92060594   -10.09121716   3.70393876   -3.63615955
                                                  

 CCSDT(Q)/USERDEF energy=    -10.091217160175

        CCSDT(Q)        HF-SCF  
    -10.09121716     -9.92060594
 **********************************************************************************************************************************
 Variable memory released
