
 Primary working directories    : /global/cscratch1/sd/aannabe
 Secondary working directories  : /global/cscratch1/sd/aannabe
 Wavefunction directory         : /global/homes/a/aannabe/wfu/
 Main file repository           : /global/cscratch1/sd/aannabe/

 SHA1      : 2873118e99aab1bc19f5b6fc1784693c06d15c95
 NAME      : 2015.1.8
 ARCHNAME  : linux/x86_64
 FC        : /opt/cray/pe/craype/2.5.5/bin/ftn
 BLASLIB   : -Wl,-_start-group /opt/intel/compilers_and_libraries_2016.3.210/linux/mkl/lib/intel64/libmkl_intel_ilp64.a /opt/intel/compilers_and_libraries_2016.3.210/linux/mkl/lib/intel64/libmkl_intel_thread.a /opt/intel/compilers_and_libraries_2016.3.210/linux/mkl/lib/intel64/libmkl_core.a -Wl,-_end-group
 id        : lbl

 Nodes     nprocs
 nid00445     1

 Using customized tuning parameters: mindgm=8; mindgv=16; mindgc=4; mindgr=1; noblas=0; minvec=7
 default implementation of scratch files=df  

 ***,Cl
 memory,8,g
 gthresh,twoint=1.e-12
 
 gprint,basis,orbitals
 gexpec,ekin,pot
 
 angstrom
 geometry={
 1                                                                               ! Number of atoms
 Cl 0.0 0.0 0.0
 }
 
 basis={
 Including file /global/homes/a/aannabe/docs/totals/pps/Cl.pp
 Including file /global/homes/a/aannabe/docs/totals/basis/aug-cc-pVnZ/Cl_tz.basis
 }
 
 {hf
 wf,7,3,1
 occ,1,1,1,0,1,0,0,0
                                                                                 !open,1.3
 closed,1,1,0,0,1,0,0,0
                                                                                 !sym,
 }
 scf(i)=energy
 
 _CC_NORM_MAX=2.0
  !NOTE: Perturbative MRCC works only with UHF reference. So, here we will trick MRCC by doing zero UHF iteration right after ROHF.
 
 {uhf
 wf,7,3,1
 occ,1,1,1,0,1,0,0,0
                                                                                 !open,1.3
 closed,1,1,0,0,1,0,0,0
                                                                                 !sym,
 maxit,0
 }
 scf(i)=energy
 
 {mrcc,method=CCSDT(Q)
 orbital,ignore_error=1                                                          !Ignore the fact that UHF WF is not converged
 maxit,100
 core
 }
 posthf(i)=energy
 
 table,scf,posthf,ekin,pot
 save,3.csv,new
 
 

 Variables initialized (889), CPU time= 0.01 sec
 Commands  initialized (702), CPU time= 0.00 sec, 572 directives.
 Default parameters read. Elapsed time= 0.12 sec

 Checking input...
 Passed
1


                                         ***  PROGRAM SYSTEM MOLPRO  ***
                                       Copyright, TTI GmbH Stuttgart, 2015
                                    Version 2015.1 linked Sep  7 2016 23:09:38


 **********************************************************************************************************************************
 LABEL *   Cl                                                                            
  64 bit serial version                                                                  DATE: 05-Oct-18          TIME: 10:58:02  
 **********************************************************************************************************************************

 SHA1:             2873118e99aab1bc19f5b6fc1784693c06d15c95
 **********************************************************************************************************************************

 THRESHOLDS:

 ZERO    =  1.00D-12  ONEINT  =  1.00D-12  TWOINT  =  1.00D-12  PREFAC  =  1.00D-14  LOCALI  =  1.00D-09  EORDER  =  1.00D-04
 ENERGY  =  0.00D+00  ETEST   =  0.00D+00  EDENS   =  0.00D+00  THRDEDEF=  1.00D-06  GRADIENT=  1.00D-02  STEP    =  1.00D-03
 ORBITAL =  1.00D-05  CIVEC   =  1.00D-05  COEFF   =  1.00D-04  PRINTCI =  5.00D-02  PUNCHCI =  9.90D+01  OPTGRAD =  3.00D-04
 OPTENERG=  1.00D-06  OPTSTEP =  3.00D-04  THRGRAD =  1.00D-10  COMPRESS=  1.00D-11  VARMIN  =  1.00D-07  VARMAX  =  1.00D-03
 THRDOUB =  0.00D+00  THRDIV  =  1.00D-05  THRRED  =  1.00D-07  THRPSP  =  1.00D+00  THRDC   =  1.00D-10  THRCS   =  1.00D-10
 THRNRM  =  1.00D-08  THREQ   =  0.00D+00  THRDE   =  1.00D+00  THRREF  =  1.00D-05  SPARFAC =  1.00D+00  THRDLP  =  1.00D-07
 THRDIA  =  1.00D-10  THRDLS  =  1.00D-07  THRGPS  =  0.00D+00  THRKEX  =  0.00D+00  THRDIS  =  2.00D-01  THRVAR  =  1.00D-10
 THRLOC  =  1.00D-06  THRGAP  =  1.00D-06  THRLOCT = -1.00D+00  THRGAPT = -1.00D+00  THRORB  =  1.00D-06  THRMLTP =  0.00D+00
 THRCPQCI=  1.00D-10  KEXTA   =  0.00D+00  THRCOARS=  0.00D+00  SYMTOL  =  1.00D-06  GRADTOL =  1.00D-06  THROVL  =  1.00D-08
 THRORTH =  1.00D-08  GRID    =  1.00D-06  GRIDMAX =  1.00D-03  DTMAX   =  0.00D+00  THROCCDE=  1.00D-01  THROCCDE=  1.00D-01



 ZUNIT=ANG
 

Geometry recognized as XYZ


 Variable memory set to 8000000000 words,  buffer space   230000 words

 SETTING BASIS          =    USERDEF


 Recomputing integrals since basis changed


 Using spherical harmonics



 PROGRAM * SEWARD (Integral evaluation for generally contracted gaussian basis sets)     Author: Roland Lindh, 1990

 Geometry written to block  1 of record 700

 Orientation using atomic masses  
 Molecule type: Atom
 Symmetry elements: X,Y,Z
 Rotational constants:       0.0000000      0.0000000      0.0000000 GHz  (calculated with average atomic masses)

 Point group  D2h 



 ATOMIC COORDINATES

 NR  ATOM    CHARGE       X              Y              Z

   1  CL      7.00    0.000000000    0.000000000    0.000000000


          CL  CORE POTENTIAL

          d POTENTIAL

 POWERS             1              3              2
 EXPONENTIALS   7.944352       12.80126       6.296744    
 COEFFICIENTS   7.000000       55.61046      -22.86078    

          s - d POTENTIAL

 POWERS             2              2
 EXPONENTIALS   17.90843       4.159880    
 COEFFICIENTS   15.83923       44.46950    

          p - d POTENTIAL

 POWERS             2              2
 EXPONENTIALS   7.931763       3.610412    
 COEFFICIENTS   8.321946       24.04474    


 BASIS DATA

   Nr Sym  Nuc  Type         Exponents   Contraction coefficients

    1.1 Ag    1  1s          15.583847     0.002501
                              8.858485    -0.010046
                              5.035519     0.085810
                              2.862391    -0.290136
                              1.627098    -0.140314
                              0.924908     0.146839
                              0.525755     0.392484
                              0.298860     0.425061
                              0.169884     0.227195
                              0.096569     0.059828
    2.1 Ag    1  1s           1.020976     1.000000
    3.1 Ag    1  1s           0.186161     1.000000
    4.1 Ag    1  1s           0.132342     1.000000
    5.1 Ag    1  3d0          1.172371     1.000000
    6.1 Ag    1  3d2+         1.172371     1.000000
    7.1 Ag    1  3d0          0.363254     1.000000
    8.1 Ag    1  3d2+         0.363254     1.000000
    9.1 Ag    1  3d0          0.137654     1.000000
   10.1 Ag    1  3d2+         0.137654     1.000000
    1.2 B3u   1  2px          7.682894    -0.004609
                              4.507558    -0.001798
                              2.644587    -0.068614
                              1.551581     0.062352
                              0.910313     0.166337
                              0.534081     0.282292
                              0.313346     0.275967
                              0.183840     0.241328
                              0.107859     0.110223
                              0.063281     0.040289
    2.2 B3u   1  2px          0.899235     1.000000
    3.2 B3u   1  2px          0.143669     1.000000
    4.2 B3u   1  2px          0.051775     1.000000
    5.2 B3u   1  4f1+         0.720453     1.000000
    6.2 B3u   1  4f3+         0.720453     1.000000
    7.2 B3u   1  4f1+         0.300374     1.000000
    8.2 B3u   1  4f3+         0.300374     1.000000
    1.3 B2u   1  2py          7.682894    -0.004609
                              4.507558    -0.001798
                              2.644587    -0.068614
                              1.551581     0.062352
                              0.910313     0.166337
                              0.534081     0.282292
                              0.313346     0.275967
                              0.183840     0.241328
                              0.107859     0.110223
                              0.063281     0.040289
    2.3 B2u   1  2py          0.899235     1.000000
    3.3 B2u   1  2py          0.143669     1.000000
    4.3 B2u   1  2py          0.051775     1.000000
    5.3 B2u   1  4f1-         0.720453     1.000000
    6.3 B2u   1  4f3-         0.720453     1.000000
    7.3 B2u   1  4f1-         0.300374     1.000000
    8.3 B2u   1  4f3-         0.300374     1.000000
    1.4 B1g   1  3d2-         1.172371     1.000000
    2.4 B1g   1  3d2-         0.363254     1.000000
    3.4 B1g   1  3d2-         0.137654     1.000000
    1.5 B1u   1  2pz          7.682894    -0.004609
                              4.507558    -0.001798
                              2.644587    -0.068614
                              1.551581     0.062352
                              0.910313     0.166337
                              0.534081     0.282292
                              0.313346     0.275967
                              0.183840     0.241328
                              0.107859     0.110223
                              0.063281     0.040289
    2.5 B1u   1  2pz          0.899235     1.000000
    3.5 B1u   1  2pz          0.143669     1.000000
    4.5 B1u   1  2pz          0.051775     1.000000
    5.5 B1u   1  4f0          0.720453     1.000000
    6.5 B1u   1  4f2+         0.720453     1.000000
    7.5 B1u   1  4f0          0.300374     1.000000
    8.5 B1u   1  4f2+         0.300374     1.000000
    1.6 B2g   1  3d1+         1.172371     1.000000
    2.6 B2g   1  3d1+         0.363254     1.000000
    3.6 B2g   1  3d1+         0.137654     1.000000
    1.7 B3g   1  3d1-         1.172371     1.000000
    2.7 B3g   1  3d1-         0.363254     1.000000
    3.7 B3g   1  3d1-         0.137654     1.000000
    1.8 Au    1  4f2-         0.720453     1.000000
    2.8 Au    1  4f2-         0.300374     1.000000

 NUCLEAR CHARGE:                    7
 NUMBER OF PRIMITIVE AOS:          90
 NUMBER OF SYMMETRY AOS:           81
 NUMBER OF CONTRACTIONS:           45   (  10Ag  +   8B3u +   8B2u +   3B1g +   8B1u +   3B2g +   3B3g +   2Au  )
 NUMBER OF CORE ORBITALS:           0   (   0Ag  +   0B3u +   0B2u +   0B1g +   0B1u +   0B2g +   0B3g +   0Au  )
 NUMBER OF VALENCE ORBITALS:        4   (   1Ag  +   1B3u +   1B2u +   0B1g +   1B1u +   0B2g +   0B3g +   0Au  )


 NUCLEAR REPULSION ENERGY    0.00000000

 EXTRA SYMMETRY OF AOS IN SYMMETRY 1:   1 1 1 1 2 3 2 3 2 3
 EXTRA SYMMETRY OF AOS IN SYMMETRY 2:   1 1 1 1 2 3 2 3
 EXTRA SYMMETRY OF AOS IN SYMMETRY 3:   1 1 1 1 2 3 2 3
 EXTRA SYMMETRY OF AOS IN SYMMETRY 5:   1 1 1 1 2 3 2 3

 Eigenvalues of metric

         1 0.483E-02 0.726E-01 0.205E+00 0.205E+00 0.569E+00 0.822E+00 0.822E+00 0.197E+01
         2 0.179E-01 0.251E+00 0.341E+00 0.341E+00 0.985E+00 0.166E+01 0.166E+01 0.275E+01
         3 0.179E-01 0.251E+00 0.341E+00 0.341E+00 0.985E+00 0.166E+01 0.166E+01 0.275E+01
         4 0.205E+00 0.822E+00 0.197E+01
         5 0.179E-01 0.251E+00 0.341E+00 0.341E+00 0.985E+00 0.166E+01 0.166E+01 0.275E+01
         6 0.205E+00 0.822E+00 0.197E+01
         7 0.205E+00 0.822E+00 0.197E+01
         8 0.341E+00 0.166E+01


 Contracted 2-electron integrals neglected if value below      1.0D-12
 AO integral compression algorithm  1   Integral accuracy      1.0D-12

     1.049 MB (compressed) written to integral file ( 94.8%)


 NUMBER OF SORTED TWO-ELECTRON INTEGRALS:      75808.     BUFFER LENGTH:  32768
 NUMBER OF SEGMENTS:   1  SEGMENT LENGTH:      75808      RECORD LENGTH: 524288

 Memory used in sort:       0.63 MW

 SORT1 READ      155797. AND WROTE       61548. INTEGRALS IN      1 RECORDS. CPU TIME:     0.00 SEC, REAL TIME:     0.01 SEC
 SORT2 READ       61548. AND WROTE       75808. INTEGRALS IN      4 RECORDS. CPU TIME:     0.02 SEC, REAL TIME:     0.03 SEC

 FILE SIZES:   FILE 1:    20.2 MBYTE,  FILE 4:     4.2 MBYTE,   TOTAL:     24.4 MBYTE

 OPERATOR DM      FOR CENTER  0  COORDINATES:    0.000000    0.000000    0.000000
 OPERATOR EKIN    FOR CENTER  0  COORDINATES:    0.000000    0.000000    0.000000
 OPERATOR POT     FOR CENTER  0  COORDINATES:    0.000000    0.000000    0.000000


 **********************************************************************************************************************************
 DATASETS  * FILE   NREC   LENGTH (MB)   RECORD NAMES
              1      20       19.60       500      610      700      900      950      970     1000      129      960     1100   
                                          VAR    BASINP    GEOM    SYMINP    ZMAT    AOBASIS   BASIS     P2S    ABASIS      S 
                                         1400     1410     1420     1200     1210     1080     1600     1650     1300     1700   
                                         EKIN       V       ECP      H0       H01     AOSYM     SMH    MOLCAS    ERIS     OPER   

 PROGRAMS   *        TOTAL       INT
 CPU TIMES  *         1.87      1.76
 REAL TIME  *        11.19 SEC
 DISK USED  *        24.67 MB      
 **********************************************************************************************************************************


 PROGRAM * RHF-SCF (OPEN SHELL)       Authors: W. Meyer, H.-J. Werner


 NUMBER OF ELECTRONS:       4+    3-    SPACE SYMMETRY=3    SPIN SYMMETRY: Doublet 
 CONVERGENCE THRESHOLDS:    1.00E-05 (Density)    1.00E-07 (Energy)
 MAX. NUMBER OF ITERATIONS:       60
 INTERPOLATION TYPE:            DIIS
 INTERPOLATION STEPS:              2 (START)      1 (STEP)
 LEVEL SHIFTS:                 -0.60 (CLOSED) -0.30 (OPEN) 

 Number of closed-shell orbitals:    3 (   1   1   0   0   1   0   0   0 )
 Number of open-shell orbitals:      1 (   0   0   1   0   0   0   0   0 )



   Atom=CL basis=ECP10MWB_GUESS    lmin=0  lmax=1

 Orbital guess generated from atomic densities. Full valence occupancy:    1   1   1   0   1   0   0   0


 Molecular orbital dump at record        2100.2

 ITERATION    DDIFF          GRAD             ENERGY        2-EL.EN.            DIPOLE MOMENTS         DIIS   ORB.
    1      0.000D+00      0.000D+00       -14.68772296     19.777928    0.00000    0.00000    0.00000    0    start
    2      0.000D+00      0.819D-02       -14.69087380     19.934695    0.00000    0.00000    0.00000    1    diag,B
    3      0.770D-02      0.215D-02       -14.69124750     19.978012    0.00000    0.00000    0.00000    2    diag,B
    4      0.357D-02      0.672D-03       -14.69129538     19.987416    0.00000    0.00000    0.00000    3    diag,B
    5      0.152D-02      0.142D-03       -14.69129784     19.989033    0.00000    0.00000    0.00000    4    diag,B
    6      0.433D-03      0.262D-04       -14.69129790     19.989215    0.00000    0.00000    0.00000    5    diag,B
    7      0.884D-04      0.521D-05       -14.69129790     19.989291    0.00000    0.00000    0.00000    6    fixocc
    8      0.884D-05      0.178D-05       -14.69129790     19.989305    0.00000    0.00000    0.00000    0    orth

 Final alpha occupancy:   1   1   1   0   1   0   0   0
 Final beta  occupancy:   1   1   0   0   1   0   0   0

 !RHF STATE 1.3 Energy                -14.691297900215
 Nuclear energy                         0.00000000
 One-electron energy                  -24.68595030
 Two-electron energy                    9.99465240
 Virial quotient                       -2.67238925
 !RHF STATE 1.3 Dipole moment           0.00000000     0.00000000     0.00000000
 Dipole moment /Debye                   0.00000000     0.00000000     0.00000000
 

 !RHF expec          <1.3|EKIN|1.3>     5.497439379063
 
 !RHF expec           <1.3|POT|1.3>    -4.697885441961

 ELECTRON ORBITALS
 =================


   Orb  Occ    Energy  Couls-En    Coefficients

                                   1 1s      1 1s      1 1s      1 1s      1 3d0     1 3d2+    1 3d0     1 3d2+    1 3d0     1 3d2+ 


   1.1   2    -1.0800   -5.0931  1.000035  0.000005  0.000171 -0.000244  0.000470  0.000815  0.001039  0.001800  0.001979  0.003428

                                   1 2px     1 2px     1 2px     1 2px     1 4f1+    1 4f3+    1 4f1+    1 4f3+ 

   1.2   2    -0.4913   -3.8161  0.989753  0.001344  0.008227  0.004429 -0.001097 -0.004247 -0.000979 -0.003791

                                   1 2py     1 2py     1 2py     1 2py     1 4f1-    1 4f3-    1 4f1-    1 4f3- 

   1.3   +    -0.5717   -3.9317  1.042920 -0.005923 -0.036904 -0.015501 -0.007529 -0.009721 -0.005816 -0.007509

                                   1 2pz     1 2pz     1 2pz     1 2pz     1 4f0     1 4f2+    1 4f0     1 4f2+ 

   1.5   2    -0.4913   -3.8161  0.989753  0.001344  0.008227  0.004429 -0.002686 -0.003468 -0.002398 -0.003096

 HOMO      1.2    -0.491255 =     -13.3677eV
 LUMO      2.3     0.133110 =       3.6221eV
 LUMO-HOMO         0.624365 =      16.9898eV


 **********************************************************************************************************************************
 DATASETS  * FILE   NREC   LENGTH (MB)   RECORD NAMES
              1      20       19.60       500      610      700      900      950      970     1000      129      960     1100   
                                          VAR    BASINP    GEOM    SYMINP    ZMAT    AOBASIS   BASIS     P2S    ABASIS      S 
                                         1400     1410     1420     1200     1210     1080     1600     1650     1300     1700   
                                         EKIN       V       ECP      H0       H01     AOSYM     SMH    MOLCAS    ERIS     OPER   

              2       4        2.76       700     1000      520     2100   
                                         GEOM     BASIS   MCVARS     RHF  

 PROGRAMS   *        TOTAL        HF       INT
 CPU TIMES  *         1.91      0.04      1.76
 REAL TIME  *        11.33 SEC
 DISK USED  *        24.67 MB      
 **********************************************************************************************************************************
 SETTING SCF(I)         =       -14.69129790  AU                              
 SETTING _CC_NORM_MAX   =         2.00000000                                  


 PROGRAM * UHF-SCF       Authors: W. Meyer, H.-J. Werner


 NUMBER OF ELECTRONS:       4+    3-    SPACE SYMMETRY=3    SPIN SYMMETRY: Doublet 
 CONVERGENCE THRESHOLDS:    1.00E-05 (Density)    1.00E-07 (Energy)
 MAX. NUMBER OF ITERATIONS:        0
 INTERPOLATION TYPE:            DIIS
 INTERPOLATION STEPS:              2 (START)      1 (STEP)
 LEVEL SHIFTS:                  0.20 (ALPHA)   0.20 (BETA) 

 Number of closed-shell orbitals:    3 (   1   1   0   0   1   0   0   0 )
 Number of open-shell orbitals:      1 (   0   0   1   0   0   0   0   0 )


 Molecular orbitals read from record     2100.2  Type=RHF/CANONICAL (state 1.3)

 Molecular orbital dump at record        2200.2

 Initial alpha occupation   1   1   1   0   1   0   0   0
 Initial beta  occupation   1   1   0   0   1   0   0   0

 ITERATION    DDIFF          GRAD             ENERGY        2-EL.EN.            DIPOLE MOMENTS         DIIS
    1      0.000D+00      0.000D+00       -14.69129790     19.989305    0.00000    0.00000    0.00000    0
 
 Final alpha occupancy:   1   1   1   0   1   0   0   0
 Final beta  occupancy:   1   1   0   0   1   0   0   0

 !UHF STATE 1.3 Energy                -14.691297900215
 Nuclear energy                         0.00000000
 One-electron energy                  -24.68595030
 Two-electron energy                    9.99465240
 Virial quotient                       -2.67238925
 !UHF STATE 1.3 Dipole moment           0.00000000     0.00000000     0.00000000
 Dipole moment /Debye                   0.00000000     0.00000000     0.00000000
 

 !UHF expec          <1.3|EKIN|1.3>     5.497439379063
 
 !UHF expec           <1.3|POT|1.3>    -4.697885441961

 ELECTRON ORBITALS FOR POSITIVE SPIN
 ===================================


   Orb  Occ    Energy  Couls-En    Coefficients

                                   1 1s      1 1s      1 1s      1 1s      1 3d0     1 3d2+    1 3d0     1 3d2+    1 3d0     1 3d2+ 


   1.1   +    -1.0800   -5.0931  1.000035  0.000005  0.000171 -0.000244  0.000470  0.000815  0.001039  0.001800  0.001979  0.003428

                                   1 2px     1 2px     1 2px     1 2px     1 4f1+    1 4f3+    1 4f1+    1 4f3+ 

   1.2   +    -0.4913   -3.8161  0.989753  0.001344  0.008227  0.004429 -0.001097 -0.004247 -0.000979 -0.003791

                                   1 2py     1 2py     1 2py     1 2py     1 4f1-    1 4f3-    1 4f1-    1 4f3- 

   1.3   +    -0.5717   -3.9317  1.042920 -0.005923 -0.036904 -0.015501 -0.007529 -0.009721 -0.005816 -0.007509

                                   1 2pz     1 2pz     1 2pz     1 2pz     1 4f0     1 4f2+    1 4f0     1 4f2+ 

   1.5   +    -0.4913   -3.8161  0.989753  0.001344  0.008227  0.004429 -0.002686 -0.003468 -0.002398 -0.003096

 ELECTRON ORBITALS FOR NEGATIVE SPIN
 ===================================


   Orb  Occ    Energy  Couls-En    Coefficients

                                   1 1s      1 1s      1 1s      1 1s      1 3d0     1 3d2+    1 3d0     1 3d2+    1 3d0     1 3d2+ 


   1.1   -    -1.0800   -5.0931  1.000035  0.000005  0.000171 -0.000244  0.000470  0.000815  0.001039  0.001800  0.001979  0.003428

                                   1 2px     1 2px     1 2px     1 2px     1 4f1+    1 4f3+    1 4f1+    1 4f3+ 

   1.2   -    -0.4913   -3.8161  0.989753  0.001344  0.008227  0.004429 -0.001097 -0.004247 -0.000979 -0.003791

                                   1 2pz     1 2pz     1 2pz     1 2pz     1 4f0     1 4f2+    1 4f0     1 4f2+ 

   1.5   -    -0.4913   -3.8161  0.989753  0.001344  0.008227  0.004429 -0.002686 -0.003468 -0.002398 -0.003096

 HOMO      1.2    -0.491255 =     -13.3677eV
 LUMO     -1.3    -0.571663 =     -15.5557eV
 LUMO-HOMO        -0.080408 =      -2.1880eV

 EXPECTATION VALUE OF S**2:             0.75000000

 Occupation number threshold for canonical orbitals:  1.999000 (occupied),  0.001000 (virtual)

 Number of pseudo-canonical orbitals per symmetry:    1   1   0   0   1   0   0   0
 Number of active natural orbitals per symmetry:      0   0   1   0   0   0   0   0

 NATURAL CHARGE ORBITALS
 =======================


   Orb     Occ        Energy       Coefficients

                                   1 1s      1 1s      1 1s      1 1s      1 3d0     1 3d2+    1 3d0     1 3d2+    1 3d0     1 3d2+ 


   1.1  2.00000    -1.079985     1.000035  0.000005  0.000171 -0.000244  0.000470  0.000815  0.001039  0.001800  0.001979  0.003428

                                   1 2px     1 2px     1 2px     1 2px     1 4f1+    1 4f3+    1 4f1+    1 4f3+ 

   1.2  2.00000    -0.491255     0.989753  0.001344  0.008227  0.004429 -0.001097 -0.004247 -0.000979 -0.003791

                                   1 2py     1 2py     1 2py     1 2py     1 4f1-    1 4f3-    1 4f1-    1 4f3- 

   1.3  1.00000    -0.298458     1.042920 -0.005923 -0.036904 -0.015501 -0.007529 -0.009721 -0.005816 -0.007509

                                   1 2pz     1 2pz     1 2pz     1 2pz     1 4f0     1 4f2+    1 4f0     1 4f2+ 

   1.5  2.00000    -0.491255     0.989753  0.001344  0.008227  0.004429 -0.002686 -0.003468 -0.002398 -0.003096

 Natural orbitals saved to record    2200.2 (Orbital set 3)

 Orbital spaces for UNO-CAS (Min. occupation: 0.020  Max. occupation: 1.980):

 Closed:        1   1   0   0   1   0   0   0
 Active:        0   0   1   0   0   0   0   0

 No convergence



 **********************************************************************************************************************************
 DATASETS  * FILE   NREC   LENGTH (MB)   RECORD NAMES
              1      20       19.60       500      610      700      900      950      970     1000      129      960     1100   
                                          VAR    BASINP    GEOM    SYMINP    ZMAT    AOBASIS   BASIS     P2S    ABASIS      S 
                                         1400     1410     1420     1200     1210     1080     1600     1650     1300     1700   
                                         EKIN       V       ECP      H0       H01     AOSYM     SMH    MOLCAS    ERIS     OPER   

              2       5        5.27       700     1000      520     2100     2200   
                                         GEOM     BASIS   MCVARS     RHF      UHF  

 PROGRAMS   *        TOTAL       UHF        HF       INT
 CPU TIMES  *         1.93      0.01      0.04      1.76
 REAL TIME  *        11.43 SEC
 DISK USED  *        24.96 MB      
 **********************************************************************************************************************************
 SETTING SCF(I)         =       -14.69129790  AU                              


 PROGRAM * MRCC (General Multireference Coupled Cluster)    Author: M. Kallay, 2000-2005

 ***  Initialisation ***

   0 Spin projections
 
 Molecular orbitals read from record     2200.2  Type=UHF/ALPHA (state 1.3)

 ?Warning: UHF not converged
 Molecular orbitals read from record     2200.2  Type=UHF/BETA (state 1.3)

 ?Warning: UHF not converged
 
 Frozen orbitals:              0 (  0  0  0  0  0  0  0  0)
 Active orbitals:             45 ( 10  8  8  3  8  3  3  2)
 Active electrons:             7
 Spin quantum number:          0.5

 Transformed integrals will be written to file mrcc_36073/fort.55

 Load integrals                2.0 sec
 Transform integrals           2.0 sec
 Storage for integrals:         426551
 Remaining memory:           *********

 Core energy:               0.00000000
 
 MRCC Input:
     4     0     0     0     3     0     0     3     0     0     0     1     1     0     0     7     0     0   0.000     0   64000
  ex.lev,nsing,ntrip, rest,method,dens,conver,symm, diag, CS ,spatial, HF, ndoub,nacto,nactv, tol, maxex, sacc, freq,  dboc,   mem
  2  0  0  0  0  0  0  0  0  0  2  0  0  0  0  0  0  0  1  0  0  0  0  0  0  0  0  0  0  2  0  0  0  0  0  0  0  0  0  0  0  0  0  0  0
 MRCC Input end
 Variable memory released
 MRCC now being run, temporary output in /global/cscratch1/sd/aannabe/mrcc_36073/mrcc.out
 **********************************************************************
                          MRCC program system
 **********************************************************************

                              Written by
  Mihaly Kallay, Zoltan Rolik, Jozsef Csontos, Peter Nagy, Gyula Samu,
      David Mester, Jozsef Csoka, Bernat Szabo, Istvan Ladjanszki,
       Lorant Szegedy, Bence Ladoczki, Klara Petrov, Mate Farkas,
                    Pal D. Mezei, and Bence Hegely

        Department of Physical Chemistry and Materials Science
            Budapest University of Technology and Economics
                  Budapest P.O.Box 91, H-1521 Hungary

                              www.mrcc.hu

                       Release date: May 23, 2018

 ************************ 2018-10-05 10:58:20 *************************
 Executing goldstone...

 Generation of CC equations in terms of H and T...
 Generation of antisymmetrized Goldstone diagrams...
 Number of diagrams in T^1 equations:    15
 Number of diagrams in T^2 equations:    38
 Number of diagrams in T^3 equations:    49
 Number of diagrams in T^4 equations:     5
 Translation of diagrams to factorized equations...
 Optimizing intermediate calculation...
 Number of floating-point operations per iteration step:   5.0173E+09
 Probable CPU time per iteration step (hours):      0.05
 Required memory (Mbytes):     393.4
 Number of intermediates:                                  79
 Number of intermediates to be stored:                     32
 Length of intermediate file (Mbytes):       9.8

 ************************ 2018-10-05 10:58:20 *************************
 Executing xmrcc...

 **********************************************************************
 CC(3)(4) calculation


 Allocation of 393.4 Mbytes of memory...
 Number of spinorbitals:                    90
 Number of alpha electrons:                        4
 Number of beta electrons:                         3
 Spin multiplicity:                     2
 z-component of spin:  0.5
 Spatial symmetry:                      3
 Convergence criterion:  1.0E-07
 Construction of occupation graphs...
 Number of                     0 -fold excitations:                      1
 Number of                     1 -fold excitations:                     53
 Number of                     2 -fold excitations:                   3698
 Number of                     3 -fold excitations:                 137170
 Total number of configurations:                 140922
 Calculation of coupling coefficients...
 Length of intermediate file (Mbytes):       7.8

 ======================================================================

 Spin case  1   Alpha:  1   Beta:  3
 Number of excitations:                 235120
 Spin case  2   Alpha:  2   Beta:  2
 Number of excitations:                1588850
 Spin case  3   Alpha:  3   Beta:  1
 Number of excitations:                 671700
 Spin case  4   Alpha:  4   Beta:  0
 Number of excitations:                  12879
 Number of                     4 -fold excitations:                2508549

 Memory requirements /Mbyte/:
               Minimal        Optimal
 Real*8:         29.2913        31.3201
 Integer:         9.4256
 Total:          38.7169        40.7457


 ************************ 2018-10-05 10:58:21 *************************
 Executing mrcc...

 **********************************************************************
 CCSDT(Q) calculation


 OpenMP parallel version is running.
 Number of CPUs:   1
 Allocation of   31.3 Mbytes of memory...
 Number of spinorbitals:  90
 Number of alpha electrons:  4
 Number of beta  electrons:  3
 Spin multiplicity: 2
 z-component of spin:  0.5
 Spatial symmetry: 3
 Convergence criterion:  1.0E-07
 Construction of occupation graphs...
 Number of 0-fold excitations: 1
 Number of 1-fold excitations: 53
 Number of 2-fold excitations: 3698
 Number of 3-fold excitations: 137170
 Total number of determinants: 140922
 Calculation of coupling coefficients...
 Initial cluster amplitudes are generated.
 Length of intermediate file (Mbytes):       7.8
 Reading integral list from unit 55...
 Sorting integrals...
 Sorting integrals...
 Sorting integrals...
 Sorting integrals...
 Energy of reference determinant [au]:     -14.691297900215
 Calculation of MP denominators...

 Starting CC iteration...
 ======================================================================
 Norm of residual vector:     0.77170667
 CPU time [min]:     0.047                   Wall time [min]:     0.050

 Iteration  1  CC energy:   -14.86916673  Energy decrease:   0.17786883
 ======================================================================
 Norm of residual vector:     0.20463829
 CPU time [min]:     0.077                   Wall time [min]:     0.081

 Iteration  2  CC energy:   -14.88612360  Energy decrease:   0.01695687
 ======================================================================
 Norm of residual vector:     0.05142142
 CPU time [min]:     0.108                   Wall time [min]:     0.113

 Iteration  3  CC energy:   -14.89715592  Energy decrease:   0.01103232
 ======================================================================
 Norm of residual vector:     0.01254033
 CPU time [min]:     0.140                   Wall time [min]:     0.146

 Iteration  4  CC energy:   -14.89754098  Energy decrease:   0.00038506
 ======================================================================
 Norm of residual vector:     0.00394984
 CPU time [min]:     0.170                   Wall time [min]:     0.181

 Iteration  5  CC energy:   -14.89757745  Energy decrease:   0.00003647
 ======================================================================
 Norm of residual vector:     0.00135847
 CPU time [min]:     0.202                   Wall time [min]:     0.215

 Iteration  6  CC energy:   -14.89759435  Energy decrease:   0.00001690
 ======================================================================
 Norm of residual vector:     0.00054117
 CPU time [min]:     0.233                   Wall time [min]:     0.249

 Iteration  7  CC energy:   -14.89758781  Energy decrease:   0.00000654
 ======================================================================
 Norm of residual vector:     0.00022091
 CPU time [min]:     0.266                   Wall time [min]:     0.283

 Iteration  8  CC energy:   -14.89758903  Energy decrease:   0.00000123
 ======================================================================
 Norm of residual vector:     0.00007657
 CPU time [min]:     0.298                   Wall time [min]:     0.317

 Iteration  9  CC energy:   -14.89759095  Energy decrease:   0.00000192
 ======================================================================
 Norm of residual vector:     0.00002390
 CPU time [min]:     0.332                   Wall time [min]:     0.352

 Iteration 10  CC energy:   -14.89759034  Energy decrease:   0.00000061
 ======================================================================
 Norm of residual vector:     0.00000709
 CPU time [min]:     0.365                   Wall time [min]:     0.385

 Iteration 11  CC energy:   -14.89759016  Energy decrease:   0.00000018
 ======================================================================
 Norm of residual vector:     0.00000217
 CPU time [min]:     0.397                   Wall time [min]:     0.419

 Iteration 12  CC energy:   -14.89759025  Energy decrease:   0.00000009
 ======================================================================
 Norm of residual vector:     0.00000063
 CPU time [min]:     0.430                   Wall time [min]:     0.452

 Iteration 13  CC energy:   -14.89759025  Energy decrease:   0.00000001
 ======================================================================
 Norm of residual vector:     0.00000019
 CPU time [min]:     0.462                   Wall time [min]:     0.485

 Iteration 14  CC energy:   -14.89759024  Energy decrease:   4.0534E-09
 ======================================================================
 Norm of residual vector:     0.00000006
 CPU time [min]:     0.492                   Wall time [min]:     0.515

 Iteration 15  CC energy:   -14.89759024  Energy decrease:   1.2555E-09
 ======================================================================

 Iteration has converged in 15 steps.

 Final results:
 Total CCSDT energy [au]:            -14.897590242611
 Total MP2 energy [au]:              -14.869166725459

 Perturbative corrections are calculated...
 ======================================================================
 Spin case  1   Alpha:  1   Beta:  3
 Number of excitations:        235120
 CPU time [min]:     1.202                   Wall time [min]:     1.226
 ======================================================================
 Spin case  2   Alpha:  2   Beta:  2
 Number of excitations:        1588850
 CPU time [min]:     2.878                   Wall time [min]:     2.904
 ======================================================================
 Spin case  3   Alpha:  3   Beta:  1
 Number of excitations:        671700
 CPU time [min]:     3.794                   Wall time [min]:     3.827
 ======================================================================
 Spin case  4   Alpha:  4   Beta:  0
 Number of excitations:        12879
 CPU time [min]:     3.866                   Wall time [min]:     3.899
 ======================================================================
 Number of 4-fold excitations: 2508549
 CPU time [min]:     3.866                   Wall time [min]:     3.900

 Total CCSDT[Q] energy [au]:         -14.897600153200
 Total CCSDT(Q) energy [au]:         -14.897809318901

 ************************ 2018-10-05 11:02:16 *************************
                      Normal termination of mrcc.
 **********************************************************************
 !CCSDT STATE 1.3 Energy              -14.897590242611
 !MP2 STATE 1.3 Energy                -14.869166725459
 !CCSDT[Q] STATE 1.3 Energy           -14.897600153200
 !CCSDT(Q) STATE 1.3 Energy           -14.897809318901
 
 CPU-time for MRCC:            232.0 sec
 Elapsed-time for MRCC:        237.7 sec

 Variable memory set to 8000000000 words,  buffer space   230000 words



 **********************************************************************************************************************************
 DATASETS  * FILE   NREC   LENGTH (MB)   RECORD NAMES
              1      20       19.60       500      610      700      900      950      970     1000      129      960     1100   
                                          VAR    BASINP    GEOM    SYMINP    ZMAT    AOBASIS   BASIS     P2S    ABASIS      S 
                                         1400     1410     1420     1200     1210     1080     1600     1650     1300     1700   
                                         EKIN       V       ECP      H0       H01     AOSYM     SMH    MOLCAS    ERIS     OPER   

              2       5        5.27       700     1000      520     2100     2200   
                                         GEOM     BASIS   MCVARS     RHF      UHF  

 PROGRAMS   *        TOTAL      MRCC       UHF        HF       INT
 CPU TIMES  *       234.74    232.80      0.01      0.04      1.76
 REAL TIME  *       254.78 SEC
 DISK USED  *        24.96 MB      
 **********************************************************************************************************************************
 SETTING POSTHF(I)      =       -14.89780932  AU                              
                                                                                                                                                                                                                                                                

        SCF            POSTHF       EKIN          POT
    -14.69129790   -14.89780932   5.49743938   -4.69788544
                                                  

 CCSDT(Q)/USERDEF energy=    -14.897809318901

        CCSDT(Q)        UHF-SCF         HF-SCF  
    -14.89780932    -14.69129790    -14.69129790
 **********************************************************************************************************************************
 Variable memory released
