
 Primary working directories    : /global/cscratch1/sd/aannabe
 Secondary working directories  : /global/cscratch1/sd/aannabe
 Wavefunction directory         : /global/homes/a/aannabe/wfu/
 Main file repository           : /global/cscratch1/sd/aannabe/

 SHA1      : 2873118e99aab1bc19f5b6fc1784693c06d15c95
 NAME      : 2015.1.8
 ARCHNAME  : linux/x86_64
 FC        : /opt/cray/pe/craype/2.5.5/bin/ftn
 BLASLIB   : -Wl,-_start-group /opt/intel/compilers_and_libraries_2016.3.210/linux/mkl/lib/intel64/libmkl_intel_ilp64.a /opt/intel/compilers_and_libraries_2016.3.210/linux/mkl/lib/intel64/libmkl_intel_thread.a /opt/intel/compilers_and_libraries_2016.3.210/linux/mkl/lib/intel64/libmkl_core.a -Wl,-_end-group
 id        : lbl

 Nodes     nprocs
 nid00445     1

 Using customized tuning parameters: mindgm=8; mindgv=16; mindgc=4; mindgr=1; noblas=0; minvec=7
 default implementation of scratch files=df  

 ***,Cl
 memory,8,g
 gthresh,twoint=1.e-12
 
 gprint,basis,orbitals
 gexpec,ekin,pot
 
 angstrom
 geometry={
 1                                                                               ! Number of atoms
 Cl 0.0 0.0 0.0
 }
 
 basis={
 Including file /global/homes/a/aannabe/docs/totals/pps/Cl.pp
 Including file /global/homes/a/aannabe/docs/totals/basis/aug-cc-pVnZ/Cl_qz.basis
 }
 
 {hf
 wf,7,3,1
 occ,1,1,1,0,1,0,0,0
                                                                                 !open,1.3
 closed,1,1,0,0,1,0,0,0
                                                                                 !sym,
 }
 scf(i)=energy
 
 _CC_NORM_MAX=2.0
  !NOTE: Perturbative MRCC works only with UHF reference. So, here we will trick MRCC by doing zero UHF iteration right after ROHF.
 
 {uhf
 wf,7,3,1
 occ,1,1,1,0,1,0,0,0
                                                                                 !open,1.3
 closed,1,1,0,0,1,0,0,0
                                                                                 !sym,
 maxit,0
 }
 scf(i)=energy
 
 {mrcc,method=CCSDT(Q)
 orbital,ignore_error=1                                                          !Ignore the fact that UHF WF is not converged
 maxit,100
 core
 }
 posthf(i)=energy
 
 table,scf,posthf,ekin,pot
 save,4.csv,new
 
 

 Variables initialized (889), CPU time= 0.00 sec
 Commands  initialized (702), CPU time= 0.01 sec, 572 directives.
 Default parameters read. Elapsed time= 0.12 sec

 Checking input...
 Passed
1


                                         ***  PROGRAM SYSTEM MOLPRO  ***
                                       Copyright, TTI GmbH Stuttgart, 2015
                                    Version 2015.1 linked Sep  7 2016 23:09:38


 **********************************************************************************************************************************
 LABEL *   Cl                                                                            
  64 bit serial version                                                                  DATE: 05-Oct-18          TIME: 11:02:21  
 **********************************************************************************************************************************

 SHA1:             2873118e99aab1bc19f5b6fc1784693c06d15c95
 **********************************************************************************************************************************

 THRESHOLDS:

 ZERO    =  1.00D-12  ONEINT  =  1.00D-12  TWOINT  =  1.00D-12  PREFAC  =  1.00D-14  LOCALI  =  1.00D-09  EORDER  =  1.00D-04
 ENERGY  =  0.00D+00  ETEST   =  0.00D+00  EDENS   =  0.00D+00  THRDEDEF=  1.00D-06  GRADIENT=  1.00D-02  STEP    =  1.00D-03
 ORBITAL =  1.00D-05  CIVEC   =  1.00D-05  COEFF   =  1.00D-04  PRINTCI =  5.00D-02  PUNCHCI =  9.90D+01  OPTGRAD =  3.00D-04
 OPTENERG=  1.00D-06  OPTSTEP =  3.00D-04  THRGRAD =  1.00D-10  COMPRESS=  1.00D-11  VARMIN  =  1.00D-07  VARMAX  =  1.00D-03
 THRDOUB =  0.00D+00  THRDIV  =  1.00D-05  THRRED  =  1.00D-07  THRPSP  =  1.00D+00  THRDC   =  1.00D-10  THRCS   =  1.00D-10
 THRNRM  =  1.00D-08  THREQ   =  0.00D+00  THRDE   =  1.00D+00  THRREF  =  1.00D-05  SPARFAC =  1.00D+00  THRDLP  =  1.00D-07
 THRDIA  =  1.00D-10  THRDLS  =  1.00D-07  THRGPS  =  0.00D+00  THRKEX  =  0.00D+00  THRDIS  =  2.00D-01  THRVAR  =  1.00D-10
 THRLOC  =  1.00D-06  THRGAP  =  1.00D-06  THRLOCT = -1.00D+00  THRGAPT = -1.00D+00  THRORB  =  1.00D-06  THRMLTP =  0.00D+00
 THRCPQCI=  1.00D-10  KEXTA   =  0.00D+00  THRCOARS=  0.00D+00  SYMTOL  =  1.00D-06  GRADTOL =  1.00D-06  THROVL  =  1.00D-08
 THRORTH =  1.00D-08  GRID    =  1.00D-06  GRIDMAX =  1.00D-03  DTMAX   =  0.00D+00  THROCCDE=  1.00D-01  THROCCDE=  1.00D-01



 ZUNIT=ANG
 

Geometry recognized as XYZ


 Variable memory set to 8000000000 words,  buffer space   230000 words

 SETTING BASIS          =    USERDEF


 Recomputing integrals since basis changed


 Using spherical harmonics



 PROGRAM * SEWARD (Integral evaluation for generally contracted gaussian basis sets)     Author: Roland Lindh, 1990

 Geometry written to block  1 of record 700

 Orientation using atomic masses  
 Molecule type: Atom
 Symmetry elements: X,Y,Z
 Rotational constants:       0.0000000      0.0000000      0.0000000 GHz  (calculated with average atomic masses)

 Point group  D2h 



 ATOMIC COORDINATES

 NR  ATOM    CHARGE       X              Y              Z

   1  CL      7.00    0.000000000    0.000000000    0.000000000


          CL  CORE POTENTIAL

          d POTENTIAL

 POWERS             1              3              2
 EXPONENTIALS   7.944352       12.80126       6.296744    
 COEFFICIENTS   7.000000       55.61046      -22.86078    

          s - d POTENTIAL

 POWERS             2              2
 EXPONENTIALS   17.90843       4.159880    
 COEFFICIENTS   15.83923       44.46950    

          p - d POTENTIAL

 POWERS             2              2
 EXPONENTIALS   7.931763       3.610412    
 COEFFICIENTS   8.321946       24.04474    


 BASIS DATA

   Nr Sym  Nuc  Type         Exponents   Contraction coefficients

    1.1 Ag    1  1s          15.583847     0.002501
                              8.858485    -0.010046
                              5.035519     0.085810
                              2.862391    -0.290136
                              1.627098    -0.140314
                              0.924908     0.146839
                              0.525755     0.392484
                              0.298860     0.425061
                              0.169884     0.227195
                              0.096569     0.059828
    2.1 Ag    1  1s           1.038268     1.000000
    3.1 Ag    1  1s           0.418863     1.000000
    4.1 Ag    1  1s           0.168980     1.000000
    5.1 Ag    1  1s           0.080650     1.000000
    6.1 Ag    1  3d0          2.102692     1.000000
    7.1 Ag    1  3d2+         2.102692     1.000000
    8.1 Ag    1  3d0          0.763188     1.000000
    9.1 Ag    1  3d2+         0.763188     1.000000
   10.1 Ag    1  3d0          0.277005     1.000000
   11.1 Ag    1  3d2+         0.277005     1.000000
   12.1 Ag    1  3d0          0.110075     1.000000
   13.1 Ag    1  3d2+         0.110075     1.000000
   14.1 Ag    1  5g0          0.844301     1.000000
   15.1 Ag    1  5g4+         0.844301     1.000000
   16.1 Ag    1  5g2+         0.844301     1.000000
   17.1 Ag    1  5g0          0.374704     1.000000
   18.1 Ag    1  5g4+         0.374704     1.000000
   19.1 Ag    1  5g2+         0.374704     1.000000
    1.2 B3u   1  2px          7.682894    -0.004609
                              4.507558    -0.001798
                              2.644587    -0.068614
                              1.551581     0.062352
                              0.910313     0.166337
                              0.534081     0.282292
                              0.313346     0.275967
                              0.183840     0.241328
                              0.107859     0.110223
                              0.063281     0.040289
    2.2 B3u   1  2px          2.626653     1.000000
    3.2 B3u   1  2px          1.069041     1.000000
    4.2 B3u   1  2px          0.435097     1.000000
    5.2 B3u   1  2px          0.204536     1.000000
    6.2 B3u   1  4f1+         1.139446     1.000000
    7.2 B3u   1  4f3+         1.139446     1.000000
    8.2 B3u   1  4f1+         0.434852     1.000000
    9.2 B3u   1  4f3+         0.434852     1.000000
   10.2 B3u   1  4f1+         0.209794     1.000000
   11.2 B3u   1  4f3+         0.209794     1.000000
    1.3 B2u   1  2py          7.682894    -0.004609
                              4.507558    -0.001798
                              2.644587    -0.068614
                              1.551581     0.062352
                              0.910313     0.166337
                              0.534081     0.282292
                              0.313346     0.275967
                              0.183840     0.241328
                              0.107859     0.110223
                              0.063281     0.040289
    2.3 B2u   1  2py          2.626653     1.000000
    3.3 B2u   1  2py          1.069041     1.000000
    4.3 B2u   1  2py          0.435097     1.000000
    5.3 B2u   1  2py          0.204536     1.000000
    6.3 B2u   1  4f1-         1.139446     1.000000
    7.3 B2u   1  4f3-         1.139446     1.000000
    8.3 B2u   1  4f1-         0.434852     1.000000
    9.3 B2u   1  4f3-         0.434852     1.000000
   10.3 B2u   1  4f1-         0.209794     1.000000
   11.3 B2u   1  4f3-         0.209794     1.000000
    1.4 B1g   1  3d2-         2.102692     1.000000
    2.4 B1g   1  3d2-         0.763188     1.000000
    3.4 B1g   1  3d2-         0.277005     1.000000
    4.4 B1g   1  3d2-         0.110075     1.000000
    5.4 B1g   1  5g2-         0.844301     1.000000
    6.4 B1g   1  5g4-         0.844301     1.000000
    7.4 B1g   1  5g2-         0.374704     1.000000
    8.4 B1g   1  5g4-         0.374704     1.000000
    1.5 B1u   1  2pz          7.682894    -0.004609
                              4.507558    -0.001798
                              2.644587    -0.068614
                              1.551581     0.062352
                              0.910313     0.166337
                              0.534081     0.282292
                              0.313346     0.275967
                              0.183840     0.241328
                              0.107859     0.110223
                              0.063281     0.040289
    2.5 B1u   1  2pz          2.626653     1.000000
    3.5 B1u   1  2pz          1.069041     1.000000
    4.5 B1u   1  2pz          0.435097     1.000000
    5.5 B1u   1  2pz          0.204536     1.000000
    6.5 B1u   1  4f0          1.139446     1.000000
    7.5 B1u   1  4f2+         1.139446     1.000000
    8.5 B1u   1  4f0          0.434852     1.000000
    9.5 B1u   1  4f2+         0.434852     1.000000
   10.5 B1u   1  4f0          0.209794     1.000000
   11.5 B1u   1  4f2+         0.209794     1.000000
    1.6 B2g   1  3d1+         2.102692     1.000000
    2.6 B2g   1  3d1+         0.763188     1.000000
    3.6 B2g   1  3d1+         0.277005     1.000000
    4.6 B2g   1  3d1+         0.110075     1.000000
    5.6 B2g   1  5g1+         0.844301     1.000000
    6.6 B2g   1  5g3+         0.844301     1.000000
    7.6 B2g   1  5g1+         0.374704     1.000000
    8.6 B2g   1  5g3+         0.374704     1.000000
    1.7 B3g   1  3d1-         2.102692     1.000000
    2.7 B3g   1  3d1-         0.763188     1.000000
    3.7 B3g   1  3d1-         0.277005     1.000000
    4.7 B3g   1  3d1-         0.110075     1.000000
    5.7 B3g   1  5g1-         0.844301     1.000000
    6.7 B3g   1  5g3-         0.844301     1.000000
    7.7 B3g   1  5g1-         0.374704     1.000000
    8.7 B3g   1  5g3-         0.374704     1.000000
    1.8 Au    1  4f2-         1.139446     1.000000
    2.8 Au    1  4f2-         0.434852     1.000000
    3.8 Au    1  4f2-         0.209794     1.000000

 NUCLEAR CHARGE:                    7
 NUMBER OF PRIMITIVE AOS:         140
 NUMBER OF SYMMETRY AOS:          115
 NUMBER OF CONTRACTIONS:           79   (  19Ag  +  11B3u +  11B2u +   8B1g +  11B1u +   8B2g +   8B3g +   3Au  )
 NUMBER OF CORE ORBITALS:           0   (   0Ag  +   0B3u +   0B2u +   0B1g +   0B1u +   0B2g +   0B3g +   0Au  )
 NUMBER OF VALENCE ORBITALS:        4   (   1Ag  +   1B3u +   1B2u +   0B1g +   1B1u +   0B2g +   0B3g +   0Au  )


 NUCLEAR REPULSION ENERGY    0.00000000

 EXTRA SYMMETRY OF AOS IN SYMMETRY 1:   1 1 1 1 1 2 3 2 3 2   3 2 3 4 5 6 4 5 6
 EXTRA SYMMETRY OF AOS IN SYMMETRY 2:   1 1 1 1 1 2 3 2 3 2   3
 EXTRA SYMMETRY OF AOS IN SYMMETRY 3:   1 1 1 1 1 2 3 2 3 2   3
 EXTRA SYMMETRY OF AOS IN SYMMETRY 4:   1 1 1 1 2 3 2 3
 EXTRA SYMMETRY OF AOS IN SYMMETRY 5:   1 1 1 1 1 2 3 2 3 2   3
 EXTRA SYMMETRY OF AOS IN SYMMETRY 6:   1 1 1 1 2 3 2 3
 EXTRA SYMMETRY OF AOS IN SYMMETRY 7:   1 1 1 1 2 3 2 3

 Eigenvalues of metric

         1 0.278E-02 0.171E-01 0.108E+00 0.108E+00 0.171E+00 0.357E+00 0.357E+00 0.357E+00
         2 0.243E-02 0.334E-01 0.146E+00 0.146E+00 0.207E+00 0.771E+00 0.771E+00 0.110E+01
         3 0.243E-02 0.334E-01 0.146E+00 0.146E+00 0.207E+00 0.771E+00 0.771E+00 0.110E+01
         4 0.108E+00 0.357E+00 0.357E+00 0.406E+00 0.119E+01 0.164E+01 0.164E+01 0.230E+01
         5 0.243E-02 0.334E-01 0.146E+00 0.146E+00 0.207E+00 0.771E+00 0.771E+00 0.110E+01
         6 0.108E+00 0.357E+00 0.357E+00 0.406E+00 0.119E+01 0.164E+01 0.164E+01 0.230E+01
         7 0.108E+00 0.357E+00 0.357E+00 0.406E+00 0.119E+01 0.164E+01 0.164E+01 0.230E+01
         8 0.146E+00 0.771E+00 0.208E+01


 Contracted 2-electron integrals neglected if value below      1.0D-12
 AO integral compression algorithm  1   Integral accuracy      1.0D-12

     6.554 MB (compressed) written to integral file ( 67.7%)


 NUMBER OF SORTED TWO-ELECTRON INTEGRALS:     665704.     BUFFER LENGTH:  32768
 NUMBER OF SEGMENTS:   1  SEGMENT LENGTH:     665704      RECORD LENGTH: 524288

 Memory used in sort:       1.22 MW

 SORT1 READ     1222209. AND WROTE      500866. INTEGRALS IN      2 RECORDS. CPU TIME:     0.04 SEC, REAL TIME:     0.06 SEC
 SORT2 READ      500866. AND WROTE      665704. INTEGRALS IN     25 RECORDS. CPU TIME:     0.07 SEC, REAL TIME:     0.11 SEC

 FILE SIZES:   FILE 1:    25.8 MBYTE,  FILE 4:     8.4 MBYTE,   TOTAL:     34.2 MBYTE

 OPERATOR DM      FOR CENTER  0  COORDINATES:    0.000000    0.000000    0.000000
 OPERATOR EKIN    FOR CENTER  0  COORDINATES:    0.000000    0.000000    0.000000
 OPERATOR POT     FOR CENTER  0  COORDINATES:    0.000000    0.000000    0.000000


 **********************************************************************************************************************************
 DATASETS  * FILE   NREC   LENGTH (MB)   RECORD NAMES
              1      20       22.76       500      610      700      900      950      970     1000      129      960     1100   
                                          VAR    BASINP    GEOM    SYMINP    ZMAT    AOBASIS   BASIS     P2S    ABASIS      S 
                                         1400     1410     1420     1200     1210     1080     1600     1650     1300     1700   
                                         EKIN       V       ECP      H0       H01     AOSYM     SMH    MOLCAS    ERIS     OPER   

 PROGRAMS   *        TOTAL       INT
 CPU TIMES  *         2.30      2.18
 REAL TIME  *        13.94 SEC
 DISK USED  *        34.49 MB      
 **********************************************************************************************************************************


 PROGRAM * RHF-SCF (OPEN SHELL)       Authors: W. Meyer, H.-J. Werner


 NUMBER OF ELECTRONS:       4+    3-    SPACE SYMMETRY=3    SPIN SYMMETRY: Doublet 
 CONVERGENCE THRESHOLDS:    1.00E-05 (Density)    1.00E-07 (Energy)
 MAX. NUMBER OF ITERATIONS:       60
 INTERPOLATION TYPE:            DIIS
 INTERPOLATION STEPS:              2 (START)      1 (STEP)
 LEVEL SHIFTS:                 -0.60 (CLOSED) -0.30 (OPEN) 

 Number of closed-shell orbitals:    3 (   1   1   0   0   1   0   0   0 )
 Number of open-shell orbitals:      1 (   0   0   1   0   0   0   0   0 )



   Atom=CL basis=ECP10MWB_GUESS    lmin=0  lmax=1

 Orbital guess generated from atomic densities. Full valence occupancy:    1   1   1   0   1   0   0   0


 Molecular orbital dump at record        2100.2

 ITERATION    DDIFF          GRAD             ENERGY        2-EL.EN.            DIPOLE MOMENTS         DIIS   ORB.
    1      0.000D+00      0.000D+00       -14.68779936     19.786308    0.00000    0.00000    0.00000    0    start
    2      0.000D+00      0.663D-02       -14.69093293     19.939857    0.00000    0.00000    0.00000    1    diag,B
    3      0.200D-01      0.170D-02       -14.69128479     19.980618    0.00000    0.00000    0.00000    2    diag,B
    4      0.104D-01      0.512D-03       -14.69132421     19.988947    0.00000    0.00000    0.00000    3    diag,B
    5      0.524D-02      0.924D-04       -14.69132555     19.989856    0.00000    0.00000    0.00000    4    diag,B
    6      0.114D-02      0.116D-04       -14.69132557     19.989815    0.00000    0.00000    0.00000    5    diag,B
    7      0.533D-04      0.303D-05       -14.69132557     19.989780    0.00000    0.00000    0.00000    6    fixocc
    8      0.314D-04      0.731D-06       -14.69132557     19.989772    0.00000    0.00000    0.00000    7    diag,B
    9      0.146D-04      0.131D-06       -14.69132557     19.989769    0.00000    0.00000    0.00000    8    diag,B
   10      0.259D-05      0.222D-07       -14.69132557     19.989768    0.00000    0.00000    0.00000    0    orth

 Final alpha occupancy:   1   1   1   0   1   0   0   0
 Final beta  occupancy:   1   1   0   0   1   0   0   0

 !RHF STATE 1.3 Energy                -14.691325569109
 Nuclear energy                         0.00000000
 One-electron energy                  -24.68620979
 Two-electron energy                    9.99488422
 Virial quotient                       -2.67226807
 !RHF STATE 1.3 Dipole moment           0.00000000     0.00000000     0.00000000
 Dipole moment /Debye                   0.00000000     0.00000000     0.00000000
 

 !RHF expec          <1.3|EKIN|1.3>     5.497699036432
 
 !RHF expec           <1.3|POT|1.3>    -4.697962286985

 ELECTRON ORBITALS
 =================


   Orb  Occ    Energy  Couls-En    Coefficients

                                   1 1s      1 1s      1 1s      1 1s      1 1s      1 3d0     1 3d2+    1 3d0     1 3d2+    1 3d0  
                                   1 3d2+    1 3d0     1 3d2+    1 5g0     1 5g4+    1 5g2+    1 5g0     1 5g4+    1 5g2+ 

   1.1   2    -1.0799   -5.0931  0.999973 -0.000060  0.000207 -0.000224  0.000085  0.000571  0.000989  0.000005  0.000008  0.001988
                                 0.003444  0.001114  0.001929  0.000000  0.000000  0.000000 -0.000012 -0.000023 -0.000017

                                   1 2px     1 2px     1 2px     1 2px     1 2px     1 4f1+    1 4f3+    1 4f1+    1 4f3+    1 4f1+ 
                                   1 4f3+ 

   1.2   2    -0.4913   -3.8165  1.046398  0.004049 -0.012281 -0.025849 -0.015100 -0.000629 -0.002437 -0.001069 -0.004140 -0.000579
                                -0.002241

                                   1 2py     1 2py     1 2py     1 2py     1 2py     1 4f1-    1 4f3-    1 4f1-    1 4f3-    1 4f1- 
                                   1 4f3- 

   1.3   +    -0.5715   -3.9307  0.822579 -0.015627  0.046817  0.101719  0.054116 -0.004278 -0.005522 -0.007167 -0.009252 -0.003083
                                -0.003980

                                   1 2pz     1 2pz     1 2pz     1 2pz     1 2pz     1 4f0     1 4f2+    1 4f0     1 4f2+    1 4f0  
                                   1 4f2+ 

   1.5   2    -0.4913   -3.8165  1.046398  0.004049 -0.012281 -0.025849 -0.015100 -0.001541 -0.001990 -0.002618 -0.003380 -0.001417
                                -0.001830

 HOMO      1.2    -0.491278 =     -13.3683eV
 LUMO      2.1     0.154362 =       4.2004eV
 LUMO-HOMO         0.645639 =      17.5687eV


 **********************************************************************************************************************************
 DATASETS  * FILE   NREC   LENGTH (MB)   RECORD NAMES
              1      20       22.76       500      610      700      900      950      970     1000      129      960     1100   
                                          VAR    BASINP    GEOM    SYMINP    ZMAT    AOBASIS   BASIS     P2S    ABASIS      S 
                                         1400     1410     1420     1200     1210     1080     1600     1650     1300     1700   
                                         EKIN       V       ECP      H0       H01     AOSYM     SMH    MOLCAS    ERIS     OPER   

              2       4        2.78       700     1000      520     2100   
                                         GEOM     BASIS   MCVARS     RHF  

 PROGRAMS   *        TOTAL        HF       INT
 CPU TIMES  *         2.42      0.13      2.18
 REAL TIME  *        14.23 SEC
 DISK USED  *        34.49 MB      
 **********************************************************************************************************************************
 SETTING SCF(I)         =       -14.69132557  AU                              
 SETTING _CC_NORM_MAX   =         2.00000000                                  


 PROGRAM * UHF-SCF       Authors: W. Meyer, H.-J. Werner


 NUMBER OF ELECTRONS:       4+    3-    SPACE SYMMETRY=3    SPIN SYMMETRY: Doublet 
 CONVERGENCE THRESHOLDS:    1.00E-05 (Density)    1.00E-07 (Energy)
 MAX. NUMBER OF ITERATIONS:        0
 INTERPOLATION TYPE:            DIIS
 INTERPOLATION STEPS:              2 (START)      1 (STEP)
 LEVEL SHIFTS:                  0.20 (ALPHA)   0.20 (BETA) 

 Number of closed-shell orbitals:    3 (   1   1   0   0   1   0   0   0 )
 Number of open-shell orbitals:      1 (   0   0   1   0   0   0   0   0 )


 Molecular orbitals read from record     2100.2  Type=RHF/CANONICAL (state 1.3)

 Molecular orbital dump at record        2200.2

 Initial alpha occupation   1   1   1   0   1   0   0   0
 Initial beta  occupation   1   1   0   0   1   0   0   0

 ITERATION    DDIFF          GRAD             ENERGY        2-EL.EN.            DIPOLE MOMENTS         DIIS
    1      0.000D+00      0.000D+00       -14.69132557     19.989768    0.00000    0.00000    0.00000    0
 
 Final alpha occupancy:   1   1   1   0   1   0   0   0
 Final beta  occupancy:   1   1   0   0   1   0   0   0

 !UHF STATE 1.3 Energy                -14.691325569109
 Nuclear energy                         0.00000000
 One-electron energy                  -24.68620979
 Two-electron energy                    9.99488422
 Virial quotient                       -2.67226807
 !UHF STATE 1.3 Dipole moment           0.00000000     0.00000000     0.00000000
 Dipole moment /Debye                   0.00000000     0.00000000     0.00000000
 

 !UHF expec          <1.3|EKIN|1.3>     5.497699036432
 
 !UHF expec           <1.3|POT|1.3>    -4.697962286985

 ELECTRON ORBITALS FOR POSITIVE SPIN
 ===================================


   Orb  Occ    Energy  Couls-En    Coefficients

                                   1 1s      1 1s      1 1s      1 1s      1 1s      1 3d0     1 3d2+    1 3d0     1 3d2+    1 3d0  
                                   1 3d2+    1 3d0     1 3d2+    1 5g0     1 5g4+    1 5g2+    1 5g0     1 5g4+    1 5g2+ 

   1.1   +    -1.0799   -5.0931  0.999973 -0.000060  0.000207 -0.000224  0.000085  0.000571  0.000989  0.000005  0.000008  0.001988
                                 0.003444  0.001114  0.001929  0.000000  0.000000  0.000000 -0.000012 -0.000023 -0.000017

                                   1 2px     1 2px     1 2px     1 2px     1 2px     1 4f1+    1 4f3+    1 4f1+    1 4f3+    1 4f1+ 
                                   1 4f3+ 

   1.2   +    -0.4913   -3.8165  1.046398  0.004049 -0.012281 -0.025849 -0.015100 -0.000629 -0.002437 -0.001069 -0.004140 -0.000579
                                -0.002241

                                   1 2py     1 2py     1 2py     1 2py     1 2py     1 4f1-    1 4f3-    1 4f1-    1 4f3-    1 4f1- 
                                   1 4f3- 

   1.3   +    -0.5715   -3.9307  0.822579 -0.015627  0.046817  0.101719  0.054116 -0.004278 -0.005522 -0.007167 -0.009252 -0.003083
                                -0.003980

                                   1 2pz     1 2pz     1 2pz     1 2pz     1 2pz     1 4f0     1 4f2+    1 4f0     1 4f2+    1 4f0  
                                   1 4f2+ 

   1.5   +    -0.4913   -3.8165  1.046398  0.004049 -0.012281 -0.025849 -0.015100 -0.001541 -0.001990 -0.002618 -0.003380 -0.001417
                                -0.001830

 ELECTRON ORBITALS FOR NEGATIVE SPIN
 ===================================


   Orb  Occ    Energy  Couls-En    Coefficients

                                   1 1s      1 1s      1 1s      1 1s      1 1s      1 3d0     1 3d2+    1 3d0     1 3d2+    1 3d0  
                                   1 3d2+    1 3d0     1 3d2+    1 5g0     1 5g4+    1 5g2+    1 5g0     1 5g4+    1 5g2+ 

   1.1   -    -1.0799   -5.0931  0.999973 -0.000060  0.000207 -0.000224  0.000085  0.000571  0.000989  0.000005  0.000008  0.001988
                                 0.003444  0.001114  0.001929  0.000000  0.000000  0.000000 -0.000012 -0.000023 -0.000017

                                   1 2px     1 2px     1 2px     1 2px     1 2px     1 4f1+    1 4f3+    1 4f1+    1 4f3+    1 4f1+ 
                                   1 4f3+ 

   1.2   -    -0.4913   -3.8165  1.046398  0.004049 -0.012281 -0.025849 -0.015100 -0.000629 -0.002437 -0.001069 -0.004140 -0.000579
                                -0.002241

                                   1 2pz     1 2pz     1 2pz     1 2pz     1 2pz     1 4f0     1 4f2+    1 4f0     1 4f2+    1 4f0  
                                   1 4f2+ 

   1.5   -    -0.4913   -3.8165  1.046398  0.004049 -0.012281 -0.025849 -0.015100 -0.001541 -0.001990 -0.002618 -0.003380 -0.001417
                                -0.001830

 HOMO      1.2    -0.491278 =     -13.3683eV
 LUMO     -1.3    -0.571456 =     -15.5501eV
 LUMO-HOMO        -0.080179 =      -2.1818eV

 EXPECTATION VALUE OF S**2:             0.75000000

 Occupation number threshold for canonical orbitals:  1.999000 (occupied),  0.001000 (virtual)

 Number of pseudo-canonical orbitals per symmetry:    1   1   0   0   1   0   0   0
 Number of active natural orbitals per symmetry:      0   0   1   0   0   0   0   0

 NATURAL CHARGE ORBITALS
 =======================


   Orb     Occ        Energy       Coefficients

                                   1 1s      1 1s      1 1s      1 1s      1 1s      1 3d0     1 3d2+    1 3d0     1 3d2+    1 3d0  
                                   1 3d2+    1 3d0     1 3d2+    1 5g0     1 5g4+    1 5g2+    1 5g0     1 5g4+    1 5g2+ 

   1.1  2.00000    -1.079937     0.999973 -0.000060  0.000207 -0.000224  0.000085  0.000571  0.000989  0.000005  0.000008  0.001988
                                 0.003444  0.001114  0.001929  0.000000  0.000000  0.000000 -0.000012 -0.000023 -0.000017

                                   1 2px     1 2px     1 2px     1 2px     1 2px     1 4f1+    1 4f3+    1 4f1+    1 4f3+    1 4f1+ 
                                   1 4f3+ 

   1.2  2.00000    -0.491278     1.046398  0.004049 -0.012281 -0.025849 -0.015100 -0.000629 -0.002437 -0.001069 -0.004140 -0.000579
                                -0.002241

                                   1 2py     1 2py     1 2py     1 2py     1 2py     1 4f1-    1 4f3-    1 4f1-    1 4f3-    1 4f1- 
                                   1 4f3- 

   1.3  1.00000    -0.298363     0.822579 -0.015627  0.046817  0.101719  0.054116 -0.004278 -0.005522 -0.007167 -0.009252 -0.003083
                                -0.003980

                                   1 2pz     1 2pz     1 2pz     1 2pz     1 2pz     1 4f0     1 4f2+    1 4f0     1 4f2+    1 4f0  
                                   1 4f2+ 

   1.5  2.00000    -0.491278     1.046398  0.004049 -0.012281 -0.025849 -0.015100 -0.001541 -0.001990 -0.002618 -0.003380 -0.001417
                                -0.001830

 Natural orbitals saved to record    2200.2 (Orbital set 3)

 Orbital spaces for UNO-CAS (Min. occupation: 0.020  Max. occupation: 1.980):

 Closed:        1   1   0   0   1   0   0   0
 Active:        0   0   1   0   0   0   0   0

 No convergence



 **********************************************************************************************************************************
 DATASETS  * FILE   NREC   LENGTH (MB)   RECORD NAMES
              1      20       22.76       500      610      700      900      950      970     1000      129      960     1100   
                                          VAR    BASINP    GEOM    SYMINP    ZMAT    AOBASIS   BASIS     P2S    ABASIS      S 
                                         1400     1410     1420     1200     1210     1080     1600     1650     1300     1700   
                                         EKIN       V       ECP      H0       H01     AOSYM     SMH    MOLCAS    ERIS     OPER   

              2       5        5.33       700     1000      520     2100     2200   
                                         GEOM     BASIS   MCVARS     RHF      UHF  

 PROGRAMS   *        TOTAL       UHF        HF       INT
 CPU TIMES  *         2.43      0.01      0.13      2.18
 REAL TIME  *        14.38 SEC
 DISK USED  *        34.49 MB      
 **********************************************************************************************************************************
 SETTING SCF(I)         =       -14.69132557  AU                              


 PROGRAM * MRCC (General Multireference Coupled Cluster)    Author: M. Kallay, 2000-2005

 ***  Initialisation ***

   0 Spin projections
 
 Molecular orbitals read from record     2200.2  Type=UHF/ALPHA (state 1.3)

 ?Warning: UHF not converged
 Molecular orbitals read from record     2200.2  Type=UHF/BETA (state 1.3)

 ?Warning: UHF not converged
 
 Frozen orbitals:              0 (  0  0  0  0  0  0  0  0)
 Active orbitals:             79 ( 19 11 11  8 11  8  8  3)
 Active electrons:             7
 Spin quantum number:          0.5

 Transformed integrals will be written to file mrcc_38133/fort.55

 Load integrals                2.4 sec
 Transform integrals           2.9 sec
 Storage for integrals:        3835052
 Remaining memory:           *********

 Core energy:               0.00000000
 
 MRCC Input:
     4     0     0     0     3     0     0     3     0     0     0     1     1     0     0     7     0     0   0.000     0   64000
  ex.lev,nsing,ntrip, rest,method,dens,conver,symm, diag, CS ,spatial, HF, ndoub,nacto,nactv, tol, maxex, sacc, freq,  dboc,   mem
  2  0  0  0  0  0  0  0  0  0  0  0  0  0  0  0  0  0  0  2  0  0  0  0  0  0  0  0  0  0  1  0  0  0  0  0  0  0  0  0  0  0  0  0  0  0  0  0  0  2  0  0  0  0  0  0  0  0  0  0  0  0  0  0  0  0  0  0  0  0  0  0  0  0  0  0  0  0  0
 MRCC Input end
 Variable memory released
 MRCC now being run, temporary output in /global/cscratch1/sd/aannabe/mrcc_38133/mrcc.out
 **********************************************************************
                          MRCC program system
 **********************************************************************

                              Written by
  Mihaly Kallay, Zoltan Rolik, Jozsef Csontos, Peter Nagy, Gyula Samu,
      David Mester, Jozsef Csoka, Bernat Szabo, Istvan Ladjanszki,
       Lorant Szegedy, Bence Ladoczki, Klara Petrov, Mate Farkas,
                    Pal D. Mezei, and Bence Hegely

        Department of Physical Chemistry and Materials Science
            Budapest University of Technology and Economics
                  Budapest P.O.Box 91, H-1521 Hungary

                              www.mrcc.hu

                       Release date: May 23, 2018

 ************************ 2018-10-05 11:03:29 *************************
 Executing goldstone...

 Generation of CC equations in terms of H and T...
 Generation of antisymmetrized Goldstone diagrams...
 Number of diagrams in T^1 equations:    15
 Number of diagrams in T^2 equations:    38
 Number of diagrams in T^3 equations:    49
 Number of diagrams in T^4 equations:     5
 Translation of diagrams to factorized equations...
 Optimizing intermediate calculation...
 Number of floating-point operations per iteration step:   9.6462E+10
 Probable CPU time per iteration step (hours):      0.96
 Required memory (Mbytes):    4263.8
 Number of intermediates:                                  79
 Number of intermediates to be stored:                     32
 Length of intermediate file (Mbytes):      82.9

 ************************ 2018-10-05 11:03:30 *************************
 Executing xmrcc...

 **********************************************************************
 CC(3)(4) calculation


 Allocation of4263.8 Mbytes of memory...
 Number of spinorbitals:                   158
 Number of alpha electrons:                        4
 Number of beta electrons:                         3
 Spin multiplicity:                     2
 z-component of spin:  0.5
 Spatial symmetry:                      3
 Convergence criterion:  1.0E-07
 Construction of occupation graphs...
 Number of                     0 -fold excitations:                      1
 Number of                     1 -fold excitations:                     86
 Number of                     2 -fold excitations:                  12116
 Number of                     3 -fold excitations:                 837497
 Total number of configurations:                 849700
 Calculation of coupling coefficients...
 Length of intermediate file (Mbytes):      63.1

 ======================================================================

 Spin case  1   Alpha:  1   Beta:  3
 Number of excitations:                2634577
 Spin case  2   Alpha:  2   Beta:  2
 Number of excitations:               17795529
 Spin case  3   Alpha:  3   Beta:  1
 Number of excitations:                7694349
 Spin case  4   Alpha:  4   Beta:  0
 Number of excitations:                 152628
 Number of                     4 -fold excitations:               28277083

 Memory requirements /Mbyte/:
               Minimal        Optimal
 Real*8:        124.8425       297.2647
 Integer:        38.9714
 Total:         163.8139       336.2361


 ************************ 2018-10-05 11:03:33 *************************
 Executing mrcc...

 **********************************************************************
 CCSDT(Q) calculation


 OpenMP parallel version is running.
 Number of CPUs:   1
 Allocation of  297.3 Mbytes of memory...
 Number of spinorbitals: 158
 Number of alpha electrons:  4
 Number of beta  electrons:  3
 Spin multiplicity: 2
 z-component of spin:  0.5
 Spatial symmetry: 3
 Convergence criterion:  1.0E-07
 Construction of occupation graphs...
 Number of 0-fold excitations: 1
 Number of 1-fold excitations: 86
 Number of 2-fold excitations: 12116
 Number of 3-fold excitations: 837497
 Total number of determinants: 849700
 Calculation of coupling coefficients...
 Initial cluster amplitudes are generated.
 Length of intermediate file (Mbytes):      63.1
 Reading integral list from unit 55...
 Sorting integrals...
 Sorting integrals...
 Sorting integrals...
 Sorting integrals...
 Energy of reference determinant [au]:     -14.691325569109
 Calculation of MP denominators...

 Starting CC iteration...
 ======================================================================
 Norm of residual vector:     0.86076283
 CPU time [min]:     0.367                   Wall time [min]:     0.374

 Iteration  1  CC energy:   -14.88743967  Energy decrease:   0.19611410
 ======================================================================
 Norm of residual vector:     0.23685704
 CPU time [min]:     0.597                   Wall time [min]:     0.620

 Iteration  2  CC energy:   -14.90241375  Energy decrease:   0.01497408
 ======================================================================
 Norm of residual vector:     0.06046767
 CPU time [min]:     0.837                   Wall time [min]:     0.869

 Iteration  3  CC energy:   -14.91537586  Energy decrease:   0.01296211
 ======================================================================
 Norm of residual vector:     0.01405732
 CPU time [min]:     1.078                   Wall time [min]:     1.122

 Iteration  4  CC energy:   -14.91587273  Energy decrease:   0.00049687
 ======================================================================
 Norm of residual vector:     0.00439935
 CPU time [min]:     1.320                   Wall time [min]:     1.396

 Iteration  5  CC energy:   -14.91589123  Energy decrease:   0.00001850
 ======================================================================
 Norm of residual vector:     0.00144578
 CPU time [min]:     1.562                   Wall time [min]:     1.668

 Iteration  6  CC energy:   -14.91590816  Energy decrease:   0.00001693
 ======================================================================
 Norm of residual vector:     0.00048065
 CPU time [min]:     1.772                   Wall time [min]:     1.891

 Iteration  7  CC energy:   -14.91590467  Energy decrease:   0.00000349
 ======================================================================
 Norm of residual vector:     0.00018664
 CPU time [min]:     1.970                   Wall time [min]:     2.101

 Iteration  8  CC energy:   -14.91590175  Energy decrease:   0.00000292
 ======================================================================
 Norm of residual vector:     0.00006780
 CPU time [min]:     2.171                   Wall time [min]:     2.314

 Iteration  9  CC energy:   -14.91590457  Energy decrease:   0.00000282
 ======================================================================
 Norm of residual vector:     0.00002189
 CPU time [min]:     2.375                   Wall time [min]:     2.526

 Iteration 10  CC energy:   -14.91590420  Energy decrease:   0.00000037
 ======================================================================
 Norm of residual vector:     0.00000619
 CPU time [min]:     2.588                   Wall time [min]:     2.749

 Iteration 11  CC energy:   -14.91590396  Energy decrease:   0.00000024
 ======================================================================
 Norm of residual vector:     0.00000187
 CPU time [min]:     2.802                   Wall time [min]:     2.981

 Iteration 12  CC energy:   -14.91590403  Energy decrease:   0.00000007
 ======================================================================
 Norm of residual vector:     0.00000054
 CPU time [min]:     3.014                   Wall time [min]:     3.199

 Iteration 13  CC energy:   -14.91590403  Energy decrease:   4.1128E-09
 ======================================================================
 Norm of residual vector:     0.00000015
 CPU time [min]:     3.226                   Wall time [min]:     3.424

 Iteration 14  CC energy:   -14.91590403  Energy decrease:   0.00000001
 ======================================================================
 Norm of residual vector:     0.00000004
 CPU time [min]:     3.428                   Wall time [min]:     3.640

 Iteration 15  CC energy:   -14.91590403  Energy decrease:   5.7227E-10
 ======================================================================

 Iteration has converged in 15 steps.

 Final results:
 Total CCSDT energy [au]:            -14.915904028887
 Total MP2 energy [au]:              -14.887439673667

 Perturbative corrections are calculated...
 ======================================================================
 Spin case  1   Alpha:  1   Beta:  3
 Number of excitations:        2634577
 CPU time [min]:    12.260                   Wall time [min]:    12.475
 ======================================================================
 Spin case  2   Alpha:  2   Beta:  2
 Number of excitations:        17795529
 CPU time [min]:    33.001                   Wall time [min]:    33.217
 ======================================================================
 Spin case  3   Alpha:  3   Beta:  1
 Number of excitations:        7694349
 CPU time [min]:    44.861                   Wall time [min]:    45.086
 ======================================================================
 Spin case  4   Alpha:  4   Beta:  0
 Number of excitations:        152628
 CPU time [min]:    45.814                   Wall time [min]:    46.039
 ======================================================================
 Number of 4-fold excitations: 28277083
 CPU time [min]:    45.814                   Wall time [min]:    46.040

 Total CCSDT[Q] energy [au]:         -14.915886143909
 Total CCSDT(Q) energy [au]:         -14.916188822016

 ************************ 2018-10-05 11:49:36 *************************
                      Normal termination of mrcc.
 **********************************************************************
 !CCSDT STATE 1.3 Energy              -14.915904028887
 !MP2 STATE 1.3 Energy                -14.887439673667
 !CCSDT[Q] STATE 1.3 Energy           -14.915886143909
 !CCSDT(Q) STATE 1.3 Energy           -14.916188822016
 
 CPU-time for MRCC:           2748.8 sec
 Elapsed-time for MRCC:       2768.4 sec

 Variable memory set to 8000000000 words,  buffer space   230000 words



 **********************************************************************************************************************************
 DATASETS  * FILE   NREC   LENGTH (MB)   RECORD NAMES
              1      20       22.76       500      610      700      900      950      970     1000      129      960     1100   
                                          VAR    BASINP    GEOM    SYMINP    ZMAT    AOBASIS   BASIS     P2S    ABASIS      S 
                                         1400     1410     1420     1200     1210     1080     1600     1650     1300     1700   
                                         EKIN       V       ECP      H0       H01     AOSYM     SMH    MOLCAS    ERIS     OPER   

              2       5        5.33       700     1000      520     2100     2200   
                                         GEOM     BASIS   MCVARS     RHF      UHF  

 PROGRAMS   *        TOTAL      MRCC       UHF        HF       INT
 CPU TIMES  *      2760.16   2757.73      0.01      0.13      2.18
 REAL TIME  *      2835.49 SEC
 DISK USED  *        34.49 MB      
 **********************************************************************************************************************************
 SETTING POSTHF(I)      =       -14.91618882  AU                              
                                                                                                                                                                                                                                                                

        SCF            POSTHF       EKIN          POT
    -14.69132557   -14.91618882   5.49769904   -4.69796229
                                                  

 CCSDT(Q)/USERDEF energy=    -14.916188822016

        CCSDT(Q)        UHF-SCF         HF-SCF  
    -14.91618882    -14.69132557    -14.69132557
 **********************************************************************************************************************************
 Variable memory released
