
 Primary working directories    : /global/cscratch1/sd/aannabe
 Secondary working directories  : /global/cscratch1/sd/aannabe
 Wavefunction directory         : /global/homes/a/aannabe/wfu/
 Main file repository           : /global/cscratch1/sd/aannabe/

 SHA1      : 2873118e99aab1bc19f5b6fc1784693c06d15c95
 NAME      : 2015.1.8
 ARCHNAME  : linux/x86_64
 FC        : /opt/cray/pe/craype/2.5.5/bin/ftn
 BLASLIB   : -Wl,-_start-group /opt/intel/compilers_and_libraries_2016.3.210/linux/mkl/lib/intel64/libmkl_intel_ilp64.a /opt/intel/compilers_and_libraries_2016.3.210/linux/mkl/lib/intel64/libmkl_intel_thread.a /opt/intel/compilers_and_libraries_2016.3.210/linux/mkl/lib/intel64/libmkl_core.a -Wl,-_end-group
 id        : lbl

 Nodes     nprocs
 nid00458     1

 Using customized tuning parameters: mindgm=8; mindgv=16; mindgc=4; mindgr=1; noblas=0; minvec=7
 default implementation of scratch files=df  

 ***,Si
 memory,8,g
 gthresh,twoint=1.e-12
 
 gprint,basis,orbitals
 gexpec,ekin,pot
 
 angstrom
 geometry={
 1                                                                               ! Number of atoms
 Si 0.0 0.0 0.0
 }
 
 basis={
 Including file /global/homes/a/aannabe/docs/accurate/BFD_Kh/pps/Si.pp
 Including file /global/homes/a/aannabe/docs/accurate/BFD_Kh/basis/aug-cc-pVnZ/Si_tz.basis
 }
 
 {rhf
  start,atden
  wf,4,6,2
  occ,1,1,0,0,1,0,0,0
  open,1.2,1.5
  save,4202.2
 }
 {multi
  start,4202.2
  occ,1,1,1,0,1,0,0
  closed,1,0,0,0,0,0,0,0
  wf,4,4,2;state,1
  wf,4,6,2;state,1
  wf,4,7,2;state,1
  natorb,ci,print
  orbital,5202.2
 }
 {rhf,nitord=1,maxit=0
  start,5202.2
  wf,4,6,2
  occ,1,1,0,0,1,0,0,0
  open,1.2,1.5
 }
 scf(i)=energy
 
 _CC_NORM_MAX=2.0
  !NOTE: Perturbative MRCC works only with UHF reference. So, here we will trick MRCC by doing zero UHF iteration right after ROHF.
 
 {uhf
 maxit,0
 }
 scf(i)=energy
 
 {mrcc,method=CCSDT(Q)
 orbital,ignore_error=1                                                          !Ignore the fact that UHF WF is not converged
 maxit,100
 core
 }
 posthf(i)=energy
 
 table,scf,posthf,ekin,pot
 save,3.csv,new
 
 

 Variables initialized (889), CPU time= 0.01 sec
 Commands  initialized (702), CPU time= 0.01 sec, 572 directives.
 Default parameters read. Elapsed time= 0.15 sec

 Checking input...
 Passed
1


                                         ***  PROGRAM SYSTEM MOLPRO  ***
                                       Copyright, TTI GmbH Stuttgart, 2015
                                    Version 2015.1 linked Sep  7 2016 23:09:38


 **********************************************************************************************************************************
 LABEL *   Si                                                                            
  64 bit serial version                                                                  DATE: 05-Nov-18          TIME: 13:02:28  
 **********************************************************************************************************************************

 SHA1:             2873118e99aab1bc19f5b6fc1784693c06d15c95
 **********************************************************************************************************************************

 THRESHOLDS:

 ZERO    =  1.00D-12  ONEINT  =  1.00D-12  TWOINT  =  1.00D-12  PREFAC  =  1.00D-14  LOCALI  =  1.00D-09  EORDER  =  1.00D-04
 ENERGY  =  0.00D+00  ETEST   =  0.00D+00  EDENS   =  0.00D+00  THRDEDEF=  1.00D-06  GRADIENT=  1.00D-02  STEP    =  1.00D-03
 ORBITAL =  1.00D-05  CIVEC   =  1.00D-05  COEFF   =  1.00D-04  PRINTCI =  5.00D-02  PUNCHCI =  9.90D+01  OPTGRAD =  3.00D-04
 OPTENERG=  1.00D-06  OPTSTEP =  3.00D-04  THRGRAD =  1.00D-10  COMPRESS=  1.00D-11  VARMIN  =  1.00D-07  VARMAX  =  1.00D-03
 THRDOUB =  0.00D+00  THRDIV  =  1.00D-05  THRRED  =  1.00D-07  THRPSP  =  1.00D+00  THRDC   =  1.00D-10  THRCS   =  1.00D-10
 THRNRM  =  1.00D-08  THREQ   =  0.00D+00  THRDE   =  1.00D+00  THRREF  =  1.00D-05  SPARFAC =  1.00D+00  THRDLP  =  1.00D-07
 THRDIA  =  1.00D-10  THRDLS  =  1.00D-07  THRGPS  =  0.00D+00  THRKEX  =  0.00D+00  THRDIS  =  2.00D-01  THRVAR  =  1.00D-10
 THRLOC  =  1.00D-06  THRGAP  =  1.00D-06  THRLOCT = -1.00D+00  THRGAPT = -1.00D+00  THRORB  =  1.00D-06  THRMLTP =  0.00D+00
 THRCPQCI=  1.00D-10  KEXTA   =  0.00D+00  THRCOARS=  0.00D+00  SYMTOL  =  1.00D-06  GRADTOL =  1.00D-06  THROVL  =  1.00D-08
 THRORTH =  1.00D-08  GRID    =  1.00D-06  GRIDMAX =  1.00D-03  DTMAX   =  0.00D+00  THROCCDE=  1.00D-01  THROCCDE=  1.00D-01



 ZUNIT=ANG
 

Geometry recognized as XYZ


 Variable memory set to 8000000000 words,  buffer space   230000 words

 SETTING BASIS          =    USERDEF


 Recomputing integrals since basis changed


 Using spherical harmonics



 PROGRAM * SEWARD (Integral evaluation for generally contracted gaussian basis sets)     Author: Roland Lindh, 1990

 Geometry written to block  1 of record 700

 Orientation using atomic masses  
 Molecule type: Atom
 Symmetry elements: X,Y,Z
 Rotational constants:       0.0000000      0.0000000      0.0000000 GHz  (calculated with average atomic masses)

 Point group  D2h 



 ATOMIC COORDINATES

 NR  ATOM    CHARGE       X              Y              Z

   1  SI      4.00    0.000000000    0.000000000    0.000000000


          SI  CORE POTENTIAL

          d POTENTIAL

 POWERS             1              3              2
 EXPONENTIALS   1.807211       9.996331       2.500432    
 COEFFICIENTS   4.000000       7.228842      -13.06726    

          s - d POTENTIAL

 POWERS             2
 EXPONENTIALS   2.266864    
 COEFFICIENTS   21.20532    

          p - d POTENTIAL

 POWERS             2
 EXPONENTIALS   2.116597    
 COEFFICIENTS   15.43694    


 BASIS DATA

   Nr Sym  Nuc  Type         Exponents   Contraction coefficients

    1.1 Ag    1  1s           0.059887     0.167492
                              0.130108     0.532550
                              0.282668     0.464290
                              0.614115    -0.002322
                              1.334205    -0.268234
                              2.898645     0.031921
                              6.297493    -0.000106
                             13.681707    -0.000145
                             29.724387     0.000067
    2.1 Ag    1  1s           0.036045     1.000000
    3.1 Ag    1  1s           0.090113     1.000000
    4.1 Ag    1  1s           0.507467     1.000000
    5.1 Ag    1  3d0          0.068158     1.000000
    6.1 Ag    1  3d2+         0.068158     1.000000
    7.1 Ag    1  3d0          0.170395     1.000000
    8.1 Ag    1  3d2+         0.170395     1.000000
    9.1 Ag    1  3d0          0.539756     1.000000
   10.1 Ag    1  3d2+         0.539756     1.000000
    1.2 B3u   1  2px          0.036525     0.078761
                              0.076137     0.308331
                              0.158712     0.417773
                              0.330843     0.281676
                              0.689658     0.069876
                              1.437625    -0.056306
                              2.996797     0.000744
                              6.246966    -0.000259
                             13.022097    -0.000022
    2.2 B3u   1  2px          0.022459     1.000000
    3.2 B3u   1  2px          0.056148     1.000000
    4.2 B3u   1  2px          0.146758     1.000000
    5.2 B3u   1  4f1+         0.141200     1.000000
    6.2 B3u   1  4f3+         0.141200     1.000000
    7.2 B3u   1  4f1+         0.352999     1.000000
    8.2 B3u   1  4f3+         0.352999     1.000000
    1.3 B2u   1  2py          0.036525     0.078761
                              0.076137     0.308331
                              0.158712     0.417773
                              0.330843     0.281676
                              0.689658     0.069876
                              1.437625    -0.056306
                              2.996797     0.000744
                              6.246966    -0.000259
                             13.022097    -0.000022
    2.3 B2u   1  2py          0.022459     1.000000
    3.3 B2u   1  2py          0.056148     1.000000
    4.3 B2u   1  2py          0.146758     1.000000
    5.3 B2u   1  4f1-         0.141200     1.000000
    6.3 B2u   1  4f3-         0.141200     1.000000
    7.3 B2u   1  4f1-         0.352999     1.000000
    8.3 B2u   1  4f3-         0.352999     1.000000
    1.4 B1g   1  3d2-         0.068158     1.000000
    2.4 B1g   1  3d2-         0.170395     1.000000
    3.4 B1g   1  3d2-         0.539756     1.000000
    1.5 B1u   1  2pz          0.036525     0.078761
                              0.076137     0.308331
                              0.158712     0.417773
                              0.330843     0.281676
                              0.689658     0.069876
                              1.437625    -0.056306
                              2.996797     0.000744
                              6.246966    -0.000259
                             13.022097    -0.000022
    2.5 B1u   1  2pz          0.022459     1.000000
    3.5 B1u   1  2pz          0.056148     1.000000
    4.5 B1u   1  2pz          0.146758     1.000000
    5.5 B1u   1  4f0          0.141200     1.000000
    6.5 B1u   1  4f2+         0.141200     1.000000
    7.5 B1u   1  4f0          0.352999     1.000000
    8.5 B1u   1  4f2+         0.352999     1.000000
    1.6 B2g   1  3d1+         0.068158     1.000000
    2.6 B2g   1  3d1+         0.170395     1.000000
    3.6 B2g   1  3d1+         0.539756     1.000000
    1.7 B3g   1  3d1-         0.068158     1.000000
    2.7 B3g   1  3d1-         0.170395     1.000000
    3.7 B3g   1  3d1-         0.539756     1.000000
    1.8 Au    1  4f2-         0.141200     1.000000
    2.8 Au    1  4f2-         0.352999     1.000000

 NUCLEAR CHARGE:                    4
 NUMBER OF PRIMITIVE AOS:          86
 NUMBER OF SYMMETRY AOS:           77
 NUMBER OF CONTRACTIONS:           45   (  10Ag  +   8B3u +   8B2u +   3B1g +   8B1u +   3B2g +   3B3g +   2Au  )
 NUMBER OF CORE ORBITALS:           0   (   0Ag  +   0B3u +   0B2u +   0B1g +   0B1u +   0B2g +   0B3g +   0Au  )
 NUMBER OF VALENCE ORBITALS:        4   (   1Ag  +   1B3u +   1B2u +   0B1g +   1B1u +   0B2g +   0B3g +   0Au  )


 NUCLEAR REPULSION ENERGY    0.00000000

 EXTRA SYMMETRY OF AOS IN SYMMETRY 1:   1 1 1 1 2 3 2 3 2 3
 EXTRA SYMMETRY OF AOS IN SYMMETRY 2:   1 1 1 1 2 3 2 3
 EXTRA SYMMETRY OF AOS IN SYMMETRY 3:   1 1 1 1 2 3 2 3
 EXTRA SYMMETRY OF AOS IN SYMMETRY 5:   1 1 1 1 2 3 2 3

 Eigenvalues of metric

         1 0.163E-01 0.161E+00 0.184E+00 0.184E+00 0.677E+00 0.805E+00 0.805E+00 0.201E+01
         2 0.115E-01 0.100E+00 0.367E+00 0.367E+00 0.775E+00 0.163E+01 0.163E+01 0.311E+01
         3 0.115E-01 0.100E+00 0.367E+00 0.367E+00 0.775E+00 0.163E+01 0.163E+01 0.311E+01
         4 0.184E+00 0.805E+00 0.201E+01
         5 0.115E-01 0.100E+00 0.367E+00 0.367E+00 0.775E+00 0.163E+01 0.163E+01 0.311E+01
         6 0.184E+00 0.805E+00 0.201E+01
         7 0.184E+00 0.805E+00 0.201E+01
         8 0.367E+00 0.163E+01


 Contracted 2-electron integrals neglected if value below      1.0D-12
 AO integral compression algorithm  1   Integral accuracy      1.0D-12

     1.049 MB (compressed) written to integral file ( 90.3%)


 NUMBER OF SORTED TWO-ELECTRON INTEGRALS:      75808.     BUFFER LENGTH:  32768
 NUMBER OF SEGMENTS:   1  SEGMENT LENGTH:      75808      RECORD LENGTH: 524288

 Memory used in sort:       0.63 MW

 SORT1 READ      155797. AND WROTE       61548. INTEGRALS IN      1 RECORDS. CPU TIME:     0.00 SEC, REAL TIME:     0.01 SEC
 SORT2 READ       61548. AND WROTE       75808. INTEGRALS IN      4 RECORDS. CPU TIME:     0.02 SEC, REAL TIME:     0.03 SEC

 FILE SIZES:   FILE 1:    20.2 MBYTE,  FILE 4:     4.2 MBYTE,   TOTAL:     24.4 MBYTE

 OPERATOR DM      FOR CENTER  0  COORDINATES:    0.000000    0.000000    0.000000
 OPERATOR EKIN    FOR CENTER  0  COORDINATES:    0.000000    0.000000    0.000000
 OPERATOR POT     FOR CENTER  0  COORDINATES:    0.000000    0.000000    0.000000


 **********************************************************************************************************************************
 DATASETS  * FILE   NREC   LENGTH (MB)   RECORD NAMES
              1      20       19.59       500      610      700      900      950      970     1000      129      960     1100   
                                          VAR    BASINP    GEOM    SYMINP    ZMAT    AOBASIS   BASIS     P2S    ABASIS      S 
                                         1400     1410     1420     1200     1210     1080     1600     1650     1300     1700   
                                         EKIN       V       ECP      H0       H01     AOSYM     SMH    MOLCAS    ERIS     OPER   

 PROGRAMS   *        TOTAL       INT
 CPU TIMES  *         2.26      2.09
 REAL TIME  *        16.25 SEC
 DISK USED  *        24.67 MB      
 **********************************************************************************************************************************


 PROGRAM * RHF-SCF (OPEN SHELL)       Authors: W. Meyer, H.-J. Werner


 NUMBER OF ELECTRONS:       3+    1-    SPACE SYMMETRY=6    SPIN SYMMETRY: Triplet 
 CONVERGENCE THRESHOLDS:    1.00E-05 (Density)    1.00E-07 (Energy)
 MAX. NUMBER OF ITERATIONS:       60
 INTERPOLATION TYPE:            DIIS
 INTERPOLATION STEPS:              2 (START)      1 (STEP)
 LEVEL SHIFTS:                 -0.60 (CLOSED) -0.30 (OPEN) 


 Singly occupied orbitals:      1.2       1.5

   Atom=SI basis=ECP10MWB_GUESS    lmin=0  lmax=1

 Orbital guess generated from atomic densities. Full valence occupancy:    1   1   1   0   1   0   0   0


 Molecular orbital dump at record        4202.2

 ITERATION    DDIFF          GRAD             ENERGY        2-EL.EN.            DIPOLE MOMENTS         DIIS   ORB.
    1      0.000D+00      0.000D+00        -3.66689098      3.786091    0.00000    0.00000    0.00000    0    start
    2      0.000D+00      0.809D-02        -3.67493977      3.896088    0.00000    0.00000    0.00000    1    diag,B
    3      0.182D-01      0.361D-02        -3.67798772      3.972557    0.00000    0.00000    0.00000    2    diag,B
    4      0.103D-01      0.155D-02        -3.67862968      4.001288    0.00000    0.00000    0.00000    3    diag,B
    5      0.491D-02      0.491D-03        -3.67867203      4.004655    0.00000    0.00000    0.00000    4    diag,B
    6      0.263D-02      0.823D-04        -3.67867286      4.004982    0.00000    0.00000    0.00000    5    diag,B
    7      0.486D-03      0.257D-04        -3.67867291      4.004682    0.00000    0.00000    0.00000    6    fixocc
    8      0.775D-04      0.660D-05        -3.67867292      4.004729    0.00000    0.00000    0.00000    7    diag,B
    9      0.377D-04      0.107D-05        -3.67867292      4.004731    0.00000    0.00000    0.00000    8    diag,B
   10      0.576D-05      0.308D-06        -3.67867292      4.004728    0.00000    0.00000    0.00000    0    orth

 Final alpha occupancy:   1   1   0   0   1   0   0   0
 Final beta  occupancy:   1   0   0   0   0   0   0   0

 !RHF STATE 1.6 Energy                 -3.678672919998
 Nuclear energy                         0.00000000
 One-electron energy                   -5.68103715
 Two-electron energy                    2.00236423
 Virial quotient                       -2.83262903
 !RHF STATE 1.6 Dipole moment           0.00000000     0.00000000     0.00000000
 Dipole moment /Debye                   0.00000000     0.00000000     0.00000000
 

 !RHF expec          <1.6|EKIN|1.6>     1.298677969948
 
 !RHF expec           <1.6|POT|1.6>    -1.930259879894

 ELECTRON ORBITALS
 =================


   Orb  Occ    Energy  Couls-En    Coefficients

                                   1 1s      1 1s      1 1s      1 1s      1 3d0     1 3d2+    1 3d0     1 3d2+    1 3d0     1 3d2+ 


   1.1   2    -0.5411   -2.1419  1.000346  0.000364 -0.000751  0.000106  0.002852  0.004941  0.001558  0.002698 -0.000135 -0.000235

                                   1 2px     1 2px     1 2px     1 2px     1 4f1+    1 4f3+    1 4f1+    1 4f3+ 

   1.2   +    -0.2970   -1.5368  0.999722  0.000462 -0.000306  0.000312  0.000015  0.000058 -0.000033 -0.000127

                                   1 2pz     1 2pz     1 2pz     1 2pz     1 4f0     1 4f2+    1 4f0     1 4f2+ 

   1.5   +    -0.2970   -1.5368  0.999722  0.000462 -0.000306  0.000312  0.000037  0.000047 -0.000080 -0.000104

 HOMO      1.2    -0.297011 =      -8.0821eV
 LUMO      1.3    -0.016973 =      -0.4619eV
 LUMO-HOMO         0.280038 =       7.6202eV


 **********************************************************************************************************************************
 DATASETS  * FILE   NREC   LENGTH (MB)   RECORD NAMES
              1      20       19.59       500      610      700      900      950      970     1000      129      960     1100   
                                          VAR    BASINP    GEOM    SYMINP    ZMAT    AOBASIS   BASIS     P2S    ABASIS      S 
                                         1400     1410     1420     1200     1210     1080     1600     1650     1300     1700   
                                         EKIN       V       ECP      H0       H01     AOSYM     SMH    MOLCAS    ERIS     OPER   

              2       4        2.76       700     1000      520     4202   
                                         GEOM     BASIS   MCVARS     RHF  

 PROGRAMS   *        TOTAL       RHF       INT
 CPU TIMES  *         2.30      0.04      2.09
 REAL TIME  *        16.43 SEC
 DISK USED  *        24.67 MB      
 **********************************************************************************************************************************


 PROGRAM * MULTI (Direct Multiconfiguration SCF)       Authors: P.J. Knowles, H.-J. Werner (1984)     S.T. Elbert (1988)


 Number of closed-shell orbitals:   1 (   1   0   0   0   0   0   0   0 )
 Number of active  orbitals:        3 (   0   1   1   0   1   0   0   0 )
 Number of external orbitals:      41 (   9   7   7   3   7   3   3   2 )

 State symmetry 1

 Number of electrons:     2    Spin symmetry=Triplet   Space symmetry=4
 Number of states:        1
 Number of CSFs:          1   (1 determinants, 3 intermediate states)

 State symmetry 2

 Number of electrons:     2    Spin symmetry=Triplet   Space symmetry=6
 Number of states:        1
 Number of CSFs:          1   (1 determinants, 3 intermediate states)

 State symmetry 3

 Number of electrons:     2    Spin symmetry=Triplet   Space symmetry=7
 Number of states:        1
 Number of CSFs:          1   (1 determinants, 3 intermediate states)

 Molecular orbitals read from record     4202.2  Type=RHF/CANONICAL (state 1.6)
 *** IN SYMMETRY 1 ORBITAL  1 SYMMETRY CONTAMINATION OF 0.122D-01 HAS BEEN REMOVED

 EXTRA SYMMETRY OF MOS IN SYMMETRY 1:   1 1 2 3 2 3 1 3 2 1
 *** IN SYMMETRY 2 ORBITAL  1 SYMMETRY CONTAMINATION OF 0.232D-03 HAS BEEN REMOVED
 EXTRA SYMMETRY OF MOS IN SYMMETRY 2:   1 1 1 3 2 1 3 2
 *** IN SYMMETRY 3 ORBITAL  1 SYMMETRY CONTAMINATION OF 0.479D-02 HAS BEEN REMOVED
 EXTRA SYMMETRY OF MOS IN SYMMETRY 3:   1 1 1 3 2 1 3 2
 *** IN SYMMETRY 5 ORBITAL  1 SYMMETRY CONTAMINATION OF 0.268D-03 HAS BEEN REMOVED
 EXTRA SYMMETRY OF MOS IN SYMMETRY 5:   1 1 1 3 2 1 3 2

 Wavefunction dump at record             5202.2

 Convergence thresholds  0.10E-01 (gradient)  0.10E-05 (energy)  0.10E-02 (step length)

 Weight factors for state symmetry  1:    0.33333
 Weight factors for state symmetry  2:    0.33333
 Weight factors for state symmetry  3:    0.33333

 Number of orbital rotations:       30   (     0 Core/Active      9 Core/Virtual   0 Active/Active     21 Active/Virtual)
 Total number of variables:         33


 ITER. MIC  NCI  NEG     ENERGY(VAR)     ENERGY(PROJ)   ENERGY CHANGE     GRAD(0)  GRAD(ORB)   GRAD(CI)     STEP       TIME

   1   20   12    0      -3.66109597      -3.67860917   -0.01751320    0.05635485 0.00000000 0.00000000  0.33D+00      0.02
   2   15   12    0      -3.67859051      -3.67859993   -0.00000942    0.00293315 0.00000000 0.00000000  0.53D-02      0.02
   3   13   12    0      -3.67859994      -3.67859994   -0.00000000    0.00000324 0.00000000 0.00000000  0.45D-05      0.03

 ** WVFN ****  CONVERGENCE REACHED, FINAL GRADIENT:  0.36D-11



 Results for state 1.4
 =====================

 !MCSCF STATE 1.4 Energy               -3.678599935719
 Nuclear energy                         0.00000000
 Kinetic energy                         1.29866559
 One electron energy                   -5.68114210
 Two electron energy                    2.00254217
 Virial ratio                           3.83259984

 !MCSCF STATE 1.4 Dipole moment         0.00000000     0.00000000     0.00000000
 Dipole moment /Debye                   0.00000000     0.00000000     0.00000000



 Results for state 1.6
 =====================

 !MCSCF STATE 1.6 Energy               -3.678599935719
 Nuclear energy                         0.00000000
 Kinetic energy                         1.29866559
 One electron energy                   -5.68114210
 Two electron energy                    2.00254217
 Virial ratio                           3.83259984

 !MCSCF STATE 1.6 Dipole moment         0.00000000     0.00000000     0.00000000
 Dipole moment /Debye                   0.00000000     0.00000000     0.00000000



 Results for state 1.7
 =====================

 !MCSCF STATE 1.7 Energy               -3.678599935719
 Nuclear energy                         0.00000000
 Kinetic energy                         1.29866559
 One electron energy                   -5.68114210
 Two electron energy                    2.00254217
 Virial ratio                           3.83259984

 !MCSCF STATE 1.7 Dipole moment         0.00000000     0.00000000     0.00000000
 Dipole moment /Debye                   0.00000000     0.00000000     0.00000000

 State-averaged charge density matrix saved on record  5202.2 (density set 1)

 !MCSCF expec        <1.4|EKIN|1.4>     1.298665589201
 !MCSCF expec        <1.6|EKIN|1.6>     1.298665589202
 !MCSCF expec        <1.7|EKIN|1.7>     1.298665589201

 !MCSCF expec         <1.4|POT|1.4>    -1.930276313225
 !MCSCF expec         <1.6|POT|1.6>    -1.930276313226
 !MCSCF expec         <1.7|POT|1.7>    -1.930276313225


 NATURAL ORBITALS (state averaged)
 =================================

   Orb     Occ        Energy       Coefficients

                                   1 1s      1 1s      1 1s      1 1s      1 3d0     1 3d2+    1 3d0     1 3d2+    1 3d0     1 3d2+ 


   1.1  2.00000    -0.541091     1.000210  0.000441 -0.000608  0.000068  0.000000  0.000000  0.000000  0.000000  0.000000  0.000000

                                   1 2px     1 2px     1 2px     1 2px     1 4f1+    1 4f3+    1 4f1+    1 4f3+ 

   1.2  0.66667    -0.066133     0.999801  0.000473 -0.000449  0.000344  0.000000  0.000000  0.000000  0.000000

                                   1 2py     1 2py     1 2py     1 2py     1 4f1-    1 4f3-    1 4f1-    1 4f3- 

   1.3  0.66667    -0.066133     0.999801  0.000473 -0.000449  0.000344  0.000000  0.000000  0.000000  0.000000

                                   1 2pz     1 2pz     1 2pz     1 2pz     1 4f0     1 4f2+    1 4f0     1 4f2+ 

   1.5  0.66667    -0.066133     0.999801  0.000473 -0.000449  0.000344  0.000000  0.000000  0.000000  0.000000
 

 EXTRA SYMMETRY OF MOS IN SYMMETRY 1:   1 1 2 3 2 3 1 2 3 1
 EXTRA SYMMETRY OF MOS IN SYMMETRY 5:   1 1 1 2 3 1 2 3

 Natural orbital dump (state averaged) at molpro section  5202.2    (Orbital set 2)


 CI vector for state symmetry 1
 ==============================

 a a 0           1.0000000

 TOTAL ENERGIES                        -3.67859994

 CI vector for state symmetry 2
 ==============================

 a 0 a           1.0000000

 TOTAL ENERGIES                        -3.67859994

 CI vector for state symmetry 3
 ==============================

 0 a a           1.0000000

 TOTAL ENERGIES                        -3.67859994



 **********************************************************************************************************************************
 DATASETS  * FILE   NREC   LENGTH (MB)   RECORD NAMES
              1      21       19.63       500      610      700      900      950      970     1000      129      960     1100   
                                          VAR    BASINP    GEOM    SYMINP    ZMAT    AOBASIS   BASIS     P2S    ABASIS      S 
                                         1400     1410     1420     1200     1210     1080     1600     1650     1300     1700   
                                         EKIN       V       ECP      H0       H01     AOSYM     SMH    MOLCAS    ERIS     OPER   
                                         1380   
                                         JKOP   

              2       5        5.26       700     1000      520     4202     5202   
                                         GEOM     BASIS   MCVARS     RHF     MCSCF   

 PROGRAMS   *        TOTAL     MULTI       RHF       INT
 CPU TIMES  *         2.36      0.07      0.04      2.09
 REAL TIME  *        17.21 SEC
 DISK USED  *        34.11 MB      
 **********************************************************************************************************************************


 PROGRAM * RHF-SCF (OPEN SHELL)       Authors: W. Meyer, H.-J. Werner


 NUMBER OF ELECTRONS:       3+    1-    SPACE SYMMETRY=6    SPIN SYMMETRY: Triplet 
 CONVERGENCE THRESHOLDS:    1.00E-05 (Density)    1.00E-07 (Energy)
 MAX. NUMBER OF ITERATIONS:        0
 INTERPOLATION TYPE:            DIIS
 INTERPOLATION STEPS:              2 (START)      1 (STEP)
 LEVEL SHIFTS:                 -0.60 (CLOSED) -0.30 (OPEN) 


 Singly occupied orbitals:      1.2       1.5
 Molecular orbitals read from record     5202.2  Type=MCSCF/NATURAL (state averaged)

 Molecular orbital dump at record        2101.2

 ITERATION    DDIFF          GRAD             ENERGY        2-EL.EN.            DIPOLE MOMENTS         DIIS   ORB.
    1      0.000D+00      0.000D+00        -3.67859994      4.005084    0.00000    0.00000    0.00000    0    start

 Final alpha occupancy:   1   1   0   0   1   0   0   0
 Final beta  occupancy:   1   0   0   0   0   0   0   0

 !RHF STATE 1.6 Energy                 -3.678599935719
 Nuclear energy                         0.00000000
 One-electron energy                   -5.68114210
 Two-electron energy                    2.00254217
 Virial quotient                       -2.83259984
 !RHF STATE 1.6 Dipole moment           0.00000000     0.00000000     0.00000000
 Dipole moment /Debye                   0.00000000     0.00000000     0.00000000
 

 !RHF expec          <1.6|EKIN|1.6>     1.298665589202
 
 !RHF expec           <1.6|POT|1.6>    -1.930276313226

 ELECTRON ORBITALS
 =================


   Orb  Occ    Energy  Couls-En    Coefficients

                                   1 1s      1 1s      1 1s      1 1s      1 3d0     1 3d2+    1 3d0     1 3d2+    1 3d0     1 3d2+ 


   1.1   2    -0.5411   -2.1418  1.000210  0.000441 -0.000608  0.000068  0.000000  0.000000  0.000000  0.000000  0.000000  0.000000

                                   1 2px     1 2px     1 2px     1 2px     1 4f1+    1 4f3+    1 4f1+    1 4f3+ 

   1.2   +    -0.0661   -1.3060  0.999801  0.000473 -0.000449  0.000344  0.000000  0.000000  0.000000  0.000000

                                   1 2pz     1 2pz     1 2pz     1 2pz     1 4f0     1 4f2+    1 4f0     1 4f2+ 

   1.5   +    -0.0661   -1.3060  0.999801  0.000473 -0.000449  0.000344  0.000000  0.000000  0.000000  0.000000

 HOMO      1.2    -0.066133 =      -1.7996eV
 LUMO      1.3    -0.066133 =      -1.7996eV
 LUMO-HOMO        -0.000000 =      -0.0000eV


 **********************************************************************************************************************************
 DATASETS  * FILE   NREC   LENGTH (MB)   RECORD NAMES
              1      21       19.63       500      610      700      900      950      970     1000      129      960     1100   
                                          VAR    BASINP    GEOM    SYMINP    ZMAT    AOBASIS   BASIS     P2S    ABASIS      S 
                                         1400     1410     1420     1200     1210     1080     1600     1650     1300     1700   
                                         EKIN       V       ECP      H0       H01     AOSYM     SMH    MOLCAS    ERIS     OPER   
                                         1380   
                                         JKOP   

              2       6        7.77       700     1000      520     4202     5202     2101   
                                         GEOM     BASIS   MCVARS     RHF     MCSCF     RHF  

 PROGRAMS   *        TOTAL       RHF     MULTI       RHF       INT
 CPU TIMES  *         2.38      0.02      0.07      0.04      2.09
 REAL TIME  *        17.30 SEC
 DISK USED  *        34.11 MB      
 **********************************************************************************************************************************
 SETTING SCF(I)         =        -3.67859994  AU                              
 SETTING _CC_NORM_MAX   =         2.00000000                                  


 PROGRAM * UHF-SCF       Authors: W. Meyer, H.-J. Werner


 NUMBER OF ELECTRONS:       3+    1-    SPACE SYMMETRY=6    SPIN SYMMETRY: Triplet 
 CONVERGENCE THRESHOLDS:    1.00E-05 (Density)    1.00E-07 (Energy)
 MAX. NUMBER OF ITERATIONS:        0
 INTERPOLATION TYPE:            DIIS
 INTERPOLATION STEPS:              2 (START)      1 (STEP)
 LEVEL SHIFTS:                  0.20 (ALPHA)   0.20 (BETA) 



 Molecular orbitals read from record     2101.2  Type=RHF/CANONICAL (state 1.6)

 Molecular orbital dump at record        2200.2

 Initial alpha occupation   1   1   0   0   1   0   0   0
 Initial beta  occupation   1   0   0   0   0   0   0   0

 ITERATION    DDIFF          GRAD             ENERGY        2-EL.EN.            DIPOLE MOMENTS         DIIS
    1      0.000D+00      0.000D+00        -3.67859994      4.005084    0.00000    0.00000    0.00000    0
 
 Final alpha occupancy:   1   1   0   0   1   0   0   0
 Final beta  occupancy:   1   0   0   0   0   0   0   0

 !UHF STATE 1.6 Energy                 -3.678599935719
 Nuclear energy                         0.00000000
 One-electron energy                   -5.68114210
 Two-electron energy                    2.00254217
 Virial quotient                       -2.83259984
 !UHF STATE 1.6 Dipole moment           0.00000000     0.00000000     0.00000000
 Dipole moment /Debye                   0.00000000     0.00000000     0.00000000
 

 !UHF expec          <1.6|EKIN|1.6>     1.298665589202
 
 !UHF expec           <1.6|POT|1.6>    -1.930276313226

 ELECTRON ORBITALS FOR POSITIVE SPIN
 ===================================


   Orb  Occ    Energy  Couls-En    Coefficients

                                   1 1s      1 1s      1 1s      1 1s      1 3d0     1 3d2+    1 3d0     1 3d2+    1 3d0     1 3d2+ 


   1.1   +    -0.5411   -2.1418  1.000210  0.000441 -0.000608  0.000068  0.000000  0.000000  0.000000  0.000000  0.000000  0.000000

                                   1 2px     1 2px     1 2px     1 2px     1 4f1+    1 4f3+    1 4f1+    1 4f3+ 

   1.2   +    -0.0661   -1.3060  0.999801  0.000473 -0.000449  0.000344  0.000000  0.000000  0.000000  0.000000

                                   1 2pz     1 2pz     1 2pz     1 2pz     1 4f0     1 4f2+    1 4f0     1 4f2+ 

   1.5   +    -0.0661   -1.3060  0.999801  0.000473 -0.000449  0.000344  0.000000  0.000000  0.000000  0.000000

 ELECTRON ORBITALS FOR NEGATIVE SPIN
 ===================================


   Orb  Occ    Energy  Couls-En    Coefficients

                                   1 1s      1 1s      1 1s      1 1s      1 3d0     1 3d2+    1 3d0     1 3d2+    1 3d0     1 3d2+ 


   1.1   -    -0.5411   -2.1418  1.000210  0.000441 -0.000608  0.000068  0.000000  0.000000  0.000000  0.000000  0.000000  0.000000

 HOMO      1.2    -0.066133 =      -1.7996eV
 LUMO      1.3    -0.066133 =      -1.7996eV
 LUMO-HOMO        -0.000000 =      -0.0000eV

 EXPECTATION VALUE OF S**2:             2.00000000

 Occupation number threshold for canonical orbitals:  1.999000 (occupied),  0.001000 (virtual)

 Number of pseudo-canonical orbitals per symmetry:    1   0   0   0   0   0   0   0
 Number of active natural orbitals per symmetry:      0   1   0   0   1   0   0   0

 NATURAL CHARGE ORBITALS
 =======================


   Orb     Occ        Energy       Coefficients

                                   1 1s      1 1s      1 1s      1 1s      1 3d0     1 3d2+    1 3d0     1 3d2+    1 3d0     1 3d2+ 


   1.1  2.00000    -0.541091     1.000210  0.000441 -0.000608  0.000068  0.000000  0.000000  0.000000  0.000000  0.000000  0.000000

                                   1 2px     1 2px     1 2px     1 2px     1 4f1+    1 4f3+    1 4f1+    1 4f3+ 

   1.2  1.00000    -0.108604     0.999801  0.000473 -0.000449  0.000344  0.000000  0.000000  0.000000  0.000000

                                   1 2pz     1 2pz     1 2pz     1 2pz     1 4f0     1 4f2+    1 4f0     1 4f2+ 

   1.5  1.00000    -0.108604     0.999801  0.000473 -0.000449  0.000344  0.000000  0.000000  0.000000  0.000000

 Natural orbitals saved to record    2200.2 (Orbital set 3)

 Orbital spaces for UNO-CAS (Min. occupation: 0.020  Max. occupation: 1.980):

 Closed:        1   0   0   0   0   0   0   0
 Active:        0   1   0   0   1   0   0   0

 No convergence



 **********************************************************************************************************************************
 DATASETS  * FILE   NREC   LENGTH (MB)   RECORD NAMES
              1      21       19.63       500      610      700      900      950      970     1000      129      960     1100   
                                          VAR    BASINP    GEOM    SYMINP    ZMAT    AOBASIS   BASIS     P2S    ABASIS      S 
                                         1400     1410     1420     1200     1210     1080     1600     1650     1300     1700   
                                         EKIN       V       ECP      H0       H01     AOSYM     SMH    MOLCAS    ERIS     OPER   
                                         1380   
                                         JKOP   

              2       7       10.28       700     1000      520     4202     5202     2101     2200   
                                         GEOM     BASIS   MCVARS     RHF     MCSCF     RHF      UHF  

 PROGRAMS   *        TOTAL       UHF       RHF     MULTI       RHF       INT
 CPU TIMES  *         2.40      0.01      0.02      0.07      0.04      2.09
 REAL TIME  *        17.43 SEC
 DISK USED  *        34.11 MB      
 **********************************************************************************************************************************
 SETTING SCF(I)         =        -3.67859994  AU                              


 PROGRAM * MRCC (General Multireference Coupled Cluster)    Author: M. Kallay, 2000-2005

 ***  Initialisation ***

   0 Spin projections
 
 Molecular orbitals read from record     2200.2  Type=UHF/ALPHA (state 1.6)

 ?Warning: UHF not converged
 Molecular orbitals read from record     2200.2  Type=UHF/BETA (state 1.6)

 ?Warning: UHF not converged
 
 Frozen orbitals:              0 (  0  0  0  0  0  0  0  0)
 Active orbitals:             45 ( 10  8  8  3  8  3  3  2)
 Active electrons:             4
 Spin quantum number:          1.0

 Transformed integrals will be written to file mrcc_58042/fort.55

 Load integrals                2.4 sec
 Transform integrals           2.5 sec
 Storage for integrals:         426551
 Remaining memory:           *********

 Core energy:               0.00000000
 
 MRCC Input:
     4     0     0     0     3     0     0     6     0     0     0     1     1     0     0     7     0     0   0.000     0   64000
  ex.lev,nsing,ntrip, rest,method,dens,conver,symm, diag, CS ,spatial, HF, ndoub,nacto,nactv, tol, maxex, sacc, freq,  dboc,   mem
  2  0  0  0  0  0  0  0  0  0  1  0  0  0  0  0  0  0  0  0  0  0  0  0  0  0  0  0  0  1  0  0  0  0  0  0  0  0  0  0  0  0  0  0  0
 MRCC Input end
 Variable memory released
 MRCC now being run, temporary output in /global/cscratch1/sd/aannabe/mrcc_58042/mrcc.out
 **********************************************************************
                          MRCC program system
 **********************************************************************

                              Written by
  Mihaly Kallay, Zoltan Rolik, Jozsef Csontos, Peter Nagy, Gyula Samu,
      David Mester, Jozsef Csoka, Bernat Szabo, Istvan Ladjanszki,
       Lorant Szegedy, Bence Ladoczki, Klara Petrov, Mate Farkas,
                    Pal D. Mezei, and Bence Hegely

        Department of Physical Chemistry and Materials Science
            Budapest University of Technology and Economics
                  Budapest P.O.Box 91, H-1521 Hungary

                              www.mrcc.hu

                       Release date: May 23, 2018

 ************************ 2018-11-05 13:02:53 *************************
 Executing goldstone...

 Generation of CC equations in terms of H and T...
 Generation of antisymmetrized Goldstone diagrams...
 Number of diagrams in T^1 equations:    15
 Number of diagrams in T^2 equations:    38
 Number of diagrams in T^3 equations:    49
 Number of diagrams in T^4 equations:     5
 Translation of diagrams to factorized equations...
 Optimizing intermediate calculation...
 Number of floating-point operations per iteration step:   4.0982E+08
 Probable CPU time per iteration step (hours):      0.00
 Required memory (Mbytes):     448.7
 Number of intermediates:                                  80
 Number of intermediates to be stored:                     32
 Length of intermediate file (Mbytes):       8.4

 ************************ 2018-11-05 13:02:53 *************************
 Executing xmrcc...

 **********************************************************************
 CC(3)(4) calculation


 Allocation of 448.7 Mbytes of memory...
 Number of spinorbitals:                    90
 Number of alpha electrons:                        3
 Number of beta electrons:                         1
 Spin multiplicity:                     2
 z-component of spin:  1.0
 Spatial symmetry:                      6
 Convergence criterion:  1.0E-07
 Construction of occupation graphs...
 Number of                     0 -fold excitations:                      1
 Number of                     1 -fold excitations:                     32
 Number of                     2 -fold excitations:                   1097
 Number of                     3 -fold excitations:                  15607
 Total number of configurations:                  16737
 Calculation of coupling coefficients...
 Length of intermediate file (Mbytes):       6.7

 ======================================================================

 Spin case  1   Alpha:  3   Beta:  1
 Number of excitations:                  62872
 Number of                     4 -fold excitations:                  62872

 Memory requirements /Mbyte/:
               Minimal        Optimal
 Real*8:         23.0082        31.3201
 Integer:         6.5905
 Total:          29.5986        37.9106


 ************************ 2018-11-05 13:02:54 *************************
 Executing mrcc...

 **********************************************************************
 CCSDT(Q) calculation


 Allocation of   31.3 Mbytes of memory...
 Number of spinorbitals:  90
 Number of alpha electrons:  3
 Number of beta  electrons:  1
 Spin multiplicity: 2
 z-component of spin:  1.0
 Spatial symmetry: 6
 Convergence criterion:  1.0E-07
 Construction of occupation graphs...
 Number of 0-fold excitations: 1
 Number of 1-fold excitations: 32
 Number of 2-fold excitations: 1097
 Number of 3-fold excitations: 15607
 Total number of determinants: 16737
 Calculation of coupling coefficients...
 Initial cluster amplitudes are generated.
 Length of intermediate file (Mbytes):       6.7
 Reading integral list from unit 55...
 Sorting integrals...
 Sorting integrals...
 Sorting integrals...
 Sorting integrals...
 Energy of reference determinant [au]:      -3.678599935719
 Calculation of MP denominators...

 Starting CC iteration...
 ======================================================================
 Norm of residual vector:     0.33768468
 CPU time [min]:     0.027                   Wall time [min]:     0.028

 Iteration  1  CC energy:    -3.74371588  Energy decrease:   0.06511595
 ======================================================================
 Norm of residual vector:     0.10302942
 CPU time [min]:     0.039                   Wall time [min]:     0.040

 Iteration  2  CC energy:    -3.75812617  Energy decrease:   0.01441029
 ======================================================================
 Norm of residual vector:     0.03269218
 CPU time [min]:     0.050                   Wall time [min]:     0.051

 Iteration  3  CC energy:    -3.76396699  Energy decrease:   0.00584082
 ======================================================================
 Norm of residual vector:     0.00875743
 CPU time [min]:     0.061                   Wall time [min]:     0.064

 Iteration  4  CC energy:    -3.76426907  Energy decrease:   0.00030208
 ======================================================================
 Norm of residual vector:     0.00243675
 CPU time [min]:     0.073                   Wall time [min]:     0.077

 Iteration  5  CC energy:    -3.76438798  Energy decrease:   0.00011891
 ======================================================================
 Norm of residual vector:     0.00074858
 CPU time [min]:     0.084                   Wall time [min]:     0.089

 Iteration  6  CC energy:    -3.76434212  Energy decrease:   0.00004587
 ======================================================================
 Norm of residual vector:     0.00021123
 CPU time [min]:     0.095                   Wall time [min]:     0.101

 Iteration  7  CC energy:    -3.76434976  Energy decrease:   0.00000765
 ======================================================================
 Norm of residual vector:     0.00006960
 CPU time [min]:     0.107                   Wall time [min]:     0.113

 Iteration  8  CC energy:    -3.76435114  Energy decrease:   0.00000138
 ======================================================================
 Norm of residual vector:     0.00002427
 CPU time [min]:     0.118                   Wall time [min]:     0.128

 Iteration  9  CC energy:    -3.76435011  Energy decrease:   0.00000104
 ======================================================================
 Norm of residual vector:     0.00000818
 CPU time [min]:     0.130                   Wall time [min]:     0.140

 Iteration 10  CC energy:    -3.76435039  Energy decrease:   0.00000028
 ======================================================================
 Norm of residual vector:     0.00000275
 CPU time [min]:     0.141                   Wall time [min]:     0.151

 Iteration 11  CC energy:    -3.76435040  Energy decrease:   0.00000001
 ======================================================================
 Norm of residual vector:     0.00000090
 CPU time [min]:     0.153                   Wall time [min]:     0.164

 Iteration 12  CC energy:    -3.76435036  Energy decrease:   0.00000004
 ======================================================================
 Norm of residual vector:     0.00000029
 CPU time [min]:     0.164                   Wall time [min]:     0.176

 Iteration 13  CC energy:    -3.76435037  Energy decrease:   0.00000001
 ======================================================================
 Norm of residual vector:     0.00000008
 CPU time [min]:     0.175                   Wall time [min]:     0.188

 Iteration 14  CC energy:    -3.76435037  Energy decrease:   8.1526E-10
 ======================================================================

 Iteration has converged in 14 steps.

 Final results:
 Total CCSDT energy [au]:             -3.764350369039
 Total MP2 energy [au]:               -3.743715880881

 Perturbative corrections are calculated...
 ======================================================================
 Spin case  1   Alpha:  3   Beta:  1
 Number of excitations:        62872
 CPU time [min]:     0.511                   Wall time [min]:     0.524
 ======================================================================
 Number of 4-fold excitations: 62872
 CPU time [min]:     0.511                   Wall time [min]:     0.524

 Total CCSDT[Q] energy [au]:          -3.764380731702
 Total CCSDT(Q) energy [au]:          -3.764423732337

 ************************ 2018-11-05 13:03:27 *************************
                      Normal termination of mrcc.
 **********************************************************************
 !CCSDT STATE 1.6 Energy               -3.764350369039
 !MP2 STATE 1.6 Energy                 -3.743715880881
 !CCSDT[Q] STATE 1.6 Energy            -3.764380731702
 !CCSDT(Q) STATE 1.6 Energy            -3.764423732337
 
 CPU-time for MRCC:             30.7 sec
 Elapsed-time for MRCC:         36.5 sec

 Variable memory set to 8000000000 words,  buffer space   230000 words



 **********************************************************************************************************************************
 DATASETS  * FILE   NREC   LENGTH (MB)   RECORD NAMES
              1      21       19.63       500      610      700      900      950      970     1000      129      960     1100   
                                          VAR    BASINP    GEOM    SYMINP    ZMAT    AOBASIS   BASIS     P2S    ABASIS      S 
                                         1400     1410     1420     1200     1210     1080     1600     1650     1300     1700   
                                         EKIN       V       ECP      H0       H01     AOSYM     SMH    MOLCAS    ERIS     OPER   
                                         1380   
                                         JKOP   

              2       7       10.28       700     1000      520     4202     5202     2101     2200   
                                         GEOM     BASIS   MCVARS     RHF     MCSCF     RHF      UHF  

 PROGRAMS   *        TOTAL      MRCC       UHF       RHF     MULTI       RHF       INT
 CPU TIMES  *        34.08     31.68      0.01      0.02      0.07      0.04      2.09
 REAL TIME  *        60.06 SEC
 DISK USED  *        34.11 MB      
 **********************************************************************************************************************************
 SETTING POSTHF(I)      =        -3.76442373  AU                              
                                                                                                                                                                                                                                                                

       SCF           POSTHF       EKIN          POT
    -3.67859994   -3.76442373   1.29866559   -1.93027631
                                                  

 CCSDT(Q)/USERDEF energy=     -3.764423732337

        CCSDT(Q)        RHF-SCF         MULTI           RHF-SCF 
     -3.76442373     -3.67859994     -3.67859994     -3.67867292
 **********************************************************************************************************************************
 Variable memory released
