
 Primary working directories    : /global/cscratch1/sd/aannabe
 Secondary working directories  : /global/cscratch1/sd/aannabe
 Wavefunction directory         : /global/homes/a/aannabe/wfu/
 Main file repository           : /global/cscratch1/sd/aannabe/

 SHA1      : 2873118e99aab1bc19f5b6fc1784693c06d15c95
 NAME      : 2015.1.8
 ARCHNAME  : linux/x86_64
 FC        : /opt/cray/pe/craype/2.5.5/bin/ftn
 BLASLIB   : -Wl,-_start-group /opt/intel/compilers_and_libraries_2016.3.210/linux/mkl/lib/intel64/libmkl_intel_ilp64.a /opt/intel/compilers_and_libraries_2016.3.210/linux/mkl/lib/intel64/libmkl_intel_thread.a /opt/intel/compilers_and_libraries_2016.3.210/linux/mkl/lib/intel64/libmkl_core.a -Wl,-_end-group
 id        : lbl

 Nodes     nprocs
 nid00458     1

 Using customized tuning parameters: mindgm=8; mindgv=16; mindgc=4; mindgr=1; noblas=0; minvec=7
 default implementation of scratch files=df  

 ***,Si
 memory,8,g
 gthresh,twoint=1.e-12
 
 gprint,basis,orbitals
 gexpec,ekin,pot
 
 angstrom
 geometry={
 1                                                                               ! Number of atoms
 Si 0.0 0.0 0.0
 }
 
 basis={
 Including file /global/homes/a/aannabe/docs/accurate/BFD_Kh/pps/Si.pp
 Including file /global/homes/a/aannabe/docs/accurate/BFD_Kh/basis/aug-cc-pVnZ/Si_qz.basis
 }
 
 {rhf
  start,atden
  wf,4,6,2
  occ,1,1,0,0,1,0,0,0
  open,1.2,1.5
  save,4202.2
 }
 {multi
  start,4202.2
  occ,1,1,1,0,1,0,0
  closed,1,0,0,0,0,0,0,0
  wf,4,4,2;state,1
  wf,4,6,2;state,1
  wf,4,7,2;state,1
  natorb,ci,print
  orbital,5202.2
 }
 {rhf,nitord=1,maxit=0
  start,5202.2
  wf,4,6,2
  occ,1,1,0,0,1,0,0,0
  open,1.2,1.5
 }
 scf(i)=energy
 
 _CC_NORM_MAX=2.0
  !NOTE: Perturbative MRCC works only with UHF reference. So, here we will trick MRCC by doing zero UHF iteration right after ROHF.
 
 {uhf
 maxit,0
 }
 scf(i)=energy
 
 {mrcc,method=CCSDT(Q)
 orbital,ignore_error=1                                                          !Ignore the fact that UHF WF is not converged
 maxit,100
 core
 }
 posthf(i)=energy
 
 table,scf,posthf,ekin,pot
 save,4.csv,new
 
 

 Variables initialized (889), CPU time= 0.00 sec
 Commands  initialized (702), CPU time= 0.01 sec, 572 directives.
 Default parameters read. Elapsed time= 0.15 sec

 Checking input...
 Passed
1


                                         ***  PROGRAM SYSTEM MOLPRO  ***
                                       Copyright, TTI GmbH Stuttgart, 2015
                                    Version 2015.1 linked Sep  7 2016 23:09:38


 **********************************************************************************************************************************
 LABEL *   Si                                                                            
  64 bit serial version                                                                  DATE: 05-Nov-18          TIME: 13:04:02  
 **********************************************************************************************************************************

 SHA1:             2873118e99aab1bc19f5b6fc1784693c06d15c95
 **********************************************************************************************************************************

 THRESHOLDS:

 ZERO    =  1.00D-12  ONEINT  =  1.00D-12  TWOINT  =  1.00D-12  PREFAC  =  1.00D-14  LOCALI  =  1.00D-09  EORDER  =  1.00D-04
 ENERGY  =  0.00D+00  ETEST   =  0.00D+00  EDENS   =  0.00D+00  THRDEDEF=  1.00D-06  GRADIENT=  1.00D-02  STEP    =  1.00D-03
 ORBITAL =  1.00D-05  CIVEC   =  1.00D-05  COEFF   =  1.00D-04  PRINTCI =  5.00D-02  PUNCHCI =  9.90D+01  OPTGRAD =  3.00D-04
 OPTENERG=  1.00D-06  OPTSTEP =  3.00D-04  THRGRAD =  1.00D-10  COMPRESS=  1.00D-11  VARMIN  =  1.00D-07  VARMAX  =  1.00D-03
 THRDOUB =  0.00D+00  THRDIV  =  1.00D-05  THRRED  =  1.00D-07  THRPSP  =  1.00D+00  THRDC   =  1.00D-10  THRCS   =  1.00D-10
 THRNRM  =  1.00D-08  THREQ   =  0.00D+00  THRDE   =  1.00D+00  THRREF  =  1.00D-05  SPARFAC =  1.00D+00  THRDLP  =  1.00D-07
 THRDIA  =  1.00D-10  THRDLS  =  1.00D-07  THRGPS  =  0.00D+00  THRKEX  =  0.00D+00  THRDIS  =  2.00D-01  THRVAR  =  1.00D-10
 THRLOC  =  1.00D-06  THRGAP  =  1.00D-06  THRLOCT = -1.00D+00  THRGAPT = -1.00D+00  THRORB  =  1.00D-06  THRMLTP =  0.00D+00
 THRCPQCI=  1.00D-10  KEXTA   =  0.00D+00  THRCOARS=  0.00D+00  SYMTOL  =  1.00D-06  GRADTOL =  1.00D-06  THROVL  =  1.00D-08
 THRORTH =  1.00D-08  GRID    =  1.00D-06  GRIDMAX =  1.00D-03  DTMAX   =  0.00D+00  THROCCDE=  1.00D-01  THROCCDE=  1.00D-01



 ZUNIT=ANG
 

Geometry recognized as XYZ


 Variable memory set to 8000000000 words,  buffer space   230000 words

 SETTING BASIS          =    USERDEF


 Recomputing integrals since basis changed


 Using spherical harmonics



 PROGRAM * SEWARD (Integral evaluation for generally contracted gaussian basis sets)     Author: Roland Lindh, 1990

 Geometry written to block  1 of record 700

 Orientation using atomic masses  
 Molecule type: Atom
 Symmetry elements: X,Y,Z
 Rotational constants:       0.0000000      0.0000000      0.0000000 GHz  (calculated with average atomic masses)

 Point group  D2h 



 ATOMIC COORDINATES

 NR  ATOM    CHARGE       X              Y              Z

   1  SI      4.00    0.000000000    0.000000000    0.000000000


          SI  CORE POTENTIAL

          d POTENTIAL

 POWERS             1              3              2
 EXPONENTIALS   1.807211       9.996331       2.500432    
 COEFFICIENTS   4.000000       7.228842      -13.06726    

          s - d POTENTIAL

 POWERS             2
 EXPONENTIALS   2.266864    
 COEFFICIENTS   21.20532    

          p - d POTENTIAL

 POWERS             2
 EXPONENTIALS   2.116597    
 COEFFICIENTS   15.43694    


 BASIS DATA

   Nr Sym  Nuc  Type         Exponents   Contraction coefficients

    1.1 Ag    1  1s           0.059887     0.167492
                              0.130108     0.532550
                              0.282668     0.464290
                              0.614115    -0.002322
                              1.334205    -0.268234
                              2.898645     0.031921
                              6.297493    -0.000106
                             13.681707    -0.000145
                             29.724387     0.000067
    2.1 Ag    1  1s           0.031960     1.000000
    3.1 Ag    1  1s           0.079900     1.000000
    4.1 Ag    1  1s           0.206024     1.000000
    5.1 Ag    1  1s           0.435017     1.000000
    6.1 Ag    1  3d0          0.053247     1.000000
    7.1 Ag    1  3d2+         0.053247     1.000000
    8.1 Ag    1  3d0          0.133118     1.000000
    9.1 Ag    1  3d2+         0.133118     1.000000
   10.1 Ag    1  3d0          0.350967     1.000000
   11.1 Ag    1  3d2+         0.350967     1.000000
   12.1 Ag    1  3d0          1.063961     1.000000
   13.1 Ag    1  3d2+         1.063961     1.000000
   14.1 Ag    1  5g0          0.186146     1.000000
   15.1 Ag    1  5g4+         0.186146     1.000000
   16.1 Ag    1  5g2+         0.186146     1.000000
   17.1 Ag    1  5g0          0.465365     1.000000
   18.1 Ag    1  5g4+         0.465365     1.000000
   19.1 Ag    1  5g2+         0.465365     1.000000
    1.2 B3u   1  2px          0.036525     0.078761
                              0.076137     0.308331
                              0.158712     0.417773
                              0.330843     0.281676
                              0.689658     0.069876
                              1.437625    -0.056306
                              2.996797     0.000744
                              6.246966    -0.000259
                             13.022097    -0.000022
    2.2 B3u   1  2px          0.021830     1.000000
    3.2 B3u   1  2px          0.054575     1.000000
    4.2 B3u   1  2px          0.599112     1.000000
    5.2 B3u   1  2px          0.134681     1.000000
    6.2 B3u   1  4f1+         0.084528     1.000000
    7.2 B3u   1  4f3+         0.084528     1.000000
    8.2 B3u   1  4f1+         0.211319     1.000000
    9.2 B3u   1  4f3+         0.211319     1.000000
   10.2 B3u   1  4f1+         0.535932     1.000000
   11.2 B3u   1  4f3+         0.535932     1.000000
    1.3 B2u   1  2py          0.036525     0.078761
                              0.076137     0.308331
                              0.158712     0.417773
                              0.330843     0.281676
                              0.689658     0.069876
                              1.437625    -0.056306
                              2.996797     0.000744
                              6.246966    -0.000259
                             13.022097    -0.000022
    2.3 B2u   1  2py          0.021830     1.000000
    3.3 B2u   1  2py          0.054575     1.000000
    4.3 B2u   1  2py          0.599112     1.000000
    5.3 B2u   1  2py          0.134681     1.000000
    6.3 B2u   1  4f1-         0.084528     1.000000
    7.3 B2u   1  4f3-         0.084528     1.000000
    8.3 B2u   1  4f1-         0.211319     1.000000
    9.3 B2u   1  4f3-         0.211319     1.000000
   10.3 B2u   1  4f1-         0.535932     1.000000
   11.3 B2u   1  4f3-         0.535932     1.000000
    1.4 B1g   1  3d2-         0.053247     1.000000
    2.4 B1g   1  3d2-         0.133118     1.000000
    3.4 B1g   1  3d2-         0.350967     1.000000
    4.4 B1g   1  3d2-         1.063961     1.000000
    5.4 B1g   1  5g2-         0.186146     1.000000
    6.4 B1g   1  5g4-         0.186146     1.000000
    7.4 B1g   1  5g2-         0.465365     1.000000
    8.4 B1g   1  5g4-         0.465365     1.000000
    1.5 B1u   1  2pz          0.036525     0.078761
                              0.076137     0.308331
                              0.158712     0.417773
                              0.330843     0.281676
                              0.689658     0.069876
                              1.437625    -0.056306
                              2.996797     0.000744
                              6.246966    -0.000259
                             13.022097    -0.000022
    2.5 B1u   1  2pz          0.021830     1.000000
    3.5 B1u   1  2pz          0.054575     1.000000
    4.5 B1u   1  2pz          0.599112     1.000000
    5.5 B1u   1  2pz          0.134681     1.000000
    6.5 B1u   1  4f0          0.084528     1.000000
    7.5 B1u   1  4f2+         0.084528     1.000000
    8.5 B1u   1  4f0          0.211319     1.000000
    9.5 B1u   1  4f2+         0.211319     1.000000
   10.5 B1u   1  4f0          0.535932     1.000000
   11.5 B1u   1  4f2+         0.535932     1.000000
    1.6 B2g   1  3d1+         0.053247     1.000000
    2.6 B2g   1  3d1+         0.133118     1.000000
    3.6 B2g   1  3d1+         0.350967     1.000000
    4.6 B2g   1  3d1+         1.063961     1.000000
    5.6 B2g   1  5g1+         0.186146     1.000000
    6.6 B2g   1  5g3+         0.186146     1.000000
    7.6 B2g   1  5g1+         0.465365     1.000000
    8.6 B2g   1  5g3+         0.465365     1.000000
    1.7 B3g   1  3d1-         0.053247     1.000000
    2.7 B3g   1  3d1-         0.133118     1.000000
    3.7 B3g   1  3d1-         0.350967     1.000000
    4.7 B3g   1  3d1-         1.063961     1.000000
    5.7 B3g   1  5g1-         0.186146     1.000000
    6.7 B3g   1  5g3-         0.186146     1.000000
    7.7 B3g   1  5g1-         0.465365     1.000000
    8.7 B3g   1  5g3-         0.465365     1.000000
    1.8 Au    1  4f2-         0.084528     1.000000
    2.8 Au    1  4f2-         0.211319     1.000000
    3.8 Au    1  4f2-         0.535932     1.000000

 NUCLEAR CHARGE:                    4
 NUMBER OF PRIMITIVE AOS:         136
 NUMBER OF SYMMETRY AOS:          111
 NUMBER OF CONTRACTIONS:           79   (  19Ag  +  11B3u +  11B2u +   8B1g +  11B1u +   8B2g +   8B3g +   3Au  )
 NUMBER OF CORE ORBITALS:           0   (   0Ag  +   0B3u +   0B2u +   0B1g +   0B1u +   0B2g +   0B3g +   0Au  )
 NUMBER OF VALENCE ORBITALS:        4   (   1Ag  +   1B3u +   1B2u +   0B1g +   1B1u +   0B2g +   0B3g +   0Au  )


 NUCLEAR REPULSION ENERGY    0.00000000

 EXTRA SYMMETRY OF AOS IN SYMMETRY 1:   1 1 1 1 1 2 3 2 3 2   3 2 3 4 5 6 4 5 6
 EXTRA SYMMETRY OF AOS IN SYMMETRY 2:   1 1 1 1 1 2 3 2 3 2   3
 EXTRA SYMMETRY OF AOS IN SYMMETRY 3:   1 1 1 1 1 2 3 2 3 2   3
 EXTRA SYMMETRY OF AOS IN SYMMETRY 4:   1 1 1 1 2 3 2 3
 EXTRA SYMMETRY OF AOS IN SYMMETRY 5:   1 1 1 1 1 2 3 2 3 2   3
 EXTRA SYMMETRY OF AOS IN SYMMETRY 6:   1 1 1 1 2 3 2 3
 EXTRA SYMMETRY OF AOS IN SYMMETRY 7:   1 1 1 1 2 3 2 3

 Eigenvalues of metric

         1 0.308E-02 0.207E-01 0.108E+00 0.108E+00 0.160E+00 0.428E+00 0.428E+00 0.428E+00
         2 0.394E-02 0.693E-01 0.197E+00 0.197E+00 0.436E+00 0.817E+00 0.817E+00 0.111E+01
         3 0.394E-02 0.693E-01 0.197E+00 0.197E+00 0.436E+00 0.817E+00 0.817E+00 0.111E+01
         4 0.108E+00 0.428E+00 0.428E+00 0.435E+00 0.116E+01 0.157E+01 0.157E+01 0.229E+01
         5 0.394E-02 0.693E-01 0.197E+00 0.197E+00 0.436E+00 0.817E+00 0.817E+00 0.111E+01
         6 0.108E+00 0.428E+00 0.428E+00 0.435E+00 0.116E+01 0.157E+01 0.157E+01 0.229E+01
         7 0.108E+00 0.428E+00 0.428E+00 0.435E+00 0.116E+01 0.157E+01 0.157E+01 0.229E+01
         8 0.197E+00 0.817E+00 0.199E+01


 Contracted 2-electron integrals neglected if value below      1.0D-12
 AO integral compression algorithm  1   Integral accuracy      1.0D-12

     6.029 MB (compressed) written to integral file ( 63.5%)


 NUMBER OF SORTED TWO-ELECTRON INTEGRALS:     665704.     BUFFER LENGTH:  32768
 NUMBER OF SEGMENTS:   1  SEGMENT LENGTH:     665704      RECORD LENGTH: 524288

 Memory used in sort:       1.22 MW

 SORT1 READ     1222209. AND WROTE      500866. INTEGRALS IN      2 RECORDS. CPU TIME:     0.03 SEC, REAL TIME:     0.05 SEC
 SORT2 READ      500866. AND WROTE      665704. INTEGRALS IN     23 RECORDS. CPU TIME:     0.06 SEC, REAL TIME:     0.12 SEC

 FILE SIZES:   FILE 1:    25.3 MBYTE,  FILE 4:     8.4 MBYTE,   TOTAL:     33.7 MBYTE

 OPERATOR DM      FOR CENTER  0  COORDINATES:    0.000000    0.000000    0.000000
 OPERATOR EKIN    FOR CENTER  0  COORDINATES:    0.000000    0.000000    0.000000
 OPERATOR POT     FOR CENTER  0  COORDINATES:    0.000000    0.000000    0.000000


 **********************************************************************************************************************************
 DATASETS  * FILE   NREC   LENGTH (MB)   RECORD NAMES
              1      20       22.55       500      610      700      900      950      970     1000      129      960     1100   
                                          VAR    BASINP    GEOM    SYMINP    ZMAT    AOBASIS   BASIS     P2S    ABASIS      S 
                                         1400     1410     1420     1200     1210     1080     1600     1650     1300     1700   
                                         EKIN       V       ECP      H0       H01     AOSYM     SMH    MOLCAS    ERIS     OPER   

 PROGRAMS   *        TOTAL       INT
 CPU TIMES  *         2.54      2.41
 REAL TIME  *        14.03 SEC
 DISK USED  *        33.97 MB      
 **********************************************************************************************************************************


 PROGRAM * RHF-SCF (OPEN SHELL)       Authors: W. Meyer, H.-J. Werner


 NUMBER OF ELECTRONS:       3+    1-    SPACE SYMMETRY=6    SPIN SYMMETRY: Triplet 
 CONVERGENCE THRESHOLDS:    1.00E-05 (Density)    1.00E-07 (Energy)
 MAX. NUMBER OF ITERATIONS:       60
 INTERPOLATION TYPE:            DIIS
 INTERPOLATION STEPS:              2 (START)      1 (STEP)
 LEVEL SHIFTS:                 -0.60 (CLOSED) -0.30 (OPEN) 


 Singly occupied orbitals:      1.2       1.5

   Atom=SI basis=ECP10MWB_GUESS    lmin=0  lmax=1

 Orbital guess generated from atomic densities. Full valence occupancy:    1   1   1   0   1   0   0   0


 Molecular orbital dump at record        4202.2

 ITERATION    DDIFF          GRAD             ENERGY        2-EL.EN.            DIPOLE MOMENTS         DIIS   ORB.
    1      0.000D+00      0.000D+00        -3.66685326      3.785695    0.00000    0.00000    0.00000    0    start
    2      0.000D+00      0.631D-02        -3.67492495      3.895880    0.00000    0.00000    0.00000    1    diag,B
    3      0.106D-01      0.282D-02        -3.67798229      3.972227    0.00000    0.00000    0.00000    2    diag,B
    4      0.628D-02      0.122D-02        -3.67864126      4.002583    0.00000    0.00000    0.00000    3    diag,B
    5      0.347D-02      0.348D-03        -3.67867347      4.004435    0.00000    0.00000    0.00000    4    diag,B
    6      0.107D-02      0.908D-04        -3.67867526      4.004901    0.00000    0.00000    0.00000    5    diag,B
    7      0.395D-03      0.173D-04        -3.67867530      4.004699    0.00000    0.00000    0.00000    6    fixocc
    8      0.346D-04      0.573D-05        -3.67867531      4.004750    0.00000    0.00000    0.00000    7    diag,B
    9      0.274D-04      0.451D-06        -3.67867531      4.004752    0.00000    0.00000    0.00000    8    diag,B
   10      0.150D-05      0.176D-06        -3.67867531      4.004751    0.00000    0.00000    0.00000    0    orth

 Final alpha occupancy:   1   1   0   0   1   0   0   0
 Final beta  occupancy:   1   0   0   0   0   0   0   0

 !RHF STATE 1.6 Energy                 -3.678675310096
 Nuclear energy                         0.00000000
 One-electron energy                   -5.68105071
 Two-electron energy                    2.00237540
 Virial quotient                       -2.83262298
 !RHF STATE 1.6 Dipole moment           0.00000000     0.00000000     0.00000000
 Dipole moment /Debye                   0.00000000     0.00000000     0.00000000
 

 !RHF expec          <1.6|EKIN|1.6>     1.298681587955
 
 !RHF expec           <1.6|POT|1.6>    -1.930260326004

 ELECTRON ORBITALS
 =================


   Orb  Occ    Energy  Couls-En    Coefficients

                                   1 1s      1 1s      1 1s      1 1s      1 1s      1 3d0     1 3d2+    1 3d0     1 3d2+    1 3d0  
                                   1 3d2+    1 3d0     1 3d2+    1 5g0     1 5g4+    1 5g2+    1 5g0     1 5g4+    1 5g2+ 

   1.1   2    -0.5411   -2.1419  0.999732  0.000849 -0.001431  0.001416 -0.000489  0.001544  0.002674  0.003121  0.005406 -0.000592
                                -0.001025  0.000352  0.000610 -0.000033 -0.000065 -0.000049 -0.000002 -0.000004 -0.000003

                                   1 2px     1 2px     1 2px     1 2px     1 2px     1 4f1+    1 4f3+    1 4f1+    1 4f3+    1 4f1+ 
                                   1 4f3+ 

   1.2   +    -0.2970   -1.5368  0.999487  0.000538 -0.000390  0.000044  0.000558  0.000029  0.000114 -0.000023 -0.000087 -0.000016
                                -0.000062

                                   1 2pz     1 2pz     1 2pz     1 2pz     1 2pz     1 4f0     1 4f2+    1 4f0     1 4f2+    1 4f0  
                                   1 4f2+ 

   1.5   +    -0.2970   -1.5368  0.999487  0.000538 -0.000390  0.000044  0.000558  0.000072  0.000093 -0.000055 -0.000071 -0.000039
                                -0.000050

 HOMO      1.2    -0.297009 =      -8.0820eV
 LUMO      1.3    -0.017024 =      -0.4632eV
 LUMO-HOMO         0.279986 =       7.6188eV


 **********************************************************************************************************************************
 DATASETS  * FILE   NREC   LENGTH (MB)   RECORD NAMES
              1      20       22.55       500      610      700      900      950      970     1000      129      960     1100   
                                          VAR    BASINP    GEOM    SYMINP    ZMAT    AOBASIS   BASIS     P2S    ABASIS      S 
                                         1400     1410     1420     1200     1210     1080     1600     1650     1300     1700   
                                         EKIN       V       ECP      H0       H01     AOSYM     SMH    MOLCAS    ERIS     OPER   

              2       4        2.78       700     1000      520     4202   
                                         GEOM     BASIS   MCVARS     RHF  

 PROGRAMS   *        TOTAL       RHF       INT
 CPU TIMES  *         2.61      0.08      2.41
 REAL TIME  *        14.26 SEC
 DISK USED  *        33.97 MB      
 **********************************************************************************************************************************


 PROGRAM * MULTI (Direct Multiconfiguration SCF)       Authors: P.J. Knowles, H.-J. Werner (1984)     S.T. Elbert (1988)


 Number of closed-shell orbitals:   1 (   1   0   0   0   0   0   0   0 )
 Number of active  orbitals:        3 (   0   1   1   0   1   0   0   0 )
 Number of external orbitals:      75 (  18  10  10   8  10   8   8   3 )

 State symmetry 1

 Number of electrons:     2    Spin symmetry=Triplet   Space symmetry=4
 Number of states:        1
 Number of CSFs:          1   (1 determinants, 3 intermediate states)

 State symmetry 2

 Number of electrons:     2    Spin symmetry=Triplet   Space symmetry=6
 Number of states:        1
 Number of CSFs:          1   (1 determinants, 3 intermediate states)

 State symmetry 3

 Number of electrons:     2    Spin symmetry=Triplet   Space symmetry=7
 Number of states:        1
 Number of CSFs:          1   (1 determinants, 3 intermediate states)

 Molecular orbitals read from record     4202.2  Type=RHF/CANONICAL (state 1.6)
 *** IN SYMMETRY 1 ORBITAL  1 SYMMETRY CONTAMINATION OF 0.152D-01 HAS BEEN REMOVED

 EXTRA SYMMETRY OF MOS IN SYMMETRY 1:   1 1 2 3 1 2 3 5 4 6   3 2 1 5 4 6 3 2 1
 *** IN SYMMETRY 2 ORBITAL  1 SYMMETRY CONTAMINATION OF 0.331D-03 HAS BEEN REMOVED
 EXTRA SYMMETRY OF MOS IN SYMMETRY 2:   1 1 1 3 2 1 2 3 3 2   1
 *** IN SYMMETRY 3 ORBITAL  1 SYMMETRY CONTAMINATION OF 0.753D-02 HAS BEEN REMOVED
 EXTRA SYMMETRY OF MOS IN SYMMETRY 3:   1 1 1 3 2 1 2 3 3 2   1
 EXTRA SYMMETRY OF MOS IN SYMMETRY 4:   1 1 3 2 1 3 2 1
 *** IN SYMMETRY 5 ORBITAL  1 SYMMETRY CONTAMINATION OF 0.381D-03 HAS BEEN REMOVED
 EXTRA SYMMETRY OF MOS IN SYMMETRY 5:   1 1 1 3 2 1 2 3 3 2   1
 EXTRA SYMMETRY OF MOS IN SYMMETRY 6:   1 1 3 2 1 3 2 1
 EXTRA SYMMETRY OF MOS IN SYMMETRY 7:   1 1 2 3 1 2 3 1

 Wavefunction dump at record             5202.2

 Convergence thresholds  0.10E-01 (gradient)  0.10E-05 (energy)  0.10E-02 (step length)

 Weight factors for state symmetry  1:    0.33333
 Weight factors for state symmetry  2:    0.33333
 Weight factors for state symmetry  3:    0.33333

 Number of orbital rotations:       48   (     0 Core/Active     18 Core/Virtual   0 Active/Active     30 Active/Virtual)
 Total number of variables:         51


 ITER. MIC  NCI  NEG     ENERGY(VAR)     ENERGY(PROJ)   ENERGY CHANGE     GRAD(0)  GRAD(ORB)   GRAD(CI)     STEP       TIME

   1   21   12    0      -3.66095279      -3.67860954   -0.01765674    0.05663002 0.00000000 0.00000000  0.33D+00      0.03
   2   15   12    0      -3.67859029      -3.67860001   -0.00000972    0.00301540 0.00000000 0.00000000  0.53D-02      0.05
   3   15   12    0      -3.67860002      -3.67860002   -0.00000000    0.00000345 0.00000000 0.00000000  0.47D-05      0.07

 ** WVFN ****  CONVERGENCE REACHED, FINAL GRADIENT:  0.41D-11



 Results for state 1.4
 =====================

 !MCSCF STATE 1.4 Energy               -3.678600016320
 Nuclear energy                         0.00000000
 Kinetic energy                         1.29866289
 One electron energy                   -5.68115323
 Two electron energy                    2.00255321
 Virial ratio                           3.83260579

 !MCSCF STATE 1.4 Dipole moment         0.00000000     0.00000000     0.00000000
 Dipole moment /Debye                   0.00000000     0.00000000     0.00000000



 Results for state 1.6
 =====================

 !MCSCF STATE 1.6 Energy               -3.678600016320
 Nuclear energy                         0.00000000
 Kinetic energy                         1.29866289
 One electron energy                   -5.68115323
 Two electron energy                    2.00255321
 Virial ratio                           3.83260579

 !MCSCF STATE 1.6 Dipole moment         0.00000000     0.00000000     0.00000000
 Dipole moment /Debye                   0.00000000     0.00000000     0.00000000



 Results for state 1.7
 =====================

 !MCSCF STATE 1.7 Energy               -3.678600016320
 Nuclear energy                         0.00000000
 Kinetic energy                         1.29866289
 One electron energy                   -5.68115323
 Two electron energy                    2.00255321
 Virial ratio                           3.83260579

 !MCSCF STATE 1.7 Dipole moment         0.00000000     0.00000000     0.00000000
 Dipole moment /Debye                   0.00000000     0.00000000     0.00000000

 State-averaged charge density matrix saved on record  5202.2 (density set 1)

 !MCSCF expec        <1.4|EKIN|1.4>     1.298662889808
 !MCSCF expec        <1.6|EKIN|1.6>     1.298662889809
 !MCSCF expec        <1.7|EKIN|1.7>     1.298662889808

 !MCSCF expec         <1.4|POT|1.4>    -1.930274747890
 !MCSCF expec         <1.6|POT|1.6>    -1.930274747891
 !MCSCF expec         <1.7|POT|1.7>    -1.930274747890


 NATURAL ORBITALS (state averaged)
 =================================

   Orb     Occ        Energy       Coefficients

                                   1 1s      1 1s      1 1s      1 1s      1 1s      1 3d0     1 3d2+    1 3d0     1 3d2+    1 3d0  
                                   1 3d2+    1 3d0     1 3d2+    1 5g0     1 5g4+    1 5g2+    1 5g0     1 5g4+    1 5g2+ 

   1.1  2.00000    -0.541089     0.999686  0.000857 -0.001197  0.001227 -0.000447  0.000000  0.000000  0.000000  0.000000  0.000000
                                 0.000000  0.000000  0.000000  0.000000  0.000000  0.000000  0.000000  0.000000  0.000000

                                   1 2px     1 2px     1 2px     1 2px     1 2px     1 4f1+    1 4f3+    1 4f1+    1 4f3+    1 4f1+ 
                                   1 4f3+ 

   1.2  0.66667    -0.066130     0.999654  0.000555 -0.000549  0.000026  0.000520  0.000000  0.000000  0.000000  0.000000  0.000000
                                 0.000000

                                   1 2py     1 2py     1 2py     1 2py     1 2py     1 4f1-    1 4f3-    1 4f1-    1 4f3-    1 4f1- 
                                   1 4f3- 

   1.3  0.66667    -0.066130     0.999654  0.000555 -0.000549  0.000026  0.000520  0.000000  0.000000  0.000000  0.000000  0.000000
                                 0.000000

                                   1 2pz     1 2pz     1 2pz     1 2pz     1 2pz     1 4f0     1 4f2+    1 4f0     1 4f2+    1 4f0  
                                   1 4f2+ 

   1.5  0.66667    -0.066130     0.999654  0.000555 -0.000549  0.000026  0.000520  0.000000  0.000000  0.000000  0.000000  0.000000
                                 0.000000
 

 EXTRA SYMMETRY OF MOS IN SYMMETRY 1:   1 1 2 3 1 3 2 4 6 5   2 3 1 5 4 6 3 2 1
 EXTRA SYMMETRY OF MOS IN SYMMETRY 2:   1 1 1 3 2 3 2 1 3 2   1
 EXTRA SYMMETRY OF MOS IN SYMMETRY 3:   1 1 1 3 2 3 2 1 3 2   1
 EXTRA SYMMETRY OF MOS IN SYMMETRY 4:   1 1 2 3 1 3 2 1
 EXTRA SYMMETRY OF MOS IN SYMMETRY 5:   1 1 1 3 2 3 2 1 3 2   1
 EXTRA SYMMETRY OF MOS IN SYMMETRY 7:   1 1 3 2 1 3 2 1

 Natural orbital dump (state averaged) at molpro section  5202.2    (Orbital set 2)


 CI vector for state symmetry 1
 ==============================

 a a 0           1.0000000

 TOTAL ENERGIES                        -3.67860002

 CI vector for state symmetry 2
 ==============================

 a 0 a           1.0000000

 TOTAL ENERGIES                        -3.67860002

 CI vector for state symmetry 3
 ==============================

 0 a a           1.0000000

 TOTAL ENERGIES                        -3.67860002



 **********************************************************************************************************************************
 DATASETS  * FILE   NREC   LENGTH (MB)   RECORD NAMES
              1      21       22.67       500      610      700      900      950      970     1000      129      960     1100   
                                          VAR    BASINP    GEOM    SYMINP    ZMAT    AOBASIS   BASIS     P2S    ABASIS      S 
                                         1400     1410     1420     1200     1210     1080     1600     1650     1300     1700   
                                         EKIN       V       ECP      H0       H01     AOSYM     SMH    MOLCAS    ERIS     OPER   
                                         1380   
                                         JKOP   

              2       5        5.31       700     1000      520     4202     5202   
                                         GEOM     BASIS   MCVARS     RHF     MCSCF   

 PROGRAMS   *        TOTAL     MULTI       RHF       INT
 CPU TIMES  *         2.69      0.08      0.08      2.41
 REAL TIME  *        15.28 SEC
 DISK USED  *        37.52 MB      
 **********************************************************************************************************************************


 PROGRAM * RHF-SCF (OPEN SHELL)       Authors: W. Meyer, H.-J. Werner


 NUMBER OF ELECTRONS:       3+    1-    SPACE SYMMETRY=6    SPIN SYMMETRY: Triplet 
 CONVERGENCE THRESHOLDS:    1.00E-05 (Density)    1.00E-07 (Energy)
 MAX. NUMBER OF ITERATIONS:        0
 INTERPOLATION TYPE:            DIIS
 INTERPOLATION STEPS:              2 (START)      1 (STEP)
 LEVEL SHIFTS:                 -0.60 (CLOSED) -0.30 (OPEN) 


 Singly occupied orbitals:      1.2       1.5
 Molecular orbitals read from record     5202.2  Type=MCSCF/NATURAL (state averaged)

 Molecular orbital dump at record        2101.2

 ITERATION    DDIFF          GRAD             ENERGY        2-EL.EN.            DIPOLE MOMENTS         DIIS   ORB.
    1      0.000D+00      0.000D+00        -3.67860002      4.005106    0.00000    0.00000    0.00000    0    start

 Final alpha occupancy:   1   1   0   0   1   0   0   0
 Final beta  occupancy:   1   0   0   0   0   0   0   0

 !RHF STATE 1.6 Energy                 -3.678600016320
 Nuclear energy                         0.00000000
 One-electron energy                   -5.68115323
 Two-electron energy                    2.00255321
 Virial quotient                       -2.83260579
 !RHF STATE 1.6 Dipole moment           0.00000000     0.00000000     0.00000000
 Dipole moment /Debye                   0.00000000     0.00000000     0.00000000
 

 !RHF expec          <1.6|EKIN|1.6>     1.298662889809
 
 !RHF expec           <1.6|POT|1.6>    -1.930274747891

 ELECTRON ORBITALS
 =================


   Orb  Occ    Energy  Couls-En    Coefficients

                                   1 1s      1 1s      1 1s      1 1s      1 1s      1 3d0     1 3d2+    1 3d0     1 3d2+    1 3d0  
                                   1 3d2+    1 3d0     1 3d2+    1 5g0     1 5g4+    1 5g2+    1 5g0     1 5g4+    1 5g2+ 

   1.1   2    -0.5411   -2.1418  0.999686  0.000857 -0.001197  0.001227 -0.000447  0.000000  0.000000  0.000000  0.000000  0.000000
                                 0.000000  0.000000  0.000000  0.000000  0.000000  0.000000  0.000000  0.000000  0.000000

                                   1 2px     1 2px     1 2px     1 2px     1 2px     1 4f1+    1 4f3+    1 4f1+    1 4f3+    1 4f1+ 
                                   1 4f3+ 

   1.2   +    -0.0661   -1.3060  0.999654  0.000555 -0.000549  0.000026  0.000520  0.000000  0.000000  0.000000  0.000000  0.000000
                                 0.000000

                                   1 2pz     1 2pz     1 2pz     1 2pz     1 2pz     1 4f0     1 4f2+    1 4f0     1 4f2+    1 4f0  
                                   1 4f2+ 

   1.5   +    -0.0661   -1.3060  0.999654  0.000555 -0.000549  0.000026  0.000520  0.000000  0.000000  0.000000  0.000000  0.000000
                                 0.000000

 HOMO      1.2    -0.066130 =      -1.7995eV
 LUMO      1.3    -0.066130 =      -1.7995eV
 LUMO-HOMO        -0.000000 =      -0.0000eV


 **********************************************************************************************************************************
 DATASETS  * FILE   NREC   LENGTH (MB)   RECORD NAMES
              1      21       22.67       500      610      700      900      950      970     1000      129      960     1100   
                                          VAR    BASINP    GEOM    SYMINP    ZMAT    AOBASIS   BASIS     P2S    ABASIS      S 
                                         1400     1410     1420     1200     1210     1080     1600     1650     1300     1700   
                                         EKIN       V       ECP      H0       H01     AOSYM     SMH    MOLCAS    ERIS     OPER   
                                         1380   
                                         JKOP   

              2       6        7.84       700     1000      520     4202     5202     2101   
                                         GEOM     BASIS   MCVARS     RHF     MCSCF     RHF  

 PROGRAMS   *        TOTAL       RHF     MULTI       RHF       INT
 CPU TIMES  *         2.72      0.02      0.08      0.08      2.41
 REAL TIME  *        15.57 SEC
 DISK USED  *        37.52 MB      
 **********************************************************************************************************************************
 SETTING SCF(I)         =        -3.67860002  AU                              
 SETTING _CC_NORM_MAX   =         2.00000000                                  


 PROGRAM * UHF-SCF       Authors: W. Meyer, H.-J. Werner


 NUMBER OF ELECTRONS:       3+    1-    SPACE SYMMETRY=6    SPIN SYMMETRY: Triplet 
 CONVERGENCE THRESHOLDS:    1.00E-05 (Density)    1.00E-07 (Energy)
 MAX. NUMBER OF ITERATIONS:        0
 INTERPOLATION TYPE:            DIIS
 INTERPOLATION STEPS:              2 (START)      1 (STEP)
 LEVEL SHIFTS:                  0.20 (ALPHA)   0.20 (BETA) 



 Molecular orbitals read from record     2101.2  Type=RHF/CANONICAL (state 1.6)

 Molecular orbital dump at record        2200.2

 Initial alpha occupation   1   1   0   0   1   0   0   0
 Initial beta  occupation   1   0   0   0   0   0   0   0

 ITERATION    DDIFF          GRAD             ENERGY        2-EL.EN.            DIPOLE MOMENTS         DIIS
    1      0.000D+00      0.000D+00        -3.67860002      4.005106    0.00000    0.00000    0.00000    0
 
 Final alpha occupancy:   1   1   0   0   1   0   0   0
 Final beta  occupancy:   1   0   0   0   0   0   0   0

 !UHF STATE 1.6 Energy                 -3.678600016320
 Nuclear energy                         0.00000000
 One-electron energy                   -5.68115323
 Two-electron energy                    2.00255321
 Virial quotient                       -2.83260579
 !UHF STATE 1.6 Dipole moment           0.00000000     0.00000000     0.00000000
 Dipole moment /Debye                   0.00000000     0.00000000     0.00000000
 

 !UHF expec          <1.6|EKIN|1.6>     1.298662889809
 
 !UHF expec           <1.6|POT|1.6>    -1.930274747891

 ELECTRON ORBITALS FOR POSITIVE SPIN
 ===================================


   Orb  Occ    Energy  Couls-En    Coefficients

                                   1 1s      1 1s      1 1s      1 1s      1 1s      1 3d0     1 3d2+    1 3d0     1 3d2+    1 3d0  
                                   1 3d2+    1 3d0     1 3d2+    1 5g0     1 5g4+    1 5g2+    1 5g0     1 5g4+    1 5g2+ 

   1.1   +    -0.5411   -2.1418  0.999686  0.000857 -0.001197  0.001227 -0.000447  0.000000  0.000000  0.000000  0.000000  0.000000
                                 0.000000  0.000000  0.000000  0.000000  0.000000  0.000000  0.000000  0.000000  0.000000

                                   1 2px     1 2px     1 2px     1 2px     1 2px     1 4f1+    1 4f3+    1 4f1+    1 4f3+    1 4f1+ 
                                   1 4f3+ 

   1.2   +    -0.0661   -1.3060  0.999654  0.000555 -0.000549  0.000026  0.000520  0.000000  0.000000  0.000000  0.000000  0.000000
                                 0.000000

                                   1 2pz     1 2pz     1 2pz     1 2pz     1 2pz     1 4f0     1 4f2+    1 4f0     1 4f2+    1 4f0  
                                   1 4f2+ 

   1.5   +    -0.0661   -1.3060  0.999654  0.000555 -0.000549  0.000026  0.000520  0.000000  0.000000  0.000000  0.000000  0.000000
                                 0.000000

 ELECTRON ORBITALS FOR NEGATIVE SPIN
 ===================================


   Orb  Occ    Energy  Couls-En    Coefficients

                                   1 1s      1 1s      1 1s      1 1s      1 1s      1 3d0     1 3d2+    1 3d0     1 3d2+    1 3d0  
                                   1 3d2+    1 3d0     1 3d2+    1 5g0     1 5g4+    1 5g2+    1 5g0     1 5g4+    1 5g2+ 

   1.1   -    -0.5411   -2.1418  0.999686  0.000857 -0.001197  0.001227 -0.000447  0.000000  0.000000  0.000000  0.000000  0.000000
                                 0.000000  0.000000  0.000000  0.000000  0.000000  0.000000  0.000000  0.000000  0.000000

 HOMO      1.2    -0.066130 =      -1.7995eV
 LUMO      1.3    -0.066130 =      -1.7995eV
 LUMO-HOMO        -0.000000 =      -0.0000eV

 EXPECTATION VALUE OF S**2:             2.00000000

 Occupation number threshold for canonical orbitals:  1.999000 (occupied),  0.001000 (virtual)

 Number of pseudo-canonical orbitals per symmetry:    1   0   0   0   0   0   0   0
 Number of active natural orbitals per symmetry:      0   1   0   0   1   0   0   0

 NATURAL CHARGE ORBITALS
 =======================


   Orb     Occ        Energy       Coefficients

                                   1 1s      1 1s      1 1s      1 1s      1 1s      1 3d0     1 3d2+    1 3d0     1 3d2+    1 3d0  
                                   1 3d2+    1 3d0     1 3d2+    1 5g0     1 5g4+    1 5g2+    1 5g0     1 5g4+    1 5g2+ 

   1.1  2.00000    -0.541089     0.999686  0.000857 -0.001197  0.001227 -0.000447  0.000000  0.000000  0.000000  0.000000  0.000000
                                 0.000000  0.000000  0.000000  0.000000  0.000000  0.000000  0.000000  0.000000  0.000000

                                   1 2px     1 2px     1 2px     1 2px     1 2px     1 4f1+    1 4f3+    1 4f1+    1 4f3+    1 4f1+ 
                                   1 4f3+ 

   1.2  1.00000    -0.108601     0.999654  0.000555 -0.000549  0.000026  0.000520  0.000000  0.000000  0.000000  0.000000  0.000000
                                 0.000000

                                   1 2pz     1 2pz     1 2pz     1 2pz     1 2pz     1 4f0     1 4f2+    1 4f0     1 4f2+    1 4f0  
                                   1 4f2+ 

   1.5  1.00000    -0.108601     0.999654  0.000555 -0.000549  0.000026  0.000520  0.000000  0.000000  0.000000  0.000000  0.000000
                                 0.000000

 Natural orbitals saved to record    2200.2 (Orbital set 3)

 Orbital spaces for UNO-CAS (Min. occupation: 0.020  Max. occupation: 1.980):

 Closed:        1   0   0   0   0   0   0   0
 Active:        0   1   0   0   1   0   0   0

 No convergence



 **********************************************************************************************************************************
 DATASETS  * FILE   NREC   LENGTH (MB)   RECORD NAMES
              1      21       22.67       500      610      700      900      950      970     1000      129      960     1100   
                                          VAR    BASINP    GEOM    SYMINP    ZMAT    AOBASIS   BASIS     P2S    ABASIS      S 
                                         1400     1410     1420     1200     1210     1080     1600     1650     1300     1700   
                                         EKIN       V       ECP      H0       H01     AOSYM     SMH    MOLCAS    ERIS     OPER   
                                         1380   
                                         JKOP   

              2       7       10.38       700     1000      520     4202     5202     2101     2200   
                                         GEOM     BASIS   MCVARS     RHF     MCSCF     RHF      UHF  

 PROGRAMS   *        TOTAL       UHF       RHF     MULTI       RHF       INT
 CPU TIMES  *         2.73      0.01      0.02      0.08      0.08      2.41
 REAL TIME  *        15.74 SEC
 DISK USED  *        37.52 MB      
 **********************************************************************************************************************************
 SETTING SCF(I)         =        -3.67860002  AU                              


 PROGRAM * MRCC (General Multireference Coupled Cluster)    Author: M. Kallay, 2000-2005

 ***  Initialisation ***

   0 Spin projections
 
 Molecular orbitals read from record     2200.2  Type=UHF/ALPHA (state 1.6)

 ?Warning: UHF not converged
 Molecular orbitals read from record     2200.2  Type=UHF/BETA (state 1.6)

 ?Warning: UHF not converged
 
 Frozen orbitals:              0 (  0  0  0  0  0  0  0  0)
 Active orbitals:             79 ( 19 11 11  8 11  8  8  3)
 Active electrons:             4
 Spin quantum number:          1.0

 Transformed integrals will be written to file mrcc_59273/fort.55

 Load integrals                2.8 sec
 Transform integrals           3.2 sec
 Storage for integrals:        3835052
 Remaining memory:           *********

 Core energy:               0.00000000
 
 MRCC Input:
     4     0     0     0     3     0     0     6     0     0     0     1     1     0     0     7     0     0   0.000     0   64000
  ex.lev,nsing,ntrip, rest,method,dens,conver,symm, diag, CS ,spatial, HF, ndoub,nacto,nactv, tol, maxex, sacc, freq,  dboc,   mem
  2  0  0  0  0  0  0  0  0  0  0  0  0  0  0  0  0  0  0  1  0  0  0  0  0  0  0  0  0  0  0  0  0  0  0  0  0  0  0  0  0  0  0  0  0  0  0  0  0  1  0  0  0  0  0  0  0  0  0  0  0  0  0  0  0  0  0  0  0  0  0  0  0  0  0  0  0  0  0
 MRCC Input end
 Variable memory released
 MRCC now being run, temporary output in /global/cscratch1/sd/aannabe/mrcc_59273/mrcc.out
 **********************************************************************
                          MRCC program system
 **********************************************************************

                              Written by
  Mihaly Kallay, Zoltan Rolik, Jozsef Csontos, Peter Nagy, Gyula Samu,
      David Mester, Jozsef Csoka, Bernat Szabo, Istvan Ladjanszki,
       Lorant Szegedy, Bence Ladoczki, Klara Petrov, Mate Farkas,
                    Pal D. Mezei, and Bence Hegely

        Department of Physical Chemistry and Materials Science
            Budapest University of Technology and Economics
                  Budapest P.O.Box 91, H-1521 Hungary

                              www.mrcc.hu

                       Release date: May 23, 2018

 ************************ 2018-11-05 13:05:16 *************************
 Executing goldstone...

 Generation of CC equations in terms of H and T...
 Generation of antisymmetrized Goldstone diagrams...
 Number of diagrams in T^1 equations:    15
 Number of diagrams in T^2 equations:    38
 Number of diagrams in T^3 equations:    49
 Number of diagrams in T^4 equations:     5
 Translation of diagrams to factorized equations...
 Optimizing intermediate calculation...
 Number of floating-point operations per iteration step:   7.1953E+09
 Probable CPU time per iteration step (hours):      0.07
 Required memory (Mbytes):    4588.5
 Number of intermediates:                                  80
 Number of intermediates to be stored:                     32
 Length of intermediate file (Mbytes):      77.4

 ************************ 2018-11-05 13:05:17 *************************
 Executing xmrcc...

 **********************************************************************
 CC(3)(4) calculation


 Allocation of4588.5 Mbytes of memory...
 Number of spinorbitals:                   158
 Number of alpha electrons:                        3
 Number of beta electrons:                         1
 Spin multiplicity:                     2
 z-component of spin:  1.0
 Spatial symmetry:                      6
 Convergence criterion:  1.0E-07
 Construction of occupation graphs...
 Number of                     0 -fold excitations:                      1
 Number of                     1 -fold excitations:                     56
 Number of                     2 -fold excitations:                   3491
 Number of                     3 -fold excitations:                  92140
 Total number of configurations:                  95688
 Calculation of coupling coefficients...
 Length of intermediate file (Mbytes):      58.9

 ======================================================================

 Spin case  1   Alpha:  3   Beta:  1
 Number of excitations:                 684122
 Number of                     4 -fold excitations:                 684122

 Memory requirements /Mbyte/:
               Minimal        Optimal
 Real*8:        129.4662       297.2647
 Integer:        21.7145
 Total:         151.1808       318.9792


 ************************ 2018-11-05 13:05:19 *************************
 Executing mrcc...

 **********************************************************************
 CCSDT(Q) calculation


 Allocation of  297.3 Mbytes of memory...
 Number of spinorbitals: 158
 Number of alpha electrons:  3
 Number of beta  electrons:  1
 Spin multiplicity: 2
 z-component of spin:  1.0
 Spatial symmetry: 6
 Convergence criterion:  1.0E-07
 Construction of occupation graphs...
 Number of 0-fold excitations: 1
 Number of 1-fold excitations: 56
 Number of 2-fold excitations: 3491
 Number of 3-fold excitations: 92140
 Total number of determinants: 95688
 Calculation of coupling coefficients...
 Initial cluster amplitudes are generated.
 Length of intermediate file (Mbytes):      58.9
 Reading integral list from unit 55...
 Sorting integrals...
 Sorting integrals...
 Sorting integrals...
 Sorting integrals...
 Energy of reference determinant [au]:      -3.678600016320
 Calculation of MP denominators...

 Starting CC iteration...
 ======================================================================
 Norm of residual vector:     0.36538671
 CPU time [min]:     0.215                   Wall time [min]:     0.242

 Iteration  1  CC energy:    -3.74779681  Energy decrease:   0.06919680
 ======================================================================
 Norm of residual vector:     0.11316547
 CPU time [min]:     0.305                   Wall time [min]:     0.331

 Iteration  2  CC energy:    -3.75971942  Energy decrease:   0.01192260
 ======================================================================
 Norm of residual vector:     0.03656648
 CPU time [min]:     0.395                   Wall time [min]:     0.421

 Iteration  3  CC energy:    -3.76670172  Energy decrease:   0.00698230
 ======================================================================
 Norm of residual vector:     0.01004787
 CPU time [min]:     0.485                   Wall time [min]:     0.512

 Iteration  4  CC energy:    -3.76689312  Energy decrease:   0.00019141
 ======================================================================
 Norm of residual vector:     0.00286168
 CPU time [min]:     0.576                   Wall time [min]:     0.602

 Iteration  5  CC energy:    -3.76706678  Energy decrease:   0.00017365
 ======================================================================
 Norm of residual vector:     0.00092293
 CPU time [min]:     0.667                   Wall time [min]:     0.695

 Iteration  6  CC energy:    -3.76703346  Energy decrease:   0.00003331
 ======================================================================
 Norm of residual vector:     0.00027823
 CPU time [min]:     0.758                   Wall time [min]:     0.786

 Iteration  7  CC energy:    -3.76702859  Energy decrease:   0.00000488
 ======================================================================
 Norm of residual vector:     0.00009335
 CPU time [min]:     0.849                   Wall time [min]:     0.877

 Iteration  8  CC energy:    -3.76703183  Energy decrease:   0.00000324
 ======================================================================
 Norm of residual vector:     0.00003287
 CPU time [min]:     0.940                   Wall time [min]:     0.968

 Iteration  9  CC energy:    -3.76703196  Energy decrease:   0.00000013
 ======================================================================
 Norm of residual vector:     0.00001181
 CPU time [min]:     1.031                   Wall time [min]:     1.059

 Iteration 10  CC energy:    -3.76703157  Energy decrease:   0.00000039
 ======================================================================
 Norm of residual vector:     0.00000408
 CPU time [min]:     1.123                   Wall time [min]:     1.151

 Iteration 11  CC energy:    -3.76703170  Energy decrease:   0.00000013
 ======================================================================
 Norm of residual vector:     0.00000143
 CPU time [min]:     1.214                   Wall time [min]:     1.243

 Iteration 12  CC energy:    -3.76703171  Energy decrease:   0.00000001
 ======================================================================
 Norm of residual vector:     0.00000048
 CPU time [min]:     1.307                   Wall time [min]:     1.337

 Iteration 13  CC energy:    -3.76703169  Energy decrease:   0.00000002
 ======================================================================
 Norm of residual vector:     0.00000015
 CPU time [min]:     1.399                   Wall time [min]:     1.429

 Iteration 14  CC energy:    -3.76703169  Energy decrease:   0.00000001
 ======================================================================
 Norm of residual vector:     0.00000004
 CPU time [min]:     1.488                   Wall time [min]:     1.518

 Iteration 15  CC energy:    -3.76703169  Energy decrease:   1.6952E-10
 ======================================================================

 Iteration has converged in 15 steps.

 Final results:
 Total CCSDT energy [au]:             -3.767031691788
 Total MP2 energy [au]:               -3.747796813972

 Perturbative corrections are calculated...
 ======================================================================
 Spin case  1   Alpha:  3   Beta:  1
 Number of excitations:        684122
 CPU time [min]:     5.769                   Wall time [min]:     5.861
 ======================================================================
 Number of 4-fold excitations: 684122
 CPU time [min]:     5.769                   Wall time [min]:     5.861

 Total CCSDT[Q] energy [au]:          -3.767061538787
 Total CCSDT(Q) energy [au]:          -3.767116816124

 ************************ 2018-11-05 13:11:15 *************************
                      Normal termination of mrcc.
 **********************************************************************
 !CCSDT STATE 1.6 Energy               -3.767031691788
 !MP2 STATE 1.6 Energy                 -3.747796813972
 !CCSDT[Q] STATE 1.6 Energy            -3.767061538787
 !CCSDT(Q) STATE 1.6 Energy            -3.767116816124
 
 CPU-time for MRCC:            346.1 sec
 Elapsed-time for MRCC:        361.7 sec

 Variable memory set to 8000000000 words,  buffer space   230000 words



 **********************************************************************************************************************************
 DATASETS  * FILE   NREC   LENGTH (MB)   RECORD NAMES
              1      21       22.67       500      610      700      900      950      970     1000      129      960     1100   
                                          VAR    BASINP    GEOM    SYMINP    ZMAT    AOBASIS   BASIS     P2S    ABASIS      S 
                                         1400     1410     1420     1200     1210     1080     1600     1650     1300     1700   
                                         EKIN       V       ECP      H0       H01     AOSYM     SMH    MOLCAS    ERIS     OPER   
                                         1380   
                                         JKOP   

              2       7       10.38       700     1000      520     4202     5202     2101     2200   
                                         GEOM     BASIS   MCVARS     RHF     MCSCF     RHF      UHF  

 PROGRAMS   *        TOTAL      MRCC       UHF       RHF     MULTI       RHF       INT
 CPU TIMES  *       358.91    356.17      0.01      0.02      0.08      0.08      2.41
 REAL TIME  *       433.88 SEC
 DISK USED  *        37.52 MB      
 **********************************************************************************************************************************
 SETTING POSTHF(I)      =        -3.76711682  AU                              
                                                                                                                                                                                                                                                                

       SCF           POSTHF       EKIN          POT
    -3.67860002   -3.76711682   1.29866289   -1.93027475
                                                  

 CCSDT(Q)/USERDEF energy=     -3.767116816124

        CCSDT(Q)        RHF-SCF         MULTI           RHF-SCF 
     -3.76711682     -3.67860002     -3.67860002     -3.67867531
 **********************************************************************************************************************************
 Variable memory released
