
 Primary working directories    : /global/cscratch1/sd/aannabe
 Secondary working directories  : /global/cscratch1/sd/aannabe
 Wavefunction directory         : /global/homes/a/aannabe/wfu/
 Main file repository           : /global/cscratch1/sd/aannabe/

 SHA1      : 2873118e99aab1bc19f5b6fc1784693c06d15c95
 NAME      : 2015.1.8
 ARCHNAME  : linux/x86_64
 FC        : /opt/cray/pe/craype/2.5.5/bin/ftn
 BLASLIB   : -Wl,-_start-group /opt/intel/compilers_and_libraries_2016.3.210/linux/mkl/lib/intel64/libmkl_intel_ilp64.a /opt/intel/compilers_and_libraries_2016.3.210/linux/mkl/lib/intel64/libmkl_intel_thread.a /opt/intel/compilers_and_libraries_2016.3.210/linux/mkl/lib/intel64/libmkl_core.a -Wl,-_end-group
 id        : lbl

 Nodes     nprocs
 nid00458     1

 Using customized tuning parameters: mindgm=8; mindgv=16; mindgc=4; mindgr=1; noblas=0; minvec=7
 default implementation of scratch files=df  

 ***,Si
 memory,8,g
 gthresh,twoint=1.e-12
 
 gprint,basis,orbitals
 gexpec,ekin,pot
 
 angstrom
 geometry={
 1                                                                               ! Number of atoms
 Si 0.0 0.0 0.0
 }
 
 basis={
 Including file /global/homes/a/aannabe/docs/accurate/BFD_Kh/pps/Si.pp
 Including file /global/homes/a/aannabe/docs/accurate/BFD_Kh/basis/aug-cc-pVnZ/Si_6z.basis
 }
 
 {rhf
  start,atden
  wf,4,6,2
  occ,1,1,0,0,1,0,0,0
  open,1.2,1.5
  save,4202.2
 }
 {multi
  start,4202.2
  occ,1,1,1,0,1,0,0
  closed,1,0,0,0,0,0,0,0
  wf,4,4,2;state,1
  wf,4,6,2;state,1
  wf,4,7,2;state,1
  natorb,ci,print
  orbital,5202.2
 }
 {rhf,nitord=1,maxit=0
  start,5202.2
  wf,4,6,2
  occ,1,1,0,0,1,0,0,0
  open,1.2,1.5
 }
 scf(i)=energy
 
 _CC_NORM_MAX=2.0
  !NOTE: Perturbative MRCC works only with UHF reference. So, here we will trick MRCC by doing zero UHF iteration right after ROHF.
 
 {uhf
 maxit,0
 }
 scf(i)=energy
 
 {mrcc,method=CCSDT(Q)
 orbital,ignore_error=1                                                          !Ignore the fact that UHF WF is not converged
 maxit,100
 core
 }
 posthf(i)=energy
 
 table,scf,posthf,ekin,pot
 save,6.csv,new
 
 

 Variables initialized (889), CPU time= 0.00 sec
 Commands  initialized (702), CPU time= 0.01 sec, 572 directives.
 Default parameters read. Elapsed time= 0.19 sec

 Checking input...
 Passed
1


                                         ***  PROGRAM SYSTEM MOLPRO  ***
                                       Copyright, TTI GmbH Stuttgart, 2015
                                    Version 2015.1 linked Sep  7 2016 23:09:38


 **********************************************************************************************************************************
 LABEL *   Si                                                                            
  64 bit serial version                                                                  DATE: 05-Nov-18          TIME: 14:08:59  
 **********************************************************************************************************************************

 SHA1:             2873118e99aab1bc19f5b6fc1784693c06d15c95
 **********************************************************************************************************************************

 THRESHOLDS:

 ZERO    =  1.00D-12  ONEINT  =  1.00D-12  TWOINT  =  1.00D-12  PREFAC  =  1.00D-14  LOCALI  =  1.00D-09  EORDER  =  1.00D-04
 ENERGY  =  0.00D+00  ETEST   =  0.00D+00  EDENS   =  0.00D+00  THRDEDEF=  1.00D-06  GRADIENT=  1.00D-02  STEP    =  1.00D-03
 ORBITAL =  1.00D-05  CIVEC   =  1.00D-05  COEFF   =  1.00D-04  PRINTCI =  5.00D-02  PUNCHCI =  9.90D+01  OPTGRAD =  3.00D-04
 OPTENERG=  1.00D-06  OPTSTEP =  3.00D-04  THRGRAD =  1.00D-10  COMPRESS=  1.00D-11  VARMIN  =  1.00D-07  VARMAX  =  1.00D-03
 THRDOUB =  0.00D+00  THRDIV  =  1.00D-05  THRRED  =  1.00D-07  THRPSP  =  1.00D+00  THRDC   =  1.00D-10  THRCS   =  1.00D-10
 THRNRM  =  1.00D-08  THREQ   =  0.00D+00  THRDE   =  1.00D+00  THRREF  =  1.00D-05  SPARFAC =  1.00D+00  THRDLP  =  1.00D-07
 THRDIA  =  1.00D-10  THRDLS  =  1.00D-07  THRGPS  =  0.00D+00  THRKEX  =  0.00D+00  THRDIS  =  2.00D-01  THRVAR  =  1.00D-10
 THRLOC  =  1.00D-06  THRGAP  =  1.00D-06  THRLOCT = -1.00D+00  THRGAPT = -1.00D+00  THRORB  =  1.00D-06  THRMLTP =  0.00D+00
 THRCPQCI=  1.00D-10  KEXTA   =  0.00D+00  THRCOARS=  0.00D+00  SYMTOL  =  1.00D-06  GRADTOL =  1.00D-06  THROVL  =  1.00D-08
 THRORTH =  1.00D-08  GRID    =  1.00D-06  GRIDMAX =  1.00D-03  DTMAX   =  0.00D+00  THROCCDE=  1.00D-01  THROCCDE=  1.00D-01



 ZUNIT=ANG
 

Geometry recognized as XYZ


 Variable memory set to 8000000000 words,  buffer space   230000 words

 SETTING BASIS          =    USERDEF


 Recomputing integrals since basis changed


 Using spherical harmonics



 PROGRAM * SEWARD (Integral evaluation for generally contracted gaussian basis sets)     Author: Roland Lindh, 1990

 Geometry written to block  1 of record 700

 Orientation using atomic masses  
 Molecule type: Atom
 Symmetry elements: X,Y,Z
 Rotational constants:       0.0000000      0.0000000      0.0000000 GHz  (calculated with average atomic masses)

 Point group  D2h 



 ATOMIC COORDINATES

 NR  ATOM    CHARGE       X              Y              Z

   1  SI      4.00    0.000000000    0.000000000    0.000000000


          SI  CORE POTENTIAL

          d POTENTIAL

 POWERS             1              3              2
 EXPONENTIALS   1.807211       9.996331       2.500432    
 COEFFICIENTS   4.000000       7.228842      -13.06726    

          s - d POTENTIAL

 POWERS             2
 EXPONENTIALS   2.266864    
 COEFFICIENTS   21.20532    

          p - d POTENTIAL

 POWERS             2
 EXPONENTIALS   2.116597    
 COEFFICIENTS   15.43694    


 BASIS DATA

   Nr Sym  Nuc  Type         Exponents   Contraction coefficients

    1.1 Ag    1  1s           0.059887     0.167492
                              0.130108     0.532550
                              0.282668     0.464290
                              0.614115    -0.002322
                              1.334205    -0.268234
                              2.898645     0.031921
                              6.297493    -0.000106
                             13.681707    -0.000145
                             29.724387     0.000067
    2.1 Ag    1  1s           0.027441     1.000000
    3.1 Ag    1  1s           0.068603     1.000000
    4.1 Ag    1  1s           0.164269     1.000000
    5.1 Ag    1  1s           0.312954     1.000000
    6.1 Ag    1  1s           0.670935     1.000000
    7.1 Ag    1  1s           1.614307     1.000000
    8.1 Ag    1  3d0          0.039668     1.000000
    9.1 Ag    1  3d2+         0.039668     1.000000
   10.1 Ag    1  3d0          0.099170     1.000000
   11.1 Ag    1  3d2+         0.099170     1.000000
   12.1 Ag    1  3d0          0.239301     1.000000
   13.1 Ag    1  3d2+         0.239301     1.000000
   14.1 Ag    1  3d0          0.504435     1.000000
   15.1 Ag    1  3d2+         0.504435     1.000000
   16.1 Ag    1  3d0          0.816019     1.000000
   17.1 Ag    1  3d2+         0.816019     1.000000
   18.1 Ag    1  3d0          2.283872     1.000000
   19.1 Ag    1  3d2+         2.283872     1.000000
   20.1 Ag    1  5g0          0.104255     1.000000
   21.1 Ag    1  5g4+         0.104255     1.000000
   22.1 Ag    1  5g2+         0.104255     1.000000
   23.1 Ag    1  5g0          0.260637     1.000000
   24.1 Ag    1  5g4+         0.260637     1.000000
   25.1 Ag    1  5g2+         0.260637     1.000000
   26.1 Ag    1  5g0          0.597946     1.000000
   27.1 Ag    1  5g4+         0.597946     1.000000
   28.1 Ag    1  5g2+         0.597946     1.000000
   29.1 Ag    1  5g0          0.882350     1.000000
   30.1 Ag    1  5g4+         0.882350     1.000000
   31.1 Ag    1  5g2+         0.882350     1.000000
   32.1 Ag    1  7i6+         0.274326     1.000000
   33.1 Ag    1  7i4+         0.274326     1.000000
   34.1 Ag    1  7i2+         0.274326     1.000000
   35.1 Ag    1  7i0          0.274326     1.000000
   36.1 Ag    1  7i6+         0.685814     1.000000
   37.1 Ag    1  7i4+         0.685814     1.000000
   38.1 Ag    1  7i2+         0.685814     1.000000
   39.1 Ag    1  7i0          0.685814     1.000000
    1.2 B3u   1  2px          0.036525     0.078761
                              0.076137     0.308331
                              0.158712     0.417773
                              0.330843     0.281676
                              0.689658     0.069876
                              1.437625    -0.056306
                              2.996797     0.000744
                              6.246966    -0.000259
                             13.022097    -0.000022
    2.2 B3u   1  2px          0.017810     1.000000
    3.2 B3u   1  2px          0.044525     1.000000
    4.2 B3u   1  2px          0.102044     1.000000
    5.2 B3u   1  2px          0.231240     1.000000
    6.2 B3u   1  2px          0.438270     1.000000
    7.2 B3u   1  2px          0.901754     1.000000
    8.2 B3u   1  4f1+         0.055806     1.000000
    9.2 B3u   1  4f3+         0.055806     1.000000
   10.2 B3u   1  4f1+         0.139516     1.000000
   11.2 B3u   1  4f3+         0.139516     1.000000
   12.2 B3u   1  4f1+         0.328079     1.000000
   13.2 B3u   1  4f3+         0.328079     1.000000
   14.2 B3u   1  4f1+         0.656421     1.000000
   15.2 B3u   1  4f3+         0.656421     1.000000
   16.2 B3u   1  4f1+         0.873588     1.000000
   17.2 B3u   1  4f3+         0.873588     1.000000
   18.2 B3u   1  6h1+         0.168037     1.000000
   19.2 B3u   1  6h3+         0.168037     1.000000
   20.2 B3u   1  6h5+         0.168037     1.000000
   21.2 B3u   1  6h1+         0.420092     1.000000
   22.2 B3u   1  6h3+         0.420092     1.000000
   23.2 B3u   1  6h5+         0.420092     1.000000
   24.2 B3u   1  6h1+         0.844317     1.000000
   25.2 B3u   1  6h3+         0.844317     1.000000
   26.2 B3u   1  6h5+         0.844317     1.000000
    1.3 B2u   1  2py          0.036525     0.078761
                              0.076137     0.308331
                              0.158712     0.417773
                              0.330843     0.281676
                              0.689658     0.069876
                              1.437625    -0.056306
                              2.996797     0.000744
                              6.246966    -0.000259
                             13.022097    -0.000022
    2.3 B2u   1  2py          0.017810     1.000000
    3.3 B2u   1  2py          0.044525     1.000000
    4.3 B2u   1  2py          0.102044     1.000000
    5.3 B2u   1  2py          0.231240     1.000000
    6.3 B2u   1  2py          0.438270     1.000000
    7.3 B2u   1  2py          0.901754     1.000000
    8.3 B2u   1  4f1-         0.055806     1.000000
    9.3 B2u   1  4f3-         0.055806     1.000000
   10.3 B2u   1  4f1-         0.139516     1.000000
   11.3 B2u   1  4f3-         0.139516     1.000000
   12.3 B2u   1  4f1-         0.328079     1.000000
   13.3 B2u   1  4f3-         0.328079     1.000000
   14.3 B2u   1  4f1-         0.656421     1.000000
   15.3 B2u   1  4f3-         0.656421     1.000000
   16.3 B2u   1  4f1-         0.873588     1.000000
   17.3 B2u   1  4f3-         0.873588     1.000000
   18.3 B2u   1  6h1-         0.168037     1.000000
   19.3 B2u   1  6h3-         0.168037     1.000000
   20.3 B2u   1  6h5-         0.168037     1.000000
   21.3 B2u   1  6h1-         0.420092     1.000000
   22.3 B2u   1  6h3-         0.420092     1.000000
   23.3 B2u   1  6h5-         0.420092     1.000000
   24.3 B2u   1  6h1-         0.844317     1.000000
   25.3 B2u   1  6h3-         0.844317     1.000000
   26.3 B2u   1  6h5-         0.844317     1.000000
    1.4 B1g   1  3d2-         0.039668     1.000000
    2.4 B1g   1  3d2-         0.099170     1.000000
    3.4 B1g   1  3d2-         0.239301     1.000000
    4.4 B1g   1  3d2-         0.504435     1.000000
    5.4 B1g   1  3d2-         0.816019     1.000000
    6.4 B1g   1  3d2-         2.283872     1.000000
    7.4 B1g   1  5g2-         0.104255     1.000000
    8.4 B1g   1  5g4-         0.104255     1.000000
    9.4 B1g   1  5g2-         0.260637     1.000000
   10.4 B1g   1  5g4-         0.260637     1.000000
   11.4 B1g   1  5g2-         0.597946     1.000000
   12.4 B1g   1  5g4-         0.597946     1.000000
   13.4 B1g   1  5g2-         0.882350     1.000000
   14.4 B1g   1  5g4-         0.882350     1.000000
   15.4 B1g   1  7i2-         0.274326     1.000000
   16.4 B1g   1  7i6-         0.274326     1.000000
   17.4 B1g   1  7i4-         0.274326     1.000000
   18.4 B1g   1  7i2-         0.685814     1.000000
   19.4 B1g   1  7i6-         0.685814     1.000000
   20.4 B1g   1  7i4-         0.685814     1.000000
    1.5 B1u   1  2pz          0.036525     0.078761
                              0.076137     0.308331
                              0.158712     0.417773
                              0.330843     0.281676
                              0.689658     0.069876
                              1.437625    -0.056306
                              2.996797     0.000744
                              6.246966    -0.000259
                             13.022097    -0.000022
    2.5 B1u   1  2pz          0.017810     1.000000
    3.5 B1u   1  2pz          0.044525     1.000000
    4.5 B1u   1  2pz          0.102044     1.000000
    5.5 B1u   1  2pz          0.231240     1.000000
    6.5 B1u   1  2pz          0.438270     1.000000
    7.5 B1u   1  2pz          0.901754     1.000000
    8.5 B1u   1  4f0          0.055806     1.000000
    9.5 B1u   1  4f2+         0.055806     1.000000
   10.5 B1u   1  4f0          0.139516     1.000000
   11.5 B1u   1  4f2+         0.139516     1.000000
   12.5 B1u   1  4f0          0.328079     1.000000
   13.5 B1u   1  4f2+         0.328079     1.000000
   14.5 B1u   1  4f0          0.656421     1.000000
   15.5 B1u   1  4f2+         0.656421     1.000000
   16.5 B1u   1  4f0          0.873588     1.000000
   17.5 B1u   1  4f2+         0.873588     1.000000
   18.5 B1u   1  6h2+         0.168037     1.000000
   19.5 B1u   1  6h4+         0.168037     1.000000
   20.5 B1u   1  6h0          0.168037     1.000000
   21.5 B1u   1  6h2+         0.420092     1.000000
   22.5 B1u   1  6h4+         0.420092     1.000000
   23.5 B1u   1  6h0          0.420092     1.000000
   24.5 B1u   1  6h2+         0.844317     1.000000
   25.5 B1u   1  6h4+         0.844317     1.000000
   26.5 B1u   1  6h0          0.844317     1.000000
    1.6 B2g   1  3d1+         0.039668     1.000000
    2.6 B2g   1  3d1+         0.099170     1.000000
    3.6 B2g   1  3d1+         0.239301     1.000000
    4.6 B2g   1  3d1+         0.504435     1.000000
    5.6 B2g   1  3d1+         0.816019     1.000000
    6.6 B2g   1  3d1+         2.283872     1.000000
    7.6 B2g   1  5g1+         0.104255     1.000000
    8.6 B2g   1  5g3+         0.104255     1.000000
    9.6 B2g   1  5g1+         0.260637     1.000000
   10.6 B2g   1  5g3+         0.260637     1.000000
   11.6 B2g   1  5g1+         0.597946     1.000000
   12.6 B2g   1  5g3+         0.597946     1.000000
   13.6 B2g   1  5g1+         0.882350     1.000000
   14.6 B2g   1  5g3+         0.882350     1.000000
   15.6 B2g   1  7i5+         0.274326     1.000000
   16.6 B2g   1  7i3+         0.274326     1.000000
   17.6 B2g   1  7i1+         0.274326     1.000000
   18.6 B2g   1  7i5+         0.685814     1.000000
   19.6 B2g   1  7i3+         0.685814     1.000000
   20.6 B2g   1  7i1+         0.685814     1.000000
    1.7 B3g   1  3d1-         0.039668     1.000000
    2.7 B3g   1  3d1-         0.099170     1.000000
    3.7 B3g   1  3d1-         0.239301     1.000000
    4.7 B3g   1  3d1-         0.504435     1.000000
    5.7 B3g   1  3d1-         0.816019     1.000000
    6.7 B3g   1  3d1-         2.283872     1.000000
    7.7 B3g   1  5g1-         0.104255     1.000000
    8.7 B3g   1  5g3-         0.104255     1.000000
    9.7 B3g   1  5g1-         0.260637     1.000000
   10.7 B3g   1  5g3-         0.260637     1.000000
   11.7 B3g   1  5g1-         0.597946     1.000000
   12.7 B3g   1  5g3-         0.597946     1.000000
   13.7 B3g   1  5g1-         0.882350     1.000000
   14.7 B3g   1  5g3-         0.882350     1.000000
   15.7 B3g   1  7i5-         0.274326     1.000000
   16.7 B3g   1  7i3-         0.274326     1.000000
   17.7 B3g   1  7i1-         0.274326     1.000000
   18.7 B3g   1  7i5-         0.685814     1.000000
   19.7 B3g   1  7i3-         0.685814     1.000000
   20.7 B3g   1  7i1-         0.685814     1.000000
    1.8 Au    1  4f2-         0.055806     1.000000
    2.8 Au    1  4f2-         0.139516     1.000000
    3.8 Au    1  4f2-         0.328079     1.000000
    4.8 Au    1  4f2-         0.656421     1.000000
    5.8 Au    1  4f2-         0.873588     1.000000
    6.8 Au    1  6h4-         0.168037     1.000000
    7.8 Au    1  6h2-         0.168037     1.000000
    8.8 Au    1  6h4-         0.420092     1.000000
    9.8 Au    1  6h2-         0.420092     1.000000
   10.8 Au    1  6h4-         0.844317     1.000000
   11.8 Au    1  6h2-         0.844317     1.000000

 NUCLEAR CHARGE:                    4
 NUMBER OF PRIMITIVE AOS:         325
 NUMBER OF SYMMETRY AOS:          220
 NUMBER OF CONTRACTIONS:          188   (  39Ag  +  26B3u +  26B2u +  20B1g +  26B1u +  20B2g +  20B3g +  11Au  )
 NUMBER OF CORE ORBITALS:           0   (   0Ag  +   0B3u +   0B2u +   0B1g +   0B1u +   0B2g +   0B3g +   0Au  )
 NUMBER OF VALENCE ORBITALS:        4   (   1Ag  +   1B3u +   1B2u +   0B1g +   1B1u +   0B2g +   0B3g +   0Au  )


 NUCLEAR REPULSION ENERGY    0.00000000

 EXTRA SYMMETRY OF AOS IN SYMMETRY 1:   1 1 1 1 1 1 1 2 3 2   3 2 3 2 3 2 3 2 3 4   5 6 4 5 6 4 5 6 4 5   6 7 8 910 7 8 910
 EXTRA SYMMETRY OF AOS IN SYMMETRY 2:   1 1 1 1 1 1 1 2 3 2   3 2 3 2 3 2 3 4 5 6   4 5 6 4 5 6
 EXTRA SYMMETRY OF AOS IN SYMMETRY 3:   1 1 1 1 1 1 1 2 3 2   3 2 3 2 3 2 3 4 5 6   4 5 6 4 5 6
 EXTRA SYMMETRY OF AOS IN SYMMETRY 4:   1 1 1 1 1 1 2 3 2 3   2 3 2 3 4 5 6 4 5 6
 EXTRA SYMMETRY OF AOS IN SYMMETRY 5:   1 1 1 1 1 1 1 2 3 2   3 2 3 2 3 2 3 4 5 6   4 5 6 4 5 6
 EXTRA SYMMETRY OF AOS IN SYMMETRY 6:   1 1 1 1 1 1 2 3 2 3   2 3 2 3 4 5 6 4 5 6
 EXTRA SYMMETRY OF AOS IN SYMMETRY 7:   1 1 1 1 1 1 2 3 2 3   2 3 2 3 4 5 6 4 5 6
 EXTRA SYMMETRY OF AOS IN SYMMETRY 8:   1 1 1 1 1 2 3 2 3 2   3

 Eigenvalues of metric

         1 0.833E-04 0.189E-02 0.108E-01 0.108E-01 0.199E-01 0.431E-01 0.431E-01 0.431E-01
         2 0.838E-04 0.642E-02 0.996E-02 0.996E-02 0.415E-01 0.125E+00 0.125E+00 0.187E+00
         3 0.838E-04 0.642E-02 0.996E-02 0.996E-02 0.415E-01 0.125E+00 0.125E+00 0.187E+00
         4 0.108E-01 0.431E-01 0.431E-01 0.890E-01 0.337E+00 0.346E+00 0.346E+00 0.533E+00
         5 0.838E-04 0.642E-02 0.996E-02 0.996E-02 0.415E-01 0.125E+00 0.125E+00 0.187E+00
         6 0.108E-01 0.431E-01 0.431E-01 0.890E-01 0.337E+00 0.346E+00 0.346E+00 0.533E+00
         7 0.108E-01 0.431E-01 0.431E-01 0.890E-01 0.337E+00 0.346E+00 0.346E+00 0.533E+00
         8 0.996E-02 0.125E+00 0.214E+00 0.214E+00 0.509E+00 0.859E+00 0.859E+00 0.148E+01


 Contracted 2-electron integrals neglected if value below      1.0D-12
 AO integral compression algorithm  1   Integral accuracy      1.0D-12

     115.606 MB (compressed) written to integral file ( 45.6%)


 NUMBER OF SORTED TWO-ELECTRON INTEGRALS:   20212815.     BUFFER LENGTH:  32768
 NUMBER OF SEGMENTS:   2  SEGMENT LENGTH:   15998787      RECORD LENGTH: 524288

 Memory used in sort:      16.56 MW

 SORT1 READ    31710950. AND WROTE    13213985. INTEGRALS IN     39 RECORDS. CPU TIME:     1.11 SEC, REAL TIME:     1.47 SEC
 SORT2 READ    13213985. AND WROTE    20212815. INTEGRALS IN    441 RECORDS. CPU TIME:     0.59 SEC, REAL TIME:     1.13 SEC

 FILE SIZES:   FILE 1:   135.5 MBYTE,  FILE 4:   163.6 MBYTE,   TOTAL:    299.1 MBYTE

 OPERATOR DM      FOR CENTER  0  COORDINATES:    0.000000    0.000000    0.000000
 OPERATOR EKIN    FOR CENTER  0  COORDINATES:    0.000000    0.000000    0.000000
 OPERATOR POT     FOR CENTER  0  COORDINATES:    0.000000    0.000000    0.000000


 **********************************************************************************************************************************
 DATASETS  * FILE   NREC   LENGTH (MB)   RECORD NAMES
              1      20       94.39       500      610      700      900      950      970     1000      129      960     1100   
                                          VAR    BASINP    GEOM    SYMINP    ZMAT    AOBASIS   BASIS     P2S    ABASIS      S 
                                         1400     1410     1420     1200     1210     1080     1600     1650     1300     1700   
                                         EKIN       V       ECP      H0       H01     AOSYM     SMH    MOLCAS    ERIS     OPER   

 PROGRAMS   *        TOTAL       INT
 CPU TIMES  *         9.01      8.87
 REAL TIME  *        21.83 SEC
 DISK USED  *       299.45 MB      
 **********************************************************************************************************************************


 PROGRAM * RHF-SCF (OPEN SHELL)       Authors: W. Meyer, H.-J. Werner


 NUMBER OF ELECTRONS:       3+    1-    SPACE SYMMETRY=6    SPIN SYMMETRY: Triplet 
 CONVERGENCE THRESHOLDS:    1.00E-05 (Density)    1.00E-07 (Energy)
 MAX. NUMBER OF ITERATIONS:       60
 INTERPOLATION TYPE:            DIIS
 INTERPOLATION STEPS:              2 (START)      1 (STEP)
 LEVEL SHIFTS:                 -0.60 (CLOSED) -0.30 (OPEN) 


 Singly occupied orbitals:      1.2       1.5

   Atom=SI basis=ECP10MWB_GUESS    lmin=0  lmax=1

 Orbital guess generated from atomic densities. Full valence occupancy:    1   1   1   0   1   0   0   0


 Molecular orbital dump at record        4202.2

 ITERATION    DDIFF          GRAD             ENERGY        2-EL.EN.            DIPOLE MOMENTS         DIIS   ORB.
    1      0.000D+00      0.000D+00        -3.66684687      3.785631    0.00000    0.00000    0.00000    0    start
    2      0.000D+00      0.415D-02        -3.67492361      3.895866    0.00000    0.00000    0.00000    1    diag,B
    3      0.383D-02      0.185D-02        -3.67798779      3.972532    0.00000    0.00000    0.00000    2    diag,B
    4      0.256D-02      0.802D-03        -3.67864587      4.002935    0.00000    0.00000    0.00000    3    diag,B
    5      0.147D-02      0.218D-03        -3.67867407      4.004465    0.00000    0.00000    0.00000    4    diag,B
    6      0.355D-03      0.571D-04        -3.67867571      4.004956    0.00000    0.00000    0.00000    5    diag,B
    7      0.194D-03      0.136D-04        -3.67867577      4.004746    0.00000    0.00000    0.00000    6    fixocc
    8      0.728D-04      0.364D-05        -3.67867577      4.004775    0.00000    0.00000    0.00000    7    diag,B
    9      0.885D-05      0.127D-05        -3.67867577      4.004769    0.00000    0.00000    0.00000    0    orth

 Final alpha occupancy:   1   1   0   0   1   0   0   0
 Final beta  occupancy:   1   0   0   0   0   0   0   0

 !RHF STATE 1.6 Energy                 -3.678675772139
 Nuclear energy                         0.00000000
 One-electron energy                   -5.68106042
 Two-electron energy                    2.00238464
 Virial quotient                       -2.83261655
 !RHF STATE 1.6 Dipole moment           0.00000000     0.00000000     0.00000000
 Dipole moment /Debye                   0.00000000     0.00000000     0.00000000
 

 !RHF expec          <1.6|EKIN|1.6>     1.298684701245
 
 !RHF expec           <1.6|POT|1.6>    -1.930267395140

 ELECTRON ORBITALS
 =================


   Orb  Occ    Energy  Couls-En    Coefficients

                                   1 1s      1 1s      1 1s      1 1s      1 1s      1 1s      1 1s      1 3d0     1 3d2+    1 3d0  
                                   1 3d2+    1 3d0     1 3d2+    1 3d0     1 3d2+    1 3d0     1 3d2+    1 3d0     1 3d2+    1 5g0  
                                   1 5g4+    1 5g2+    1 5g0     1 5g4+    1 5g2+    1 5g0     1 5g4+    1 5g2+    1 5g0     1 5g4+ 
                                   1 5g2+    1 7i6+    1 7i4+    1 7i2+    1 7i0     1 7i6+    1 7i4+    1 7i2+    1 7i0  

   1.1   2    -0.5411   -2.1419  1.002099  0.001422 -0.003467  0.001980 -0.002953  0.001132  0.000113  0.000593  0.001026  0.003357
                                 0.005814  0.000659  0.001142 -0.000833 -0.001443  0.000571  0.000989  0.000103  0.000178 -0.000021
                                -0.000041 -0.000031 -0.000022 -0.000043 -0.000032  0.000003  0.000007  0.000005 -0.000003 -0.000005
                                -0.000004  0.000000  0.000000  0.000000  0.000000  0.000000  0.000000  0.000000  0.000000

                                   1 2px     1 2px     1 2px     1 2px     1 2px     1 2px     1 2px     1 4f1+    1 4f3+    1 4f1+ 
                                   1 4f3+    1 4f1+    1 4f3+    1 4f1+    1 4f3+    1 4f1+    1 4f3+    1 6h1+    1 6h3+    1 6h5+ 
                                   1 6h1+    1 6h3+    1 6h5+    1 6h1+    1 6h3+    1 6h5+ 

   1.2   +    -0.2970   -1.5368  0.997875  0.000990 -0.001092  0.002284 -0.000328  0.001031 -0.000264  0.000019  0.000073  0.000008
                                 0.000030 -0.000029 -0.000113 -0.000004 -0.000014 -0.000001 -0.000002 -0.000000 -0.000001 -0.000002
                                -0.000000 -0.000000 -0.000000  0.000000  0.000000  0.000000

                                   1 2pz     1 2pz     1 2pz     1 2pz     1 2pz     1 2pz     1 2pz     1 4f0     1 4f2+    1 4f0  
                                   1 4f2+    1 4f0     1 4f2+    1 4f0     1 4f2+    1 4f0     1 4f2+    1 6h2+    1 6h4+    1 6h0  
                                   1 6h2+    1 6h4+    1 6h0     1 6h2+    1 6h4+    1 6h0  

   1.5   +    -0.2970   -1.5368  0.997875  0.000990 -0.001092  0.002284 -0.000328  0.001031 -0.000264  0.000046  0.000060  0.000019
                                 0.000025 -0.000072 -0.000092 -0.000009 -0.000011 -0.000001 -0.000002 -0.000001 -0.000001 -0.000001
                                -0.000000 -0.000000 -0.000000  0.000000  0.000000  0.000000

 HOMO      1.2    -0.297006 =      -8.0819eV
 LUMO      1.3    -0.017136 =      -0.4663eV
 LUMO-HOMO         0.279870 =       7.6157eV


 **********************************************************************************************************************************
 DATASETS  * FILE   NREC   LENGTH (MB)   RECORD NAMES
              1      20       94.39       500      610      700      900      950      970     1000      129      960     1100   
                                          VAR    BASINP    GEOM    SYMINP    ZMAT    AOBASIS   BASIS     P2S    ABASIS      S 
                                         1400     1410     1420     1200     1210     1080     1600     1650     1300     1700   
                                         EKIN       V       ECP      H0       H01     AOSYM     SMH    MOLCAS    ERIS     OPER   

              2       4        2.92       700     1000      520     4202   
                                         GEOM     BASIS   MCVARS     RHF  

 PROGRAMS   *        TOTAL       RHF       INT
 CPU TIMES  *         9.69      0.69      8.87
 REAL TIME  *        22.71 SEC
 DISK USED  *       299.45 MB      
 **********************************************************************************************************************************


 PROGRAM * MULTI (Direct Multiconfiguration SCF)       Authors: P.J. Knowles, H.-J. Werner (1984)     S.T. Elbert (1988)


 Number of closed-shell orbitals:   1 (   1   0   0   0   0   0   0   0 )
 Number of active  orbitals:        3 (   0   1   1   0   1   0   0   0 )
 Number of external orbitals:     184 (  38  25  25  20  25  20  20  11 )

 State symmetry 1

 Number of electrons:     2    Spin symmetry=Triplet   Space symmetry=4
 Number of states:        1
 Number of CSFs:          1   (1 determinants, 3 intermediate states)

 State symmetry 2

 Number of electrons:     2    Spin symmetry=Triplet   Space symmetry=6
 Number of states:        1
 Number of CSFs:          1   (1 determinants, 3 intermediate states)

 State symmetry 3

 Number of electrons:     2    Spin symmetry=Triplet   Space symmetry=7
 Number of states:        1
 Number of CSFs:          1   (1 determinants, 3 intermediate states)

 Molecular orbitals read from record     4202.2  Type=RHF/CANONICAL (state 1.6)
 *** IN SYMMETRY 1 ORBITAL  1 SYMMETRY CONTAMINATION OF 0.164D-01 HAS BEEN REMOVED

 EXTRA SYMMETRY OF MOS IN SYMMETRY 1:   1 1 3 2 1 2 3 5 4 6   2 3 1 5 4 6 3 2 7 9   810 1 5 4 6 3 2 7 9   810 5 4 6 1 3 2 1
 *** IN SYMMETRY 2 ORBITAL  1 SYMMETRY CONTAMINATION OF 0.295D-03 HAS BEEN REMOVED
 EXTRA SYMMETRY OF MOS IN SYMMETRY 2:   1 1 1 3 2 1 3 2 6 5   4 3 2 1 6 5 4 3 2 1   3 2 6 5 4 1
 *** IN SYMMETRY 3 ORBITAL  1 SYMMETRY CONTAMINATION OF 0.768D-02 HAS BEEN REMOVED
 EXTRA SYMMETRY OF MOS IN SYMMETRY 3:   1 1 1 3 2 1 3 2 6 4   5 3 2 1 6 4 5 3 2 1   3 2 6 4 5 1
 EXTRA SYMMETRY OF MOS IN SYMMETRY 4:   1 1 3 2 1 3 2 1 5 6   4 3 2 1 5 6 4 3 2 1
 *** IN SYMMETRY 5 ORBITAL  1 SYMMETRY CONTAMINATION OF 0.340D-03 HAS BEEN REMOVED
 EXTRA SYMMETRY OF MOS IN SYMMETRY 5:   1 1 1 3 2 1 3 2 4 5   6 3 2 1 4 5 6 3 2 1   3 2 4 5 6 1
 EXTRA SYMMETRY OF MOS IN SYMMETRY 6:   1 1 3 2 1 3 2 1 4 5   6 3 2 1 4 5 6 3 2 1
 EXTRA SYMMETRY OF MOS IN SYMMETRY 7:   1 1 2 3 1 2 3 1 6 4   5 2 3 1 6 4 5 2 3 1
 EXTRA SYMMETRY OF MOS IN SYMMETRY 8:   1 1 2 3 1 2 3 1 1 2   3

 Wavefunction dump at record             5202.2

 Convergence thresholds  0.10E-01 (gradient)  0.10E-05 (energy)  0.10E-02 (step length)

 Weight factors for state symmetry  1:    0.33333
 Weight factors for state symmetry  2:    0.33333
 Weight factors for state symmetry  3:    0.33333

 Number of orbital rotations:      113   (     0 Core/Active     38 Core/Virtual   0 Active/Active     75 Active/Virtual)
 Total number of variables:        116


 ITER. MIC  NCI  NEG     ENERGY(VAR)     ENERGY(PROJ)   ENERGY CHANGE     GRAD(0)  GRAD(ORB)   GRAD(CI)     STEP       TIME

   1   20   12    0      -3.66011395      -3.67861036   -0.01849640    0.05746793 0.00000000 0.00000000  0.34D+00      0.17
   2   15   12    0      -3.67858992      -3.67860025   -0.00001033    0.00312000 0.00000000 0.00000000  0.55D-02      0.35
   3   15   12    0      -3.67860026      -3.67860026   -0.00000000    0.00000369 0.00000000 0.00000000  0.50D-05      0.52

 ** WVFN ****  CONVERGENCE REACHED, FINAL GRADIENT:  0.47D-11



 Results for state 1.4
 =====================

 !MCSCF STATE 1.4 Energy               -3.678600256584
 Nuclear energy                         0.00000000
 Kinetic energy                         1.29866035
 One electron energy                   -5.68115973
 Two electron energy                    2.00255947
 Virial ratio                           3.83261152

 !MCSCF STATE 1.4 Dipole moment         0.00000000     0.00000000     0.00000000
 Dipole moment /Debye                   0.00000000     0.00000000     0.00000000



 Results for state 1.6
 =====================

 !MCSCF STATE 1.6 Energy               -3.678600256584
 Nuclear energy                         0.00000000
 Kinetic energy                         1.29866035
 One electron energy                   -5.68115973
 Two electron energy                    2.00255947
 Virial ratio                           3.83261152

 !MCSCF STATE 1.6 Dipole moment         0.00000000     0.00000000     0.00000000
 Dipole moment /Debye                   0.00000000     0.00000000     0.00000000



 Results for state 1.7
 =====================

 !MCSCF STATE 1.7 Energy               -3.678600256584
 Nuclear energy                         0.00000000
 Kinetic energy                         1.29866035
 One electron energy                   -5.68115973
 Two electron energy                    2.00255947
 Virial ratio                           3.83261152

 !MCSCF STATE 1.7 Dipole moment         0.00000000     0.00000000     0.00000000
 Dipole moment /Debye                   0.00000000     0.00000000     0.00000000

 State-averaged charge density matrix saved on record  5202.2 (density set 1)

 !MCSCF expec        <1.4|EKIN|1.4>     1.298660346241
 !MCSCF expec        <1.6|EKIN|1.6>     1.298660346243
 !MCSCF expec        <1.7|EKIN|1.7>     1.298660346241

 !MCSCF expec         <1.4|POT|1.4>    -1.930279774863
 !MCSCF expec         <1.6|POT|1.6>    -1.930279774864
 !MCSCF expec         <1.7|POT|1.7>    -1.930279774863


 NATURAL ORBITALS (state averaged)
 =================================

   Orb     Occ        Energy       Coefficients

                                   1 1s      1 1s      1 1s      1 1s      1 1s      1 1s      1 1s      1 3d0     1 3d2+    1 3d0  
                                   1 3d2+    1 3d0     1 3d2+    1 3d0     1 3d2+    1 3d0     1 3d2+    1 3d0     1 3d2+    1 5g0  
                                   1 5g4+    1 5g2+    1 5g0     1 5g4+    1 5g2+    1 5g0     1 5g4+    1 5g2+    1 5g0     1 5g4+ 
                                   1 5g2+    1 7i6+    1 7i4+    1 7i2+    1 7i0     1 7i6+    1 7i4+    1 7i2+    1 7i0  

   1.1  2.00000    -0.541088     1.002148  0.001450 -0.003325  0.001905 -0.003116  0.001213  0.000115  0.000000  0.000000  0.000000
                                 0.000000  0.000000  0.000000  0.000000  0.000000  0.000000  0.000000  0.000000  0.000000  0.000000
                                 0.000000  0.000000  0.000000  0.000000  0.000000  0.000000  0.000000  0.000000  0.000000  0.000000
                                 0.000000  0.000000  0.000000  0.000000  0.000000  0.000000  0.000000  0.000000  0.000000

                                   1 2px     1 2px     1 2px     1 2px     1 2px     1 2px     1 2px     1 4f1+    1 4f3+    1 4f1+ 
                                   1 4f3+    1 4f1+    1 4f3+    1 4f1+    1 4f3+    1 4f1+    1 4f3+    1 6h1+    1 6h3+    1 6h5+ 
                                   1 6h1+    1 6h3+    1 6h5+    1 6h1+    1 6h3+    1 6h5+ 

   1.2  0.66667    -0.066128     0.997857  0.001008 -0.001156  0.002236 -0.000208  0.001025 -0.000275  0.000000  0.000000  0.000000
                                 0.000000  0.000000  0.000000  0.000000  0.000000  0.000000  0.000000  0.000000  0.000000  0.000000
                                 0.000000  0.000000  0.000000  0.000000  0.000000  0.000000

                                   1 2py     1 2py     1 2py     1 2py     1 2py     1 2py     1 2py     1 4f1-    1 4f3-    1 4f1- 
                                   1 4f3-    1 4f1-    1 4f3-    1 4f1-    1 4f3-    1 4f1-    1 4f3-    1 6h1-    1 6h3-    1 6h5- 
                                   1 6h1-    1 6h3-    1 6h5-    1 6h1-    1 6h3-    1 6h5- 

   1.3  0.66667    -0.066128     0.997857  0.001008 -0.001156  0.002236 -0.000208  0.001025 -0.000275  0.000000  0.000000  0.000000
                                 0.000000  0.000000  0.000000  0.000000  0.000000  0.000000  0.000000  0.000000  0.000000  0.000000
                                 0.000000  0.000000  0.000000  0.000000  0.000000  0.000000

                                   1 2pz     1 2pz     1 2pz     1 2pz     1 2pz     1 2pz     1 2pz     1 4f0     1 4f2+    1 4f0  
                                   1 4f2+    1 4f0     1 4f2+    1 4f0     1 4f2+    1 4f0     1 4f2+    1 6h2+    1 6h4+    1 6h0  
                                   1 6h2+    1 6h4+    1 6h0     1 6h2+    1 6h4+    1 6h0  

   1.5  0.66667    -0.066128     0.997857  0.001008 -0.001156  0.002236 -0.000208  0.001025 -0.000275  0.000000  0.000000  0.000000
                                 0.000000  0.000000  0.000000  0.000000  0.000000  0.000000  0.000000  0.000000  0.000000  0.000000
                                 0.000000  0.000000  0.000000  0.000000  0.000000  0.000000
 

 EXTRA SYMMETRY OF MOS IN SYMMETRY 1:   1 1 3 2 1 2 3 4 5 6   3 2 1 4 6 5 2 3 9 7   810 1 6 4 5 3 2 7 9   810 6 4 5 1 2 3 1
 EXTRA SYMMETRY OF MOS IN SYMMETRY 2:   1 1 1 3 2 1 3 2 6 4   5 2 3 1 6 5 4 2 3 1   2 3 5 6 4 1
 EXTRA SYMMETRY OF MOS IN SYMMETRY 3:   1 1 1 3 2 1 3 2 6 4   5 2 3 1 6 5 4 2 3 1   2 3 5 6 4 1
 EXTRA SYMMETRY OF MOS IN SYMMETRY 4:   1 1 3 2 1 2 3 1 4 5   6 2 3 1 5 4 6 2 3 1
 EXTRA SYMMETRY OF MOS IN SYMMETRY 5:   1 1 1 2 3 1 2 3 5 4   6 2 3 1 5 4 6 2 3 1   2 3 6 4 5 1
 EXTRA SYMMETRY OF MOS IN SYMMETRY 6:   1 1 2 3 1 3 2 1 4 5   6 3 2 1 4 5 6 3 2 1
 EXTRA SYMMETRY OF MOS IN SYMMETRY 7:   1 1 2 3 1 3 2 1 4 5   6 3 2 1 4 5 6 3 2 1
 EXTRA SYMMETRY OF MOS IN SYMMETRY 8:   1 1 2 3 1 2 3 1 1 3   2

 Natural orbital dump (state averaged) at molpro section  5202.2    (Orbital set 2)


 CI vector for state symmetry 1
 ==============================

 a a 0           1.0000000

 TOTAL ENERGIES                        -3.67860026

 CI vector for state symmetry 2
 ==============================

 a 0 a           1.0000000

 TOTAL ENERGIES                        -3.67860026

 CI vector for state symmetry 3
 ==============================

 0 a a           1.0000000

 TOTAL ENERGIES                        -3.67860026



 **********************************************************************************************************************************
 DATASETS  * FILE   NREC   LENGTH (MB)   RECORD NAMES
              1      21       95.03       500      610      700      900      950      970     1000      129      960     1100   
                                          VAR    BASINP    GEOM    SYMINP    ZMAT    AOBASIS   BASIS     P2S    ABASIS      S 
                                         1400     1410     1420     1200     1210     1080     1600     1650     1300     1700   
                                         EKIN       V       ECP      H0       H01     AOSYM     SMH    MOLCAS    ERIS     OPER   
                                         1380   
                                         JKOP   

              2       5        5.60       700     1000      520     4202     5202   
                                         GEOM     BASIS   MCVARS     RHF     MCSCF   

 PROGRAMS   *        TOTAL     MULTI       RHF       INT
 CPU TIMES  *        10.39      0.70      0.69      8.87
 REAL TIME  *        24.41 SEC
 DISK USED  *       299.45 MB      
 **********************************************************************************************************************************


 PROGRAM * RHF-SCF (OPEN SHELL)       Authors: W. Meyer, H.-J. Werner


 NUMBER OF ELECTRONS:       3+    1-    SPACE SYMMETRY=6    SPIN SYMMETRY: Triplet 
 CONVERGENCE THRESHOLDS:    1.00E-05 (Density)    1.00E-07 (Energy)
 MAX. NUMBER OF ITERATIONS:        0
 INTERPOLATION TYPE:            DIIS
 INTERPOLATION STEPS:              2 (START)      1 (STEP)
 LEVEL SHIFTS:                 -0.60 (CLOSED) -0.30 (OPEN) 


 Singly occupied orbitals:      1.2       1.5
 Molecular orbitals read from record     5202.2  Type=MCSCF/NATURAL (state averaged)

 Molecular orbital dump at record        2101.2

 ITERATION    DDIFF          GRAD             ENERGY        2-EL.EN.            DIPOLE MOMENTS         DIIS   ORB.
    1      0.000D+00      0.000D+00        -3.67860026      4.005119    0.00000    0.00000    0.00000    0    start

 Final alpha occupancy:   1   1   0   0   1   0   0   0
 Final beta  occupancy:   1   0   0   0   0   0   0   0

 !RHF STATE 1.6 Energy                 -3.678600256584
 Nuclear energy                         0.00000000
 One-electron energy                   -5.68115973
 Two-electron energy                    2.00255947
 Virial quotient                       -2.83261152
 !RHF STATE 1.6 Dipole moment           0.00000000     0.00000000     0.00000000
 Dipole moment /Debye                   0.00000000     0.00000000     0.00000000
 

 !RHF expec          <1.6|EKIN|1.6>     1.298660346243
 
 !RHF expec           <1.6|POT|1.6>    -1.930279774864

 ELECTRON ORBITALS
 =================


   Orb  Occ    Energy  Couls-En    Coefficients

                                   1 1s      1 1s      1 1s      1 1s      1 1s      1 1s      1 1s      1 3d0     1 3d2+    1 3d0  
                                   1 3d2+    1 3d0     1 3d2+    1 3d0     1 3d2+    1 3d0     1 3d2+    1 3d0     1 3d2+    1 5g0  
                                   1 5g4+    1 5g2+    1 5g0     1 5g4+    1 5g2+    1 5g0     1 5g4+    1 5g2+    1 5g0     1 5g4+ 
                                   1 5g2+    1 7i6+    1 7i4+    1 7i2+    1 7i0     1 7i6+    1 7i4+    1 7i2+    1 7i0  

   1.1   2    -0.5411   -2.1418  1.002148  0.001450 -0.003325  0.001905 -0.003116  0.001213  0.000115  0.000000  0.000000  0.000000
                                 0.000000  0.000000  0.000000  0.000000  0.000000  0.000000  0.000000  0.000000  0.000000  0.000000
                                 0.000000  0.000000  0.000000  0.000000  0.000000  0.000000  0.000000  0.000000  0.000000  0.000000
                                 0.000000  0.000000  0.000000  0.000000  0.000000  0.000000  0.000000  0.000000  0.000000

                                   1 2px     1 2px     1 2px     1 2px     1 2px     1 2px     1 2px     1 4f1+    1 4f3+    1 4f1+ 
                                   1 4f3+    1 4f1+    1 4f3+    1 4f1+    1 4f3+    1 4f1+    1 4f3+    1 6h1+    1 6h3+    1 6h5+ 
                                   1 6h1+    1 6h3+    1 6h5+    1 6h1+    1 6h3+    1 6h5+ 

   1.2   +    -0.0661   -1.3059  0.997857  0.001008 -0.001156  0.002236 -0.000208  0.001025 -0.000275  0.000000  0.000000  0.000000
                                 0.000000  0.000000  0.000000  0.000000  0.000000  0.000000  0.000000  0.000000  0.000000  0.000000
                                 0.000000  0.000000  0.000000  0.000000  0.000000  0.000000

                                   1 2pz     1 2pz     1 2pz     1 2pz     1 2pz     1 2pz     1 2pz     1 4f0     1 4f2+    1 4f0  
                                   1 4f2+    1 4f0     1 4f2+    1 4f0     1 4f2+    1 4f0     1 4f2+    1 6h2+    1 6h4+    1 6h0  
                                   1 6h2+    1 6h4+    1 6h0     1 6h2+    1 6h4+    1 6h0  

   1.5   +    -0.0661   -1.3059  0.997857  0.001008 -0.001156  0.002236 -0.000208  0.001025 -0.000275  0.000000  0.000000  0.000000
                                 0.000000  0.000000  0.000000  0.000000  0.000000  0.000000  0.000000  0.000000  0.000000  0.000000
                                 0.000000  0.000000  0.000000  0.000000  0.000000  0.000000

 HOMO      1.2    -0.066128 =      -1.7994eV
 LUMO      1.3    -0.066128 =      -1.7994eV
 LUMO-HOMO        -0.000000 =      -0.0000eV


 **********************************************************************************************************************************
 DATASETS  * FILE   NREC   LENGTH (MB)   RECORD NAMES
              1      21       95.03       500      610      700      900      950      970     1000      129      960     1100   
                                          VAR    BASINP    GEOM    SYMINP    ZMAT    AOBASIS   BASIS     P2S    ABASIS      S 
                                         1400     1410     1420     1200     1210     1080     1600     1650     1300     1700   
                                         EKIN       V       ECP      H0       H01     AOSYM     SMH    MOLCAS    ERIS     OPER   
                                         1380   
                                         JKOP   

              2       6        8.31       700     1000      520     4202     5202     2101   
                                         GEOM     BASIS   MCVARS     RHF     MCSCF     RHF  

 PROGRAMS   *        TOTAL       RHF     MULTI       RHF       INT
 CPU TIMES  *        10.48      0.09      0.70      0.69      8.87
 REAL TIME  *        24.83 SEC
 DISK USED  *       299.45 MB      
 **********************************************************************************************************************************
 SETTING SCF(I)         =        -3.67860026  AU                              
 SETTING _CC_NORM_MAX   =         2.00000000                                  


 PROGRAM * UHF-SCF       Authors: W. Meyer, H.-J. Werner


 NUMBER OF ELECTRONS:       3+    1-    SPACE SYMMETRY=6    SPIN SYMMETRY: Triplet 
 CONVERGENCE THRESHOLDS:    1.00E-05 (Density)    1.00E-07 (Energy)
 MAX. NUMBER OF ITERATIONS:        0
 INTERPOLATION TYPE:            DIIS
 INTERPOLATION STEPS:              2 (START)      1 (STEP)
 LEVEL SHIFTS:                  0.20 (ALPHA)   0.20 (BETA) 



 Molecular orbitals read from record     2101.2  Type=RHF/CANONICAL (state 1.6)

 Molecular orbital dump at record        2200.2

 Initial alpha occupation   1   1   0   0   1   0   0   0
 Initial beta  occupation   1   0   0   0   0   0   0   0

 ITERATION    DDIFF          GRAD             ENERGY        2-EL.EN.            DIPOLE MOMENTS         DIIS
    1      0.000D+00      0.000D+00        -3.67860026      4.005119    0.00000    0.00000    0.00000    0
 
 Final alpha occupancy:   1   1   0   0   1   0   0   0
 Final beta  occupancy:   1   0   0   0   0   0   0   0

 !UHF STATE 1.6 Energy                 -3.678600256584
 Nuclear energy                         0.00000000
 One-electron energy                   -5.68115973
 Two-electron energy                    2.00255947
 Virial quotient                       -2.83261152
 !UHF STATE 1.6 Dipole moment           0.00000000     0.00000000     0.00000000
 Dipole moment /Debye                   0.00000000     0.00000000     0.00000000
 

 !UHF expec          <1.6|EKIN|1.6>     1.298660346243
 
 !UHF expec           <1.6|POT|1.6>    -1.930279774864

 ELECTRON ORBITALS FOR POSITIVE SPIN
 ===================================


   Orb  Occ    Energy  Couls-En    Coefficients

                                   1 1s      1 1s      1 1s      1 1s      1 1s      1 1s      1 1s      1 3d0     1 3d2+    1 3d0  
                                   1 3d2+    1 3d0     1 3d2+    1 3d0     1 3d2+    1 3d0     1 3d2+    1 3d0     1 3d2+    1 5g0  
                                   1 5g4+    1 5g2+    1 5g0     1 5g4+    1 5g2+    1 5g0     1 5g4+    1 5g2+    1 5g0     1 5g4+ 
                                   1 5g2+    1 7i6+    1 7i4+    1 7i2+    1 7i0     1 7i6+    1 7i4+    1 7i2+    1 7i0  

   1.1   +    -0.5411   -2.1418  1.002148  0.001450 -0.003325  0.001905 -0.003116  0.001213  0.000115  0.000000  0.000000  0.000000
                                 0.000000  0.000000  0.000000  0.000000  0.000000  0.000000  0.000000  0.000000  0.000000  0.000000
                                 0.000000  0.000000  0.000000  0.000000  0.000000  0.000000  0.000000  0.000000  0.000000  0.000000
                                 0.000000  0.000000  0.000000  0.000000  0.000000  0.000000  0.000000  0.000000  0.000000

                                   1 2px     1 2px     1 2px     1 2px     1 2px     1 2px     1 2px     1 4f1+    1 4f3+    1 4f1+ 
                                   1 4f3+    1 4f1+    1 4f3+    1 4f1+    1 4f3+    1 4f1+    1 4f3+    1 6h1+    1 6h3+    1 6h5+ 
                                   1 6h1+    1 6h3+    1 6h5+    1 6h1+    1 6h3+    1 6h5+ 

   1.2   +    -0.0661   -1.3059  0.997857  0.001008 -0.001156  0.002236 -0.000208  0.001025 -0.000275  0.000000  0.000000  0.000000
                                 0.000000  0.000000  0.000000  0.000000  0.000000  0.000000  0.000000  0.000000  0.000000  0.000000
                                 0.000000  0.000000  0.000000  0.000000  0.000000  0.000000

                                   1 2pz     1 2pz     1 2pz     1 2pz     1 2pz     1 2pz     1 2pz     1 4f0     1 4f2+    1 4f0  
                                   1 4f2+    1 4f0     1 4f2+    1 4f0     1 4f2+    1 4f0     1 4f2+    1 6h2+    1 6h4+    1 6h0  
                                   1 6h2+    1 6h4+    1 6h0     1 6h2+    1 6h4+    1 6h0  

   1.5   +    -0.0661   -1.3059  0.997857  0.001008 -0.001156  0.002236 -0.000208  0.001025 -0.000275  0.000000  0.000000  0.000000
                                 0.000000  0.000000  0.000000  0.000000  0.000000  0.000000  0.000000  0.000000  0.000000  0.000000
                                 0.000000  0.000000  0.000000  0.000000  0.000000  0.000000

 ELECTRON ORBITALS FOR NEGATIVE SPIN
 ===================================


   Orb  Occ    Energy  Couls-En    Coefficients

                                   1 1s      1 1s      1 1s      1 1s      1 1s      1 1s      1 1s      1 3d0     1 3d2+    1 3d0  
                                   1 3d2+    1 3d0     1 3d2+    1 3d0     1 3d2+    1 3d0     1 3d2+    1 3d0     1 3d2+    1 5g0  
                                   1 5g4+    1 5g2+    1 5g0     1 5g4+    1 5g2+    1 5g0     1 5g4+    1 5g2+    1 5g0     1 5g4+ 
                                   1 5g2+    1 7i6+    1 7i4+    1 7i2+    1 7i0     1 7i6+    1 7i4+    1 7i2+    1 7i0  

   1.1   -    -0.5411   -2.1418  1.002148  0.001450 -0.003325  0.001905 -0.003116  0.001213  0.000115  0.000000  0.000000  0.000000
                                 0.000000  0.000000  0.000000  0.000000  0.000000  0.000000  0.000000  0.000000  0.000000  0.000000
                                 0.000000  0.000000  0.000000  0.000000  0.000000  0.000000  0.000000  0.000000  0.000000  0.000000
                                 0.000000  0.000000  0.000000  0.000000  0.000000  0.000000  0.000000  0.000000  0.000000

 HOMO      1.2    -0.066128 =      -1.7994eV
 LUMO      1.3    -0.066128 =      -1.7994eV
 LUMO-HOMO        -0.000000 =      -0.0000eV

 EXPECTATION VALUE OF S**2:             2.00000000

 Occupation number threshold for canonical orbitals:  1.999000 (occupied),  0.001000 (virtual)

 Number of pseudo-canonical orbitals per symmetry:    1   0   0   0   0   0   0   0
 Number of active natural orbitals per symmetry:      0   1   0   0   1   0   0   0

 NATURAL CHARGE ORBITALS
 =======================


   Orb     Occ        Energy       Coefficients

                                   1 1s      1 1s      1 1s      1 1s      1 1s      1 1s      1 1s      1 3d0     1 3d2+    1 3d0  
                                   1 3d2+    1 3d0     1 3d2+    1 3d0     1 3d2+    1 3d0     1 3d2+    1 3d0     1 3d2+    1 5g0  
                                   1 5g4+    1 5g2+    1 5g0     1 5g4+    1 5g2+    1 5g0     1 5g4+    1 5g2+    1 5g0     1 5g4+ 
                                   1 5g2+    1 7i6+    1 7i4+    1 7i2+    1 7i0     1 7i6+    1 7i4+    1 7i2+    1 7i0  

   1.1  2.00000    -0.541088     1.002148  0.001450 -0.003325  0.001905 -0.003116  0.001213  0.000115  0.000000  0.000000  0.000000
                                 0.000000  0.000000  0.000000  0.000000  0.000000  0.000000  0.000000  0.000000  0.000000  0.000000
                                 0.000000  0.000000  0.000000  0.000000  0.000000  0.000000  0.000000  0.000000  0.000000  0.000000
                                 0.000000  0.000000  0.000000  0.000000  0.000000  0.000000  0.000000  0.000000  0.000000

                                   1 2px     1 2px     1 2px     1 2px     1 2px     1 2px     1 2px     1 4f1+    1 4f3+    1 4f1+ 
                                   1 4f3+    1 4f1+    1 4f3+    1 4f1+    1 4f3+    1 4f1+    1 4f3+    1 6h1+    1 6h3+    1 6h5+ 
                                   1 6h1+    1 6h3+    1 6h5+    1 6h1+    1 6h3+    1 6h5+ 

   1.2  1.00000    -0.108599     0.997857  0.001008 -0.001156  0.002236 -0.000208  0.001025 -0.000275  0.000000  0.000000  0.000000
                                 0.000000  0.000000  0.000000  0.000000  0.000000  0.000000  0.000000  0.000000  0.000000  0.000000
                                 0.000000  0.000000  0.000000  0.000000  0.000000  0.000000

                                   1 2pz     1 2pz     1 2pz     1 2pz     1 2pz     1 2pz     1 2pz     1 4f0     1 4f2+    1 4f0  
                                   1 4f2+    1 4f0     1 4f2+    1 4f0     1 4f2+    1 4f0     1 4f2+    1 6h2+    1 6h4+    1 6h0  
                                   1 6h2+    1 6h4+    1 6h0     1 6h2+    1 6h4+    1 6h0  

   1.5  1.00000    -0.108599     0.997857  0.001008 -0.001156  0.002236 -0.000208  0.001025 -0.000275  0.000000  0.000000  0.000000
                                 0.000000  0.000000  0.000000  0.000000  0.000000  0.000000  0.000000  0.000000  0.000000  0.000000
                                 0.000000  0.000000  0.000000  0.000000  0.000000  0.000000

 Natural orbitals saved to record    2200.2 (Orbital set 3)

 Orbital spaces for UNO-CAS (Min. occupation: 0.020  Max. occupation: 1.980):

 Closed:        1   0   0   0   0   0   0   0
 Active:        0   1   0   0   1   0   0   0

 No convergence



 **********************************************************************************************************************************
 DATASETS  * FILE   NREC   LENGTH (MB)   RECORD NAMES
              1      21       95.03       500      610      700      900      950      970     1000      129      960     1100   
                                          VAR    BASINP    GEOM    SYMINP    ZMAT    AOBASIS   BASIS     P2S    ABASIS      S 
                                         1400     1410     1420     1200     1210     1080     1600     1650     1300     1700   
                                         EKIN       V       ECP      H0       H01     AOSYM     SMH    MOLCAS    ERIS     OPER   
                                         1380   
                                         JKOP   

              2       7       11.08       700     1000      520     4202     5202     2101     2200   
                                         GEOM     BASIS   MCVARS     RHF     MCSCF     RHF      UHF  

 PROGRAMS   *        TOTAL       UHF       RHF     MULTI       RHF       INT
 CPU TIMES  *        10.56      0.08      0.09      0.70      0.69      8.87
 REAL TIME  *        25.07 SEC
 DISK USED  *       299.45 MB      
 **********************************************************************************************************************************
 SETTING SCF(I)         =        -3.67860026  AU                              


 PROGRAM * MRCC (General Multireference Coupled Cluster)    Author: M. Kallay, 2000-2005

 ***  Initialisation ***

   0 Spin projections
 
 Molecular orbitals read from record     2200.2  Type=UHF/ALPHA (state 1.6)

 ?Warning: UHF not converged
 Molecular orbitals read from record     2200.2  Type=UHF/BETA (state 1.6)

 ?Warning: UHF not converged
 
 Frozen orbitals:              0 (  0  0  0  0  0  0  0  0)
 Active orbitals:            188 ( 39 26 26 20 26 20 20 11)
 Active electrons:             4
 Spin quantum number:          1.0

 Transformed integrals will be written to file mrcc_23677/fort.55

 Load integrals               10.6 sec
 Transform integrals          23.8 sec
 Storage for integrals:      119071012
 Remaining memory:           *********

 Core energy:               0.00000000
 
 MRCC Input:
     4     0     0     0     3     0     0     6     0     0     0     1     1     0     0     7     0     0   0.000     0   64000
  ex.lev,nsing,ntrip, rest,method,dens,conver,symm, diag, CS ,spatial, HF, ndoub,nacto,nactv, tol, maxex, sacc, freq,  dboc,   mem
  2  0  0  0  0  0  0  0  0  0  0  0  0  0  0  0  0  0  0  0  0  0  0  0  0  0  0  0  0  0  0  0  0  0  0  0  0  0  0  1  0  0  0  0  0  0  0  0  0  0  0  0  0  0  0  0  0  0  0  0  0  0  0  0  0  0  0  0  0  0  0  0  0  0  0  0  0  0  0  0  0  0  0  0  0  0  0  0  0  0  0  0  0  0  0  0  0  0  0  0  0  0  0  0  0  0  0  0  0  0  0  1  0  0  0  0  0  0  0  0  0  0  0  0  0  0  0  0  0  0  0  0  0  0  0  0  0  0  0  0  0  0  0  0  0  0  0  0  0  0  0  0  0  0  0  0  0  0  0  0  0  0  0  0  0  0  0  0  0  0  0  0  0  0  0  0  0  0  0  0  0  0  0  0  0  0  0  0
 MRCC Input end
 Variable memory released
 MRCC now being run, temporary output in /global/cscratch1/sd/aannabe/mrcc_23677/mrcc.out
 **********************************************************************
                          MRCC program system
 **********************************************************************

                              Written by
  Mihaly Kallay, Zoltan Rolik, Jozsef Csontos, Peter Nagy, Gyula Samu,
      David Mester, Jozsef Csoka, Bernat Szabo, Istvan Ladjanszki,
       Lorant Szegedy, Bence Ladoczki, Klara Petrov, Mate Farkas,
                    Pal D. Mezei, and Bence Hegely

        Department of Physical Chemistry and Materials Science
            Budapest University of Technology and Economics
                  Budapest P.O.Box 91, H-1521 Hungary

                              www.mrcc.hu

                       Release date: May 23, 2018

 ************************ 2018-11-05 14:40:56 *************************
 Executing goldstone...

 Generation of CC equations in terms of H and T...
 Generation of antisymmetrized Goldstone diagrams...
 Number of diagrams in T^1 equations:    15
 Number of diagrams in T^2 equations:    38
 Number of diagrams in T^3 equations:    49
 Number of diagrams in T^4 equations:     5
 Translation of diagrams to factorized equations...
 Optimizing intermediate calculation...
 Number of floating-point operations per iteration step:   5.7097E+11
 Probable CPU time per iteration step (hours):      5.71
 Required memory (Mbytes):  155635.9
 Number of intermediates:                                  80
 Number of intermediates to be stored:                     32
 Length of intermediate file (Mbytes):    2422.2

 ************************ 2018-11-05 14:40:57 *************************
 Executing xmrcc...

 **********************************************************************
 CC(3)(4) calculation


 Allocation of****** Mbytes of memory...
 Number of spinorbitals:                   376
 Number of alpha electrons:                        3
 Number of beta electrons:                         1
 Spin multiplicity:                     2
 z-component of spin:  1.0
 Spatial symmetry:                      6
 Convergence criterion:  1.0E-07
 Construction of occupation graphs...
 Number of                     0 -fold excitations:                      1
 Number of                     1 -fold excitations:                    126
 Number of                     2 -fold excitations:                  20068
 Number of                     3 -fold excitations:                1323950
 Total number of configurations:                1344145
 Calculation of coupling coefficients...
 Length of intermediate file (Mbytes):    1822.8

 ======================================================================

 Spin case  1   Alpha:  3   Beta:  1
 Number of excitations:               24251915
 Number of                     4 -fold excitations:               24251915

 Memory requirements /Mbyte/:
               Minimal        Optimal
 Real*8:       4012.0013      9531.1702
 Integer:       263.3254
 Total:        4275.3267      9794.4956


 ************************ 2018-11-05 14:41:28 *************************
 Executing mrcc...

 **********************************************************************
 CCSDT(Q) calculation


 Allocation of 9531.2 Mbytes of memory...
 Number of spinorbitals: 376
 Number of alpha electrons:  3
 Number of beta  electrons:  1
 Spin multiplicity: 2
 z-component of spin:  1.0
 Spatial symmetry: 6
 Convergence criterion:  1.0E-07
 Construction of occupation graphs...
 Number of 0-fold excitations: 1
 Number of 1-fold excitations: 126
 Number of 2-fold excitations: 20068
 Number of 3-fold excitations: 1323950
 Total number of determinants: 1344145
 Calculation of coupling coefficients...
 Initial cluster amplitudes are generated.
 Length of intermediate file (Mbytes):    1822.8
 Reading integral list from unit 55...
 Sorting integrals...
 Sorting integrals...
 Sorting integrals...
 Sorting integrals...
 Energy of reference determinant [au]:      -3.678600256584
 Calculation of MP denominators...

 Starting CC iteration...
 ======================================================================
 Norm of residual vector:     0.39538078
 CPU time [min]:     6.400                   Wall time [min]:     6.405

 Iteration  1  CC energy:    -3.75031449  Energy decrease:   0.07171424
 ======================================================================
 Norm of residual vector:     0.13110512
 CPU time [min]:     9.152                   Wall time [min]:     9.176

 Iteration  2  CC energy:    -3.75990258  Energy decrease:   0.00958809
 ======================================================================
 Norm of residual vector:     0.04197839
 CPU time [min]:    11.884                   Wall time [min]:    11.912

 Iteration  3  CC energy:    -3.76789237  Energy decrease:   0.00798978
 ======================================================================
 Norm of residual vector:     0.01182306
 CPU time [min]:    14.653                   Wall time [min]:    14.690

 Iteration  4  CC energy:    -3.76795423  Energy decrease:   0.00006186
 ======================================================================
 Norm of residual vector:     0.00348170
 CPU time [min]:    17.392                   Wall time [min]:    17.432

 Iteration  5  CC energy:    -3.76813718  Energy decrease:   0.00018295
 ======================================================================
 Norm of residual vector:     0.00116076
 CPU time [min]:    20.173                   Wall time [min]:    20.216

 Iteration  6  CC energy:    -3.76814841  Energy decrease:   0.00001123
 ======================================================================
 Norm of residual vector:     0.00038847
 CPU time [min]:    22.955                   Wall time [min]:    23.001

 Iteration  7  CC energy:    -3.76812647  Energy decrease:   0.00002194
 ======================================================================
 Norm of residual vector:     0.00012727
 CPU time [min]:    25.745                   Wall time [min]:    25.793

 Iteration  8  CC energy:    -3.76812741  Energy decrease:   0.00000094
 ======================================================================
 Norm of residual vector:     0.00004470
 CPU time [min]:    28.541                   Wall time [min]:    28.595

 Iteration  9  CC energy:    -3.76813012  Energy decrease:   0.00000271
 ======================================================================
 Norm of residual vector:     0.00001674
 CPU time [min]:    31.323                   Wall time [min]:    31.389

 Iteration 10  CC energy:    -3.76812943  Energy decrease:   0.00000069
 ======================================================================
 Norm of residual vector:     0.00000613
 CPU time [min]:    34.070                   Wall time [min]:    34.140

 Iteration 11  CC energy:    -3.76812922  Energy decrease:   0.00000021
 ======================================================================
 Norm of residual vector:     0.00000230
 CPU time [min]:    36.862                   Wall time [min]:    36.936

 Iteration 12  CC energy:    -3.76812936  Energy decrease:   0.00000014
 ======================================================================
 Norm of residual vector:     0.00000083
 CPU time [min]:    39.616                   Wall time [min]:    39.693

 Iteration 13  CC energy:    -3.76812936  Energy decrease:   2.5713E-09
 ======================================================================
 Norm of residual vector:     0.00000028
 CPU time [min]:    42.368                   Wall time [min]:    42.449

 Iteration 14  CC energy:    -3.76812935  Energy decrease:   0.00000001
 ======================================================================
 Norm of residual vector:     0.00000009
 CPU time [min]:    45.089                   Wall time [min]:    45.178

 Iteration 15  CC energy:    -3.76812935  Energy decrease:   2.8428E-09
 ======================================================================

 Iteration has converged in 15 steps.

 Final results:
 Total CCSDT energy [au]:             -3.768129350082
 Total MP2 energy [au]:               -3.750314493250

 Perturbative corrections are calculated...
 ======================================================================
 Spin case  1   Alpha:  3   Beta:  1
 Number of excitations:        24251915
 CPU time [min]:   341.235                   Wall time [min]:   341.349
 ======================================================================
 Number of 4-fold excitations: 24251915
 CPU time [min]:   341.235                   Wall time [min]:   341.359

 Total CCSDT[Q] energy [au]:          -3.768158923446
 Total CCSDT(Q) energy [au]:          -3.768217512773

 ************************ 2018-11-05 20:22:51 *************************
                      Normal termination of mrcc.
 **********************************************************************
 !CCSDT STATE 1.6 Energy               -3.768129350082
 !MP2 STATE 1.6 Energy                 -3.750314493250
 !CCSDT[Q] STATE 1.6 Energy            -3.768158923446
 !CCSDT(Q) STATE 1.6 Energy            -3.768217512773
 
 CPU-time for MRCC:          20474.1 sec
 Elapsed-time for MRCC:      20517.3 sec

 Variable memory set to 8000000000 words,  buffer space   230000 words



 **********************************************************************************************************************************
 DATASETS  * FILE   NREC   LENGTH (MB)   RECORD NAMES
              1      21       95.03       500      610      700      900      950      970     1000      129      960     1100   
                                          VAR    BASINP    GEOM    SYMINP    ZMAT    AOBASIS   BASIS     P2S    ABASIS      S 
                                         1400     1410     1420     1200     1210     1080     1600     1650     1300     1700   
                                         EKIN       V       ECP      H0       H01     AOSYM     SMH    MOLCAS    ERIS     OPER   
                                         1380   
                                         JKOP   

              2       7       11.08       700     1000      520     4202     5202     2101     2200   
                                         GEOM     BASIS   MCVARS     RHF     MCSCF     RHF      UHF  

 PROGRAMS   *        TOTAL      MRCC       UHF       RHF     MULTI       RHF       INT
 CPU TIMES  *     20921.59  20911.03      0.08      0.09      0.70      0.69      8.87
 REAL TIME  *     22433.21 SEC
 DISK USED  *       299.45 MB      
 **********************************************************************************************************************************
 SETTING POSTHF(I)      =        -3.76821751  AU                              
                                                                                                                                                                                                                                                                

       SCF           POSTHF       EKIN          POT
    -3.67860026   -3.76821751   1.29866035   -1.93027977
                                                  

 CCSDT(Q)/USERDEF energy=     -3.768217512773

        CCSDT(Q)        RHF-SCF         MULTI           RHF-SCF 
     -3.76821751     -3.67860026     -3.67860026     -3.67867577
 **********************************************************************************************************************************
 Variable memory released
