
 Primary working directories    : /global/cscratch1/sd/aannabe
 Secondary working directories  : /global/cscratch1/sd/aannabe
 Wavefunction directory         : /global/homes/a/aannabe/wfu/
 Main file repository           : /global/cscratch1/sd/aannabe/

 SHA1      : 19cd028119e0e09f93f0674bd8af7968d9b3eff6
 NAME      : 2015.1.36
 ARCHNAME  : linux/x86_64
 FC        : /opt/cray/pe/craype/2.5.14/bin/ftn
 BLASLIB   : -L/opt/intel/compilers_and_libraries_2018.1.163/linux/mkl/lib/intel64 -Wl,-_start-group -lmkl_intel_ilp64 -lmkl_intel_thread -lmkl_core -Wl,-_end-group -liomp5
 id        : lbl

 Nodes     nprocs
 nid00473     1

 Using customized tuning parameters: mindgm=7; mindgv=16; mindgc=1; mindgr=1; noblas=0; minvec=7
 default implementation of scratch files=df  

 ***,Br
 memory,8,g
 gthresh,twoint=1.e-12
 
 gprint,basis,orbitals
 gexpec,ekin,pot
 
 angstrom
 geometry={
 1                                                                               ! Number of atoms
 Br 0.0 0.0 0.0
 }
 
 basis={
 
 Including file /global/homes/a/aannabe/repos/pseudopotentiallibrary/recipes/Br/ccECP/Br.ccECP.molpro
 
                                   !include,/global/homes/a/aannabe/repos/pseudopotentiallibrary/recipes/Br/ccECP/Br.cc-pV5Z.molpro
                                  !include,/global/homes/a/aannabe/repos/pseudopotentiallibrary/recipes/Br/ccECP/Br.cc-pCV5Z.molpro
 Including file /global/homes/a/aannabe/repos/pseudopotentiallibrary/recipes/Br/ccECP/Br.aug-cc-pV5Z.molpro
 
 
 }
 
 {hf
 wf,7,3,1
 occ,1,1,1,0,1,0,0,0
                                                                                 !open,1.3
 closed,1,1,0,0,1,0,0,0
                                                                                 !sym,
 }
 scf(i)=energy
 
 _CC_NORM_MAX=2.0
  !NOTE: Perturbative MRCC works only with UHF reference. So, here we will trick MRCC by doing zero UHF iteration right after ROHF.
 
 {uhf
 wf,7,3,1
 occ,1,1,1,0,1,0,0,0
                                                                                 !open,1.3
 closed,1,1,0,0,1,0,0,0
                                                                                 !sym,
 maxit,0
 }
 scf(i)=energy
 
 {mrcc,method=CCSDT(Q),dir=mrccdir                                               !,restart=1
 orbital,ignore_error=1                                                          !Ignore the fact that UHF WF is not converged
 maxit,100
 core
 }
 posthf(i)=energy
 
 table,scf,posthf,ekin,pot
 save,5.csv,new
 
 

 Variables initialized (889), CPU time= 0.00 sec
 Commands  initialized (702), CPU time= 0.00 sec, 572 directives.
 Default parameters read. Elapsed time= 0.12 sec

 Checking input...
 Passed
1


                                         ***  PROGRAM SYSTEM MOLPRO  ***
                                       Copyright, TTI GmbH Stuttgart, 2015
                                    Version 2015.1 linked Dec 29 2018 15:55:43


 **********************************************************************************************************************************
 LABEL *   Br                                                                            
  64 bit serial version                                                                  DATE: 25-Jun-19          TIME: 12:51:49  
 **********************************************************************************************************************************

 SHA1:             19cd028119e0e09f93f0674bd8af7968d9b3eff6
 **********************************************************************************************************************************

 THRESHOLDS:

 ZERO    =  1.00D-12  ONEINT  =  1.00D-12  TWOINT  =  1.00D-12  PREFAC  =  1.00D-14  LOCALI  =  1.00D-09  EORDER  =  1.00D-04
 ENERGY  =  0.00D+00  ETEST   =  0.00D+00  EDENS   =  0.00D+00  THRDEDEF=  1.00D-06  GRADIENT=  1.00D-02  STEP    =  1.00D-03
 ORBITAL =  1.00D-05  CIVEC   =  1.00D-05  COEFF   =  1.00D-04  PRINTCI =  5.00D-02  PUNCHCI =  9.90D+01  OPTGRAD =  3.00D-04
 OPTENERG=  1.00D-06  OPTSTEP =  3.00D-04  THRGRAD =  1.00D-10  COMPRESS=  1.00D-11  VARMIN  =  1.00D-07  VARMAX  =  1.00D-03
 THRDOUB =  0.00D+00  THRDIV  =  1.00D-05  THRRED  =  1.00D-07  THRPSP  =  1.00D+00  THRDC   =  1.00D-10  THRCS   =  1.00D-10
 THRNRM  =  1.00D-08  THREQ   =  0.00D+00  THRDE   =  1.00D+00  THRREF  =  1.00D-05  SPARFAC =  1.00D+00  THRDLP  =  1.00D-07
 THRDIA  =  1.00D-10  THRDLS  =  1.00D-07  THRGPS  =  0.00D+00  THRKEX  =  0.00D+00  THRDIS  =  2.00D-01  THRVAR  =  1.00D-10
 THRLOC  =  1.00D-06  THRGAP  =  1.00D-06  THRLOCT = -1.00D+00  THRGAPT = -1.00D+00  THRORB  =  1.00D-06  THRMLTP =  0.00D+00
 THRCPQCI=  1.00D-10  KEXTA   =  0.00D+00  THRCOARS=  0.00D+00  SYMTOL  =  1.00D-06  GRADTOL =  1.00D-06  THROVL  =  1.00D-08
 THRORTH =  1.00D-08  GRID    =  1.00D-06  GRIDMAX =  1.00D-03  DTMAX   =  0.00D+00  THROCCDE=  1.00D-01  THROCCDE=  1.00D-01



 ZUNIT=ANG
 

Geometry recognized as XYZ


 Variable memory set to 8000000000 words,  buffer space   230000 words

 SETTING BASIS          =    USERDEF


 Recomputing integrals since basis changed


 Using spherical harmonics



 PROGRAM * SEWARD (Integral evaluation for generally contracted gaussian basis sets)     Author: Roland Lindh, 1990

 Geometry written to block  1 of record 700

 Orientation using atomic masses  
 Molecule type: Atom
 Symmetry elements: X,Y,Z
 Rotational constants:       0.0000000      0.0000000      0.0000000 GHz  (calculated with average atomic masses)

 Point group  D2h 



 ATOMIC COORDINATES

 NR  ATOM    CHARGE       X              Y              Z

   1  BR      7.00    0.000000000    0.000000000    0.000000000


          BR  CORE POTENTIAL

          f POTENTIAL

 POWERS             1              3              2              2
 EXPONENTIALS   3.665770       5.293023       3.176376       2.897544    
 COEFFICIENTS   7.000000       25.66039       13.04026      -21.90884    

          s - f POTENTIAL

 POWERS             2              2
 EXPONENTIALS   4.971807       2.042687    
 COEFFICIENTS   85.88435       4.621255    

          p - f POTENTIAL

 POWERS             2              2
 EXPONENTIALS   4.711839       2.384293    
 COEFFICIENTS   55.36172       11.03141    

          d - f POTENTIAL

 POWERS             2              2
 EXPONENTIALS   3.412863       1.530285    
 COEFFICIENTS   26.41041       5.468739    


 BASIS DATA

   Nr Sym  Nuc  Type         Exponents   Contraction coefficients

    1.1 Ag    1  1s          60.457695    -0.000452
                             27.422852     0.003372
                             12.438662    -0.025045
                              5.642021     0.170101
                              2.559150    -0.430992
                              1.160798    -0.154358
                              0.526524     0.525458
                              0.238824     0.592735
                              0.108328     0.169490
    2.1 Ag    1  1s           0.717852     1.000000
    3.1 Ag    1  1s           0.387636     1.000000
    4.1 Ag    1  1s           0.209321     1.000000
    5.1 Ag    1  1s           0.113032     1.000000
    6.1 Ag    1  1s           0.045213     1.000000
    7.1 Ag    1  3d0          2.131944     1.000000
    8.1 Ag    1  3d2+         2.131944     1.000000
    9.1 Ag    1  3d0          0.965261     1.000000
   10.1 Ag    1  3d2+         0.965261     1.000000
   11.1 Ag    1  3d0          0.437032     1.000000
   12.1 Ag    1  3d2+         0.437032     1.000000
   13.1 Ag    1  3d0          0.197871     1.000000
   14.1 Ag    1  3d2+         0.197871     1.000000
   15.1 Ag    1  3d0          0.079148     1.000000
   16.1 Ag    1  3d2+         0.079148     1.000000
   17.1 Ag    1  5g0          1.023572     1.000000
   18.1 Ag    1  5g4+         1.023572     1.000000
   19.1 Ag    1  5g2+         1.023572     1.000000
   20.1 Ag    1  5g0          0.454585     1.000000
   21.1 Ag    1  5g4+         0.454585     1.000000
   22.1 Ag    1  5g2+         0.454585     1.000000
   23.1 Ag    1  5g0          0.181834     1.000000
   24.1 Ag    1  5g4+         0.181834     1.000000
   25.1 Ag    1  5g2+         0.181834     1.000000
    1.2 B3u   1  2px         27.437987     0.000087
                             12.887440    -0.001797
                              6.053145     0.027150
                              2.843122    -0.134143
                              1.335395    -0.006234
                              0.627226     0.309551
                              0.294604     0.440285
                              0.138374     0.316750
                              0.064993     0.092533
    2.2 B3u   1  2px          1.077437     1.000000
    3.2 B3u   1  2px          0.464537     1.000000
    4.2 B3u   1  2px          0.200285     1.000000
    5.2 B3u   1  2px          0.086353     1.000000
    6.2 B3u   1  2px          0.034541     1.000000
    7.2 B3u   1  4f1+         1.053363     1.000000
    8.2 B3u   1  4f3+         1.053363     1.000000
    9.2 B3u   1  4f1+         0.531391     1.000000
   10.2 B3u   1  4f3+         0.531391     1.000000
   11.2 B3u   1  4f1+         0.268071     1.000000
   12.2 B3u   1  4f3+         0.268071     1.000000
   13.2 B3u   1  4f1+         0.107228     1.000000
   14.2 B3u   1  4f3+         0.107228     1.000000
   15.2 B3u   1  6h1+         0.837913     1.000000
   16.2 B3u   1  6h3+         0.837913     1.000000
   17.2 B3u   1  6h5+         0.837913     1.000000
   18.2 B3u   1  6h1+         0.335165     1.000000
   19.2 B3u   1  6h3+         0.335165     1.000000
   20.2 B3u   1  6h5+         0.335165     1.000000
    1.3 B2u   1  2py         27.437987     0.000087
                             12.887440    -0.001797
                              6.053145     0.027150
                              2.843122    -0.134143
                              1.335395    -0.006234
                              0.627226     0.309551
                              0.294604     0.440285
                              0.138374     0.316750
                              0.064993     0.092533
    2.3 B2u   1  2py          1.077437     1.000000
    3.3 B2u   1  2py          0.464537     1.000000
    4.3 B2u   1  2py          0.200285     1.000000
    5.3 B2u   1  2py          0.086353     1.000000
    6.3 B2u   1  2py          0.034541     1.000000
    7.3 B2u   1  4f1-         1.053363     1.000000
    8.3 B2u   1  4f3-         1.053363     1.000000
    9.3 B2u   1  4f1-         0.531391     1.000000
   10.3 B2u   1  4f3-         0.531391     1.000000
   11.3 B2u   1  4f1-         0.268071     1.000000
   12.3 B2u   1  4f3-         0.268071     1.000000
   13.3 B2u   1  4f1-         0.107228     1.000000
   14.3 B2u   1  4f3-         0.107228     1.000000
   15.3 B2u   1  6h1-         0.837913     1.000000
   16.3 B2u   1  6h3-         0.837913     1.000000
   17.3 B2u   1  6h5-         0.837913     1.000000
   18.3 B2u   1  6h1-         0.335165     1.000000
   19.3 B2u   1  6h3-         0.335165     1.000000
   20.3 B2u   1  6h5-         0.335165     1.000000
    1.4 B1g   1  3d2-         2.131944     1.000000
    2.4 B1g   1  3d2-         0.965261     1.000000
    3.4 B1g   1  3d2-         0.437032     1.000000
    4.4 B1g   1  3d2-         0.197871     1.000000
    5.4 B1g   1  3d2-         0.079148     1.000000
    6.4 B1g   1  5g2-         1.023572     1.000000
    7.4 B1g   1  5g4-         1.023572     1.000000
    8.4 B1g   1  5g2-         0.454585     1.000000
    9.4 B1g   1  5g4-         0.454585     1.000000
   10.4 B1g   1  5g2-         0.181834     1.000000
   11.4 B1g   1  5g4-         0.181834     1.000000
    1.5 B1u   1  2pz         27.437987     0.000087
                             12.887440    -0.001797
                              6.053145     0.027150
                              2.843122    -0.134143
                              1.335395    -0.006234
                              0.627226     0.309551
                              0.294604     0.440285
                              0.138374     0.316750
                              0.064993     0.092533
    2.5 B1u   1  2pz          1.077437     1.000000
    3.5 B1u   1  2pz          0.464537     1.000000
    4.5 B1u   1  2pz          0.200285     1.000000
    5.5 B1u   1  2pz          0.086353     1.000000
    6.5 B1u   1  2pz          0.034541     1.000000
    7.5 B1u   1  4f0          1.053363     1.000000
    8.5 B1u   1  4f2+         1.053363     1.000000
    9.5 B1u   1  4f0          0.531391     1.000000
   10.5 B1u   1  4f2+         0.531391     1.000000
   11.5 B1u   1  4f0          0.268071     1.000000
   12.5 B1u   1  4f2+         0.268071     1.000000
   13.5 B1u   1  4f0          0.107228     1.000000
   14.5 B1u   1  4f2+         0.107228     1.000000
   15.5 B1u   1  6h2+         0.837913     1.000000
   16.5 B1u   1  6h4+         0.837913     1.000000
   17.5 B1u   1  6h0          0.837913     1.000000
   18.5 B1u   1  6h2+         0.335165     1.000000
   19.5 B1u   1  6h4+         0.335165     1.000000
   20.5 B1u   1  6h0          0.335165     1.000000
    1.6 B2g   1  3d1+         2.131944     1.000000
    2.6 B2g   1  3d1+         0.965261     1.000000
    3.6 B2g   1  3d1+         0.437032     1.000000
    4.6 B2g   1  3d1+         0.197871     1.000000
    5.6 B2g   1  3d1+         0.079148     1.000000
    6.6 B2g   1  5g1+         1.023572     1.000000
    7.6 B2g   1  5g3+         1.023572     1.000000
    8.6 B2g   1  5g1+         0.454585     1.000000
    9.6 B2g   1  5g3+         0.454585     1.000000
   10.6 B2g   1  5g1+         0.181834     1.000000
   11.6 B2g   1  5g3+         0.181834     1.000000
    1.7 B3g   1  3d1-         2.131944     1.000000
    2.7 B3g   1  3d1-         0.965261     1.000000
    3.7 B3g   1  3d1-         0.437032     1.000000
    4.7 B3g   1  3d1-         0.197871     1.000000
    5.7 B3g   1  3d1-         0.079148     1.000000
    6.7 B3g   1  5g1-         1.023572     1.000000
    7.7 B3g   1  5g3-         1.023572     1.000000
    8.7 B3g   1  5g1-         0.454585     1.000000
    9.7 B3g   1  5g3-         0.454585     1.000000
   10.7 B3g   1  5g1-         0.181834     1.000000
   11.7 B3g   1  5g3-         0.181834     1.000000
    1.8 Au    1  4f2-         1.053363     1.000000
    2.8 Au    1  4f2-         0.531391     1.000000
    3.8 Au    1  4f2-         0.268071     1.000000
    4.8 Au    1  4f2-         0.107228     1.000000
    5.8 Au    1  6h4-         0.837913     1.000000
    6.8 Au    1  6h2-         0.837913     1.000000
    7.8 Au    1  6h4-         0.335165     1.000000
    8.8 Au    1  6h2-         0.335165     1.000000

 NUCLEAR CHARGE:                    7
 NUMBER OF PRIMITIVE AOS:         213
 NUMBER OF SYMMETRY AOS:          158
 NUMBER OF CONTRACTIONS:          126   (  25Ag  +  20B3u +  20B2u +  11B1g +  20B1u +  11B2g +  11B3g +   8Au  )
 NUMBER OF CORE ORBITALS:           0   (   0Ag  +   0B3u +   0B2u +   0B1g +   0B1u +   0B2g +   0B3g +   0Au  )
 NUMBER OF VALENCE ORBITALS:        4   (   1Ag  +   1B3u +   1B2u +   0B1g +   1B1u +   0B2g +   0B3g +   0Au  )


 NUCLEAR REPULSION ENERGY    0.00000000

 EXTRA SYMMETRY OF AOS IN SYMMETRY 1:   1 1 1 1 1 1 2 3 2 3   2 3 2 3 2 3 4 5 6 4   5 6 4 5 6
 EXTRA SYMMETRY OF AOS IN SYMMETRY 2:   1 1 1 1 1 1 2 3 2 3   2 3 2 3 4 5 6 4 5 6
 EXTRA SYMMETRY OF AOS IN SYMMETRY 3:   1 1 1 1 1 1 2 3 2 3   2 3 2 3 4 5 6 4 5 6
 EXTRA SYMMETRY OF AOS IN SYMMETRY 4:   1 1 1 1 1 2 3 2 3 2   3
 EXTRA SYMMETRY OF AOS IN SYMMETRY 5:   1 1 1 1 1 1 2 3 2 3   2 3 2 3 4 5 6 4 5 6
 EXTRA SYMMETRY OF AOS IN SYMMETRY 6:   1 1 1 1 1 2 3 2 3 2   3
 EXTRA SYMMETRY OF AOS IN SYMMETRY 7:   1 1 1 1 1 2 3 2 3 2   3
 EXTRA SYMMETRY OF AOS IN SYMMETRY 8:   1 1 1 1 2 3 2 3

 Eigenvalues of metric

         1 0.575E-03 0.600E-02 0.311E-01 0.311E-01 0.409E-01 0.162E+00 0.162E+00 0.214E+00
         2 0.190E-02 0.199E-01 0.524E-01 0.524E-01 0.115E+00 0.349E+00 0.349E+00 0.483E+00
         3 0.190E-02 0.199E-01 0.524E-01 0.524E-01 0.115E+00 0.349E+00 0.349E+00 0.483E+00
         4 0.311E-01 0.162E+00 0.214E+00 0.214E+00 0.562E+00 0.842E+00 0.842E+00 0.144E+01
         5 0.190E-02 0.199E-01 0.524E-01 0.524E-01 0.115E+00 0.349E+00 0.349E+00 0.483E+00
         6 0.311E-01 0.162E+00 0.214E+00 0.214E+00 0.562E+00 0.842E+00 0.842E+00 0.144E+01
         7 0.311E-01 0.162E+00 0.214E+00 0.214E+00 0.562E+00 0.842E+00 0.842E+00 0.144E+01
         8 0.524E-01 0.349E+00 0.483E+00 0.483E+00 0.108E+01 0.152E+01 0.152E+01 0.252E+01


 Contracted 2-electron integrals neglected if value below      1.0D-12
 AO integral compression algorithm  1   Integral accuracy      1.0D-12

     30.671 MB (compressed) written to integral file ( 55.0%)


 NUMBER OF SORTED TWO-ELECTRON INTEGRALS:    4156552.     BUFFER LENGTH:  32768
 NUMBER OF SEGMENTS:   1  SEGMENT LENGTH:    4156552      RECORD LENGTH: 524288

 Memory used in sort:       4.71 MW

 SORT1 READ     6989366. AND WROTE     2907704. INTEGRALS IN      9 RECORDS. CPU TIME:     0.16 SEC, REAL TIME:     0.22 SEC
 SORT2 READ     2907704. AND WROTE     4156552. INTEGRALS IN    117 RECORDS. CPU TIME:     0.15 SEC, REAL TIME:     0.28 SEC

 FILE SIZES:   FILE 1:    50.9 MBYTE,  FILE 4:    37.8 MBYTE,   TOTAL:     88.7 MBYTE

 OPERATOR DM      FOR CENTER  0  COORDINATES:    0.000000    0.000000    0.000000
 OPERATOR EKIN    FOR CENTER  0  COORDINATES:    0.000000    0.000000    0.000000
 OPERATOR POT     FOR CENTER  0  COORDINATES:    0.000000    0.000000    0.000000


 **********************************************************************************************************************************
 DATASETS  * FILE   NREC   LENGTH (MB)   RECORD NAMES
              1      20       38.71       500      610      700      900      950      970     1000      129      960     1100   
                                          VAR    BASINP    GEOM    SYMINP    ZMAT    AOBASIS   BASIS     P2S    ABASIS      S 
                                         1400     1410     1420     1200     1210     1080     1600     1650     1300     1700   
                                         EKIN       V       ECP      H0       H01     AOSYM     SMH    MOLCAS    ERIS     OPER   

 PROGRAMS   *        TOTAL       INT
 CPU TIMES  *         2.91      2.81
 REAL TIME  *        12.40 SEC
 DISK USED  *        89.02 MB      
 **********************************************************************************************************************************


 PROGRAM * RHF-SCF (OPEN SHELL)       Authors: W. Meyer, H.-J. Werner


 NUMBER OF ELECTRONS:       4+    3-    SPACE SYMMETRY=3    SPIN SYMMETRY: Doublet 
 CONVERGENCE THRESHOLDS:    1.00E-05 (Density)    1.00E-07 (Energy)
 MAX. NUMBER OF ITERATIONS:       60
 INTERPOLATION TYPE:            DIIS
 INTERPOLATION STEPS:              2 (START)      1 (STEP)
 LEVEL SHIFTS:                 -0.60 (CLOSED) -0.30 (OPEN) 

 Number of closed-shell orbitals:    3 (   1   1   0   0   1   0   0   0 )
 Number of open-shell orbitals:      1 (   0   0   1   0   0   0   0   0 )



   Atom=BR basis=ECP28MDF_GUESS    lmin=0  lmax=1

 Orbital guess generated from atomic densities. Full valence occupancy:    1   1   1   0   1   0   0   0


 Molecular orbital dump at record        2100.2

 ITERATION    DDIFF          GRAD             ENERGY        2-EL.EN.            DIPOLE MOMENTS         DIIS   ORB.
    1      0.000D+00      0.000D+00       -13.11813653     17.402220    0.00000    0.00000    0.00000    0    start
    2      0.000D+00      0.474D-02       -13.12106988     17.516335    0.00000    0.00000    0.00000    1    diag,B
    3      0.353D-02      0.134D-02       -13.12149845     17.558698    0.00000    0.00000    0.00000    2    diag,B
    4      0.978D-03      0.395D-03       -13.12154621     17.569118    0.00000    0.00000    0.00000    3    diag,B
    5      0.511D-03      0.979D-04       -13.12154934     17.570779    0.00000    0.00000    0.00000    4    diag,B
    6      0.144D-03      0.243D-04       -13.12154954     17.571234    0.00000    0.00000    0.00000    5    diag,B
    7      0.459D-04      0.728D-05       -13.12154956     17.571315    0.00000    0.00000    0.00000    6    fixocc
    8      0.225D-04      0.184D-05       -13.12154956     17.571343    0.00000    0.00000    0.00000    7    diag,B
    9      0.450D-05      0.429D-06       -13.12154956     17.571347    0.00000    0.00000    0.00000    0    orth

 Final alpha occupancy:   1   1   1   0   1   0   0   0
 Final beta  occupancy:   1   1   0   0   1   0   0   0

 !RHF STATE 1.3 Energy                -13.121549562948
 Nuclear energy                         0.00000000
 One-electron energy                  -21.90722282
 Two-electron energy                    8.78567325
 Virial quotient                       -2.85088586
 !RHF STATE 1.3 Dipole moment           0.00000000     0.00000000     0.00000000
 Dipole moment /Debye                   0.00000000     0.00000000     0.00000000
 

 !RHF expec          <1.3|EKIN|1.3>     4.602621859091
 
 !RHF expec           <1.3|POT|1.3>    -4.025267410340

 ELECTRON ORBITALS
 =================


   Orb  Occ    Energy  Couls-En    Coefficients

                                   1 1s      1 1s      1 1s      1 1s      1 1s      1 1s      1 3d0     1 3d2+    1 3d0     1 3d2+ 
                                   1 3d0     1 3d2+    1 3d0     1 3d2+    1 3d0     1 3d2+    1 5g0     1 5g4+    1 5g2+    1 5g0  
                                   1 5g4+    1 5g2+    1 5g0     1 5g4+    1 5g2+ 

   1.1   2    -1.0195   -4.6423  1.000227  0.001039 -0.003980  0.007110 -0.006716  0.002717  0.000049  0.000084 -0.000055 -0.000095
                                -0.000043 -0.000074  0.002474  0.004285  0.000705  0.001221  0.000002  0.000004  0.000003 -0.000002
                                -0.000004 -0.000003 -0.000009 -0.000019 -0.000014

                                   1 2px     1 2px     1 2px     1 2px     1 2px     1 2px     1 4f1+    1 4f3+    1 4f1+    1 4f3+ 
                                   1 4f1+    1 4f3+    1 4f1+    1 4f3+    1 6h1+    1 6h3+    1 6h5+    1 6h1+    1 6h3+    1 6h5+ 


   1.2   2    -0.4448   -3.3714  1.001194  0.000447 -0.001721  0.002002 -0.003541  0.001896 -0.000409 -0.001583 -0.000867 -0.003356
                                -0.001067 -0.004134 -0.000377 -0.001462  0.000003  0.000011  0.000025  0.000006  0.000018  0.000041

                                   1 2py     1 2py     1 2py     1 2py     1 2py     1 2py     1 4f1-    1 4f3-    1 4f1-    1 4f3- 
                                   1 4f1-    1 4f3-    1 4f1-    1 4f3-    1 6h1-    1 6h3-    1 6h5-    1 6h1-    1 6h3-    1 6h5- 


   1.3   +    -0.5176   -3.4728  1.016637 -0.005223  0.017262  0.005138 -0.043275 -0.004515 -0.002802 -0.003618 -0.006116 -0.007896
                                -0.006780 -0.008753 -0.001929 -0.002490  0.000099  0.000107  0.000143  0.000127  0.000137  0.000183

                                   1 2pz     1 2pz     1 2pz     1 2pz     1 2pz     1 2pz     1 4f0     1 4f2+    1 4f0     1 4f2+ 
                                   1 4f0     1 4f2+    1 4f0     1 4f2+    1 6h2+    1 6h4+    1 6h0     1 6h2+    1 6h4+    1 6h0  


   1.5   2    -0.4448   -3.3714  1.001194  0.000447 -0.001721  0.002002 -0.003541  0.001896 -0.001001 -0.001292 -0.002123 -0.002740
                                -0.002615 -0.003376 -0.000925 -0.001194  0.000018  0.000016  0.000013  0.000030  0.000026  0.000022

 HOMO      1.2    -0.444837 =     -12.1046eV
 LUMO      2.1     0.074674 =       2.0320eV
 LUMO-HOMO         0.519510 =      14.1366eV


 **********************************************************************************************************************************
 DATASETS  * FILE   NREC   LENGTH (MB)   RECORD NAMES
              1      20       38.71       500      610      700      900      950      970     1000      129      960     1100   
                                          VAR    BASINP    GEOM    SYMINP    ZMAT    AOBASIS   BASIS     P2S    ABASIS      S 
                                         1400     1410     1420     1200     1210     1080     1600     1650     1300     1700   
                                         EKIN       V       ECP      H0       H01     AOSYM     SMH    MOLCAS    ERIS     OPER   

              2       4        2.83       700     1000      520     2100   
                                         GEOM     BASIS   MCVARS     RHF  

 PROGRAMS   *        TOTAL        HF       INT
 CPU TIMES  *         3.07      0.16      2.81
 REAL TIME  *        12.69 SEC
 DISK USED  *        89.02 MB      
 **********************************************************************************************************************************
 SETTING SCF(I)         =       -13.12154956  AU                              
 SETTING _CC_NORM_MAX   =         2.00000000                                  


 PROGRAM * UHF-SCF       Authors: W. Meyer, H.-J. Werner


 NUMBER OF ELECTRONS:       4+    3-    SPACE SYMMETRY=3    SPIN SYMMETRY: Doublet 
 CONVERGENCE THRESHOLDS:    1.00E-05 (Density)    1.00E-07 (Energy)
 MAX. NUMBER OF ITERATIONS:        0
 INTERPOLATION TYPE:            DIIS
 INTERPOLATION STEPS:              2 (START)      1 (STEP)
 LEVEL SHIFTS:                  0.20 (ALPHA)   0.20 (BETA) 

 Number of closed-shell orbitals:    3 (   1   1   0   0   1   0   0   0 )
 Number of open-shell orbitals:      1 (   0   0   1   0   0   0   0   0 )


 Molecular orbitals read from record     2100.2  Type=RHF/CANONICAL (state 1.3)

 Molecular orbital dump at record        2200.2

 Initial alpha occupation   1   1   1   0   1   0   0   0
 Initial beta  occupation   1   1   0   0   1   0   0   0

 ITERATION    DDIFF          GRAD             ENERGY        2-EL.EN.            DIPOLE MOMENTS         DIIS
    1      0.000D+00      0.000D+00       -13.12154956     17.571347    0.00000    0.00000    0.00000    0
 
 Final alpha occupancy:   1   1   1   0   1   0   0   0
 Final beta  occupancy:   1   1   0   0   1   0   0   0

 !UHF STATE 1.3 Energy                -13.121549562948
 Nuclear energy                         0.00000000
 One-electron energy                  -21.90722282
 Two-electron energy                    8.78567325
 Virial quotient                       -2.85088586
 !UHF STATE 1.3 Dipole moment           0.00000000     0.00000000     0.00000000
 Dipole moment /Debye                   0.00000000     0.00000000     0.00000000
 

 !UHF expec          <1.3|EKIN|1.3>     4.602621859091
 
 !UHF expec           <1.3|POT|1.3>    -4.025267410340

 ELECTRON ORBITALS FOR POSITIVE SPIN
 ===================================


   Orb  Occ    Energy  Couls-En    Coefficients

                                   1 1s      1 1s      1 1s      1 1s      1 1s      1 1s      1 3d0     1 3d2+    1 3d0     1 3d2+ 
                                   1 3d0     1 3d2+    1 3d0     1 3d2+    1 3d0     1 3d2+    1 5g0     1 5g4+    1 5g2+    1 5g0  
                                   1 5g4+    1 5g2+    1 5g0     1 5g4+    1 5g2+ 

   1.1   +    -1.0195   -4.6423  1.000227  0.001039 -0.003980  0.007110 -0.006716  0.002717  0.000049  0.000084 -0.000055 -0.000095
                                -0.000043 -0.000074  0.002474  0.004285  0.000705  0.001221  0.000002  0.000004  0.000003 -0.000002
                                -0.000004 -0.000003 -0.000009 -0.000019 -0.000014

                                   1 2px     1 2px     1 2px     1 2px     1 2px     1 2px     1 4f1+    1 4f3+    1 4f1+    1 4f3+ 
                                   1 4f1+    1 4f3+    1 4f1+    1 4f3+    1 6h1+    1 6h3+    1 6h5+    1 6h1+    1 6h3+    1 6h5+ 


   1.2   +    -0.4448   -3.3714  1.001194  0.000447 -0.001721  0.002002 -0.003541  0.001896 -0.000409 -0.001583 -0.000867 -0.003356
                                -0.001067 -0.004134 -0.000377 -0.001462  0.000003  0.000011  0.000025  0.000006  0.000018  0.000041

                                   1 2py     1 2py     1 2py     1 2py     1 2py     1 2py     1 4f1-    1 4f3-    1 4f1-    1 4f3- 
                                   1 4f1-    1 4f3-    1 4f1-    1 4f3-    1 6h1-    1 6h3-    1 6h5-    1 6h1-    1 6h3-    1 6h5- 


   1.3   +    -0.5176   -3.4728  1.016637 -0.005223  0.017262  0.005138 -0.043275 -0.004515 -0.002802 -0.003618 -0.006116 -0.007896
                                -0.006780 -0.008753 -0.001929 -0.002490  0.000099  0.000107  0.000143  0.000127  0.000137  0.000183

                                   1 2pz     1 2pz     1 2pz     1 2pz     1 2pz     1 2pz     1 4f0     1 4f2+    1 4f0     1 4f2+ 
                                   1 4f0     1 4f2+    1 4f0     1 4f2+    1 6h2+    1 6h4+    1 6h0     1 6h2+    1 6h4+    1 6h0  


   1.5   +    -0.4448   -3.3714  1.001194  0.000447 -0.001721  0.002002 -0.003541  0.001896 -0.001001 -0.001292 -0.002123 -0.002740
                                -0.002615 -0.003376 -0.000925 -0.001194  0.000018  0.000016  0.000013  0.000030  0.000026  0.000022

 ELECTRON ORBITALS FOR NEGATIVE SPIN
 ===================================


   Orb  Occ    Energy  Couls-En    Coefficients

                                   1 1s      1 1s      1 1s      1 1s      1 1s      1 1s      1 3d0     1 3d2+    1 3d0     1 3d2+ 
                                   1 3d0     1 3d2+    1 3d0     1 3d2+    1 3d0     1 3d2+    1 5g0     1 5g4+    1 5g2+    1 5g0  
                                   1 5g4+    1 5g2+    1 5g0     1 5g4+    1 5g2+ 

   1.1   -    -1.0195   -4.6423  1.000227  0.001039 -0.003980  0.007110 -0.006716  0.002717  0.000049  0.000084 -0.000055 -0.000095
                                -0.000043 -0.000074  0.002474  0.004285  0.000705  0.001221  0.000002  0.000004  0.000003 -0.000002
                                -0.000004 -0.000003 -0.000009 -0.000019 -0.000014

                                   1 2px     1 2px     1 2px     1 2px     1 2px     1 2px     1 4f1+    1 4f3+    1 4f1+    1 4f3+ 
                                   1 4f1+    1 4f3+    1 4f1+    1 4f3+    1 6h1+    1 6h3+    1 6h5+    1 6h1+    1 6h3+    1 6h5+ 


   1.2   -    -0.4448   -3.3714  1.001194  0.000447 -0.001721  0.002002 -0.003541  0.001896 -0.000409 -0.001583 -0.000867 -0.003356
                                -0.001067 -0.004134 -0.000377 -0.001462  0.000003  0.000011  0.000025  0.000006  0.000018  0.000041

                                   1 2pz     1 2pz     1 2pz     1 2pz     1 2pz     1 2pz     1 4f0     1 4f2+    1 4f0     1 4f2+ 
                                   1 4f0     1 4f2+    1 4f0     1 4f2+    1 6h2+    1 6h4+    1 6h0     1 6h2+    1 6h4+    1 6h0  


   1.5   -    -0.4448   -3.3714  1.001194  0.000447 -0.001721  0.002002 -0.003541  0.001896 -0.001001 -0.001292 -0.002123 -0.002740
                                -0.002615 -0.003376 -0.000925 -0.001194  0.000018  0.000016  0.000013  0.000030  0.000026  0.000022

 HOMO      1.2    -0.444837 =     -12.1046eV
 LUMO     -1.3    -0.517559 =     -14.0835eV
 LUMO-HOMO        -0.072722 =      -1.9789eV

 EXPECTATION VALUE OF S**2:             0.75000000

 Occupation number threshold for canonical orbitals:  1.999000 (occupied),  0.001000 (virtual)

 Number of pseudo-canonical orbitals per symmetry:    1   1   0   0   1   0   0   0
 Number of active natural orbitals per symmetry:      0   0   1   0   0   0   0   0

 NATURAL CHARGE ORBITALS
 =======================


   Orb     Occ        Energy       Coefficients

                                   1 1s      1 1s      1 1s      1 1s      1 1s      1 1s      1 3d0     1 3d2+    1 3d0     1 3d2+ 
                                   1 3d0     1 3d2+    1 3d0     1 3d2+    1 3d0     1 3d2+    1 5g0     1 5g4+    1 5g2+    1 5g0  
                                   1 5g4+    1 5g2+    1 5g0     1 5g4+    1 5g2+ 

   1.1  2.00000    -1.019486     1.000227  0.001039 -0.003980  0.007110 -0.006716  0.002717  0.000049  0.000084 -0.000055 -0.000095
                                -0.000043 -0.000074  0.002474  0.004285  0.000705  0.001221  0.000002  0.000004  0.000003 -0.000002
                                -0.000004 -0.000003 -0.000009 -0.000019 -0.000014

                                   1 2px     1 2px     1 2px     1 2px     1 2px     1 2px     1 4f1+    1 4f3+    1 4f1+    1 4f3+ 
                                   1 4f1+    1 4f3+    1 4f1+    1 4f3+    1 6h1+    1 6h3+    1 6h5+    1 6h1+    1 6h3+    1 6h5+ 


   1.2  2.00000    -0.444837     1.001194  0.000447 -0.001721  0.002002 -0.003541  0.001896 -0.000409 -0.001583 -0.000867 -0.003356
                                -0.001067 -0.004134 -0.000377 -0.001462  0.000003  0.000011  0.000025  0.000006  0.000018  0.000041

                                   1 2py     1 2py     1 2py     1 2py     1 2py     1 2py     1 4f1-    1 4f3-    1 4f1-    1 4f3- 
                                   1 4f1-    1 4f3-    1 4f1-    1 4f3-    1 6h1-    1 6h3-    1 6h5-    1 6h1-    1 6h3-    1 6h5- 


   1.3  1.00000    -0.277954     1.016637 -0.005223  0.017262  0.005138 -0.043275 -0.004515 -0.002802 -0.003618 -0.006116 -0.007896
                                -0.006780 -0.008753 -0.001929 -0.002490  0.000099  0.000107  0.000143  0.000127  0.000137  0.000183

                                   1 2pz     1 2pz     1 2pz     1 2pz     1 2pz     1 2pz     1 4f0     1 4f2+    1 4f0     1 4f2+ 
                                   1 4f0     1 4f2+    1 4f0     1 4f2+    1 6h2+    1 6h4+    1 6h0     1 6h2+    1 6h4+    1 6h0  


   1.5  2.00000    -0.444837     1.001194  0.000447 -0.001721  0.002002 -0.003541  0.001896 -0.001001 -0.001292 -0.002123 -0.002740
                                -0.002615 -0.003376 -0.000925 -0.001194  0.000018  0.000016  0.000013  0.000030  0.000026  0.000022

 Natural orbitals saved to record    2200.2 (Orbital set 3)

 Orbital spaces for UNO-CAS (Min. occupation: 0.020  Max. occupation: 1.980):

 Closed:        1   1   0   0   1   0   0   0
 Active:        0   0   1   0   0   0   0   0

 No convergence



 **********************************************************************************************************************************
 DATASETS  * FILE   NREC   LENGTH (MB)   RECORD NAMES
              1      20       38.71       500      610      700      900      950      970     1000      129      960     1100   
                                          VAR    BASINP    GEOM    SYMINP    ZMAT    AOBASIS   BASIS     P2S    ABASIS      S 
                                         1400     1410     1420     1200     1210     1080     1600     1650     1300     1700   
                                         EKIN       V       ECP      H0       H01     AOSYM     SMH    MOLCAS    ERIS     OPER   

              2       5        5.45       700     1000      520     2100     2200   
                                         GEOM     BASIS   MCVARS     RHF      UHF  

 PROGRAMS   *        TOTAL       UHF        HF       INT
 CPU TIMES  *         3.10      0.02      0.16      2.81
 REAL TIME  *        12.90 SEC
 DISK USED  *        89.02 MB      
 **********************************************************************************************************************************
 SETTING SCF(I)         =       -13.12154956  AU                              


 PROGRAM * MRCC (General Multireference Coupled Cluster)    Author: M. Kallay, 2000-2005

 ***  Initialisation ***

   0 Spin projections
 
 Molecular orbitals read from record     2200.2  Type=UHF/ALPHA (state 1.3)

 ?Warning: UHF not converged
 Molecular orbitals read from record     2200.2  Type=UHF/BETA (state 1.3)

 ?Warning: UHF not converged
 
 Frozen orbitals:              0 (  0  0  0  0  0  0  0  0)
 Active orbitals:            126 ( 25 20 20 11 20 11 11  8)
 Active electrons:             7
 Spin quantum number:          0.5

 Transformed integrals will be written to file mrccdir/mrcc_14155/fort.55

 Load integrals                3.1 sec
 Transform integrals           5.0 sec
 Storage for integrals:       24278327
 Remaining memory:           *********

 Core energy:               0.00000000
 
 MRCC Input:
     4     0     0     0     3     0     0     3     0     0     0     1     1     0     0     7     0     0   0.000     0   64000
  ex.lev,nsing,ntrip, rest,method,dens,conver,symm, diag, CS ,spatial, HF, ndoub,nacto,nactv, tol, maxex, sacc, freq,  dboc,   mem
  2  0  0  0  0  0  0  0  0  0  0  0  0  0  0  0  0  0  0  0  0  0  0  0  0  2  0  0  0  0  0  0  0  0  0  0  0  0  0  0  0  0  0  0  0  1  0  0  0  0  0  0  0  0  0  0  0  0  0  0  0  0  0  0  0  0  0  0  0  0  0  0  0  0  0  0  2  0  0  0  0  0  0  0  0  0  0  0  0  0  0  0  0  0  0  0  0  0  0  0  0  0  0  0  0  0  0  0  0  0  0  0  0  0  0  0  0  0  0  0  0  0  0  0  0  0
 MRCC Input end
 Variable memory released
 MRCC now being run, temporary output in /global/cscratch1/sd/aannabe/mrccdir/mrcc_14155/mrcc.out
 **********************************************************************
                          MRCC program system
 **********************************************************************

                              Written by
  Mihaly Kallay, Zoltan Rolik, Jozsef Csontos, Peter Nagy, Gyula Samu,
      David Mester, Jozsef Csoka, Bernat Szabo, Istvan Ladjanszki,
       Lorant Szegedy, Bence Ladoczki, Klara Petrov, Mate Farkas,
                    Pal D. Mezei, and Bence Hegely

        Department of Physical Chemistry and Materials Science
            Budapest University of Technology and Economics
                  Budapest P.O.Box 91, H-1521 Hungary

                              www.mrcc.hu

                       Release date: May 23, 2018

 ************************ 2019-06-25 12:56:41 *************************
 Executing goldstone...

 Generation of CC equations in terms of H and T...
 Generation of antisymmetrized Goldstone diagrams...
 Number of diagrams in T^1 equations:    15
 Number of diagrams in T^2 equations:    38
 Number of diagrams in T^3 equations:    49
 Number of diagrams in T^4 equations:     5
 Translation of diagrams to factorized equations...
 Optimizing intermediate calculation...
 Number of floating-point operations per iteration step:   1.0665E+12
 Probable CPU time per iteration step (hours):     10.67
 Required memory (Mbytes):   29412.3
 Number of intermediates:                                  79
 Number of intermediates to be stored:                     32
 Length of intermediate file (Mbytes):     511.2

 ************************ 2019-06-25 12:56:42 *************************
 Executing xmrcc...

 **********************************************************************
 CC(3)(4) calculation


 Allocation of****** Mbytes of memory...
 Number of spinorbitals:                   252
 Number of alpha electrons:                        4
 Number of beta electrons:                         3
 Spin multiplicity:                     2
 z-component of spin:  0.5
 Spatial symmetry:                      3
 Convergence criterion:  1.0E-07
 Construction of occupation graphs...
 Number of                     0 -fold excitations:                      1
 Number of                     1 -fold excitations:                    143
 Number of                     2 -fold excitations:                  31673
 Number of                     3 -fold excitations:                3601177
 Total number of configurations:                3632994
 Calculation of coupling coefficients...
 Length of intermediate file (Mbytes):     386.4

 ======================================================================

 Spin case  1   Alpha:  1   Beta:  3
 Number of excitations:               18451565
 Spin case  2   Alpha:  2   Beta:  2
 Number of excitations:              124606837
 Spin case  3   Alpha:  3   Beta:  1
 Number of excitations:               54447452
 Spin case  4   Alpha:  4   Beta:  0
 Number of excitations:                1099202
 Number of                     4 -fold excitations:              198605056

 Memory requirements /Mbyte/:
               Minimal        Optimal
 Real*8:        773.5070      1923.2150
 Integer:       154.3052
 Total:         927.8123      2077.5202


 ************************ 2019-06-25 12:56:56 *************************
 Executing mrcc...

 **********************************************************************
 CCSDT(Q) calculation


 Allocation of 1923.2 Mbytes of memory...
 Number of spinorbitals: 252
 Number of alpha electrons:  4
 Number of beta  electrons:  3
 Spin multiplicity: 2
 z-component of spin:  0.5
 Spatial symmetry: 3
 Convergence criterion:  1.0E-07
 Construction of occupation graphs...
 Number of 0-fold excitations: 1
 Number of 1-fold excitations: 143
 Number of 2-fold excitations: 31673
 Number of 3-fold excitations: 3601177
 Total number of determinants: 3632994
 Calculation of coupling coefficients...
 Initial cluster amplitudes are generated.
 Length of intermediate file (Mbytes):     386.4
 Reading integral list from unit 55...
 Sorting integrals...
 Sorting integrals...
 Sorting integrals...
 Sorting integrals...
 Energy of reference determinant [au]:     -13.121549562948
 Calculation of MP denominators...

 Starting CC iteration...
 ======================================================================
 Norm of residual vector:     0.80490236
 CPU time [min]:     1.623                   Wall time [min]:     1.627

 Iteration  1  CC energy:   -13.29376596  Energy decrease:   0.17221639
 ======================================================================
 Norm of residual vector:     0.20667951
 CPU time [min]:     2.547                   Wall time [min]:     2.557

 Iteration  2  CC energy:   -13.30320165  Energy decrease:   0.00943570
 ======================================================================
 Norm of residual vector:     0.05220367
 CPU time [min]:     3.515                   Wall time [min]:     3.536

 Iteration  3  CC energy:   -13.31337193  Energy decrease:   0.01017028
 ======================================================================
 Norm of residual vector:     0.01166276
 CPU time [min]:     4.487                   Wall time [min]:     4.512

 Iteration  4  CC energy:   -13.31381998  Energy decrease:   0.00044805
 ======================================================================
 Norm of residual vector:     0.00373786
 CPU time [min]:     5.465                   Wall time [min]:     5.494

 Iteration  5  CC energy:   -13.31380048  Energy decrease:   0.00001950
 ======================================================================
 Norm of residual vector:     0.00130747
 CPU time [min]:     6.448                   Wall time [min]:     6.484

 Iteration  6  CC energy:   -13.31381432  Energy decrease:   0.00001384
 ======================================================================
 Norm of residual vector:     0.00049137
 CPU time [min]:     7.434                   Wall time [min]:     7.474

 Iteration  7  CC energy:   -13.31381469  Energy decrease:   0.00000037
 ======================================================================
 Norm of residual vector:     0.00020823
 CPU time [min]:     8.424                   Wall time [min]:     8.466

 Iteration  8  CC energy:   -13.31381187  Energy decrease:   0.00000282
 ======================================================================
 Norm of residual vector:     0.00007950
 CPU time [min]:     9.418                   Wall time [min]:     9.462

 Iteration  9  CC energy:   -13.31381376  Energy decrease:   0.00000189
 ======================================================================
 Norm of residual vector:     0.00002724
 CPU time [min]:    10.416                   Wall time [min]:    10.467

 Iteration 10  CC energy:   -13.31381405  Energy decrease:   0.00000028
 ======================================================================
 Norm of residual vector:     0.00000926
 CPU time [min]:    11.420                   Wall time [min]:    11.484

 Iteration 11  CC energy:   -13.31381369  Energy decrease:   0.00000035
 ======================================================================
 Norm of residual vector:     0.00000291
 CPU time [min]:    12.427                   Wall time [min]:    12.495

 Iteration 12  CC energy:   -13.31381373  Energy decrease:   0.00000003
 ======================================================================
 Norm of residual vector:     0.00000090
 CPU time [min]:    13.438                   Wall time [min]:    13.508

 Iteration 13  CC energy:   -13.31381376  Energy decrease:   0.00000003
 ======================================================================
 Norm of residual vector:     0.00000028
 CPU time [min]:    14.453                   Wall time [min]:    14.526

 Iteration 14  CC energy:   -13.31381375  Energy decrease:   0.00000001
 ======================================================================
 Norm of residual vector:     0.00000009
 CPU time [min]:    15.403                   Wall time [min]:    15.526

 Iteration 15  CC energy:   -13.31381375  Energy decrease:   7.5423E-10
 ======================================================================

 Iteration has converged in 15 steps.

 Final results:
 Total CCSDT energy [au]:            -13.313813751482
 Total MP2 energy [au]:              -13.293765955392

 Perturbative corrections are calculated...
 ======================================================================
 Spin case  1   Alpha:  1   Beta:  3
 Number of excitations:        18451565
 CPU time [min]:    86.637                   Wall time [min]:    86.767
 ======================================================================
 Spin case  2   Alpha:  2   Beta:  2
 Number of excitations:        124606837
 CPU time [min]:   256.439                   Wall time [min]:   256.597
 ======================================================================
 Spin case  3   Alpha:  3   Beta:  1
 Number of excitations:        54447452
 CPU time [min]:   359.358                   Wall time [min]:   359.536
 ======================================================================
 Spin case  4   Alpha:  4   Beta:  0
 Number of excitations:        1099202
 CPU time [min]:   368.381                   Wall time [min]:   368.570
 ======================================================================
 Number of 4-fold excitations: 198605056
 CPU time [min]:   368.381                   Wall time [min]:   368.570

 Total CCSDT[Q] energy [au]:         -13.313785953766
 Total CCSDT(Q) energy [au]:         -13.314026525541

 ************************ 2019-06-25 19:05:31 *************************
                      Normal termination of mrcc.
 **********************************************************************
 !CCSDT STATE 1.3 Energy              -13.313813751482
 !MP2 STATE 1.3 Energy                -13.293765955392
 !CCSDT[Q] STATE 1.3 Energy           -13.313785953766
 !CCSDT(Q) STATE 1.3 Energy           -13.314026525541
 
 CPU-time for MRCC:          22102.9 sec
 Elapsed-time for MRCC:      22131.6 sec

 Variable memory set to 8000000000 words,  buffer space   230000 words



 **********************************************************************************************************************************
 DATASETS  * FILE   NREC   LENGTH (MB)   RECORD NAMES
              1      20       38.71       500      610      700      900      950      970     1000      129      960     1100   
                                          VAR    BASINP    GEOM    SYMINP    ZMAT    AOBASIS   BASIS     P2S    ABASIS      S 
                                         1400     1410     1420     1200     1210     1080     1600     1650     1300     1700   
                                         EKIN       V       ECP      H0       H01     AOSYM     SMH    MOLCAS    ERIS     OPER   

              2       5        5.45       700     1000      520     2100     2200   
                                         GEOM     BASIS   MCVARS     RHF      UHF  

 PROGRAMS   *        TOTAL      MRCC       UHF        HF       INT
 CPU TIMES  *     22160.03  22156.93      0.02      0.16      2.81
 REAL TIME  *     22423.35 SEC
 DISK USED  *        89.02 MB      
 **********************************************************************************************************************************
 SETTING POSTHF(I)      =       -13.31402653  AU                              
                                                                                                                                                                                                                                                                

        SCF            POSTHF       EKIN          POT
    -13.12154956   -13.31402653   4.60262186   -4.02526741
                                                  

 CCSDT(Q)/USERDEF energy=    -13.314026525541

        CCSDT(Q)        HF-SCF  
    -13.31402653    -13.12154956
 **********************************************************************************************************************************
 Molpro calculation terminated
 Variable memory released
