
 Primary working directories    : /global/cscratch1/sd/aannabe
 Secondary working directories  : /global/cscratch1/sd/aannabe
 Wavefunction directory         : /global/homes/a/aannabe/wfu/
 Main file repository           : /global/cscratch1/sd/aannabe/

 SHA1      : 2873118e99aab1bc19f5b6fc1784693c06d15c95
 NAME      : 2015.1.8
 ARCHNAME  : linux/x86_64
 FC        : /opt/cray/pe/craype/2.5.5/bin/ftn
 BLASLIB   : -Wl,-_start-group /opt/intel/compilers_and_libraries_2016.3.210/linux/mkl/lib/intel64/libmkl_intel_ilp64.a /opt/intel/compilers_and_libraries_2016.3.210/linux/mkl/lib/intel64/libmkl_intel_thread.a /opt/intel/compilers_and_libraries_2016.3.210/linux/mkl/lib/intel64/libmkl_core.a -Wl,-_end-group
 id        : lbl

 Nodes     nprocs
 nid00507     1

 Using customized tuning parameters: mindgm=8; mindgv=16; mindgc=4; mindgr=1; noblas=0; minvec=7
 default implementation of scratch files=df  

 ***,C
 memory,8,g
 gthresh,twoint=1.e-12
 
 gprint,basis,orbitals
 gexpec,ekin,pot
 
 angstrom
 geometry={
 1                                                                               ! Number of atoms
 C 0.0 0.0 0.0
 }
 
 basis={
 Including file /global/homes/a/aannabe/docs/accurate/ccECP_Kh/pps/C.pp
 Including file /global/homes/a/aannabe/docs/accurate/ccECP_Kh/basis/aug-cc-pVnZ/C_dz.basis
 }
 
 {rhf
  start,atden
  wf,4,4,2
  occ,1,1,1,0,0,0,0,0
  open,1.2,1.3
  save,4202.2
 }
 {multi
  start,4202.2
  occ,1,1,1,0,1,0,0
  closed,1,0,0,0,0,0,0,0
  wf,4,4,2;state,1
  wf,4,6,2;state,1
  wf,4,7,2;state,1
  natorb,ci,print
  orbital,5202.2
 }
 {rhf,nitord=1,maxit=0
  start,5202.2
  wf,4,4,2
  occ,1,1,1,0,0,0,0,0
  open,1.2,1.3
 }
 
 scf(i)=energy
 
 _CC_NORM_MAX=2.0
  !NOTE: Perturbative MRCC works only with UHF reference. So, here we will trick MRCC by doing zero UHF iteration right after ROHF.
 
 {uhf
 maxit,0
 }
 scf(i)=energy
 
 {mrcc,method=CCSDT(Q)
 orbital,ignore_error=1                                                          !Ignore the fact that UHF WF is not converged
 maxit,100
 core
 }
 posthf(i)=energy
 
 table,scf,posthf,ekin,pot
 save,2.csv,new
 
 

 Variables initialized (889), CPU time= 0.00 sec
 Commands  initialized (702), CPU time= 0.01 sec, 572 directives.
 Default parameters read. Elapsed time= 0.17 sec

 Checking input...
 Passed
1


                                         ***  PROGRAM SYSTEM MOLPRO  ***
                                       Copyright, TTI GmbH Stuttgart, 2015
                                    Version 2015.1 linked Sep  7 2016 23:09:38


 **********************************************************************************************************************************
 LABEL *   C                                                                             
  64 bit serial version                                                                  DATE: 02-Nov-18          TIME: 14:47:40  
 **********************************************************************************************************************************

 SHA1:             2873118e99aab1bc19f5b6fc1784693c06d15c95
 **********************************************************************************************************************************

 THRESHOLDS:

 ZERO    =  1.00D-12  ONEINT  =  1.00D-12  TWOINT  =  1.00D-12  PREFAC  =  1.00D-14  LOCALI  =  1.00D-09  EORDER  =  1.00D-04
 ENERGY  =  0.00D+00  ETEST   =  0.00D+00  EDENS   =  0.00D+00  THRDEDEF=  1.00D-06  GRADIENT=  1.00D-02  STEP    =  1.00D-03
 ORBITAL =  1.00D-05  CIVEC   =  1.00D-05  COEFF   =  1.00D-04  PRINTCI =  5.00D-02  PUNCHCI =  9.90D+01  OPTGRAD =  3.00D-04
 OPTENERG=  1.00D-06  OPTSTEP =  3.00D-04  THRGRAD =  1.00D-10  COMPRESS=  1.00D-11  VARMIN  =  1.00D-07  VARMAX  =  1.00D-03
 THRDOUB =  0.00D+00  THRDIV  =  1.00D-05  THRRED  =  1.00D-07  THRPSP  =  1.00D+00  THRDC   =  1.00D-10  THRCS   =  1.00D-10
 THRNRM  =  1.00D-08  THREQ   =  0.00D+00  THRDE   =  1.00D+00  THRREF  =  1.00D-05  SPARFAC =  1.00D+00  THRDLP  =  1.00D-07
 THRDIA  =  1.00D-10  THRDLS  =  1.00D-07  THRGPS  =  0.00D+00  THRKEX  =  0.00D+00  THRDIS  =  2.00D-01  THRVAR  =  1.00D-10
 THRLOC  =  1.00D-06  THRGAP  =  1.00D-06  THRLOCT = -1.00D+00  THRGAPT = -1.00D+00  THRORB  =  1.00D-06  THRMLTP =  0.00D+00
 THRCPQCI=  1.00D-10  KEXTA   =  0.00D+00  THRCOARS=  0.00D+00  SYMTOL  =  1.00D-06  GRADTOL =  1.00D-06  THROVL  =  1.00D-08
 THRORTH =  1.00D-08  GRID    =  1.00D-06  GRIDMAX =  1.00D-03  DTMAX   =  0.00D+00  THROCCDE=  1.00D-01  THROCCDE=  1.00D-01



 ZUNIT=ANG
 

Geometry recognized as XYZ


 Variable memory set to 8000000000 words,  buffer space   230000 words

 SETTING BASIS          =    USERDEF


 Recomputing integrals since basis changed


 Using spherical harmonics



 PROGRAM * SEWARD (Integral evaluation for generally contracted gaussian basis sets)     Author: Roland Lindh, 1990

 Geometry written to block  1 of record 700

 Orientation using atomic masses  
 Molecule type: Atom
 Symmetry elements: X,Y,Z
 Rotational constants:       0.0000000      0.0000000      0.0000000 GHz  (calculated with average atomic masses)

 Point group  D2h 



 ATOMIC COORDINATES

 NR  ATOM    CHARGE       X              Y              Z

   1  C       4.00    0.000000000    0.000000000    0.000000000


          C   CORE POTENTIAL

          p POTENTIAL

 POWERS             1              3              2
 EXPONENTIALS   14.43502       8.398890       7.381880    
 COEFFICIENTS   4.000000       57.74008      -25.81955    

          s - p POTENTIAL

 POWERS             2
 EXPONENTIALS   7.760790    
 COEFFICIENTS   52.13345    


 BASIS DATA

   Nr Sym  Nuc  Type         Exponents   Contraction coefficients

    1.1 Ag    1  1s          13.073594     0.005158
                              6.541187     0.060342
                              4.573411    -0.197847
                              1.637494    -0.081034
                              0.819297     0.232173
                              0.409924     0.291464
                              0.231300     0.433640
                              0.102619     0.213194
                              0.051344     0.004985
    2.1 Ag    1  1s           0.127852     1.000000
    3.1 Ag    1  1s           0.051141     1.000000
    4.1 Ag    1  3d0          0.561160     1.000000
    5.1 Ag    1  3d2+         0.561160     1.000000
    6.1 Ag    1  3d0          0.224464     1.000000
    7.1 Ag    1  3d2+         0.224464     1.000000
    1.2 B3u   1  2px          9.934169     0.020908
                              3.886955     0.057270
                              1.871016     0.112268
                              0.935757     0.213008
                              0.468003     0.283581
                              0.239473     0.301121
                              0.117063     0.201693
                              0.058547     0.045358
                              0.029281     0.002978
    2.2 B3u   1  2px          0.149161     1.000000
    3.2 B3u   1  2px          0.059664     1.000000
    1.3 B2u   1  2py          9.934169     0.020908
                              3.886955     0.057270
                              1.871016     0.112268
                              0.935757     0.213008
                              0.468003     0.283581
                              0.239473     0.301121
                              0.117063     0.201693
                              0.058547     0.045358
                              0.029281     0.002978
    2.3 B2u   1  2py          0.149161     1.000000
    3.3 B2u   1  2py          0.059664     1.000000
    1.4 B1g   1  3d2-         0.561160     1.000000
    2.4 B1g   1  3d2-         0.224464     1.000000
    1.5 B1u   1  2pz          9.934169     0.020908
                              3.886955     0.057270
                              1.871016     0.112268
                              0.935757     0.213008
                              0.468003     0.283581
                              0.239473     0.301121
                              0.117063     0.201693
                              0.058547     0.045358
                              0.029281     0.002978
    2.5 B1u   1  2pz          0.149161     1.000000
    3.5 B1u   1  2pz          0.059664     1.000000
    1.6 B2g   1  3d1+         0.561160     1.000000
    2.6 B2g   1  3d1+         0.224464     1.000000
    1.7 B3g   1  3d1-         0.561160     1.000000
    2.7 B3g   1  3d1-         0.224464     1.000000

 NUCLEAR CHARGE:                    4
 NUMBER OF PRIMITIVE AOS:          56
 NUMBER OF SYMMETRY AOS:           54
 NUMBER OF CONTRACTIONS:           22   (   7Ag  +   3B3u +   3B2u +   2B1g +   3B1u +   2B2g +   2B3g +   0Au  )
 NUMBER OF CORE ORBITALS:           0   (   0Ag  +   0B3u +   0B2u +   0B1g +   0B1u +   0B2g +   0B3g +   0Au  )
 NUMBER OF VALENCE ORBITALS:        4   (   1Ag  +   1B3u +   1B2u +   0B1g +   1B1u +   0B2g +   0B3g +   0Au  )


 NUCLEAR REPULSION ENERGY    0.00000000

 EXTRA SYMMETRY OF AOS IN SYMMETRY 1:   1 1 1 2 3 2 3

 Eigenvalues of metric

         1 0.304E-01 0.299E+00 0.299E+00 0.322E+00 0.170E+01 0.170E+01 0.265E+01
         2 0.104E+00 0.473E+00 0.242E+01
         3 0.104E+00 0.473E+00 0.242E+01
         4 0.299E+00 0.170E+01
         5 0.104E+00 0.473E+00 0.242E+01
         6 0.299E+00 0.170E+01
         7 0.299E+00 0.170E+01


 Contracted 2-electron integrals neglected if value below      1.0D-12
 AO integral compression algorithm  1   Integral accuracy      1.0D-12

     0.262 MB (compressed) written to integral file (100.0%)


 NUMBER OF SORTED TWO-ELECTRON INTEGRALS:       5272.     BUFFER LENGTH:  32768
 NUMBER OF SEGMENTS:   1  SEGMENT LENGTH:       5272      RECORD LENGTH: 524288

 Memory used in sort:       0.56 MW

 SORT1 READ       12220. AND WROTE        4734. INTEGRALS IN      1 RECORDS. CPU TIME:     0.00 SEC, REAL TIME:     0.01 SEC
 SORT2 READ        4734. AND WROTE        5272. INTEGRALS IN      1 RECORDS. CPU TIME:     0.00 SEC, REAL TIME:     0.01 SEC

 FILE SIZES:   FILE 1:    19.3 MBYTE,  FILE 4:     4.2 MBYTE,   TOTAL:     23.6 MBYTE

 OPERATOR DM      FOR CENTER  0  COORDINATES:    0.000000    0.000000    0.000000
 OPERATOR EKIN    FOR CENTER  0  COORDINATES:    0.000000    0.000000    0.000000
 OPERATOR POT     FOR CENTER  0  COORDINATES:    0.000000    0.000000    0.000000


 **********************************************************************************************************************************
 DATASETS  * FILE   NREC   LENGTH (MB)   RECORD NAMES
              1      20       19.12       500      610      700      900      950      970     1000      129      960     1100   
                                          VAR    BASINP    GEOM    SYMINP    ZMAT    AOBASIS   BASIS     P2S    ABASIS      S 
                                         1400     1410     1420     1200     1210     1080     1600     1650     1300     1700   
                                         EKIN       V       ECP      H0       H01     AOSYM     SMH    MOLCAS    ERIS     OPER   

 PROGRAMS   *        TOTAL       INT
 CPU TIMES  *         2.24      2.11
 REAL TIME  *        18.54 SEC
 DISK USED  *        23.83 MB      
 **********************************************************************************************************************************


 PROGRAM * RHF-SCF (OPEN SHELL)       Authors: W. Meyer, H.-J. Werner


 NUMBER OF ELECTRONS:       3+    1-    SPACE SYMMETRY=4    SPIN SYMMETRY: Triplet 
 CONVERGENCE THRESHOLDS:    1.00E-05 (Density)    1.00E-07 (Energy)
 MAX. NUMBER OF ITERATIONS:       60
 INTERPOLATION TYPE:            DIIS
 INTERPOLATION STEPS:              2 (START)      1 (STEP)
 LEVEL SHIFTS:                 -0.60 (CLOSED) -0.30 (OPEN) 


 Singly occupied orbitals:      1.2       1.3

   Atom=C  basis=ECP2MWB_GUESS     lmin=0  lmax=1

 Orbital guess generated from atomic densities. Full valence occupancy:    1   1   1   0   1   0   0   0


 Molecular orbital dump at record        4202.2

 ITERATION    DDIFF          GRAD             ENERGY        2-EL.EN.            DIPOLE MOMENTS         DIIS   ORB.
    1      0.000D+00      0.000D+00        -5.28158368      5.541137    0.00000    0.00000    0.00000    0    start
    2      0.000D+00      0.301D-01        -5.30907599      5.872404    0.00000    0.00000    0.00000    1    diag,B
    3      0.518D-01      0.910D-02        -5.31368449      6.013879    0.00000    0.00000    0.00000    2    diag,B
    4      0.182D-01      0.315D-02        -5.31429863      6.058521    0.00000    0.00000    0.00000    3    diag,B
    5      0.116D-01      0.306D-03        -5.31430245      6.057283    0.00000    0.00000    0.00000    4    diag,B
    6      0.715D-03      0.105D-03        -5.31430312      6.058507    0.00000    0.00000    0.00000    5    diag,B
    7      0.317D-03      0.298D-04        -5.31430315      6.058315    0.00000    0.00000    0.00000    6    fixocc
    8      0.827D-04      0.253D-05        -5.31430315      6.058274    0.00000    0.00000    0.00000    7    diag,B
    9      0.584D-05      0.249D-06        -5.31430315      6.058274    0.00000    0.00000    0.00000    0    orth

 Final alpha occupancy:   1   1   1   0   0   0   0
 Final beta  occupancy:   1   0   0   0   0   0   0

 !RHF STATE 1.4 Energy                 -5.314303147144
 Nuclear energy                         0.00000000
 One-electron energy                   -8.34344021
 Two-electron energy                    3.02913707
 Virial quotient                       -1.54733558
 !RHF STATE 1.4 Dipole moment           0.00000000     0.00000000     0.00000000
 Dipole moment /Debye                   0.00000000     0.00000000     0.00000000
 

 !RHF expec          <1.4|EKIN|1.4>     3.434486490871
 
 !RHF expec           <1.4|POT|1.4>    -3.072590491357

 ELECTRON ORBITALS
 =================


   Orb  Occ    Energy  Couls-En    Coefficients

                                   1 1s      1 1s      1 1s      1 3d0     1 3d2+    1 3d0     1 3d2+ 

   1.1   2    -0.7072   -2.9683  1.000004  0.000045 -0.000086 -0.000637 -0.000000 -0.004629 -0.000000

                                   1 2px     1 2px     1 2px  

   1.2   +    -0.4353   -2.3460  0.999915  0.000127 -0.000036

                                   1 2py     1 2py     1 2py  

   1.3   +    -0.4353   -2.3460  0.999915  0.000127 -0.000036

 HOMO      1.2    -0.435348 =     -11.8464eV
 LUMO      1.5     0.014767 =       0.4018eV
 LUMO-HOMO         0.450115 =      12.2483eV


 **********************************************************************************************************************************
 DATASETS  * FILE   NREC   LENGTH (MB)   RECORD NAMES
              1      20       19.12       500      610      700      900      950      970     1000      129      960     1100   
                                          VAR    BASINP    GEOM    SYMINP    ZMAT    AOBASIS   BASIS     P2S    ABASIS      S 
                                         1400     1410     1420     1200     1210     1080     1600     1650     1300     1700   
                                         EKIN       V       ECP      H0       H01     AOSYM     SMH    MOLCAS    ERIS     OPER   

              2       4        2.75       700     1000      520     4202   
                                         GEOM     BASIS   MCVARS     RHF  

 PROGRAMS   *        TOTAL       RHF       INT
 CPU TIMES  *         2.28      0.04      2.11
 REAL TIME  *        18.75 SEC
 DISK USED  *        23.83 MB      
 **********************************************************************************************************************************


 PROGRAM * MULTI (Direct Multiconfiguration SCF)       Authors: P.J. Knowles, H.-J. Werner (1984)     S.T. Elbert (1988)


 Number of closed-shell orbitals:   1 (   1   0   0   0   0   0   0   0 )
 Number of active  orbitals:        3 (   0   1   1   0   1   0   0   0 )
 Number of external orbitals:      18 (   6   2   2   2   2   2   2   0 )

 State symmetry 1

 Number of electrons:     2    Spin symmetry=Triplet   Space symmetry=4
 Number of states:        1
 Number of CSFs:          1   (1 determinants, 3 intermediate states)

 State symmetry 2

 Number of electrons:     2    Spin symmetry=Triplet   Space symmetry=6
 Number of states:        1
 Number of CSFs:          1   (1 determinants, 3 intermediate states)

 State symmetry 3

 Number of electrons:     2    Spin symmetry=Triplet   Space symmetry=7
 Number of states:        1
 Number of CSFs:          1   (1 determinants, 3 intermediate states)

 Molecular orbitals read from record     4202.2  Type=RHF/CANONICAL (state 1.4)
 *** IN SYMMETRY 1 ORBITAL  1 SYMMETRY CONTAMINATION OF 0.524D-02 HAS BEEN REMOVED

 EXTRA SYMMETRY OF MOS IN SYMMETRY 1:   1 1 3 2 1 3 2

 Wavefunction dump at record             5202.2

 Convergence thresholds  0.10E-01 (gradient)  0.10E-05 (energy)  0.10E-02 (step length)

 Weight factors for state symmetry  1:    0.33333
 Weight factors for state symmetry  2:    0.33333
 Weight factors for state symmetry  3:    0.33333

 Number of orbital rotations:       12   (     0 Core/Active      6 Core/Virtual   0 Active/Active      6 Active/Virtual)
 Total number of variables:         15


 ITER. MIC  NCI  NEG     ENERGY(VAR)     ENERGY(PROJ)   ENERGY CHANGE     GRAD(0)  GRAD(ORB)   GRAD(CI)     STEP       TIME

   1   25   12    0      -5.27277059      -5.31430904   -0.04153845    0.11128482 0.00000000 0.00000000  0.39D+00      0.02
   2   15   12    0      -5.31418750      -5.31424788   -0.00006037    0.00896366 0.00000000 0.00000000  0.11D-01      0.02
   3   15   12    0      -5.31424795      -5.31424795   -0.00000000    0.00001628 0.00000000 0.00000000  0.19D-04      0.03

 ** WVFN ****  CONVERGENCE REACHED, FINAL GRADIENT:  0.61D-10



 Results for state 1.4
 =====================

 !MCSCF STATE 1.4 Energy               -5.314247950730
 Nuclear energy                         0.00000000
 Kinetic energy                         3.43460442
 One electron energy                   -8.34353584
 Two electron energy                    3.02928789
 Virial ratio                           2.54726638

 !MCSCF STATE 1.4 Dipole moment         0.00000000     0.00000000     0.00000000
 Dipole moment /Debye                   0.00000000     0.00000000     0.00000000



 Results for state 1.6
 =====================

 !MCSCF STATE 1.6 Energy               -5.314247950730
 Nuclear energy                         0.00000000
 Kinetic energy                         3.43460442
 One electron energy                   -8.34353584
 Two electron energy                    3.02928789
 Virial ratio                           2.54726638

 !MCSCF STATE 1.6 Dipole moment         0.00000000     0.00000000     0.00000000
 Dipole moment /Debye                   0.00000000     0.00000000     0.00000000



 Results for state 1.7
 =====================

 !MCSCF STATE 1.7 Energy               -5.314247950730
 Nuclear energy                         0.00000000
 Kinetic energy                         3.43460442
 One electron energy                   -8.34353584
 Two electron energy                    3.02928789
 Virial ratio                           2.54726638

 !MCSCF STATE 1.7 Dipole moment         0.00000000     0.00000000     0.00000000
 Dipole moment /Debye                   0.00000000     0.00000000     0.00000000

 State-averaged charge density matrix saved on record  5202.2 (density set 1)

 !MCSCF expec        <1.4|EKIN|1.4>     3.434604415846
 !MCSCF expec        <1.6|EKIN|1.6>     3.434604415753
 !MCSCF expec        <1.7|EKIN|1.7>     3.434604415753

 !MCSCF expec         <1.4|POT|1.4>    -3.072645282708
 !MCSCF expec         <1.6|POT|1.6>    -3.072645282677
 !MCSCF expec         <1.7|POT|1.7>    -3.072645282677


 NATURAL ORBITALS (state averaged)
 =================================

   Orb     Occ        Energy       Coefficients

                                   1 1s      1 1s      1 1s      1 3d0     1 3d2+    1 3d0     1 3d2+ 

   1.1  2.00000    -0.707190     0.999931  0.000126 -0.000069  0.000000  0.000000  0.000000  0.000000

                                   1 2px     1 2px     1 2px  

   1.2  0.66667    -0.059826     0.999989  0.000029 -0.000024

                                   1 2py     1 2py     1 2py  

   1.3  0.66667    -0.059826     0.999989  0.000029 -0.000024

                                   1 2pz     1 2pz     1 2pz  

   1.5  0.66667    -0.059826     0.999989  0.000029 -0.000024
 

 EXTRA SYMMETRY OF MOS IN SYMMETRY 1:   1 1 2 3 1 3 2

 Natural orbital dump (state averaged) at molpro section  5202.2    (Orbital set 2)


 CI vector for state symmetry 1
 ==============================

 a a 0           1.0000000

 TOTAL ENERGIES                        -5.31424795

 CI vector for state symmetry 2
 ==============================

 a 0 a           1.0000000

 TOTAL ENERGIES                        -5.31424795

 CI vector for state symmetry 3
 ==============================

 0 a a           1.0000000

 TOTAL ENERGIES                        -5.31424795



 **********************************************************************************************************************************
 DATASETS  * FILE   NREC   LENGTH (MB)   RECORD NAMES
              1      21       19.13       500      610      700      900      950      970     1000      129      960     1100   
                                          VAR    BASINP    GEOM    SYMINP    ZMAT    AOBASIS   BASIS     P2S    ABASIS      S 
                                         1400     1410     1420     1200     1210     1080     1600     1650     1300     1700   
                                         EKIN       V       ECP      H0       H01     AOSYM     SMH    MOLCAS    ERIS     OPER   
                                         1380   
                                         JKOP   

              2       5        5.24       700     1000      520     4202     5202   
                                         GEOM     BASIS   MCVARS     RHF     MCSCF   

 PROGRAMS   *        TOTAL     MULTI       RHF       INT
 CPU TIMES  *         2.33      0.06      0.04      2.11
 REAL TIME  *        21.99 SEC
 DISK USED  *        33.51 MB      
 **********************************************************************************************************************************


 PROGRAM * RHF-SCF (OPEN SHELL)       Authors: W. Meyer, H.-J. Werner


 NUMBER OF ELECTRONS:       3+    1-    SPACE SYMMETRY=4    SPIN SYMMETRY: Triplet 
 CONVERGENCE THRESHOLDS:    1.00E-05 (Density)    1.00E-07 (Energy)
 MAX. NUMBER OF ITERATIONS:        0
 INTERPOLATION TYPE:            DIIS
 INTERPOLATION STEPS:              2 (START)      1 (STEP)
 LEVEL SHIFTS:                 -0.60 (CLOSED) -0.30 (OPEN) 


 Singly occupied orbitals:      1.2       1.3
 Molecular orbitals read from record     5202.2  Type=MCSCF/NATURAL (state averaged)

 Molecular orbital dump at record        2101.2

 ITERATION    DDIFF          GRAD             ENERGY        2-EL.EN.            DIPOLE MOMENTS         DIIS   ORB.
    1      0.000D+00      0.000D+00        -5.31424795      6.058576    0.00000    0.00000    0.00000    0    start

 Final alpha occupancy:   1   1   1   0   0   0   0
 Final beta  occupancy:   1   0   0   0   0   0   0

 !RHF STATE 1.4 Energy                 -5.314247950730
 Nuclear energy                         0.00000000
 One-electron energy                   -8.34353584
 Two-electron energy                    3.02928789
 Virial quotient                       -1.54726638
 !RHF STATE 1.4 Dipole moment           0.00000000     0.00000000     0.00000000
 Dipole moment /Debye                   0.00000000     0.00000000     0.00000000
 

 !RHF expec          <1.4|EKIN|1.4>     3.434604415846
 
 !RHF expec           <1.4|POT|1.4>    -3.072645282708

 ELECTRON ORBITALS
 =================


   Orb  Occ    Energy  Couls-En    Coefficients

                                   1 1s      1 1s      1 1s      1 3d0     1 3d2+    1 3d0     1 3d2+ 

   1.1   2    -0.7072   -2.9683  0.999931  0.000126 -0.000069  0.000000  0.000000  0.000000  0.000000

                                   1 2px     1 2px     1 2px  

   1.2   +    -0.0598   -1.9705  0.999989  0.000029 -0.000024

                                   1 2py     1 2py     1 2py  

   1.3   +    -0.0598   -1.9705  0.999989  0.000029 -0.000024

 HOMO      1.2    -0.059826 =      -1.6280eV
 LUMO      1.5    -0.059826 =      -1.6280eV
 LUMO-HOMO        -0.000000 =      -0.0000eV


 **********************************************************************************************************************************
 DATASETS  * FILE   NREC   LENGTH (MB)   RECORD NAMES
              1      21       19.13       500      610      700      900      950      970     1000      129      960     1100   
                                          VAR    BASINP    GEOM    SYMINP    ZMAT    AOBASIS   BASIS     P2S    ABASIS      S 
                                         1400     1410     1420     1200     1210     1080     1600     1650     1300     1700   
                                         EKIN       V       ECP      H0       H01     AOSYM     SMH    MOLCAS    ERIS     OPER   
                                         1380   
                                         JKOP   

              2       6        7.74       700     1000      520     4202     5202     2101   
                                         GEOM     BASIS   MCVARS     RHF     MCSCF     RHF  

 PROGRAMS   *        TOTAL       RHF     MULTI       RHF       INT
 CPU TIMES  *         2.36      0.02      0.06      0.04      2.11
 REAL TIME  *        22.17 SEC
 DISK USED  *        33.51 MB      
 **********************************************************************************************************************************
 SETTING SCF(I)         =        -5.31424795  AU                              
 SETTING _CC_NORM_MAX   =         2.00000000                                  


 PROGRAM * UHF-SCF       Authors: W. Meyer, H.-J. Werner


 NUMBER OF ELECTRONS:       3+    1-    SPACE SYMMETRY=4    SPIN SYMMETRY: Triplet 
 CONVERGENCE THRESHOLDS:    1.00E-05 (Density)    1.00E-07 (Energy)
 MAX. NUMBER OF ITERATIONS:        0
 INTERPOLATION TYPE:            DIIS
 INTERPOLATION STEPS:              2 (START)      1 (STEP)
 LEVEL SHIFTS:                  0.20 (ALPHA)   0.20 (BETA) 



 Molecular orbitals read from record     2101.2  Type=RHF/CANONICAL (state 1.4)

 Molecular orbital dump at record        2200.2

 Initial alpha occupation   1   1   1   0   0   0   0
 Initial beta  occupation   1   0   0   0   0   0   0

 ITERATION    DDIFF          GRAD             ENERGY        2-EL.EN.            DIPOLE MOMENTS         DIIS
    1      0.000D+00      0.000D+00        -5.31424795      6.058576    0.00000    0.00000    0.00000    0
 
 Final alpha occupancy:   1   1   1   0   0   0   0
 Final beta  occupancy:   1   0   0   0   0   0   0

 !UHF STATE 1.4 Energy                 -5.314247950730
 Nuclear energy                         0.00000000
 One-electron energy                   -8.34353584
 Two-electron energy                    3.02928789
 Virial quotient                       -1.54726638
 !UHF STATE 1.4 Dipole moment           0.00000000     0.00000000     0.00000000
 Dipole moment /Debye                   0.00000000     0.00000000     0.00000000
 

 !UHF expec          <1.4|EKIN|1.4>     3.434604415846
 
 !UHF expec           <1.4|POT|1.4>    -3.072645282708

 ELECTRON ORBITALS FOR POSITIVE SPIN
 ===================================


   Orb  Occ    Energy  Couls-En    Coefficients

                                   1 1s      1 1s      1 1s      1 3d0     1 3d2+    1 3d0     1 3d2+ 

   1.1   +    -0.7072   -2.9683  0.999931  0.000126 -0.000069  0.000000  0.000000  0.000000  0.000000

                                   1 2px     1 2px     1 2px  

   1.2   +    -0.0598   -1.9705  0.999989  0.000029 -0.000024

                                   1 2py     1 2py     1 2py  

   1.3   +    -0.0598   -1.9705  0.999989  0.000029 -0.000024

 ELECTRON ORBITALS FOR NEGATIVE SPIN
 ===================================


   Orb  Occ    Energy  Couls-En    Coefficients

                                   1 1s      1 1s      1 1s      1 3d0     1 3d2+    1 3d0     1 3d2+ 

   1.1   -    -0.7072   -2.9683  0.999931  0.000126 -0.000069  0.000000  0.000000  0.000000  0.000000

 HOMO      1.2    -0.059826 =      -1.6280eV
 LUMO      1.5    -0.059826 =      -1.6280eV
 LUMO-HOMO        -0.000000 =      -0.0000eV

 EXPECTATION VALUE OF S**2:             2.00000000

 Occupation number threshold for canonical orbitals:  1.999000 (occupied),  0.001000 (virtual)

 Number of pseudo-canonical orbitals per symmetry:    1   0   0   0   0   0   0
 Number of active natural orbitals per symmetry:      0   1   1   0   0   0   0

 NATURAL CHARGE ORBITALS
 =======================


   Orb     Occ        Energy       Coefficients

                                   1 1s      1 1s      1 1s      1 3d0     1 3d2+    1 3d0     1 3d2+ 

   1.1  2.00000    -0.707190     0.999931  0.000126 -0.000069  0.000000  0.000000  0.000000  0.000000

                                   1 2px     1 2px     1 2px  

   1.2  1.00000    -0.131733     0.999989  0.000029 -0.000024

                                   1 2py     1 2py     1 2py  

   1.3  1.00000    -0.131733     0.999989  0.000029 -0.000024

 Natural orbitals saved to record    2200.2 (Orbital set 3)

 Orbital spaces for UNO-CAS (Min. occupation: 0.020  Max. occupation: 1.980):

 Closed:        1   0   0   0   0   0   0
 Active:        0   1   1   0   0   0   0

 No convergence



 **********************************************************************************************************************************
 DATASETS  * FILE   NREC   LENGTH (MB)   RECORD NAMES
              1      21       19.13       500      610      700      900      950      970     1000      129      960     1100   
                                          VAR    BASINP    GEOM    SYMINP    ZMAT    AOBASIS   BASIS     P2S    ABASIS      S 
                                         1400     1410     1420     1200     1210     1080     1600     1650     1300     1700   
                                         EKIN       V       ECP      H0       H01     AOSYM     SMH    MOLCAS    ERIS     OPER   
                                         1380   
                                         JKOP   

              2       7       10.24       700     1000      520     4202     5202     2101     2200   
                                         GEOM     BASIS   MCVARS     RHF     MCSCF     RHF      UHF  

 PROGRAMS   *        TOTAL       UHF       RHF     MULTI       RHF       INT
 CPU TIMES  *         2.38      0.02      0.02      0.06      0.04      2.11
 REAL TIME  *        22.33 SEC
 DISK USED  *        33.51 MB      
 **********************************************************************************************************************************
 SETTING SCF(I)         =        -5.31424795  AU                              


 PROGRAM * MRCC (General Multireference Coupled Cluster)    Author: M. Kallay, 2000-2005

 ***  Initialisation ***

   0 Spin projections
 
 Molecular orbitals read from record     2200.2  Type=UHF/ALPHA (state 1.4)

 ?Warning: UHF not converged
 Molecular orbitals read from record     2200.2  Type=UHF/BETA (state 1.4)

 ?Warning: UHF not converged
 
 Frozen orbitals:              0 (  0  0  0  0  0  0  0  0)
 Active orbitals:             22 (  7  3  3  2  3  2  2  0)
 Active electrons:             4
 Spin quantum number:          1.0

 Transformed integrals will be written to file mrcc_8210/fort.55

 Load integrals                2.4 sec
 Transform integrals           2.4 sec
 Storage for integrals:          28961
 Remaining memory:           *********

 Core energy:               0.00000000
 
 MRCC Input:
     4     0     0     0     3     0     0     4     0     0     0     1     1     0     0     7     0     0   0.000     0   64000
  ex.lev,nsing,ntrip, rest,method,dens,conver,symm, diag, CS ,spatial, HF, ndoub,nacto,nactv, tol, maxex, sacc, freq,  dboc,   mem
  2  0  0  0  0  0  0  1  0  0  1  0  0  0  0  0  0  0  0  0  0  0
 MRCC Input end
 Variable memory released
 MRCC now being run, temporary output in /global/cscratch1/sd/aannabe/mrcc_8210/mrcc.out
 **********************************************************************
                          MRCC program system
 **********************************************************************

                              Written by
  Mihaly Kallay, Zoltan Rolik, Jozsef Csontos, Peter Nagy, Gyula Samu,
      David Mester, Jozsef Csoka, Bernat Szabo, Istvan Ladjanszki,
       Lorant Szegedy, Bence Ladoczki, Klara Petrov, Mate Farkas,
                    Pal D. Mezei, and Bence Hegely

        Department of Physical Chemistry and Materials Science
            Budapest University of Technology and Economics
                  Budapest P.O.Box 91, H-1521 Hungary

                              www.mrcc.hu

                       Release date: May 23, 2018

 ************************ 2018-11-02 14:48:06 *************************
 Executing goldstone...

 Generation of CC equations in terms of H and T...
 Generation of antisymmetrized Goldstone diagrams...
 Number of diagrams in T^1 equations:    15
 Number of diagrams in T^2 equations:    38
 Number of diagrams in T^3 equations:    49
 Number of diagrams in T^4 equations:     5
 Translation of diagrams to factorized equations...
 Optimizing intermediate calculation...
 Number of floating-point operations per iteration step:   1.0061E+07
 Probable CPU time per iteration step (hours):      0.00
 Required memory (Mbytes):      21.3
 Number of intermediates:                                  80
 Number of intermediates to be stored:                     32
 Length of intermediate file (Mbytes):       0.5

 ************************ 2018-11-02 14:48:07 *************************
 Executing xmrcc...

 **********************************************************************
 CC(3)(4) calculation


 Allocation of 100.0 Mbytes of memory...
 Number of spinorbitals:                    44
 Number of alpha electrons:                        3
 Number of beta electrons:                         1
 Spin multiplicity:                     2
 z-component of spin:  1.0
 Spatial symmetry:                      4
 Convergence criterion:  1.0E-07
 Construction of occupation graphs...
 Number of                     0 -fold excitations:                      1
 Number of                     1 -fold excitations:                     16
 Number of                     2 -fold excitations:                    237
 Number of                     3 -fold excitations:                   1446
 Total number of configurations:                   1700
 Calculation of coupling coefficients...
 Length of intermediate file (Mbytes):       0.7

 ======================================================================

 Spin case  1   Alpha:  3   Beta:  1
 Number of excitations:                   2524
 Number of                     4 -fold excitations:                   2524

 Memory requirements /Mbyte/:
               Minimal        Optimal
 Real*8:         13.8830        13.8869
 Integer:         3.7478
 Total:          17.6308        17.6347


 ************************ 2018-11-02 14:48:08 *************************
 Executing mrcc...

 **********************************************************************
 CCSDT(Q) calculation


 Allocation of   13.9 Mbytes of memory...
 Number of spinorbitals:  44
 Number of alpha electrons:  3
 Number of beta  electrons:  1
 Spin multiplicity: 2
 z-component of spin:  1.0
 Spatial symmetry: 4
 Convergence criterion:  1.0E-07
 Construction of occupation graphs...
 Number of 0-fold excitations: 1
 Number of 1-fold excitations: 16
 Number of 2-fold excitations: 237
 Number of 3-fold excitations: 1446
 Total number of determinants: 1700
 Calculation of coupling coefficients...
 Initial cluster amplitudes are generated.
 Length of intermediate file (Mbytes):       0.7
 Reading integral list from unit 55...
 Sorting integrals...
 Sorting integrals...
 Sorting integrals...
 Sorting integrals...
 Energy of reference determinant [au]:      -5.314247950730
 Calculation of MP denominators...

 Starting CC iteration...
 ======================================================================
 Norm of residual vector:     0.38386693
 CPU time [min]:     0.003                   Wall time [min]:     0.004

 Iteration  1  CC energy:    -5.37193598  Energy decrease:   0.05768803
 ======================================================================
 Norm of residual vector:     0.11046298
 CPU time [min]:     0.004                   Wall time [min]:     0.005

 Iteration  2  CC energy:    -5.39121109  Energy decrease:   0.01927511
 ======================================================================
 Norm of residual vector:     0.03097303
 CPU time [min]:     0.006                   Wall time [min]:     0.006

 Iteration  3  CC energy:    -5.39448484  Energy decrease:   0.00327375
 ======================================================================
 Norm of residual vector:     0.00789247
 CPU time [min]:     0.007                   Wall time [min]:     0.007

 Iteration  4  CC energy:    -5.39504985  Energy decrease:   0.00056501
 ======================================================================
 Norm of residual vector:     0.00222322
 CPU time [min]:     0.008                   Wall time [min]:     0.009

 Iteration  5  CC energy:    -5.39502633  Energy decrease:   0.00002352
 ======================================================================
 Norm of residual vector:     0.00066613
 CPU time [min]:     0.009                   Wall time [min]:     0.010

 Iteration  6  CC energy:    -5.39501474  Energy decrease:   0.00001159
 ======================================================================
 Norm of residual vector:     0.00017539
 CPU time [min]:     0.011                   Wall time [min]:     0.011

 Iteration  7  CC energy:    -5.39502446  Energy decrease:   0.00000972
 ======================================================================
 Norm of residual vector:     0.00005840
 CPU time [min]:     0.012                   Wall time [min]:     0.012

 Iteration  8  CC energy:    -5.39502308  Energy decrease:   0.00000138
 ======================================================================
 Norm of residual vector:     0.00001966
 CPU time [min]:     0.013                   Wall time [min]:     0.014

 Iteration  9  CC energy:    -5.39502267  Energy decrease:   0.00000041
 ======================================================================
 Norm of residual vector:     0.00000521
 CPU time [min]:     0.015                   Wall time [min]:     0.015

 Iteration 10  CC energy:    -5.39502295  Energy decrease:   0.00000028
 ======================================================================
 Norm of residual vector:     0.00000147
 CPU time [min]:     0.016                   Wall time [min]:     0.016

 Iteration 11  CC energy:    -5.39502288  Energy decrease:   0.00000007
 ======================================================================
 Norm of residual vector:     0.00000046
 CPU time [min]:     0.017                   Wall time [min]:     0.018

 Iteration 12  CC energy:    -5.39502289  Energy decrease:   3.0516E-09
 ======================================================================
 Norm of residual vector:     0.00000014
 CPU time [min]:     0.018                   Wall time [min]:     0.019

 Iteration 13  CC energy:    -5.39502289  Energy decrease:   0.00000001
 ======================================================================
 Norm of residual vector:     0.00000004
 CPU time [min]:     0.020                   Wall time [min]:     0.020

 Iteration 14  CC energy:    -5.39502289  Energy decrease:   1.4809E-09
 ======================================================================

 Iteration has converged in 14 steps.

 Final results:
 Total CCSDT energy [au]:             -5.395022892829
 Total MP2 energy [au]:               -5.371935980305

 Perturbative corrections are calculated...
 ======================================================================
 Spin case  1   Alpha:  3   Beta:  1
 Number of excitations:        2524
 CPU time [min]:     0.030                   Wall time [min]:     0.031
 ======================================================================
 Number of 4-fold excitations: 2524
 CPU time [min]:     0.030                   Wall time [min]:     0.031

 Total CCSDT[Q] energy [au]:          -5.395041395473
 Total CCSDT(Q) energy [au]:          -5.395049652166

 ************************ 2018-11-02 14:48:11 *************************
                      Normal termination of mrcc.
 **********************************************************************
 !CCSDT STATE 1.4 Energy               -5.395022892829
 !MP2 STATE 1.4 Energy                 -5.371935980305
 !CCSDT[Q] STATE 1.4 Energy            -5.395041395473
 !CCSDT(Q) STATE 1.4 Energy            -5.395049652166
 
 CPU-time for MRCC:              1.8 sec
 Elapsed-time for MRCC:          9.6 sec

 Variable memory set to 8000000000 words,  buffer space   230000 words



 **********************************************************************************************************************************
 DATASETS  * FILE   NREC   LENGTH (MB)   RECORD NAMES
              1      21       19.13       500      610      700      900      950      970     1000      129      960     1100   
                                          VAR    BASINP    GEOM    SYMINP    ZMAT    AOBASIS   BASIS     P2S    ABASIS      S 
                                         1400     1410     1420     1200     1210     1080     1600     1650     1300     1700   
                                         EKIN       V       ECP      H0       H01     AOSYM     SMH    MOLCAS    ERIS     OPER   
                                         1380   
                                         JKOP   

              2       7       10.24       700     1000      520     4202     5202     2101     2200   
                                         GEOM     BASIS   MCVARS     RHF     MCSCF     RHF      UHF  

 PROGRAMS   *        TOTAL      MRCC       UHF       RHF     MULTI       RHF       INT
 CPU TIMES  *         4.26      1.88      0.02      0.02      0.06      0.04      2.11
 REAL TIME  *        32.45 SEC
 DISK USED  *        33.51 MB      
 **********************************************************************************************************************************
 SETTING POSTHF(I)      =        -5.39504965  AU                              
                                                                                                                                                                                                                                                                

       SCF           POSTHF       EKIN          POT
    -5.31424795   -5.39504965   3.43460442   -3.07264528
                                                  

 CCSDT(Q)/USERDEF energy=     -5.395049652166

        CCSDT(Q)        UHF-SCF         MULTI           RHF-SCF 
     -5.39504965     -5.31424795     -5.31424795     -5.31430315
 **********************************************************************************************************************************
 Variable memory released
