
 Primary working directories    : /global/cscratch1/sd/aannabe
 Secondary working directories  : /global/cscratch1/sd/aannabe
 Wavefunction directory         : /global/homes/a/aannabe/wfu/
 Main file repository           : /global/cscratch1/sd/aannabe/

 SHA1      : 2873118e99aab1bc19f5b6fc1784693c06d15c95
 NAME      : 2015.1.8
 ARCHNAME  : linux/x86_64
 FC        : /opt/cray/pe/craype/2.5.5/bin/ftn
 BLASLIB   : -Wl,-_start-group /opt/intel/compilers_and_libraries_2016.3.210/linux/mkl/lib/intel64/libmkl_intel_ilp64.a /opt/intel/compilers_and_libraries_2016.3.210/linux/mkl/lib/intel64/libmkl_intel_thread.a /opt/intel/compilers_and_libraries_2016.3.210/linux/mkl/lib/intel64/libmkl_core.a -Wl,-_end-group
 id        : lbl

 Nodes     nprocs
 nid00507     1

 Using customized tuning parameters: mindgm=8; mindgv=16; mindgc=4; mindgr=1; noblas=0; minvec=7
 default implementation of scratch files=df  

 ***,C
 memory,8,g
 gthresh,twoint=1.e-12
 
 gprint,basis,orbitals
 gexpec,ekin,pot
 
 angstrom
 geometry={
 1                                                                               ! Number of atoms
 C 0.0 0.0 0.0
 }
 
 basis={
 Including file /global/homes/a/aannabe/docs/accurate/ccECP_Kh/pps/C.pp
 Including file /global/homes/a/aannabe/docs/accurate/ccECP_Kh/basis/aug-cc-pVnZ/C_tz.basis
 }
 
 {rhf
  start,atden
  wf,4,4,2
  occ,1,1,1,0,0,0,0,0
  open,1.2,1.3
  save,4202.2
 }
 {multi
  start,4202.2
  occ,1,1,1,0,1,0,0
  closed,1,0,0,0,0,0,0,0
  wf,4,4,2;state,1
  wf,4,6,2;state,1
  wf,4,7,2;state,1
  natorb,ci,print
  orbital,5202.2
 }
 {rhf,nitord=1,maxit=0
  start,5202.2
  wf,4,4,2
  occ,1,1,1,0,0,0,0,0
  open,1.2,1.3
 }
 
 scf(i)=energy
 
 _CC_NORM_MAX=2.0
  !NOTE: Perturbative MRCC works only with UHF reference. So, here we will trick MRCC by doing zero UHF iteration right after ROHF.
 
 {uhf
 maxit,0
 }
 scf(i)=energy
 
 {mrcc,method=CCSDT(Q)
 orbital,ignore_error=1                                                          !Ignore the fact that UHF WF is not converged
 maxit,100
 core
 }
 posthf(i)=energy
 
 table,scf,posthf,ekin,pot
 save,3.csv,new
 
 

 Variables initialized (889), CPU time= 0.00 sec
 Commands  initialized (702), CPU time= 0.01 sec, 572 directives.
 Default parameters read. Elapsed time= 0.14 sec

 Checking input...
 Passed
1


                                         ***  PROGRAM SYSTEM MOLPRO  ***
                                       Copyright, TTI GmbH Stuttgart, 2015
                                    Version 2015.1 linked Sep  7 2016 23:09:38


 **********************************************************************************************************************************
 LABEL *   C                                                                             
  64 bit serial version                                                                  DATE: 02-Nov-18          TIME: 14:48:29  
 **********************************************************************************************************************************

 SHA1:             2873118e99aab1bc19f5b6fc1784693c06d15c95
 **********************************************************************************************************************************

 THRESHOLDS:

 ZERO    =  1.00D-12  ONEINT  =  1.00D-12  TWOINT  =  1.00D-12  PREFAC  =  1.00D-14  LOCALI  =  1.00D-09  EORDER  =  1.00D-04
 ENERGY  =  0.00D+00  ETEST   =  0.00D+00  EDENS   =  0.00D+00  THRDEDEF=  1.00D-06  GRADIENT=  1.00D-02  STEP    =  1.00D-03
 ORBITAL =  1.00D-05  CIVEC   =  1.00D-05  COEFF   =  1.00D-04  PRINTCI =  5.00D-02  PUNCHCI =  9.90D+01  OPTGRAD =  3.00D-04
 OPTENERG=  1.00D-06  OPTSTEP =  3.00D-04  THRGRAD =  1.00D-10  COMPRESS=  1.00D-11  VARMIN  =  1.00D-07  VARMAX  =  1.00D-03
 THRDOUB =  0.00D+00  THRDIV  =  1.00D-05  THRRED  =  1.00D-07  THRPSP  =  1.00D+00  THRDC   =  1.00D-10  THRCS   =  1.00D-10
 THRNRM  =  1.00D-08  THREQ   =  0.00D+00  THRDE   =  1.00D+00  THRREF  =  1.00D-05  SPARFAC =  1.00D+00  THRDLP  =  1.00D-07
 THRDIA  =  1.00D-10  THRDLS  =  1.00D-07  THRGPS  =  0.00D+00  THRKEX  =  0.00D+00  THRDIS  =  2.00D-01  THRVAR  =  1.00D-10
 THRLOC  =  1.00D-06  THRGAP  =  1.00D-06  THRLOCT = -1.00D+00  THRGAPT = -1.00D+00  THRORB  =  1.00D-06  THRMLTP =  0.00D+00
 THRCPQCI=  1.00D-10  KEXTA   =  0.00D+00  THRCOARS=  0.00D+00  SYMTOL  =  1.00D-06  GRADTOL =  1.00D-06  THROVL  =  1.00D-08
 THRORTH =  1.00D-08  GRID    =  1.00D-06  GRIDMAX =  1.00D-03  DTMAX   =  0.00D+00  THROCCDE=  1.00D-01  THROCCDE=  1.00D-01



 ZUNIT=ANG
 

Geometry recognized as XYZ


 Variable memory set to 8000000000 words,  buffer space   230000 words

 SETTING BASIS          =    USERDEF


 Recomputing integrals since basis changed


 Using spherical harmonics



 PROGRAM * SEWARD (Integral evaluation for generally contracted gaussian basis sets)     Author: Roland Lindh, 1990

 Geometry written to block  1 of record 700

 Orientation using atomic masses  
 Molecule type: Atom
 Symmetry elements: X,Y,Z
 Rotational constants:       0.0000000      0.0000000      0.0000000 GHz  (calculated with average atomic masses)

 Point group  D2h 



 ATOMIC COORDINATES

 NR  ATOM    CHARGE       X              Y              Z

   1  C       4.00    0.000000000    0.000000000    0.000000000


          C   CORE POTENTIAL

          p POTENTIAL

 POWERS             1              3              2
 EXPONENTIALS   14.43502       8.398890       7.381880    
 COEFFICIENTS   4.000000       57.74008      -25.81955    

          s - p POTENTIAL

 POWERS             2
 EXPONENTIALS   7.760790    
 COEFFICIENTS   52.13345    


 BASIS DATA

   Nr Sym  Nuc  Type         Exponents   Contraction coefficients

    1.1 Ag    1  1s          13.073594     0.005158
                              6.541187     0.060342
                              4.573411    -0.197847
                              1.637494    -0.081034
                              0.819297     0.232173
                              0.409924     0.291464
                              0.231300     0.433640
                              0.102619     0.213194
                              0.051344     0.004985
    2.1 Ag    1  1s           0.921552     1.000000
    3.1 Ag    1  1s           0.132800     1.000000
    4.1 Ag    1  1s           0.053120     1.000000
    5.1 Ag    1  3d0          1.141611     1.000000
    6.1 Ag    1  3d2+         1.141611     1.000000
    7.1 Ag    1  3d0          0.329486     1.000000
    8.1 Ag    1  3d2+         0.329486     1.000000
    9.1 Ag    1  3d0          0.131794     1.000000
   10.1 Ag    1  3d2+         0.131794     1.000000
    1.2 B3u   1  2px          9.934169     0.020908
                              3.886955     0.057270
                              1.871016     0.112268
                              0.935757     0.213008
                              0.468003     0.283581
                              0.239473     0.301121
                              0.117063     0.201693
                              0.058547     0.045358
                              0.029281     0.002978
    2.2 B3u   1  2px          0.376742     1.000000
    3.2 B3u   1  2px          0.126772     1.000000
    4.2 B3u   1  2px          0.050709     1.000000
    5.2 B3u   1  4f1+         0.773485     1.000000
    6.2 B3u   1  4f3+         0.773485     1.000000
    7.2 B3u   1  4f1+         0.309394     1.000000
    8.2 B3u   1  4f3+         0.309394     1.000000
    1.3 B2u   1  2py          9.934169     0.020908
                              3.886955     0.057270
                              1.871016     0.112268
                              0.935757     0.213008
                              0.468003     0.283581
                              0.239473     0.301121
                              0.117063     0.201693
                              0.058547     0.045358
                              0.029281     0.002978
    2.3 B2u   1  2py          0.376742     1.000000
    3.3 B2u   1  2py          0.126772     1.000000
    4.3 B2u   1  2py          0.050709     1.000000
    5.3 B2u   1  4f1-         0.773485     1.000000
    6.3 B2u   1  4f3-         0.773485     1.000000
    7.3 B2u   1  4f1-         0.309394     1.000000
    8.3 B2u   1  4f3-         0.309394     1.000000
    1.4 B1g   1  3d2-         1.141611     1.000000
    2.4 B1g   1  3d2-         0.329486     1.000000
    3.4 B1g   1  3d2-         0.131794     1.000000
    1.5 B1u   1  2pz          9.934169     0.020908
                              3.886955     0.057270
                              1.871016     0.112268
                              0.935757     0.213008
                              0.468003     0.283581
                              0.239473     0.301121
                              0.117063     0.201693
                              0.058547     0.045358
                              0.029281     0.002978
    2.5 B1u   1  2pz          0.376742     1.000000
    3.5 B1u   1  2pz          0.126772     1.000000
    4.5 B1u   1  2pz          0.050709     1.000000
    5.5 B1u   1  4f0          0.773485     1.000000
    6.5 B1u   1  4f2+         0.773485     1.000000
    7.5 B1u   1  4f0          0.309394     1.000000
    8.5 B1u   1  4f2+         0.309394     1.000000
    1.6 B2g   1  3d1+         1.141611     1.000000
    2.6 B2g   1  3d1+         0.329486     1.000000
    3.6 B2g   1  3d1+         0.131794     1.000000
    1.7 B3g   1  3d1-         1.141611     1.000000
    2.7 B3g   1  3d1-         0.329486     1.000000
    3.7 B3g   1  3d1-         0.131794     1.000000
    1.8 Au    1  4f2-         0.773485     1.000000
    2.8 Au    1  4f2-         0.309394     1.000000

 NUCLEAR CHARGE:                    4
 NUMBER OF PRIMITIVE AOS:          86
 NUMBER OF SYMMETRY AOS:           77
 NUMBER OF CONTRACTIONS:           45   (  10Ag  +   8B3u +   8B2u +   3B1g +   8B1u +   3B2g +   3B3g +   2Au  )
 NUMBER OF CORE ORBITALS:           0   (   0Ag  +   0B3u +   0B2u +   0B1g +   0B1u +   0B2g +   0B3g +   0Au  )
 NUMBER OF VALENCE ORBITALS:        4   (   1Ag  +   1B3u +   1B2u +   0B1g +   1B1u +   0B2g +   0B3g +   0Au  )


 NUCLEAR REPULSION ENERGY    0.00000000

 EXTRA SYMMETRY OF AOS IN SYMMETRY 1:   1 1 1 1 2 3 2 3 2 3
 EXTRA SYMMETRY OF AOS IN SYMMETRY 2:   1 1 1 1 2 3 2 3
 EXTRA SYMMETRY OF AOS IN SYMMETRY 3:   1 1 1 1 2 3 2 3
 EXTRA SYMMETRY OF AOS IN SYMMETRY 5:   1 1 1 1 2 3 2 3

 Eigenvalues of metric

         1 0.200E-01 0.160E+00 0.201E+00 0.201E+00 0.750E+00 0.831E+00 0.831E+00 0.197E+01
         2 0.372E-01 0.119E+00 0.367E+00 0.367E+00 0.811E+00 0.163E+01 0.163E+01 0.303E+01
         3 0.372E-01 0.119E+00 0.367E+00 0.367E+00 0.811E+00 0.163E+01 0.163E+01 0.303E+01
         4 0.201E+00 0.831E+00 0.197E+01
         5 0.372E-01 0.119E+00 0.367E+00 0.367E+00 0.811E+00 0.163E+01 0.163E+01 0.303E+01
         6 0.201E+00 0.831E+00 0.197E+01
         7 0.201E+00 0.831E+00 0.197E+01
         8 0.367E+00 0.163E+01


 Contracted 2-electron integrals neglected if value below      1.0D-12
 AO integral compression algorithm  1   Integral accuracy      1.0D-12

     1.049 MB (compressed) written to integral file ( 96.5%)


 NUMBER OF SORTED TWO-ELECTRON INTEGRALS:      75808.     BUFFER LENGTH:  32768
 NUMBER OF SEGMENTS:   1  SEGMENT LENGTH:      75808      RECORD LENGTH: 524288

 Memory used in sort:       0.63 MW

 SORT1 READ      155797. AND WROTE       61548. INTEGRALS IN      1 RECORDS. CPU TIME:     0.00 SEC, REAL TIME:     0.09 SEC
 SORT2 READ       61548. AND WROTE       75808. INTEGRALS IN      4 RECORDS. CPU TIME:     0.02 SEC, REAL TIME:     0.03 SEC

 FILE SIZES:   FILE 1:    20.2 MBYTE,  FILE 4:     4.2 MBYTE,   TOTAL:     24.4 MBYTE

 OPERATOR DM      FOR CENTER  0  COORDINATES:    0.000000    0.000000    0.000000
 OPERATOR EKIN    FOR CENTER  0  COORDINATES:    0.000000    0.000000    0.000000
 OPERATOR POT     FOR CENTER  0  COORDINATES:    0.000000    0.000000    0.000000


 **********************************************************************************************************************************
 DATASETS  * FILE   NREC   LENGTH (MB)   RECORD NAMES
              1      20       19.61       500      610      700      900      950      970     1000      129      960     1100   
                                          VAR    BASINP    GEOM    SYMINP    ZMAT    AOBASIS   BASIS     P2S    ABASIS      S 
                                         1400     1410     1420     1200     1210     1080     1600     1650     1300     1700   
                                         EKIN       V       ECP      H0       H01     AOSYM     SMH    MOLCAS    ERIS     OPER   

 PROGRAMS   *        TOTAL       INT
 CPU TIMES  *         2.26      2.13
 REAL TIME  *        19.88 SEC
 DISK USED  *        24.67 MB      
 **********************************************************************************************************************************


 PROGRAM * RHF-SCF (OPEN SHELL)       Authors: W. Meyer, H.-J. Werner


 NUMBER OF ELECTRONS:       3+    1-    SPACE SYMMETRY=4    SPIN SYMMETRY: Triplet 
 CONVERGENCE THRESHOLDS:    1.00E-05 (Density)    1.00E-07 (Energy)
 MAX. NUMBER OF ITERATIONS:       60
 INTERPOLATION TYPE:            DIIS
 INTERPOLATION STEPS:              2 (START)      1 (STEP)
 LEVEL SHIFTS:                 -0.60 (CLOSED) -0.30 (OPEN) 


 Singly occupied orbitals:      1.2       1.3

   Atom=C  basis=ECP2MWB_GUESS     lmin=0  lmax=1

 Orbital guess generated from atomic densities. Full valence occupancy:    1   1   1   0   1   0   0   0


 Molecular orbital dump at record        4202.2

 ITERATION    DDIFF          GRAD             ENERGY        2-EL.EN.            DIPOLE MOMENTS         DIIS   ORB.
    1      0.000D+00      0.000D+00        -5.27611330      5.492912    0.00000    0.00000    0.00000    0    start
    2      0.000D+00      0.226D-01        -5.30888072      5.871257    0.00000    0.00000    0.00000    1    diag,B
    3      0.313D-01      0.632D-02        -5.31354253      6.011869    0.00000    0.00000    0.00000    2    diag,B
    4      0.873D-02      0.223D-02        -5.31424751      6.049473    0.00000    0.00000    0.00000    3    diag,B
    5      0.416D-02      0.709D-03        -5.31431122      6.057640    0.00000    0.00000    0.00000    4    diag,B
    6      0.231D-02      0.103D-03        -5.31431217      6.058294    0.00000    0.00000    0.00000    5    diag,B
    7      0.246D-03      0.354D-04        -5.31431227      6.058125    0.00000    0.00000    0.00000    6    fixocc
    8      0.794D-04      0.444D-05        -5.31431227      6.058220    0.00000    0.00000    0.00000    7    diag,B
    9      0.772D-05      0.518D-06        -5.31431227      6.058221    0.00000    0.00000    0.00000    0    orth

 Final alpha occupancy:   1   1   1   0   0   0   0   0
 Final beta  occupancy:   1   0   0   0   0   0   0   0

 !RHF STATE 1.4 Energy                 -5.314312274461
 Nuclear energy                         0.00000000
 One-electron energy                   -8.34342263
 Two-electron energy                    3.02911036
 Virial quotient                       -1.54732107
 !RHF STATE 1.4 Dipole moment           0.00000000     0.00000000     0.00000000
 Dipole moment /Debye                   0.00000000     0.00000000     0.00000000
 

 !RHF expec          <1.4|EKIN|1.4>     3.434524591180
 
 !RHF expec           <1.4|POT|1.4>    -3.072602631984

 ELECTRON ORBITALS
 =================


   Orb  Occ    Energy  Couls-En    Coefficients

                                   1 1s      1 1s      1 1s      1 1s      1 3d0     1 3d2+    1 3d0     1 3d2+    1 3d0     1 3d2+ 


   1.1   2    -0.7072   -2.9683  0.999970  0.000006  0.000116 -0.000143 -0.001118 -0.000000 -0.001503  0.000000 -0.004146 -0.000000

                                   1 2px     1 2px     1 2px     1 2px     1 4f1+    1 4f3+    1 4f1+    1 4f3+ 

   1.2   +    -0.4354   -2.3460  0.999961 -0.000034  0.000084  0.000014  0.000059 -0.000000 -0.000011  0.000000

                                   1 2py     1 2py     1 2py     1 2py     1 4f1-    1 4f3-    1 4f1-    1 4f3- 

   1.3   +    -0.4354   -2.3460  0.999961 -0.000034  0.000084  0.000014  0.000059  0.000000 -0.000011 -0.000000

 HOMO      1.2    -0.435358 =     -11.8467eV
 LUMO      1.5     0.013260 =       0.3608eV
 LUMO-HOMO         0.448619 =      12.2075eV


 **********************************************************************************************************************************
 DATASETS  * FILE   NREC   LENGTH (MB)   RECORD NAMES
              1      20       19.61       500      610      700      900      950      970     1000      129      960     1100   
                                          VAR    BASINP    GEOM    SYMINP    ZMAT    AOBASIS   BASIS     P2S    ABASIS      S 
                                         1400     1410     1420     1200     1210     1080     1600     1650     1300     1700   
                                         EKIN       V       ECP      H0       H01     AOSYM     SMH    MOLCAS    ERIS     OPER   

              2       4        2.76       700     1000      520     4202   
                                         GEOM     BASIS   MCVARS     RHF  

 PROGRAMS   *        TOTAL       RHF       INT
 CPU TIMES  *         2.30      0.04      2.13
 REAL TIME  *        20.07 SEC
 DISK USED  *        24.67 MB      
 **********************************************************************************************************************************


 PROGRAM * MULTI (Direct Multiconfiguration SCF)       Authors: P.J. Knowles, H.-J. Werner (1984)     S.T. Elbert (1988)


 Number of closed-shell orbitals:   1 (   1   0   0   0   0   0   0   0 )
 Number of active  orbitals:        3 (   0   1   1   0   1   0   0   0 )
 Number of external orbitals:      41 (   9   7   7   3   7   3   3   2 )

 State symmetry 1

 Number of electrons:     2    Spin symmetry=Triplet   Space symmetry=4
 Number of states:        1
 Number of CSFs:          1   (1 determinants, 3 intermediate states)

 State symmetry 2

 Number of electrons:     2    Spin symmetry=Triplet   Space symmetry=6
 Number of states:        1
 Number of CSFs:          1   (1 determinants, 3 intermediate states)

 State symmetry 3

 Number of electrons:     2    Spin symmetry=Triplet   Space symmetry=7
 Number of states:        1
 Number of CSFs:          1   (1 determinants, 3 intermediate states)

 Molecular orbitals read from record     4202.2  Type=RHF/CANONICAL (state 1.4)
 *** IN SYMMETRY 1 ORBITAL  1 SYMMETRY CONTAMINATION OF 0.672D-02 HAS BEEN REMOVED

 EXTRA SYMMETRY OF MOS IN SYMMETRY 1:   1 1 3 2 1 3 2 3 2 1
 *** IN SYMMETRY 2 ORBITAL  1 SYMMETRY CONTAMINATION OF 0.696D-04 HAS BEEN REMOVED
 EXTRA SYMMETRY OF MOS IN SYMMETRY 2:   1 1 1 2 3 1 2 3
 *** IN SYMMETRY 3 ORBITAL  1 SYMMETRY CONTAMINATION OF 0.696D-04 HAS BEEN REMOVED
 EXTRA SYMMETRY OF MOS IN SYMMETRY 3:   1 1 1 2 3 1 2 3
 *** IN SYMMETRY 5 ORBITAL  1 SYMMETRY CONTAMINATION OF 0.210D-02 HAS BEEN REMOVED
 EXTRA SYMMETRY OF MOS IN SYMMETRY 5:   1 1 1 2 3 1 2 3

 Wavefunction dump at record             5202.2

 Convergence thresholds  0.10E-01 (gradient)  0.10E-05 (energy)  0.10E-02 (step length)

 Weight factors for state symmetry  1:    0.33333
 Weight factors for state symmetry  2:    0.33333
 Weight factors for state symmetry  3:    0.33333

 Number of orbital rotations:       30   (     0 Core/Active      9 Core/Virtual   0 Active/Active     21 Active/Virtual)
 Total number of variables:         33


 ITER. MIC  NCI  NEG     ENERGY(VAR)     ENERGY(PROJ)   ENERGY CHANGE     GRAD(0)  GRAD(ORB)   GRAD(CI)     STEP       TIME

   1   29   12    0      -5.26775857      -5.31433249   -0.04657392    0.12034069 0.00000000 0.00000000  0.42D+00      0.01
   2   15   12    0      -5.31416383      -5.31424781   -0.00008398    0.01169481 0.00000000 0.00000000  0.11D-01      0.02
   3   15   12    0      -5.31424795      -5.31424795   -0.00000000    0.00003188 0.00000000 0.00000000  0.28D-04      0.03

 ** WVFN ****  CONVERGENCE REACHED, FINAL GRADIENT:  0.24D-09



 Results for state 1.4
 =====================

 !MCSCF STATE 1.4 Energy               -5.314247953483
 Nuclear energy                         0.00000000
 Kinetic energy                         3.43464583
 One electron energy                   -8.34353433
 Two electron energy                    3.02928638
 Virial ratio                           2.54724773

 !MCSCF STATE 1.4 Dipole moment         0.00000000     0.00000000     0.00000000
 Dipole moment /Debye                   0.00000000     0.00000000     0.00000000



 Results for state 1.6
 =====================

 !MCSCF STATE 1.6 Energy               -5.314247953483
 Nuclear energy                         0.00000000
 Kinetic energy                         3.43464583
 One electron energy                   -8.34353433
 Two electron energy                    3.02928638
 Virial ratio                           2.54724773

 !MCSCF STATE 1.6 Dipole moment         0.00000000     0.00000000     0.00000000
 Dipole moment /Debye                   0.00000000     0.00000000     0.00000000



 Results for state 1.7
 =====================

 !MCSCF STATE 1.7 Energy               -5.314247953483
 Nuclear energy                         0.00000000
 Kinetic energy                         3.43464583
 One electron energy                   -8.34353433
 Two electron energy                    3.02928638
 Virial ratio                           2.54724773

 !MCSCF STATE 1.7 Dipole moment         0.00000000     0.00000000     0.00000000
 Dipole moment /Debye                   0.00000000     0.00000000     0.00000000

 State-averaged charge density matrix saved on record  5202.2 (density set 1)

 !MCSCF expec        <1.4|EKIN|1.4>     3.434645826584
 !MCSCF expec        <1.6|EKIN|1.6>     3.434645826241
 !MCSCF expec        <1.7|EKIN|1.7>     3.434645826241

 !MCSCF expec         <1.4|POT|1.4>    -3.072647276031
 !MCSCF expec         <1.6|POT|1.6>    -3.072647275923
 !MCSCF expec         <1.7|POT|1.7>    -3.072647275923


 NATURAL ORBITALS (state averaged)
 =================================

   Orb     Occ        Energy       Coefficients

                                   1 1s      1 1s      1 1s      1 1s      1 3d0     1 3d2+    1 3d0     1 3d2+    1 3d0     1 3d2+ 


   1.1  2.00000    -0.707189     0.999912 -0.000014  0.000191 -0.000114  0.000000  0.000000  0.000000  0.000000  0.000000  0.000000

                                   1 2px     1 2px     1 2px     1 2px     1 4f1+    1 4f3+    1 4f1+    1 4f3+ 

   1.2  0.66667    -0.059827     1.000023 -0.000024  0.000002 -0.000004  0.000000  0.000000  0.000000  0.000000

                                   1 2py     1 2py     1 2py     1 2py     1 4f1-    1 4f3-    1 4f1-    1 4f3- 

   1.3  0.66667    -0.059827     1.000023 -0.000024  0.000002 -0.000004  0.000000  0.000000  0.000000  0.000000

                                   1 2pz     1 2pz     1 2pz     1 2pz     1 4f0     1 4f2+    1 4f0     1 4f2+ 

   1.5  0.66667    -0.059827     1.000023 -0.000024  0.000002 -0.000004  0.000000  0.000000  0.000000  0.000000
 

 EXTRA SYMMETRY OF MOS IN SYMMETRY 1:   1 1 2 3 1 2 3 2 3 1
 EXTRA SYMMETRY OF MOS IN SYMMETRY 2:   1 1 1 3 2 1 2 3
 EXTRA SYMMETRY OF MOS IN SYMMETRY 3:   1 1 1 3 2 1 2 3
 EXTRA SYMMETRY OF MOS IN SYMMETRY 5:   1 1 1 3 2 1 2 3

 Natural orbital dump (state averaged) at molpro section  5202.2    (Orbital set 2)


 CI vector for state symmetry 1
 ==============================

 a a 0           1.0000000

 TOTAL ENERGIES                        -5.31424795

 CI vector for state symmetry 2
 ==============================

 a 0 a           1.0000000

 TOTAL ENERGIES                        -5.31424795

 CI vector for state symmetry 3
 ==============================

 0 a a           1.0000000

 TOTAL ENERGIES                        -5.31424795



 **********************************************************************************************************************************
 DATASETS  * FILE   NREC   LENGTH (MB)   RECORD NAMES
              1      21       19.65       500      610      700      900      950      970     1000      129      960     1100   
                                          VAR    BASINP    GEOM    SYMINP    ZMAT    AOBASIS   BASIS     P2S    ABASIS      S 
                                         1400     1410     1420     1200     1210     1080     1600     1650     1300     1700   
                                         EKIN       V       ECP      H0       H01     AOSYM     SMH    MOLCAS    ERIS     OPER   
                                         1380   
                                         JKOP   

              2       5        5.26       700     1000      520     4202     5202   
                                         GEOM     BASIS   MCVARS     RHF     MCSCF   

 PROGRAMS   *        TOTAL     MULTI       RHF       INT
 CPU TIMES  *         2.36      0.07      0.04      2.13
 REAL TIME  *        23.35 SEC
 DISK USED  *        34.12 MB      
 **********************************************************************************************************************************


 PROGRAM * RHF-SCF (OPEN SHELL)       Authors: W. Meyer, H.-J. Werner


 NUMBER OF ELECTRONS:       3+    1-    SPACE SYMMETRY=4    SPIN SYMMETRY: Triplet 
 CONVERGENCE THRESHOLDS:    1.00E-05 (Density)    1.00E-07 (Energy)
 MAX. NUMBER OF ITERATIONS:        0
 INTERPOLATION TYPE:            DIIS
 INTERPOLATION STEPS:              2 (START)      1 (STEP)
 LEVEL SHIFTS:                 -0.60 (CLOSED) -0.30 (OPEN) 


 Singly occupied orbitals:      1.2       1.3
 Molecular orbitals read from record     5202.2  Type=MCSCF/NATURAL (state averaged)

 Molecular orbital dump at record        2101.2

 ITERATION    DDIFF          GRAD             ENERGY        2-EL.EN.            DIPOLE MOMENTS         DIIS   ORB.
    1      0.000D+00      0.000D+00        -5.31424795      6.058573    0.00000    0.00000    0.00000    0    start

 Final alpha occupancy:   1   1   1   0   0   0   0   0
 Final beta  occupancy:   1   0   0   0   0   0   0   0

 !RHF STATE 1.4 Energy                 -5.314247953483
 Nuclear energy                         0.00000000
 One-electron energy                   -8.34353433
 Two-electron energy                    3.02928638
 Virial quotient                       -1.54724773
 !RHF STATE 1.4 Dipole moment           0.00000000     0.00000000     0.00000000
 Dipole moment /Debye                   0.00000000     0.00000000     0.00000000
 

 !RHF expec          <1.4|EKIN|1.4>     3.434645826584
 
 !RHF expec           <1.4|POT|1.4>    -3.072647276031

 ELECTRON ORBITALS
 =================


   Orb  Occ    Energy  Couls-En    Coefficients

                                   1 1s      1 1s      1 1s      1 1s      1 3d0     1 3d2+    1 3d0     1 3d2+    1 3d0     1 3d2+ 


   1.1   2    -0.7072   -2.9683  0.999912 -0.000014  0.000191 -0.000114  0.000000  0.000000  0.000000  0.000000  0.000000  0.000000

                                   1 2px     1 2px     1 2px     1 2px     1 4f1+    1 4f3+    1 4f1+    1 4f3+ 

   1.2   +    -0.0598   -1.9705  1.000023 -0.000024  0.000002 -0.000004  0.000000  0.000000  0.000000  0.000000

                                   1 2py     1 2py     1 2py     1 2py     1 4f1-    1 4f3-    1 4f1-    1 4f3- 

   1.3   +    -0.0598   -1.9705  1.000023 -0.000024  0.000002 -0.000004  0.000000  0.000000  0.000000  0.000000

 HOMO      1.2    -0.059827 =      -1.6280eV
 LUMO      1.5    -0.059827 =      -1.6280eV
 LUMO-HOMO        -0.000000 =      -0.0000eV


 **********************************************************************************************************************************
 DATASETS  * FILE   NREC   LENGTH (MB)   RECORD NAMES
              1      21       19.65       500      610      700      900      950      970     1000      129      960     1100   
                                          VAR    BASINP    GEOM    SYMINP    ZMAT    AOBASIS   BASIS     P2S    ABASIS      S 
                                         1400     1410     1420     1200     1210     1080     1600     1650     1300     1700   
                                         EKIN       V       ECP      H0       H01     AOSYM     SMH    MOLCAS    ERIS     OPER   
                                         1380   
                                         JKOP   

              2       6        7.77       700     1000      520     4202     5202     2101   
                                         GEOM     BASIS   MCVARS     RHF     MCSCF     RHF  

 PROGRAMS   *        TOTAL       RHF     MULTI       RHF       INT
 CPU TIMES  *         2.38      0.02      0.07      0.04      2.13
 REAL TIME  *        23.53 SEC
 DISK USED  *        34.12 MB      
 **********************************************************************************************************************************
 SETTING SCF(I)         =        -5.31424795  AU                              
 SETTING _CC_NORM_MAX   =         2.00000000                                  


 PROGRAM * UHF-SCF       Authors: W. Meyer, H.-J. Werner


 NUMBER OF ELECTRONS:       3+    1-    SPACE SYMMETRY=4    SPIN SYMMETRY: Triplet 
 CONVERGENCE THRESHOLDS:    1.00E-05 (Density)    1.00E-07 (Energy)
 MAX. NUMBER OF ITERATIONS:        0
 INTERPOLATION TYPE:            DIIS
 INTERPOLATION STEPS:              2 (START)      1 (STEP)
 LEVEL SHIFTS:                  0.20 (ALPHA)   0.20 (BETA) 



 Molecular orbitals read from record     2101.2  Type=RHF/CANONICAL (state 1.4)

 Molecular orbital dump at record        2200.2

 Initial alpha occupation   1   1   1   0   0   0   0   0
 Initial beta  occupation   1   0   0   0   0   0   0   0

 ITERATION    DDIFF          GRAD             ENERGY        2-EL.EN.            DIPOLE MOMENTS         DIIS
    1      0.000D+00      0.000D+00        -5.31424795      6.058573    0.00000    0.00000    0.00000    0
 
 Final alpha occupancy:   1   1   1   0   0   0   0   0
 Final beta  occupancy:   1   0   0   0   0   0   0   0

 !UHF STATE 1.4 Energy                 -5.314247953483
 Nuclear energy                         0.00000000
 One-electron energy                   -8.34353433
 Two-electron energy                    3.02928638
 Virial quotient                       -1.54724773
 !UHF STATE 1.4 Dipole moment           0.00000000     0.00000000     0.00000000
 Dipole moment /Debye                   0.00000000     0.00000000     0.00000000
 

 !UHF expec          <1.4|EKIN|1.4>     3.434645826584
 
 !UHF expec           <1.4|POT|1.4>    -3.072647276031

 ELECTRON ORBITALS FOR POSITIVE SPIN
 ===================================


   Orb  Occ    Energy  Couls-En    Coefficients

                                   1 1s      1 1s      1 1s      1 1s      1 3d0     1 3d2+    1 3d0     1 3d2+    1 3d0     1 3d2+ 


   1.1   +    -0.7072   -2.9683  0.999912 -0.000014  0.000191 -0.000114  0.000000  0.000000  0.000000  0.000000  0.000000  0.000000

                                   1 2px     1 2px     1 2px     1 2px     1 4f1+    1 4f3+    1 4f1+    1 4f3+ 

   1.2   +    -0.0598   -1.9705  1.000023 -0.000024  0.000002 -0.000004  0.000000  0.000000  0.000000  0.000000

                                   1 2py     1 2py     1 2py     1 2py     1 4f1-    1 4f3-    1 4f1-    1 4f3- 

   1.3   +    -0.0598   -1.9705  1.000023 -0.000024  0.000002 -0.000004  0.000000  0.000000  0.000000  0.000000

 ELECTRON ORBITALS FOR NEGATIVE SPIN
 ===================================


   Orb  Occ    Energy  Couls-En    Coefficients

                                   1 1s      1 1s      1 1s      1 1s      1 3d0     1 3d2+    1 3d0     1 3d2+    1 3d0     1 3d2+ 


   1.1   -    -0.7072   -2.9683  0.999912 -0.000014  0.000191 -0.000114  0.000000  0.000000  0.000000  0.000000  0.000000  0.000000

 HOMO      1.2    -0.059827 =      -1.6280eV
 LUMO      1.5    -0.059827 =      -1.6280eV
 LUMO-HOMO        -0.000000 =      -0.0000eV

 EXPECTATION VALUE OF S**2:             2.00000000

 Occupation number threshold for canonical orbitals:  1.999000 (occupied),  0.001000 (virtual)

 Number of pseudo-canonical orbitals per symmetry:    1   0   0   0   0   0   0   0
 Number of active natural orbitals per symmetry:      0   1   1   0   0   0   0   0

 NATURAL CHARGE ORBITALS
 =======================


   Orb     Occ        Energy       Coefficients

                                   1 1s      1 1s      1 1s      1 1s      1 3d0     1 3d2+    1 3d0     1 3d2+    1 3d0     1 3d2+ 


   1.1  2.00000    -0.707189     0.999912 -0.000014  0.000191 -0.000114  0.000000  0.000000  0.000000  0.000000  0.000000  0.000000

                                   1 2px     1 2px     1 2px     1 2px     1 4f1+    1 4f3+    1 4f1+    1 4f3+ 

   1.2  1.00000    -0.131733     1.000023 -0.000024  0.000002 -0.000004  0.000000  0.000000  0.000000  0.000000

                                   1 2py     1 2py     1 2py     1 2py     1 4f1-    1 4f3-    1 4f1-    1 4f3- 

   1.3  1.00000    -0.131733     1.000023 -0.000024  0.000002 -0.000004  0.000000  0.000000  0.000000  0.000000

 Natural orbitals saved to record    2200.2 (Orbital set 3)

 Orbital spaces for UNO-CAS (Min. occupation: 0.020  Max. occupation: 1.980):

 Closed:        1   0   0   0   0   0   0   0
 Active:        0   1   1   0   0   0   0   0

 No convergence



 **********************************************************************************************************************************
 DATASETS  * FILE   NREC   LENGTH (MB)   RECORD NAMES
              1      21       19.65       500      610      700      900      950      970     1000      129      960     1100   
                                          VAR    BASINP    GEOM    SYMINP    ZMAT    AOBASIS   BASIS     P2S    ABASIS      S 
                                         1400     1410     1420     1200     1210     1080     1600     1650     1300     1700   
                                         EKIN       V       ECP      H0       H01     AOSYM     SMH    MOLCAS    ERIS     OPER   
                                         1380   
                                         JKOP   

              2       7       10.28       700     1000      520     4202     5202     2101     2200   
                                         GEOM     BASIS   MCVARS     RHF     MCSCF     RHF      UHF  

 PROGRAMS   *        TOTAL       UHF       RHF     MULTI       RHF       INT
 CPU TIMES  *         2.40      0.02      0.02      0.07      0.04      2.13
 REAL TIME  *        23.71 SEC
 DISK USED  *        34.12 MB      
 **********************************************************************************************************************************
 SETTING SCF(I)         =        -5.31424795  AU                              


 PROGRAM * MRCC (General Multireference Coupled Cluster)    Author: M. Kallay, 2000-2005

 ***  Initialisation ***

   0 Spin projections
 
 Molecular orbitals read from record     2200.2  Type=UHF/ALPHA (state 1.4)

 ?Warning: UHF not converged
 Molecular orbitals read from record     2200.2  Type=UHF/BETA (state 1.4)

 ?Warning: UHF not converged
 
 Frozen orbitals:              0 (  0  0  0  0  0  0  0  0)
 Active orbitals:             45 ( 10  8  8  3  8  3  3  2)
 Active electrons:             4
 Spin quantum number:          1.0

 Transformed integrals will be written to file mrcc_9062/fort.55

 Load integrals                2.4 sec
 Transform integrals           2.5 sec
 Storage for integrals:         426551
 Remaining memory:           *********

 Core energy:               0.00000000
 
 MRCC Input:
     4     0     0     0     3     0     0     4     0     0     0     1     1     0     0     7     0     0   0.000     0   64000
  ex.lev,nsing,ntrip, rest,method,dens,conver,symm, diag, CS ,spatial, HF, ndoub,nacto,nactv, tol, maxex, sacc, freq,  dboc,   mem
  2  0  0  0  0  0  0  0  0  0  1  0  0  0  0  0  0  0  1  0  0  0  0  0  0  0  0  0  0  0  0  0  0  0  0  0  0  0  0  0  0  0  0  0  0
 MRCC Input end
 Variable memory released
 MRCC now being run, temporary output in /global/cscratch1/sd/aannabe/mrcc_9062/mrcc.out
 **********************************************************************
                          MRCC program system
 **********************************************************************

                              Written by
  Mihaly Kallay, Zoltan Rolik, Jozsef Csontos, Peter Nagy, Gyula Samu,
      David Mester, Jozsef Csoka, Bernat Szabo, Istvan Ladjanszki,
       Lorant Szegedy, Bence Ladoczki, Klara Petrov, Mate Farkas,
                    Pal D. Mezei, and Bence Hegely

        Department of Physical Chemistry and Materials Science
            Budapest University of Technology and Economics
                  Budapest P.O.Box 91, H-1521 Hungary

                              www.mrcc.hu

                       Release date: May 23, 2018

 ************************ 2018-11-02 14:49:01 *************************
 Executing goldstone...

 Generation of CC equations in terms of H and T...
 Generation of antisymmetrized Goldstone diagrams...
 Number of diagrams in T^1 equations:    15
 Number of diagrams in T^2 equations:    38
 Number of diagrams in T^3 equations:    49
 Number of diagrams in T^4 equations:     5
 Translation of diagrams to factorized equations...
 Optimizing intermediate calculation...
 Number of floating-point operations per iteration step:   4.0982E+08
 Probable CPU time per iteration step (hours):      0.00
 Required memory (Mbytes):     448.7
 Number of intermediates:                                  80
 Number of intermediates to be stored:                     32
 Length of intermediate file (Mbytes):       8.4

 ************************ 2018-11-02 14:49:01 *************************
 Executing xmrcc...

 **********************************************************************
 CC(3)(4) calculation


 Allocation of 448.7 Mbytes of memory...
 Number of spinorbitals:                    90
 Number of alpha electrons:                        3
 Number of beta electrons:                         1
 Spin multiplicity:                     2
 z-component of spin:  1.0
 Spatial symmetry:                      4
 Convergence criterion:  1.0E-07
 Construction of occupation graphs...
 Number of                     0 -fold excitations:                      1
 Number of                     1 -fold excitations:                     32
 Number of                     2 -fold excitations:                   1097
 Number of                     3 -fold excitations:                  15607
 Total number of configurations:                  16737
 Calculation of coupling coefficients...
 Length of intermediate file (Mbytes):       6.7

 ======================================================================

 Spin case  1   Alpha:  3   Beta:  1
 Number of excitations:                  62872
 Number of                     4 -fold excitations:                  62872

 Memory requirements /Mbyte/:
               Minimal        Optimal
 Real*8:         23.0082        31.3201
 Integer:         6.5905
 Total:          29.5986        37.9106


 ************************ 2018-11-02 14:49:02 *************************
 Executing mrcc...

 **********************************************************************
 CCSDT(Q) calculation


 Allocation of   31.3 Mbytes of memory...
 Number of spinorbitals:  90
 Number of alpha electrons:  3
 Number of beta  electrons:  1
 Spin multiplicity: 2
 z-component of spin:  1.0
 Spatial symmetry: 4
 Convergence criterion:  1.0E-07
 Construction of occupation graphs...
 Number of 0-fold excitations: 1
 Number of 1-fold excitations: 32
 Number of 2-fold excitations: 1097
 Number of 3-fold excitations: 15607
 Total number of determinants: 16737
 Calculation of coupling coefficients...
 Initial cluster amplitudes are generated.
 Length of intermediate file (Mbytes):       6.7
 Reading integral list from unit 55...
 Sorting integrals...
 Sorting integrals...
 Sorting integrals...
 Sorting integrals...
 Energy of reference determinant [au]:      -5.314247953483
 Calculation of MP denominators...

 Starting CC iteration...
 ======================================================================
 Norm of residual vector:     0.49733276
 CPU time [min]:     0.027                   Wall time [min]:     0.028

 Iteration  1  CC energy:    -5.38944890  Energy decrease:   0.07520095
 ======================================================================
 Norm of residual vector:     0.13054111
 CPU time [min]:     0.038                   Wall time [min]:     0.040

 Iteration  2  CC energy:    -5.40613953  Energy decrease:   0.01669063
 ======================================================================
 Norm of residual vector:     0.03785705
 CPU time [min]:     0.050                   Wall time [min]:     0.051

 Iteration  3  CC energy:    -5.41161383  Energy decrease:   0.00547430
 ======================================================================
 Norm of residual vector:     0.01136966
 CPU time [min]:     0.061                   Wall time [min]:     0.068

 Iteration  4  CC energy:    -5.41198850  Energy decrease:   0.00037466
 ======================================================================
 Norm of residual vector:     0.00287680
 CPU time [min]:     0.072                   Wall time [min]:     0.080

 Iteration  5  CC energy:    -5.41205887  Energy decrease:   0.00007037
 ======================================================================
 Norm of residual vector:     0.00080828
 CPU time [min]:     0.084                   Wall time [min]:     0.092

 Iteration  6  CC energy:    -5.41205056  Energy decrease:   0.00000831
 ======================================================================
 Norm of residual vector:     0.00027031
 CPU time [min]:     0.095                   Wall time [min]:     0.103

 Iteration  7  CC energy:    -5.41204870  Energy decrease:   0.00000186
 ======================================================================
 Norm of residual vector:     0.00009572
 CPU time [min]:     0.107                   Wall time [min]:     0.115

 Iteration  8  CC energy:    -5.41205173  Energy decrease:   0.00000303
 ======================================================================
 Norm of residual vector:     0.00003059
 CPU time [min]:     0.118                   Wall time [min]:     0.127

 Iteration  9  CC energy:    -5.41205089  Energy decrease:   0.00000084
 ======================================================================
 Norm of residual vector:     0.00001033
 CPU time [min]:     0.130                   Wall time [min]:     0.139

 Iteration 10  CC energy:    -5.41205079  Energy decrease:   0.00000010
 ======================================================================
 Norm of residual vector:     0.00000332
 CPU time [min]:     0.141                   Wall time [min]:     0.152

 Iteration 11  CC energy:    -5.41205091  Energy decrease:   0.00000011
 ======================================================================
 Norm of residual vector:     0.00000091
 CPU time [min]:     0.153                   Wall time [min]:     0.169

 Iteration 12  CC energy:    -5.41205089  Energy decrease:   0.00000002
 ======================================================================
 Norm of residual vector:     0.00000026
 CPU time [min]:     0.164                   Wall time [min]:     0.180

 Iteration 13  CC energy:    -5.41205088  Energy decrease:   3.3827E-09
 ======================================================================
 Norm of residual vector:     0.00000007
 CPU time [min]:     0.175                   Wall time [min]:     0.192

 Iteration 14  CC energy:    -5.41205088  Energy decrease:   1.2876E-09
 ======================================================================

 Iteration has converged in 14 steps.

 Final results:
 Total CCSDT energy [au]:             -5.412050884424
 Total MP2 energy [au]:               -5.389448902959

 Perturbative corrections are calculated...
 ======================================================================
 Spin case  1   Alpha:  3   Beta:  1
 Number of excitations:        62872
 CPU time [min]:     0.479                   Wall time [min]:     0.497
 ======================================================================
 Number of 4-fold excitations: 62872
 CPU time [min]:     0.479                   Wall time [min]:     0.497

 Total CCSDT[Q] energy [au]:          -5.412066696894
 Total CCSDT(Q) energy [au]:          -5.412090152979

 ************************ 2018-11-02 14:49:42 *************************
                      Normal termination of mrcc.
 **********************************************************************
 !CCSDT STATE 1.4 Energy               -5.412050884424
 !MP2 STATE 1.4 Energy                 -5.389448902959
 !CCSDT[Q] STATE 1.4 Energy            -5.412066696894
 !CCSDT(Q) STATE 1.4 Energy            -5.412090152979
 
 CPU-time for MRCC:             28.7 sec
 Elapsed-time for MRCC:         43.5 sec

 Variable memory set to 8000000000 words,  buffer space   230000 words



 **********************************************************************************************************************************
 DATASETS  * FILE   NREC   LENGTH (MB)   RECORD NAMES
              1      21       19.65       500      610      700      900      950      970     1000      129      960     1100   
                                          VAR    BASINP    GEOM    SYMINP    ZMAT    AOBASIS   BASIS     P2S    ABASIS      S 
                                         1400     1410     1420     1200     1210     1080     1600     1650     1300     1700   
                                         EKIN       V       ECP      H0       H01     AOSYM     SMH    MOLCAS    ERIS     OPER   
                                         1380   
                                         JKOP   

              2       7       10.28       700     1000      520     4202     5202     2101     2200   
                                         GEOM     BASIS   MCVARS     RHF     MCSCF     RHF      UHF  

 PROGRAMS   *        TOTAL      MRCC       UHF       RHF     MULTI       RHF       INT
 CPU TIMES  *        32.16     29.76      0.02      0.02      0.07      0.04      2.13
 REAL TIME  *        73.92 SEC
 DISK USED  *        34.12 MB      
 **********************************************************************************************************************************
 SETTING POSTHF(I)      =        -5.41209015  AU                              
                                                                                                                                                                                                                                                                

       SCF           POSTHF       EKIN          POT
    -5.31424795   -5.41209015   3.43464583   -3.07264728
                                                  

 CCSDT(Q)/USERDEF energy=     -5.412090152979

        CCSDT(Q)        RHF-SCF         MULTI           RHF-SCF 
     -5.41209015     -5.31424795     -5.31424795     -5.31431227
 **********************************************************************************************************************************
 Variable memory released
