
 Primary working directories    : /global/cscratch1/sd/aannabe
 Secondary working directories  : /global/cscratch1/sd/aannabe
 Wavefunction directory         : /global/homes/a/aannabe/wfu/
 Main file repository           : /global/cscratch1/sd/aannabe/

 SHA1      : 19cd028119e0e09f93f0674bd8af7968d9b3eff6
 NAME      : 2015.1.36
 ARCHNAME  : linux/x86_64
 FC        : /opt/cray/pe/craype/2.5.14/bin/ftn
 BLASLIB   : -L/opt/intel/compilers_and_libraries_2018.1.163/linux/mkl/lib/intel64 -Wl,-_start-group -lmkl_intel_ilp64 -lmkl_intel_thread -lmkl_core -Wl,-_end-group -liomp5
 id        : lbl

 Nodes     nprocs
 nid00466     1

 Using customized tuning parameters: mindgm=7; mindgv=16; mindgc=1; mindgr=1; noblas=0; minvec=7
 default implementation of scratch files=df  

 ***,As
 memory,8,g
 gthresh,twoint=1.e-12
 
 gprint,basis,orbitals
 gexpec,ekin,pot
 
 angstrom
 geometry={
 1                                                                               ! Number of atoms
 As 0.0 0.0 0.0
 }
 
 basis={
 
 Including file /global/homes/a/aannabe/repos/pseudopotentiallibrary/recipes/As/ccECP/As.ccECP.molpro
 
                                   !include,/global/homes/a/aannabe/repos/pseudopotentiallibrary/recipes/As/ccECP/As.cc-pVDZ.molpro
                                  !include,/global/homes/a/aannabe/repos/pseudopotentiallibrary/recipes/As/ccECP/As.cc-pCVDZ.molpro
 Including file /global/homes/a/aannabe/repos/pseudopotentiallibrary/recipes/As/ccECP/As.aug-cc-pVDZ.molpro
 
 
 }
 
 {hf
 wf,5,8,3
 occ,1,1,1,0,1,0,0,0
                                                                                 !open,1.3
 closed,1,0,0,0,0,0,0,0
                                                                                 !sym,
 }
 scf(i)=energy
 
 _CC_NORM_MAX=2.0
  !NOTE: Perturbative MRCC works only with UHF reference. So, here we will trick MRCC by doing zero UHF iteration right after ROHF.
 
 {uhf
 wf,5,8,3
 occ,1,1,1,0,1,0,0,0
                                                                                 !open,1.3
 closed,1,0,0,0,0,0,0,0
                                                                                 !sym,
 maxit,0
 }
 scf(i)=energy
 
 {mrcc,method=CCSDT(Q),dir=mrccdir                                               !,restart=1
 orbital,ignore_error=1                                                          !Ignore the fact that UHF WF is not converged
 maxit,100
 core
 }
 posthf(i)=energy
 
 table,scf,posthf,ekin,pot
 save,2.csv,new
 
 

 Variables initialized (889), CPU time= 0.00 sec
 Commands  initialized (702), CPU time= 0.01 sec, 572 directives.
 Default parameters read. Elapsed time= 0.27 sec

 Checking input...
 Passed
1


                                         ***  PROGRAM SYSTEM MOLPRO  ***
                                       Copyright, TTI GmbH Stuttgart, 2015
                                    Version 2015.1 linked Dec 29 2018 15:55:43


 **********************************************************************************************************************************
 LABEL *   As                                                                            
  64 bit serial version                                                                  DATE: 25-Jun-19          TIME: 12:02:56  
 **********************************************************************************************************************************

 SHA1:             19cd028119e0e09f93f0674bd8af7968d9b3eff6
 **********************************************************************************************************************************

 THRESHOLDS:

 ZERO    =  1.00D-12  ONEINT  =  1.00D-12  TWOINT  =  1.00D-12  PREFAC  =  1.00D-14  LOCALI  =  1.00D-09  EORDER  =  1.00D-04
 ENERGY  =  0.00D+00  ETEST   =  0.00D+00  EDENS   =  0.00D+00  THRDEDEF=  1.00D-06  GRADIENT=  1.00D-02  STEP    =  1.00D-03
 ORBITAL =  1.00D-05  CIVEC   =  1.00D-05  COEFF   =  1.00D-04  PRINTCI =  5.00D-02  PUNCHCI =  9.90D+01  OPTGRAD =  3.00D-04
 OPTENERG=  1.00D-06  OPTSTEP =  3.00D-04  THRGRAD =  1.00D-10  COMPRESS=  1.00D-11  VARMIN  =  1.00D-07  VARMAX  =  1.00D-03
 THRDOUB =  0.00D+00  THRDIV  =  1.00D-05  THRRED  =  1.00D-07  THRPSP  =  1.00D+00  THRDC   =  1.00D-10  THRCS   =  1.00D-10
 THRNRM  =  1.00D-08  THREQ   =  0.00D+00  THRDE   =  1.00D+00  THRREF  =  1.00D-05  SPARFAC =  1.00D+00  THRDLP  =  1.00D-07
 THRDIA  =  1.00D-10  THRDLS  =  1.00D-07  THRGPS  =  0.00D+00  THRKEX  =  0.00D+00  THRDIS  =  2.00D-01  THRVAR  =  1.00D-10
 THRLOC  =  1.00D-06  THRGAP  =  1.00D-06  THRLOCT = -1.00D+00  THRGAPT = -1.00D+00  THRORB  =  1.00D-06  THRMLTP =  0.00D+00
 THRCPQCI=  1.00D-10  KEXTA   =  0.00D+00  THRCOARS=  0.00D+00  SYMTOL  =  1.00D-06  GRADTOL =  1.00D-06  THROVL  =  1.00D-08
 THRORTH =  1.00D-08  GRID    =  1.00D-06  GRIDMAX =  1.00D-03  DTMAX   =  0.00D+00  THROCCDE=  1.00D-01  THROCCDE=  1.00D-01



 ZUNIT=ANG
 

Geometry recognized as XYZ


 Variable memory set to 8000000000 words,  buffer space   230000 words

 SETTING BASIS          =    USERDEF


 Recomputing integrals since basis changed


 Using spherical harmonics



 PROGRAM * SEWARD (Integral evaluation for generally contracted gaussian basis sets)     Author: Roland Lindh, 1990

 Geometry written to block  1 of record 700

 Orientation using atomic masses  
 Molecule type: Atom
 Symmetry elements: X,Y,Z
 Rotational constants:       0.0000000      0.0000000      0.0000000 GHz  (calculated with average atomic masses)

 Point group  D2h 



 ATOMIC COORDINATES

 NR  ATOM    CHARGE       X              Y              Z

   1  AS      5.00    0.000000000    0.000000000    0.000000000


          AS  CORE POTENTIAL

          f POTENTIAL

 POWERS             1              3              2              2
 EXPONENTIALS   1.285931       9.934874       1.895682       1.728256    
 COEFFICIENTS   5.000000       6.429657      -15.01244       2.898814    

          s - f POTENTIAL

 POWERS             2              2
 EXPONENTIALS   3.479387       1.637480    
 COEFFICIENTS   75.65519      -3.311453    

          p - f POTENTIAL

 POWERS             2              2
 EXPONENTIALS   3.229364       1.666366    
 COEFFICIENTS   67.96187      -3.094558    

          d - f POTENTIAL

 POWERS             2              2
 EXPONENTIALS   2.068163       1.546999    
 COEFFICIENTS   24.30473      0.9394562    


 BASIS DATA

   Nr Sym  Nuc  Type         Exponents   Contraction coefficients

    1.1 Ag    1  1s          50.230536    -0.000538
                             22.441775     0.003660
                             10.026436    -0.023992
                              4.479567     0.158076
                              2.001361    -0.419346
                              0.894159    -0.100519
                              0.399488     0.450020
                              0.178482     0.605104
                              0.079741     0.190009
    2.1 Ag    1  1s           0.051680     1.000000
    3.1 Ag    1  1s           0.020672     1.000000
    4.1 Ag    1  3d0          0.294836     1.000000
    5.1 Ag    1  3d2+         0.294836     1.000000
    6.1 Ag    1  3d0          0.117934     1.000000
    7.1 Ag    1  3d2+         0.117934     1.000000
    1.2 B3u   1  2px         22.695464     0.000322
                             10.529662    -0.003120
                              4.885284     0.029849
                              2.266549    -0.127882
                              1.051576    -0.004461
                              0.487883     0.248666
                              0.226356     0.457083
                              0.105019     0.351483
                              0.048724     0.091636
    2.2 B3u   1  2px          0.093979     1.000000
    3.2 B3u   1  2px          0.037592     1.000000
    1.3 B2u   1  2py         22.695464     0.000322
                             10.529662    -0.003120
                              4.885284     0.029849
                              2.266549    -0.127882
                              1.051576    -0.004461
                              0.487883     0.248666
                              0.226356     0.457083
                              0.105019     0.351483
                              0.048724     0.091636
    2.3 B2u   1  2py          0.093979     1.000000
    3.3 B2u   1  2py          0.037592     1.000000
    1.4 B1g   1  3d2-         0.294836     1.000000
    2.4 B1g   1  3d2-         0.117934     1.000000
    1.5 B1u   1  2pz         22.695464     0.000322
                             10.529662    -0.003120
                              4.885284     0.029849
                              2.266549    -0.127882
                              1.051576    -0.004461
                              0.487883     0.248666
                              0.226356     0.457083
                              0.105019     0.351483
                              0.048724     0.091636
    2.5 B1u   1  2pz          0.093979     1.000000
    3.5 B1u   1  2pz          0.037592     1.000000
    1.6 B2g   1  3d1+         0.294836     1.000000
    2.6 B2g   1  3d1+         0.117934     1.000000
    1.7 B3g   1  3d1-         0.294836     1.000000
    2.7 B3g   1  3d1-         0.117934     1.000000

 NUCLEAR CHARGE:                    5
 NUMBER OF PRIMITIVE AOS:          56
 NUMBER OF SYMMETRY AOS:           54
 NUMBER OF CONTRACTIONS:           22   (   7Ag  +   3B3u +   3B2u +   2B1g +   3B1u +   2B2g +   2B3g +   0Au  )
 NUMBER OF CORE ORBITALS:           0   (   0Ag  +   0B3u +   0B2u +   0B1g +   0B1u +   0B2g +   0B3g +   0Au  )
 NUMBER OF VALENCE ORBITALS:        4   (   1Ag  +   1B3u +   1B2u +   0B1g +   1B1u +   0B2g +   0B3g +   0Au  )


 NUCLEAR REPULSION ENERGY    0.00000000

 EXTRA SYMMETRY OF AOS IN SYMMETRY 1:   1 1 1 2 3 2 3

 Eigenvalues of metric

         1 0.611E-01 0.299E+00 0.299E+00 0.496E+00 0.170E+01 0.170E+01 0.244E+01
         2 0.593E-01 0.435E+00 0.251E+01
         3 0.593E-01 0.435E+00 0.251E+01
         4 0.299E+00 0.170E+01
         5 0.593E-01 0.435E+00 0.251E+01
         6 0.299E+00 0.170E+01
         7 0.299E+00 0.170E+01


 Contracted 2-electron integrals neglected if value below      1.0D-12
 AO integral compression algorithm  1   Integral accuracy      1.0D-12

     0.262 MB (compressed) written to integral file (100.0%)


 NUMBER OF SORTED TWO-ELECTRON INTEGRALS:       5272.     BUFFER LENGTH:  32768
 NUMBER OF SEGMENTS:   1  SEGMENT LENGTH:       5272      RECORD LENGTH: 524288

 Memory used in sort:       0.56 MW

 SORT1 READ       12220. AND WROTE        4734. INTEGRALS IN      1 RECORDS. CPU TIME:     0.00 SEC, REAL TIME:     0.01 SEC
 SORT2 READ        4734. AND WROTE        5272. INTEGRALS IN      1 RECORDS. CPU TIME:     0.00 SEC, REAL TIME:     0.01 SEC

 FILE SIZES:   FILE 1:    20.1 MBYTE,  FILE 4:     4.2 MBYTE,   TOTAL:     24.4 MBYTE

 OPERATOR DM      FOR CENTER  0  COORDINATES:    0.000000    0.000000    0.000000
 OPERATOR EKIN    FOR CENTER  0  COORDINATES:    0.000000    0.000000    0.000000
 OPERATOR POT     FOR CENTER  0  COORDINATES:    0.000000    0.000000    0.000000


 **********************************************************************************************************************************
 DATASETS  * FILE   NREC   LENGTH (MB)   RECORD NAMES
              1      20       19.92       500      610      700      900      950      970     1000      129      960     1100   
                                          VAR    BASINP    GEOM    SYMINP    ZMAT    AOBASIS   BASIS     P2S    ABASIS      S 
                                         1400     1410     1420     1200     1210     1080     1600     1650     1300     1700   
                                         EKIN       V       ECP      H0       H01     AOSYM     SMH    MOLCAS    ERIS     OPER   

 PROGRAMS   *        TOTAL       INT
 CPU TIMES  *         1.78      1.69
 REAL TIME  *        11.55 SEC
 DISK USED  *        24.63 MB      
 **********************************************************************************************************************************


 PROGRAM * RHF-SCF (OPEN SHELL)       Authors: W. Meyer, H.-J. Werner


 NUMBER OF ELECTRONS:       4+    1-    SPACE SYMMETRY=8    SPIN SYMMETRY: Quartet 
 CONVERGENCE THRESHOLDS:    1.00E-05 (Density)    1.00E-07 (Energy)
 MAX. NUMBER OF ITERATIONS:       60
 INTERPOLATION TYPE:            DIIS
 INTERPOLATION STEPS:              2 (START)      1 (STEP)
 LEVEL SHIFTS:                 -0.60 (CLOSED) -0.30 (OPEN) 

 Number of closed-shell orbitals:    1 (   1   0   0   0   0   0   0 )
 Number of open-shell orbitals:      3 (   0   1   1   0   1   0   0 )



   Atom=AS basis=ECP28MDF_GUESS    lmin=0  lmax=1

 Orbital guess generated from atomic densities. Full valence occupancy:    1   1   1   0   1   0   0   0


 Molecular orbital dump at record        2100.2

 ITERATION    DDIFF          GRAD             ENERGY        2-EL.EN.            DIPOLE MOMENTS         DIIS   ORB.
    1      0.000D+00      0.000D+00        -6.05220730      6.787074    0.00000    0.00000    0.00000    0    start
    2      0.000D+00      0.122D-01        -6.06259044      6.957152    0.00000    0.00000    0.00000    1    diag,B
    3      0.340D-01      0.542D-02        -6.06564131      7.070422    0.00000    0.00000    0.00000    2    diag,B
    4      0.220D-01      0.153D-02        -6.06587560      7.092586    0.00000    0.00000    0.00000    3    diag,B
    5      0.615D-02      0.154D-03        -6.06587726      7.092068    0.00000    0.00000    0.00000    4    diag,B
    6      0.866D-03      0.356D-04        -6.06587734      7.092664    0.00000    0.00000    0.00000    5    diag,B
    7      0.133D-03      0.646D-05        -6.06587734      7.092590    0.00000    0.00000    0.00000    6    fixocc
    8      0.194D-04      0.597D-06        -6.06587734      7.092577    0.00000    0.00000    0.00000    7    diag,B
    9      0.241D-05      0.472D-08        -6.06587734      7.092576    0.00000    0.00000    0.00000    0    orth

 Final alpha occupancy:   1   1   1   0   1   0   0
 Final beta  occupancy:   1   0   0   0   0   0   0

 !RHF STATE 1.8 Energy                 -6.065877340570
 Nuclear energy                         0.00000000
 One-electron energy                   -9.61216559
 Two-electron energy                    3.54628825
 Virial quotient                       -2.63826922
 !RHF STATE 1.8 Dipole moment           0.00000000     0.00000000     0.00000000
 Dipole moment /Debye                   0.00000000     0.00000000     0.00000000
 

 !RHF expec          <1.8|EKIN|1.8>     2.299188157568
 
 !RHF expec           <1.8|POT|1.8>    -2.512261317559

 ELECTRON ORBITALS
 =================


   Orb  Occ    Energy  Couls-En    Coefficients

                                   1 1s      1 1s      1 1s      1 3d0     1 3d2+    1 3d0     1 3d2+ 

   1.1   2    -0.7039   -2.9217  1.000131 -0.001294  0.001740  0.000000  0.000000 -0.000000 -0.000000

                                   1 2px     1 2px     1 2px  

   1.2   +    -0.3706   -2.0961  1.000064 -0.000169  0.000152

                                   1 2py     1 2py     1 2py  

   1.3   +    -0.3706   -2.0961  1.000064 -0.000169  0.000152

                                   1 2pz     1 2pz     1 2pz  

   1.5   +    -0.3706   -2.0961  1.000064 -0.000169  0.000152

 HOMO      1.2    -0.370584 =     -10.0841eV
 LUMO      2.1     0.034405 =       0.9362eV
 LUMO-HOMO         0.404989 =      11.0203eV


 **********************************************************************************************************************************
 DATASETS  * FILE   NREC   LENGTH (MB)   RECORD NAMES
              1      20       19.92       500      610      700      900      950      970     1000      129      960     1100   
                                          VAR    BASINP    GEOM    SYMINP    ZMAT    AOBASIS   BASIS     P2S    ABASIS      S 
                                         1400     1410     1420     1200     1210     1080     1600     1650     1300     1700   
                                         EKIN       V       ECP      H0       H01     AOSYM     SMH    MOLCAS    ERIS     OPER   

              2       4        2.75       700     1000      520     2100   
                                         GEOM     BASIS   MCVARS     RHF  

 PROGRAMS   *        TOTAL        HF       INT
 CPU TIMES  *         1.80      0.02      1.69
 REAL TIME  *        11.67 SEC
 DISK USED  *        24.63 MB      
 **********************************************************************************************************************************
 SETTING SCF(I)         =        -6.06587734  AU                              
 SETTING _CC_NORM_MAX   =         2.00000000                                  


 PROGRAM * UHF-SCF       Authors: W. Meyer, H.-J. Werner


 NUMBER OF ELECTRONS:       4+    1-    SPACE SYMMETRY=8    SPIN SYMMETRY: Quartet 
 CONVERGENCE THRESHOLDS:    1.00E-05 (Density)    1.00E-07 (Energy)
 MAX. NUMBER OF ITERATIONS:        0
 INTERPOLATION TYPE:            DIIS
 INTERPOLATION STEPS:              2 (START)      1 (STEP)
 LEVEL SHIFTS:                  0.20 (ALPHA)   0.20 (BETA) 

 Number of closed-shell orbitals:    1 (   1   0   0   0   0   0   0 )
 Number of open-shell orbitals:      3 (   0   1   1   0   1   0   0 )


 Molecular orbitals read from record     2100.2  Type=RHF/CANONICAL (state 1.8)

 Molecular orbital dump at record        2200.2

 Initial alpha occupation   1   1   1   0   1   0   0
 Initial beta  occupation   1   0   0   0   0   0   0

 ITERATION    DDIFF          GRAD             ENERGY        2-EL.EN.            DIPOLE MOMENTS         DIIS
    1      0.000D+00      0.000D+00        -6.06587734      7.092576    0.00000    0.00000    0.00000    0
 
 Final alpha occupancy:   1   1   1   0   1   0   0
 Final beta  occupancy:   1   0   0   0   0   0   0

 !UHF STATE 1.8 Energy                 -6.065877340570
 Nuclear energy                         0.00000000
 One-electron energy                   -9.61216559
 Two-electron energy                    3.54628825
 Virial quotient                       -2.63826922
 !UHF STATE 1.8 Dipole moment           0.00000000     0.00000000     0.00000000
 Dipole moment /Debye                   0.00000000     0.00000000     0.00000000
 

 !UHF expec          <1.8|EKIN|1.8>     2.299188157568
 
 !UHF expec           <1.8|POT|1.8>    -2.512261317559

 ELECTRON ORBITALS FOR POSITIVE SPIN
 ===================================


   Orb  Occ    Energy  Couls-En    Coefficients

                                   1 1s      1 1s      1 1s      1 3d0     1 3d2+    1 3d0     1 3d2+ 

   1.1   +    -0.7039   -2.9217  1.000131 -0.001294  0.001740  0.000000  0.000000 -0.000000 -0.000000

                                   1 2px     1 2px     1 2px  

   1.2   +    -0.3706   -2.0961  1.000064 -0.000169  0.000152

                                   1 2py     1 2py     1 2py  

   1.3   +    -0.3706   -2.0961  1.000064 -0.000169  0.000152

                                   1 2pz     1 2pz     1 2pz  

   1.5   +    -0.3706   -2.0961  1.000064 -0.000169  0.000152

 ELECTRON ORBITALS FOR NEGATIVE SPIN
 ===================================


   Orb  Occ    Energy  Couls-En    Coefficients

                                   1 1s      1 1s      1 1s      1 3d0     1 3d2+    1 3d0     1 3d2+ 

   1.1   -    -0.7039   -2.9217  1.000131 -0.001294  0.001740  0.000000  0.000000 -0.000000 -0.000000

 HOMO      1.2    -0.370584 =     -10.0841eV
 LUMO     -1.2    -0.370584 =     -10.0841eV
 LUMO-HOMO         0.000000 =       0.0000eV

 EXPECTATION VALUE OF S**2:             3.75000000

 Occupation number threshold for canonical orbitals:  1.999000 (occupied),  0.001000 (virtual)

 Number of pseudo-canonical orbitals per symmetry:    1   0   0   0   0   0   0
 Number of active natural orbitals per symmetry:      0   1   1   0   1   0   0

 NATURAL CHARGE ORBITALS
 =======================


   Orb     Occ        Energy       Coefficients

                                   1 1s      1 1s      1 1s      1 3d0     1 3d2+    1 3d0     1 3d2+ 

   1.1  2.00000    -0.703919     1.000131 -0.001294  0.001740  0.000000  0.000000 -0.000000 -0.000000

                                   1 2px     1 2px     1 2px  

   1.2  1.00000    -0.150730     1.000064 -0.000169  0.000152

                                   1 2py     1 2py     1 2py  

   1.3  1.00000    -0.150730     1.000064 -0.000169  0.000152

                                   1 2pz     1 2pz     1 2pz  

   1.5  1.00000    -0.150730     1.000064 -0.000169  0.000152

 Natural orbitals saved to record    2200.2 (Orbital set 3)

 Orbital spaces for UNO-CAS (Min. occupation: 0.020  Max. occupation: 1.980):

 Closed:        1   0   0   0   0   0   0
 Active:        0   1   1   0   1   0   0

 No convergence



 **********************************************************************************************************************************
 DATASETS  * FILE   NREC   LENGTH (MB)   RECORD NAMES
              1      20       19.92       500      610      700      900      950      970     1000      129      960     1100   
                                          VAR    BASINP    GEOM    SYMINP    ZMAT    AOBASIS   BASIS     P2S    ABASIS      S 
                                         1400     1410     1420     1200     1210     1080     1600     1650     1300     1700   
                                         EKIN       V       ECP      H0       H01     AOSYM     SMH    MOLCAS    ERIS     OPER   

              2       5        5.25       700     1000      520     2100     2200   
                                         GEOM     BASIS   MCVARS     RHF      UHF  

 PROGRAMS   *        TOTAL       UHF        HF       INT
 CPU TIMES  *         1.81      0.01      0.02      1.69
 REAL TIME  *        11.88 SEC
 DISK USED  *        25.24 MB      
 **********************************************************************************************************************************
 SETTING SCF(I)         =        -6.06587734  AU                              


 PROGRAM * MRCC (General Multireference Coupled Cluster)    Author: M. Kallay, 2000-2005

 ***  Initialisation ***

   0 Spin projections
 
 Molecular orbitals read from record     2200.2  Type=UHF/ALPHA (state 1.8)

 ?Warning: UHF not converged
 Molecular orbitals read from record     2200.2  Type=UHF/BETA (state 1.8)

 ?Warning: UHF not converged
 
 Frozen orbitals:              0 (  0  0  0  0  0  0  0  0)
 Active orbitals:             22 (  7  3  3  2  3  2  2  0)
 Active electrons:             5
 Spin quantum number:          1.5

 Transformed integrals will be written to file mrccdir/mrcc_39857/fort.55

 Load integrals                1.9 sec
 Transform integrals           1.9 sec
 Storage for integrals:          28961
 Remaining memory:           *********

 Core energy:               0.00000000
 
 MRCC Input:
     4     0     0     0     3     0     0     8     0     0     0     1     1     0     0     7     0     0   0.000     0   64000
  ex.lev,nsing,ntrip, rest,method,dens,conver,symm, diag, CS ,spatial, HF, ndoub,nacto,nactv, tol, maxex, sacc, freq,  dboc,   mem
  2  0  0  0  0  0  0  1  0  0  1  0  0  0  0  1  0  0  0  0  0  0
 MRCC Input end
 Variable memory released
 MRCC now being run, temporary output in /global/cscratch1/sd/aannabe/mrccdir/mrcc_39857/mrcc.out
 **********************************************************************
                          MRCC program system
 **********************************************************************

                              Written by
  Mihaly Kallay, Zoltan Rolik, Jozsef Csontos, Peter Nagy, Gyula Samu,
      David Mester, Jozsef Csoka, Bernat Szabo, Istvan Ladjanszki,
       Lorant Szegedy, Bence Ladoczki, Klara Petrov, Mate Farkas,
                    Pal D. Mezei, and Bence Hegely

        Department of Physical Chemistry and Materials Science
            Budapest University of Technology and Economics
                  Budapest P.O.Box 91, H-1521 Hungary

                              www.mrcc.hu

                       Release date: May 23, 2018

 ************************ 2019-06-25 12:03:09 *************************
 Executing goldstone...

 Generation of CC equations in terms of H and T...
 Generation of antisymmetrized Goldstone diagrams...
 Number of diagrams in T^1 equations:    15
 Number of diagrams in T^2 equations:    38
 Number of diagrams in T^3 equations:    49
 Number of diagrams in T^4 equations:     5
 Translation of diagrams to factorized equations...
 Optimizing intermediate calculation...
 Number of floating-point operations per iteration step:   2.4994E+07
 Probable CPU time per iteration step (hours):      0.00
 Required memory (Mbytes):      19.5
 Number of intermediates:                                  79
 Number of intermediates to be stored:                     32
 Length of intermediate file (Mbytes):       0.6

 ************************ 2019-06-25 12:03:10 *************************
 Executing xmrcc...

 **********************************************************************
 CC(3)(4) calculation


 Allocation of 100.0 Mbytes of memory...
 Number of spinorbitals:                    44
 Number of alpha electrons:                        4
 Number of beta electrons:                         1
 Spin multiplicity:                     2
 z-component of spin:  1.5
 Spatial symmetry:                      8
 Convergence criterion:  1.0E-07
 Construction of occupation graphs...
 Number of                     0 -fold excitations:                      1
 Number of                     1 -fold excitations:                     18
 Number of                     2 -fold excitations:                    336
 Number of                     3 -fold excitations:                   2831
 Total number of configurations:                   3186
 Calculation of coupling coefficients...
 Length of intermediate file (Mbytes):       0.7

 ======================================================================

 Spin case  1   Alpha:  3   Beta:  1
 Number of excitations:                   8640
 Spin case  2   Alpha:  4   Beta:  0
 Number of excitations:                    420
 Number of                     4 -fold excitations:                   9060

 Memory requirements /Mbyte/:
               Minimal        Optimal
 Real*8:         13.8458        13.8497
 Integer:         3.7082
 Total:          17.5540        17.5579


 ************************ 2019-06-25 12:03:10 *************************
 Executing mrcc...

 **********************************************************************
 CCSDT(Q) calculation


 Allocation of   13.8 Mbytes of memory...
 Number of spinorbitals:  44
 Number of alpha electrons:  4
 Number of beta  electrons:  1
 Spin multiplicity: 2
 z-component of spin:  1.5
 Spatial symmetry: 8
 Convergence criterion:  1.0E-07
 Construction of occupation graphs...
 Number of 0-fold excitations: 1
 Number of 1-fold excitations: 18
 Number of 2-fold excitations: 336
 Number of 3-fold excitations: 2831
 Total number of determinants: 3186
 Calculation of coupling coefficients...
 Initial cluster amplitudes are generated.
 Length of intermediate file (Mbytes):       0.7
 Reading integral list from unit 55...
 Sorting integrals...
 Sorting integrals...
 Sorting integrals...
 Sorting integrals...
 Energy of reference determinant [au]:      -6.065877340570
 Calculation of MP denominators...

 Starting CC iteration...
 ======================================================================
 Norm of residual vector:     0.32926339
 CPU time [min]:     0.002                   Wall time [min]:     0.003

 Iteration  1  CC energy:    -6.12408458  Energy decrease:   0.05820724
 ======================================================================
 Norm of residual vector:     0.07809339
 CPU time [min]:     0.003                   Wall time [min]:     0.004

 Iteration  2  CC energy:    -6.13652571  Energy decrease:   0.01244113
 ======================================================================
 Norm of residual vector:     0.01663098
 CPU time [min]:     0.005                   Wall time [min]:     0.005

 Iteration  3  CC energy:    -6.13815037  Energy decrease:   0.00162466
 ======================================================================
 Norm of residual vector:     0.00283993
 CPU time [min]:     0.006                   Wall time [min]:     0.006

 Iteration  4  CC energy:    -6.13828581  Energy decrease:   0.00013545
 ======================================================================
 Norm of residual vector:     0.00065983
 CPU time [min]:     0.007                   Wall time [min]:     0.007

 Iteration  5  CC energy:    -6.13827092  Energy decrease:   0.00001489
 ======================================================================
 Norm of residual vector:     0.00017109
 CPU time [min]:     0.008                   Wall time [min]:     0.009

 Iteration  6  CC energy:    -6.13826664  Energy decrease:   0.00000429
 ======================================================================
 Norm of residual vector:     0.00003047
 CPU time [min]:     0.009                   Wall time [min]:     0.010

 Iteration  7  CC energy:    -6.13826785  Energy decrease:   0.00000122
 ======================================================================
 Norm of residual vector:     0.00000945
 CPU time [min]:     0.011                   Wall time [min]:     0.011

 Iteration  8  CC energy:    -6.13826802  Energy decrease:   0.00000017
 ======================================================================
 Norm of residual vector:     0.00000309
 CPU time [min]:     0.012                   Wall time [min]:     0.012

 Iteration  9  CC energy:    -6.13826794  Energy decrease:   0.00000009
 ======================================================================
 Norm of residual vector:     0.00000074
 CPU time [min]:     0.013                   Wall time [min]:     0.013

 Iteration 10  CC energy:    -6.13826796  Energy decrease:   0.00000002
 ======================================================================
 Norm of residual vector:     0.00000012
 CPU time [min]:     0.014                   Wall time [min]:     0.015

 Iteration 11  CC energy:    -6.13826795  Energy decrease:   7.6690E-10
 ======================================================================
 Norm of residual vector:     0.00000002
 CPU time [min]:     0.016                   Wall time [min]:     0.016

 Iteration 12  CC energy:    -6.13826795  Energy decrease:   4.9050E-10
 ======================================================================

 Iteration has converged in 12 steps.

 Final results:
 Total CCSDT energy [au]:             -6.138267954334
 Total MP2 energy [au]:               -6.124084580271

 Perturbative corrections are calculated...
 ======================================================================
 Spin case  1   Alpha:  3   Beta:  1
 Number of excitations:        8640
 CPU time [min]:     0.027                   Wall time [min]:     0.027
 ======================================================================
 Spin case  2   Alpha:  4   Beta:  0
 Number of excitations:        420
 CPU time [min]:     0.028                   Wall time [min]:     0.029
 ======================================================================
 Number of 4-fold excitations: 9060
 CPU time [min]:     0.028                   Wall time [min]:     0.029

 Total CCSDT[Q] energy [au]:          -6.138334635400
 Total CCSDT(Q) energy [au]:          -6.138339556811

 ************************ 2019-06-25 12:03:13 *************************
                      Normal termination of mrcc.
 **********************************************************************
 !CCSDT STATE 1.8 Energy               -6.138267954334
 !MP2 STATE 1.8 Energy                 -6.124084580271
 !CCSDT[Q] STATE 1.8 Energy            -6.138334635400
 !CCSDT(Q) STATE 1.8 Energy            -6.138339556811
 
 CPU-time for MRCC:              1.7 sec
 Elapsed-time for MRCC:          5.1 sec

 Variable memory set to 8000000000 words,  buffer space   230000 words



 **********************************************************************************************************************************
 DATASETS  * FILE   NREC   LENGTH (MB)   RECORD NAMES
              1      20       19.92       500      610      700      900      950      970     1000      129      960     1100   
                                          VAR    BASINP    GEOM    SYMINP    ZMAT    AOBASIS   BASIS     P2S    ABASIS      S 
                                         1400     1410     1420     1200     1210     1080     1600     1650     1300     1700   
                                         EKIN       V       ECP      H0       H01     AOSYM     SMH    MOLCAS    ERIS     OPER   

              2       5        5.25       700     1000      520     2100     2200   
                                         GEOM     BASIS   MCVARS     RHF      UHF  

 PROGRAMS   *        TOTAL      MRCC       UHF        HF       INT
 CPU TIMES  *         3.55      1.74      0.01      0.02      1.69
 REAL TIME  *        17.64 SEC
 DISK USED  *        25.24 MB      
 **********************************************************************************************************************************
 SETTING POSTHF(I)      =        -6.13833956  AU                              
                                                                                                                                                                                                                                                                

       SCF           POSTHF       EKIN          POT
    -6.06587734   -6.13833956   2.29918816   -2.51226132
                                                  

 CCSDT(Q)/USERDEF energy=     -6.138339556811

        CCSDT(Q)        HF-SCF  
     -6.13833956     -6.06587734
 **********************************************************************************************************************************
 Molpro calculation terminated
 Variable memory released
