
 Primary working directories    : /global/cscratch1/sd/aannabe
 Secondary working directories  : /global/cscratch1/sd/aannabe
 Wavefunction directory         : /global/homes/a/aannabe/wfu/
 Main file repository           : /global/cscratch1/sd/aannabe/

 SHA1      : 19cd028119e0e09f93f0674bd8af7968d9b3eff6
 NAME      : 2015.1.36
 ARCHNAME  : linux/x86_64
 FC        : /opt/cray/pe/craype/2.5.14/bin/ftn
 BLASLIB   : -L/opt/intel/compilers_and_libraries_2018.1.163/linux/mkl/lib/intel64 -Wl,-_start-group -lmkl_intel_ilp64 -lmkl_intel_thread -lmkl_core -Wl,-_end-group -liomp5
 id        : lbl

 Nodes     nprocs
 nid00466     1

 Using customized tuning parameters: mindgm=7; mindgv=16; mindgc=1; mindgr=1; noblas=0; minvec=7
 default implementation of scratch files=df  

 ***,As
 memory,8,g
 gthresh,twoint=1.e-12
 
 gprint,basis,orbitals
 gexpec,ekin,pot
 
 angstrom
 geometry={
 1                                                                               ! Number of atoms
 As 0.0 0.0 0.0
 }
 
 basis={
 
 Including file /global/homes/a/aannabe/repos/pseudopotentiallibrary/recipes/As/ccECP/As.ccECP.molpro
 
                                   !include,/global/homes/a/aannabe/repos/pseudopotentiallibrary/recipes/As/ccECP/As.cc-pVTZ.molpro
                                  !include,/global/homes/a/aannabe/repos/pseudopotentiallibrary/recipes/As/ccECP/As.cc-pCVTZ.molpro
 Including file /global/homes/a/aannabe/repos/pseudopotentiallibrary/recipes/As/ccECP/As.aug-cc-pVTZ.molpro
 
 
 }
 
 {hf
 wf,5,8,3
 occ,1,1,1,0,1,0,0,0
                                                                                 !open,1.3
 closed,1,0,0,0,0,0,0,0
                                                                                 !sym,
 }
 scf(i)=energy
 
 _CC_NORM_MAX=2.0
  !NOTE: Perturbative MRCC works only with UHF reference. So, here we will trick MRCC by doing zero UHF iteration right after ROHF.
 
 {uhf
 wf,5,8,3
 occ,1,1,1,0,1,0,0,0
                                                                                 !open,1.3
 closed,1,0,0,0,0,0,0,0
                                                                                 !sym,
 maxit,0
 }
 scf(i)=energy
 
 {mrcc,method=CCSDT(Q),dir=mrccdir                                               !,restart=1
 orbital,ignore_error=1                                                          !Ignore the fact that UHF WF is not converged
 maxit,100
 core
 }
 posthf(i)=energy
 
 table,scf,posthf,ekin,pot
 save,3.csv,new
 
 

 Variables initialized (889), CPU time= 0.00 sec
 Commands  initialized (702), CPU time= 0.01 sec, 572 directives.
 Default parameters read. Elapsed time= 0.11 sec

 Checking input...
 Passed
1


                                         ***  PROGRAM SYSTEM MOLPRO  ***
                                       Copyright, TTI GmbH Stuttgart, 2015
                                    Version 2015.1 linked Dec 29 2018 15:55:43


 **********************************************************************************************************************************
 LABEL *   As                                                                            
  64 bit serial version                                                                  DATE: 25-Jun-19          TIME: 12:03:46  
 **********************************************************************************************************************************

 SHA1:             19cd028119e0e09f93f0674bd8af7968d9b3eff6
 **********************************************************************************************************************************

 THRESHOLDS:

 ZERO    =  1.00D-12  ONEINT  =  1.00D-12  TWOINT  =  1.00D-12  PREFAC  =  1.00D-14  LOCALI  =  1.00D-09  EORDER  =  1.00D-04
 ENERGY  =  0.00D+00  ETEST   =  0.00D+00  EDENS   =  0.00D+00  THRDEDEF=  1.00D-06  GRADIENT=  1.00D-02  STEP    =  1.00D-03
 ORBITAL =  1.00D-05  CIVEC   =  1.00D-05  COEFF   =  1.00D-04  PRINTCI =  5.00D-02  PUNCHCI =  9.90D+01  OPTGRAD =  3.00D-04
 OPTENERG=  1.00D-06  OPTSTEP =  3.00D-04  THRGRAD =  1.00D-10  COMPRESS=  1.00D-11  VARMIN  =  1.00D-07  VARMAX  =  1.00D-03
 THRDOUB =  0.00D+00  THRDIV  =  1.00D-05  THRRED  =  1.00D-07  THRPSP  =  1.00D+00  THRDC   =  1.00D-10  THRCS   =  1.00D-10
 THRNRM  =  1.00D-08  THREQ   =  0.00D+00  THRDE   =  1.00D+00  THRREF  =  1.00D-05  SPARFAC =  1.00D+00  THRDLP  =  1.00D-07
 THRDIA  =  1.00D-10  THRDLS  =  1.00D-07  THRGPS  =  0.00D+00  THRKEX  =  0.00D+00  THRDIS  =  2.00D-01  THRVAR  =  1.00D-10
 THRLOC  =  1.00D-06  THRGAP  =  1.00D-06  THRLOCT = -1.00D+00  THRGAPT = -1.00D+00  THRORB  =  1.00D-06  THRMLTP =  0.00D+00
 THRCPQCI=  1.00D-10  KEXTA   =  0.00D+00  THRCOARS=  0.00D+00  SYMTOL  =  1.00D-06  GRADTOL =  1.00D-06  THROVL  =  1.00D-08
 THRORTH =  1.00D-08  GRID    =  1.00D-06  GRIDMAX =  1.00D-03  DTMAX   =  0.00D+00  THROCCDE=  1.00D-01  THROCCDE=  1.00D-01



 ZUNIT=ANG
 

Geometry recognized as XYZ


 Variable memory set to 8000000000 words,  buffer space   230000 words

 SETTING BASIS          =    USERDEF


 Recomputing integrals since basis changed


 Using spherical harmonics



 PROGRAM * SEWARD (Integral evaluation for generally contracted gaussian basis sets)     Author: Roland Lindh, 1990

 Geometry written to block  1 of record 700

 Orientation using atomic masses  
 Molecule type: Atom
 Symmetry elements: X,Y,Z
 Rotational constants:       0.0000000      0.0000000      0.0000000 GHz  (calculated with average atomic masses)

 Point group  D2h 



 ATOMIC COORDINATES

 NR  ATOM    CHARGE       X              Y              Z

   1  AS      5.00    0.000000000    0.000000000    0.000000000


          AS  CORE POTENTIAL

          f POTENTIAL

 POWERS             1              3              2              2
 EXPONENTIALS   1.285931       9.934874       1.895682       1.728256    
 COEFFICIENTS   5.000000       6.429657      -15.01244       2.898814    

          s - f POTENTIAL

 POWERS             2              2
 EXPONENTIALS   3.479387       1.637480    
 COEFFICIENTS   75.65519      -3.311453    

          p - f POTENTIAL

 POWERS             2              2
 EXPONENTIALS   3.229364       1.666366    
 COEFFICIENTS   67.96187      -3.094558    

          d - f POTENTIAL

 POWERS             2              2
 EXPONENTIALS   2.068163       1.546999    
 COEFFICIENTS   24.30473      0.9394562    


 BASIS DATA

   Nr Sym  Nuc  Type         Exponents   Contraction coefficients

    1.1 Ag    1  1s          50.230536    -0.000538
                             22.441775     0.003660
                             10.026436    -0.023992
                              4.479567     0.158076
                              2.001361    -0.419346
                              0.894159    -0.100519
                              0.399488     0.450020
                              0.178482     0.605104
                              0.079741     0.190009
    2.1 Ag    1  1s           0.549347     1.000000
    3.1 Ag    1  1s           0.115547     1.000000
    4.1 Ag    1  1s           0.046219     1.000000
    5.1 Ag    1  3d0          0.401888     1.000000
    6.1 Ag    1  3d2+         0.401888     1.000000
    7.1 Ag    1  3d0          0.166254     1.000000
    8.1 Ag    1  3d2+         0.166254     1.000000
    9.1 Ag    1  3d0          0.066502     1.000000
   10.1 Ag    1  3d2+         0.066502     1.000000
    1.2 B3u   1  2px         22.695464     0.000322
                             10.529662    -0.003120
                              4.885284     0.029849
                              2.266549    -0.127882
                              1.051576    -0.004461
                              0.487883     0.248666
                              0.226356     0.457083
                              0.105019     0.351483
                              0.048724     0.091636
    2.2 B3u   1  2px          0.603543     1.000000
    3.2 B3u   1  2px          0.099669     1.000000
    4.2 B3u   1  2px          0.039868     1.000000
    5.2 B3u   1  4f1+         0.430378     1.000000
    6.2 B3u   1  4f3+         0.430378     1.000000
    7.2 B3u   1  4f1+         0.172151     1.000000
    8.2 B3u   1  4f3+         0.172151     1.000000
    1.3 B2u   1  2py         22.695464     0.000322
                             10.529662    -0.003120
                              4.885284     0.029849
                              2.266549    -0.127882
                              1.051576    -0.004461
                              0.487883     0.248666
                              0.226356     0.457083
                              0.105019     0.351483
                              0.048724     0.091636
    2.3 B2u   1  2py          0.603543     1.000000
    3.3 B2u   1  2py          0.099669     1.000000
    4.3 B2u   1  2py          0.039868     1.000000
    5.3 B2u   1  4f1-         0.430378     1.000000
    6.3 B2u   1  4f3-         0.430378     1.000000
    7.3 B2u   1  4f1-         0.172151     1.000000
    8.3 B2u   1  4f3-         0.172151     1.000000
    1.4 B1g   1  3d2-         0.401888     1.000000
    2.4 B1g   1  3d2-         0.166254     1.000000
    3.4 B1g   1  3d2-         0.066502     1.000000
    1.5 B1u   1  2pz         22.695464     0.000322
                             10.529662    -0.003120
                              4.885284     0.029849
                              2.266549    -0.127882
                              1.051576    -0.004461
                              0.487883     0.248666
                              0.226356     0.457083
                              0.105019     0.351483
                              0.048724     0.091636
    2.5 B1u   1  2pz          0.603543     1.000000
    3.5 B1u   1  2pz          0.099669     1.000000
    4.5 B1u   1  2pz          0.039868     1.000000
    5.5 B1u   1  4f0          0.430378     1.000000
    6.5 B1u   1  4f2+         0.430378     1.000000
    7.5 B1u   1  4f0          0.172151     1.000000
    8.5 B1u   1  4f2+         0.172151     1.000000
    1.6 B2g   1  3d1+         0.401888     1.000000
    2.6 B2g   1  3d1+         0.166254     1.000000
    3.6 B2g   1  3d1+         0.066502     1.000000
    1.7 B3g   1  3d1-         0.401888     1.000000
    2.7 B3g   1  3d1-         0.166254     1.000000
    3.7 B3g   1  3d1-         0.066502     1.000000
    1.8 Au    1  4f2-         0.430378     1.000000
    2.8 Au    1  4f2-         0.172151     1.000000

 NUCLEAR CHARGE:                    5
 NUMBER OF PRIMITIVE AOS:          86
 NUMBER OF SYMMETRY AOS:           77
 NUMBER OF CONTRACTIONS:           45   (  10Ag  +   8B3u +   8B2u +   3B1g +   8B1u +   3B2g +   3B3g +   2Au  )
 NUMBER OF CORE ORBITALS:           0   (   0Ag  +   0B3u +   0B2u +   0B1g +   0B1u +   0B2g +   0B3g +   0Au  )
 NUMBER OF VALENCE ORBITALS:        4   (   1Ag  +   1B3u +   1B2u +   0B1g +   1B1u +   0B2g +   0B3g +   0Au  )


 NUCLEAR REPULSION ENERGY    0.00000000

 EXTRA SYMMETRY OF AOS IN SYMMETRY 1:   1 1 1 1 2 3 2 3 2 3
 EXTRA SYMMETRY OF AOS IN SYMMETRY 2:   1 1 1 1 2 3 2 3
 EXTRA SYMMETRY OF AOS IN SYMMETRY 3:   1 1 1 1 2 3 2 3
 EXTRA SYMMETRY OF AOS IN SYMMETRY 5:   1 1 1 1 2 3 2 3

 Eigenvalues of metric

         1 0.217E-01 0.128E+00 0.128E+00 0.166E+00 0.626E+00 0.716E+00 0.716E+00 0.216E+01
         2 0.235E-01 0.236E+00 0.367E+00 0.367E+00 0.910E+00 0.163E+01 0.163E+01 0.283E+01
         3 0.235E-01 0.236E+00 0.367E+00 0.367E+00 0.910E+00 0.163E+01 0.163E+01 0.283E+01
         4 0.128E+00 0.716E+00 0.216E+01
         5 0.235E-01 0.236E+00 0.367E+00 0.367E+00 0.910E+00 0.163E+01 0.163E+01 0.283E+01
         6 0.128E+00 0.716E+00 0.216E+01
         7 0.128E+00 0.716E+00 0.216E+01
         8 0.367E+00 0.163E+01


 Contracted 2-electron integrals neglected if value below      1.0D-12
 AO integral compression algorithm  1   Integral accuracy      1.0D-12

     1.049 MB (compressed) written to integral file ( 92.4%)


 NUMBER OF SORTED TWO-ELECTRON INTEGRALS:      75808.     BUFFER LENGTH:  32768
 NUMBER OF SEGMENTS:   1  SEGMENT LENGTH:      75808      RECORD LENGTH: 524288

 Memory used in sort:       0.63 MW

 SORT1 READ      155797. AND WROTE       61548. INTEGRALS IN      1 RECORDS. CPU TIME:     0.01 SEC, REAL TIME:     0.01 SEC
 SORT2 READ       61548. AND WROTE       75808. INTEGRALS IN      4 RECORDS. CPU TIME:     0.01 SEC, REAL TIME:     0.02 SEC

 FILE SIZES:   FILE 1:    21.0 MBYTE,  FILE 4:     4.2 MBYTE,   TOTAL:     25.2 MBYTE

 OPERATOR DM      FOR CENTER  0  COORDINATES:    0.000000    0.000000    0.000000
 OPERATOR EKIN    FOR CENTER  0  COORDINATES:    0.000000    0.000000    0.000000
 OPERATOR POT     FOR CENTER  0  COORDINATES:    0.000000    0.000000    0.000000


 **********************************************************************************************************************************
 DATASETS  * FILE   NREC   LENGTH (MB)   RECORD NAMES
              1      20       20.40       500      610      700      900      950      970     1000      129      960     1100   
                                          VAR    BASINP    GEOM    SYMINP    ZMAT    AOBASIS   BASIS     P2S    ABASIS      S 
                                         1400     1410     1420     1200     1210     1080     1600     1650     1300     1700   
                                         EKIN       V       ECP      H0       H01     AOSYM     SMH    MOLCAS    ERIS     OPER   

 PROGRAMS   *        TOTAL       INT
 CPU TIMES  *         1.74      1.64
 REAL TIME  *        10.74 SEC
 DISK USED  *        25.47 MB      
 **********************************************************************************************************************************


 PROGRAM * RHF-SCF (OPEN SHELL)       Authors: W. Meyer, H.-J. Werner


 NUMBER OF ELECTRONS:       4+    1-    SPACE SYMMETRY=8    SPIN SYMMETRY: Quartet 
 CONVERGENCE THRESHOLDS:    1.00E-05 (Density)    1.00E-07 (Energy)
 MAX. NUMBER OF ITERATIONS:       60
 INTERPOLATION TYPE:            DIIS
 INTERPOLATION STEPS:              2 (START)      1 (STEP)
 LEVEL SHIFTS:                 -0.60 (CLOSED) -0.30 (OPEN) 

 Number of closed-shell orbitals:    1 (   1   0   0   0   0   0   0   0 )
 Number of open-shell orbitals:      3 (   0   1   1   0   1   0   0   0 )



   Atom=AS basis=ECP28MDF_GUESS    lmin=0  lmax=1

 Orbital guess generated from atomic densities. Full valence occupancy:    1   1   1   0   1   0   0   0


 Molecular orbital dump at record        2100.2

 ITERATION    DDIFF          GRAD             ENERGY        2-EL.EN.            DIPOLE MOMENTS         DIIS   ORB.
    1      0.000D+00      0.000D+00        -6.05196166      6.785029    0.00000    0.00000    0.00000    0    start
    2      0.000D+00      0.794D-02        -6.06250422      6.963542    0.00000    0.00000    0.00000    1    diag,B
    3      0.178D-01      0.347D-02        -6.06548097      7.066948    0.00000    0.00000    0.00000    2    diag,B
    4      0.107D-01      0.137D-02        -6.06587515      7.093974    0.00000    0.00000    0.00000    3    diag,B
    5      0.606D-02      0.121D-03        -6.06587638      7.092832    0.00000    0.00000    0.00000    4    diag,B
    6      0.284D-03      0.511D-04        -6.06587662      7.092808    0.00000    0.00000    0.00000    5    diag,B
    7      0.176D-03      0.463D-05        -6.06587662      7.092714    0.00000    0.00000    0.00000    6    fixocc
    8      0.108D-04      0.162D-05        -6.06587663      7.092690    0.00000    0.00000    0.00000    7    diag,B
    9      0.754D-05      0.509D-07        -6.06587663      7.092691    0.00000    0.00000    0.00000    0    orth

 Final alpha occupancy:   1   1   1   0   1   0   0   0
 Final beta  occupancy:   1   0   0   0   0   0   0   0

 !RHF STATE 1.8 Energy                 -6.065876625054
 Nuclear energy                         0.00000000
 One-electron energy                   -9.61222192
 Two-electron energy                    3.54634529
 Virial quotient                       -2.63824681
 !RHF STATE 1.8 Dipole moment           0.00000000     0.00000000     0.00000000
 Dipole moment /Debye                   0.00000000     0.00000000     0.00000000
 

 !RHF expec          <1.8|EKIN|1.8>     2.299207412654
 
 !RHF expec           <1.8|POT|1.8>    -2.512322514513

 ELECTRON ORBITALS
 =================


   Orb  Occ    Energy  Couls-En    Coefficients

                                   1 1s      1 1s      1 1s      1 1s      1 3d0     1 3d2+    1 3d0     1 3d2+    1 3d0     1 3d2+ 


   1.1   2    -0.7039   -2.9217  1.000384  0.000273 -0.001478  0.001123  0.000000 -0.000000 -0.000000  0.000000 -0.000000 -0.000000

                                   1 2px     1 2px     1 2px     1 2px     1 4f1+    1 4f3+    1 4f1+    1 4f3+ 

   1.2   +    -0.3706   -2.0961  1.000021 -0.000001 -0.000088  0.000101  0.000000 -0.000000 -0.000000  0.000000

                                   1 2py     1 2py     1 2py     1 2py     1 4f1-    1 4f3-    1 4f1-    1 4f3- 

   1.3   +    -0.3706   -2.0961  1.000021 -0.000001 -0.000088  0.000101  0.000000 -0.000000 -0.000000  0.000000

                                   1 2pz     1 2pz     1 2pz     1 2pz     1 4f0     1 4f2+    1 4f0     1 4f2+ 

   1.5   +    -0.3706   -2.0961  1.000021 -0.000001 -0.000088  0.000101  0.000000 -0.000000  0.000000  0.000000

 HOMO      1.2    -0.370570 =     -10.0837eV
 LUMO      2.1     0.094735 =       2.5779eV
 LUMO-HOMO         0.465305 =      12.6616eV


 **********************************************************************************************************************************
 DATASETS  * FILE   NREC   LENGTH (MB)   RECORD NAMES
              1      20       20.40       500      610      700      900      950      970     1000      129      960     1100   
                                          VAR    BASINP    GEOM    SYMINP    ZMAT    AOBASIS   BASIS     P2S    ABASIS      S 
                                         1400     1410     1420     1200     1210     1080     1600     1650     1300     1700   
                                         EKIN       V       ECP      H0       H01     AOSYM     SMH    MOLCAS    ERIS     OPER   

              2       4        2.76       700     1000      520     2100   
                                         GEOM     BASIS   MCVARS     RHF  

 PROGRAMS   *        TOTAL        HF       INT
 CPU TIMES  *         1.78      0.04      1.64
 REAL TIME  *        10.88 SEC
 DISK USED  *        25.47 MB      
 **********************************************************************************************************************************
 SETTING SCF(I)         =        -6.06587663  AU                              
 SETTING _CC_NORM_MAX   =         2.00000000                                  


 PROGRAM * UHF-SCF       Authors: W. Meyer, H.-J. Werner


 NUMBER OF ELECTRONS:       4+    1-    SPACE SYMMETRY=8    SPIN SYMMETRY: Quartet 
 CONVERGENCE THRESHOLDS:    1.00E-05 (Density)    1.00E-07 (Energy)
 MAX. NUMBER OF ITERATIONS:        0
 INTERPOLATION TYPE:            DIIS
 INTERPOLATION STEPS:              2 (START)      1 (STEP)
 LEVEL SHIFTS:                  0.20 (ALPHA)   0.20 (BETA) 

 Number of closed-shell orbitals:    1 (   1   0   0   0   0   0   0   0 )
 Number of open-shell orbitals:      3 (   0   1   1   0   1   0   0   0 )


 Molecular orbitals read from record     2100.2  Type=RHF/CANONICAL (state 1.8)

 Molecular orbital dump at record        2200.2

 Initial alpha occupation   1   1   1   0   1   0   0   0
 Initial beta  occupation   1   0   0   0   0   0   0   0

 ITERATION    DDIFF          GRAD             ENERGY        2-EL.EN.            DIPOLE MOMENTS         DIIS
    1      0.000D+00      0.000D+00        -6.06587663      7.092691    0.00000    0.00000    0.00000    0
 
 Final alpha occupancy:   1   1   1   0   1   0   0   0
 Final beta  occupancy:   1   0   0   0   0   0   0   0

 !UHF STATE 1.8 Energy                 -6.065876625054
 Nuclear energy                         0.00000000
 One-electron energy                   -9.61222192
 Two-electron energy                    3.54634529
 Virial quotient                       -2.63824681
 !UHF STATE 1.8 Dipole moment           0.00000000     0.00000000     0.00000000
 Dipole moment /Debye                   0.00000000     0.00000000     0.00000000
 

 !UHF expec          <1.8|EKIN|1.8>     2.299207412654
 
 !UHF expec           <1.8|POT|1.8>    -2.512322514513

 ELECTRON ORBITALS FOR POSITIVE SPIN
 ===================================


   Orb  Occ    Energy  Couls-En    Coefficients

                                   1 1s      1 1s      1 1s      1 1s      1 3d0     1 3d2+    1 3d0     1 3d2+    1 3d0     1 3d2+ 


   1.1   +    -0.7039   -2.9217  1.000384  0.000273 -0.001478  0.001123  0.000000 -0.000000 -0.000000  0.000000 -0.000000 -0.000000

                                   1 2px     1 2px     1 2px     1 2px     1 4f1+    1 4f3+    1 4f1+    1 4f3+ 

   1.2   +    -0.3706   -2.0961  1.000021 -0.000001 -0.000088  0.000101  0.000000 -0.000000 -0.000000  0.000000

                                   1 2py     1 2py     1 2py     1 2py     1 4f1-    1 4f3-    1 4f1-    1 4f3- 

   1.3   +    -0.3706   -2.0961  1.000021 -0.000001 -0.000088  0.000101  0.000000 -0.000000 -0.000000  0.000000

                                   1 2pz     1 2pz     1 2pz     1 2pz     1 4f0     1 4f2+    1 4f0     1 4f2+ 

   1.5   +    -0.3706   -2.0961  1.000021 -0.000001 -0.000088  0.000101  0.000000 -0.000000  0.000000  0.000000

 ELECTRON ORBITALS FOR NEGATIVE SPIN
 ===================================


   Orb  Occ    Energy  Couls-En    Coefficients

                                   1 1s      1 1s      1 1s      1 1s      1 3d0     1 3d2+    1 3d0     1 3d2+    1 3d0     1 3d2+ 


   1.1   -    -0.7039   -2.9217  1.000384  0.000273 -0.001478  0.001123  0.000000 -0.000000 -0.000000  0.000000 -0.000000 -0.000000

 HOMO      1.2    -0.370570 =     -10.0837eV
 LUMO     -1.2    -0.370570 =     -10.0837eV
 LUMO-HOMO         0.000000 =       0.0000eV

 EXPECTATION VALUE OF S**2:             3.75000000

 Occupation number threshold for canonical orbitals:  1.999000 (occupied),  0.001000 (virtual)

 Number of pseudo-canonical orbitals per symmetry:    1   0   0   0   0   0   0   0
 Number of active natural orbitals per symmetry:      0   1   1   0   1   0   0   0

 NATURAL CHARGE ORBITALS
 =======================


   Orb     Occ        Energy       Coefficients

                                   1 1s      1 1s      1 1s      1 1s      1 3d0     1 3d2+    1 3d0     1 3d2+    1 3d0     1 3d2+ 


   1.1  2.00000    -0.703911     1.000384  0.000273 -0.001478  0.001123  0.000000 -0.000000 -0.000000  0.000000 -0.000000 -0.000000

                                   1 2px     1 2px     1 2px     1 2px     1 4f1+    1 4f3+    1 4f1+    1 4f3+ 

   1.2  1.00000    -0.150718     1.000021 -0.000001 -0.000088  0.000101  0.000000 -0.000000 -0.000000  0.000000

                                   1 2py     1 2py     1 2py     1 2py     1 4f1-    1 4f3-    1 4f1-    1 4f3- 

   1.3  1.00000    -0.150718     1.000021 -0.000001 -0.000088  0.000101  0.000000 -0.000000 -0.000000  0.000000

                                   1 2pz     1 2pz     1 2pz     1 2pz     1 4f0     1 4f2+    1 4f0     1 4f2+ 

   1.5  1.00000    -0.150718     1.000021 -0.000001 -0.000088  0.000101  0.000000 -0.000000  0.000000  0.000000

 Natural orbitals saved to record    2200.2 (Orbital set 3)

 Orbital spaces for UNO-CAS (Min. occupation: 0.020  Max. occupation: 1.980):

 Closed:        1   0   0   0   0   0   0   0
 Active:        0   1   1   0   1   0   0   0

 No convergence



 **********************************************************************************************************************************
 DATASETS  * FILE   NREC   LENGTH (MB)   RECORD NAMES
              1      20       20.40       500      610      700      900      950      970     1000      129      960     1100   
                                          VAR    BASINP    GEOM    SYMINP    ZMAT    AOBASIS   BASIS     P2S    ABASIS      S 
                                         1400     1410     1420     1200     1210     1080     1600     1650     1300     1700   
                                         EKIN       V       ECP      H0       H01     AOSYM     SMH    MOLCAS    ERIS     OPER   

              2       5        5.27       700     1000      520     2100     2200   
                                         GEOM     BASIS   MCVARS     RHF      UHF  

 PROGRAMS   *        TOTAL       UHF        HF       INT
 CPU TIMES  *         1.80      0.02      0.04      1.64
 REAL TIME  *        11.02 SEC
 DISK USED  *        25.75 MB      
 **********************************************************************************************************************************
 SETTING SCF(I)         =        -6.06587663  AU                              


 PROGRAM * MRCC (General Multireference Coupled Cluster)    Author: M. Kallay, 2000-2005

 ***  Initialisation ***

   0 Spin projections
 
 Molecular orbitals read from record     2200.2  Type=UHF/ALPHA (state 1.8)

 ?Warning: UHF not converged
 Molecular orbitals read from record     2200.2  Type=UHF/BETA (state 1.8)

 ?Warning: UHF not converged
 
 Frozen orbitals:              0 (  0  0  0  0  0  0  0  0)
 Active orbitals:             45 ( 10  8  8  3  8  3  3  2)
 Active electrons:             5
 Spin quantum number:          1.5

 Transformed integrals will be written to file mrccdir/mrcc_40405/fort.55

 Load integrals                1.9 sec
 Transform integrals           1.9 sec
 Storage for integrals:         426551
 Remaining memory:           *********

 Core energy:               0.00000000
 
 MRCC Input:
     4     0     0     0     3     0     0     8     0     0     0     1     1     0     0     7     0     0   0.000     0   64000
  ex.lev,nsing,ntrip, rest,method,dens,conver,symm, diag, CS ,spatial, HF, ndoub,nacto,nactv, tol, maxex, sacc, freq,  dboc,   mem
  2  0  0  0  0  0  0  0  0  0  1  0  0  0  0  0  0  0  1  0  0  0  0  0  0  0  0  0  0  1  0  0  0  0  0  0  0  0  0  0  0  0  0  0  0
 MRCC Input end
 Variable memory released
 MRCC now being run, temporary output in /global/cscratch1/sd/aannabe/mrccdir/mrcc_40405/mrcc.out
 **********************************************************************
                          MRCC program system
 **********************************************************************

                              Written by
  Mihaly Kallay, Zoltan Rolik, Jozsef Csontos, Peter Nagy, Gyula Samu,
      David Mester, Jozsef Csoka, Bernat Szabo, Istvan Ladjanszki,
       Lorant Szegedy, Bence Ladoczki, Klara Petrov, Mate Farkas,
                    Pal D. Mezei, and Bence Hegely

        Department of Physical Chemistry and Materials Science
            Budapest University of Technology and Economics
                  Budapest P.O.Box 91, H-1521 Hungary

                              www.mrcc.hu

                       Release date: May 23, 2018

 ************************ 2019-06-25 12:04:04 *************************
 Executing goldstone...

 Generation of CC equations in terms of H and T...
 Generation of antisymmetrized Goldstone diagrams...
 Number of diagrams in T^1 equations:    15
 Number of diagrams in T^2 equations:    38
 Number of diagrams in T^3 equations:    49
 Number of diagrams in T^4 equations:     5
 Translation of diagrams to factorized equations...
 Optimizing intermediate calculation...
 Number of floating-point operations per iteration step:   1.1712E+09
 Probable CPU time per iteration step (hours):      0.01
 Required memory (Mbytes):     429.6
 Number of intermediates:                                  80
 Number of intermediates to be stored:                     32
 Length of intermediate file (Mbytes):       8.7

 ************************ 2019-06-25 12:04:04 *************************
 Executing xmrcc...

 **********************************************************************
 CC(3)(4) calculation


 Allocation of 429.6 Mbytes of memory...
 Number of spinorbitals:                    90
 Number of alpha electrons:                        4
 Number of beta electrons:                         1
 Spin multiplicity:                     2
 z-component of spin:  1.5
 Spatial symmetry:                      8
 Convergence criterion:  1.0E-07
 Construction of occupation graphs...
 Number of                     0 -fold excitations:                      1
 Number of                     1 -fold excitations:                     39
 Number of                     2 -fold excitations:                   1621
 Number of                     3 -fold excitations:                  32410
 Total number of configurations:                  34071
 Calculation of coupling coefficients...
 Length of intermediate file (Mbytes):       6.9

 ======================================================================

 Spin case  1   Alpha:  3   Beta:  1
 Number of excitations:                 234360
 Spin case  2   Alpha:  4   Beta:  0
 Number of excitations:                  12879
 Number of                     4 -fold excitations:                 247239

 Memory requirements /Mbyte/:
               Minimal        Optimal
 Real*8:         22.4391        31.3201
 Integer:         6.3828
 Total:          28.8220        37.7029


 ************************ 2019-06-25 12:04:05 *************************
 Executing mrcc...

 **********************************************************************
 CCSDT(Q) calculation


 Allocation of   31.3 Mbytes of memory...
 Number of spinorbitals:  90
 Number of alpha electrons:  4
 Number of beta  electrons:  1
 Spin multiplicity: 2
 z-component of spin:  1.5
 Spatial symmetry: 8
 Convergence criterion:  1.0E-07
 Construction of occupation graphs...
 Number of 0-fold excitations: 1
 Number of 1-fold excitations: 39
 Number of 2-fold excitations: 1621
 Number of 3-fold excitations: 32410
 Total number of determinants: 34071
 Calculation of coupling coefficients...
 Initial cluster amplitudes are generated.
 Length of intermediate file (Mbytes):       6.9
 Reading integral list from unit 55...
 Sorting integrals...
 Sorting integrals...
 Sorting integrals...
 Sorting integrals...
 Energy of reference determinant [au]:      -6.065876625054
 Calculation of MP denominators...

 Starting CC iteration...
 ======================================================================
 Norm of residual vector:     0.41996816
 CPU time [min]:     0.023                   Wall time [min]:     0.024

 Iteration  1  CC energy:    -6.14248725  Energy decrease:   0.07661063
 ======================================================================
 Norm of residual vector:     0.11172226
 CPU time [min]:     0.034                   Wall time [min]:     0.039

 Iteration  2  CC energy:    -6.15325093  Energy decrease:   0.01076368
 ======================================================================
 Norm of residual vector:     0.02721216
 CPU time [min]:     0.045                   Wall time [min]:     0.051

 Iteration  3  CC energy:    -6.15790940  Energy decrease:   0.00465847
 ======================================================================
 Norm of residual vector:     0.00549032
 CPU time [min]:     0.057                   Wall time [min]:     0.064

 Iteration  4  CC energy:    -6.15793555  Energy decrease:   0.00002615
 ======================================================================
 Norm of residual vector:     0.00118499
 CPU time [min]:     0.068                   Wall time [min]:     0.079

 Iteration  5  CC energy:    -6.15796839  Energy decrease:   0.00003284
 ======================================================================
 Norm of residual vector:     0.00031057
 CPU time [min]:     0.079                   Wall time [min]:     0.096

 Iteration  6  CC energy:    -6.15796210  Energy decrease:   0.00000630
 ======================================================================
 Norm of residual vector:     0.00007821
 CPU time [min]:     0.091                   Wall time [min]:     0.109

 Iteration  7  CC energy:    -6.15796092  Energy decrease:   0.00000118
 ======================================================================
 Norm of residual vector:     0.00002196
 CPU time [min]:     0.102                   Wall time [min]:     0.121

 Iteration  8  CC energy:    -6.15796167  Energy decrease:   0.00000075
 ======================================================================
 Norm of residual vector:     0.00000580
 CPU time [min]:     0.114                   Wall time [min]:     0.135

 Iteration  9  CC energy:    -6.15796160  Energy decrease:   0.00000007
 ======================================================================
 Norm of residual vector:     0.00000206
 CPU time [min]:     0.125                   Wall time [min]:     0.150

 Iteration 10  CC energy:    -6.15796154  Energy decrease:   0.00000006
 ======================================================================
 Norm of residual vector:     0.00000055
 CPU time [min]:     0.137                   Wall time [min]:     0.163

 Iteration 11  CC energy:    -6.15796156  Energy decrease:   0.00000002
 ======================================================================
 Norm of residual vector:     0.00000013
 CPU time [min]:     0.149                   Wall time [min]:     0.175

 Iteration 12  CC energy:    -6.15796156  Energy decrease:   2.4576E-10
 ======================================================================
 Norm of residual vector:     0.00000003
 CPU time [min]:     0.160                   Wall time [min]:     0.188

 Iteration 13  CC energy:    -6.15796156  Energy decrease:   4.1710E-10
 ======================================================================

 Iteration has converged in 13 steps.

 Final results:
 Total CCSDT energy [au]:             -6.157961563276
 Total MP2 energy [au]:               -6.142487251456

 Perturbative corrections are calculated...
 ======================================================================
 Spin case  1   Alpha:  3   Beta:  1
 Number of excitations:        234360
 CPU time [min]:     0.585                   Wall time [min]:     0.614
 ======================================================================
 Spin case  2   Alpha:  4   Beta:  0
 Number of excitations:        12879
 CPU time [min]:     0.650                   Wall time [min]:     0.679
 ======================================================================
 Number of 4-fold excitations: 247239
 CPU time [min]:     0.650                   Wall time [min]:     0.679

 Total CCSDT[Q] energy [au]:          -6.157987251917
 Total CCSDT(Q) energy [au]:          -6.158044932008

 ************************ 2019-06-25 12:04:46 *************************
                      Normal termination of mrcc.
 **********************************************************************
 !CCSDT STATE 1.8 Energy               -6.157961563276
 !MP2 STATE 1.8 Energy                 -6.142487251456
 !CCSDT[Q] STATE 1.8 Energy            -6.157987251917
 !CCSDT(Q) STATE 1.8 Energy            -6.158044932008
 
 CPU-time for MRCC:             39.0 sec
 Elapsed-time for MRCC:         43.8 sec

 Variable memory set to 8000000000 words,  buffer space   230000 words



 **********************************************************************************************************************************
 DATASETS  * FILE   NREC   LENGTH (MB)   RECORD NAMES
              1      20       20.40       500      610      700      900      950      970     1000      129      960     1100   
                                          VAR    BASINP    GEOM    SYMINP    ZMAT    AOBASIS   BASIS     P2S    ABASIS      S 
                                         1400     1410     1420     1200     1210     1080     1600     1650     1300     1700   
                                         EKIN       V       ECP      H0       H01     AOSYM     SMH    MOLCAS    ERIS     OPER   

              2       5        5.27       700     1000      520     2100     2200   
                                         GEOM     BASIS   MCVARS     RHF      UHF  

 PROGRAMS   *        TOTAL      MRCC       UHF        HF       INT
 CPU TIMES  *        41.64     39.84      0.02      0.04      1.64
 REAL TIME  *        59.88 SEC
 DISK USED  *        25.75 MB      
 **********************************************************************************************************************************
 SETTING POSTHF(I)      =        -6.15804493  AU                              
                                                                                                                                                                                                                                                                

       SCF           POSTHF       EKIN          POT
    -6.06587663   -6.15804493   2.29920741   -2.51232251
                                                  

 CCSDT(Q)/USERDEF energy=     -6.158044932008

        CCSDT(Q)        UHF-SCF         HF-SCF  
     -6.15804493     -6.06587663     -6.06587663
 **********************************************************************************************************************************
 Molpro calculation terminated
 Variable memory released
