
 Primary working directories    : /global/cscratch1/sd/aannabe
 Secondary working directories  : /global/cscratch1/sd/aannabe
 Wavefunction directory         : /global/homes/a/aannabe/wfu/
 Main file repository           : /global/cscratch1/sd/aannabe/

 SHA1      : 19cd028119e0e09f93f0674bd8af7968d9b3eff6
 NAME      : 2015.1.36
 ARCHNAME  : linux/x86_64
 FC        : /opt/cray/pe/craype/2.5.14/bin/ftn
 BLASLIB   : -L/opt/intel/compilers_and_libraries_2018.1.163/linux/mkl/lib/intel64 -Wl,-_start-group -lmkl_intel_ilp64 -lmkl_intel_thread -lmkl_core -Wl,-_end-group -liomp5
 id        : lbl

 Nodes     nprocs
 nid00466     1

 Using customized tuning parameters: mindgm=7; mindgv=16; mindgc=1; mindgr=1; noblas=0; minvec=7
 default implementation of scratch files=df  

 ***,As
 memory,8,g
 gthresh,twoint=1.e-12
 
 gprint,basis,orbitals
 gexpec,ekin,pot
 
 angstrom
 geometry={
 1                                                                               ! Number of atoms
 As 0.0 0.0 0.0
 }
 
 basis={
 
 Including file /global/homes/a/aannabe/repos/pseudopotentiallibrary/recipes/As/ccECP/As.ccECP.molpro
 
                                   !include,/global/homes/a/aannabe/repos/pseudopotentiallibrary/recipes/As/ccECP/As.cc-pV5Z.molpro
                                  !include,/global/homes/a/aannabe/repos/pseudopotentiallibrary/recipes/As/ccECP/As.cc-pCV5Z.molpro
 Including file /global/homes/a/aannabe/repos/pseudopotentiallibrary/recipes/As/ccECP/As.aug-cc-pV5Z.molpro
 
 
 }
 
 {hf
 wf,5,8,3
 occ,1,1,1,0,1,0,0,0
                                                                                 !open,1.3
 closed,1,0,0,0,0,0,0,0
                                                                                 !sym,
 }
 scf(i)=energy
 
 _CC_NORM_MAX=2.0
  !NOTE: Perturbative MRCC works only with UHF reference. So, here we will trick MRCC by doing zero UHF iteration right after ROHF.
 
 {uhf
 wf,5,8,3
 occ,1,1,1,0,1,0,0,0
                                                                                 !open,1.3
 closed,1,0,0,0,0,0,0,0
                                                                                 !sym,
 maxit,0
 }
 scf(i)=energy
 
 {mrcc,method=CCSDT(Q),dir=mrccdir                                               !,restart=1
 orbital,ignore_error=1                                                          !Ignore the fact that UHF WF is not converged
 maxit,100
 core
 }
 posthf(i)=energy
 
 table,scf,posthf,ekin,pot
 save,5.csv,new
 
 

 Variables initialized (889), CPU time= 0.01 sec
 Commands  initialized (702), CPU time= 0.00 sec, 572 directives.
 Default parameters read. Elapsed time= 0.33 sec

 Checking input...
 Passed
1


                                         ***  PROGRAM SYSTEM MOLPRO  ***
                                       Copyright, TTI GmbH Stuttgart, 2015
                                    Version 2015.1 linked Dec 29 2018 15:55:43


 **********************************************************************************************************************************
 LABEL *   As                                                                            
  64 bit serial version                                                                  DATE: 25-Jun-19          TIME: 12:14:21  
 **********************************************************************************************************************************

 SHA1:             19cd028119e0e09f93f0674bd8af7968d9b3eff6
 **********************************************************************************************************************************

 THRESHOLDS:

 ZERO    =  1.00D-12  ONEINT  =  1.00D-12  TWOINT  =  1.00D-12  PREFAC  =  1.00D-14  LOCALI  =  1.00D-09  EORDER  =  1.00D-04
 ENERGY  =  0.00D+00  ETEST   =  0.00D+00  EDENS   =  0.00D+00  THRDEDEF=  1.00D-06  GRADIENT=  1.00D-02  STEP    =  1.00D-03
 ORBITAL =  1.00D-05  CIVEC   =  1.00D-05  COEFF   =  1.00D-04  PRINTCI =  5.00D-02  PUNCHCI =  9.90D+01  OPTGRAD =  3.00D-04
 OPTENERG=  1.00D-06  OPTSTEP =  3.00D-04  THRGRAD =  1.00D-10  COMPRESS=  1.00D-11  VARMIN  =  1.00D-07  VARMAX  =  1.00D-03
 THRDOUB =  0.00D+00  THRDIV  =  1.00D-05  THRRED  =  1.00D-07  THRPSP  =  1.00D+00  THRDC   =  1.00D-10  THRCS   =  1.00D-10
 THRNRM  =  1.00D-08  THREQ   =  0.00D+00  THRDE   =  1.00D+00  THRREF  =  1.00D-05  SPARFAC =  1.00D+00  THRDLP  =  1.00D-07
 THRDIA  =  1.00D-10  THRDLS  =  1.00D-07  THRGPS  =  0.00D+00  THRKEX  =  0.00D+00  THRDIS  =  2.00D-01  THRVAR  =  1.00D-10
 THRLOC  =  1.00D-06  THRGAP  =  1.00D-06  THRLOCT = -1.00D+00  THRGAPT = -1.00D+00  THRORB  =  1.00D-06  THRMLTP =  0.00D+00
 THRCPQCI=  1.00D-10  KEXTA   =  0.00D+00  THRCOARS=  0.00D+00  SYMTOL  =  1.00D-06  GRADTOL =  1.00D-06  THROVL  =  1.00D-08
 THRORTH =  1.00D-08  GRID    =  1.00D-06  GRIDMAX =  1.00D-03  DTMAX   =  0.00D+00  THROCCDE=  1.00D-01  THROCCDE=  1.00D-01



 ZUNIT=ANG
 

Geometry recognized as XYZ


 Variable memory set to 8000000000 words,  buffer space   230000 words

 SETTING BASIS          =    USERDEF


 Recomputing integrals since basis changed


 Using spherical harmonics



 PROGRAM * SEWARD (Integral evaluation for generally contracted gaussian basis sets)     Author: Roland Lindh, 1990

 Geometry written to block  1 of record 700

 Orientation using atomic masses  
 Molecule type: Atom
 Symmetry elements: X,Y,Z
 Rotational constants:       0.0000000      0.0000000      0.0000000 GHz  (calculated with average atomic masses)

 Point group  D2h 



 ATOMIC COORDINATES

 NR  ATOM    CHARGE       X              Y              Z

   1  AS      5.00    0.000000000    0.000000000    0.000000000


          AS  CORE POTENTIAL

          f POTENTIAL

 POWERS             1              3              2              2
 EXPONENTIALS   1.285931       9.934874       1.895682       1.728256    
 COEFFICIENTS   5.000000       6.429657      -15.01244       2.898814    

          s - f POTENTIAL

 POWERS             2              2
 EXPONENTIALS   3.479387       1.637480    
 COEFFICIENTS   75.65519      -3.311453    

          p - f POTENTIAL

 POWERS             2              2
 EXPONENTIALS   3.229364       1.666366    
 COEFFICIENTS   67.96187      -3.094558    

          d - f POTENTIAL

 POWERS             2              2
 EXPONENTIALS   2.068163       1.546999    
 COEFFICIENTS   24.30473      0.9394562    


 BASIS DATA

   Nr Sym  Nuc  Type         Exponents   Contraction coefficients

    1.1 Ag    1  1s          50.230536    -0.000538
                             22.441775     0.003660
                             10.026436    -0.023992
                              4.479567     0.158076
                              2.001361    -0.419346
                              0.894159    -0.100519
                              0.399488     0.450020
                              0.178482     0.605104
                              0.079741     0.190009
    2.1 Ag    1  1s           0.547920     1.000000
    3.1 Ag    1  1s           0.295142     1.000000
    4.1 Ag    1  1s           0.158980     1.000000
    5.1 Ag    1  1s           0.085636     1.000000
    6.1 Ag    1  1s           0.034254     1.000000
    7.1 Ag    1  3d0          1.494090     1.000000
    8.1 Ag    1  3d2+         1.494090     1.000000
    9.1 Ag    1  3d0          0.672936     1.000000
   10.1 Ag    1  3d2+         0.672936     1.000000
   11.1 Ag    1  3d0          0.303089     1.000000
   12.1 Ag    1  3d2+         0.303089     1.000000
   13.1 Ag    1  3d0          0.136511     1.000000
   14.1 Ag    1  3d2+         0.136511     1.000000
   15.1 Ag    1  3d0          0.054604     1.000000
   16.1 Ag    1  3d2+         0.054604     1.000000
   17.1 Ag    1  5g0          0.838980     1.000000
   18.1 Ag    1  5g4+         0.838980     1.000000
   19.1 Ag    1  5g2+         0.838980     1.000000
   20.1 Ag    1  5g0          0.389390     1.000000
   21.1 Ag    1  5g4+         0.389390     1.000000
   22.1 Ag    1  5g2+         0.389390     1.000000
   23.1 Ag    1  5g0          0.155756     1.000000
   24.1 Ag    1  5g4+         0.155756     1.000000
   25.1 Ag    1  5g2+         0.155756     1.000000
    1.2 B3u   1  2px         22.695464     0.000322
                             10.529662    -0.003120
                              4.885284     0.029849
                              2.266549    -0.127882
                              1.051576    -0.004461
                              0.487883     0.248666
                              0.226356     0.457083
                              0.105019     0.351483
                              0.048724     0.091636
    2.2 B3u   1  2px          0.876022     1.000000
    3.2 B3u   1  2px          0.372655     1.000000
    4.2 B3u   1  2px          0.158526     1.000000
    5.2 B3u   1  2px          0.067436     1.000000
    6.2 B3u   1  2px          0.026974     1.000000
    7.2 B3u   1  4f1+         0.809189     1.000000
    8.2 B3u   1  4f3+         0.809189     1.000000
    9.2 B3u   1  4f1+         0.407052     1.000000
   10.2 B3u   1  4f3+         0.407052     1.000000
   11.2 B3u   1  4f1+         0.204762     1.000000
   12.2 B3u   1  4f3+         0.204762     1.000000
   13.2 B3u   1  4f1+         0.081905     1.000000
   14.2 B3u   1  4f3+         0.081905     1.000000
   15.2 B3u   1  6h1+         0.703049     1.000000
   16.2 B3u   1  6h3+         0.703049     1.000000
   17.2 B3u   1  6h5+         0.703049     1.000000
   18.2 B3u   1  6h1+         0.281220     1.000000
   19.2 B3u   1  6h3+         0.281220     1.000000
   20.2 B3u   1  6h5+         0.281220     1.000000
    1.3 B2u   1  2py         22.695464     0.000322
                             10.529662    -0.003120
                              4.885284     0.029849
                              2.266549    -0.127882
                              1.051576    -0.004461
                              0.487883     0.248666
                              0.226356     0.457083
                              0.105019     0.351483
                              0.048724     0.091636
    2.3 B2u   1  2py          0.876022     1.000000
    3.3 B2u   1  2py          0.372655     1.000000
    4.3 B2u   1  2py          0.158526     1.000000
    5.3 B2u   1  2py          0.067436     1.000000
    6.3 B2u   1  2py          0.026974     1.000000
    7.3 B2u   1  4f1-         0.809189     1.000000
    8.3 B2u   1  4f3-         0.809189     1.000000
    9.3 B2u   1  4f1-         0.407052     1.000000
   10.3 B2u   1  4f3-         0.407052     1.000000
   11.3 B2u   1  4f1-         0.204762     1.000000
   12.3 B2u   1  4f3-         0.204762     1.000000
   13.3 B2u   1  4f1-         0.081905     1.000000
   14.3 B2u   1  4f3-         0.081905     1.000000
   15.3 B2u   1  6h1-         0.703049     1.000000
   16.3 B2u   1  6h3-         0.703049     1.000000
   17.3 B2u   1  6h5-         0.703049     1.000000
   18.3 B2u   1  6h1-         0.281220     1.000000
   19.3 B2u   1  6h3-         0.281220     1.000000
   20.3 B2u   1  6h5-         0.281220     1.000000
    1.4 B1g   1  3d2-         1.494090     1.000000
    2.4 B1g   1  3d2-         0.672936     1.000000
    3.4 B1g   1  3d2-         0.303089     1.000000
    4.4 B1g   1  3d2-         0.136511     1.000000
    5.4 B1g   1  3d2-         0.054604     1.000000
    6.4 B1g   1  5g2-         0.838980     1.000000
    7.4 B1g   1  5g4-         0.838980     1.000000
    8.4 B1g   1  5g2-         0.389390     1.000000
    9.4 B1g   1  5g4-         0.389390     1.000000
   10.4 B1g   1  5g2-         0.155756     1.000000
   11.4 B1g   1  5g4-         0.155756     1.000000
    1.5 B1u   1  2pz         22.695464     0.000322
                             10.529662    -0.003120
                              4.885284     0.029849
                              2.266549    -0.127882
                              1.051576    -0.004461
                              0.487883     0.248666
                              0.226356     0.457083
                              0.105019     0.351483
                              0.048724     0.091636
    2.5 B1u   1  2pz          0.876022     1.000000
    3.5 B1u   1  2pz          0.372655     1.000000
    4.5 B1u   1  2pz          0.158526     1.000000
    5.5 B1u   1  2pz          0.067436     1.000000
    6.5 B1u   1  2pz          0.026974     1.000000
    7.5 B1u   1  4f0          0.809189     1.000000
    8.5 B1u   1  4f2+         0.809189     1.000000
    9.5 B1u   1  4f0          0.407052     1.000000
   10.5 B1u   1  4f2+         0.407052     1.000000
   11.5 B1u   1  4f0          0.204762     1.000000
   12.5 B1u   1  4f2+         0.204762     1.000000
   13.5 B1u   1  4f0          0.081905     1.000000
   14.5 B1u   1  4f2+         0.081905     1.000000
   15.5 B1u   1  6h2+         0.703049     1.000000
   16.5 B1u   1  6h4+         0.703049     1.000000
   17.5 B1u   1  6h0          0.703049     1.000000
   18.5 B1u   1  6h2+         0.281220     1.000000
   19.5 B1u   1  6h4+         0.281220     1.000000
   20.5 B1u   1  6h0          0.281220     1.000000
    1.6 B2g   1  3d1+         1.494090     1.000000
    2.6 B2g   1  3d1+         0.672936     1.000000
    3.6 B2g   1  3d1+         0.303089     1.000000
    4.6 B2g   1  3d1+         0.136511     1.000000
    5.6 B2g   1  3d1+         0.054604     1.000000
    6.6 B2g   1  5g1+         0.838980     1.000000
    7.6 B2g   1  5g3+         0.838980     1.000000
    8.6 B2g   1  5g1+         0.389390     1.000000
    9.6 B2g   1  5g3+         0.389390     1.000000
   10.6 B2g   1  5g1+         0.155756     1.000000
   11.6 B2g   1  5g3+         0.155756     1.000000
    1.7 B3g   1  3d1-         1.494090     1.000000
    2.7 B3g   1  3d1-         0.672936     1.000000
    3.7 B3g   1  3d1-         0.303089     1.000000
    4.7 B3g   1  3d1-         0.136511     1.000000
    5.7 B3g   1  3d1-         0.054604     1.000000
    6.7 B3g   1  5g1-         0.838980     1.000000
    7.7 B3g   1  5g3-         0.838980     1.000000
    8.7 B3g   1  5g1-         0.389390     1.000000
    9.7 B3g   1  5g3-         0.389390     1.000000
   10.7 B3g   1  5g1-         0.155756     1.000000
   11.7 B3g   1  5g3-         0.155756     1.000000
    1.8 Au    1  4f2-         0.809189     1.000000
    2.8 Au    1  4f2-         0.407052     1.000000
    3.8 Au    1  4f2-         0.204762     1.000000
    4.8 Au    1  4f2-         0.081905     1.000000
    5.8 Au    1  6h4-         0.703049     1.000000
    6.8 Au    1  6h2-         0.703049     1.000000
    7.8 Au    1  6h4-         0.281220     1.000000
    8.8 Au    1  6h2-         0.281220     1.000000

 NUCLEAR CHARGE:                    5
 NUMBER OF PRIMITIVE AOS:         213
 NUMBER OF SYMMETRY AOS:          158
 NUMBER OF CONTRACTIONS:          126   (  25Ag  +  20B3u +  20B2u +  11B1g +  20B1u +  11B2g +  11B3g +   8Au  )
 NUMBER OF CORE ORBITALS:           0   (   0Ag  +   0B3u +   0B2u +   0B1g +   0B1u +   0B2g +   0B3g +   0Au  )
 NUMBER OF VALENCE ORBITALS:        4   (   1Ag  +   1B3u +   1B2u +   0B1g +   1B1u +   0B2g +   0B3g +   0Au  )


 NUCLEAR REPULSION ENERGY    0.00000000

 EXTRA SYMMETRY OF AOS IN SYMMETRY 1:   1 1 1 1 1 1 2 3 2 3   2 3 2 3 2 3 4 5 6 4   5 6 4 5 6
 EXTRA SYMMETRY OF AOS IN SYMMETRY 2:   1 1 1 1 1 1 2 3 2 3   2 3 2 3 4 5 6 4 5 6
 EXTRA SYMMETRY OF AOS IN SYMMETRY 3:   1 1 1 1 1 1 2 3 2 3   2 3 2 3 4 5 6 4 5 6
 EXTRA SYMMETRY OF AOS IN SYMMETRY 4:   1 1 1 1 1 2 3 2 3 2   3
 EXTRA SYMMETRY OF AOS IN SYMMETRY 5:   1 1 1 1 1 1 2 3 2 3   2 3 2 3 4 5 6 4 5 6
 EXTRA SYMMETRY OF AOS IN SYMMETRY 6:   1 1 1 1 1 2 3 2 3 2   3
 EXTRA SYMMETRY OF AOS IN SYMMETRY 7:   1 1 1 1 1 2 3 2 3 2   3
 EXTRA SYMMETRY OF AOS IN SYMMETRY 8:   1 1 1 1 2 3 2 3

 Eigenvalues of metric

         1 0.627E-03 0.627E-02 0.321E-01 0.321E-01 0.379E-01 0.164E+00 0.164E+00 0.197E+00
         2 0.147E-02 0.208E-01 0.532E-01 0.532E-01 0.117E+00 0.350E+00 0.350E+00 0.483E+00
         3 0.147E-02 0.208E-01 0.532E-01 0.532E-01 0.117E+00 0.350E+00 0.350E+00 0.483E+00
         4 0.321E-01 0.164E+00 0.197E+00 0.197E+00 0.565E+00 0.830E+00 0.830E+00 0.144E+01
         5 0.147E-02 0.208E-01 0.532E-01 0.532E-01 0.117E+00 0.350E+00 0.350E+00 0.483E+00
         6 0.321E-01 0.164E+00 0.197E+00 0.197E+00 0.565E+00 0.830E+00 0.830E+00 0.144E+01
         7 0.321E-01 0.164E+00 0.197E+00 0.197E+00 0.565E+00 0.830E+00 0.830E+00 0.144E+01
         8 0.532E-01 0.350E+00 0.483E+00 0.483E+00 0.108E+01 0.152E+01 0.152E+01 0.251E+01


 Contracted 2-electron integrals neglected if value below      1.0D-12
 AO integral compression algorithm  1   Integral accuracy      1.0D-12

     30.147 MB (compressed) written to integral file ( 54.2%)


 NUMBER OF SORTED TWO-ELECTRON INTEGRALS:    4156552.     BUFFER LENGTH:  32768
 NUMBER OF SEGMENTS:   1  SEGMENT LENGTH:    4156552      RECORD LENGTH: 524288

 Memory used in sort:       4.71 MW

 SORT1 READ     6989366. AND WROTE     2907704. INTEGRALS IN      9 RECORDS. CPU TIME:     0.16 SEC, REAL TIME:     0.23 SEC
 SORT2 READ     2907704. AND WROTE     4156552. INTEGRALS IN    115 RECORDS. CPU TIME:     0.16 SEC, REAL TIME:     0.32 SEC

 FILE SIZES:   FILE 1:    50.4 MBYTE,  FILE 4:    37.8 MBYTE,   TOTAL:     88.2 MBYTE

 OPERATOR DM      FOR CENTER  0  COORDINATES:    0.000000    0.000000    0.000000
 OPERATOR EKIN    FOR CENTER  0  COORDINATES:    0.000000    0.000000    0.000000
 OPERATOR POT     FOR CENTER  0  COORDINATES:    0.000000    0.000000    0.000000


 **********************************************************************************************************************************
 DATASETS  * FILE   NREC   LENGTH (MB)   RECORD NAMES
              1      20       38.45       500      610      700      900      950      970     1000      129      960     1100   
                                          VAR    BASINP    GEOM    SYMINP    ZMAT    AOBASIS   BASIS     P2S    ABASIS      S 
                                         1400     1410     1420     1200     1210     1080     1600     1650     1300     1700   
                                         EKIN       V       ECP      H0       H01     AOSYM     SMH    MOLCAS    ERIS     OPER   

 PROGRAMS   *        TOTAL       INT
 CPU TIMES  *         3.01      2.92
 REAL TIME  *        12.69 SEC
 DISK USED  *        88.49 MB      
 **********************************************************************************************************************************


 PROGRAM * RHF-SCF (OPEN SHELL)       Authors: W. Meyer, H.-J. Werner


 NUMBER OF ELECTRONS:       4+    1-    SPACE SYMMETRY=8    SPIN SYMMETRY: Quartet 
 CONVERGENCE THRESHOLDS:    1.00E-05 (Density)    1.00E-07 (Energy)
 MAX. NUMBER OF ITERATIONS:       60
 INTERPOLATION TYPE:            DIIS
 INTERPOLATION STEPS:              2 (START)      1 (STEP)
 LEVEL SHIFTS:                 -0.60 (CLOSED) -0.30 (OPEN) 

 Number of closed-shell orbitals:    1 (   1   0   0   0   0   0   0   0 )
 Number of open-shell orbitals:      3 (   0   1   1   0   1   0   0   0 )



   Atom=AS basis=ECP28MDF_GUESS    lmin=0  lmax=1

 Orbital guess generated from atomic densities. Full valence occupancy:    1   1   1   0   1   0   0   0


 Molecular orbital dump at record        2100.2

 ITERATION    DDIFF          GRAD             ENERGY        2-EL.EN.            DIPOLE MOMENTS         DIIS   ORB.
    1      0.000D+00      0.000D+00        -6.05202054      6.785697    0.00000    0.00000    0.00000    0    start
    2      0.000D+00      0.487D-02        -6.06250337      6.963375    0.00000    0.00000    0.00000    1    diag,B
    3      0.585D-02      0.212D-02        -6.06543678      7.063012    0.00000    0.00000    0.00000    2    diag,B
    4      0.326D-02      0.862D-03        -6.06586562      7.092804    0.00000    0.00000    0.00000    3    diag,B
    5      0.198D-02      0.179D-03        -6.06587712      7.092824    0.00000    0.00000    0.00000    4    diag,B
    6      0.377D-03      0.432D-04        -6.06587776      7.092996    0.00000    0.00000    0.00000    5    diag,B
    7      0.202D-03      0.875D-05        -6.06587778      7.092871    0.00000    0.00000    0.00000    6    fixocc
    8      0.708D-04      0.145D-05        -6.06587778      7.092871    0.00000    0.00000    0.00000    7    diag,B
    9      0.516D-05      0.353D-06        -6.06587778      7.092869    0.00000    0.00000    0.00000    0    orth

 Final alpha occupancy:   1   1   1   0   1   0   0   0
 Final beta  occupancy:   1   0   0   0   0   0   0   0

 !RHF STATE 1.8 Energy                 -6.065877776197
 Nuclear energy                         0.00000000
 One-electron energy                   -9.61231212
 Two-electron energy                    3.54643435
 Virial quotient                       -2.63826120
 !RHF STATE 1.8 Dipole moment           0.00000000     0.00000000     0.00000000
 Dipole moment /Debye                   0.00000000     0.00000000     0.00000000
 

 !RHF expec          <1.8|EKIN|1.8>     2.299195310388
 
 !RHF expec           <1.8|POT|1.8>    -2.512313527792

 ELECTRON ORBITALS
 =================


   Orb  Occ    Energy  Couls-En    Coefficients

                                   1 1s      1 1s      1 1s      1 1s      1 1s      1 1s      1 3d0     1 3d2+    1 3d0     1 3d2+ 
                                   1 3d0     1 3d2+    1 3d0     1 3d2+    1 3d0     1 3d2+    1 5g0     1 5g4+    1 5g2+    1 5g0  
                                   1 5g4+    1 5g2+    1 5g0     1 5g4+    1 5g2+ 

   1.1   2    -0.7039   -2.9217  0.999094 -0.001431  0.001805  0.002738 -0.004624  0.002748 -0.000000 -0.000000  0.000000  0.000000
                                -0.000000 -0.000000  0.000000  0.000000 -0.000000  0.000000 -0.000000 -0.000000  0.000000  0.000000
                                 0.000000 -0.000000 -0.000000 -0.000000  0.000000

                                   1 2px     1 2px     1 2px     1 2px     1 2px     1 2px     1 4f1+    1 4f3+    1 4f1+    1 4f3+ 
                                   1 4f1+    1 4f3+    1 4f1+    1 4f3+    1 6h1+    1 6h3+    1 6h5+    1 6h1+    1 6h3+    1 6h5+ 


   1.2   +    -0.3705   -2.0961  0.999775 -0.000055  0.000112  0.000308 -0.000490  0.000536  0.000000 -0.000000 -0.000000  0.000000
                                 0.000000 -0.000000 -0.000000  0.000000 -0.000000 -0.000000  0.000000  0.000000 -0.000000 -0.000000

                                   1 2py     1 2py     1 2py     1 2py     1 2py     1 2py     1 4f1-    1 4f3-    1 4f1-    1 4f3- 
                                   1 4f1-    1 4f3-    1 4f1-    1 4f3-    1 6h1-    1 6h3-    1 6h5-    1 6h1-    1 6h3-    1 6h5- 


   1.3   +    -0.3705   -2.0961  0.999775 -0.000055  0.000112  0.000308 -0.000490  0.000536  0.000000  0.000000 -0.000000 -0.000000
                                 0.000000  0.000000 -0.000000 -0.000000 -0.000000 -0.000000  0.000000  0.000000 -0.000000  0.000000

                                   1 2pz     1 2pz     1 2pz     1 2pz     1 2pz     1 2pz     1 4f0     1 4f2+    1 4f0     1 4f2+ 
                                   1 4f0     1 4f2+    1 4f0     1 4f2+    1 6h2+    1 6h4+    1 6h0     1 6h2+    1 6h4+    1 6h0  


   1.5   +    -0.3705   -2.0961  0.999775 -0.000055  0.000112  0.000308 -0.000490  0.000536  0.000000  0.000000 -0.000000 -0.000000
                                 0.000000  0.000000 -0.000000  0.000000 -0.000000  0.000000 -0.000000  0.000000  0.000000  0.000000

 HOMO      1.2    -0.370550 =     -10.0832eV
 LUMO      2.1     0.055630 =       1.5138eV
 LUMO-HOMO         0.426180 =      11.5969eV


 **********************************************************************************************************************************
 DATASETS  * FILE   NREC   LENGTH (MB)   RECORD NAMES
              1      20       38.45       500      610      700      900      950      970     1000      129      960     1100   
                                          VAR    BASINP    GEOM    SYMINP    ZMAT    AOBASIS   BASIS     P2S    ABASIS      S 
                                         1400     1410     1420     1200     1210     1080     1600     1650     1300     1700   
                                         EKIN       V       ECP      H0       H01     AOSYM     SMH    MOLCAS    ERIS     OPER   

              2       4        2.83       700     1000      520     2100   
                                         GEOM     BASIS   MCVARS     RHF  

 PROGRAMS   *        TOTAL        HF       INT
 CPU TIMES  *         3.17      0.16      2.92
 REAL TIME  *        13.22 SEC
 DISK USED  *        88.49 MB      
 **********************************************************************************************************************************
 SETTING SCF(I)         =        -6.06587778  AU                              
 SETTING _CC_NORM_MAX   =         2.00000000                                  


 PROGRAM * UHF-SCF       Authors: W. Meyer, H.-J. Werner


 NUMBER OF ELECTRONS:       4+    1-    SPACE SYMMETRY=8    SPIN SYMMETRY: Quartet 
 CONVERGENCE THRESHOLDS:    1.00E-05 (Density)    1.00E-07 (Energy)
 MAX. NUMBER OF ITERATIONS:        0
 INTERPOLATION TYPE:            DIIS
 INTERPOLATION STEPS:              2 (START)      1 (STEP)
 LEVEL SHIFTS:                  0.20 (ALPHA)   0.20 (BETA) 

 Number of closed-shell orbitals:    1 (   1   0   0   0   0   0   0   0 )
 Number of open-shell orbitals:      3 (   0   1   1   0   1   0   0   0 )


 Molecular orbitals read from record     2100.2  Type=RHF/CANONICAL (state 1.8)

 Molecular orbital dump at record        2200.2

 Initial alpha occupation   1   1   1   0   1   0   0   0
 Initial beta  occupation   1   0   0   0   0   0   0   0

 ITERATION    DDIFF          GRAD             ENERGY        2-EL.EN.            DIPOLE MOMENTS         DIIS
    1      0.000D+00      0.000D+00        -6.06587778      7.092869    0.00000    0.00000    0.00000    0
 
 Final alpha occupancy:   1   1   1   0   1   0   0   0
 Final beta  occupancy:   1   0   0   0   0   0   0   0

 !UHF STATE 1.8 Energy                 -6.065877776197
 Nuclear energy                         0.00000000
 One-electron energy                   -9.61231212
 Two-electron energy                    3.54643435
 Virial quotient                       -2.63826120
 !UHF STATE 1.8 Dipole moment           0.00000000     0.00000000     0.00000000
 Dipole moment /Debye                   0.00000000     0.00000000     0.00000000
 

 !UHF expec          <1.8|EKIN|1.8>     2.299195310388
 
 !UHF expec           <1.8|POT|1.8>    -2.512313527792

 ELECTRON ORBITALS FOR POSITIVE SPIN
 ===================================


   Orb  Occ    Energy  Couls-En    Coefficients

                                   1 1s      1 1s      1 1s      1 1s      1 1s      1 1s      1 3d0     1 3d2+    1 3d0     1 3d2+ 
                                   1 3d0     1 3d2+    1 3d0     1 3d2+    1 3d0     1 3d2+    1 5g0     1 5g4+    1 5g2+    1 5g0  
                                   1 5g4+    1 5g2+    1 5g0     1 5g4+    1 5g2+ 

   1.1   +    -0.7039   -2.9217  0.999094 -0.001431  0.001805  0.002738 -0.004624  0.002748 -0.000000 -0.000000  0.000000  0.000000
                                -0.000000 -0.000000  0.000000  0.000000 -0.000000  0.000000 -0.000000 -0.000000  0.000000  0.000000
                                 0.000000 -0.000000 -0.000000 -0.000000  0.000000

                                   1 2px     1 2px     1 2px     1 2px     1 2px     1 2px     1 4f1+    1 4f3+    1 4f1+    1 4f3+ 
                                   1 4f1+    1 4f3+    1 4f1+    1 4f3+    1 6h1+    1 6h3+    1 6h5+    1 6h1+    1 6h3+    1 6h5+ 


   1.2   +    -0.3705   -2.0961  0.999775 -0.000055  0.000112  0.000308 -0.000490  0.000536  0.000000 -0.000000 -0.000000  0.000000
                                 0.000000 -0.000000 -0.000000  0.000000 -0.000000 -0.000000  0.000000  0.000000 -0.000000 -0.000000

                                   1 2py     1 2py     1 2py     1 2py     1 2py     1 2py     1 4f1-    1 4f3-    1 4f1-    1 4f3- 
                                   1 4f1-    1 4f3-    1 4f1-    1 4f3-    1 6h1-    1 6h3-    1 6h5-    1 6h1-    1 6h3-    1 6h5- 


   1.3   +    -0.3705   -2.0961  0.999775 -0.000055  0.000112  0.000308 -0.000490  0.000536  0.000000  0.000000 -0.000000 -0.000000
                                 0.000000  0.000000 -0.000000 -0.000000 -0.000000 -0.000000  0.000000  0.000000 -0.000000  0.000000

                                   1 2pz     1 2pz     1 2pz     1 2pz     1 2pz     1 2pz     1 4f0     1 4f2+    1 4f0     1 4f2+ 
                                   1 4f0     1 4f2+    1 4f0     1 4f2+    1 6h2+    1 6h4+    1 6h0     1 6h2+    1 6h4+    1 6h0  


   1.5   +    -0.3705   -2.0961  0.999775 -0.000055  0.000112  0.000308 -0.000490  0.000536  0.000000  0.000000 -0.000000 -0.000000
                                 0.000000  0.000000 -0.000000  0.000000 -0.000000  0.000000 -0.000000  0.000000  0.000000  0.000000

 ELECTRON ORBITALS FOR NEGATIVE SPIN
 ===================================


   Orb  Occ    Energy  Couls-En    Coefficients

                                   1 1s      1 1s      1 1s      1 1s      1 1s      1 1s      1 3d0     1 3d2+    1 3d0     1 3d2+ 
                                   1 3d0     1 3d2+    1 3d0     1 3d2+    1 3d0     1 3d2+    1 5g0     1 5g4+    1 5g2+    1 5g0  
                                   1 5g4+    1 5g2+    1 5g0     1 5g4+    1 5g2+ 

   1.1   -    -0.7039   -2.9217  0.999094 -0.001431  0.001805  0.002738 -0.004624  0.002748 -0.000000 -0.000000  0.000000  0.000000
                                -0.000000 -0.000000  0.000000  0.000000 -0.000000  0.000000 -0.000000 -0.000000  0.000000  0.000000
                                 0.000000 -0.000000 -0.000000 -0.000000  0.000000

 HOMO      1.2    -0.370550 =     -10.0832eV
 LUMO     -1.2    -0.370550 =     -10.0832eV
 LUMO-HOMO         0.000000 =       0.0000eV

 EXPECTATION VALUE OF S**2:             3.75000000

 Occupation number threshold for canonical orbitals:  1.999000 (occupied),  0.001000 (virtual)

 Number of pseudo-canonical orbitals per symmetry:    1   0   0   0   0   0   0   0
 Number of active natural orbitals per symmetry:      0   1   1   0   1   0   0   0

 NATURAL CHARGE ORBITALS
 =======================


   Orb     Occ        Energy       Coefficients

                                   1 1s      1 1s      1 1s      1 1s      1 1s      1 1s      1 3d0     1 3d2+    1 3d0     1 3d2+ 
                                   1 3d0     1 3d2+    1 3d0     1 3d2+    1 3d0     1 3d2+    1 5g0     1 5g4+    1 5g2+    1 5g0  
                                   1 5g4+    1 5g2+    1 5g0     1 5g4+    1 5g2+ 

   1.1  2.00000    -0.703896     0.999094 -0.001431  0.001805  0.002738 -0.004624  0.002748 -0.000000 -0.000000  0.000000  0.000000
                                -0.000000 -0.000000  0.000000  0.000000 -0.000000  0.000000 -0.000000 -0.000000  0.000000  0.000000
                                 0.000000 -0.000000 -0.000000 -0.000000  0.000000

                                   1 2px     1 2px     1 2px     1 2px     1 2px     1 2px     1 4f1+    1 4f3+    1 4f1+    1 4f3+ 
                                   1 4f1+    1 4f3+    1 4f1+    1 4f3+    1 6h1+    1 6h3+    1 6h5+    1 6h1+    1 6h3+    1 6h5+ 


   1.2  1.00000    -0.150697     0.999775 -0.000055  0.000112  0.000308 -0.000490  0.000536  0.000000 -0.000000 -0.000000  0.000000
                                 0.000000 -0.000000 -0.000000  0.000000 -0.000000 -0.000000  0.000000  0.000000 -0.000000 -0.000000

                                   1 2py     1 2py     1 2py     1 2py     1 2py     1 2py     1 4f1-    1 4f3-    1 4f1-    1 4f3- 
                                   1 4f1-    1 4f3-    1 4f1-    1 4f3-    1 6h1-    1 6h3-    1 6h5-    1 6h1-    1 6h3-    1 6h5- 


   1.3  1.00000    -0.150697     0.999775 -0.000055  0.000112  0.000308 -0.000490  0.000536  0.000000  0.000000 -0.000000 -0.000000
                                 0.000000  0.000000 -0.000000 -0.000000 -0.000000 -0.000000  0.000000  0.000000 -0.000000  0.000000

                                   1 2pz     1 2pz     1 2pz     1 2pz     1 2pz     1 2pz     1 4f0     1 4f2+    1 4f0     1 4f2+ 
                                   1 4f0     1 4f2+    1 4f0     1 4f2+    1 6h2+    1 6h4+    1 6h0     1 6h2+    1 6h4+    1 6h0  


   1.5  1.00000    -0.150697     0.999775 -0.000055  0.000112  0.000308 -0.000490  0.000536  0.000000  0.000000 -0.000000 -0.000000
                                 0.000000  0.000000 -0.000000  0.000000 -0.000000  0.000000 -0.000000  0.000000  0.000000  0.000000

 Natural orbitals saved to record    2200.2 (Orbital set 3)

 Orbital spaces for UNO-CAS (Min. occupation: 0.020  Max. occupation: 1.980):

 Closed:        1   0   0   0   0   0   0   0
 Active:        0   1   1   0   1   0   0   0

 No convergence



 **********************************************************************************************************************************
 DATASETS  * FILE   NREC   LENGTH (MB)   RECORD NAMES
              1      20       38.45       500      610      700      900      950      970     1000      129      960     1100   
                                          VAR    BASINP    GEOM    SYMINP    ZMAT    AOBASIS   BASIS     P2S    ABASIS      S 
                                         1400     1410     1420     1200     1210     1080     1600     1650     1300     1700   
                                         EKIN       V       ECP      H0       H01     AOSYM     SMH    MOLCAS    ERIS     OPER   

              2       5        5.45       700     1000      520     2100     2200   
                                         GEOM     BASIS   MCVARS     RHF      UHF  

 PROGRAMS   *        TOTAL       UHF        HF       INT
 CPU TIMES  *         3.19      0.02      0.16      2.92
 REAL TIME  *        13.41 SEC
 DISK USED  *        88.49 MB      
 **********************************************************************************************************************************
 SETTING SCF(I)         =        -6.06587778  AU                              


 PROGRAM * MRCC (General Multireference Coupled Cluster)    Author: M. Kallay, 2000-2005

 ***  Initialisation ***

   0 Spin projections
 
 Molecular orbitals read from record     2200.2  Type=UHF/ALPHA (state 1.8)

 ?Warning: UHF not converged
 Molecular orbitals read from record     2200.2  Type=UHF/BETA (state 1.8)

 ?Warning: UHF not converged
 
 Frozen orbitals:              0 (  0  0  0  0  0  0  0  0)
 Active orbitals:            126 ( 25 20 20 11 20 11 11  8)
 Active electrons:             5
 Spin quantum number:          1.5

 Transformed integrals will be written to file mrccdir/mrcc_41516/fort.55

 Load integrals                3.2 sec
 Transform integrals           5.5 sec
 Storage for integrals:       24278327
 Remaining memory:           *********

 Core energy:               0.00000000
 
 MRCC Input:
     4     0     0     0     3     0     0     8     0     0     0     1     1     0     0     7     0     0   0.000     0   64000
  ex.lev,nsing,ntrip, rest,method,dens,conver,symm, diag, CS ,spatial, HF, ndoub,nacto,nactv, tol, maxex, sacc, freq,  dboc,   mem
  2  0  0  0  0  0  0  0  0  0  0  0  0  0  0  0  0  0  0  0  0  0  0  0  0  1  0  0  0  0  0  0  0  0  0  0  0  0  0  0  0  0  0  0  0  1  0  0  0  0  0  0  0  0  0  0  0  0  0  0  0  0  0  0  0  0  0  0  0  0  0  0  0  0  0  0  1  0  0  0  0  0  0  0  0  0  0  0  0  0  0  0  0  0  0  0  0  0  0  0  0  0  0  0  0  0  0  0  0  0  0  0  0  0  0  0  0  0  0  0  0  0  0  0  0  0
 MRCC Input end
 Variable memory released
 MRCC now being run, temporary output in /global/cscratch1/sd/aannabe/mrccdir/mrcc_41516/mrcc.out
 **********************************************************************
                          MRCC program system
 **********************************************************************

                              Written by
  Mihaly Kallay, Zoltan Rolik, Jozsef Csontos, Peter Nagy, Gyula Samu,
      David Mester, Jozsef Csoka, Bernat Szabo, Istvan Ladjanszki,
       Lorant Szegedy, Bence Ladoczki, Klara Petrov, Mate Farkas,
                    Pal D. Mezei, and Bence Hegely

        Department of Physical Chemistry and Materials Science
            Budapest University of Technology and Economics
                  Budapest P.O.Box 91, H-1521 Hungary

                              www.mrcc.hu

                       Release date: May 23, 2018

 ************************ 2019-06-25 12:19:23 *************************
 Executing goldstone...

 Generation of CC equations in terms of H and T...
 Generation of antisymmetrized Goldstone diagrams...
 Number of diagrams in T^1 equations:    15
 Number of diagrams in T^2 equations:    38
 Number of diagrams in T^3 equations:    49
 Number of diagrams in T^4 equations:     5
 Translation of diagrams to factorized equations...
 Optimizing intermediate calculation...
 Number of floating-point operations per iteration step:   2.2471E+11
 Probable CPU time per iteration step (hours):      2.25
 Required memory (Mbytes):   30320.9
 Number of intermediates:                                  80
 Number of intermediates to be stored:                     32
 Length of intermediate file (Mbytes):     497.7

 ************************ 2019-06-25 12:19:23 *************************
 Executing xmrcc...

 **********************************************************************
 CC(3)(4) calculation


 Allocation of****** Mbytes of memory...
 Number of spinorbitals:                   252
 Number of alpha electrons:                        4
 Number of beta electrons:                         1
 Spin multiplicity:                     2
 z-component of spin:  1.5
 Spatial symmetry:                      8
 Convergence criterion:  1.0E-07
 Construction of occupation graphs...
 Number of                     0 -fold excitations:                      1
 Number of                     1 -fold excitations:                    105
 Number of                     2 -fold excitations:                  13633
 Number of                     3 -fold excitations:                 839097
 Total number of configurations:                 852836
 Calculation of coupling coefficients...
 Length of intermediate file (Mbytes):     375.6

 ======================================================================

 Spin case  1   Alpha:  3   Beta:  1
 Number of excitations:               18435500
 Spin case  2   Alpha:  4   Beta:  0
 Number of excitations:                1099202
 Number of                     4 -fold excitations:               19534702

 Memory requirements /Mbyte/:
               Minimal        Optimal
 Real*8:        788.5721      1923.2150
 Integer:        78.3539
 Total:         866.9260      2001.5690


 ************************ 2019-06-25 12:19:34 *************************
 Executing mrcc...

 **********************************************************************
 CCSDT(Q) calculation


 Allocation of 1923.2 Mbytes of memory...
 Number of spinorbitals: 252
 Number of alpha electrons:  4
 Number of beta  electrons:  1
 Spin multiplicity: 2
 z-component of spin:  1.5
 Spatial symmetry: 8
 Convergence criterion:  1.0E-07
 Construction of occupation graphs...
 Number of 0-fold excitations: 1
 Number of 1-fold excitations: 105
 Number of 2-fold excitations: 13633
 Number of 3-fold excitations: 839097
 Total number of determinants: 852836
 Calculation of coupling coefficients...
 Initial cluster amplitudes are generated.
 Length of intermediate file (Mbytes):     375.6
 Reading integral list from unit 55...
 Sorting integrals...
 Sorting integrals...
 Sorting integrals...
 Sorting integrals...
 Energy of reference determinant [au]:      -6.065877776197
 Calculation of MP denominators...

 Starting CC iteration...
 ======================================================================
 Norm of residual vector:     0.48542751
 CPU time [min]:     1.169                   Wall time [min]:     1.178

 Iteration  1  CC energy:    -6.15170536  Energy decrease:   0.08582759
 ======================================================================
 Norm of residual vector:     0.13489835
 CPU time [min]:     1.665                   Wall time [min]:     1.686

 Iteration  2  CC energy:    -6.15851457  Energy decrease:   0.00680920
 ======================================================================
 Norm of residual vector:     0.03478266
 CPU time [min]:     2.173                   Wall time [min]:     2.206

 Iteration  3  CC energy:    -6.16443292  Energy decrease:   0.00591835
 ======================================================================
 Norm of residual vector:     0.00732605
 CPU time [min]:     2.678                   Wall time [min]:     2.716

 Iteration  4  CC energy:    -6.16447431  Energy decrease:   0.00004140
 ======================================================================
 Norm of residual vector:     0.00175871
 CPU time [min]:     3.185                   Wall time [min]:     3.229

 Iteration  5  CC energy:    -6.16450346  Energy decrease:   0.00002915
 ======================================================================
 Norm of residual vector:     0.00045856
 CPU time [min]:     3.694                   Wall time [min]:     3.743

 Iteration  6  CC energy:    -6.16451119  Energy decrease:   0.00000773
 ======================================================================
 Norm of residual vector:     0.00012242
 CPU time [min]:     4.202                   Wall time [min]:     4.260

 Iteration  7  CC energy:    -6.16450709  Energy decrease:   0.00000410
 ======================================================================
 Norm of residual vector:     0.00003172
 CPU time [min]:     4.711                   Wall time [min]:     4.778

 Iteration  8  CC energy:    -6.16450700  Energy decrease:   0.00000009
 ======================================================================
 Norm of residual vector:     0.00000939
 CPU time [min]:     5.223                   Wall time [min]:     5.297

 Iteration  9  CC energy:    -6.16450741  Energy decrease:   0.00000041
 ======================================================================
 Norm of residual vector:     0.00000279
 CPU time [min]:     5.737                   Wall time [min]:     5.817

 Iteration 10  CC energy:    -6.16450733  Energy decrease:   0.00000008
 ======================================================================
 Norm of residual vector:     0.00000095
 CPU time [min]:     6.248                   Wall time [min]:     6.336

 Iteration 11  CC energy:    -6.16450730  Energy decrease:   0.00000002
 ======================================================================
 Norm of residual vector:     0.00000031
 CPU time [min]:     6.762                   Wall time [min]:     6.857

 Iteration 12  CC energy:    -6.16450732  Energy decrease:   0.00000001
 ======================================================================
 Norm of residual vector:     0.00000007
 CPU time [min]:     7.261                   Wall time [min]:     7.363

 Iteration 13  CC energy:    -6.16450731  Energy decrease:   4.2332E-10
 ======================================================================

 Iteration has converged in 13 steps.

 Final results:
 Total CCSDT energy [au]:             -6.164507314887
 Total MP2 energy [au]:               -6.151705364281

 Perturbative corrections are calculated...
 ======================================================================
 Spin case  1   Alpha:  3   Beta:  1
 Number of excitations:        18435500
 CPU time [min]:    61.433                   Wall time [min]:    61.537
 ======================================================================
 Spin case  2   Alpha:  4   Beta:  0
 Number of excitations:        1099202
 CPU time [min]:    70.054                   Wall time [min]:    70.158
 ======================================================================
 Number of 4-fold excitations: 19534702
 CPU time [min]:    70.054                   Wall time [min]:    70.158

 Total CCSDT[Q] energy [au]:          -6.164528840648
 Total CCSDT(Q) energy [au]:          -6.164618562063

 ************************ 2019-06-25 13:29:47 *************************
                      Normal termination of mrcc.
 **********************************************************************
 !CCSDT STATE 1.8 Energy               -6.164507314887
 !MP2 STATE 1.8 Energy                 -6.151705364281
 !CCSDT[Q] STATE 1.8 Energy            -6.164528840648
 !CCSDT(Q) STATE 1.8 Energy            -6.164618562063
 
 CPU-time for MRCC:           4203.2 sec
 Elapsed-time for MRCC:       4225.8 sec

 Variable memory set to 8000000000 words,  buffer space   230000 words



 **********************************************************************************************************************************
 DATASETS  * FILE   NREC   LENGTH (MB)   RECORD NAMES
              1      20       38.45       500      610      700      900      950      970     1000      129      960     1100   
                                          VAR    BASINP    GEOM    SYMINP    ZMAT    AOBASIS   BASIS     P2S    ABASIS      S 
                                         1400     1410     1420     1200     1210     1080     1600     1650     1300     1700   
                                         EKIN       V       ECP      H0       H01     AOSYM     SMH    MOLCAS    ERIS     OPER   

              2       5        5.45       700     1000      520     2100     2200   
                                         GEOM     BASIS   MCVARS     RHF      UHF  

 PROGRAMS   *        TOTAL      MRCC       UHF        HF       INT
 CPU TIMES  *      4260.23   4257.03      0.02      0.16      2.92
 REAL TIME  *      4526.94 SEC
 DISK USED  *        88.49 MB      
 **********************************************************************************************************************************
 SETTING POSTHF(I)      =        -6.16461856  AU                              
                                                                                                                                                                                                                                                                

       SCF           POSTHF       EKIN          POT
    -6.06587778   -6.16461856   2.29919531   -2.51231353
                                                  

 CCSDT(Q)/USERDEF energy=     -6.164618562063

        CCSDT(Q)        HF-SCF  
     -6.16461856     -6.06587778
 **********************************************************************************************************************************
 Molpro calculation terminated
 Variable memory released
