
 Primary working directories    : /global/cscratch1/sd/aannabe
 Secondary working directories  : /global/cscratch1/sd/aannabe
 Wavefunction directory         : /global/homes/a/aannabe/wfu/
 Main file repository           : /global/cscratch1/sd/aannabe/

 SHA1      : 2873118e99aab1bc19f5b6fc1784693c06d15c95
 NAME      : 2015.1.8
 ARCHNAME  : linux/x86_64
 FC        : /opt/cray/pe/craype/2.5.5/bin/ftn
 BLASLIB   : -Wl,-_start-group /opt/intel/compilers_and_libraries_2016.3.210/linux/mkl/lib/intel64/libmkl_intel_ilp64.a /opt/intel/compilers_and_libraries_2016.3.210/linux/mkl/lib/intel64/libmkl_intel_thread.a /opt/intel/compilers_and_libraries_2016.3.210/linux/mkl/lib/intel64/libmkl_core.a -Wl,-_end-group
 id        : lbl

 Nodes     nprocs
 nid01788     1

 Using customized tuning parameters: mindgm=8; mindgv=16; mindgc=4; mindgr=1; noblas=0; minvec=7
 default implementation of scratch files=df  

 ***,Si
 memory,512,m
 gthresh,twoint=1.e-12
 
 gprint,basis,orbitals
 gexpec,ekin,pot
 
 angstrom
 geometry={
 1                                                                               ! Number of atoms
 Si 0.0 0.0 0.0
 }
 
 basis={
 Including file /global/homes/a/aannabe/docs/accurate/ccECP_Kh/pps/Si.pp
 Including file /global/homes/a/aannabe/docs/accurate/ccECP_Kh/basis/aug-cc-pVnZ/Si_tz.basis
 }
 
 {rhf
  start,atden
  wf,4,6,2
  occ,1,1,0,0,1,0,0,0
  open,1.2,1.5
  save,4202.2
 }
 {multi
  start,4202.2
  occ,1,1,1,0,1,0,0
  closed,1,0,0,0,0,0,0,0
  wf,4,4,2;state,1
  wf,4,6,2;state,1
  wf,4,7,2;state,1
  natorb,ci,print
  orbital,5202.2
 }
 {rhf,nitord=1,maxit=0
  start,5202.2
  wf,4,6,2
  occ,1,1,0,0,1,0,0,0
  open,1.2,1.5
 }
 
 scf(i)=energy
 
 _CC_NORM_MAX=2.0
 {ci
 maxit,100
 core
 }
 posthf(i)=energy
 
 table,scf,posthf,ekin,pot
 save,3.csv,new
 
 

 Variables initialized (889), CPU time= 0.01 sec
 Commands  initialized (702), CPU time= 0.01 sec, 572 directives.
 Default parameters read. Elapsed time= 0.15 sec

 Checking input...
 Passed
1


                                         ***  PROGRAM SYSTEM MOLPRO  ***
                                       Copyright, TTI GmbH Stuttgart, 2015
                                    Version 2015.1 linked Sep  7 2016 23:09:38


 **********************************************************************************************************************************
 LABEL *   Si                                                                            
  64 bit serial version                                                                  DATE: 30-Oct-18          TIME: 18:29:43  
 **********************************************************************************************************************************

 SHA1:             2873118e99aab1bc19f5b6fc1784693c06d15c95
 **********************************************************************************************************************************

 THRESHOLDS:

 ZERO    =  1.00D-12  ONEINT  =  1.00D-12  TWOINT  =  1.00D-12  PREFAC  =  1.00D-14  LOCALI  =  1.00D-09  EORDER  =  1.00D-04
 ENERGY  =  0.00D+00  ETEST   =  0.00D+00  EDENS   =  0.00D+00  THRDEDEF=  1.00D-06  GRADIENT=  1.00D-02  STEP    =  1.00D-03
 ORBITAL =  1.00D-05  CIVEC   =  1.00D-05  COEFF   =  1.00D-04  PRINTCI =  5.00D-02  PUNCHCI =  9.90D+01  OPTGRAD =  3.00D-04
 OPTENERG=  1.00D-06  OPTSTEP =  3.00D-04  THRGRAD =  1.00D-10  COMPRESS=  1.00D-11  VARMIN  =  1.00D-07  VARMAX  =  1.00D-03
 THRDOUB =  0.00D+00  THRDIV  =  1.00D-05  THRRED  =  1.00D-07  THRPSP  =  1.00D+00  THRDC   =  1.00D-10  THRCS   =  1.00D-10
 THRNRM  =  1.00D-08  THREQ   =  0.00D+00  THRDE   =  1.00D+00  THRREF  =  1.00D-05  SPARFAC =  1.00D+00  THRDLP  =  1.00D-07
 THRDIA  =  1.00D-10  THRDLS  =  1.00D-07  THRGPS  =  0.00D+00  THRKEX  =  0.00D+00  THRDIS  =  2.00D-01  THRVAR  =  1.00D-10
 THRLOC  =  1.00D-06  THRGAP  =  1.00D-06  THRLOCT = -1.00D+00  THRGAPT = -1.00D+00  THRORB  =  1.00D-06  THRMLTP =  0.00D+00
 THRCPQCI=  1.00D-10  KEXTA   =  0.00D+00  THRCOARS=  0.00D+00  SYMTOL  =  1.00D-06  GRADTOL =  1.00D-06  THROVL  =  1.00D-08
 THRORTH =  1.00D-08  GRID    =  1.00D-06  GRIDMAX =  1.00D-03  DTMAX   =  0.00D+00  THROCCDE=  1.00D-01  THROCCDE=  1.00D-01



 ZUNIT=ANG
 

Geometry recognized as XYZ


 Variable memory set to  512000000 words,  buffer space   230000 words

 SETTING BASIS          =    USERDEF


 Recomputing integrals since basis changed


 Using spherical harmonics



 PROGRAM * SEWARD (Integral evaluation for generally contracted gaussian basis sets)     Author: Roland Lindh, 1990

 Geometry written to block  1 of record 700

 Orientation using atomic masses  
 Molecule type: Atom
 Symmetry elements: X,Y,Z
 Rotational constants:       0.0000000      0.0000000      0.0000000 GHz  (calculated with average atomic masses)

 Point group  D2h 



 ATOMIC COORDINATES

 NR  ATOM    CHARGE       X              Y              Z

   1  SI      4.00    0.000000000    0.000000000    0.000000000


          SI  CORE POTENTIAL

          d POTENTIAL

 POWERS             1              3              2
 EXPONENTIALS   5.168316       8.861690       3.933474    
 COEFFICIENTS   4.000000       20.67326      -14.81817    

          s - d POTENTIAL

 POWERS             2              2
 EXPONENTIALS   9.447023       2.553812    
 COEFFICIENTS   14.83276       26.34966    

          p - d POTENTIAL

 POWERS             2              2
 EXPONENTIALS   3.660001       1.903653    
 COEFFICIENTS   7.621400       10.33158    


 BASIS DATA

   Nr Sym  Nuc  Type         Exponents   Contraction coefficients

    1.1 Ag    1  1s           9.998274     0.002894
                              5.517644    -0.014523
                              3.044965     0.077634
                              1.680393    -0.224022
                              0.927341    -0.149080
                              0.511762     0.085944
                              0.282421     0.355394
                              0.155857     0.445219
                              0.086011     0.267230
                              0.047466     0.060787
    2.1 Ag    1  1s           0.528701     1.000000
    3.1 Ag    1  1s           0.090848     1.000000
    4.1 Ag    1  1s           0.050501     1.000000
    5.1 Ag    1  3d0          0.524220     1.000000
    6.1 Ag    1  3d2+         0.524220     1.000000
    7.1 Ag    1  3d0          0.168245     1.000000
    8.1 Ag    1  3d2+         0.168245     1.000000
    9.1 Ag    1  3d0          0.058408     1.000000
   10.1 Ag    1  3d2+         0.058408     1.000000
    1.2 B3u   1  2px          5.027868    -0.003242
                              2.867751     0.010649
                              1.635683    -0.049761
                              0.932947    -0.000017
                              0.532126     0.106060
                              0.303509     0.236202
                              0.173113     0.310665
                              0.098739     0.294696
                              0.056318     0.153898
                              0.032122     0.042337
    2.2 B3u   1  2px          0.411682     1.000000
    3.2 B3u   1  2px          0.070048     1.000000
    4.2 B3u   1  2px          0.024162     1.000000
    5.2 B3u   1  4f1+         0.350329     1.000000
    6.2 B3u   1  4f3+         0.350329     1.000000
    7.2 B3u   1  4f1+         0.130364     1.000000
    8.2 B3u   1  4f3+         0.130364     1.000000
    1.3 B2u   1  2py          5.027868    -0.003242
                              2.867751     0.010649
                              1.635683    -0.049761
                              0.932947    -0.000017
                              0.532126     0.106060
                              0.303509     0.236202
                              0.173113     0.310665
                              0.098739     0.294696
                              0.056318     0.153898
                              0.032122     0.042337
    2.3 B2u   1  2py          0.411682     1.000000
    3.3 B2u   1  2py          0.070048     1.000000
    4.3 B2u   1  2py          0.024162     1.000000
    5.3 B2u   1  4f1-         0.350329     1.000000
    6.3 B2u   1  4f3-         0.350329     1.000000
    7.3 B2u   1  4f1-         0.130364     1.000000
    8.3 B2u   1  4f3-         0.130364     1.000000
    1.4 B1g   1  3d2-         0.524220     1.000000
    2.4 B1g   1  3d2-         0.168245     1.000000
    3.4 B1g   1  3d2-         0.058408     1.000000
    1.5 B1u   1  2pz          5.027868    -0.003242
                              2.867751     0.010649
                              1.635683    -0.049761
                              0.932947    -0.000017
                              0.532126     0.106060
                              0.303509     0.236202
                              0.173113     0.310665
                              0.098739     0.294696
                              0.056318     0.153898
                              0.032122     0.042337
    2.5 B1u   1  2pz          0.411682     1.000000
    3.5 B1u   1  2pz          0.070048     1.000000
    4.5 B1u   1  2pz          0.024162     1.000000
    5.5 B1u   1  4f0          0.350329     1.000000
    6.5 B1u   1  4f2+         0.350329     1.000000
    7.5 B1u   1  4f0          0.130364     1.000000
    8.5 B1u   1  4f2+         0.130364     1.000000
    1.6 B2g   1  3d1+         0.524220     1.000000
    2.6 B2g   1  3d1+         0.168245     1.000000
    3.6 B2g   1  3d1+         0.058408     1.000000
    1.7 B3g   1  3d1-         0.524220     1.000000
    2.7 B3g   1  3d1-         0.168245     1.000000
    3.7 B3g   1  3d1-         0.058408     1.000000
    1.8 Au    1  4f2-         0.350329     1.000000
    2.8 Au    1  4f2-         0.130364     1.000000

 NUCLEAR CHARGE:                    4
 NUMBER OF PRIMITIVE AOS:          90
 NUMBER OF SYMMETRY AOS:           81
 NUMBER OF CONTRACTIONS:           45   (  10Ag  +   8B3u +   8B2u +   3B1g +   8B1u +   3B2g +   3B3g +   2Au  )
 NUMBER OF CORE ORBITALS:           0   (   0Ag  +   0B3u +   0B2u +   0B1g +   0B1u +   0B2g +   0B3g +   0Au  )
 NUMBER OF VALENCE ORBITALS:        4   (   1Ag  +   1B3u +   1B2u +   0B1g +   1B1u +   0B2g +   0B3g +   0Au  )


 NUCLEAR REPULSION ENERGY    0.00000000

 EXTRA SYMMETRY OF AOS IN SYMMETRY 1:   1 1 1 1 2 3 2 3 2 3
 EXTRA SYMMETRY OF AOS IN SYMMETRY 2:   1 1 1 1 2 3 2 3
 EXTRA SYMMETRY OF AOS IN SYMMETRY 3:   1 1 1 1 2 3 2 3
 EXTRA SYMMETRY OF AOS IN SYMMETRY 5:   1 1 1 1 2 3 2 3

 Eigenvalues of metric

         1 0.109E-01 0.107E+00 0.223E+00 0.223E+00 0.630E+00 0.832E+00 0.832E+00 0.194E+01
         2 0.149E-01 0.261E+00 0.411E+00 0.411E+00 0.960E+00 0.159E+01 0.159E+01 0.276E+01
         3 0.149E-01 0.261E+00 0.411E+00 0.411E+00 0.960E+00 0.159E+01 0.159E+01 0.276E+01
         4 0.223E+00 0.832E+00 0.194E+01
         5 0.149E-01 0.261E+00 0.411E+00 0.411E+00 0.960E+00 0.159E+01 0.159E+01 0.276E+01
         6 0.223E+00 0.832E+00 0.194E+01
         7 0.223E+00 0.832E+00 0.194E+01
         8 0.411E+00 0.159E+01


 Contracted 2-electron integrals neglected if value below      1.0D-12
 AO integral compression algorithm  1   Integral accuracy      1.0D-12

     1.049 MB (compressed) written to integral file ( 85.8%)


 NUMBER OF SORTED TWO-ELECTRON INTEGRALS:      75808.     BUFFER LENGTH:  32768
 NUMBER OF SEGMENTS:   1  SEGMENT LENGTH:      75808      RECORD LENGTH: 524288

 Memory used in sort:       0.63 MW

 SORT1 READ      155797. AND WROTE       61548. INTEGRALS IN      1 RECORDS. CPU TIME:     0.00 SEC, REAL TIME:     0.01 SEC
 SORT2 READ       61548. AND WROTE       75808. INTEGRALS IN      4 RECORDS. CPU TIME:     0.02 SEC, REAL TIME:     0.03 SEC

 FILE SIZES:   FILE 1:    20.2 MBYTE,  FILE 4:     4.2 MBYTE,   TOTAL:     24.4 MBYTE

 OPERATOR DM      FOR CENTER  0  COORDINATES:    0.000000    0.000000    0.000000
 OPERATOR EKIN    FOR CENTER  0  COORDINATES:    0.000000    0.000000    0.000000
 OPERATOR POT     FOR CENTER  0  COORDINATES:    0.000000    0.000000    0.000000


 **********************************************************************************************************************************
 DATASETS  * FILE   NREC   LENGTH (MB)   RECORD NAMES
              1      20       19.58       500      610      700      900      950      970     1000      129      960     1100   
                                          VAR    BASINP    GEOM    SYMINP    ZMAT    AOBASIS   BASIS     P2S    ABASIS      S 
                                         1400     1410     1420     1200     1210     1080     1600     1650     1300     1700   
                                         EKIN       V       ECP      H0       H01     AOSYM     SMH    MOLCAS    ERIS     OPER   

 PROGRAMS   *        TOTAL       INT
 CPU TIMES  *         0.29      0.18
 REAL TIME  *         1.97 SEC
 DISK USED  *        24.67 MB      
 **********************************************************************************************************************************


 PROGRAM * RHF-SCF (OPEN SHELL)       Authors: W. Meyer, H.-J. Werner


 NUMBER OF ELECTRONS:       3+    1-    SPACE SYMMETRY=6    SPIN SYMMETRY: Triplet 
 CONVERGENCE THRESHOLDS:    1.00E-05 (Density)    1.00E-07 (Energy)
 MAX. NUMBER OF ITERATIONS:       60
 INTERPOLATION TYPE:            DIIS
 INTERPOLATION STEPS:              2 (START)      1 (STEP)
 LEVEL SHIFTS:                 -0.60 (CLOSED) -0.30 (OPEN) 


 Singly occupied orbitals:      1.2       1.5

   Atom=SI basis=ECP10MWB_GUESS    lmin=0  lmax=1

 Orbital guess generated from atomic densities. Full valence occupancy:    1   1   1   0   1   0   0   0


 Molecular orbital dump at record        4202.2

 ITERATION    DDIFF          GRAD             ENERGY        2-EL.EN.            DIPOLE MOMENTS         DIIS   ORB.
    1      0.000D+00      0.000D+00        -3.66023395      3.768664    0.00000    0.00000    0.00000    0    start
    2      0.000D+00      0.781D-02        -3.66859826      3.880009    0.00000    0.00000    0.00000    1    diag,B
    3      0.176D-01      0.369D-02        -3.67190990      3.961939    0.00000    0.00000    0.00000    2    diag,B
    4      0.146D-01      0.154D-02        -3.67252540      3.989032    0.00000    0.00000    0.00000    3    diag,B
    5      0.838D-02      0.366D-03        -3.67254803      3.990715    0.00000    0.00000    0.00000    4    diag,B
    6      0.159D-02      0.976D-04        -3.67254914      3.991056    0.00000    0.00000    0.00000    5    diag,B
    7      0.456D-03      0.258D-04        -3.67254919      3.990740    0.00000    0.00000    0.00000    6    fixocc
    8      0.120D-03      0.478D-05        -3.67254919      3.990801    0.00000    0.00000    0.00000    7    diag,B
    9      0.392D-04      0.168D-05        -3.67254920      3.990789    0.00000    0.00000    0.00000    8    diag,B
   10      0.793D-05      0.165D-06        -3.67254920      3.990788    0.00000    0.00000    0.00000    0    orth

 Final alpha occupancy:   1   1   0   0   1   0   0   0
 Final beta  occupancy:   1   0   0   0   0   0   0   0

 !RHF STATE 1.6 Energy                 -3.672549195338
 Nuclear energy                         0.00000000
 One-electron energy                   -5.66794309
 Two-electron energy                    1.99539390
 Virial quotient                       -2.76360070
 !RHF STATE 1.6 Dipole moment           0.00000000     0.00000000     0.00000000
 Dipole moment /Debye                   0.00000000     0.00000000     0.00000000
 

 !RHF expec          <1.6|EKIN|1.6>     1.328900083849
 
 !RHF expec           <1.6|POT|1.6>    -1.912887964254

 ELECTRON ORBITALS
 =================


   Orb  Occ    Energy  Couls-En    Coefficients

                                   1 1s      1 1s      1 1s      1 1s      1 3d0     1 3d2+    1 3d0     1 3d2+    1 3d0     1 3d2+ 


   1.1   2    -0.5415   -2.1380  1.000111  0.000033 -0.000042 -0.000149 -0.000231 -0.000399  0.001982  0.003433  0.002549  0.004415

                                   1 2px     1 2px     1 2px     1 2px     1 4f1+    1 4f3+    1 4f1+    1 4f3+ 

   1.2   +    -0.2971   -1.5346  0.999879  0.000006  0.000082  0.000090 -0.000032 -0.000123  0.000015  0.000057

                                   1 2pz     1 2pz     1 2pz     1 2pz     1 4f0     1 4f2+    1 4f0     1 4f2+ 

   1.5   +    -0.2971   -1.5346  0.999879  0.000006  0.000082  0.000090 -0.000078 -0.000100  0.000036  0.000046

 HOMO      1.2    -0.297071 =      -8.0837eV
 LUMO      1.3    -0.017217 =      -0.4685eV
 LUMO-HOMO         0.279854 =       7.6152eV


 **********************************************************************************************************************************
 DATASETS  * FILE   NREC   LENGTH (MB)   RECORD NAMES
              1      20       19.58       500      610      700      900      950      970     1000      129      960     1100   
                                          VAR    BASINP    GEOM    SYMINP    ZMAT    AOBASIS   BASIS     P2S    ABASIS      S 
                                         1400     1410     1420     1200     1210     1080     1600     1650     1300     1700   
                                         EKIN       V       ECP      H0       H01     AOSYM     SMH    MOLCAS    ERIS     OPER   

              2       4        2.76       700     1000      520     4202   
                                         GEOM     BASIS   MCVARS     RHF  

 PROGRAMS   *        TOTAL       RHF       INT
 CPU TIMES  *         0.32      0.04      0.18
 REAL TIME  *         2.13 SEC
 DISK USED  *        24.67 MB      
 **********************************************************************************************************************************


 PROGRAM * MULTI (Direct Multiconfiguration SCF)       Authors: P.J. Knowles, H.-J. Werner (1984)     S.T. Elbert (1988)


 Number of closed-shell orbitals:   1 (   1   0   0   0   0   0   0   0 )
 Number of active  orbitals:        3 (   0   1   1   0   1   0   0   0 )
 Number of external orbitals:      41 (   9   7   7   3   7   3   3   2 )

 State symmetry 1

 Number of electrons:     2    Spin symmetry=Triplet   Space symmetry=4
 Number of states:        1
 Number of CSFs:          1   (1 determinants, 3 intermediate states)

 State symmetry 2

 Number of electrons:     2    Spin symmetry=Triplet   Space symmetry=6
 Number of states:        1
 Number of CSFs:          1   (1 determinants, 3 intermediate states)

 State symmetry 3

 Number of electrons:     2    Spin symmetry=Triplet   Space symmetry=7
 Number of states:        1
 Number of CSFs:          1   (1 determinants, 3 intermediate states)

 Molecular orbitals read from record     4202.2  Type=RHF/CANONICAL (state 1.6)
 *** IN SYMMETRY 1 ORBITAL  1 SYMMETRY CONTAMINATION OF 0.128D-01 HAS BEEN REMOVED

 EXTRA SYMMETRY OF MOS IN SYMMETRY 1:   1 1 2 3 2 3 1 3 2 1
 *** IN SYMMETRY 2 ORBITAL  1 SYMMETRY CONTAMINATION OF 0.226D-03 HAS BEEN REMOVED
 EXTRA SYMMETRY OF MOS IN SYMMETRY 2:   1 1 1 3 2 3 2 1
 *** IN SYMMETRY 3 ORBITAL  1 SYMMETRY CONTAMINATION OF 0.487D-02 HAS BEEN REMOVED
 EXTRA SYMMETRY OF MOS IN SYMMETRY 3:   1 1 1 3 2 3 2 1
 *** IN SYMMETRY 5 ORBITAL  1 SYMMETRY CONTAMINATION OF 0.261D-03 HAS BEEN REMOVED
 EXTRA SYMMETRY OF MOS IN SYMMETRY 5:   1 1 1 3 2 3 2 1

 Wavefunction dump at record             5202.2

 Convergence thresholds  0.10E-01 (gradient)  0.10E-05 (energy)  0.10E-02 (step length)

 Weight factors for state symmetry  1:    0.33333
 Weight factors for state symmetry  2:    0.33333
 Weight factors for state symmetry  3:    0.33333

 Number of orbital rotations:       30   (     0 Core/Active      9 Core/Virtual   0 Active/Active     21 Active/Virtual)
 Total number of variables:         33


 ITER. MIC  NCI  NEG     ENERGY(VAR)     ENERGY(PROJ)   ENERGY CHANGE     GRAD(0)  GRAD(ORB)   GRAD(CI)     STEP       TIME

   1   20   12    0      -3.65535545      -3.67248678   -0.01713133    0.05588931 0.00000000 0.00000000  0.33D+00      0.00
   2   15   12    0      -3.67246852      -3.67247773   -0.00000921    0.00288468 0.00000000 0.00000000  0.52D-02      0.01
   3   13   12    0      -3.67247773      -3.67247773   -0.00000000    0.00000314 0.00000000 0.00000000  0.44D-05      0.02

 ** WVFN ****  CONVERGENCE REACHED, FINAL GRADIENT:  0.34D-11



 Results for state 1.4
 =====================

 !MCSCF STATE 1.4 Energy               -3.672477733044
 Nuclear energy                         0.00000000
 Kinetic energy                         1.32888774
 One electron energy                   -5.66804663
 Two electron energy                    1.99556890
 Virial ratio                           3.76357260

 !MCSCF STATE 1.4 Dipole moment         0.00000000     0.00000000     0.00000000
 Dipole moment /Debye                   0.00000000     0.00000000     0.00000000



 Results for state 1.6
 =====================

 !MCSCF STATE 1.6 Energy               -3.672477733044
 Nuclear energy                         0.00000000
 Kinetic energy                         1.32888774
 One electron energy                   -5.66804663
 Two electron energy                    1.99556890
 Virial ratio                           3.76357260

 !MCSCF STATE 1.6 Dipole moment         0.00000000     0.00000000     0.00000000
 Dipole moment /Debye                   0.00000000     0.00000000     0.00000000



 Results for state 1.7
 =====================

 !MCSCF STATE 1.7 Energy               -3.672477733044
 Nuclear energy                         0.00000000
 Kinetic energy                         1.32888774
 One electron energy                   -5.66804663
 Two electron energy                    1.99556890
 Virial ratio                           3.76357260

 !MCSCF STATE 1.7 Dipole moment         0.00000000     0.00000000     0.00000000
 Dipole moment /Debye                   0.00000000     0.00000000     0.00000000

 State-averaged charge density matrix saved on record  5202.2 (density set 1)

 !MCSCF expec        <1.4|EKIN|1.4>     1.328887737043
 !MCSCF expec        <1.6|EKIN|1.6>     1.328887737044
 !MCSCF expec        <1.7|EKIN|1.7>     1.328887737043

 !MCSCF expec         <1.4|POT|1.4>    -1.912905065285
 !MCSCF expec         <1.6|POT|1.6>    -1.912905065286
 !MCSCF expec         <1.7|POT|1.7>    -1.912905065285


 NATURAL ORBITALS (state averaged)
 =================================

   Orb     Occ        Energy       Coefficients

                                   1 1s      1 1s      1 1s      1 1s      1 3d0     1 3d2+    1 3d0     1 3d2+    1 3d0     1 3d2+ 


   1.1  2.00000    -0.541455     0.999993 -0.000002  0.000028 -0.000023  0.000000  0.000000  0.000000  0.000000  0.000000  0.000000

                                   1 2px     1 2px     1 2px     1 2px     1 4f1+    1 4f3+    1 4f1+    1 4f3+ 

   1.2  0.66667    -0.066397     1.000023 -0.000009 -0.000052  0.000058  0.000000  0.000000  0.000000  0.000000

                                   1 2py     1 2py     1 2py     1 2py     1 4f1-    1 4f3-    1 4f1-    1 4f3- 

   1.3  0.66667    -0.066397     1.000023 -0.000009 -0.000052  0.000058  0.000000  0.000000  0.000000  0.000000

                                   1 2pz     1 2pz     1 2pz     1 2pz     1 4f0     1 4f2+    1 4f0     1 4f2+ 

   1.5  0.66667    -0.066397     1.000023 -0.000009 -0.000052  0.000058  0.000000  0.000000  0.000000  0.000000
 

 EXTRA SYMMETRY OF MOS IN SYMMETRY 1:   1 1 2 3 2 3 1 2 3 1
 EXTRA SYMMETRY OF MOS IN SYMMETRY 5:   1 1 1 2 3 3 2 1

 Natural orbital dump (state averaged) at molpro section  5202.2    (Orbital set 2)


 CI vector for state symmetry 1
 ==============================

 a a 0           1.0000000

 TOTAL ENERGIES                        -3.67247773

 CI vector for state symmetry 2
 ==============================

 a 0 a           1.0000000

 TOTAL ENERGIES                        -3.67247773

 CI vector for state symmetry 3
 ==============================

 0 a a           1.0000000

 TOTAL ENERGIES                        -3.67247773



 **********************************************************************************************************************************
 DATASETS  * FILE   NREC   LENGTH (MB)   RECORD NAMES
              1      21       19.63       500      610      700      900      950      970     1000      129      960     1100   
                                          VAR    BASINP    GEOM    SYMINP    ZMAT    AOBASIS   BASIS     P2S    ABASIS      S 
                                         1400     1410     1420     1200     1210     1080     1600     1650     1300     1700   
                                         EKIN       V       ECP      H0       H01     AOSYM     SMH    MOLCAS    ERIS     OPER   
                                         1380   
                                         JKOP   

              2       5        5.26       700     1000      520     4202     5202   
                                         GEOM     BASIS   MCVARS     RHF     MCSCF   

 PROGRAMS   *        TOTAL     MULTI       RHF       INT
 CPU TIMES  *         0.35      0.03      0.04      0.18
 REAL TIME  *         3.17 SEC
 DISK USED  *        34.10 MB      
 **********************************************************************************************************************************


 PROGRAM * RHF-SCF (OPEN SHELL)       Authors: W. Meyer, H.-J. Werner


 NUMBER OF ELECTRONS:       3+    1-    SPACE SYMMETRY=6    SPIN SYMMETRY: Triplet 
 CONVERGENCE THRESHOLDS:    1.00E-05 (Density)    1.00E-07 (Energy)
 MAX. NUMBER OF ITERATIONS:        0
 INTERPOLATION TYPE:            DIIS
 INTERPOLATION STEPS:              2 (START)      1 (STEP)
 LEVEL SHIFTS:                 -0.60 (CLOSED) -0.30 (OPEN) 


 Singly occupied orbitals:      1.2       1.5
 Molecular orbitals read from record     5202.2  Type=MCSCF/NATURAL (state averaged)

 Molecular orbital dump at record        2101.2

 ITERATION    DDIFF          GRAD             ENERGY        2-EL.EN.            DIPOLE MOMENTS         DIIS   ORB.
    1      0.000D+00      0.000D+00        -3.67247773      3.991138    0.00000    0.00000    0.00000    0    start

 Final alpha occupancy:   1   1   0   0   1   0   0   0
 Final beta  occupancy:   1   0   0   0   0   0   0   0

 !RHF STATE 1.6 Energy                 -3.672477733044
 Nuclear energy                         0.00000000
 One-electron energy                   -5.66804663
 Two-electron energy                    1.99556890
 Virial quotient                       -2.76357260
 !RHF STATE 1.6 Dipole moment           0.00000000     0.00000000     0.00000000
 Dipole moment /Debye                   0.00000000     0.00000000     0.00000000
 

 !RHF expec          <1.6|EKIN|1.6>     1.328887737044
 
 !RHF expec           <1.6|POT|1.6>    -1.912905065286

 ELECTRON ORBITALS
 =================


   Orb  Occ    Energy  Couls-En    Coefficients

                                   1 1s      1 1s      1 1s      1 1s      1 3d0     1 3d2+    1 3d0     1 3d2+    1 3d0     1 3d2+ 


   1.1   2    -0.5415   -2.1380  0.999993 -0.000002  0.000028 -0.000023  0.000000  0.000000  0.000000  0.000000  0.000000  0.000000

                                   1 2px     1 2px     1 2px     1 2px     1 4f1+    1 4f3+    1 4f1+    1 4f3+ 

   1.2   +    -0.0664   -1.3039  1.000023 -0.000009 -0.000052  0.000058  0.000000  0.000000  0.000000  0.000000

                                   1 2pz     1 2pz     1 2pz     1 2pz     1 4f0     1 4f2+    1 4f0     1 4f2+ 

   1.5   +    -0.0664   -1.3039  1.000023 -0.000009 -0.000052  0.000058  0.000000  0.000000  0.000000  0.000000

 HOMO      1.2    -0.066397 =      -1.8067eV
 LUMO      1.3    -0.066397 =      -1.8067eV
 LUMO-HOMO        -0.000000 =      -0.0000eV


 **********************************************************************************************************************************
 DATASETS  * FILE   NREC   LENGTH (MB)   RECORD NAMES
              1      21       19.63       500      610      700      900      950      970     1000      129      960     1100   
                                          VAR    BASINP    GEOM    SYMINP    ZMAT    AOBASIS   BASIS     P2S    ABASIS      S 
                                         1400     1410     1420     1200     1210     1080     1600     1650     1300     1700   
                                         EKIN       V       ECP      H0       H01     AOSYM     SMH    MOLCAS    ERIS     OPER   
                                         1380   
                                         JKOP   

              2       6        7.77       700     1000      520     4202     5202     2101   
                                         GEOM     BASIS   MCVARS     RHF     MCSCF     RHF  

 PROGRAMS   *        TOTAL       RHF     MULTI       RHF       INT
 CPU TIMES  *         0.36      0.01      0.03      0.04      0.18
 REAL TIME  *         3.34 SEC
 DISK USED  *        34.10 MB      
 **********************************************************************************************************************************
 SETTING SCF(I)         =        -3.67247773  AU                              
 SETTING _CC_NORM_MAX   =         2.00000000                                  


 PROGRAM * CI (Multireference internally contracted CI)     Authors: H.-J. Werner, P.J. Knowles, 1987


 Convergence thresholds:  THRVAR = 1.00D-08  THRDEN = 1.00D-06

 Number of optimized states:  1  Roots:   1
 Number of reference states:  1  Roots:   1

 Reference symmetry:                   6   Triplet 
 Number of electrons:                  4
 Maximum number of shells:             2
 Maximum number of spin couplings:     3

 Reference space:        1 conf        1 CSFs
 N elec internal:        3 conf        3 CSFs
 N-1 el internal:        7 conf        9 CSFs
 N-2 el internal:        4 conf       10 CSFs

 Number of electrons in valence space:                      4
 Maximum number of open shell orbitals in reference space:  2
 Maximum number of open shell orbitals in internal spaces:  4


 Number of closed-shell orbitals:   1 (   1   0   0   0   0   0   0   0 )
 Number of active  orbitals:        2 (   0   1   0   0   1   0   0   0 )
 Number of external orbitals:      42 (   9   7   8   3   7   3   3   2 )

 Molecular orbitals read from record     2101.2  Type=RHF/CANONICAL (state 1.6)

 Coulomb and exchange operators available. No transformation done.

 Number of p-space configurations:   1

 Reference wavefunction optimized for reference space (refopt=1)

 State     Reference Energy 
   1          -3.67247773

 Number of blocks in overlap matrix:     6   Smallest eigenvalue:  0.10D+01
 Number of N-2 electron functions:       6
 Number of N-1 electron functions:       9

 Number of internal configurations:                    1
 Number of singly external configurations:            61
 Number of doubly external configurations:           715
 Total number of contracted configurations:          777
 Total number of uncontracted configurations:       1237

 Diagonal Coupling coefficients finished.               Storage:     446 words, CPU-Time:      0.00 seconds.
 Energy denominators for pairs finished in 1 passes.    Storage:    1961 words, CPU-time:      0.00 seconds.

  ITER. STATE  ROOT     SQ.NORM     CORR.ENERGY   TOTAL ENERGY   ENERGY CHANGE       DEN1      VAR(S)    VAR(P)      TIME
    1     1     1     1.00000000     0.00000000    -3.67247773     0.00000000    -0.07991053  0.25D-01  0.43D-01     0.01
    2     1     1     1.06685428    -0.07883903    -3.75131676    -0.07883903    -0.00144171  0.51D-03  0.58D-03     0.01
    3     1     1     1.07475463    -0.08059937    -3.75307710    -0.00176034    -0.00007036  0.14D-04  0.40D-04     0.01
    4     1     1     1.07572856    -0.08069155    -3.75316928    -0.00009218    -0.00000473  0.12D-05  0.22D-05     0.02
    5     1     1     1.07592235    -0.08069767    -3.75317540    -0.00000612    -0.00000018  0.40D-07  0.89D-07     0.02
    6     1     1     1.07594207    -0.08069788    -3.75317561    -0.00000021    -0.00000000  0.15D-08  0.22D-08     0.03


 =====================================
 Analysis of CPU times by interactions
 =====================================

       I      S      P

 I   0.0%
 S   0.0%   0.0%
 P   0.0%  33.3%  33.3%

 Initialization:  33.3%
 Other:            0.0%

 Total CPU:        0.0 seconds
 =====================================



 Reference coefficients greater than 0.0500000
 =============================================
 2//           0.9640633

 Coefficients of singly external configurations greater than 0.0500000
 =====================================================================

 /\/   5.1     0.0654962
 \//   6.1     0.0518404
 /02   2.6    -0.0511359
 /20   2.6     0.0511345

 Coefficients of doubly external configurations greater than 0.0500000
 =====================================================================

 PAIR    I     J   ->   K     L     NP  SYM  REF     COEFFICIENTS

   1    1.1   1.1      1.3   1.3     1   1    1   -0.10933485



 RESULTS FOR STATE 1.6
 =====================

 Coefficient of reference function:   C(0) = 0.96406331 (fixed)   0.96406331 (relaxed)

 Energy contributions of configuration classes

 CLASS          SQ.NORM        ECORR1        ECORR2
 +++++++++++++++++++++++++++++++++++++++++++++++++++
 Internals    0.00000000    0.00000000    0.00000000
 Singles      0.02662901   -0.02404087   -0.02434028
 Pairs        0.04931306   -0.05665701   -0.05635760
 Total        1.07594207   -0.08069788   -0.08069788
 +++++++++++++++++++++++++++++++++++++++++++++++++++


 Reference energy                      -3.67247773
 Nuclear energy                         0.00000000
 Kinetic energy                         1.40885143
 One electron energy                   -5.62703723
 Two electron energy                    1.87386162
 Virial quotient                       -2.66399673
 Correlation energy                    -0.08069788
 !CI(SD) STATE 1.6 Energy              -3.753175613566

 Properties without orbital relaxation:

 !CI(SD) STATE 1.6 Dipole moment        0.00000000     0.00000000     0.00000000
 Dipole moment /Debye                   0.00000000     0.00000000     0.00000000

 Cluster corrected energies            -3.75930398 (Davidson, fixed reference)
 Cluster corrected energies            -3.75930398 (Davidson, relaxed reference)

 Cluster corrected energies            -3.75317561 (Pople, fixed reference)
 Cluster corrected energies            -3.75317561 (Pople, relaxed reference)

 

 !CI(SD) expec       <1.6|EKIN|1.6>     1.408851432670
 
 !CI(SD) expec        <1.6|POT|1.6>    -1.922771954719


 **********************************************************************************************************************************
 DATASETS  * FILE   NREC   LENGTH (MB)   RECORD NAMES
              1      21       19.63       500      610      700      900      950      970     1000      129      960     1100   
                                          VAR    BASINP    GEOM    SYMINP    ZMAT    AOBASIS   BASIS     P2S    ABASIS      S 
                                         1400     1410     1420     1200     1210     1080     1600     1650     1300     1700   
                                         EKIN       V       ECP      H0       H01     AOSYM     SMH    MOLCAS    ERIS     OPER   
                                         1380   
                                         JKOP   

              2       6        7.77       700     1000      520     4202     5202     2101   
                                         GEOM     BASIS   MCVARS     RHF     MCSCF     RHF  

 PROGRAMS   *        TOTAL        CI       RHF     MULTI       RHF       INT
 CPU TIMES  *         0.42      0.05      0.01      0.03      0.04      0.18
 REAL TIME  *         3.87 SEC
 DISK USED  *        34.10 MB      
 **********************************************************************************************************************************
 SETTING POSTHF(I)      =        -3.75317561  AU                              
                                                                                                                                                                                                                                                                

       SCF           POSTHF       EKIN          POT
    -3.67247773   -3.75317561   1.40885143   -1.92277195
                                                  

 CI/USERDEF energy=     -3.753175613566

        CI              RHF-SCF         MULTI           RHF-SCF 
     -3.75317561     -3.67247773     -3.67247773     -3.67254920
 **********************************************************************************************************************************
 Variable memory released
