
 Primary working directories    : /global/cscratch1/sd/aannabe
 Secondary working directories  : /global/cscratch1/sd/aannabe
 Wavefunction directory         : /global/homes/a/aannabe/wfu/
 Main file repository           : /global/cscratch1/sd/aannabe/

 SHA1      : 2873118e99aab1bc19f5b6fc1784693c06d15c95
 NAME      : 2015.1.8
 ARCHNAME  : linux/x86_64
 FC        : /opt/cray/pe/craype/2.5.5/bin/ftn
 BLASLIB   : -Wl,-_start-group /opt/intel/compilers_and_libraries_2016.3.210/linux/mkl/lib/intel64/libmkl_intel_ilp64.a /opt/intel/compilers_and_libraries_2016.3.210/linux/mkl/lib/intel64/libmkl_intel_thread.a /opt/intel/compilers_and_libraries_2016.3.210/linux/mkl/lib/intel64/libmkl_core.a -Wl,-_end-group
 id        : lbl

 Nodes     nprocs
 nid00471     1

 Using customized tuning parameters: mindgm=8; mindgv=16; mindgc=4; mindgr=1; noblas=0; minvec=7
 default implementation of scratch files=df  

 ***,Si
 memory,512,m
 gthresh,twoint=1.e-12
 
 gprint,basis,orbitals
 gexpec,ekin,pot
 
 angstrom
 geometry={
 1                                                                               ! Number of atoms
 Si 0.0 0.0 0.0
 }
 
 basis={
 Including file /global/homes/a/aannabe/docs/accurate/ccECP_Kh/pps/Si.pp
 Including file /global/homes/a/aannabe/docs/accurate/ccECP_Kh/basis/aug-cc-pVnZ/Si_5z.basis
 }
 
 {rhf
  start,atden
  wf,4,6,2
  occ,1,1,0,0,1,0,0,0
  open,1.2,1.5
  save,4202.2
 }
 {multi
  start,4202.2
  occ,1,1,1,0,1,0,0
  closed,1,0,0,0,0,0,0,0
  wf,4,4,2;state,1
  wf,4,6,2;state,1
  wf,4,7,2;state,1
  natorb,ci,print
  orbital,5202.2
 }
 {rhf,nitord=1,maxit=0
  start,5202.2
  wf,4,6,2
  occ,1,1,0,0,1,0,0,0
  open,1.2,1.5
 }
 
 scf(i)=energy
 
 _CC_NORM_MAX=2.0
  !NOTE: Perturbative MRCC works only with UHF reference. So, here we will trick MRCC by doing zero UHF iteration right after ROHF.
 
 {uhf
 maxit,0
 }
 scf(i)=energy
 
 {mrcc,method=CCSDT(Q)
 orbital,ignore_error=1                                                          !Ignore the fact that UHF WF is not converged
 maxit,100
 core
 }
 posthf(i)=energy
 
 table,scf,posthf,ekin,pot
 save,5.csv,new
 
 

 Variables initialized (889), CPU time= 0.01 sec
 Commands  initialized (702), CPU time= 0.01 sec, 572 directives.
 Default parameters read. Elapsed time= 0.19 sec

 Checking input...
 Passed
1


                                         ***  PROGRAM SYSTEM MOLPRO  ***
                                       Copyright, TTI GmbH Stuttgart, 2015
                                    Version 2015.1 linked Sep  7 2016 23:09:38


 **********************************************************************************************************************************
 LABEL *   Si                                                                            
  64 bit serial version                                                                  DATE: 30-Oct-18          TIME: 19:15:00  
 **********************************************************************************************************************************

 SHA1:             2873118e99aab1bc19f5b6fc1784693c06d15c95
 **********************************************************************************************************************************

 THRESHOLDS:

 ZERO    =  1.00D-12  ONEINT  =  1.00D-12  TWOINT  =  1.00D-12  PREFAC  =  1.00D-14  LOCALI  =  1.00D-09  EORDER  =  1.00D-04
 ENERGY  =  0.00D+00  ETEST   =  0.00D+00  EDENS   =  0.00D+00  THRDEDEF=  1.00D-06  GRADIENT=  1.00D-02  STEP    =  1.00D-03
 ORBITAL =  1.00D-05  CIVEC   =  1.00D-05  COEFF   =  1.00D-04  PRINTCI =  5.00D-02  PUNCHCI =  9.90D+01  OPTGRAD =  3.00D-04
 OPTENERG=  1.00D-06  OPTSTEP =  3.00D-04  THRGRAD =  1.00D-10  COMPRESS=  1.00D-11  VARMIN  =  1.00D-07  VARMAX  =  1.00D-03
 THRDOUB =  0.00D+00  THRDIV  =  1.00D-05  THRRED  =  1.00D-07  THRPSP  =  1.00D+00  THRDC   =  1.00D-10  THRCS   =  1.00D-10
 THRNRM  =  1.00D-08  THREQ   =  0.00D+00  THRDE   =  1.00D+00  THRREF  =  1.00D-05  SPARFAC =  1.00D+00  THRDLP  =  1.00D-07
 THRDIA  =  1.00D-10  THRDLS  =  1.00D-07  THRGPS  =  0.00D+00  THRKEX  =  0.00D+00  THRDIS  =  2.00D-01  THRVAR  =  1.00D-10
 THRLOC  =  1.00D-06  THRGAP  =  1.00D-06  THRLOCT = -1.00D+00  THRGAPT = -1.00D+00  THRORB  =  1.00D-06  THRMLTP =  0.00D+00
 THRCPQCI=  1.00D-10  KEXTA   =  0.00D+00  THRCOARS=  0.00D+00  SYMTOL  =  1.00D-06  GRADTOL =  1.00D-06  THROVL  =  1.00D-08
 THRORTH =  1.00D-08  GRID    =  1.00D-06  GRIDMAX =  1.00D-03  DTMAX   =  0.00D+00  THROCCDE=  1.00D-01  THROCCDE=  1.00D-01



 ZUNIT=ANG
 

Geometry recognized as XYZ


 Variable memory set to  512000000 words,  buffer space   230000 words

 SETTING BASIS          =    USERDEF


 Recomputing integrals since basis changed


 Using spherical harmonics



 PROGRAM * SEWARD (Integral evaluation for generally contracted gaussian basis sets)     Author: Roland Lindh, 1990

 Geometry written to block  1 of record 700

 Orientation using atomic masses  
 Molecule type: Atom
 Symmetry elements: X,Y,Z
 Rotational constants:       0.0000000      0.0000000      0.0000000 GHz  (calculated with average atomic masses)

 Point group  D2h 



 ATOMIC COORDINATES

 NR  ATOM    CHARGE       X              Y              Z

   1  SI      4.00    0.000000000    0.000000000    0.000000000


          SI  CORE POTENTIAL

          d POTENTIAL

 POWERS             1              3              2
 EXPONENTIALS   5.168316       8.861690       3.933474    
 COEFFICIENTS   4.000000       20.67326      -14.81817    

          s - d POTENTIAL

 POWERS             2              2
 EXPONENTIALS   9.447023       2.553812    
 COEFFICIENTS   14.83276       26.34966    

          p - d POTENTIAL

 POWERS             2              2
 EXPONENTIALS   3.660001       1.903653    
 COEFFICIENTS   7.621400       10.33158    


 BASIS DATA

   Nr Sym  Nuc  Type         Exponents   Contraction coefficients

    1.1 Ag    1  1s           9.998274     0.002894
                              5.517644    -0.014523
                              3.044965     0.077634
                              1.680393    -0.224022
                              0.927341    -0.149080
                              0.511762     0.085944
                              0.282421     0.355394
                              0.155857     0.445219
                              0.086011     0.267230
                              0.047466     0.060787
    2.1 Ag    1  1s           0.700625     1.000000
    3.1 Ag    1  1s           0.318864     1.000000
    4.1 Ag    1  1s           0.145120     1.000000
    5.1 Ag    1  1s           0.066046     1.000000
    6.1 Ag    1  1s           0.030094     1.000000
    7.1 Ag    1  3d0          2.145983     1.000000
    8.1 Ag    1  3d2+         2.145983     1.000000
    9.1 Ag    1  3d0          0.828929     1.000000
   10.1 Ag    1  3d2+         0.828929     1.000000
   11.1 Ag    1  3d0          0.320190     1.000000
   12.1 Ag    1  3d2+         0.320190     1.000000
   13.1 Ag    1  3d0          0.123680     1.000000
   14.1 Ag    1  3d2+         0.123680     1.000000
   15.1 Ag    1  3d0          0.047779     1.000000
   16.1 Ag    1  3d2+         0.047779     1.000000
   17.1 Ag    1  5g0          0.702896     1.000000
   18.1 Ag    1  5g4+         0.702896     1.000000
   19.1 Ag    1  5g2+         0.702896     1.000000
   20.1 Ag    1  5g0          0.316879     1.000000
   21.1 Ag    1  5g4+         0.316879     1.000000
   22.1 Ag    1  5g2+         0.316879     1.000000
   23.1 Ag    1  5g0          0.146875     1.000000
   24.1 Ag    1  5g4+         0.146875     1.000000
   25.1 Ag    1  5g2+         0.146875     1.000000
    1.2 B3u   1  2px          5.027868    -0.003242
                              2.867751     0.010649
                              1.635683    -0.049761
                              0.932947    -0.000017
                              0.532126     0.106060
                              0.303509     0.236202
                              0.173113     0.310665
                              0.098739     0.294696
                              0.056318     0.153898
                              0.032122     0.042337
    2.2 B3u   1  2px          1.336968     1.000000
    3.2 B3u   1  2px          0.652035     1.000000
    4.2 B3u   1  2px          0.317995     1.000000
    5.2 B3u   1  2px          0.155085     1.000000
    6.2 B3u   1  2px          0.072391     1.000000
    7.2 B3u   1  4f1+         0.756775     1.000000
    8.2 B3u   1  4f3+         0.756775     1.000000
    9.2 B3u   1  4f1+         0.357607     1.000000
   10.2 B3u   1  4f3+         0.357607     1.000000
   11.2 B3u   1  4f1+         0.168984     1.000000
   12.2 B3u   1  4f3+         0.168984     1.000000
   13.2 B3u   1  4f1+         0.073194     1.000000
   14.2 B3u   1  4f3+         0.073194     1.000000
   15.2 B3u   1  6h1+         0.575435     1.000000
   16.2 B3u   1  6h3+         0.575435     1.000000
   17.2 B3u   1  6h5+         0.575435     1.000000
   18.2 B3u   1  6h1+         0.306338     1.000000
   19.2 B3u   1  6h3+         0.306338     1.000000
   20.2 B3u   1  6h5+         0.306338     1.000000
    1.3 B2u   1  2py          5.027868    -0.003242
                              2.867751     0.010649
                              1.635683    -0.049761
                              0.932947    -0.000017
                              0.532126     0.106060
                              0.303509     0.236202
                              0.173113     0.310665
                              0.098739     0.294696
                              0.056318     0.153898
                              0.032122     0.042337
    2.3 B2u   1  2py          1.336968     1.000000
    3.3 B2u   1  2py          0.652035     1.000000
    4.3 B2u   1  2py          0.317995     1.000000
    5.3 B2u   1  2py          0.155085     1.000000
    6.3 B2u   1  2py          0.072391     1.000000
    7.3 B2u   1  4f1-         0.756775     1.000000
    8.3 B2u   1  4f3-         0.756775     1.000000
    9.3 B2u   1  4f1-         0.357607     1.000000
   10.3 B2u   1  4f3-         0.357607     1.000000
   11.3 B2u   1  4f1-         0.168984     1.000000
   12.3 B2u   1  4f3-         0.168984     1.000000
   13.3 B2u   1  4f1-         0.073194     1.000000
   14.3 B2u   1  4f3-         0.073194     1.000000
   15.3 B2u   1  6h1-         0.575435     1.000000
   16.3 B2u   1  6h3-         0.575435     1.000000
   17.3 B2u   1  6h5-         0.575435     1.000000
   18.3 B2u   1  6h1-         0.306338     1.000000
   19.3 B2u   1  6h3-         0.306338     1.000000
   20.3 B2u   1  6h5-         0.306338     1.000000
    1.4 B1g   1  3d2-         2.145983     1.000000
    2.4 B1g   1  3d2-         0.828929     1.000000
    3.4 B1g   1  3d2-         0.320190     1.000000
    4.4 B1g   1  3d2-         0.123680     1.000000
    5.4 B1g   1  3d2-         0.047779     1.000000
    6.4 B1g   1  5g2-         0.702896     1.000000
    7.4 B1g   1  5g4-         0.702896     1.000000
    8.4 B1g   1  5g2-         0.316879     1.000000
    9.4 B1g   1  5g4-         0.316879     1.000000
   10.4 B1g   1  5g2-         0.146875     1.000000
   11.4 B1g   1  5g4-         0.146875     1.000000
    1.5 B1u   1  2pz          5.027868    -0.003242
                              2.867751     0.010649
                              1.635683    -0.049761
                              0.932947    -0.000017
                              0.532126     0.106060
                              0.303509     0.236202
                              0.173113     0.310665
                              0.098739     0.294696
                              0.056318     0.153898
                              0.032122     0.042337
    2.5 B1u   1  2pz          1.336968     1.000000
    3.5 B1u   1  2pz          0.652035     1.000000
    4.5 B1u   1  2pz          0.317995     1.000000
    5.5 B1u   1  2pz          0.155085     1.000000
    6.5 B1u   1  2pz          0.072391     1.000000
    7.5 B1u   1  4f0          0.756775     1.000000
    8.5 B1u   1  4f2+         0.756775     1.000000
    9.5 B1u   1  4f0          0.357607     1.000000
   10.5 B1u   1  4f2+         0.357607     1.000000
   11.5 B1u   1  4f0          0.168984     1.000000
   12.5 B1u   1  4f2+         0.168984     1.000000
   13.5 B1u   1  4f0          0.073194     1.000000
   14.5 B1u   1  4f2+         0.073194     1.000000
   15.5 B1u   1  6h2+         0.575435     1.000000
   16.5 B1u   1  6h4+         0.575435     1.000000
   17.5 B1u   1  6h0          0.575435     1.000000
   18.5 B1u   1  6h2+         0.306338     1.000000
   19.5 B1u   1  6h4+         0.306338     1.000000
   20.5 B1u   1  6h0          0.306338     1.000000
    1.6 B2g   1  3d1+         2.145983     1.000000
    2.6 B2g   1  3d1+         0.828929     1.000000
    3.6 B2g   1  3d1+         0.320190     1.000000
    4.6 B2g   1  3d1+         0.123680     1.000000
    5.6 B2g   1  3d1+         0.047779     1.000000
    6.6 B2g   1  5g1+         0.702896     1.000000
    7.6 B2g   1  5g3+         0.702896     1.000000
    8.6 B2g   1  5g1+         0.316879     1.000000
    9.6 B2g   1  5g3+         0.316879     1.000000
   10.6 B2g   1  5g1+         0.146875     1.000000
   11.6 B2g   1  5g3+         0.146875     1.000000
    1.7 B3g   1  3d1-         2.145983     1.000000
    2.7 B3g   1  3d1-         0.828929     1.000000
    3.7 B3g   1  3d1-         0.320190     1.000000
    4.7 B3g   1  3d1-         0.123680     1.000000
    5.7 B3g   1  3d1-         0.047779     1.000000
    6.7 B3g   1  5g1-         0.702896     1.000000
    7.7 B3g   1  5g3-         0.702896     1.000000
    8.7 B3g   1  5g1-         0.316879     1.000000
    9.7 B3g   1  5g3-         0.316879     1.000000
   10.7 B3g   1  5g1-         0.146875     1.000000
   11.7 B3g   1  5g3-         0.146875     1.000000
    1.8 Au    1  4f2-         0.756775     1.000000
    2.8 Au    1  4f2-         0.357607     1.000000
    3.8 Au    1  4f2-         0.168984     1.000000
    4.8 Au    1  4f2-         0.073194     1.000000
    5.8 Au    1  6h4-         0.575435     1.000000
    6.8 Au    1  6h2-         0.575435     1.000000
    7.8 Au    1  6h4-         0.306338     1.000000
    8.8 Au    1  6h2-         0.306338     1.000000

 NUCLEAR CHARGE:                    4
 NUMBER OF PRIMITIVE AOS:         217
 NUMBER OF SYMMETRY AOS:          162
 NUMBER OF CONTRACTIONS:          126   (  25Ag  +  20B3u +  20B2u +  11B1g +  20B1u +  11B2g +  11B3g +   8Au  )
 NUMBER OF CORE ORBITALS:           0   (   0Ag  +   0B3u +   0B2u +   0B1g +   0B1u +   0B2g +   0B3g +   0Au  )
 NUMBER OF VALENCE ORBITALS:        4   (   1Ag  +   1B3u +   1B2u +   0B1g +   1B1u +   0B2g +   0B3g +   0Au  )


 NUCLEAR REPULSION ENERGY    0.00000000

 EXTRA SYMMETRY OF AOS IN SYMMETRY 1:   1 1 1 1 1 1 2 3 2 3   2 3 2 3 2 3 4 5 6 4   5 6 4 5 6
 EXTRA SYMMETRY OF AOS IN SYMMETRY 2:   1 1 1 1 1 1 2 3 2 3   2 3 2 3 4 5 6 4 5 6
 EXTRA SYMMETRY OF AOS IN SYMMETRY 3:   1 1 1 1 1 1 2 3 2 3   2 3 2 3 4 5 6 4 5 6
 EXTRA SYMMETRY OF AOS IN SYMMETRY 4:   1 1 1 1 1 2 3 2 3 2   3
 EXTRA SYMMETRY OF AOS IN SYMMETRY 5:   1 1 1 1 1 1 2 3 2 3   2 3 2 3 4 5 6 4 5 6
 EXTRA SYMMETRY OF AOS IN SYMMETRY 6:   1 1 1 1 1 2 3 2 3 2   3
 EXTRA SYMMETRY OF AOS IN SYMMETRY 7:   1 1 1 1 1 2 3 2 3 2   3
 EXTRA SYMMETRY OF AOS IN SYMMETRY 8:   1 1 1 1 2 3 2 3

 Eigenvalues of metric

         1 0.739E-03 0.453E-02 0.379E-01 0.693E-01 0.693E-01 0.164E+00 0.164E+00 0.164E+00
         2 0.341E-03 0.753E-02 0.603E-01 0.649E-01 0.649E-01 0.272E+00 0.272E+00 0.272E+00
         3 0.341E-03 0.753E-02 0.603E-01 0.649E-01 0.649E-01 0.272E+00 0.272E+00 0.272E+00
         4 0.693E-01 0.164E+00 0.164E+00 0.238E+00 0.672E+00 0.785E+00 0.785E+00 0.150E+01
         5 0.341E-03 0.753E-02 0.603E-01 0.649E-01 0.649E-01 0.272E+00 0.272E+00 0.272E+00
         6 0.693E-01 0.164E+00 0.164E+00 0.238E+00 0.672E+00 0.785E+00 0.785E+00 0.150E+01
         7 0.693E-01 0.164E+00 0.164E+00 0.238E+00 0.672E+00 0.785E+00 0.785E+00 0.150E+01
         8 0.649E-01 0.272E+00 0.272E+00 0.352E+00 0.112E+01 0.173E+01 0.173E+01 0.246E+01


 Contracted 2-electron integrals neglected if value below      1.0D-12
 AO integral compression algorithm  1   Integral accuracy      1.0D-12

     29.884 MB (compressed) written to integral file ( 53.1%)


 NUMBER OF SORTED TWO-ELECTRON INTEGRALS:    4156552.     BUFFER LENGTH:  32768
 NUMBER OF SEGMENTS:   1  SEGMENT LENGTH:    4156552      RECORD LENGTH: 524288

 Memory used in sort:       4.71 MW

 SORT1 READ     6989366. AND WROTE     2907704. INTEGRALS IN      9 RECORDS. CPU TIME:     0.24 SEC, REAL TIME:     0.32 SEC
 SORT2 READ     2907704. AND WROTE     4156552. INTEGRALS IN    114 RECORDS. CPU TIME:     0.22 SEC, REAL TIME:     0.39 SEC

 FILE SIZES:   FILE 1:    49.3 MBYTE,  FILE 4:    37.8 MBYTE,   TOTAL:     87.1 MBYTE

 OPERATOR DM      FOR CENTER  0  COORDINATES:    0.000000    0.000000    0.000000
 OPERATOR EKIN    FOR CENTER  0  COORDINATES:    0.000000    0.000000    0.000000
 OPERATOR POT     FOR CENTER  0  COORDINATES:    0.000000    0.000000    0.000000


 **********************************************************************************************************************************
 DATASETS  * FILE   NREC   LENGTH (MB)   RECORD NAMES
              1      20       37.34       500      610      700      900      950      970     1000      129      960     1100   
                                          VAR    BASINP    GEOM    SYMINP    ZMAT    AOBASIS   BASIS     P2S    ABASIS      S 
                                         1400     1410     1420     1200     1210     1080     1600     1650     1300     1700   
                                         EKIN       V       ECP      H0       H01     AOSYM     SMH    MOLCAS    ERIS     OPER   

 PROGRAMS   *        TOTAL       INT
 CPU TIMES  *         2.22      2.07
 REAL TIME  *         4.31 SEC
 DISK USED  *        87.43 MB      
 **********************************************************************************************************************************


 PROGRAM * RHF-SCF (OPEN SHELL)       Authors: W. Meyer, H.-J. Werner


 NUMBER OF ELECTRONS:       3+    1-    SPACE SYMMETRY=6    SPIN SYMMETRY: Triplet 
 CONVERGENCE THRESHOLDS:    1.00E-05 (Density)    1.00E-07 (Energy)
 MAX. NUMBER OF ITERATIONS:       60
 INTERPOLATION TYPE:            DIIS
 INTERPOLATION STEPS:              2 (START)      1 (STEP)
 LEVEL SHIFTS:                 -0.60 (CLOSED) -0.30 (OPEN) 


 Singly occupied orbitals:      1.2       1.5

   Atom=SI basis=ECP10MWB_GUESS    lmin=0  lmax=1

 Orbital guess generated from atomic densities. Full valence occupancy:    1   1   1   0   1   0   0   0


 Molecular orbital dump at record        4202.2

 ITERATION    DDIFF          GRAD             ENERGY        2-EL.EN.            DIPOLE MOMENTS         DIIS   ORB.
    1      0.000D+00      0.000D+00        -3.66058373      3.773088    0.00000    0.00000    0.00000    0    start
    2      0.000D+00      0.475D-02        -3.66876486      3.882467    0.00000    0.00000    0.00000    1    diag,B
    3      0.180D+00      0.223D-02        -3.67194839      3.961737    0.00000    0.00000    0.00000    2    diag,B
    4      0.139D+00      0.936D-03        -3.67253559      3.990019    0.00000    0.00000    0.00000    3    diag,B
    5      0.710D-01      0.222D-03        -3.67255228      3.990388    0.00000    0.00000    0.00000    4    diag,B
    6      0.104D-01      0.532D-04        -3.67255308      3.991122    0.00000    0.00000    0.00000    5    diag,B
    7      0.183D-02      0.145D-04        -3.67255313      3.990811    0.00000    0.00000    0.00000    6    fixocc
    8      0.158D-03      0.471D-05        -3.67255314      3.990795    0.00000    0.00000    0.00000    7    diag,B
    9      0.162D-03      0.721D-06        -3.67255314      3.990796    0.00000    0.00000    0.00000    8    diag,B
   10      0.346D-05      0.167D-06        -3.67255314      3.990795    0.00000    0.00000    0.00000    0    orth

 Final alpha occupancy:   1   1   0   0   1   0   0   0
 Final beta  occupancy:   1   0   0   0   0   0   0   0

 !RHF STATE 1.6 Energy                 -3.672553136840
 Nuclear energy                         0.00000000
 One-electron energy                   -5.66795073
 Two-electron energy                    1.99539759
 Virial quotient                       -2.76356520
 !RHF STATE 1.6 Dipole moment           0.00000000     0.00000000     0.00000000
 Dipole moment /Debye                   0.00000000     0.00000000     0.00000000
 

 !RHF expec          <1.6|EKIN|1.6>     1.328918578508
 
 !RHF expec           <1.6|POT|1.6>    -1.912893250557

 ELECTRON ORBITALS
 =================


   Orb  Occ    Energy  Couls-En    Coefficients

                                   1 1s      1 1s      1 1s      1 1s      1 1s      1 1s      1 3d0     1 3d2+    1 3d0     1 3d2+ 
                                   1 3d0     1 3d2+    1 3d0     1 3d2+    1 3d0     1 3d2+    1 5g0     1 5g4+    1 5g2+    1 5g0  
                                   1 5g4+    1 5g2+    1 5g0     1 5g4+    1 5g2+ 

   1.1   2    -0.5415   -2.1380  1.000102  0.000059 -0.000221  0.000587 -0.000905  0.000380  0.000180  0.000312  0.000203  0.000351
                                -0.000527 -0.000912  0.003402  0.005893  0.001215  0.002105 -0.000001 -0.000001 -0.000001 -0.000009
                                -0.000017 -0.000013 -0.000029 -0.000058 -0.000044

                                   1 2px     1 2px     1 2px     1 2px     1 2px     1 2px     1 4f1+    1 4f3+    1 4f1+    1 4f3+ 
                                   1 4f1+    1 4f3+    1 4f1+    1 4f3+    1 6h1+    1 6h3+    1 6h5+    1 6h1+    1 6h3+    1 6h5+ 


   1.2   +    -0.2971   -1.5346  0.999666 -0.000018  0.000044  0.000055  0.000035  0.000262 -0.000002 -0.000009 -0.000027 -0.000106
                                -0.000002 -0.000010  0.000024  0.000093  0.000000  0.000000  0.000000 -0.000000 -0.000001 -0.000001

                                   1 2pz     1 2pz     1 2pz     1 2pz     1 2pz     1 2pz     1 4f0     1 4f2+    1 4f0     1 4f2+ 
                                   1 4f0     1 4f2+    1 4f0     1 4f2+    1 6h2+    1 6h4+    1 6h0     1 6h2+    1 6h4+    1 6h0  


   1.5   +    -0.2971   -1.5346  0.999666 -0.000018  0.000044  0.000055  0.000035  0.000262 -0.000006 -0.000007 -0.000067 -0.000086
                                -0.000006 -0.000008  0.000059  0.000076  0.000000  0.000000  0.000000 -0.000001 -0.000001 -0.000001

 HOMO      1.2    -0.297073 =      -8.0838eV
 LUMO      1.3    -0.016360 =      -0.4452eV
 LUMO-HOMO         0.280714 =       7.6386eV


 **********************************************************************************************************************************
 DATASETS  * FILE   NREC   LENGTH (MB)   RECORD NAMES
              1      20       37.34       500      610      700      900      950      970     1000      129      960     1100   
                                          VAR    BASINP    GEOM    SYMINP    ZMAT    AOBASIS   BASIS     P2S    ABASIS      S 
                                         1400     1410     1420     1200     1210     1080     1600     1650     1300     1700   
                                         EKIN       V       ECP      H0       H01     AOSYM     SMH    MOLCAS    ERIS     OPER   

              2       4        2.83       700     1000      520     4202   
                                         GEOM     BASIS   MCVARS     RHF  

 PROGRAMS   *        TOTAL       RHF       INT
 CPU TIMES  *         2.45      0.23      2.07
 REAL TIME  *         4.73 SEC
 DISK USED  *        87.43 MB      
 **********************************************************************************************************************************


 PROGRAM * MULTI (Direct Multiconfiguration SCF)       Authors: P.J. Knowles, H.-J. Werner (1984)     S.T. Elbert (1988)


 Number of closed-shell orbitals:   1 (   1   0   0   0   0   0   0   0 )
 Number of active  orbitals:        3 (   0   1   1   0   1   0   0   0 )
 Number of external orbitals:     122 (  24  19  19  11  19  11  11   8 )

 State symmetry 1

 Number of electrons:     2    Spin symmetry=Triplet   Space symmetry=4
 Number of states:        1
 Number of CSFs:          1   (1 determinants, 3 intermediate states)

 State symmetry 2

 Number of electrons:     2    Spin symmetry=Triplet   Space symmetry=6
 Number of states:        1
 Number of CSFs:          1   (1 determinants, 3 intermediate states)

 State symmetry 3

 Number of electrons:     2    Spin symmetry=Triplet   Space symmetry=7
 Number of states:        1
 Number of CSFs:          1   (1 determinants, 3 intermediate states)

 Molecular orbitals read from record     4202.2  Type=RHF/CANONICAL (state 1.6)
 *** IN SYMMETRY 1 ORBITAL  1 SYMMETRY CONTAMINATION OF 0.150D-01 HAS BEEN REMOVED

 EXTRA SYMMETRY OF MOS IN SYMMETRY 1:   1 1 2 3 1 2 3 5 4 6   3 2 1 5 4 6 3 2 1 5   4 6 3 2 1
 *** IN SYMMETRY 2 ORBITAL  1 SYMMETRY CONTAMINATION OF 0.276D-03 HAS BEEN REMOVED
 EXTRA SYMMETRY OF MOS IN SYMMETRY 2:   1 1 3 2 1 3 2 1 3 6   2 5 4 1 3 2 6 5 4 1
 *** IN SYMMETRY 3 ORBITAL  1 SYMMETRY CONTAMINATION OF 0.673D-03 HAS BEEN REMOVED
 EXTRA SYMMETRY OF MOS IN SYMMETRY 3:   1 1 3 2 1 3 2 1 3 2   6 4 5 1 3 2 6 4 5 1
 EXTRA SYMMETRY OF MOS IN SYMMETRY 4:   1 1 3 2 1 3 2 1 3 2   1
 *** IN SYMMETRY 5 ORBITAL  1 SYMMETRY CONTAMINATION OF 0.318D-03 HAS BEEN REMOVED
 EXTRA SYMMETRY OF MOS IN SYMMETRY 5:   1 1 3 2 1 3 2 1 3 4   2 5 6 1 3 2 4 5 6 1
 EXTRA SYMMETRY OF MOS IN SYMMETRY 6:   1 1 3 2 1 3 2 1 3 2   1
 EXTRA SYMMETRY OF MOS IN SYMMETRY 7:   1 1 2 3 1 2 3 1 2 3   1
 EXTRA SYMMETRY OF MOS IN SYMMETRY 8:   1 1 1 2 3 1 2 3

 Wavefunction dump at record             5202.2

 Convergence thresholds  0.10E-01 (gradient)  0.10E-05 (energy)  0.10E-02 (step length)

 Weight factors for state symmetry  1:    0.33333
 Weight factors for state symmetry  2:    0.33333
 Weight factors for state symmetry  3:    0.33333

 Number of orbital rotations:       81   (     0 Core/Active     24 Core/Virtual   0 Active/Active     57 Active/Virtual)
 Total number of variables:         84


 ITER. MIC  NCI  NEG     ENERGY(VAR)     ENERGY(PROJ)   ENERGY CHANGE     GRAD(0)  GRAD(ORB)   GRAD(CI)     STEP       TIME

   1   20   12    0      -3.65799932      -3.67248462   -0.01448530    0.05336732 0.00000000 0.00000000  0.29D+00      0.07
   2   15   12    0      -3.67247070      -3.67247774   -0.00000704    0.00251591 0.00000000 0.00000000  0.46D-02      0.12
   3   15   12    0      -3.67247774      -3.67247774   -0.00000000    0.00000242 0.00000000 0.00000000  0.33D-05      0.16

 ** WVFN ****  CONVERGENCE REACHED, FINAL GRADIENT:  0.20D-11



 Results for state 1.4
 =====================

 !MCSCF STATE 1.4 Energy               -3.672477743753
 Nuclear energy                         0.00000000
 Kinetic energy                         1.32889540
 One electron energy                   -5.66805443
 Two electron energy                    1.99557669
 Virial ratio                           3.76355666

 !MCSCF STATE 1.4 Dipole moment         0.00000000     0.00000000     0.00000000
 Dipole moment /Debye                   0.00000000     0.00000000     0.00000000



 Results for state 1.6
 =====================

 !MCSCF STATE 1.6 Energy               -3.672477743753
 Nuclear energy                         0.00000000
 Kinetic energy                         1.32889540
 One electron energy                   -5.66805443
 Two electron energy                    1.99557669
 Virial ratio                           3.76355666

 !MCSCF STATE 1.6 Dipole moment         0.00000000     0.00000000     0.00000000
 Dipole moment /Debye                   0.00000000     0.00000000     0.00000000



 Results for state 1.7
 =====================

 !MCSCF STATE 1.7 Energy               -3.672477743753
 Nuclear energy                         0.00000000
 Kinetic energy                         1.32889540
 One electron energy                   -5.66805443
 Two electron energy                    1.99557669
 Virial ratio                           3.76355666

 !MCSCF STATE 1.7 Dipole moment         0.00000000     0.00000000     0.00000000
 Dipole moment /Debye                   0.00000000     0.00000000     0.00000000

 State-averaged charge density matrix saved on record  5202.2 (density set 1)

 !MCSCF expec        <1.4|EKIN|1.4>     1.328895404553
 !MCSCF expec        <1.6|EKIN|1.6>     1.328895404554
 !MCSCF expec        <1.7|EKIN|1.7>     1.328895404553

 !MCSCF expec         <1.4|POT|1.4>    -1.912909501386
 !MCSCF expec         <1.6|POT|1.6>    -1.912909501387
 !MCSCF expec         <1.7|POT|1.7>    -1.912909501386


 NATURAL ORBITALS (state averaged)
 =================================

   Orb     Occ        Energy       Coefficients

                                   1 1s      1 1s      1 1s      1 1s      1 1s      1 1s      1 3d0     1 3d2+    1 3d0     1 3d2+ 
                                   1 3d0     1 3d2+    1 3d0     1 3d2+    1 3d0     1 3d2+    1 5g0     1 5g4+    1 5g2+    1 5g0  
                                   1 5g4+    1 5g2+    1 5g0     1 5g4+    1 5g2+ 

   1.1  2.00000    -0.541452     1.000134  0.000133 -0.000367  0.000499 -0.000712  0.000371  0.000000  0.000000  0.000000  0.000000
                                 0.000000  0.000000  0.000000  0.000000  0.000000  0.000000  0.000000  0.000000  0.000000  0.000000
                                 0.000000  0.000000  0.000000  0.000000  0.000000

                                   1 2px     1 2px     1 2px     1 2px     1 2px     1 2px     1 4f1+    1 4f3+    1 4f1+    1 4f3+ 
                                   1 4f1+    1 4f3+    1 4f1+    1 4f3+    1 6h1+    1 6h3+    1 6h5+    1 6h1+    1 6h3+    1 6h5+ 


   1.2  0.66667    -0.066393     0.999458 -0.000029  0.000034  0.000183  0.000176  0.000227  0.000000  0.000000  0.000000  0.000000
                                 0.000000  0.000000  0.000000  0.000000  0.000000  0.000000  0.000000  0.000000  0.000000  0.000000

                                   1 2py     1 2py     1 2py     1 2py     1 2py     1 2py     1 4f1-    1 4f3-    1 4f1-    1 4f3- 
                                   1 4f1-    1 4f3-    1 4f1-    1 4f3-    1 6h1-    1 6h3-    1 6h5-    1 6h1-    1 6h3-    1 6h5- 


   1.3  0.66667    -0.066393     0.999458 -0.000029  0.000034  0.000183  0.000176  0.000227  0.000000  0.000000  0.000000  0.000000
                                 0.000000  0.000000  0.000000  0.000000  0.000000  0.000000  0.000000  0.000000  0.000000  0.000000

                                   1 2pz     1 2pz     1 2pz     1 2pz     1 2pz     1 2pz     1 4f0     1 4f2+    1 4f0     1 4f2+ 
                                   1 4f0     1 4f2+    1 4f0     1 4f2+    1 6h2+    1 6h4+    1 6h0     1 6h2+    1 6h4+    1 6h0  


   1.5  0.66667    -0.066393     0.999458 -0.000029  0.000034  0.000183  0.000176  0.000227  0.000000  0.000000  0.000000  0.000000
                                 0.000000  0.000000  0.000000  0.000000  0.000000  0.000000  0.000000  0.000000  0.000000  0.000000
 

 EXTRA SYMMETRY OF MOS IN SYMMETRY 1:   1 1 2 3 1 2 3 4 6 5   2 3 1 4 6 5 3 2 1 5   6 4 2 3 1
 EXTRA SYMMETRY OF MOS IN SYMMETRY 2:   1 1 2 3 1 2 3 1 2 3   5 6 4 1 2 3 5 6 4 1
 EXTRA SYMMETRY OF MOS IN SYMMETRY 3:   1 1 2 3 1 2 3 1 2 3   5 6 4 1 2 3 5 6 4 1
 EXTRA SYMMETRY OF MOS IN SYMMETRY 4:   1 1 2 3 1 2 3 1 3 2   1
 EXTRA SYMMETRY OF MOS IN SYMMETRY 5:   1 1 3 2 1 3 2 1 3 2   6 4 5 1 3 2 6 4 5 1
 EXTRA SYMMETRY OF MOS IN SYMMETRY 7:   1 1 3 2 1 3 2 1 3 2   1
 EXTRA SYMMETRY OF MOS IN SYMMETRY 8:   1 1 1 3 2 1 2 3

 Natural orbital dump (state averaged) at molpro section  5202.2    (Orbital set 2)


 CI vector for state symmetry 1
 ==============================

 a a 0           1.0000000

 TOTAL ENERGIES                        -3.67247774

 CI vector for state symmetry 2
 ==============================

 a 0 a           1.0000000

 TOTAL ENERGIES                        -3.67247774

 CI vector for state symmetry 3
 ==============================

 0 a a           1.0000000

 TOTAL ENERGIES                        -3.67247774



 **********************************************************************************************************************************
 DATASETS  * FILE   NREC   LENGTH (MB)   RECORD NAMES
              1      21       37.63       500      610      700      900      950      970     1000      129      960     1100   
                                          VAR    BASINP    GEOM    SYMINP    ZMAT    AOBASIS   BASIS     P2S    ABASIS      S 
                                         1400     1410     1420     1200     1210     1080     1600     1650     1300     1700   
                                         EKIN       V       ECP      H0       H01     AOSYM     SMH    MOLCAS    ERIS     OPER   
                                         1380   
                                         JKOP   

              2       5        5.40       700     1000      520     4202     5202   
                                         GEOM     BASIS   MCVARS     RHF     MCSCF   

 PROGRAMS   *        TOTAL     MULTI       RHF       INT
 CPU TIMES  *         2.67      0.22      0.23      2.07
 REAL TIME  *         6.02 SEC
 DISK USED  *        87.43 MB      
 **********************************************************************************************************************************


 PROGRAM * RHF-SCF (OPEN SHELL)       Authors: W. Meyer, H.-J. Werner


 NUMBER OF ELECTRONS:       3+    1-    SPACE SYMMETRY=6    SPIN SYMMETRY: Triplet 
 CONVERGENCE THRESHOLDS:    1.00E-05 (Density)    1.00E-07 (Energy)
 MAX. NUMBER OF ITERATIONS:        0
 INTERPOLATION TYPE:            DIIS
 INTERPOLATION STEPS:              2 (START)      1 (STEP)
 LEVEL SHIFTS:                 -0.60 (CLOSED) -0.30 (OPEN) 


 Singly occupied orbitals:      1.2       1.5
 Molecular orbitals read from record     5202.2  Type=MCSCF/NATURAL (state averaged)

 Molecular orbital dump at record        2101.2

 ITERATION    DDIFF          GRAD             ENERGY        2-EL.EN.            DIPOLE MOMENTS         DIIS   ORB.
    1      0.000D+00      0.000D+00        -3.67247774      3.991153    0.00000    0.00000    0.00000    0    start

 Final alpha occupancy:   1   1   0   0   1   0   0   0
 Final beta  occupancy:   1   0   0   0   0   0   0   0

 !RHF STATE 1.6 Energy                 -3.672477743753
 Nuclear energy                         0.00000000
 One-electron energy                   -5.66805443
 Two-electron energy                    1.99557669
 Virial quotient                       -2.76355666
 !RHF STATE 1.6 Dipole moment           0.00000000     0.00000000     0.00000000
 Dipole moment /Debye                   0.00000000     0.00000000     0.00000000
 

 !RHF expec          <1.6|EKIN|1.6>     1.328895404554
 
 !RHF expec           <1.6|POT|1.6>    -1.912909501387

 ELECTRON ORBITALS
 =================


   Orb  Occ    Energy  Couls-En    Coefficients

                                   1 1s      1 1s      1 1s      1 1s      1 1s      1 1s      1 3d0     1 3d2+    1 3d0     1 3d2+ 
                                   1 3d0     1 3d2+    1 3d0     1 3d2+    1 3d0     1 3d2+    1 5g0     1 5g4+    1 5g2+    1 5g0  
                                   1 5g4+    1 5g2+    1 5g0     1 5g4+    1 5g2+ 

   1.1   2    -0.5415   -2.1379  1.000134  0.000133 -0.000367  0.000499 -0.000712  0.000371  0.000000  0.000000  0.000000  0.000000
                                 0.000000  0.000000  0.000000  0.000000  0.000000  0.000000  0.000000  0.000000  0.000000  0.000000
                                 0.000000  0.000000  0.000000  0.000000  0.000000

                                   1 2px     1 2px     1 2px     1 2px     1 2px     1 2px     1 4f1+    1 4f3+    1 4f1+    1 4f3+ 
                                   1 4f1+    1 4f3+    1 4f1+    1 4f3+    1 6h1+    1 6h3+    1 6h5+    1 6h1+    1 6h3+    1 6h5+ 


   1.2   +    -0.0664   -1.3039  0.999458 -0.000029  0.000034  0.000183  0.000176  0.000227  0.000000  0.000000  0.000000  0.000000
                                 0.000000  0.000000  0.000000  0.000000  0.000000  0.000000  0.000000  0.000000  0.000000  0.000000

                                   1 2pz     1 2pz     1 2pz     1 2pz     1 2pz     1 2pz     1 4f0     1 4f2+    1 4f0     1 4f2+ 
                                   1 4f0     1 4f2+    1 4f0     1 4f2+    1 6h2+    1 6h4+    1 6h0     1 6h2+    1 6h4+    1 6h0  


   1.5   +    -0.0664   -1.3039  0.999458 -0.000029  0.000034  0.000183  0.000176  0.000227  0.000000  0.000000  0.000000  0.000000
                                 0.000000  0.000000  0.000000  0.000000  0.000000  0.000000  0.000000  0.000000  0.000000  0.000000

 HOMO      1.2    -0.066393 =      -1.8067eV
 LUMO      1.3    -0.066393 =      -1.8067eV
 LUMO-HOMO        -0.000000 =      -0.0000eV


 **********************************************************************************************************************************
 DATASETS  * FILE   NREC   LENGTH (MB)   RECORD NAMES
              1      21       37.63       500      610      700      900      950      970     1000      129      960     1100   
                                          VAR    BASINP    GEOM    SYMINP    ZMAT    AOBASIS   BASIS     P2S    ABASIS      S 
                                         1400     1410     1420     1200     1210     1080     1600     1650     1300     1700   
                                         EKIN       V       ECP      H0       H01     AOSYM     SMH    MOLCAS    ERIS     OPER   
                                         1380   
                                         JKOP   

              2       6        8.00       700     1000      520     4202     5202     2101   
                                         GEOM     BASIS   MCVARS     RHF     MCSCF     RHF  

 PROGRAMS   *        TOTAL       RHF     MULTI       RHF       INT
 CPU TIMES  *         2.70      0.03      0.22      0.23      2.07
 REAL TIME  *         6.71 SEC
 DISK USED  *        87.43 MB      
 **********************************************************************************************************************************
 SETTING SCF(I)         =        -3.67247774  AU                              
 SETTING _CC_NORM_MAX   =         2.00000000                                  


 PROGRAM * UHF-SCF       Authors: W. Meyer, H.-J. Werner


 NUMBER OF ELECTRONS:       3+    1-    SPACE SYMMETRY=6    SPIN SYMMETRY: Triplet 
 CONVERGENCE THRESHOLDS:    1.00E-05 (Density)    1.00E-07 (Energy)
 MAX. NUMBER OF ITERATIONS:        0
 INTERPOLATION TYPE:            DIIS
 INTERPOLATION STEPS:              2 (START)      1 (STEP)
 LEVEL SHIFTS:                  0.20 (ALPHA)   0.20 (BETA) 



 Molecular orbitals read from record     2101.2  Type=RHF/CANONICAL (state 1.6)

 Molecular orbital dump at record        2200.2

 Initial alpha occupation   1   1   0   0   1   0   0   0
 Initial beta  occupation   1   0   0   0   0   0   0   0

 ITERATION    DDIFF          GRAD             ENERGY        2-EL.EN.            DIPOLE MOMENTS         DIIS
    1      0.000D+00      0.000D+00        -3.67247774      3.991153    0.00000    0.00000    0.00000    0
 
 Final alpha occupancy:   1   1   0   0   1   0   0   0
 Final beta  occupancy:   1   0   0   0   0   0   0   0

 !UHF STATE 1.6 Energy                 -3.672477743753
 Nuclear energy                         0.00000000
 One-electron energy                   -5.66805443
 Two-electron energy                    1.99557669
 Virial quotient                       -2.76355666
 !UHF STATE 1.6 Dipole moment           0.00000000     0.00000000     0.00000000
 Dipole moment /Debye                   0.00000000     0.00000000     0.00000000
 

 !UHF expec          <1.6|EKIN|1.6>     1.328895404554
 
 !UHF expec           <1.6|POT|1.6>    -1.912909501387

 ELECTRON ORBITALS FOR POSITIVE SPIN
 ===================================


   Orb  Occ    Energy  Couls-En    Coefficients

                                   1 1s      1 1s      1 1s      1 1s      1 1s      1 1s      1 3d0     1 3d2+    1 3d0     1 3d2+ 
                                   1 3d0     1 3d2+    1 3d0     1 3d2+    1 3d0     1 3d2+    1 5g0     1 5g4+    1 5g2+    1 5g0  
                                   1 5g4+    1 5g2+    1 5g0     1 5g4+    1 5g2+ 

   1.1   +    -0.5415   -2.1379  1.000134  0.000133 -0.000367  0.000499 -0.000712  0.000371  0.000000  0.000000  0.000000  0.000000
                                 0.000000  0.000000  0.000000  0.000000  0.000000  0.000000  0.000000  0.000000  0.000000  0.000000
                                 0.000000  0.000000  0.000000  0.000000  0.000000

                                   1 2px     1 2px     1 2px     1 2px     1 2px     1 2px     1 4f1+    1 4f3+    1 4f1+    1 4f3+ 
                                   1 4f1+    1 4f3+    1 4f1+    1 4f3+    1 6h1+    1 6h3+    1 6h5+    1 6h1+    1 6h3+    1 6h5+ 


   1.2   +    -0.0664   -1.3039  0.999458 -0.000029  0.000034  0.000183  0.000176  0.000227  0.000000  0.000000  0.000000  0.000000
                                 0.000000  0.000000  0.000000  0.000000  0.000000  0.000000  0.000000  0.000000  0.000000  0.000000

                                   1 2pz     1 2pz     1 2pz     1 2pz     1 2pz     1 2pz     1 4f0     1 4f2+    1 4f0     1 4f2+ 
                                   1 4f0     1 4f2+    1 4f0     1 4f2+    1 6h2+    1 6h4+    1 6h0     1 6h2+    1 6h4+    1 6h0  


   1.5   +    -0.0664   -1.3039  0.999458 -0.000029  0.000034  0.000183  0.000176  0.000227  0.000000  0.000000  0.000000  0.000000
                                 0.000000  0.000000  0.000000  0.000000  0.000000  0.000000  0.000000  0.000000  0.000000  0.000000

 ELECTRON ORBITALS FOR NEGATIVE SPIN
 ===================================


   Orb  Occ    Energy  Couls-En    Coefficients

                                   1 1s      1 1s      1 1s      1 1s      1 1s      1 1s      1 3d0     1 3d2+    1 3d0     1 3d2+ 
                                   1 3d0     1 3d2+    1 3d0     1 3d2+    1 3d0     1 3d2+    1 5g0     1 5g4+    1 5g2+    1 5g0  
                                   1 5g4+    1 5g2+    1 5g0     1 5g4+    1 5g2+ 

   1.1   -    -0.5415   -2.1379  1.000134  0.000133 -0.000367  0.000499 -0.000712  0.000371  0.000000  0.000000  0.000000  0.000000
                                 0.000000  0.000000  0.000000  0.000000  0.000000  0.000000  0.000000  0.000000  0.000000  0.000000
                                 0.000000  0.000000  0.000000  0.000000  0.000000

 HOMO      1.2    -0.066393 =      -1.8067eV
 LUMO      1.3    -0.066393 =      -1.8067eV
 LUMO-HOMO        -0.000000 =      -0.0000eV

 EXPECTATION VALUE OF S**2:             2.00000000

 Occupation number threshold for canonical orbitals:  1.999000 (occupied),  0.001000 (virtual)

 Number of pseudo-canonical orbitals per symmetry:    1   0   0   0   0   0   0   0
 Number of active natural orbitals per symmetry:      0   1   0   0   1   0   0   0

 NATURAL CHARGE ORBITALS
 =======================


   Orb     Occ        Energy       Coefficients

                                   1 1s      1 1s      1 1s      1 1s      1 1s      1 1s      1 3d0     1 3d2+    1 3d0     1 3d2+ 
                                   1 3d0     1 3d2+    1 3d0     1 3d2+    1 3d0     1 3d2+    1 5g0     1 5g4+    1 5g2+    1 5g0  
                                   1 5g4+    1 5g2+    1 5g0     1 5g4+    1 5g2+ 

   1.1  2.00000    -0.541452     1.000134  0.000133 -0.000367  0.000499 -0.000712  0.000371  0.000000  0.000000  0.000000  0.000000
                                 0.000000  0.000000  0.000000  0.000000  0.000000  0.000000  0.000000  0.000000  0.000000  0.000000
                                 0.000000  0.000000  0.000000  0.000000  0.000000

                                   1 2px     1 2px     1 2px     1 2px     1 2px     1 2px     1 4f1+    1 4f3+    1 4f1+    1 4f3+ 
                                   1 4f1+    1 4f3+    1 4f1+    1 4f3+    1 6h1+    1 6h3+    1 6h5+    1 6h1+    1 6h3+    1 6h5+ 


   1.2  1.00000    -0.108833     0.999458 -0.000029  0.000034  0.000183  0.000176  0.000227  0.000000  0.000000  0.000000  0.000000
                                 0.000000  0.000000  0.000000  0.000000  0.000000  0.000000  0.000000  0.000000  0.000000  0.000000

                                   1 2pz     1 2pz     1 2pz     1 2pz     1 2pz     1 2pz     1 4f0     1 4f2+    1 4f0     1 4f2+ 
                                   1 4f0     1 4f2+    1 4f0     1 4f2+    1 6h2+    1 6h4+    1 6h0     1 6h2+    1 6h4+    1 6h0  


   1.5  1.00000    -0.108833     0.999458 -0.000029  0.000034  0.000183  0.000176  0.000227  0.000000  0.000000  0.000000  0.000000
                                 0.000000  0.000000  0.000000  0.000000  0.000000  0.000000  0.000000  0.000000  0.000000  0.000000

 Natural orbitals saved to record    2200.2 (Orbital set 3)

 Orbital spaces for UNO-CAS (Min. occupation: 0.020  Max. occupation: 1.980):

 Closed:        1   0   0   0   0   0   0   0
 Active:        0   1   0   0   1   0   0   0

 No convergence



 **********************************************************************************************************************************
 DATASETS  * FILE   NREC   LENGTH (MB)   RECORD NAMES
              1      21       37.63       500      610      700      900      950      970     1000      129      960     1100   
                                          VAR    BASINP    GEOM    SYMINP    ZMAT    AOBASIS   BASIS     P2S    ABASIS      S 
                                         1400     1410     1420     1200     1210     1080     1600     1650     1300     1700   
                                         EKIN       V       ECP      H0       H01     AOSYM     SMH    MOLCAS    ERIS     OPER   
                                         1380   
                                         JKOP   

              2       7       10.62       700     1000      520     4202     5202     2101     2200   
                                         GEOM     BASIS   MCVARS     RHF     MCSCF     RHF      UHF  

 PROGRAMS   *        TOTAL       UHF       RHF     MULTI       RHF       INT
 CPU TIMES  *         2.74      0.04      0.03      0.22      0.23      2.07
 REAL TIME  *         6.89 SEC
 DISK USED  *        87.43 MB      
 **********************************************************************************************************************************
 SETTING SCF(I)         =        -3.67247774  AU                              


 PROGRAM * MRCC (General Multireference Coupled Cluster)    Author: M. Kallay, 2000-2005

 ***  Initialisation ***

   0 Spin projections
 
 Molecular orbitals read from record     2200.2  Type=UHF/ALPHA (state 1.6)

 ?Warning: UHF not converged
 Molecular orbitals read from record     2200.2  Type=UHF/BETA (state 1.6)

 ?Warning: UHF not converged
 
 Frozen orbitals:              0 (  0  0  0  0  0  0  0  0)
 Active orbitals:            126 ( 25 20 20 11 20 11 11  8)
 Active electrons:             4
 Spin quantum number:          1.0

 Transformed integrals will be written to file mrcc_15585/fort.55

 Load integrals                2.8 sec
 Transform integrals           5.4 sec
 Storage for integrals:       24278327
 Remaining memory:           487658069

 Core energy:               0.00000000
 
 MRCC Input:
     4     0     0     0     3     0     0     6     0     0     0     1     1     0     0     7     0     0   0.000     0    4096
  ex.lev,nsing,ntrip, rest,method,dens,conver,symm, diag, CS ,spatial, HF, ndoub,nacto,nactv, tol, maxex, sacc, freq,  dboc,   mem
  2  0  0  0  0  0  0  0  0  0  0  0  0  0  0  0  0  0  0  0  0  0  0  0  0  1  0  0  0  0  0  0  0  0  0  0  0  0  0  0  0  0  0  0  0  0  0  0  0  0  0  0  0  0  0  0  0  0  0  0  0  0  0  0  0  0  0  0  0  0  0  0  0  0  0  0  1  0  0  0  0  0  0  0  0  0  0  0  0  0  0  0  0  0  0  0  0  0  0  0  0  0  0  0  0  0  0  0  0  0  0  0  0  0  0  0  0  0  0  0  0  0  0  0  0  0
 MRCC Input end
 Variable memory released
 MRCC now being run, temporary output in /global/cscratch1/sd/aannabe/mrcc_15585/mrcc.out
 **********************************************************************
                          MRCC program system
 **********************************************************************

                              Written by
  Mihaly Kallay, Zoltan Rolik, Jozsef Csontos, Peter Nagy, Gyula Samu,
      David Mester, Jozsef Csoka, Bernat Szabo, Istvan Ladjanszki,
       Lorant Szegedy, Bence Ladoczki, Klara Petrov, Mate Farkas,
                    Pal D. Mezei, and Bence Hegely

        Department of Physical Chemistry and Materials Science
            Budapest University of Technology and Economics
                  Budapest P.O.Box 91, H-1521 Hungary

                              www.mrcc.hu

                       Release date: May 23, 2018

 ************************ 2018-10-30 19:21:28 *************************
 Executing goldstone...

 Generation of CC equations in terms of H and T...
 Generation of antisymmetrized Goldstone diagrams...
 Number of diagrams in T^1 equations:    15
 Number of diagrams in T^2 equations:    38
 Number of diagrams in T^3 equations:    49
 Number of diagrams in T^4 equations:     5
 Translation of diagrams to factorized equations...
 Optimizing intermediate calculation...
 Number of floating-point operations per iteration step:   7.6150E+10
 Probable CPU time per iteration step (hours):      0.76
 Required memory (Mbytes):   30783.6
 Number of intermediates:                                  80
 Number of intermediates to be stored:                     32
 Length of intermediate file (Mbytes):     492.9

 ************************ 2018-10-30 19:21:28 *************************
 Executing xmrcc...

 **********************************************************************
 CC(3)(4) calculation


 Allocation of4096.0 Mbytes of memory...
 Number of spinorbitals:                   252
 Number of alpha electrons:                        3
 Number of beta electrons:                         1
 Spin multiplicity:                     2
 z-component of spin:  1.0
 Spatial symmetry:                      6
 Convergence criterion:  1.0E-07
 Construction of occupation graphs...
 Number of                     0 -fold excitations:                      1
 Number of                     1 -fold excitations:                     86
 Number of                     2 -fold excitations:                   8977
 Number of                     3 -fold excitations:                 389714
 Total number of configurations:                 398778
 Calculation of coupling coefficients...
 Length of intermediate file (Mbytes):     372.0

 ======================================================================

 Spin case  1   Alpha:  3   Beta:  1
 Number of excitations:                4723078
 Number of                     4 -fold excitations:                4723078

 Memory requirements /Mbyte/:
               Minimal        Optimal
 Real*8:        802.7682      1923.2150
 Integer:        80.1863
 Total:         882.9545      2003.4013


 ************************ 2018-10-30 19:21:37 *************************
 Executing mrcc...

 **********************************************************************
 CCSDT(Q) calculation


 Allocation of 1923.2 Mbytes of memory...
 Number of spinorbitals: 252
 Number of alpha electrons:  3
 Number of beta  electrons:  1
 Spin multiplicity: 2
 z-component of spin:  1.0
 Spatial symmetry: 6
 Convergence criterion:  1.0E-07
 Construction of occupation graphs...
 Number of 0-fold excitations: 1
 Number of 1-fold excitations: 86
 Number of 2-fold excitations: 8977
 Number of 3-fold excitations: 389714
 Total number of determinants: 398778
 Calculation of coupling coefficients...
 Initial cluster amplitudes are generated.
 Length of intermediate file (Mbytes):     372.0
 Reading integral list from unit 55...
 Sorting integrals...
 Sorting integrals...
 Sorting integrals...
 Sorting integrals...
 Energy of reference determinant [au]:      -3.672477743753
 Calculation of MP denominators...

 Starting CC iteration...
 ======================================================================
 Norm of residual vector:     0.38349404
 CPU time [min]:     1.370                   Wall time [min]:     1.380

 Iteration  1  CC energy:    -3.74312159  Energy decrease:   0.07064385
 ======================================================================
 Norm of residual vector:     0.12256699
 CPU time [min]:     1.937                   Wall time [min]:     1.958

 Iteration  2  CC energy:    -3.75341294  Energy decrease:   0.01029135
 ======================================================================
 Norm of residual vector:     0.03933060
 CPU time [min]:     2.512                   Wall time [min]:     2.536

 Iteration  3  CC energy:    -3.76097115  Energy decrease:   0.00755821
 ======================================================================
 Norm of residual vector:     0.01088410
 CPU time [min]:     3.091                   Wall time [min]:     3.120

 Iteration  4  CC energy:    -3.76108247  Energy decrease:   0.00011133
 ======================================================================
 Norm of residual vector:     0.00313249
 CPU time [min]:     3.678                   Wall time [min]:     3.713

 Iteration  5  CC energy:    -3.76125978  Energy decrease:   0.00017730
 ======================================================================
 Norm of residual vector:     0.00103076
 CPU time [min]:     4.257                   Wall time [min]:     4.301

 Iteration  6  CC energy:    -3.76125186  Energy decrease:   0.00000791
 ======================================================================
 Norm of residual vector:     0.00032116
 CPU time [min]:     4.838                   Wall time [min]:     4.887

 Iteration  7  CC energy:    -3.76123678  Energy decrease:   0.00001508
 ======================================================================
 Norm of residual vector:     0.00010534
 CPU time [min]:     5.417                   Wall time [min]:     5.483

 Iteration  8  CC energy:    -3.76123990  Energy decrease:   0.00000312
 ======================================================================
 Norm of residual vector:     0.00003623
 CPU time [min]:     5.996                   Wall time [min]:     6.064

 Iteration  9  CC energy:    -3.76124109  Energy decrease:   0.00000119
 ======================================================================
 Norm of residual vector:     0.00001367
 CPU time [min]:     6.573                   Wall time [min]:     6.644

 Iteration 10  CC energy:    -3.76124046  Energy decrease:   0.00000063
 ======================================================================
 Norm of residual vector:     0.00000490
 CPU time [min]:     7.154                   Wall time [min]:     7.230

 Iteration 11  CC energy:    -3.76124050  Energy decrease:   0.00000004
 ======================================================================
 Norm of residual vector:     0.00000170
 CPU time [min]:     7.735                   Wall time [min]:     7.813

 Iteration 12  CC energy:    -3.76124057  Energy decrease:   0.00000006
 ======================================================================
 Norm of residual vector:     0.00000061
 CPU time [min]:     8.318                   Wall time [min]:     8.410

 Iteration 13  CC energy:    -3.76124054  Energy decrease:   0.00000003
 ======================================================================
 Norm of residual vector:     0.00000019
 CPU time [min]:     8.903                   Wall time [min]:     9.006

 Iteration 14  CC energy:    -3.76124054  Energy decrease:   2.0116E-09
 ======================================================================
 Norm of residual vector:     0.00000005
 CPU time [min]:     9.476                   Wall time [min]:     9.580

 Iteration 15  CC energy:    -3.76124054  Energy decrease:   5.6168E-10
 ======================================================================

 Iteration has converged in 15 steps.

 Final results:
 Total CCSDT energy [au]:             -3.761240543218
 Total MP2 energy [au]:               -3.743121590423

 Perturbative corrections are calculated...
 ======================================================================
 Spin case  1   Alpha:  3   Beta:  1
 Number of excitations:        4723078
 CPU time [min]:    55.745                   Wall time [min]:    55.857
 ======================================================================
 Number of 4-fold excitations: 4723078
 CPU time [min]:    55.745                   Wall time [min]:    55.857

 Total CCSDT[Q] energy [au]:          -3.761270089298
 Total CCSDT(Q) energy [au]:          -3.761326732109

 ************************ 2018-10-30 20:17:30 *************************
                      Normal termination of mrcc.
 **********************************************************************
 !CCSDT STATE 1.6 Energy               -3.761240543218
 !MP2 STATE 1.6 Energy                 -3.743121590423
 !CCSDT[Q] STATE 1.6 Energy            -3.761270089298
 !CCSDT(Q) STATE 1.6 Energy            -3.761326732109
 
 CPU-time for MRCC:           3344.7 sec
 Elapsed-time for MRCC:       3364.2 sec

 Variable memory set to  512000000 words,  buffer space   230000 words



 **********************************************************************************************************************************
 DATASETS  * FILE   NREC   LENGTH (MB)   RECORD NAMES
              1      21       37.63       500      610      700      900      950      970     1000      129      960     1100   
                                          VAR    BASINP    GEOM    SYMINP    ZMAT    AOBASIS   BASIS     P2S    ABASIS      S 
                                         1400     1410     1420     1200     1210     1080     1600     1650     1300     1700   
                                         EKIN       V       ECP      H0       H01     AOSYM     SMH    MOLCAS    ERIS     OPER   
                                         1380   
                                         JKOP   

              2       7       10.62       700     1000      520     4202     5202     2101     2200   
                                         GEOM     BASIS   MCVARS     RHF     MCSCF     RHF      UHF  

 PROGRAMS   *        TOTAL      MRCC       UHF       RHF     MULTI       RHF       INT
 CPU TIMES  *      3422.83   3420.09      0.04      0.03      0.22      0.23      2.07
 REAL TIME  *      3751.78 SEC
 DISK USED  *        87.43 MB      
 **********************************************************************************************************************************
 SETTING POSTHF(I)      =        -3.76132673  AU                              
                                                                                                                                                                                                                                                                

       SCF           POSTHF       EKIN          POT
    -3.67247774   -3.76132673   1.32889540   -1.91290950
                                                  

 CCSDT(Q)/USERDEF energy=     -3.761326732109

        CCSDT(Q)        RHF-SCF         MULTI           RHF-SCF 
     -3.76132673     -3.67247774     -3.67247774     -3.67255314
 **********************************************************************************************************************************
 Variable memory released
