
 Primary working directories    : /global/cscratch1/sd/aannabe
 Secondary working directories  : /global/cscratch1/sd/aannabe
 Wavefunction directory         : /global/homes/a/aannabe/wfu/
 Main file repository           : /global/cscratch1/sd/aannabe/

 SHA1      : 2873118e99aab1bc19f5b6fc1784693c06d15c95
 NAME      : 2015.1.8
 ARCHNAME  : linux/x86_64
 FC        : /opt/cray/pe/craype/2.5.5/bin/ftn
 BLASLIB   : -Wl,-_start-group /opt/intel/compilers_and_libraries_2016.3.210/linux/mkl/lib/intel64/libmkl_intel_ilp64.a /opt/intel/compilers_and_libraries_2016.3.210/linux/mkl/lib/intel64/libmkl_intel_thread.a /opt/intel/compilers_and_libraries_2016.3.210/linux/mkl/lib/intel64/libmkl_core.a -Wl,-_end-group
 id        : lbl

 Nodes     nprocs
 nid00492     1

 Using customized tuning parameters: mindgm=8; mindgv=16; mindgc=4; mindgr=1; noblas=0; minvec=7
 default implementation of scratch files=df  

 ***,N
 memory,8,g
 gthresh,twoint=1.e-12
 
 gprint,basis,orbitals
 gexpec,ekin,pot
 
 angstrom
 geometry={
 1                                                                               ! Number of atoms
 N 0.0 0.0 0.0
 }
 
 basis={
 Including file /global/homes/a/aannabe/docs/totals/pps/N.pp
 Including file /global/homes/a/aannabe/docs/totals/basis/aug-cc-pVnZ/N_dz.basis
 }
 
 {hf
 wf,5,8,3
 occ,1,1,1,0,1,0,0,0
                                                                                 !open,1.3
 closed,1,0,0,0,0,0,0,0
                                                                                 !sym,
 }
 scf(i)=energy
 
 _CC_NORM_MAX=2.0
  !NOTE: Perturbative MRCC works only with UHF reference. So, here we will trick MRCC by doing zero UHF iteration right after ROHF.
 
 {uhf
 wf,5,8,3
 occ,1,1,1,0,1,0,0,0
                                                                                 !open,1.3
 closed,1,0,0,0,0,0,0,0
                                                                                 !sym,
 maxit,0
 }
 scf(i)=energy
 
 {mrcc,method=CCSDT(Q)
 orbital,ignore_error=1                                                          !Ignore the fact that UHF WF is not converged
 maxit,100
 core
 }
 posthf(i)=energy
 
 table,scf,posthf,ekin,pot
 save,2.csv,new
 
 

 Variables initialized (889), CPU time= 0.01 sec
 Commands  initialized (702), CPU time= 0.01 sec, 572 directives.
 Default parameters read. Elapsed time= 0.13 sec

 Checking input...
 Passed
1


                                         ***  PROGRAM SYSTEM MOLPRO  ***
                                       Copyright, TTI GmbH Stuttgart, 2015
                                    Version 2015.1 linked Sep  7 2016 23:09:38


 **********************************************************************************************************************************
 LABEL *   N                                                                             
  64 bit serial version                                                                  DATE: 15-Jun-18          TIME: 16:21:17  
 **********************************************************************************************************************************

 SHA1:             2873118e99aab1bc19f5b6fc1784693c06d15c95
 **********************************************************************************************************************************

 THRESHOLDS:

 ZERO    =  1.00D-12  ONEINT  =  1.00D-12  TWOINT  =  1.00D-12  PREFAC  =  1.00D-14  LOCALI  =  1.00D-09  EORDER  =  1.00D-04
 ENERGY  =  0.00D+00  ETEST   =  0.00D+00  EDENS   =  0.00D+00  THRDEDEF=  1.00D-06  GRADIENT=  1.00D-02  STEP    =  1.00D-03
 ORBITAL =  1.00D-05  CIVEC   =  1.00D-05  COEFF   =  1.00D-04  PRINTCI =  5.00D-02  PUNCHCI =  9.90D+01  OPTGRAD =  3.00D-04
 OPTENERG=  1.00D-06  OPTSTEP =  3.00D-04  THRGRAD =  1.00D-10  COMPRESS=  1.00D-11  VARMIN  =  1.00D-07  VARMAX  =  1.00D-03
 THRDOUB =  0.00D+00  THRDIV  =  1.00D-05  THRRED  =  1.00D-07  THRPSP  =  1.00D+00  THRDC   =  1.00D-10  THRCS   =  1.00D-10
 THRNRM  =  1.00D-08  THREQ   =  0.00D+00  THRDE   =  1.00D+00  THRREF  =  1.00D-05  SPARFAC =  1.00D+00  THRDLP  =  1.00D-07
 THRDIA  =  1.00D-10  THRDLS  =  1.00D-07  THRGPS  =  0.00D+00  THRKEX  =  0.00D+00  THRDIS  =  2.00D-01  THRVAR  =  1.00D-10
 THRLOC  =  1.00D-06  THRGAP  =  1.00D-06  THRLOCT = -1.00D+00  THRGAPT = -1.00D+00  THRORB  =  1.00D-06  THRMLTP =  0.00D+00
 THRCPQCI=  1.00D-10  KEXTA   =  0.00D+00  THRCOARS=  0.00D+00  SYMTOL  =  1.00D-06  GRADTOL =  1.00D-06  THROVL  =  1.00D-08
 THRORTH =  1.00D-08  GRID    =  1.00D-06  GRIDMAX =  1.00D-03  DTMAX   =  0.00D+00  THROCCDE=  1.00D-01  THROCCDE=  1.00D-01



 ZUNIT=ANG
 

Geometry recognized as XYZ


 Variable memory set to 8000000000 words,  buffer space   230000 words

 SETTING BASIS          =    USERDEF


 Recomputing integrals since basis changed


 Using spherical harmonics



 PROGRAM * SEWARD (Integral evaluation for generally contracted gaussian basis sets)     Author: Roland Lindh, 1990

 Geometry written to block  1 of record 700

 Orientation using atomic masses  
 Molecule type: Atom
 Symmetry elements: X,Y,Z
 Rotational constants:       0.0000000      0.0000000      0.0000000 GHz  (calculated with average atomic masses)

 Point group  D2h 



 ATOMIC COORDINATES

 NR  ATOM    CHARGE       X              Y              Z

   1  N       5.00    0.000000000    0.000000000    0.000000000


          N   CORE POTENTIAL

          p POTENTIAL

 POWERS             1              1              3              3              2              2
 EXPONENTIALS   12.91881       9.228250       12.96581       8.054770       12.54876       7.533600    
 COEFFICIENTS   3.250000       1.750000       41.98612       16.14945      -26.09522      -10.32626    

          s - p POTENTIAL

 POWERS             2              2
 EXPONENTIALS   9.416090       8.166940    
 COEFFICIENTS   34.77692       15.20330    


 BASIS DATA

   Nr Sym  Nuc  Type         Exponents   Contraction coefficients

    1.1 Ag    1  1s          42.693822    -0.000936
                             19.963207     0.006330
                              9.334597     0.010504
                              4.927819    -0.165374
                              2.040920    -0.000535
                              0.967080     0.245206
                              0.476131     0.458213
                              0.211443     0.364122
                              0.098869     0.062041
    2.1 Ag    1  1s           0.175123     1.000000
    3.1 Ag    1  1s           0.070049     1.000000
    4.1 Ag    1  3d0          0.832058     1.000000
    5.1 Ag    1  3d2+         0.832058     1.000000
    6.1 Ag    1  3d0          0.332823     1.000000
    7.1 Ag    1  3d2+         0.332823     1.000000
    1.2 B3u   1  2px         18.925871     0.007351
                              9.225603     0.029284
                              4.581431     0.065217
                              2.300164     0.140515
                              1.154825     0.232819
                              0.582039     0.298956
                              0.290535     0.280251
                              0.145867     0.152800
                              0.073234     0.035548
    2.2 B3u   1  2px          0.223042     1.000000
    3.2 B3u   1  2px          0.089217     1.000000
    1.3 B2u   1  2py         18.925871     0.007351
                              9.225603     0.029284
                              4.581431     0.065217
                              2.300164     0.140515
                              1.154825     0.232819
                              0.582039     0.298956
                              0.290535     0.280251
                              0.145867     0.152800
                              0.073234     0.035548
    2.3 B2u   1  2py          0.223042     1.000000
    3.3 B2u   1  2py          0.089217     1.000000
    1.4 B1g   1  3d2-         0.832058     1.000000
    2.4 B1g   1  3d2-         0.332823     1.000000
    1.5 B1u   1  2pz         18.925871     0.007351
                              9.225603     0.029284
                              4.581431     0.065217
                              2.300164     0.140515
                              1.154825     0.232819
                              0.582039     0.298956
                              0.290535     0.280251
                              0.145867     0.152800
                              0.073234     0.035548
    2.5 B1u   1  2pz          0.223042     1.000000
    3.5 B1u   1  2pz          0.089217     1.000000
    1.6 B2g   1  3d1+         0.832058     1.000000
    2.6 B2g   1  3d1+         0.332823     1.000000
    1.7 B3g   1  3d1-         0.832058     1.000000
    2.7 B3g   1  3d1-         0.332823     1.000000

 NUCLEAR CHARGE:                    5
 NUMBER OF PRIMITIVE AOS:          56
 NUMBER OF SYMMETRY AOS:           54
 NUMBER OF CONTRACTIONS:           22   (   7Ag  +   3B3u +   3B2u +   2B1g +   3B1u +   2B2g +   2B3g +   0Au  )
 NUMBER OF CORE ORBITALS:           0   (   0Ag  +   0B3u +   0B2u +   0B1g +   0B1u +   0B2g +   0B3g +   0Au  )
 NUMBER OF VALENCE ORBITALS:        4   (   1Ag  +   1B3u +   1B2u +   0B1g +   1B1u +   0B2g +   0B3g +   0Au  )


 NUCLEAR REPULSION ENERGY    0.00000000

 EXTRA SYMMETRY OF AOS IN SYMMETRY 1:   1 1 1 2 3 2 3

 Eigenvalues of metric

         1 0.321E-01 0.299E+00 0.299E+00 0.330E+00 0.170E+01 0.170E+01 0.264E+01
         2 0.105E+00 0.466E+00 0.243E+01
         3 0.105E+00 0.466E+00 0.243E+01
         4 0.299E+00 0.170E+01
         5 0.105E+00 0.466E+00 0.243E+01
         6 0.299E+00 0.170E+01
         7 0.299E+00 0.170E+01


 Contracted 2-electron integrals neglected if value below      1.0D-12
 AO integral compression algorithm  1   Integral accuracy      1.0D-12

     0.262 MB (compressed) written to integral file (100.0%)


 NUMBER OF SORTED TWO-ELECTRON INTEGRALS:       5272.     BUFFER LENGTH:  32768
 NUMBER OF SEGMENTS:   1  SEGMENT LENGTH:       5272      RECORD LENGTH: 524288

 Memory used in sort:       0.56 MW

 SORT1 READ       12220. AND WROTE        4734. INTEGRALS IN      1 RECORDS. CPU TIME:     0.00 SEC, REAL TIME:     0.00 SEC
 SORT2 READ        4734. AND WROTE        5272. INTEGRALS IN      1 RECORDS. CPU TIME:     0.00 SEC, REAL TIME:     0.01 SEC

 FILE SIZES:   FILE 1:    19.3 MBYTE,  FILE 4:     4.2 MBYTE,   TOTAL:     23.6 MBYTE

 OPERATOR DM      FOR CENTER  0  COORDINATES:    0.000000    0.000000    0.000000
 OPERATOR EKIN    FOR CENTER  0  COORDINATES:    0.000000    0.000000    0.000000
 OPERATOR POT     FOR CENTER  0  COORDINATES:    0.000000    0.000000    0.000000


 **********************************************************************************************************************************
 DATASETS  * FILE   NREC   LENGTH (MB)   RECORD NAMES
              1      20       19.12       500      610      700      900      950      970     1000      129      960     1100   
                                          VAR    BASINP    GEOM    SYMINP    ZMAT    AOBASIS   BASIS     P2S    ABASIS      S 
                                         1400     1410     1420     1200     1210     1080     1600     1650     1300     1700   
                                         EKIN       V       ECP      H0       H01     AOSYM     SMH    MOLCAS    ERIS     OPER   

 PROGRAMS   *        TOTAL       INT
 CPU TIMES  *         2.02      1.89
 REAL TIME  *        12.56 SEC
 DISK USED  *        23.83 MB      
 **********************************************************************************************************************************


 PROGRAM * RHF-SCF (OPEN SHELL)       Authors: W. Meyer, H.-J. Werner


 NUMBER OF ELECTRONS:       4+    1-    SPACE SYMMETRY=8    SPIN SYMMETRY: Quartet 
 CONVERGENCE THRESHOLDS:    1.00E-05 (Density)    1.00E-07 (Energy)
 MAX. NUMBER OF ITERATIONS:       60
 INTERPOLATION TYPE:            DIIS
 INTERPOLATION STEPS:              2 (START)      1 (STEP)
 LEVEL SHIFTS:                 -0.60 (CLOSED) -0.30 (OPEN) 

 Number of closed-shell orbitals:    1 (   1   0   0   0   0   0   0 )
 Number of open-shell orbitals:      3 (   0   1   1   0   1   0   0 )



   Atom=N  basis=ECP2MWB_GUESS     lmin=0  lmax=1

 Orbital guess generated from atomic densities. Full valence occupancy:    1   1   1   0   1   0   0   0


 Molecular orbital dump at record        2100.2

 ITERATION    DDIFF          GRAD             ENERGY        2-EL.EN.            DIPOLE MOMENTS         DIIS   ORB.
    1      0.000D+00      0.000D+00        -9.59004948     11.201718    0.00000    0.00000    0.00000    0    start
    2      0.000D+00      0.344D-01        -9.63013109     11.893579    0.00000    0.00000    0.00000    1    diag,B
    3      0.540D-01      0.780D-02        -9.63329576     12.034441    0.00000    0.00000    0.00000    2    diag,B
    4      0.130D-01      0.357D-02        -9.63386250     12.076837    0.00000    0.00000    0.00000    3    diag,B
    5      0.116D-01      0.372D-03        -9.63386635     12.074163    0.00000    0.00000    0.00000    4    diag,B
    6      0.809D-03      0.395D-04        -9.63386641     12.074686    0.00000    0.00000    0.00000    5    diag,B
    7      0.940D-04      0.372D-05        -9.63386641     12.074651    0.00000    0.00000    0.00000    6    fixocc
    8      0.975D-05      0.468D-06        -9.63386641     12.074643    0.00000    0.00000    0.00000    0    orth

 Final alpha occupancy:   1   1   1   0   1   0   0
 Final beta  occupancy:   1   0   0   0   0   0   0

 !RHF STATE 1.8 Energy                 -9.633866410009
 Nuclear energy                         0.00000000
 One-electron energy                  -15.67118794
 Two-electron energy                    6.03732153
 Virial quotient                       -1.41102629
 !RHF STATE 1.8 Dipole moment           0.00000000     0.00000000     0.00000000
 Dipole moment /Debye                   0.00000000     0.00000000     0.00000000
 

 !RHF expec          <1.8|EKIN|1.8>     6.827559843447
 
 !RHF expec           <1.8|POT|1.8>    -4.684410949072

 ELECTRON ORBITALS
 =================


   Orb  Occ    Energy  Couls-En    Coefficients

                                   1 1s      1 1s      1 1s      1 3d0     1 3d2+    1 3d0     1 3d2+ 

   1.1   2    -0.9437   -4.3503  1.000301 -0.000773  0.000606 -0.000000  0.000000  0.000000 -0.000000

                                   1 2px     1 2px     1 2px  

   1.2   +    -0.5697   -3.5224  0.999999  0.000008 -0.000010

                                   1 2py     1 2py     1 2py  

   1.3   +    -0.5697   -3.5224  0.999999  0.000008 -0.000010

                                   1 2pz     1 2pz     1 2pz  

   1.5   +    -0.5697   -3.5224  0.999999  0.000008 -0.000010

 HOMO      1.2    -0.569726 =     -15.5030eV
 LUMO      2.1     0.144162 =       3.9228eV
 LUMO-HOMO         0.713888 =      19.4259eV


 **********************************************************************************************************************************
 DATASETS  * FILE   NREC   LENGTH (MB)   RECORD NAMES
              1      20       19.12       500      610      700      900      950      970     1000      129      960     1100   
                                          VAR    BASINP    GEOM    SYMINP    ZMAT    AOBASIS   BASIS     P2S    ABASIS      S 
                                         1400     1410     1420     1200     1210     1080     1600     1650     1300     1700   
                                         EKIN       V       ECP      H0       H01     AOSYM     SMH    MOLCAS    ERIS     OPER   

              2       4        2.75       700     1000      520     2100   
                                         GEOM     BASIS   MCVARS     RHF  

 PROGRAMS   *        TOTAL        HF       INT
 CPU TIMES  *         2.06      0.04      1.89
 REAL TIME  *        12.69 SEC
 DISK USED  *        23.83 MB      
 **********************************************************************************************************************************
 SETTING SCF(I)         =        -9.63386641  AU                              
 SETTING _CC_NORM_MAX   =         2.00000000                                  


 PROGRAM * UHF-SCF       Authors: W. Meyer, H.-J. Werner


 NUMBER OF ELECTRONS:       4+    1-    SPACE SYMMETRY=8    SPIN SYMMETRY: Quartet 
 CONVERGENCE THRESHOLDS:    1.00E-05 (Density)    1.00E-07 (Energy)
 MAX. NUMBER OF ITERATIONS:        0
 INTERPOLATION TYPE:            DIIS
 INTERPOLATION STEPS:              2 (START)      1 (STEP)
 LEVEL SHIFTS:                  0.20 (ALPHA)   0.20 (BETA) 

 Number of closed-shell orbitals:    1 (   1   0   0   0   0   0   0 )
 Number of open-shell orbitals:      3 (   0   1   1   0   1   0   0 )


 Molecular orbitals read from record     2100.2  Type=RHF/CANONICAL (state 1.8)

 Molecular orbital dump at record        2200.2

 Initial alpha occupation   1   1   1   0   1   0   0
 Initial beta  occupation   1   0   0   0   0   0   0

 ITERATION    DDIFF          GRAD             ENERGY        2-EL.EN.            DIPOLE MOMENTS         DIIS
    1      0.000D+00      0.000D+00        -9.63386641     12.074643    0.00000    0.00000    0.00000    0
 
 Final alpha occupancy:   1   1   1   0   1   0   0
 Final beta  occupancy:   1   0   0   0   0   0   0

 !UHF STATE 1.8 Energy                 -9.633866410009
 Nuclear energy                         0.00000000
 One-electron energy                  -15.67118794
 Two-electron energy                    6.03732153
 Virial quotient                       -1.41102629
 !UHF STATE 1.8 Dipole moment           0.00000000     0.00000000     0.00000000
 Dipole moment /Debye                   0.00000000     0.00000000     0.00000000
 

 !UHF expec          <1.8|EKIN|1.8>     6.827559843447
 
 !UHF expec           <1.8|POT|1.8>    -4.684410949072

 ELECTRON ORBITALS FOR POSITIVE SPIN
 ===================================


   Orb  Occ    Energy  Couls-En    Coefficients

                                   1 1s      1 1s      1 1s      1 3d0     1 3d2+    1 3d0     1 3d2+ 

   1.1   +    -0.9437   -4.3503  1.000301 -0.000773  0.000606 -0.000000  0.000000  0.000000 -0.000000

                                   1 2px     1 2px     1 2px  

   1.2   +    -0.5697   -3.5224  0.999999  0.000008 -0.000010

                                   1 2py     1 2py     1 2py  

   1.3   +    -0.5697   -3.5224  0.999999  0.000008 -0.000010

                                   1 2pz     1 2pz     1 2pz  

   1.5   +    -0.5697   -3.5224  0.999999  0.000008 -0.000010

 ELECTRON ORBITALS FOR NEGATIVE SPIN
 ===================================


   Orb  Occ    Energy  Couls-En    Coefficients

                                   1 1s      1 1s      1 1s      1 3d0     1 3d2+    1 3d0     1 3d2+ 

   1.1   -    -0.9437   -4.3503  1.000301 -0.000773  0.000606 -0.000000  0.000000  0.000000 -0.000000

 HOMO      1.2    -0.569726 =     -15.5030eV
 LUMO     -1.2    -0.569726 =     -15.5030eV
 LUMO-HOMO         0.000000 =       0.0000eV

 EXPECTATION VALUE OF S**2:             3.75000000

 Occupation number threshold for canonical orbitals:  1.999000 (occupied),  0.001000 (virtual)

 Number of pseudo-canonical orbitals per symmetry:    1   0   0   0   0   0   0
 Number of active natural orbitals per symmetry:      0   1   1   0   1   0   0

 NATURAL CHARGE ORBITALS
 =======================


   Orb     Occ        Energy       Coefficients

                                   1 1s      1 1s      1 1s      1 3d0     1 3d2+    1 3d0     1 3d2+ 

   1.1  2.00000    -0.943682     1.000301 -0.000773  0.000606 -0.000000  0.000000  0.000000 -0.000000

                                   1 2px     1 2px     1 2px  

   1.2  1.00000    -0.182416     0.999999  0.000008 -0.000010

                                   1 2py     1 2py     1 2py  

   1.3  1.00000    -0.182416     0.999999  0.000008 -0.000010

                                   1 2pz     1 2pz     1 2pz  

   1.5  1.00000    -0.182416     0.999999  0.000008 -0.000010

 Natural orbitals saved to record    2200.2 (Orbital set 3)

 Orbital spaces for UNO-CAS (Min. occupation: 0.020  Max. occupation: 1.980):

 Closed:        1   0   0   0   0   0   0
 Active:        0   1   1   0   1   0   0

 No convergence



 **********************************************************************************************************************************
 DATASETS  * FILE   NREC   LENGTH (MB)   RECORD NAMES
              1      20       19.12       500      610      700      900      950      970     1000      129      960     1100   
                                          VAR    BASINP    GEOM    SYMINP    ZMAT    AOBASIS   BASIS     P2S    ABASIS      S 
                                         1400     1410     1420     1200     1210     1080     1600     1650     1300     1700   
                                         EKIN       V       ECP      H0       H01     AOSYM     SMH    MOLCAS    ERIS     OPER   

              2       5        5.25       700     1000      520     2100     2200   
                                         GEOM     BASIS   MCVARS     RHF      UHF  

 PROGRAMS   *        TOTAL       UHF        HF       INT
 CPU TIMES  *         2.08      0.02      0.04      1.89
 REAL TIME  *        12.96 SEC
 DISK USED  *        24.44 MB      
 **********************************************************************************************************************************
 SETTING SCF(I)         =        -9.63386641  AU                              


 PROGRAM * MRCC (General Multireference Coupled Cluster)    Author: M. Kallay, 2000-2005

 ***  Initialisation ***

   0 Spin projections
 
 Molecular orbitals read from record     2200.2  Type=UHF/ALPHA (state 1.8)

 ?Warning: UHF not converged
 Molecular orbitals read from record     2200.2  Type=UHF/BETA (state 1.8)

 ?Warning: UHF not converged
 
 Frozen orbitals:              0 (  0  0  0  0  0  0  0  0)
 Active orbitals:             22 (  7  3  3  2  3  2  2  0)
 Active electrons:             5
 Spin quantum number:          1.5

 Transformed integrals will be written to file mrcc_37781/fort.55

 Load integrals                2.1 sec
 Transform integrals           2.1 sec
 Storage for integrals:          28961
 Remaining memory:           *********

 Core energy:               0.00000000
 
 MRCC Input:
     4     0     0     0     3     0     0     8     0     0     0     1     1     0     0     7     0     0   0.000     0   64000
  ex.lev,nsing,ntrip, rest,method,dens,conver,symm, diag, CS ,spatial, HF, ndoub,nacto,nactv, tol, maxex, sacc, freq,  dboc,   mem
  2  0  0  0  0  0  0  1  0  0  1  0  0  0  0  1  0  0  0  0  0  0
 MRCC Input end
 Variable memory released
 MRCC now being run, temporary output in /global/cscratch1/sd/aannabe/mrcc_37781/mrcc.out
 **********************************************************************
                          MRCC program system
 **********************************************************************

                              Written by
  Mihaly Kallay, Zoltan Rolik, Jozsef Csontos, Peter Nagy, Gyula Samu,
      David Mester, Jozsef Csoka, Bernat Szabo, Istvan Ladjanszki,
       Lorant Szegedy, Bence Ladoczki, Klara Petrov, Mate Farkas,
                    Pal D. Mezei, and Bence Hegely

        Department of Physical Chemistry and Materials Science
            Budapest University of Technology and Economics
                  Budapest P.O.Box 91, H-1521 Hungary

                              www.mrcc.hu

                       Release date: May 23, 2018

 ************************ 2018-06-15 16:21:31 *************************
 Executing goldstone...

 Generation of CC equations in terms of H and T...
 Generation of antisymmetrized Goldstone diagrams...
 Number of diagrams in T^1 equations:    15
 Number of diagrams in T^2 equations:    38
 Number of diagrams in T^3 equations:    49
 Number of diagrams in T^4 equations:     5
 Translation of diagrams to factorized equations...
 Optimizing intermediate calculation...
 Number of floating-point operations per iteration step:   2.4994E+07
 Probable CPU time per iteration step (hours):      0.00
 Required memory (Mbytes):      19.5
 Number of intermediates:                                  79
 Number of intermediates to be stored:                     32
 Length of intermediate file (Mbytes):       0.6

 ************************ 2018-06-15 16:21:32 *************************
 Executing xmrcc...

 **********************************************************************
 CC(3)(4) calculation


 Allocation of 100.0 Mbytes of memory...
 Number of spinorbitals:                    44
 Number of alpha electrons:                        4
 Number of beta electrons:                         1
 Spin multiplicity:                     2
 z-component of spin:  1.5
 Spatial symmetry:                      8
 Convergence criterion:  1.0E-07
 Construction of occupation graphs...
 Number of                     0 -fold excitations:                      1
 Number of                     1 -fold excitations:                     18
 Number of                     2 -fold excitations:                    336
 Number of                     3 -fold excitations:                   2831
 Total number of configurations:                   3186
 Calculation of coupling coefficients...
 Length of intermediate file (Mbytes):       0.7

 ======================================================================

 Spin case  1   Alpha:  3   Beta:  1
 Number of excitations:                   8640
 Spin case  2   Alpha:  4   Beta:  0
 Number of excitations:                    420
 Number of                     4 -fold excitations:                   9060

 Memory requirements /Mbyte/:
               Minimal        Optimal
 Real*8:         13.8458        13.8497
 Integer:         3.7082
 Total:          17.5540        17.5579


 ************************ 2018-06-15 16:21:32 *************************
 Executing mrcc...

 **********************************************************************
 CCSDT(Q) calculation


 OpenMP parallel version is running.
 Number of CPUs:   1
 Allocation of   13.8 Mbytes of memory...
 Number of spinorbitals:  44
 Number of alpha electrons:  4
 Number of beta  electrons:  1
 Spin multiplicity: 2
 z-component of spin:  1.5
 Spatial symmetry: 8
 Convergence criterion:  1.0E-07
 Construction of occupation graphs...
 Number of 0-fold excitations: 1
 Number of 1-fold excitations: 18
 Number of 2-fold excitations: 336
 Number of 3-fold excitations: 2831
 Total number of determinants: 3186
 Calculation of coupling coefficients...
 Initial cluster amplitudes are generated.
 Length of intermediate file (Mbytes):       0.7
 Reading integral list from unit 55...
 Sorting integrals...
 Sorting integrals...
 Sorting integrals...
 Sorting integrals...
 Energy of reference determinant [au]:      -9.633866410009
 Calculation of MP denominators...

 Starting CC iteration...
 ======================================================================
 Norm of residual vector:     0.53023862
 CPU time [min]:     0.003                   Wall time [min]:     0.003

 Iteration  1  CC energy:    -9.71108621  Energy decrease:   0.07721980
 ======================================================================
 Norm of residual vector:     0.11655996
 CPU time [min]:     0.004                   Wall time [min]:     0.004

 Iteration  2  CC energy:    -9.72746074  Energy decrease:   0.01637453
 ======================================================================
 Norm of residual vector:     0.02448417
 CPU time [min]:     0.006                   Wall time [min]:     0.006

 Iteration  3  CC energy:    -9.72954467  Energy decrease:   0.00208392
 ======================================================================
 Norm of residual vector:     0.00627620
 CPU time [min]:     0.007                   Wall time [min]:     0.007

 Iteration  4  CC energy:    -9.72982696  Energy decrease:   0.00028229
 ======================================================================
 Norm of residual vector:     0.00226960
 CPU time [min]:     0.008                   Wall time [min]:     0.009

 Iteration  5  CC energy:    -9.72982319  Energy decrease:   0.00000377
 ======================================================================
 Norm of residual vector:     0.00080066
 CPU time [min]:     0.010                   Wall time [min]:     0.010

 Iteration  6  CC energy:    -9.72981800  Energy decrease:   0.00000519
 ======================================================================
 Norm of residual vector:     0.00030186
 CPU time [min]:     0.011                   Wall time [min]:     0.012

 Iteration  7  CC energy:    -9.72982452  Energy decrease:   0.00000651
 ======================================================================
 Norm of residual vector:     0.00006902
 CPU time [min]:     0.013                   Wall time [min]:     0.013

 Iteration  8  CC energy:    -9.72982563  Energy decrease:   0.00000112
 ======================================================================
 Norm of residual vector:     0.00001816
 CPU time [min]:     0.014                   Wall time [min]:     0.015

 Iteration  9  CC energy:    -9.72982525  Energy decrease:   0.00000038
 ======================================================================
 Norm of residual vector:     0.00000506
 CPU time [min]:     0.016                   Wall time [min]:     0.016

 Iteration 10  CC energy:    -9.72982520  Energy decrease:   0.00000006
 ======================================================================
 Norm of residual vector:     0.00000093
 CPU time [min]:     0.017                   Wall time [min]:     0.017

 Iteration 11  CC energy:    -9.72982521  Energy decrease:   0.00000001
 ======================================================================
 Norm of residual vector:     0.00000020
 CPU time [min]:     0.019                   Wall time [min]:     0.019

 Iteration 12  CC energy:    -9.72982521  Energy decrease:   1.5687E-09
 ======================================================================
 Norm of residual vector:     0.00000003
 CPU time [min]:     0.020                   Wall time [min]:     0.020

 Iteration 13  CC energy:    -9.72982521  Energy decrease:   1.4297E-10
 ======================================================================

 Iteration has converged in 13 steps.

 Final results:
 Total CCSDT energy [au]:             -9.729825207665
 Total MP2 energy [au]:               -9.711086214286

 Perturbative corrections are calculated...
 ======================================================================
 Spin case  1   Alpha:  3   Beta:  1
 Number of excitations:        8640
 CPU time [min]:     0.033                   Wall time [min]:     0.033
 ======================================================================
 Spin case  2   Alpha:  4   Beta:  0
 Number of excitations:        420
 CPU time [min]:     0.034                   Wall time [min]:     0.035
 ======================================================================
 Number of 4-fold excitations: 9060
 CPU time [min]:     0.034                   Wall time [min]:     0.035

 Total CCSDT[Q] energy [au]:          -9.729830019446
 Total CCSDT(Q) energy [au]:          -9.729852700112

 ************************ 2018-06-15 16:21:34 *************************
                      Normal termination of mrcc.
 **********************************************************************
 !CCSDT STATE 1.8 Energy               -9.729825207665
 !MP2 STATE 1.8 Energy                 -9.711086214286
 !CCSDT[Q] STATE 1.8 Energy            -9.729830019446
 !CCSDT(Q) STATE 1.8 Energy            -9.729852700112
 
 CPU-time for MRCC:              2.0 sec
 Elapsed-time for MRCC:          4.1 sec

 Variable memory set to 8000000000 words,  buffer space   230000 words



 **********************************************************************************************************************************
 DATASETS  * FILE   NREC   LENGTH (MB)   RECORD NAMES
              1      20       19.12       500      610      700      900      950      970     1000      129      960     1100   
                                          VAR    BASINP    GEOM    SYMINP    ZMAT    AOBASIS   BASIS     P2S    ABASIS      S 
                                         1400     1410     1420     1200     1210     1080     1600     1650     1300     1700   
                                         EKIN       V       ECP      H0       H01     AOSYM     SMH    MOLCAS    ERIS     OPER   

              2       5        5.25       700     1000      520     2100     2200   
                                         GEOM     BASIS   MCVARS     RHF      UHF  

 PROGRAMS   *        TOTAL      MRCC       UHF        HF       INT
 CPU TIMES  *         4.18      2.10      0.02      0.04      1.89
 REAL TIME  *        17.64 SEC
 DISK USED  *        24.44 MB      
 **********************************************************************************************************************************
 SETTING POSTHF(I)      =        -9.72985270  AU                              
                                                                                                                                                                                                                                                                

       SCF           POSTHF       EKIN          POT
    -9.63386641   -9.72985270   6.82755984   -4.68441095
                                                  

 CCSDT(Q)/USERDEF energy=     -9.729852700112

        CCSDT(Q)        UHF-SCF         HF-SCF  
     -9.72985270     -9.63386641     -9.63386641
 **********************************************************************************************************************************
 Variable memory released
