
 Primary working directories    : /global/cscratch1/sd/aannabe
 Secondary working directories  : /global/cscratch1/sd/aannabe
 Wavefunction directory         : /global/homes/a/aannabe/wfu/
 Main file repository           : /global/cscratch1/sd/aannabe/

 SHA1      : 2873118e99aab1bc19f5b6fc1784693c06d15c95
 NAME      : 2015.1.8
 ARCHNAME  : linux/x86_64
 FC        : /opt/cray/pe/craype/2.5.5/bin/ftn
 BLASLIB   : -Wl,-_start-group /opt/intel/compilers_and_libraries_2016.3.210/linux/mkl/lib/intel64/libmkl_intel_ilp64.a /opt/intel/compilers_and_libraries_2016.3.210/linux/mkl/lib/intel64/libmkl_intel_thread.a /opt/intel/compilers_and_libraries_2016.3.210/linux/mkl/lib/intel64/libmkl_core.a -Wl,-_end-group
 id        : lbl

 Nodes     nprocs
 nid00492     1

 Using customized tuning parameters: mindgm=8; mindgv=16; mindgc=4; mindgr=1; noblas=0; minvec=7
 default implementation of scratch files=df  

 ***,S
 memory,8,g
 gthresh,twoint=1.e-12
 
 gprint,basis,orbitals
 gexpec,ekin,pot
 
 angstrom
 geometry={
 1                                                                               ! Number of atoms
 S 0.0 0.0 0.0
 }
 
 basis={
 Including file /global/homes/a/aannabe/docs/accurate/ccECP_Kh/pps/S.pp
 Including file /global/homes/a/aannabe/docs/accurate/ccECP_Kh/basis/aug-cc-pVnZ/S_5z.basis
 }
 
 {rhf
  start,atden
  wf,6,7,2
  occ,1,1,1,0,1,0,0,0
  open,1.3,1.5
  orbital,4202.2
 }
 {multi
  maxiter,40
  start,4202.2
  occ,1,1,1,0,1,0,0,0
  closed,1,0,0,0,0,0,0
  wf,6,4,2;state,1
  wf,6,6,2;state,1
  wf,6,7,2;state,1
  natorb,ci,print
  orbital,5202.2
 }
 {rhf,nitord=1,maxit=0
  start,5202.2
  wf,6,7,2
  occ,1,1,1,0,1,0,0,0
  open,1.3,1.5
 }
 
 scf(i)=energy
 
 _CC_NORM_MAX=2.0
  !NOTE: Perturbative MRCC works only with UHF reference. So, here we will trick MRCC by doing zero UHF iteration right after ROHF.
 
 {uhf
 maxit,0
 }
 scf(i)=energy
 
 {mrcc,method=CCSDT(Q)
 orbital,ignore_error=1                                                          !Ignore the fact that UHF WF is not converged
 maxit,100
 core
 }
 posthf(i)=energy
 
 table,scf,posthf,ekin,pot
 save,5.csv,new
 
 

 Variables initialized (889), CPU time= 0.01 sec
 Commands  initialized (702), CPU time= 0.00 sec, 572 directives.
 Default parameters read. Elapsed time= 0.17 sec

 Checking input...
 Passed
1


                                         ***  PROGRAM SYSTEM MOLPRO  ***
                                       Copyright, TTI GmbH Stuttgart, 2015
                                    Version 2015.1 linked Sep  7 2016 23:09:38


 **********************************************************************************************************************************
 LABEL *   S                                                                             
  64 bit serial version                                                                  DATE: 30-Oct-18          TIME: 20:21:19  
 **********************************************************************************************************************************

 SHA1:             2873118e99aab1bc19f5b6fc1784693c06d15c95
 **********************************************************************************************************************************

 THRESHOLDS:

 ZERO    =  1.00D-12  ONEINT  =  1.00D-12  TWOINT  =  1.00D-12  PREFAC  =  1.00D-14  LOCALI  =  1.00D-09  EORDER  =  1.00D-04
 ENERGY  =  0.00D+00  ETEST   =  0.00D+00  EDENS   =  0.00D+00  THRDEDEF=  1.00D-06  GRADIENT=  1.00D-02  STEP    =  1.00D-03
 ORBITAL =  1.00D-05  CIVEC   =  1.00D-05  COEFF   =  1.00D-04  PRINTCI =  5.00D-02  PUNCHCI =  9.90D+01  OPTGRAD =  3.00D-04
 OPTENERG=  1.00D-06  OPTSTEP =  3.00D-04  THRGRAD =  1.00D-10  COMPRESS=  1.00D-11  VARMIN  =  1.00D-07  VARMAX  =  1.00D-03
 THRDOUB =  0.00D+00  THRDIV  =  1.00D-05  THRRED  =  1.00D-07  THRPSP  =  1.00D+00  THRDC   =  1.00D-10  THRCS   =  1.00D-10
 THRNRM  =  1.00D-08  THREQ   =  0.00D+00  THRDE   =  1.00D+00  THRREF  =  1.00D-05  SPARFAC =  1.00D+00  THRDLP  =  1.00D-07
 THRDIA  =  1.00D-10  THRDLS  =  1.00D-07  THRGPS  =  0.00D+00  THRKEX  =  0.00D+00  THRDIS  =  2.00D-01  THRVAR  =  1.00D-10
 THRLOC  =  1.00D-06  THRGAP  =  1.00D-06  THRLOCT = -1.00D+00  THRGAPT = -1.00D+00  THRORB  =  1.00D-06  THRMLTP =  0.00D+00
 THRCPQCI=  1.00D-10  KEXTA   =  0.00D+00  THRCOARS=  0.00D+00  SYMTOL  =  1.00D-06  GRADTOL =  1.00D-06  THROVL  =  1.00D-08
 THRORTH =  1.00D-08  GRID    =  1.00D-06  GRIDMAX =  1.00D-03  DTMAX   =  0.00D+00  THROCCDE=  1.00D-01  THROCCDE=  1.00D-01



 ZUNIT=ANG
 

Geometry recognized as XYZ


 Variable memory set to 8000000000 words,  buffer space   230000 words

 SETTING BASIS          =    USERDEF


 Recomputing integrals since basis changed


 Using spherical harmonics



 PROGRAM * SEWARD (Integral evaluation for generally contracted gaussian basis sets)     Author: Roland Lindh, 1990

 Geometry written to block  1 of record 700

 Orientation using atomic masses  
 Molecule type: Atom
 Symmetry elements: X,Y,Z
 Rotational constants:       0.0000000      0.0000000      0.0000000 GHz  (calculated with average atomic masses)

 Point group  D2h 



 ATOMIC COORDINATES

 NR  ATOM    CHARGE       X              Y              Z

   1  S       6.00    0.000000000    0.000000000    0.000000000


          S   CORE POTENTIAL

          d POTENTIAL

 POWERS             1              3              2
 EXPONENTIALS   6.151144       11.56157       5.390961    
 COEFFICIENTS   6.000000       36.90686      -19.81953    

          s - d POTENTIAL

 POWERS             2              2
 EXPONENTIALS   16.11769       3.608629    
 COEFFICIENTS   15.92575       38.51590    

          p - d POTENTIAL

 POWERS             2              2
 EXPONENTIALS   6.228956       2.978074    
 COEFFICIENTS   8.062221       18.73753    


 BASIS DATA

   Nr Sym  Nuc  Type         Exponents   Contraction coefficients

    1.1 Ag    1  1s          14.052570     0.002102
                              7.864913    -0.011042
                              4.401818     0.086618
                              2.463600    -0.271004
                              1.378823    -0.151274
                              0.771696     0.136044
                              0.431901     0.394360
                              0.241726     0.432098
                              0.135289     0.230974
                              0.075718     0.051205
    2.1 Ag    1  1s           1.063029     1.000000
    3.1 Ag    1  1s           0.493066     1.000000
    4.1 Ag    1  1s           0.228700     1.000000
    5.1 Ag    1  1s           0.106078     1.000000
    6.1 Ag    1  1s           0.052553     1.000000
    7.1 Ag    1  3d0          2.970037     1.000000
    8.1 Ag    1  3d2+         2.970037     1.000000
    9.1 Ag    1  3d0          1.199940     1.000000
   10.1 Ag    1  3d2+         1.199940     1.000000
   11.1 Ag    1  3d0          0.484794     1.000000
   12.1 Ag    1  3d2+         0.484794     1.000000
   13.1 Ag    1  3d0          0.195864     1.000000
   14.1 Ag    1  3d2+         0.195864     1.000000
   15.1 Ag    1  3d0          0.082302     1.000000
   16.1 Ag    1  3d2+         0.082302     1.000000
   17.1 Ag    1  5g0          1.084319     1.000000
   18.1 Ag    1  5g4+         1.084319     1.000000
   19.1 Ag    1  5g2+         1.084319     1.000000
   20.1 Ag    1  5g0          0.461540     1.000000
   21.1 Ag    1  5g4+         0.461540     1.000000
   22.1 Ag    1  5g2+         0.461540     1.000000
   23.1 Ag    1  5g0          0.216088     1.000000
   24.1 Ag    1  5g4+         0.216088     1.000000
   25.1 Ag    1  5g2+         0.216088     1.000000
    1.2 B3u   1  2px          6.808844    -0.003573
                              3.941560     0.001903
                              2.281723    -0.065016
                              1.320863     0.042305
                              0.764632     0.158772
                              0.442637     0.278172
                              0.256237     0.293821
                              0.148333     0.248015
                              0.085868     0.114905
                              0.049708     0.032934
    2.2 B3u   1  2px          2.340619     1.000000
    3.2 B3u   1  2px          1.091901     1.000000
    4.2 B3u   1  2px          0.509373     1.000000
    5.2 B3u   1  2px          0.237623     1.000000
    6.2 B3u   1  2px          0.130591     1.000000
    7.2 B3u   1  4f1+         1.247601     1.000000
    8.2 B3u   1  4f3+         1.247601     1.000000
    9.2 B3u   1  4f1+         0.566437     1.000000
   10.2 B3u   1  4f3+         0.566437     1.000000
   11.2 B3u   1  4f1+         0.257174     1.000000
   12.2 B3u   1  4f3+         0.257174     1.000000
   13.2 B3u   1  4f1+         0.114058     1.000000
   14.2 B3u   1  4f3+         0.114058     1.000000
   15.2 B3u   1  6h1+         0.868299     1.000000
   16.2 B3u   1  6h3+         0.868299     1.000000
   17.2 B3u   1  6h5+         0.868299     1.000000
   18.2 B3u   1  6h1+         0.457479     1.000000
   19.2 B3u   1  6h3+         0.457479     1.000000
   20.2 B3u   1  6h5+         0.457479     1.000000
    1.3 B2u   1  2py          6.808844    -0.003573
                              3.941560     0.001903
                              2.281723    -0.065016
                              1.320863     0.042305
                              0.764632     0.158772
                              0.442637     0.278172
                              0.256237     0.293821
                              0.148333     0.248015
                              0.085868     0.114905
                              0.049708     0.032934
    2.3 B2u   1  2py          2.340619     1.000000
    3.3 B2u   1  2py          1.091901     1.000000
    4.3 B2u   1  2py          0.509373     1.000000
    5.3 B2u   1  2py          0.237623     1.000000
    6.3 B2u   1  2py          0.130591     1.000000
    7.3 B2u   1  4f1-         1.247601     1.000000
    8.3 B2u   1  4f3-         1.247601     1.000000
    9.3 B2u   1  4f1-         0.566437     1.000000
   10.3 B2u   1  4f3-         0.566437     1.000000
   11.3 B2u   1  4f1-         0.257174     1.000000
   12.3 B2u   1  4f3-         0.257174     1.000000
   13.3 B2u   1  4f1-         0.114058     1.000000
   14.3 B2u   1  4f3-         0.114058     1.000000
   15.3 B2u   1  6h1-         0.868299     1.000000
   16.3 B2u   1  6h3-         0.868299     1.000000
   17.3 B2u   1  6h5-         0.868299     1.000000
   18.3 B2u   1  6h1-         0.457479     1.000000
   19.3 B2u   1  6h3-         0.457479     1.000000
   20.3 B2u   1  6h5-         0.457479     1.000000
    1.4 B1g   1  3d2-         2.970037     1.000000
    2.4 B1g   1  3d2-         1.199940     1.000000
    3.4 B1g   1  3d2-         0.484794     1.000000
    4.4 B1g   1  3d2-         0.195864     1.000000
    5.4 B1g   1  3d2-         0.082302     1.000000
    6.4 B1g   1  5g2-         1.084319     1.000000
    7.4 B1g   1  5g4-         1.084319     1.000000
    8.4 B1g   1  5g2-         0.461540     1.000000
    9.4 B1g   1  5g4-         0.461540     1.000000
   10.4 B1g   1  5g2-         0.216088     1.000000
   11.4 B1g   1  5g4-         0.216088     1.000000
    1.5 B1u   1  2pz          6.808844    -0.003573
                              3.941560     0.001903
                              2.281723    -0.065016
                              1.320863     0.042305
                              0.764632     0.158772
                              0.442637     0.278172
                              0.256237     0.293821
                              0.148333     0.248015
                              0.085868     0.114905
                              0.049708     0.032934
    2.5 B1u   1  2pz          2.340619     1.000000
    3.5 B1u   1  2pz          1.091901     1.000000
    4.5 B1u   1  2pz          0.509373     1.000000
    5.5 B1u   1  2pz          0.237623     1.000000
    6.5 B1u   1  2pz          0.130591     1.000000
    7.5 B1u   1  4f0          1.247601     1.000000
    8.5 B1u   1  4f2+         1.247601     1.000000
    9.5 B1u   1  4f0          0.566437     1.000000
   10.5 B1u   1  4f2+         0.566437     1.000000
   11.5 B1u   1  4f0          0.257174     1.000000
   12.5 B1u   1  4f2+         0.257174     1.000000
   13.5 B1u   1  4f0          0.114058     1.000000
   14.5 B1u   1  4f2+         0.114058     1.000000
   15.5 B1u   1  6h2+         0.868299     1.000000
   16.5 B1u   1  6h4+         0.868299     1.000000
   17.5 B1u   1  6h0          0.868299     1.000000
   18.5 B1u   1  6h2+         0.457479     1.000000
   19.5 B1u   1  6h4+         0.457479     1.000000
   20.5 B1u   1  6h0          0.457479     1.000000
    1.6 B2g   1  3d1+         2.970037     1.000000
    2.6 B2g   1  3d1+         1.199940     1.000000
    3.6 B2g   1  3d1+         0.484794     1.000000
    4.6 B2g   1  3d1+         0.195864     1.000000
    5.6 B2g   1  3d1+         0.082302     1.000000
    6.6 B2g   1  5g1+         1.084319     1.000000
    7.6 B2g   1  5g3+         1.084319     1.000000
    8.6 B2g   1  5g1+         0.461540     1.000000
    9.6 B2g   1  5g3+         0.461540     1.000000
   10.6 B2g   1  5g1+         0.216088     1.000000
   11.6 B2g   1  5g3+         0.216088     1.000000
    1.7 B3g   1  3d1-         2.970037     1.000000
    2.7 B3g   1  3d1-         1.199940     1.000000
    3.7 B3g   1  3d1-         0.484794     1.000000
    4.7 B3g   1  3d1-         0.195864     1.000000
    5.7 B3g   1  3d1-         0.082302     1.000000
    6.7 B3g   1  5g1-         1.084319     1.000000
    7.7 B3g   1  5g3-         1.084319     1.000000
    8.7 B3g   1  5g1-         0.461540     1.000000
    9.7 B3g   1  5g3-         0.461540     1.000000
   10.7 B3g   1  5g1-         0.216088     1.000000
   11.7 B3g   1  5g3-         0.216088     1.000000
    1.8 Au    1  4f2-         1.247601     1.000000
    2.8 Au    1  4f2-         0.566437     1.000000
    3.8 Au    1  4f2-         0.257174     1.000000
    4.8 Au    1  4f2-         0.114058     1.000000
    5.8 Au    1  6h4-         0.868299     1.000000
    6.8 Au    1  6h2-         0.868299     1.000000
    7.8 Au    1  6h4-         0.457479     1.000000
    8.8 Au    1  6h2-         0.457479     1.000000

 NUCLEAR CHARGE:                    6
 NUMBER OF PRIMITIVE AOS:         217
 NUMBER OF SYMMETRY AOS:          162
 NUMBER OF CONTRACTIONS:          126   (  25Ag  +  20B3u +  20B2u +  11B1g +  20B1u +  11B2g +  11B3g +   8Au  )
 NUMBER OF CORE ORBITALS:           0   (   0Ag  +   0B3u +   0B2u +   0B1g +   0B1u +   0B2g +   0B3g +   0Au  )
 NUMBER OF VALENCE ORBITALS:        4   (   1Ag  +   1B3u +   1B2u +   0B1g +   1B1u +   0B2g +   0B3g +   0Au  )


 NUCLEAR REPULSION ENERGY    0.00000000

 EXTRA SYMMETRY OF AOS IN SYMMETRY 1:   1 1 1 1 1 1 2 3 2 3   2 3 2 3 2 3 4 5 6 4   5 6 4 5 6
 EXTRA SYMMETRY OF AOS IN SYMMETRY 2:   1 1 1 1 1 1 2 3 2 3   2 3 2 3 4 5 6 4 5 6
 EXTRA SYMMETRY OF AOS IN SYMMETRY 3:   1 1 1 1 1 1 2 3 2 3   2 3 2 3 4 5 6 4 5 6
 EXTRA SYMMETRY OF AOS IN SYMMETRY 4:   1 1 1 1 1 2 3 2 3 2   3
 EXTRA SYMMETRY OF AOS IN SYMMETRY 5:   1 1 1 1 1 1 2 3 2 3   2 3 2 3 4 5 6 4 5 6
 EXTRA SYMMETRY OF AOS IN SYMMETRY 6:   1 1 1 1 1 2 3 2 3 2   3
 EXTRA SYMMETRY OF AOS IN SYMMETRY 7:   1 1 1 1 1 2 3 2 3 2   3
 EXTRA SYMMETRY OF AOS IN SYMMETRY 8:   1 1 1 1 2 3 2 3

 Eigenvalues of metric

         1 0.717E-03 0.395E-02 0.327E-01 0.533E-01 0.533E-01 0.177E+00 0.177E+00 0.177E+00
         2 0.546E-03 0.842E-02 0.549E-01 0.741E-01 0.741E-01 0.280E+00 0.280E+00 0.280E+00
         3 0.546E-03 0.842E-02 0.549E-01 0.741E-01 0.741E-01 0.280E+00 0.280E+00 0.280E+00
         4 0.533E-01 0.177E+00 0.177E+00 0.201E+00 0.623E+00 0.804E+00 0.804E+00 0.150E+01
         5 0.546E-03 0.842E-02 0.549E-01 0.741E-01 0.741E-01 0.280E+00 0.280E+00 0.280E+00
         6 0.533E-01 0.177E+00 0.177E+00 0.201E+00 0.623E+00 0.804E+00 0.804E+00 0.150E+01
         7 0.533E-01 0.177E+00 0.177E+00 0.201E+00 0.623E+00 0.804E+00 0.804E+00 0.150E+01
         8 0.741E-01 0.280E+00 0.280E+00 0.362E+00 0.115E+01 0.172E+01 0.172E+01 0.242E+01


 Contracted 2-electron integrals neglected if value below      1.0D-12
 AO integral compression algorithm  1   Integral accuracy      1.0D-12

     30.933 MB (compressed) written to integral file ( 55.0%)


 NUMBER OF SORTED TWO-ELECTRON INTEGRALS:    4156552.     BUFFER LENGTH:  32768
 NUMBER OF SEGMENTS:   1  SEGMENT LENGTH:    4156552      RECORD LENGTH: 524288

 Memory used in sort:       4.71 MW

 SORT1 READ     6989366. AND WROTE     2907704. INTEGRALS IN      9 RECORDS. CPU TIME:     0.24 SEC, REAL TIME:     0.33 SEC
 SORT2 READ     2907704. AND WROTE     4156552. INTEGRALS IN    118 RECORDS. CPU TIME:     0.21 SEC, REAL TIME:     0.41 SEC

 FILE SIZES:   FILE 1:    50.4 MBYTE,  FILE 4:    37.8 MBYTE,   TOTAL:     88.2 MBYTE

 OPERATOR DM      FOR CENTER  0  COORDINATES:    0.000000    0.000000    0.000000
 OPERATOR EKIN    FOR CENTER  0  COORDINATES:    0.000000    0.000000    0.000000
 OPERATOR POT     FOR CENTER  0  COORDINATES:    0.000000    0.000000    0.000000


 **********************************************************************************************************************************
 DATASETS  * FILE   NREC   LENGTH (MB)   RECORD NAMES
              1      20       37.92       500      610      700      900      950      970     1000      129      960     1100   
                                          VAR    BASINP    GEOM    SYMINP    ZMAT    AOBASIS   BASIS     P2S    ABASIS      S 
                                         1400     1410     1420     1200     1210     1080     1600     1650     1300     1700   
                                         EKIN       V       ECP      H0       H01     AOSYM     SMH    MOLCAS    ERIS     OPER   

 PROGRAMS   *        TOTAL       INT
 CPU TIMES  *         4.10      3.97
 REAL TIME  *        18.10 SEC
 DISK USED  *        88.48 MB      
 **********************************************************************************************************************************


 PROGRAM * RHF-SCF (OPEN SHELL)       Authors: W. Meyer, H.-J. Werner


 NUMBER OF ELECTRONS:       4+    2-    SPACE SYMMETRY=7    SPIN SYMMETRY: Triplet 
 CONVERGENCE THRESHOLDS:    1.00E-05 (Density)    1.00E-07 (Energy)
 MAX. NUMBER OF ITERATIONS:       60
 INTERPOLATION TYPE:            DIIS
 INTERPOLATION STEPS:              2 (START)      1 (STEP)
 LEVEL SHIFTS:                 -0.60 (CLOSED) -0.30 (OPEN) 


 Singly occupied orbitals:      1.3       1.5

   Atom=S  basis=ECP10MWB_GUESS    lmin=0  lmax=1

 Orbital guess generated from atomic densities. Full valence occupancy:    1   1   1   0   1   0   0   0


 Molecular orbital dump at record        4202.2

 ITERATION    DDIFF          GRAD             ENERGY        2-EL.EN.            DIPOLE MOMENTS         DIIS   ORB.
    1      0.000D+00      0.000D+00        -9.91250554     12.499249    0.00000    0.00000    0.00000    0    start
    2      0.000D+00      0.581D-02        -9.91941815     12.701521    0.00000    0.00000    0.00000    1    diag,B
    3      0.329D-01      0.175D-02        -9.92047860     12.774281    0.00000    0.00000    0.00000    2    diag,B
    4      0.190D-01      0.627D-03        -9.92062346     12.792809    0.00000    0.00000    0.00000    3    diag,B
    5      0.112D-01      0.125D-03        -9.92062817     12.793901    0.00000    0.00000    0.00000    4    diag,B
    6      0.297D-02      0.241D-04        -9.92062830     12.793878    0.00000    0.00000    0.00000    5    diag,B
    7      0.557D-03      0.445D-05        -9.92062831     12.793782    0.00000    0.00000    0.00000    6    fixocc
    8      0.254D-04      0.179D-05        -9.92062831     12.793767    0.00000    0.00000    0.00000    7    diag,B
    9      0.505D-04      0.533D-06        -9.92062831     12.793756    0.00000    0.00000    0.00000    8    diag,B
   10      0.246D-04      0.142D-06        -9.92062831     12.793755    0.00000    0.00000    0.00000    9    orth
   11      0.740D-05      0.226D-07        -9.92062831     12.793755    0.00000    0.00000    0.00000    0    orth

 Final alpha occupancy:   1   1   1   0   1   0   0   0
 Final beta  occupancy:   1   1   0   0   0   0   0   0

 !RHF STATE 1.7 Energy                 -9.920628308393
 Nuclear energy                         0.00000000
 One-electron energy                  -16.31750571
 Two-electron energy                    6.39687740
 Virial quotient                       -2.67848850
 !RHF STATE 1.7 Dipole moment           0.00000000     0.00000000     0.00000000
 Dipole moment /Debye                   0.00000000     0.00000000     0.00000000
 

 !RHF expec          <1.7|EKIN|1.7>     3.703815904700
 
 !RHF expec           <1.7|POT|1.7>    -3.636097225741

 ELECTRON ORBITALS
 =================


   Orb  Occ    Energy  Couls-En    Coefficients

                                   1 1s      1 1s      1 1s      1 1s      1 1s      1 1s      1 3d0     1 3d2+    1 3d0     1 3d2+ 
                                   1 3d0     1 3d2+    1 3d0     1 3d2+    1 3d0     1 3d2+    1 5g0     1 5g4+    1 5g2+    1 5g0  
                                   1 5g4+    1 5g2+    1 5g0     1 5g4+    1 5g2+ 

   1.1   2    -0.8838   -3.9817  1.000080  0.000030 -0.000162  0.000590 -0.000956  0.000422 -0.000253  0.000439 -0.000347  0.000601
                                -0.000031  0.000053 -0.002419  0.004190 -0.001060  0.001836 -0.000000 -0.000001  0.000000  0.000000
                                 0.000001 -0.000001 -0.000016 -0.000032  0.000024

                                   1 2px     1 2px     1 2px     1 2px     1 2px     1 2px     1 4f1+    1 4f3+    1 4f1+    1 4f3+ 
                                   1 4f1+    1 4f3+    1 4f1+    1 4f3+    1 6h1+    1 6h3+    1 6h5+    1 6h1+    1 6h3+    1 6h5+ 


   1.2   2    -0.3961   -2.9084  1.211224  0.015033 -0.021680 -0.086630 -0.093442 -0.038589  0.000777 -0.001003  0.002644 -0.003413
                                 0.003038 -0.003922  0.001209 -0.001561  0.000008 -0.000009  0.000012  0.000027 -0.000030  0.000040

                                   1 2py     1 2py     1 2py     1 2py     1 2py     1 2py     1 4f1-    1 4f3-    1 4f1-    1 4f3- 
                                   1 4f1-    1 4f3-    1 4f1-    1 4f3-    1 6h1-    1 6h3-    1 6h5-    1 6h1-    1 6h3-    1 6h5- 


   1.3   +    -0.4819   -3.0306  0.816273 -0.013200  0.018345  0.078019  0.083064  0.028475  0.000601 -0.002329  0.002055 -0.007957
                                 0.002103 -0.008145  0.000599 -0.002319  0.000011 -0.000034  0.000076  0.000023 -0.000075  0.000169

                                   1 2pz     1 2pz     1 2pz     1 2pz     1 2pz     1 2pz     1 4f0     1 4f2+    1 4f0     1 4f2+ 
                                   1 4f0     1 4f2+    1 4f0     1 4f2+    1 6h2+    1 6h4+    1 6h0     1 6h2+    1 6h4+    1 6h0  


   1.5   +    -0.4819   -3.0306  0.816273 -0.013200  0.018345  0.078019  0.083064  0.028475  0.001473 -0.001902  0.005033 -0.006497
                                 0.005151 -0.006650  0.001467 -0.001893 -0.000056  0.000048  0.000041 -0.000123  0.000107  0.000090

 HOMO      1.2    -0.396145 =     -10.7797eV
 LUMO      2.1     0.086275 =       2.3477eV
 LUMO-HOMO         0.482421 =      13.1273eV


 **********************************************************************************************************************************
 DATASETS  * FILE   NREC   LENGTH (MB)   RECORD NAMES
              1      20       37.92       500      610      700      900      950      970     1000      129      960     1100   
                                          VAR    BASINP    GEOM    SYMINP    ZMAT    AOBASIS   BASIS     P2S    ABASIS      S 
                                         1400     1410     1420     1200     1210     1080     1600     1650     1300     1700   
                                         EKIN       V       ECP      H0       H01     AOSYM     SMH    MOLCAS    ERIS     OPER   

              2       4        2.83       700     1000      520     4202   
                                         GEOM     BASIS   MCVARS     RHF  

 PROGRAMS   *        TOTAL       RHF       INT
 CPU TIMES  *         4.35      0.25      3.97
 REAL TIME  *        18.57 SEC
 DISK USED  *        88.48 MB      
 **********************************************************************************************************************************


 PROGRAM * MULTI (Direct Multiconfiguration SCF)       Authors: P.J. Knowles, H.-J. Werner (1984)     S.T. Elbert (1988)


 Number of closed-shell orbitals:   1 (   1   0   0   0   0   0   0   0 )
 Number of active  orbitals:        3 (   0   1   1   0   1   0   0   0 )
 Number of external orbitals:     122 (  24  19  19  11  19  11  11   8 )

 State symmetry 1

 Number of electrons:     4    Spin symmetry=Triplet   Space symmetry=4
 Number of states:        1
 Number of CSFs:          1   (1 determinants, 3 intermediate states)

 State symmetry 2

 Number of electrons:     4    Spin symmetry=Triplet   Space symmetry=6
 Number of states:        1
 Number of CSFs:          1   (1 determinants, 3 intermediate states)

 State symmetry 3

 Number of electrons:     4    Spin symmetry=Triplet   Space symmetry=7
 Number of states:        1
 Number of CSFs:          1   (1 determinants, 3 intermediate states)

 Iteration controls:
             1  2  3  4  5  6  7  8  9 10 11 12 13 14 15 16 17 18 19 20 21 22 23 24 25 26 27 28 29 30 31 32 33 34 35 36 37 38 39
 DIAGCI      T  T  T  T  T  T  T  T  T  T  T  T  T  T  T  T  T  T  T  T  T  T  T  T  T  T  T  T  T  T  T  T  T  T  T  T  T  T  T
 WERNER      T  T  T  T  T  T  T  T  T  T  T  T  T  T  T  T  T  T  T  T  T  T  T  T  T  T  T  T  T  T  T  T  T  T  T  T  T  T  T
 INTERNAL    F  T  T  T  T  T  T  T  T  T  T  T  T  T  T  T  T  T  T  T  T  T  T  T  T  T  T  T  T  T  T  T  T  T  T  T  T  T  T

 Molecular orbitals read from record     4202.2  Type=RHF/CANONICAL (state 1.7)
 *** IN SYMMETRY 1 ORBITAL  1 SYMMETRY CONTAMINATION OF 0.112D-01 HAS BEEN REMOVED

 EXTRA SYMMETRY OF MOS IN SYMMETRY 1:   1 1 2 3 1 2 3 4 5 6   2 3 1 4 5 6 2 3 1 4   5 6 2 3 1
 *** IN SYMMETRY 2 ORBITAL  1 SYMMETRY CONTAMINATION OF 0.119D-01 HAS BEEN REMOVED
 EXTRA SYMMETRY OF MOS IN SYMMETRY 2:   1 1 2 3 1 2 3 1 5 6   4 2 3 1 2 3 5 6 4 1
 *** IN SYMMETRY 3 ORBITAL  1 SYMMETRY CONTAMINATION OF 0.249D-01 HAS BEEN REMOVED
 EXTRA SYMMETRY OF MOS IN SYMMETRY 3:   1 1 2 3 1 2 3 1 4 2   5 6 3 1 2 3 4 5 6 1
 EXTRA SYMMETRY OF MOS IN SYMMETRY 4:   1 1 2 3 1 2 3 1 2 3   1
 *** IN SYMMETRY 5 ORBITAL  1 SYMMETRY CONTAMINATION OF 0.286D-01 HAS BEEN REMOVED
 EXTRA SYMMETRY OF MOS IN SYMMETRY 5:   1 1 2 3 1 2 3 1 6 2   5 4 3 1 2 3 6 5 4 1
 EXTRA SYMMETRY OF MOS IN SYMMETRY 6:   1 1 3 2 1 3 2 1 3 2   1
 EXTRA SYMMETRY OF MOS IN SYMMETRY 7:   1 1 2 3 1 2 3 1 2 3   1
 EXTRA SYMMETRY OF MOS IN SYMMETRY 8:   1 1 3 2 1 1 3 2

 Wavefunction dump at record             5202.2

 Convergence thresholds  0.10E-01 (gradient)  0.10E-05 (energy)  0.10E-02 (step length)

 Weight factors for state symmetry  1:    0.33333
 Weight factors for state symmetry  2:    0.33333
 Weight factors for state symmetry  3:    0.33333

 Number of orbital rotations:       81   (     0 Core/Active     24 Core/Virtual   0 Active/Active     57 Active/Virtual)
 Total number of variables:         84


 ITER. MIC  NCI  NEG     ENERGY(VAR)     ENERGY(PROJ)   ENERGY CHANGE     GRAD(0)  GRAD(ORB)   GRAD(CI)     STEP       TIME

   1   23   12    0      -9.91713529      -9.91821588   -0.00108059    0.03092776 0.00000000 0.00000000  0.40D-01      0.07
   2   13   12    0      -9.91821902      -9.91821905   -0.00000003    0.00018501 0.00000000 0.00000000  0.19D-03      0.10
   3   14   12    0      -9.91821905      -9.91821905    0.00000000    0.00000001 0.00000000 0.00000000  0.68D-08      0.15

 ** WVFN ****  CONVERGENCE REACHED, FINAL GRADIENT:  0.78D-13



 Results for state 1.4
 =====================

 !MCSCF STATE 1.4 Energy               -9.918219046871
 Nuclear energy                         0.00000000
 Kinetic energy                         3.70170464
 One electron energy                  -16.32072293
 Two electron energy                    6.40250388
 Virial ratio                           3.67936532

 !MCSCF STATE 1.4 Dipole moment         0.00000000     0.00000000     0.00000000
 Dipole moment /Debye                   0.00000000     0.00000000     0.00000000



 Results for state 1.6
 =====================

 !MCSCF STATE 1.6 Energy               -9.918219046871
 Nuclear energy                         0.00000000
 Kinetic energy                         3.70170464
 One electron energy                  -16.32072293
 Two electron energy                    6.40250388
 Virial ratio                           3.67936532

 !MCSCF STATE 1.6 Dipole moment         0.00000000     0.00000000     0.00000000
 Dipole moment /Debye                   0.00000000     0.00000000     0.00000000



 Results for state 1.7
 =====================

 !MCSCF STATE 1.7 Energy               -9.918219046871
 Nuclear energy                         0.00000000
 Kinetic energy                         3.70170464
 One electron energy                  -16.32072293
 Two electron energy                    6.40250388
 Virial ratio                           3.67936532

 !MCSCF STATE 1.7 Dipole moment         0.00000000     0.00000000     0.00000000
 Dipole moment /Debye                   0.00000000     0.00000000     0.00000000

 State-averaged charge density matrix saved on record  5202.2 (density set 1)

 !MCSCF expec        <1.4|EKIN|1.4>     3.701704637974
 !MCSCF expec        <1.6|EKIN|1.6>     3.701704637974
 !MCSCF expec        <1.7|EKIN|1.7>     3.701704637974

 !MCSCF expec         <1.4|POT|1.4>    -3.636267782983
 !MCSCF expec         <1.6|POT|1.6>    -3.636267782983
 !MCSCF expec         <1.7|POT|1.7>    -3.636267782983


 NATURAL ORBITALS (state averaged)
 =================================

   Orb     Occ        Energy       Coefficients

                                   1 1s      1 1s      1 1s      1 1s      1 1s      1 1s      1 3d0     1 3d2+    1 3d0     1 3d2+ 
                                   1 3d0     1 3d2+    1 3d0     1 3d2+    1 3d0     1 3d2+    1 5g0     1 5g4+    1 5g2+    1 5g0  
                                   1 5g4+    1 5g2+    1 5g0     1 5g4+    1 5g2+ 

   1.1  2.00000    -0.883648     1.000112  0.000124 -0.000340  0.000457 -0.000641  0.000334  0.000000  0.000000  0.000000  0.000000
                                 0.000000  0.000000  0.000000  0.000000  0.000000  0.000000  0.000000  0.000000  0.000000  0.000000
                                 0.000000  0.000000  0.000000  0.000000  0.000000

                                   1 2px     1 2px     1 2px     1 2px     1 2px     1 2px     1 4f1+    1 4f3+    1 4f1+    1 4f3+ 
                                   1 4f1+    1 4f3+    1 4f1+    1 4f3+    1 6h1+    1 6h3+    1 6h5+    1 6h1+    1 6h3+    1 6h5+ 


   1.2  1.33333    -0.283235     0.999876 -0.000006  0.000003  0.000064  0.000016  0.000057  0.000000  0.000000  0.000000  0.000000
                                 0.000000  0.000000  0.000000  0.000000  0.000000  0.000000  0.000000  0.000000  0.000000  0.000000

                                   1 2py     1 2py     1 2py     1 2py     1 2py     1 2py     1 4f1-    1 4f3-    1 4f1-    1 4f3- 
                                   1 4f1-    1 4f3-    1 4f1-    1 4f3-    1 6h1-    1 6h3-    1 6h5-    1 6h1-    1 6h3-    1 6h5- 


   1.3  1.33333    -0.283235     0.999876 -0.000006  0.000003  0.000064  0.000016  0.000057  0.000000  0.000000  0.000000  0.000000
                                 0.000000  0.000000  0.000000  0.000000  0.000000  0.000000  0.000000  0.000000  0.000000  0.000000

                                   1 2pz     1 2pz     1 2pz     1 2pz     1 2pz     1 2pz     1 4f0     1 4f2+    1 4f0     1 4f2+ 
                                   1 4f0     1 4f2+    1 4f0     1 4f2+    1 6h2+    1 6h4+    1 6h0     1 6h2+    1 6h4+    1 6h0  


   1.5  1.33333    -0.283235     0.999876 -0.000006  0.000003  0.000064  0.000016  0.000057  0.000000  0.000000  0.000000  0.000000
                                 0.000000  0.000000  0.000000  0.000000  0.000000  0.000000  0.000000  0.000000  0.000000  0.000000
 

 EXTRA SYMMETRY OF MOS IN SYMMETRY 1:   1 1 2 3 1 2 3 6 4 5   2 3 1 6 4 5 3 2 1 6   4 5 2 3 1
 EXTRA SYMMETRY OF MOS IN SYMMETRY 2:   1 1 3 2 1 3 2 1 6 5   4 3 2 1 3 2 5 4 6 1
 EXTRA SYMMETRY OF MOS IN SYMMETRY 3:   1 1 3 2 1 3 2 1 6 5   4 3 2 1 3 2 5 4 6 1
 EXTRA SYMMETRY OF MOS IN SYMMETRY 5:   1 1 3 2 1 3 2 1 6 4   5 3 2 1 3 2 6 4 5 1
 EXTRA SYMMETRY OF MOS IN SYMMETRY 7:   1 1 3 2 1 3 2 1 3 2   1
 EXTRA SYMMETRY OF MOS IN SYMMETRY 8:   1 1 2 3 1 1 2 3

 Natural orbital dump (state averaged) at molpro section  5202.2    (Orbital set 2)


 CI vector for state symmetry 1
 ==============================

 a a 2           1.0000000

 TOTAL ENERGIES                        -9.91821905

 CI vector for state symmetry 2
 ==============================

 a 2 a           1.0000000

 TOTAL ENERGIES                        -9.91821905

 CI vector for state symmetry 3
 ==============================

 2 a a           1.0000000

 TOTAL ENERGIES                        -9.91821905



 **********************************************************************************************************************************
 DATASETS  * FILE   NREC   LENGTH (MB)   RECORD NAMES
              1      21       38.22       500      610      700      900      950      970     1000      129      960     1100   
                                          VAR    BASINP    GEOM    SYMINP    ZMAT    AOBASIS   BASIS     P2S    ABASIS      S 
                                         1400     1410     1420     1200     1210     1080     1600     1650     1300     1700   
                                         EKIN       V       ECP      H0       H01     AOSYM     SMH    MOLCAS    ERIS     OPER   
                                         1380   
                                         JKOP   

              2       5        5.40       700     1000      520     4202     5202   
                                         GEOM     BASIS   MCVARS     RHF     MCSCF   

 PROGRAMS   *        TOTAL     MULTI       RHF       INT
 CPU TIMES  *         4.55      0.19      0.25      3.97
 REAL TIME  *        19.66 SEC
 DISK USED  *        88.48 MB      
 **********************************************************************************************************************************


 PROGRAM * RHF-SCF (OPEN SHELL)       Authors: W. Meyer, H.-J. Werner


 NUMBER OF ELECTRONS:       4+    2-    SPACE SYMMETRY=7    SPIN SYMMETRY: Triplet 
 CONVERGENCE THRESHOLDS:    1.00E-05 (Density)    1.00E-07 (Energy)
 MAX. NUMBER OF ITERATIONS:        0
 INTERPOLATION TYPE:            DIIS
 INTERPOLATION STEPS:              2 (START)      1 (STEP)
 LEVEL SHIFTS:                 -0.60 (CLOSED) -0.30 (OPEN) 


 Singly occupied orbitals:      1.3       1.5
 Molecular orbitals read from record     5202.2  Type=MCSCF/NATURAL (state averaged)

 Molecular orbital dump at record        2101.2

 ITERATION    DDIFF          GRAD             ENERGY        2-EL.EN.            DIPOLE MOMENTS         DIIS   ORB.
    1      0.000D+00      0.000D+00        -9.91821905     12.805008    0.00000    0.00000    0.00000    0    start

 Final alpha occupancy:   1   1   1   0   1   0   0   0
 Final beta  occupancy:   1   1   0   0   0   0   0   0

 !RHF STATE 1.7 Energy                 -9.918219046871
 Nuclear energy                         0.00000000
 One-electron energy                  -16.32072293
 Two-electron energy                    6.40250388
 Virial quotient                       -2.67936532
 !RHF STATE 1.7 Dipole moment           0.00000000     0.00000000     0.00000000
 Dipole moment /Debye                   0.00000000     0.00000000     0.00000000
 

 !RHF expec          <1.7|EKIN|1.7>     3.701704637974
 
 !RHF expec           <1.7|POT|1.7>    -3.636267782983

 ELECTRON ORBITALS
 =================


   Orb  Occ    Energy  Couls-En    Coefficients

                                   1 1s      1 1s      1 1s      1 1s      1 1s      1 1s      1 3d0     1 3d2+    1 3d0     1 3d2+ 
                                   1 3d0     1 3d2+    1 3d0     1 3d2+    1 3d0     1 3d2+    1 5g0     1 5g4+    1 5g2+    1 5g0  
                                   1 5g4+    1 5g2+    1 5g0     1 5g4+    1 5g2+ 

   1.1   2    -0.8836   -3.9815  1.000112  0.000124 -0.000340  0.000457 -0.000641  0.000334  0.000000  0.000000  0.000000  0.000000
                                 0.000000  0.000000  0.000000  0.000000  0.000000  0.000000  0.000000  0.000000  0.000000  0.000000
                                 0.000000  0.000000  0.000000  0.000000  0.000000

                                   1 2px     1 2px     1 2px     1 2px     1 2px     1 2px     1 4f1+    1 4f3+    1 4f1+    1 4f3+ 
                                   1 4f1+    1 4f3+    1 4f1+    1 4f3+    1 6h1+    1 6h3+    1 6h5+    1 6h1+    1 6h3+    1 6h5+ 


   1.2   2    -0.2832   -2.8145  0.999876 -0.000006  0.000003  0.000064  0.000016  0.000057  0.000000  0.000000  0.000000  0.000000
                                 0.000000  0.000000  0.000000  0.000000  0.000000  0.000000  0.000000  0.000000  0.000000  0.000000

                                   1 2py     1 2py     1 2py     1 2py     1 2py     1 2py     1 4f1-    1 4f3-    1 4f1-    1 4f3- 
                                   1 4f1-    1 4f3-    1 4f1-    1 4f3-    1 6h1-    1 6h3-    1 6h5-    1 6h1-    1 6h3-    1 6h5- 


   1.3   +    -0.2832   -2.8145  0.999876 -0.000006  0.000003  0.000064  0.000016  0.000057  0.000000  0.000000  0.000000  0.000000
                                 0.000000  0.000000  0.000000  0.000000  0.000000  0.000000  0.000000  0.000000  0.000000  0.000000

                                   1 2pz     1 2pz     1 2pz     1 2pz     1 2pz     1 2pz     1 4f0     1 4f2+    1 4f0     1 4f2+ 
                                   1 4f0     1 4f2+    1 4f0     1 4f2+    1 6h2+    1 6h4+    1 6h0     1 6h2+    1 6h4+    1 6h0  


   1.5   +    -0.2832   -2.8145  0.999876 -0.000006  0.000003  0.000064  0.000016  0.000057  0.000000  0.000000  0.000000  0.000000
                                 0.000000  0.000000  0.000000  0.000000  0.000000  0.000000  0.000000  0.000000  0.000000  0.000000

 HOMO      1.2    -0.283235 =      -7.7072eV
 LUMO      2.1     0.091145 =       2.4802eV
 LUMO-HOMO         0.374380 =      10.1874eV


 **********************************************************************************************************************************
 DATASETS  * FILE   NREC   LENGTH (MB)   RECORD NAMES
              1      21       38.22       500      610      700      900      950      970     1000      129      960     1100   
                                          VAR    BASINP    GEOM    SYMINP    ZMAT    AOBASIS   BASIS     P2S    ABASIS      S 
                                         1400     1410     1420     1200     1210     1080     1600     1650     1300     1700   
                                         EKIN       V       ECP      H0       H01     AOSYM     SMH    MOLCAS    ERIS     OPER   
                                         1380   
                                         JKOP   

              2       6        8.00       700     1000      520     4202     5202     2101   
                                         GEOM     BASIS   MCVARS     RHF     MCSCF     RHF  

 PROGRAMS   *        TOTAL       RHF     MULTI       RHF       INT
 CPU TIMES  *         4.58      0.04      0.19      0.25      3.97
 REAL TIME  *        19.91 SEC
 DISK USED  *        88.48 MB      
 **********************************************************************************************************************************
 SETTING SCF(I)         =        -9.91821905  AU                              
 SETTING _CC_NORM_MAX   =         2.00000000                                  


 PROGRAM * UHF-SCF       Authors: W. Meyer, H.-J. Werner


 NUMBER OF ELECTRONS:       4+    2-    SPACE SYMMETRY=7    SPIN SYMMETRY: Triplet 
 CONVERGENCE THRESHOLDS:    1.00E-05 (Density)    1.00E-07 (Energy)
 MAX. NUMBER OF ITERATIONS:        0
 INTERPOLATION TYPE:            DIIS
 INTERPOLATION STEPS:              2 (START)      1 (STEP)
 LEVEL SHIFTS:                  0.20 (ALPHA)   0.20 (BETA) 



 Molecular orbitals read from record     2101.2  Type=RHF/CANONICAL (state 1.7)

 Molecular orbital dump at record        2200.2

 Initial alpha occupation   1   1   1   0   1   0   0   0
 Initial beta  occupation   1   1   0   0   0   0   0   0

 ITERATION    DDIFF          GRAD             ENERGY        2-EL.EN.            DIPOLE MOMENTS         DIIS
    1      0.000D+00      0.000D+00        -9.91821905     12.805008    0.00000    0.00000    0.00000    0
 
 Final alpha occupancy:   1   1   1   0   1   0   0   0
 Final beta  occupancy:   1   1   0   0   0   0   0   0

 !UHF STATE 1.7 Energy                 -9.918219046871
 Nuclear energy                         0.00000000
 One-electron energy                  -16.32072293
 Two-electron energy                    6.40250388
 Virial quotient                       -2.67936532
 !UHF STATE 1.7 Dipole moment           0.00000000     0.00000000     0.00000000
 Dipole moment /Debye                   0.00000000     0.00000000     0.00000000
 

 !UHF expec          <1.7|EKIN|1.7>     3.701704637974
 
 !UHF expec           <1.7|POT|1.7>    -3.636267782983

 ELECTRON ORBITALS FOR POSITIVE SPIN
 ===================================


   Orb  Occ    Energy  Couls-En    Coefficients

                                   1 1s      1 1s      1 1s      1 1s      1 1s      1 1s      1 3d0     1 3d2+    1 3d0     1 3d2+ 
                                   1 3d0     1 3d2+    1 3d0     1 3d2+    1 3d0     1 3d2+    1 5g0     1 5g4+    1 5g2+    1 5g0  
                                   1 5g4+    1 5g2+    1 5g0     1 5g4+    1 5g2+ 

   1.1   +    -0.8836   -3.9815  1.000112  0.000124 -0.000340  0.000457 -0.000641  0.000334  0.000000  0.000000  0.000000  0.000000
                                 0.000000  0.000000  0.000000  0.000000  0.000000  0.000000  0.000000  0.000000  0.000000  0.000000
                                 0.000000  0.000000  0.000000  0.000000  0.000000

                                   1 2px     1 2px     1 2px     1 2px     1 2px     1 2px     1 4f1+    1 4f3+    1 4f1+    1 4f3+ 
                                   1 4f1+    1 4f3+    1 4f1+    1 4f3+    1 6h1+    1 6h3+    1 6h5+    1 6h1+    1 6h3+    1 6h5+ 


   1.2   +    -0.2832   -2.8145  0.999876 -0.000006  0.000003  0.000064  0.000016  0.000057  0.000000  0.000000  0.000000  0.000000
                                 0.000000  0.000000  0.000000  0.000000  0.000000  0.000000  0.000000  0.000000  0.000000  0.000000

                                   1 2py     1 2py     1 2py     1 2py     1 2py     1 2py     1 4f1-    1 4f3-    1 4f1-    1 4f3- 
                                   1 4f1-    1 4f3-    1 4f1-    1 4f3-    1 6h1-    1 6h3-    1 6h5-    1 6h1-    1 6h3-    1 6h5- 


   1.3   +    -0.2832   -2.8145  0.999876 -0.000006  0.000003  0.000064  0.000016  0.000057  0.000000  0.000000  0.000000  0.000000
                                 0.000000  0.000000  0.000000  0.000000  0.000000  0.000000  0.000000  0.000000  0.000000  0.000000

                                   1 2pz     1 2pz     1 2pz     1 2pz     1 2pz     1 2pz     1 4f0     1 4f2+    1 4f0     1 4f2+ 
                                   1 4f0     1 4f2+    1 4f0     1 4f2+    1 6h2+    1 6h4+    1 6h0     1 6h2+    1 6h4+    1 6h0  


   1.5   +    -0.2832   -2.8145  0.999876 -0.000006  0.000003  0.000064  0.000016  0.000057  0.000000  0.000000  0.000000  0.000000
                                 0.000000  0.000000  0.000000  0.000000  0.000000  0.000000  0.000000  0.000000  0.000000  0.000000

 ELECTRON ORBITALS FOR NEGATIVE SPIN
 ===================================


   Orb  Occ    Energy  Couls-En    Coefficients

                                   1 1s      1 1s      1 1s      1 1s      1 1s      1 1s      1 3d0     1 3d2+    1 3d0     1 3d2+ 
                                   1 3d0     1 3d2+    1 3d0     1 3d2+    1 3d0     1 3d2+    1 5g0     1 5g4+    1 5g2+    1 5g0  
                                   1 5g4+    1 5g2+    1 5g0     1 5g4+    1 5g2+ 

   1.1   -    -0.8836   -3.9815  1.000112  0.000124 -0.000340  0.000457 -0.000641  0.000334  0.000000  0.000000  0.000000  0.000000
                                 0.000000  0.000000  0.000000  0.000000  0.000000  0.000000  0.000000  0.000000  0.000000  0.000000
                                 0.000000  0.000000  0.000000  0.000000  0.000000

                                   1 2px     1 2px     1 2px     1 2px     1 2px     1 2px     1 4f1+    1 4f3+    1 4f1+    1 4f3+ 
                                   1 4f1+    1 4f3+    1 4f1+    1 4f3+    1 6h1+    1 6h3+    1 6h5+    1 6h1+    1 6h3+    1 6h5+ 


   1.2   -    -0.2832   -2.8145  0.999876 -0.000006  0.000003  0.000064  0.000016  0.000057  0.000000  0.000000  0.000000  0.000000
                                 0.000000  0.000000  0.000000  0.000000  0.000000  0.000000  0.000000  0.000000  0.000000  0.000000

 HOMO      1.2    -0.283235 =      -7.7072eV
 LUMO     -1.3    -0.283235 =      -7.7072eV
 LUMO-HOMO        -0.000000 =      -0.0000eV

 EXPECTATION VALUE OF S**2:             2.00000000

 Occupation number threshold for canonical orbitals:  1.999000 (occupied),  0.001000 (virtual)

 Number of pseudo-canonical orbitals per symmetry:    1   1   0   0   0   0   0   0
 Number of active natural orbitals per symmetry:      0   0   1   0   1   0   0   0

 NATURAL CHARGE ORBITALS
 =======================


   Orb     Occ        Energy       Coefficients

                                   1 1s      1 1s      1 1s      1 1s      1 1s      1 1s      1 3d0     1 3d2+    1 3d0     1 3d2+ 
                                   1 3d0     1 3d2+    1 3d0     1 3d2+    1 3d0     1 3d2+    1 5g0     1 5g4+    1 5g2+    1 5g0  
                                   1 5g4+    1 5g2+    1 5g0     1 5g4+    1 5g2+ 

   1.1  2.00000    -0.883648     1.000112  0.000124 -0.000340  0.000457 -0.000641  0.000334  0.000000  0.000000  0.000000  0.000000
                                 0.000000  0.000000  0.000000  0.000000  0.000000  0.000000  0.000000  0.000000  0.000000  0.000000
                                 0.000000  0.000000  0.000000  0.000000  0.000000

                                   1 2px     1 2px     1 2px     1 2px     1 2px     1 2px     1 4f1+    1 4f3+    1 4f1+    1 4f3+ 
                                   1 4f1+    1 4f3+    1 4f1+    1 4f3+    1 6h1+    1 6h3+    1 6h5+    1 6h1+    1 6h3+    1 6h5+ 


   1.2  2.00000    -0.283235     0.999876 -0.000006  0.000003  0.000064  0.000016  0.000057  0.000000  0.000000  0.000000  0.000000
                                 0.000000  0.000000  0.000000  0.000000  0.000000  0.000000  0.000000  0.000000  0.000000  0.000000

                                   1 2py     1 2py     1 2py     1 2py     1 2py     1 2py     1 4f1-    1 4f3-    1 4f1-    1 4f3- 
                                   1 4f1-    1 4f3-    1 4f1-    1 4f3-    1 6h1-    1 6h3-    1 6h5-    1 6h1-    1 6h3-    1 6h5- 


   1.3  1.00000    -0.226641     0.999876 -0.000006  0.000003  0.000064  0.000016  0.000057  0.000000  0.000000  0.000000  0.000000
                                 0.000000  0.000000  0.000000  0.000000  0.000000  0.000000  0.000000  0.000000  0.000000  0.000000

                                   1 2pz     1 2pz     1 2pz     1 2pz     1 2pz     1 2pz     1 4f0     1 4f2+    1 4f0     1 4f2+ 
                                   1 4f0     1 4f2+    1 4f0     1 4f2+    1 6h2+    1 6h4+    1 6h0     1 6h2+    1 6h4+    1 6h0  


   1.5  1.00000    -0.226641     0.999876 -0.000006  0.000003  0.000064  0.000016  0.000057  0.000000  0.000000  0.000000  0.000000
                                 0.000000  0.000000  0.000000  0.000000  0.000000  0.000000  0.000000  0.000000  0.000000  0.000000

 Natural orbitals saved to record    2200.2 (Orbital set 3)

 Orbital spaces for UNO-CAS (Min. occupation: 0.020  Max. occupation: 1.980):

 Closed:        1   1   0   0   0   0   0   0
 Active:        0   0   1   0   1   0   0   0

 No convergence



 **********************************************************************************************************************************
 DATASETS  * FILE   NREC   LENGTH (MB)   RECORD NAMES
              1      21       38.22       500      610      700      900      950      970     1000      129      960     1100   
                                          VAR    BASINP    GEOM    SYMINP    ZMAT    AOBASIS   BASIS     P2S    ABASIS      S 
                                         1400     1410     1420     1200     1210     1080     1600     1650     1300     1700   
                                         EKIN       V       ECP      H0       H01     AOSYM     SMH    MOLCAS    ERIS     OPER   
                                         1380   
                                         JKOP   

              2       7       10.62       700     1000      520     4202     5202     2101     2200   
                                         GEOM     BASIS   MCVARS     RHF     MCSCF     RHF      UHF  

 PROGRAMS   *        TOTAL       UHF       RHF     MULTI       RHF       INT
 CPU TIMES  *         4.62      0.04      0.04      0.19      0.25      3.97
 REAL TIME  *        20.13 SEC
 DISK USED  *        88.48 MB      
 **********************************************************************************************************************************
 SETTING SCF(I)         =        -9.91821905  AU                              


 PROGRAM * MRCC (General Multireference Coupled Cluster)    Author: M. Kallay, 2000-2005

 ***  Initialisation ***

   0 Spin projections
 
 Molecular orbitals read from record     2200.2  Type=UHF/ALPHA (state 1.7)

 ?Warning: UHF not converged
 Molecular orbitals read from record     2200.2  Type=UHF/BETA (state 1.7)

 ?Warning: UHF not converged
 
 Frozen orbitals:              0 (  0  0  0  0  0  0  0  0)
 Active orbitals:            126 ( 25 20 20 11 20 11 11  8)
 Active electrons:             6
 Spin quantum number:          1.0

 Transformed integrals will be written to file mrcc_55829/fort.55

 Load integrals                4.7 sec
 Transform integrals           7.4 sec
 Storage for integrals:       24278327
 Remaining memory:           *********

 Core energy:               0.00000000
 
 MRCC Input:
     4     0     0     0     3     0     0     7     0     0     0     1     1     0     0     7     0     0   0.000     0   64000
  ex.lev,nsing,ntrip, rest,method,dens,conver,symm, diag, CS ,spatial, HF, ndoub,nacto,nactv, tol, maxex, sacc, freq,  dboc,   mem
  2  0  0  0  0  0  0  0  0  0  0  0  0  0  0  0  0  0  0  0  0  0  0  0  0  2  0  0  0  0  0  0  0  0  0  0  0  0  0  0  0  0  0  0  0  1  0  0  0  0  0  0  0  0  0  0  0  0  0  0  0  0  0  0  0  0  0  0  0  0  0  0  0  0  0  0  1  0  0  0  0  0  0  0  0  0  0  0  0  0  0  0  0  0  0  0  0  0  0  0  0  0  0  0  0  0  0  0  0  0  0  0  0  0  0  0  0  0  0  0  0  0  0  0  0  0
 MRCC Input end
 Variable memory released
 MRCC now being run, temporary output in /global/cscratch1/sd/aannabe/mrcc_55829/mrcc.out
 **********************************************************************
                          MRCC program system
 **********************************************************************

                              Written by
  Mihaly Kallay, Zoltan Rolik, Jozsef Csontos, Peter Nagy, Gyula Samu,
      David Mester, Jozsef Csoka, Bernat Szabo, Istvan Ladjanszki,
       Lorant Szegedy, Bence Ladoczki, Klara Petrov, Mate Farkas,
                    Pal D. Mezei, and Bence Hegely

        Department of Physical Chemistry and Materials Science
            Budapest University of Technology and Economics
                  Budapest P.O.Box 91, H-1521 Hungary

                              www.mrcc.hu

                       Release date: May 23, 2018

 ************************ 2018-10-30 20:28:17 *************************
 Executing goldstone...

 Generation of CC equations in terms of H and T...
 Generation of antisymmetrized Goldstone diagrams...
 Number of diagrams in T^1 equations:    15
 Number of diagrams in T^2 equations:    38
 Number of diagrams in T^3 equations:    49
 Number of diagrams in T^4 equations:     5
 Translation of diagrams to factorized equations...
 Optimizing intermediate calculation...
 Number of floating-point operations per iteration step:   5.2358E+11
 Probable CPU time per iteration step (hours):      5.24
 Required memory (Mbytes):   29863.8
 Number of intermediates:                                  79
 Number of intermediates to be stored:                     32
 Length of intermediate file (Mbytes):     503.7

 ************************ 2018-10-30 20:28:18 *************************
 Executing xmrcc...

 **********************************************************************
 CC(3)(4) calculation


 Allocation of****** Mbytes of memory...
 Number of spinorbitals:                   252
 Number of alpha electrons:                        4
 Number of beta electrons:                         2
 Spin multiplicity:                     2
 z-component of spin:  1.0
 Spatial symmetry:                      7
 Convergence criterion:  1.0E-07
 Construction of occupation graphs...
 Number of                     0 -fold excitations:                      1
 Number of                     1 -fold excitations:                    124
 Number of                     2 -fold excitations:                  22268
 Number of                     3 -fold excitations:                1986216
 Total number of configurations:                2008609
 Calculation of coupling coefficients...
 Length of intermediate file (Mbytes):     381.0

 ======================================================================

 Spin case  1   Alpha:  2   Beta:  2
 Number of excitations:               42216485
 Spin case  2   Alpha:  3   Beta:  1
 Number of excitations:               36589408
 Spin case  3   Alpha:  4   Beta:  0
 Number of excitations:                1099202
 Number of                     4 -fold excitations:               79905095

 Memory requirements /Mbyte/:
               Minimal        Optimal
 Real*8:        786.3175      1923.2150
 Integer:        79.5111
 Total:         865.8286      2002.7261


 ************************ 2018-10-30 20:28:35 *************************
 Executing mrcc...

 **********************************************************************
 CCSDT(Q) calculation


 Allocation of 1923.2 Mbytes of memory...
 Number of spinorbitals: 252
 Number of alpha electrons:  4
 Number of beta  electrons:  2
 Spin multiplicity: 2
 z-component of spin:  1.0
 Spatial symmetry: 7
 Convergence criterion:  1.0E-07
 Construction of occupation graphs...
 Number of 0-fold excitations: 1
 Number of 1-fold excitations: 124
 Number of 2-fold excitations: 22268
 Number of 3-fold excitations: 1986216
 Total number of determinants: 2008609
 Calculation of coupling coefficients...
 Initial cluster amplitudes are generated.
 Length of intermediate file (Mbytes):     381.0
 Reading integral list from unit 55...
 Sorting integrals...
 Sorting integrals...
 Sorting integrals...
 Sorting integrals...
 Energy of reference determinant [au]:      -9.918219046871
 Calculation of MP denominators...

 Starting CC iteration...
 ======================================================================
 Norm of residual vector:     0.71075881
 CPU time [min]:     2.002                   Wall time [min]:     2.020

 Iteration  1  CC energy:   -10.06820354  Energy decrease:   0.14998450
 ======================================================================
 Norm of residual vector:     0.20450761
 CPU time [min]:     3.073                   Wall time [min]:     3.098

 Iteration  2  CC energy:   -10.08255188  Energy decrease:   0.01434834
 ======================================================================
 Norm of residual vector:     0.05573332
 CPU time [min]:     4.176                   Wall time [min]:     4.204

 Iteration  3  CC energy:   -10.09391092  Energy decrease:   0.01135904
 ======================================================================
 Norm of residual vector:     0.01342567
 CPU time [min]:     5.283                   Wall time [min]:     5.316

 Iteration  4  CC energy:   -10.09427645  Energy decrease:   0.00036553
 ======================================================================
 Norm of residual vector:     0.00430565
 CPU time [min]:     6.198                   Wall time [min]:     6.239

 Iteration  5  CC energy:   -10.09433849  Energy decrease:   0.00006204
 ======================================================================
 Norm of residual vector:     0.00158698
 CPU time [min]:     7.062                   Wall time [min]:     7.117

 Iteration  6  CC energy:   -10.09436372  Energy decrease:   0.00002523
 ======================================================================
 Norm of residual vector:     0.00063482
 CPU time [min]:     7.928                   Wall time [min]:     8.029

 Iteration  7  CC energy:   -10.09435292  Energy decrease:   0.00001080
 ======================================================================
 Norm of residual vector:     0.00027166
 CPU time [min]:     9.061                   Wall time [min]:     9.226

 Iteration  8  CC energy:   -10.09435159  Energy decrease:   0.00000133
 ======================================================================
 Norm of residual vector:     0.00011162
 CPU time [min]:    10.210                   Wall time [min]:    10.389

 Iteration  9  CC energy:   -10.09435657  Energy decrease:   0.00000497
 ======================================================================
 Norm of residual vector:     0.00004112
 CPU time [min]:    11.348                   Wall time [min]:    11.536

 Iteration 10  CC energy:   -10.09435595  Energy decrease:   0.00000062
 ======================================================================
 Norm of residual vector:     0.00001374
 CPU time [min]:    12.510                   Wall time [min]:    12.781

 Iteration 11  CC energy:   -10.09435529  Energy decrease:   0.00000066
 ======================================================================
 Norm of residual vector:     0.00000442
 CPU time [min]:    13.666                   Wall time [min]:    13.944

 Iteration 12  CC energy:   -10.09435544  Energy decrease:   0.00000015
 ======================================================================
 Norm of residual vector:     0.00000140
 CPU time [min]:    14.816                   Wall time [min]:    15.098

 Iteration 13  CC energy:   -10.09435546  Energy decrease:   0.00000002
 ======================================================================
 Norm of residual vector:     0.00000044
 CPU time [min]:    15.975                   Wall time [min]:    16.260

 Iteration 14  CC energy:   -10.09435544  Energy decrease:   0.00000002
 ======================================================================
 Norm of residual vector:     0.00000013
 CPU time [min]:    17.147                   Wall time [min]:    17.463

 Iteration 15  CC energy:   -10.09435544  Energy decrease:   2.0109E-09
 ======================================================================
 Norm of residual vector:     0.00000004
 CPU time [min]:    18.258                   Wall time [min]:    18.578

 Iteration 16  CC energy:   -10.09435545  Energy decrease:   7.7679E-10
 ======================================================================

 Iteration has converged in 16 steps.

 Final results:
 Total CCSDT energy [au]:            -10.094355445632
 Total MP2 energy [au]:              -10.068203543244

 Perturbative corrections are calculated...
 ======================================================================
 Spin case  1   Alpha:  2   Beta:  2
 Number of excitations:        42216485
 CPU time [min]:   159.545                   Wall time [min]:   159.879
 ======================================================================
 Spin case  2   Alpha:  3   Beta:  1
 Number of excitations:        36589408
 CPU time [min]:   275.788                   Wall time [min]:   276.152
 ======================================================================
 Spin case  3   Alpha:  4   Beta:  0
 Number of excitations:        1099202
 CPU time [min]:   289.091                   Wall time [min]:   289.470
 ======================================================================
 Number of 4-fold excitations: 79905095
 CPU time [min]:   289.091                   Wall time [min]:   289.480

 Total CCSDT[Q] energy [au]:         -10.094347149235
 Total CCSDT(Q) energy [au]:         -10.094594379218

 ************************ 2018-10-31 01:18:04 *************************
                      Normal termination of mrcc.
 **********************************************************************
 !CCSDT STATE 1.7 Energy              -10.094355445632
 !MP2 STATE 1.7 Energy                -10.068203543244
 !CCSDT[Q] STATE 1.7 Energy           -10.094347149235
 !CCSDT(Q) STATE 1.7 Energy           -10.094594379218
 
 CPU-time for MRCC:          17345.5 sec
 Elapsed-time for MRCC:      17389.2 sec

 Variable memory set to 8000000000 words,  buffer space   230000 words



 **********************************************************************************************************************************
 DATASETS  * FILE   NREC   LENGTH (MB)   RECORD NAMES
              1      21       38.22       500      610      700      900      950      970     1000      129      960     1100   
                                          VAR    BASINP    GEOM    SYMINP    ZMAT    AOBASIS   BASIS     P2S    ABASIS      S 
                                         1400     1410     1420     1200     1210     1080     1600     1650     1300     1700   
                                         EKIN       V       ECP      H0       H01     AOSYM     SMH    MOLCAS    ERIS     OPER   
                                         1380   
                                         JKOP   

              2       7       10.62       700     1000      520     4202     5202     2101     2200   
                                         GEOM     BASIS   MCVARS     RHF     MCSCF     RHF      UHF  

 PROGRAMS   *        TOTAL      MRCC       UHF       RHF     MULTI       RHF       INT
 CPU TIMES  *     17433.27  17428.65      0.04      0.04      0.19      0.25      3.97
 REAL TIME  *     17805.47 SEC
 DISK USED  *        88.48 MB      
 **********************************************************************************************************************************
 SETTING POSTHF(I)      =       -10.09459438  AU                              
                                                                                                                                                                                                                                                                

       SCF            POSTHF       EKIN          POT
    -9.91821905   -10.09459438   3.70170464   -3.63626778
                                                  

 CCSDT(Q)/USERDEF energy=    -10.094594379218

        CCSDT(Q)        RHF-SCF         MULTI           RHF-SCF 
    -10.09459438     -9.91821905     -9.91821905     -9.92062831
 **********************************************************************************************************************************
 Variable memory released
