
 Primary working directories    : /global/cscratch1/sd/aannabe
 Secondary working directories  : /global/cscratch1/sd/aannabe
 Wavefunction directory         : /global/homes/a/aannabe/wfu/
 Main file repository           : /global/cscratch1/sd/aannabe/

 SHA1      : 19cd028119e0e09f93f0674bd8af7968d9b3eff6
 NAME      : 2015.1.36
 ARCHNAME  : linux/x86_64
 FC        : /opt/cray/pe/craype/2.5.14/bin/ftn
 BLASLIB   : -L/opt/intel/compilers_and_libraries_2018.1.163/linux/mkl/lib/intel64 -Wl,-_start-group -lmkl_intel_ilp64 -lmkl_intel_thread -lmkl_core -Wl,-_end-group -liomp5
 id        : lbl

 Nodes     nprocs
 nid00506     1

 Using customized tuning parameters: mindgm=7; mindgv=16; mindgc=1; mindgr=1; noblas=0; minvec=7
 default implementation of scratch files=df  

 ***,F
 memory,8,g
 gthresh,twoint=1.e-12
 
 gprint,basis,orbitals
 gexpec,ekin,pot
 
 angstrom
 geometry={
 1                                                                               ! Number of atoms
 F 0.0 0.0 0.0
 }
 
 basis={
                                                                  !include,/global/homes/a/aannabe/docs/accurate/ccECP_D2h/pps/F.pp
                                              !include,/global/homes/a/aannabe/docs/accurate/ccECP_D2h/basis/aug-cc-pVnZ/F_TZ.basis
                                                  !include,/global/homes/a/aannabe/docs/accurate/ccECP_D2h/basis/cc-pVnZ/F_TZ.basis
 
 Including file /global/homes/a/aannabe/repos/pseudopotentiallibrary/recipes/F/ccECP/F.ccECP.molpro
                                    !include,/global/homes/a/aannabe/repos/pseudopotentiallibrary/recipes/F/ccECP/F.cc-pCVTZ.molpro
 Including file /global/homes/a/aannabe/repos/pseudopotentiallibrary/recipes/F/ccECP/F.aug-cc-pVTZ.molpro
 
 
 }
 
 {hf
 wf,7,3,1
 occ,1,1,1,0,1,0,0,0
                                                                                 !open,1.3
 closed,1,1,0,0,1,0,0,0
                                                                                 !sym,
 }
 scf(i)=energy
 
 _CC_NORM_MAX=2.0
  !NOTE: Perturbative MRCC works only with UHF reference. So, here we will trick MRCC by doing zero UHF iteration right after ROHF.
 
 {uhf
 wf,7,3,1
 occ,1,1,1,0,1,0,0,0
                                                                                 !open,1.3
 closed,1,1,0,0,1,0,0,0
                                                                                 !sym,
 maxit,0
 }
 scf(i)=energy
 
 {mrcc,method=CCSDT(Q),dir=mrccdir                                               !,restart=1
 orbital,ignore_error=1                                                          !Ignore the fact that UHF WF is not converged
 maxit,100
 core
 }
 posthf(i)=energy
 
 table,scf,posthf,ekin,pot
 save,3.csv,new
 
 

 Variables initialized (889), CPU time= 0.01 sec
 Commands  initialized (702), CPU time= 0.01 sec, 572 directives.
 Default parameters read. Elapsed time= 0.19 sec

 Checking input...
 Passed
1


                                         ***  PROGRAM SYSTEM MOLPRO  ***
                                       Copyright, TTI GmbH Stuttgart, 2015
                                    Version 2015.1 linked Dec 29 2018 15:55:43


 **********************************************************************************************************************************
 LABEL *   F                                                                             
  64 bit serial version                                                                  DATE: 01-Feb-19          TIME: 16:50:48  
 **********************************************************************************************************************************

 SHA1:             19cd028119e0e09f93f0674bd8af7968d9b3eff6
 **********************************************************************************************************************************

 THRESHOLDS:

 ZERO    =  1.00D-12  ONEINT  =  1.00D-12  TWOINT  =  1.00D-12  PREFAC  =  1.00D-14  LOCALI  =  1.00D-09  EORDER  =  1.00D-04
 ENERGY  =  0.00D+00  ETEST   =  0.00D+00  EDENS   =  0.00D+00  THRDEDEF=  1.00D-06  GRADIENT=  1.00D-02  STEP    =  1.00D-03
 ORBITAL =  1.00D-05  CIVEC   =  1.00D-05  COEFF   =  1.00D-04  PRINTCI =  5.00D-02  PUNCHCI =  9.90D+01  OPTGRAD =  3.00D-04
 OPTENERG=  1.00D-06  OPTSTEP =  3.00D-04  THRGRAD =  1.00D-10  COMPRESS=  1.00D-11  VARMIN  =  1.00D-07  VARMAX  =  1.00D-03
 THRDOUB =  0.00D+00  THRDIV  =  1.00D-05  THRRED  =  1.00D-07  THRPSP  =  1.00D+00  THRDC   =  1.00D-10  THRCS   =  1.00D-10
 THRNRM  =  1.00D-08  THREQ   =  0.00D+00  THRDE   =  1.00D+00  THRREF  =  1.00D-05  SPARFAC =  1.00D+00  THRDLP  =  1.00D-07
 THRDIA  =  1.00D-10  THRDLS  =  1.00D-07  THRGPS  =  0.00D+00  THRKEX  =  0.00D+00  THRDIS  =  2.00D-01  THRVAR  =  1.00D-10
 THRLOC  =  1.00D-06  THRGAP  =  1.00D-06  THRLOCT = -1.00D+00  THRGAPT = -1.00D+00  THRORB  =  1.00D-06  THRMLTP =  0.00D+00
 THRCPQCI=  1.00D-10  KEXTA   =  0.00D+00  THRCOARS=  0.00D+00  SYMTOL  =  1.00D-06  GRADTOL =  1.00D-06  THROVL  =  1.00D-08
 THRORTH =  1.00D-08  GRID    =  1.00D-06  GRIDMAX =  1.00D-03  DTMAX   =  0.00D+00  THROCCDE=  1.00D-01  THROCCDE=  1.00D-01



 ZUNIT=ANG
 

Geometry recognized as XYZ


 Variable memory set to 8000000000 words,  buffer space   230000 words

 SETTING BASIS          =    USERDEF


 Recomputing integrals since basis changed


 Using spherical harmonics



 PROGRAM * SEWARD (Integral evaluation for generally contracted gaussian basis sets)     Author: Roland Lindh, 1990

 Geometry written to block  1 of record 700

 Orientation using atomic masses  
 Molecule type: Atom
 Symmetry elements: X,Y,Z
 Rotational constants:       0.0000000      0.0000000      0.0000000 GHz  (calculated with average atomic masses)

 Point group  D2h 



 ATOMIC COORDINATES

 NR  ATOM    CHARGE       X              Y              Z

   1  F       7.00    0.000000000    0.000000000    0.000000000


          F   CORE POTENTIAL

          p POTENTIAL

 POWERS             1              3              2
 EXPONENTIALS   12.08758       12.83806       12.31235    
 COEFFICIENTS   7.000000       84.61309      -53.02752    

          s - p POTENTIAL

 POWERS             2
 EXPONENTIALS   14.78076    
 COEFFICIENTS   78.90177    


 BASIS DATA

   Nr Sym  Nuc  Type         Exponents   Contraction coefficients

    1.1 Ag    1  1s          84.048652    -0.000003
                             41.094617    -0.000354
                             20.092738     0.018409
                              9.824112    -0.127766
                              4.803386    -0.070287
                              2.348560     0.157160
                              1.148301     0.376901
                              0.561449     0.409517
                              0.274514     0.197089
                              0.134220     0.024348
    2.1 Ag    1  1s           2.289795     1.000000
    3.1 Ag    1  1s           0.327712     1.000000
    4.1 Ag    1  1s           0.131085     1.000000
    5.1 Ag    1  3d0          3.297425     1.000000
    6.1 Ag    1  3d2+         3.297425     1.000000
    7.1 Ag    1  3d0          0.900763     1.000000
    8.1 Ag    1  3d2+         0.900763     1.000000
    9.1 Ag    1  3d0          0.360305     1.000000
   10.1 Ag    1  3d2+         0.360305     1.000000
    1.2 B3u   1  2px         31.642619     0.002967
                             16.243233     0.029805
                              8.338204     0.066949
                              4.280284     0.133779
                              2.197215     0.214831
                              1.127906     0.266486
                              0.578992     0.261895
                              0.297216     0.192022
                              0.152571     0.082847
                              0.078320     0.013305
    2.2 B3u   1  2px          0.804181     1.000000
    3.2 B3u   1  2px          0.243660     1.000000
    4.2 B3u   1  2px          0.097464     1.000000
    5.2 B3u   1  4f1+         1.859274     1.000000
    6.2 B3u   1  4f3+         1.859274     1.000000
    7.2 B3u   1  4f1+         0.743710     1.000000
    8.2 B3u   1  4f3+         0.743710     1.000000
    1.3 B2u   1  2py         31.642619     0.002967
                             16.243233     0.029805
                              8.338204     0.066949
                              4.280284     0.133779
                              2.197215     0.214831
                              1.127906     0.266486
                              0.578992     0.261895
                              0.297216     0.192022
                              0.152571     0.082847
                              0.078320     0.013305
    2.3 B2u   1  2py          0.804181     1.000000
    3.3 B2u   1  2py          0.243660     1.000000
    4.3 B2u   1  2py          0.097464     1.000000
    5.3 B2u   1  4f1-         1.859274     1.000000
    6.3 B2u   1  4f3-         1.859274     1.000000
    7.3 B2u   1  4f1-         0.743710     1.000000
    8.3 B2u   1  4f3-         0.743710     1.000000
    1.4 B1g   1  3d2-         3.297425     1.000000
    2.4 B1g   1  3d2-         0.900763     1.000000
    3.4 B1g   1  3d2-         0.360305     1.000000
    1.5 B1u   1  2pz         31.642619     0.002967
                             16.243233     0.029805
                              8.338204     0.066949
                              4.280284     0.133779
                              2.197215     0.214831
                              1.127906     0.266486
                              0.578992     0.261895
                              0.297216     0.192022
                              0.152571     0.082847
                              0.078320     0.013305
    2.5 B1u   1  2pz          0.804181     1.000000
    3.5 B1u   1  2pz          0.243660     1.000000
    4.5 B1u   1  2pz          0.097464     1.000000
    5.5 B1u   1  4f0          1.859274     1.000000
    6.5 B1u   1  4f2+         1.859274     1.000000
    7.5 B1u   1  4f0          0.743710     1.000000
    8.5 B1u   1  4f2+         0.743710     1.000000
    1.6 B2g   1  3d1+         3.297425     1.000000
    2.6 B2g   1  3d1+         0.900763     1.000000
    3.6 B2g   1  3d1+         0.360305     1.000000
    1.7 B3g   1  3d1-         3.297425     1.000000
    2.7 B3g   1  3d1-         0.900763     1.000000
    3.7 B3g   1  3d1-         0.360305     1.000000
    1.8 Au    1  4f2-         1.859274     1.000000
    2.8 Au    1  4f2-         0.743710     1.000000

 NUCLEAR CHARGE:                    7
 NUMBER OF PRIMITIVE AOS:          90
 NUMBER OF SYMMETRY AOS:           81
 NUMBER OF CONTRACTIONS:           45   (  10Ag  +   8B3u +   8B2u +   3B1g +   8B1u +   3B2g +   3B3g +   2Au  )
 NUMBER OF CORE ORBITALS:           0   (   0Ag  +   0B3u +   0B2u +   0B1g +   0B1u +   0B2g +   0B3g +   0Au  )
 NUMBER OF VALENCE ORBITALS:        4   (   1Ag  +   1B3u +   1B2u +   0B1g +   1B1u +   0B2g +   0B3g +   0Au  )


 NUCLEAR REPULSION ENERGY    0.00000000

 EXTRA SYMMETRY OF AOS IN SYMMETRY 1:   1 1 1 1 2 3 2 3 2 3
 EXTRA SYMMETRY OF AOS IN SYMMETRY 2:   1 1 1 1 2 3 2 3
 EXTRA SYMMETRY OF AOS IN SYMMETRY 3:   1 1 1 1 2 3 2 3
 EXTRA SYMMETRY OF AOS IN SYMMETRY 5:   1 1 1 1 2 3 2 3

 Eigenvalues of metric

         1 0.183E-01 0.153E+00 0.210E+00 0.210E+00 0.758E+00 0.846E+00 0.846E+00 0.194E+01
         2 0.555E-01 0.139E+00 0.367E+00 0.367E+00 0.885E+00 0.163E+01 0.163E+01 0.292E+01
         3 0.555E-01 0.139E+00 0.367E+00 0.367E+00 0.885E+00 0.163E+01 0.163E+01 0.292E+01
         4 0.210E+00 0.846E+00 0.194E+01
         5 0.555E-01 0.139E+00 0.367E+00 0.367E+00 0.885E+00 0.163E+01 0.163E+01 0.292E+01
         6 0.210E+00 0.846E+00 0.194E+01
         7 0.210E+00 0.846E+00 0.194E+01
         8 0.367E+00 0.163E+01


 Contracted 2-electron integrals neglected if value below      1.0D-12
 AO integral compression algorithm  1   Integral accuracy      1.0D-12

     1.049 MB (compressed) written to integral file ( 99.8%)


 NUMBER OF SORTED TWO-ELECTRON INTEGRALS:      75808.     BUFFER LENGTH:  32768
 NUMBER OF SEGMENTS:   1  SEGMENT LENGTH:      75808      RECORD LENGTH: 524288

 Memory used in sort:       0.63 MW

 SORT1 READ      155797. AND WROTE       61548. INTEGRALS IN      1 RECORDS. CPU TIME:     0.01 SEC, REAL TIME:     0.01 SEC
 SORT2 READ       61548. AND WROTE       75808. INTEGRALS IN      4 RECORDS. CPU TIME:     0.02 SEC, REAL TIME:     0.03 SEC

 FILE SIZES:   FILE 1:    21.0 MBYTE,  FILE 4:     4.2 MBYTE,   TOTAL:     25.2 MBYTE

 OPERATOR DM      FOR CENTER  0  COORDINATES:    0.000000    0.000000    0.000000
 OPERATOR EKIN    FOR CENTER  0  COORDINATES:    0.000000    0.000000    0.000000
 OPERATOR POT     FOR CENTER  0  COORDINATES:    0.000000    0.000000    0.000000


 **********************************************************************************************************************************
 DATASETS  * FILE   NREC   LENGTH (MB)   RECORD NAMES
              1      20       20.41       500      610      700      900      950      970     1000      129      960     1100   
                                          VAR    BASINP    GEOM    SYMINP    ZMAT    AOBASIS   BASIS     P2S    ABASIS      S 
                                         1400     1410     1420     1200     1210     1080     1600     1650     1300     1700   
                                         EKIN       V       ECP      H0       H01     AOSYM     SMH    MOLCAS    ERIS     OPER   

 PROGRAMS   *        TOTAL       INT
 CPU TIMES  *         1.92      1.79
 REAL TIME  *        11.54 SEC
 DISK USED  *        25.47 MB      
 **********************************************************************************************************************************


 PROGRAM * RHF-SCF (OPEN SHELL)       Authors: W. Meyer, H.-J. Werner


 NUMBER OF ELECTRONS:       4+    3-    SPACE SYMMETRY=3    SPIN SYMMETRY: Doublet 
 CONVERGENCE THRESHOLDS:    1.00E-05 (Density)    1.00E-07 (Energy)
 MAX. NUMBER OF ITERATIONS:       60
 INTERPOLATION TYPE:            DIIS
 INTERPOLATION STEPS:              2 (START)      1 (STEP)
 LEVEL SHIFTS:                 -0.60 (CLOSED) -0.30 (OPEN) 

 Number of closed-shell orbitals:    3 (   1   1   0   0   1   0   0   0 )
 Number of open-shell orbitals:      1 (   0   0   1   0   0   0   0   0 )



   Atom=F  basis=ECP2MWB_GUESS     lmin=0  lmax=1

 Orbital guess generated from atomic densities. Full valence occupancy:    1   1   1   0   1   0   0   0


 Molecular orbital dump at record        2100.2

 ITERATION    DDIFF          GRAD             ENERGY        2-EL.EN.            DIPOLE MOMENTS         DIIS   ORB.
    1      0.000D+00      0.000D+00       -23.93081617     33.617342    0.00000    0.00000    0.00000    0    start
    2      0.000D+00      0.166D-01       -23.93735003     34.200810    0.00000    0.00000    0.00000    1    diag,B
    3      0.132D-01      0.431D-02       -23.93771842     34.166750    0.00000    0.00000    0.00000    2    diag,B
    4      0.282D-02      0.123D-02       -23.93781824     34.179465    0.00000    0.00000    0.00000    3    diag,B
    5      0.128D-02      0.337D-03       -23.93782812     34.180434    0.00000    0.00000    0.00000    4    diag,B
    6      0.538D-03      0.503D-04       -23.93782830     34.179839    0.00000    0.00000    0.00000    5    diag,B
    7      0.664D-04      0.113D-04       -23.93782831     34.179715    0.00000    0.00000    0.00000    6    fixocc
    8      0.160D-04      0.228D-05       -23.93782831     34.179662    0.00000    0.00000    0.00000    7    diag,B
    9      0.370D-05      0.376D-06       -23.93782831     34.179664    0.00000    0.00000    0.00000    0    orth

 Final alpha occupancy:   1   1   1   0   1   0   0   0
 Final beta  occupancy:   1   1   0   0   1   0   0   0

 !RHF STATE 1.3 Energy                -23.937828308089
 Nuclear energy                         0.00000000
 One-electron energy                  -41.02766047
 Two-electron energy                   17.08983216
 Virial quotient                       -1.28396150
 !RHF STATE 1.3 Dipole moment           0.00000000     0.00000000     0.00000000
 Dipole moment /Debye                   0.00000000     0.00000000     0.00000000
 

 !RHF expec          <1.3|EKIN|1.3>    18.643727518650
 
 !RHF expec           <1.3|POT|1.3>    -8.770957680437

 ELECTRON ORBITALS
 =================


   Orb  Occ    Energy  Couls-En    Coefficients

                                   1 1s      1 1s      1 1s      1 1s      1 3d0     1 3d2+    1 3d0     1 3d2+    1 3d0     1 3d2+ 


   1.1   2    -1.5944   -8.0495  1.000001  0.000003  0.000016 -0.000037  0.000423  0.000732  0.000266  0.000461  0.001675  0.002901

                                   1 2px     1 2px     1 2px     1 2px     1 4f1+    1 4f3+    1 4f1+    1 4f3+ 

   1.2   2    -0.7061   -6.3118  0.999995  0.000097 -0.000067 -0.000109 -0.000551 -0.002135 -0.000529 -0.002048

                                   1 2py     1 2py     1 2py     1 2py     1 4f1-    1 4f3-    1 4f1-    1 4f3- 

   1.3   +    -0.8350   -6.5293  1.032739  0.001357 -0.040139 -0.015733 -0.003653 -0.004717 -0.002983 -0.003852

                                   1 2pz     1 2pz     1 2pz     1 2pz     1 4f0     1 4f2+    1 4f0     1 4f2+ 

   1.5   2    -0.7061   -6.3118  0.999995  0.000097 -0.000067 -0.000109 -0.001350 -0.001743 -0.001295 -0.001672

 HOMO      1.2    -0.706060 =     -19.2129eV
 LUMO      2.3     0.234398 =       6.3783eV
 LUMO-HOMO         0.940458 =      25.5912eV


 **********************************************************************************************************************************
 DATASETS  * FILE   NREC   LENGTH (MB)   RECORD NAMES
              1      20       20.41       500      610      700      900      950      970     1000      129      960     1100   
                                          VAR    BASINP    GEOM    SYMINP    ZMAT    AOBASIS   BASIS     P2S    ABASIS      S 
                                         1400     1410     1420     1200     1210     1080     1600     1650     1300     1700   
                                         EKIN       V       ECP      H0       H01     AOSYM     SMH    MOLCAS    ERIS     OPER   

              2       4        2.76       700     1000      520     2100   
                                         GEOM     BASIS   MCVARS     RHF  

 PROGRAMS   *        TOTAL        HF       INT
 CPU TIMES  *         1.95      0.03      1.79
 REAL TIME  *        11.76 SEC
 DISK USED  *        25.47 MB      
 **********************************************************************************************************************************
 SETTING SCF(I)         =       -23.93782831  AU                              
 SETTING _CC_NORM_MAX   =         2.00000000                                  


 PROGRAM * UHF-SCF       Authors: W. Meyer, H.-J. Werner


 NUMBER OF ELECTRONS:       4+    3-    SPACE SYMMETRY=3    SPIN SYMMETRY: Doublet 
 CONVERGENCE THRESHOLDS:    1.00E-05 (Density)    1.00E-07 (Energy)
 MAX. NUMBER OF ITERATIONS:        0
 INTERPOLATION TYPE:            DIIS
 INTERPOLATION STEPS:              2 (START)      1 (STEP)
 LEVEL SHIFTS:                  0.20 (ALPHA)   0.20 (BETA) 

 Number of closed-shell orbitals:    3 (   1   1   0   0   1   0   0   0 )
 Number of open-shell orbitals:      1 (   0   0   1   0   0   0   0   0 )


 Molecular orbitals read from record     2100.2  Type=RHF/CANONICAL (state 1.3)

 Molecular orbital dump at record        2200.2

 Initial alpha occupation   1   1   1   0   1   0   0   0
 Initial beta  occupation   1   1   0   0   1   0   0   0

 ITERATION    DDIFF          GRAD             ENERGY        2-EL.EN.            DIPOLE MOMENTS         DIIS
    1      0.000D+00      0.000D+00       -23.93782831     34.179664    0.00000    0.00000    0.00000    0
 
 Final alpha occupancy:   1   1   1   0   1   0   0   0
 Final beta  occupancy:   1   1   0   0   1   0   0   0

 !UHF STATE 1.3 Energy                -23.937828308089
 Nuclear energy                         0.00000000
 One-electron energy                  -41.02766047
 Two-electron energy                   17.08983216
 Virial quotient                       -1.28396150
 !UHF STATE 1.3 Dipole moment           0.00000000     0.00000000     0.00000000
 Dipole moment /Debye                   0.00000000     0.00000000     0.00000000
 

 !UHF expec          <1.3|EKIN|1.3>    18.643727518650
 
 !UHF expec           <1.3|POT|1.3>    -8.770957680437

 ELECTRON ORBITALS FOR POSITIVE SPIN
 ===================================


   Orb  Occ    Energy  Couls-En    Coefficients

                                   1 1s      1 1s      1 1s      1 1s      1 3d0     1 3d2+    1 3d0     1 3d2+    1 3d0     1 3d2+ 


   1.1   +    -1.5944   -8.0495  1.000001  0.000003  0.000016 -0.000037  0.000423  0.000732  0.000266  0.000461  0.001675  0.002901

                                   1 2px     1 2px     1 2px     1 2px     1 4f1+    1 4f3+    1 4f1+    1 4f3+ 

   1.2   +    -0.7061   -6.3118  0.999995  0.000097 -0.000067 -0.000109 -0.000551 -0.002135 -0.000529 -0.002048

                                   1 2py     1 2py     1 2py     1 2py     1 4f1-    1 4f3-    1 4f1-    1 4f3- 

   1.3   +    -0.8350   -6.5293  1.032739  0.001357 -0.040139 -0.015733 -0.003653 -0.004717 -0.002983 -0.003852

                                   1 2pz     1 2pz     1 2pz     1 2pz     1 4f0     1 4f2+    1 4f0     1 4f2+ 

   1.5   +    -0.7061   -6.3118  0.999995  0.000097 -0.000067 -0.000109 -0.001350 -0.001743 -0.001295 -0.001672

 ELECTRON ORBITALS FOR NEGATIVE SPIN
 ===================================


   Orb  Occ    Energy  Couls-En    Coefficients

                                   1 1s      1 1s      1 1s      1 1s      1 3d0     1 3d2+    1 3d0     1 3d2+    1 3d0     1 3d2+ 


   1.1   -    -1.5944   -8.0495  1.000001  0.000003  0.000016 -0.000037  0.000423  0.000732  0.000266  0.000461  0.001675  0.002901

                                   1 2px     1 2px     1 2px     1 2px     1 4f1+    1 4f3+    1 4f1+    1 4f3+ 

   1.2   -    -0.7061   -6.3118  0.999995  0.000097 -0.000067 -0.000109 -0.000551 -0.002135 -0.000529 -0.002048

                                   1 2pz     1 2pz     1 2pz     1 2pz     1 4f0     1 4f2+    1 4f0     1 4f2+ 

   1.5   -    -0.7061   -6.3118  0.999995  0.000097 -0.000067 -0.000109 -0.001350 -0.001743 -0.001295 -0.001672

 HOMO      1.2    -0.706060 =     -19.2129eV
 LUMO     -1.3    -0.834972 =     -22.7207eV
 LUMO-HOMO        -0.128912 =      -3.5079eV

 EXPECTATION VALUE OF S**2:             0.75000000

 Occupation number threshold for canonical orbitals:  1.999000 (occupied),  0.001000 (virtual)

 Number of pseudo-canonical orbitals per symmetry:    1   1   0   0   1   0   0   0
 Number of active natural orbitals per symmetry:      0   0   1   0   0   0   0   0

 NATURAL CHARGE ORBITALS
 =======================


   Orb     Occ        Energy       Coefficients

                                   1 1s      1 1s      1 1s      1 1s      1 3d0     1 3d2+    1 3d0     1 3d2+    1 3d0     1 3d2+ 


   1.1  2.00000    -1.594393     1.000001  0.000003  0.000016 -0.000037  0.000423  0.000732  0.000266  0.000461  0.001675  0.002901

                                   1 2px     1 2px     1 2px     1 2px     1 4f1+    1 4f3+    1 4f1+    1 4f3+ 

   1.2  2.00000    -0.706060     0.999995  0.000097 -0.000067 -0.000109 -0.000551 -0.002135 -0.000529 -0.002048

                                   1 2py     1 2py     1 2py     1 2py     1 4f1-    1 4f3-    1 4f1-    1 4f3- 

   1.3  1.00000    -0.359628     1.032739  0.001357 -0.040139 -0.015733 -0.003653 -0.004717 -0.002983 -0.003852

                                   1 2pz     1 2pz     1 2pz     1 2pz     1 4f0     1 4f2+    1 4f0     1 4f2+ 

   1.5  2.00000    -0.706060     0.999995  0.000097 -0.000067 -0.000109 -0.001350 -0.001743 -0.001295 -0.001672

 Natural orbitals saved to record    2200.2 (Orbital set 3)

 Orbital spaces for UNO-CAS (Min. occupation: 0.020  Max. occupation: 1.980):

 Closed:        1   1   0   0   1   0   0   0
 Active:        0   0   1   0   0   0   0   0

 No convergence



 **********************************************************************************************************************************
 DATASETS  * FILE   NREC   LENGTH (MB)   RECORD NAMES
              1      20       20.41       500      610      700      900      950      970     1000      129      960     1100   
                                          VAR    BASINP    GEOM    SYMINP    ZMAT    AOBASIS   BASIS     P2S    ABASIS      S 
                                         1400     1410     1420     1200     1210     1080     1600     1650     1300     1700   
                                         EKIN       V       ECP      H0       H01     AOSYM     SMH    MOLCAS    ERIS     OPER   

              2       5        5.27       700     1000      520     2100     2200   
                                         GEOM     BASIS   MCVARS     RHF      UHF  

 PROGRAMS   *        TOTAL       UHF        HF       INT
 CPU TIMES  *         1.96      0.00      0.03      1.79
 REAL TIME  *        11.87 SEC
 DISK USED  *        25.77 MB      
 **********************************************************************************************************************************
 SETTING SCF(I)         =       -23.93782831  AU                              


 PROGRAM * MRCC (General Multireference Coupled Cluster)    Author: M. Kallay, 2000-2005

 ***  Initialisation ***

   0 Spin projections
 
 Molecular orbitals read from record     2200.2  Type=UHF/ALPHA (state 1.3)

 ?Warning: UHF not converged
 Molecular orbitals read from record     2200.2  Type=UHF/BETA (state 1.3)

 ?Warning: UHF not converged
 
 Frozen orbitals:              0 (  0  0  0  0  0  0  0  0)
 Active orbitals:             45 ( 10  8  8  3  8  3  3  2)
 Active electrons:             7
 Spin quantum number:          0.5

 Transformed integrals will be written to file mrccdir/mrcc_41911/fort.55

 Load integrals                2.0 sec
 Transform integrals           2.0 sec
 Storage for integrals:         426551
 Remaining memory:           *********

 Core energy:               0.00000000
 
 MRCC Input:
     4     0     0     0     3     0     0     3     0     0     0     1     1     0     0     7     0     0   0.000     0   64000
  ex.lev,nsing,ntrip, rest,method,dens,conver,symm, diag, CS ,spatial, HF, ndoub,nacto,nactv, tol, maxex, sacc, freq,  dboc,   mem
  2  0  0  0  0  0  0  0  0  0  2  0  0  0  0  0  0  0  1  0  0  0  0  0  0  0  0  0  0  2  0  0  0  0  0  0  0  0  0  0  0  0  0  0  0
 MRCC Input end
 Variable memory released
 MRCC now being run, temporary output in /global/cscratch1/sd/aannabe/mrccdir/mrcc_41911/mrcc.out
 **********************************************************************
                          MRCC program system
 **********************************************************************

                              Written by
  Mihaly Kallay, Zoltan Rolik, Jozsef Csontos, Peter Nagy, Gyula Samu,
      David Mester, Jozsef Csoka, Bernat Szabo, Istvan Ladjanszki,
       Lorant Szegedy, Bence Ladoczki, Klara Petrov, Mate Farkas,
                    Pal D. Mezei, and Bence Hegely

        Department of Physical Chemistry and Materials Science
            Budapest University of Technology and Economics
                  Budapest P.O.Box 91, H-1521 Hungary

                              www.mrcc.hu

                       Release date: May 23, 2018

 ************************ 2019-02-01 16:51:07 *************************
 Executing goldstone...

 Generation of CC equations in terms of H and T...
 Generation of antisymmetrized Goldstone diagrams...
 Number of diagrams in T^1 equations:    15
 Number of diagrams in T^2 equations:    38
 Number of diagrams in T^3 equations:    49
 Number of diagrams in T^4 equations:     5
 Translation of diagrams to factorized equations...
 Optimizing intermediate calculation...
 Number of floating-point operations per iteration step:   5.0173E+09
 Probable CPU time per iteration step (hours):      0.05
 Required memory (Mbytes):     393.4
 Number of intermediates:                                  79
 Number of intermediates to be stored:                     32
 Length of intermediate file (Mbytes):       9.8

 ************************ 2019-02-01 16:51:08 *************************
 Executing xmrcc...

 **********************************************************************
 CC(3)(4) calculation


 Allocation of 393.4 Mbytes of memory...
 Number of spinorbitals:                    90
 Number of alpha electrons:                        4
 Number of beta electrons:                         3
 Spin multiplicity:                     2
 z-component of spin:  0.5
 Spatial symmetry:                      3
 Convergence criterion:  1.0E-07
 Construction of occupation graphs...
 Number of                     0 -fold excitations:                      1
 Number of                     1 -fold excitations:                     53
 Number of                     2 -fold excitations:                   3698
 Number of                     3 -fold excitations:                 137170
 Total number of configurations:                 140922
 Calculation of coupling coefficients...
 Length of intermediate file (Mbytes):       7.8

 ======================================================================

 Spin case  1   Alpha:  1   Beta:  3
 Number of excitations:                 235120
 Spin case  2   Alpha:  2   Beta:  2
 Number of excitations:                1588850
 Spin case  3   Alpha:  3   Beta:  1
 Number of excitations:                 671700
 Spin case  4   Alpha:  4   Beta:  0
 Number of excitations:                  12879
 Number of                     4 -fold excitations:                2508549

 Memory requirements /Mbyte/:
               Minimal        Optimal
 Real*8:         29.2913        31.3201
 Integer:         9.4256
 Total:          38.7169        40.7457


 ************************ 2019-02-01 16:51:09 *************************
 Executing mrcc...

 **********************************************************************
 CCSDT(Q) calculation


 Allocation of   31.3 Mbytes of memory...
 Number of spinorbitals:  90
 Number of alpha electrons:  4
 Number of beta  electrons:  3
 Spin multiplicity: 2
 z-component of spin:  0.5
 Spatial symmetry: 3
 Convergence criterion:  1.0E-07
 Construction of occupation graphs...
 Number of 0-fold excitations: 1
 Number of 1-fold excitations: 53
 Number of 2-fold excitations: 3698
 Number of 3-fold excitations: 137170
 Total number of determinants: 140922
 Calculation of coupling coefficients...
 Initial cluster amplitudes are generated.
 Length of intermediate file (Mbytes):       7.8
 Reading integral list from unit 55...
 Sorting integrals...
 Sorting integrals...
 Sorting integrals...
 Sorting integrals...
 Energy of reference determinant [au]:     -23.937828308089
 Calculation of MP denominators...

 Starting CC iteration...
 ======================================================================
 Norm of residual vector:     1.34711706
 CPU time [min]:     0.049                   Wall time [min]:     0.313

 Iteration  1  CC energy:   -24.14873828  Energy decrease:   0.21090997
 ======================================================================
 Norm of residual vector:     0.24523582
 CPU time [min]:     0.079                   Wall time [min]:     0.350

 Iteration  2  CC energy:   -24.15719253  Energy decrease:   0.00845425
 ======================================================================
 Norm of residual vector:     0.05401074
 CPU time [min]:     0.106                   Wall time [min]:     0.379

 Iteration  3  CC energy:   -24.16391422  Energy decrease:   0.00672169
 ======================================================================
 Norm of residual vector:     0.01720580
 CPU time [min]:     0.134                   Wall time [min]:     0.406

 Iteration  4  CC energy:   -24.16541476  Energy decrease:   0.00150054
 ======================================================================
 Norm of residual vector:     0.00731253
 CPU time [min]:     0.161                   Wall time [min]:     0.435

 Iteration  5  CC energy:   -24.16519776  Energy decrease:   0.00021701
 ======================================================================
 Norm of residual vector:     0.00324373
 CPU time [min]:     0.188                   Wall time [min]:     0.470

 Iteration  6  CC energy:   -24.16513552  Energy decrease:   0.00006224
 ======================================================================
 Norm of residual vector:     0.00158733
 CPU time [min]:     0.215                   Wall time [min]:     0.498

 Iteration  7  CC energy:   -24.16519874  Energy decrease:   0.00006323
 ======================================================================
 Norm of residual vector:     0.00051373
 CPU time [min]:     0.244                   Wall time [min]:     0.529

 Iteration  8  CC energy:   -24.16520477  Energy decrease:   0.00000603
 ======================================================================
 Norm of residual vector:     0.00017720
 CPU time [min]:     0.273                   Wall time [min]:     0.558

 Iteration  9  CC energy:   -24.16520282  Energy decrease:   0.00000195
 ======================================================================
 Norm of residual vector:     0.00006187
 CPU time [min]:     0.301                   Wall time [min]:     0.591

 Iteration 10  CC energy:   -24.16520302  Energy decrease:   0.00000019
 ======================================================================
 Norm of residual vector:     0.00002184
 CPU time [min]:     0.329                   Wall time [min]:     0.620

 Iteration 11  CC energy:   -24.16520302  Energy decrease:   3.8107E-10
 ======================================================================
 Norm of residual vector:     0.00000681
 CPU time [min]:     0.357                   Wall time [min]:     0.648

 Iteration 12  CC energy:   -24.16520298  Energy decrease:   0.00000004
 ======================================================================
 Norm of residual vector:     0.00000252
 CPU time [min]:     0.386                   Wall time [min]:     0.678

 Iteration 13  CC energy:   -24.16520298  Energy decrease:   3.3587E-10
 ======================================================================
 Norm of residual vector:     0.00000082
 CPU time [min]:     0.415                   Wall time [min]:     0.708

 Iteration 14  CC energy:   -24.16520298  Energy decrease:   4.5294E-10
 ======================================================================
 Norm of residual vector:     0.00000029
 CPU time [min]:     0.444                   Wall time [min]:     0.737

 Iteration 15  CC energy:   -24.16520298  Energy decrease:   1.3389E-09
 ======================================================================
 Norm of residual vector:     0.00000010
 CPU time [min]:     0.472                   Wall time [min]:     0.767

 Iteration 16  CC energy:   -24.16520298  Energy decrease:   6.9937E-10
 ======================================================================
 Norm of residual vector:     0.00000003
 CPU time [min]:     0.498                   Wall time [min]:     0.805

 Iteration 17  CC energy:   -24.16520298  Energy decrease:   2.3342E-10
 ======================================================================

 Iteration has converged in 17 steps.

 Final results:
 Total CCSDT energy [au]:            -24.165202977937
 Total MP2 energy [au]:              -24.148738279721

 Perturbative corrections are calculated...
 ======================================================================
 Spin case  1   Alpha:  1   Beta:  3
 Number of excitations:        235120
 CPU time [min]:     1.093                   Wall time [min]:     1.401
 ======================================================================
 Spin case  2   Alpha:  2   Beta:  2
 Number of excitations:        1588850
 CPU time [min]:     2.530                   Wall time [min]:     2.845
 ======================================================================
 Spin case  3   Alpha:  3   Beta:  1
 Number of excitations:        671700
 CPU time [min]:     3.396                   Wall time [min]:     3.711
 ======================================================================
 Spin case  4   Alpha:  4   Beta:  0
 Number of excitations:        12879
 CPU time [min]:     3.464                   Wall time [min]:     3.780
 ======================================================================
 Number of 4-fold excitations: 2508549
 CPU time [min]:     3.464                   Wall time [min]:     3.780

 Total CCSDT[Q] energy [au]:         -24.165150544598
 Total CCSDT(Q) energy [au]:         -24.165284117119

 ************************ 2019-02-01 16:54:56 *************************
                      Normal termination of mrcc.
 **********************************************************************
 !CCSDT STATE 1.3 Energy              -24.165202977937
 !MP2 STATE 1.3 Energy                -24.148738279721
 !CCSDT[Q] STATE 1.3 Energy           -24.165150544598
 !CCSDT(Q) STATE 1.3 Energy           -24.165284117119
 
 CPU-time for MRCC:            207.8 sec
 Elapsed-time for MRCC:        230.6 sec

 Variable memory set to 8000000000 words,  buffer space   230000 words



 **********************************************************************************************************************************
 DATASETS  * FILE   NREC   LENGTH (MB)   RECORD NAMES
              1      20       20.41       500      610      700      900      950      970     1000      129      960     1100   
                                          VAR    BASINP    GEOM    SYMINP    ZMAT    AOBASIS   BASIS     P2S    ABASIS      S 
                                         1400     1410     1420     1200     1210     1080     1600     1650     1300     1700   
                                         EKIN       V       ECP      H0       H01     AOSYM     SMH    MOLCAS    ERIS     OPER   

              2       5        5.27       700     1000      520     2100     2200   
                                         GEOM     BASIS   MCVARS     RHF      UHF  

 PROGRAMS   *        TOTAL      MRCC       UHF        HF       INT
 CPU TIMES  *       210.67    208.71      0.00      0.03      1.79
 REAL TIME  *       248.05 SEC
 DISK USED  *        25.77 MB      
 **********************************************************************************************************************************
 SETTING POSTHF(I)      =       -24.16528412  AU                              
                                                                                                                                                                                                                                                                

        SCF            POSTHF        EKIN          POT
    -23.93782831   -24.16528412   18.64372752   -8.77095768
                                                  

 CCSDT(Q)/USERDEF energy=    -24.165284117119

        CCSDT(Q)        UHF-SCF         HF-SCF  
    -24.16528412    -23.93782831    -23.93782831
 **********************************************************************************************************************************
 Molpro calculation terminated
 Variable memory released
