
 Primary working directories    : /global/cscratch1/sd/aannabe
 Secondary working directories  : /global/cscratch1/sd/aannabe
 Wavefunction directory         : /global/homes/a/aannabe/wfu/
 Main file repository           : /global/cscratch1/sd/aannabe/

 SHA1      : 2873118e99aab1bc19f5b6fc1784693c06d15c95
 NAME      : 2015.1.8
 ARCHNAME  : linux/x86_64
 FC        : /opt/cray/pe/craype/2.5.5/bin/ftn
 BLASLIB   : -Wl,-_start-group /opt/intel/compilers_and_libraries_2016.3.210/linux/mkl/lib/intel64/libmkl_intel_ilp64.a /opt/intel/compilers_and_libraries_2016.3.210/linux/mkl/lib/intel64/libmkl_intel_thread.a /opt/intel/compilers_and_libraries_2016.3.210/linux/mkl/lib/intel64/libmkl_core.a -Wl,-_end-group
 id        : lbl

 Nodes     nprocs
 nid00498     1

 Using customized tuning parameters: mindgm=8; mindgv=16; mindgc=4; mindgr=1; noblas=0; minvec=7
 default implementation of scratch files=df  

 ***,F
 memory,8,g
 gthresh,twoint=1.e-12
 
 gprint,basis,orbitals
 gexpec,ekin,pot
 
 angstrom
 geometry={
 1                                                                               ! Number of atoms
 F 0.0 0.0 0.0
 }
 
 basis={
 Including file /global/homes/a/aannabe/docs/totals/pps/F.pp
 Including file /global/homes/a/aannabe/docs/totals/basis/aug-cc-pVnZ/F_qz.basis
 }
 
 {hf
 wf,7,3,1
 occ,1,1,1,0,1,0,0,0
                                                                                 !open,1.3
 closed,1,1,0,0,1,0,0,0
                                                                                 !sym,
 }
 scf(i)=energy
 
 _CC_NORM_MAX=2.0
  !NOTE: Perturbative MRCC works only with UHF reference. So, here we will trick MRCC by doing zero UHF iteration right after ROHF.
 
 {uhf
 wf,7,3,1
 occ,1,1,1,0,1,0,0,0
                                                                                 !open,1.3
 closed,1,1,0,0,1,0,0,0
                                                                                 !sym,
 maxit,0
 }
 scf(i)=energy
 
 {mrcc,method=CCSDT(Q)
 orbital,ignore_error=1                                                          !Ignore the fact that UHF WF is not converged
 maxit,100
 core
 }
 posthf(i)=energy
 
 table,scf,posthf,ekin,pot
 save,4.csv,new
 
 

 Variables initialized (889), CPU time= 0.00 sec
 Commands  initialized (702), CPU time= 0.01 sec, 572 directives.
 Default parameters read. Elapsed time= 0.13 sec

 Checking input...
 Passed
1


                                         ***  PROGRAM SYSTEM MOLPRO  ***
                                       Copyright, TTI GmbH Stuttgart, 2015
                                    Version 2015.1 linked Sep  7 2016 23:09:38


 **********************************************************************************************************************************
 LABEL *   F                                                                             
  64 bit serial version                                                                  DATE: 15-Jun-18          TIME: 16:26:58  
 **********************************************************************************************************************************

 SHA1:             2873118e99aab1bc19f5b6fc1784693c06d15c95
 **********************************************************************************************************************************

 THRESHOLDS:

 ZERO    =  1.00D-12  ONEINT  =  1.00D-12  TWOINT  =  1.00D-12  PREFAC  =  1.00D-14  LOCALI  =  1.00D-09  EORDER  =  1.00D-04
 ENERGY  =  0.00D+00  ETEST   =  0.00D+00  EDENS   =  0.00D+00  THRDEDEF=  1.00D-06  GRADIENT=  1.00D-02  STEP    =  1.00D-03
 ORBITAL =  1.00D-05  CIVEC   =  1.00D-05  COEFF   =  1.00D-04  PRINTCI =  5.00D-02  PUNCHCI =  9.90D+01  OPTGRAD =  3.00D-04
 OPTENERG=  1.00D-06  OPTSTEP =  3.00D-04  THRGRAD =  1.00D-10  COMPRESS=  1.00D-11  VARMIN  =  1.00D-07  VARMAX  =  1.00D-03
 THRDOUB =  0.00D+00  THRDIV  =  1.00D-05  THRRED  =  1.00D-07  THRPSP  =  1.00D+00  THRDC   =  1.00D-10  THRCS   =  1.00D-10
 THRNRM  =  1.00D-08  THREQ   =  0.00D+00  THRDE   =  1.00D+00  THRREF  =  1.00D-05  SPARFAC =  1.00D+00  THRDLP  =  1.00D-07
 THRDIA  =  1.00D-10  THRDLS  =  1.00D-07  THRGPS  =  0.00D+00  THRKEX  =  0.00D+00  THRDIS  =  2.00D-01  THRVAR  =  1.00D-10
 THRLOC  =  1.00D-06  THRGAP  =  1.00D-06  THRLOCT = -1.00D+00  THRGAPT = -1.00D+00  THRORB  =  1.00D-06  THRMLTP =  0.00D+00
 THRCPQCI=  1.00D-10  KEXTA   =  0.00D+00  THRCOARS=  0.00D+00  SYMTOL  =  1.00D-06  GRADTOL =  1.00D-06  THROVL  =  1.00D-08
 THRORTH =  1.00D-08  GRID    =  1.00D-06  GRIDMAX =  1.00D-03  DTMAX   =  0.00D+00  THROCCDE=  1.00D-01  THROCCDE=  1.00D-01



 ZUNIT=ANG
 

Geometry recognized as XYZ


 Variable memory set to 8000000000 words,  buffer space   230000 words

 SETTING BASIS          =    USERDEF


 Recomputing integrals since basis changed


 Using spherical harmonics



 PROGRAM * SEWARD (Integral evaluation for generally contracted gaussian basis sets)     Author: Roland Lindh, 1990

 Geometry written to block  1 of record 700

 Orientation using atomic masses  
 Molecule type: Atom
 Symmetry elements: X,Y,Z
 Rotational constants:       0.0000000      0.0000000      0.0000000 GHz  (calculated with average atomic masses)

 Point group  D2h 



 ATOMIC COORDINATES

 NR  ATOM    CHARGE       X              Y              Z

   1  F       7.00    0.000000000    0.000000000    0.000000000


          F   CORE POTENTIAL

          p POTENTIAL

 POWERS             1              3              2
 EXPONENTIALS   11.39544       10.49202       10.28681    
 COEFFICIENTS   7.000000       79.76808      -49.49901    

          s - p POTENTIAL

 POWERS             2
 EXPONENTIALS   11.39035    
 COEFFICIENTS   51.39347    


 BASIS DATA

   Nr Sym  Nuc  Type         Exponents   Contraction coefficients

    1.1 Ag    1  1s          71.173909    -0.000057
                             33.399038     0.000363
                             15.672819     0.009533
                              7.354620    -0.127065
                              3.451226     0.011527
                              1.619521     0.290584
                              0.759976     0.448567
                              0.356626     0.312306
                              0.167350     0.065625
    2.1 Ag    1  1s           1.705653     1.000000
    3.1 Ag    1  1s           1.048013     1.000000
    4.1 Ag    1  1s           0.294345     1.000000
    5.1 Ag    1  1s           0.117738     1.000000
    6.1 Ag    1  3d0          4.998085     1.000000
    7.1 Ag    1  3d2+         4.998085     1.000000
    8.1 Ag    1  3d0          1.724392     1.000000
    9.1 Ag    1  3d2+         1.724392     1.000000
   10.1 Ag    1  3d0          0.587354     1.000000
   11.1 Ag    1  3d2+         0.587354     1.000000
   12.1 Ag    1  3d0          0.234942     1.000000
   13.1 Ag    1  3d2+         0.234942     1.000000
   14.1 Ag    1  5g0          2.406583     1.000000
   15.1 Ag    1  5g4+         2.406583     1.000000
   16.1 Ag    1  5g2+         2.406583     1.000000
   17.1 Ag    1  5g0          0.962633     1.000000
   18.1 Ag    1  5g4+         0.962633     1.000000
   19.1 Ag    1  5g2+         0.962633     1.000000
    1.2 B3u   1  2px         27.863051     0.003758
                             13.662475     0.043495
                              6.699310     0.093050
                              3.284965     0.177293
                              1.610762     0.261759
                              0.789827     0.289687
                              0.387287     0.243341
                              0.189904     0.125496
                              0.093118     0.026843
    2.2 B3u   1  2px          1.650688     1.000000
    3.2 B3u   1  2px          0.647240     1.000000
    4.2 B3u   1  2px          0.205806     1.000000
    5.2 B3u   1  2px          0.082322     1.000000
    6.2 B3u   1  4f1+         3.694285     1.000000
    7.2 B3u   1  4f3+         3.694285     1.000000
    8.2 B3u   1  4f1+         1.178147     1.000000
    9.2 B3u   1  4f3+         1.178147     1.000000
   10.2 B3u   1  4f1+         0.471259     1.000000
   11.2 B3u   1  4f3+         0.471259     1.000000
    1.3 B2u   1  2py         27.863051     0.003758
                             13.662475     0.043495
                              6.699310     0.093050
                              3.284965     0.177293
                              1.610762     0.261759
                              0.789827     0.289687
                              0.387287     0.243341
                              0.189904     0.125496
                              0.093118     0.026843
    2.3 B2u   1  2py          1.650688     1.000000
    3.3 B2u   1  2py          0.647240     1.000000
    4.3 B2u   1  2py          0.205806     1.000000
    5.3 B2u   1  2py          0.082322     1.000000
    6.3 B2u   1  4f1-         3.694285     1.000000
    7.3 B2u   1  4f3-         3.694285     1.000000
    8.3 B2u   1  4f1-         1.178147     1.000000
    9.3 B2u   1  4f3-         1.178147     1.000000
   10.3 B2u   1  4f1-         0.471259     1.000000
   11.3 B2u   1  4f3-         0.471259     1.000000
    1.4 B1g   1  3d2-         4.998085     1.000000
    2.4 B1g   1  3d2-         1.724392     1.000000
    3.4 B1g   1  3d2-         0.587354     1.000000
    4.4 B1g   1  3d2-         0.234942     1.000000
    5.4 B1g   1  5g2-         2.406583     1.000000
    6.4 B1g   1  5g4-         2.406583     1.000000
    7.4 B1g   1  5g2-         0.962633     1.000000
    8.4 B1g   1  5g4-         0.962633     1.000000
    1.5 B1u   1  2pz         27.863051     0.003758
                             13.662475     0.043495
                              6.699310     0.093050
                              3.284965     0.177293
                              1.610762     0.261759
                              0.789827     0.289687
                              0.387287     0.243341
                              0.189904     0.125496
                              0.093118     0.026843
    2.5 B1u   1  2pz          1.650688     1.000000
    3.5 B1u   1  2pz          0.647240     1.000000
    4.5 B1u   1  2pz          0.205806     1.000000
    5.5 B1u   1  2pz          0.082322     1.000000
    6.5 B1u   1  4f0          3.694285     1.000000
    7.5 B1u   1  4f2+         3.694285     1.000000
    8.5 B1u   1  4f0          1.178147     1.000000
    9.5 B1u   1  4f2+         1.178147     1.000000
   10.5 B1u   1  4f0          0.471259     1.000000
   11.5 B1u   1  4f2+         0.471259     1.000000
    1.6 B2g   1  3d1+         4.998085     1.000000
    2.6 B2g   1  3d1+         1.724392     1.000000
    3.6 B2g   1  3d1+         0.587354     1.000000
    4.6 B2g   1  3d1+         0.234942     1.000000
    5.6 B2g   1  5g1+         2.406583     1.000000
    6.6 B2g   1  5g3+         2.406583     1.000000
    7.6 B2g   1  5g1+         0.962633     1.000000
    8.6 B2g   1  5g3+         0.962633     1.000000
    1.7 B3g   1  3d1-         4.998085     1.000000
    2.7 B3g   1  3d1-         1.724392     1.000000
    3.7 B3g   1  3d1-         0.587354     1.000000
    4.7 B3g   1  3d1-         0.234942     1.000000
    5.7 B3g   1  5g1-         2.406583     1.000000
    6.7 B3g   1  5g3-         2.406583     1.000000
    7.7 B3g   1  5g1-         0.962633     1.000000
    8.7 B3g   1  5g3-         0.962633     1.000000
    1.8 Au    1  4f2-         3.694285     1.000000
    2.8 Au    1  4f2-         1.178147     1.000000
    3.8 Au    1  4f2-         0.471259     1.000000

 NUCLEAR CHARGE:                    7
 NUMBER OF PRIMITIVE AOS:         136
 NUMBER OF SYMMETRY AOS:          111
 NUMBER OF CONTRACTIONS:           79   (  19Ag  +  11B3u +  11B2u +   8B1g +  11B1u +   8B2g +   8B3g +   3Au  )
 NUMBER OF CORE ORBITALS:           0   (   0Ag  +   0B3u +   0B2u +   0B1g +   0B1u +   0B2g +   0B3g +   0Au  )
 NUMBER OF VALENCE ORBITALS:        4   (   1Ag  +   1B3u +   1B2u +   0B1g +   1B1u +   0B2g +   0B3g +   0Au  )


 NUCLEAR REPULSION ENERGY    0.00000000

 EXTRA SYMMETRY OF AOS IN SYMMETRY 1:   1 1 1 1 1 2 3 2 3 2   3 2 3 4 5 6 4 5 6
 EXTRA SYMMETRY OF AOS IN SYMMETRY 2:   1 1 1 1 1 2 3 2 3 2   3
 EXTRA SYMMETRY OF AOS IN SYMMETRY 3:   1 1 1 1 1 2 3 2 3 2   3
 EXTRA SYMMETRY OF AOS IN SYMMETRY 4:   1 1 1 1 2 3 2 3
 EXTRA SYMMETRY OF AOS IN SYMMETRY 5:   1 1 1 1 1 2 3 2 3 2   3
 EXTRA SYMMETRY OF AOS IN SYMMETRY 6:   1 1 1 1 2 3 2 3
 EXTRA SYMMETRY OF AOS IN SYMMETRY 7:   1 1 1 1 2 3 2 3

 Eigenvalues of metric

         1 0.134E-02 0.162E-01 0.119E+00 0.124E+00 0.124E+00 0.425E+00 0.425E+00 0.428E+00
         2 0.174E-01 0.730E-01 0.254E+00 0.254E+00 0.277E+00 0.876E+00 0.876E+00 0.124E+01
         3 0.174E-01 0.730E-01 0.254E+00 0.254E+00 0.277E+00 0.876E+00 0.876E+00 0.124E+01
         4 0.124E+00 0.425E+00 0.428E+00 0.428E+00 0.121E+01 0.157E+01 0.157E+01 0.224E+01
         5 0.174E-01 0.730E-01 0.254E+00 0.254E+00 0.277E+00 0.876E+00 0.876E+00 0.124E+01
         6 0.124E+00 0.425E+00 0.428E+00 0.428E+00 0.121E+01 0.157E+01 0.157E+01 0.224E+01
         7 0.124E+00 0.425E+00 0.428E+00 0.428E+00 0.121E+01 0.157E+01 0.157E+01 0.224E+01
         8 0.254E+00 0.876E+00 0.187E+01


 Contracted 2-electron integrals neglected if value below      1.0D-12
 AO integral compression algorithm  1   Integral accuracy      1.0D-12

     6.816 MB (compressed) written to integral file ( 70.0%)


 NUMBER OF SORTED TWO-ELECTRON INTEGRALS:     665704.     BUFFER LENGTH:  32768
 NUMBER OF SEGMENTS:   1  SEGMENT LENGTH:     665704      RECORD LENGTH: 524288

 Memory used in sort:       1.22 MW

 SORT1 READ     1222209. AND WROTE      500866. INTEGRALS IN      2 RECORDS. CPU TIME:     0.03 SEC, REAL TIME:     0.05 SEC
 SORT2 READ      500866. AND WROTE      665704. INTEGRALS IN     26 RECORDS. CPU TIME:     0.06 SEC, REAL TIME:     0.11 SEC

 FILE SIZES:   FILE 1:    26.0 MBYTE,  FILE 4:     8.4 MBYTE,   TOTAL:     34.5 MBYTE

 OPERATOR DM      FOR CENTER  0  COORDINATES:    0.000000    0.000000    0.000000
 OPERATOR EKIN    FOR CENTER  0  COORDINATES:    0.000000    0.000000    0.000000
 OPERATOR POT     FOR CENTER  0  COORDINATES:    0.000000    0.000000    0.000000


 **********************************************************************************************************************************
 DATASETS  * FILE   NREC   LENGTH (MB)   RECORD NAMES
              1      20       22.88       500      610      700      900      950      970     1000      129      960     1100   
                                          VAR    BASINP    GEOM    SYMINP    ZMAT    AOBASIS   BASIS     P2S    ABASIS      S 
                                         1400     1410     1420     1200     1210     1080     1600     1650     1300     1700   
                                         EKIN       V       ECP      H0       H01     AOSYM     SMH    MOLCAS    ERIS     OPER   

 PROGRAMS   *        TOTAL       INT
 CPU TIMES  *         2.32      2.22
 REAL TIME  *        13.11 SEC
 DISK USED  *        34.75 MB      
 **********************************************************************************************************************************


 PROGRAM * RHF-SCF (OPEN SHELL)       Authors: W. Meyer, H.-J. Werner


 NUMBER OF ELECTRONS:       4+    3-    SPACE SYMMETRY=3    SPIN SYMMETRY: Doublet 
 CONVERGENCE THRESHOLDS:    1.00E-05 (Density)    1.00E-07 (Energy)
 MAX. NUMBER OF ITERATIONS:       60
 INTERPOLATION TYPE:            DIIS
 INTERPOLATION STEPS:              2 (START)      1 (STEP)
 LEVEL SHIFTS:                 -0.60 (CLOSED) -0.30 (OPEN) 

 Number of closed-shell orbitals:    3 (   1   1   0   0   1   0   0   0 )
 Number of open-shell orbitals:      1 (   0   0   1   0   0   0   0   0 )



   Atom=F  basis=ECP2MWB_GUESS     lmin=0  lmax=1

 Orbital guess generated from atomic densities. Full valence occupancy:    1   1   1   0   1   0   0   0


 Molecular orbital dump at record        2100.2

 ITERATION    DDIFF          GRAD             ENERGY        2-EL.EN.            DIPOLE MOMENTS         DIIS   ORB.
    1      0.000D+00      0.000D+00       -23.90168487     33.743261    0.00000    0.00000    0.00000    0    start
    2      0.000D+00      0.140D-01       -23.90748677     34.270857    0.00000    0.00000    0.00000    1    diag,B
    3      0.695D-02      0.331D-02       -23.90785368     34.234575    0.00000    0.00000    0.00000    2    diag,B
    4      0.185D-02      0.896D-03       -23.90794563     34.247553    0.00000    0.00000    0.00000    3    diag,B
    5      0.658D-03      0.297D-03       -23.90795758     34.248440    0.00000    0.00000    0.00000    4    diag,B
    6      0.321D-03      0.500D-04       -23.90795787     34.247777    0.00000    0.00000    0.00000    5    diag,B
    7      0.561D-04      0.935D-05       -23.90795788     34.247620    0.00000    0.00000    0.00000    6    fixocc
    8      0.881D-05      0.224D-05       -23.90795788     34.247601    0.00000    0.00000    0.00000    0    orth

 Final alpha occupancy:   1   1   1   0   1   0   0   0
 Final beta  occupancy:   1   1   0   0   1   0   0   0

 !RHF STATE 1.3 Energy                -23.907957882277
 Nuclear energy                         0.00000000
 One-electron energy                  -41.03175814
 Two-electron energy                   17.12380026
 Virial quotient                       -1.29006840
 !RHF STATE 1.3 Dipole moment           0.00000000     0.00000000     0.00000000
 Dipole moment /Debye                   0.00000000     0.00000000     0.00000000
 

 !RHF expec          <1.3|EKIN|1.3>    18.532318072622
 
 !RHF expec           <1.3|POT|1.3>    -8.840884240608

 ELECTRON ORBITALS
 =================


   Orb  Occ    Energy  Couls-En    Coefficients

                                   1 1s      1 1s      1 1s      1 1s      1 1s      1 3d0     1 3d2+    1 3d0     1 3d2+    1 3d0  
                                   1 3d2+    1 3d0     1 3d2+    1 5g0     1 5g4+    1 5g2+    1 5g0     1 5g4+    1 5g2+ 

   1.1   2    -1.5590   -7.9872  1.000149  0.000032 -0.000086 -0.000207  0.000128  0.000390  0.000675  0.000094  0.000163  0.001117
                                 0.001934  0.000958  0.001659 -0.000000 -0.000000 -0.000000 -0.000006 -0.000011 -0.000008

                                   1 2px     1 2px     1 2px     1 2px     1 2px     1 4f1+    1 4f3+    1 4f1+    1 4f3+    1 4f1+ 
                                   1 4f3+ 

   1.2   2    -0.7074   -6.3245  0.999987  0.000033  0.000065 -0.000091 -0.000067 -0.000281 -0.001090 -0.000573 -0.002220 -0.000404
                                -0.001566

                                   1 2py     1 2py     1 2py     1 2py     1 2py     1 4f1-    1 4f3-    1 4f1-    1 4f3-    1 4f1- 
                                   1 4f3- 

   1.3   +    -0.8366   -6.5433  1.026012  0.008015 -0.005669 -0.038326 -0.010565 -0.001866 -0.002409 -0.003669 -0.004737 -0.002117
                                -0.002733

                                   1 2pz     1 2pz     1 2pz     1 2pz     1 2pz     1 4f0     1 4f2+    1 4f0     1 4f2+    1 4f0  
                                   1 4f2+ 

   1.5   2    -0.7074   -6.3245  0.999987  0.000033  0.000065 -0.000091 -0.000067 -0.000689 -0.000890 -0.001404 -0.001813 -0.000991
                                -0.001279

 HOMO      1.2    -0.707383 =     -19.2489eV
 LUMO      2.3     0.192276 =       5.2321eV
 LUMO-HOMO         0.899658 =      24.4810eV


 **********************************************************************************************************************************
 DATASETS  * FILE   NREC   LENGTH (MB)   RECORD NAMES
              1      20       22.88       500      610      700      900      950      970     1000      129      960     1100   
                                          VAR    BASINP    GEOM    SYMINP    ZMAT    AOBASIS   BASIS     P2S    ABASIS      S 
                                         1400     1410     1420     1200     1210     1080     1600     1650     1300     1700   
                                         EKIN       V       ECP      H0       H01     AOSYM     SMH    MOLCAS    ERIS     OPER   

              2       4        2.78       700     1000      520     2100   
                                         GEOM     BASIS   MCVARS     RHF  

 PROGRAMS   *        TOTAL        HF       INT
 CPU TIMES  *         2.39      0.06      2.22
 REAL TIME  *        13.29 SEC
 DISK USED  *        34.75 MB      
 **********************************************************************************************************************************
 SETTING SCF(I)         =       -23.90795788  AU                              
 SETTING _CC_NORM_MAX   =         2.00000000                                  


 PROGRAM * UHF-SCF       Authors: W. Meyer, H.-J. Werner


 NUMBER OF ELECTRONS:       4+    3-    SPACE SYMMETRY=3    SPIN SYMMETRY: Doublet 
 CONVERGENCE THRESHOLDS:    1.00E-05 (Density)    1.00E-07 (Energy)
 MAX. NUMBER OF ITERATIONS:        0
 INTERPOLATION TYPE:            DIIS
 INTERPOLATION STEPS:              2 (START)      1 (STEP)
 LEVEL SHIFTS:                  0.20 (ALPHA)   0.20 (BETA) 

 Number of closed-shell orbitals:    3 (   1   1   0   0   1   0   0   0 )
 Number of open-shell orbitals:      1 (   0   0   1   0   0   0   0   0 )


 Molecular orbitals read from record     2100.2  Type=RHF/CANONICAL (state 1.3)

 Molecular orbital dump at record        2200.2

 Initial alpha occupation   1   1   1   0   1   0   0   0
 Initial beta  occupation   1   1   0   0   1   0   0   0

 ITERATION    DDIFF          GRAD             ENERGY        2-EL.EN.            DIPOLE MOMENTS         DIIS
    1      0.000D+00      0.000D+00       -23.90795788     34.247601    0.00000    0.00000    0.00000    0
 
 Final alpha occupancy:   1   1   1   0   1   0   0   0
 Final beta  occupancy:   1   1   0   0   1   0   0   0

 !UHF STATE 1.3 Energy                -23.907957882277
 Nuclear energy                         0.00000000
 One-electron energy                  -41.03175814
 Two-electron energy                   17.12380026
 Virial quotient                       -1.29006840
 !UHF STATE 1.3 Dipole moment           0.00000000     0.00000000     0.00000000
 Dipole moment /Debye                   0.00000000     0.00000000     0.00000000
 

 !UHF expec          <1.3|EKIN|1.3>    18.532318072622
 
 !UHF expec           <1.3|POT|1.3>    -8.840884240608

 ELECTRON ORBITALS FOR POSITIVE SPIN
 ===================================


   Orb  Occ    Energy  Couls-En    Coefficients

                                   1 1s      1 1s      1 1s      1 1s      1 1s      1 3d0     1 3d2+    1 3d0     1 3d2+    1 3d0  
                                   1 3d2+    1 3d0     1 3d2+    1 5g0     1 5g4+    1 5g2+    1 5g0     1 5g4+    1 5g2+ 

   1.1   +    -1.5590   -7.9872  1.000149  0.000032 -0.000086 -0.000207  0.000128  0.000390  0.000675  0.000094  0.000163  0.001117
                                 0.001934  0.000958  0.001659 -0.000000 -0.000000 -0.000000 -0.000006 -0.000011 -0.000008

                                   1 2px     1 2px     1 2px     1 2px     1 2px     1 4f1+    1 4f3+    1 4f1+    1 4f3+    1 4f1+ 
                                   1 4f3+ 

   1.2   +    -0.7074   -6.3245  0.999987  0.000033  0.000065 -0.000091 -0.000067 -0.000281 -0.001090 -0.000573 -0.002220 -0.000404
                                -0.001566

                                   1 2py     1 2py     1 2py     1 2py     1 2py     1 4f1-    1 4f3-    1 4f1-    1 4f3-    1 4f1- 
                                   1 4f3- 

   1.3   +    -0.8366   -6.5433  1.026012  0.008015 -0.005669 -0.038326 -0.010565 -0.001866 -0.002409 -0.003669 -0.004737 -0.002117
                                -0.002733

                                   1 2pz     1 2pz     1 2pz     1 2pz     1 2pz     1 4f0     1 4f2+    1 4f0     1 4f2+    1 4f0  
                                   1 4f2+ 

   1.5   +    -0.7074   -6.3245  0.999987  0.000033  0.000065 -0.000091 -0.000067 -0.000689 -0.000890 -0.001404 -0.001813 -0.000991
                                -0.001279

 ELECTRON ORBITALS FOR NEGATIVE SPIN
 ===================================


   Orb  Occ    Energy  Couls-En    Coefficients

                                   1 1s      1 1s      1 1s      1 1s      1 1s      1 3d0     1 3d2+    1 3d0     1 3d2+    1 3d0  
                                   1 3d2+    1 3d0     1 3d2+    1 5g0     1 5g4+    1 5g2+    1 5g0     1 5g4+    1 5g2+ 

   1.1   -    -1.5590   -7.9872  1.000149  0.000032 -0.000086 -0.000207  0.000128  0.000390  0.000675  0.000094  0.000163  0.001117
                                 0.001934  0.000958  0.001659 -0.000000 -0.000000 -0.000000 -0.000006 -0.000011 -0.000008

                                   1 2px     1 2px     1 2px     1 2px     1 2px     1 4f1+    1 4f3+    1 4f1+    1 4f3+    1 4f1+ 
                                   1 4f3+ 

   1.2   -    -0.7074   -6.3245  0.999987  0.000033  0.000065 -0.000091 -0.000067 -0.000281 -0.001090 -0.000573 -0.002220 -0.000404
                                -0.001566

                                   1 2pz     1 2pz     1 2pz     1 2pz     1 2pz     1 4f0     1 4f2+    1 4f0     1 4f2+    1 4f0  
                                   1 4f2+ 

   1.5   -    -0.7074   -6.3245  0.999987  0.000033  0.000065 -0.000091 -0.000067 -0.000689 -0.000890 -0.001404 -0.001813 -0.000991
                                -0.001279

 HOMO      1.2    -0.707383 =     -19.2489eV
 LUMO     -1.3    -0.836570 =     -22.7642eV
 LUMO-HOMO        -0.129187 =      -3.5154eV

 EXPECTATION VALUE OF S**2:             0.75000000

 Occupation number threshold for canonical orbitals:  1.999000 (occupied),  0.001000 (virtual)

 Number of pseudo-canonical orbitals per symmetry:    1   1   0   0   1   0   0   0
 Number of active natural orbitals per symmetry:      0   0   1   0   0   0   0   0

 NATURAL CHARGE ORBITALS
 =======================


   Orb     Occ        Energy       Coefficients

                                   1 1s      1 1s      1 1s      1 1s      1 1s      1 3d0     1 3d2+    1 3d0     1 3d2+    1 3d0  
                                   1 3d2+    1 3d0     1 3d2+    1 5g0     1 5g4+    1 5g2+    1 5g0     1 5g4+    1 5g2+ 

   1.1  2.00000    -1.559024     1.000149  0.000032 -0.000086 -0.000207  0.000128  0.000390  0.000675  0.000094  0.000163  0.001117
                                 0.001934  0.000958  0.001659 -0.000000 -0.000000 -0.000000 -0.000006 -0.000011 -0.000008

                                   1 2px     1 2px     1 2px     1 2px     1 2px     1 4f1+    1 4f3+    1 4f1+    1 4f3+    1 4f1+ 
                                   1 4f3+ 

   1.2  2.00000    -0.707383     0.999987  0.000033  0.000065 -0.000091 -0.000067 -0.000281 -0.001090 -0.000573 -0.002220 -0.000404
                                -0.001566

                                   1 2py     1 2py     1 2py     1 2py     1 2py     1 4f1-    1 4f3-    1 4f1-    1 4f3-    1 4f1- 
                                   1 4f3- 

   1.3  1.00000    -0.360030     1.026012  0.008015 -0.005669 -0.038326 -0.010565 -0.001866 -0.002409 -0.003669 -0.004737 -0.002117
                                -0.002733

                                   1 2pz     1 2pz     1 2pz     1 2pz     1 2pz     1 4f0     1 4f2+    1 4f0     1 4f2+    1 4f0  
                                   1 4f2+ 

   1.5  2.00000    -0.707383     0.999987  0.000033  0.000065 -0.000091 -0.000067 -0.000689 -0.000890 -0.001404 -0.001813 -0.000991
                                -0.001279

 Natural orbitals saved to record    2200.2 (Orbital set 3)

 Orbital spaces for UNO-CAS (Min. occupation: 0.020  Max. occupation: 1.980):

 Closed:        1   1   0   0   1   0   0   0
 Active:        0   0   1   0   0   0   0   0

 No convergence



 **********************************************************************************************************************************
 DATASETS  * FILE   NREC   LENGTH (MB)   RECORD NAMES
              1      20       22.88       500      610      700      900      950      970     1000      129      960     1100   
                                          VAR    BASINP    GEOM    SYMINP    ZMAT    AOBASIS   BASIS     P2S    ABASIS      S 
                                         1400     1410     1420     1200     1210     1080     1600     1650     1300     1700   
                                         EKIN       V       ECP      H0       H01     AOSYM     SMH    MOLCAS    ERIS     OPER   

              2       5        5.33       700     1000      520     2100     2200   
                                         GEOM     BASIS   MCVARS     RHF      UHF  

 PROGRAMS   *        TOTAL       UHF        HF       INT
 CPU TIMES  *         2.41      0.02      0.06      2.22
 REAL TIME  *        13.40 SEC
 DISK USED  *        34.75 MB      
 **********************************************************************************************************************************
 SETTING SCF(I)         =       -23.90795788  AU                              


 PROGRAM * MRCC (General Multireference Coupled Cluster)    Author: M. Kallay, 2000-2005

 ***  Initialisation ***

   0 Spin projections
 
 Molecular orbitals read from record     2200.2  Type=UHF/ALPHA (state 1.3)

 ?Warning: UHF not converged
 Molecular orbitals read from record     2200.2  Type=UHF/BETA (state 1.3)

 ?Warning: UHF not converged
 
 Frozen orbitals:              0 (  0  0  0  0  0  0  0  0)
 Active orbitals:             79 ( 19 11 11  8 11  8  8  3)
 Active electrons:             7
 Spin quantum number:          0.5

 Transformed integrals will be written to file mrcc_37744/fort.55

 Load integrals                2.4 sec
 Transform integrals           2.9 sec
 Storage for integrals:        3835052
 Remaining memory:           *********

 Core energy:               0.00000000
 
 MRCC Input:
     4     0     0     0     3     0     0     3     0     0     0     1     1     0     0     7     0     0   0.000     0   64000
  ex.lev,nsing,ntrip, rest,method,dens,conver,symm, diag, CS ,spatial, HF, ndoub,nacto,nactv, tol, maxex, sacc, freq,  dboc,   mem
  2  0  0  0  0  0  0  0  0  0  0  0  0  0  0  0  0  0  0  2  0  0  0  0  0  0  0  0  0  0  1  0  0  0  0  0  0  0  0  0  0  0  0  0  0  0  0  0  0  2  0  0  0  0  0  0  0  0  0  0  0  0  0  0  0  0  0  0  0  0  0  0  0  0  0  0  0  0  0
 MRCC Input end
 Variable memory released
 MRCC now being run, temporary output in /global/cscratch1/sd/aannabe/mrcc_37744/mrcc.out
 **********************************************************************
                          MRCC program system
 **********************************************************************

                              Written by
  Mihaly Kallay, Zoltan Rolik, Jozsef Csontos, Peter Nagy, Gyula Samu,
      David Mester, Jozsef Csoka, Bernat Szabo, Istvan Ladjanszki,
       Lorant Szegedy, Bence Ladoczki, Klara Petrov, Mate Farkas,
                    Pal D. Mezei, and Bence Hegely

        Department of Physical Chemistry and Materials Science
            Budapest University of Technology and Economics
                  Budapest P.O.Box 91, H-1521 Hungary

                              www.mrcc.hu

                       Release date: May 23, 2018

 ************************ 2018-06-15 16:28:06 *************************
 Executing goldstone...

 Generation of CC equations in terms of H and T...
 Generation of antisymmetrized Goldstone diagrams...
 Number of diagrams in T^1 equations:    15
 Number of diagrams in T^2 equations:    38
 Number of diagrams in T^3 equations:    49
 Number of diagrams in T^4 equations:     5
 Translation of diagrams to factorized equations...
 Optimizing intermediate calculation...
 Number of floating-point operations per iteration step:   9.6462E+10
 Probable CPU time per iteration step (hours):      0.96
 Required memory (Mbytes):    4263.8
 Number of intermediates:                                  79
 Number of intermediates to be stored:                     32
 Length of intermediate file (Mbytes):      82.9

 ************************ 2018-06-15 16:28:06 *************************
 Executing xmrcc...

 **********************************************************************
 CC(3)(4) calculation


 Allocation of4263.8 Mbytes of memory...
 Number of spinorbitals:                   158
 Number of alpha electrons:                        4
 Number of beta electrons:                         3
 Spin multiplicity:                     2
 z-component of spin:  0.5
 Spatial symmetry:                      3
 Convergence criterion:  1.0E-07
 Construction of occupation graphs...
 Number of                     0 -fold excitations:                      1
 Number of                     1 -fold excitations:                     86
 Number of                     2 -fold excitations:                  12116
 Number of                     3 -fold excitations:                 837497
 Total number of configurations:                 849700
 Calculation of coupling coefficients...
 Length of intermediate file (Mbytes):      63.1

 ======================================================================

 Spin case  1   Alpha:  1   Beta:  3
 Number of excitations:                2634577
 Spin case  2   Alpha:  2   Beta:  2
 Number of excitations:               17795529
 Spin case  3   Alpha:  3   Beta:  1
 Number of excitations:                7694349
 Spin case  4   Alpha:  4   Beta:  0
 Number of excitations:                 152628
 Number of                     4 -fold excitations:               28277083

 Memory requirements /Mbyte/:
               Minimal        Optimal
 Real*8:        124.8425       297.2647
 Integer:        38.9714
 Total:         163.8139       336.2361


 ************************ 2018-06-15 16:28:10 *************************
 Executing mrcc...

 **********************************************************************
 CCSDT(Q) calculation


 OpenMP parallel version is running.
 Number of CPUs:   1
 Allocation of  297.3 Mbytes of memory...
 Number of spinorbitals: 158
 Number of alpha electrons:  4
 Number of beta  electrons:  3
 Spin multiplicity: 2
 z-component of spin:  0.5
 Spatial symmetry: 3
 Convergence criterion:  1.0E-07
 Construction of occupation graphs...
 Number of 0-fold excitations: 1
 Number of 1-fold excitations: 86
 Number of 2-fold excitations: 12116
 Number of 3-fold excitations: 837497
 Total number of determinants: 849700
 Calculation of coupling coefficients...
 Initial cluster amplitudes are generated.
 Length of intermediate file (Mbytes):      63.1
 Reading integral list from unit 55...
 Sorting integrals...
 Sorting integrals...
 Sorting integrals...
 Sorting integrals...
 Energy of reference determinant [au]:     -23.907957882277
 Calculation of MP denominators...

 Starting CC iteration...
 ======================================================================
 Norm of residual vector:     1.53519352
 CPU time [min]:     0.368                   Wall time [min]:     0.375

 Iteration  1  CC energy:   -24.14276950  Energy decrease:   0.23481162
 ======================================================================
 Norm of residual vector:     0.29235162
 CPU time [min]:     0.597                   Wall time [min]:     0.615

 Iteration  2  CC energy:   -24.14917516  Energy decrease:   0.00640566
 ======================================================================
 Norm of residual vector:     0.05895887
 CPU time [min]:     0.835                   Wall time [min]:     0.862

 Iteration  3  CC energy:   -24.15664528  Energy decrease:   0.00747013
 ======================================================================
 Norm of residual vector:     0.01877696
 CPU time [min]:     1.082                   Wall time [min]:     1.121

 Iteration  4  CC energy:   -24.15831275  Energy decrease:   0.00166747
 ======================================================================
 Norm of residual vector:     0.00810609
 CPU time [min]:     1.321                   Wall time [min]:     1.373

 Iteration  5  CC energy:   -24.15804435  Energy decrease:   0.00026840
 ======================================================================
 Norm of residual vector:     0.00343906
 CPU time [min]:     1.562                   Wall time [min]:     1.626

 Iteration  6  CC energy:   -24.15796660  Energy decrease:   0.00007775
 ======================================================================
 Norm of residual vector:     0.00175658
 CPU time [min]:     1.807                   Wall time [min]:     1.884

 Iteration  7  CC energy:   -24.15802944  Energy decrease:   0.00006284
 ======================================================================
 Norm of residual vector:     0.00063006
 CPU time [min]:     2.054                   Wall time [min]:     2.137

 Iteration  8  CC energy:   -24.15804175  Energy decrease:   0.00001231
 ======================================================================
 Norm of residual vector:     0.00022883
 CPU time [min]:     2.298                   Wall time [min]:     2.391

 Iteration  9  CC energy:   -24.15803867  Energy decrease:   0.00000307
 ======================================================================
 Norm of residual vector:     0.00008567
 CPU time [min]:     2.544                   Wall time [min]:     2.643

 Iteration 10  CC energy:   -24.15803860  Energy decrease:   0.00000007
 ======================================================================
 Norm of residual vector:     0.00003155
 CPU time [min]:     2.806                   Wall time [min]:     2.921

 Iteration 11  CC energy:   -24.15803875  Energy decrease:   0.00000015
 ======================================================================
 Norm of residual vector:     0.00001011
 CPU time [min]:     3.055                   Wall time [min]:     3.181

 Iteration 12  CC energy:   -24.15803867  Energy decrease:   0.00000009
 ======================================================================
 Norm of residual vector:     0.00000367
 CPU time [min]:     3.306                   Wall time [min]:     3.442

 Iteration 13  CC energy:   -24.15803865  Energy decrease:   0.00000002
 ======================================================================
 Norm of residual vector:     0.00000112
 CPU time [min]:     3.561                   Wall time [min]:     3.706

 Iteration 14  CC energy:   -24.15803866  Energy decrease:   0.00000001
 ======================================================================
 Norm of residual vector:     0.00000039
 CPU time [min]:     3.810                   Wall time [min]:     3.968

 Iteration 15  CC energy:   -24.15803866  Energy decrease:   2.1050E-09
 ======================================================================
 Norm of residual vector:     0.00000015
 CPU time [min]:     4.065                   Wall time [min]:     4.241

 Iteration 16  CC energy:   -24.15803866  Energy decrease:   9.1067E-10
 ======================================================================
 Norm of residual vector:     0.00000006
 CPU time [min]:     4.313                   Wall time [min]:     4.501

 Iteration 17  CC energy:   -24.15803866  Energy decrease:   5.5055E-10
 ======================================================================

 Iteration has converged in 17 steps.

 Final results:
 Total CCSDT energy [au]:            -24.158038656752
 Total MP2 energy [au]:              -24.142769499837

 Perturbative corrections are calculated...
 ======================================================================
 Spin case  1   Alpha:  1   Beta:  3
 Number of excitations:        2634577
 CPU time [min]:    13.978                   Wall time [min]:    14.169
 ======================================================================
 Spin case  2   Alpha:  2   Beta:  2
 Number of excitations:        17795529
 CPU time [min]:    36.672                   Wall time [min]:    36.871
 ======================================================================
 Spin case  3   Alpha:  3   Beta:  1
 Number of excitations:        7694349
 CPU time [min]:    50.601                   Wall time [min]:    50.810
 ======================================================================
 Spin case  4   Alpha:  4   Beta:  0
 Number of excitations:        152628
 CPU time [min]:    51.520                   Wall time [min]:    51.738
 ======================================================================
 Number of 4-fold excitations: 28277083
 CPU time [min]:    51.520                   Wall time [min]:    51.739

 Total CCSDT[Q] energy [au]:         -24.157987737673
 Total CCSDT(Q) energy [au]:         -24.158141547926

 ************************ 2018-06-15 17:19:54 *************************
                      Normal termination of mrcc.
 **********************************************************************
 !CCSDT STATE 1.3 Energy              -24.158038656752
 !MP2 STATE 1.3 Energy                -24.142769499837
 !CCSDT[Q] STATE 1.3 Energy           -24.157987737673
 !CCSDT(Q) STATE 1.3 Energy           -24.158141547926
 
 CPU-time for MRCC:           3091.2 sec
 Elapsed-time for MRCC:       3109.9 sec

 Variable memory set to 8000000000 words,  buffer space   230000 words



 **********************************************************************************************************************************
 DATASETS  * FILE   NREC   LENGTH (MB)   RECORD NAMES
              1      20       22.88       500      610      700      900      950      970     1000      129      960     1100   
                                          VAR    BASINP    GEOM    SYMINP    ZMAT    AOBASIS   BASIS     P2S    ABASIS      S 
                                         1400     1410     1420     1200     1210     1080     1600     1650     1300     1700   
                                         EKIN       V       ECP      H0       H01     AOSYM     SMH    MOLCAS    ERIS     OPER   

              2       5        5.33       700     1000      520     2100     2200   
                                         GEOM     BASIS   MCVARS     RHF      UHF  

 PROGRAMS   *        TOTAL      MRCC       UHF        HF       INT
 CPU TIMES  *      3102.80   3100.39      0.02      0.06      2.22
 REAL TIME  *      3176.92 SEC
 DISK USED  *        34.75 MB      
 **********************************************************************************************************************************
 SETTING POSTHF(I)      =       -24.15814155  AU                              
                                                                                                                                                                                                                                                                

        SCF            POSTHF        EKIN          POT
    -23.90795788   -24.15814155   18.53231807   -8.84088424
                                                  

 CCSDT(Q)/USERDEF energy=    -24.158141547926

        CCSDT(Q)        UHF-SCF         HF-SCF  
    -24.15814155    -23.90795788    -23.90795788
 **********************************************************************************************************************************
 Variable memory released
