
 Primary working directories    : /global/cscratch1/sd/aannabe
 Secondary working directories  : /global/cscratch1/sd/aannabe
 Wavefunction directory         : /global/homes/a/aannabe/wfu/
 Main file repository           : /global/cscratch1/sd/aannabe/

 SHA1      : 19cd028119e0e09f93f0674bd8af7968d9b3eff6
 NAME      : 2015.1.36
 ARCHNAME  : linux/x86_64
 FC        : /opt/cray/pe/craype/2.5.14/bin/ftn
 BLASLIB   : -L/opt/intel/compilers_and_libraries_2018.1.163/linux/mkl/lib/intel64 -Wl,-_start-group -lmkl_intel_ilp64 -lmkl_intel_thread -lmkl_core -Wl,-_end-group -liomp5
 id        : lbl

 Nodes     nprocs
 nid00506     1

 Using customized tuning parameters: mindgm=7; mindgv=16; mindgc=1; mindgr=1; noblas=0; minvec=7
 default implementation of scratch files=df  

 ***,F
 memory,8,g
 gthresh,twoint=1.e-12
 
 gprint,basis,orbitals
 gexpec,ekin,pot
 
 angstrom
 geometry={
 1                                                                               ! Number of atoms
 F 0.0 0.0 0.0
 }
 
 basis={
                                                                  !include,/global/homes/a/aannabe/docs/accurate/ccECP_D2h/pps/F.pp
                                              !include,/global/homes/a/aannabe/docs/accurate/ccECP_D2h/basis/aug-cc-pVnZ/F_5Z.basis
                                                  !include,/global/homes/a/aannabe/docs/accurate/ccECP_D2h/basis/cc-pVnZ/F_5Z.basis
 
 Including file /global/homes/a/aannabe/repos/pseudopotentiallibrary/recipes/F/ccECP/F.ccECP.molpro
                                    !include,/global/homes/a/aannabe/repos/pseudopotentiallibrary/recipes/F/ccECP/F.cc-pCV5Z.molpro
 Including file /global/homes/a/aannabe/repos/pseudopotentiallibrary/recipes/F/ccECP/F.aug-cc-pV5Z.molpro
 
 
 }
 
 {hf
 wf,7,3,1
 occ,1,1,1,0,1,0,0,0
                                                                                 !open,1.3
 closed,1,1,0,0,1,0,0,0
                                                                                 !sym,
 }
 scf(i)=energy
 
 _CC_NORM_MAX=2.0
  !NOTE: Perturbative MRCC works only with UHF reference. So, here we will trick MRCC by doing zero UHF iteration right after ROHF.
 
 {uhf
 wf,7,3,1
 occ,1,1,1,0,1,0,0,0
                                                                                 !open,1.3
 closed,1,1,0,0,1,0,0,0
                                                                                 !sym,
 maxit,0
 }
 scf(i)=energy
 
 {mrcc,method=CCSDT(Q),dir=mrccdir                                               !,restart=1
 orbital,ignore_error=1                                                          !Ignore the fact that UHF WF is not converged
 maxit,100
 core
 }
 posthf(i)=energy
 
 table,scf,posthf,ekin,pot
 save,5.csv,new
 
 

 Variables initialized (889), CPU time= 0.00 sec
 Commands  initialized (702), CPU time= 0.01 sec, 572 directives.
 Default parameters read. Elapsed time= 0.24 sec

 Checking input...
 Passed
1


                                         ***  PROGRAM SYSTEM MOLPRO  ***
                                       Copyright, TTI GmbH Stuttgart, 2015
                                    Version 2015.1 linked Dec 29 2018 15:55:43


 **********************************************************************************************************************************
 LABEL *   F                                                                             
  64 bit serial version                                                                  DATE: 01-Feb-19          TIME: 17:47:53  
 **********************************************************************************************************************************

 SHA1:             19cd028119e0e09f93f0674bd8af7968d9b3eff6
 **********************************************************************************************************************************

 THRESHOLDS:

 ZERO    =  1.00D-12  ONEINT  =  1.00D-12  TWOINT  =  1.00D-12  PREFAC  =  1.00D-14  LOCALI  =  1.00D-09  EORDER  =  1.00D-04
 ENERGY  =  0.00D+00  ETEST   =  0.00D+00  EDENS   =  0.00D+00  THRDEDEF=  1.00D-06  GRADIENT=  1.00D-02  STEP    =  1.00D-03
 ORBITAL =  1.00D-05  CIVEC   =  1.00D-05  COEFF   =  1.00D-04  PRINTCI =  5.00D-02  PUNCHCI =  9.90D+01  OPTGRAD =  3.00D-04
 OPTENERG=  1.00D-06  OPTSTEP =  3.00D-04  THRGRAD =  1.00D-10  COMPRESS=  1.00D-11  VARMIN  =  1.00D-07  VARMAX  =  1.00D-03
 THRDOUB =  0.00D+00  THRDIV  =  1.00D-05  THRRED  =  1.00D-07  THRPSP  =  1.00D+00  THRDC   =  1.00D-10  THRCS   =  1.00D-10
 THRNRM  =  1.00D-08  THREQ   =  0.00D+00  THRDE   =  1.00D+00  THRREF  =  1.00D-05  SPARFAC =  1.00D+00  THRDLP  =  1.00D-07
 THRDIA  =  1.00D-10  THRDLS  =  1.00D-07  THRGPS  =  0.00D+00  THRKEX  =  0.00D+00  THRDIS  =  2.00D-01  THRVAR  =  1.00D-10
 THRLOC  =  1.00D-06  THRGAP  =  1.00D-06  THRLOCT = -1.00D+00  THRGAPT = -1.00D+00  THRORB  =  1.00D-06  THRMLTP =  0.00D+00
 THRCPQCI=  1.00D-10  KEXTA   =  0.00D+00  THRCOARS=  0.00D+00  SYMTOL  =  1.00D-06  GRADTOL =  1.00D-06  THROVL  =  1.00D-08
 THRORTH =  1.00D-08  GRID    =  1.00D-06  GRIDMAX =  1.00D-03  DTMAX   =  0.00D+00  THROCCDE=  1.00D-01  THROCCDE=  1.00D-01



 ZUNIT=ANG
 

Geometry recognized as XYZ


 Variable memory set to 8000000000 words,  buffer space   230000 words

 SETTING BASIS          =    USERDEF


 Recomputing integrals since basis changed


 Using spherical harmonics



 PROGRAM * SEWARD (Integral evaluation for generally contracted gaussian basis sets)     Author: Roland Lindh, 1990

 Geometry written to block  1 of record 700

 Orientation using atomic masses  
 Molecule type: Atom
 Symmetry elements: X,Y,Z
 Rotational constants:       0.0000000      0.0000000      0.0000000 GHz  (calculated with average atomic masses)

 Point group  D2h 



 ATOMIC COORDINATES

 NR  ATOM    CHARGE       X              Y              Z

   1  F       7.00    0.000000000    0.000000000    0.000000000


          F   CORE POTENTIAL

          p POTENTIAL

 POWERS             1              3              2
 EXPONENTIALS   12.08758       12.83806       12.31235    
 COEFFICIENTS   7.000000       84.61309      -53.02752    

          s - p POTENTIAL

 POWERS             2
 EXPONENTIALS   14.78076    
 COEFFICIENTS   78.90177    


 BASIS DATA

   Nr Sym  Nuc  Type         Exponents   Contraction coefficients

    1.1 Ag    1  1s          84.048652    -0.000003
                             41.094617    -0.000354
                             20.092738     0.018409
                              9.824112    -0.127766
                              4.803386    -0.070287
                              2.348560     0.157160
                              1.148301     0.376901
                              0.561449     0.409517
                              0.274514     0.197089
                              0.134220     0.024348
    2.1 Ag    1  1s           2.542428     1.000000
    3.1 Ag    1  1s           1.250265     1.000000
    4.1 Ag    1  1s           0.459697     1.000000
    5.1 Ag    1  1s           0.191146     1.000000
    6.1 Ag    1  1s           0.076458     1.000000
    7.1 Ag    1  3d0          5.603581     1.000000
    8.1 Ag    1  3d2+         5.603581     1.000000
    9.1 Ag    1  3d0          3.901897     1.000000
   10.1 Ag    1  3d2+         3.901897     1.000000
   11.1 Ag    1  3d0          1.523306     1.000000
   12.1 Ag    1  3d2+         1.523306     1.000000
   13.1 Ag    1  3d0          0.517711     1.000000
   14.1 Ag    1  3d2+         0.517711     1.000000
   15.1 Ag    1  3d0          0.207084     1.000000
   16.1 Ag    1  3d2+         0.207084     1.000000
   17.1 Ag    1  5g0          4.619953     1.000000
   18.1 Ag    1  5g4+         4.619953     1.000000
   19.1 Ag    1  5g2+         4.619953     1.000000
   20.1 Ag    1  5g0          1.638933     1.000000
   21.1 Ag    1  5g4+         1.638933     1.000000
   22.1 Ag    1  5g2+         1.638933     1.000000
   23.1 Ag    1  5g0          0.655573     1.000000
   24.1 Ag    1  5g4+         0.655573     1.000000
   25.1 Ag    1  5g2+         0.655573     1.000000
    1.2 B3u   1  2px         31.642619     0.002967
                             16.243233     0.029805
                              8.338204     0.066949
                              4.280284     0.133779
                              2.197215     0.214831
                              1.127906     0.266486
                              0.578992     0.261895
                              0.297216     0.192022
                              0.152571     0.082847
                              0.078320     0.013305
    2.2 B3u   1  2px          2.018698     1.000000
    3.2 B3u   1  2px          1.505085     1.000000
    4.2 B3u   1  2px          0.489019     1.000000
    5.2 B3u   1  2px          0.170574     1.000000
    6.2 B3u   1  2px          0.068230     1.000000
    7.2 B3u   1  4f1+         4.297889     1.000000
    8.2 B3u   1  4f3+         4.297889     1.000000
    9.2 B3u   1  4f1+         2.950321     1.000000
   10.2 B3u   1  4f3+         2.950321     1.000000
   11.2 B3u   1  4f1+         0.981494     1.000000
   12.2 B3u   1  4f3+         0.981494     1.000000
   13.2 B3u   1  4f1+         0.392598     1.000000
   14.2 B3u   1  4f3+         0.392598     1.000000
   15.2 B3u   1  6h1+         2.963127     1.000000
   16.2 B3u   1  6h3+         2.963127     1.000000
   17.2 B3u   1  6h5+         2.963127     1.000000
   18.2 B3u   1  6h1+         1.185251     1.000000
   19.2 B3u   1  6h3+         1.185251     1.000000
   20.2 B3u   1  6h5+         1.185251     1.000000
    1.3 B2u   1  2py         31.642619     0.002967
                             16.243233     0.029805
                              8.338204     0.066949
                              4.280284     0.133779
                              2.197215     0.214831
                              1.127906     0.266486
                              0.578992     0.261895
                              0.297216     0.192022
                              0.152571     0.082847
                              0.078320     0.013305
    2.3 B2u   1  2py          2.018698     1.000000
    3.3 B2u   1  2py          1.505085     1.000000
    4.3 B2u   1  2py          0.489019     1.000000
    5.3 B2u   1  2py          0.170574     1.000000
    6.3 B2u   1  2py          0.068230     1.000000
    7.3 B2u   1  4f1-         4.297889     1.000000
    8.3 B2u   1  4f3-         4.297889     1.000000
    9.3 B2u   1  4f1-         2.950321     1.000000
   10.3 B2u   1  4f3-         2.950321     1.000000
   11.3 B2u   1  4f1-         0.981494     1.000000
   12.3 B2u   1  4f3-         0.981494     1.000000
   13.3 B2u   1  4f1-         0.392598     1.000000
   14.3 B2u   1  4f3-         0.392598     1.000000
   15.3 B2u   1  6h1-         2.963127     1.000000
   16.3 B2u   1  6h3-         2.963127     1.000000
   17.3 B2u   1  6h5-         2.963127     1.000000
   18.3 B2u   1  6h1-         1.185251     1.000000
   19.3 B2u   1  6h3-         1.185251     1.000000
   20.3 B2u   1  6h5-         1.185251     1.000000
    1.4 B1g   1  3d2-         5.603581     1.000000
    2.4 B1g   1  3d2-         3.901897     1.000000
    3.4 B1g   1  3d2-         1.523306     1.000000
    4.4 B1g   1  3d2-         0.517711     1.000000
    5.4 B1g   1  3d2-         0.207084     1.000000
    6.4 B1g   1  5g2-         4.619953     1.000000
    7.4 B1g   1  5g4-         4.619953     1.000000
    8.4 B1g   1  5g2-         1.638933     1.000000
    9.4 B1g   1  5g4-         1.638933     1.000000
   10.4 B1g   1  5g2-         0.655573     1.000000
   11.4 B1g   1  5g4-         0.655573     1.000000
    1.5 B1u   1  2pz         31.642619     0.002967
                             16.243233     0.029805
                              8.338204     0.066949
                              4.280284     0.133779
                              2.197215     0.214831
                              1.127906     0.266486
                              0.578992     0.261895
                              0.297216     0.192022
                              0.152571     0.082847
                              0.078320     0.013305
    2.5 B1u   1  2pz          2.018698     1.000000
    3.5 B1u   1  2pz          1.505085     1.000000
    4.5 B1u   1  2pz          0.489019     1.000000
    5.5 B1u   1  2pz          0.170574     1.000000
    6.5 B1u   1  2pz          0.068230     1.000000
    7.5 B1u   1  4f0          4.297889     1.000000
    8.5 B1u   1  4f2+         4.297889     1.000000
    9.5 B1u   1  4f0          2.950321     1.000000
   10.5 B1u   1  4f2+         2.950321     1.000000
   11.5 B1u   1  4f0          0.981494     1.000000
   12.5 B1u   1  4f2+         0.981494     1.000000
   13.5 B1u   1  4f0          0.392598     1.000000
   14.5 B1u   1  4f2+         0.392598     1.000000
   15.5 B1u   1  6h2+         2.963127     1.000000
   16.5 B1u   1  6h4+         2.963127     1.000000
   17.5 B1u   1  6h0          2.963127     1.000000
   18.5 B1u   1  6h2+         1.185251     1.000000
   19.5 B1u   1  6h4+         1.185251     1.000000
   20.5 B1u   1  6h0          1.185251     1.000000
    1.6 B2g   1  3d1+         5.603581     1.000000
    2.6 B2g   1  3d1+         3.901897     1.000000
    3.6 B2g   1  3d1+         1.523306     1.000000
    4.6 B2g   1  3d1+         0.517711     1.000000
    5.6 B2g   1  3d1+         0.207084     1.000000
    6.6 B2g   1  5g1+         4.619953     1.000000
    7.6 B2g   1  5g3+         4.619953     1.000000
    8.6 B2g   1  5g1+         1.638933     1.000000
    9.6 B2g   1  5g3+         1.638933     1.000000
   10.6 B2g   1  5g1+         0.655573     1.000000
   11.6 B2g   1  5g3+         0.655573     1.000000
    1.7 B3g   1  3d1-         5.603581     1.000000
    2.7 B3g   1  3d1-         3.901897     1.000000
    3.7 B3g   1  3d1-         1.523306     1.000000
    4.7 B3g   1  3d1-         0.517711     1.000000
    5.7 B3g   1  3d1-         0.207084     1.000000
    6.7 B3g   1  5g1-         4.619953     1.000000
    7.7 B3g   1  5g3-         4.619953     1.000000
    8.7 B3g   1  5g1-         1.638933     1.000000
    9.7 B3g   1  5g3-         1.638933     1.000000
   10.7 B3g   1  5g1-         0.655573     1.000000
   11.7 B3g   1  5g3-         0.655573     1.000000
    1.8 Au    1  4f2-         4.297889     1.000000
    2.8 Au    1  4f2-         2.950321     1.000000
    3.8 Au    1  4f2-         0.981494     1.000000
    4.8 Au    1  4f2-         0.392598     1.000000
    5.8 Au    1  6h4-         2.963127     1.000000
    6.8 Au    1  6h2-         2.963127     1.000000
    7.8 Au    1  6h4-         1.185251     1.000000
    8.8 Au    1  6h2-         1.185251     1.000000

 NUCLEAR CHARGE:                    7
 NUMBER OF PRIMITIVE AOS:         217
 NUMBER OF SYMMETRY AOS:          162
 NUMBER OF CONTRACTIONS:          126   (  25Ag  +  20B3u +  20B2u +  11B1g +  20B1u +  11B2g +  11B3g +   8Au  )
 NUMBER OF CORE ORBITALS:           0   (   0Ag  +   0B3u +   0B2u +   0B1g +   0B1u +   0B2g +   0B3g +   0Au  )
 NUMBER OF VALENCE ORBITALS:        4   (   1Ag  +   1B3u +   1B2u +   0B1g +   1B1u +   0B2g +   0B3g +   0Au  )


 NUCLEAR REPULSION ENERGY    0.00000000

 EXTRA SYMMETRY OF AOS IN SYMMETRY 1:   1 1 1 1 1 1 2 3 2 3   2 3 2 3 2 3 4 5 6 4   5 6 4 5 6
 EXTRA SYMMETRY OF AOS IN SYMMETRY 2:   1 1 1 1 1 1 2 3 2 3   2 3 2 3 4 5 6 4 5 6
 EXTRA SYMMETRY OF AOS IN SYMMETRY 3:   1 1 1 1 1 1 2 3 2 3   2 3 2 3 4 5 6 4 5 6
 EXTRA SYMMETRY OF AOS IN SYMMETRY 4:   1 1 1 1 1 2 3 2 3 2   3
 EXTRA SYMMETRY OF AOS IN SYMMETRY 5:   1 1 1 1 1 1 2 3 2 3   2 3 2 3 4 5 6 4 5 6
 EXTRA SYMMETRY OF AOS IN SYMMETRY 6:   1 1 1 1 1 2 3 2 3 2   3
 EXTRA SYMMETRY OF AOS IN SYMMETRY 7:   1 1 1 1 1 2 3 2 3 2   3
 EXTRA SYMMETRY OF AOS IN SYMMETRY 8:   1 1 1 1 2 3 2 3

 Eigenvalues of metric

         1 0.202E-02 0.920E-02 0.195E-01 0.195E-01 0.550E-01 0.147E+00 0.147E+00 0.293E+00
         2 0.392E-02 0.205E-01 0.431E-01 0.431E-01 0.836E-01 0.317E+00 0.317E+00 0.431E+00
         3 0.392E-02 0.205E-01 0.431E-01 0.431E-01 0.836E-01 0.317E+00 0.317E+00 0.431E+00
         4 0.195E-01 0.147E+00 0.293E+00 0.293E+00 0.533E+00 0.900E+00 0.900E+00 0.158E+01
         5 0.392E-02 0.205E-01 0.431E-01 0.431E-01 0.836E-01 0.317E+00 0.317E+00 0.431E+00
         6 0.195E-01 0.147E+00 0.293E+00 0.293E+00 0.533E+00 0.900E+00 0.900E+00 0.158E+01
         7 0.195E-01 0.147E+00 0.293E+00 0.293E+00 0.533E+00 0.900E+00 0.900E+00 0.158E+01
         8 0.431E-01 0.317E+00 0.483E+00 0.483E+00 0.128E+01 0.152E+01 0.152E+01 0.236E+01


 Contracted 2-electron integrals neglected if value below      1.0D-12
 AO integral compression algorithm  1   Integral accuracy      1.0D-12

     32.506 MB (compressed) written to integral file ( 58.6%)


 NUMBER OF SORTED TWO-ELECTRON INTEGRALS:    4156552.     BUFFER LENGTH:  32768
 NUMBER OF SEGMENTS:   1  SEGMENT LENGTH:    4156552      RECORD LENGTH: 524288

 Memory used in sort:       4.71 MW

 SORT1 READ     6989366. AND WROTE     2907704. INTEGRALS IN      9 RECORDS. CPU TIME:     0.24 SEC, REAL TIME:     0.34 SEC
 SORT2 READ     2907704. AND WROTE     4156552. INTEGRALS IN    124 RECORDS. CPU TIME:     0.22 SEC, REAL TIME:     0.43 SEC

 FILE SIZES:   FILE 1:    52.8 MBYTE,  FILE 4:    37.8 MBYTE,   TOTAL:     90.5 MBYTE

 OPERATOR DM      FOR CENTER  0  COORDINATES:    0.000000    0.000000    0.000000
 OPERATOR EKIN    FOR CENTER  0  COORDINATES:    0.000000    0.000000    0.000000
 OPERATOR POT     FOR CENTER  0  COORDINATES:    0.000000    0.000000    0.000000


 **********************************************************************************************************************************
 DATASETS  * FILE   NREC   LENGTH (MB)   RECORD NAMES
              1      20       39.76       500      610      700      900      950      970     1000      129      960     1100   
                                          VAR    BASINP    GEOM    SYMINP    ZMAT    AOBASIS   BASIS     P2S    ABASIS      S 
                                         1400     1410     1420     1200     1210     1080     1600     1650     1300     1700   
                                         EKIN       V       ECP      H0       H01     AOSYM     SMH    MOLCAS    ERIS     OPER   

 PROGRAMS   *        TOTAL       INT
 CPU TIMES  *         3.88      3.74
 REAL TIME  *        38.83 SEC
 DISK USED  *        90.85 MB      
 **********************************************************************************************************************************


 PROGRAM * RHF-SCF (OPEN SHELL)       Authors: W. Meyer, H.-J. Werner


 NUMBER OF ELECTRONS:       4+    3-    SPACE SYMMETRY=3    SPIN SYMMETRY: Doublet 
 CONVERGENCE THRESHOLDS:    1.00E-05 (Density)    1.00E-07 (Energy)
 MAX. NUMBER OF ITERATIONS:       60
 INTERPOLATION TYPE:            DIIS
 INTERPOLATION STEPS:              2 (START)      1 (STEP)
 LEVEL SHIFTS:                 -0.60 (CLOSED) -0.30 (OPEN) 

 Number of closed-shell orbitals:    3 (   1   1   0   0   1   0   0   0 )
 Number of open-shell orbitals:      1 (   0   0   1   0   0   0   0   0 )



   Atom=F  basis=ECP2MWB_GUESS     lmin=0  lmax=1

 Orbital guess generated from atomic densities. Full valence occupancy:    1   1   1   0   1   0   0   0


 Molecular orbital dump at record        2100.2

 ITERATION    DDIFF          GRAD             ENERGY        2-EL.EN.            DIPOLE MOMENTS         DIIS   ORB.
    1      0.000D+00      0.000D+00       -23.93069134     33.609907    0.00000    0.00000    0.00000    0    start
    2      0.000D+00      0.107D-01       -23.93742104     34.201796    0.00000    0.00000    0.00000    1    diag,B
    3      0.499D-02      0.272D-02       -23.93780216     34.166055    0.00000    0.00000    0.00000    2    diag,B
    4      0.122D-02      0.752D-03       -23.93790218     34.179160    0.00000    0.00000    0.00000    3    diag,B
    5      0.469D-03      0.223D-03       -23.93791345     34.180739    0.00000    0.00000    0.00000    4    diag,B
    6      0.203D-03      0.383D-04       -23.93791375     34.180129    0.00000    0.00000    0.00000    5    diag,B
    7      0.391D-04      0.758D-05       -23.93791376     34.179959    0.00000    0.00000    0.00000    6    fixocc
    8      0.738D-05      0.148D-05       -23.93791376     34.179942    0.00000    0.00000    0.00000    0    orth

 Final alpha occupancy:   1   1   1   0   1   0   0   0
 Final beta  occupancy:   1   1   0   0   1   0   0   0

 !RHF STATE 1.3 Energy                -23.937913758645
 Nuclear energy                         0.00000000
 One-electron energy                  -41.02788468
 Two-electron energy                   17.08997092
 Virial quotient                       -1.28414445
 !RHF STATE 1.3 Dipole moment           0.00000000     0.00000000     0.00000000
 Dipole moment /Debye                   0.00000000     0.00000000     0.00000000
 

 !RHF expec          <1.3|EKIN|1.3>    18.641137900053
 
 !RHF expec           <1.3|POT|1.3>    -8.770635225861

 ELECTRON ORBITALS
 =================


   Orb  Occ    Energy  Couls-En    Coefficients

                                   1 1s      1 1s      1 1s      1 1s      1 1s      1 1s      1 3d0     1 3d2+    1 3d0     1 3d2+ 
                                   1 3d0     1 3d2+    1 3d0     1 3d2+    1 3d0     1 3d2+    1 5g0     1 5g4+    1 5g2+    1 5g0  
                                   1 5g4+    1 5g2+    1 5g0     1 5g4+    1 5g2+ 

   1.1   2    -1.5943   -8.0495  1.000015  0.000018 -0.000048  0.000082 -0.000141  0.000077  0.000516  0.000895 -0.000236 -0.000409
                                 0.000305  0.000529  0.001172  0.002030  0.000794  0.001375 -0.000000 -0.000001 -0.000001 -0.000001
                                -0.000002 -0.000001 -0.000006 -0.000012 -0.000009

                                   1 2px     1 2px     1 2px     1 2px     1 2px     1 2px     1 4f1+    1 4f3+    1 4f1+    1 4f3+ 
                                   1 4f1+    1 4f3+    1 4f1+    1 4f3+    1 6h1+    1 6h3+    1 6h5+    1 6h1+    1 6h3+    1 6h5+ 


   1.2   2    -0.7061   -6.3118  0.999989 -0.000008  0.000053  0.000056 -0.000124 -0.000043 -0.000092 -0.000356 -0.000262 -0.001015
                                -0.000617 -0.002389 -0.000309 -0.001195  0.000001  0.000002  0.000004  0.000001  0.000005  0.000010

                                   1 2py     1 2py     1 2py     1 2py     1 2py     1 2py     1 4f1-    1 4f3-    1 4f1-    1 4f3- 
                                   1 4f1-    1 4f3-    1 4f1-    1 4f3-    1 6h1-    1 6h3-    1 6h5-    1 6h1-    1 6h3-    1 6h5- 


   1.3   +    -0.8350   -6.5296  1.026415  0.000412  0.007773 -0.011912 -0.038176 -0.005060 -0.000617 -0.000797 -0.001725 -0.002227
                                -0.003878 -0.005006 -0.001519 -0.001961  0.000015  0.000016  0.000021  0.000027  0.000030  0.000040

                                   1 2pz     1 2pz     1 2pz     1 2pz     1 2pz     1 2pz     1 4f0     1 4f2+    1 4f0     1 4f2+ 
                                   1 4f0     1 4f2+    1 4f0     1 4f2+    1 6h2+    1 6h4+    1 6h0     1 6h2+    1 6h4+    1 6h0  


   1.5   2    -0.7061   -6.3118  0.999989 -0.000008  0.000053  0.000056 -0.000124 -0.000043 -0.000225 -0.000291 -0.000642 -0.000829
                                -0.001511 -0.001950 -0.000756 -0.000976  0.000003  0.000003  0.000002  0.000008  0.000007  0.000006

 HOMO      1.2    -0.706065 =     -19.2130eV
 LUMO      2.1     0.131537 =       3.5793eV
 LUMO-HOMO         0.837602 =      22.7923eV


 **********************************************************************************************************************************
 DATASETS  * FILE   NREC   LENGTH (MB)   RECORD NAMES
              1      20       39.76       500      610      700      900      950      970     1000      129      960     1100   
                                          VAR    BASINP    GEOM    SYMINP    ZMAT    AOBASIS   BASIS     P2S    ABASIS      S 
                                         1400     1410     1420     1200     1210     1080     1600     1650     1300     1700   
                                         EKIN       V       ECP      H0       H01     AOSYM     SMH    MOLCAS    ERIS     OPER   

              2       4        2.83       700     1000      520     2100   
                                         GEOM     BASIS   MCVARS     RHF  

 PROGRAMS   *        TOTAL        HF       INT
 CPU TIMES  *         4.09      0.21      3.74
 REAL TIME  *        39.68 SEC
 DISK USED  *        90.85 MB      
 **********************************************************************************************************************************
 SETTING SCF(I)         =       -23.93791376  AU                              
 SETTING _CC_NORM_MAX   =         2.00000000                                  


 PROGRAM * UHF-SCF       Authors: W. Meyer, H.-J. Werner


 NUMBER OF ELECTRONS:       4+    3-    SPACE SYMMETRY=3    SPIN SYMMETRY: Doublet 
 CONVERGENCE THRESHOLDS:    1.00E-05 (Density)    1.00E-07 (Energy)
 MAX. NUMBER OF ITERATIONS:        0
 INTERPOLATION TYPE:            DIIS
 INTERPOLATION STEPS:              2 (START)      1 (STEP)
 LEVEL SHIFTS:                  0.20 (ALPHA)   0.20 (BETA) 

 Number of closed-shell orbitals:    3 (   1   1   0   0   1   0   0   0 )
 Number of open-shell orbitals:      1 (   0   0   1   0   0   0   0   0 )


 Molecular orbitals read from record     2100.2  Type=RHF/CANONICAL (state 1.3)

 Molecular orbital dump at record        2200.2

 Initial alpha occupation   1   1   1   0   1   0   0   0
 Initial beta  occupation   1   1   0   0   1   0   0   0

 ITERATION    DDIFF          GRAD             ENERGY        2-EL.EN.            DIPOLE MOMENTS         DIIS
    1      0.000D+00      0.000D+00       -23.93791376     34.179942    0.00000    0.00000    0.00000    0
 
 Final alpha occupancy:   1   1   1   0   1   0   0   0
 Final beta  occupancy:   1   1   0   0   1   0   0   0

 !UHF STATE 1.3 Energy                -23.937913758645
 Nuclear energy                         0.00000000
 One-electron energy                  -41.02788468
 Two-electron energy                   17.08997092
 Virial quotient                       -1.28414445
 !UHF STATE 1.3 Dipole moment           0.00000000     0.00000000     0.00000000
 Dipole moment /Debye                   0.00000000     0.00000000     0.00000000
 

 !UHF expec          <1.3|EKIN|1.3>    18.641137900053
 
 !UHF expec           <1.3|POT|1.3>    -8.770635225861

 ELECTRON ORBITALS FOR POSITIVE SPIN
 ===================================


   Orb  Occ    Energy  Couls-En    Coefficients

                                   1 1s      1 1s      1 1s      1 1s      1 1s      1 1s      1 3d0     1 3d2+    1 3d0     1 3d2+ 
                                   1 3d0     1 3d2+    1 3d0     1 3d2+    1 3d0     1 3d2+    1 5g0     1 5g4+    1 5g2+    1 5g0  
                                   1 5g4+    1 5g2+    1 5g0     1 5g4+    1 5g2+ 

   1.1   +    -1.5943   -8.0495  1.000015  0.000018 -0.000048  0.000082 -0.000141  0.000077  0.000516  0.000895 -0.000236 -0.000409
                                 0.000305  0.000529  0.001172  0.002030  0.000794  0.001375 -0.000000 -0.000001 -0.000001 -0.000001
                                -0.000002 -0.000001 -0.000006 -0.000012 -0.000009

                                   1 2px     1 2px     1 2px     1 2px     1 2px     1 2px     1 4f1+    1 4f3+    1 4f1+    1 4f3+ 
                                   1 4f1+    1 4f3+    1 4f1+    1 4f3+    1 6h1+    1 6h3+    1 6h5+    1 6h1+    1 6h3+    1 6h5+ 


   1.2   +    -0.7061   -6.3118  0.999989 -0.000008  0.000053  0.000056 -0.000124 -0.000043 -0.000092 -0.000356 -0.000262 -0.001015
                                -0.000617 -0.002389 -0.000309 -0.001195  0.000001  0.000002  0.000004  0.000001  0.000005  0.000010

                                   1 2py     1 2py     1 2py     1 2py     1 2py     1 2py     1 4f1-    1 4f3-    1 4f1-    1 4f3- 
                                   1 4f1-    1 4f3-    1 4f1-    1 4f3-    1 6h1-    1 6h3-    1 6h5-    1 6h1-    1 6h3-    1 6h5- 


   1.3   +    -0.8350   -6.5296  1.026415  0.000412  0.007773 -0.011912 -0.038176 -0.005060 -0.000617 -0.000797 -0.001725 -0.002227
                                -0.003878 -0.005006 -0.001519 -0.001961  0.000015  0.000016  0.000021  0.000027  0.000030  0.000040

                                   1 2pz     1 2pz     1 2pz     1 2pz     1 2pz     1 2pz     1 4f0     1 4f2+    1 4f0     1 4f2+ 
                                   1 4f0     1 4f2+    1 4f0     1 4f2+    1 6h2+    1 6h4+    1 6h0     1 6h2+    1 6h4+    1 6h0  


   1.5   +    -0.7061   -6.3118  0.999989 -0.000008  0.000053  0.000056 -0.000124 -0.000043 -0.000225 -0.000291 -0.000642 -0.000829
                                -0.001511 -0.001950 -0.000756 -0.000976  0.000003  0.000003  0.000002  0.000008  0.000007  0.000006

 ELECTRON ORBITALS FOR NEGATIVE SPIN
 ===================================


   Orb  Occ    Energy  Couls-En    Coefficients

                                   1 1s      1 1s      1 1s      1 1s      1 1s      1 1s      1 3d0     1 3d2+    1 3d0     1 3d2+ 
                                   1 3d0     1 3d2+    1 3d0     1 3d2+    1 3d0     1 3d2+    1 5g0     1 5g4+    1 5g2+    1 5g0  
                                   1 5g4+    1 5g2+    1 5g0     1 5g4+    1 5g2+ 

   1.1   -    -1.5943   -8.0495  1.000015  0.000018 -0.000048  0.000082 -0.000141  0.000077  0.000516  0.000895 -0.000236 -0.000409
                                 0.000305  0.000529  0.001172  0.002030  0.000794  0.001375 -0.000000 -0.000001 -0.000001 -0.000001
                                -0.000002 -0.000001 -0.000006 -0.000012 -0.000009

                                   1 2px     1 2px     1 2px     1 2px     1 2px     1 2px     1 4f1+    1 4f3+    1 4f1+    1 4f3+ 
                                   1 4f1+    1 4f3+    1 4f1+    1 4f3+    1 6h1+    1 6h3+    1 6h5+    1 6h1+    1 6h3+    1 6h5+ 


   1.2   -    -0.7061   -6.3118  0.999989 -0.000008  0.000053  0.000056 -0.000124 -0.000043 -0.000092 -0.000356 -0.000262 -0.001015
                                -0.000617 -0.002389 -0.000309 -0.001195  0.000001  0.000002  0.000004  0.000001  0.000005  0.000010

                                   1 2pz     1 2pz     1 2pz     1 2pz     1 2pz     1 2pz     1 4f0     1 4f2+    1 4f0     1 4f2+ 
                                   1 4f0     1 4f2+    1 4f0     1 4f2+    1 6h2+    1 6h4+    1 6h0     1 6h2+    1 6h4+    1 6h0  


   1.5   -    -0.7061   -6.3118  0.999989 -0.000008  0.000053  0.000056 -0.000124 -0.000043 -0.000225 -0.000291 -0.000642 -0.000829
                                -0.001511 -0.001950 -0.000756 -0.000976  0.000003  0.000003  0.000002  0.000008  0.000007  0.000006

 HOMO      1.2    -0.706065 =     -19.2130eV
 LUMO     -1.3    -0.834979 =     -22.7209eV
 LUMO-HOMO        -0.128914 =      -3.5079eV

 EXPECTATION VALUE OF S**2:             0.75000000

 Occupation number threshold for canonical orbitals:  1.999000 (occupied),  0.001000 (virtual)

 Number of pseudo-canonical orbitals per symmetry:    1   1   0   0   1   0   0   0
 Number of active natural orbitals per symmetry:      0   0   1   0   0   0   0   0

 NATURAL CHARGE ORBITALS
 =======================


   Orb     Occ        Energy       Coefficients

                                   1 1s      1 1s      1 1s      1 1s      1 1s      1 1s      1 3d0     1 3d2+    1 3d0     1 3d2+ 
                                   1 3d0     1 3d2+    1 3d0     1 3d2+    1 3d0     1 3d2+    1 5g0     1 5g4+    1 5g2+    1 5g0  
                                   1 5g4+    1 5g2+    1 5g0     1 5g4+    1 5g2+ 

   1.1  2.00000    -1.594347     1.000015  0.000018 -0.000048  0.000082 -0.000141  0.000077  0.000516  0.000895 -0.000236 -0.000409
                                 0.000305  0.000529  0.001172  0.002030  0.000794  0.001375 -0.000000 -0.000001 -0.000001 -0.000001
                                -0.000002 -0.000001 -0.000006 -0.000012 -0.000009

                                   1 2px     1 2px     1 2px     1 2px     1 2px     1 2px     1 4f1+    1 4f3+    1 4f1+    1 4f3+ 
                                   1 4f1+    1 4f3+    1 4f1+    1 4f3+    1 6h1+    1 6h3+    1 6h5+    1 6h1+    1 6h3+    1 6h5+ 


   1.2  2.00000    -0.706065     0.999989 -0.000008  0.000053  0.000056 -0.000124 -0.000043 -0.000092 -0.000356 -0.000262 -0.001015
                                -0.000617 -0.002389 -0.000309 -0.001195  0.000001  0.000002  0.000004  0.000001  0.000005  0.000010

                                   1 2py     1 2py     1 2py     1 2py     1 2py     1 2py     1 4f1-    1 4f3-    1 4f1-    1 4f3- 
                                   1 4f1-    1 4f3-    1 4f1-    1 4f3-    1 6h1-    1 6h3-    1 6h5-    1 6h1-    1 6h3-    1 6h5- 


   1.3  1.00000    -0.359459     1.026415  0.000412  0.007773 -0.011912 -0.038176 -0.005060 -0.000617 -0.000797 -0.001725 -0.002227
                                -0.003878 -0.005006 -0.001519 -0.001961  0.000015  0.000016  0.000021  0.000027  0.000030  0.000040

                                   1 2pz     1 2pz     1 2pz     1 2pz     1 2pz     1 2pz     1 4f0     1 4f2+    1 4f0     1 4f2+ 
                                   1 4f0     1 4f2+    1 4f0     1 4f2+    1 6h2+    1 6h4+    1 6h0     1 6h2+    1 6h4+    1 6h0  


   1.5  2.00000    -0.706065     0.999989 -0.000008  0.000053  0.000056 -0.000124 -0.000043 -0.000225 -0.000291 -0.000642 -0.000829
                                -0.001511 -0.001950 -0.000756 -0.000976  0.000003  0.000003  0.000002  0.000008  0.000007  0.000006

 Natural orbitals saved to record    2200.2 (Orbital set 3)

 Orbital spaces for UNO-CAS (Min. occupation: 0.020  Max. occupation: 1.980):

 Closed:        1   1   0   0   1   0   0   0
 Active:        0   0   1   0   0   0   0   0

 No convergence



 **********************************************************************************************************************************
 DATASETS  * FILE   NREC   LENGTH (MB)   RECORD NAMES
              1      20       39.76       500      610      700      900      950      970     1000      129      960     1100   
                                          VAR    BASINP    GEOM    SYMINP    ZMAT    AOBASIS   BASIS     P2S    ABASIS      S 
                                         1400     1410     1420     1200     1210     1080     1600     1650     1300     1700   
                                         EKIN       V       ECP      H0       H01     AOSYM     SMH    MOLCAS    ERIS     OPER   

              2       5        5.45       700     1000      520     2100     2200   
                                         GEOM     BASIS   MCVARS     RHF      UHF  

 PROGRAMS   *        TOTAL       UHF        HF       INT
 CPU TIMES  *         4.13      0.04      0.21      3.74
 REAL TIME  *        41.07 SEC
 DISK USED  *        90.85 MB      
 **********************************************************************************************************************************
 SETTING SCF(I)         =       -23.93791376  AU                              


 PROGRAM * MRCC (General Multireference Coupled Cluster)    Author: M. Kallay, 2000-2005

 ***  Initialisation ***

   0 Spin projections
 
 Molecular orbitals read from record     2200.2  Type=UHF/ALPHA (state 1.3)

 ?Warning: UHF not converged
 Molecular orbitals read from record     2200.2  Type=UHF/BETA (state 1.3)

 ?Warning: UHF not converged
 
 Frozen orbitals:              0 (  0  0  0  0  0  0  0  0)
 Active orbitals:            126 ( 25 20 20 11 20 11 11  8)
 Active electrons:             7
 Spin quantum number:          0.5

 Transformed integrals will be written to file mrccdir/mrcc_40606/fort.55

 Load integrals                4.2 sec
 Transform integrals           7.0 sec
 Storage for integrals:       24278327
 Remaining memory:           *********

 Core energy:               0.00000000
 
 MRCC Input:
     4     0     0     0     3     0     0     3     0     0     0     1     1     0     0     7     0     0   0.000     0   64000
  ex.lev,nsing,ntrip, rest,method,dens,conver,symm, diag, CS ,spatial, HF, ndoub,nacto,nactv, tol, maxex, sacc, freq,  dboc,   mem
  2  0  0  0  0  0  0  0  0  0  0  0  0  0  0  0  0  0  0  0  0  0  0  0  0  2  0  0  0  0  0  0  0  0  0  0  0  0  0  0  0  0  0  0  0  1  0  0  0  0  0  0  0  0  0  0  0  0  0  0  0  0  0  0  0  0  0  0  0  0  0  0  0  0  0  0  2  0  0  0  0  0  0  0  0  0  0  0  0  0  0  0  0  0  0  0  0  0  0  0  0  0  0  0  0  0  0  0  0  0  0  0  0  0  0  0  0  0  0  0  0  0  0  0  0  0
 MRCC Input end
 Variable memory released
 MRCC now being run, temporary output in /global/cscratch1/sd/aannabe/mrccdir/mrcc_40606/mrcc.out
 **********************************************************************
                          MRCC program system
 **********************************************************************

                              Written by
  Mihaly Kallay, Zoltan Rolik, Jozsef Csontos, Peter Nagy, Gyula Samu,
      David Mester, Jozsef Csoka, Bernat Szabo, Istvan Ladjanszki,
       Lorant Szegedy, Bence Ladoczki, Klara Petrov, Mate Farkas,
                    Pal D. Mezei, and Bence Hegely

        Department of Physical Chemistry and Materials Science
            Budapest University of Technology and Economics
                  Budapest P.O.Box 91, H-1521 Hungary

                              www.mrcc.hu

                       Release date: May 23, 2018

 ************************ 2019-02-01 17:54:23 *************************
 Executing goldstone...

 Generation of CC equations in terms of H and T...
 Generation of antisymmetrized Goldstone diagrams...
 Number of diagrams in T^1 equations:    15
 Number of diagrams in T^2 equations:    38
 Number of diagrams in T^3 equations:    49
 Number of diagrams in T^4 equations:     5
 Translation of diagrams to factorized equations...
 Optimizing intermediate calculation...
 Number of floating-point operations per iteration step:   1.0665E+12
 Probable CPU time per iteration step (hours):     10.67
 Required memory (Mbytes):   29412.3
 Number of intermediates:                                  79
 Number of intermediates to be stored:                     32
 Length of intermediate file (Mbytes):     511.2

 ************************ 2019-02-01 17:54:24 *************************
 Executing xmrcc...

 **********************************************************************
 CC(3)(4) calculation


 Allocation of****** Mbytes of memory...
 Number of spinorbitals:                   252
 Number of alpha electrons:                        4
 Number of beta electrons:                         3
 Spin multiplicity:                     2
 z-component of spin:  0.5
 Spatial symmetry:                      3
 Convergence criterion:  1.0E-07
 Construction of occupation graphs...
 Number of                     0 -fold excitations:                      1
 Number of                     1 -fold excitations:                    143
 Number of                     2 -fold excitations:                  31673
 Number of                     3 -fold excitations:                3601177
 Total number of configurations:                3632994
 Calculation of coupling coefficients...
 Length of intermediate file (Mbytes):     386.4

 ======================================================================

 Spin case  1   Alpha:  1   Beta:  3
 Number of excitations:               18451565
 Spin case  2   Alpha:  2   Beta:  2
 Number of excitations:              124606837
 Spin case  3   Alpha:  3   Beta:  1
 Number of excitations:               54447452
 Spin case  4   Alpha:  4   Beta:  0
 Number of excitations:                1099202
 Number of                     4 -fold excitations:              198605056

 Memory requirements /Mbyte/:
               Minimal        Optimal
 Real*8:        773.5070      1923.2150
 Integer:       154.3052
 Total:         927.8123      2077.5202


 ************************ 2019-02-01 17:54:44 *************************
 Executing mrcc...

 **********************************************************************
 CCSDT(Q) calculation


 Allocation of 1923.2 Mbytes of memory...
 Number of spinorbitals: 252
 Number of alpha electrons:  4
 Number of beta  electrons:  3
 Spin multiplicity: 2
 z-component of spin:  0.5
 Spatial symmetry: 3
 Convergence criterion:  1.0E-07
 Construction of occupation graphs...
 Number of 0-fold excitations: 1
 Number of 1-fold excitations: 143
 Number of 2-fold excitations: 31673
 Number of 3-fold excitations: 3601177
 Total number of determinants: 3632994
 Calculation of coupling coefficients...
 Initial cluster amplitudes are generated.
 Length of intermediate file (Mbytes):     386.4
 Reading integral list from unit 55...
 Sorting integrals...
 Sorting integrals...
 Sorting integrals...
 Sorting integrals...
 Energy of reference determinant [au]:     -23.937913758645
 Calculation of MP denominators...

 Starting CC iteration...
 ======================================================================
 Norm of residual vector:     1.62740468
 CPU time [min]:     1.992                   Wall time [min]:     2.465

 Iteration  1  CC energy:   -24.17672783  Energy decrease:   0.23881407
 ======================================================================
 Norm of residual vector:     0.30789783
 CPU time [min]:     3.187                   Wall time [min]:     3.670

 Iteration  2  CC energy:   -24.18180911  Energy decrease:   0.00508128
 ======================================================================
 Norm of residual vector:     0.05949416
 CPU time [min]:     4.480                   Wall time [min]:     4.972

 Iteration  3  CC energy:   -24.18911203  Energy decrease:   0.00730292
 ======================================================================
 Norm of residual vector:     0.01872430
 CPU time [min]:     5.909                   Wall time [min]:     6.414

 Iteration  4  CC energy:   -24.19077180  Energy decrease:   0.00165977
 ======================================================================
 Norm of residual vector:     0.00807572
 CPU time [min]:     7.138                   Wall time [min]:     7.648

 Iteration  5  CC energy:   -24.19049578  Energy decrease:   0.00027601
 ======================================================================
 Norm of residual vector:     0.00339112
 CPU time [min]:     8.568                   Wall time [min]:     9.087

 Iteration  6  CC energy:   -24.19041874  Energy decrease:   0.00007704
 ======================================================================
 Norm of residual vector:     0.00176675
 CPU time [min]:     9.882                   Wall time [min]:    10.405

 Iteration  7  CC energy:   -24.19047517  Energy decrease:   0.00005643
 ======================================================================
 Norm of residual vector:     0.00066191
 CPU time [min]:    11.193                   Wall time [min]:    11.726

 Iteration  8  CC energy:   -24.19049035  Energy decrease:   0.00001518
 ======================================================================
 Norm of residual vector:     0.00025155
 CPU time [min]:    12.526                   Wall time [min]:    13.066

 Iteration  9  CC energy:   -24.19048759  Energy decrease:   0.00000276
 ======================================================================
 Norm of residual vector:     0.00010210
 CPU time [min]:    13.868                   Wall time [min]:    14.419

 Iteration 10  CC energy:   -24.19048704  Energy decrease:   0.00000055
 ======================================================================
 Norm of residual vector:     0.00003916
 CPU time [min]:    15.204                   Wall time [min]:    15.766

 Iteration 11  CC energy:   -24.19048737  Energy decrease:   0.00000033
 ======================================================================
 Norm of residual vector:     0.00001406
 CPU time [min]:    16.596                   Wall time [min]:    17.298

 Iteration 12  CC energy:   -24.19048728  Energy decrease:   0.00000009
 ======================================================================
 Norm of residual vector:     0.00000513
 CPU time [min]:    17.984                   Wall time [min]:    18.848

 Iteration 13  CC energy:   -24.19048723  Energy decrease:   0.00000005
 ======================================================================
 Norm of residual vector:     0.00000149
 CPU time [min]:    19.361                   Wall time [min]:    20.231

 Iteration 14  CC energy:   -24.19048725  Energy decrease:   0.00000001
 ======================================================================
 Norm of residual vector:     0.00000048
 CPU time [min]:    20.755                   Wall time [min]:    21.636

 Iteration 15  CC energy:   -24.19048725  Energy decrease:   5.4499E-10
 ======================================================================
 Norm of residual vector:     0.00000016
 CPU time [min]:    22.060                   Wall time [min]:    22.948

 Iteration 16  CC energy:   -24.19048724  Energy decrease:   2.3143E-09
 ======================================================================
 Norm of residual vector:     0.00000006
 CPU time [min]:    23.244                   Wall time [min]:    24.140

 Iteration 17  CC energy:   -24.19048724  Energy decrease:   2.8082E-10
 ======================================================================

 Iteration has converged in 17 steps.

 Final results:
 Total CCSDT energy [au]:            -24.190487244568
 Total MP2 energy [au]:              -24.176727827319

 Perturbative corrections are calculated...
 ======================================================================
 Spin case  1   Alpha:  1   Beta:  3
 Number of excitations:        18451565
 CPU time [min]:   117.068                   Wall time [min]:   118.012
 ======================================================================
 Spin case  2   Alpha:  2   Beta:  2
 Number of excitations:        124606837
 CPU time [min]:   331.135                   Wall time [min]:   332.119
 ======================================================================
 Spin case  3   Alpha:  3   Beta:  1
 Number of excitations:        54447452
 CPU time [min]:   442.599                   Wall time [min]:   443.613
 ======================================================================
 Spin case  4   Alpha:  4   Beta:  0
 Number of excitations:        1099202
 CPU time [min]:   450.612                   Wall time [min]:   451.649
 ======================================================================
 Number of 4-fold excitations: 198605056
 CPU time [min]:   450.612                   Wall time [min]:   451.654

 Total CCSDT[Q] energy [au]:         -24.190439256522
 Total CCSDT(Q) energy [au]:         -24.190590596983

 ************************ 2019-02-02 01:26:25 *************************
                      Normal termination of mrcc.
 **********************************************************************
 !CCSDT STATE 1.3 Energy              -24.190487244568
 !MP2 STATE 1.3 Energy                -24.176727827319
 !CCSDT[Q] STATE 1.3 Energy           -24.190439256522
 !CCSDT(Q) STATE 1.3 Energy           -24.190590596983
 
 CPU-time for MRCC:          27036.7 sec
 Elapsed-time for MRCC:      27124.0 sec

 Variable memory set to 8000000000 words,  buffer space   230000 words



 **********************************************************************************************************************************
 DATASETS  * FILE   NREC   LENGTH (MB)   RECORD NAMES
              1      20       39.76       500      610      700      900      950      970     1000      129      960     1100   
                                          VAR    BASINP    GEOM    SYMINP    ZMAT    AOBASIS   BASIS     P2S    ABASIS      S 
                                         1400     1410     1420     1200     1210     1080     1600     1650     1300     1700   
                                         EKIN       V       ECP      H0       H01     AOSYM     SMH    MOLCAS    ERIS     OPER   

              2       5        5.45       700     1000      520     2100     2200   
                                         GEOM     BASIS   MCVARS     RHF      UHF  

 PROGRAMS   *        TOTAL      MRCC       UHF        HF       INT
 CPU TIMES  *     27105.53  27101.39      0.04      0.21      3.74
 REAL TIME  *     27511.70 SEC
 DISK USED  *        90.85 MB      
 **********************************************************************************************************************************
 SETTING POSTHF(I)      =       -24.19059060  AU                              
                                                                                                                                                                                                                                                                

        SCF            POSTHF        EKIN          POT
    -23.93791376   -24.19059060   18.64113790   -8.77063523
                                                  

 CCSDT(Q)/USERDEF energy=    -24.190590596983

        CCSDT(Q)        HF-SCF  
    -24.19059060    -23.93791376
 **********************************************************************************************************************************
 Molpro calculation terminated
 Variable memory released
