
 Primary working directories    : /global/cscratch1/sd/aannabe
 Secondary working directories  : /global/cscratch1/sd/aannabe
 Wavefunction directory         : /global/homes/a/aannabe/wfu/
 Main file repository           : /global/cscratch1/sd/aannabe/

 SHA1      : 2873118e99aab1bc19f5b6fc1784693c06d15c95
 NAME      : 2015.1.8
 ARCHNAME  : linux/x86_64
 FC        : /opt/cray/pe/craype/2.5.5/bin/ftn
 BLASLIB   : -Wl,-_start-group /opt/intel/compilers_and_libraries_2016.3.210/linux/mkl/lib/intel64/libmkl_intel_ilp64.a /opt/intel/compilers_and_libraries_2016.3.210/linux/mkl/lib/intel64/libmkl_intel_thread.a /opt/intel/compilers_and_libraries_2016.3.210/linux/mkl/lib/intel64/libmkl_core.a -Wl,-_end-group
 id        : lbl

 Nodes     nprocs
 nid00498     1

 Using customized tuning parameters: mindgm=8; mindgv=16; mindgc=4; mindgr=1; noblas=0; minvec=7
 default implementation of scratch files=df  

 ***,F
 memory,8,g
 gthresh,twoint=1.e-12
 
 gprint,basis,orbitals
 gexpec,ekin,pot
 
 angstrom
 geometry={
 1                                                                               ! Number of atoms
 F 0.0 0.0 0.0
 }
 
 basis={
 Including file /global/homes/a/aannabe/docs/totals/pps/F.pp
 Including file /global/homes/a/aannabe/docs/totals/basis/aug-cc-pVnZ/F_5z.basis
 }
 
 {hf
 wf,7,3,1
 occ,1,1,1,0,1,0,0,0
                                                                                 !open,1.3
 closed,1,1,0,0,1,0,0,0
                                                                                 !sym,
 }
 scf(i)=energy
 
 _CC_NORM_MAX=2.0
  !NOTE: Perturbative MRCC works only with UHF reference. So, here we will trick MRCC by doing zero UHF iteration right after ROHF.
 
 {uhf
 wf,7,3,1
 occ,1,1,1,0,1,0,0,0
                                                                                 !open,1.3
 closed,1,1,0,0,1,0,0,0
                                                                                 !sym,
 maxit,0
 }
 scf(i)=energy
 
 {mrcc,method=CCSDT(Q)
 orbital,ignore_error=1                                                          !Ignore the fact that UHF WF is not converged
 maxit,100
 core
 }
 posthf(i)=energy
 
 table,scf,posthf,ekin,pot
 save,5.csv,new
 
 

 Variables initialized (889), CPU time= 0.00 sec
 Commands  initialized (702), CPU time= 0.01 sec, 572 directives.
 Default parameters read. Elapsed time= 0.13 sec

 Checking input...
 Passed
1


                                         ***  PROGRAM SYSTEM MOLPRO  ***
                                       Copyright, TTI GmbH Stuttgart, 2015
                                    Version 2015.1 linked Sep  7 2016 23:09:38


 **********************************************************************************************************************************
 LABEL *   F                                                                             
  64 bit serial version                                                                  DATE: 15-Jun-18          TIME: 17:19:59  
 **********************************************************************************************************************************

 SHA1:             2873118e99aab1bc19f5b6fc1784693c06d15c95
 **********************************************************************************************************************************

 THRESHOLDS:

 ZERO    =  1.00D-12  ONEINT  =  1.00D-12  TWOINT  =  1.00D-12  PREFAC  =  1.00D-14  LOCALI  =  1.00D-09  EORDER  =  1.00D-04
 ENERGY  =  0.00D+00  ETEST   =  0.00D+00  EDENS   =  0.00D+00  THRDEDEF=  1.00D-06  GRADIENT=  1.00D-02  STEP    =  1.00D-03
 ORBITAL =  1.00D-05  CIVEC   =  1.00D-05  COEFF   =  1.00D-04  PRINTCI =  5.00D-02  PUNCHCI =  9.90D+01  OPTGRAD =  3.00D-04
 OPTENERG=  1.00D-06  OPTSTEP =  3.00D-04  THRGRAD =  1.00D-10  COMPRESS=  1.00D-11  VARMIN  =  1.00D-07  VARMAX  =  1.00D-03
 THRDOUB =  0.00D+00  THRDIV  =  1.00D-05  THRRED  =  1.00D-07  THRPSP  =  1.00D+00  THRDC   =  1.00D-10  THRCS   =  1.00D-10
 THRNRM  =  1.00D-08  THREQ   =  0.00D+00  THRDE   =  1.00D+00  THRREF  =  1.00D-05  SPARFAC =  1.00D+00  THRDLP  =  1.00D-07
 THRDIA  =  1.00D-10  THRDLS  =  1.00D-07  THRGPS  =  0.00D+00  THRKEX  =  0.00D+00  THRDIS  =  2.00D-01  THRVAR  =  1.00D-10
 THRLOC  =  1.00D-06  THRGAP  =  1.00D-06  THRLOCT = -1.00D+00  THRGAPT = -1.00D+00  THRORB  =  1.00D-06  THRMLTP =  0.00D+00
 THRCPQCI=  1.00D-10  KEXTA   =  0.00D+00  THRCOARS=  0.00D+00  SYMTOL  =  1.00D-06  GRADTOL =  1.00D-06  THROVL  =  1.00D-08
 THRORTH =  1.00D-08  GRID    =  1.00D-06  GRIDMAX =  1.00D-03  DTMAX   =  0.00D+00  THROCCDE=  1.00D-01  THROCCDE=  1.00D-01



 ZUNIT=ANG
 

Geometry recognized as XYZ


 Variable memory set to 8000000000 words,  buffer space   230000 words

 SETTING BASIS          =    USERDEF


 Recomputing integrals since basis changed


 Using spherical harmonics



 PROGRAM * SEWARD (Integral evaluation for generally contracted gaussian basis sets)     Author: Roland Lindh, 1990

 Geometry written to block  1 of record 700

 Orientation using atomic masses  
 Molecule type: Atom
 Symmetry elements: X,Y,Z
 Rotational constants:       0.0000000      0.0000000      0.0000000 GHz  (calculated with average atomic masses)

 Point group  D2h 



 ATOMIC COORDINATES

 NR  ATOM    CHARGE       X              Y              Z

   1  F       7.00    0.000000000    0.000000000    0.000000000


          F   CORE POTENTIAL

          p POTENTIAL

 POWERS             1              3              2
 EXPONENTIALS   11.39544       10.49202       10.28681    
 COEFFICIENTS   7.000000       79.76808      -49.49901    

          s - p POTENTIAL

 POWERS             2
 EXPONENTIALS   11.39035    
 COEFFICIENTS   51.39347    


 BASIS DATA

   Nr Sym  Nuc  Type         Exponents   Contraction coefficients

    1.1 Ag    1  1s          71.173909    -0.000057
                             33.399038     0.000363
                             15.672819     0.009533
                              7.354620    -0.127065
                              3.451226     0.011527
                              1.619521     0.290584
                              0.759976     0.448567
                              0.356626     0.312306
                              0.167350     0.065625
    2.1 Ag    1  1s           2.542428     1.000000
    3.1 Ag    1  1s           1.250265     1.000000
    4.1 Ag    1  1s           0.459697     1.000000
    5.1 Ag    1  1s           0.191146     1.000000
    6.1 Ag    1  1s           0.076458     1.000000
    7.1 Ag    1  3d0          5.603581     1.000000
    8.1 Ag    1  3d2+         5.603581     1.000000
    9.1 Ag    1  3d0          3.901897     1.000000
   10.1 Ag    1  3d2+         3.901897     1.000000
   11.1 Ag    1  3d0          1.523306     1.000000
   12.1 Ag    1  3d2+         1.523306     1.000000
   13.1 Ag    1  3d0          0.517711     1.000000
   14.1 Ag    1  3d2+         0.517711     1.000000
   15.1 Ag    1  3d0          0.207084     1.000000
   16.1 Ag    1  3d2+         0.207084     1.000000
   17.1 Ag    1  5g0          4.619953     1.000000
   18.1 Ag    1  5g4+         4.619953     1.000000
   19.1 Ag    1  5g2+         4.619953     1.000000
   20.1 Ag    1  5g0          1.638933     1.000000
   21.1 Ag    1  5g4+         1.638933     1.000000
   22.1 Ag    1  5g2+         1.638933     1.000000
   23.1 Ag    1  5g0          0.655573     1.000000
   24.1 Ag    1  5g4+         0.655573     1.000000
   25.1 Ag    1  5g2+         0.655573     1.000000
    1.2 B3u   1  2px         27.863051     0.003758
                             13.662475     0.043495
                              6.699310     0.093050
                              3.284965     0.177293
                              1.610762     0.261759
                              0.789827     0.289687
                              0.387287     0.243341
                              0.189904     0.125496
                              0.093118     0.026843
    2.2 B3u   1  2px          2.018698     1.000000
    3.2 B3u   1  2px          1.505085     1.000000
    4.2 B3u   1  2px          0.489019     1.000000
    5.2 B3u   1  2px          0.170574     1.000000
    6.2 B3u   1  2px          0.068230     1.000000
    7.2 B3u   1  4f1+         4.297889     1.000000
    8.2 B3u   1  4f3+         4.297889     1.000000
    9.2 B3u   1  4f1+         2.950321     1.000000
   10.2 B3u   1  4f3+         2.950321     1.000000
   11.2 B3u   1  4f1+         0.981494     1.000000
   12.2 B3u   1  4f3+         0.981494     1.000000
   13.2 B3u   1  4f1+         0.392598     1.000000
   14.2 B3u   1  4f3+         0.392598     1.000000
   15.2 B3u   1  6h1+         2.963127     1.000000
   16.2 B3u   1  6h3+         2.963127     1.000000
   17.2 B3u   1  6h5+         2.963127     1.000000
   18.2 B3u   1  6h1+         1.185251     1.000000
   19.2 B3u   1  6h3+         1.185251     1.000000
   20.2 B3u   1  6h5+         1.185251     1.000000
    1.3 B2u   1  2py         27.863051     0.003758
                             13.662475     0.043495
                              6.699310     0.093050
                              3.284965     0.177293
                              1.610762     0.261759
                              0.789827     0.289687
                              0.387287     0.243341
                              0.189904     0.125496
                              0.093118     0.026843
    2.3 B2u   1  2py          2.018698     1.000000
    3.3 B2u   1  2py          1.505085     1.000000
    4.3 B2u   1  2py          0.489019     1.000000
    5.3 B2u   1  2py          0.170574     1.000000
    6.3 B2u   1  2py          0.068230     1.000000
    7.3 B2u   1  4f1-         4.297889     1.000000
    8.3 B2u   1  4f3-         4.297889     1.000000
    9.3 B2u   1  4f1-         2.950321     1.000000
   10.3 B2u   1  4f3-         2.950321     1.000000
   11.3 B2u   1  4f1-         0.981494     1.000000
   12.3 B2u   1  4f3-         0.981494     1.000000
   13.3 B2u   1  4f1-         0.392598     1.000000
   14.3 B2u   1  4f3-         0.392598     1.000000
   15.3 B2u   1  6h1-         2.963127     1.000000
   16.3 B2u   1  6h3-         2.963127     1.000000
   17.3 B2u   1  6h5-         2.963127     1.000000
   18.3 B2u   1  6h1-         1.185251     1.000000
   19.3 B2u   1  6h3-         1.185251     1.000000
   20.3 B2u   1  6h5-         1.185251     1.000000
    1.4 B1g   1  3d2-         5.603581     1.000000
    2.4 B1g   1  3d2-         3.901897     1.000000
    3.4 B1g   1  3d2-         1.523306     1.000000
    4.4 B1g   1  3d2-         0.517711     1.000000
    5.4 B1g   1  3d2-         0.207084     1.000000
    6.4 B1g   1  5g2-         4.619953     1.000000
    7.4 B1g   1  5g4-         4.619953     1.000000
    8.4 B1g   1  5g2-         1.638933     1.000000
    9.4 B1g   1  5g4-         1.638933     1.000000
   10.4 B1g   1  5g2-         0.655573     1.000000
   11.4 B1g   1  5g4-         0.655573     1.000000
    1.5 B1u   1  2pz         27.863051     0.003758
                             13.662475     0.043495
                              6.699310     0.093050
                              3.284965     0.177293
                              1.610762     0.261759
                              0.789827     0.289687
                              0.387287     0.243341
                              0.189904     0.125496
                              0.093118     0.026843
    2.5 B1u   1  2pz          2.018698     1.000000
    3.5 B1u   1  2pz          1.505085     1.000000
    4.5 B1u   1  2pz          0.489019     1.000000
    5.5 B1u   1  2pz          0.170574     1.000000
    6.5 B1u   1  2pz          0.068230     1.000000
    7.5 B1u   1  4f0          4.297889     1.000000
    8.5 B1u   1  4f2+         4.297889     1.000000
    9.5 B1u   1  4f0          2.950321     1.000000
   10.5 B1u   1  4f2+         2.950321     1.000000
   11.5 B1u   1  4f0          0.981494     1.000000
   12.5 B1u   1  4f2+         0.981494     1.000000
   13.5 B1u   1  4f0          0.392598     1.000000
   14.5 B1u   1  4f2+         0.392598     1.000000
   15.5 B1u   1  6h2+         2.963127     1.000000
   16.5 B1u   1  6h4+         2.963127     1.000000
   17.5 B1u   1  6h0          2.963127     1.000000
   18.5 B1u   1  6h2+         1.185251     1.000000
   19.5 B1u   1  6h4+         1.185251     1.000000
   20.5 B1u   1  6h0          1.185251     1.000000
    1.6 B2g   1  3d1+         5.603581     1.000000
    2.6 B2g   1  3d1+         3.901897     1.000000
    3.6 B2g   1  3d1+         1.523306     1.000000
    4.6 B2g   1  3d1+         0.517711     1.000000
    5.6 B2g   1  3d1+         0.207084     1.000000
    6.6 B2g   1  5g1+         4.619953     1.000000
    7.6 B2g   1  5g3+         4.619953     1.000000
    8.6 B2g   1  5g1+         1.638933     1.000000
    9.6 B2g   1  5g3+         1.638933     1.000000
   10.6 B2g   1  5g1+         0.655573     1.000000
   11.6 B2g   1  5g3+         0.655573     1.000000
    1.7 B3g   1  3d1-         5.603581     1.000000
    2.7 B3g   1  3d1-         3.901897     1.000000
    3.7 B3g   1  3d1-         1.523306     1.000000
    4.7 B3g   1  3d1-         0.517711     1.000000
    5.7 B3g   1  3d1-         0.207084     1.000000
    6.7 B3g   1  5g1-         4.619953     1.000000
    7.7 B3g   1  5g3-         4.619953     1.000000
    8.7 B3g   1  5g1-         1.638933     1.000000
    9.7 B3g   1  5g3-         1.638933     1.000000
   10.7 B3g   1  5g1-         0.655573     1.000000
   11.7 B3g   1  5g3-         0.655573     1.000000
    1.8 Au    1  4f2-         4.297889     1.000000
    2.8 Au    1  4f2-         2.950321     1.000000
    3.8 Au    1  4f2-         0.981494     1.000000
    4.8 Au    1  4f2-         0.392598     1.000000
    5.8 Au    1  6h4-         2.963127     1.000000
    6.8 Au    1  6h2-         2.963127     1.000000
    7.8 Au    1  6h4-         1.185251     1.000000
    8.8 Au    1  6h2-         1.185251     1.000000

 NUCLEAR CHARGE:                    7
 NUMBER OF PRIMITIVE AOS:         213
 NUMBER OF SYMMETRY AOS:          158
 NUMBER OF CONTRACTIONS:          126   (  25Ag  +  20B3u +  20B2u +  11B1g +  20B1u +  11B2g +  11B3g +   8Au  )
 NUMBER OF CORE ORBITALS:           0   (   0Ag  +   0B3u +   0B2u +   0B1g +   0B1u +   0B2g +   0B3g +   0Au  )
 NUMBER OF VALENCE ORBITALS:        4   (   1Ag  +   1B3u +   1B2u +   0B1g +   1B1u +   0B2g +   0B3g +   0Au  )


 NUCLEAR REPULSION ENERGY    0.00000000

 EXTRA SYMMETRY OF AOS IN SYMMETRY 1:   1 1 1 1 1 1 2 3 2 3   2 3 2 3 2 3 4 5 6 4   5 6 4 5 6
 EXTRA SYMMETRY OF AOS IN SYMMETRY 2:   1 1 1 1 1 1 2 3 2 3   2 3 2 3 4 5 6 4 5 6
 EXTRA SYMMETRY OF AOS IN SYMMETRY 3:   1 1 1 1 1 1 2 3 2 3   2 3 2 3 4 5 6 4 5 6
 EXTRA SYMMETRY OF AOS IN SYMMETRY 4:   1 1 1 1 1 2 3 2 3 2   3
 EXTRA SYMMETRY OF AOS IN SYMMETRY 5:   1 1 1 1 1 1 2 3 2 3   2 3 2 3 4 5 6 4 5 6
 EXTRA SYMMETRY OF AOS IN SYMMETRY 6:   1 1 1 1 1 2 3 2 3 2   3
 EXTRA SYMMETRY OF AOS IN SYMMETRY 7:   1 1 1 1 1 2 3 2 3 2   3
 EXTRA SYMMETRY OF AOS IN SYMMETRY 8:   1 1 1 1 2 3 2 3

 Eigenvalues of metric

         1 0.951E-03 0.854E-02 0.195E-01 0.195E-01 0.525E-01 0.147E+00 0.147E+00 0.293E+00
         2 0.393E-02 0.208E-01 0.431E-01 0.431E-01 0.836E-01 0.317E+00 0.317E+00 0.431E+00
         3 0.393E-02 0.208E-01 0.431E-01 0.431E-01 0.836E-01 0.317E+00 0.317E+00 0.431E+00
         4 0.195E-01 0.147E+00 0.293E+00 0.293E+00 0.533E+00 0.900E+00 0.900E+00 0.158E+01
         5 0.393E-02 0.208E-01 0.431E-01 0.431E-01 0.836E-01 0.317E+00 0.317E+00 0.431E+00
         6 0.195E-01 0.147E+00 0.293E+00 0.293E+00 0.533E+00 0.900E+00 0.900E+00 0.158E+01
         7 0.195E-01 0.147E+00 0.293E+00 0.293E+00 0.533E+00 0.900E+00 0.900E+00 0.158E+01
         8 0.431E-01 0.317E+00 0.483E+00 0.483E+00 0.128E+01 0.152E+01 0.152E+01 0.236E+01


 Contracted 2-electron integrals neglected if value below      1.0D-12
 AO integral compression algorithm  1   Integral accuracy      1.0D-12

     32.506 MB (compressed) written to integral file ( 58.6%)


 NUMBER OF SORTED TWO-ELECTRON INTEGRALS:    4156552.     BUFFER LENGTH:  32768
 NUMBER OF SEGMENTS:   1  SEGMENT LENGTH:    4156552      RECORD LENGTH: 524288

 Memory used in sort:       4.71 MW

 SORT1 READ     6989366. AND WROTE     2907704. INTEGRALS IN      9 RECORDS. CPU TIME:     0.19 SEC, REAL TIME:     0.26 SEC
 SORT2 READ     2907704. AND WROTE     4156552. INTEGRALS IN    124 RECORDS. CPU TIME:     0.16 SEC, REAL TIME:     0.30 SEC

 FILE SIZES:   FILE 1:    52.0 MBYTE,  FILE 4:    37.8 MBYTE,   TOTAL:     89.7 MBYTE

 OPERATOR DM      FOR CENTER  0  COORDINATES:    0.000000    0.000000    0.000000
 OPERATOR EKIN    FOR CENTER  0  COORDINATES:    0.000000    0.000000    0.000000
 OPERATOR POT     FOR CENTER  0  COORDINATES:    0.000000    0.000000    0.000000


 **********************************************************************************************************************************
 DATASETS  * FILE   NREC   LENGTH (MB)   RECORD NAMES
              1      20       38.95       500      610      700      900      950      970     1000      129      960     1100   
                                          VAR    BASINP    GEOM    SYMINP    ZMAT    AOBASIS   BASIS     P2S    ABASIS      S 
                                         1400     1410     1420     1200     1210     1080     1600     1650     1300     1700   
                                         EKIN       V       ECP      H0       H01     AOSYM     SMH    MOLCAS    ERIS     OPER   

 PROGRAMS   *        TOTAL       INT
 CPU TIMES  *         3.28      3.17
 REAL TIME  *        13.71 SEC
 DISK USED  *        90.05 MB      
 **********************************************************************************************************************************


 PROGRAM * RHF-SCF (OPEN SHELL)       Authors: W. Meyer, H.-J. Werner


 NUMBER OF ELECTRONS:       4+    3-    SPACE SYMMETRY=3    SPIN SYMMETRY: Doublet 
 CONVERGENCE THRESHOLDS:    1.00E-05 (Density)    1.00E-07 (Energy)
 MAX. NUMBER OF ITERATIONS:       60
 INTERPOLATION TYPE:            DIIS
 INTERPOLATION STEPS:              2 (START)      1 (STEP)
 LEVEL SHIFTS:                 -0.60 (CLOSED) -0.30 (OPEN) 

 Number of closed-shell orbitals:    3 (   1   1   0   0   1   0   0   0 )
 Number of open-shell orbitals:      1 (   0   0   1   0   0   0   0   0 )



   Atom=F  basis=ECP2MWB_GUESS     lmin=0  lmax=1

 Orbital guess generated from atomic densities. Full valence occupancy:    1   1   1   0   1   0   0   0


 Molecular orbital dump at record        2100.2

 ITERATION    DDIFF          GRAD             ENERGY        2-EL.EN.            DIPOLE MOMENTS         DIIS   ORB.
    1      0.000D+00      0.000D+00       -23.90180278     33.752036    0.00000    0.00000    0.00000    0    start
    2      0.000D+00      0.108D-01       -23.90748756     34.271222    0.00000    0.00000    0.00000    1    diag,B
    3      0.421D-02      0.252D-02       -23.90785279     34.234519    0.00000    0.00000    0.00000    2    diag,B
    4      0.121D-02      0.684D-03       -23.90794426     34.247431    0.00000    0.00000    0.00000    3    diag,B
    5      0.429D-03      0.232D-03       -23.90795647     34.248469    0.00000    0.00000    0.00000    4    diag,B
    6      0.212D-03      0.385D-04       -23.90795677     34.247819    0.00000    0.00000    0.00000    5    diag,B
    7      0.372D-04      0.801D-05       -23.90795678     34.247620    0.00000    0.00000    0.00000    6    fixocc
    8      0.743D-05      0.159D-05       -23.90795678     34.247605    0.00000    0.00000    0.00000    0    orth

 Final alpha occupancy:   1   1   1   0   1   0   0   0
 Final beta  occupancy:   1   1   0   0   1   0   0   0

 !RHF STATE 1.3 Energy                -23.907956779002
 Nuclear energy                         0.00000000
 One-electron energy                  -41.03175912
 Two-electron energy                   17.12380234
 Virial quotient                       -1.29005167
 !RHF STATE 1.3 Dipole moment           0.00000000     0.00000000     0.00000000
 Dipole moment /Debye                   0.00000000     0.00000000     0.00000000
 

 !RHF expec          <1.3|EKIN|1.3>    18.532557497919
 
 !RHF expec           <1.3|POT|1.3>    -8.840926524141

 ELECTRON ORBITALS
 =================


   Orb  Occ    Energy  Couls-En    Coefficients

                                   1 1s      1 1s      1 1s      1 1s      1 1s      1 1s      1 3d0     1 3d2+    1 3d0     1 3d2+ 
                                   1 3d0     1 3d2+    1 3d0     1 3d2+    1 3d0     1 3d2+    1 5g0     1 5g4+    1 5g2+    1 5g0  
                                   1 5g4+    1 5g2+    1 5g0     1 5g4+    1 5g2+ 

   1.1   2    -1.5590   -7.9872  1.000381  0.000252 -0.000725  0.000699 -0.001167  0.000653  0.000485  0.000839 -0.000181 -0.000313
                                 0.000320  0.000555  0.001163  0.002015  0.000806  0.001396 -0.000000 -0.000001 -0.000001 -0.000001
                                -0.000002 -0.000001 -0.000006 -0.000012 -0.000009

                                   1 2px     1 2px     1 2px     1 2px     1 2px     1 2px     1 4f1+    1 4f3+    1 4f1+    1 4f3+ 
                                   1 4f1+    1 4f3+    1 4f1+    1 4f3+    1 6h1+    1 6h3+    1 6h5+    1 6h1+    1 6h3+    1 6h5+ 


   1.2   2    -0.7074   -6.3245  0.999969  0.000048 -0.000007  0.000112 -0.000206  0.000040 -0.000094 -0.000366 -0.000259 -0.001004
                                -0.000616 -0.002386 -0.000307 -0.001189  0.000001  0.000002  0.000004  0.000001  0.000005  0.000010

                                   1 2py     1 2py     1 2py     1 2py     1 2py     1 2py     1 4f1-    1 4f3-    1 4f1-    1 4f3- 
                                   1 4f1-    1 4f3-    1 4f1-    1 4f3-    1 6h1-    1 6h3-    1 6h5-    1 6h1-    1 6h3-    1 6h5- 


   1.3   +    -0.8366   -6.5433  1.026628  0.000566  0.007551 -0.012076 -0.038333 -0.004918 -0.000634 -0.000819 -0.001706 -0.002202
                                -0.003872 -0.004998 -0.001507 -0.001946  0.000015  0.000016  0.000021  0.000027  0.000029  0.000039

                                   1 2pz     1 2pz     1 2pz     1 2pz     1 2pz     1 2pz     1 4f0     1 4f2+    1 4f0     1 4f2+ 
                                   1 4f0     1 4f2+    1 4f0     1 4f2+    1 6h2+    1 6h4+    1 6h0     1 6h2+    1 6h4+    1 6h0  


   1.5   2    -0.7074   -6.3245  0.999969  0.000048 -0.000007  0.000112 -0.000206  0.000040 -0.000231 -0.000299 -0.000635 -0.000820
                                -0.001509 -0.001949 -0.000752 -0.000970  0.000003  0.000003  0.000002  0.000007  0.000006  0.000005

 HOMO      1.2    -0.707382 =     -19.2489eV
 LUMO      2.1     0.131919 =       3.5897eV
 LUMO-HOMO         0.839302 =      22.8386eV


 **********************************************************************************************************************************
 DATASETS  * FILE   NREC   LENGTH (MB)   RECORD NAMES
              1      20       38.95       500      610      700      900      950      970     1000      129      960     1100   
                                          VAR    BASINP    GEOM    SYMINP    ZMAT    AOBASIS   BASIS     P2S    ABASIS      S 
                                         1400     1410     1420     1200     1210     1080     1600     1650     1300     1700   
                                         EKIN       V       ECP      H0       H01     AOSYM     SMH    MOLCAS    ERIS     OPER   

              2       4        2.83       700     1000      520     2100   
                                         GEOM     BASIS   MCVARS     RHF  

 PROGRAMS   *        TOTAL        HF       INT
 CPU TIMES  *         3.45      0.17      3.17
 REAL TIME  *        14.00 SEC
 DISK USED  *        90.05 MB      
 **********************************************************************************************************************************
 SETTING SCF(I)         =       -23.90795678  AU                              
 SETTING _CC_NORM_MAX   =         2.00000000                                  


 PROGRAM * UHF-SCF       Authors: W. Meyer, H.-J. Werner


 NUMBER OF ELECTRONS:       4+    3-    SPACE SYMMETRY=3    SPIN SYMMETRY: Doublet 
 CONVERGENCE THRESHOLDS:    1.00E-05 (Density)    1.00E-07 (Energy)
 MAX. NUMBER OF ITERATIONS:        0
 INTERPOLATION TYPE:            DIIS
 INTERPOLATION STEPS:              2 (START)      1 (STEP)
 LEVEL SHIFTS:                  0.20 (ALPHA)   0.20 (BETA) 

 Number of closed-shell orbitals:    3 (   1   1   0   0   1   0   0   0 )
 Number of open-shell orbitals:      1 (   0   0   1   0   0   0   0   0 )


 Molecular orbitals read from record     2100.2  Type=RHF/CANONICAL (state 1.3)

 Molecular orbital dump at record        2200.2

 Initial alpha occupation   1   1   1   0   1   0   0   0
 Initial beta  occupation   1   1   0   0   1   0   0   0

 ITERATION    DDIFF          GRAD             ENERGY        2-EL.EN.            DIPOLE MOMENTS         DIIS
    1      0.000D+00      0.000D+00       -23.90795678     34.247605    0.00000    0.00000    0.00000    0
 
 Final alpha occupancy:   1   1   1   0   1   0   0   0
 Final beta  occupancy:   1   1   0   0   1   0   0   0

 !UHF STATE 1.3 Energy                -23.907956779002
 Nuclear energy                         0.00000000
 One-electron energy                  -41.03175912
 Two-electron energy                   17.12380234
 Virial quotient                       -1.29005167
 !UHF STATE 1.3 Dipole moment           0.00000000     0.00000000     0.00000000
 Dipole moment /Debye                   0.00000000     0.00000000     0.00000000
 

 !UHF expec          <1.3|EKIN|1.3>    18.532557497919
 
 !UHF expec           <1.3|POT|1.3>    -8.840926524141

 ELECTRON ORBITALS FOR POSITIVE SPIN
 ===================================


   Orb  Occ    Energy  Couls-En    Coefficients

                                   1 1s      1 1s      1 1s      1 1s      1 1s      1 1s      1 3d0     1 3d2+    1 3d0     1 3d2+ 
                                   1 3d0     1 3d2+    1 3d0     1 3d2+    1 3d0     1 3d2+    1 5g0     1 5g4+    1 5g2+    1 5g0  
                                   1 5g4+    1 5g2+    1 5g0     1 5g4+    1 5g2+ 

   1.1   +    -1.5590   -7.9872  1.000381  0.000252 -0.000725  0.000699 -0.001167  0.000653  0.000485  0.000839 -0.000181 -0.000313
                                 0.000320  0.000555  0.001163  0.002015  0.000806  0.001396 -0.000000 -0.000001 -0.000001 -0.000001
                                -0.000002 -0.000001 -0.000006 -0.000012 -0.000009

                                   1 2px     1 2px     1 2px     1 2px     1 2px     1 2px     1 4f1+    1 4f3+    1 4f1+    1 4f3+ 
                                   1 4f1+    1 4f3+    1 4f1+    1 4f3+    1 6h1+    1 6h3+    1 6h5+    1 6h1+    1 6h3+    1 6h5+ 


   1.2   +    -0.7074   -6.3245  0.999969  0.000048 -0.000007  0.000112 -0.000206  0.000040 -0.000094 -0.000366 -0.000259 -0.001004
                                -0.000616 -0.002386 -0.000307 -0.001189  0.000001  0.000002  0.000004  0.000001  0.000005  0.000010

                                   1 2py     1 2py     1 2py     1 2py     1 2py     1 2py     1 4f1-    1 4f3-    1 4f1-    1 4f3- 
                                   1 4f1-    1 4f3-    1 4f1-    1 4f3-    1 6h1-    1 6h3-    1 6h5-    1 6h1-    1 6h3-    1 6h5- 


   1.3   +    -0.8366   -6.5433  1.026628  0.000566  0.007551 -0.012076 -0.038333 -0.004918 -0.000634 -0.000819 -0.001706 -0.002202
                                -0.003872 -0.004998 -0.001507 -0.001946  0.000015  0.000016  0.000021  0.000027  0.000029  0.000039

                                   1 2pz     1 2pz     1 2pz     1 2pz     1 2pz     1 2pz     1 4f0     1 4f2+    1 4f0     1 4f2+ 
                                   1 4f0     1 4f2+    1 4f0     1 4f2+    1 6h2+    1 6h4+    1 6h0     1 6h2+    1 6h4+    1 6h0  


   1.5   +    -0.7074   -6.3245  0.999969  0.000048 -0.000007  0.000112 -0.000206  0.000040 -0.000231 -0.000299 -0.000635 -0.000820
                                -0.001509 -0.001949 -0.000752 -0.000970  0.000003  0.000003  0.000002  0.000007  0.000006  0.000005

 ELECTRON ORBITALS FOR NEGATIVE SPIN
 ===================================


   Orb  Occ    Energy  Couls-En    Coefficients

                                   1 1s      1 1s      1 1s      1 1s      1 1s      1 1s      1 3d0     1 3d2+    1 3d0     1 3d2+ 
                                   1 3d0     1 3d2+    1 3d0     1 3d2+    1 3d0     1 3d2+    1 5g0     1 5g4+    1 5g2+    1 5g0  
                                   1 5g4+    1 5g2+    1 5g0     1 5g4+    1 5g2+ 

   1.1   -    -1.5590   -7.9872  1.000381  0.000252 -0.000725  0.000699 -0.001167  0.000653  0.000485  0.000839 -0.000181 -0.000313
                                 0.000320  0.000555  0.001163  0.002015  0.000806  0.001396 -0.000000 -0.000001 -0.000001 -0.000001
                                -0.000002 -0.000001 -0.000006 -0.000012 -0.000009

                                   1 2px     1 2px     1 2px     1 2px     1 2px     1 2px     1 4f1+    1 4f3+    1 4f1+    1 4f3+ 
                                   1 4f1+    1 4f3+    1 4f1+    1 4f3+    1 6h1+    1 6h3+    1 6h5+    1 6h1+    1 6h3+    1 6h5+ 


   1.2   -    -0.7074   -6.3245  0.999969  0.000048 -0.000007  0.000112 -0.000206  0.000040 -0.000094 -0.000366 -0.000259 -0.001004
                                -0.000616 -0.002386 -0.000307 -0.001189  0.000001  0.000002  0.000004  0.000001  0.000005  0.000010

                                   1 2pz     1 2pz     1 2pz     1 2pz     1 2pz     1 2pz     1 4f0     1 4f2+    1 4f0     1 4f2+ 
                                   1 4f0     1 4f2+    1 4f0     1 4f2+    1 6h2+    1 6h4+    1 6h0     1 6h2+    1 6h4+    1 6h0  


   1.5   -    -0.7074   -6.3245  0.999969  0.000048 -0.000007  0.000112 -0.000206  0.000040 -0.000231 -0.000299 -0.000635 -0.000820
                                -0.001509 -0.001949 -0.000752 -0.000970  0.000003  0.000003  0.000002  0.000007  0.000006  0.000005

 HOMO      1.2    -0.707382 =     -19.2489eV
 LUMO     -1.3    -0.836566 =     -22.7641eV
 LUMO-HOMO        -0.129184 =      -3.5153eV

 EXPECTATION VALUE OF S**2:             0.75000000

 Occupation number threshold for canonical orbitals:  1.999000 (occupied),  0.001000 (virtual)

 Number of pseudo-canonical orbitals per symmetry:    1   1   0   0   1   0   0   0
 Number of active natural orbitals per symmetry:      0   0   1   0   0   0   0   0

 NATURAL CHARGE ORBITALS
 =======================


   Orb     Occ        Energy       Coefficients

                                   1 1s      1 1s      1 1s      1 1s      1 1s      1 1s      1 3d0     1 3d2+    1 3d0     1 3d2+ 
                                   1 3d0     1 3d2+    1 3d0     1 3d2+    1 3d0     1 3d2+    1 5g0     1 5g4+    1 5g2+    1 5g0  
                                   1 5g4+    1 5g2+    1 5g0     1 5g4+    1 5g2+ 

   1.1  2.00000    -1.559025     1.000381  0.000252 -0.000725  0.000699 -0.001167  0.000653  0.000485  0.000839 -0.000181 -0.000313
                                 0.000320  0.000555  0.001163  0.002015  0.000806  0.001396 -0.000000 -0.000001 -0.000001 -0.000001
                                -0.000002 -0.000001 -0.000006 -0.000012 -0.000009

                                   1 2px     1 2px     1 2px     1 2px     1 2px     1 2px     1 4f1+    1 4f3+    1 4f1+    1 4f3+ 
                                   1 4f1+    1 4f3+    1 4f1+    1 4f3+    1 6h1+    1 6h3+    1 6h5+    1 6h1+    1 6h3+    1 6h5+ 


   1.2  2.00000    -0.707382     0.999969  0.000048 -0.000007  0.000112 -0.000206  0.000040 -0.000094 -0.000366 -0.000259 -0.001004
                                -0.000616 -0.002386 -0.000307 -0.001189  0.000001  0.000002  0.000004  0.000001  0.000005  0.000010

                                   1 2py     1 2py     1 2py     1 2py     1 2py     1 2py     1 4f1-    1 4f3-    1 4f1-    1 4f3- 
                                   1 4f1-    1 4f3-    1 4f1-    1 4f3-    1 6h1-    1 6h3-    1 6h5-    1 6h1-    1 6h3-    1 6h5- 


   1.3  1.00000    -0.360031     1.026628  0.000566  0.007551 -0.012076 -0.038333 -0.004918 -0.000634 -0.000819 -0.001706 -0.002202
                                -0.003872 -0.004998 -0.001507 -0.001946  0.000015  0.000016  0.000021  0.000027  0.000029  0.000039

                                   1 2pz     1 2pz     1 2pz     1 2pz     1 2pz     1 2pz     1 4f0     1 4f2+    1 4f0     1 4f2+ 
                                   1 4f0     1 4f2+    1 4f0     1 4f2+    1 6h2+    1 6h4+    1 6h0     1 6h2+    1 6h4+    1 6h0  


   1.5  2.00000    -0.707382     0.999969  0.000048 -0.000007  0.000112 -0.000206  0.000040 -0.000231 -0.000299 -0.000635 -0.000820
                                -0.001509 -0.001949 -0.000752 -0.000970  0.000003  0.000003  0.000002  0.000007  0.000006  0.000005

 Natural orbitals saved to record    2200.2 (Orbital set 3)

 Orbital spaces for UNO-CAS (Min. occupation: 0.020  Max. occupation: 1.980):

 Closed:        1   1   0   0   1   0   0   0
 Active:        0   0   1   0   0   0   0   0

 No convergence



 **********************************************************************************************************************************
 DATASETS  * FILE   NREC   LENGTH (MB)   RECORD NAMES
              1      20       38.95       500      610      700      900      950      970     1000      129      960     1100   
                                          VAR    BASINP    GEOM    SYMINP    ZMAT    AOBASIS   BASIS     P2S    ABASIS      S 
                                         1400     1410     1420     1200     1210     1080     1600     1650     1300     1700   
                                         EKIN       V       ECP      H0       H01     AOSYM     SMH    MOLCAS    ERIS     OPER   

              2       5        5.45       700     1000      520     2100     2200   
                                         GEOM     BASIS   MCVARS     RHF      UHF  

 PROGRAMS   *        TOTAL       UHF        HF       INT
 CPU TIMES  *         3.49      0.03      0.17      3.17
 REAL TIME  *        14.16 SEC
 DISK USED  *        90.05 MB      
 **********************************************************************************************************************************
 SETTING SCF(I)         =       -23.90795678  AU                              


 PROGRAM * MRCC (General Multireference Coupled Cluster)    Author: M. Kallay, 2000-2005

 ***  Initialisation ***

   0 Spin projections
 
 Molecular orbitals read from record     2200.2  Type=UHF/ALPHA (state 1.3)

 ?Warning: UHF not converged
 Molecular orbitals read from record     2200.2  Type=UHF/BETA (state 1.3)

 ?Warning: UHF not converged
 
 Frozen orbitals:              0 (  0  0  0  0  0  0  0  0)
 Active orbitals:            126 ( 25 20 20 11 20 11 11  8)
 Active electrons:             7
 Spin quantum number:          0.5

 Transformed integrals will be written to file mrcc_40141/fort.55

 Load integrals                3.5 sec
 Transform integrals           5.7 sec
 Storage for integrals:       24278327
 Remaining memory:           *********

 Core energy:               0.00000000
 
 MRCC Input:
     4     0     0     0     3     0     0     3     0     0     0     1     1     0     0     7     0     0   0.000     0   64000
  ex.lev,nsing,ntrip, rest,method,dens,conver,symm, diag, CS ,spatial, HF, ndoub,nacto,nactv, tol, maxex, sacc, freq,  dboc,   mem
  2  0  0  0  0  0  0  0  0  0  0  0  0  0  0  0  0  0  0  0  0  0  0  0  0  2  0  0  0  0  0  0  0  0  0  0  0  0  0  0  0  0  0  0  0  1  0  0  0  0  0  0  0  0  0  0  0  0  0  0  0  0  0  0  0  0  0  0  0  0  0  0  0  0  0  0  2  0  0  0  0  0  0  0  0  0  0  0  0  0  0  0  0  0  0  0  0  0  0  0  0  0  0  0  0  0  0  0  0  0  0  0  0  0  0  0  0  0  0  0  0  0  0  0  0  0
 MRCC Input end
 Variable memory released
 MRCC now being run, temporary output in /global/cscratch1/sd/aannabe/mrcc_40141/mrcc.out
 **********************************************************************
                          MRCC program system
 **********************************************************************

                              Written by
  Mihaly Kallay, Zoltan Rolik, Jozsef Csontos, Peter Nagy, Gyula Samu,
      David Mester, Jozsef Csoka, Bernat Szabo, Istvan Ladjanszki,
       Lorant Szegedy, Bence Ladoczki, Klara Petrov, Mate Farkas,
                    Pal D. Mezei, and Bence Hegely

        Department of Physical Chemistry and Materials Science
            Budapest University of Technology and Economics
                  Budapest P.O.Box 91, H-1521 Hungary

                              www.mrcc.hu

                       Release date: May 23, 2018

 ************************ 2018-06-15 17:26:01 *************************
 Executing goldstone...

 Generation of CC equations in terms of H and T...
 Generation of antisymmetrized Goldstone diagrams...
 Number of diagrams in T^1 equations:    15
 Number of diagrams in T^2 equations:    38
 Number of diagrams in T^3 equations:    49
 Number of diagrams in T^4 equations:     5
 Translation of diagrams to factorized equations...
 Optimizing intermediate calculation...
 Number of floating-point operations per iteration step:   1.0665E+12
 Probable CPU time per iteration step (hours):     10.67
 Required memory (Mbytes):   29412.3
 Number of intermediates:                                  79
 Number of intermediates to be stored:                     32
 Length of intermediate file (Mbytes):     511.2

 ************************ 2018-06-15 17:26:01 *************************
 Executing xmrcc...

 **********************************************************************
 CC(3)(4) calculation


 Allocation of****** Mbytes of memory...
 Number of spinorbitals:                   252
 Number of alpha electrons:                        4
 Number of beta electrons:                         3
 Spin multiplicity:                     2
 z-component of spin:  0.5
 Spatial symmetry:                      3
 Convergence criterion:  1.0E-07
 Construction of occupation graphs...
 Number of                     0 -fold excitations:                      1
 Number of                     1 -fold excitations:                    143
 Number of                     2 -fold excitations:                  31673
 Number of                     3 -fold excitations:                3601177
 Total number of configurations:                3632994
 Calculation of coupling coefficients...
 Length of intermediate file (Mbytes):     386.4

 ======================================================================

 Spin case  1   Alpha:  1   Beta:  3
 Number of excitations:               18451565
 Spin case  2   Alpha:  2   Beta:  2
 Number of excitations:              124606837
 Spin case  3   Alpha:  3   Beta:  1
 Number of excitations:               54447452
 Spin case  4   Alpha:  4   Beta:  0
 Number of excitations:                1099202
 Number of                     4 -fold excitations:              198605056

 Memory requirements /Mbyte/:
               Minimal        Optimal
 Real*8:        773.5070      1923.2150
 Integer:       154.3052
 Total:         927.8123      2077.5202


 ************************ 2018-06-15 17:26:14 *************************
 Executing mrcc...

 **********************************************************************
 CCSDT(Q) calculation


 OpenMP parallel version is running.
 Number of CPUs:   1
 Allocation of 1923.2 Mbytes of memory...
 Number of spinorbitals: 252
 Number of alpha electrons:  4
 Number of beta  electrons:  3
 Spin multiplicity: 2
 z-component of spin:  0.5
 Spatial symmetry: 3
 Convergence criterion:  1.0E-07
 Construction of occupation graphs...
 Number of 0-fold excitations: 1
 Number of 1-fold excitations: 143
 Number of 2-fold excitations: 31673
 Number of 3-fold excitations: 3601177
 Total number of determinants: 3632994
 Calculation of coupling coefficients...
 Initial cluster amplitudes are generated.
 Length of intermediate file (Mbytes):     386.4
 Reading integral list from unit 55...
 Sorting integrals...
 Sorting integrals...
 Sorting integrals...
 Sorting integrals...
 Energy of reference determinant [au]:     -23.907956779002
 Calculation of MP denominators...

 Starting CC iteration...
 ======================================================================
 Norm of residual vector:     1.63543465
 CPU time [min]:     1.735                   Wall time [min]:     1.738

 Iteration  1  CC energy:   -24.15030717  Energy decrease:   0.24235039
 ======================================================================
 Norm of residual vector:     0.31328102
 CPU time [min]:     2.954                   Wall time [min]:     2.962

 Iteration  2  CC energy:   -24.15503793  Energy decrease:   0.00473076
 ======================================================================
 Norm of residual vector:     0.06091028
 CPU time [min]:     4.144                   Wall time [min]:     4.154

 Iteration  3  CC energy:   -24.16258611  Energy decrease:   0.00754818
 ======================================================================
 Norm of residual vector:     0.01919594
 CPU time [min]:     5.246                   Wall time [min]:     5.260

 Iteration  4  CC energy:   -24.16430665  Energy decrease:   0.00172054
 ======================================================================
 Norm of residual vector:     0.00830050
 CPU time [min]:     6.338                   Wall time [min]:     6.355

 Iteration  5  CC energy:   -24.16402438  Energy decrease:   0.00028227
 ======================================================================
 Norm of residual vector:     0.00347039
 CPU time [min]:     7.631                   Wall time [min]:     7.657

 Iteration  6  CC energy:   -24.16394380  Energy decrease:   0.00008058
 ======================================================================
 Norm of residual vector:     0.00181173
 CPU time [min]:     8.781                   Wall time [min]:     8.810

 Iteration  7  CC energy:   -24.16400172  Energy decrease:   0.00005792
 ======================================================================
 Norm of residual vector:     0.00068463
 CPU time [min]:    10.132                   Wall time [min]:    10.163

 Iteration  8  CC energy:   -24.16401807  Energy decrease:   0.00001636
 ======================================================================
 Norm of residual vector:     0.00025998
 CPU time [min]:    11.525                   Wall time [min]:    11.556

 Iteration  9  CC energy:   -24.16401515  Energy decrease:   0.00000293
 ======================================================================
 Norm of residual vector:     0.00010562
 CPU time [min]:    12.880                   Wall time [min]:    12.916

 Iteration 10  CC energy:   -24.16401452  Energy decrease:   0.00000062
 ======================================================================
 Norm of residual vector:     0.00004059
 CPU time [min]:    14.254                   Wall time [min]:    14.294

 Iteration 11  CC energy:   -24.16401487  Energy decrease:   0.00000035
 ======================================================================
 Norm of residual vector:     0.00001457
 CPU time [min]:    15.391                   Wall time [min]:    15.440

 Iteration 12  CC energy:   -24.16401478  Energy decrease:   0.00000009
 ======================================================================
 Norm of residual vector:     0.00000540
 CPU time [min]:    16.529                   Wall time [min]:    16.584

 Iteration 13  CC energy:   -24.16401473  Energy decrease:   0.00000005
 ======================================================================
 Norm of residual vector:     0.00000159
 CPU time [min]:    17.667                   Wall time [min]:    17.730

 Iteration 14  CC energy:   -24.16401474  Energy decrease:   0.00000001
 ======================================================================
 Norm of residual vector:     0.00000051
 CPU time [min]:    18.800                   Wall time [min]:    18.873

 Iteration 15  CC energy:   -24.16401474  Energy decrease:   5.2406E-10
 ======================================================================
 Norm of residual vector:     0.00000017
 CPU time [min]:    20.248                   Wall time [min]:    20.323

 Iteration 16  CC energy:   -24.16401474  Energy decrease:   2.3732E-09
 ======================================================================
 Norm of residual vector:     0.00000006
 CPU time [min]:    21.521                   Wall time [min]:    21.601

 Iteration 17  CC energy:   -24.16401474  Energy decrease:   2.8324E-10
 ======================================================================

 Iteration has converged in 17 steps.

 Final results:
 Total CCSDT energy [au]:            -24.164014737521
 Total MP2 energy [au]:              -24.150307172116

 Perturbative corrections are calculated...
 ======================================================================
 Spin case  1   Alpha:  1   Beta:  3
 Number of excitations:        18451565
 CPU time [min]:   112.883                   Wall time [min]:   112.969
 ======================================================================
 Spin case  2   Alpha:  2   Beta:  2
 Number of excitations:        124606837
 CPU time [min]:   347.452                   Wall time [min]:   347.576
 ======================================================================
 Spin case  3   Alpha:  3   Beta:  1
 Number of excitations:        54447452
 CPU time [min]:   501.797                   Wall time [min]:   501.941
 ======================================================================
 Spin case  4   Alpha:  4   Beta:  0
 Number of excitations:        1099202
 CPU time [min]:   513.732                   Wall time [min]:   513.886
 ======================================================================
 Number of 4-fold excitations: 198605056
 CPU time [min]:   513.732                   Wall time [min]:   513.887

 Total CCSDT[Q] energy [au]:         -24.163968431888
 Total CCSDT(Q) energy [au]:         -24.164124496941

 ************************ 2018-06-16 02:00:08 *************************
                      Normal termination of mrcc.
 **********************************************************************
 !CCSDT STATE 1.3 Energy              -24.164014737521
 !MP2 STATE 1.3 Energy                -24.150307172116
 !CCSDT[Q] STATE 1.3 Energy           -24.163968431888
 !CCSDT(Q) STATE 1.3 Energy           -24.164124496941
 
 CPU-time for MRCC:          30823.9 sec
 Elapsed-time for MRCC:      30849.2 sec

 Variable memory set to 8000000000 words,  buffer space   230000 words



 **********************************************************************************************************************************
 DATASETS  * FILE   NREC   LENGTH (MB)   RECORD NAMES
              1      20       38.95       500      610      700      900      950      970     1000      129      960     1100   
                                          VAR    BASINP    GEOM    SYMINP    ZMAT    AOBASIS   BASIS     P2S    ABASIS      S 
                                         1400     1410     1420     1200     1210     1080     1600     1650     1300     1700   
                                         EKIN       V       ECP      H0       H01     AOSYM     SMH    MOLCAS    ERIS     OPER   

              2       5        5.45       700     1000      520     2100     2200   
                                         GEOM     BASIS   MCVARS     RHF      UHF  

 PROGRAMS   *        TOTAL      MRCC       UHF        HF       INT
 CPU TIMES  *     30892.86  30889.36      0.03      0.17      3.17
 REAL TIME  *     31209.49 SEC
 DISK USED  *        90.05 MB      
 **********************************************************************************************************************************
 SETTING POSTHF(I)      =       -24.16412450  AU                              
                                                                                                                                                                                                                                                                

        SCF            POSTHF        EKIN          POT
    -23.90795678   -24.16412450   18.53255750   -8.84092652
                                                  

 CCSDT(Q)/USERDEF energy=    -24.164124496941

        CCSDT(Q)        UHF-SCF         HF-SCF  
    -24.16412450    -23.90795678    -23.90795678
 **********************************************************************************************************************************
 Variable memory released
