
 Primary working directories    : /global/cscratch1/sd/aannabe
 Secondary working directories  : /global/cscratch1/sd/aannabe
 Wavefunction directory         : /global/homes/a/aannabe/wfu/
 Main file repository           : /global/cscratch1/sd/aannabe/

 SHA1      : 2873118e99aab1bc19f5b6fc1784693c06d15c95
 NAME      : 2015.1.8
 ARCHNAME  : linux/x86_64
 FC        : /opt/cray/pe/craype/2.5.5/bin/ftn
 BLASLIB   : -Wl,-_start-group /opt/intel/compilers_and_libraries_2016.3.210/linux/mkl/lib/intel64/libmkl_intel_ilp64.a /opt/intel/compilers_and_libraries_2016.3.210/linux/mkl/lib/intel64/libmkl_intel_thread.a /opt/intel/compilers_and_libraries_2016.3.210/linux/mkl/lib/intel64/libmkl_core.a -Wl,-_end-group
 id        : lbl

 Nodes     nprocs
 nid00511     1

 Using customized tuning parameters: mindgm=8; mindgv=16; mindgc=4; mindgr=1; noblas=0; minvec=7
 default implementation of scratch files=df  

 ***,N
 memory,8,g
 gthresh,twoint=1.e-12
 
 gprint,basis,orbitals
 gexpec,ekin,pot
 
 angstrom
 geometry={
 1                                                                               ! Number of atoms
 N 0.0 0.0 0.0
 }
 
 basis={
 Including file /global/homes/a/aannabe/docs/totals_bfd/pps/N.pp
 Including file /global/homes/a/aannabe/docs/totals_bfd/basis/aug-cc-pVnZ/N_5z.basis
 }
 
 {hf
 wf,5,8,3
 occ,1,1,1,0,1,0,0,0
                                                                                 !open,1.3
 closed,1,0,0,0,0,0,0,0
                                                                                 !sym,
 }
 scf(i)=energy
 
 _CC_NORM_MAX=2.0
  !NOTE: Perturbative MRCC works only with UHF reference. So, here we will trick MRCC by doing zero UHF iteration right after ROHF.
 
 {uhf
 wf,5,8,3
 occ,1,1,1,0,1,0,0,0
                                                                                 !open,1.3
 closed,1,0,0,0,0,0,0,0
                                                                                 !sym,
 maxit,0
 }
 scf(i)=energy
 
 {mrcc,method=CCSDT(Q)
 orbital,ignore_error=1                                                          !Ignore the fact that UHF WF is not converged
 maxit,100
 core
 }
 posthf(i)=energy
 
 table,scf,posthf,ekin,pot
 save,5.csv,new
 
 

 Variables initialized (889), CPU time= 0.00 sec
 Commands  initialized (702), CPU time= 0.01 sec, 572 directives.
 Default parameters read. Elapsed time= 0.11 sec

 Checking input...
 Passed
1


                                         ***  PROGRAM SYSTEM MOLPRO  ***
                                       Copyright, TTI GmbH Stuttgart, 2015
                                    Version 2015.1 linked Sep  7 2016 23:09:38


 **********************************************************************************************************************************
 LABEL *   N                                                                             
  64 bit serial version                                                                  DATE: 20-Jun-18          TIME: 14:00:15  
 **********************************************************************************************************************************

 SHA1:             2873118e99aab1bc19f5b6fc1784693c06d15c95
 **********************************************************************************************************************************

 THRESHOLDS:

 ZERO    =  1.00D-12  ONEINT  =  1.00D-12  TWOINT  =  1.00D-12  PREFAC  =  1.00D-14  LOCALI  =  1.00D-09  EORDER  =  1.00D-04
 ENERGY  =  0.00D+00  ETEST   =  0.00D+00  EDENS   =  0.00D+00  THRDEDEF=  1.00D-06  GRADIENT=  1.00D-02  STEP    =  1.00D-03
 ORBITAL =  1.00D-05  CIVEC   =  1.00D-05  COEFF   =  1.00D-04  PRINTCI =  5.00D-02  PUNCHCI =  9.90D+01  OPTGRAD =  3.00D-04
 OPTENERG=  1.00D-06  OPTSTEP =  3.00D-04  THRGRAD =  1.00D-10  COMPRESS=  1.00D-11  VARMIN  =  1.00D-07  VARMAX  =  1.00D-03
 THRDOUB =  0.00D+00  THRDIV  =  1.00D-05  THRRED  =  1.00D-07  THRPSP  =  1.00D+00  THRDC   =  1.00D-10  THRCS   =  1.00D-10
 THRNRM  =  1.00D-08  THREQ   =  0.00D+00  THRDE   =  1.00D+00  THRREF  =  1.00D-05  SPARFAC =  1.00D+00  THRDLP  =  1.00D-07
 THRDIA  =  1.00D-10  THRDLS  =  1.00D-07  THRGPS  =  0.00D+00  THRKEX  =  0.00D+00  THRDIS  =  2.00D-01  THRVAR  =  1.00D-10
 THRLOC  =  1.00D-06  THRGAP  =  1.00D-06  THRLOCT = -1.00D+00  THRGAPT = -1.00D+00  THRORB  =  1.00D-06  THRMLTP =  0.00D+00
 THRCPQCI=  1.00D-10  KEXTA   =  0.00D+00  THRCOARS=  0.00D+00  SYMTOL  =  1.00D-06  GRADTOL =  1.00D-06  THROVL  =  1.00D-08
 THRORTH =  1.00D-08  GRID    =  1.00D-06  GRIDMAX =  1.00D-03  DTMAX   =  0.00D+00  THROCCDE=  1.00D-01  THROCCDE=  1.00D-01



 ZUNIT=ANG
 

Geometry recognized as XYZ


 Variable memory set to 8000000000 words,  buffer space   230000 words

 SETTING BASIS          =    USERDEF


 Recomputing integrals since basis changed


 Using spherical harmonics



 PROGRAM * SEWARD (Integral evaluation for generally contracted gaussian basis sets)     Author: Roland Lindh, 1990

 Geometry written to block  1 of record 700

 Orientation using atomic masses  
 Molecule type: Atom
 Symmetry elements: X,Y,Z
 Rotational constants:       0.0000000      0.0000000      0.0000000 GHz  (calculated with average atomic masses)

 Point group  D2h 



 ATOMIC COORDINATES

 NR  ATOM    CHARGE       X              Y              Z

   1  N       5.00    0.000000000    0.000000000    0.000000000


          N   CORE POTENTIAL

          p POTENTIAL

 POWERS             1              3              2
 EXPONENTIALS   9.235010       7.668300       7.344861    
 COEFFICIENTS   5.000000       46.17505      -30.18894    

          s - p POTENTIAL

 POWERS             2
 EXPONENTIALS   6.995365    
 COEFFICIENTS   31.69720    


 BASIS DATA

   Nr Sym  Nuc  Type         Exponents   Contraction coefficients

    1.1 Ag    1  1s           0.098869     0.067266
                              0.211443     0.334290
                              0.452197     0.454257
                              0.967080     0.267861
                              2.068221     0.000248
                              4.423150    -0.132606
                              9.459462     0.014437
                             20.230246     0.000359
                             43.264919    -0.000094
    2.1 Ag    1  1s           0.046128     1.000000
    3.1 Ag    1  1s           0.115320     1.000000
    4.1 Ag    1  1s           0.286632     1.000000
    5.1 Ag    1  1s           0.702011     1.000000
    6.1 Ag    1  1s           1.532221     1.000000
    7.1 Ag    1  3d0          0.122232     1.000000
    8.1 Ag    1  3d2+         0.122232     1.000000
    9.1 Ag    1  3d0          0.305579     1.000000
   10.1 Ag    1  3d2+         0.305579     1.000000
   11.1 Ag    1  3d0          0.891436     1.000000
   12.1 Ag    1  3d2+         0.891436     1.000000
   13.1 Ag    1  3d0          1.542532     1.000000
   14.1 Ag    1  3d2+         1.542532     1.000000
   15.1 Ag    1  3d0          2.798122     1.000000
   16.1 Ag    1  3d2+         2.798122     1.000000
   17.1 Ag    1  5g0          0.415455     1.000000
   18.1 Ag    1  5g4+         0.415455     1.000000
   19.1 Ag    1  5g2+         0.415455     1.000000
   20.1 Ag    1  5g0          1.038637     1.000000
   21.1 Ag    1  5g4+         1.038637     1.000000
   22.1 Ag    1  5g2+         1.038637     1.000000
   23.1 Ag    1  5g0          2.842018     1.000000
   24.1 Ag    1  5g4+         2.842018     1.000000
   25.1 Ag    1  5g2+         2.842018     1.000000
    1.2 B3u   1  2px          0.073234     0.035758
                              0.145867     0.153945
                              0.290535     0.277656
                              0.578683     0.297676
                              1.152612     0.234403
                              2.295756     0.140321
                              4.572652     0.067219
                              9.107739     0.031594
                             18.140657     0.003301
    2.2 B3u   1  2px          0.048240     1.000000
    3.2 B3u   1  2px          0.120601     1.000000
    4.2 B3u   1  2px          0.322697     1.000000
    5.2 B3u   1  2px          0.978538     1.000000
    6.2 B3u   1  2px          1.272759     1.000000
    7.2 B3u   1  4f1+         0.235070     1.000000
    8.2 B3u   1  4f3+         0.235070     1.000000
    9.2 B3u   1  4f1+         0.587676     1.000000
   10.2 B3u   1  4f3+         0.587676     1.000000
   11.2 B3u   1  4f1+         1.592967     1.000000
   12.2 B3u   1  4f3+         1.592967     1.000000
   13.2 B3u   1  4f1+         2.443045     1.000000
   14.2 B3u   1  4f3+         2.443045     1.000000
   15.2 B3u   1  6h1+         0.909017     1.000000
   16.2 B3u   1  6h3+         0.909017     1.000000
   17.2 B3u   1  6h5+         0.909017     1.000000
   18.2 B3u   1  6h1+         2.272542     1.000000
   19.2 B3u   1  6h3+         2.272542     1.000000
   20.2 B3u   1  6h5+         2.272542     1.000000
    1.3 B2u   1  2py          0.073234     0.035758
                              0.145867     0.153945
                              0.290535     0.277656
                              0.578683     0.297676
                              1.152612     0.234403
                              2.295756     0.140321
                              4.572652     0.067219
                              9.107739     0.031594
                             18.140657     0.003301
    2.3 B2u   1  2py          0.048240     1.000000
    3.3 B2u   1  2py          0.120601     1.000000
    4.3 B2u   1  2py          0.322697     1.000000
    5.3 B2u   1  2py          0.978538     1.000000
    6.3 B2u   1  2py          1.272759     1.000000
    7.3 B2u   1  4f1-         0.235070     1.000000
    8.3 B2u   1  4f3-         0.235070     1.000000
    9.3 B2u   1  4f1-         0.587676     1.000000
   10.3 B2u   1  4f3-         0.587676     1.000000
   11.3 B2u   1  4f1-         1.592967     1.000000
   12.3 B2u   1  4f3-         1.592967     1.000000
   13.3 B2u   1  4f1-         2.443045     1.000000
   14.3 B2u   1  4f3-         2.443045     1.000000
   15.3 B2u   1  6h1-         0.909017     1.000000
   16.3 B2u   1  6h3-         0.909017     1.000000
   17.3 B2u   1  6h5-         0.909017     1.000000
   18.3 B2u   1  6h1-         2.272542     1.000000
   19.3 B2u   1  6h3-         2.272542     1.000000
   20.3 B2u   1  6h5-         2.272542     1.000000
    1.4 B1g   1  3d2-         0.122232     1.000000
    2.4 B1g   1  3d2-         0.305579     1.000000
    3.4 B1g   1  3d2-         0.891436     1.000000
    4.4 B1g   1  3d2-         1.542532     1.000000
    5.4 B1g   1  3d2-         2.798122     1.000000
    6.4 B1g   1  5g2-         0.415455     1.000000
    7.4 B1g   1  5g4-         0.415455     1.000000
    8.4 B1g   1  5g2-         1.038637     1.000000
    9.4 B1g   1  5g4-         1.038637     1.000000
   10.4 B1g   1  5g2-         2.842018     1.000000
   11.4 B1g   1  5g4-         2.842018     1.000000
    1.5 B1u   1  2pz          0.073234     0.035758
                              0.145867     0.153945
                              0.290535     0.277656
                              0.578683     0.297676
                              1.152612     0.234403
                              2.295756     0.140321
                              4.572652     0.067219
                              9.107739     0.031594
                             18.140657     0.003301
    2.5 B1u   1  2pz          0.048240     1.000000
    3.5 B1u   1  2pz          0.120601     1.000000
    4.5 B1u   1  2pz          0.322697     1.000000
    5.5 B1u   1  2pz          0.978538     1.000000
    6.5 B1u   1  2pz          1.272759     1.000000
    7.5 B1u   1  4f0          0.235070     1.000000
    8.5 B1u   1  4f2+         0.235070     1.000000
    9.5 B1u   1  4f0          0.587676     1.000000
   10.5 B1u   1  4f2+         0.587676     1.000000
   11.5 B1u   1  4f0          1.592967     1.000000
   12.5 B1u   1  4f2+         1.592967     1.000000
   13.5 B1u   1  4f0          2.443045     1.000000
   14.5 B1u   1  4f2+         2.443045     1.000000
   15.5 B1u   1  6h2+         0.909017     1.000000
   16.5 B1u   1  6h4+         0.909017     1.000000
   17.5 B1u   1  6h0          0.909017     1.000000
   18.5 B1u   1  6h2+         2.272542     1.000000
   19.5 B1u   1  6h4+         2.272542     1.000000
   20.5 B1u   1  6h0          2.272542     1.000000
    1.6 B2g   1  3d1+         0.122232     1.000000
    2.6 B2g   1  3d1+         0.305579     1.000000
    3.6 B2g   1  3d1+         0.891436     1.000000
    4.6 B2g   1  3d1+         1.542532     1.000000
    5.6 B2g   1  3d1+         2.798122     1.000000
    6.6 B2g   1  5g1+         0.415455     1.000000
    7.6 B2g   1  5g3+         0.415455     1.000000
    8.6 B2g   1  5g1+         1.038637     1.000000
    9.6 B2g   1  5g3+         1.038637     1.000000
   10.6 B2g   1  5g1+         2.842018     1.000000
   11.6 B2g   1  5g3+         2.842018     1.000000
    1.7 B3g   1  3d1-         0.122232     1.000000
    2.7 B3g   1  3d1-         0.305579     1.000000
    3.7 B3g   1  3d1-         0.891436     1.000000
    4.7 B3g   1  3d1-         1.542532     1.000000
    5.7 B3g   1  3d1-         2.798122     1.000000
    6.7 B3g   1  5g1-         0.415455     1.000000
    7.7 B3g   1  5g3-         0.415455     1.000000
    8.7 B3g   1  5g1-         1.038637     1.000000
    9.7 B3g   1  5g3-         1.038637     1.000000
   10.7 B3g   1  5g1-         2.842018     1.000000
   11.7 B3g   1  5g3-         2.842018     1.000000
    1.8 Au    1  4f2-         0.235070     1.000000
    2.8 Au    1  4f2-         0.587676     1.000000
    3.8 Au    1  4f2-         1.592967     1.000000
    4.8 Au    1  4f2-         2.443045     1.000000
    5.8 Au    1  6h4-         0.909017     1.000000
    6.8 Au    1  6h2-         0.909017     1.000000
    7.8 Au    1  6h4-         2.272542     1.000000
    8.8 Au    1  6h2-         2.272542     1.000000

 NUCLEAR CHARGE:                    5
 NUMBER OF PRIMITIVE AOS:         213
 NUMBER OF SYMMETRY AOS:          158
 NUMBER OF CONTRACTIONS:          126   (  25Ag  +  20B3u +  20B2u +  11B1g +  20B1u +  11B2g +  11B3g +   8Au  )
 NUMBER OF CORE ORBITALS:           0   (   0Ag  +   0B3u +   0B2u +   0B1g +   0B1u +   0B2g +   0B3g +   0Au  )
 NUMBER OF VALENCE ORBITALS:        4   (   1Ag  +   1B3u +   1B2u +   0B1g +   1B1u +   0B2g +   0B3g +   0Au  )


 NUCLEAR REPULSION ENERGY    0.00000000

 EXTRA SYMMETRY OF AOS IN SYMMETRY 1:   1 1 1 1 1 1 2 3 2 3   2 3 2 3 2 3 4 5 6 4   5 6 4 5 6
 EXTRA SYMMETRY OF AOS IN SYMMETRY 2:   1 1 1 1 1 1 2 3 2 3   2 3 2 3 4 5 6 4 5 6
 EXTRA SYMMETRY OF AOS IN SYMMETRY 3:   1 1 1 1 1 1 2 3 2 3   2 3 2 3 4 5 6 4 5 6
 EXTRA SYMMETRY OF AOS IN SYMMETRY 4:   1 1 1 1 1 2 3 2 3 2   3
 EXTRA SYMMETRY OF AOS IN SYMMETRY 5:   1 1 1 1 1 1 2 3 2 3   2 3 2 3 4 5 6 4 5 6
 EXTRA SYMMETRY OF AOS IN SYMMETRY 6:   1 1 1 1 1 2 3 2 3 2   3
 EXTRA SYMMETRY OF AOS IN SYMMETRY 7:   1 1 1 1 1 2 3 2 3 2   3
 EXTRA SYMMETRY OF AOS IN SYMMETRY 8:   1 1 1 1 2 3 2 3

 Eigenvalues of metric

         1 0.110E-02 0.807E-02 0.155E-01 0.155E-01 0.537E-01 0.151E+00 0.151E+00 0.284E+00
         2 0.293E-02 0.145E-01 0.474E-01 0.474E-01 0.724E-01 0.313E+00 0.313E+00 0.415E+00
         3 0.293E-02 0.145E-01 0.474E-01 0.474E-01 0.724E-01 0.313E+00 0.313E+00 0.415E+00
         4 0.155E-01 0.151E+00 0.284E+00 0.284E+00 0.453E+00 0.893E+00 0.893E+00 0.147E+01
         5 0.293E-02 0.145E-01 0.474E-01 0.474E-01 0.724E-01 0.313E+00 0.313E+00 0.415E+00
         6 0.155E-01 0.151E+00 0.284E+00 0.284E+00 0.453E+00 0.893E+00 0.893E+00 0.147E+01
         7 0.155E-01 0.151E+00 0.284E+00 0.284E+00 0.453E+00 0.893E+00 0.893E+00 0.147E+01
         8 0.474E-01 0.313E+00 0.483E+00 0.483E+00 0.123E+01 0.152E+01 0.152E+01 0.241E+01


 Contracted 2-electron integrals neglected if value below      1.0D-12
 AO integral compression algorithm  1   Integral accuracy      1.0D-12

     32.506 MB (compressed) written to integral file ( 57.8%)


 NUMBER OF SORTED TWO-ELECTRON INTEGRALS:    4156552.     BUFFER LENGTH:  32768
 NUMBER OF SEGMENTS:   1  SEGMENT LENGTH:    4156552      RECORD LENGTH: 524288

 Memory used in sort:       4.71 MW

 SORT1 READ     6989366. AND WROTE     2907704. INTEGRALS IN      9 RECORDS. CPU TIME:     0.16 SEC, REAL TIME:     0.24 SEC
 SORT2 READ     2907704. AND WROTE     4156552. INTEGRALS IN    124 RECORDS. CPU TIME:     0.13 SEC, REAL TIME:     0.29 SEC

 FILE SIZES:   FILE 1:    52.0 MBYTE,  FILE 4:    37.8 MBYTE,   TOTAL:     89.7 MBYTE

 OPERATOR DM      FOR CENTER  0  COORDINATES:    0.000000    0.000000    0.000000
 OPERATOR EKIN    FOR CENTER  0  COORDINATES:    0.000000    0.000000    0.000000
 OPERATOR POT     FOR CENTER  0  COORDINATES:    0.000000    0.000000    0.000000


 **********************************************************************************************************************************
 DATASETS  * FILE   NREC   LENGTH (MB)   RECORD NAMES
              1      20       38.85       500      610      700      900      950      970     1000      129      960     1100   
                                          VAR    BASINP    GEOM    SYMINP    ZMAT    AOBASIS   BASIS     P2S    ABASIS      S 
                                         1400     1410     1420     1200     1210     1080     1600     1650     1300     1700   
                                         EKIN       V       ECP      H0       H01     AOSYM     SMH    MOLCAS    ERIS     OPER   

 PROGRAMS   *        TOTAL       INT
 CPU TIMES  *         2.81      2.71
 REAL TIME  *        11.83 SEC
 DISK USED  *        90.05 MB      
 **********************************************************************************************************************************


 PROGRAM * RHF-SCF (OPEN SHELL)       Authors: W. Meyer, H.-J. Werner


 NUMBER OF ELECTRONS:       4+    1-    SPACE SYMMETRY=8    SPIN SYMMETRY: Quartet 
 CONVERGENCE THRESHOLDS:    1.00E-05 (Density)    1.00E-07 (Energy)
 MAX. NUMBER OF ITERATIONS:       60
 INTERPOLATION TYPE:            DIIS
 INTERPOLATION STEPS:              2 (START)      1 (STEP)
 LEVEL SHIFTS:                 -0.60 (CLOSED) -0.30 (OPEN) 

 Number of closed-shell orbitals:    1 (   1   0   0   0   0   0   0   0 )
 Number of open-shell orbitals:      3 (   0   1   1   0   1   0   0   0 )



   Atom=N  basis=ECP2MWB_GUESS     lmin=0  lmax=1

 Orbital guess generated from atomic densities. Full valence occupancy:    1   1   1   0   1   0   0   0


 Molecular orbital dump at record        2100.2

 ITERATION    DDIFF          GRAD             ENERGY        2-EL.EN.            DIPOLE MOMENTS         DIIS   ORB.
    1      0.000D+00      0.000D+00        -9.62257836     11.238423    0.00000    0.00000    0.00000    0    start
    2      0.000D+00      0.146D-01        -9.66445196     11.987727    0.00000    0.00000    0.00000    1    diag,B
    3      0.113D-01      0.355D-02        -9.66749606     12.096147    0.00000    0.00000    0.00000    2    diag,B
    4      0.228D-02      0.173D-02        -9.66833432     12.146050    0.00000    0.00000    0.00000    3    diag,B
    5      0.184D-02      0.405D-03        -9.66837524     12.151403    0.00000    0.00000    0.00000    4    diag,B
    6      0.431D-03      0.783D-04        -9.66837629     12.150637    0.00000    0.00000    0.00000    5    diag,B
    7      0.124D-03      0.144D-04        -9.66837632     12.150526    0.00000    0.00000    0.00000    6    fixocc
    8      0.267D-04      0.307D-05        -9.66837632     12.150500    0.00000    0.00000    0.00000    7    diag,B
    9      0.565D-05      0.497D-06        -9.66837632     12.150500    0.00000    0.00000    0.00000    0    orth

 Final alpha occupancy:   1   1   1   0   1   0   0   0
 Final beta  occupancy:   1   0   0   0   0   0   0   0

 !RHF STATE 1.8 Energy                 -9.668376323887
 Nuclear energy                         0.00000000
 One-electron energy                  -15.74362619
 Two-electron energy                    6.07524986
 Virial quotient                       -1.43195663
 !RHF STATE 1.8 Dipole moment           0.00000000     0.00000000     0.00000000
 Dipole moment /Debye                   0.00000000     0.00000000     0.00000000
 

 !RHF expec          <1.8|EKIN|1.8>     6.751863945693
 
 !RHF expec           <1.8|POT|1.8>    -4.748769158003

 ELECTRON ORBITALS
 =================


   Orb  Occ    Energy  Couls-En    Coefficients

                                   1 1s      1 1s      1 1s      1 1s      1 1s      1 1s      1 3d0     1 3d2+    1 3d0     1 3d2+ 
                                   1 3d0     1 3d2+    1 3d0     1 3d2+    1 3d0     1 3d2+    1 5g0     1 5g4+    1 5g2+    1 5g0  
                                   1 5g4+    1 5g2+    1 5g0     1 5g4+    1 5g2+ 

   1.1   2    -0.9454   -4.3761  1.000038  0.000163 -0.000275  0.000192 -0.000127  0.000035 -0.000000 -0.000000 -0.000000  0.000000
                                 0.000000 -0.000000 -0.000000  0.000000  0.000000  0.000000  0.000000  0.000000 -0.000000 -0.000000
                                -0.000000  0.000000  0.000000 -0.000000  0.000000

                                   1 2px     1 2px     1 2px     1 2px     1 2px     1 2px     1 4f1+    1 4f3+    1 4f1+    1 4f3+ 
                                   1 4f1+    1 4f3+    1 4f1+    1 4f3+    1 6h1+    1 6h3+    1 6h5+    1 6h1+    1 6h3+    1 6h5+ 


   1.2   +    -0.5675   -3.5282  1.000010  0.000199 -0.000202  0.000079 -0.000032  0.000009 -0.000000 -0.000000  0.000000  0.000000
                                -0.000000 -0.000000  0.000000  0.000000  0.000000 -0.000000  0.000000 -0.000000  0.000000 -0.000000

                                   1 2py     1 2py     1 2py     1 2py     1 2py     1 2py     1 4f1-    1 4f3-    1 4f1-    1 4f3- 
                                   1 4f1-    1 4f3-    1 4f1-    1 4f3-    1 6h1-    1 6h3-    1 6h5-    1 6h1-    1 6h3-    1 6h5- 


   1.3   +    -0.5675   -3.5282  1.000010  0.000199 -0.000202  0.000079 -0.000032  0.000009 -0.000000  0.000000  0.000000 -0.000000
                                -0.000000  0.000000  0.000000 -0.000000  0.000000  0.000000  0.000000 -0.000000  0.000000 -0.000000

                                   1 2pz     1 2pz     1 2pz     1 2pz     1 2pz     1 2pz     1 4f0     1 4f2+    1 4f0     1 4f2+ 
                                   1 4f0     1 4f2+    1 4f0     1 4f2+    1 6h2+    1 6h4+    1 6h0     1 6h2+    1 6h4+    1 6h0  


   1.5   +    -0.5675   -3.5282  1.000010  0.000199 -0.000202  0.000079 -0.000032  0.000009  0.000000 -0.000000  0.000000  0.000000
                                -0.000000 -0.000000  0.000000  0.000000 -0.000000  0.000000  0.000000  0.000000 -0.000000 -0.000000

 HOMO      1.2    -0.567463 =     -15.4415eV
 LUMO      2.1     0.079169 =       2.1543eV
 LUMO-HOMO         0.646632 =      17.5957eV


 **********************************************************************************************************************************
 DATASETS  * FILE   NREC   LENGTH (MB)   RECORD NAMES
              1      20       38.85       500      610      700      900      950      970     1000      129      960     1100   
                                          VAR    BASINP    GEOM    SYMINP    ZMAT    AOBASIS   BASIS     P2S    ABASIS      S 
                                         1400     1410     1420     1200     1210     1080     1600     1650     1300     1700   
                                         EKIN       V       ECP      H0       H01     AOSYM     SMH    MOLCAS    ERIS     OPER   

              2       4        2.83       700     1000      520     2100   
                                         GEOM     BASIS   MCVARS     RHF  

 PROGRAMS   *        TOTAL        HF       INT
 CPU TIMES  *         2.98      0.17      2.71
 REAL TIME  *        12.22 SEC
 DISK USED  *        90.05 MB      
 **********************************************************************************************************************************
 SETTING SCF(I)         =        -9.66837632  AU                              
 SETTING _CC_NORM_MAX   =         2.00000000                                  


 PROGRAM * UHF-SCF       Authors: W. Meyer, H.-J. Werner


 NUMBER OF ELECTRONS:       4+    1-    SPACE SYMMETRY=8    SPIN SYMMETRY: Quartet 
 CONVERGENCE THRESHOLDS:    1.00E-05 (Density)    1.00E-07 (Energy)
 MAX. NUMBER OF ITERATIONS:        0
 INTERPOLATION TYPE:            DIIS
 INTERPOLATION STEPS:              2 (START)      1 (STEP)
 LEVEL SHIFTS:                  0.20 (ALPHA)   0.20 (BETA) 

 Number of closed-shell orbitals:    1 (   1   0   0   0   0   0   0   0 )
 Number of open-shell orbitals:      3 (   0   1   1   0   1   0   0   0 )


 Molecular orbitals read from record     2100.2  Type=RHF/CANONICAL (state 1.8)

 Molecular orbital dump at record        2200.2

 Initial alpha occupation   1   1   1   0   1   0   0   0
 Initial beta  occupation   1   0   0   0   0   0   0   0

 ITERATION    DDIFF          GRAD             ENERGY        2-EL.EN.            DIPOLE MOMENTS         DIIS
    1      0.000D+00      0.000D+00        -9.66837632     12.150500    0.00000    0.00000    0.00000    0
 
 Final alpha occupancy:   1   1   1   0   1   0   0   0
 Final beta  occupancy:   1   0   0   0   0   0   0   0

 !UHF STATE 1.8 Energy                 -9.668376323887
 Nuclear energy                         0.00000000
 One-electron energy                  -15.74362619
 Two-electron energy                    6.07524986
 Virial quotient                       -1.43195663
 !UHF STATE 1.8 Dipole moment           0.00000000     0.00000000     0.00000000
 Dipole moment /Debye                   0.00000000     0.00000000     0.00000000
 

 !UHF expec          <1.8|EKIN|1.8>     6.751863945693
 
 !UHF expec           <1.8|POT|1.8>    -4.748769158003

 ELECTRON ORBITALS FOR POSITIVE SPIN
 ===================================


   Orb  Occ    Energy  Couls-En    Coefficients

                                   1 1s      1 1s      1 1s      1 1s      1 1s      1 1s      1 3d0     1 3d2+    1 3d0     1 3d2+ 
                                   1 3d0     1 3d2+    1 3d0     1 3d2+    1 3d0     1 3d2+    1 5g0     1 5g4+    1 5g2+    1 5g0  
                                   1 5g4+    1 5g2+    1 5g0     1 5g4+    1 5g2+ 

   1.1   +    -0.9454   -4.3761  1.000038  0.000163 -0.000275  0.000192 -0.000127  0.000035 -0.000000 -0.000000 -0.000000  0.000000
                                 0.000000 -0.000000 -0.000000  0.000000  0.000000  0.000000  0.000000  0.000000 -0.000000 -0.000000
                                -0.000000  0.000000  0.000000 -0.000000  0.000000

                                   1 2px     1 2px     1 2px     1 2px     1 2px     1 2px     1 4f1+    1 4f3+    1 4f1+    1 4f3+ 
                                   1 4f1+    1 4f3+    1 4f1+    1 4f3+    1 6h1+    1 6h3+    1 6h5+    1 6h1+    1 6h3+    1 6h5+ 


   1.2   +    -0.5675   -3.5282  1.000010  0.000199 -0.000202  0.000079 -0.000032  0.000009 -0.000000 -0.000000  0.000000  0.000000
                                -0.000000 -0.000000  0.000000  0.000000  0.000000 -0.000000  0.000000 -0.000000  0.000000 -0.000000

                                   1 2py     1 2py     1 2py     1 2py     1 2py     1 2py     1 4f1-    1 4f3-    1 4f1-    1 4f3- 
                                   1 4f1-    1 4f3-    1 4f1-    1 4f3-    1 6h1-    1 6h3-    1 6h5-    1 6h1-    1 6h3-    1 6h5- 


   1.3   +    -0.5675   -3.5282  1.000010  0.000199 -0.000202  0.000079 -0.000032  0.000009 -0.000000  0.000000  0.000000 -0.000000
                                -0.000000  0.000000  0.000000 -0.000000  0.000000  0.000000  0.000000 -0.000000  0.000000 -0.000000

                                   1 2pz     1 2pz     1 2pz     1 2pz     1 2pz     1 2pz     1 4f0     1 4f2+    1 4f0     1 4f2+ 
                                   1 4f0     1 4f2+    1 4f0     1 4f2+    1 6h2+    1 6h4+    1 6h0     1 6h2+    1 6h4+    1 6h0  


   1.5   +    -0.5675   -3.5282  1.000010  0.000199 -0.000202  0.000079 -0.000032  0.000009  0.000000 -0.000000  0.000000  0.000000
                                -0.000000 -0.000000  0.000000  0.000000 -0.000000  0.000000  0.000000  0.000000 -0.000000 -0.000000

 ELECTRON ORBITALS FOR NEGATIVE SPIN
 ===================================


   Orb  Occ    Energy  Couls-En    Coefficients

                                   1 1s      1 1s      1 1s      1 1s      1 1s      1 1s      1 3d0     1 3d2+    1 3d0     1 3d2+ 
                                   1 3d0     1 3d2+    1 3d0     1 3d2+    1 3d0     1 3d2+    1 5g0     1 5g4+    1 5g2+    1 5g0  
                                   1 5g4+    1 5g2+    1 5g0     1 5g4+    1 5g2+ 

   1.1   -    -0.9454   -4.3761  1.000038  0.000163 -0.000275  0.000192 -0.000127  0.000035 -0.000000 -0.000000 -0.000000  0.000000
                                 0.000000 -0.000000 -0.000000  0.000000  0.000000  0.000000  0.000000  0.000000 -0.000000 -0.000000
                                -0.000000  0.000000  0.000000 -0.000000  0.000000

 HOMO      1.2    -0.567463 =     -15.4415eV
 LUMO     -1.2    -0.567463 =     -15.4415eV
 LUMO-HOMO         0.000000 =       0.0000eV

 EXPECTATION VALUE OF S**2:             3.75000000

 Occupation number threshold for canonical orbitals:  1.999000 (occupied),  0.001000 (virtual)

 Number of pseudo-canonical orbitals per symmetry:    1   0   0   0   0   0   0   0
 Number of active natural orbitals per symmetry:      0   1   1   0   1   0   0   0

 NATURAL CHARGE ORBITALS
 =======================


   Orb     Occ        Energy       Coefficients

                                   1 1s      1 1s      1 1s      1 1s      1 1s      1 1s      1 3d0     1 3d2+    1 3d0     1 3d2+ 
                                   1 3d0     1 3d2+    1 3d0     1 3d2+    1 3d0     1 3d2+    1 5g0     1 5g4+    1 5g2+    1 5g0  
                                   1 5g4+    1 5g2+    1 5g0     1 5g4+    1 5g2+ 

   1.1  2.00000    -0.945369     1.000038  0.000163 -0.000275  0.000192 -0.000127  0.000035 -0.000000 -0.000000 -0.000000  0.000000
                                 0.000000 -0.000000 -0.000000  0.000000  0.000000  0.000000  0.000000  0.000000 -0.000000 -0.000000
                                -0.000000  0.000000  0.000000 -0.000000  0.000000

                                   1 2px     1 2px     1 2px     1 2px     1 2px     1 2px     1 4f1+    1 4f3+    1 4f1+    1 4f3+ 
                                   1 4f1+    1 4f3+    1 4f1+    1 4f3+    1 6h1+    1 6h3+    1 6h5+    1 6h1+    1 6h3+    1 6h5+ 


   1.2  1.00000    -0.179862     1.000010  0.000199 -0.000202  0.000079 -0.000032  0.000009 -0.000000 -0.000000  0.000000  0.000000
                                -0.000000 -0.000000  0.000000  0.000000  0.000000 -0.000000  0.000000 -0.000000  0.000000 -0.000000

                                   1 2py     1 2py     1 2py     1 2py     1 2py     1 2py     1 4f1-    1 4f3-    1 4f1-    1 4f3- 
                                   1 4f1-    1 4f3-    1 4f1-    1 4f3-    1 6h1-    1 6h3-    1 6h5-    1 6h1-    1 6h3-    1 6h5- 


   1.3  1.00000    -0.179862     1.000010  0.000199 -0.000202  0.000079 -0.000032  0.000009 -0.000000  0.000000  0.000000 -0.000000
                                -0.000000  0.000000  0.000000 -0.000000  0.000000  0.000000  0.000000 -0.000000  0.000000 -0.000000

                                   1 2pz     1 2pz     1 2pz     1 2pz     1 2pz     1 2pz     1 4f0     1 4f2+    1 4f0     1 4f2+ 
                                   1 4f0     1 4f2+    1 4f0     1 4f2+    1 6h2+    1 6h4+    1 6h0     1 6h2+    1 6h4+    1 6h0  


   1.5  1.00000    -0.179862     1.000010  0.000199 -0.000202  0.000079 -0.000032  0.000009  0.000000 -0.000000  0.000000  0.000000
                                -0.000000 -0.000000  0.000000  0.000000 -0.000000  0.000000  0.000000  0.000000 -0.000000 -0.000000

 Natural orbitals saved to record    2200.2 (Orbital set 3)

 Orbital spaces for UNO-CAS (Min. occupation: 0.020  Max. occupation: 1.980):

 Closed:        1   0   0   0   0   0   0   0
 Active:        0   1   1   0   1   0   0   0

 No convergence



 **********************************************************************************************************************************
 DATASETS  * FILE   NREC   LENGTH (MB)   RECORD NAMES
              1      20       38.85       500      610      700      900      950      970     1000      129      960     1100   
                                          VAR    BASINP    GEOM    SYMINP    ZMAT    AOBASIS   BASIS     P2S    ABASIS      S 
                                         1400     1410     1420     1200     1210     1080     1600     1650     1300     1700   
                                         EKIN       V       ECP      H0       H01     AOSYM     SMH    MOLCAS    ERIS     OPER   

              2       5        5.45       700     1000      520     2100     2200   
                                         GEOM     BASIS   MCVARS     RHF      UHF  

 PROGRAMS   *        TOTAL       UHF        HF       INT
 CPU TIMES  *         3.00      0.02      0.17      2.71
 REAL TIME  *        12.42 SEC
 DISK USED  *        90.05 MB      
 **********************************************************************************************************************************
 SETTING SCF(I)         =        -9.66837632  AU                              


 PROGRAM * MRCC (General Multireference Coupled Cluster)    Author: M. Kallay, 2000-2005

 ***  Initialisation ***

   0 Spin projections
 
 Molecular orbitals read from record     2200.2  Type=UHF/ALPHA (state 1.8)

 ?Warning: UHF not converged
 Molecular orbitals read from record     2200.2  Type=UHF/BETA (state 1.8)

 ?Warning: UHF not converged
 
 Frozen orbitals:              0 (  0  0  0  0  0  0  0  0)
 Active orbitals:            126 ( 25 20 20 11 20 11 11  8)
 Active electrons:             5
 Spin quantum number:          1.5

 Transformed integrals will be written to file mrcc_22563/fort.55

 Load integrals                3.0 sec
 Transform integrals           4.9 sec
 Storage for integrals:       24278327
 Remaining memory:           *********

 Core energy:               0.00000000
 
 MRCC Input:
     4     0     0     0     3     0     0     8     0     0     0     1     1     0     0     7     0     0   0.000     0   64000
  ex.lev,nsing,ntrip, rest,method,dens,conver,symm, diag, CS ,spatial, HF, ndoub,nacto,nactv, tol, maxex, sacc, freq,  dboc,   mem
  2  0  0  0  0  0  0  0  0  0  0  0  0  0  0  0  0  0  0  0  0  0  0  0  0  1  0  0  0  0  0  0  0  0  0  0  0  0  0  0  0  0  0  0  0  1  0  0  0  0  0  0  0  0  0  0  0  0  0  0  0  0  0  0  0  0  0  0  0  0  0  0  0  0  0  0  1  0  0  0  0  0  0  0  0  0  0  0  0  0  0  0  0  0  0  0  0  0  0  0  0  0  0  0  0  0  0  0  0  0  0  0  0  0  0  0  0  0  0  0  0  0  0  0  0  0
 MRCC Input end
 Variable memory released
 MRCC now being run, temporary output in /global/cscratch1/sd/aannabe/mrcc_22563/mrcc.out
 **********************************************************************
                          MRCC program system
 **********************************************************************

                              Written by
  Mihaly Kallay, Zoltan Rolik, Jozsef Csontos, Peter Nagy, Gyula Samu,
      David Mester, Jozsef Csoka, Bernat Szabo, Istvan Ladjanszki,
       Lorant Szegedy, Bence Ladoczki, Klara Petrov, Mate Farkas,
                    Pal D. Mezei, and Bence Hegely

        Department of Physical Chemistry and Materials Science
            Budapest University of Technology and Economics
                  Budapest P.O.Box 91, H-1521 Hungary

                              www.mrcc.hu

                       Release date: May 23, 2018

 ************************ 2018-06-20 14:05:01 *************************
 Executing goldstone...

 Generation of CC equations in terms of H and T...
 Generation of antisymmetrized Goldstone diagrams...
 Number of diagrams in T^1 equations:    15
 Number of diagrams in T^2 equations:    38
 Number of diagrams in T^3 equations:    49
 Number of diagrams in T^4 equations:     5
 Translation of diagrams to factorized equations...
 Optimizing intermediate calculation...
 Number of floating-point operations per iteration step:   2.2471E+11
 Probable CPU time per iteration step (hours):      2.25
 Required memory (Mbytes):   30320.9
 Number of intermediates:                                  80
 Number of intermediates to be stored:                     32
 Length of intermediate file (Mbytes):     497.7

 ************************ 2018-06-20 14:05:01 *************************
 Executing xmrcc...

 **********************************************************************
 CC(3)(4) calculation


 Allocation of****** Mbytes of memory...
 Number of spinorbitals:                   252
 Number of alpha electrons:                        4
 Number of beta electrons:                         1
 Spin multiplicity:                     2
 z-component of spin:  1.5
 Spatial symmetry:                      8
 Convergence criterion:  1.0E-07
 Construction of occupation graphs...
 Number of                     0 -fold excitations:                      1
 Number of                     1 -fold excitations:                    105
 Number of                     2 -fold excitations:                  13633
 Number of                     3 -fold excitations:                 839097
 Total number of configurations:                 852836
 Calculation of coupling coefficients...
 Length of intermediate file (Mbytes):     375.6

 ======================================================================

 Spin case  1   Alpha:  3   Beta:  1
 Number of excitations:               18435500
 Spin case  2   Alpha:  4   Beta:  0
 Number of excitations:                1099202
 Number of                     4 -fold excitations:               19534702

 Memory requirements /Mbyte/:
               Minimal        Optimal
 Real*8:        788.5721      1923.2150
 Integer:        78.3539
 Total:         866.9260      2001.5690


 ************************ 2018-06-20 14:05:11 *************************
 Executing mrcc...

 **********************************************************************
 CCSDT(Q) calculation


 OpenMP parallel version is running.
 Number of CPUs:   1
 Allocation of 1923.2 Mbytes of memory...
 Number of spinorbitals: 252
 Number of alpha electrons:  4
 Number of beta  electrons:  1
 Spin multiplicity: 2
 z-component of spin:  1.5
 Spatial symmetry: 8
 Convergence criterion:  1.0E-07
 Construction of occupation graphs...
 Number of 0-fold excitations: 1
 Number of 1-fold excitations: 105
 Number of 2-fold excitations: 13633
 Number of 3-fold excitations: 839097
 Total number of determinants: 852836
 Calculation of coupling coefficients...
 Initial cluster amplitudes are generated.
 Length of intermediate file (Mbytes):     375.6
 Reading integral list from unit 55...
 Sorting integrals...
 Sorting integrals...
 Sorting integrals...
 Sorting integrals...
 Energy of reference determinant [au]:      -9.668376323887
 Calculation of MP denominators...

 Starting CC iteration...
 ======================================================================
 Norm of residual vector:     0.83448864
 CPU time [min]:     1.068                   Wall time [min]:     1.083

 Iteration  1  CC energy:    -9.78485754  Energy decrease:   0.11648122
 ======================================================================
 Norm of residual vector:     0.19308196
 CPU time [min]:     1.508                   Wall time [min]:     1.535

 Iteration  2  CC energy:    -9.79490829  Energy decrease:   0.01005075
 ======================================================================
 Norm of residual vector:     0.04187986
 CPU time [min]:     1.960                   Wall time [min]:     1.994

 Iteration  3  CC energy:    -9.80049780  Energy decrease:   0.00558951
 ======================================================================
 Norm of residual vector:     0.00999628
 CPU time [min]:     2.412                   Wall time [min]:     2.453

 Iteration  4  CC energy:    -9.80067928  Energy decrease:   0.00018148
 ======================================================================
 Norm of residual vector:     0.00270426
 CPU time [min]:     2.861                   Wall time [min]:     2.907

 Iteration  5  CC energy:    -9.80066029  Energy decrease:   0.00001898
 ======================================================================
 Norm of residual vector:     0.00104669
 CPU time [min]:     3.311                   Wall time [min]:     3.365

 Iteration  6  CC energy:    -9.80067965  Energy decrease:   0.00001935
 ======================================================================
 Norm of residual vector:     0.00042220
 CPU time [min]:     3.761                   Wall time [min]:     3.825

 Iteration  7  CC energy:    -9.80068022  Energy decrease:   0.00000057
 ======================================================================
 Norm of residual vector:     0.00015173
 CPU time [min]:     4.212                   Wall time [min]:     4.283

 Iteration  8  CC energy:    -9.80067895  Energy decrease:   0.00000127
 ======================================================================
 Norm of residual vector:     0.00005387
 CPU time [min]:     4.664                   Wall time [min]:     4.746

 Iteration  9  CC energy:    -9.80067965  Energy decrease:   0.00000070
 ======================================================================
 Norm of residual vector:     0.00001634
 CPU time [min]:     5.115                   Wall time [min]:     5.203

 Iteration 10  CC energy:    -9.80067974  Energy decrease:   0.00000009
 ======================================================================
 Norm of residual vector:     0.00000400
 CPU time [min]:     5.569                   Wall time [min]:     5.663

 Iteration 11  CC energy:    -9.80067964  Energy decrease:   0.00000011
 ======================================================================
 Norm of residual vector:     0.00000102
 CPU time [min]:     6.024                   Wall time [min]:     6.137

 Iteration 12  CC energy:    -9.80067964  Energy decrease:   4.6429E-09
 ======================================================================
 Norm of residual vector:     0.00000032
 CPU time [min]:     6.479                   Wall time [min]:     6.597

 Iteration 13  CC energy:    -9.80067965  Energy decrease:   0.00000001
 ======================================================================
 Norm of residual vector:     0.00000010
 CPU time [min]:     6.939                   Wall time [min]:     7.068

 Iteration 14  CC energy:    -9.80067965  Energy decrease:   2.4904E-09
 ======================================================================
 Norm of residual vector:     0.00000003
 CPU time [min]:     7.383                   Wall time [min]:     7.519

 Iteration 15  CC energy:    -9.80067965  Energy decrease:   3.3158E-10
 ======================================================================

 Iteration has converged in 15 steps.

 Final results:
 Total CCSDT energy [au]:             -9.800679647500
 Total MP2 energy [au]:               -9.784857541631

 Perturbative corrections are calculated...
 ======================================================================
 Spin case  1   Alpha:  3   Beta:  1
 Number of excitations:        18435500
 CPU time [min]:    58.647                   Wall time [min]:    58.785
 ======================================================================
 Spin case  2   Alpha:  4   Beta:  0
 Number of excitations:        1099202
 CPU time [min]:    66.970                   Wall time [min]:    67.118
 ======================================================================
 Number of 4-fold excitations: 19534702
 CPU time [min]:    66.970                   Wall time [min]:    67.120

 Total CCSDT[Q] energy [au]:          -9.800688376355
 Total CCSDT(Q) energy [au]:          -9.800741665372

 ************************ 2018-06-20 15:12:19 *************************
                      Normal termination of mrcc.
 **********************************************************************
 !CCSDT STATE 1.8 Energy               -9.800679647500
 !MP2 STATE 1.8 Energy                 -9.784857541631
 !CCSDT[Q] STATE 1.8 Energy            -9.800688376355
 !CCSDT(Q) STATE 1.8 Energy            -9.800741665372
 
 CPU-time for MRCC:           4018.2 sec
 Elapsed-time for MRCC:       4038.8 sec

 Variable memory set to 8000000000 words,  buffer space   230000 words



 **********************************************************************************************************************************
 DATASETS  * FILE   NREC   LENGTH (MB)   RECORD NAMES
              1      20       38.85       500      610      700      900      950      970     1000      129      960     1100   
                                          VAR    BASINP    GEOM    SYMINP    ZMAT    AOBASIS   BASIS     P2S    ABASIS      S 
                                         1400     1410     1420     1200     1210     1080     1600     1650     1300     1700   
                                         EKIN       V       ECP      H0       H01     AOSYM     SMH    MOLCAS    ERIS     OPER   

              2       5        5.45       700     1000      520     2100     2200   
                                         GEOM     BASIS   MCVARS     RHF      UHF  

 PROGRAMS   *        TOTAL      MRCC       UHF        HF       INT
 CPU TIMES  *      4069.88   4066.88      0.02      0.17      2.71
 REAL TIME  *      4324.34 SEC
 DISK USED  *        90.05 MB      
 **********************************************************************************************************************************
 SETTING POSTHF(I)      =        -9.80074167  AU                              
                                                                                                                                                                                                                                                                

       SCF           POSTHF       EKIN          POT
    -9.66837632   -9.80074167   6.75186395   -4.74876916
                                                  

 CCSDT(Q)/USERDEF energy=     -9.800741665372

        CCSDT(Q)        HF-SCF  
     -9.80074167     -9.66837632
 **********************************************************************************************************************************
 Variable memory released
