
 Primary working directories    : /global/cscratch1/sd/aannabe
 Secondary working directories  : /global/cscratch1/sd/aannabe
 Wavefunction directory         : /global/homes/a/aannabe/wfu/
 Main file repository           : /global/cscratch1/sd/aannabe/

 SHA1      : 2873118e99aab1bc19f5b6fc1784693c06d15c95
 NAME      : 2015.1.8
 ARCHNAME  : linux/x86_64
 FC        : /opt/cray/pe/craype/2.5.5/bin/ftn
 BLASLIB   : -Wl,-_start-group /opt/intel/compilers_and_libraries_2016.3.210/linux/mkl/lib/intel64/libmkl_intel_ilp64.a /opt/intel/compilers_and_libraries_2016.3.210/linux/mkl/lib/intel64/libmkl_intel_thread.a /opt/intel/compilers_and_libraries_2016.3.210/linux/mkl/lib/intel64/libmkl_core.a -Wl,-_end-group
 id        : lbl

 Nodes     nprocs
 nid00511     1

 Using customized tuning parameters: mindgm=8; mindgv=16; mindgc=4; mindgr=1; noblas=0; minvec=7
 default implementation of scratch files=df  

 ***,N
 memory,8,g
 gthresh,twoint=1.e-12
 
 gprint,basis,orbitals
 gexpec,ekin,pot
 
 angstrom
 geometry={
 1                                                                               ! Number of atoms
 N 0.0 0.0 0.0
 }
 
 basis={
 Including file /global/homes/a/aannabe/docs/totals_bfd/pps/N.pp
 Including file /global/homes/a/aannabe/docs/totals_bfd/basis/aug-cc-pVnZ/N_6z.basis
 }
 
 {hf
 wf,5,8,3
 occ,1,1,1,0,1,0,0,0
                                                                                 !open,1.3
 closed,1,0,0,0,0,0,0,0
                                                                                 !sym,
 }
 scf(i)=energy
 
 _CC_NORM_MAX=2.0
  !NOTE: Perturbative MRCC works only with UHF reference. So, here we will trick MRCC by doing zero UHF iteration right after ROHF.
 
 {uhf
 wf,5,8,3
 occ,1,1,1,0,1,0,0,0
                                                                                 !open,1.3
 closed,1,0,0,0,0,0,0,0
                                                                                 !sym,
 maxit,0
 }
 scf(i)=energy
 
 {mrcc,method=CCSDT(Q)
 orbital,ignore_error=1                                                          !Ignore the fact that UHF WF is not converged
 maxit,100
 core
 }
 posthf(i)=energy
 
 table,scf,posthf,ekin,pot
 save,6.csv,new
 
 

 Variables initialized (889), CPU time= 0.00 sec
 Commands  initialized (702), CPU time= 0.01 sec, 572 directives.
 Default parameters read. Elapsed time= 0.11 sec

 Checking input...
 Passed
1


                                         ***  PROGRAM SYSTEM MOLPRO  ***
                                       Copyright, TTI GmbH Stuttgart, 2015
                                    Version 2015.1 linked Sep  7 2016 23:09:38


 **********************************************************************************************************************************
 LABEL *   N                                                                             
  64 bit serial version                                                                  DATE: 20-Jun-18          TIME: 15:12:32  
 **********************************************************************************************************************************

 SHA1:             2873118e99aab1bc19f5b6fc1784693c06d15c95
 **********************************************************************************************************************************

 THRESHOLDS:

 ZERO    =  1.00D-12  ONEINT  =  1.00D-12  TWOINT  =  1.00D-12  PREFAC  =  1.00D-14  LOCALI  =  1.00D-09  EORDER  =  1.00D-04
 ENERGY  =  0.00D+00  ETEST   =  0.00D+00  EDENS   =  0.00D+00  THRDEDEF=  1.00D-06  GRADIENT=  1.00D-02  STEP    =  1.00D-03
 ORBITAL =  1.00D-05  CIVEC   =  1.00D-05  COEFF   =  1.00D-04  PRINTCI =  5.00D-02  PUNCHCI =  9.90D+01  OPTGRAD =  3.00D-04
 OPTENERG=  1.00D-06  OPTSTEP =  3.00D-04  THRGRAD =  1.00D-10  COMPRESS=  1.00D-11  VARMIN  =  1.00D-07  VARMAX  =  1.00D-03
 THRDOUB =  0.00D+00  THRDIV  =  1.00D-05  THRRED  =  1.00D-07  THRPSP  =  1.00D+00  THRDC   =  1.00D-10  THRCS   =  1.00D-10
 THRNRM  =  1.00D-08  THREQ   =  0.00D+00  THRDE   =  1.00D+00  THRREF  =  1.00D-05  SPARFAC =  1.00D+00  THRDLP  =  1.00D-07
 THRDIA  =  1.00D-10  THRDLS  =  1.00D-07  THRGPS  =  0.00D+00  THRKEX  =  0.00D+00  THRDIS  =  2.00D-01  THRVAR  =  1.00D-10
 THRLOC  =  1.00D-06  THRGAP  =  1.00D-06  THRLOCT = -1.00D+00  THRGAPT = -1.00D+00  THRORB  =  1.00D-06  THRMLTP =  0.00D+00
 THRCPQCI=  1.00D-10  KEXTA   =  0.00D+00  THRCOARS=  0.00D+00  SYMTOL  =  1.00D-06  GRADTOL =  1.00D-06  THROVL  =  1.00D-08
 THRORTH =  1.00D-08  GRID    =  1.00D-06  GRIDMAX =  1.00D-03  DTMAX   =  0.00D+00  THROCCDE=  1.00D-01  THROCCDE=  1.00D-01



 ZUNIT=ANG
 

Geometry recognized as XYZ


 Variable memory set to 8000000000 words,  buffer space   230000 words

 SETTING BASIS          =    USERDEF


 Recomputing integrals since basis changed


 Using spherical harmonics



 PROGRAM * SEWARD (Integral evaluation for generally contracted gaussian basis sets)     Author: Roland Lindh, 1990

 Geometry written to block  1 of record 700

 Orientation using atomic masses  
 Molecule type: Atom
 Symmetry elements: X,Y,Z
 Rotational constants:       0.0000000      0.0000000      0.0000000 GHz  (calculated with average atomic masses)

 Point group  D2h 



 ATOMIC COORDINATES

 NR  ATOM    CHARGE       X              Y              Z

   1  N       5.00    0.000000000    0.000000000    0.000000000


          N   CORE POTENTIAL

          p POTENTIAL

 POWERS             1              3              2
 EXPONENTIALS   9.235010       7.668300       7.344861    
 COEFFICIENTS   5.000000       46.17505      -30.18894    

          s - p POTENTIAL

 POWERS             2
 EXPONENTIALS   6.995365    
 COEFFICIENTS   31.69720    


 BASIS DATA

   Nr Sym  Nuc  Type         Exponents   Contraction coefficients

    1.1 Ag    1  1s           0.098869     0.067266
                              0.211443     0.334290
                              0.452197     0.454257
                              0.967080     0.267861
                              2.068221     0.000248
                              4.423150    -0.132606
                              9.459462     0.014437
                             20.230246     0.000359
                             43.264919    -0.000094
    2.1 Ag    1  1s           0.041268     1.000000
    3.1 Ag    1  1s           0.103171     1.000000
    4.1 Ag    1  1s           0.236182     1.000000
    5.1 Ag    1  1s           0.530399     1.000000
    6.1 Ag    1  1s           1.101198     1.000000
    7.1 Ag    1  1s           2.386742     1.000000
    8.1 Ag    1  3d0          0.097442     1.000000
    9.1 Ag    1  3d2+         0.097442     1.000000
   10.1 Ag    1  3d0          0.243606     1.000000
   11.1 Ag    1  3d2+         0.243606     1.000000
   12.1 Ag    1  3d0          0.625451     1.000000
   13.1 Ag    1  3d2+         0.625451     1.000000
   14.1 Ag    1  3d0          1.395216     1.000000
   15.1 Ag    1  3d2+         1.395216     1.000000
   16.1 Ag    1  3d0          2.708889     1.000000
   17.1 Ag    1  3d2+         2.708889     1.000000
   18.1 Ag    1  3d0          6.671193     1.000000
   19.1 Ag    1  3d2+         6.671193     1.000000
   20.1 Ag    1  5g0          0.305106     1.000000
   21.1 Ag    1  5g4+         0.305106     1.000000
   22.1 Ag    1  5g2+         0.305106     1.000000
   23.1 Ag    1  5g0          0.762765     1.000000
   24.1 Ag    1  5g4+         0.762765     1.000000
   25.1 Ag    1  5g2+         0.762765     1.000000
   26.1 Ag    1  5g0          1.808740     1.000000
   27.1 Ag    1  5g4+         1.808740     1.000000
   28.1 Ag    1  5g2+         1.808740     1.000000
   29.1 Ag    1  5g0          3.690676     1.000000
   30.1 Ag    1  5g4+         3.690676     1.000000
   31.1 Ag    1  5g2+         3.690676     1.000000
   32.1 Ag    1  7i6+         0.833886     1.000000
   33.1 Ag    1  7i4+         0.833886     1.000000
   34.1 Ag    1  7i2+         0.833886     1.000000
   35.1 Ag    1  7i0          0.833886     1.000000
   36.1 Ag    1  7i6+         2.084716     1.000000
   37.1 Ag    1  7i4+         2.084716     1.000000
   38.1 Ag    1  7i2+         2.084716     1.000000
   39.1 Ag    1  7i0          2.084716     1.000000
    1.2 B3u   1  2px          0.073234     0.035758
                              0.145867     0.153945
                              0.290535     0.277656
                              0.578683     0.297676
                              1.152612     0.234403
                              2.295756     0.140321
                              4.572652     0.067219
                              9.107739     0.031594
                             18.140657     0.003301
    2.2 B3u   1  2px          0.042244     1.000000
    3.2 B3u   1  2px          0.105611     1.000000
    4.2 B3u   1  2px          0.262849     1.000000
    5.2 B3u   1  2px          0.597244     1.000000
    6.2 B3u   1  2px          1.508762     1.000000
    7.2 B3u   1  2px          2.096116     1.000000
    8.2 B3u   1  4f1+         0.157028     1.000000
    9.2 B3u   1  4f3+         0.157028     1.000000
   10.2 B3u   1  4f1+         0.392571     1.000000
   11.2 B3u   1  4f3+         0.392571     1.000000
   12.2 B3u   1  4f1+         0.934622     1.000000
   13.2 B3u   1  4f3+         0.934622     1.000000
   14.2 B3u   1  4f1+         1.879609     1.000000
   15.2 B3u   1  4f3+         1.879609     1.000000
   16.2 B3u   1  4f1+         3.904393     1.000000
   17.2 B3u   1  4f3+         3.904393     1.000000
   18.2 B3u   1  6h1+         0.468255     1.000000
   19.2 B3u   1  6h3+         0.468255     1.000000
   20.2 B3u   1  6h5+         0.468255     1.000000
   21.2 B3u   1  6h1+         1.170637     1.000000
   22.2 B3u   1  6h3+         1.170637     1.000000
   23.2 B3u   1  6h5+         1.170637     1.000000
   24.2 B3u   1  6h1+         2.723494     1.000000
   25.2 B3u   1  6h3+         2.723494     1.000000
   26.2 B3u   1  6h5+         2.723494     1.000000
    1.3 B2u   1  2py          0.073234     0.035758
                              0.145867     0.153945
                              0.290535     0.277656
                              0.578683     0.297676
                              1.152612     0.234403
                              2.295756     0.140321
                              4.572652     0.067219
                              9.107739     0.031594
                             18.140657     0.003301
    2.3 B2u   1  2py          0.042244     1.000000
    3.3 B2u   1  2py          0.105611     1.000000
    4.3 B2u   1  2py          0.262849     1.000000
    5.3 B2u   1  2py          0.597244     1.000000
    6.3 B2u   1  2py          1.508762     1.000000
    7.3 B2u   1  2py          2.096116     1.000000
    8.3 B2u   1  4f1-         0.157028     1.000000
    9.3 B2u   1  4f3-         0.157028     1.000000
   10.3 B2u   1  4f1-         0.392571     1.000000
   11.3 B2u   1  4f3-         0.392571     1.000000
   12.3 B2u   1  4f1-         0.934622     1.000000
   13.3 B2u   1  4f3-         0.934622     1.000000
   14.3 B2u   1  4f1-         1.879609     1.000000
   15.3 B2u   1  4f3-         1.879609     1.000000
   16.3 B2u   1  4f1-         3.904393     1.000000
   17.3 B2u   1  4f3-         3.904393     1.000000
   18.3 B2u   1  6h1-         0.468255     1.000000
   19.3 B2u   1  6h3-         0.468255     1.000000
   20.3 B2u   1  6h5-         0.468255     1.000000
   21.3 B2u   1  6h1-         1.170637     1.000000
   22.3 B2u   1  6h3-         1.170637     1.000000
   23.3 B2u   1  6h5-         1.170637     1.000000
   24.3 B2u   1  6h1-         2.723494     1.000000
   25.3 B2u   1  6h3-         2.723494     1.000000
   26.3 B2u   1  6h5-         2.723494     1.000000
    1.4 B1g   1  3d2-         0.097442     1.000000
    2.4 B1g   1  3d2-         0.243606     1.000000
    3.4 B1g   1  3d2-         0.625451     1.000000
    4.4 B1g   1  3d2-         1.395216     1.000000
    5.4 B1g   1  3d2-         2.708889     1.000000
    6.4 B1g   1  3d2-         6.671193     1.000000
    7.4 B1g   1  5g2-         0.305106     1.000000
    8.4 B1g   1  5g4-         0.305106     1.000000
    9.4 B1g   1  5g2-         0.762765     1.000000
   10.4 B1g   1  5g4-         0.762765     1.000000
   11.4 B1g   1  5g2-         1.808740     1.000000
   12.4 B1g   1  5g4-         1.808740     1.000000
   13.4 B1g   1  5g2-         3.690676     1.000000
   14.4 B1g   1  5g4-         3.690676     1.000000
   15.4 B1g   1  7i2-         0.833886     1.000000
   16.4 B1g   1  7i6-         0.833886     1.000000
   17.4 B1g   1  7i4-         0.833886     1.000000
   18.4 B1g   1  7i2-         2.084716     1.000000
   19.4 B1g   1  7i6-         2.084716     1.000000
   20.4 B1g   1  7i4-         2.084716     1.000000
    1.5 B1u   1  2pz          0.073234     0.035758
                              0.145867     0.153945
                              0.290535     0.277656
                              0.578683     0.297676
                              1.152612     0.234403
                              2.295756     0.140321
                              4.572652     0.067219
                              9.107739     0.031594
                             18.140657     0.003301
    2.5 B1u   1  2pz          0.042244     1.000000
    3.5 B1u   1  2pz          0.105611     1.000000
    4.5 B1u   1  2pz          0.262849     1.000000
    5.5 B1u   1  2pz          0.597244     1.000000
    6.5 B1u   1  2pz          1.508762     1.000000
    7.5 B1u   1  2pz          2.096116     1.000000
    8.5 B1u   1  4f0          0.157028     1.000000
    9.5 B1u   1  4f2+         0.157028     1.000000
   10.5 B1u   1  4f0          0.392571     1.000000
   11.5 B1u   1  4f2+         0.392571     1.000000
   12.5 B1u   1  4f0          0.934622     1.000000
   13.5 B1u   1  4f2+         0.934622     1.000000
   14.5 B1u   1  4f0          1.879609     1.000000
   15.5 B1u   1  4f2+         1.879609     1.000000
   16.5 B1u   1  4f0          3.904393     1.000000
   17.5 B1u   1  4f2+         3.904393     1.000000
   18.5 B1u   1  6h2+         0.468255     1.000000
   19.5 B1u   1  6h4+         0.468255     1.000000
   20.5 B1u   1  6h0          0.468255     1.000000
   21.5 B1u   1  6h2+         1.170637     1.000000
   22.5 B1u   1  6h4+         1.170637     1.000000
   23.5 B1u   1  6h0          1.170637     1.000000
   24.5 B1u   1  6h2+         2.723494     1.000000
   25.5 B1u   1  6h4+         2.723494     1.000000
   26.5 B1u   1  6h0          2.723494     1.000000
    1.6 B2g   1  3d1+         0.097442     1.000000
    2.6 B2g   1  3d1+         0.243606     1.000000
    3.6 B2g   1  3d1+         0.625451     1.000000
    4.6 B2g   1  3d1+         1.395216     1.000000
    5.6 B2g   1  3d1+         2.708889     1.000000
    6.6 B2g   1  3d1+         6.671193     1.000000
    7.6 B2g   1  5g1+         0.305106     1.000000
    8.6 B2g   1  5g3+         0.305106     1.000000
    9.6 B2g   1  5g1+         0.762765     1.000000
   10.6 B2g   1  5g3+         0.762765     1.000000
   11.6 B2g   1  5g1+         1.808740     1.000000
   12.6 B2g   1  5g3+         1.808740     1.000000
   13.6 B2g   1  5g1+         3.690676     1.000000
   14.6 B2g   1  5g3+         3.690676     1.000000
   15.6 B2g   1  7i5+         0.833886     1.000000
   16.6 B2g   1  7i3+         0.833886     1.000000
   17.6 B2g   1  7i1+         0.833886     1.000000
   18.6 B2g   1  7i5+         2.084716     1.000000
   19.6 B2g   1  7i3+         2.084716     1.000000
   20.6 B2g   1  7i1+         2.084716     1.000000
    1.7 B3g   1  3d1-         0.097442     1.000000
    2.7 B3g   1  3d1-         0.243606     1.000000
    3.7 B3g   1  3d1-         0.625451     1.000000
    4.7 B3g   1  3d1-         1.395216     1.000000
    5.7 B3g   1  3d1-         2.708889     1.000000
    6.7 B3g   1  3d1-         6.671193     1.000000
    7.7 B3g   1  5g1-         0.305106     1.000000
    8.7 B3g   1  5g3-         0.305106     1.000000
    9.7 B3g   1  5g1-         0.762765     1.000000
   10.7 B3g   1  5g3-         0.762765     1.000000
   11.7 B3g   1  5g1-         1.808740     1.000000
   12.7 B3g   1  5g3-         1.808740     1.000000
   13.7 B3g   1  5g1-         3.690676     1.000000
   14.7 B3g   1  5g3-         3.690676     1.000000
   15.7 B3g   1  7i5-         0.833886     1.000000
   16.7 B3g   1  7i3-         0.833886     1.000000
   17.7 B3g   1  7i1-         0.833886     1.000000
   18.7 B3g   1  7i5-         2.084716     1.000000
   19.7 B3g   1  7i3-         2.084716     1.000000
   20.7 B3g   1  7i1-         2.084716     1.000000
    1.8 Au    1  4f2-         0.157028     1.000000
    2.8 Au    1  4f2-         0.392571     1.000000
    3.8 Au    1  4f2-         0.934622     1.000000
    4.8 Au    1  4f2-         1.879609     1.000000
    5.8 Au    1  4f2-         3.904393     1.000000
    6.8 Au    1  6h4-         0.468255     1.000000
    7.8 Au    1  6h2-         0.468255     1.000000
    8.8 Au    1  6h4-         1.170637     1.000000
    9.8 Au    1  6h2-         1.170637     1.000000
   10.8 Au    1  6h4-         2.723494     1.000000
   11.8 Au    1  6h2-         2.723494     1.000000

 NUCLEAR CHARGE:                    5
 NUMBER OF PRIMITIVE AOS:         325
 NUMBER OF SYMMETRY AOS:          220
 NUMBER OF CONTRACTIONS:          188   (  39Ag  +  26B3u +  26B2u +  20B1g +  26B1u +  20B2g +  20B3g +  11Au  )
 NUMBER OF CORE ORBITALS:           0   (   0Ag  +   0B3u +   0B2u +   0B1g +   0B1u +   0B2g +   0B3g +   0Au  )
 NUMBER OF VALENCE ORBITALS:        4   (   1Ag  +   1B3u +   1B2u +   0B1g +   1B1u +   0B2g +   0B3g +   0Au  )


 NUCLEAR REPULSION ENERGY    0.00000000

 EXTRA SYMMETRY OF AOS IN SYMMETRY 1:   1 1 1 1 1 1 1 2 3 2   3 2 3 2 3 2 3 2 3 4   5 6 4 5 6 4 5 6 4 5   6 7 8 910 7 8 910
 EXTRA SYMMETRY OF AOS IN SYMMETRY 2:   1 1 1 1 1 1 1 2 3 2   3 2 3 2 3 2 3 4 5 6   4 5 6 4 5 6
 EXTRA SYMMETRY OF AOS IN SYMMETRY 3:   1 1 1 1 1 1 1 2 3 2   3 2 3 2 3 2 3 4 5 6   4 5 6 4 5 6
 EXTRA SYMMETRY OF AOS IN SYMMETRY 4:   1 1 1 1 1 1 2 3 2 3   2 3 2 3 4 5 6 4 5 6
 EXTRA SYMMETRY OF AOS IN SYMMETRY 5:   1 1 1 1 1 1 1 2 3 2   3 2 3 2 3 2 3 4 5 6   4 5 6 4 5 6
 EXTRA SYMMETRY OF AOS IN SYMMETRY 6:   1 1 1 1 1 1 2 3 2 3   2 3 2 3 4 5 6 4 5 6
 EXTRA SYMMETRY OF AOS IN SYMMETRY 7:   1 1 1 1 1 1 2 3 2 3   2 3 2 3 4 5 6 4 5 6
 EXTRA SYMMETRY OF AOS IN SYMMETRY 8:   1 1 1 1 1 2 3 2 3 2   3

 Eigenvalues of metric

         1 0.159E-03 0.258E-02 0.178E-01 0.222E-01 0.222E-01 0.990E-01 0.113E+00 0.113E+00
         2 0.119E-02 0.709E-02 0.333E-01 0.463E-01 0.463E-01 0.162E+00 0.223E+00 0.223E+00
         3 0.119E-02 0.709E-02 0.333E-01 0.463E-01 0.463E-01 0.162E+00 0.223E+00 0.223E+00
         4 0.222E-01 0.113E+00 0.125E+00 0.125E+00 0.346E+00 0.459E+00 0.459E+00 0.533E+00
         5 0.119E-02 0.709E-02 0.333E-01 0.463E-01 0.463E-01 0.162E+00 0.223E+00 0.223E+00
         6 0.222E-01 0.113E+00 0.125E+00 0.125E+00 0.346E+00 0.459E+00 0.459E+00 0.533E+00
         7 0.222E-01 0.113E+00 0.125E+00 0.125E+00 0.346E+00 0.459E+00 0.459E+00 0.533E+00
         8 0.463E-01 0.223E+00 0.281E+00 0.281E+00 0.643E+00 0.895E+00 0.895E+00 0.148E+01


 Contracted 2-electron integrals neglected if value below      1.0D-12
 AO integral compression algorithm  1   Integral accuracy      1.0D-12

     120.848 MB (compressed) written to integral file ( 47.7%)


 NUMBER OF SORTED TWO-ELECTRON INTEGRALS:   20212815.     BUFFER LENGTH:  32768
 NUMBER OF SEGMENTS:   2  SEGMENT LENGTH:   15998787      RECORD LENGTH: 524288

 Memory used in sort:      16.56 MW

 SORT1 READ    31710950. AND WROTE    13213985. INTEGRALS IN     39 RECORDS. CPU TIME:     0.85 SEC, REAL TIME:     1.14 SEC
 SORT2 READ    13213985. AND WROTE    20212815. INTEGRALS IN    461 RECORDS. CPU TIME:     0.48 SEC, REAL TIME:     0.91 SEC

 FILE SIZES:   FILE 1:   140.7 MBYTE,  FILE 4:   163.6 MBYTE,   TOTAL:    304.4 MBYTE

 OPERATOR DM      FOR CENTER  0  COORDINATES:    0.000000    0.000000    0.000000
 OPERATOR EKIN    FOR CENTER  0  COORDINATES:    0.000000    0.000000    0.000000
 OPERATOR POT     FOR CENTER  0  COORDINATES:    0.000000    0.000000    0.000000


 **********************************************************************************************************************************
 DATASETS  * FILE   NREC   LENGTH (MB)   RECORD NAMES
              1      20       97.67       500      610      700      900      950      970     1000      129      960     1100   
                                          VAR    BASINP    GEOM    SYMINP    ZMAT    AOBASIS   BASIS     P2S    ABASIS      S 
                                         1400     1410     1420     1200     1210     1080     1600     1650     1300     1700   
                                         EKIN       V       ECP      H0       H01     AOSYM     SMH    MOLCAS    ERIS     OPER   

 PROGRAMS   *        TOTAL       INT
 CPU TIMES  *         7.16      7.07
 REAL TIME  *        17.39 SEC
 DISK USED  *       304.69 MB      
 **********************************************************************************************************************************


 PROGRAM * RHF-SCF (OPEN SHELL)       Authors: W. Meyer, H.-J. Werner


 NUMBER OF ELECTRONS:       4+    1-    SPACE SYMMETRY=8    SPIN SYMMETRY: Quartet 
 CONVERGENCE THRESHOLDS:    1.00E-05 (Density)    1.00E-07 (Energy)
 MAX. NUMBER OF ITERATIONS:       60
 INTERPOLATION TYPE:            DIIS
 INTERPOLATION STEPS:              2 (START)      1 (STEP)
 LEVEL SHIFTS:                 -0.60 (CLOSED) -0.30 (OPEN) 

 Number of closed-shell orbitals:    1 (   1   0   0   0   0   0   0   0 )
 Number of open-shell orbitals:      3 (   0   1   1   0   1   0   0   0 )



   Atom=N  basis=ECP2MWB_GUESS     lmin=0  lmax=1

 Orbital guess generated from atomic densities. Full valence occupancy:    1   1   1   0   1   0   0   0


 Molecular orbital dump at record        2100.2

 ITERATION    DDIFF          GRAD             ENERGY        2-EL.EN.            DIPOLE MOMENTS         DIIS   ORB.
    1      0.000D+00      0.000D+00        -9.62230406     11.235494    0.00000    0.00000    0.00000    0    start
    2      0.000D+00      0.124D-01        -9.66444476     11.987359    0.00000    0.00000    0.00000    1    diag,B
    3      0.848D-02      0.301D-02        -9.66749528     12.096094    0.00000    0.00000    0.00000    2    diag,B
    4      0.150D-02      0.146D-02        -9.66833375     12.145990    0.00000    0.00000    0.00000    3    diag,B
    5      0.127D-02      0.345D-03        -9.66837530     12.151366    0.00000    0.00000    0.00000    4    diag,B
    6      0.392D-03      0.651D-04        -9.66837632     12.150680    0.00000    0.00000    0.00000    5    diag,B
    7      0.791D-04      0.141D-04        -9.66837636     12.150531    0.00000    0.00000    0.00000    6    fixocc
    8      0.302D-04      0.228D-05        -9.66837636     12.150503    0.00000    0.00000    0.00000    7    diag,B
    9      0.317D-05      0.645D-06        -9.66837636     12.150502    0.00000    0.00000    0.00000    0    orth

 Final alpha occupancy:   1   1   1   0   1   0   0   0
 Final beta  occupancy:   1   0   0   0   0   0   0   0

 !RHF STATE 1.8 Energy                 -9.668376362716
 Nuclear energy                         0.00000000
 One-electron energy                  -15.74362755
 Two-electron energy                    6.07525119
 Virial quotient                       -1.43195489
 !RHF STATE 1.8 Dipole moment           0.00000000     0.00000000     0.00000000
 Dipole moment /Debye                   0.00000000     0.00000000     0.00000000
 

 !RHF expec          <1.8|EKIN|1.8>     6.751872141566
 
 !RHF expec           <1.8|POT|1.8>    -4.748771687138

 ELECTRON ORBITALS
 =================


   Orb  Occ    Energy  Couls-En    Coefficients

                                   1 1s      1 1s      1 1s      1 1s      1 1s      1 1s      1 1s      1 3d0     1 3d2+    1 3d0  
                                   1 3d2+    1 3d0     1 3d2+    1 3d0     1 3d2+    1 3d0     1 3d2+    1 3d0     1 3d2+    1 5g0  
                                   1 5g4+    1 5g2+    1 5g0     1 5g4+    1 5g2+    1 5g0     1 5g4+    1 5g2+    1 5g0     1 5g4+ 
                                   1 5g2+    1 7i6+    1 7i4+    1 7i2+    1 7i0     1 7i6+    1 7i4+    1 7i2+    1 7i0  

   1.1   2    -0.9454   -4.3761  0.999978  0.000211 -0.000391  0.000372 -0.000214  0.000100 -0.000022 -0.000000 -0.000000  0.000000
                                 0.000000 -0.000000 -0.000000  0.000000  0.000000 -0.000000 -0.000000  0.000000  0.000000 -0.000000
                                -0.000000  0.000000  0.000000  0.000000 -0.000000 -0.000000 -0.000000  0.000000  0.000000  0.000000
                                -0.000000  0.000000 -0.000000 -0.000000  0.000000 -0.000000  0.000000  0.000000 -0.000000

                                   1 2px     1 2px     1 2px     1 2px     1 2px     1 2px     1 2px     1 4f1+    1 4f3+    1 4f1+ 
                                   1 4f3+    1 4f1+    1 4f3+    1 4f1+    1 4f3+    1 4f1+    1 4f3+    1 6h1+    1 6h3+    1 6h5+ 
                                   1 6h1+    1 6h3+    1 6h5+    1 6h1+    1 6h3+    1 6h5+ 

   1.2   +    -0.5675   -3.5282  1.000074  0.000339 -0.000427  0.000259 -0.000178  0.000096 -0.000079 -0.000000  0.000000  0.000000
                                -0.000000 -0.000000  0.000000  0.000000 -0.000000 -0.000000  0.000000 -0.000000  0.000000 -0.000000
                                 0.000000 -0.000000  0.000000 -0.000000  0.000000 -0.000000

                                   1 2py     1 2py     1 2py     1 2py     1 2py     1 2py     1 2py     1 4f1-    1 4f3-    1 4f1- 
                                   1 4f3-    1 4f1-    1 4f3-    1 4f1-    1 4f3-    1 4f1-    1 4f3-    1 6h1-    1 6h3-    1 6h5- 
                                   1 6h1-    1 6h3-    1 6h5-    1 6h1-    1 6h3-    1 6h5- 

   1.3   +    -0.5675   -3.5282  1.000074  0.000339 -0.000427  0.000259 -0.000178  0.000096 -0.000079 -0.000000 -0.000000  0.000000
                                 0.000000 -0.000000 -0.000000  0.000000  0.000000 -0.000000 -0.000000 -0.000000 -0.000000 -0.000000
                                 0.000000  0.000000  0.000000 -0.000000 -0.000000 -0.000000

                                   1 2pz     1 2pz     1 2pz     1 2pz     1 2pz     1 2pz     1 2pz     1 4f0     1 4f2+    1 4f0  
                                   1 4f2+    1 4f0     1 4f2+    1 4f0     1 4f2+    1 4f0     1 4f2+    1 6h2+    1 6h4+    1 6h0  
                                   1 6h2+    1 6h4+    1 6h0     1 6h2+    1 6h4+    1 6h0  

   1.5   +    -0.5675   -3.5282  1.000074  0.000339 -0.000427  0.000259 -0.000178  0.000096 -0.000079 -0.000000 -0.000000  0.000000
                                 0.000000 -0.000000 -0.000000  0.000000  0.000000 -0.000000 -0.000000  0.000000 -0.000000 -0.000000
                                 0.000000  0.000000  0.000000 -0.000000 -0.000000 -0.000000

 HOMO      1.2    -0.567463 =     -15.4414eV
 LUMO      2.1     0.067685 =       1.8418eV
 LUMO-HOMO         0.635148 =      17.2833eV


 **********************************************************************************************************************************
 DATASETS  * FILE   NREC   LENGTH (MB)   RECORD NAMES
              1      20       97.67       500      610      700      900      950      970     1000      129      960     1100   
                                          VAR    BASINP    GEOM    SYMINP    ZMAT    AOBASIS   BASIS     P2S    ABASIS      S 
                                         1400     1410     1420     1200     1210     1080     1600     1650     1300     1700   
                                         EKIN       V       ECP      H0       H01     AOSYM     SMH    MOLCAS    ERIS     OPER   

              2       4        2.92       700     1000      520     2100   
                                         GEOM     BASIS   MCVARS     RHF  

 PROGRAMS   *        TOTAL        HF       INT
 CPU TIMES  *         7.69      0.53      7.07
 REAL TIME  *        18.07 SEC
 DISK USED  *       304.69 MB      
 **********************************************************************************************************************************
 SETTING SCF(I)         =        -9.66837636  AU                              
 SETTING _CC_NORM_MAX   =         2.00000000                                  


 PROGRAM * UHF-SCF       Authors: W. Meyer, H.-J. Werner


 NUMBER OF ELECTRONS:       4+    1-    SPACE SYMMETRY=8    SPIN SYMMETRY: Quartet 
 CONVERGENCE THRESHOLDS:    1.00E-05 (Density)    1.00E-07 (Energy)
 MAX. NUMBER OF ITERATIONS:        0
 INTERPOLATION TYPE:            DIIS
 INTERPOLATION STEPS:              2 (START)      1 (STEP)
 LEVEL SHIFTS:                  0.20 (ALPHA)   0.20 (BETA) 

 Number of closed-shell orbitals:    1 (   1   0   0   0   0   0   0   0 )
 Number of open-shell orbitals:      3 (   0   1   1   0   1   0   0   0 )


 Molecular orbitals read from record     2100.2  Type=RHF/CANONICAL (state 1.8)

 Molecular orbital dump at record        2200.2

 Initial alpha occupation   1   1   1   0   1   0   0   0
 Initial beta  occupation   1   0   0   0   0   0   0   0

 ITERATION    DDIFF          GRAD             ENERGY        2-EL.EN.            DIPOLE MOMENTS         DIIS
    1      0.000D+00      0.000D+00        -9.66837636     12.150502    0.00000    0.00000    0.00000    0
 
 Final alpha occupancy:   1   1   1   0   1   0   0   0
 Final beta  occupancy:   1   0   0   0   0   0   0   0

 !UHF STATE 1.8 Energy                 -9.668376362716
 Nuclear energy                         0.00000000
 One-electron energy                  -15.74362755
 Two-electron energy                    6.07525119
 Virial quotient                       -1.43195489
 !UHF STATE 1.8 Dipole moment           0.00000000     0.00000000     0.00000000
 Dipole moment /Debye                   0.00000000     0.00000000     0.00000000
 

 !UHF expec          <1.8|EKIN|1.8>     6.751872141566
 
 !UHF expec           <1.8|POT|1.8>    -4.748771687138

 ELECTRON ORBITALS FOR POSITIVE SPIN
 ===================================


   Orb  Occ    Energy  Couls-En    Coefficients

                                   1 1s      1 1s      1 1s      1 1s      1 1s      1 1s      1 1s      1 3d0     1 3d2+    1 3d0  
                                   1 3d2+    1 3d0     1 3d2+    1 3d0     1 3d2+    1 3d0     1 3d2+    1 3d0     1 3d2+    1 5g0  
                                   1 5g4+    1 5g2+    1 5g0     1 5g4+    1 5g2+    1 5g0     1 5g4+    1 5g2+    1 5g0     1 5g4+ 
                                   1 5g2+    1 7i6+    1 7i4+    1 7i2+    1 7i0     1 7i6+    1 7i4+    1 7i2+    1 7i0  

   1.1   +    -0.9454   -4.3761  0.999978  0.000211 -0.000391  0.000372 -0.000214  0.000100 -0.000022 -0.000000 -0.000000  0.000000
                                 0.000000 -0.000000 -0.000000  0.000000  0.000000 -0.000000 -0.000000  0.000000  0.000000 -0.000000
                                -0.000000  0.000000  0.000000  0.000000 -0.000000 -0.000000 -0.000000  0.000000  0.000000  0.000000
                                -0.000000  0.000000 -0.000000 -0.000000  0.000000 -0.000000  0.000000  0.000000 -0.000000

                                   1 2px     1 2px     1 2px     1 2px     1 2px     1 2px     1 2px     1 4f1+    1 4f3+    1 4f1+ 
                                   1 4f3+    1 4f1+    1 4f3+    1 4f1+    1 4f3+    1 4f1+    1 4f3+    1 6h1+    1 6h3+    1 6h5+ 
                                   1 6h1+    1 6h3+    1 6h5+    1 6h1+    1 6h3+    1 6h5+ 

   1.2   +    -0.5675   -3.5282  1.000074  0.000339 -0.000427  0.000259 -0.000178  0.000096 -0.000079 -0.000000  0.000000  0.000000
                                -0.000000 -0.000000  0.000000  0.000000 -0.000000 -0.000000  0.000000 -0.000000  0.000000 -0.000000
                                 0.000000 -0.000000  0.000000 -0.000000  0.000000 -0.000000

                                   1 2py     1 2py     1 2py     1 2py     1 2py     1 2py     1 2py     1 4f1-    1 4f3-    1 4f1- 
                                   1 4f3-    1 4f1-    1 4f3-    1 4f1-    1 4f3-    1 4f1-    1 4f3-    1 6h1-    1 6h3-    1 6h5- 
                                   1 6h1-    1 6h3-    1 6h5-    1 6h1-    1 6h3-    1 6h5- 

   1.3   +    -0.5675   -3.5282  1.000074  0.000339 -0.000427  0.000259 -0.000178  0.000096 -0.000079 -0.000000 -0.000000  0.000000
                                 0.000000 -0.000000 -0.000000  0.000000  0.000000 -0.000000 -0.000000 -0.000000 -0.000000 -0.000000
                                 0.000000  0.000000  0.000000 -0.000000 -0.000000 -0.000000

                                   1 2pz     1 2pz     1 2pz     1 2pz     1 2pz     1 2pz     1 2pz     1 4f0     1 4f2+    1 4f0  
                                   1 4f2+    1 4f0     1 4f2+    1 4f0     1 4f2+    1 4f0     1 4f2+    1 6h2+    1 6h4+    1 6h0  
                                   1 6h2+    1 6h4+    1 6h0     1 6h2+    1 6h4+    1 6h0  

   1.5   +    -0.5675   -3.5282  1.000074  0.000339 -0.000427  0.000259 -0.000178  0.000096 -0.000079 -0.000000 -0.000000  0.000000
                                 0.000000 -0.000000 -0.000000  0.000000  0.000000 -0.000000 -0.000000  0.000000 -0.000000 -0.000000
                                 0.000000  0.000000  0.000000 -0.000000 -0.000000 -0.000000

 ELECTRON ORBITALS FOR NEGATIVE SPIN
 ===================================


   Orb  Occ    Energy  Couls-En    Coefficients

                                   1 1s      1 1s      1 1s      1 1s      1 1s      1 1s      1 1s      1 3d0     1 3d2+    1 3d0  
                                   1 3d2+    1 3d0     1 3d2+    1 3d0     1 3d2+    1 3d0     1 3d2+    1 3d0     1 3d2+    1 5g0  
                                   1 5g4+    1 5g2+    1 5g0     1 5g4+    1 5g2+    1 5g0     1 5g4+    1 5g2+    1 5g0     1 5g4+ 
                                   1 5g2+    1 7i6+    1 7i4+    1 7i2+    1 7i0     1 7i6+    1 7i4+    1 7i2+    1 7i0  

   1.1   -    -0.9454   -4.3761  0.999978  0.000211 -0.000391  0.000372 -0.000214  0.000100 -0.000022 -0.000000 -0.000000  0.000000
                                 0.000000 -0.000000 -0.000000  0.000000  0.000000 -0.000000 -0.000000  0.000000  0.000000 -0.000000
                                -0.000000  0.000000  0.000000  0.000000 -0.000000 -0.000000 -0.000000  0.000000  0.000000  0.000000
                                -0.000000  0.000000 -0.000000 -0.000000  0.000000 -0.000000  0.000000  0.000000 -0.000000

 HOMO      1.2    -0.567463 =     -15.4414eV
 LUMO     -1.2    -0.567463 =     -15.4414eV
 LUMO-HOMO         0.000000 =       0.0000eV

 EXPECTATION VALUE OF S**2:             3.75000000

 Occupation number threshold for canonical orbitals:  1.999000 (occupied),  0.001000 (virtual)

 Number of pseudo-canonical orbitals per symmetry:    1   0   0   0   0   0   0   0
 Number of active natural orbitals per symmetry:      0   1   1   0   1   0   0   0

 NATURAL CHARGE ORBITALS
 =======================


   Orb     Occ        Energy       Coefficients

                                   1 1s      1 1s      1 1s      1 1s      1 1s      1 1s      1 1s      1 3d0     1 3d2+    1 3d0  
                                   1 3d2+    1 3d0     1 3d2+    1 3d0     1 3d2+    1 3d0     1 3d2+    1 3d0     1 3d2+    1 5g0  
                                   1 5g4+    1 5g2+    1 5g0     1 5g4+    1 5g2+    1 5g0     1 5g4+    1 5g2+    1 5g0     1 5g4+ 
                                   1 5g2+    1 7i6+    1 7i4+    1 7i2+    1 7i0     1 7i6+    1 7i4+    1 7i2+    1 7i0  

   1.1  2.00000    -0.945368     0.999978  0.000211 -0.000391  0.000372 -0.000214  0.000100 -0.000022 -0.000000 -0.000000  0.000000
                                 0.000000 -0.000000 -0.000000  0.000000  0.000000 -0.000000 -0.000000  0.000000  0.000000 -0.000000
                                -0.000000  0.000000  0.000000  0.000000 -0.000000 -0.000000 -0.000000  0.000000  0.000000  0.000000
                                -0.000000  0.000000 -0.000000 -0.000000  0.000000 -0.000000  0.000000  0.000000 -0.000000

                                   1 2px     1 2px     1 2px     1 2px     1 2px     1 2px     1 2px     1 4f1+    1 4f3+    1 4f1+ 
                                   1 4f3+    1 4f1+    1 4f3+    1 4f1+    1 4f3+    1 4f1+    1 4f3+    1 6h1+    1 6h3+    1 6h5+ 
                                   1 6h1+    1 6h3+    1 6h5+    1 6h1+    1 6h3+    1 6h5+ 

   1.2  1.00000    -0.179862     1.000074  0.000339 -0.000427  0.000259 -0.000178  0.000096 -0.000079 -0.000000  0.000000  0.000000
                                -0.000000 -0.000000  0.000000  0.000000 -0.000000 -0.000000  0.000000 -0.000000  0.000000 -0.000000
                                 0.000000 -0.000000  0.000000 -0.000000  0.000000 -0.000000

                                   1 2py     1 2py     1 2py     1 2py     1 2py     1 2py     1 2py     1 4f1-    1 4f3-    1 4f1- 
                                   1 4f3-    1 4f1-    1 4f3-    1 4f1-    1 4f3-    1 4f1-    1 4f3-    1 6h1-    1 6h3-    1 6h5- 
                                   1 6h1-    1 6h3-    1 6h5-    1 6h1-    1 6h3-    1 6h5- 

   1.3  1.00000    -0.179862     1.000074  0.000339 -0.000427  0.000259 -0.000178  0.000096 -0.000079 -0.000000 -0.000000  0.000000
                                 0.000000 -0.000000 -0.000000  0.000000  0.000000 -0.000000 -0.000000 -0.000000 -0.000000 -0.000000
                                 0.000000  0.000000  0.000000 -0.000000 -0.000000 -0.000000

                                   1 2pz     1 2pz     1 2pz     1 2pz     1 2pz     1 2pz     1 2pz     1 4f0     1 4f2+    1 4f0  
                                   1 4f2+    1 4f0     1 4f2+    1 4f0     1 4f2+    1 4f0     1 4f2+    1 6h2+    1 6h4+    1 6h0  
                                   1 6h2+    1 6h4+    1 6h0     1 6h2+    1 6h4+    1 6h0  

   1.5  1.00000    -0.179862     1.000074  0.000339 -0.000427  0.000259 -0.000178  0.000096 -0.000079 -0.000000 -0.000000  0.000000
                                 0.000000 -0.000000 -0.000000  0.000000  0.000000 -0.000000 -0.000000  0.000000 -0.000000 -0.000000
                                 0.000000  0.000000  0.000000 -0.000000 -0.000000 -0.000000

 Natural orbitals saved to record    2200.2 (Orbital set 3)

 Orbital spaces for UNO-CAS (Min. occupation: 0.020  Max. occupation: 1.980):

 Closed:        1   0   0   0   0   0   0   0
 Active:        0   1   1   0   1   0   0   0

 No convergence



 **********************************************************************************************************************************
 DATASETS  * FILE   NREC   LENGTH (MB)   RECORD NAMES
              1      20       97.67       500      610      700      900      950      970     1000      129      960     1100   
                                          VAR    BASINP    GEOM    SYMINP    ZMAT    AOBASIS   BASIS     P2S    ABASIS      S 
                                         1400     1410     1420     1200     1210     1080     1600     1650     1300     1700   
                                         EKIN       V       ECP      H0       H01     AOSYM     SMH    MOLCAS    ERIS     OPER   

              2       5        5.69       700     1000      520     2100     2200   
                                         GEOM     BASIS   MCVARS     RHF      UHF  

 PROGRAMS   *        TOTAL       UHF        HF       INT
 CPU TIMES  *         7.73      0.04      0.53      7.07
 REAL TIME  *        18.55 SEC
 DISK USED  *       304.69 MB      
 **********************************************************************************************************************************
 SETTING SCF(I)         =        -9.66837636  AU                              


 PROGRAM * MRCC (General Multireference Coupled Cluster)    Author: M. Kallay, 2000-2005

 ***  Initialisation ***

   0 Spin projections
 
 Molecular orbitals read from record     2200.2  Type=UHF/ALPHA (state 1.8)

 ?Warning: UHF not converged
 Molecular orbitals read from record     2200.2  Type=UHF/BETA (state 1.8)

 ?Warning: UHF not converged
 
 Frozen orbitals:              0 (  0  0  0  0  0  0  0  0)
 Active orbitals:            188 ( 39 26 26 20 26 20 20 11)
 Active electrons:             5
 Spin quantum number:          1.5

 Transformed integrals will be written to file mrcc_25147/fort.55

 Load integrals                7.8 sec
 Transform integrals          17.8 sec
 Storage for integrals:      119071012
 Remaining memory:           *********

 Core energy:               0.00000000
 
 MRCC Input:
     4     0     0     0     3     0     0     8     0     0     0     1     1     0     0     7     0     0   0.000     0   64000
  ex.lev,nsing,ntrip, rest,method,dens,conver,symm, diag, CS ,spatial, HF, ndoub,nacto,nactv, tol, maxex, sacc, freq,  dboc,   mem
  2  0  0  0  0  0  0  0  0  0  0  0  0  0  0  0  0  0  0  0  0  0  0  0  0  0  0  0  0  0  0  0  0  0  0  0  0  0  0  1  0  0  0  0  0  0  0  0  0  0  0  0  0  0  0  0  0  0  0  0  0  0  0  0  0  1  0  0  0  0  0  0  0  0  0  0  0  0  0  0  0  0  0  0  0  0  0  0  0  0  0  0  0  0  0  0  0  0  0  0  0  0  0  0  0  0  0  0  0  0  0  1  0  0  0  0  0  0  0  0  0  0  0  0  0  0  0  0  0  0  0  0  0  0  0  0  0  0  0  0  0  0  0  0  0  0  0  0  0  0  0  0  0  0  0  0  0  0  0  0  0  0  0  0  0  0  0  0  0  0  0  0  0  0  0  0  0  0  0  0  0  0  0  0  0  0  0  0
 MRCC Input end
 Variable memory released
 MRCC now being run, temporary output in /global/cscratch1/sd/aannabe/mrcc_25147/mrcc.out
 **********************************************************************
                          MRCC program system
 **********************************************************************

                              Written by
  Mihaly Kallay, Zoltan Rolik, Jozsef Csontos, Peter Nagy, Gyula Samu,
      David Mester, Jozsef Csoka, Bernat Szabo, Istvan Ladjanszki,
       Lorant Szegedy, Bence Ladoczki, Klara Petrov, Mate Farkas,
                    Pal D. Mezei, and Bence Hegely

        Department of Physical Chemistry and Materials Science
            Budapest University of Technology and Economics
                  Budapest P.O.Box 91, H-1521 Hungary

                              www.mrcc.hu

                       Release date: May 23, 2018

 ************************ 2018-06-20 15:36:33 *************************
 Executing goldstone...

 Generation of CC equations in terms of H and T...
 Generation of antisymmetrized Goldstone diagrams...
 Number of diagrams in T^1 equations:    15
 Number of diagrams in T^2 equations:    38
 Number of diagrams in T^3 equations:    49
 Number of diagrams in T^4 equations:     5
 Translation of diagrams to factorized equations...
 Optimizing intermediate calculation...
 Number of floating-point operations per iteration step:   1.6942E+12
 Probable CPU time per iteration step (hours):     16.94
 Required memory (Mbytes):  154071.2
 Number of intermediates:                                  80
 Number of intermediates to be stored:                     32
 Length of intermediate file (Mbytes):    2437.2

 ************************ 2018-06-20 15:36:33 *************************
 Executing xmrcc...

 **********************************************************************
 CC(3)(4) calculation


 Allocation of****** Mbytes of memory...
 Number of spinorbitals:                   376
 Number of alpha electrons:                        4
 Number of beta electrons:                         1
 Spin multiplicity:                     2
 z-component of spin:  1.5
 Spatial symmetry:                      8
 Convergence criterion:  1.0E-07
 Construction of occupation graphs...
 Number of                     0 -fold excitations:                      1
 Number of                     1 -fold excitations:                    151
 Number of                     2 -fold excitations:                  30659
 Number of                     3 -fold excitations:                2870031
 Total number of configurations:                2900842
 Calculation of coupling coefficients...
 Length of intermediate file (Mbytes):    1834.1

 ======================================================================

 Spin case  1   Alpha:  3   Beta:  1
 Number of excitations:               95435009
 Spin case  2   Alpha:  4   Beta:  0
 Number of excitations:                5778276
 Number of                     4 -fold excitations:              101213285

 Memory requirements /Mbyte/:
               Minimal        Optimal
 Real*8:       3963.7248      9531.1702
 Integer:       259.1672
 Total:        4222.8921      9790.3374


 ************************ 2018-06-20 15:37:21 *************************
 Executing mrcc...

 **********************************************************************
 CCSDT(Q) calculation


 OpenMP parallel version is running.
 Number of CPUs:   1
 Allocation of 9531.2 Mbytes of memory...
 Number of spinorbitals: 376
 Number of alpha electrons:  4
 Number of beta  electrons:  1
 Spin multiplicity: 2
 z-component of spin:  1.5
 Spatial symmetry: 8
 Convergence criterion:  1.0E-07
 Construction of occupation graphs...
 Number of 0-fold excitations: 1
 Number of 1-fold excitations: 151
 Number of 2-fold excitations: 30659
 Number of 3-fold excitations: 2870031
 Total number of determinants: 2900842
 Calculation of coupling coefficients...
 Initial cluster amplitudes are generated.
 Length of intermediate file (Mbytes):    1834.1
 Reading integral list from unit 55...
 Sorting integrals...
 Sorting integrals...
 Sorting integrals...
 Sorting integrals...
 Energy of reference determinant [au]:      -9.668376362716
 Calculation of MP denominators...

 Starting CC iteration...
 ======================================================================
 Norm of residual vector:     0.85792442
 CPU time [min]:     5.225                   Wall time [min]:     5.230

 Iteration  1  CC energy:    -9.78616372  Energy decrease:   0.11778735
 ======================================================================
 Norm of residual vector:     0.20363438
 CPU time [min]:     7.434                   Wall time [min]:     7.445

 Iteration  2  CC energy:    -9.79553151  Energy decrease:   0.00936780
 ======================================================================
 Norm of residual vector:     0.04480720
 CPU time [min]:     9.678                   Wall time [min]:     9.692

 Iteration  3  CC energy:    -9.80131529  Energy decrease:   0.00578378
 ======================================================================
 Norm of residual vector:     0.01039954
 CPU time [min]:    11.931                   Wall time [min]:    11.954

 Iteration  4  CC energy:    -9.80150397  Energy decrease:   0.00018867
 ======================================================================
 Norm of residual vector:     0.00286335
 CPU time [min]:    14.181                   Wall time [min]:    14.206

 Iteration  5  CC energy:    -9.80148332  Energy decrease:   0.00002064
 ======================================================================
 Norm of residual vector:     0.00109420
 CPU time [min]:    16.438                   Wall time [min]:    16.470

 Iteration  6  CC energy:    -9.80150432  Energy decrease:   0.00002100
 ======================================================================
 Norm of residual vector:     0.00044757
 CPU time [min]:    18.647                   Wall time [min]:    18.760

 Iteration  7  CC energy:    -9.80150519  Energy decrease:   0.00000086
 ======================================================================
 Norm of residual vector:     0.00016182
 CPU time [min]:    20.820                   Wall time [min]:    20.997

 Iteration  8  CC energy:    -9.80150345  Energy decrease:   0.00000174
 ======================================================================
 Norm of residual vector:     0.00005815
 CPU time [min]:    22.942                   Wall time [min]:    23.122

 Iteration  9  CC energy:    -9.80150416  Energy decrease:   0.00000072
 ======================================================================
 Norm of residual vector:     0.00001879
 CPU time [min]:    25.069                   Wall time [min]:    25.256

 Iteration 10  CC energy:    -9.80150438  Energy decrease:   0.00000022
 ======================================================================
 Norm of residual vector:     0.00000532
 CPU time [min]:    27.194                   Wall time [min]:    27.383

 Iteration 11  CC energy:    -9.80150424  Energy decrease:   0.00000014
 ======================================================================
 Norm of residual vector:     0.00000146
 CPU time [min]:    29.329                   Wall time [min]:    29.525

 Iteration 12  CC energy:    -9.80150423  Energy decrease:   0.00000001
 ======================================================================
 Norm of residual vector:     0.00000042
 CPU time [min]:    31.458                   Wall time [min]:    31.656

 Iteration 13  CC energy:    -9.80150425  Energy decrease:   0.00000001
 ======================================================================
 Norm of residual vector:     0.00000014
 CPU time [min]:    33.591                   Wall time [min]:    33.795

 Iteration 14  CC energy:    -9.80150425  Energy decrease:   1.1509E-09
 ======================================================================
 Norm of residual vector:     0.00000005
 CPU time [min]:    35.682                   Wall time [min]:    35.891

 Iteration 15  CC energy:    -9.80150425  Energy decrease:   9.6690E-10
 ======================================================================

 Iteration has converged in 15 steps.

 Final results:
 Total CCSDT energy [au]:             -9.801504247501
 Total MP2 energy [au]:               -9.786163715299

 Perturbative corrections are calculated...
 ======================================================================
 Spin case  1   Alpha:  3   Beta:  1
 Number of excitations:        95435009
 CPU time [min]:   450.762                   Wall time [min]:   450.986
 ======================================================================
 Spin case  2   Alpha:  4   Beta:  0
 Number of excitations:        5778276
 CPU time [min]:   535.134                   Wall time [min]:   535.381
 ======================================================================
 Number of 4-fold excitations: 101213285
 CPU time [min]:   535.134                   Wall time [min]:   535.392

 Total CCSDT[Q] energy [au]:          -9.801512884426
 Total CCSDT(Q) energy [au]:          -9.801567046998

 ************************ 2018-06-21 00:32:46 *************************
                      Normal termination of mrcc.
 **********************************************************************
 !CCSDT STATE 1.8 Energy               -9.801504247501
 !MP2 STATE 1.8 Energy                 -9.786163715299
 !CCSDT[Q] STATE 1.8 Energy            -9.801512884426
 !CCSDT(Q) STATE 1.8 Energy            -9.801567046998
 
 CPU-time for MRCC:          32108.0 sec
 Elapsed-time for MRCC:      32174.6 sec

 Variable memory set to 8000000000 words,  buffer space   230000 words



 **********************************************************************************************************************************
 DATASETS  * FILE   NREC   LENGTH (MB)   RECORD NAMES
              1      20       97.67       500      610      700      900      950      970     1000      129      960     1100   
                                          VAR    BASINP    GEOM    SYMINP    ZMAT    AOBASIS   BASIS     P2S    ABASIS      S 
                                         1400     1410     1420     1200     1210     1080     1600     1650     1300     1700   
                                         EKIN       V       ECP      H0       H01     AOSYM     SMH    MOLCAS    ERIS     OPER   

              2       5        5.69       700     1000      520     2100     2200   
                                         GEOM     BASIS   MCVARS     RHF      UHF  

 PROGRAMS   *        TOTAL      MRCC       UHF        HF       INT
 CPU TIMES  *     32407.73  32399.99      0.04      0.53      7.07
 REAL TIME  *     33613.82 SEC
 DISK USED  *       304.69 MB      
 **********************************************************************************************************************************
 SETTING POSTHF(I)      =        -9.80156705  AU                              
                                                                                                                                                                                                                                                                

       SCF           POSTHF       EKIN          POT
    -9.66837636   -9.80156705   6.75187214   -4.74877169
                                                  

 CCSDT(Q)/USERDEF energy=     -9.801567046998

        CCSDT(Q)        HF-SCF  
     -9.80156705     -9.66837636
 **********************************************************************************************************************************
 Variable memory released
