
 Primary working directories    : /global/cscratch1/sd/aannabe
 Secondary working directories  : /global/cscratch1/sd/aannabe
 Wavefunction directory         : /global/homes/a/aannabe/wfu/
 Main file repository           : /global/cscratch1/sd/aannabe/

 SHA1      : 2873118e99aab1bc19f5b6fc1784693c06d15c95
 NAME      : 2015.1.8
 ARCHNAME  : linux/x86_64
 FC        : /opt/cray/pe/craype/2.5.5/bin/ftn
 BLASLIB   : -Wl,-_start-group /opt/intel/compilers_and_libraries_2016.3.210/linux/mkl/lib/intel64/libmkl_intel_ilp64.a /opt/intel/compilers_and_libraries_2016.3.210/linux/mkl/lib/intel64/libmkl_intel_thread.a /opt/intel/compilers_and_libraries_2016.3.210/linux/mkl/lib/intel64/libmkl_core.a -Wl,-_end-group
 id        : lbl

 Nodes     nprocs
 nid00506     1

 Using customized tuning parameters: mindgm=8; mindgv=16; mindgc=4; mindgr=1; noblas=0; minvec=7
 default implementation of scratch files=df  

 ***,C
 memory,8,g
 gthresh,twoint=1.e-12
 
 gprint,basis,orbitals
 gexpec,ekin,pot
 
 angstrom
 geometry={
 1                                                                               ! Number of atoms
 C 0.0 0.0 0.0
 }
 
 basis={
 Including file /global/homes/a/aannabe/docs/totals/pps/C.pp
 Including file /global/homes/a/aannabe/docs/totals/basis/aug-cc-pVnZ/C_qz.basis
 }
 
 {hf
 wf,4,6,2
 occ,1,1,0,0,1,0,0,0
                                                                                 !open,1.2,1.5
 closed,1,0,0,0,0,0,0,0
                                                                                 !sym,
 }
 scf(i)=energy
 
 _CC_NORM_MAX=2.0
  !NOTE: Perturbative MRCC works only with UHF reference. So, here we will trick MRCC by doing zero UHF iteration right after ROHF.
 
 {uhf
 wf,4,6,2
 occ,1,1,0,0,1,0,0,0
                                                                                 !open,1.2,1.5
 closed,1,0,0,0,0,0,0,0
                                                                                 !sym,
 maxit,0
 }
 scf(i)=energy
 
 {mrcc,method=CCSDT(Q)
 orbital,ignore_error=1                                                          !Ignore the fact that UHF WF is not converged
 maxit,100
 core
 }
 posthf(i)=energy
 
 table,scf,posthf,ekin,pot
 save,4.csv,new
 
 

 Variables initialized (889), CPU time= 0.00 sec
 Commands  initialized (702), CPU time= 0.00 sec, 572 directives.
 Default parameters read. Elapsed time= 0.12 sec

 Checking input...
 Passed
1


                                         ***  PROGRAM SYSTEM MOLPRO  ***
                                       Copyright, TTI GmbH Stuttgart, 2015
                                    Version 2015.1 linked Sep  7 2016 23:09:38


 **********************************************************************************************************************************
 LABEL *   C                                                                             
  64 bit serial version                                                                  DATE: 15-Jun-18          TIME: 16:18:31  
 **********************************************************************************************************************************

 SHA1:             2873118e99aab1bc19f5b6fc1784693c06d15c95
 **********************************************************************************************************************************

 THRESHOLDS:

 ZERO    =  1.00D-12  ONEINT  =  1.00D-12  TWOINT  =  1.00D-12  PREFAC  =  1.00D-14  LOCALI  =  1.00D-09  EORDER  =  1.00D-04
 ENERGY  =  0.00D+00  ETEST   =  0.00D+00  EDENS   =  0.00D+00  THRDEDEF=  1.00D-06  GRADIENT=  1.00D-02  STEP    =  1.00D-03
 ORBITAL =  1.00D-05  CIVEC   =  1.00D-05  COEFF   =  1.00D-04  PRINTCI =  5.00D-02  PUNCHCI =  9.90D+01  OPTGRAD =  3.00D-04
 OPTENERG=  1.00D-06  OPTSTEP =  3.00D-04  THRGRAD =  1.00D-10  COMPRESS=  1.00D-11  VARMIN  =  1.00D-07  VARMAX  =  1.00D-03
 THRDOUB =  0.00D+00  THRDIV  =  1.00D-05  THRRED  =  1.00D-07  THRPSP  =  1.00D+00  THRDC   =  1.00D-10  THRCS   =  1.00D-10
 THRNRM  =  1.00D-08  THREQ   =  0.00D+00  THRDE   =  1.00D+00  THRREF  =  1.00D-05  SPARFAC =  1.00D+00  THRDLP  =  1.00D-07
 THRDIA  =  1.00D-10  THRDLS  =  1.00D-07  THRGPS  =  0.00D+00  THRKEX  =  0.00D+00  THRDIS  =  2.00D-01  THRVAR  =  1.00D-10
 THRLOC  =  1.00D-06  THRGAP  =  1.00D-06  THRLOCT = -1.00D+00  THRGAPT = -1.00D+00  THRORB  =  1.00D-06  THRMLTP =  0.00D+00
 THRCPQCI=  1.00D-10  KEXTA   =  0.00D+00  THRCOARS=  0.00D+00  SYMTOL  =  1.00D-06  GRADTOL =  1.00D-06  THROVL  =  1.00D-08
 THRORTH =  1.00D-08  GRID    =  1.00D-06  GRIDMAX =  1.00D-03  DTMAX   =  0.00D+00  THROCCDE=  1.00D-01  THROCCDE=  1.00D-01



 ZUNIT=ANG
 

Geometry recognized as XYZ


 Variable memory set to 8000000000 words,  buffer space   230000 words

 SETTING BASIS          =    USERDEF


 Recomputing integrals since basis changed


 Using spherical harmonics



 PROGRAM * SEWARD (Integral evaluation for generally contracted gaussian basis sets)     Author: Roland Lindh, 1990

 Geometry written to block  1 of record 700

 Orientation using atomic masses  
 Molecule type: Atom
 Symmetry elements: X,Y,Z
 Rotational constants:       0.0000000      0.0000000      0.0000000 GHz  (calculated with average atomic masses)

 Point group  D2h 



 ATOMIC COORDINATES

 NR  ATOM    CHARGE       X              Y              Z

   1  C       4.00    0.000000000    0.000000000    0.000000000


          C   CORE POTENTIAL

          p POTENTIAL

 POWERS             1              3              2
 EXPONENTIALS   14.43502       8.398890       7.381880    
 COEFFICIENTS   4.000000       57.74008      -25.81955    

          s - p POTENTIAL

 POWERS             2
 EXPONENTIALS   7.760790    
 COEFFICIENTS   52.13345    


 BASIS DATA

   Nr Sym  Nuc  Type         Exponents   Contraction coefficients

    1.1 Ag    1  1s          13.073594     0.005158
                              6.541187     0.060342
                              4.573411    -0.197847
                              1.637494    -0.081034
                              0.819297     0.232173
                              0.409924     0.291464
                              0.231300     0.433640
                              0.102619     0.213194
                              0.051344     0.004985
    2.1 Ag    1  1s           0.846879     1.000000
    3.1 Ag    1  1s           0.269659     1.000000
    4.1 Ag    1  1s           0.109576     1.000000
    5.1 Ag    1  1s           0.043830     1.000000
    6.1 Ag    1  3d0          2.013760     1.000000
    7.1 Ag    1  3d2+         2.013760     1.000000
    8.1 Ag    1  3d0          0.684884     1.000000
    9.1 Ag    1  3d2+         0.684884     1.000000
   10.1 Ag    1  3d0          0.240171     1.000000
   11.1 Ag    1  3d2+         0.240171     1.000000
   12.1 Ag    1  3d0          0.096069     1.000000
   13.1 Ag    1  3d2+         0.096069     1.000000
   14.1 Ag    1  5g0          1.034180     1.000000
   15.1 Ag    1  5g4+         1.034180     1.000000
   16.1 Ag    1  5g2+         1.034180     1.000000
   17.1 Ag    1  5g0          0.413672     1.000000
   18.1 Ag    1  5g4+         0.413672     1.000000
   19.1 Ag    1  5g2+         0.413672     1.000000
    1.2 B3u   1  2px          9.934169     0.020908
                              3.886955     0.057270
                              1.871016     0.112268
                              0.935757     0.213008
                              0.468003     0.283581
                              0.239473     0.301121
                              0.117063     0.201693
                              0.058547     0.045358
                              0.029281     0.002978
    2.2 B3u   1  2px          0.804681     1.000000
    3.2 B3u   1  2px          0.313254     1.000000
    4.2 B3u   1  2px          0.105389     1.000000
    5.2 B3u   1  2px          0.042156     1.000000
    6.2 B3u   1  4f1+         0.457302     1.000000
    7.2 B3u   1  4f3+         0.457302     1.000000
    8.2 B3u   1  4f1+         1.324930     1.000000
    9.2 B3u   1  4f3+         1.324930     1.000000
   10.2 B3u   1  4f1+         0.529972     1.000000
   11.2 B3u   1  4f3+         0.529972     1.000000
    1.3 B2u   1  2py          9.934169     0.020908
                              3.886955     0.057270
                              1.871016     0.112268
                              0.935757     0.213008
                              0.468003     0.283581
                              0.239473     0.301121
                              0.117063     0.201693
                              0.058547     0.045358
                              0.029281     0.002978
    2.3 B2u   1  2py          0.804681     1.000000
    3.3 B2u   1  2py          0.313254     1.000000
    4.3 B2u   1  2py          0.105389     1.000000
    5.3 B2u   1  2py          0.042156     1.000000
    6.3 B2u   1  4f1-         0.457302     1.000000
    7.3 B2u   1  4f3-         0.457302     1.000000
    8.3 B2u   1  4f1-         1.324930     1.000000
    9.3 B2u   1  4f3-         1.324930     1.000000
   10.3 B2u   1  4f1-         0.529972     1.000000
   11.3 B2u   1  4f3-         0.529972     1.000000
    1.4 B1g   1  3d2-         2.013760     1.000000
    2.4 B1g   1  3d2-         0.684884     1.000000
    3.4 B1g   1  3d2-         0.240171     1.000000
    4.4 B1g   1  3d2-         0.096069     1.000000
    5.4 B1g   1  5g2-         1.034180     1.000000
    6.4 B1g   1  5g4-         1.034180     1.000000
    7.4 B1g   1  5g2-         0.413672     1.000000
    8.4 B1g   1  5g4-         0.413672     1.000000
    1.5 B1u   1  2pz          9.934169     0.020908
                              3.886955     0.057270
                              1.871016     0.112268
                              0.935757     0.213008
                              0.468003     0.283581
                              0.239473     0.301121
                              0.117063     0.201693
                              0.058547     0.045358
                              0.029281     0.002978
    2.5 B1u   1  2pz          0.804681     1.000000
    3.5 B1u   1  2pz          0.313254     1.000000
    4.5 B1u   1  2pz          0.105389     1.000000
    5.5 B1u   1  2pz          0.042156     1.000000
    6.5 B1u   1  4f0          0.457302     1.000000
    7.5 B1u   1  4f2+         0.457302     1.000000
    8.5 B1u   1  4f0          1.324930     1.000000
    9.5 B1u   1  4f2+         1.324930     1.000000
   10.5 B1u   1  4f0          0.529972     1.000000
   11.5 B1u   1  4f2+         0.529972     1.000000
    1.6 B2g   1  3d1+         2.013760     1.000000
    2.6 B2g   1  3d1+         0.684884     1.000000
    3.6 B2g   1  3d1+         0.240171     1.000000
    4.6 B2g   1  3d1+         0.096069     1.000000
    5.6 B2g   1  5g1+         1.034180     1.000000
    6.6 B2g   1  5g3+         1.034180     1.000000
    7.6 B2g   1  5g1+         0.413672     1.000000
    8.6 B2g   1  5g3+         0.413672     1.000000
    1.7 B3g   1  3d1-         2.013760     1.000000
    2.7 B3g   1  3d1-         0.684884     1.000000
    3.7 B3g   1  3d1-         0.240171     1.000000
    4.7 B3g   1  3d1-         0.096069     1.000000
    5.7 B3g   1  5g1-         1.034180     1.000000
    6.7 B3g   1  5g3-         1.034180     1.000000
    7.7 B3g   1  5g1-         0.413672     1.000000
    8.7 B3g   1  5g3-         0.413672     1.000000
    1.8 Au    1  4f2-         0.457302     1.000000
    2.8 Au    1  4f2-         1.324930     1.000000
    3.8 Au    1  4f2-         0.529972     1.000000

 NUCLEAR CHARGE:                    4
 NUMBER OF PRIMITIVE AOS:         136
 NUMBER OF SYMMETRY AOS:          111
 NUMBER OF CONTRACTIONS:           79   (  19Ag  +  11B3u +  11B2u +   8B1g +  11B1u +   8B2g +   8B3g +   3Au  )
 NUMBER OF CORE ORBITALS:           0   (   0Ag  +   0B3u +   0B2u +   0B1g +   0B1u +   0B2g +   0B3g +   0Au  )
 NUMBER OF VALENCE ORBITALS:        4   (   1Ag  +   1B3u +   1B2u +   0B1g +   1B1u +   0B2g +   0B3g +   0Au  )


 NUCLEAR REPULSION ENERGY    0.00000000

 EXTRA SYMMETRY OF AOS IN SYMMETRY 1:   1 1 1 1 1 2 3 2 3 2   3 2 3 4 5 6 4 5 6
 EXTRA SYMMETRY OF AOS IN SYMMETRY 2:   1 1 1 1 1 2 3 2 3 2   3
 EXTRA SYMMETRY OF AOS IN SYMMETRY 3:   1 1 1 1 1 2 3 2 3 2   3
 EXTRA SYMMETRY OF AOS IN SYMMETRY 4:   1 1 1 1 2 3 2 3
 EXTRA SYMMETRY OF AOS IN SYMMETRY 5:   1 1 1 1 1 2 3 2 3 2   3
 EXTRA SYMMETRY OF AOS IN SYMMETRY 6:   1 1 1 1 2 3 2 3
 EXTRA SYMMETRY OF AOS IN SYMMETRY 7:   1 1 1 1 2 3 2 3

 Eigenvalues of metric

         1 0.644E-02 0.264E-01 0.120E+00 0.120E+00 0.204E+00 0.428E+00 0.428E+00 0.428E+00
         2 0.596E-02 0.596E-02 0.916E-02 0.639E-01 0.274E+00 0.532E+00 0.532E+00 0.119E+01
         3 0.596E-02 0.596E-02 0.916E-02 0.639E-01 0.274E+00 0.532E+00 0.532E+00 0.119E+01
         4 0.120E+00 0.428E+00 0.428E+00 0.428E+00 0.120E+01 0.157E+01 0.157E+01 0.226E+01
         5 0.596E-02 0.596E-02 0.916E-02 0.639E-01 0.274E+00 0.532E+00 0.532E+00 0.119E+01
         6 0.120E+00 0.428E+00 0.428E+00 0.428E+00 0.120E+01 0.157E+01 0.157E+01 0.226E+01
         7 0.120E+00 0.428E+00 0.428E+00 0.428E+00 0.120E+01 0.157E+01 0.157E+01 0.226E+01
         8 0.596E-02 0.532E+00 0.246E+01


 Contracted 2-electron integrals neglected if value below      1.0D-12
 AO integral compression algorithm  1   Integral accuracy      1.0D-12

     6.816 MB (compressed) written to integral file ( 70.2%)


 NUMBER OF SORTED TWO-ELECTRON INTEGRALS:     665704.     BUFFER LENGTH:  32768
 NUMBER OF SEGMENTS:   1  SEGMENT LENGTH:     665704      RECORD LENGTH: 524288

 Memory used in sort:       1.22 MW

 SORT1 READ     1222209. AND WROTE      500866. INTEGRALS IN      2 RECORDS. CPU TIME:     0.03 SEC, REAL TIME:     0.05 SEC
 SORT2 READ      500866. AND WROTE      665704. INTEGRALS IN     26 RECORDS. CPU TIME:     0.05 SEC, REAL TIME:     0.09 SEC

 FILE SIZES:   FILE 1:    26.0 MBYTE,  FILE 4:     8.4 MBYTE,   TOTAL:     34.5 MBYTE

 OPERATOR DM      FOR CENTER  0  COORDINATES:    0.000000    0.000000    0.000000
 OPERATOR EKIN    FOR CENTER  0  COORDINATES:    0.000000    0.000000    0.000000
 OPERATOR POT     FOR CENTER  0  COORDINATES:    0.000000    0.000000    0.000000


 **********************************************************************************************************************************
 DATASETS  * FILE   NREC   LENGTH (MB)   RECORD NAMES
              1      20       22.86       500      610      700      900      950      970     1000      129      960     1100   
                                          VAR    BASINP    GEOM    SYMINP    ZMAT    AOBASIS   BASIS     P2S    ABASIS      S 
                                         1400     1410     1420     1200     1210     1080     1600     1650     1300     1700   
                                         EKIN       V       ECP      H0       H01     AOSYM     SMH    MOLCAS    ERIS     OPER   

 PROGRAMS   *        TOTAL       INT
 CPU TIMES  *         2.25      2.16
 REAL TIME  *        11.61 SEC
 DISK USED  *        34.75 MB      
 **********************************************************************************************************************************


 PROGRAM * RHF-SCF (OPEN SHELL)       Authors: W. Meyer, H.-J. Werner


 NUMBER OF ELECTRONS:       3+    1-    SPACE SYMMETRY=6    SPIN SYMMETRY: Triplet 
 CONVERGENCE THRESHOLDS:    1.00E-05 (Density)    1.00E-07 (Energy)
 MAX. NUMBER OF ITERATIONS:       60
 INTERPOLATION TYPE:            DIIS
 INTERPOLATION STEPS:              2 (START)      1 (STEP)
 LEVEL SHIFTS:                 -0.60 (CLOSED) -0.30 (OPEN) 

 Number of closed-shell orbitals:    1 (   1   0   0   0   0   0   0   0 )
 Number of open-shell orbitals:      2 (   0   1   0   0   1   0   0   0 )



   Atom=C  basis=ECP2MWB_GUESS     lmin=0  lmax=1

 Orbital guess generated from atomic densities. Full valence occupancy:    1   1   1   0   1   0   0   0


 Molecular orbital dump at record        2100.2

 ITERATION    DDIFF          GRAD             ENERGY        2-EL.EN.            DIPOLE MOMENTS         DIIS   ORB.
    1      0.000D+00      0.000D+00        -5.27582306      5.489583    0.00000    0.00000    0.00000    0    start
    2      0.000D+00      0.178D-01        -5.30877715      5.869693    0.00000    0.00000    0.00000    1    diag,B
    3      0.185D-01      0.494D-02        -5.31350705      6.008866    0.00000    0.00000    0.00000    2    diag,B
    4      0.498D-02      0.186D-02        -5.31427912      6.053368    0.00000    0.00000    0.00000    3    diag,B
    5      0.296D-02      0.426D-03        -5.31431531      6.056984    0.00000    0.00000    0.00000    4    diag,B
    6      0.917D-03      0.117D-03        -5.31431797      6.058304    0.00000    0.00000    0.00000    5    diag,B
    7      0.313D-03      0.192D-04        -5.31431801      6.058188    0.00000    0.00000    0.00000    6    fixocc
    8      0.193D-04      0.708D-05        -5.31431802      6.058222    0.00000    0.00000    0.00000    7    diag,B
    9      0.174D-04      0.812D-06        -5.31431802      6.058219    0.00000    0.00000    0.00000    8    diag,B
   10      0.151D-05      0.238D-06        -5.31431802      6.058218    0.00000    0.00000    0.00000    0    orth

 Final alpha occupancy:   1   1   0   0   1   0   0   0
 Final beta  occupancy:   1   0   0   0   0   0   0   0

 !RHF STATE 1.6 Energy                 -5.314318019576
 Nuclear energy                         0.00000000
 One-electron energy                   -8.34342718
 Two-electron energy                    3.02910916
 Virial quotient                       -1.54728424
 !RHF STATE 1.6 Dipole moment           0.00000000     0.00000000     0.00000000
 Dipole moment /Debye                   0.00000000     0.00000000     0.00000000
 

 !RHF expec          <1.6|EKIN|1.6>     3.434610061785
 
 !RHF expec           <1.6|POT|1.6>    -3.072624069097

 ELECTRON ORBITALS
 =================


   Orb  Occ    Energy  Couls-En    Coefficients

                                   1 1s      1 1s      1 1s      1 1s      1 1s      1 3d0     1 3d2+    1 3d0     1 3d2+    1 3d0  
                                   1 3d2+    1 3d0     1 3d2+    1 5g0     1 5g4+    1 5g2+    1 5g0     1 5g4+    1 5g2+ 

   1.1   2    -0.7072   -2.9683  1.000047  0.000011  0.000059 -0.000244  0.000138  0.000571  0.000988 -0.000009 -0.000016  0.001866
                                 0.003232  0.001101  0.001906 -0.000002 -0.000004 -0.000003 -0.000013 -0.000026 -0.000020

                                   1 2px     1 2px     1 2px     1 2px     1 2px     1 4f1+    1 4f3+    1 4f1+    1 4f3+    1 4f1+ 
                                   1 4f3+ 

   1.2   +    -0.4354   -2.3460  0.999983 -0.000010 -0.000027  0.000049  0.000037  0.000035  0.000135 -0.000003 -0.000013 -0.000044
                                -0.000170

                                   1 2pz     1 2pz     1 2pz     1 2pz     1 2pz     1 4f0     1 4f2+    1 4f0     1 4f2+    1 4f0  
                                   1 4f2+ 

   1.5   +    -0.4354   -2.3460  0.999983 -0.000010 -0.000027  0.000049  0.000037  0.000085  0.000110 -0.000008 -0.000011 -0.000107
                                -0.000139

 HOMO      1.2    -0.435362 =     -11.8468eV
 LUMO      1.3     0.012010 =       0.3268eV
 LUMO-HOMO         0.447372 =      12.1736eV


 **********************************************************************************************************************************
 DATASETS  * FILE   NREC   LENGTH (MB)   RECORD NAMES
              1      20       22.86       500      610      700      900      950      970     1000      129      960     1100   
                                          VAR    BASINP    GEOM    SYMINP    ZMAT    AOBASIS   BASIS     P2S    ABASIS      S 
                                         1400     1410     1420     1200     1210     1080     1600     1650     1300     1700   
                                         EKIN       V       ECP      H0       H01     AOSYM     SMH    MOLCAS    ERIS     OPER   

              2       4        2.78       700     1000      520     2100   
                                         GEOM     BASIS   MCVARS     RHF  

 PROGRAMS   *        TOTAL        HF       INT
 CPU TIMES  *         2.33      0.09      2.16
 REAL TIME  *        11.89 SEC
 DISK USED  *        34.75 MB      
 **********************************************************************************************************************************
 SETTING SCF(I)         =        -5.31431802  AU                              
 SETTING _CC_NORM_MAX   =         2.00000000                                  


 PROGRAM * UHF-SCF       Authors: W. Meyer, H.-J. Werner


 NUMBER OF ELECTRONS:       3+    1-    SPACE SYMMETRY=6    SPIN SYMMETRY: Triplet 
 CONVERGENCE THRESHOLDS:    1.00E-05 (Density)    1.00E-07 (Energy)
 MAX. NUMBER OF ITERATIONS:        0
 INTERPOLATION TYPE:            DIIS
 INTERPOLATION STEPS:              2 (START)      1 (STEP)
 LEVEL SHIFTS:                  0.20 (ALPHA)   0.20 (BETA) 

 Number of closed-shell orbitals:    1 (   1   0   0   0   0   0   0   0 )
 Number of open-shell orbitals:      2 (   0   1   0   0   1   0   0   0 )


 Molecular orbitals read from record     2100.2  Type=RHF/CANONICAL (state 1.6)

 Molecular orbital dump at record        2200.2

 Initial alpha occupation   1   1   0   0   1   0   0   0
 Initial beta  occupation   1   0   0   0   0   0   0   0

 ITERATION    DDIFF          GRAD             ENERGY        2-EL.EN.            DIPOLE MOMENTS         DIIS
    1      0.000D+00      0.000D+00        -5.31431802      6.058218    0.00000    0.00000    0.00000    0
 
 Final alpha occupancy:   1   1   0   0   1   0   0   0
 Final beta  occupancy:   1   0   0   0   0   0   0   0

 !UHF STATE 1.6 Energy                 -5.314318019576
 Nuclear energy                         0.00000000
 One-electron energy                   -8.34342718
 Two-electron energy                    3.02910916
 Virial quotient                       -1.54728424
 !UHF STATE 1.6 Dipole moment           0.00000000     0.00000000     0.00000000
 Dipole moment /Debye                   0.00000000     0.00000000     0.00000000
 

 !UHF expec          <1.6|EKIN|1.6>     3.434610061785
 
 !UHF expec           <1.6|POT|1.6>    -3.072624069097

 ELECTRON ORBITALS FOR POSITIVE SPIN
 ===================================


   Orb  Occ    Energy  Couls-En    Coefficients

                                   1 1s      1 1s      1 1s      1 1s      1 1s      1 3d0     1 3d2+    1 3d0     1 3d2+    1 3d0  
                                   1 3d2+    1 3d0     1 3d2+    1 5g0     1 5g4+    1 5g2+    1 5g0     1 5g4+    1 5g2+ 

   1.1   +    -0.7072   -2.9683  1.000047  0.000011  0.000059 -0.000244  0.000138  0.000571  0.000988 -0.000009 -0.000016  0.001866
                                 0.003232  0.001101  0.001906 -0.000002 -0.000004 -0.000003 -0.000013 -0.000026 -0.000020

                                   1 2px     1 2px     1 2px     1 2px     1 2px     1 4f1+    1 4f3+    1 4f1+    1 4f3+    1 4f1+ 
                                   1 4f3+ 

   1.2   +    -0.4354   -2.3460  0.999983 -0.000010 -0.000027  0.000049  0.000037  0.000035  0.000135 -0.000003 -0.000013 -0.000044
                                -0.000170

                                   1 2pz     1 2pz     1 2pz     1 2pz     1 2pz     1 4f0     1 4f2+    1 4f0     1 4f2+    1 4f0  
                                   1 4f2+ 

   1.5   +    -0.4354   -2.3460  0.999983 -0.000010 -0.000027  0.000049  0.000037  0.000085  0.000110 -0.000008 -0.000011 -0.000107
                                -0.000139

 ELECTRON ORBITALS FOR NEGATIVE SPIN
 ===================================


   Orb  Occ    Energy  Couls-En    Coefficients

                                   1 1s      1 1s      1 1s      1 1s      1 1s      1 3d0     1 3d2+    1 3d0     1 3d2+    1 3d0  
                                   1 3d2+    1 3d0     1 3d2+    1 5g0     1 5g4+    1 5g2+    1 5g0     1 5g4+    1 5g2+ 

   1.1   -    -0.7072   -2.9683  1.000047  0.000011  0.000059 -0.000244  0.000138  0.000571  0.000988 -0.000009 -0.000016  0.001866
                                 0.003232  0.001101  0.001906 -0.000002 -0.000004 -0.000003 -0.000013 -0.000026 -0.000020

 HOMO      1.2    -0.435362 =     -11.8468eV
 LUMO     -1.2    -0.435362 =     -11.8468eV
 LUMO-HOMO         0.000000 =       0.0000eV

 EXPECTATION VALUE OF S**2:             2.00000000

 Occupation number threshold for canonical orbitals:  1.999000 (occupied),  0.001000 (virtual)

 Number of pseudo-canonical orbitals per symmetry:    1   0   0   0   0   0   0   0
 Number of active natural orbitals per symmetry:      0   1   0   0   1   0   0   0

 NATURAL CHARGE ORBITALS
 =======================


   Orb     Occ        Energy       Coefficients

                                   1 1s      1 1s      1 1s      1 1s      1 1s      1 3d0     1 3d2+    1 3d0     1 3d2+    1 3d0  
                                   1 3d2+    1 3d0     1 3d2+    1 5g0     1 5g4+    1 5g2+    1 5g0     1 5g4+    1 5g2+ 

   1.1  2.00000    -0.707242     1.000047  0.000011  0.000059 -0.000244  0.000138  0.000571  0.000988 -0.000009 -0.000016  0.001866
                                 0.003232  0.001101  0.001906 -0.000002 -0.000004 -0.000003 -0.000013 -0.000026 -0.000020

                                   1 2px     1 2px     1 2px     1 2px     1 2px     1 4f1+    1 4f3+    1 4f1+    1 4f3+    1 4f1+ 
                                   1 4f3+ 

   1.2  1.00000    -0.131824     0.999983 -0.000010 -0.000027  0.000049  0.000037  0.000035  0.000135 -0.000003 -0.000013 -0.000044
                                -0.000170

                                   1 2pz     1 2pz     1 2pz     1 2pz     1 2pz     1 4f0     1 4f2+    1 4f0     1 4f2+    1 4f0  
                                   1 4f2+ 

   1.5  1.00000    -0.131824     0.999983 -0.000010 -0.000027  0.000049  0.000037  0.000085  0.000110 -0.000008 -0.000011 -0.000107
                                -0.000139

 Natural orbitals saved to record    2200.2 (Orbital set 3)

 Orbital spaces for UNO-CAS (Min. occupation: 0.020  Max. occupation: 1.980):

 Closed:        1   0   0   0   0   0   0   0
 Active:        0   1   0   0   1   0   0   0

 No convergence



 **********************************************************************************************************************************
 DATASETS  * FILE   NREC   LENGTH (MB)   RECORD NAMES
              1      20       22.86       500      610      700      900      950      970     1000      129      960     1100   
                                          VAR    BASINP    GEOM    SYMINP    ZMAT    AOBASIS   BASIS     P2S    ABASIS      S 
                                         1400     1410     1420     1200     1210     1080     1600     1650     1300     1700   
                                         EKIN       V       ECP      H0       H01     AOSYM     SMH    MOLCAS    ERIS     OPER   

              2       5        5.33       700     1000      520     2100     2200   
                                         GEOM     BASIS   MCVARS     RHF      UHF  

 PROGRAMS   *        TOTAL       UHF        HF       INT
 CPU TIMES  *         2.34      0.01      0.09      2.16
 REAL TIME  *        12.00 SEC
 DISK USED  *        34.75 MB      
 **********************************************************************************************************************************
 SETTING SCF(I)         =        -5.31431802  AU                              


 PROGRAM * MRCC (General Multireference Coupled Cluster)    Author: M. Kallay, 2000-2005

 ***  Initialisation ***

   0 Spin projections
 
 Molecular orbitals read from record     2200.2  Type=UHF/ALPHA (state 1.6)

 ?Warning: UHF not converged
 Molecular orbitals read from record     2200.2  Type=UHF/BETA (state 1.6)

 ?Warning: UHF not converged
 
 Frozen orbitals:              0 (  0  0  0  0  0  0  0  0)
 Active orbitals:             79 ( 19 11 11  8 11  8  8  3)
 Active electrons:             4
 Spin quantum number:          1.0

 Transformed integrals will be written to file mrcc_37518/fort.55

 Load integrals                2.4 sec
 Transform integrals           2.7 sec
 Storage for integrals:        3835052
 Remaining memory:           *********

 Core energy:               0.00000000
 
 MRCC Input:
     4     0     0     0     3     0     0     6     0     0     0     1     1     0     0     7     0     0   0.000     0   64000
  ex.lev,nsing,ntrip, rest,method,dens,conver,symm, diag, CS ,spatial, HF, ndoub,nacto,nactv, tol, maxex, sacc, freq,  dboc,   mem
  2  0  0  0  0  0  0  0  0  0  0  0  0  0  0  0  0  0  0  1  0  0  0  0  0  0  0  0  0  0  0  0  0  0  0  0  0  0  0  0  0  0  0  0  0  0  0  0  0  1  0  0  0  0  0  0  0  0  0  0  0  0  0  0  0  0  0  0  0  0  0  0  0  0  0  0  0  0  0
 MRCC Input end
 Variable memory released
 MRCC now being run, temporary output in /global/cscratch1/sd/aannabe/mrcc_37518/mrcc.out
 **********************************************************************
                          MRCC program system
 **********************************************************************

                              Written by
  Mihaly Kallay, Zoltan Rolik, Jozsef Csontos, Peter Nagy, Gyula Samu,
      David Mester, Jozsef Csoka, Bernat Szabo, Istvan Ladjanszki,
       Lorant Szegedy, Bence Ladoczki, Klara Petrov, Mate Farkas,
                    Pal D. Mezei, and Bence Hegely

        Department of Physical Chemistry and Materials Science
            Budapest University of Technology and Economics
                  Budapest P.O.Box 91, H-1521 Hungary

                              www.mrcc.hu

                       Release date: May 23, 2018

 ************************ 2018-06-15 16:19:36 *************************
 Executing goldstone...

 Generation of CC equations in terms of H and T...
 Generation of antisymmetrized Goldstone diagrams...
 Number of diagrams in T^1 equations:    15
 Number of diagrams in T^2 equations:    38
 Number of diagrams in T^3 equations:    49
 Number of diagrams in T^4 equations:     5
 Translation of diagrams to factorized equations...
 Optimizing intermediate calculation...
 Number of floating-point operations per iteration step:   7.1953E+09
 Probable CPU time per iteration step (hours):      0.07
 Required memory (Mbytes):    4588.5
 Number of intermediates:                                  80
 Number of intermediates to be stored:                     32
 Length of intermediate file (Mbytes):      77.4

 ************************ 2018-06-15 16:19:36 *************************
 Executing xmrcc...

 **********************************************************************
 CC(3)(4) calculation


 Allocation of4588.5 Mbytes of memory...
 Number of spinorbitals:                   158
 Number of alpha electrons:                        3
 Number of beta electrons:                         1
 Spin multiplicity:                     2
 z-component of spin:  1.0
 Spatial symmetry:                      6
 Convergence criterion:  1.0E-07
 Construction of occupation graphs...
 Number of                     0 -fold excitations:                      1
 Number of                     1 -fold excitations:                     56
 Number of                     2 -fold excitations:                   3491
 Number of                     3 -fold excitations:                  92140
 Total number of configurations:                  95688
 Calculation of coupling coefficients...
 Length of intermediate file (Mbytes):      58.9

 ======================================================================

 Spin case  1   Alpha:  3   Beta:  1
 Number of excitations:                 684122
 Number of                     4 -fold excitations:                 684122

 Memory requirements /Mbyte/:
               Minimal        Optimal
 Real*8:        129.4662       297.2647
 Integer:        21.7145
 Total:         151.1808       318.9792


 ************************ 2018-06-15 16:19:38 *************************
 Executing mrcc...

 **********************************************************************
 CCSDT(Q) calculation


 OpenMP parallel version is running.
 Number of CPUs:   1
 Allocation of  297.3 Mbytes of memory...
 Number of spinorbitals: 158
 Number of alpha electrons:  3
 Number of beta  electrons:  1
 Spin multiplicity: 2
 z-component of spin:  1.0
 Spatial symmetry: 6
 Convergence criterion:  1.0E-07
 Construction of occupation graphs...
 Number of 0-fold excitations: 1
 Number of 1-fold excitations: 56
 Number of 2-fold excitations: 3491
 Number of 3-fold excitations: 92140
 Total number of determinants: 95688
 Calculation of coupling coefficients...
 Initial cluster amplitudes are generated.
 Length of intermediate file (Mbytes):      58.9
 Reading integral list from unit 55...
 Sorting integrals...
 Sorting integrals...
 Sorting integrals...
 Sorting integrals...
 Energy of reference determinant [au]:      -5.314318019576
 Calculation of MP denominators...

 Starting CC iteration...
 ======================================================================
 Norm of residual vector:     0.54898082
 CPU time [min]:     0.193                   Wall time [min]:     0.195

 Iteration  1  CC energy:    -5.39496258  Energy decrease:   0.08064457
 ======================================================================
 Norm of residual vector:     0.14238653
 CPU time [min]:     0.273                   Wall time [min]:     0.275

 Iteration  2  CC energy:    -5.40870885  Energy decrease:   0.01374627
 ======================================================================
 Norm of residual vector:     0.04204922
 CPU time [min]:     0.354                   Wall time [min]:     0.356

 Iteration  3  CC energy:    -5.41516447  Energy decrease:   0.00645561
 ======================================================================
 Norm of residual vector:     0.01300806
 CPU time [min]:     0.435                   Wall time [min]:     0.437

 Iteration  4  CC energy:    -5.41551572  Energy decrease:   0.00035126
 ======================================================================
 Norm of residual vector:     0.00325621
 CPU time [min]:     0.513                   Wall time [min]:     0.515

 Iteration  5  CC energy:    -5.41563140  Energy decrease:   0.00011567
 ======================================================================
 Norm of residual vector:     0.00088301
 CPU time [min]:     0.584                   Wall time [min]:     0.586

 Iteration  6  CC energy:    -5.41562370  Energy decrease:   0.00000769
 ======================================================================
 Norm of residual vector:     0.00029860
 CPU time [min]:     0.656                   Wall time [min]:     0.658

 Iteration  7  CC energy:    -5.41561868  Energy decrease:   0.00000503
 ======================================================================
 Norm of residual vector:     0.00011267
 CPU time [min]:     0.727                   Wall time [min]:     0.729

 Iteration  8  CC energy:    -5.41562108  Energy decrease:   0.00000240
 ======================================================================
 Norm of residual vector:     0.00004019
 CPU time [min]:     0.799                   Wall time [min]:     0.801

 Iteration  9  CC energy:    -5.41562122  Energy decrease:   0.00000014
 ======================================================================
 Norm of residual vector:     0.00001457
 CPU time [min]:     0.870                   Wall time [min]:     0.872

 Iteration 10  CC energy:    -5.41562086  Energy decrease:   0.00000036
 ======================================================================
 Norm of residual vector:     0.00000503
 CPU time [min]:     0.941                   Wall time [min]:     0.943

 Iteration 11  CC energy:    -5.41562088  Energy decrease:   0.00000002
 ======================================================================
 Norm of residual vector:     0.00000160
 CPU time [min]:     1.012                   Wall time [min]:     1.014

 Iteration 12  CC energy:    -5.41562093  Energy decrease:   0.00000005
 ======================================================================
 Norm of residual vector:     0.00000046
 CPU time [min]:     1.083                   Wall time [min]:     1.085

 Iteration 13  CC energy:    -5.41562092  Energy decrease:   0.00000002
 ======================================================================
 Norm of residual vector:     0.00000014
 CPU time [min]:     1.155                   Wall time [min]:     1.157

 Iteration 14  CC energy:    -5.41562091  Energy decrease:   1.8865E-09
 ======================================================================
 Norm of residual vector:     0.00000004
 CPU time [min]:     1.224                   Wall time [min]:     1.226

 Iteration 15  CC energy:    -5.41562092  Energy decrease:   1.2956E-09
 ======================================================================

 Iteration has converged in 15 steps.

 Final results:
 Total CCSDT energy [au]:             -5.415620915427
 Total MP2 energy [au]:               -5.394962584957

 Perturbative corrections are calculated...
 ======================================================================
 Spin case  1   Alpha:  3   Beta:  1
 Number of excitations:        684122
 CPU time [min]:     4.526                   Wall time [min]:     4.531
 ======================================================================
 Number of 4-fold excitations: 684122
 CPU time [min]:     4.526                   Wall time [min]:     4.531

 Total CCSDT[Q] energy [au]:          -5.415635793537
 Total CCSDT(Q) energy [au]:          -5.415663953651

 ************************ 2018-06-15 16:24:10 *************************
                      Normal termination of mrcc.
 **********************************************************************
 !CCSDT STATE 1.6 Energy               -5.415620915427
 !MP2 STATE 1.6 Energy                 -5.394962584957
 !CCSDT[Q] STATE 1.6 Energy            -5.415635793537
 !CCSDT(Q) STATE 1.6 Energy            -5.415663953651
 
 CPU-time for MRCC:            271.6 sec
 Elapsed-time for MRCC:        275.6 sec

 Variable memory set to 8000000000 words,  buffer space   230000 words



 **********************************************************************************************************************************
 DATASETS  * FILE   NREC   LENGTH (MB)   RECORD NAMES
              1      20       22.86       500      610      700      900      950      970     1000      129      960     1100   
                                          VAR    BASINP    GEOM    SYMINP    ZMAT    AOBASIS   BASIS     P2S    ABASIS      S 
                                         1400     1410     1420     1200     1210     1080     1600     1650     1300     1700   
                                         EKIN       V       ECP      H0       H01     AOSYM     SMH    MOLCAS    ERIS     OPER   

              2       5        5.33       700     1000      520     2100     2200   
                                         GEOM     BASIS   MCVARS     RHF      UHF  

 PROGRAMS   *        TOTAL      MRCC       UHF        HF       INT
 CPU TIMES  *       283.52    281.18      0.01      0.09      2.16
 REAL TIME  *       338.94 SEC
 DISK USED  *        34.75 MB      
 **********************************************************************************************************************************
 SETTING POSTHF(I)      =        -5.41566395  AU                              
                                                                                                                                                                                                                                                                

       SCF           POSTHF       EKIN          POT
    -5.31431802   -5.41566395   3.43461006   -3.07262407
                                                  

 CCSDT(Q)/USERDEF energy=     -5.415663953651

        CCSDT(Q)        HF-SCF  
     -5.41566395     -5.31431802
 **********************************************************************************************************************************
 Variable memory released
