
 Primary working directories    : /global/cscratch1/sd/aannabe
 Secondary working directories  : /global/cscratch1/sd/aannabe
 Wavefunction directory         : /global/homes/a/aannabe/wfu/
 Main file repository           : /global/cscratch1/sd/aannabe/

 SHA1      : 2873118e99aab1bc19f5b6fc1784693c06d15c95
 NAME      : 2015.1.8
 ARCHNAME  : linux/x86_64
 FC        : /opt/cray/pe/craype/2.5.5/bin/ftn
 BLASLIB   : -Wl,-_start-group /opt/intel/compilers_and_libraries_2016.3.210/linux/mkl/lib/intel64/libmkl_intel_ilp64.a /opt/intel/compilers_and_libraries_2016.3.210/linux/mkl/lib/intel64/libmkl_intel_thread.a /opt/intel/compilers_and_libraries_2016.3.210/linux/mkl/lib/intel64/libmkl_core.a -Wl,-_end-group
 id        : lbl

 Nodes     nprocs
 nid00506     1

 Using customized tuning parameters: mindgm=8; mindgv=16; mindgc=4; mindgr=1; noblas=0; minvec=7
 default implementation of scratch files=df  

 ***,C
 memory,8,g
 gthresh,twoint=1.e-12
 
 gprint,basis,orbitals
 gexpec,ekin,pot
 
 angstrom
 geometry={
 1                                                                               ! Number of atoms
 C 0.0 0.0 0.0
 }
 
 basis={
 Including file /global/homes/a/aannabe/docs/totals/pps/C.pp
 Including file /global/homes/a/aannabe/docs/totals/basis/aug-cc-pVnZ/C_5z.basis
 }
 
 {hf
 wf,4,6,2
 occ,1,1,0,0,1,0,0,0
                                                                                 !open,1.2,1.5
 closed,1,0,0,0,0,0,0,0
                                                                                 !sym,
 }
 scf(i)=energy
 
 _CC_NORM_MAX=2.0
  !NOTE: Perturbative MRCC works only with UHF reference. So, here we will trick MRCC by doing zero UHF iteration right after ROHF.
 
 {uhf
 wf,4,6,2
 occ,1,1,0,0,1,0,0,0
                                                                                 !open,1.2,1.5
 closed,1,0,0,0,0,0,0,0
                                                                                 !sym,
 maxit,0
 }
 scf(i)=energy
 
 {mrcc,method=CCSDT(Q)
 orbital,ignore_error=1                                                          !Ignore the fact that UHF WF is not converged
 maxit,100
 core
 }
 posthf(i)=energy
 
 table,scf,posthf,ekin,pot
 save,5.csv,new
 
 

 Variables initialized (889), CPU time= 0.00 sec
 Commands  initialized (702), CPU time= 0.01 sec, 572 directives.
 Default parameters read. Elapsed time= 0.12 sec

 Checking input...
 Passed
1


                                         ***  PROGRAM SYSTEM MOLPRO  ***
                                       Copyright, TTI GmbH Stuttgart, 2015
                                    Version 2015.1 linked Sep  7 2016 23:09:38


 **********************************************************************************************************************************
 LABEL *   C                                                                             
  64 bit serial version                                                                  DATE: 15-Jun-18          TIME: 16:24:14  
 **********************************************************************************************************************************

 SHA1:             2873118e99aab1bc19f5b6fc1784693c06d15c95
 **********************************************************************************************************************************

 THRESHOLDS:

 ZERO    =  1.00D-12  ONEINT  =  1.00D-12  TWOINT  =  1.00D-12  PREFAC  =  1.00D-14  LOCALI  =  1.00D-09  EORDER  =  1.00D-04
 ENERGY  =  0.00D+00  ETEST   =  0.00D+00  EDENS   =  0.00D+00  THRDEDEF=  1.00D-06  GRADIENT=  1.00D-02  STEP    =  1.00D-03
 ORBITAL =  1.00D-05  CIVEC   =  1.00D-05  COEFF   =  1.00D-04  PRINTCI =  5.00D-02  PUNCHCI =  9.90D+01  OPTGRAD =  3.00D-04
 OPTENERG=  1.00D-06  OPTSTEP =  3.00D-04  THRGRAD =  1.00D-10  COMPRESS=  1.00D-11  VARMIN  =  1.00D-07  VARMAX  =  1.00D-03
 THRDOUB =  0.00D+00  THRDIV  =  1.00D-05  THRRED  =  1.00D-07  THRPSP  =  1.00D+00  THRDC   =  1.00D-10  THRCS   =  1.00D-10
 THRNRM  =  1.00D-08  THREQ   =  0.00D+00  THRDE   =  1.00D+00  THRREF  =  1.00D-05  SPARFAC =  1.00D+00  THRDLP  =  1.00D-07
 THRDIA  =  1.00D-10  THRDLS  =  1.00D-07  THRGPS  =  0.00D+00  THRKEX  =  0.00D+00  THRDIS  =  2.00D-01  THRVAR  =  1.00D-10
 THRLOC  =  1.00D-06  THRGAP  =  1.00D-06  THRLOCT = -1.00D+00  THRGAPT = -1.00D+00  THRORB  =  1.00D-06  THRMLTP =  0.00D+00
 THRCPQCI=  1.00D-10  KEXTA   =  0.00D+00  THRCOARS=  0.00D+00  SYMTOL  =  1.00D-06  GRADTOL =  1.00D-06  THROVL  =  1.00D-08
 THRORTH =  1.00D-08  GRID    =  1.00D-06  GRIDMAX =  1.00D-03  DTMAX   =  0.00D+00  THROCCDE=  1.00D-01  THROCCDE=  1.00D-01



 ZUNIT=ANG
 

Geometry recognized as XYZ


 Variable memory set to 8000000000 words,  buffer space   230000 words

 SETTING BASIS          =    USERDEF


 Recomputing integrals since basis changed


 Using spherical harmonics



 PROGRAM * SEWARD (Integral evaluation for generally contracted gaussian basis sets)     Author: Roland Lindh, 1990

 Geometry written to block  1 of record 700

 Orientation using atomic masses  
 Molecule type: Atom
 Symmetry elements: X,Y,Z
 Rotational constants:       0.0000000      0.0000000      0.0000000 GHz  (calculated with average atomic masses)

 Point group  D2h 



 ATOMIC COORDINATES

 NR  ATOM    CHARGE       X              Y              Z

   1  C       4.00    0.000000000    0.000000000    0.000000000


          C   CORE POTENTIAL

          p POTENTIAL

 POWERS             1              3              2
 EXPONENTIALS   14.43502       8.398890       7.381880    
 COEFFICIENTS   4.000000       57.74008      -25.81955    

          s - p POTENTIAL

 POWERS             2
 EXPONENTIALS   7.760790    
 COEFFICIENTS   52.13345    


 BASIS DATA

   Nr Sym  Nuc  Type         Exponents   Contraction coefficients

    1.1 Ag    1  1s          13.073594     0.005158
                              6.541187     0.060342
                              4.573411    -0.197847
                              1.637494    -0.081034
                              0.819297     0.232173
                              0.409924     0.291464
                              0.231300     0.433640
                              0.102619     0.213194
                              0.051344     0.004985
    2.1 Ag    1  1s           0.039321     1.000000
    3.1 Ag    1  1s           0.098302     1.000000
    4.1 Ag    1  1s           0.232034     1.000000
    5.1 Ag    1  1s           0.744448     1.000000
    6.1 Ag    1  1s           1.009914     1.000000
    7.1 Ag    1  3d0          0.082648     1.000000
    8.1 Ag    1  3d2+         0.082648     1.000000
    9.1 Ag    1  3d0          0.206619     1.000000
   10.1 Ag    1  3d2+         0.206619     1.000000
   11.1 Ag    1  3d0          0.606933     1.000000
   12.1 Ag    1  3d2+         0.606933     1.000000
   13.1 Ag    1  3d0          1.001526     1.000000
   14.1 Ag    1  3d2+         1.001526     1.000000
   15.1 Ag    1  3d0          1.504882     1.000000
   16.1 Ag    1  3d2+         1.504882     1.000000
   17.1 Ag    1  5g0          0.319059     1.000000
   18.1 Ag    1  5g4+         0.319059     1.000000
   19.1 Ag    1  5g2+         0.319059     1.000000
   20.1 Ag    1  5g0          0.797648     1.000000
   21.1 Ag    1  5g4+         0.797648     1.000000
   22.1 Ag    1  5g2+         0.797648     1.000000
   23.1 Ag    1  5g0          1.401343     1.000000
   24.1 Ag    1  5g4+         1.401343     1.000000
   25.1 Ag    1  5g2+         1.401343     1.000000
    1.2 B3u   1  2px          9.934169     0.020908
                              3.886955     0.057270
                              1.871016     0.112268
                              0.935757     0.213008
                              0.468003     0.283581
                              0.239473     0.301121
                              0.117063     0.201693
                              0.058547     0.045358
                              0.029281     0.002978
    2.2 B3u   1  2px          0.033619     1.000000
    3.2 B3u   1  2px          0.084047     1.000000
    4.2 B3u   1  2px          0.216618     1.000000
    5.2 B3u   1  2px          0.576869     1.000000
    6.2 B3u   1  2px          1.006252     1.000000
    7.2 B3u   1  4f1+         0.160229     1.000000
    8.2 B3u   1  4f3+         0.160229     1.000000
    9.2 B3u   1  4f1+         0.400573     1.000000
   10.2 B3u   1  4f3+         0.400573     1.000000
   11.2 B3u   1  4f1+         1.099564     1.000000
   12.2 B3u   1  4f3+         1.099564     1.000000
   13.2 B3u   1  4f1+         1.501091     1.000000
   14.2 B3u   1  4f3+         1.501091     1.000000
   15.2 B3u   1  6h1+         0.400681     1.000000
   16.2 B3u   1  6h3+         0.400681     1.000000
   17.2 B3u   1  6h5+         0.400681     1.000000
   18.2 B3u   1  6h1+         1.001703     1.000000
   19.2 B3u   1  6h3+         1.001703     1.000000
   20.2 B3u   1  6h5+         1.001703     1.000000
    1.3 B2u   1  2py          9.934169     0.020908
                              3.886955     0.057270
                              1.871016     0.112268
                              0.935757     0.213008
                              0.468003     0.283581
                              0.239473     0.301121
                              0.117063     0.201693
                              0.058547     0.045358
                              0.029281     0.002978
    2.3 B2u   1  2py          0.033619     1.000000
    3.3 B2u   1  2py          0.084047     1.000000
    4.3 B2u   1  2py          0.216618     1.000000
    5.3 B2u   1  2py          0.576869     1.000000
    6.3 B2u   1  2py          1.006252     1.000000
    7.3 B2u   1  4f1-         0.160229     1.000000
    8.3 B2u   1  4f3-         0.160229     1.000000
    9.3 B2u   1  4f1-         0.400573     1.000000
   10.3 B2u   1  4f3-         0.400573     1.000000
   11.3 B2u   1  4f1-         1.099564     1.000000
   12.3 B2u   1  4f3-         1.099564     1.000000
   13.3 B2u   1  4f1-         1.501091     1.000000
   14.3 B2u   1  4f3-         1.501091     1.000000
   15.3 B2u   1  6h1-         0.400681     1.000000
   16.3 B2u   1  6h3-         0.400681     1.000000
   17.3 B2u   1  6h5-         0.400681     1.000000
   18.3 B2u   1  6h1-         1.001703     1.000000
   19.3 B2u   1  6h3-         1.001703     1.000000
   20.3 B2u   1  6h5-         1.001703     1.000000
    1.4 B1g   1  3d2-         0.082648     1.000000
    2.4 B1g   1  3d2-         0.206619     1.000000
    3.4 B1g   1  3d2-         0.606933     1.000000
    4.4 B1g   1  3d2-         1.001526     1.000000
    5.4 B1g   1  3d2-         1.504882     1.000000
    6.4 B1g   1  5g2-         0.319059     1.000000
    7.4 B1g   1  5g4-         0.319059     1.000000
    8.4 B1g   1  5g2-         0.797648     1.000000
    9.4 B1g   1  5g4-         0.797648     1.000000
   10.4 B1g   1  5g2-         1.401343     1.000000
   11.4 B1g   1  5g4-         1.401343     1.000000
    1.5 B1u   1  2pz          9.934169     0.020908
                              3.886955     0.057270
                              1.871016     0.112268
                              0.935757     0.213008
                              0.468003     0.283581
                              0.239473     0.301121
                              0.117063     0.201693
                              0.058547     0.045358
                              0.029281     0.002978
    2.5 B1u   1  2pz          0.033619     1.000000
    3.5 B1u   1  2pz          0.084047     1.000000
    4.5 B1u   1  2pz          0.216618     1.000000
    5.5 B1u   1  2pz          0.576869     1.000000
    6.5 B1u   1  2pz          1.006252     1.000000
    7.5 B1u   1  4f0          0.160229     1.000000
    8.5 B1u   1  4f2+         0.160229     1.000000
    9.5 B1u   1  4f0          0.400573     1.000000
   10.5 B1u   1  4f2+         0.400573     1.000000
   11.5 B1u   1  4f0          1.099564     1.000000
   12.5 B1u   1  4f2+         1.099564     1.000000
   13.5 B1u   1  4f0          1.501091     1.000000
   14.5 B1u   1  4f2+         1.501091     1.000000
   15.5 B1u   1  6h2+         0.400681     1.000000
   16.5 B1u   1  6h4+         0.400681     1.000000
   17.5 B1u   1  6h0          0.400681     1.000000
   18.5 B1u   1  6h2+         1.001703     1.000000
   19.5 B1u   1  6h4+         1.001703     1.000000
   20.5 B1u   1  6h0          1.001703     1.000000
    1.6 B2g   1  3d1+         0.082648     1.000000
    2.6 B2g   1  3d1+         0.206619     1.000000
    3.6 B2g   1  3d1+         0.606933     1.000000
    4.6 B2g   1  3d1+         1.001526     1.000000
    5.6 B2g   1  3d1+         1.504882     1.000000
    6.6 B2g   1  5g1+         0.319059     1.000000
    7.6 B2g   1  5g3+         0.319059     1.000000
    8.6 B2g   1  5g1+         0.797648     1.000000
    9.6 B2g   1  5g3+         0.797648     1.000000
   10.6 B2g   1  5g1+         1.401343     1.000000
   11.6 B2g   1  5g3+         1.401343     1.000000
    1.7 B3g   1  3d1-         0.082648     1.000000
    2.7 B3g   1  3d1-         0.206619     1.000000
    3.7 B3g   1  3d1-         0.606933     1.000000
    4.7 B3g   1  3d1-         1.001526     1.000000
    5.7 B3g   1  3d1-         1.504882     1.000000
    6.7 B3g   1  5g1-         0.319059     1.000000
    7.7 B3g   1  5g3-         0.319059     1.000000
    8.7 B3g   1  5g1-         0.797648     1.000000
    9.7 B3g   1  5g3-         0.797648     1.000000
   10.7 B3g   1  5g1-         1.401343     1.000000
   11.7 B3g   1  5g3-         1.401343     1.000000
    1.8 Au    1  4f2-         0.160229     1.000000
    2.8 Au    1  4f2-         0.400573     1.000000
    3.8 Au    1  4f2-         1.099564     1.000000
    4.8 Au    1  4f2-         1.501091     1.000000
    5.8 Au    1  6h4-         0.400681     1.000000
    6.8 Au    1  6h2-         0.400681     1.000000
    7.8 Au    1  6h4-         1.001703     1.000000
    8.8 Au    1  6h2-         1.001703     1.000000

 NUCLEAR CHARGE:                    4
 NUMBER OF PRIMITIVE AOS:         213
 NUMBER OF SYMMETRY AOS:          158
 NUMBER OF CONTRACTIONS:          126   (  25Ag  +  20B3u +  20B2u +  11B1g +  20B1u +  11B2g +  11B3g +   8Au  )
 NUMBER OF CORE ORBITALS:           0   (   0Ag  +   0B3u +   0B2u +   0B1g +   0B1u +   0B2g +   0B3g +   0Au  )
 NUMBER OF VALENCE ORBITALS:        4   (   1Ag  +   1B3u +   1B2u +   0B1g +   1B1u +   0B2g +   0B3g +   0Au  )


 NUCLEAR REPULSION ENERGY    0.00000000

 EXTRA SYMMETRY OF AOS IN SYMMETRY 1:   1 1 1 1 1 1 2 3 2 3   2 3 2 3 2 3 4 5 6 4   5 6 4 5 6
 EXTRA SYMMETRY OF AOS IN SYMMETRY 2:   1 1 1 1 1 1 2 3 2 3   2 3 2 3 4 5 6 4 5 6
 EXTRA SYMMETRY OF AOS IN SYMMETRY 3:   1 1 1 1 1 1 2 3 2 3   2 3 2 3 4 5 6 4 5 6
 EXTRA SYMMETRY OF AOS IN SYMMETRY 4:   1 1 1 1 1 2 3 2 3 2   3
 EXTRA SYMMETRY OF AOS IN SYMMETRY 5:   1 1 1 1 1 1 2 3 2 3   2 3 2 3 4 5 6 4 5 6
 EXTRA SYMMETRY OF AOS IN SYMMETRY 6:   1 1 1 1 1 2 3 2 3 2   3
 EXTRA SYMMETRY OF AOS IN SYMMETRY 7:   1 1 1 1 1 2 3 2 3 2   3
 EXTRA SYMMETRY OF AOS IN SYMMETRY 8:   1 1 1 1 2 3 2 3

 Eigenvalues of metric

         1 0.778E-03 0.674E-02 0.674E-02 0.762E-02 0.349E-01 0.113E+00 0.113E+00 0.118E+00
         2 0.414E-02 0.226E-01 0.263E-01 0.263E-01 0.900E-01 0.291E+00 0.291E+00 0.429E+00
         3 0.414E-02 0.226E-01 0.263E-01 0.263E-01 0.900E-01 0.291E+00 0.291E+00 0.429E+00
         4 0.674E-02 0.113E+00 0.118E+00 0.118E+00 0.376E+00 0.766E+00 0.766E+00 0.145E+01
         5 0.414E-02 0.226E-01 0.263E-01 0.263E-01 0.900E-01 0.291E+00 0.291E+00 0.429E+00
         6 0.674E-02 0.113E+00 0.118E+00 0.118E+00 0.376E+00 0.766E+00 0.766E+00 0.145E+01
         7 0.674E-02 0.113E+00 0.118E+00 0.118E+00 0.376E+00 0.766E+00 0.766E+00 0.145E+01
         8 0.263E-01 0.291E+00 0.483E+00 0.483E+00 0.122E+01 0.152E+01 0.152E+01 0.247E+01


 Contracted 2-electron integrals neglected if value below      1.0D-12
 AO integral compression algorithm  1   Integral accuracy      1.0D-12

     31.982 MB (compressed) written to integral file ( 56.9%)


 NUMBER OF SORTED TWO-ELECTRON INTEGRALS:    4156552.     BUFFER LENGTH:  32768
 NUMBER OF SEGMENTS:   1  SEGMENT LENGTH:    4156552      RECORD LENGTH: 524288

 Memory used in sort:       4.71 MW

 SORT1 READ     6989366. AND WROTE     2907704. INTEGRALS IN      9 RECORDS. CPU TIME:     0.16 SEC, REAL TIME:     0.24 SEC
 SORT2 READ     2907704. AND WROTE     4156552. INTEGRALS IN    122 RECORDS. CPU TIME:     0.13 SEC, REAL TIME:     0.27 SEC

 FILE SIZES:   FILE 1:    51.4 MBYTE,  FILE 4:    37.8 MBYTE,   TOTAL:     89.2 MBYTE

 OPERATOR DM      FOR CENTER  0  COORDINATES:    0.000000    0.000000    0.000000
 OPERATOR EKIN    FOR CENTER  0  COORDINATES:    0.000000    0.000000    0.000000
 OPERATOR POT     FOR CENTER  0  COORDINATES:    0.000000    0.000000    0.000000


 **********************************************************************************************************************************
 DATASETS  * FILE   NREC   LENGTH (MB)   RECORD NAMES
              1      20       38.57       500      610      700      900      950      970     1000      129      960     1100   
                                          VAR    BASINP    GEOM    SYMINP    ZMAT    AOBASIS   BASIS     P2S    ABASIS      S 
                                         1400     1410     1420     1200     1210     1080     1600     1650     1300     1700   
                                         EKIN       V       ECP      H0       H01     AOSYM     SMH    MOLCAS    ERIS     OPER   

 PROGRAMS   *        TOTAL       INT
 CPU TIMES  *         2.79      2.69
 REAL TIME  *        11.55 SEC
 DISK USED  *        89.53 MB      
 **********************************************************************************************************************************


 PROGRAM * RHF-SCF (OPEN SHELL)       Authors: W. Meyer, H.-J. Werner


 NUMBER OF ELECTRONS:       3+    1-    SPACE SYMMETRY=6    SPIN SYMMETRY: Triplet 
 CONVERGENCE THRESHOLDS:    1.00E-05 (Density)    1.00E-07 (Energy)
 MAX. NUMBER OF ITERATIONS:       60
 INTERPOLATION TYPE:            DIIS
 INTERPOLATION STEPS:              2 (START)      1 (STEP)
 LEVEL SHIFTS:                 -0.60 (CLOSED) -0.30 (OPEN) 

 Number of closed-shell orbitals:    1 (   1   0   0   0   0   0   0   0 )
 Number of open-shell orbitals:      2 (   0   1   0   0   1   0   0   0 )



   Atom=C  basis=ECP2MWB_GUESS     lmin=0  lmax=1

 Orbital guess generated from atomic densities. Full valence occupancy:    1   1   1   0   1   0   0   0


 Molecular orbital dump at record        2100.2

 ITERATION    DDIFF          GRAD             ENERGY        2-EL.EN.            DIPOLE MOMENTS         DIIS   ORB.
    1      0.000D+00      0.000D+00        -5.27601194      5.490952    0.00000    0.00000    0.00000    0    start
    2      0.000D+00      0.139D-01        -5.30879165      5.870258    0.00000    0.00000    0.00000    1    diag,B
    3      0.119D-01      0.386D-02        -5.31348993      6.008343    0.00000    0.00000    0.00000    2    diag,B
    4      0.324D-02      0.146D-02        -5.31427005      6.052056    0.00000    0.00000    0.00000    3    diag,B
    5      0.185D-02      0.363D-03        -5.31431485      6.057221    0.00000    0.00000    0.00000    4    diag,B
    6      0.571D-03      0.903D-04        -5.31431733      6.058420    0.00000    0.00000    0.00000    5    diag,B
    7      0.230D-03      0.168D-04        -5.31431737      6.058244    0.00000    0.00000    0.00000    6    fixocc
    8      0.361D-04      0.527D-05        -5.31431738      6.058261    0.00000    0.00000    0.00000    7    diag,B
    9      0.943D-05      0.930D-06        -5.31431738      6.058259    0.00000    0.00000    0.00000    0    orth

 Final alpha occupancy:   1   1   0   0   1   0   0   0
 Final beta  occupancy:   1   0   0   0   0   0   0   0

 !RHF STATE 1.6 Energy                 -5.314317378328
 Nuclear energy                         0.00000000
 One-electron energy                   -8.34344690
 Two-electron energy                    3.02912952
 Virial quotient                       -1.54730348
 !RHF STATE 1.6 Dipole moment           0.00000000     0.00000000     0.00000000
 Dipole moment /Debye                   0.00000000     0.00000000     0.00000000
 

 !RHF expec          <1.6|EKIN|1.6>     3.434566950498
 
 !RHF expec           <1.6|POT|1.6>    -3.072620277979

 ELECTRON ORBITALS
 =================


   Orb  Occ    Energy  Couls-En    Coefficients

                                   1 1s      1 1s      1 1s      1 1s      1 1s      1 1s      1 3d0     1 3d2+    1 3d0     1 3d2+ 
                                   1 3d0     1 3d2+    1 3d0     1 3d2+    1 3d0     1 3d2+    1 5g0     1 5g4+    1 5g2+    1 5g0  
                                   1 5g4+    1 5g2+    1 5g0     1 5g4+    1 5g2+ 

   1.1   2    -0.7072   -2.9683  0.999968  0.000447 -0.000739  0.000415  0.000004 -0.000040  0.000896  0.001552  0.001753  0.003037
                                 0.001142  0.001978 -0.001711 -0.002964  0.001453  0.002517 -0.000014 -0.000028 -0.000021 -0.000002
                                -0.000004 -0.000003 -0.000002 -0.000004 -0.000003

                                   1 2px     1 2px     1 2px     1 2px     1 2px     1 2px     1 4f1+    1 4f3+    1 4f1+    1 4f3+ 
                                   1 4f1+    1 4f3+    1 4f1+    1 4f3+    1 6h1+    1 6h3+    1 6h5+    1 6h1+    1 6h3+    1 6h5+ 


   1.2   +    -0.4354   -2.3460  0.999912  0.000070 -0.000029  0.000111 -0.000046  0.000030  0.000013  0.000052 -0.000010 -0.000040
                                -0.000010 -0.000039  0.000001  0.000005 -0.000000 -0.000000 -0.000000 -0.000000 -0.000000 -0.000000

                                   1 2pz     1 2pz     1 2pz     1 2pz     1 2pz     1 2pz     1 4f0     1 4f2+    1 4f0     1 4f2+ 
                                   1 4f0     1 4f2+    1 4f0     1 4f2+    1 6h2+    1 6h4+    1 6h0     1 6h2+    1 6h4+    1 6h0  


   1.5   +    -0.4354   -2.3460  0.999912  0.000070 -0.000029  0.000111 -0.000046  0.000030  0.000033  0.000042 -0.000026 -0.000033
                                -0.000025 -0.000032  0.000003  0.000004 -0.000000 -0.000000 -0.000000 -0.000000 -0.000000 -0.000000

 HOMO      1.2    -0.435354 =     -11.8466eV
 LUMO      1.3     0.010832 =       0.2948eV
 LUMO-HOMO         0.446186 =      12.1414eV


 **********************************************************************************************************************************
 DATASETS  * FILE   NREC   LENGTH (MB)   RECORD NAMES
              1      20       38.57       500      610      700      900      950      970     1000      129      960     1100   
                                          VAR    BASINP    GEOM    SYMINP    ZMAT    AOBASIS   BASIS     P2S    ABASIS      S 
                                         1400     1410     1420     1200     1210     1080     1600     1650     1300     1700   
                                         EKIN       V       ECP      H0       H01     AOSYM     SMH    MOLCAS    ERIS     OPER   

              2       4        2.83       700     1000      520     2100   
                                         GEOM     BASIS   MCVARS     RHF  

 PROGRAMS   *        TOTAL        HF       INT
 CPU TIMES  *         2.96      0.17      2.69
 REAL TIME  *        11.86 SEC
 DISK USED  *        89.53 MB      
 **********************************************************************************************************************************
 SETTING SCF(I)         =        -5.31431738  AU                              
 SETTING _CC_NORM_MAX   =         2.00000000                                  


 PROGRAM * UHF-SCF       Authors: W. Meyer, H.-J. Werner


 NUMBER OF ELECTRONS:       3+    1-    SPACE SYMMETRY=6    SPIN SYMMETRY: Triplet 
 CONVERGENCE THRESHOLDS:    1.00E-05 (Density)    1.00E-07 (Energy)
 MAX. NUMBER OF ITERATIONS:        0
 INTERPOLATION TYPE:            DIIS
 INTERPOLATION STEPS:              2 (START)      1 (STEP)
 LEVEL SHIFTS:                  0.20 (ALPHA)   0.20 (BETA) 

 Number of closed-shell orbitals:    1 (   1   0   0   0   0   0   0   0 )
 Number of open-shell orbitals:      2 (   0   1   0   0   1   0   0   0 )


 Molecular orbitals read from record     2100.2  Type=RHF/CANONICAL (state 1.6)

 Molecular orbital dump at record        2200.2

 Initial alpha occupation   1   1   0   0   1   0   0   0
 Initial beta  occupation   1   0   0   0   0   0   0   0

 ITERATION    DDIFF          GRAD             ENERGY        2-EL.EN.            DIPOLE MOMENTS         DIIS
    1      0.000D+00      0.000D+00        -5.31431738      6.058259    0.00000    0.00000    0.00000    0
 
 Final alpha occupancy:   1   1   0   0   1   0   0   0
 Final beta  occupancy:   1   0   0   0   0   0   0   0

 !UHF STATE 1.6 Energy                 -5.314317378328
 Nuclear energy                         0.00000000
 One-electron energy                   -8.34344690
 Two-electron energy                    3.02912952
 Virial quotient                       -1.54730348
 !UHF STATE 1.6 Dipole moment           0.00000000     0.00000000     0.00000000
 Dipole moment /Debye                   0.00000000     0.00000000     0.00000000
 

 !UHF expec          <1.6|EKIN|1.6>     3.434566950498
 
 !UHF expec           <1.6|POT|1.6>    -3.072620277979

 ELECTRON ORBITALS FOR POSITIVE SPIN
 ===================================


   Orb  Occ    Energy  Couls-En    Coefficients

                                   1 1s      1 1s      1 1s      1 1s      1 1s      1 1s      1 3d0     1 3d2+    1 3d0     1 3d2+ 
                                   1 3d0     1 3d2+    1 3d0     1 3d2+    1 3d0     1 3d2+    1 5g0     1 5g4+    1 5g2+    1 5g0  
                                   1 5g4+    1 5g2+    1 5g0     1 5g4+    1 5g2+ 

   1.1   +    -0.7072   -2.9683  0.999968  0.000447 -0.000739  0.000415  0.000004 -0.000040  0.000896  0.001552  0.001753  0.003037
                                 0.001142  0.001978 -0.001711 -0.002964  0.001453  0.002517 -0.000014 -0.000028 -0.000021 -0.000002
                                -0.000004 -0.000003 -0.000002 -0.000004 -0.000003

                                   1 2px     1 2px     1 2px     1 2px     1 2px     1 2px     1 4f1+    1 4f3+    1 4f1+    1 4f3+ 
                                   1 4f1+    1 4f3+    1 4f1+    1 4f3+    1 6h1+    1 6h3+    1 6h5+    1 6h1+    1 6h3+    1 6h5+ 


   1.2   +    -0.4354   -2.3460  0.999912  0.000070 -0.000029  0.000111 -0.000046  0.000030  0.000013  0.000052 -0.000010 -0.000040
                                -0.000010 -0.000039  0.000001  0.000005 -0.000000 -0.000000 -0.000000 -0.000000 -0.000000 -0.000000

                                   1 2pz     1 2pz     1 2pz     1 2pz     1 2pz     1 2pz     1 4f0     1 4f2+    1 4f0     1 4f2+ 
                                   1 4f0     1 4f2+    1 4f0     1 4f2+    1 6h2+    1 6h4+    1 6h0     1 6h2+    1 6h4+    1 6h0  


   1.5   +    -0.4354   -2.3460  0.999912  0.000070 -0.000029  0.000111 -0.000046  0.000030  0.000033  0.000042 -0.000026 -0.000033
                                -0.000025 -0.000032  0.000003  0.000004 -0.000000 -0.000000 -0.000000 -0.000000 -0.000000 -0.000000

 ELECTRON ORBITALS FOR NEGATIVE SPIN
 ===================================


   Orb  Occ    Energy  Couls-En    Coefficients

                                   1 1s      1 1s      1 1s      1 1s      1 1s      1 1s      1 3d0     1 3d2+    1 3d0     1 3d2+ 
                                   1 3d0     1 3d2+    1 3d0     1 3d2+    1 3d0     1 3d2+    1 5g0     1 5g4+    1 5g2+    1 5g0  
                                   1 5g4+    1 5g2+    1 5g0     1 5g4+    1 5g2+ 

   1.1   -    -0.7072   -2.9683  0.999968  0.000447 -0.000739  0.000415  0.000004 -0.000040  0.000896  0.001552  0.001753  0.003037
                                 0.001142  0.001978 -0.001711 -0.002964  0.001453  0.002517 -0.000014 -0.000028 -0.000021 -0.000002
                                -0.000004 -0.000003 -0.000002 -0.000004 -0.000003

 HOMO      1.2    -0.435354 =     -11.8466eV
 LUMO     -1.2    -0.435354 =     -11.8466eV
 LUMO-HOMO         0.000000 =       0.0000eV

 EXPECTATION VALUE OF S**2:             2.00000000

 Occupation number threshold for canonical orbitals:  1.999000 (occupied),  0.001000 (virtual)

 Number of pseudo-canonical orbitals per symmetry:    1   0   0   0   0   0   0   0
 Number of active natural orbitals per symmetry:      0   1   0   0   1   0   0   0

 NATURAL CHARGE ORBITALS
 =======================


   Orb     Occ        Energy       Coefficients

                                   1 1s      1 1s      1 1s      1 1s      1 1s      1 1s      1 3d0     1 3d2+    1 3d0     1 3d2+ 
                                   1 3d0     1 3d2+    1 3d0     1 3d2+    1 3d0     1 3d2+    1 5g0     1 5g4+    1 5g2+    1 5g0  
                                   1 5g4+    1 5g2+    1 5g0     1 5g4+    1 5g2+ 

   1.1  2.00000    -0.707239     0.999968  0.000447 -0.000739  0.000415  0.000004 -0.000040  0.000896  0.001552  0.001753  0.003037
                                 0.001142  0.001978 -0.001711 -0.002964  0.001453  0.002517 -0.000014 -0.000028 -0.000021 -0.000002
                                -0.000004 -0.000003 -0.000002 -0.000004 -0.000003

                                   1 2px     1 2px     1 2px     1 2px     1 2px     1 2px     1 4f1+    1 4f3+    1 4f1+    1 4f3+ 
                                   1 4f1+    1 4f3+    1 4f1+    1 4f3+    1 6h1+    1 6h3+    1 6h5+    1 6h1+    1 6h3+    1 6h5+ 


   1.2  1.00000    -0.131817     0.999912  0.000070 -0.000029  0.000111 -0.000046  0.000030  0.000013  0.000052 -0.000010 -0.000040
                                -0.000010 -0.000039  0.000001  0.000005 -0.000000 -0.000000 -0.000000 -0.000000 -0.000000 -0.000000

                                   1 2pz     1 2pz     1 2pz     1 2pz     1 2pz     1 2pz     1 4f0     1 4f2+    1 4f0     1 4f2+ 
                                   1 4f0     1 4f2+    1 4f0     1 4f2+    1 6h2+    1 6h4+    1 6h0     1 6h2+    1 6h4+    1 6h0  


   1.5  1.00000    -0.131817     0.999912  0.000070 -0.000029  0.000111 -0.000046  0.000030  0.000033  0.000042 -0.000026 -0.000033
                                -0.000025 -0.000032  0.000003  0.000004 -0.000000 -0.000000 -0.000000 -0.000000 -0.000000 -0.000000

 Natural orbitals saved to record    2200.2 (Orbital set 3)

 Orbital spaces for UNO-CAS (Min. occupation: 0.020  Max. occupation: 1.980):

 Closed:        1   0   0   0   0   0   0   0
 Active:        0   1   0   0   1   0   0   0

 No convergence



 **********************************************************************************************************************************
 DATASETS  * FILE   NREC   LENGTH (MB)   RECORD NAMES
              1      20       38.57       500      610      700      900      950      970     1000      129      960     1100   
                                          VAR    BASINP    GEOM    SYMINP    ZMAT    AOBASIS   BASIS     P2S    ABASIS      S 
                                         1400     1410     1420     1200     1210     1080     1600     1650     1300     1700   
                                         EKIN       V       ECP      H0       H01     AOSYM     SMH    MOLCAS    ERIS     OPER   

              2       5        5.45       700     1000      520     2100     2200   
                                         GEOM     BASIS   MCVARS     RHF      UHF  

 PROGRAMS   *        TOTAL       UHF        HF       INT
 CPU TIMES  *         2.98      0.02      0.17      2.69
 REAL TIME  *        11.97 SEC
 DISK USED  *        89.53 MB      
 **********************************************************************************************************************************
 SETTING SCF(I)         =        -5.31431738  AU                              


 PROGRAM * MRCC (General Multireference Coupled Cluster)    Author: M. Kallay, 2000-2005

 ***  Initialisation ***

   0 Spin projections
 
 Molecular orbitals read from record     2200.2  Type=UHF/ALPHA (state 1.6)

 ?Warning: UHF not converged
 Molecular orbitals read from record     2200.2  Type=UHF/BETA (state 1.6)

 ?Warning: UHF not converged
 
 Frozen orbitals:              0 (  0  0  0  0  0  0  0  0)
 Active orbitals:            126 ( 25 20 20 11 20 11 11  8)
 Active electrons:             4
 Spin quantum number:          1.0

 Transformed integrals will be written to file mrcc_37887/fort.55

 Load integrals                3.0 sec
 Transform integrals           5.2 sec
 Storage for integrals:       24278327
 Remaining memory:           *********

 Core energy:               0.00000000
 
 MRCC Input:
     4     0     0     0     3     0     0     6     0     0     0     1     1     0     0     7     0     0   0.000     0   64000
  ex.lev,nsing,ntrip, rest,method,dens,conver,symm, diag, CS ,spatial, HF, ndoub,nacto,nactv, tol, maxex, sacc, freq,  dboc,   mem
  2  0  0  0  0  0  0  0  0  0  0  0  0  0  0  0  0  0  0  0  0  0  0  0  0  1  0  0  0  0  0  0  0  0  0  0  0  0  0  0  0  0  0  0  0  0  0  0  0  0  0  0  0  0  0  0  0  0  0  0  0  0  0  0  0  0  0  0  0  0  0  0  0  0  0  0  1  0  0  0  0  0  0  0  0  0  0  0  0  0  0  0  0  0  0  0  0  0  0  0  0  0  0  0  0  0  0  0  0  0  0  0  0  0  0  0  0  0  0  0  0  0  0  0  0  0
 MRCC Input end
 Variable memory released
 MRCC now being run, temporary output in /global/cscratch1/sd/aannabe/mrcc_37887/mrcc.out
 **********************************************************************
                          MRCC program system
 **********************************************************************

                              Written by
  Mihaly Kallay, Zoltan Rolik, Jozsef Csontos, Peter Nagy, Gyula Samu,
      David Mester, Jozsef Csoka, Bernat Szabo, Istvan Ladjanszki,
       Lorant Szegedy, Bence Ladoczki, Klara Petrov, Mate Farkas,
                    Pal D. Mezei, and Bence Hegely

        Department of Physical Chemistry and Materials Science
            Budapest University of Technology and Economics
                  Budapest P.O.Box 91, H-1521 Hungary

                              www.mrcc.hu

                       Release date: May 23, 2018

 ************************ 2018-06-15 16:29:19 *************************
 Executing goldstone...

 Generation of CC equations in terms of H and T...
 Generation of antisymmetrized Goldstone diagrams...
 Number of diagrams in T^1 equations:    15
 Number of diagrams in T^2 equations:    38
 Number of diagrams in T^3 equations:    49
 Number of diagrams in T^4 equations:     5
 Translation of diagrams to factorized equations...
 Optimizing intermediate calculation...
 Number of floating-point operations per iteration step:   7.6150E+10
 Probable CPU time per iteration step (hours):      0.76
 Required memory (Mbytes):   30783.6
 Number of intermediates:                                  80
 Number of intermediates to be stored:                     32
 Length of intermediate file (Mbytes):     492.9

 ************************ 2018-06-15 16:29:19 *************************
 Executing xmrcc...

 **********************************************************************
 CC(3)(4) calculation


 Allocation of****** Mbytes of memory...
 Number of spinorbitals:                   252
 Number of alpha electrons:                        3
 Number of beta electrons:                         1
 Spin multiplicity:                     2
 z-component of spin:  1.0
 Spatial symmetry:                      6
 Convergence criterion:  1.0E-07
 Construction of occupation graphs...
 Number of                     0 -fold excitations:                      1
 Number of                     1 -fold excitations:                     86
 Number of                     2 -fold excitations:                   8977
 Number of                     3 -fold excitations:                 389714
 Total number of configurations:                 398778
 Calculation of coupling coefficients...
 Length of intermediate file (Mbytes):     372.0

 ======================================================================

 Spin case  1   Alpha:  3   Beta:  1
 Number of excitations:                4723078
 Number of                     4 -fold excitations:                4723078

 Memory requirements /Mbyte/:
               Minimal        Optimal
 Real*8:        802.7682      1923.2150
 Integer:        80.1863
 Total:         882.9545      2003.4013


 ************************ 2018-06-15 16:29:24 *************************
 Executing mrcc...

 **********************************************************************
 CCSDT(Q) calculation


 OpenMP parallel version is running.
 Number of CPUs:   1
 Allocation of 1923.2 Mbytes of memory...
 Number of spinorbitals: 252
 Number of alpha electrons:  3
 Number of beta  electrons:  1
 Spin multiplicity: 2
 z-component of spin:  1.0
 Spatial symmetry: 6
 Convergence criterion:  1.0E-07
 Construction of occupation graphs...
 Number of 0-fold excitations: 1
 Number of 1-fold excitations: 86
 Number of 2-fold excitations: 8977
 Number of 3-fold excitations: 389714
 Total number of determinants: 398778
 Calculation of coupling coefficients...
 Initial cluster amplitudes are generated.
 Length of intermediate file (Mbytes):     372.0
 Reading integral list from unit 55...
 Sorting integrals...
 Sorting integrals...
 Sorting integrals...
 Sorting integrals...
 Energy of reference determinant [au]:      -5.314317378328
 Calculation of MP denominators...

 Starting CC iteration...
 ======================================================================
 Norm of residual vector:     0.57153029
 CPU time [min]:     0.913                   Wall time [min]:     0.919

 Iteration  1  CC energy:    -5.39665731  Energy decrease:   0.08233994
 ======================================================================
 Norm of residual vector:     0.15042564
 CPU time [min]:     1.316                   Wall time [min]:     1.328

 Iteration  2  CC energy:    -5.40919982  Energy decrease:   0.01254251
 ======================================================================
 Norm of residual vector:     0.04382340
 CPU time [min]:     1.748                   Wall time [min]:     1.773

 Iteration  3  CC energy:    -5.41603873  Energy decrease:   0.00683890
 ======================================================================
 Norm of residual vector:     0.01368039
 CPU time [min]:     2.111                   Wall time [min]:     2.142

 Iteration  4  CC energy:    -5.41636195  Energy decrease:   0.00032322
 ======================================================================
 Norm of residual vector:     0.00352628
 CPU time [min]:     2.452                   Wall time [min]:     2.491

 Iteration  5  CC energy:    -5.41648387  Energy decrease:   0.00012192
 ======================================================================
 Norm of residual vector:     0.00104509
 CPU time [min]:     2.793                   Wall time [min]:     2.838

 Iteration  6  CC energy:    -5.41648805  Energy decrease:   0.00000418
 ======================================================================
 Norm of residual vector:     0.00034764
 CPU time [min]:     3.134                   Wall time [min]:     3.185

 Iteration  7  CC energy:    -5.41647989  Energy decrease:   0.00000815
 ======================================================================
 Norm of residual vector:     0.00012464
 CPU time [min]:     3.475                   Wall time [min]:     3.530

 Iteration  8  CC energy:    -5.41648143  Energy decrease:   0.00000154
 ======================================================================
 Norm of residual vector:     0.00004791
 CPU time [min]:     3.816                   Wall time [min]:     3.878

 Iteration  9  CC energy:    -5.41648229  Energy decrease:   0.00000086
 ======================================================================
 Norm of residual vector:     0.00001903
 CPU time [min]:     4.155                   Wall time [min]:     4.222

 Iteration 10  CC energy:    -5.41648195  Energy decrease:   0.00000035
 ======================================================================
 Norm of residual vector:     0.00000666
 CPU time [min]:     4.501                   Wall time [min]:     4.573

 Iteration 11  CC energy:    -5.41648182  Energy decrease:   0.00000012
 ======================================================================
 Norm of residual vector:     0.00000238
 CPU time [min]:     4.923                   Wall time [min]:     5.000

 Iteration 12  CC energy:    -5.41648190  Energy decrease:   0.00000007
 ======================================================================
 Norm of residual vector:     0.00000078
 CPU time [min]:     5.359                   Wall time [min]:     5.442

 Iteration 13  CC energy:    -5.41648190  Energy decrease:   0.00000001
 ======================================================================
 Norm of residual vector:     0.00000023
 CPU time [min]:     5.809                   Wall time [min]:     5.897

 Iteration 14  CC energy:    -5.41648189  Energy decrease:   0.00000001
 ======================================================================
 Norm of residual vector:     0.00000007
 CPU time [min]:     6.245                   Wall time [min]:     6.338

 Iteration 15  CC energy:    -5.41648189  Energy decrease:   1.4481E-09
 ======================================================================

 Iteration has converged in 15 steps.

 Final results:
 Total CCSDT energy [au]:             -5.416481891060
 Total MP2 energy [au]:               -5.396657313671

 Perturbative corrections are calculated...
 ======================================================================
 Spin case  1   Alpha:  3   Beta:  1
 Number of excitations:        4723078
 CPU time [min]:    37.443                   Wall time [min]:    37.538
 ======================================================================
 Number of 4-fold excitations: 4723078
 CPU time [min]:    37.443                   Wall time [min]:    37.540

 Total CCSDT[Q] energy [au]:          -5.416496640295
 Total CCSDT(Q) energy [au]:          -5.416525793890

 ************************ 2018-06-15 17:06:56 *************************
                      Normal termination of mrcc.
 **********************************************************************
 !CCSDT STATE 1.6 Energy               -5.416481891060
 !MP2 STATE 1.6 Energy                 -5.396657313671
 !CCSDT[Q] STATE 1.6 Energy            -5.416496640295
 !CCSDT(Q) STATE 1.6 Energy            -5.416525793890
 
 CPU-time for MRCC:           2246.6 sec
 Elapsed-time for MRCC:       2259.0 sec

 Variable memory set to 8000000000 words,  buffer space   230000 words



 **********************************************************************************************************************************
 DATASETS  * FILE   NREC   LENGTH (MB)   RECORD NAMES
              1      20       38.57       500      610      700      900      950      970     1000      129      960     1100   
                                          VAR    BASINP    GEOM    SYMINP    ZMAT    AOBASIS   BASIS     P2S    ABASIS      S 
                                         1400     1410     1420     1200     1210     1080     1600     1650     1300     1700   
                                         EKIN       V       ECP      H0       H01     AOSYM     SMH    MOLCAS    ERIS     OPER   

              2       5        5.45       700     1000      520     2100     2200   
                                         GEOM     BASIS   MCVARS     RHF      UHF  

 PROGRAMS   *        TOTAL      MRCC       UHF        HF       INT
 CPU TIMES  *      2305.92   2302.93      0.02      0.17      2.69
 REAL TIME  *      2563.19 SEC
 DISK USED  *        89.53 MB      
 **********************************************************************************************************************************
 SETTING POSTHF(I)      =        -5.41652579  AU                              
                                                                                                                                                                                                                                                                

       SCF           POSTHF       EKIN          POT
    -5.31431738   -5.41652579   3.43456695   -3.07262028
                                                  

 CCSDT(Q)/USERDEF energy=     -5.416525793890

        CCSDT(Q)        HF-SCF  
     -5.41652579     -5.31431738
 **********************************************************************************************************************************
 Variable memory released
