
 Primary working directories    : /global/cscratch1/sd/aannabe
 Secondary working directories  : /global/cscratch1/sd/aannabe
 Wavefunction directory         : /global/homes/a/aannabe/wfu/
 Main file repository           : /global/cscratch1/sd/aannabe/

 SHA1      : 19cd028119e0e09f93f0674bd8af7968d9b3eff6
 NAME      : 2015.1.36
 ARCHNAME  : linux/x86_64
 FC        : /opt/cray/pe/craype/2.5.14/bin/ftn
 BLASLIB   : -L/opt/intel/compilers_and_libraries_2018.1.163/linux/mkl/lib/intel64 -Wl,-_start-group -lmkl_intel_ilp64 -lmkl_intel_thread -lmkl_core -Wl,-_end-group -liomp5
 id        : lbl

 Nodes     nprocs
 nid00443     1

 Using customized tuning parameters: mindgm=7; mindgv=16; mindgc=1; mindgr=1; noblas=0; minvec=7
 default implementation of scratch files=df  

 ***,Si
 memory,512,m
 gthresh,twoint=1.e-12
 
 gprint,basis,orbitals
 gexpec,ekin,pot
 
 angstrom
 geometry={
 1                                                                               ! Number of atoms
 Si 0.0 0.0 0.0
 }
 
 basis={
 Including file /global/homes/a/aannabe/repos/pseudopotentiallibrary/recipes/Si/ccECP_He_core/Si.ccECP.molpro
 Including file /global/homes/a/aannabe/repos/pseudopotentiallibrary/recipes/Si/ccECP_He_core/cc-pCVDZ.molpro
 }
 
 {rhf
  start,atden
  wf,12,4,2
  occ,2,2,2,0,1,0,0,0
  closed,2,1,1,0,1,0,0,0
                                                                                 ! open,2.2,2.3
  save,4202.2
 }
 {multi
  start,4202.2
  occ,2,2,2,0,2,0,0
  closed,2,1,1,0,1,0,0,0
  wf,12,4,2;state,1
  wf,12,6,2;state,1
  wf,12,7,2;state,1
  natorb,ci,print
  orbital,5202.2
 }
 {rhf,nitord=1,maxit=0
  start,5202.2
  wf,12,4,2
  occ,2,2,2,0,1,0,0,0
  closed,2,1,1,0,1,0,0,0
                                                                                 ! open,2.2,2.3
 }
 
 scf(i)=energy
 
 _CC_NORM_MAX=2.0
 {uccsd(t)
 maxit,100
 core
 }
 posthf(i)=energy
 
 table,scf,posthf,ekin,pot
 save,2.csv,new
 
 

 Variables initialized (889), CPU time= 0.01 sec
 Commands  initialized (702), CPU time= 0.00 sec, 572 directives.
 Default parameters read. Elapsed time= 0.11 sec

 Checking input...
 Passed
1


                                         ***  PROGRAM SYSTEM MOLPRO  ***
                                       Copyright, TTI GmbH Stuttgart, 2015
                                    Version 2015.1 linked Dec 29 2018 15:55:43


 **********************************************************************************************************************************
 LABEL *   Si                                                                            
  64 bit serial version                                                                  DATE: 28-Jan-19          TIME: 15:30:09  
 **********************************************************************************************************************************

 SHA1:             19cd028119e0e09f93f0674bd8af7968d9b3eff6
 **********************************************************************************************************************************

 THRESHOLDS:

 ZERO    =  1.00D-12  ONEINT  =  1.00D-12  TWOINT  =  1.00D-12  PREFAC  =  1.00D-14  LOCALI  =  1.00D-09  EORDER  =  1.00D-04
 ENERGY  =  0.00D+00  ETEST   =  0.00D+00  EDENS   =  0.00D+00  THRDEDEF=  1.00D-06  GRADIENT=  1.00D-02  STEP    =  1.00D-03
 ORBITAL =  1.00D-05  CIVEC   =  1.00D-05  COEFF   =  1.00D-04  PRINTCI =  5.00D-02  PUNCHCI =  9.90D+01  OPTGRAD =  3.00D-04
 OPTENERG=  1.00D-06  OPTSTEP =  3.00D-04  THRGRAD =  1.00D-10  COMPRESS=  1.00D-11  VARMIN  =  1.00D-07  VARMAX  =  1.00D-03
 THRDOUB =  0.00D+00  THRDIV  =  1.00D-05  THRRED  =  1.00D-07  THRPSP  =  1.00D+00  THRDC   =  1.00D-10  THRCS   =  1.00D-10
 THRNRM  =  1.00D-08  THREQ   =  0.00D+00  THRDE   =  1.00D+00  THRREF  =  1.00D-05  SPARFAC =  1.00D+00  THRDLP  =  1.00D-07
 THRDIA  =  1.00D-10  THRDLS  =  1.00D-07  THRGPS  =  0.00D+00  THRKEX  =  0.00D+00  THRDIS  =  2.00D-01  THRVAR  =  1.00D-10
 THRLOC  =  1.00D-06  THRGAP  =  1.00D-06  THRLOCT = -1.00D+00  THRGAPT = -1.00D+00  THRORB  =  1.00D-06  THRMLTP =  0.00D+00
 THRCPQCI=  1.00D-10  KEXTA   =  0.00D+00  THRCOARS=  0.00D+00  SYMTOL  =  1.00D-06  GRADTOL =  1.00D-06  THROVL  =  1.00D-08
 THRORTH =  1.00D-08  GRID    =  1.00D-06  GRIDMAX =  1.00D-03  DTMAX   =  0.00D+00  THROCCDE=  1.00D-01  THROCCDE=  1.00D-01



 ZUNIT=ANG
 

Geometry recognized as XYZ


 Variable memory set to  512000000 words,  buffer space   230000 words

 SETTING BASIS          =    USERDEF


 Recomputing integrals since basis changed


 Using spherical harmonics



 PROGRAM * SEWARD (Integral evaluation for generally contracted gaussian basis sets)     Author: Roland Lindh, 1990

 Geometry written to block  1 of record 700

 Orientation using atomic masses  
 Molecule type: Atom
 Symmetry elements: X,Y,Z
 Rotational constants:       0.0000000      0.0000000      0.0000000 GHz  (calculated with average atomic masses)

 Point group  D2h 



 ATOMIC COORDINATES

 NR  ATOM    CHARGE       X              Y              Z

   1  SI      4.00    0.000000000    0.000000000    0.000000000


          SI  CORE POTENTIAL

          d POTENTIAL

 POWERS             1              3              2              1              1
 EXPONENTIALS   12.06605       15.27662       14.50627       0.000000       0.000000    
 COEFFICIENTS   12.00000       144.7926      -99.22939       4.000000      -12.00000    

          s - d POTENTIAL

 POWERS             2              2
 EXPONENTIALS   92.04625       30.89573    
 COEFFICIENTS   25.22833       150.4831    

          p - d POTENTIAL

 POWERS             2
 EXPONENTIALS   1.000000    
 COEFFICIENTS   0.000000    


 BASIS DATA

   Nr Sym  Nuc  Type         Exponents   Contraction coefficients

    1.1 Ag    1  1s          96.651837    -0.000440   -0.000004
    2.1 Ag                   48.652547     0.018671   -0.004421
                             24.490692    -0.154353    0.043362
                             12.328111    -0.057738    0.015853
                              6.205717     0.168087   -0.051706
                              3.123831     0.453428   -0.162895
                              1.572472     0.417675   -0.250218
                              0.791550     0.111901   -0.124216
                              0.398450     0.003337    0.246325
                              0.200572     0.000995    0.505899
                              0.100964    -0.000038    0.386314
                              0.050823     0.000069    0.087701
    3.1 Ag    1  1s           5.023487     1.000000
    4.1 Ag    1  1s           0.086279     1.000000
    5.1 Ag    1  3d0          6.114612     1.000000
    6.1 Ag    1  3d2+         6.114612     1.000000
    7.1 Ag    1  3d0          0.274454     1.000000
    8.1 Ag    1  3d2+         0.274454     1.000000
    1.2 B3u   1  2px         40.315996     0.012938    0.002833
    2.2 B3u                  21.171265     0.098129    0.020869
                             11.117733     0.179324    0.038236
                              5.838290     0.263886    0.059679
                              3.065879     0.309272    0.072776
                              1.609995     0.232748    0.061129
                              0.845462     0.085900   -0.016776
                              0.443980     0.010260   -0.172259
                              0.233149     0.001560   -0.321196
                              0.122434    -0.000003   -0.362828
                              0.064294     0.000232   -0.220789
                              0.033763    -0.000023   -0.055152
    3.2 B3u   1  2px          1.930885     1.000000
    4.2 B3u   1  2px          0.079370     1.000000
    1.3 B2u   1  2py         40.315996     0.012938    0.002833
    2.3 B2u                  21.171265     0.098129    0.020869
                             11.117733     0.179324    0.038236
                              5.838290     0.263886    0.059679
                              3.065879     0.309272    0.072776
                              1.609995     0.232748    0.061129
                              0.845462     0.085900   -0.016776
                              0.443980     0.010260   -0.172259
                              0.233149     0.001560   -0.321196
                              0.122434    -0.000003   -0.362828
                              0.064294     0.000232   -0.220789
                              0.033763    -0.000023   -0.055152
    3.3 B2u   1  2py          1.930885     1.000000
    4.3 B2u   1  2py          0.079370     1.000000
    1.4 B1g   1  3d2-         6.114612     1.000000
    2.4 B1g   1  3d2-         0.274454     1.000000
    1.5 B1u   1  2pz         40.315996     0.012938    0.002833
    2.5 B1u                  21.171265     0.098129    0.020869
                             11.117733     0.179324    0.038236
                              5.838290     0.263886    0.059679
                              3.065879     0.309272    0.072776
                              1.609995     0.232748    0.061129
                              0.845462     0.085900   -0.016776
                              0.443980     0.010260   -0.172259
                              0.233149     0.001560   -0.321196
                              0.122434    -0.000003   -0.362828
                              0.064294     0.000232   -0.220789
                              0.033763    -0.000023   -0.055152
    3.5 B1u   1  2pz          1.930885     1.000000
    4.5 B1u   1  2pz          0.079370     1.000000
    1.6 B2g   1  3d1+         6.114612     1.000000
    2.6 B2g   1  3d1+         0.274454     1.000000
    1.7 B3g   1  3d1-         6.114612     1.000000
    2.7 B3g   1  3d1-         0.274454     1.000000

 NUCLEAR CHARGE:                    4
 NUMBER OF PRIMITIVE AOS:          68
 NUMBER OF SYMMETRY AOS:           66
 NUMBER OF CONTRACTIONS:           26   (   8Ag  +   4B3u +   4B2u +   2B1g +   4B1u +   2B2g +   2B3g +   0Au  )
 NUMBER OF CORE ORBITALS:           0   (   0Ag  +   0B3u +   0B2u +   0B1g +   0B1u +   0B2g +   0B3g +   0Au  )
 NUMBER OF VALENCE ORBITALS:        4   (   1Ag  +   1B3u +   1B2u +   0B1g +   1B1u +   0B2g +   0B3g +   0Au  )


 NUCLEAR REPULSION ENERGY    0.00000000

 EXTRA SYMMETRY OF AOS IN SYMMETRY 1:   1 1 1 1 2 3 2 3

 Eigenvalues of metric

         1 0.433E-01 0.135E+00 0.958E+00 0.958E+00 0.104E+01 0.104E+01 0.179E+01 0.203E+01
         2 0.742E-01 0.147E+00 0.176E+01 0.202E+01
         3 0.742E-01 0.147E+00 0.176E+01 0.202E+01
         4 0.958E+00 0.104E+01
         5 0.742E-01 0.147E+00 0.176E+01 0.202E+01
         6 0.958E+00 0.104E+01
         7 0.958E+00 0.104E+01


 Contracted 2-electron integrals neglected if value below      1.0D-12
 AO integral compression algorithm  1   Integral accuracy      1.0D-12

     0.262 MB (compressed) written to integral file (100.0%)


 NUMBER OF SORTED TWO-ELECTRON INTEGRALS:       9924.     BUFFER LENGTH:  32768
 NUMBER OF SEGMENTS:   1  SEGMENT LENGTH:       9924      RECORD LENGTH: 524288

 Memory used in sort:       0.57 MW

 SORT1 READ       22992. AND WROTE        9008. INTEGRALS IN      1 RECORDS. CPU TIME:     0.00 SEC, REAL TIME:     0.01 SEC
 SORT2 READ        9008. AND WROTE        9924. INTEGRALS IN      1 RECORDS. CPU TIME:     0.01 SEC, REAL TIME:     0.01 SEC

 FILE SIZES:   FILE 1:    20.1 MBYTE,  FILE 4:     4.2 MBYTE,   TOTAL:     24.4 MBYTE

 OPERATOR DM      FOR CENTER  0  COORDINATES:    0.000000    0.000000    0.000000
 OPERATOR EKIN    FOR CENTER  0  COORDINATES:    0.000000    0.000000    0.000000
 OPERATOR POT     FOR CENTER  0  COORDINATES:    0.000000    0.000000    0.000000


 **********************************************************************************************************************************
 DATASETS  * FILE   NREC   LENGTH (MB)   RECORD NAMES
              1      20       19.95       500      610      700      900      950      970     1000      129      960     1100   
                                          VAR    BASINP    GEOM    SYMINP    ZMAT    AOBASIS   BASIS     P2S    ABASIS      S 
                                         1400     1410     1420     1200     1210     1080     1600     1650     1300     1700   
                                         EKIN       V       ECP      H0       H01     AOSYM     SMH    MOLCAS    ERIS     OPER   

 PROGRAMS   *        TOTAL       INT
 CPU TIMES  *         0.37      0.26
 REAL TIME  *         1.49 SEC
 DISK USED  *        24.64 MB      
 **********************************************************************************************************************************


 PROGRAM * RHF-SCF (OPEN SHELL)       Authors: W. Meyer, H.-J. Werner


 NUMBER OF ELECTRONS:       7+    5-    SPACE SYMMETRY=4    SPIN SYMMETRY: Triplet 
 CONVERGENCE THRESHOLDS:    1.00E-05 (Density)    1.00E-07 (Energy)
 MAX. NUMBER OF ITERATIONS:       60
 INTERPOLATION TYPE:            DIIS
 INTERPOLATION STEPS:              2 (START)      1 (STEP)
 LEVEL SHIFTS:                 -0.60 (CLOSED) -0.30 (OPEN) 

 Number of closed-shell orbitals:    5 (   2   1   1   0   1   0   0 )
 Number of open-shell orbitals:      2 (   0   1   1   0   0   0   0 )



   Atom=SI basis=ECP10MWB_GUESS    lmin=0  lmax=1

 Orbital guess generated from atomic densities. Full valence occupancy:    1   1   1   0   1   0   0   0


 Molecular orbital dump at record        4202.2

 ITERATION    DDIFF          GRAD             ENERGY        2-EL.EN.            DIPOLE MOMENTS         DIIS   ORB.
    1      0.000D+00      0.000D+00       -90.05628983    170.521066    0.00000    0.00000    0.00000    0    start
    2      0.000D+00      0.122D+01      -100.99278919    115.701926    0.00000    0.00000    0.00000    1    diag,B
    3      0.132D+01      0.339D+00      -101.59483735    123.018892    0.00000    0.00000    0.00000    2    diag,B
    4      0.162D+00      0.310D-01      -101.61870255    123.426873    0.00000    0.00000    0.00000    3    diag,B
    5      0.114D+00      0.950D-02      -101.62461550    123.341575    0.00000    0.00000    0.00000    4    diag,B
    6      0.699D-01      0.389D-02      -101.62613347    123.320459    0.00000    0.00000    0.00000    5    diag,B
    7      0.482D-01      0.340D-03      -101.62614499    123.327295    0.00000    0.00000    0.00000    6    fixocc
    8      0.368D-02      0.407D-04      -101.62614519    123.330463    0.00000    0.00000    0.00000    7    diag,B
    9      0.282D-03      0.916D-05      -101.62614521    123.331833    0.00000    0.00000    0.00000    8    diag,B
   10      0.899D-04      0.129D-05      -101.62614521    123.331913    0.00000    0.00000    0.00000    9    orth
   11      0.685D-05      0.149D-06      -101.62614521    123.331913    0.00000    0.00000    0.00000    0    orth

 Final alpha occupancy:   2   2   2   0   1   0   0
 Final beta  occupancy:   2   1   1   0   1   0   0

 !RHF STATE 1.4 Energy               -101.626145206396
 Nuclear energy                         0.00000000
 One-electron energy                 -163.29210154
 Two-electron energy                   61.66595633
 Virial quotient                       -1.27970445
 !RHF STATE 1.4 Dipole moment           0.00000000     0.00000000     0.00000000
 Dipole moment /Debye                   0.00000000     0.00000000     0.00000000
 

 !RHF expec          <1.4|EKIN|1.4>    79.413762315463
 
 !RHF expec           <1.4|POT|1.4>   -20.707244394939

 ELECTRON ORBITALS
 =================


   Orb  Occ    Energy  Couls-En    Coefficients

                                   1 1s      1 1s      1 1s      1 1s      1 3d0     1 3d2+    1 3d0     1 3d2+ 

   1.1   2    -6.1563  -24.6926  1.000000  0.000001  0.000000 -0.000001  0.000415  0.000000  0.000112 -0.000000

   2.1   2    -0.5415   -6.4555 -0.000014  0.999940 -0.000004  0.000060  0.000043 -0.000000 -0.003177 -0.000000

                                   1 2px     1 2px     1 2px     1 2px  

   1.2   2    -4.3277  -21.8014  1.000841  0.001357 -0.001038  0.000891

   2.2   +    -0.2968   -5.0836 -0.000651  1.000253 -0.000022  0.000284

                                   1 2py     1 2py     1 2py     1 2py  

   1.3   2    -4.3277  -21.8014  1.000841  0.001357 -0.001038  0.000891

   2.3   +    -0.2968   -5.0836 -0.000651  1.000253 -0.000022  0.000284

                                   1 2pz     1 2pz     1 2pz     1 2pz  

   1.5   2    -4.3301  -21.7916  0.998318 -0.002113  0.002074 -0.001789

 HOMO      2.2    -0.296754 =      -8.0751eV
 LUMO      2.5    -0.009490 =      -0.2582eV
 LUMO-HOMO         0.287264 =       7.8169eV


 **********************************************************************************************************************************
 DATASETS  * FILE   NREC   LENGTH (MB)   RECORD NAMES
              1      20       19.95       500      610      700      900      950      970     1000      129      960     1100   
                                          VAR    BASINP    GEOM    SYMINP    ZMAT    AOBASIS   BASIS     P2S    ABASIS      S 
                                         1400     1410     1420     1200     1210     1080     1600     1650     1300     1700   
                                         EKIN       V       ECP      H0       H01     AOSYM     SMH    MOLCAS    ERIS     OPER   

              2       4        2.75       700     1000      520     4202   
                                         GEOM     BASIS   MCVARS     RHF  

 PROGRAMS   *        TOTAL       RHF       INT
 CPU TIMES  *         0.41      0.04      0.26
 REAL TIME  *         1.64 SEC
 DISK USED  *        24.64 MB      
 **********************************************************************************************************************************


 PROGRAM * MULTI (Direct Multiconfiguration SCF)       Authors: P.J. Knowles, H.-J. Werner (1984)     S.T. Elbert (1988)


 Number of closed-shell orbitals:   5 (   2   1   1   0   1   0   0   0 )
 Number of active  orbitals:        3 (   0   1   1   0   1   0   0   0 )
 Number of external orbitals:      18 (   6   2   2   2   2   2   2   0 )

 State symmetry 1

 Number of electrons:     2    Spin symmetry=Triplet   Space symmetry=4
 Number of states:        1
 Number of CSFs:          1   (1 determinants, 3 intermediate states)

 State symmetry 2

 Number of electrons:     2    Spin symmetry=Triplet   Space symmetry=6
 Number of states:        1
 Number of CSFs:          1   (1 determinants, 3 intermediate states)

 State symmetry 3

 Number of electrons:     2    Spin symmetry=Triplet   Space symmetry=7
 Number of states:        1
 Number of CSFs:          1   (1 determinants, 3 intermediate states)

 Molecular orbitals read from record     4202.2  Type=RHF/CANONICAL (state 1.4)
 *** IN SYMMETRY 1 ORBITAL  1 SYMMETRY CONTAMINATION OF 0.526D-03 HAS BEEN REMOVED
 *** IN SYMMETRY 1 ORBITAL  2 SYMMETRY CONTAMINATION OF 0.321D-02 HAS BEEN REMOVED

 EXTRA SYMMETRY OF MOS IN SYMMETRY 1:   1 1 1 3 2 2 3 1

 Wavefunction dump at record             5202.2

 Convergence thresholds  0.10E-01 (gradient)  0.10E-05 (energy)  0.10E-02 (step length)

 Weight factors for state symmetry  1:    0.33333
 Weight factors for state symmetry  2:    0.33333
 Weight factors for state symmetry  3:    0.33333

 Number of orbital rotations:       27   (     3 Core/Active     18 Core/Virtual   0 Active/Active      6 Active/Virtual)
 Total number of variables:         30


 ITER. MIC  NCI  NEG     ENERGY(VAR)     ENERGY(PROJ)   ENERGY CHANGE     GRAD(0)  GRAD(ORB)   GRAD(CI)     STEP       TIME

   1   16   21    0    -101.61988537    -101.62607984   -0.00619446    0.04862196 0.00000000 0.00000000  0.15D+00      0.02
   2   14   24    0    -101.62607788    -101.62607954   -0.00000166    0.00155955 0.00000000 0.00000000  0.17D-02      0.05
   3   14   15    0    -101.62607954    -101.62607954   -0.00000000    0.00000054 0.00000000 0.00000000  0.70D-06      0.06

 ** WVFN ****  CONVERGENCE REACHED, FINAL GRADIENT:  0.45D-13



 Results for state 1.4
 =====================

 !MCSCF STATE 1.4 Energy             -101.626079538803
 Nuclear energy                         0.00000000
 Kinetic energy                        79.41354057
 One electron energy                 -163.29158385
 Two electron energy                   61.66550431
 Virial ratio                           2.27970720

 !MCSCF STATE 1.4 Dipole moment         0.00000000     0.00000000     0.00000000
 Dipole moment /Debye                   0.00000000     0.00000000     0.00000000



 Results for state 1.6
 =====================

 !MCSCF STATE 1.6 Energy             -101.626079538803
 Nuclear energy                         0.00000000
 Kinetic energy                        79.41354057
 One electron energy                 -163.29158385
 Two electron energy                   61.66550431
 Virial ratio                           2.27970720

 !MCSCF STATE 1.6 Dipole moment         0.00000000     0.00000000     0.00000000
 Dipole moment /Debye                   0.00000000     0.00000000     0.00000000



 Results for state 1.7
 =====================

 !MCSCF STATE 1.7 Energy             -101.626079538803
 Nuclear energy                         0.00000000
 Kinetic energy                        79.41354057
 One electron energy                 -163.29158385
 Two electron energy                   61.66550431
 Virial ratio                           2.27970720

 !MCSCF STATE 1.7 Dipole moment         0.00000000     0.00000000     0.00000000
 Dipole moment /Debye                   0.00000000     0.00000000     0.00000000

 State-averaged charge density matrix saved on record  5202.2 (density set 1)

 !MCSCF expec        <1.4|EKIN|1.4>    79.413540571668
 !MCSCF expec        <1.6|EKIN|1.6>    79.413540571668
 !MCSCF expec        <1.7|EKIN|1.7>    79.413540571668

 !MCSCF expec         <1.4|POT|1.4>   -20.707185037060
 !MCSCF expec         <1.6|POT|1.6>   -20.707185037060
 !MCSCF expec         <1.7|POT|1.7>   -20.707185037060


 NATURAL ORBITALS (state averaged)
 =================================

   Orb     Occ        Energy       Coefficients

                                   1 1s      1 1s      1 1s      1 1s      1 3d0     1 3d2+    1 3d0     1 3d2+ 

   1.1  2.00000    -6.156404     1.000000 -0.000000  0.000000 -0.000000  0.000000  0.000000  0.000000  0.000000

   2.1  2.00000    -0.541507     0.000007  1.000021 -0.000001 -0.000024  0.000000  0.000000  0.000000  0.000000

                                   1 2px     1 2px     1 2px     1 2px  

   1.2  2.00000    -4.328558     1.000000 -0.000001  0.000000 -0.000001

   2.2  0.66667    -0.066090     0.000001  0.999982 -0.000000 -0.000020

                                   1 2py     1 2py     1 2py     1 2py  

   1.3  2.00000    -4.328558     1.000000 -0.000001  0.000000 -0.000001

   2.3  0.66667    -0.066090     0.000001  0.999982 -0.000000 -0.000020

                                   1 2pz     1 2pz     1 2pz     1 2pz  

   1.5  2.00000    -4.328558     1.000000 -0.000001  0.000000 -0.000001

   2.5  0.66667    -0.066090    -0.000001 -0.999982  0.000000  0.000020

 Total charge:  -8.000000000000
 

 EXTRA SYMMETRY OF MOS IN SYMMETRY 1:   1 1 1 2 3 3 2 1

 Natural orbital dump (state averaged) at molpro section  5202.2    (Orbital set 2)


 CI vector for state symmetry 1
 ==============================

 a a 0           1.0000000

 TOTAL ENERGIES                      -101.62607954

 CI vector for state symmetry 2
 ==============================

 a 0 a           1.0000000

 TOTAL ENERGIES                      -101.62607954

 CI vector for state symmetry 3
 ==============================

 0 a a           1.0000000

 TOTAL ENERGIES                      -101.62607954



 **********************************************************************************************************************************
 DATASETS  * FILE   NREC   LENGTH (MB)   RECORD NAMES
              1      21       20.00       500      610      700      900      950      970     1000      129      960     1100   
                                          VAR    BASINP    GEOM    SYMINP    ZMAT    AOBASIS   BASIS     P2S    ABASIS      S 
                                         1400     1410     1420     1200     1210     1080     1600     1650     1300     1700   
                                         EKIN       V       ECP      H0       H01     AOSYM     SMH    MOLCAS    ERIS     OPER   
                                         1380   
                                         JKOP   

              2       5        5.24       700     1000      520     4202     5202   
                                         GEOM     BASIS   MCVARS     RHF     MCSCF   

 PROGRAMS   *        TOTAL     MULTI       RHF       INT
 CPU TIMES  *         0.49      0.08      0.04      0.26
 REAL TIME  *         2.94 SEC
 DISK USED  *        34.48 MB      
 **********************************************************************************************************************************


 PROGRAM * RHF-SCF (OPEN SHELL)       Authors: W. Meyer, H.-J. Werner


 NUMBER OF ELECTRONS:       7+    5-    SPACE SYMMETRY=4    SPIN SYMMETRY: Triplet 
 CONVERGENCE THRESHOLDS:    1.00E-05 (Density)    1.00E-07 (Energy)
 MAX. NUMBER OF ITERATIONS:        0
 INTERPOLATION TYPE:            DIIS
 INTERPOLATION STEPS:              2 (START)      1 (STEP)
 LEVEL SHIFTS:                 -0.60 (CLOSED) -0.30 (OPEN) 

 Number of closed-shell orbitals:    5 (   2   1   1   0   1   0   0 )
 Number of open-shell orbitals:      2 (   0   1   1   0   0   0   0 )


 Molecular orbitals read from record     5202.2  Type=MCSCF/NATURAL (state averaged)

 Molecular orbital dump at record        2101.2

 ITERATION    DDIFF          GRAD             ENERGY        2-EL.EN.            DIPOLE MOMENTS         DIIS   ORB.
    1      0.000D+00      0.000D+00      -101.62607954    123.331009    0.00000    0.00000    0.00000    0    start

 Final alpha occupancy:   2   2   2   0   1   0   0
 Final beta  occupancy:   2   1   1   0   1   0   0

 !RHF STATE 1.4 Energy               -101.626079538803
 Nuclear energy                         0.00000000
 One-electron energy                 -163.29158385
 Two-electron energy                   61.66550431
 Virial quotient                       -1.27970720
 !RHF STATE 1.4 Dipole moment           0.00000000     0.00000000     0.00000000
 Dipole moment /Debye                   0.00000000     0.00000000     0.00000000
 

 !RHF expec          <1.4|EKIN|1.4>    79.413540571668
 
 !RHF expec           <1.4|POT|1.4>   -20.707185037060

 ELECTRON ORBITALS
 =================


   Orb  Occ    Energy  Couls-En    Coefficients

                                   1 1s      1 1s      1 1s      1 1s      1 3d0     1 3d2+    1 3d0     1 3d2+ 

   1.1   2    -6.1564  -24.6927  1.000000 -0.000000  0.000000 -0.000000  0.000000  0.000000  0.000000  0.000000

   2.1   2    -0.5415   -6.4556  0.000007  1.000021 -0.000001 -0.000024  0.000000  0.000000  0.000000  0.000000

                                   1 2px     1 2px     1 2px     1 2px  

   1.2   2    -4.3286  -21.7978  1.000000 -0.000001  0.000000 -0.000001

   2.2   +    -0.0661   -4.8536  0.000001  0.999982 -0.000000 -0.000020

                                   1 2py     1 2py     1 2py     1 2py  

   1.3   2    -4.3286  -21.7978  1.000000 -0.000001  0.000000 -0.000001

   2.3   +    -0.0661   -4.8536  0.000001  0.999982 -0.000000 -0.000020

                                   1 2pz     1 2pz     1 2pz     1 2pz  

   1.5   2    -4.3286  -21.7978  1.000000 -0.000001  0.000000 -0.000001

 HOMO      2.2    -0.066090 =      -1.7984eV
 LUMO      2.5    -0.066090 =      -1.7984eV
 LUMO-HOMO        -0.000000 =      -0.0000eV


 **********************************************************************************************************************************
 DATASETS  * FILE   NREC   LENGTH (MB)   RECORD NAMES
              1      21       20.00       500      610      700      900      950      970     1000      129      960     1100   
                                          VAR    BASINP    GEOM    SYMINP    ZMAT    AOBASIS   BASIS     P2S    ABASIS      S 
                                         1400     1410     1420     1200     1210     1080     1600     1650     1300     1700   
                                         EKIN       V       ECP      H0       H01     AOSYM     SMH    MOLCAS    ERIS     OPER   
                                         1380   
                                         JKOP   

              2       6        7.74       700     1000      520     4202     5202     2101   
                                         GEOM     BASIS   MCVARS     RHF     MCSCF     RHF  

 PROGRAMS   *        TOTAL       RHF     MULTI       RHF       INT
 CPU TIMES  *         0.50      0.01      0.08      0.04      0.26
 REAL TIME  *         3.06 SEC
 DISK USED  *        34.48 MB      
 **********************************************************************************************************************************
 SETTING SCF(I)         =      -101.62607954  AU                              
 SETTING _CC_NORM_MAX   =         2.00000000                                  


 PROGRAM * CCSD (Unrestricted open-shell coupled cluster)     Authors: C. Hampel, H.-J. Werner, 1991, M. Deegan, P.J. Knowles, 1992


 Convergence thresholds:  THRVAR = 1.00D-08  THRDEN = 1.00D-06

 CCSD(T)     terms to be evaluated (factor= 1.000)


 Number of closed-shell orbitals:   5 (   2   1   1   0   1   0   0 )
 Number of active  orbitals:        2 (   0   1   1   0   0   0   0 )
 Number of external orbitals:      19 (   6   2   2   2   3   2   2 )

 Memory could be reduced to 0.32 Mwords without degradation in triples

 Number of N-1 electron functions:              12
 Number of N-2 electron functions:              66
 Number of singly external CSFs:                48
 Number of doubly external CSFs:              2998
 Total number of CSFs:                        3046

 Molecular orbitals read from record     2101.2  Type=RHF/CANONICAL (state 1.4)

 Integral transformation finished. Total CPU:   0.00 sec, npass=  1  Memory used:   0.07 MW

 Starting RMP2 calculation

 ITER.      SQ.NORM     CORR.ENERGY   TOTAL ENERGY   ENERGY CHANGE        DEN1      VAR(S)    VAR(P)  DIIS     TIME
   1      1.03964675    -0.22745033  -101.85352987    -0.22745033    -0.00048103  0.23D-04  0.28D-03  1  1     0.00
   2      1.04041980    -0.22797819  -101.85405773    -0.00052785    -0.00000200  0.32D-07  0.12D-05  2  2     0.00
   3      1.04046303    -0.22800216  -101.85408170    -0.00002397    -0.00000001  0.24D-09  0.59D-08  3  3     0.00
   4      1.04046337    -0.22800203  -101.85408157     0.00000013    -0.00000000  0.44D-12  0.21D-10  4  4     0.00

 Norm of t1 vector:      0.04510618      S-energy:    -0.00229830      T1 diagnostic:  0.00054067
 Norm of t2 vector:      0.19603265      P-energy:    -0.22570373
                                         Alpha-Beta:  -0.16810296
                                         Alpha-Alpha: -0.03287967
                                         Beta-Beta:   -0.02472110

 Spin contamination <S**2-Sz**2-Sz>     0.00483246
  Reference energy                   -101.626079538803
  RHF-RMP2 correlation energy          -0.228002026947
 !RHF-RMP2 energy                    -101.854081565750

 Starting UCCSD calculation

 ITER.      SQ.NORM     CORR.ENERGY   TOTAL ENERGY   ENERGY CHANGE        DEN1      VAR(S)    VAR(P)  DIIS     TIME
   1      1.05558898    -0.24063322  -101.86671275    -0.24063322    -0.00560300  0.27D-03  0.31D-02  1  1     0.01
   2      1.06753033    -0.24691579  -101.87299533    -0.00628258    -0.00042608  0.37D-04  0.25D-03  2  2     0.02
   3      1.07198434    -0.24856510  -101.87464464    -0.00164931    -0.00003977  0.32D-05  0.23D-04  3  3     0.03
   4      1.07324761    -0.24888687  -101.87496641    -0.00032177    -0.00000283  0.14D-06  0.17D-05  4  4     0.04
   5      1.07343353    -0.24890888  -101.87498842    -0.00002200    -0.00000020  0.90D-08  0.11D-06  5  5     0.05
   6      1.07345165    -0.24890953  -101.87498907    -0.00000065    -0.00000001  0.10D-08  0.45D-08  6  6     0.06

 Norm of t1 vector:      0.06088910      S-energy:    -0.00275422      T1 diagnostic:  0.00501696
                                                                       D1 diagnostic:  0.01468579
 Norm of t2 vector:      0.26409121      P-energy:    -0.24615531
                                         Alpha-Beta:  -0.18863662
                                         Alpha-Alpha: -0.03325363
                                         Beta-Beta:   -0.02426505

 Singles amplitudes (print threshold =  0.500E-01):

         I         SYM. A    A   T(IA) [Beta-Beta]

         2         1         2      0.05179767

 Doubles amplitudes (print threshold =  0.500E-01):

         I         J         SYM. A    SYM. B    A         B      T(IJ, AB) [Alpha-Beta]

         2         2         5         5         1         1     -0.11347768
         4         2         1         2         3         1     -0.06139914
         4         2         4         3         1         1     -0.06139914
         4         2         6         5         1         1      0.06379414
         6         2         1         3         3         1      0.06139914
         6         2         4         2         1         1     -0.06139914
         6         2         7         5         1         1      0.06379414

 Spin contamination <S**2-Sz**2-Sz>     0.00031717

 Memory could be reduced to 0.33 Mwords without degradation in triples
 

 RESULTS
 =======

  Reference energy                   -101.626079538803
  UCCSD singles energy                 -0.002754221031
  UCCSD pair energy                    -0.246155305362
  UCCSD correlation energy             -0.248909526393
  Triples (T) contribution             -0.001859801587
  Total correlation energy             -0.250769327979
 
  RHF-UCCSD energy                   -101.874989065196
  RHF-UCCSD[T] energy                -101.876815579833
  RHF-UCCSD-T energy                 -101.876847167083
 !RHF-UCCSD(T) energy                -101.876848866782

 Program statistics:

 Available memory in ccsd:               511999438
 Min. memory needed in ccsd:                 13342
 Max. memory used in ccsd:                   16652
 Max. memory used in cckext:                 53460 ( 6 integral passes)
 Max. memory used in cckint:                 72895 ( 1 integral passes)



 **********************************************************************************************************************************
 DATASETS  * FILE   NREC   LENGTH (MB)   RECORD NAMES
              1      21       20.00       500      610      700      900      950      970     1000      129      960     1100   
                                          VAR    BASINP    GEOM    SYMINP    ZMAT    AOBASIS   BASIS     P2S    ABASIS      S 
                                         1400     1410     1420     1200     1210     1080     1600     1650     1300     1700   
                                         EKIN       V       ECP      H0       H01     AOSYM     SMH    MOLCAS    ERIS     OPER   
                                         1380   
                                         JKOP   

              2       6        7.74       700     1000      520     4202     5202     2101   
                                         GEOM     BASIS   MCVARS     RHF     MCSCF     RHF  

 PROGRAMS   *        TOTAL  UCCSD(T)       RHF     MULTI       RHF       INT
 CPU TIMES  *         0.62      0.12      0.01      0.08      0.04      0.26
 REAL TIME  *         3.99 SEC
 DISK USED  *        34.48 MB      
 **********************************************************************************************************************************
 SETTING POSTHF(I)      =      -101.87684887  AU                              
                                                                                                                                                                                                                                                                

         SCF            POSTHF       EKIN           POT
    -101.6260795   -101.8768489   79.41354057   -20.70718504
                                                  

 UCCSD(T)/USERDEF energy=   -101.876848866782

        UCCSD(T)        RHF-SCF         MULTI           RHF-SCF 
   -101.87684887   -101.62607954   -101.62607954   -101.62614521
 **********************************************************************************************************************************
 Molpro calculation terminated
 Variable memory released
