
 Primary working directories    : /global/cscratch1/sd/aannabe
 Secondary working directories  : /global/cscratch1/sd/aannabe
 Wavefunction directory         : /global/homes/a/aannabe/wfu/
 Main file repository           : /global/cscratch1/sd/aannabe/

 SHA1      : 19cd028119e0e09f93f0674bd8af7968d9b3eff6
 NAME      : 2015.1.36
 ARCHNAME  : linux/x86_64
 FC        : /opt/cray/pe/craype/2.5.14/bin/ftn
 BLASLIB   : -L/opt/intel/compilers_and_libraries_2018.1.163/linux/mkl/lib/intel64 -Wl,-_start-group -lmkl_intel_ilp64 -lmkl_intel_thread -lmkl_core -Wl,-_end-group -liomp5
 id        : lbl

 Nodes     nprocs
 nid00443     1

 Using customized tuning parameters: mindgm=7; mindgv=16; mindgc=1; mindgr=1; noblas=0; minvec=7
 default implementation of scratch files=df  

 ***,Si
 memory,512,m
 gthresh,twoint=1.e-12
 
 gprint,basis,orbitals
 gexpec,ekin,pot
 
 angstrom
 geometry={
 1                                                                               ! Number of atoms
 Si 0.0 0.0 0.0
 }
 
 basis={
 Including file /global/homes/a/aannabe/repos/pseudopotentiallibrary/recipes/Si/ccECP_He_core/Si.ccECP.molpro
 Including file /global/homes/a/aannabe/repos/pseudopotentiallibrary/recipes/Si/ccECP_He_core/cc-pCVTZ.molpro
 }
 
 {rhf
  start,atden
  wf,12,4,2
  occ,2,2,2,0,1,0,0,0
  closed,2,1,1,0,1,0,0,0
                                                                                 ! open,2.2,2.3
  save,4202.2
 }
 {multi
  start,4202.2
  occ,2,2,2,0,2,0,0
  closed,2,1,1,0,1,0,0,0
  wf,12,4,2;state,1
  wf,12,6,2;state,1
  wf,12,7,2;state,1
  natorb,ci,print
  orbital,5202.2
 }
 {rhf,nitord=1,maxit=0
  start,5202.2
  wf,12,4,2
  occ,2,2,2,0,1,0,0,0
  closed,2,1,1,0,1,0,0,0
                                                                                 ! open,2.2,2.3
 }
 
 scf(i)=energy
 
 _CC_NORM_MAX=2.0
 {uccsd(t)
 maxit,100
 core
 }
 posthf(i)=energy
 
 table,scf,posthf,ekin,pot
 save,3.csv,new
 
 

 Variables initialized (889), CPU time= 0.01 sec
 Commands  initialized (702), CPU time= 0.01 sec, 572 directives.
 Default parameters read. Elapsed time= 0.12 sec

 Checking input...
 Passed
1


                                         ***  PROGRAM SYSTEM MOLPRO  ***
                                       Copyright, TTI GmbH Stuttgart, 2015
                                    Version 2015.1 linked Dec 29 2018 15:55:43


 **********************************************************************************************************************************
 LABEL *   Si                                                                            
  64 bit serial version                                                                  DATE: 28-Jan-19          TIME: 15:30:29  
 **********************************************************************************************************************************

 SHA1:             19cd028119e0e09f93f0674bd8af7968d9b3eff6
 **********************************************************************************************************************************

 THRESHOLDS:

 ZERO    =  1.00D-12  ONEINT  =  1.00D-12  TWOINT  =  1.00D-12  PREFAC  =  1.00D-14  LOCALI  =  1.00D-09  EORDER  =  1.00D-04
 ENERGY  =  0.00D+00  ETEST   =  0.00D+00  EDENS   =  0.00D+00  THRDEDEF=  1.00D-06  GRADIENT=  1.00D-02  STEP    =  1.00D-03
 ORBITAL =  1.00D-05  CIVEC   =  1.00D-05  COEFF   =  1.00D-04  PRINTCI =  5.00D-02  PUNCHCI =  9.90D+01  OPTGRAD =  3.00D-04
 OPTENERG=  1.00D-06  OPTSTEP =  3.00D-04  THRGRAD =  1.00D-10  COMPRESS=  1.00D-11  VARMIN  =  1.00D-07  VARMAX  =  1.00D-03
 THRDOUB =  0.00D+00  THRDIV  =  1.00D-05  THRRED  =  1.00D-07  THRPSP  =  1.00D+00  THRDC   =  1.00D-10  THRCS   =  1.00D-10
 THRNRM  =  1.00D-08  THREQ   =  0.00D+00  THRDE   =  1.00D+00  THRREF  =  1.00D-05  SPARFAC =  1.00D+00  THRDLP  =  1.00D-07
 THRDIA  =  1.00D-10  THRDLS  =  1.00D-07  THRGPS  =  0.00D+00  THRKEX  =  0.00D+00  THRDIS  =  2.00D-01  THRVAR  =  1.00D-10
 THRLOC  =  1.00D-06  THRGAP  =  1.00D-06  THRLOCT = -1.00D+00  THRGAPT = -1.00D+00  THRORB  =  1.00D-06  THRMLTP =  0.00D+00
 THRCPQCI=  1.00D-10  KEXTA   =  0.00D+00  THRCOARS=  0.00D+00  SYMTOL  =  1.00D-06  GRADTOL =  1.00D-06  THROVL  =  1.00D-08
 THRORTH =  1.00D-08  GRID    =  1.00D-06  GRIDMAX =  1.00D-03  DTMAX   =  0.00D+00  THROCCDE=  1.00D-01  THROCCDE=  1.00D-01



 ZUNIT=ANG
 

Geometry recognized as XYZ


 Variable memory set to  512000000 words,  buffer space   230000 words

 SETTING BASIS          =    USERDEF


 Recomputing integrals since basis changed


 Using spherical harmonics



 PROGRAM * SEWARD (Integral evaluation for generally contracted gaussian basis sets)     Author: Roland Lindh, 1990

 Geometry written to block  1 of record 700

 Orientation using atomic masses  
 Molecule type: Atom
 Symmetry elements: X,Y,Z
 Rotational constants:       0.0000000      0.0000000      0.0000000 GHz  (calculated with average atomic masses)

 Point group  D2h 



 ATOMIC COORDINATES

 NR  ATOM    CHARGE       X              Y              Z

   1  SI      4.00    0.000000000    0.000000000    0.000000000


          SI  CORE POTENTIAL

          d POTENTIAL

 POWERS             1              3              2              1              1
 EXPONENTIALS   12.06605       15.27662       14.50627       0.000000       0.000000    
 COEFFICIENTS   12.00000       144.7926      -99.22939       4.000000      -12.00000    

          s - d POTENTIAL

 POWERS             2              2
 EXPONENTIALS   92.04625       30.89573    
 COEFFICIENTS   25.22833       150.4831    

          p - d POTENTIAL

 POWERS             2
 EXPONENTIALS   1.000000    
 COEFFICIENTS   0.000000    


 BASIS DATA

   Nr Sym  Nuc  Type         Exponents   Contraction coefficients

    1.1 Ag    1  1s          96.651837    -0.000440   -0.000004
    2.1 Ag                   48.652547     0.018671   -0.004421
                             24.490692    -0.154353    0.043362
                             12.328111    -0.057738    0.015853
                              6.205717     0.168087   -0.051706
                              3.123831     0.453428   -0.162895
                              1.572472     0.417675   -0.250218
                              0.791550     0.111901   -0.124216
                              0.398450     0.003337    0.246325
                              0.200572     0.000995    0.505899
                              0.100964    -0.000038    0.386314
                              0.050823     0.000069    0.087701
    3.1 Ag    1  1s           9.930223     1.000000
    4.1 Ag    1  1s           1.781175     1.000000
    5.1 Ag    1  1s           0.547336     1.000000
    6.1 Ag    1  1s           0.088480     1.000000
    7.1 Ag    1  3d0         11.115847     1.000000
    8.1 Ag    1  3d2+        11.115847     1.000000
    9.1 Ag    1  3d0          3.390126     1.000000
   10.1 Ag    1  3d2+         3.390126     1.000000
   11.1 Ag    1  3d0          0.473506     1.000000
   12.1 Ag    1  3d2+         0.473506     1.000000
   13.1 Ag    1  3d0          0.157898     1.000000
   14.1 Ag    1  3d2+         0.157898     1.000000
    1.2 B3u   1  2px         40.315996     0.012938    0.002833
    2.2 B3u                  21.171265     0.098129    0.020869
                             11.117733     0.179324    0.038236
                              5.838290     0.263886    0.059679
                              3.065879     0.309272    0.072776
                              1.609995     0.232748    0.061129
                              0.845462     0.085900   -0.016776
                              0.443980     0.010260   -0.172259
                              0.233149     0.001560   -0.321196
                              0.122434    -0.000003   -0.362828
                              0.064294     0.000232   -0.220789
                              0.033763    -0.000023   -0.055152
    3.2 B3u   1  2px          4.624701     1.000000
    4.2 B3u   1  2px          1.771338     1.000000
    5.2 B3u   1  2px          0.443733     1.000000
    6.2 B3u   1  2px          0.067145     1.000000
    7.2 B3u   1  4f1+         7.189751     1.000000
    8.2 B3u   1  4f3+         7.189751     1.000000
    9.2 B3u   1  4f1+         0.345983     1.000000
   10.2 B3u   1  4f3+         0.345983     1.000000
    1.3 B2u   1  2py         40.315996     0.012938    0.002833
    2.3 B2u                  21.171265     0.098129    0.020869
                             11.117733     0.179324    0.038236
                              5.838290     0.263886    0.059679
                              3.065879     0.309272    0.072776
                              1.609995     0.232748    0.061129
                              0.845462     0.085900   -0.016776
                              0.443980     0.010260   -0.172259
                              0.233149     0.001560   -0.321196
                              0.122434    -0.000003   -0.362828
                              0.064294     0.000232   -0.220789
                              0.033763    -0.000023   -0.055152
    3.3 B2u   1  2py          4.624701     1.000000
    4.3 B2u   1  2py          1.771338     1.000000
    5.3 B2u   1  2py          0.443733     1.000000
    6.3 B2u   1  2py          0.067145     1.000000
    7.3 B2u   1  4f1-         7.189751     1.000000
    8.3 B2u   1  4f3-         7.189751     1.000000
    9.3 B2u   1  4f1-         0.345983     1.000000
   10.3 B2u   1  4f3-         0.345983     1.000000
    1.4 B1g   1  3d2-        11.115847     1.000000
    2.4 B1g   1  3d2-         3.390126     1.000000
    3.4 B1g   1  3d2-         0.473506     1.000000
    4.4 B1g   1  3d2-         0.157898     1.000000
    1.5 B1u   1  2pz         40.315996     0.012938    0.002833
    2.5 B1u                  21.171265     0.098129    0.020869
                             11.117733     0.179324    0.038236
                              5.838290     0.263886    0.059679
                              3.065879     0.309272    0.072776
                              1.609995     0.232748    0.061129
                              0.845462     0.085900   -0.016776
                              0.443980     0.010260   -0.172259
                              0.233149     0.001560   -0.321196
                              0.122434    -0.000003   -0.362828
                              0.064294     0.000232   -0.220789
                              0.033763    -0.000023   -0.055152
    3.5 B1u   1  2pz          4.624701     1.000000
    4.5 B1u   1  2pz          1.771338     1.000000
    5.5 B1u   1  2pz          0.443733     1.000000
    6.5 B1u   1  2pz          0.067145     1.000000
    7.5 B1u   1  4f0          7.189751     1.000000
    8.5 B1u   1  4f2+         7.189751     1.000000
    9.5 B1u   1  4f0          0.345983     1.000000
   10.5 B1u   1  4f2+         0.345983     1.000000
    1.6 B2g   1  3d1+        11.115847     1.000000
    2.6 B2g   1  3d1+         3.390126     1.000000
    3.6 B2g   1  3d1+         0.473506     1.000000
    4.6 B2g   1  3d1+         0.157898     1.000000
    1.7 B3g   1  3d1-        11.115847     1.000000
    2.7 B3g   1  3d1-         3.390126     1.000000
    3.7 B3g   1  3d1-         0.473506     1.000000
    4.7 B3g   1  3d1-         0.157898     1.000000
    1.8 Au    1  4f2-         7.189751     1.000000
    2.8 Au    1  4f2-         0.345983     1.000000

 NUCLEAR CHARGE:                    4
 NUMBER OF PRIMITIVE AOS:         108
 NUMBER OF SYMMETRY AOS:           98
 NUMBER OF CONTRACTIONS:           58   (  14Ag  +  10B3u +  10B2u +   4B1g +  10B1u +   4B2g +   4B3g +   2Au  )
 NUMBER OF CORE ORBITALS:           0   (   0Ag  +   0B3u +   0B2u +   0B1g +   0B1u +   0B2g +   0B3g +   0Au  )
 NUMBER OF VALENCE ORBITALS:        4   (   1Ag  +   1B3u +   1B2u +   0B1g +   1B1u +   0B2g +   0B3g +   0Au  )


 NUCLEAR REPULSION ENERGY    0.00000000

 EXTRA SYMMETRY OF AOS IN SYMMETRY 1:   1 1 1 1 1 1 2 3 2 3   2 3 2 3
 EXTRA SYMMETRY OF AOS IN SYMMETRY 2:   1 1 1 1 1 1 2 3 2 3
 EXTRA SYMMETRY OF AOS IN SYMMETRY 3:   1 1 1 1 1 1 2 3 2 3
 EXTRA SYMMETRY OF AOS IN SYMMETRY 5:   1 1 1 1 1 1 2 3 2 3

 Eigenvalues of metric

         1 0.503E-02 0.103E-01 0.155E+00 0.329E+00 0.329E+00 0.488E+00 0.488E+00 0.560E+00
         2 0.131E-01 0.267E-01 0.163E+00 0.599E+00 0.980E+00 0.980E+00 0.102E+01 0.102E+01
         3 0.131E-01 0.267E-01 0.163E+00 0.599E+00 0.980E+00 0.980E+00 0.102E+01 0.102E+01
         4 0.329E+00 0.488E+00 0.143E+01 0.175E+01
         5 0.131E-01 0.267E-01 0.163E+00 0.599E+00 0.980E+00 0.980E+00 0.102E+01 0.102E+01
         6 0.329E+00 0.488E+00 0.143E+01 0.175E+01
         7 0.329E+00 0.488E+00 0.143E+01 0.175E+01
         8 0.980E+00 0.102E+01


 Contracted 2-electron integrals neglected if value below      1.0D-12
 AO integral compression algorithm  1   Integral accuracy      1.0D-12

     2.359 MB (compressed) written to integral file ( 66.0%)


 NUMBER OF SORTED TWO-ELECTRON INTEGRALS:     203904.     BUFFER LENGTH:  32768
 NUMBER OF SEGMENTS:   1  SEGMENT LENGTH:     203904      RECORD LENGTH: 524288

 Memory used in sort:       0.76 MW

 SORT1 READ      417520. AND WROTE      167428. INTEGRALS IN      1 RECORDS. CPU TIME:     0.01 SEC, REAL TIME:     0.02 SEC
 SORT2 READ      167428. AND WROTE      203904. INTEGRALS IN      9 RECORDS. CPU TIME:     0.01 SEC, REAL TIME:     0.06 SEC

 FILE SIZES:   FILE 1:    22.3 MBYTE,  FILE 4:     4.2 MBYTE,   TOTAL:     26.6 MBYTE

 OPERATOR DM      FOR CENTER  0  COORDINATES:    0.000000    0.000000    0.000000
 OPERATOR EKIN    FOR CENTER  0  COORDINATES:    0.000000    0.000000    0.000000
 OPERATOR POT     FOR CENTER  0  COORDINATES:    0.000000    0.000000    0.000000


 **********************************************************************************************************************************
 DATASETS  * FILE   NREC   LENGTH (MB)   RECORD NAMES
              1      20       21.04       500      610      700      900      950      970     1000      129      960     1100   
                                          VAR    BASINP    GEOM    SYMINP    ZMAT    AOBASIS   BASIS     P2S    ABASIS      S 
                                         1400     1410     1420     1200     1210     1080     1600     1650     1300     1700   
                                         EKIN       V       ECP      H0       H01     AOSYM     SMH    MOLCAS    ERIS     OPER   

 PROGRAMS   *        TOTAL       INT
 CPU TIMES  *         0.59      0.46
 REAL TIME  *         2.55 SEC
 DISK USED  *        26.83 MB      
 **********************************************************************************************************************************


 PROGRAM * RHF-SCF (OPEN SHELL)       Authors: W. Meyer, H.-J. Werner


 NUMBER OF ELECTRONS:       7+    5-    SPACE SYMMETRY=4    SPIN SYMMETRY: Triplet 
 CONVERGENCE THRESHOLDS:    1.00E-05 (Density)    1.00E-07 (Energy)
 MAX. NUMBER OF ITERATIONS:       60
 INTERPOLATION TYPE:            DIIS
 INTERPOLATION STEPS:              2 (START)      1 (STEP)
 LEVEL SHIFTS:                 -0.60 (CLOSED) -0.30 (OPEN) 

 Number of closed-shell orbitals:    5 (   2   1   1   0   1   0   0   0 )
 Number of open-shell orbitals:      2 (   0   1   1   0   0   0   0   0 )



   Atom=SI basis=ECP10MWB_GUESS    lmin=0  lmax=1

 Orbital guess generated from atomic densities. Full valence occupancy:    1   1   1   0   1   0   0   0


 Molecular orbital dump at record        4202.2

 ITERATION    DDIFF          GRAD             ENERGY        2-EL.EN.            DIPOLE MOMENTS         DIIS   ORB.
    1      0.000D+00      0.000D+00       -88.13385129    183.097483    0.00000    0.00000    0.00000    0    start
    2      0.000D+00      0.838D+00       -99.93477344    105.428373    0.00000    0.00000    0.00000    1    diag,B
    3      0.916D+00      0.302D+00      -101.51763702    120.634978    0.00000    0.00000    0.00000    2    diag,B
    4      0.183D+00      0.331D-01      -101.59902366    122.326034    0.00000    0.00000    0.00000    3    diag,B
    5      0.679D-01      0.943D-02      -101.61955864    122.885232    0.00000    0.00000    0.00000    4    diag,B
    6      0.341D-01      0.369D-02      -101.62570858    123.278041    0.00000    0.00000    0.00000    5    diag,B
    7      0.298D-01      0.118D-02      -101.62619666    123.364174    0.00000    0.00000    0.00000    6    fixocc
    8      0.138D-01      0.289D-03      -101.62621101    123.343471    0.00000    0.00000    0.00000    7    diag,B
    9      0.367D-02      0.517D-04      -101.62621203    123.333372    0.00000    0.00000    0.00000    8    diag,B
   10      0.514D-03      0.595D-05      -101.62621204    123.332063    0.00000    0.00000    0.00000    9    orth
   11      0.504D-04      0.124D-05      -101.62621204    123.332014    0.00000    0.00000    0.00000    9    diag,B
   12      0.211D-05      0.426D-06      -101.62621204    123.332030    0.00000    0.00000    0.00000    0    orth

 Final alpha occupancy:   2   2   2   0   1   0   0   0
 Final beta  occupancy:   2   1   1   0   1   0   0   0

 !RHF STATE 1.4 Energy               -101.626212038428
 Nuclear energy                         0.00000000
 One-electron energy                 -163.29222694
 Two-electron energy                   61.66601491
 Virial quotient                       -1.27970637
 !RHF STATE 1.4 Dipole moment           0.00000000     0.00000000     0.00000000
 Dipole moment /Debye                   0.00000000     0.00000000     0.00000000
 

 !RHF expec          <1.4|EKIN|1.4>    79.413695232523
 
 !RHF expec           <1.4|POT|1.4>   -20.707252158649

 ELECTRON ORBITALS
 =================


   Orb  Occ    Energy  Couls-En    Coefficients

                                   1 1s      1 1s      1 1s      1 1s      1 1s      1 1s      1 3d0     1 3d2+    1 3d0     1 3d2+ 
                                   1 3d0     1 3d2+    1 3d0     1 3d2+ 

   1.1   2    -6.1563  -24.6926  1.000000  0.000003  0.000000 -0.000000  0.000001 -0.000003 -0.000057 -0.000000  0.000812  0.000000
                                 0.000507  0.000000 -0.000353 -0.000000

   2.1   2    -0.5415   -6.4557  0.000043  1.000187  0.000001  0.000021 -0.000008 -0.000222  0.000073 -0.000000 -0.000053  0.000000
                                 0.001409  0.000000 -0.007100  0.000000

                                   1 2px     1 2px     1 2px     1 2px     1 2px     1 2px     1 4f1+    1 4f3+    1 4f1+    1 4f3+ 


   1.2   2    -4.3278  -21.8021  1.001086 -0.000488  0.000159 -0.000920 -0.001032 -0.000350  0.000193  0.000000  0.000182 -0.000000

   2.2   +    -0.2968   -5.0836  0.000638 -1.000115 -0.000005  0.000026  0.000037 -0.000169  0.000000 -0.000000  0.000036 -0.000000

                                   1 2py     1 2py     1 2py     1 2py     1 2py     1 2py     1 4f1-    1 4f3-    1 4f1-    1 4f3- 


   1.3   2    -4.3278  -21.8021  1.001086 -0.000488  0.000159 -0.000920 -0.001032 -0.000350  0.000193 -0.000000  0.000182  0.000000

   2.3   +    -0.2968   -5.0836  0.000638 -1.000115 -0.000005  0.000026  0.000037 -0.000169  0.000000  0.000000  0.000036  0.000000

                                   1 2pz     1 2pz     1 2pz     1 2pz     1 2pz     1 2pz     1 4f0     1 4f2+    1 4f0     1 4f2+ 


   1.5   2    -4.3298  -21.7902  0.997809  0.001600 -0.000305  0.001834  0.002085  0.000708  0.000237 -0.000000  0.000226 -0.000000

 HOMO      2.2    -0.296810 =      -8.0766eV
 LUMO      2.5    -0.011710 =      -0.3186eV
 LUMO-HOMO         0.285100 =       7.7580eV


 **********************************************************************************************************************************
 DATASETS  * FILE   NREC   LENGTH (MB)   RECORD NAMES
              1      20       21.04       500      610      700      900      950      970     1000      129      960     1100   
                                          VAR    BASINP    GEOM    SYMINP    ZMAT    AOBASIS   BASIS     P2S    ABASIS      S 
                                         1400     1410     1420     1200     1210     1080     1600     1650     1300     1700   
                                         EKIN       V       ECP      H0       H01     AOSYM     SMH    MOLCAS    ERIS     OPER   

              2       4        2.77       700     1000      520     4202   
                                         GEOM     BASIS   MCVARS     RHF  

 PROGRAMS   *        TOTAL       RHF       INT
 CPU TIMES  *         0.67      0.08      0.46
 REAL TIME  *         2.84 SEC
 DISK USED  *        26.83 MB      
 **********************************************************************************************************************************


 PROGRAM * MULTI (Direct Multiconfiguration SCF)       Authors: P.J. Knowles, H.-J. Werner (1984)     S.T. Elbert (1988)


 Number of closed-shell orbitals:   5 (   2   1   1   0   1   0   0   0 )
 Number of active  orbitals:        3 (   0   1   1   0   1   0   0   0 )
 Number of external orbitals:      50 (  12   8   8   4   8   4   4   2 )

 State symmetry 1

 Number of electrons:     2    Spin symmetry=Triplet   Space symmetry=4
 Number of states:        1
 Number of CSFs:          1   (1 determinants, 3 intermediate states)

 State symmetry 2

 Number of electrons:     2    Spin symmetry=Triplet   Space symmetry=6
 Number of states:        1
 Number of CSFs:          1   (1 determinants, 3 intermediate states)

 State symmetry 3

 Number of electrons:     2    Spin symmetry=Triplet   Space symmetry=7
 Number of states:        1
 Number of CSFs:          1   (1 determinants, 3 intermediate states)

 Molecular orbitals read from record     4202.2  Type=RHF/CANONICAL (state 1.4)
 *** IN SYMMETRY 1 ORBITAL  1 SYMMETRY CONTAMINATION OF 0.173D-02 HAS BEEN REMOVED
 *** IN SYMMETRY 1 ORBITAL  2 SYMMETRY CONTAMINATION OF 0.856D-02 HAS BEEN REMOVED

 EXTRA SYMMETRY OF MOS IN SYMMETRY 1:   1 1 1 3 2 2 3 1 2 3   1 2 3 1
 *** IN SYMMETRY 2 ORBITAL  1 SYMMETRY CONTAMINATION OF 0.373D-03 HAS BEEN REMOVED
 *** IN SYMMETRY 2 ORBITAL  2 SYMMETRY CONTAMINATION OF 0.359D-04 HAS BEEN REMOVED
 EXTRA SYMMETRY OF MOS IN SYMMETRY 2:   1 1 1 1 2 3 1 2 3 1
 *** IN SYMMETRY 3 ORBITAL  1 SYMMETRY CONTAMINATION OF 0.373D-03 HAS BEEN REMOVED
 *** IN SYMMETRY 3 ORBITAL  2 SYMMETRY CONTAMINATION OF 0.359D-04 HAS BEEN REMOVED
 EXTRA SYMMETRY OF MOS IN SYMMETRY 3:   1 1 1 1 2 3 1 2 3 1
 *** IN SYMMETRY 5 ORBITAL  1 SYMMETRY CONTAMINATION OF 0.460D-03 HAS BEEN REMOVED
 *** IN SYMMETRY 5 ORBITAL  2 SYMMETRY CONTAMINATION OF 0.290D-03 HAS BEEN REMOVED
 EXTRA SYMMETRY OF MOS IN SYMMETRY 5:   1 1 1 1 2 3 1 2 3 1

 Wavefunction dump at record             5202.2

 Convergence thresholds  0.10E-01 (gradient)  0.10E-05 (energy)  0.10E-02 (step length)

 Weight factors for state symmetry  1:    0.33333
 Weight factors for state symmetry  2:    0.33333
 Weight factors for state symmetry  3:    0.33333

 Number of orbital rotations:       75   (     3 Core/Active     48 Core/Virtual   0 Active/Active     24 Active/Virtual)
 Total number of variables:         78


 ITER. MIC  NCI  NEG     ENERGY(VAR)     ENERGY(PROJ)   ENERGY CHANGE     GRAD(0)  GRAD(ORB)   GRAD(CI)     STEP       TIME

   1   17   21    0    -101.61753183    -101.62608043   -0.00854860    0.05215229 0.00000000 0.00000000  0.19D+00      0.02
   2   15   24    0    -101.62607661    -101.62607954   -0.00000293    0.00195117 0.00000000 0.00000000  0.26D-02      0.04
   3   15   15    0    -101.62607954    -101.62607954   -0.00000000    0.00000107 0.00000000 0.00000000  0.13D-05      0.06

 ** WVFN ****  CONVERGENCE REACHED, FINAL GRADIENT:  0.31D-12



 Results for state 1.4
 =====================

 !MCSCF STATE 1.4 Energy             -101.626079538961
 Nuclear energy                         0.00000000
 Kinetic energy                        79.41348183
 One electron energy                 -163.29160586
 Two electron energy                   61.66552632
 Virial ratio                           2.27970815

 !MCSCF STATE 1.4 Dipole moment         0.00000000     0.00000000     0.00000000
 Dipole moment /Debye                   0.00000000     0.00000000     0.00000000



 Results for state 1.6
 =====================

 !MCSCF STATE 1.6 Energy             -101.626079538961
 Nuclear energy                         0.00000000
 Kinetic energy                        79.41348183
 One electron energy                 -163.29160586
 Two electron energy                   61.66552632
 Virial ratio                           2.27970815

 !MCSCF STATE 1.6 Dipole moment         0.00000000     0.00000000     0.00000000
 Dipole moment /Debye                   0.00000000     0.00000000     0.00000000



 Results for state 1.7
 =====================

 !MCSCF STATE 1.7 Energy             -101.626079538961
 Nuclear energy                         0.00000000
 Kinetic energy                        79.41348183
 One electron energy                 -163.29160586
 Two electron energy                   61.66552632
 Virial ratio                           2.27970815

 !MCSCF STATE 1.7 Dipole moment         0.00000000     0.00000000     0.00000000
 Dipole moment /Debye                   0.00000000     0.00000000     0.00000000

 State-averaged charge density matrix saved on record  5202.2 (density set 1)

 !MCSCF expec        <1.4|EKIN|1.4>    79.413481828449
 !MCSCF expec        <1.6|EKIN|1.6>    79.413481828449
 !MCSCF expec        <1.7|EKIN|1.7>    79.413481828449

 !MCSCF expec         <1.4|POT|1.4>   -20.707180705171
 !MCSCF expec         <1.6|POT|1.6>   -20.707180705171
 !MCSCF expec         <1.7|POT|1.7>   -20.707180705171


 NATURAL ORBITALS (state averaged)
 =================================

   Orb     Occ        Energy       Coefficients

                                   1 1s      1 1s      1 1s      1 1s      1 1s      1 1s      1 3d0     1 3d2+    1 3d0     1 3d2+ 
                                   1 3d0     1 3d2+    1 3d0     1 3d2+ 

   1.1  2.00000    -6.156402     1.000000 -0.000000  0.000000  0.000000 -0.000000 -0.000000  0.000000  0.000000  0.000000  0.000000
                                 0.000000  0.000000  0.000000  0.000000

   2.1  2.00000    -0.541505     0.000005  1.000039 -0.000000  0.000011 -0.000009 -0.000038  0.000000  0.000000  0.000000  0.000000
                                 0.000000  0.000000  0.000000  0.000000

                                   1 2px     1 2px     1 2px     1 2px     1 2px     1 2px     1 4f1+    1 4f3+    1 4f1+    1 4f3+ 


   1.2  2.00000    -4.328556     0.999994  0.000004  0.000004 -0.000000  0.000004  0.000002  0.000000  0.000000  0.000000  0.000000

   2.2  0.66667    -0.066089    -0.000005 -0.999987  0.000004 -0.000001  0.000005  0.000012  0.000000  0.000000  0.000000  0.000000

                                   1 2py     1 2py     1 2py     1 2py     1 2py     1 2py     1 4f1-    1 4f3-    1 4f1-    1 4f3- 


   1.3  2.00000    -4.328556     0.999994  0.000004  0.000004 -0.000000  0.000004  0.000002  0.000000  0.000000  0.000000  0.000000

   2.3  0.66667    -0.066089    -0.000005 -0.999987  0.000004 -0.000001  0.000005  0.000012  0.000000  0.000000  0.000000  0.000000

                                   1 2pz     1 2pz     1 2pz     1 2pz     1 2pz     1 2pz     1 4f0     1 4f2+    1 4f0     1 4f2+ 


   1.5  2.00000    -4.328556     0.999994  0.000004  0.000004 -0.000000  0.000004  0.000002  0.000000  0.000000  0.000000  0.000000

   2.5  0.66667    -0.066089    -0.000005 -0.999987  0.000004 -0.000001  0.000005  0.000012  0.000000  0.000000  0.000000  0.000000

 Total charge:  -8.000000000000
 

 EXTRA SYMMETRY OF MOS IN SYMMETRY 1:   1 1 1 2 3 3 2 1 2 3   1 2 3 1
 EXTRA SYMMETRY OF MOS IN SYMMETRY 2:   1 1 1 1 3 2 1 3 2 1
 EXTRA SYMMETRY OF MOS IN SYMMETRY 3:   1 1 1 1 3 2 1 3 2 1
 EXTRA SYMMETRY OF MOS IN SYMMETRY 5:   1 1 1 1 3 2 1 2 3 1

 Natural orbital dump (state averaged) at molpro section  5202.2    (Orbital set 2)


 CI vector for state symmetry 1
 ==============================

 a a 0           1.0000000

 TOTAL ENERGIES                      -101.62607954

 CI vector for state symmetry 2
 ==============================

 a 0 a           1.0000000

 TOTAL ENERGIES                      -101.62607954

 CI vector for state symmetry 3
 ==============================

 0 a a           1.0000000

 TOTAL ENERGIES                      -101.62607954



 **********************************************************************************************************************************
 DATASETS  * FILE   NREC   LENGTH (MB)   RECORD NAMES
              1      21       21.26       500      610      700      900      950      970     1000      129      960     1100   
                                          VAR    BASINP    GEOM    SYMINP    ZMAT    AOBASIS   BASIS     P2S    ABASIS      S 
                                         1400     1410     1420     1200     1210     1080     1600     1650     1300     1700   
                                         EKIN       V       ECP      H0       H01     AOSYM     SMH    MOLCAS    ERIS     OPER   
                                         1380   
                                         JKOP   

              2       5        5.28       700     1000      520     4202     5202   
                                         GEOM     BASIS   MCVARS     RHF     MCSCF   

 PROGRAMS   *        TOTAL     MULTI       RHF       INT
 CPU TIMES  *         0.76      0.09      0.08      0.46
 REAL TIME  *         4.24 SEC
 DISK USED  *        36.54 MB      
 **********************************************************************************************************************************


 PROGRAM * RHF-SCF (OPEN SHELL)       Authors: W. Meyer, H.-J. Werner


 NUMBER OF ELECTRONS:       7+    5-    SPACE SYMMETRY=4    SPIN SYMMETRY: Triplet 
 CONVERGENCE THRESHOLDS:    1.00E-05 (Density)    1.00E-07 (Energy)
 MAX. NUMBER OF ITERATIONS:        0
 INTERPOLATION TYPE:            DIIS
 INTERPOLATION STEPS:              2 (START)      1 (STEP)
 LEVEL SHIFTS:                 -0.60 (CLOSED) -0.30 (OPEN) 

 Number of closed-shell orbitals:    5 (   2   1   1   0   1   0   0   0 )
 Number of open-shell orbitals:      2 (   0   1   1   0   0   0   0   0 )


 Molecular orbitals read from record     5202.2  Type=MCSCF/NATURAL (state averaged)

 Molecular orbital dump at record        2101.2

 ITERATION    DDIFF          GRAD             ENERGY        2-EL.EN.            DIPOLE MOMENTS         DIIS   ORB.
    1      0.000D+00      0.000D+00      -101.62607954    123.331053    0.00000    0.00000    0.00000    0    start

 Final alpha occupancy:   2   2   2   0   1   0   0   0
 Final beta  occupancy:   2   1   1   0   1   0   0   0

 !RHF STATE 1.4 Energy               -101.626079538961
 Nuclear energy                         0.00000000
 One-electron energy                 -163.29160586
 Two-electron energy                   61.66552632
 Virial quotient                       -1.27970815
 !RHF STATE 1.4 Dipole moment           0.00000000     0.00000000     0.00000000
 Dipole moment /Debye                   0.00000000     0.00000000     0.00000000
 

 !RHF expec          <1.4|EKIN|1.4>    79.413481828449
 
 !RHF expec           <1.4|POT|1.4>   -20.707180705171

 ELECTRON ORBITALS
 =================


   Orb  Occ    Energy  Couls-En    Coefficients

                                   1 1s      1 1s      1 1s      1 1s      1 1s      1 1s      1 3d0     1 3d2+    1 3d0     1 3d2+ 
                                   1 3d0     1 3d2+    1 3d0     1 3d2+ 

   1.1   2    -6.1564  -24.6927  1.000000 -0.000000  0.000000  0.000000 -0.000000 -0.000000  0.000000  0.000000  0.000000  0.000000
                                 0.000000  0.000000  0.000000  0.000000

   2.1   2    -0.5415   -6.4556  0.000005  1.000039 -0.000000  0.000011 -0.000009 -0.000038  0.000000  0.000000  0.000000  0.000000
                                 0.000000  0.000000  0.000000  0.000000

                                   1 2px     1 2px     1 2px     1 2px     1 2px     1 2px     1 4f1+    1 4f3+    1 4f1+    1 4f3+ 


   1.2   2    -4.3286  -21.7978  0.999994  0.000004  0.000004 -0.000000  0.000004  0.000002  0.000000  0.000000  0.000000  0.000000

   2.2   +    -0.0661   -4.8536 -0.000005 -0.999987  0.000004 -0.000001  0.000005  0.000012  0.000000  0.000000  0.000000  0.000000

                                   1 2py     1 2py     1 2py     1 2py     1 2py     1 2py     1 4f1-    1 4f3-    1 4f1-    1 4f3- 


   1.3   2    -4.3286  -21.7978  0.999994  0.000004  0.000004 -0.000000  0.000004  0.000002  0.000000  0.000000  0.000000  0.000000

   2.3   +    -0.0661   -4.8536 -0.000005 -0.999987  0.000004 -0.000001  0.000005  0.000012  0.000000  0.000000  0.000000  0.000000

                                   1 2pz     1 2pz     1 2pz     1 2pz     1 2pz     1 2pz     1 4f0     1 4f2+    1 4f0     1 4f2+ 


   1.5   2    -4.3286  -21.7978  0.999994  0.000004  0.000004 -0.000000  0.000004  0.000002  0.000000  0.000000  0.000000  0.000000

 HOMO      2.2    -0.066089 =      -1.7984eV
 LUMO      2.5    -0.066089 =      -1.7984eV
 LUMO-HOMO        -0.000000 =      -0.0000eV


 **********************************************************************************************************************************
 DATASETS  * FILE   NREC   LENGTH (MB)   RECORD NAMES
              1      21       21.26       500      610      700      900      950      970     1000      129      960     1100   
                                          VAR    BASINP    GEOM    SYMINP    ZMAT    AOBASIS   BASIS     P2S    ABASIS      S 
                                         1400     1410     1420     1200     1210     1080     1600     1650     1300     1700   
                                         EKIN       V       ECP      H0       H01     AOSYM     SMH    MOLCAS    ERIS     OPER   
                                         1380   
                                         JKOP   

              2       6        7.80       700     1000      520     4202     5202     2101   
                                         GEOM     BASIS   MCVARS     RHF     MCSCF     RHF  

 PROGRAMS   *        TOTAL       RHF     MULTI       RHF       INT
 CPU TIMES  *         0.78      0.02      0.09      0.08      0.46
 REAL TIME  *         4.37 SEC
 DISK USED  *        36.54 MB      
 **********************************************************************************************************************************
 SETTING SCF(I)         =      -101.62607954  AU                              
 SETTING _CC_NORM_MAX   =         2.00000000                                  


 PROGRAM * CCSD (Unrestricted open-shell coupled cluster)     Authors: C. Hampel, H.-J. Werner, 1991, M. Deegan, P.J. Knowles, 1992


 Convergence thresholds:  THRVAR = 1.00D-08  THRDEN = 1.00D-06

 CCSD(T)     terms to be evaluated (factor= 1.000)


 Number of closed-shell orbitals:   5 (   2   1   1   0   1   0   0   0 )
 Number of active  orbitals:        2 (   0   1   1   0   0   0   0   0 )
 Number of external orbitals:      51 (  12   8   8   4   9   4   4   2 )

 Memory could be reduced to 0.65 Mwords without degradation in triples

 Number of N-1 electron functions:              12
 Number of N-2 electron functions:              66
 Number of singly external CSFs:               120
 Number of doubly external CSFs:             18800
 Total number of CSFs:                       18920

 Molecular orbitals read from record     2101.2  Type=RHF/CANONICAL (state 1.4)

 Integral transformation finished. Total CPU:   0.01 sec, npass=  1  Memory used:   0.13 MW

 Starting RMP2 calculation

 ITER.      SQ.NORM     CORR.ENERGY   TOTAL ENERGY   ENERGY CHANGE        DEN1      VAR(S)    VAR(P)  DIIS     TIME
   1      1.05133705    -0.33785158  -101.96393112    -0.33785158    -0.00066121  0.35D-04  0.40D-03  1  1     0.01
   2      1.05245500    -0.33857794  -101.96465748    -0.00072636    -0.00000392  0.12D-06  0.25D-05  2  2     0.01
   3      1.05253709    -0.33861984  -101.96469938    -0.00004190    -0.00000002  0.36D-09  0.10D-07  3  3     0.01
   4      1.05253781    -0.33861976  -101.96469930     0.00000008    -0.00000000  0.24D-11  0.27D-10  4  4     0.01

 Norm of t1 vector:      0.05036089      S-energy:    -0.00263108      T1 diagnostic:  0.00102417
 Norm of t2 vector:      0.22361036      P-energy:    -0.33598868
                                         Alpha-Beta:  -0.25443064
                                         Alpha-Alpha: -0.04661417
                                         Beta-Beta:   -0.03494387

 Spin contamination <S**2-Sz**2-Sz>     0.00573366
  Reference energy                   -101.626079538961
  RHF-RMP2 correlation energy          -0.338619756415
 !RHF-RMP2 energy                    -101.964699295377

 Starting UCCSD calculation

 ITER.      SQ.NORM     CORR.ENERGY   TOTAL ENERGY   ENERGY CHANGE        DEN1      VAR(S)    VAR(P)  DIIS     TIME
   1      1.06559562    -0.35103526  -101.97711480    -0.35103526    -0.00575853  0.50D-03  0.28D-02  1  1     0.05
   2      1.07628693    -0.35690209  -101.98298163    -0.00586683    -0.00054164  0.53D-04  0.31D-03  2  2     0.07
   3      1.08143228    -0.35873670  -101.98481623    -0.00183461    -0.00004689  0.43D-05  0.27D-04  3  3     0.09
   4      1.08298059    -0.35913593  -101.98521547    -0.00039924    -0.00000487  0.46D-06  0.29D-05  4  4     0.11
   5      1.08330746    -0.35917973  -101.98525927    -0.00004379    -0.00000028  0.16D-07  0.15D-06  5  5     0.13
   6      1.08334577    -0.35918599  -101.98526552    -0.00000626    -0.00000002  0.61D-09  0.11D-07  6  6     0.15
   7      1.08334781    -0.35918604  -101.98526558    -0.00000005    -0.00000000  0.46D-10  0.12D-08  6  1     0.19

 Norm of t1 vector:      0.06873314      S-energy:    -0.00303578      T1 diagnostic:  0.00693224
                                                                       D1 diagnostic:  0.01850713
 Norm of t2 vector:      0.28039894      P-energy:    -0.35615026
                                         Alpha-Beta:  -0.27513626
                                         Alpha-Alpha: -0.04686880
                                         Beta-Beta:   -0.03414520

 Doubles amplitudes (print threshold =  0.500E-01):

         I         J         SYM. A    SYM. B    A         B      T(IJ, AB) [Alpha-Alpha]

         6         4         1         4         3         1      0.05329274
         6         4         4         1         1         3     -0.05329274
 
         I         J         SYM. A    SYM. B    A         B      T(IJ, AB) [Alpha-Beta]

         2         2         5         5         1         1     -0.10662921
         4         2         1         2         3         1     -0.05994390
         4         2         4         3         1         1     -0.05994390
         4         2         6         5         1         1     -0.06227004
         6         2         1         3         3         1      0.05994390
         6         2         4         2         1         1     -0.05994390
         6         2         7         5         1         1     -0.06227004

 Spin contamination <S**2-Sz**2-Sz>     0.00287292

 Memory could be reduced to 0.67 Mwords without degradation in triples
 

 RESULTS
 =======

  Reference energy                   -101.626079538961
  UCCSD singles energy                 -0.003035775848
  UCCSD pair energy                    -0.356150262820
  UCCSD correlation energy             -0.359186038668
  Triples (T) contribution             -0.005221165830
  Total correlation energy             -0.364407204498
 
  RHF-UCCSD energy                   -101.985265577629
  RHF-UCCSD[T] energy                -101.990479735382
  RHF-UCCSD-T energy                 -101.990486974381
 !RHF-UCCSD(T) energy                -101.990486743459

 Program statistics:

 Available memory in ccsd:               511999438
 Min. memory needed in ccsd:                 69142
 Max. memory used in ccsd:                   90083
 Max. memory used in cckext:                114906 ( 7 integral passes)
 Max. memory used in cckint:                127186 ( 1 integral passes)



 **********************************************************************************************************************************
 DATASETS  * FILE   NREC   LENGTH (MB)   RECORD NAMES
              1      21       21.26       500      610      700      900      950      970     1000      129      960     1100   
                                          VAR    BASINP    GEOM    SYMINP    ZMAT    AOBASIS   BASIS     P2S    ABASIS      S 
                                         1400     1410     1420     1200     1210     1080     1600     1650     1300     1700   
                                         EKIN       V       ECP      H0       H01     AOSYM     SMH    MOLCAS    ERIS     OPER   
                                         1380   
                                         JKOP   

              2       6        7.80       700     1000      520     4202     5202     2101   
                                         GEOM     BASIS   MCVARS     RHF     MCSCF     RHF  

 PROGRAMS   *        TOTAL  UCCSD(T)       RHF     MULTI       RHF       INT
 CPU TIMES  *         1.15      0.37      0.02      0.09      0.08      0.46
 REAL TIME  *         5.72 SEC
 DISK USED  *        36.66 MB      
 **********************************************************************************************************************************
 SETTING POSTHF(I)      =      -101.99048674  AU                              
                                                                                                                                                                                                                                                                

         SCF            POSTHF       EKIN           POT
    -101.6260795   -101.9904867   79.41348183   -20.70718071
                                                  

 UCCSD(T)/USERDEF energy=   -101.990486743459

        UCCSD(T)        RHF-SCF         MULTI           RHF-SCF 
   -101.99048674   -101.62607954   -101.62607954   -101.62621204
 **********************************************************************************************************************************
 Molpro calculation terminated
 Variable memory released
