
 Primary working directories    : /global/cscratch1/sd/aannabe
 Secondary working directories  : /global/cscratch1/sd/aannabe
 Wavefunction directory         : /global/homes/a/aannabe/wfu/
 Main file repository           : /global/cscratch1/sd/aannabe/

 SHA1      : 19cd028119e0e09f93f0674bd8af7968d9b3eff6
 NAME      : 2015.1.36
 ARCHNAME  : linux/x86_64
 FC        : /opt/cray/pe/craype/2.5.14/bin/ftn
 BLASLIB   : -L/opt/intel/compilers_and_libraries_2018.1.163/linux/mkl/lib/intel64 -Wl,-_start-group -lmkl_intel_ilp64 -lmkl_intel_thread -lmkl_core -Wl,-_end-group -liomp5
 id        : lbl

 Nodes     nprocs
 nid00471     1

 Using customized tuning parameters: mindgm=7; mindgv=16; mindgc=1; mindgr=1; noblas=0; minvec=7
 default implementation of scratch files=df  

 ***,Se
 memory,8,g
 gthresh,twoint=1.e-12
 
 gprint,basis,orbitals
 gexpec,ekin,pot
 
 angstrom
 geometry={
 1                                                                               ! Number of atoms
 Se 0.0 0.0 0.0
 }
 
 basis={
 
 Including file /global/homes/a/aannabe/repos/pseudopotentiallibrary/recipes/Se/ccECP/Se.ccECP.molpro
 
                                   !include,/global/homes/a/aannabe/repos/pseudopotentiallibrary/recipes/Se/ccECP/Se.cc-pVDZ.molpro
                                  !include,/global/homes/a/aannabe/repos/pseudopotentiallibrary/recipes/Se/ccECP/Se.cc-pCVDZ.molpro
 Including file /global/homes/a/aannabe/repos/pseudopotentiallibrary/recipes/Se/ccECP/Se.aug-cc-pVDZ.molpro
 
 
 }
 
 
 {rhf
  start,atden
  wf,6,7,2
  occ,1,1,1,0,1,0,0,0
  open,1.3,1.5
  orbital,4202.2
 }
 {multi
  maxiter,40
  start,4202.2
  occ,1,1,1,0,1,0,0,0
  closed,1,0,0,0,0,0,0
  wf,6,4,2;state,1
  wf,6,6,2;state,1
  wf,6,7,2;state,1
  natorb,ci,print
  orbital,5202.2
 }
 {rhf,nitord=1,maxit=0
  start,5202.2
  wf,6,7,2
  occ,1,1,1,0,1,0,0,0
  open,1.3,1.5
 }
 
 scf(i)=energy
 
 _CC_NORM_MAX=2.0
  !NOTE: Perturbative MRCC works only with UHF reference. So, here we will trick MRCC by doing zero UHF iteration right after ROHF.
 
 {uhf
 maxit,0
 }
 scf(i)=energy
 
 {mrcc,method=CCSDT(Q)
 orbital,ignore_error=1                                                          !Ignore the fact that UHF WF is not converged
 maxit,100
 core
 }
 posthf(i)=energy
 
 table,scf,posthf,ekin,pot
 save,2.csv,new
 
 

 Variables initialized (889), CPU time= 0.01 sec
 Commands  initialized (702), CPU time= 0.01 sec, 572 directives.
 Default parameters read. Elapsed time= 0.10 sec

 Checking input...
 Passed
1


                                         ***  PROGRAM SYSTEM MOLPRO  ***
                                       Copyright, TTI GmbH Stuttgart, 2015
                                    Version 2015.1 linked Dec 29 2018 15:55:43


 **********************************************************************************************************************************
 LABEL *   Se                                                                            
  64 bit serial version                                                                  DATE: 25-Jun-19          TIME: 12:31:40  
 **********************************************************************************************************************************

 SHA1:             19cd028119e0e09f93f0674bd8af7968d9b3eff6
 **********************************************************************************************************************************

 THRESHOLDS:

 ZERO    =  1.00D-12  ONEINT  =  1.00D-12  TWOINT  =  1.00D-12  PREFAC  =  1.00D-14  LOCALI  =  1.00D-09  EORDER  =  1.00D-04
 ENERGY  =  0.00D+00  ETEST   =  0.00D+00  EDENS   =  0.00D+00  THRDEDEF=  1.00D-06  GRADIENT=  1.00D-02  STEP    =  1.00D-03
 ORBITAL =  1.00D-05  CIVEC   =  1.00D-05  COEFF   =  1.00D-04  PRINTCI =  5.00D-02  PUNCHCI =  9.90D+01  OPTGRAD =  3.00D-04
 OPTENERG=  1.00D-06  OPTSTEP =  3.00D-04  THRGRAD =  1.00D-10  COMPRESS=  1.00D-11  VARMIN  =  1.00D-07  VARMAX  =  1.00D-03
 THRDOUB =  0.00D+00  THRDIV  =  1.00D-05  THRRED  =  1.00D-07  THRPSP  =  1.00D+00  THRDC   =  1.00D-10  THRCS   =  1.00D-10
 THRNRM  =  1.00D-08  THREQ   =  0.00D+00  THRDE   =  1.00D+00  THRREF  =  1.00D-05  SPARFAC =  1.00D+00  THRDLP  =  1.00D-07
 THRDIA  =  1.00D-10  THRDLS  =  1.00D-07  THRGPS  =  0.00D+00  THRKEX  =  0.00D+00  THRDIS  =  2.00D-01  THRVAR  =  1.00D-10
 THRLOC  =  1.00D-06  THRGAP  =  1.00D-06  THRLOCT = -1.00D+00  THRGAPT = -1.00D+00  THRORB  =  1.00D-06  THRMLTP =  0.00D+00
 THRCPQCI=  1.00D-10  KEXTA   =  0.00D+00  THRCOARS=  0.00D+00  SYMTOL  =  1.00D-06  GRADTOL =  1.00D-06  THROVL  =  1.00D-08
 THRORTH =  1.00D-08  GRID    =  1.00D-06  GRIDMAX =  1.00D-03  DTMAX   =  0.00D+00  THROCCDE=  1.00D-01  THROCCDE=  1.00D-01



 ZUNIT=ANG
 

Geometry recognized as XYZ


 Variable memory set to 8000000000 words,  buffer space   230000 words

 SETTING BASIS          =    USERDEF


 Recomputing integrals since basis changed


 Using spherical harmonics



 PROGRAM * SEWARD (Integral evaluation for generally contracted gaussian basis sets)     Author: Roland Lindh, 1990

 Geometry written to block  1 of record 700

 Orientation using atomic masses  
 Molecule type: Atom
 Symmetry elements: X,Y,Z
 Rotational constants:       0.0000000      0.0000000      0.0000000 GHz  (calculated with average atomic masses)

 Point group  D2h 



 ATOMIC COORDINATES

 NR  ATOM    CHARGE       X              Y              Z

   1  SE      6.00    0.000000000    0.000000000    0.000000000


          SE  CORE POTENTIAL

          f POTENTIAL

 POWERS             1              3              2              2
 EXPONENTIALS   2.977052       7.016674       3.960663       5.028263    
 COEFFICIENTS   6.000000       17.86231      -20.00913       10.00574    

          s - f POTENTIAL

 POWERS             2              2
 EXPONENTIALS   4.175363       2.144911    
 COEFFICIENTS   71.37928      0.4261986    

          p - f POTENTIAL

 POWERS             2              2
 EXPONENTIALS   4.287722       2.095383    
 COEFFICIENTS   50.94829       5.542881    

          d - f POTENTIAL

 POWERS             2              2
 EXPONENTIALS   1.394037       1.696599    
 COEFFICIENTS   6.204697      0.5339570    


 BASIS DATA

   Nr Sym  Nuc  Type         Exponents   Contraction coefficients

    1.1 Ag    1  1s          53.235856    -0.000173
                             24.069480     0.001518
                             10.882513    -0.015384
                              4.920301     0.136816
                              2.224611    -0.394610
                              1.005811    -0.139559
                              0.454757     0.507331
                              0.205609     0.586875
                              0.092962     0.177170
    2.1 Ag    1  1s           0.063298     1.000000
    3.1 Ag    1  1s           0.025319     1.000000
    4.1 Ag    1  3d0          0.364897     1.000000
    5.1 Ag    1  3d2+         0.364897     1.000000
    6.1 Ag    1  3d0          0.145959     1.000000
    7.1 Ag    1  3d2+         0.145959     1.000000
    1.2 B3u   1  2px         25.056177    -0.000153
                             11.673683     0.000332
                              5.438773     0.014175
                              2.533927    -0.103893
                              1.180557    -0.008134
                              0.550022     0.284904
                              0.256256     0.427437
                              0.119390     0.334066
                              0.055624     0.112340
    2.2 B3u   1  2px          0.103012     1.000000
    3.2 B3u   1  2px          0.041205     1.000000
    1.3 B2u   1  2py         25.056177    -0.000153
                             11.673683     0.000332
                              5.438773     0.014175
                              2.533927    -0.103893
                              1.180557    -0.008134
                              0.550022     0.284904
                              0.256256     0.427437
                              0.119390     0.334066
                              0.055624     0.112340
    2.3 B2u   1  2py          0.103012     1.000000
    3.3 B2u   1  2py          0.041205     1.000000
    1.4 B1g   1  3d2-         0.364897     1.000000
    2.4 B1g   1  3d2-         0.145959     1.000000
    1.5 B1u   1  2pz         25.056177    -0.000153
                             11.673683     0.000332
                              5.438773     0.014175
                              2.533927    -0.103893
                              1.180557    -0.008134
                              0.550022     0.284904
                              0.256256     0.427437
                              0.119390     0.334066
                              0.055624     0.112340
    2.5 B1u   1  2pz          0.103012     1.000000
    3.5 B1u   1  2pz          0.041205     1.000000
    1.6 B2g   1  3d1+         0.364897     1.000000
    2.6 B2g   1  3d1+         0.145959     1.000000
    1.7 B3g   1  3d1-         0.364897     1.000000
    2.7 B3g   1  3d1-         0.145959     1.000000

 NUCLEAR CHARGE:                    6
 NUMBER OF PRIMITIVE AOS:          56
 NUMBER OF SYMMETRY AOS:           54
 NUMBER OF CONTRACTIONS:           22   (   7Ag  +   3B3u +   3B2u +   2B1g +   3B1u +   2B2g +   2B3g +   0Au  )
 NUMBER OF CORE ORBITALS:           0   (   0Ag  +   0B3u +   0B2u +   0B1g +   0B1u +   0B2g +   0B3g +   0Au  )
 NUMBER OF VALENCE ORBITALS:        4   (   1Ag  +   1B3u +   1B2u +   0B1g +   1B1u +   0B2g +   0B3g +   0Au  )


 NUCLEAR REPULSION ENERGY    0.00000000

 EXTRA SYMMETRY OF AOS IN SYMMETRY 1:   1 1 1 2 3 2 3

 Eigenvalues of metric

         1 0.587E-01 0.299E+00 0.299E+00 0.485E+00 0.170E+01 0.170E+01 0.246E+01
         2 0.670E-01 0.443E+00 0.249E+01
         3 0.670E-01 0.443E+00 0.249E+01
         4 0.299E+00 0.170E+01
         5 0.670E-01 0.443E+00 0.249E+01
         6 0.299E+00 0.170E+01
         7 0.299E+00 0.170E+01


 Contracted 2-electron integrals neglected if value below      1.0D-12
 AO integral compression algorithm  1   Integral accuracy      1.0D-12

     0.262 MB (compressed) written to integral file (100.0%)


 NUMBER OF SORTED TWO-ELECTRON INTEGRALS:       5272.     BUFFER LENGTH:  32768
 NUMBER OF SEGMENTS:   1  SEGMENT LENGTH:       5272      RECORD LENGTH: 524288

 Memory used in sort:       0.56 MW

 SORT1 READ       12220. AND WROTE        4734. INTEGRALS IN      1 RECORDS. CPU TIME:     0.00 SEC, REAL TIME:     0.03 SEC
 SORT2 READ        4734. AND WROTE        5272. INTEGRALS IN      1 RECORDS. CPU TIME:     0.00 SEC, REAL TIME:     0.01 SEC

 FILE SIZES:   FILE 1:    20.1 MBYTE,  FILE 4:     4.2 MBYTE,   TOTAL:     24.4 MBYTE

 OPERATOR DM      FOR CENTER  0  COORDINATES:    0.000000    0.000000    0.000000
 OPERATOR EKIN    FOR CENTER  0  COORDINATES:    0.000000    0.000000    0.000000
 OPERATOR POT     FOR CENTER  0  COORDINATES:    0.000000    0.000000    0.000000


 **********************************************************************************************************************************
 DATASETS  * FILE   NREC   LENGTH (MB)   RECORD NAMES
              1      20       19.92       500      610      700      900      950      970     1000      129      960     1100   
                                          VAR    BASINP    GEOM    SYMINP    ZMAT    AOBASIS   BASIS     P2S    ABASIS      S 
                                         1400     1410     1420     1200     1210     1080     1600     1650     1300     1700   
                                         EKIN       V       ECP      H0       H01     AOSYM     SMH    MOLCAS    ERIS     OPER   

 PROGRAMS   *        TOTAL       INT
 CPU TIMES  *         2.07      1.95
 REAL TIME  *        12.77 SEC
 DISK USED  *        24.63 MB      
 **********************************************************************************************************************************


 PROGRAM * RHF-SCF (OPEN SHELL)       Authors: W. Meyer, H.-J. Werner


 NUMBER OF ELECTRONS:       4+    2-    SPACE SYMMETRY=7    SPIN SYMMETRY: Triplet 
 CONVERGENCE THRESHOLDS:    1.00E-05 (Density)    1.00E-07 (Energy)
 MAX. NUMBER OF ITERATIONS:       60
 INTERPOLATION TYPE:            DIIS
 INTERPOLATION STEPS:              2 (START)      1 (STEP)
 LEVEL SHIFTS:                 -0.60 (CLOSED) -0.30 (OPEN) 


 Singly occupied orbitals:      1.3       1.5

   Atom=SE basis=ECP28MDF_GUESS    lmin=0  lmax=1

 Orbital guess generated from atomic densities. Full valence occupancy:    1   1   1   0   1   0   0   0


 Molecular orbital dump at record        4202.2

 ITERATION    DDIFF          GRAD             ENERGY        2-EL.EN.            DIPOLE MOMENTS         DIIS   ORB.
    1      0.000D+00      0.000D+00        -9.14248585     11.382538    0.00000    0.00000    0.00000    0    start
    2      0.000D+00      0.103D-01        -9.14737618     11.537094    0.00000    0.00000    0.00000    1    diag,B
    3      0.277D-01      0.397D-02        -9.14847013     11.621092    0.00000    0.00000    0.00000    2    diag,B
    4      0.145D-01      0.109D-02        -9.14855828     11.633275    0.00000    0.00000    0.00000    3    diag,B
    5      0.413D-02      0.208D-03        -9.14856033     11.633639    0.00000    0.00000    0.00000    4    diag,B
    6      0.115D-02      0.279D-04        -9.14856037     11.634164    0.00000    0.00000    0.00000    5    diag,B
    7      0.144D-03      0.836D-05        -9.14856037     11.634055    0.00000    0.00000    0.00000    6    fixocc
    8      0.331D-04      0.189D-05        -9.14856037     11.634087    0.00000    0.00000    0.00000    7    diag,B
    9      0.775D-05      0.287D-06        -9.14856037     11.634087    0.00000    0.00000    0.00000    0    orth

 Final alpha occupancy:   1   1   1   0   1   0   0
 Final beta  occupancy:   1   1   0   0   0   0   0

 !RHF STATE 1.7 Energy                 -9.148560371921
 Nuclear energy                         0.00000000
 One-electron energy                  -14.96560402
 Two-electron energy                    5.81704365
 Virial quotient                       -2.78791521
 !RHF STATE 1.7 Dipole moment           0.00000000     0.00000000     0.00000000
 Dipole moment /Debye                   0.00000000     0.00000000     0.00000000
 

 !RHF expec          <1.7|EKIN|1.7>     3.281505960468
 
 !RHF expec           <1.7|POT|1.7>    -3.240848030630

 ELECTRON ORBITALS
 =================


   Orb  Occ    Energy  Couls-En    Coefficients

                                   1 1s      1 1s      1 1s      1 3d0     1 3d2+    1 3d0     1 3d2+ 

   1.1   2    -0.8552   -3.7398  1.000163 -0.001048  0.001256  0.000650 -0.001126 -0.003492  0.006048

                                   1 2px     1 2px     1 2px  

   1.2   2    -0.3646   -2.6473  0.999942 -0.000368  0.000676

                                   1 2py     1 2py     1 2py  

   1.3   +    -0.4460   -2.7615  1.059994 -0.045782 -0.036634

                                   1 2pz     1 2pz     1 2pz  

   1.5   +    -0.4460   -2.7615  1.059994 -0.045782 -0.036634

 HOMO      1.2    -0.364636 =      -9.9223eV
 LUMO      2.1     0.043053 =       1.1715eV
 LUMO-HOMO         0.407689 =      11.0938eV


 **********************************************************************************************************************************
 DATASETS  * FILE   NREC   LENGTH (MB)   RECORD NAMES
              1      20       19.92       500      610      700      900      950      970     1000      129      960     1100   
                                          VAR    BASINP    GEOM    SYMINP    ZMAT    AOBASIS   BASIS     P2S    ABASIS      S 
                                         1400     1410     1420     1200     1210     1080     1600     1650     1300     1700   
                                         EKIN       V       ECP      H0       H01     AOSYM     SMH    MOLCAS    ERIS     OPER   

              2       4        2.75       700     1000      520     4202   
                                         GEOM     BASIS   MCVARS     RHF  

 PROGRAMS   *        TOTAL       RHF       INT
 CPU TIMES  *         2.15      0.07      1.95
 REAL TIME  *        13.16 SEC
 DISK USED  *        24.63 MB      
 **********************************************************************************************************************************


 PROGRAM * MULTI (Direct Multiconfiguration SCF)       Authors: P.J. Knowles, H.-J. Werner (1984)     S.T. Elbert (1988)


 Number of closed-shell orbitals:   1 (   1   0   0   0   0   0   0   0 )
 Number of active  orbitals:        3 (   0   1   1   0   1   0   0   0 )
 Number of external orbitals:      18 (   6   2   2   2   2   2   2   0 )

 State symmetry 1

 Number of electrons:     4    Spin symmetry=Triplet   Space symmetry=4
 Number of states:        1
 Number of CSFs:          1   (1 determinants, 3 intermediate states)

 State symmetry 2

 Number of electrons:     4    Spin symmetry=Triplet   Space symmetry=6
 Number of states:        1
 Number of CSFs:          1   (1 determinants, 3 intermediate states)

 State symmetry 3

 Number of electrons:     4    Spin symmetry=Triplet   Space symmetry=7
 Number of states:        1
 Number of CSFs:          1   (1 determinants, 3 intermediate states)

 Iteration controls:
             1  2  3  4  5  6  7  8  9 10 11 12 13 14 15 16 17 18 19 20 21 22 23 24 25 26 27 28 29 30 31 32 33 34 35 36 37 38 39
 DIAGCI      T  T  T  T  T  T  T  T  T  T  T  T  T  T  T  T  T  T  T  T  T  T  T  T  T  T  T  T  T  T  T  T  T  T  T  T  T  T  T
 WERNER      T  T  T  T  T  T  T  T  T  T  T  T  T  T  T  T  T  T  T  T  T  T  T  T  T  T  T  T  T  T  T  T  T  T  T  T  T  T  T
 INTERNAL    F  T  T  T  T  T  T  T  T  T  T  T  T  T  T  T  T  T  T  T  T  T  T  T  T  T  T  T  T  T  T  T  T  T  T  T  T  T  T

 Molecular orbitals read from record     4202.2  Type=RHF/CANONICAL (state 1.7)
 *** IN SYMMETRY 1 ORBITAL  1 SYMMETRY CONTAMINATION OF 0.112D-01 HAS BEEN REMOVED

 EXTRA SYMMETRY OF MOS IN SYMMETRY 1:   1 1 2 3 2 3 1

 Wavefunction dump at record             5202.2

 Convergence thresholds  0.10E-01 (gradient)  0.10E-05 (energy)  0.10E-02 (step length)

 Weight factors for state symmetry  1:    0.33333
 Weight factors for state symmetry  2:    0.33333
 Weight factors for state symmetry  3:    0.33333

 Number of orbital rotations:       12   (     0 Core/Active      6 Core/Virtual   0 Active/Active      6 Active/Virtual)
 Total number of variables:         15


 ITER. MIC  NCI  NEG     ENERGY(VAR)     ENERGY(PROJ)   ENERGY CHANGE     GRAD(0)  GRAD(ORB)   GRAD(CI)     STEP       TIME

   1   21   12    0      -9.14658839      -9.14757808   -0.00098969    0.02602114 0.00000000 0.00000000  0.41D-01      0.02
   2   13   12    0      -9.14758100      -9.14758103   -0.00000003    0.00015229 0.00000000 0.00000000  0.19D-03      0.03
   3   15   12    0      -9.14758103      -9.14758103   -0.00000000    0.00000001 0.00000000 0.00000000  0.56D-08      0.05

 ** WVFN ****  CONVERGENCE REACHED, FINAL GRADIENT:  0.13D-14



 Results for state 1.4
 =====================

 !MCSCF STATE 1.4 Energy               -9.147581027497
 Nuclear energy                         0.00000000
 Kinetic energy                         3.28128593
 One electron energy                  -14.96850449
 Two electron energy                    5.82092346
 Virial ratio                           3.78780369

 !MCSCF STATE 1.4 Dipole moment         0.00000000     0.00000000     0.00000000
 Dipole moment /Debye                   0.00000000     0.00000000     0.00000000



 Results for state 1.6
 =====================

 !MCSCF STATE 1.6 Energy               -9.147581027497
 Nuclear energy                         0.00000000
 Kinetic energy                         3.28128593
 One electron energy                  -14.96850449
 Two electron energy                    5.82092346
 Virial ratio                           3.78780369

 !MCSCF STATE 1.6 Dipole moment         0.00000000     0.00000000     0.00000000
 Dipole moment /Debye                   0.00000000     0.00000000     0.00000000



 Results for state 1.7
 =====================

 !MCSCF STATE 1.7 Energy               -9.147581027497
 Nuclear energy                         0.00000000
 Kinetic energy                         3.28128593
 One electron energy                  -14.96850449
 Two electron energy                    5.82092346
 Virial ratio                           3.78780369

 !MCSCF STATE 1.7 Dipole moment         0.00000000     0.00000000     0.00000000
 Dipole moment /Debye                   0.00000000     0.00000000     0.00000000

 State-averaged charge density matrix saved on record  5202.2 (density set 1)

 !MCSCF expec        <1.4|EKIN|1.4>     3.281285933931
 !MCSCF expec        <1.6|EKIN|1.6>     3.281285933931
 !MCSCF expec        <1.7|EKIN|1.7>     3.281285933931

 !MCSCF expec         <1.4|POT|1.4>    -3.241315023495
 !MCSCF expec         <1.6|POT|1.6>    -3.241315023495
 !MCSCF expec         <1.7|POT|1.7>    -3.241315023495


 NATURAL ORBITALS (state averaged)
 =================================

   Orb     Occ        Energy       Coefficients

                                   1 1s      1 1s      1 1s      1 3d0     1 3d2+    1 3d0     1 3d2+ 

   1.1  2.00000    -0.854767     1.000046 -0.000840  0.001200  0.000000  0.000000  0.000000  0.000000

                                   1 2px     1 2px     1 2px  

   1.2  1.33333    -0.265245     1.029417 -0.020853 -0.019982

                                   1 2py     1 2py     1 2py  

   1.3  1.33333    -0.265245     1.029417 -0.020853 -0.019982

                                   1 2pz     1 2pz     1 2pz  

   1.5  1.33333    -0.265245     1.029417 -0.020853 -0.019982
 

 EXTRA SYMMETRY OF MOS IN SYMMETRY 1:   1 1 2 3 3 2 1

 Natural orbital dump (state averaged) at molpro section  5202.2    (Orbital set 2)


 CI vector for state symmetry 1
 ==============================

 a a 2           1.0000000

 TOTAL ENERGIES                        -9.14758103

 CI vector for state symmetry 2
 ==============================

 a 2 a           1.0000000

 TOTAL ENERGIES                        -9.14758103

 CI vector for state symmetry 3
 ==============================

 2 a a           1.0000000

 TOTAL ENERGIES                        -9.14758103



 **********************************************************************************************************************************
 DATASETS  * FILE   NREC   LENGTH (MB)   RECORD NAMES
              1      21       19.93       500      610      700      900      950      970     1000      129      960     1100   
                                          VAR    BASINP    GEOM    SYMINP    ZMAT    AOBASIS   BASIS     P2S    ABASIS      S 
                                         1400     1410     1420     1200     1210     1080     1600     1650     1300     1700   
                                         EKIN       V       ECP      H0       H01     AOSYM     SMH    MOLCAS    ERIS     OPER   
                                         1380   
                                         JKOP   

              2       5        5.24       700     1000      520     4202     5202   
                                         GEOM     BASIS   MCVARS     RHF     MCSCF   

 PROGRAMS   *        TOTAL     MULTI       RHF       INT
 CPU TIMES  *         2.23      0.08      0.07      1.95
 REAL TIME  *        14.28 SEC
 DISK USED  *        34.31 MB      
 **********************************************************************************************************************************


 PROGRAM * RHF-SCF (OPEN SHELL)       Authors: W. Meyer, H.-J. Werner


 NUMBER OF ELECTRONS:       4+    2-    SPACE SYMMETRY=7    SPIN SYMMETRY: Triplet 
 CONVERGENCE THRESHOLDS:    1.00E-05 (Density)    1.00E-07 (Energy)
 MAX. NUMBER OF ITERATIONS:        0
 INTERPOLATION TYPE:            DIIS
 INTERPOLATION STEPS:              2 (START)      1 (STEP)
 LEVEL SHIFTS:                 -0.60 (CLOSED) -0.30 (OPEN) 


 Singly occupied orbitals:      1.3       1.5
 Molecular orbitals read from record     5202.2  Type=MCSCF/NATURAL (state averaged)

 Molecular orbital dump at record        2101.2

 ITERATION    DDIFF          GRAD             ENERGY        2-EL.EN.            DIPOLE MOMENTS         DIIS   ORB.
    1      0.000D+00      0.000D+00        -9.14758103     11.641847    0.00000    0.00000    0.00000    0    start

 Final alpha occupancy:   1   1   1   0   1   0   0
 Final beta  occupancy:   1   1   0   0   0   0   0

 !RHF STATE 1.7 Energy                 -9.147581027497
 Nuclear energy                         0.00000000
 One-electron energy                  -14.96850449
 Two-electron energy                    5.82092346
 Virial quotient                       -2.78780369
 !RHF STATE 1.7 Dipole moment           0.00000000     0.00000000     0.00000000
 Dipole moment /Debye                   0.00000000     0.00000000     0.00000000
 

 !RHF expec          <1.7|EKIN|1.7>     3.281285933931
 
 !RHF expec           <1.7|POT|1.7>    -3.241315023495

 ELECTRON ORBITALS
 =================


   Orb  Occ    Energy  Couls-En    Coefficients

                                   1 1s      1 1s      1 1s      1 3d0     1 3d2+    1 3d0     1 3d2+ 

   1.1   2    -0.8548   -3.7394  1.000046 -0.000840  0.001200  0.000000  0.000000  0.000000  0.000000

                                   1 2px     1 2px     1 2px  

   1.2   2    -0.2652   -2.5650  1.029417 -0.020853 -0.019982

                                   1 2py     1 2py     1 2py  

   1.3   +    -0.2652   -2.5650  1.029417 -0.020853 -0.019982

                                   1 2pz     1 2pz     1 2pz  

   1.5   +    -0.2652   -2.5650  1.029417 -0.020853 -0.019982

 HOMO      1.2    -0.265245 =      -7.2177eV
 LUMO      2.1     0.045762 =       1.2452eV
 LUMO-HOMO         0.311007 =       8.4629eV


 **********************************************************************************************************************************
 DATASETS  * FILE   NREC   LENGTH (MB)   RECORD NAMES
              1      21       19.93       500      610      700      900      950      970     1000      129      960     1100   
                                          VAR    BASINP    GEOM    SYMINP    ZMAT    AOBASIS   BASIS     P2S    ABASIS      S 
                                         1400     1410     1420     1200     1210     1080     1600     1650     1300     1700   
                                         EKIN       V       ECP      H0       H01     AOSYM     SMH    MOLCAS    ERIS     OPER   
                                         1380   
                                         JKOP   

              2       6        7.74       700     1000      520     4202     5202     2101   
                                         GEOM     BASIS   MCVARS     RHF     MCSCF     RHF  

 PROGRAMS   *        TOTAL       RHF     MULTI       RHF       INT
 CPU TIMES  *         2.26      0.02      0.08      0.07      1.95
 REAL TIME  *        14.53 SEC
 DISK USED  *        34.31 MB      
 **********************************************************************************************************************************
 SETTING SCF(I)         =        -9.14758103  AU                              
 SETTING _CC_NORM_MAX   =         2.00000000                                  


 PROGRAM * UHF-SCF       Authors: W. Meyer, H.-J. Werner


 NUMBER OF ELECTRONS:       4+    2-    SPACE SYMMETRY=7    SPIN SYMMETRY: Triplet 
 CONVERGENCE THRESHOLDS:    1.00E-05 (Density)    1.00E-07 (Energy)
 MAX. NUMBER OF ITERATIONS:        0
 INTERPOLATION TYPE:            DIIS
 INTERPOLATION STEPS:              2 (START)      1 (STEP)
 LEVEL SHIFTS:                  0.20 (ALPHA)   0.20 (BETA) 



 Molecular orbitals read from record     2101.2  Type=RHF/CANONICAL (state 1.7)

 Molecular orbital dump at record        2200.2

 Initial alpha occupation   1   1   1   0   1   0   0
 Initial beta  occupation   1   1   0   0   0   0   0

 ITERATION    DDIFF          GRAD             ENERGY        2-EL.EN.            DIPOLE MOMENTS         DIIS
    1      0.000D+00      0.000D+00        -9.14758103     11.641847    0.00000    0.00000    0.00000    0
 
 Final alpha occupancy:   1   1   1   0   1   0   0
 Final beta  occupancy:   1   1   0   0   0   0   0

 !UHF STATE 1.7 Energy                 -9.147581027497
 Nuclear energy                         0.00000000
 One-electron energy                  -14.96850449
 Two-electron energy                    5.82092346
 Virial quotient                       -2.78780369
 !UHF STATE 1.7 Dipole moment           0.00000000     0.00000000     0.00000000
 Dipole moment /Debye                   0.00000000     0.00000000     0.00000000
 

 !UHF expec          <1.7|EKIN|1.7>     3.281285933931
 
 !UHF expec           <1.7|POT|1.7>    -3.241315023495

 ELECTRON ORBITALS FOR POSITIVE SPIN
 ===================================


   Orb  Occ    Energy  Couls-En    Coefficients

                                   1 1s      1 1s      1 1s      1 3d0     1 3d2+    1 3d0     1 3d2+ 

   1.1   +    -0.8548   -3.7394  1.000046 -0.000840  0.001200  0.000000  0.000000  0.000000  0.000000

                                   1 2px     1 2px     1 2px  

   1.2   +    -0.2652   -2.5650  1.029417 -0.020853 -0.019982

                                   1 2py     1 2py     1 2py  

   1.3   +    -0.2652   -2.5650  1.029417 -0.020853 -0.019982

                                   1 2pz     1 2pz     1 2pz  

   1.5   +    -0.2652   -2.5650  1.029417 -0.020853 -0.019982

 ELECTRON ORBITALS FOR NEGATIVE SPIN
 ===================================


   Orb  Occ    Energy  Couls-En    Coefficients

                                   1 1s      1 1s      1 1s      1 3d0     1 3d2+    1 3d0     1 3d2+ 

   1.1   -    -0.8548   -3.7394  1.000046 -0.000840  0.001200  0.000000  0.000000  0.000000  0.000000

                                   1 2px     1 2px     1 2px  

   1.2   -    -0.2652   -2.5650  1.029417 -0.020853 -0.019982

 HOMO      1.2    -0.265245 =      -7.2177eV
 LUMO     -1.3    -0.265245 =      -7.2177eV
 LUMO-HOMO        -0.000000 =      -0.0000eV

 EXPECTATION VALUE OF S**2:             2.00000000

 Occupation number threshold for canonical orbitals:  1.999000 (occupied),  0.001000 (virtual)

 Number of pseudo-canonical orbitals per symmetry:    1   1   0   0   0   0   0
 Number of active natural orbitals per symmetry:      0   0   1   0   1   0   0

 NATURAL CHARGE ORBITALS
 =======================


   Orb     Occ        Energy       Coefficients

                                   1 1s      1 1s      1 1s      1 3d0     1 3d2+    1 3d0     1 3d2+ 

   1.1  2.00000    -0.854767     1.000046 -0.000840  0.001200  0.000000  0.000000  0.000000  0.000000

                                   1 2px     1 2px     1 2px  

   1.2  2.00000    -0.265245     1.029417 -0.020853 -0.019982

                                   1 2py     1 2py     1 2py  

   1.3  1.00000    -0.214731     1.029417 -0.020853 -0.019982

                                   1 2pz     1 2pz     1 2pz  

   1.5  1.00000    -0.214731     1.029417 -0.020853 -0.019982

 Natural orbitals saved to record    2200.2 (Orbital set 3)

 Orbital spaces for UNO-CAS (Min. occupation: 0.020  Max. occupation: 1.980):

 Closed:        1   1   0   0   0   0   0
 Active:        0   0   1   0   1   0   0

 No convergence



 **********************************************************************************************************************************
 DATASETS  * FILE   NREC   LENGTH (MB)   RECORD NAMES
              1      21       19.93       500      610      700      900      950      970     1000      129      960     1100   
                                          VAR    BASINP    GEOM    SYMINP    ZMAT    AOBASIS   BASIS     P2S    ABASIS      S 
                                         1400     1410     1420     1200     1210     1080     1600     1650     1300     1700   
                                         EKIN       V       ECP      H0       H01     AOSYM     SMH    MOLCAS    ERIS     OPER   
                                         1380   
                                         JKOP   

              2       7       10.24       700     1000      520     4202     5202     2101     2200   
                                         GEOM     BASIS   MCVARS     RHF     MCSCF     RHF      UHF  

 PROGRAMS   *        TOTAL       UHF       RHF     MULTI       RHF       INT
 CPU TIMES  *         2.28      0.00      0.02      0.08      0.07      1.95
 REAL TIME  *        14.76 SEC
 DISK USED  *        34.31 MB      
 **********************************************************************************************************************************
 SETTING SCF(I)         =        -9.14758103  AU                              


 PROGRAM * MRCC (General Multireference Coupled Cluster)    Author: M. Kallay, 2000-2005

 ***  Initialisation ***

   0 Spin projections
 
 Molecular orbitals read from record     2200.2  Type=UHF/ALPHA (state 1.7)

 ?Warning: UHF not converged
 Molecular orbitals read from record     2200.2  Type=UHF/BETA (state 1.7)

 ?Warning: UHF not converged
 
 Frozen orbitals:              0 (  0  0  0  0  0  0  0  0)
 Active orbitals:             22 (  7  3  3  2  3  2  2  0)
 Active electrons:             6
 Spin quantum number:          1.0

 Transformed integrals will be written to file mrcc_24452/fort.55

 Load integrals                2.3 sec
 Transform integrals           2.3 sec
 Storage for integrals:          28961
 Remaining memory:           *********

 Core energy:               0.00000000
 
 MRCC Input:
     4     0     0     0     3     0     0     7     0     0     0     1     1     0     0     7     0     0   0.000     0   64000
  ex.lev,nsing,ntrip, rest,method,dens,conver,symm, diag, CS ,spatial, HF, ndoub,nacto,nactv, tol, maxex, sacc, freq,  dboc,   mem
  2  0  0  0  0  0  0  2  0  0  1  0  0  0  0  1  0  0  0  0  0  0
 MRCC Input end
 Variable memory released
 MRCC now being run, temporary output in /global/cscratch1/sd/aannabe/mrcc_24452/mrcc.out
 **********************************************************************
                          MRCC program system
 **********************************************************************

                              Written by
  Mihaly Kallay, Zoltan Rolik, Jozsef Csontos, Peter Nagy, Gyula Samu,
      David Mester, Jozsef Csoka, Bernat Szabo, Istvan Ladjanszki,
       Lorant Szegedy, Bence Ladoczki, Klara Petrov, Mate Farkas,
                    Pal D. Mezei, and Bence Hegely

        Department of Physical Chemistry and Materials Science
            Budapest University of Technology and Economics
                  Budapest P.O.Box 91, H-1521 Hungary

                              www.mrcc.hu

                       Release date: May 23, 2018

 ************************ 2019-06-25 12:31:57 *************************
 Executing goldstone...

 Generation of CC equations in terms of H and T...
 Generation of antisymmetrized Goldstone diagrams...
 Number of diagrams in T^1 equations:    15
 Number of diagrams in T^2 equations:    38
 Number of diagrams in T^3 equations:    49
 Number of diagrams in T^4 equations:     5
 Translation of diagrams to factorized equations...
 Optimizing intermediate calculation...
 Number of floating-point operations per iteration step:   5.3097E+07
 Probable CPU time per iteration step (hours):      0.00
 Required memory (Mbytes):      17.7
 Number of intermediates:                                  79
 Number of intermediates to be stored:                     32
 Length of intermediate file (Mbytes):       0.7

 ************************ 2019-06-25 12:31:59 *************************
 Executing xmrcc...

 **********************************************************************
 CC(3)(4) calculation


 Allocation of 100.0 Mbytes of memory...
 Number of spinorbitals:                    44
 Number of alpha electrons:                        4
 Number of beta electrons:                         2
 Spin multiplicity:                     2
 z-component of spin:  1.0
 Spatial symmetry:                      7
 Convergence criterion:  1.0E-07
 Construction of occupation graphs...
 Number of                     0 -fold excitations:                      1
 Number of                     1 -fold excitations:                     20
 Number of                     2 -fold excitations:                    540
 Number of                     3 -fold excitations:                   6704
 Total number of configurations:                   7265
 Calculation of coupling coefficients...
 Length of intermediate file (Mbytes):       0.8

 ======================================================================

 Spin case  1   Alpha:  2   Beta:  2
 Number of excitations:                  21813
 Spin case  2   Alpha:  3   Beta:  1
 Number of excitations:                  16416
 Spin case  3   Alpha:  4   Beta:  0
 Number of excitations:                    420
 Number of                     4 -fold excitations:                  38649

 Memory requirements /Mbyte/:
               Minimal        Optimal
 Real*8:         19.0827        19.0827
 Integer:         3.7368
 Total:          22.8195        22.8195


 ************************ 2019-06-25 12:32:00 *************************
 Executing mrcc...

 **********************************************************************
 CCSDT(Q) calculation


 Allocation of   19.1 Mbytes of memory...
 Number of spinorbitals:  44
 Number of alpha electrons:  4
 Number of beta  electrons:  2
 Spin multiplicity: 2
 z-component of spin:  1.0
 Spatial symmetry: 7
 Convergence criterion:  1.0E-07
 Construction of occupation graphs...
 Number of 0-fold excitations: 1
 Number of 1-fold excitations: 20
 Number of 2-fold excitations: 540
 Number of 3-fold excitations: 6704
 Total number of determinants: 7265
 Calculation of coupling coefficients...
 Initial cluster amplitudes are generated.
 Length of intermediate file (Mbytes):       0.8
 Reading integral list from unit 55...
 Sorting integrals...
 Sorting integrals...
 Sorting integrals...
 Sorting integrals...
 Energy of reference determinant [au]:      -9.147581027497
 Calculation of MP denominators...

 Starting CC iteration...
 ======================================================================
 Norm of residual vector:     0.41856032
 CPU time [min]:     0.003                   Wall time [min]:     0.004

 Iteration  1  CC energy:    -9.22895901  Energy decrease:   0.08137798
 ======================================================================
 Norm of residual vector:     0.09195748
 CPU time [min]:     0.005                   Wall time [min]:     0.006

 Iteration  2  CC energy:    -9.24258790  Energy decrease:   0.01362890
 ======================================================================
 Norm of residual vector:     0.02410333
 CPU time [min]:     0.007                   Wall time [min]:     0.008

 Iteration  3  CC energy:    -9.24578931  Energy decrease:   0.00320140
 ======================================================================
 Norm of residual vector:     0.00628911
 CPU time [min]:     0.009                   Wall time [min]:     0.010

 Iteration  4  CC energy:    -9.24597955  Energy decrease:   0.00019025
 ======================================================================
 Norm of residual vector:     0.00229571
 CPU time [min]:     0.011                   Wall time [min]:     0.012

 Iteration  5  CC energy:    -9.24597516  Energy decrease:   0.00000439
 ======================================================================
 Norm of residual vector:     0.00104744
 CPU time [min]:     0.013                   Wall time [min]:     0.014

 Iteration  6  CC energy:    -9.24598433  Energy decrease:   0.00000917
 ======================================================================
 Norm of residual vector:     0.00044021
 CPU time [min]:     0.015                   Wall time [min]:     0.016

 Iteration  7  CC energy:    -9.24598910  Energy decrease:   0.00000476
 ======================================================================
 Norm of residual vector:     0.00016033
 CPU time [min]:     0.017                   Wall time [min]:     0.018

 Iteration  8  CC energy:    -9.24599048  Energy decrease:   0.00000138
 ======================================================================
 Norm of residual vector:     0.00004933
 CPU time [min]:     0.019                   Wall time [min]:     0.020

 Iteration  9  CC energy:    -9.24599014  Energy decrease:   0.00000033
 ======================================================================
 Norm of residual vector:     0.00001432
 CPU time [min]:     0.021                   Wall time [min]:     0.022

 Iteration 10  CC energy:    -9.24599004  Energy decrease:   0.00000010
 ======================================================================
 Norm of residual vector:     0.00000446
 CPU time [min]:     0.023                   Wall time [min]:     0.024

 Iteration 11  CC energy:    -9.24599007  Energy decrease:   0.00000003
 ======================================================================
 Norm of residual vector:     0.00000117
 CPU time [min]:     0.026                   Wall time [min]:     0.026

 Iteration 12  CC energy:    -9.24599006  Energy decrease:   0.00000001
 ======================================================================
 Norm of residual vector:     0.00000030
 CPU time [min]:     0.028                   Wall time [min]:     0.028

 Iteration 13  CC energy:    -9.24599006  Energy decrease:   3.3135E-09
 ======================================================================
 Norm of residual vector:     0.00000009
 CPU time [min]:     0.030                   Wall time [min]:     0.030

 Iteration 14  CC energy:    -9.24599006  Energy decrease:   2.4368E-10
 ======================================================================

 Iteration has converged in 14 steps.

 Final results:
 Total CCSDT energy [au]:             -9.245990059075
 Total MP2 energy [au]:               -9.228959008750

 Perturbative corrections are calculated...
 ======================================================================
 Spin case  1   Alpha:  2   Beta:  2
 Number of excitations:        21813
 CPU time [min]:     0.057                   Wall time [min]:     0.058
 ======================================================================
 Spin case  2   Alpha:  3   Beta:  1
 Number of excitations:        16416
 CPU time [min]:     0.073                   Wall time [min]:     0.074
 ======================================================================
 Spin case  3   Alpha:  4   Beta:  0
 Number of excitations:        420
 CPU time [min]:     0.074                   Wall time [min]:     0.075
 ======================================================================
 Number of 4-fold excitations: 38649
 CPU time [min]:     0.074                   Wall time [min]:     0.075

 Total CCSDT[Q] energy [au]:          -9.246083002259
 Total CCSDT(Q) energy [au]:          -9.246105097588

 ************************ 2019-06-25 12:32:05 *************************
                      Normal termination of mrcc.
 **********************************************************************
 !CCSDT STATE 1.7 Energy               -9.245990059075
 !MP2 STATE 1.7 Energy                 -9.228959008750
 !CCSDT[Q] STATE 1.7 Energy            -9.246083002259
 !CCSDT(Q) STATE 1.7 Energy            -9.246105097588
 
 CPU-time for MRCC:              4.4 sec
 Elapsed-time for MRCC:         10.6 sec

 Variable memory set to 8000000000 words,  buffer space   230000 words



 **********************************************************************************************************************************
 DATASETS  * FILE   NREC   LENGTH (MB)   RECORD NAMES
              1      21       19.93       500      610      700      900      950      970     1000      129      960     1100   
                                          VAR    BASINP    GEOM    SYMINP    ZMAT    AOBASIS   BASIS     P2S    ABASIS      S 
                                         1400     1410     1420     1200     1210     1080     1600     1650     1300     1700   
                                         EKIN       V       ECP      H0       H01     AOSYM     SMH    MOLCAS    ERIS     OPER   
                                         1380   
                                         JKOP   

              2       7       10.24       700     1000      520     4202     5202     2101     2200   
                                         GEOM     BASIS   MCVARS     RHF     MCSCF     RHF      UHF  

 PROGRAMS   *        TOTAL      MRCC       UHF       RHF     MULTI       RHF       INT
 CPU TIMES  *         6.82      4.53      0.00      0.02      0.08      0.07      1.95
 REAL TIME  *        26.20 SEC
 DISK USED  *        34.31 MB      
 **********************************************************************************************************************************
 SETTING POSTHF(I)      =        -9.24610510  AU                              
                                                                                                                                                                                                                                                                

       SCF           POSTHF       EKIN          POT
    -9.14758103   -9.24610510   3.28128593   -3.24131502
                                                  

 CCSDT(Q)/USERDEF energy=     -9.246105097588

        CCSDT(Q)        RHF-SCF         MULTI           RHF-SCF 
     -9.24610510     -9.14758103     -9.14758103     -9.14856037
 **********************************************************************************************************************************
 Molpro calculation terminated
 Variable memory released
