
 Primary working directories    : /global/cscratch1/sd/aannabe
 Secondary working directories  : /global/cscratch1/sd/aannabe
 Wavefunction directory         : /global/homes/a/aannabe/wfu/
 Main file repository           : /global/cscratch1/sd/aannabe/

 SHA1      : 19cd028119e0e09f93f0674bd8af7968d9b3eff6
 NAME      : 2015.1.36
 ARCHNAME  : linux/x86_64
 FC        : /opt/cray/pe/craype/2.5.14/bin/ftn
 BLASLIB   : -L/opt/intel/compilers_and_libraries_2018.1.163/linux/mkl/lib/intel64 -Wl,-_start-group -lmkl_intel_ilp64 -lmkl_intel_thread -lmkl_core -Wl,-_end-group -liomp5
 id        : lbl

 Nodes     nprocs
 nid00471     1

 Using customized tuning parameters: mindgm=7; mindgv=16; mindgc=1; mindgr=1; noblas=0; minvec=7
 default implementation of scratch files=df  

 ***,Se
 memory,8,g
 gthresh,twoint=1.e-12
 
 gprint,basis,orbitals
 gexpec,ekin,pot
 
 angstrom
 geometry={
 1                                                                               ! Number of atoms
 Se 0.0 0.0 0.0
 }
 
 basis={
 
 Including file /global/homes/a/aannabe/repos/pseudopotentiallibrary/recipes/Se/ccECP/Se.ccECP.molpro
 
                                   !include,/global/homes/a/aannabe/repos/pseudopotentiallibrary/recipes/Se/ccECP/Se.cc-pV5Z.molpro
                                  !include,/global/homes/a/aannabe/repos/pseudopotentiallibrary/recipes/Se/ccECP/Se.cc-pCV5Z.molpro
 Including file /global/homes/a/aannabe/repos/pseudopotentiallibrary/recipes/Se/ccECP/Se.aug-cc-pV5Z.molpro
 
 
 }
 
 
 {rhf
  start,atden
  wf,6,7,2
  occ,1,1,1,0,1,0,0,0
  open,1.3,1.5
  orbital,4202.2
 }
 {multi
  maxiter,40
  start,4202.2
  occ,1,1,1,0,1,0,0,0
  closed,1,0,0,0,0,0,0
  wf,6,4,2;state,1
  wf,6,6,2;state,1
  wf,6,7,2;state,1
  natorb,ci,print
  orbital,5202.2
 }
 {rhf,nitord=1,maxit=0
  start,5202.2
  wf,6,7,2
  occ,1,1,1,0,1,0,0,0
  open,1.3,1.5
 }
 
 scf(i)=energy
 
 _CC_NORM_MAX=2.0
  !NOTE: Perturbative MRCC works only with UHF reference. So, here we will trick MRCC by doing zero UHF iteration right after ROHF.
 
 {uhf
 maxit,0
 }
 scf(i)=energy
 
 {mrcc,method=CCSDT(Q)
 orbital,ignore_error=1                                                          !Ignore the fact that UHF WF is not converged
 maxit,100
 core
 }
 posthf(i)=energy
 
 table,scf,posthf,ekin,pot
 save,5.csv,new
 
 

 Variables initialized (889), CPU time= 0.00 sec
 Commands  initialized (702), CPU time= 0.01 sec, 572 directives.
 Default parameters read. Elapsed time= 0.16 sec

 Checking input...
 Passed
1


                                         ***  PROGRAM SYSTEM MOLPRO  ***
                                       Copyright, TTI GmbH Stuttgart, 2015
                                    Version 2015.1 linked Dec 29 2018 15:55:43


 **********************************************************************************************************************************
 LABEL *   Se                                                                            
  64 bit serial version                                                                  DATE: 25-Jun-19          TIME: 12:57:49  
 **********************************************************************************************************************************

 SHA1:             19cd028119e0e09f93f0674bd8af7968d9b3eff6
 **********************************************************************************************************************************

 THRESHOLDS:

 ZERO    =  1.00D-12  ONEINT  =  1.00D-12  TWOINT  =  1.00D-12  PREFAC  =  1.00D-14  LOCALI  =  1.00D-09  EORDER  =  1.00D-04
 ENERGY  =  0.00D+00  ETEST   =  0.00D+00  EDENS   =  0.00D+00  THRDEDEF=  1.00D-06  GRADIENT=  1.00D-02  STEP    =  1.00D-03
 ORBITAL =  1.00D-05  CIVEC   =  1.00D-05  COEFF   =  1.00D-04  PRINTCI =  5.00D-02  PUNCHCI =  9.90D+01  OPTGRAD =  3.00D-04
 OPTENERG=  1.00D-06  OPTSTEP =  3.00D-04  THRGRAD =  1.00D-10  COMPRESS=  1.00D-11  VARMIN  =  1.00D-07  VARMAX  =  1.00D-03
 THRDOUB =  0.00D+00  THRDIV  =  1.00D-05  THRRED  =  1.00D-07  THRPSP  =  1.00D+00  THRDC   =  1.00D-10  THRCS   =  1.00D-10
 THRNRM  =  1.00D-08  THREQ   =  0.00D+00  THRDE   =  1.00D+00  THRREF  =  1.00D-05  SPARFAC =  1.00D+00  THRDLP  =  1.00D-07
 THRDIA  =  1.00D-10  THRDLS  =  1.00D-07  THRGPS  =  0.00D+00  THRKEX  =  0.00D+00  THRDIS  =  2.00D-01  THRVAR  =  1.00D-10
 THRLOC  =  1.00D-06  THRGAP  =  1.00D-06  THRLOCT = -1.00D+00  THRGAPT = -1.00D+00  THRORB  =  1.00D-06  THRMLTP =  0.00D+00
 THRCPQCI=  1.00D-10  KEXTA   =  0.00D+00  THRCOARS=  0.00D+00  SYMTOL  =  1.00D-06  GRADTOL =  1.00D-06  THROVL  =  1.00D-08
 THRORTH =  1.00D-08  GRID    =  1.00D-06  GRIDMAX =  1.00D-03  DTMAX   =  0.00D+00  THROCCDE=  1.00D-01  THROCCDE=  1.00D-01



 ZUNIT=ANG
 

Geometry recognized as XYZ


 Variable memory set to 8000000000 words,  buffer space   230000 words

 SETTING BASIS          =    USERDEF


 Recomputing integrals since basis changed


 Using spherical harmonics



 PROGRAM * SEWARD (Integral evaluation for generally contracted gaussian basis sets)     Author: Roland Lindh, 1990

 Geometry written to block  1 of record 700

 Orientation using atomic masses  
 Molecule type: Atom
 Symmetry elements: X,Y,Z
 Rotational constants:       0.0000000      0.0000000      0.0000000 GHz  (calculated with average atomic masses)

 Point group  D2h 



 ATOMIC COORDINATES

 NR  ATOM    CHARGE       X              Y              Z

   1  SE      6.00    0.000000000    0.000000000    0.000000000


          SE  CORE POTENTIAL

          f POTENTIAL

 POWERS             1              3              2              2
 EXPONENTIALS   2.977052       7.016674       3.960663       5.028263    
 COEFFICIENTS   6.000000       17.86231      -20.00913       10.00574    

          s - f POTENTIAL

 POWERS             2              2
 EXPONENTIALS   4.175363       2.144911    
 COEFFICIENTS   71.37928      0.4261986    

          p - f POTENTIAL

 POWERS             2              2
 EXPONENTIALS   4.287722       2.095383    
 COEFFICIENTS   50.94829       5.542881    

          d - f POTENTIAL

 POWERS             2              2
 EXPONENTIALS   1.394037       1.696599    
 COEFFICIENTS   6.204697      0.5339570    


 BASIS DATA

   Nr Sym  Nuc  Type         Exponents   Contraction coefficients

    1.1 Ag    1  1s          53.235856    -0.000173
                             24.069480     0.001518
                             10.882513    -0.015384
                              4.920301     0.136816
                              2.224611    -0.394610
                              1.005811    -0.139559
                              0.454757     0.507331
                              0.205609     0.586875
                              0.092962     0.177170
    2.1 Ag    1  1s           0.672927     1.000000
    3.1 Ag    1  1s           0.356851     1.000000
    4.1 Ag    1  1s           0.189237     1.000000
    5.1 Ag    1  1s           0.100352     1.000000
    6.1 Ag    1  1s           0.040141     1.000000
    7.1 Ag    1  3d0          1.544013     1.000000
    8.1 Ag    1  3d2+         1.544013     1.000000
    9.1 Ag    1  3d0          0.723875     1.000000
   10.1 Ag    1  3d2+         0.723875     1.000000
   11.1 Ag    1  3d0          0.339372     1.000000
   12.1 Ag    1  3d2+         0.339372     1.000000
   13.1 Ag    1  3d0          0.159107     1.000000
   14.1 Ag    1  3d2+         0.159107     1.000000
   15.1 Ag    1  3d0          0.063643     1.000000
   16.1 Ag    1  3d2+         0.063643     1.000000
   17.1 Ag    1  5g0          0.894034     1.000000
   18.1 Ag    1  5g4+         0.894034     1.000000
   19.1 Ag    1  5g2+         0.894034     1.000000
   20.1 Ag    1  5g0          0.399571     1.000000
   21.1 Ag    1  5g4+         0.399571     1.000000
   22.1 Ag    1  5g2+         0.399571     1.000000
   23.1 Ag    1  5g0          0.159828     1.000000
   24.1 Ag    1  5g4+         0.159828     1.000000
   25.1 Ag    1  5g2+         0.159828     1.000000
    1.2 B3u   1  2px         25.056177    -0.000153
                             11.673683     0.000332
                              5.438773     0.014175
                              2.533927    -0.103893
                              1.180557    -0.008134
                              0.550022     0.284904
                              0.256256     0.427437
                              0.119390     0.334066
                              0.055624     0.112340
    2.2 B3u   1  2px          0.941327     1.000000
    3.2 B3u   1  2px          0.395488     1.000000
    4.2 B3u   1  2px          0.166159     1.000000
    5.2 B3u   1  2px          0.069810     1.000000
    6.2 B3u   1  2px          0.027924     1.000000
    7.2 B3u   1  4f1+         0.901595     1.000000
    8.2 B3u   1  4f3+         0.901595     1.000000
    9.2 B3u   1  4f1+         0.447175     1.000000
   10.2 B3u   1  4f3+         0.447175     1.000000
   11.2 B3u   1  4f1+         0.221791     1.000000
   12.2 B3u   1  4f3+         0.221791     1.000000
   13.2 B3u   1  4f1+         0.088716     1.000000
   14.2 B3u   1  4f3+         0.088716     1.000000
   15.2 B3u   1  6h1+         0.742989     1.000000
   16.2 B3u   1  6h3+         0.742989     1.000000
   17.2 B3u   1  6h5+         0.742989     1.000000
   18.2 B3u   1  6h1+         0.297196     1.000000
   19.2 B3u   1  6h3+         0.297196     1.000000
   20.2 B3u   1  6h5+         0.297196     1.000000
    1.3 B2u   1  2py         25.056177    -0.000153
                             11.673683     0.000332
                              5.438773     0.014175
                              2.533927    -0.103893
                              1.180557    -0.008134
                              0.550022     0.284904
                              0.256256     0.427437
                              0.119390     0.334066
                              0.055624     0.112340
    2.3 B2u   1  2py          0.941327     1.000000
    3.3 B2u   1  2py          0.395488     1.000000
    4.3 B2u   1  2py          0.166159     1.000000
    5.3 B2u   1  2py          0.069810     1.000000
    6.3 B2u   1  2py          0.027924     1.000000
    7.3 B2u   1  4f1-         0.901595     1.000000
    8.3 B2u   1  4f3-         0.901595     1.000000
    9.3 B2u   1  4f1-         0.447175     1.000000
   10.3 B2u   1  4f3-         0.447175     1.000000
   11.3 B2u   1  4f1-         0.221791     1.000000
   12.3 B2u   1  4f3-         0.221791     1.000000
   13.3 B2u   1  4f1-         0.088716     1.000000
   14.3 B2u   1  4f3-         0.088716     1.000000
   15.3 B2u   1  6h1-         0.742989     1.000000
   16.3 B2u   1  6h3-         0.742989     1.000000
   17.3 B2u   1  6h5-         0.742989     1.000000
   18.3 B2u   1  6h1-         0.297196     1.000000
   19.3 B2u   1  6h3-         0.297196     1.000000
   20.3 B2u   1  6h5-         0.297196     1.000000
    1.4 B1g   1  3d2-         1.544013     1.000000
    2.4 B1g   1  3d2-         0.723875     1.000000
    3.4 B1g   1  3d2-         0.339372     1.000000
    4.4 B1g   1  3d2-         0.159107     1.000000
    5.4 B1g   1  3d2-         0.063643     1.000000
    6.4 B1g   1  5g2-         0.894034     1.000000
    7.4 B1g   1  5g4-         0.894034     1.000000
    8.4 B1g   1  5g2-         0.399571     1.000000
    9.4 B1g   1  5g4-         0.399571     1.000000
   10.4 B1g   1  5g2-         0.159828     1.000000
   11.4 B1g   1  5g4-         0.159828     1.000000
    1.5 B1u   1  2pz         25.056177    -0.000153
                             11.673683     0.000332
                              5.438773     0.014175
                              2.533927    -0.103893
                              1.180557    -0.008134
                              0.550022     0.284904
                              0.256256     0.427437
                              0.119390     0.334066
                              0.055624     0.112340
    2.5 B1u   1  2pz          0.941327     1.000000
    3.5 B1u   1  2pz          0.395488     1.000000
    4.5 B1u   1  2pz          0.166159     1.000000
    5.5 B1u   1  2pz          0.069810     1.000000
    6.5 B1u   1  2pz          0.027924     1.000000
    7.5 B1u   1  4f0          0.901595     1.000000
    8.5 B1u   1  4f2+         0.901595     1.000000
    9.5 B1u   1  4f0          0.447175     1.000000
   10.5 B1u   1  4f2+         0.447175     1.000000
   11.5 B1u   1  4f0          0.221791     1.000000
   12.5 B1u   1  4f2+         0.221791     1.000000
   13.5 B1u   1  4f0          0.088716     1.000000
   14.5 B1u   1  4f2+         0.088716     1.000000
   15.5 B1u   1  6h2+         0.742989     1.000000
   16.5 B1u   1  6h4+         0.742989     1.000000
   17.5 B1u   1  6h0          0.742989     1.000000
   18.5 B1u   1  6h2+         0.297196     1.000000
   19.5 B1u   1  6h4+         0.297196     1.000000
   20.5 B1u   1  6h0          0.297196     1.000000
    1.6 B2g   1  3d1+         1.544013     1.000000
    2.6 B2g   1  3d1+         0.723875     1.000000
    3.6 B2g   1  3d1+         0.339372     1.000000
    4.6 B2g   1  3d1+         0.159107     1.000000
    5.6 B2g   1  3d1+         0.063643     1.000000
    6.6 B2g   1  5g1+         0.894034     1.000000
    7.6 B2g   1  5g3+         0.894034     1.000000
    8.6 B2g   1  5g1+         0.399571     1.000000
    9.6 B2g   1  5g3+         0.399571     1.000000
   10.6 B2g   1  5g1+         0.159828     1.000000
   11.6 B2g   1  5g3+         0.159828     1.000000
    1.7 B3g   1  3d1-         1.544013     1.000000
    2.7 B3g   1  3d1-         0.723875     1.000000
    3.7 B3g   1  3d1-         0.339372     1.000000
    4.7 B3g   1  3d1-         0.159107     1.000000
    5.7 B3g   1  3d1-         0.063643     1.000000
    6.7 B3g   1  5g1-         0.894034     1.000000
    7.7 B3g   1  5g3-         0.894034     1.000000
    8.7 B3g   1  5g1-         0.399571     1.000000
    9.7 B3g   1  5g3-         0.399571     1.000000
   10.7 B3g   1  5g1-         0.159828     1.000000
   11.7 B3g   1  5g3-         0.159828     1.000000
    1.8 Au    1  4f2-         0.901595     1.000000
    2.8 Au    1  4f2-         0.447175     1.000000
    3.8 Au    1  4f2-         0.221791     1.000000
    4.8 Au    1  4f2-         0.088716     1.000000
    5.8 Au    1  6h4-         0.742989     1.000000
    6.8 Au    1  6h2-         0.742989     1.000000
    7.8 Au    1  6h4-         0.297196     1.000000
    8.8 Au    1  6h2-         0.297196     1.000000

 NUCLEAR CHARGE:                    6
 NUMBER OF PRIMITIVE AOS:         213
 NUMBER OF SYMMETRY AOS:          158
 NUMBER OF CONTRACTIONS:          126   (  25Ag  +  20B3u +  20B2u +  11B1g +  20B1u +  11B2g +  11B3g +   8Au  )
 NUMBER OF CORE ORBITALS:           0   (   0Ag  +   0B3u +   0B2u +   0B1g +   0B1u +   0B2g +   0B3g +   0Au  )
 NUMBER OF VALENCE ORBITALS:        4   (   1Ag  +   1B3u +   1B2u +   0B1g +   1B1u +   0B2g +   0B3g +   0Au  )


 NUCLEAR REPULSION ENERGY    0.00000000

 EXTRA SYMMETRY OF AOS IN SYMMETRY 1:   1 1 1 1 1 1 2 3 2 3   2 3 2 3 2 3 4 5 6 4   5 6 4 5 6
 EXTRA SYMMETRY OF AOS IN SYMMETRY 2:   1 1 1 1 1 1 2 3 2 3   2 3 2 3 4 5 6 4 5 6
 EXTRA SYMMETRY OF AOS IN SYMMETRY 3:   1 1 1 1 1 1 2 3 2 3   2 3 2 3 4 5 6 4 5 6
 EXTRA SYMMETRY OF AOS IN SYMMETRY 4:   1 1 1 1 1 2 3 2 3 2   3
 EXTRA SYMMETRY OF AOS IN SYMMETRY 5:   1 1 1 1 1 1 2 3 2 3   2 3 2 3 4 5 6 4 5 6
 EXTRA SYMMETRY OF AOS IN SYMMETRY 6:   1 1 1 1 1 2 3 2 3 2   3
 EXTRA SYMMETRY OF AOS IN SYMMETRY 7:   1 1 1 1 1 2 3 2 3 2   3
 EXTRA SYMMETRY OF AOS IN SYMMETRY 8:   1 1 1 1 2 3 2 3

 Eigenvalues of metric

         1 0.641E-03 0.567E-02 0.252E-01 0.252E-01 0.385E-01 0.146E+00 0.146E+00 0.212E+00
         2 0.160E-02 0.224E-01 0.570E-01 0.570E-01 0.121E+00 0.358E+00 0.358E+00 0.483E+00
         3 0.160E-02 0.224E-01 0.570E-01 0.570E-01 0.121E+00 0.358E+00 0.358E+00 0.483E+00
         4 0.252E-01 0.146E+00 0.212E+00 0.212E+00 0.538E+00 0.840E+00 0.840E+00 0.141E+01
         5 0.160E-02 0.224E-01 0.570E-01 0.570E-01 0.121E+00 0.358E+00 0.358E+00 0.483E+00
         6 0.252E-01 0.146E+00 0.212E+00 0.212E+00 0.538E+00 0.840E+00 0.840E+00 0.141E+01
         7 0.252E-01 0.146E+00 0.212E+00 0.212E+00 0.538E+00 0.840E+00 0.840E+00 0.141E+01
         8 0.570E-01 0.358E+00 0.483E+00 0.483E+00 0.109E+01 0.152E+01 0.152E+01 0.249E+01


 Contracted 2-electron integrals neglected if value below      1.0D-12
 AO integral compression algorithm  1   Integral accuracy      1.0D-12

     30.409 MB (compressed) written to integral file ( 54.3%)


 NUMBER OF SORTED TWO-ELECTRON INTEGRALS:    4156552.     BUFFER LENGTH:  32768
 NUMBER OF SEGMENTS:   1  SEGMENT LENGTH:    4156552      RECORD LENGTH: 524288

 Memory used in sort:       4.71 MW

 SORT1 READ     6989366. AND WROTE     2907704. INTEGRALS IN      9 RECORDS. CPU TIME:     0.20 SEC, REAL TIME:     0.28 SEC
 SORT2 READ     2907704. AND WROTE     4156552. INTEGRALS IN    116 RECORDS. CPU TIME:     0.20 SEC, REAL TIME:     0.36 SEC

 FILE SIZES:   FILE 1:    50.7 MBYTE,  FILE 4:    37.8 MBYTE,   TOTAL:     88.4 MBYTE

 OPERATOR DM      FOR CENTER  0  COORDINATES:    0.000000    0.000000    0.000000
 OPERATOR EKIN    FOR CENTER  0  COORDINATES:    0.000000    0.000000    0.000000
 OPERATOR POT     FOR CENTER  0  COORDINATES:    0.000000    0.000000    0.000000


 **********************************************************************************************************************************
 DATASETS  * FILE   NREC   LENGTH (MB)   RECORD NAMES
              1      20       38.54       500      610      700      900      950      970     1000      129      960     1100   
                                          VAR    BASINP    GEOM    SYMINP    ZMAT    AOBASIS   BASIS     P2S    ABASIS      S 
                                         1400     1410     1420     1200     1210     1080     1600     1650     1300     1700   
                                         EKIN       V       ECP      H0       H01     AOSYM     SMH    MOLCAS    ERIS     OPER   

 PROGRAMS   *        TOTAL       INT
 CPU TIMES  *         3.49      3.38
 REAL TIME  *        14.72 SEC
 DISK USED  *        88.75 MB      
 **********************************************************************************************************************************


 PROGRAM * RHF-SCF (OPEN SHELL)       Authors: W. Meyer, H.-J. Werner


 NUMBER OF ELECTRONS:       4+    2-    SPACE SYMMETRY=7    SPIN SYMMETRY: Triplet 
 CONVERGENCE THRESHOLDS:    1.00E-05 (Density)    1.00E-07 (Energy)
 MAX. NUMBER OF ITERATIONS:       60
 INTERPOLATION TYPE:            DIIS
 INTERPOLATION STEPS:              2 (START)      1 (STEP)
 LEVEL SHIFTS:                 -0.60 (CLOSED) -0.30 (OPEN) 


 Singly occupied orbitals:      1.3       1.5

   Atom=SE basis=ECP28MDF_GUESS    lmin=0  lmax=1

 Orbital guess generated from atomic densities. Full valence occupancy:    1   1   1   0   1   0   0   0


 Molecular orbital dump at record        4202.2

 ITERATION    DDIFF          GRAD             ENERGY        2-EL.EN.            DIPOLE MOMENTS         DIIS   ORB.
    1      0.000D+00      0.000D+00        -9.14223784     11.375258    0.00000    0.00000    0.00000    0    start
    2      0.000D+00      0.523D-02        -9.14863931     11.538462    0.00000    0.00000    0.00000    1    diag,B
    3      0.569D-02      0.180D-02        -9.14988353     11.611665    0.00000    0.00000    0.00000    2    diag,B
    4      0.199D-02      0.620D-03        -9.15004320     11.630363    0.00000    0.00000    0.00000    3    diag,B
    5      0.114D-02      0.135D-03        -9.15004971     11.631891    0.00000    0.00000    0.00000    4    diag,B
    6      0.235D-03      0.358D-04        -9.15005017     11.632219    0.00000    0.00000    0.00000    5    diag,B
    7      0.981D-04      0.135D-04        -9.15005024     11.632252    0.00000    0.00000    0.00000    6    fixocc
    8      0.522D-04      0.418D-05        -9.15005025     11.632311    0.00000    0.00000    0.00000    7    diag,B
    9      0.153D-04      0.118D-05        -9.15005025     11.632323    0.00000    0.00000    0.00000    8    diag,B
   10      0.196D-05      0.474D-06        -9.15005025     11.632327    0.00000    0.00000    0.00000    0    orth

 Final alpha occupancy:   1   1   1   0   1   0   0   0
 Final beta  occupancy:   1   1   0   0   0   0   0   0

 !RHF STATE 1.7 Energy                 -9.150050247358
 Nuclear energy                         0.00000000
 One-electron energy                  -14.96621359
 Two-electron energy                    5.81616334
 Virial quotient                       -2.78860535
 !RHF STATE 1.7 Dipole moment           0.00000000     0.00000000     0.00000000
 Dipole moment /Debye                   0.00000000     0.00000000     0.00000000
 

 !RHF expec          <1.7|EKIN|1.7>     3.281228108734
 
 !RHF expec           <1.7|POT|1.7>    -3.240817946209

 ELECTRON ORBITALS
 =================


   Orb  Occ    Energy  Couls-En    Coefficients

                                   1 1s      1 1s      1 1s      1 1s      1 1s      1 1s      1 3d0     1 3d2+    1 3d0     1 3d2+ 
                                   1 3d0     1 3d2+    1 3d0     1 3d2+    1 3d0     1 3d2+    1 5g0     1 5g4+    1 5g2+    1 5g0  
                                   1 5g4+    1 5g2+    1 5g0     1 5g4+    1 5g2+ 

   1.1   2    -0.8548   -3.7395  1.000960  0.002263 -0.006428  0.008093 -0.006905  0.002444 -0.000171  0.000296  0.000236 -0.000409
                                -0.000118  0.000205 -0.002711  0.004696 -0.000813  0.001408  0.000003  0.000005 -0.000004 -0.000001
                                -0.000002  0.000001 -0.000015 -0.000029  0.000022

                                   1 2px     1 2px     1 2px     1 2px     1 2px     1 2px     1 4f1+    1 4f3+    1 4f1+    1 4f3+ 
                                   1 4f1+    1 4f3+    1 4f1+    1 4f3+    1 6h1+    1 6h3+    1 6h5+    1 6h1+    1 6h3+    1 6h5+ 


   1.2   2    -0.3663   -2.6495  1.001862  0.000508 -0.002203  0.002909 -0.005675  0.002887  0.001079 -0.001393  0.002737 -0.003534
                                 0.003390 -0.004376  0.001277 -0.001649  0.000016 -0.000017  0.000023  0.000034 -0.000037  0.000049

                                   1 2py     1 2py     1 2py     1 2py     1 2py     1 2py     1 4f1-    1 4f3-    1 4f1-    1 4f3- 
                                   1 4f1-    1 4f3-    1 4f1-    1 4f3-    1 6h1-    1 6h3-    1 6h5-    1 6h1-    1 6h3-    1 6h5- 


   1.3   +    -0.4458   -2.7611  1.024472 -0.006323  0.022133  0.006685 -0.061142 -0.004886  0.000839 -0.003250  0.002189 -0.008478
                                 0.002333 -0.009037  0.000646 -0.002503  0.000019 -0.000061  0.000137  0.000030 -0.000096  0.000214

                                   1 2pz     1 2pz     1 2pz     1 2pz     1 2pz     1 2pz     1 4f0     1 4f2+    1 4f0     1 4f2+ 
                                   1 4f0     1 4f2+    1 4f0     1 4f2+    1 6h2+    1 6h4+    1 6h0     1 6h2+    1 6h4+    1 6h0  


   1.5   +    -0.4458   -2.7611  1.024472 -0.006323  0.022133  0.006685 -0.061142 -0.004886  0.002055 -0.002653  0.005362 -0.006923
                                 0.005715 -0.007379  0.001583 -0.002044 -0.000100  0.000087  0.000073 -0.000157  0.000136  0.000115

 HOMO      1.2    -0.366288 =      -9.9672eV
 LUMO      2.1     0.066165 =       1.8004eV
 LUMO-HOMO         0.432453 =      11.7676eV


 **********************************************************************************************************************************
 DATASETS  * FILE   NREC   LENGTH (MB)   RECORD NAMES
              1      20       38.54       500      610      700      900      950      970     1000      129      960     1100   
                                          VAR    BASINP    GEOM    SYMINP    ZMAT    AOBASIS   BASIS     P2S    ABASIS      S 
                                         1400     1410     1420     1200     1210     1080     1600     1650     1300     1700   
                                         EKIN       V       ECP      H0       H01     AOSYM     SMH    MOLCAS    ERIS     OPER   

              2       4        2.83       700     1000      520     4202   
                                         GEOM     BASIS   MCVARS     RHF  

 PROGRAMS   *        TOTAL       RHF       INT
 CPU TIMES  *         3.72      0.23      3.38
 REAL TIME  *        15.12 SEC
 DISK USED  *        88.75 MB      
 **********************************************************************************************************************************


 PROGRAM * MULTI (Direct Multiconfiguration SCF)       Authors: P.J. Knowles, H.-J. Werner (1984)     S.T. Elbert (1988)


 Number of closed-shell orbitals:   1 (   1   0   0   0   0   0   0   0 )
 Number of active  orbitals:        3 (   0   1   1   0   1   0   0   0 )
 Number of external orbitals:     122 (  24  19  19  11  19  11  11   8 )

 State symmetry 1

 Number of electrons:     4    Spin symmetry=Triplet   Space symmetry=4
 Number of states:        1
 Number of CSFs:          1   (1 determinants, 3 intermediate states)

 State symmetry 2

 Number of electrons:     4    Spin symmetry=Triplet   Space symmetry=6
 Number of states:        1
 Number of CSFs:          1   (1 determinants, 3 intermediate states)

 State symmetry 3

 Number of electrons:     4    Spin symmetry=Triplet   Space symmetry=7
 Number of states:        1
 Number of CSFs:          1   (1 determinants, 3 intermediate states)

 Iteration controls:
             1  2  3  4  5  6  7  8  9 10 11 12 13 14 15 16 17 18 19 20 21 22 23 24 25 26 27 28 29 30 31 32 33 34 35 36 37 38 39
 DIAGCI      T  T  T  T  T  T  T  T  T  T  T  T  T  T  T  T  T  T  T  T  T  T  T  T  T  T  T  T  T  T  T  T  T  T  T  T  T  T  T
 WERNER      T  T  T  T  T  T  T  T  T  T  T  T  T  T  T  T  T  T  T  T  T  T  T  T  T  T  T  T  T  T  T  T  T  T  T  T  T  T  T
 INTERNAL    F  T  T  T  T  T  T  T  T  T  T  T  T  T  T  T  T  T  T  T  T  T  T  T  T  T  T  T  T  T  T  T  T  T  T  T  T  T  T

 Molecular orbitals read from record     4202.2  Type=RHF/CANONICAL (state 1.7)
 *** IN SYMMETRY 1 ORBITAL  1 SYMMETRY CONTAMINATION OF 0.107D-01 HAS BEEN REMOVED

 EXTRA SYMMETRY OF MOS IN SYMMETRY 1:   1 1 2 3 1 2 3 4 5 6   2 1 3 4 5 6 2 3 1 4   5 6 2 3 1
 *** IN SYMMETRY 2 ORBITAL  1 SYMMETRY CONTAMINATION OF 0.189D-01 HAS BEEN REMOVED
 EXTRA SYMMETRY OF MOS IN SYMMETRY 2:   1 1 1 2 3 2 3 1 5 6   4 2 3 1 2 3 5 6 4 1
 *** IN SYMMETRY 3 ORBITAL  1 SYMMETRY CONTAMINATION OF 0.258D-01 HAS BEEN REMOVED
 EXTRA SYMMETRY OF MOS IN SYMMETRY 3:   1 1 1 2 3 2 3 1 4 5   6 2 3 1 2 3 4 5 6 1
 EXTRA SYMMETRY OF MOS IN SYMMETRY 4:   1 1 2 3 1 2 3 1 2 3   1
 *** IN SYMMETRY 5 ORBITAL  1 SYMMETRY CONTAMINATION OF 0.296D-01 HAS BEEN REMOVED
 EXTRA SYMMETRY OF MOS IN SYMMETRY 5:   1 1 1 2 3 2 3 1 6 5   4 2 3 1 2 3 6 5 4 1
 EXTRA SYMMETRY OF MOS IN SYMMETRY 6:   1 1 3 2 1 3 2 1 3 2   1
 EXTRA SYMMETRY OF MOS IN SYMMETRY 7:   1 1 2 3 1 2 3 1 2 3   1
 EXTRA SYMMETRY OF MOS IN SYMMETRY 8:   1 1 3 2 1 1 3 2

 Wavefunction dump at record             5202.2

 Convergence thresholds  0.10E-01 (gradient)  0.10E-05 (energy)  0.10E-02 (step length)

 Weight factors for state symmetry  1:    0.33333
 Weight factors for state symmetry  2:    0.33333
 Weight factors for state symmetry  3:    0.33333

 Number of orbital rotations:       81   (     0 Core/Active     24 Core/Virtual   0 Active/Active     57 Active/Virtual)
 Total number of variables:         84


 ITER. MIC  NCI  NEG     ENERGY(VAR)     ENERGY(PROJ)   ENERGY CHANGE     GRAD(0)  GRAD(ORB)   GRAD(CI)     STEP       TIME

   1   22   12    0      -9.14663544      -9.14763070   -0.00099526    0.02765117 0.00000000 0.00000000  0.41D-01      0.04
   2   14   12    0      -9.14763351      -9.14763353   -0.00000003    0.00015876 0.00000000 0.00000000  0.19D-03      0.06
   3   15   12    0      -9.14763353      -9.14763353    0.00000000    0.00000001 0.00000000 0.00000000  0.60D-08      0.10

 ** WVFN ****  CONVERGENCE REACHED, FINAL GRADIENT:  0.73D-13



 Results for state 1.4
 =====================

 !MCSCF STATE 1.4 Energy               -9.147633534656
 Nuclear energy                         0.00000000
 Kinetic energy                         3.27916417
 One electron energy                  -14.96940670
 Two electron energy                    5.82177317
 Virial ratio                           3.78962353

 !MCSCF STATE 1.4 Dipole moment         0.00000000     0.00000000     0.00000000
 Dipole moment /Debye                   0.00000000     0.00000000     0.00000000



 Results for state 1.6
 =====================

 !MCSCF STATE 1.6 Energy               -9.147633534656
 Nuclear energy                         0.00000000
 Kinetic energy                         3.27916417
 One electron energy                  -14.96940670
 Two electron energy                    5.82177317
 Virial ratio                           3.78962353

 !MCSCF STATE 1.6 Dipole moment         0.00000000     0.00000000     0.00000000
 Dipole moment /Debye                   0.00000000     0.00000000     0.00000000



 Results for state 1.7
 =====================

 !MCSCF STATE 1.7 Energy               -9.147633534656
 Nuclear energy                         0.00000000
 Kinetic energy                         3.27916417
 One electron energy                  -14.96940670
 Two electron energy                    5.82177317
 Virial ratio                           3.78962353

 !MCSCF STATE 1.7 Dipole moment         0.00000000     0.00000000     0.00000000
 Dipole moment /Debye                   0.00000000     0.00000000     0.00000000

 State-averaged charge density matrix saved on record  5202.2 (density set 1)

 !MCSCF expec        <1.4|EKIN|1.4>     3.279164170306
 !MCSCF expec        <1.6|EKIN|1.6>     3.279164170306
 !MCSCF expec        <1.7|EKIN|1.7>     3.279164170306

 !MCSCF expec         <1.4|POT|1.4>    -3.240998623576
 !MCSCF expec         <1.6|POT|1.6>    -3.240998623576
 !MCSCF expec         <1.7|POT|1.7>    -3.240998623576


 NATURAL ORBITALS (state averaged)
 =================================

   Orb     Occ        Energy       Coefficients

                                   1 1s      1 1s      1 1s      1 1s      1 1s      1 1s      1 3d0     1 3d2+    1 3d0     1 3d2+ 
                                   1 3d0     1 3d2+    1 3d0     1 3d2+    1 3d0     1 3d2+    1 5g0     1 5g4+    1 5g2+    1 5g0  
                                   1 5g4+    1 5g2+    1 5g0     1 5g4+    1 5g2+ 

   1.1  2.00000    -0.854624     1.000919  0.002377 -0.006714  0.008076 -0.006575  0.002380  0.000000  0.000000  0.000000  0.000000
                                 0.000000  0.000000  0.000000  0.000000  0.000000  0.000000  0.000000  0.000000  0.000000  0.000000
                                 0.000000  0.000000  0.000000  0.000000  0.000000

                                   1 2px     1 2px     1 2px     1 2px     1 2px     1 2px     1 4f1+    1 4f3+    1 4f1+    1 4f3+ 
                                   1 4f1+    1 4f3+    1 4f1+    1 4f3+    1 6h1+    1 6h3+    1 6h5+    1 6h1+    1 6h3+    1 6h5+ 


   1.2  1.33333    -0.265071     1.013697 -0.002607  0.008726  0.005960 -0.033281 -0.001928  0.000000  0.000000  0.000000  0.000000
                                 0.000000  0.000000  0.000000  0.000000  0.000000  0.000000  0.000000  0.000000  0.000000  0.000000

                                   1 2py     1 2py     1 2py     1 2py     1 2py     1 2py     1 4f1-    1 4f3-    1 4f1-    1 4f3- 
                                   1 4f1-    1 4f3-    1 4f1-    1 4f3-    1 6h1-    1 6h3-    1 6h5-    1 6h1-    1 6h3-    1 6h5- 


   1.3  1.33333    -0.265071     1.013697 -0.002607  0.008726  0.005960 -0.033281 -0.001928  0.000000  0.000000  0.000000  0.000000
                                 0.000000  0.000000  0.000000  0.000000  0.000000  0.000000  0.000000  0.000000  0.000000  0.000000

                                   1 2pz     1 2pz     1 2pz     1 2pz     1 2pz     1 2pz     1 4f0     1 4f2+    1 4f0     1 4f2+ 
                                   1 4f0     1 4f2+    1 4f0     1 4f2+    1 6h2+    1 6h4+    1 6h0     1 6h2+    1 6h4+    1 6h0  


   1.5  1.33333    -0.265071     1.013697 -0.002607  0.008726  0.005960 -0.033281 -0.001928  0.000000  0.000000  0.000000  0.000000
                                 0.000000  0.000000  0.000000  0.000000  0.000000  0.000000  0.000000  0.000000  0.000000  0.000000
 

 EXTRA SYMMETRY OF MOS IN SYMMETRY 1:   1 1 2 3 1 2 3 4 5 6   1 2 3 4 6 5 2 3 1 4   6 5 2 3 1
 EXTRA SYMMETRY OF MOS IN SYMMETRY 2:   1 1 1 3 2 2 3 1 5 6   4 2 3 1 2 3 4 5 6 1
 EXTRA SYMMETRY OF MOS IN SYMMETRY 3:   1 1 1 3 2 2 3 1 5 6   4 2 3 1 2 3 4 5 6 1
 EXTRA SYMMETRY OF MOS IN SYMMETRY 4:   1 1 3 2 1 2 3 1 2 3   1
 EXTRA SYMMETRY OF MOS IN SYMMETRY 5:   1 1 1 2 3 2 3 1 6 4   5 2 3 1 2 3 6 4 5 1
 EXTRA SYMMETRY OF MOS IN SYMMETRY 6:   1 1 2 3 1 3 2 1 3 2   1
 EXTRA SYMMETRY OF MOS IN SYMMETRY 7:   1 1 2 3 1 3 2 1 3 2   1

 Natural orbital dump (state averaged) at molpro section  5202.2    (Orbital set 2)


 CI vector for state symmetry 1
 ==============================

 a a 2           1.0000000

 TOTAL ENERGIES                        -9.14763353

 CI vector for state symmetry 2
 ==============================

 a 2 a           1.0000000

 TOTAL ENERGIES                        -9.14763353

 CI vector for state symmetry 3
 ==============================

 2 a a           1.0000000

 TOTAL ENERGIES                        -9.14763353



 **********************************************************************************************************************************
 DATASETS  * FILE   NREC   LENGTH (MB)   RECORD NAMES
              1      21       38.83       500      610      700      900      950      970     1000      129      960     1100   
                                          VAR    BASINP    GEOM    SYMINP    ZMAT    AOBASIS   BASIS     P2S    ABASIS      S 
                                         1400     1410     1420     1200     1210     1080     1600     1650     1300     1700   
                                         EKIN       V       ECP      H0       H01     AOSYM     SMH    MOLCAS    ERIS     OPER   
                                         1380   
                                         JKOP   

              2       5        5.40       700     1000      520     4202     5202   
                                         GEOM     BASIS   MCVARS     RHF     MCSCF   

 PROGRAMS   *        TOTAL     MULTI       RHF       INT
 CPU TIMES  *         3.86      0.13      0.23      3.38
 REAL TIME  *        16.29 SEC
 DISK USED  *        88.75 MB      
 **********************************************************************************************************************************


 PROGRAM * RHF-SCF (OPEN SHELL)       Authors: W. Meyer, H.-J. Werner


 NUMBER OF ELECTRONS:       4+    2-    SPACE SYMMETRY=7    SPIN SYMMETRY: Triplet 
 CONVERGENCE THRESHOLDS:    1.00E-05 (Density)    1.00E-07 (Energy)
 MAX. NUMBER OF ITERATIONS:        0
 INTERPOLATION TYPE:            DIIS
 INTERPOLATION STEPS:              2 (START)      1 (STEP)
 LEVEL SHIFTS:                 -0.60 (CLOSED) -0.30 (OPEN) 


 Singly occupied orbitals:      1.3       1.5
 Molecular orbitals read from record     5202.2  Type=MCSCF/NATURAL (state averaged)

 Molecular orbital dump at record        2101.2

 ITERATION    DDIFF          GRAD             ENERGY        2-EL.EN.            DIPOLE MOMENTS         DIIS   ORB.
    1      0.000D+00      0.000D+00        -9.14763353     11.643546    0.00000    0.00000    0.00000    0    start

 Final alpha occupancy:   1   1   1   0   1   0   0   0
 Final beta  occupancy:   1   1   0   0   0   0   0   0

 !RHF STATE 1.7 Energy                 -9.147633534656
 Nuclear energy                         0.00000000
 One-electron energy                  -14.96940670
 Two-electron energy                    5.82177317
 Virial quotient                       -2.78962353
 !RHF STATE 1.7 Dipole moment           0.00000000     0.00000000     0.00000000
 Dipole moment /Debye                   0.00000000     0.00000000     0.00000000
 

 !RHF expec          <1.7|EKIN|1.7>     3.279164170306
 
 !RHF expec           <1.7|POT|1.7>    -3.240998623576

 ELECTRON ORBITALS
 =================


   Orb  Occ    Energy  Couls-En    Coefficients

                                   1 1s      1 1s      1 1s      1 1s      1 1s      1 1s      1 3d0     1 3d2+    1 3d0     1 3d2+ 
                                   1 3d0     1 3d2+    1 3d0     1 3d2+    1 3d0     1 3d2+    1 5g0     1 5g4+    1 5g2+    1 5g0  
                                   1 5g4+    1 5g2+    1 5g0     1 5g4+    1 5g2+ 

   1.1   2    -0.8546   -3.7393  1.000919  0.002377 -0.006714  0.008076 -0.006575  0.002380  0.000000  0.000000  0.000000  0.000000
                                 0.000000  0.000000  0.000000  0.000000  0.000000  0.000000  0.000000  0.000000  0.000000  0.000000
                                 0.000000  0.000000  0.000000  0.000000  0.000000

                                   1 2px     1 2px     1 2px     1 2px     1 2px     1 2px     1 4f1+    1 4f3+    1 4f1+    1 4f3+ 
                                   1 4f1+    1 4f3+    1 4f1+    1 4f3+    1 6h1+    1 6h3+    1 6h5+    1 6h1+    1 6h3+    1 6h5+ 


   1.2   2    -0.2651   -2.5651  1.013697 -0.002607  0.008726  0.005960 -0.033281 -0.001928  0.000000  0.000000  0.000000  0.000000
                                 0.000000  0.000000  0.000000  0.000000  0.000000  0.000000  0.000000  0.000000  0.000000  0.000000

                                   1 2py     1 2py     1 2py     1 2py     1 2py     1 2py     1 4f1-    1 4f3-    1 4f1-    1 4f3- 
                                   1 4f1-    1 4f3-    1 4f1-    1 4f3-    1 6h1-    1 6h3-    1 6h5-    1 6h1-    1 6h3-    1 6h5- 


   1.3   +    -0.2651   -2.5651  1.013697 -0.002607  0.008726  0.005960 -0.033281 -0.001928  0.000000  0.000000  0.000000  0.000000
                                 0.000000  0.000000  0.000000  0.000000  0.000000  0.000000  0.000000  0.000000  0.000000  0.000000

                                   1 2pz     1 2pz     1 2pz     1 2pz     1 2pz     1 2pz     1 4f0     1 4f2+    1 4f0     1 4f2+ 
                                   1 4f0     1 4f2+    1 4f0     1 4f2+    1 6h2+    1 6h4+    1 6h0     1 6h2+    1 6h4+    1 6h0  


   1.5   +    -0.2651   -2.5651  1.013697 -0.002607  0.008726  0.005960 -0.033281 -0.001928  0.000000  0.000000  0.000000  0.000000
                                 0.000000  0.000000  0.000000  0.000000  0.000000  0.000000  0.000000  0.000000  0.000000  0.000000

 HOMO      1.2    -0.265071 =      -7.2129eV
 LUMO      2.2     0.070004 =       1.9049eV
 LUMO-HOMO         0.335075 =       9.1179eV


 **********************************************************************************************************************************
 DATASETS  * FILE   NREC   LENGTH (MB)   RECORD NAMES
              1      21       38.83       500      610      700      900      950      970     1000      129      960     1100   
                                          VAR    BASINP    GEOM    SYMINP    ZMAT    AOBASIS   BASIS     P2S    ABASIS      S 
                                         1400     1410     1420     1200     1210     1080     1600     1650     1300     1700   
                                         EKIN       V       ECP      H0       H01     AOSYM     SMH    MOLCAS    ERIS     OPER   
                                         1380   
                                         JKOP   

              2       6        8.00       700     1000      520     4202     5202     2101   
                                         GEOM     BASIS   MCVARS     RHF     MCSCF     RHF  

 PROGRAMS   *        TOTAL       RHF     MULTI       RHF       INT
 CPU TIMES  *         3.89      0.03      0.13      0.23      3.38
 REAL TIME  *        16.56 SEC
 DISK USED  *        88.75 MB      
 **********************************************************************************************************************************
 SETTING SCF(I)         =        -9.14763353  AU                              
 SETTING _CC_NORM_MAX   =         2.00000000                                  


 PROGRAM * UHF-SCF       Authors: W. Meyer, H.-J. Werner


 NUMBER OF ELECTRONS:       4+    2-    SPACE SYMMETRY=7    SPIN SYMMETRY: Triplet 
 CONVERGENCE THRESHOLDS:    1.00E-05 (Density)    1.00E-07 (Energy)
 MAX. NUMBER OF ITERATIONS:        0
 INTERPOLATION TYPE:            DIIS
 INTERPOLATION STEPS:              2 (START)      1 (STEP)
 LEVEL SHIFTS:                  0.20 (ALPHA)   0.20 (BETA) 



 Molecular orbitals read from record     2101.2  Type=RHF/CANONICAL (state 1.7)

 Molecular orbital dump at record        2200.2

 Initial alpha occupation   1   1   1   0   1   0   0   0
 Initial beta  occupation   1   1   0   0   0   0   0   0

 ITERATION    DDIFF          GRAD             ENERGY        2-EL.EN.            DIPOLE MOMENTS         DIIS
    1      0.000D+00      0.000D+00        -9.14763353     11.643546    0.00000    0.00000    0.00000    0
 
 Final alpha occupancy:   1   1   1   0   1   0   0   0
 Final beta  occupancy:   1   1   0   0   0   0   0   0

 !UHF STATE 1.7 Energy                 -9.147633534656
 Nuclear energy                         0.00000000
 One-electron energy                  -14.96940670
 Two-electron energy                    5.82177317
 Virial quotient                       -2.78962353
 !UHF STATE 1.7 Dipole moment           0.00000000     0.00000000     0.00000000
 Dipole moment /Debye                   0.00000000     0.00000000     0.00000000
 

 !UHF expec          <1.7|EKIN|1.7>     3.279164170306
 
 !UHF expec           <1.7|POT|1.7>    -3.240998623576

 ELECTRON ORBITALS FOR POSITIVE SPIN
 ===================================


   Orb  Occ    Energy  Couls-En    Coefficients

                                   1 1s      1 1s      1 1s      1 1s      1 1s      1 1s      1 3d0     1 3d2+    1 3d0     1 3d2+ 
                                   1 3d0     1 3d2+    1 3d0     1 3d2+    1 3d0     1 3d2+    1 5g0     1 5g4+    1 5g2+    1 5g0  
                                   1 5g4+    1 5g2+    1 5g0     1 5g4+    1 5g2+ 

   1.1   +    -0.8546   -3.7393  1.000919  0.002377 -0.006714  0.008076 -0.006575  0.002380  0.000000  0.000000  0.000000  0.000000
                                 0.000000  0.000000  0.000000  0.000000  0.000000  0.000000  0.000000  0.000000  0.000000  0.000000
                                 0.000000  0.000000  0.000000  0.000000  0.000000

                                   1 2px     1 2px     1 2px     1 2px     1 2px     1 2px     1 4f1+    1 4f3+    1 4f1+    1 4f3+ 
                                   1 4f1+    1 4f3+    1 4f1+    1 4f3+    1 6h1+    1 6h3+    1 6h5+    1 6h1+    1 6h3+    1 6h5+ 


   1.2   +    -0.2651   -2.5651  1.013697 -0.002607  0.008726  0.005960 -0.033281 -0.001928  0.000000  0.000000  0.000000  0.000000
                                 0.000000  0.000000  0.000000  0.000000  0.000000  0.000000  0.000000  0.000000  0.000000  0.000000

                                   1 2py     1 2py     1 2py     1 2py     1 2py     1 2py     1 4f1-    1 4f3-    1 4f1-    1 4f3- 
                                   1 4f1-    1 4f3-    1 4f1-    1 4f3-    1 6h1-    1 6h3-    1 6h5-    1 6h1-    1 6h3-    1 6h5- 


   1.3   +    -0.2651   -2.5651  1.013697 -0.002607  0.008726  0.005960 -0.033281 -0.001928  0.000000  0.000000  0.000000  0.000000
                                 0.000000  0.000000  0.000000  0.000000  0.000000  0.000000  0.000000  0.000000  0.000000  0.000000

                                   1 2pz     1 2pz     1 2pz     1 2pz     1 2pz     1 2pz     1 4f0     1 4f2+    1 4f0     1 4f2+ 
                                   1 4f0     1 4f2+    1 4f0     1 4f2+    1 6h2+    1 6h4+    1 6h0     1 6h2+    1 6h4+    1 6h0  


   1.5   +    -0.2651   -2.5651  1.013697 -0.002607  0.008726  0.005960 -0.033281 -0.001928  0.000000  0.000000  0.000000  0.000000
                                 0.000000  0.000000  0.000000  0.000000  0.000000  0.000000  0.000000  0.000000  0.000000  0.000000

 ELECTRON ORBITALS FOR NEGATIVE SPIN
 ===================================


   Orb  Occ    Energy  Couls-En    Coefficients

                                   1 1s      1 1s      1 1s      1 1s      1 1s      1 1s      1 3d0     1 3d2+    1 3d0     1 3d2+ 
                                   1 3d0     1 3d2+    1 3d0     1 3d2+    1 3d0     1 3d2+    1 5g0     1 5g4+    1 5g2+    1 5g0  
                                   1 5g4+    1 5g2+    1 5g0     1 5g4+    1 5g2+ 

   1.1   -    -0.8546   -3.7393  1.000919  0.002377 -0.006714  0.008076 -0.006575  0.002380  0.000000  0.000000  0.000000  0.000000
                                 0.000000  0.000000  0.000000  0.000000  0.000000  0.000000  0.000000  0.000000  0.000000  0.000000
                                 0.000000  0.000000  0.000000  0.000000  0.000000

                                   1 2px     1 2px     1 2px     1 2px     1 2px     1 2px     1 4f1+    1 4f3+    1 4f1+    1 4f3+ 
                                   1 4f1+    1 4f3+    1 4f1+    1 4f3+    1 6h1+    1 6h3+    1 6h5+    1 6h1+    1 6h3+    1 6h5+ 


   1.2   -    -0.2651   -2.5651  1.013697 -0.002607  0.008726  0.005960 -0.033281 -0.001928  0.000000  0.000000  0.000000  0.000000
                                 0.000000  0.000000  0.000000  0.000000  0.000000  0.000000  0.000000  0.000000  0.000000  0.000000

 HOMO      1.2    -0.265071 =      -7.2129eV
 LUMO     -1.3    -0.265071 =      -7.2129eV
 LUMO-HOMO         0.000000 =       0.0000eV

 EXPECTATION VALUE OF S**2:             2.00000000

 Occupation number threshold for canonical orbitals:  1.999000 (occupied),  0.001000 (virtual)

 Number of pseudo-canonical orbitals per symmetry:    1   1   0   0   0   0   0   0
 Number of active natural orbitals per symmetry:      0   0   1   0   1   0   0   0

 NATURAL CHARGE ORBITALS
 =======================


   Orb     Occ        Energy       Coefficients

                                   1 1s      1 1s      1 1s      1 1s      1 1s      1 1s      1 3d0     1 3d2+    1 3d0     1 3d2+ 
                                   1 3d0     1 3d2+    1 3d0     1 3d2+    1 3d0     1 3d2+    1 5g0     1 5g4+    1 5g2+    1 5g0  
                                   1 5g4+    1 5g2+    1 5g0     1 5g4+    1 5g2+ 

   1.1  2.00000    -0.854624     1.000919  0.002377 -0.006714  0.008076 -0.006575  0.002380  0.000000  0.000000  0.000000  0.000000
                                 0.000000  0.000000  0.000000  0.000000  0.000000  0.000000  0.000000  0.000000  0.000000  0.000000
                                 0.000000  0.000000  0.000000  0.000000  0.000000

                                   1 2px     1 2px     1 2px     1 2px     1 2px     1 2px     1 4f1+    1 4f3+    1 4f1+    1 4f3+ 
                                   1 4f1+    1 4f3+    1 4f1+    1 4f3+    1 6h1+    1 6h3+    1 6h5+    1 6h1+    1 6h3+    1 6h5+ 


   1.2  2.00000    -0.265071     1.013697 -0.002607  0.008726  0.005960 -0.033281 -0.001928  0.000000  0.000000  0.000000  0.000000
                                 0.000000  0.000000  0.000000  0.000000  0.000000  0.000000  0.000000  0.000000  0.000000  0.000000

                                   1 2py     1 2py     1 2py     1 2py     1 2py     1 2py     1 4f1-    1 4f3-    1 4f1-    1 4f3- 
                                   1 4f1-    1 4f3-    1 4f1-    1 4f3-    1 6h1-    1 6h3-    1 6h5-    1 6h1-    1 6h3-    1 6h5- 


   1.3  1.00000    -0.214557     1.013697 -0.002607  0.008726  0.005960 -0.033281 -0.001928  0.000000  0.000000  0.000000  0.000000
                                 0.000000  0.000000  0.000000  0.000000  0.000000  0.000000  0.000000  0.000000  0.000000  0.000000

                                   1 2pz     1 2pz     1 2pz     1 2pz     1 2pz     1 2pz     1 4f0     1 4f2+    1 4f0     1 4f2+ 
                                   1 4f0     1 4f2+    1 4f0     1 4f2+    1 6h2+    1 6h4+    1 6h0     1 6h2+    1 6h4+    1 6h0  


   1.5  1.00000    -0.214557     1.013697 -0.002607  0.008726  0.005960 -0.033281 -0.001928  0.000000  0.000000  0.000000  0.000000
                                 0.000000  0.000000  0.000000  0.000000  0.000000  0.000000  0.000000  0.000000  0.000000  0.000000

 Natural orbitals saved to record    2200.2 (Orbital set 3)

 Orbital spaces for UNO-CAS (Min. occupation: 0.020  Max. occupation: 1.980):

 Closed:        1   1   0   0   0   0   0   0
 Active:        0   0   1   0   1   0   0   0

 No convergence



 **********************************************************************************************************************************
 DATASETS  * FILE   NREC   LENGTH (MB)   RECORD NAMES
              1      21       38.83       500      610      700      900      950      970     1000      129      960     1100   
                                          VAR    BASINP    GEOM    SYMINP    ZMAT    AOBASIS   BASIS     P2S    ABASIS      S 
                                         1400     1410     1420     1200     1210     1080     1600     1650     1300     1700   
                                         EKIN       V       ECP      H0       H01     AOSYM     SMH    MOLCAS    ERIS     OPER   
                                         1380   
                                         JKOP   

              2       7       10.62       700     1000      520     4202     5202     2101     2200   
                                         GEOM     BASIS   MCVARS     RHF     MCSCF     RHF      UHF  

 PROGRAMS   *        TOTAL       UHF       RHF     MULTI       RHF       INT
 CPU TIMES  *         3.92      0.03      0.03      0.13      0.23      3.38
 REAL TIME  *        16.82 SEC
 DISK USED  *        88.75 MB      
 **********************************************************************************************************************************
 SETTING SCF(I)         =        -9.14763353  AU                              


 PROGRAM * MRCC (General Multireference Coupled Cluster)    Author: M. Kallay, 2000-2005

 ***  Initialisation ***

   0 Spin projections
 
 Molecular orbitals read from record     2200.2  Type=UHF/ALPHA (state 1.7)

 ?Warning: UHF not converged
 Molecular orbitals read from record     2200.2  Type=UHF/BETA (state 1.7)

 ?Warning: UHF not converged
 
 Frozen orbitals:              0 (  0  0  0  0  0  0  0  0)
 Active orbitals:            126 ( 25 20 20 11 20 11 11  8)
 Active electrons:             6
 Spin quantum number:          1.0

 Transformed integrals will be written to file mrcc_29580/fort.55

 Load integrals                4.0 sec
 Transform integrals           6.4 sec
 Storage for integrals:       24278327
 Remaining memory:           *********

 Core energy:               0.00000000
 
 MRCC Input:
     4     0     0     0     3     0     0     7     0     0     0     1     1     0     0     7     0     0   0.000     0   64000
  ex.lev,nsing,ntrip, rest,method,dens,conver,symm, diag, CS ,spatial, HF, ndoub,nacto,nactv, tol, maxex, sacc, freq,  dboc,   mem
  2  0  0  0  0  0  0  0  0  0  0  0  0  0  0  0  0  0  0  0  0  0  0  0  0  2  0  0  0  0  0  0  0  0  0  0  0  0  0  0  0  0  0  0  0  1  0  0  0  0  0  0  0  0  0  0  0  0  0  0  0  0  0  0  0  0  0  0  0  0  0  0  0  0  0  0  1  0  0  0  0  0  0  0  0  0  0  0  0  0  0  0  0  0  0  0  0  0  0  0  0  0  0  0  0  0  0  0  0  0  0  0  0  0  0  0  0  0  0  0  0  0  0  0  0  0
 MRCC Input end
 Variable memory released
 MRCC now being run, temporary output in /global/cscratch1/sd/aannabe/mrcc_29580/mrcc.out
 **********************************************************************
                          MRCC program system
 **********************************************************************

                              Written by
  Mihaly Kallay, Zoltan Rolik, Jozsef Csontos, Peter Nagy, Gyula Samu,
      David Mester, Jozsef Csoka, Bernat Szabo, Istvan Ladjanszki,
       Lorant Szegedy, Bence Ladoczki, Klara Petrov, Mate Farkas,
                    Pal D. Mezei, and Bence Hegely

        Department of Physical Chemistry and Materials Science
            Budapest University of Technology and Economics
                  Budapest P.O.Box 91, H-1521 Hungary

                              www.mrcc.hu

                       Release date: May 23, 2018

 ************************ 2019-06-25 13:03:32 *************************
 Executing goldstone...

 Generation of CC equations in terms of H and T...
 Generation of antisymmetrized Goldstone diagrams...
 Number of diagrams in T^1 equations:    15
 Number of diagrams in T^2 equations:    38
 Number of diagrams in T^3 equations:    49
 Number of diagrams in T^4 equations:     5
 Translation of diagrams to factorized equations...
 Optimizing intermediate calculation...
 Number of floating-point operations per iteration step:   5.2358E+11
 Probable CPU time per iteration step (hours):      5.24
 Required memory (Mbytes):   29863.8
 Number of intermediates:                                  79
 Number of intermediates to be stored:                     32
 Length of intermediate file (Mbytes):     503.7

 ************************ 2019-06-25 13:03:33 *************************
 Executing xmrcc...

 **********************************************************************
 CC(3)(4) calculation


 Allocation of****** Mbytes of memory...
 Number of spinorbitals:                   252
 Number of alpha electrons:                        4
 Number of beta electrons:                         2
 Spin multiplicity:                     2
 z-component of spin:  1.0
 Spatial symmetry:                      7
 Convergence criterion:  1.0E-07
 Construction of occupation graphs...
 Number of                     0 -fold excitations:                      1
 Number of                     1 -fold excitations:                    124
 Number of                     2 -fold excitations:                  22268
 Number of                     3 -fold excitations:                1986216
 Total number of configurations:                2008609
 Calculation of coupling coefficients...
 Length of intermediate file (Mbytes):     381.0

 ======================================================================

 Spin case  1   Alpha:  2   Beta:  2
 Number of excitations:               42216485
 Spin case  2   Alpha:  3   Beta:  1
 Number of excitations:               36589408
 Spin case  3   Alpha:  4   Beta:  0
 Number of excitations:                1099202
 Number of                     4 -fold excitations:               79905095

 Memory requirements /Mbyte/:
               Minimal        Optimal
 Real*8:        786.3175      1923.2150
 Integer:        79.5111
 Total:         865.8286      2002.7261


 ************************ 2019-06-25 13:03:43 *************************
 Executing mrcc...

 **********************************************************************
 CCSDT(Q) calculation


 Allocation of 1923.2 Mbytes of memory...
 Number of spinorbitals: 252
 Number of alpha electrons:  4
 Number of beta  electrons:  2
 Spin multiplicity: 2
 z-component of spin:  1.0
 Spatial symmetry: 7
 Convergence criterion:  1.0E-07
 Construction of occupation graphs...
 Number of 0-fold excitations: 1
 Number of 1-fold excitations: 124
 Number of 2-fold excitations: 22268
 Number of 3-fold excitations: 1986216
 Total number of determinants: 2008609
 Calculation of coupling coefficients...
 Initial cluster amplitudes are generated.
 Length of intermediate file (Mbytes):     381.0
 Reading integral list from unit 55...
 Sorting integrals...
 Sorting integrals...
 Sorting integrals...
 Sorting integrals...
 Energy of reference determinant [au]:      -9.147633534656
 Calculation of MP denominators...

 Starting CC iteration...
 ======================================================================
 Norm of residual vector:     0.64649122
 CPU time [min]:     1.268                   Wall time [min]:     1.271

 Iteration  1  CC energy:    -9.27760960  Energy decrease:   0.12997606
 ======================================================================
 Norm of residual vector:     0.17082564
 CPU time [min]:     1.920                   Wall time [min]:     1.928

 Iteration  2  CC energy:    -9.28873760  Energy decrease:   0.01112800
 ======================================================================
 Norm of residual vector:     0.04483776
 CPU time [min]:     2.596                   Wall time [min]:     2.608

 Iteration  3  CC energy:    -9.29722069  Energy decrease:   0.00848309
 ======================================================================
 Norm of residual vector:     0.01056866
 CPU time [min]:     3.274                   Wall time [min]:     3.292

 Iteration  4  CC energy:    -9.29748754  Energy decrease:   0.00026685
 ======================================================================
 Norm of residual vector:     0.00340079
 CPU time [min]:     3.954                   Wall time [min]:     3.982

 Iteration  5  CC energy:    -9.29749894  Energy decrease:   0.00001140
 ======================================================================
 Norm of residual vector:     0.00134285
 CPU time [min]:     4.635                   Wall time [min]:     4.666

 Iteration  6  CC energy:    -9.29751940  Energy decrease:   0.00002047
 ======================================================================
 Norm of residual vector:     0.00058369
 CPU time [min]:     5.321                   Wall time [min]:     5.368

 Iteration  7  CC energy:    -9.29751334  Energy decrease:   0.00000607
 ======================================================================
 Norm of residual vector:     0.00025936
 CPU time [min]:     6.007                   Wall time [min]:     6.076

 Iteration  8  CC energy:    -9.29751293  Energy decrease:   0.00000040
 ======================================================================
 Norm of residual vector:     0.00010353
 CPU time [min]:     6.697                   Wall time [min]:     6.796

 Iteration  9  CC energy:    -9.29751619  Energy decrease:   0.00000326
 ======================================================================
 Norm of residual vector:     0.00003636
 CPU time [min]:     7.388                   Wall time [min]:     7.490

 Iteration 10  CC energy:    -9.29751601  Energy decrease:   0.00000018
 ======================================================================
 Norm of residual vector:     0.00001242
 CPU time [min]:     8.080                   Wall time [min]:     8.184

 Iteration 11  CC energy:    -9.29751550  Energy decrease:   0.00000051
 ======================================================================
 Norm of residual vector:     0.00000410
 CPU time [min]:     8.776                   Wall time [min]:     8.884

 Iteration 12  CC energy:    -9.29751559  Energy decrease:   0.00000009
 ======================================================================
 Norm of residual vector:     0.00000144
 CPU time [min]:     9.473                   Wall time [min]:     9.589

 Iteration 13  CC energy:    -9.29751563  Energy decrease:   0.00000004
 ======================================================================
 Norm of residual vector:     0.00000050
 CPU time [min]:    10.174                   Wall time [min]:    10.294

 Iteration 14  CC energy:    -9.29751562  Energy decrease:   0.00000002
 ======================================================================
 Norm of residual vector:     0.00000016
 CPU time [min]:    10.874                   Wall time [min]:    10.997

 Iteration 15  CC energy:    -9.29751561  Energy decrease:   1.4901E-09
 ======================================================================
 Norm of residual vector:     0.00000005
 CPU time [min]:    11.536                   Wall time [min]:    11.661

 Iteration 16  CC energy:    -9.29751562  Energy decrease:   1.2429E-09
 ======================================================================

 Iteration has converged in 16 steps.

 Final results:
 Total CCSDT energy [au]:             -9.297515615723
 Total MP2 energy [au]:               -9.277609597463

 Perturbative corrections are calculated...
 ======================================================================
 Spin case  1   Alpha:  2   Beta:  2
 Number of excitations:        42216485
 CPU time [min]:   121.631                   Wall time [min]:   121.773
 ======================================================================
 Spin case  2   Alpha:  3   Beta:  1
 Number of excitations:        36589408
 CPU time [min]:   206.409                   Wall time [min]:   206.571
 ======================================================================
 Spin case  3   Alpha:  4   Beta:  0
 Number of excitations:        1099202
 CPU time [min]:   215.605                   Wall time [min]:   215.782
 ======================================================================
 Number of 4-fold excitations: 79905095
 CPU time [min]:   215.605                   Wall time [min]:   215.783

 Total CCSDT[Q] energy [au]:          -9.297501206441
 Total CCSDT(Q) energy [au]:          -9.297676023464

 ************************ 2019-06-25 16:39:32 *************************
                      Normal termination of mrcc.
 **********************************************************************
 !CCSDT STATE 1.7 Energy               -9.297515615723
 !MP2 STATE 1.7 Energy                 -9.277609597463
 !CCSDT[Q] STATE 1.7 Energy            -9.297501206441
 !CCSDT(Q) STATE 1.7 Energy            -9.297676023464
 
 CPU-time for MRCC:          12936.3 sec
 Elapsed-time for MRCC:      12961.6 sec

 Variable memory set to 8000000000 words,  buffer space   230000 words



 **********************************************************************************************************************************
 DATASETS  * FILE   NREC   LENGTH (MB)   RECORD NAMES
              1      21       38.83       500      610      700      900      950      970     1000      129      960     1100   
                                          VAR    BASINP    GEOM    SYMINP    ZMAT    AOBASIS   BASIS     P2S    ABASIS      S 
                                         1400     1410     1420     1200     1210     1080     1600     1650     1300     1700   
                                         EKIN       V       ECP      H0       H01     AOSYM     SMH    MOLCAS    ERIS     OPER   
                                         1380   
                                         JKOP   

              2       7       10.62       700     1000      520     4202     5202     2101     2200   
                                         GEOM     BASIS   MCVARS     RHF     MCSCF     RHF      UHF  

 PROGRAMS   *        TOTAL      MRCC       UHF       RHF     MULTI       RHF       INT
 CPU TIMES  *     12996.96  12993.04      0.03      0.03      0.13      0.23      3.38
 REAL TIME  *     13304.24 SEC
 DISK USED  *        88.75 MB      
 **********************************************************************************************************************************
 SETTING POSTHF(I)      =        -9.29767602  AU                              
                                                                                                                                                                                                                                                                

       SCF           POSTHF       EKIN          POT
    -9.14763353   -9.29767602   3.27916417   -3.24099862
                                                  

 CCSDT(Q)/USERDEF energy=     -9.297676023464

        CCSDT(Q)        RHF-SCF         MULTI           RHF-SCF 
     -9.29767602     -9.14763353     -9.14763353     -9.15005025
 **********************************************************************************************************************************
 Molpro calculation terminated
 Variable memory released
