
 Primary working directories    : /global/cscratch1/sd/aannabe
 Secondary working directories  : /global/cscratch1/sd/aannabe
 Wavefunction directory         : /global/homes/a/aannabe/wfu/
 Main file repository           : /global/cscratch1/sd/aannabe/

 SHA1      : 19cd028119e0e09f93f0674bd8af7968d9b3eff6
 NAME      : 2015.1.36
 ARCHNAME  : linux/x86_64
 FC        : /opt/cray/pe/craype/2.5.14/bin/ftn
 BLASLIB   : -L/opt/intel/compilers_and_libraries_2018.1.163/linux/mkl/lib/intel64 -Wl,-_start-group -lmkl_intel_ilp64 -lmkl_intel_thread -lmkl_core -Wl,-_end-group -liomp5
 id        : lbl

 Nodes     nprocs
 nid00471     1

 Using customized tuning parameters: mindgm=7; mindgv=16; mindgc=1; mindgr=1; noblas=0; minvec=7
 default implementation of scratch files=df  

 ***,Se
 memory,8,g
 gthresh,twoint=1.e-12
 
 gprint,basis,orbitals
 gexpec,ekin,pot
 
 angstrom
 geometry={
 1                                                                               ! Number of atoms
 Se 0.0 0.0 0.0
 }
 
 basis={
 
 Including file /global/homes/a/aannabe/repos/pseudopotentiallibrary/recipes/Se/ccECP/Se.ccECP.molpro
 
                                   !include,/global/homes/a/aannabe/repos/pseudopotentiallibrary/recipes/Se/ccECP/Se.cc-pV6Z.molpro
                                  !include,/global/homes/a/aannabe/repos/pseudopotentiallibrary/recipes/Se/ccECP/Se.cc-pCV6Z.molpro
 Including file /global/homes/a/aannabe/repos/pseudopotentiallibrary/recipes/Se/ccECP/Se.aug-cc-pV6Z.molpro
 
 
 }
 
 
 {rhf
  start,atden
  wf,6,7,2
  occ,1,1,1,0,1,0,0,0
  open,1.3,1.5
  orbital,4202.2
 }
 {multi
  maxiter,40
  start,4202.2
  occ,1,1,1,0,1,0,0,0
  closed,1,0,0,0,0,0,0
  wf,6,4,2;state,1
  wf,6,6,2;state,1
  wf,6,7,2;state,1
  natorb,ci,print
  orbital,5202.2
 }
 {rhf,nitord=1,maxit=0
  start,5202.2
  wf,6,7,2
  occ,1,1,1,0,1,0,0,0
  open,1.3,1.5
 }
 
 scf(i)=energy
 
 _CC_NORM_MAX=2.0
  !NOTE: Perturbative MRCC works only with UHF reference. So, here we will trick MRCC by doing zero UHF iteration right after ROHF.
 
 {uhf
 maxit,0
 }
 scf(i)=energy
 
 {mrcc,method=CCSDT(Q)
 orbital,ignore_error=1                                                          !Ignore the fact that UHF WF is not converged
 maxit,100
 core
 }
 posthf(i)=energy
 
 table,scf,posthf,ekin,pot
 save,6.csv,new
 
 

 Variables initialized (889), CPU time= 0.00 sec
 Commands  initialized (702), CPU time= 0.01 sec, 572 directives.
 Default parameters read. Elapsed time= 0.23 sec

 Checking input...
 Passed
1


                                         ***  PROGRAM SYSTEM MOLPRO  ***
                                       Copyright, TTI GmbH Stuttgart, 2015
                                    Version 2015.1 linked Dec 29 2018 15:55:43


 **********************************************************************************************************************************
 LABEL *   Se                                                                            
  64 bit serial version                                                                  DATE: 25-Jun-19          TIME: 16:39:47  
 **********************************************************************************************************************************

 SHA1:             19cd028119e0e09f93f0674bd8af7968d9b3eff6
 **********************************************************************************************************************************

 THRESHOLDS:

 ZERO    =  1.00D-12  ONEINT  =  1.00D-12  TWOINT  =  1.00D-12  PREFAC  =  1.00D-14  LOCALI  =  1.00D-09  EORDER  =  1.00D-04
 ENERGY  =  0.00D+00  ETEST   =  0.00D+00  EDENS   =  0.00D+00  THRDEDEF=  1.00D-06  GRADIENT=  1.00D-02  STEP    =  1.00D-03
 ORBITAL =  1.00D-05  CIVEC   =  1.00D-05  COEFF   =  1.00D-04  PRINTCI =  5.00D-02  PUNCHCI =  9.90D+01  OPTGRAD =  3.00D-04
 OPTENERG=  1.00D-06  OPTSTEP =  3.00D-04  THRGRAD =  1.00D-10  COMPRESS=  1.00D-11  VARMIN  =  1.00D-07  VARMAX  =  1.00D-03
 THRDOUB =  0.00D+00  THRDIV  =  1.00D-05  THRRED  =  1.00D-07  THRPSP  =  1.00D+00  THRDC   =  1.00D-10  THRCS   =  1.00D-10
 THRNRM  =  1.00D-08  THREQ   =  0.00D+00  THRDE   =  1.00D+00  THRREF  =  1.00D-05  SPARFAC =  1.00D+00  THRDLP  =  1.00D-07
 THRDIA  =  1.00D-10  THRDLS  =  1.00D-07  THRGPS  =  0.00D+00  THRKEX  =  0.00D+00  THRDIS  =  2.00D-01  THRVAR  =  1.00D-10
 THRLOC  =  1.00D-06  THRGAP  =  1.00D-06  THRLOCT = -1.00D+00  THRGAPT = -1.00D+00  THRORB  =  1.00D-06  THRMLTP =  0.00D+00
 THRCPQCI=  1.00D-10  KEXTA   =  0.00D+00  THRCOARS=  0.00D+00  SYMTOL  =  1.00D-06  GRADTOL =  1.00D-06  THROVL  =  1.00D-08
 THRORTH =  1.00D-08  GRID    =  1.00D-06  GRIDMAX =  1.00D-03  DTMAX   =  0.00D+00  THROCCDE=  1.00D-01  THROCCDE=  1.00D-01



 ZUNIT=ANG
 

Geometry recognized as XYZ


 Variable memory set to 8000000000 words,  buffer space   230000 words

 SETTING BASIS          =    USERDEF


 Recomputing integrals since basis changed


 Using spherical harmonics



 PROGRAM * SEWARD (Integral evaluation for generally contracted gaussian basis sets)     Author: Roland Lindh, 1990

 Geometry written to block  1 of record 700

 Orientation using atomic masses  
 Molecule type: Atom
 Symmetry elements: X,Y,Z
 Rotational constants:       0.0000000      0.0000000      0.0000000 GHz  (calculated with average atomic masses)

 Point group  D2h 



 ATOMIC COORDINATES

 NR  ATOM    CHARGE       X              Y              Z

   1  SE      6.00    0.000000000    0.000000000    0.000000000


          SE  CORE POTENTIAL

          f POTENTIAL

 POWERS             1              3              2              2
 EXPONENTIALS   2.977052       7.016674       3.960663       5.028263    
 COEFFICIENTS   6.000000       17.86231      -20.00913       10.00574    

          s - f POTENTIAL

 POWERS             2              2
 EXPONENTIALS   4.175363       2.144911    
 COEFFICIENTS   71.37928      0.4261986    

          p - f POTENTIAL

 POWERS             2              2
 EXPONENTIALS   4.287722       2.095383    
 COEFFICIENTS   50.94829       5.542881    

          d - f POTENTIAL

 POWERS             2              2
 EXPONENTIALS   1.394037       1.696599    
 COEFFICIENTS   6.204697      0.5339570    


 BASIS DATA

   Nr Sym  Nuc  Type         Exponents   Contraction coefficients

    1.1 Ag    1  1s          53.235856    -0.000173
                             24.069480     0.001518
                             10.882513    -0.015384
                              4.920301     0.136816
                              2.224611    -0.394610
                              1.005811    -0.139559
                              0.454757     0.507331
                              0.205609     0.586875
                              0.092962     0.177170
    2.1 Ag    1  1s           2.202360     1.000000
    3.1 Ag    1  1s           1.018058     1.000000
    4.1 Ag    1  1s           0.470605     1.000000
    5.1 Ag    1  1s           0.217541     1.000000
    6.1 Ag    1  1s           0.100560     1.000000
    7.1 Ag    1  1s           0.040224     1.000000
    8.1 Ag    1  3d0          1.929490     1.000000
    9.1 Ag    1  3d2+         1.929490     1.000000
   10.1 Ag    1  3d0          1.001829     1.000000
   11.1 Ag    1  3d2+         1.001829     1.000000
   12.1 Ag    1  3d0          0.520169     1.000000
   13.1 Ag    1  3d2+         0.520169     1.000000
   14.1 Ag    1  3d0          0.270082     1.000000
   15.1 Ag    1  3d2+         0.270082     1.000000
   16.1 Ag    1  3d0          0.140232     1.000000
   17.1 Ag    1  3d2+         0.140232     1.000000
   18.1 Ag    1  3d0          0.056093     1.000000
   19.1 Ag    1  3d2+         0.056093     1.000000
   20.1 Ag    1  5g0          1.154200     1.000000
   21.1 Ag    1  5g4+         1.154200     1.000000
   22.1 Ag    1  5g2+         1.154200     1.000000
   23.1 Ag    1  5g0          0.611605     1.000000
   24.1 Ag    1  5g4+         0.611605     1.000000
   25.1 Ag    1  5g2+         0.611605     1.000000
   26.1 Ag    1  5g0          0.324087     1.000000
   27.1 Ag    1  5g4+         0.324087     1.000000
   28.1 Ag    1  5g2+         0.324087     1.000000
   29.1 Ag    1  5g0          0.129635     1.000000
   30.1 Ag    1  5g4+         0.129635     1.000000
   31.1 Ag    1  5g2+         0.129635     1.000000
   32.1 Ag    1  7i6+         0.890137     1.000000
   33.1 Ag    1  7i4+         0.890137     1.000000
   34.1 Ag    1  7i2+         0.890137     1.000000
   35.1 Ag    1  7i0          0.890137     1.000000
   36.1 Ag    1  7i6+         0.356055     1.000000
   37.1 Ag    1  7i4+         0.356055     1.000000
   38.1 Ag    1  7i2+         0.356055     1.000000
   39.1 Ag    1  7i0          0.356055     1.000000
    1.2 B3u   1  2px         25.056177    -0.000153
                             11.673683     0.000332
                              5.438773     0.014175
                              2.533927    -0.103893
                              1.180557    -0.008134
                              0.550022     0.284904
                              0.256256     0.427437
                              0.119390     0.334066
                              0.055624     0.112340
    2.2 B3u   1  2px          1.273912     1.000000
    3.2 B3u   1  2px          0.601933     1.000000
    4.2 B3u   1  2px          0.284418     1.000000
    5.2 B3u   1  2px          0.134389     1.000000
    6.2 B3u   1  2px          0.063500     1.000000
    7.2 B3u   1  2px          0.025400     1.000000
    8.2 B3u   1  4f1+         1.068366     1.000000
    9.2 B3u   1  4f3+         1.068366     1.000000
   10.2 B3u   1  4f1+         0.604969     1.000000
   11.2 B3u   1  4f3+         0.604969     1.000000
   12.2 B3u   1  4f1+         0.342568     1.000000
   13.2 B3u   1  4f3+         0.342568     1.000000
   14.2 B3u   1  4f1+         0.193981     1.000000
   15.2 B3u   1  4f3+         0.193981     1.000000
   16.2 B3u   1  4f1+         0.077592     1.000000
   17.2 B3u   1  4f3+         0.077592     1.000000
   18.2 B3u   1  6h1+         1.072389     1.000000
   19.2 B3u   1  6h3+         1.072389     1.000000
   20.2 B3u   1  6h5+         1.072389     1.000000
   21.2 B3u   1  6h1+         0.535944     1.000000
   22.2 B3u   1  6h3+         0.535944     1.000000
   23.2 B3u   1  6h5+         0.535944     1.000000
   24.2 B3u   1  6h1+         0.214378     1.000000
   25.2 B3u   1  6h3+         0.214378     1.000000
   26.2 B3u   1  6h5+         0.214378     1.000000
    1.3 B2u   1  2py         25.056177    -0.000153
                             11.673683     0.000332
                              5.438773     0.014175
                              2.533927    -0.103893
                              1.180557    -0.008134
                              0.550022     0.284904
                              0.256256     0.427437
                              0.119390     0.334066
                              0.055624     0.112340
    2.3 B2u   1  2py          1.273912     1.000000
    3.3 B2u   1  2py          0.601933     1.000000
    4.3 B2u   1  2py          0.284418     1.000000
    5.3 B2u   1  2py          0.134389     1.000000
    6.3 B2u   1  2py          0.063500     1.000000
    7.3 B2u   1  2py          0.025400     1.000000
    8.3 B2u   1  4f1-         1.068366     1.000000
    9.3 B2u   1  4f3-         1.068366     1.000000
   10.3 B2u   1  4f1-         0.604969     1.000000
   11.3 B2u   1  4f3-         0.604969     1.000000
   12.3 B2u   1  4f1-         0.342568     1.000000
   13.3 B2u   1  4f3-         0.342568     1.000000
   14.3 B2u   1  4f1-         0.193981     1.000000
   15.3 B2u   1  4f3-         0.193981     1.000000
   16.3 B2u   1  4f1-         0.077592     1.000000
   17.3 B2u   1  4f3-         0.077592     1.000000
   18.3 B2u   1  6h1-         1.072389     1.000000
   19.3 B2u   1  6h3-         1.072389     1.000000
   20.3 B2u   1  6h5-         1.072389     1.000000
   21.3 B2u   1  6h1-         0.535944     1.000000
   22.3 B2u   1  6h3-         0.535944     1.000000
   23.3 B2u   1  6h5-         0.535944     1.000000
   24.3 B2u   1  6h1-         0.214378     1.000000
   25.3 B2u   1  6h3-         0.214378     1.000000
   26.3 B2u   1  6h5-         0.214378     1.000000
    1.4 B1g   1  3d2-         1.929490     1.000000
    2.4 B1g   1  3d2-         1.001829     1.000000
    3.4 B1g   1  3d2-         0.520169     1.000000
    4.4 B1g   1  3d2-         0.270082     1.000000
    5.4 B1g   1  3d2-         0.140232     1.000000
    6.4 B1g   1  3d2-         0.056093     1.000000
    7.4 B1g   1  5g2-         1.154200     1.000000
    8.4 B1g   1  5g4-         1.154200     1.000000
    9.4 B1g   1  5g2-         0.611605     1.000000
   10.4 B1g   1  5g4-         0.611605     1.000000
   11.4 B1g   1  5g2-         0.324087     1.000000
   12.4 B1g   1  5g4-         0.324087     1.000000
   13.4 B1g   1  5g2-         0.129635     1.000000
   14.4 B1g   1  5g4-         0.129635     1.000000
   15.4 B1g   1  7i2-         0.890137     1.000000
   16.4 B1g   1  7i6-         0.890137     1.000000
   17.4 B1g   1  7i4-         0.890137     1.000000
   18.4 B1g   1  7i2-         0.356055     1.000000
   19.4 B1g   1  7i6-         0.356055     1.000000
   20.4 B1g   1  7i4-         0.356055     1.000000
    1.5 B1u   1  2pz         25.056177    -0.000153
                             11.673683     0.000332
                              5.438773     0.014175
                              2.533927    -0.103893
                              1.180557    -0.008134
                              0.550022     0.284904
                              0.256256     0.427437
                              0.119390     0.334066
                              0.055624     0.112340
    2.5 B1u   1  2pz          1.273912     1.000000
    3.5 B1u   1  2pz          0.601933     1.000000
    4.5 B1u   1  2pz          0.284418     1.000000
    5.5 B1u   1  2pz          0.134389     1.000000
    6.5 B1u   1  2pz          0.063500     1.000000
    7.5 B1u   1  2pz          0.025400     1.000000
    8.5 B1u   1  4f0          1.068366     1.000000
    9.5 B1u   1  4f2+         1.068366     1.000000
   10.5 B1u   1  4f0          0.604969     1.000000
   11.5 B1u   1  4f2+         0.604969     1.000000
   12.5 B1u   1  4f0          0.342568     1.000000
   13.5 B1u   1  4f2+         0.342568     1.000000
   14.5 B1u   1  4f0          0.193981     1.000000
   15.5 B1u   1  4f2+         0.193981     1.000000
   16.5 B1u   1  4f0          0.077592     1.000000
   17.5 B1u   1  4f2+         0.077592     1.000000
   18.5 B1u   1  6h2+         1.072389     1.000000
   19.5 B1u   1  6h4+         1.072389     1.000000
   20.5 B1u   1  6h0          1.072389     1.000000
   21.5 B1u   1  6h2+         0.535944     1.000000
   22.5 B1u   1  6h4+         0.535944     1.000000
   23.5 B1u   1  6h0          0.535944     1.000000
   24.5 B1u   1  6h2+         0.214378     1.000000
   25.5 B1u   1  6h4+         0.214378     1.000000
   26.5 B1u   1  6h0          0.214378     1.000000
    1.6 B2g   1  3d1+         1.929490     1.000000
    2.6 B2g   1  3d1+         1.001829     1.000000
    3.6 B2g   1  3d1+         0.520169     1.000000
    4.6 B2g   1  3d1+         0.270082     1.000000
    5.6 B2g   1  3d1+         0.140232     1.000000
    6.6 B2g   1  3d1+         0.056093     1.000000
    7.6 B2g   1  5g1+         1.154200     1.000000
    8.6 B2g   1  5g3+         1.154200     1.000000
    9.6 B2g   1  5g1+         0.611605     1.000000
   10.6 B2g   1  5g3+         0.611605     1.000000
   11.6 B2g   1  5g1+         0.324087     1.000000
   12.6 B2g   1  5g3+         0.324087     1.000000
   13.6 B2g   1  5g1+         0.129635     1.000000
   14.6 B2g   1  5g3+         0.129635     1.000000
   15.6 B2g   1  7i5+         0.890137     1.000000
   16.6 B2g   1  7i3+         0.890137     1.000000
   17.6 B2g   1  7i1+         0.890137     1.000000
   18.6 B2g   1  7i5+         0.356055     1.000000
   19.6 B2g   1  7i3+         0.356055     1.000000
   20.6 B2g   1  7i1+         0.356055     1.000000
    1.7 B3g   1  3d1-         1.929490     1.000000
    2.7 B3g   1  3d1-         1.001829     1.000000
    3.7 B3g   1  3d1-         0.520169     1.000000
    4.7 B3g   1  3d1-         0.270082     1.000000
    5.7 B3g   1  3d1-         0.140232     1.000000
    6.7 B3g   1  3d1-         0.056093     1.000000
    7.7 B3g   1  5g1-         1.154200     1.000000
    8.7 B3g   1  5g3-         1.154200     1.000000
    9.7 B3g   1  5g1-         0.611605     1.000000
   10.7 B3g   1  5g3-         0.611605     1.000000
   11.7 B3g   1  5g1-         0.324087     1.000000
   12.7 B3g   1  5g3-         0.324087     1.000000
   13.7 B3g   1  5g1-         0.129635     1.000000
   14.7 B3g   1  5g3-         0.129635     1.000000
   15.7 B3g   1  7i5-         0.890137     1.000000
   16.7 B3g   1  7i3-         0.890137     1.000000
   17.7 B3g   1  7i1-         0.890137     1.000000
   18.7 B3g   1  7i5-         0.356055     1.000000
   19.7 B3g   1  7i3-         0.356055     1.000000
   20.7 B3g   1  7i1-         0.356055     1.000000
    1.8 Au    1  4f2-         1.068366     1.000000
    2.8 Au    1  4f2-         0.604969     1.000000
    3.8 Au    1  4f2-         0.342568     1.000000
    4.8 Au    1  4f2-         0.193981     1.000000
    5.8 Au    1  4f2-         0.077592     1.000000
    6.8 Au    1  6h4-         1.072389     1.000000
    7.8 Au    1  6h2-         1.072389     1.000000
    8.8 Au    1  6h4-         0.535944     1.000000
    9.8 Au    1  6h2-         0.535944     1.000000
   10.8 Au    1  6h4-         0.214378     1.000000
   11.8 Au    1  6h2-         0.214378     1.000000

 NUCLEAR CHARGE:                    6
 NUMBER OF PRIMITIVE AOS:         325
 NUMBER OF SYMMETRY AOS:          220
 NUMBER OF CONTRACTIONS:          188   (  39Ag  +  26B3u +  26B2u +  20B1g +  26B1u +  20B2g +  20B3g +  11Au  )
 NUMBER OF CORE ORBITALS:           0   (   0Ag  +   0B3u +   0B2u +   0B1g +   0B1u +   0B2g +   0B3g +   0Au  )
 NUMBER OF VALENCE ORBITALS:        4   (   1Ag  +   1B3u +   1B2u +   0B1g +   1B1u +   0B2g +   0B3g +   0Au  )


 NUCLEAR REPULSION ENERGY    0.00000000

 EXTRA SYMMETRY OF AOS IN SYMMETRY 1:   1 1 1 1 1 1 1 2 3 2   3 2 3 2 3 2 3 2 3 4   5 6 4 5 6 4 5 6 4 5   6 7 8 910 7 8 910
 EXTRA SYMMETRY OF AOS IN SYMMETRY 2:   1 1 1 1 1 1 1 2 3 2   3 2 3 2 3 2 3 4 5 6   4 5 6 4 5 6
 EXTRA SYMMETRY OF AOS IN SYMMETRY 3:   1 1 1 1 1 1 1 2 3 2   3 2 3 2 3 2 3 4 5 6   4 5 6 4 5 6
 EXTRA SYMMETRY OF AOS IN SYMMETRY 4:   1 1 1 1 1 1 2 3 2 3   2 3 2 3 4 5 6 4 5 6
 EXTRA SYMMETRY OF AOS IN SYMMETRY 5:   1 1 1 1 1 1 1 2 3 2   3 2 3 2 3 2 3 4 5 6   4 5 6 4 5 6
 EXTRA SYMMETRY OF AOS IN SYMMETRY 6:   1 1 1 1 1 1 2 3 2 3   2 3 2 3 4 5 6 4 5 6
 EXTRA SYMMETRY OF AOS IN SYMMETRY 7:   1 1 1 1 1 1 2 3 2 3   2 3 2 3 4 5 6 4 5 6
 EXTRA SYMMETRY OF AOS IN SYMMETRY 8:   1 1 1 1 1 2 3 2 3 2   3

 Eigenvalues of metric

         1 0.343E-03 0.242E-02 0.704E-02 0.704E-02 0.183E-01 0.490E-01 0.490E-01 0.610E-01
         2 0.345E-03 0.670E-02 0.112E-01 0.112E-01 0.413E-01 0.108E+00 0.108E+00 0.187E+00
         3 0.345E-03 0.670E-02 0.112E-01 0.112E-01 0.413E-01 0.108E+00 0.108E+00 0.187E+00
         4 0.704E-02 0.490E-01 0.610E-01 0.610E-01 0.225E+00 0.398E+00 0.398E+00 0.533E+00
         5 0.345E-03 0.670E-02 0.112E-01 0.112E-01 0.413E-01 0.108E+00 0.108E+00 0.187E+00
         6 0.704E-02 0.490E-01 0.610E-01 0.610E-01 0.225E+00 0.398E+00 0.398E+00 0.533E+00
         7 0.704E-02 0.490E-01 0.610E-01 0.610E-01 0.225E+00 0.398E+00 0.398E+00 0.533E+00
         8 0.112E-01 0.108E+00 0.212E+00 0.212E+00 0.509E+00 0.858E+00 0.858E+00 0.132E+01


 Contracted 2-electron integrals neglected if value below      1.0D-12
 AO integral compression algorithm  1   Integral accuracy      1.0D-12

     119.800 MB (compressed) written to integral file ( 47.3%)


 NUMBER OF SORTED TWO-ELECTRON INTEGRALS:   20212815.     BUFFER LENGTH:  32768
 NUMBER OF SEGMENTS:   2  SEGMENT LENGTH:   15998787      RECORD LENGTH: 524288

 Memory used in sort:      16.56 MW

 SORT1 READ    31710950. AND WROTE    13213985. INTEGRALS IN     39 RECORDS. CPU TIME:     0.96 SEC, REAL TIME:     1.31 SEC
 SORT2 READ    13213985. AND WROTE    20212815. INTEGRALS IN    457 RECORDS. CPU TIME:     0.69 SEC, REAL TIME:     1.08 SEC

 FILE SIZES:   FILE 1:   140.5 MBYTE,  FILE 4:   163.6 MBYTE,   TOTAL:    304.1 MBYTE

 OPERATOR DM      FOR CENTER  0  COORDINATES:    0.000000    0.000000    0.000000
 OPERATOR EKIN    FOR CENTER  0  COORDINATES:    0.000000    0.000000    0.000000
 OPERATOR POT     FOR CENTER  0  COORDINATES:    0.000000    0.000000    0.000000


 **********************************************************************************************************************************
 DATASETS  * FILE   NREC   LENGTH (MB)   RECORD NAMES
              1      20       98.02       500      610      700      900      950      970     1000      129      960     1100   
                                          VAR    BASINP    GEOM    SYMINP    ZMAT    AOBASIS   BASIS     P2S    ABASIS      S 
                                         1400     1410     1420     1200     1210     1080     1600     1650     1300     1700   
                                         EKIN       V       ECP      H0       H01     AOSYM     SMH    MOLCAS    ERIS     OPER   

 PROGRAMS   *        TOTAL       INT
 CPU TIMES  *         8.31      8.21
 REAL TIME  *        21.52 SEC
 DISK USED  *       304.45 MB      
 **********************************************************************************************************************************


 PROGRAM * RHF-SCF (OPEN SHELL)       Authors: W. Meyer, H.-J. Werner


 NUMBER OF ELECTRONS:       4+    2-    SPACE SYMMETRY=7    SPIN SYMMETRY: Triplet 
 CONVERGENCE THRESHOLDS:    1.00E-05 (Density)    1.00E-07 (Energy)
 MAX. NUMBER OF ITERATIONS:       60
 INTERPOLATION TYPE:            DIIS
 INTERPOLATION STEPS:              2 (START)      1 (STEP)
 LEVEL SHIFTS:                 -0.60 (CLOSED) -0.30 (OPEN) 


 Singly occupied orbitals:      1.3       1.5

   Atom=SE basis=ECP28MDF_GUESS    lmin=0  lmax=1

 Orbital guess generated from atomic densities. Full valence occupancy:    1   1   1   0   1   0   0   0


 Molecular orbital dump at record        4202.2

 ITERATION    DDIFF          GRAD             ENERGY        2-EL.EN.            DIPOLE MOMENTS         DIIS   ORB.
    1      0.000D+00      0.000D+00        -9.14222577     11.374922    0.00000    0.00000    0.00000    0    start
    2      0.000D+00      0.444D-02        -9.14863908     11.538349    0.00000    0.00000    0.00000    1    diag,B
    3      0.374D-02      0.152D-02        -9.14988499     11.611478    0.00000    0.00000    0.00000    2    diag,B
    4      0.129D-02      0.528D-03        -9.15004611     11.630310    0.00000    0.00000    0.00000    3    diag,B
    5      0.720D-03      0.117D-03        -9.15005295     11.631891    0.00000    0.00000    0.00000    4    diag,B
    6      0.174D-03      0.324D-04        -9.15005346     11.632249    0.00000    0.00000    0.00000    5    diag,B
    7      0.683D-04      0.107D-04        -9.15005352     11.632289    0.00000    0.00000    0.00000    6    fixocc
    8      0.246D-04      0.407D-05        -9.15005353     11.632350    0.00000    0.00000    0.00000    7    diag,B
    9      0.142D-04      0.990D-06        -9.15005353     11.632363    0.00000    0.00000    0.00000    8    diag,B
   10      0.151D-05      0.409D-06        -9.15005353     11.632366    0.00000    0.00000    0.00000    0    orth

 Final alpha occupancy:   1   1   1   0   1   0   0   0
 Final beta  occupancy:   1   1   0   0   0   0   0   0

 !RHF STATE 1.7 Energy                 -9.150053533365
 Nuclear energy                         0.00000000
 One-electron energy                  -14.96623643
 Two-electron energy                    5.81618289
 Virial quotient                       -2.78854723
 !RHF STATE 1.7 Dipole moment           0.00000000     0.00000000     0.00000000
 Dipole moment /Debye                   0.00000000     0.00000000     0.00000000
 

 !RHF expec          <1.7|EKIN|1.7>     3.281297672484
 
 !RHF expec           <1.7|POT|1.7>    -3.240790398808

 ELECTRON ORBITALS
 =================


   Orb  Occ    Energy  Couls-En    Coefficients

                                   1 1s      1 1s      1 1s      1 1s      1 1s      1 1s      1 1s      1 3d0     1 3d2+    1 3d0  
                                   1 3d2+    1 3d0     1 3d2+    1 3d0     1 3d2+    1 3d0     1 3d2+    1 3d0     1 3d2+    1 5g0  
                                   1 5g4+    1 5g2+    1 5g0     1 5g4+    1 5g2+    1 5g0     1 5g4+    1 5g2+    1 5g0     1 5g4+ 
                                   1 5g2+    1 7i6+    1 7i4+    1 7i2+    1 7i0     1 7i6+    1 7i4+    1 7i2+    1 7i0  

   1.1   2    -0.8548   -3.7395  1.000527 -0.000099  0.000980 -0.002256  0.003002 -0.003575  0.001742 -0.000080  0.000139 -0.000087
                                 0.000151  0.000407 -0.000704 -0.000764  0.001324 -0.002479  0.004294 -0.000572  0.000990  0.000000
                                 0.000000 -0.000000  0.000005  0.000010 -0.000008 -0.000008 -0.000015  0.000011 -0.000011 -0.000022
                                 0.000017 -0.000001  0.000000 -0.000000  0.000000 -0.000001  0.000001 -0.000001  0.000000

                                   1 2px     1 2px     1 2px     1 2px     1 2px     1 2px     1 2px     1 4f1+    1 4f3+    1 4f1+ 
                                   1 4f3+    1 4f1+    1 4f3+    1 4f1+    1 4f3+    1 4f1+    1 4f3+    1 6h1+    1 6h3+    1 6h5+ 
                                   1 6h1+    1 6h3+    1 6h5+    1 6h1+    1 6h3+    1 6h5+ 

   1.2   2    -0.3663   -2.6495  0.996097 -0.001292  0.003263 -0.001894  0.007755 -0.007001  0.003879  0.000507 -0.000654  0.001803
                                -0.002328  0.002387 -0.003082  0.002825 -0.003647  0.000978 -0.001263  0.000004 -0.000004  0.000005
                                 0.000024 -0.000026  0.000035  0.000026 -0.000028  0.000038

                                   1 2py     1 2py     1 2py     1 2py     1 2py     1 2py     1 2py     1 4f1-    1 4f3-    1 4f1- 
                                   1 4f3-    1 4f1-    1 4f3-    1 4f1-    1 4f3-    1 4f1-    1 4f3-    1 6h1-    1 6h3-    1 6h5- 
                                   1 6h1-    1 6h3-    1 6h5-    1 6h1-    1 6h3-    1 6h5- 

   1.3   +    -0.4458   -2.7611  1.009308 -0.007065  0.009668  0.029254 -0.003204 -0.053970 -0.002014  0.000391 -0.001513  0.001431
                                -0.005541  0.001872 -0.007249  0.001846 -0.007150  0.000474 -0.001836  0.000005 -0.000016  0.000036
                                 0.000025 -0.000083  0.000185  0.000021 -0.000068  0.000151

                                   1 2pz     1 2pz     1 2pz     1 2pz     1 2pz     1 2pz     1 2pz     1 4f0     1 4f2+    1 4f0  
                                   1 4f2+    1 4f0     1 4f2+    1 4f0     1 4f2+    1 4f0     1 4f2+    1 6h2+    1 6h4+    1 6h0  
                                   1 6h2+    1 6h4+    1 6h0     1 6h2+    1 6h4+    1 6h0  

   1.5   +    -0.4458   -2.7611  1.009308 -0.007065  0.009668  0.029254 -0.003204 -0.053970 -0.002014  0.000957 -0.001235  0.003504
                                -0.004524  0.004585 -0.005919  0.004522 -0.005838  0.001161 -0.001499 -0.000027  0.000023  0.000019
                                -0.000135  0.000117  0.000099 -0.000110  0.000095  0.000081

 HOMO      1.2    -0.366284 =      -9.9671eV
 LUMO      2.3     0.058142 =       1.5821eV
 LUMO-HOMO         0.424426 =      11.5492eV


 **********************************************************************************************************************************
 DATASETS  * FILE   NREC   LENGTH (MB)   RECORD NAMES
              1      20       98.02       500      610      700      900      950      970     1000      129      960     1100   
                                          VAR    BASINP    GEOM    SYMINP    ZMAT    AOBASIS   BASIS     P2S    ABASIS      S 
                                         1400     1410     1420     1200     1210     1080     1600     1650     1300     1700   
                                         EKIN       V       ECP      H0       H01     AOSYM     SMH    MOLCAS    ERIS     OPER   

              2       4        2.92       700     1000      520     4202   
                                         GEOM     BASIS   MCVARS     RHF  

 PROGRAMS   *        TOTAL       RHF       INT
 CPU TIMES  *         9.09      0.78      8.21
 REAL TIME  *        22.61 SEC
 DISK USED  *       304.45 MB      
 **********************************************************************************************************************************


 PROGRAM * MULTI (Direct Multiconfiguration SCF)       Authors: P.J. Knowles, H.-J. Werner (1984)     S.T. Elbert (1988)


 Number of closed-shell orbitals:   1 (   1   0   0   0   0   0   0   0 )
 Number of active  orbitals:        3 (   0   1   1   0   1   0   0   0 )
 Number of external orbitals:     184 (  38  25  25  20  25  20  20  11 )

 State symmetry 1

 Number of electrons:     4    Spin symmetry=Triplet   Space symmetry=4
 Number of states:        1
 Number of CSFs:          1   (1 determinants, 3 intermediate states)

 State symmetry 2

 Number of electrons:     4    Spin symmetry=Triplet   Space symmetry=6
 Number of states:        1
 Number of CSFs:          1   (1 determinants, 3 intermediate states)

 State symmetry 3

 Number of electrons:     4    Spin symmetry=Triplet   Space symmetry=7
 Number of states:        1
 Number of CSFs:          1   (1 determinants, 3 intermediate states)

 Iteration controls:
             1  2  3  4  5  6  7  8  9 10 11 12 13 14 15 16 17 18 19 20 21 22 23 24 25 26 27 28 29 30 31 32 33 34 35 36 37 38 39
 DIAGCI      T  T  T  T  T  T  T  T  T  T  T  T  T  T  T  T  T  T  T  T  T  T  T  T  T  T  T  T  T  T  T  T  T  T  T  T  T  T  T
 WERNER      T  T  T  T  T  T  T  T  T  T  T  T  T  T  T  T  T  T  T  T  T  T  T  T  T  T  T  T  T  T  T  T  T  T  T  T  T  T  T
 INTERNAL    F  T  T  T  T  T  T  T  T  T  T  T  T  T  T  T  T  T  T  T  T  T  T  T  T  T  T  T  T  T  T  T  T  T  T  T  T  T  T

 Molecular orbitals read from record     4202.2  Type=RHF/CANONICAL (state 1.7)
 *** IN SYMMETRY 1 ORBITAL  1 SYMMETRY CONTAMINATION OF 0.118D-01 HAS BEEN REMOVED

 EXTRA SYMMETRY OF MOS IN SYMMETRY 1:   1 1 2 3 2 1 1 4 5 6   2 3 1 4 5 6 2 3 9 8   710 4 5 6 1 2 3 9 8   710 4 5 6 2 3 1 3
 *** IN SYMMETRY 2 ORBITAL  1 SYMMETRY CONTAMINATION OF 0.189D-01 HAS BEEN REMOVED
 EXTRA SYMMETRY OF MOS IN SYMMETRY 2:   1 1 1 2 3 1 2 3 5 6   4 2 3 1 2 3 5 6 4 1   2 3 5 6 4 1
 *** IN SYMMETRY 3 ORBITAL  1 SYMMETRY CONTAMINATION OF 0.261D-01 HAS BEEN REMOVED
 EXTRA SYMMETRY OF MOS IN SYMMETRY 3:   1 1 1 2 3 1 2 3 4 5   6 2 3 1 2 3 4 5 6 1   2 3 4 5 6 1
 EXTRA SYMMETRY OF MOS IN SYMMETRY 4:   1 1 2 3 1 2 3 1 4 6   5 2 3 1 4 6 5 2 3 1
 *** IN SYMMETRY 5 ORBITAL  1 SYMMETRY CONTAMINATION OF 0.300D-01 HAS BEEN REMOVED
 EXTRA SYMMETRY OF MOS IN SYMMETRY 5:   1 1 1 2 3 1 2 3 6 5   4 2 3 1 2 3 6 5 4 1   2 3 6 5 4 1
 EXTRA SYMMETRY OF MOS IN SYMMETRY 6:   1 1 3 2 1 3 2 1 5 4   6 3 2 1 5 4 6 3 2 1
 EXTRA SYMMETRY OF MOS IN SYMMETRY 7:   1 1 2 3 1 2 3 1 6 5   4 2 3 1 6 5 4 2 3 1
 EXTRA SYMMETRY OF MOS IN SYMMETRY 8:   1 1 3 2 1 1 3 2 1 3   2

 Wavefunction dump at record             5202.2

 Convergence thresholds  0.10E-01 (gradient)  0.10E-05 (energy)  0.10E-02 (step length)

 Weight factors for state symmetry  1:    0.33333
 Weight factors for state symmetry  2:    0.33333
 Weight factors for state symmetry  3:    0.33333

 Number of orbital rotations:      113   (     0 Core/Active     38 Core/Virtual   0 Active/Active     75 Active/Virtual)
 Total number of variables:        116


 ITER. MIC  NCI  NEG     ENERGY(VAR)     ENERGY(PROJ)   ENERGY CHANGE     GRAD(0)  GRAD(ORB)   GRAD(CI)     STEP       TIME

   1   23   12    0      -9.14663731      -9.14763337   -0.00099606    0.02784411 0.00000000 0.00000000  0.41D-01      0.18
   2   13   12    0      -9.14763617      -9.14763620   -0.00000003    0.00015903 0.00000000 0.00000000  0.19D-03      0.33
   3   16   12    0      -9.14763620      -9.14763620   -0.00000000    0.00000001 0.00000000 0.00000000  0.61D-08      0.51

 ** WVFN ****  CONVERGENCE REACHED, FINAL GRADIENT:  0.82D-13



 Results for state 1.4
 =====================

 !MCSCF STATE 1.4 Energy               -9.147636200337
 Nuclear energy                         0.00000000
 Kinetic energy                         3.27922877
 One electron energy                  -14.96942268
 Two electron energy                    5.82178648
 Virial ratio                           3.78956939

 !MCSCF STATE 1.4 Dipole moment         0.00000000     0.00000000     0.00000000
 Dipole moment /Debye                   0.00000000     0.00000000     0.00000000



 Results for state 1.6
 =====================

 !MCSCF STATE 1.6 Energy               -9.147636200337
 Nuclear energy                         0.00000000
 Kinetic energy                         3.27922877
 One electron energy                  -14.96942268
 Two electron energy                    5.82178648
 Virial ratio                           3.78956939

 !MCSCF STATE 1.6 Dipole moment         0.00000000     0.00000000     0.00000000
 Dipole moment /Debye                   0.00000000     0.00000000     0.00000000



 Results for state 1.7
 =====================

 !MCSCF STATE 1.7 Energy               -9.147636200337
 Nuclear energy                         0.00000000
 Kinetic energy                         3.27922877
 One electron energy                  -14.96942268
 Two electron energy                    5.82178648
 Virial ratio                           3.78956939

 !MCSCF STATE 1.7 Dipole moment         0.00000000     0.00000000     0.00000000
 Dipole moment /Debye                   0.00000000     0.00000000     0.00000000

 State-averaged charge density matrix saved on record  5202.2 (density set 1)

 !MCSCF expec        <1.4|EKIN|1.4>     3.279228768146
 !MCSCF expec        <1.6|EKIN|1.6>     3.279228768146
 !MCSCF expec        <1.7|EKIN|1.7>     3.279228768146

 !MCSCF expec         <1.4|POT|1.4>    -3.240968845989
 !MCSCF expec         <1.6|POT|1.6>    -3.240968845989
 !MCSCF expec         <1.7|POT|1.7>    -3.240968845989


 NATURAL ORBITALS (state averaged)
 =================================

   Orb     Occ        Energy       Coefficients

                                   1 1s      1 1s      1 1s      1 1s      1 1s      1 1s      1 1s      1 3d0     1 3d2+    1 3d0  
                                   1 3d2+    1 3d0     1 3d2+    1 3d0     1 3d2+    1 3d0     1 3d2+    1 3d0     1 3d2+    1 5g0  
                                   1 5g4+    1 5g2+    1 5g0     1 5g4+    1 5g2+    1 5g0     1 5g4+    1 5g2+    1 5g0     1 5g4+ 
                                   1 5g2+    1 7i6+    1 7i4+    1 7i2+    1 7i0     1 7i6+    1 7i4+    1 7i2+    1 7i0  

   1.1  2.00000    -0.854621     1.000496 -0.000108  0.001062 -0.002364  0.002794 -0.003184  0.001662  0.000000  0.000000  0.000000
                                 0.000000  0.000000  0.000000  0.000000  0.000000  0.000000  0.000000  0.000000  0.000000  0.000000
                                 0.000000  0.000000  0.000000  0.000000  0.000000  0.000000  0.000000  0.000000  0.000000  0.000000
                                 0.000000  0.000000  0.000000  0.000000  0.000000  0.000000  0.000000  0.000000  0.000000

                                   1 2px     1 2px     1 2px     1 2px     1 2px     1 2px     1 2px     1 4f1+    1 4f3+    1 4f1+ 
                                   1 4f3+    1 4f1+    1 4f3+    1 4f1+    1 4f3+    1 4f1+    1 4f3+    1 6h1+    1 6h3+    1 6h5+ 
                                   1 6h1+    1 6h3+    1 6h5+    1 6h1+    1 6h3+    1 6h5+ 

   1.2  1.33333    -0.265069     1.003492 -0.003956  0.006179  0.012461  0.004069 -0.031183  0.000279  0.000000  0.000000  0.000000
                                 0.000000  0.000000  0.000000  0.000000  0.000000  0.000000  0.000000  0.000000  0.000000  0.000000
                                 0.000000  0.000000  0.000000  0.000000  0.000000  0.000000

                                   1 2py     1 2py     1 2py     1 2py     1 2py     1 2py     1 2py     1 4f1-    1 4f3-    1 4f1- 
                                   1 4f3-    1 4f1-    1 4f3-    1 4f1-    1 4f3-    1 4f1-    1 4f3-    1 6h1-    1 6h3-    1 6h5- 
                                   1 6h1-    1 6h3-    1 6h5-    1 6h1-    1 6h3-    1 6h5- 

   1.3  1.33333    -0.265069     1.003492 -0.003956  0.006179  0.012461  0.004069 -0.031183  0.000279  0.000000  0.000000  0.000000
                                 0.000000  0.000000  0.000000  0.000000  0.000000  0.000000  0.000000  0.000000  0.000000  0.000000
                                 0.000000  0.000000  0.000000  0.000000  0.000000  0.000000

                                   1 2pz     1 2pz     1 2pz     1 2pz     1 2pz     1 2pz     1 2pz     1 4f0     1 4f2+    1 4f0  
                                   1 4f2+    1 4f0     1 4f2+    1 4f0     1 4f2+    1 4f0     1 4f2+    1 6h2+    1 6h4+    1 6h0  
                                   1 6h2+    1 6h4+    1 6h0     1 6h2+    1 6h4+    1 6h0  

   1.5  1.33333    -0.265069     1.003492 -0.003956  0.006179  0.012461  0.004069 -0.031183  0.000279  0.000000  0.000000  0.000000
                                 0.000000  0.000000  0.000000  0.000000  0.000000  0.000000  0.000000  0.000000  0.000000  0.000000
                                 0.000000  0.000000  0.000000  0.000000  0.000000  0.000000
 

 EXTRA SYMMETRY OF MOS IN SYMMETRY 1:   1 1 3 2 1 3 2 5 6 4   2 3 1 5 6 4 2 3 8 9   710 6 4 5 1 2 3 8 9  10 7 6 4 5 2 3 1 1
 EXTRA SYMMETRY OF MOS IN SYMMETRY 2:   1 1 1 3 2 1 3 2 4 6   5 3 2 1 3 2 5 6 4 1   3 2 5 6 4 1
 EXTRA SYMMETRY OF MOS IN SYMMETRY 3:   1 1 1 3 2 1 3 2 4 6   5 3 2 1 3 2 5 6 4 1   3 2 5 6 4 1
 EXTRA SYMMETRY OF MOS IN SYMMETRY 4:   1 1 3 2 1 3 2 1 6 4   5 2 3 1 6 4 5 2 3 1
 EXTRA SYMMETRY OF MOS IN SYMMETRY 5:   1 1 1 3 2 1 3 2 5 4   6 3 2 1 3 2 5 4 6 1   3 2 4 5 6 1
 EXTRA SYMMETRY OF MOS IN SYMMETRY 6:   1 1 3 2 1 3 2 1 6 4   5 3 2 1 6 4 5 3 2 1
 EXTRA SYMMETRY OF MOS IN SYMMETRY 7:   1 1 3 2 1 3 2 1 6 4   5 3 2 1 6 4 5 3 2 1
 EXTRA SYMMETRY OF MOS IN SYMMETRY 8:   1 1 2 3 1 1 2 3 1 3   2

 Natural orbital dump (state averaged) at molpro section  5202.2    (Orbital set 2)


 CI vector for state symmetry 1
 ==============================

 a a 2           1.0000000

 TOTAL ENERGIES                        -9.14763620

 CI vector for state symmetry 2
 ==============================

 a 2 a           1.0000000

 TOTAL ENERGIES                        -9.14763620

 CI vector for state symmetry 3
 ==============================

 2 a a           1.0000000

 TOTAL ENERGIES                        -9.14763620



 **********************************************************************************************************************************
 DATASETS  * FILE   NREC   LENGTH (MB)   RECORD NAMES
              1      21       98.66       500      610      700      900      950      970     1000      129      960     1100   
                                          VAR    BASINP    GEOM    SYMINP    ZMAT    AOBASIS   BASIS     P2S    ABASIS      S 
                                         1400     1410     1420     1200     1210     1080     1600     1650     1300     1700   
                                         EKIN       V       ECP      H0       H01     AOSYM     SMH    MOLCAS    ERIS     OPER   
                                         1380   
                                         JKOP   

              2       5        5.60       700     1000      520     4202     5202   
                                         GEOM     BASIS   MCVARS     RHF     MCSCF   

 PROGRAMS   *        TOTAL     MULTI       RHF       INT
 CPU TIMES  *         9.78      0.69      0.78      8.21
 REAL TIME  *        24.81 SEC
 DISK USED  *       304.45 MB      
 **********************************************************************************************************************************


 PROGRAM * RHF-SCF (OPEN SHELL)       Authors: W. Meyer, H.-J. Werner


 NUMBER OF ELECTRONS:       4+    2-    SPACE SYMMETRY=7    SPIN SYMMETRY: Triplet 
 CONVERGENCE THRESHOLDS:    1.00E-05 (Density)    1.00E-07 (Energy)
 MAX. NUMBER OF ITERATIONS:        0
 INTERPOLATION TYPE:            DIIS
 INTERPOLATION STEPS:              2 (START)      1 (STEP)
 LEVEL SHIFTS:                 -0.60 (CLOSED) -0.30 (OPEN) 


 Singly occupied orbitals:      1.3       1.5
 Molecular orbitals read from record     5202.2  Type=MCSCF/NATURAL (state averaged)

 Molecular orbital dump at record        2101.2

 ITERATION    DDIFF          GRAD             ENERGY        2-EL.EN.            DIPOLE MOMENTS         DIIS   ORB.
    1      0.000D+00      0.000D+00        -9.14763620     11.643573    0.00000    0.00000    0.00000    0    start

 Final alpha occupancy:   1   1   1   0   1   0   0   0
 Final beta  occupancy:   1   1   0   0   0   0   0   0

 !RHF STATE 1.7 Energy                 -9.147636200337
 Nuclear energy                         0.00000000
 One-electron energy                  -14.96942268
 Two-electron energy                    5.82178648
 Virial quotient                       -2.78956939
 !RHF STATE 1.7 Dipole moment           0.00000000     0.00000000     0.00000000
 Dipole moment /Debye                   0.00000000     0.00000000     0.00000000
 

 !RHF expec          <1.7|EKIN|1.7>     3.279228768146
 
 !RHF expec           <1.7|POT|1.7>    -3.240968845989

 ELECTRON ORBITALS
 =================


   Orb  Occ    Energy  Couls-En    Coefficients

                                   1 1s      1 1s      1 1s      1 1s      1 1s      1 1s      1 1s      1 3d0     1 3d2+    1 3d0  
                                   1 3d2+    1 3d0     1 3d2+    1 3d0     1 3d2+    1 3d0     1 3d2+    1 3d0     1 3d2+    1 5g0  
                                   1 5g4+    1 5g2+    1 5g0     1 5g4+    1 5g2+    1 5g0     1 5g4+    1 5g2+    1 5g0     1 5g4+ 
                                   1 5g2+    1 7i6+    1 7i4+    1 7i2+    1 7i0     1 7i6+    1 7i4+    1 7i2+    1 7i0  

   1.1   2    -0.8546   -3.7393  1.000496 -0.000108  0.001062 -0.002364  0.002794 -0.003184  0.001662  0.000000  0.000000  0.000000
                                 0.000000  0.000000  0.000000  0.000000  0.000000  0.000000  0.000000  0.000000  0.000000  0.000000
                                 0.000000  0.000000  0.000000  0.000000  0.000000  0.000000  0.000000  0.000000  0.000000  0.000000
                                 0.000000  0.000000  0.000000  0.000000  0.000000  0.000000  0.000000  0.000000  0.000000

                                   1 2px     1 2px     1 2px     1 2px     1 2px     1 2px     1 2px     1 4f1+    1 4f3+    1 4f1+ 
                                   1 4f3+    1 4f1+    1 4f3+    1 4f1+    1 4f3+    1 4f1+    1 4f3+    1 6h1+    1 6h3+    1 6h5+ 
                                   1 6h1+    1 6h3+    1 6h5+    1 6h1+    1 6h3+    1 6h5+ 

   1.2   2    -0.2651   -2.5651  1.003492 -0.003956  0.006179  0.012461  0.004069 -0.031183  0.000279  0.000000  0.000000  0.000000
                                 0.000000  0.000000  0.000000  0.000000  0.000000  0.000000  0.000000  0.000000  0.000000  0.000000
                                 0.000000  0.000000  0.000000  0.000000  0.000000  0.000000

                                   1 2py     1 2py     1 2py     1 2py     1 2py     1 2py     1 2py     1 4f1-    1 4f3-    1 4f1- 
                                   1 4f3-    1 4f1-    1 4f3-    1 4f1-    1 4f3-    1 4f1-    1 4f3-    1 6h1-    1 6h3-    1 6h5- 
                                   1 6h1-    1 6h3-    1 6h5-    1 6h1-    1 6h3-    1 6h5- 

   1.3   +    -0.2651   -2.5651  1.003492 -0.003956  0.006179  0.012461  0.004069 -0.031183  0.000279  0.000000  0.000000  0.000000
                                 0.000000  0.000000  0.000000  0.000000  0.000000  0.000000  0.000000  0.000000  0.000000  0.000000
                                 0.000000  0.000000  0.000000  0.000000  0.000000  0.000000

                                   1 2pz     1 2pz     1 2pz     1 2pz     1 2pz     1 2pz     1 2pz     1 4f0     1 4f2+    1 4f0  
                                   1 4f2+    1 4f0     1 4f2+    1 4f0     1 4f2+    1 4f0     1 4f2+    1 6h2+    1 6h4+    1 6h0  
                                   1 6h2+    1 6h4+    1 6h0     1 6h2+    1 6h4+    1 6h0  

   1.5   +    -0.2651   -2.5651  1.003492 -0.003956  0.006179  0.012461  0.004069 -0.031183  0.000279  0.000000  0.000000  0.000000
                                 0.000000  0.000000  0.000000  0.000000  0.000000  0.000000  0.000000  0.000000  0.000000  0.000000
                                 0.000000  0.000000  0.000000  0.000000  0.000000  0.000000

 HOMO      1.2    -0.265069 =      -7.2129eV
 LUMO      2.2     0.061213 =       1.6657eV
 LUMO-HOMO         0.326282 =       8.8786eV


 **********************************************************************************************************************************
 DATASETS  * FILE   NREC   LENGTH (MB)   RECORD NAMES
              1      21       98.66       500      610      700      900      950      970     1000      129      960     1100   
                                          VAR    BASINP    GEOM    SYMINP    ZMAT    AOBASIS   BASIS     P2S    ABASIS      S 
                                         1400     1410     1420     1200     1210     1080     1600     1650     1300     1700   
                                         EKIN       V       ECP      H0       H01     AOSYM     SMH    MOLCAS    ERIS     OPER   
                                         1380   
                                         JKOP   

              2       6        8.31       700     1000      520     4202     5202     2101   
                                         GEOM     BASIS   MCVARS     RHF     MCSCF     RHF  

 PROGRAMS   *        TOTAL       RHF     MULTI       RHF       INT
 CPU TIMES  *         9.86      0.08      0.69      0.78      8.21
 REAL TIME  *        25.17 SEC
 DISK USED  *       304.45 MB      
 **********************************************************************************************************************************
 SETTING SCF(I)         =        -9.14763620  AU                              
 SETTING _CC_NORM_MAX   =         2.00000000                                  


 PROGRAM * UHF-SCF       Authors: W. Meyer, H.-J. Werner


 NUMBER OF ELECTRONS:       4+    2-    SPACE SYMMETRY=7    SPIN SYMMETRY: Triplet 
 CONVERGENCE THRESHOLDS:    1.00E-05 (Density)    1.00E-07 (Energy)
 MAX. NUMBER OF ITERATIONS:        0
 INTERPOLATION TYPE:            DIIS
 INTERPOLATION STEPS:              2 (START)      1 (STEP)
 LEVEL SHIFTS:                  0.20 (ALPHA)   0.20 (BETA) 



 Molecular orbitals read from record     2101.2  Type=RHF/CANONICAL (state 1.7)

 Molecular orbital dump at record        2200.2

 Initial alpha occupation   1   1   1   0   1   0   0   0
 Initial beta  occupation   1   1   0   0   0   0   0   0

 ITERATION    DDIFF          GRAD             ENERGY        2-EL.EN.            DIPOLE MOMENTS         DIIS
    1      0.000D+00      0.000D+00        -9.14763620     11.643573    0.00000    0.00000    0.00000    0
 
 Final alpha occupancy:   1   1   1   0   1   0   0   0
 Final beta  occupancy:   1   1   0   0   0   0   0   0

 !UHF STATE 1.7 Energy                 -9.147636200337
 Nuclear energy                         0.00000000
 One-electron energy                  -14.96942268
 Two-electron energy                    5.82178648
 Virial quotient                       -2.78956939
 !UHF STATE 1.7 Dipole moment           0.00000000     0.00000000     0.00000000
 Dipole moment /Debye                   0.00000000     0.00000000     0.00000000
 

 !UHF expec          <1.7|EKIN|1.7>     3.279228768146
 
 !UHF expec           <1.7|POT|1.7>    -3.240968845989

 ELECTRON ORBITALS FOR POSITIVE SPIN
 ===================================


   Orb  Occ    Energy  Couls-En    Coefficients

                                   1 1s      1 1s      1 1s      1 1s      1 1s      1 1s      1 1s      1 3d0     1 3d2+    1 3d0  
                                   1 3d2+    1 3d0     1 3d2+    1 3d0     1 3d2+    1 3d0     1 3d2+    1 3d0     1 3d2+    1 5g0  
                                   1 5g4+    1 5g2+    1 5g0     1 5g4+    1 5g2+    1 5g0     1 5g4+    1 5g2+    1 5g0     1 5g4+ 
                                   1 5g2+    1 7i6+    1 7i4+    1 7i2+    1 7i0     1 7i6+    1 7i4+    1 7i2+    1 7i0  

   1.1   +    -0.8546   -3.7393  1.000496 -0.000108  0.001062 -0.002364  0.002794 -0.003184  0.001662  0.000000  0.000000  0.000000
                                 0.000000  0.000000  0.000000  0.000000  0.000000  0.000000  0.000000  0.000000  0.000000  0.000000
                                 0.000000  0.000000  0.000000  0.000000  0.000000  0.000000  0.000000  0.000000  0.000000  0.000000
                                 0.000000  0.000000  0.000000  0.000000  0.000000  0.000000  0.000000  0.000000  0.000000

                                   1 2px     1 2px     1 2px     1 2px     1 2px     1 2px     1 2px     1 4f1+    1 4f3+    1 4f1+ 
                                   1 4f3+    1 4f1+    1 4f3+    1 4f1+    1 4f3+    1 4f1+    1 4f3+    1 6h1+    1 6h3+    1 6h5+ 
                                   1 6h1+    1 6h3+    1 6h5+    1 6h1+    1 6h3+    1 6h5+ 

   1.2   +    -0.2651   -2.5651  1.003492 -0.003956  0.006179  0.012461  0.004069 -0.031183  0.000279  0.000000  0.000000  0.000000
                                 0.000000  0.000000  0.000000  0.000000  0.000000  0.000000  0.000000  0.000000  0.000000  0.000000
                                 0.000000  0.000000  0.000000  0.000000  0.000000  0.000000

                                   1 2py     1 2py     1 2py     1 2py     1 2py     1 2py     1 2py     1 4f1-    1 4f3-    1 4f1- 
                                   1 4f3-    1 4f1-    1 4f3-    1 4f1-    1 4f3-    1 4f1-    1 4f3-    1 6h1-    1 6h3-    1 6h5- 
                                   1 6h1-    1 6h3-    1 6h5-    1 6h1-    1 6h3-    1 6h5- 

   1.3   +    -0.2651   -2.5651  1.003492 -0.003956  0.006179  0.012461  0.004069 -0.031183  0.000279  0.000000  0.000000  0.000000
                                 0.000000  0.000000  0.000000  0.000000  0.000000  0.000000  0.000000  0.000000  0.000000  0.000000
                                 0.000000  0.000000  0.000000  0.000000  0.000000  0.000000

                                   1 2pz     1 2pz     1 2pz     1 2pz     1 2pz     1 2pz     1 2pz     1 4f0     1 4f2+    1 4f0  
                                   1 4f2+    1 4f0     1 4f2+    1 4f0     1 4f2+    1 4f0     1 4f2+    1 6h2+    1 6h4+    1 6h0  
                                   1 6h2+    1 6h4+    1 6h0     1 6h2+    1 6h4+    1 6h0  

   1.5   +    -0.2651   -2.5651  1.003492 -0.003956  0.006179  0.012461  0.004069 -0.031183  0.000279  0.000000  0.000000  0.000000
                                 0.000000  0.000000  0.000000  0.000000  0.000000  0.000000  0.000000  0.000000  0.000000  0.000000
                                 0.000000  0.000000  0.000000  0.000000  0.000000  0.000000

 ELECTRON ORBITALS FOR NEGATIVE SPIN
 ===================================


   Orb  Occ    Energy  Couls-En    Coefficients

                                   1 1s      1 1s      1 1s      1 1s      1 1s      1 1s      1 1s      1 3d0     1 3d2+    1 3d0  
                                   1 3d2+    1 3d0     1 3d2+    1 3d0     1 3d2+    1 3d0     1 3d2+    1 3d0     1 3d2+    1 5g0  
                                   1 5g4+    1 5g2+    1 5g0     1 5g4+    1 5g2+    1 5g0     1 5g4+    1 5g2+    1 5g0     1 5g4+ 
                                   1 5g2+    1 7i6+    1 7i4+    1 7i2+    1 7i0     1 7i6+    1 7i4+    1 7i2+    1 7i0  

   1.1   -    -0.8546   -3.7393  1.000496 -0.000108  0.001062 -0.002364  0.002794 -0.003184  0.001662  0.000000  0.000000  0.000000
                                 0.000000  0.000000  0.000000  0.000000  0.000000  0.000000  0.000000  0.000000  0.000000  0.000000
                                 0.000000  0.000000  0.000000  0.000000  0.000000  0.000000  0.000000  0.000000  0.000000  0.000000
                                 0.000000  0.000000  0.000000  0.000000  0.000000  0.000000  0.000000  0.000000  0.000000

                                   1 2px     1 2px     1 2px     1 2px     1 2px     1 2px     1 2px     1 4f1+    1 4f3+    1 4f1+ 
                                   1 4f3+    1 4f1+    1 4f3+    1 4f1+    1 4f3+    1 4f1+    1 4f3+    1 6h1+    1 6h3+    1 6h5+ 
                                   1 6h1+    1 6h3+    1 6h5+    1 6h1+    1 6h3+    1 6h5+ 

   1.2   -    -0.2651   -2.5651  1.003492 -0.003956  0.006179  0.012461  0.004069 -0.031183  0.000279  0.000000  0.000000  0.000000
                                 0.000000  0.000000  0.000000  0.000000  0.000000  0.000000  0.000000  0.000000  0.000000  0.000000
                                 0.000000  0.000000  0.000000  0.000000  0.000000  0.000000

 HOMO      1.2    -0.265069 =      -7.2129eV
 LUMO     -1.3    -0.265069 =      -7.2129eV
 LUMO-HOMO         0.000000 =       0.0000eV

 EXPECTATION VALUE OF S**2:             2.00000000

 Occupation number threshold for canonical orbitals:  1.999000 (occupied),  0.001000 (virtual)

 Number of pseudo-canonical orbitals per symmetry:    1   1   0   0   0   0   0   0
 Number of active natural orbitals per symmetry:      0   0   1   0   1   0   0   0

 NATURAL CHARGE ORBITALS
 =======================


   Orb     Occ        Energy       Coefficients

                                   1 1s      1 1s      1 1s      1 1s      1 1s      1 1s      1 1s      1 3d0     1 3d2+    1 3d0  
                                   1 3d2+    1 3d0     1 3d2+    1 3d0     1 3d2+    1 3d0     1 3d2+    1 3d0     1 3d2+    1 5g0  
                                   1 5g4+    1 5g2+    1 5g0     1 5g4+    1 5g2+    1 5g0     1 5g4+    1 5g2+    1 5g0     1 5g4+ 
                                   1 5g2+    1 7i6+    1 7i4+    1 7i2+    1 7i0     1 7i6+    1 7i4+    1 7i2+    1 7i0  

   1.1  2.00000    -0.854621     1.000496 -0.000108  0.001062 -0.002364  0.002794 -0.003184  0.001662  0.000000  0.000000  0.000000
                                 0.000000  0.000000  0.000000  0.000000  0.000000  0.000000  0.000000  0.000000  0.000000  0.000000
                                 0.000000  0.000000  0.000000  0.000000  0.000000  0.000000  0.000000  0.000000  0.000000  0.000000
                                 0.000000  0.000000  0.000000  0.000000  0.000000  0.000000  0.000000  0.000000  0.000000

                                   1 2px     1 2px     1 2px     1 2px     1 2px     1 2px     1 2px     1 4f1+    1 4f3+    1 4f1+ 
                                   1 4f3+    1 4f1+    1 4f3+    1 4f1+    1 4f3+    1 4f1+    1 4f3+    1 6h1+    1 6h3+    1 6h5+ 
                                   1 6h1+    1 6h3+    1 6h5+    1 6h1+    1 6h3+    1 6h5+ 

   1.2  2.00000    -0.265069     1.003492 -0.003956  0.006179  0.012461  0.004069 -0.031183  0.000279  0.000000  0.000000  0.000000
                                 0.000000  0.000000  0.000000  0.000000  0.000000  0.000000  0.000000  0.000000  0.000000  0.000000
                                 0.000000  0.000000  0.000000  0.000000  0.000000  0.000000

                                   1 2py     1 2py     1 2py     1 2py     1 2py     1 2py     1 2py     1 4f1-    1 4f3-    1 4f1- 
                                   1 4f3-    1 4f1-    1 4f3-    1 4f1-    1 4f3-    1 4f1-    1 4f3-    1 6h1-    1 6h3-    1 6h5- 
                                   1 6h1-    1 6h3-    1 6h5-    1 6h1-    1 6h3-    1 6h5- 

   1.3  1.00000    -0.214555     1.003492 -0.003956  0.006179  0.012461  0.004069 -0.031183  0.000279  0.000000  0.000000  0.000000
                                 0.000000  0.000000  0.000000  0.000000  0.000000  0.000000  0.000000  0.000000  0.000000  0.000000
                                 0.000000  0.000000  0.000000  0.000000  0.000000  0.000000

                                   1 2pz     1 2pz     1 2pz     1 2pz     1 2pz     1 2pz     1 2pz     1 4f0     1 4f2+    1 4f0  
                                   1 4f2+    1 4f0     1 4f2+    1 4f0     1 4f2+    1 4f0     1 4f2+    1 6h2+    1 6h4+    1 6h0  
                                   1 6h2+    1 6h4+    1 6h0     1 6h2+    1 6h4+    1 6h0  

   1.5  1.00000    -0.214555     1.003492 -0.003956  0.006179  0.012461  0.004069 -0.031183  0.000279  0.000000  0.000000  0.000000
                                 0.000000  0.000000  0.000000  0.000000  0.000000  0.000000  0.000000  0.000000  0.000000  0.000000
                                 0.000000  0.000000  0.000000  0.000000  0.000000  0.000000

 Natural orbitals saved to record    2200.2 (Orbital set 3)

 Orbital spaces for UNO-CAS (Min. occupation: 0.020  Max. occupation: 1.980):

 Closed:        1   1   0   0   0   0   0   0
 Active:        0   0   1   0   1   0   0   0

 No convergence



 **********************************************************************************************************************************
 DATASETS  * FILE   NREC   LENGTH (MB)   RECORD NAMES
              1      21       98.66       500      610      700      900      950      970     1000      129      960     1100   
                                          VAR    BASINP    GEOM    SYMINP    ZMAT    AOBASIS   BASIS     P2S    ABASIS      S 
                                         1400     1410     1420     1200     1210     1080     1600     1650     1300     1700   
                                         EKIN       V       ECP      H0       H01     AOSYM     SMH    MOLCAS    ERIS     OPER   
                                         1380   
                                         JKOP   

              2       7       11.08       700     1000      520     4202     5202     2101     2200   
                                         GEOM     BASIS   MCVARS     RHF     MCSCF     RHF      UHF  

 PROGRAMS   *        TOTAL       UHF       RHF     MULTI       RHF       INT
 CPU TIMES  *         9.96      0.09      0.08      0.69      0.78      8.21
 REAL TIME  *        25.59 SEC
 DISK USED  *       304.45 MB      
 **********************************************************************************************************************************
 SETTING SCF(I)         =        -9.14763620  AU                              


 PROGRAM * MRCC (General Multireference Coupled Cluster)    Author: M. Kallay, 2000-2005

 ***  Initialisation ***

   0 Spin projections
 
 Molecular orbitals read from record     2200.2  Type=UHF/ALPHA (state 1.7)

 ?Warning: UHF not converged
 Molecular orbitals read from record     2200.2  Type=UHF/BETA (state 1.7)

 ?Warning: UHF not converged
 
 Frozen orbitals:              0 (  0  0  0  0  0  0  0  0)
 Active orbitals:            188 ( 39 26 26 20 26 20 20 11)
 Active electrons:             6
 Spin quantum number:          1.0

 Transformed integrals will be written to file mrcc_40595/fort.55

 Load integrals               10.0 sec
 Transform integrals          22.3 sec
 Storage for integrals:      119071012
 Remaining memory:           *********

 Core energy:               0.00000000
 
 MRCC Input:
     4     0     0     0     3     0     0     7     0     0     0     1     1     0     0     7     0     0   0.000     0   64000
  ex.lev,nsing,ntrip, rest,method,dens,conver,symm, diag, CS ,spatial, HF, ndoub,nacto,nactv, tol, maxex, sacc, freq,  dboc,   mem
  2  0  0  0  0  0  0  0  0  0  0  0  0  0  0  0  0  0  0  0  0  0  0  0  0  0  0  0  0  0  0  0  0  0  0  0  0  0  0  2  0  0  0  0  0  0  0  0  0  0  0  0  0  0  0  0  0  0  0  0  0  0  0  0  0  1  0  0  0  0  0  0  0  0  0  0  0  0  0  0  0  0  0  0  0  0  0  0  0  0  0  0  0  0  0  0  0  0  0  0  0  0  0  0  0  0  0  0  0  0  0  1  0  0  0  0  0  0  0  0  0  0  0  0  0  0  0  0  0  0  0  0  0  0  0  0  0  0  0  0  0  0  0  0  0  0  0  0  0  0  0  0  0  0  0  0  0  0  0  0  0  0  0  0  0  0  0  0  0  0  0  0  0  0  0  0  0  0  0  0  0  0  0  0  0  0  0  0
 MRCC Input end
 Variable memory released
 MRCC now being run, temporary output in /global/cscratch1/sd/aannabe/mrcc_40595/mrcc.out
 **********************************************************************
                          MRCC program system
 **********************************************************************

                              Written by
  Mihaly Kallay, Zoltan Rolik, Jozsef Csontos, Peter Nagy, Gyula Samu,
      David Mester, Jozsef Csoka, Bernat Szabo, Istvan Ladjanszki,
       Lorant Szegedy, Bence Ladoczki, Klara Petrov, Mate Farkas,
                    Pal D. Mezei, and Bence Hegely

        Department of Physical Chemistry and Materials Science
            Budapest University of Technology and Economics
                  Budapest P.O.Box 91, H-1521 Hungary

                              www.mrcc.hu

                       Release date: May 23, 2018

 ************************ 2019-06-25 17:09:35 *************************
 Executing goldstone...

 Generation of CC equations in terms of H and T...
 Generation of antisymmetrized Goldstone diagrams...
 Number of diagrams in T^1 equations:    15
 Number of diagrams in T^2 equations:    38
 Number of diagrams in T^3 equations:    49
 Number of diagrams in T^4 equations:     5
 Translation of diagrams to factorized equations...
 Optimizing intermediate calculation...
 Number of floating-point operations per iteration step:   3.9954E+12
 Probable CPU time per iteration step (hours):     39.95
 Required memory (Mbytes):  152519.1
 Number of intermediates:                                  79
 Number of intermediates to be stored:                     32
 Length of intermediate file (Mbytes):    2454.7

 ************************ 2019-06-25 17:09:36 *************************
 Executing xmrcc...

 **********************************************************************
 CC(3)(4) calculation


 Allocation of****** Mbytes of memory...
 Number of spinorbitals:                   376
 Number of alpha electrons:                        4
 Number of beta electrons:                         2
 Spin multiplicity:                     2
 z-component of spin:  1.0
 Spatial symmetry:                      7
 Convergence criterion:  1.0E-07
 Construction of occupation graphs...
 Number of                     0 -fold excitations:                      1
 Number of                     1 -fold excitations:                    176
 Number of                     2 -fold excitations:                  50148
 Number of                     3 -fold excitations:                6791476
 Total number of configurations:                6841801
 Calculation of coupling coefficients...
 Length of intermediate file (Mbytes):    1850.1

 ======================================================================

 Spin case  1   Alpha:  2   Beta:  2
 Number of excitations:              217249194
 Spin case  2   Alpha:  3   Beta:  1
 Number of excitations:              189896528
 Spin case  3   Alpha:  4   Beta:  0
 Number of excitations:                5778276
 Number of                     4 -fold excitations:              412923998

 Memory requirements /Mbyte/:
               Minimal        Optimal
 Real*8:       3948.7500      9531.1702
 Integer:       261.7832
 Total:        4210.5332      9792.9534


 ************************ 2019-06-25 17:10:33 *************************
 Executing mrcc...

 **********************************************************************
 CCSDT(Q) calculation


 Allocation of 9531.2 Mbytes of memory...
 Number of spinorbitals: 376
 Number of alpha electrons:  4
 Number of beta  electrons:  2
 Spin multiplicity: 2
 z-component of spin:  1.0
 Spatial symmetry: 7
 Convergence criterion:  1.0E-07
 Construction of occupation graphs...
 Number of 0-fold excitations: 1
 Number of 1-fold excitations: 176
 Number of 2-fold excitations: 50148
 Number of 3-fold excitations: 6791476
 Total number of determinants: 6841801
 Calculation of coupling coefficients...
 Initial cluster amplitudes are generated.
 Length of intermediate file (Mbytes):    1850.1
 Reading integral list from unit 55...
 Sorting integrals...
 Sorting integrals...
 Sorting integrals...
 Sorting integrals...
 Energy of reference determinant [au]:      -9.147636200337
 Calculation of MP denominators...

 Starting CC iteration...
 ======================================================================
 Norm of residual vector:     0.67103560
 CPU time [min]:     8.115                   Wall time [min]:     8.123

 Iteration  1  CC energy:    -9.27998577  Energy decrease:   0.13234956
 ======================================================================
 Norm of residual vector:     0.18057292
 CPU time [min]:    12.490                   Wall time [min]:    12.502

 Iteration  2  CC energy:    -9.28970569  Energy decrease:   0.00971992
 ======================================================================
 Norm of residual vector:     0.04737996
 CPU time [min]:    16.998                   Wall time [min]:    17.017

 Iteration  3  CC energy:    -9.29852489  Energy decrease:   0.00881920
 ======================================================================
 Norm of residual vector:     0.01098796
 CPU time [min]:    21.501                   Wall time [min]:    21.529

 Iteration  4  CC energy:    -9.29880023  Energy decrease:   0.00027534
 ======================================================================
 Norm of residual vector:     0.00358933
 CPU time [min]:    26.015                   Wall time [min]:    26.050

 Iteration  5  CC energy:    -9.29880030  Energy decrease:   0.00000007
 ======================================================================
 Norm of residual vector:     0.00140336
 CPU time [min]:    30.538                   Wall time [min]:    30.576

 Iteration  6  CC energy:    -9.29882610  Energy decrease:   0.00002580
 ======================================================================
 Norm of residual vector:     0.00060886
 CPU time [min]:    35.041                   Wall time [min]:    35.083

 Iteration  7  CC energy:    -9.29882235  Energy decrease:   0.00000375
 ======================================================================
 Norm of residual vector:     0.00027461
 CPU time [min]:    39.568                   Wall time [min]:    39.618

 Iteration  8  CC energy:    -9.29881963  Energy decrease:   0.00000272
 ======================================================================
 Norm of residual vector:     0.00011158
 CPU time [min]:    44.101                   Wall time [min]:    44.172

 Iteration  9  CC energy:    -9.29882311  Energy decrease:   0.00000348
 ======================================================================
 Norm of residual vector:     0.00003993
 CPU time [min]:    48.658                   Wall time [min]:    48.734

 Iteration 10  CC energy:    -9.29882337  Energy decrease:   0.00000027
 ======================================================================
 Norm of residual vector:     0.00001434
 CPU time [min]:    53.223                   Wall time [min]:    53.302

 Iteration 11  CC energy:    -9.29882274  Energy decrease:   0.00000064
 ======================================================================
 Norm of residual vector:     0.00000483
 CPU time [min]:    57.838                   Wall time [min]:    57.922

 Iteration 12  CC energy:    -9.29882280  Energy decrease:   0.00000006
 ======================================================================
 Norm of residual vector:     0.00000171
 CPU time [min]:    62.503                   Wall time [min]:    62.596

 Iteration 13  CC energy:    -9.29882287  Energy decrease:   0.00000007
 ======================================================================
 Norm of residual vector:     0.00000061
 CPU time [min]:    67.138                   Wall time [min]:    67.240

 Iteration 14  CC energy:    -9.29882285  Energy decrease:   0.00000002
 ======================================================================
 Norm of residual vector:     0.00000020
 CPU time [min]:    71.790                   Wall time [min]:    71.911

 Iteration 15  CC energy:    -9.29882284  Energy decrease:   4.6894E-09
 ======================================================================
 Norm of residual vector:     0.00000007
 CPU time [min]:    76.280                   Wall time [min]:    76.412

 Iteration 16  CC energy:    -9.29882285  Energy decrease:   1.7773E-09
 ======================================================================

 Iteration has converged in 16 steps.

 Final results:
 Total CCSDT energy [au]:             -9.298822846019
 Total MP2 energy [au]:               -9.279985765242

 Perturbative corrections are calculated...
 ======================================================================
 Spin case  1   Alpha:  2   Beta:  2
 Number of excitations:        217249194
 CPU time [min]:   911.285                   Wall time [min]:   911.502
 ======================================================================
 Spin case  2   Alpha:  3   Beta:  1
 Number of excitations:        189896528
 CPU time [min]:  1419.772                   Wall time [min]:  1420.076
 ======================================================================
 Spin case  3   Alpha:  4   Beta:  0
 Number of excitations:        5778276
 CPU time [min]:  1473.605                   Wall time [min]:  1473.941
 ======================================================================
 Number of 4-fold excitations: 412923998
 CPU time [min]:  1473.605                   Wall time [min]:  1474.027

 Total CCSDT[Q] energy [au]:          -9.298808069108
 Total CCSDT(Q) energy [au]:          -9.298986218006

 ************************ 2019-06-26 17:44:42 *************************
                      Normal termination of mrcc.
 **********************************************************************
 !CCSDT STATE 1.7 Energy               -9.298822846019
 !MP2 STATE 1.7 Energy                 -9.279985765242
 !CCSDT[Q] STATE 1.7 Energy            -9.298808069108
 !CCSDT(Q) STATE 1.7 Energy            -9.298986218006
 
 CPU-time for MRCC:          88416.3 sec
 Elapsed-time for MRCC:      88509.3 sec

 Variable memory set to 8000000000 words,  buffer space   230000 words



 **********************************************************************************************************************************
 DATASETS  * FILE   NREC   LENGTH (MB)   RECORD NAMES
              1      21       98.66       500      610      700      900      950      970     1000      129      960     1100   
                                          VAR    BASINP    GEOM    SYMINP    ZMAT    AOBASIS   BASIS     P2S    ABASIS      S 
                                         1400     1410     1420     1200     1210     1080     1600     1650     1300     1700   
                                         EKIN       V       ECP      H0       H01     AOSYM     SMH    MOLCAS    ERIS     OPER   
                                         1380   
                                         JKOP   

              2       7       11.08       700     1000      520     4202     5202     2101     2200   
                                         GEOM     BASIS   MCVARS     RHF     MCSCF     RHF      UHF  

 PROGRAMS   *        TOTAL      MRCC       UHF       RHF     MULTI       RHF       INT
 CPU TIMES  *     88791.12  88781.16      0.09      0.08      0.69      0.78      8.21
 REAL TIME  *     90296.55 SEC
 DISK USED  *       304.45 MB      
 **********************************************************************************************************************************
 SETTING POSTHF(I)      =        -9.29898622  AU                              
                                                                                                                                                                                                                                                                

       SCF           POSTHF       EKIN          POT
    -9.14763620   -9.29898622   3.27922877   -3.24096885
                                                  

 CCSDT(Q)/USERDEF energy=     -9.298986218006

        CCSDT(Q)        UHF-SCF         RHF-SCF         MULTI           RHF-SCF 
     -9.29898622     -9.14763620     -9.14763620     -9.14763620     -9.15005353
 **********************************************************************************************************************************
 Molpro calculation terminated
 Variable memory released
