
 Primary working directories    : /global/cscratch1/sd/aannabe
 Secondary working directories  : /global/cscratch1/sd/aannabe
 Wavefunction directory         : /global/homes/a/aannabe/wfu/
 Main file repository           : /global/cscratch1/sd/aannabe/

 SHA1      : 2873118e99aab1bc19f5b6fc1784693c06d15c95
 NAME      : 2015.1.8
 ARCHNAME  : linux/x86_64
 FC        : /opt/cray/pe/craype/2.5.5/bin/ftn
 BLASLIB   : -Wl,-_start-group /opt/intel/compilers_and_libraries_2016.3.210/linux/mkl/lib/intel64/libmkl_intel_ilp64.a /opt/intel/compilers_and_libraries_2016.3.210/linux/mkl/lib/intel64/libmkl_intel_thread.a /opt/intel/compilers_and_libraries_2016.3.210/linux/mkl/lib/intel64/libmkl_core.a -Wl,-_end-group
 id        : lbl

 Nodes     nprocs
 nid00510     1

 Using customized tuning parameters: mindgm=8; mindgv=16; mindgc=4; mindgr=1; noblas=0; minvec=7
 default implementation of scratch files=df  

 ***,C
 memory,8,g
 gthresh,twoint=1.e-12
 
 gprint,basis,orbitals
 gexpec,ekin,pot
 
 angstrom
 geometry={
 1                                                                               ! Number of atoms
 C 0.0 0.0 0.0
 }
 
 basis={
 Including file /global/homes/a/aannabe/docs/accurate/BFD_Kh/pps/C.pp
 Including file /global/homes/a/aannabe/docs/accurate/BFD_Kh/basis/aug-cc-pVnZ/C_dz.basis
 }
 
 {rhf
  start,atden
  wf,4,4,2
  occ,1,1,1,0,0,0,0,0
  open,1.2,1.3
  save,4202.2
 }
 {multi
  start,4202.2
  occ,1,1,1,0,1,0,0
  closed,1,0,0,0,0,0,0,0
  wf,4,4,2;state,1
  wf,4,6,2;state,1
  wf,4,7,2;state,1
  natorb,ci,print
  orbital,5202.2
 }
 {rhf,nitord=1,maxit=0
  start,5202.2
  wf,4,4,2
  occ,1,1,1,0,0,0,0,0
  open,1.2,1.3
 }
 scf(i)=energy
 
 _CC_NORM_MAX=2.0
  !NOTE: Perturbative MRCC works only with UHF reference. So, here we will trick MRCC by doing zero UHF iteration right after ROHF.
 
 {uhf
 maxit,0
 }
 scf(i)=energy
 
 {mrcc,method=CCSDT(Q)
 orbital,ignore_error=1                                                          !Ignore the fact that UHF WF is not converged
 maxit,100
 core
 }
 posthf(i)=energy
 
 table,scf,posthf,ekin,pot
 save,2.csv,new
 
 

 Variables initialized (889), CPU time= 0.00 sec
 Commands  initialized (702), CPU time= 0.01 sec, 572 directives.
 Default parameters read. Elapsed time= 0.16 sec

 Checking input...
 Passed
1


                                         ***  PROGRAM SYSTEM MOLPRO  ***
                                       Copyright, TTI GmbH Stuttgart, 2015
                                    Version 2015.1 linked Sep  7 2016 23:09:38


 **********************************************************************************************************************************
 LABEL *   C                                                                             
  64 bit serial version                                                                  DATE: 05-Nov-18          TIME: 11:21:21  
 **********************************************************************************************************************************

 SHA1:             2873118e99aab1bc19f5b6fc1784693c06d15c95
 **********************************************************************************************************************************

 THRESHOLDS:

 ZERO    =  1.00D-12  ONEINT  =  1.00D-12  TWOINT  =  1.00D-12  PREFAC  =  1.00D-14  LOCALI  =  1.00D-09  EORDER  =  1.00D-04
 ENERGY  =  0.00D+00  ETEST   =  0.00D+00  EDENS   =  0.00D+00  THRDEDEF=  1.00D-06  GRADIENT=  1.00D-02  STEP    =  1.00D-03
 ORBITAL =  1.00D-05  CIVEC   =  1.00D-05  COEFF   =  1.00D-04  PRINTCI =  5.00D-02  PUNCHCI =  9.90D+01  OPTGRAD =  3.00D-04
 OPTENERG=  1.00D-06  OPTSTEP =  3.00D-04  THRGRAD =  1.00D-10  COMPRESS=  1.00D-11  VARMIN  =  1.00D-07  VARMAX  =  1.00D-03
 THRDOUB =  0.00D+00  THRDIV  =  1.00D-05  THRRED  =  1.00D-07  THRPSP  =  1.00D+00  THRDC   =  1.00D-10  THRCS   =  1.00D-10
 THRNRM  =  1.00D-08  THREQ   =  0.00D+00  THRDE   =  1.00D+00  THRREF  =  1.00D-05  SPARFAC =  1.00D+00  THRDLP  =  1.00D-07
 THRDIA  =  1.00D-10  THRDLS  =  1.00D-07  THRGPS  =  0.00D+00  THRKEX  =  0.00D+00  THRDIS  =  2.00D-01  THRVAR  =  1.00D-10
 THRLOC  =  1.00D-06  THRGAP  =  1.00D-06  THRLOCT = -1.00D+00  THRGAPT = -1.00D+00  THRORB  =  1.00D-06  THRMLTP =  0.00D+00
 THRCPQCI=  1.00D-10  KEXTA   =  0.00D+00  THRCOARS=  0.00D+00  SYMTOL  =  1.00D-06  GRADTOL =  1.00D-06  THROVL  =  1.00D-08
 THRORTH =  1.00D-08  GRID    =  1.00D-06  GRIDMAX =  1.00D-03  DTMAX   =  0.00D+00  THROCCDE=  1.00D-01  THROCCDE=  1.00D-01



 ZUNIT=ANG
 

Geometry recognized as XYZ


 Variable memory set to 8000000000 words,  buffer space   230000 words

 SETTING BASIS          =    USERDEF


 Recomputing integrals since basis changed


 Using spherical harmonics



 PROGRAM * SEWARD (Integral evaluation for generally contracted gaussian basis sets)     Author: Roland Lindh, 1990

 Geometry written to block  1 of record 700

 Orientation using atomic masses  
 Molecule type: Atom
 Symmetry elements: X,Y,Z
 Rotational constants:       0.0000000      0.0000000      0.0000000 GHz  (calculated with average atomic masses)

 Point group  D2h 



 ATOMIC COORDINATES

 NR  ATOM    CHARGE       X              Y              Z

   1  C       4.00    0.000000000    0.000000000    0.000000000


          C   CORE POTENTIAL

          p POTENTIAL

 POWERS             1              3              2
 EXPONENTIALS   8.359738       4.483619       3.938313    
 COEFFICIENTS   4.000000       33.43895      -19.17537    

          s - p POTENTIAL

 POWERS             2
 EXPONENTIALS   5.029916    
 COEFFICIENTS   22.55164    


 BASIS DATA

   Nr Sym  Nuc  Type         Exponents   Contraction coefficients

    1.1 Ag    1  1s           0.051344     0.013991
                              0.102619     0.169852
                              0.205100     0.397529
                              0.409924     0.380369
                              0.819297     0.180113
                              1.637494    -0.033512
                              3.272791    -0.121499
                              6.541187     0.015176
                             13.073594    -0.000705
    2.1 Ag    1  1s           0.127852     1.000000
    3.1 Ag    1  1s           0.051141     1.000000
    4.1 Ag    1  3d0          0.561160     1.000000
    5.1 Ag    1  3d2+         0.561160     1.000000
    6.1 Ag    1  3d0          0.224464     1.000000
    7.1 Ag    1  3d2+         0.224464     1.000000
    1.2 B3u   1  2px          0.029281     0.001787
                              0.058547     0.050426
                              0.117063     0.191634
                              0.234064     0.302667
                              0.468003     0.289868
                              0.935757     0.210979
                              1.871016     0.112024
                              3.741035     0.054425
                              7.480076     0.021931
    2.2 B3u   1  2px          0.149161     1.000000
    3.2 B3u   1  2px          0.059664     1.000000
    1.3 B2u   1  2py          0.029281     0.001787
                              0.058547     0.050426
                              0.117063     0.191634
                              0.234064     0.302667
                              0.468003     0.289868
                              0.935757     0.210979
                              1.871016     0.112024
                              3.741035     0.054425
                              7.480076     0.021931
    2.3 B2u   1  2py          0.149161     1.000000
    3.3 B2u   1  2py          0.059664     1.000000
    1.4 B1g   1  3d2-         0.561160     1.000000
    2.4 B1g   1  3d2-         0.224464     1.000000
    1.5 B1u   1  2pz          0.029281     0.001787
                              0.058547     0.050426
                              0.117063     0.191634
                              0.234064     0.302667
                              0.468003     0.289868
                              0.935757     0.210979
                              1.871016     0.112024
                              3.741035     0.054425
                              7.480076     0.021931
    2.5 B1u   1  2pz          0.149161     1.000000
    3.5 B1u   1  2pz          0.059664     1.000000
    1.6 B2g   1  3d1+         0.561160     1.000000
    2.6 B2g   1  3d1+         0.224464     1.000000
    1.7 B3g   1  3d1-         0.561160     1.000000
    2.7 B3g   1  3d1-         0.224464     1.000000

 NUCLEAR CHARGE:                    4
 NUMBER OF PRIMITIVE AOS:          56
 NUMBER OF SYMMETRY AOS:           54
 NUMBER OF CONTRACTIONS:           22   (   7Ag  +   3B3u +   3B2u +   2B1g +   3B1u +   2B2g +   2B3g +   0Au  )
 NUMBER OF CORE ORBITALS:           0   (   0Ag  +   0B3u +   0B2u +   0B1g +   0B1u +   0B2g +   0B3g +   0Au  )
 NUMBER OF VALENCE ORBITALS:        4   (   1Ag  +   1B3u +   1B2u +   0B1g +   1B1u +   0B2g +   0B3g +   0Au  )


 NUCLEAR REPULSION ENERGY    0.00000000

 EXTRA SYMMETRY OF AOS IN SYMMETRY 1:   1 1 1 2 3 2 3

 Eigenvalues of metric

         1 0.303E-01 0.299E+00 0.299E+00 0.324E+00 0.170E+01 0.170E+01 0.265E+01
         2 0.104E+00 0.472E+00 0.242E+01
         3 0.104E+00 0.472E+00 0.242E+01
         4 0.299E+00 0.170E+01
         5 0.104E+00 0.472E+00 0.242E+01
         6 0.299E+00 0.170E+01
         7 0.299E+00 0.170E+01


 Contracted 2-electron integrals neglected if value below      1.0D-12
 AO integral compression algorithm  1   Integral accuracy      1.0D-12

     0.262 MB (compressed) written to integral file (100.0%)


 NUMBER OF SORTED TWO-ELECTRON INTEGRALS:       5272.     BUFFER LENGTH:  32768
 NUMBER OF SEGMENTS:   1  SEGMENT LENGTH:       5272      RECORD LENGTH: 524288

 Memory used in sort:       0.56 MW

 SORT1 READ       12220. AND WROTE        4734. INTEGRALS IN      1 RECORDS. CPU TIME:     0.00 SEC, REAL TIME:     0.01 SEC
 SORT2 READ        4734. AND WROTE        5272. INTEGRALS IN      1 RECORDS. CPU TIME:     0.00 SEC, REAL TIME:     0.01 SEC

 FILE SIZES:   FILE 1:    19.3 MBYTE,  FILE 4:     4.2 MBYTE,   TOTAL:     23.6 MBYTE

 OPERATOR DM      FOR CENTER  0  COORDINATES:    0.000000    0.000000    0.000000
 OPERATOR EKIN    FOR CENTER  0  COORDINATES:    0.000000    0.000000    0.000000
 OPERATOR POT     FOR CENTER  0  COORDINATES:    0.000000    0.000000    0.000000


 **********************************************************************************************************************************
 DATASETS  * FILE   NREC   LENGTH (MB)   RECORD NAMES
              1      20       19.12       500      610      700      900      950      970     1000      129      960     1100   
                                          VAR    BASINP    GEOM    SYMINP    ZMAT    AOBASIS   BASIS     P2S    ABASIS      S 
                                         1400     1410     1420     1200     1210     1080     1600     1650     1300     1700   
                                         EKIN       V       ECP      H0       H01     AOSYM     SMH    MOLCAS    ERIS     OPER   

 PROGRAMS   *        TOTAL       INT
 CPU TIMES  *         2.16      2.04
 REAL TIME  *        18.27 SEC
 DISK USED  *        23.83 MB      
 **********************************************************************************************************************************


 PROGRAM * RHF-SCF (OPEN SHELL)       Authors: W. Meyer, H.-J. Werner


 NUMBER OF ELECTRONS:       3+    1-    SPACE SYMMETRY=4    SPIN SYMMETRY: Triplet 
 CONVERGENCE THRESHOLDS:    1.00E-05 (Density)    1.00E-07 (Energy)
 MAX. NUMBER OF ITERATIONS:       60
 INTERPOLATION TYPE:            DIIS
 INTERPOLATION STEPS:              2 (START)      1 (STEP)
 LEVEL SHIFTS:                 -0.60 (CLOSED) -0.30 (OPEN) 


 Singly occupied orbitals:      1.2       1.3

   Atom=C  basis=ECP2MWB_GUESS     lmin=0  lmax=1

 Orbital guess generated from atomic densities. Full valence occupancy:    1   1   1   0   1   0   0   0


 Molecular orbital dump at record        4202.2

 ITERATION    DDIFF          GRAD             ENERGY        2-EL.EN.            DIPOLE MOMENTS         DIIS   ORB.
    1      0.000D+00      0.000D+00        -5.29655632      5.574532    0.00000    0.00000    0.00000    0    start
    2      0.000D+00      0.303D-01        -5.32424929      5.920104    0.00000    0.00000    0.00000    1    diag,B
    3      0.600D-01      0.897D-02        -5.32851839      6.067662    0.00000    0.00000    0.00000    2    diag,B
    4      0.194D-01      0.270D-02        -5.32901560      6.104853    0.00000    0.00000    0.00000    3    diag,B
    5      0.134D-01      0.310D-03        -5.32901763      6.101771    0.00000    0.00000    0.00000    4    diag,B
    6      0.591D-03      0.127D-03        -5.32901823      6.101695    0.00000    0.00000    0.00000    5    diag,B
    7      0.425D-03      0.155D-04        -5.32901824      6.101824    0.00000    0.00000    0.00000    6    fixocc
    8      0.526D-04      0.318D-05        -5.32901824      6.101754    0.00000    0.00000    0.00000    7    diag,B
    9      0.101D-04      0.126D-05        -5.32901824      6.101780    0.00000    0.00000    0.00000    8    diag,B
   10      0.367D-05      0.303D-06        -5.32901824      6.101777    0.00000    0.00000    0.00000    0    orth

 Final alpha occupancy:   1   1   1   0   0   0   0
 Final beta  occupancy:   1   0   0   0   0   0   0

 !RHF STATE 1.4 Energy                 -5.329018242588
 Nuclear energy                         0.00000000
 One-electron energy                   -8.37990649
 Two-electron energy                    3.05088825
 Virial quotient                       -1.60956667
 !RHF STATE 1.4 Dipole moment           0.00000000     0.00000000     0.00000000
 Dipole moment /Debye                   0.00000000     0.00000000     0.00000000
 

 !RHF expec          <1.4|EKIN|1.4>     3.310840331492
 
 !RHF expec           <1.4|POT|1.4>    -3.134066189811

 ELECTRON ORBITALS
 =================


   Orb  Occ    Energy  Couls-En    Coefficients

                                   1 1s      1 1s      1 1s      1 3d0     1 3d2+    1 3d0     1 3d2+ 

   1.1   2    -0.7057   -2.9801  1.000113 -0.000143  0.000008 -0.000803 -0.000000 -0.004635  0.000000

                                   1 2px     1 2px     1 2px  

   1.2   +    -0.4333   -2.3489  0.999931  0.000088 -0.000006

                                   1 2py     1 2py     1 2py  

   1.3   +    -0.4333   -2.3489  0.999931  0.000088 -0.000006

 HOMO      1.2    -0.433323 =     -11.7913eV
 LUMO      1.5     0.016095 =       0.4380eV
 LUMO-HOMO         0.449418 =      12.2293eV


 **********************************************************************************************************************************
 DATASETS  * FILE   NREC   LENGTH (MB)   RECORD NAMES
              1      20       19.12       500      610      700      900      950      970     1000      129      960     1100   
                                          VAR    BASINP    GEOM    SYMINP    ZMAT    AOBASIS   BASIS     P2S    ABASIS      S 
                                         1400     1410     1420     1200     1210     1080     1600     1650     1300     1700   
                                         EKIN       V       ECP      H0       H01     AOSYM     SMH    MOLCAS    ERIS     OPER   

              2       4        2.75       700     1000      520     4202   
                                         GEOM     BASIS   MCVARS     RHF  

 PROGRAMS   *        TOTAL       RHF       INT
 CPU TIMES  *         2.20      0.04      2.04
 REAL TIME  *        18.46 SEC
 DISK USED  *        23.83 MB      
 **********************************************************************************************************************************


 PROGRAM * MULTI (Direct Multiconfiguration SCF)       Authors: P.J. Knowles, H.-J. Werner (1984)     S.T. Elbert (1988)


 Number of closed-shell orbitals:   1 (   1   0   0   0   0   0   0   0 )
 Number of active  orbitals:        3 (   0   1   1   0   1   0   0   0 )
 Number of external orbitals:      18 (   6   2   2   2   2   2   2   0 )

 State symmetry 1

 Number of electrons:     2    Spin symmetry=Triplet   Space symmetry=4
 Number of states:        1
 Number of CSFs:          1   (1 determinants, 3 intermediate states)

 State symmetry 2

 Number of electrons:     2    Spin symmetry=Triplet   Space symmetry=6
 Number of states:        1
 Number of CSFs:          1   (1 determinants, 3 intermediate states)

 State symmetry 3

 Number of electrons:     2    Spin symmetry=Triplet   Space symmetry=7
 Number of states:        1
 Number of CSFs:          1   (1 determinants, 3 intermediate states)

 Molecular orbitals read from record     4202.2  Type=RHF/CANONICAL (state 1.4)
 *** IN SYMMETRY 1 ORBITAL  1 SYMMETRY CONTAMINATION OF 0.541D-02 HAS BEEN REMOVED

 EXTRA SYMMETRY OF MOS IN SYMMETRY 1:   1 1 3 2 1 3 2

 Wavefunction dump at record             5202.2

 Convergence thresholds  0.10E-01 (gradient)  0.10E-05 (energy)  0.10E-02 (step length)

 Weight factors for state symmetry  1:    0.33333
 Weight factors for state symmetry  2:    0.33333
 Weight factors for state symmetry  3:    0.33333

 Number of orbital rotations:       12   (     0 Core/Active      6 Core/Virtual   0 Active/Active      6 Active/Virtual)
 Total number of variables:         15


 ITER. MIC  NCI  NEG     ENERGY(VAR)     ENERGY(PROJ)   ENERGY CHANGE     GRAD(0)  GRAD(ORB)   GRAD(CI)     STEP       TIME

   1   27   12    0      -5.28704511      -5.32902789   -0.04198278    0.11265880 0.00000000 0.00000000  0.40D+00      0.02
   2   15   12    0      -5.32889199      -5.32895963   -0.00006764    0.00948867 0.00000000 0.00000000  0.11D-01      0.02
   3   15   12    0      -5.32895973      -5.32895973   -0.00000000    0.00001999 0.00000000 0.00000000  0.22D-04      0.02

 ** WVFN ****  CONVERGENCE REACHED, FINAL GRADIENT:  0.97D-10



 Results for state 1.4
 =====================

 !MCSCF STATE 1.4 Energy               -5.328959728873
 Nuclear energy                         0.00000000
 Kinetic energy                         3.31094880
 One electron energy                   -8.37999028
 Two electron energy                    3.05103055
 Virial ratio                           2.60949627

 !MCSCF STATE 1.4 Dipole moment         0.00000000     0.00000000     0.00000000
 Dipole moment /Debye                   0.00000000     0.00000000     0.00000000



 Results for state 1.6
 =====================

 !MCSCF STATE 1.6 Energy               -5.328959728873
 Nuclear energy                         0.00000000
 Kinetic energy                         3.31094880
 One electron energy                   -8.37999028
 Two electron energy                    3.05103055
 Virial ratio                           2.60949627

 !MCSCF STATE 1.6 Dipole moment         0.00000000     0.00000000     0.00000000
 Dipole moment /Debye                   0.00000000     0.00000000     0.00000000



 Results for state 1.7
 =====================

 !MCSCF STATE 1.7 Energy               -5.328959728873
 Nuclear energy                         0.00000000
 Kinetic energy                         3.31094880
 One electron energy                   -8.37999028
 Two electron energy                    3.05103055
 Virial ratio                           2.60949627

 !MCSCF STATE 1.7 Dipole moment         0.00000000     0.00000000     0.00000000
 Dipole moment /Debye                   0.00000000     0.00000000     0.00000000

 State-averaged charge density matrix saved on record  5202.2 (density set 1)

 !MCSCF expec        <1.4|EKIN|1.4>     3.310948799791
 !MCSCF expec        <1.6|EKIN|1.6>     3.310948799637
 !MCSCF expec        <1.7|EKIN|1.7>     3.310948799637

 !MCSCF expec         <1.4|POT|1.4>    -3.134105279000
 !MCSCF expec         <1.6|POT|1.6>    -3.134105278949
 !MCSCF expec         <1.7|POT|1.7>    -3.134105278949


 NATURAL ORBITALS (state averaged)
 =================================

   Orb     Occ        Energy       Coefficients

                                   1 1s      1 1s      1 1s      1 3d0     1 3d2+    1 3d0     1 3d2+ 

   1.1  2.00000    -0.705697     0.999994  0.000009 -0.000004  0.000000  0.000000  0.000000  0.000000

                                   1 2px     1 2px     1 2px  

   1.2  0.66667    -0.058034     1.000005 -0.000011  0.000007

                                   1 2py     1 2py     1 2py  

   1.3  0.66667    -0.058034     1.000005 -0.000011  0.000007

                                   1 2pz     1 2pz     1 2pz  

   1.5  0.66667    -0.058034     1.000005 -0.000011  0.000007
 

 EXTRA SYMMETRY OF MOS IN SYMMETRY 1:   1 1 2 3 1 3 2

 Natural orbital dump (state averaged) at molpro section  5202.2    (Orbital set 2)


 CI vector for state symmetry 1
 ==============================

 a a 0           1.0000000

 TOTAL ENERGIES                        -5.32895973

 CI vector for state symmetry 2
 ==============================

 a 0 a           1.0000000

 TOTAL ENERGIES                        -5.32895973

 CI vector for state symmetry 3
 ==============================

 0 a a           1.0000000

 TOTAL ENERGIES                        -5.32895973



 **********************************************************************************************************************************
 DATASETS  * FILE   NREC   LENGTH (MB)   RECORD NAMES
              1      21       19.13       500      610      700      900      950      970     1000      129      960     1100   
                                          VAR    BASINP    GEOM    SYMINP    ZMAT    AOBASIS   BASIS     P2S    ABASIS      S 
                                         1400     1410     1420     1200     1210     1080     1600     1650     1300     1700   
                                         EKIN       V       ECP      H0       H01     AOSYM     SMH    MOLCAS    ERIS     OPER   
                                         1380   
                                         JKOP   

              2       5        5.24       700     1000      520     4202     5202   
                                         GEOM     BASIS   MCVARS     RHF     MCSCF   

 PROGRAMS   *        TOTAL     MULTI       RHF       INT
 CPU TIMES  *         2.22      0.02      0.04      2.04
 REAL TIME  *        19.45 SEC
 DISK USED  *        33.51 MB      
 **********************************************************************************************************************************


 PROGRAM * RHF-SCF (OPEN SHELL)       Authors: W. Meyer, H.-J. Werner


 NUMBER OF ELECTRONS:       3+    1-    SPACE SYMMETRY=4    SPIN SYMMETRY: Triplet 
 CONVERGENCE THRESHOLDS:    1.00E-05 (Density)    1.00E-07 (Energy)
 MAX. NUMBER OF ITERATIONS:        0
 INTERPOLATION TYPE:            DIIS
 INTERPOLATION STEPS:              2 (START)      1 (STEP)
 LEVEL SHIFTS:                 -0.60 (CLOSED) -0.30 (OPEN) 


 Singly occupied orbitals:      1.2       1.3
 Molecular orbitals read from record     5202.2  Type=MCSCF/NATURAL (state averaged)

 Molecular orbital dump at record        2101.2

 ITERATION    DDIFF          GRAD             ENERGY        2-EL.EN.            DIPOLE MOMENTS         DIIS   ORB.
    1      0.000D+00      0.000D+00        -5.32895973      6.102061    0.00000    0.00000    0.00000    0    start

 Final alpha occupancy:   1   1   1   0   0   0   0
 Final beta  occupancy:   1   0   0   0   0   0   0

 !RHF STATE 1.4 Energy                 -5.328959728873
 Nuclear energy                         0.00000000
 One-electron energy                   -8.37999028
 Two-electron energy                    3.05103055
 Virial quotient                       -1.60949627
 !RHF STATE 1.4 Dipole moment           0.00000000     0.00000000     0.00000000
 Dipole moment /Debye                   0.00000000     0.00000000     0.00000000
 

 !RHF expec          <1.4|EKIN|1.4>     3.310948799791
 
 !RHF expec           <1.4|POT|1.4>    -3.134105279000

 ELECTRON ORBITALS
 =================


   Orb  Occ    Energy  Couls-En    Coefficients

                                   1 1s      1 1s      1 1s      1 3d0     1 3d2+    1 3d0     1 3d2+ 

   1.1   2    -0.7057   -2.9800  0.999994  0.000009 -0.000004  0.000000  0.000000  0.000000  0.000000

                                   1 2px     1 2px     1 2px  

   1.2   +    -0.0580   -1.9737  1.000005 -0.000011  0.000007

                                   1 2py     1 2py     1 2py  

   1.3   +    -0.0580   -1.9737  1.000005 -0.000011  0.000007

 HOMO      1.2    -0.058034 =      -1.5792eV
 LUMO      1.5    -0.058034 =      -1.5792eV
 LUMO-HOMO        -0.000000 =      -0.0000eV


 **********************************************************************************************************************************
 DATASETS  * FILE   NREC   LENGTH (MB)   RECORD NAMES
              1      21       19.13       500      610      700      900      950      970     1000      129      960     1100   
                                          VAR    BASINP    GEOM    SYMINP    ZMAT    AOBASIS   BASIS     P2S    ABASIS      S 
                                         1400     1410     1420     1200     1210     1080     1600     1650     1300     1700   
                                         EKIN       V       ECP      H0       H01     AOSYM     SMH    MOLCAS    ERIS     OPER   
                                         1380   
                                         JKOP   

              2       6        7.74       700     1000      520     4202     5202     2101   
                                         GEOM     BASIS   MCVARS     RHF     MCSCF     RHF  

 PROGRAMS   *        TOTAL       RHF     MULTI       RHF       INT
 CPU TIMES  *         2.24      0.00      0.02      0.04      2.04
 REAL TIME  *        19.54 SEC
 DISK USED  *        33.51 MB      
 **********************************************************************************************************************************
 SETTING SCF(I)         =        -5.32895973  AU                              
 SETTING _CC_NORM_MAX   =         2.00000000                                  


 PROGRAM * UHF-SCF       Authors: W. Meyer, H.-J. Werner


 NUMBER OF ELECTRONS:       3+    1-    SPACE SYMMETRY=4    SPIN SYMMETRY: Triplet 
 CONVERGENCE THRESHOLDS:    1.00E-05 (Density)    1.00E-07 (Energy)
 MAX. NUMBER OF ITERATIONS:        0
 INTERPOLATION TYPE:            DIIS
 INTERPOLATION STEPS:              2 (START)      1 (STEP)
 LEVEL SHIFTS:                  0.20 (ALPHA)   0.20 (BETA) 



 Molecular orbitals read from record     2101.2  Type=RHF/CANONICAL (state 1.4)

 Molecular orbital dump at record        2200.2

 Initial alpha occupation   1   1   1   0   0   0   0
 Initial beta  occupation   1   0   0   0   0   0   0

 ITERATION    DDIFF          GRAD             ENERGY        2-EL.EN.            DIPOLE MOMENTS         DIIS
    1      0.000D+00      0.000D+00        -5.32895973      6.102061    0.00000    0.00000    0.00000    0
 
 Final alpha occupancy:   1   1   1   0   0   0   0
 Final beta  occupancy:   1   0   0   0   0   0   0

 !UHF STATE 1.4 Energy                 -5.328959728873
 Nuclear energy                         0.00000000
 One-electron energy                   -8.37999028
 Two-electron energy                    3.05103055
 Virial quotient                       -1.60949627
 !UHF STATE 1.4 Dipole moment           0.00000000     0.00000000     0.00000000
 Dipole moment /Debye                   0.00000000     0.00000000     0.00000000
 

 !UHF expec          <1.4|EKIN|1.4>     3.310948799791
 
 !UHF expec           <1.4|POT|1.4>    -3.134105279000

 ELECTRON ORBITALS FOR POSITIVE SPIN
 ===================================


   Orb  Occ    Energy  Couls-En    Coefficients

                                   1 1s      1 1s      1 1s      1 3d0     1 3d2+    1 3d0     1 3d2+ 

   1.1   +    -0.7057   -2.9800  0.999994  0.000009 -0.000004  0.000000  0.000000  0.000000  0.000000

                                   1 2px     1 2px     1 2px  

   1.2   +    -0.0580   -1.9737  1.000005 -0.000011  0.000007

                                   1 2py     1 2py     1 2py  

   1.3   +    -0.0580   -1.9737  1.000005 -0.000011  0.000007

 ELECTRON ORBITALS FOR NEGATIVE SPIN
 ===================================


   Orb  Occ    Energy  Couls-En    Coefficients

                                   1 1s      1 1s      1 1s      1 3d0     1 3d2+    1 3d0     1 3d2+ 

   1.1   -    -0.7057   -2.9800  0.999994  0.000009 -0.000004  0.000000  0.000000  0.000000  0.000000

 HOMO      1.2    -0.058034 =      -1.5792eV
 LUMO      1.5    -0.058034 =      -1.5792eV
 LUMO-HOMO        -0.000000 =      -0.0000eV

 EXPECTATION VALUE OF S**2:             2.00000000

 Occupation number threshold for canonical orbitals:  1.999000 (occupied),  0.001000 (virtual)

 Number of pseudo-canonical orbitals per symmetry:    1   0   0   0   0   0   0
 Number of active natural orbitals per symmetry:      0   1   1   0   0   0   0

 NATURAL CHARGE ORBITALS
 =======================


   Orb     Occ        Energy       Coefficients

                                   1 1s      1 1s      1 1s      1 3d0     1 3d2+    1 3d0     1 3d2+ 

   1.1  2.00000    -0.705697     0.999994  0.000009 -0.000004  0.000000  0.000000  0.000000  0.000000

                                   1 2px     1 2px     1 2px  

   1.2  1.00000    -0.129884     1.000005 -0.000011  0.000007

                                   1 2py     1 2py     1 2py  

   1.3  1.00000    -0.129884     1.000005 -0.000011  0.000007

 Natural orbitals saved to record    2200.2 (Orbital set 3)

 Orbital spaces for UNO-CAS (Min. occupation: 0.020  Max. occupation: 1.980):

 Closed:        1   0   0   0   0   0   0
 Active:        0   1   1   0   0   0   0

 No convergence



 **********************************************************************************************************************************
 DATASETS  * FILE   NREC   LENGTH (MB)   RECORD NAMES
              1      21       19.13       500      610      700      900      950      970     1000      129      960     1100   
                                          VAR    BASINP    GEOM    SYMINP    ZMAT    AOBASIS   BASIS     P2S    ABASIS      S 
                                         1400     1410     1420     1200     1210     1080     1600     1650     1300     1700   
                                         EKIN       V       ECP      H0       H01     AOSYM     SMH    MOLCAS    ERIS     OPER   
                                         1380   
                                         JKOP   

              2       7       10.24       700     1000      520     4202     5202     2101     2200   
                                         GEOM     BASIS   MCVARS     RHF     MCSCF     RHF      UHF  

 PROGRAMS   *        TOTAL       UHF       RHF     MULTI       RHF       INT
 CPU TIMES  *         2.26      0.00      0.00      0.02      0.04      2.04
 REAL TIME  *        19.72 SEC
 DISK USED  *        33.51 MB      
 **********************************************************************************************************************************
 SETTING SCF(I)         =        -5.32895973  AU                              


 PROGRAM * MRCC (General Multireference Coupled Cluster)    Author: M. Kallay, 2000-2005

 ***  Initialisation ***

   0 Spin projections
 
 Molecular orbitals read from record     2200.2  Type=UHF/ALPHA (state 1.4)

 ?Warning: UHF not converged
 Molecular orbitals read from record     2200.2  Type=UHF/BETA (state 1.4)

 ?Warning: UHF not converged
 
 Frozen orbitals:              0 (  0  0  0  0  0  0  0  0)
 Active orbitals:             22 (  7  3  3  2  3  2  2  0)
 Active electrons:             4
 Spin quantum number:          1.0

 Transformed integrals will be written to file mrcc_4396/fort.55

 Load integrals                2.3 sec
 Transform integrals           2.3 sec
 Storage for integrals:          28961
 Remaining memory:           *********

 Core energy:               0.00000000
 
 MRCC Input:
     4     0     0     0     3     0     0     4     0     0     0     1     1     0     0     7     0     0   0.000     0   64000
  ex.lev,nsing,ntrip, rest,method,dens,conver,symm, diag, CS ,spatial, HF, ndoub,nacto,nactv, tol, maxex, sacc, freq,  dboc,   mem
  2  0  0  0  0  0  0  1  0  0  1  0  0  0  0  0  0  0  0  0  0  0
 MRCC Input end
 Variable memory released
 MRCC now being run, temporary output in /global/cscratch1/sd/aannabe/mrcc_4396/mrcc.out
 **********************************************************************
                          MRCC program system
 **********************************************************************

                              Written by
  Mihaly Kallay, Zoltan Rolik, Jozsef Csontos, Peter Nagy, Gyula Samu,
      David Mester, Jozsef Csoka, Bernat Szabo, Istvan Ladjanszki,
       Lorant Szegedy, Bence Ladoczki, Klara Petrov, Mate Farkas,
                    Pal D. Mezei, and Bence Hegely

        Department of Physical Chemistry and Materials Science
            Budapest University of Technology and Economics
                  Budapest P.O.Box 91, H-1521 Hungary

                              www.mrcc.hu

                       Release date: May 23, 2018

 ************************ 2018-11-05 11:21:38 *************************
 Executing goldstone...

 Generation of CC equations in terms of H and T...
 Generation of antisymmetrized Goldstone diagrams...
 Number of diagrams in T^1 equations:    15
 Number of diagrams in T^2 equations:    38
 Number of diagrams in T^3 equations:    49
 Number of diagrams in T^4 equations:     5
 Translation of diagrams to factorized equations...
 Optimizing intermediate calculation...
 Number of floating-point operations per iteration step:   1.0061E+07
 Probable CPU time per iteration step (hours):      0.00
 Required memory (Mbytes):      21.3
 Number of intermediates:                                  80
 Number of intermediates to be stored:                     32
 Length of intermediate file (Mbytes):       0.5

 ************************ 2018-11-05 11:21:38 *************************
 Executing xmrcc...

 **********************************************************************
 CC(3)(4) calculation


 Allocation of 100.0 Mbytes of memory...
 Number of spinorbitals:                    44
 Number of alpha electrons:                        3
 Number of beta electrons:                         1
 Spin multiplicity:                     2
 z-component of spin:  1.0
 Spatial symmetry:                      4
 Convergence criterion:  1.0E-07
 Construction of occupation graphs...
 Number of                     0 -fold excitations:                      1
 Number of                     1 -fold excitations:                     16
 Number of                     2 -fold excitations:                    237
 Number of                     3 -fold excitations:                   1446
 Total number of configurations:                   1700
 Calculation of coupling coefficients...
 Length of intermediate file (Mbytes):       0.7

 ======================================================================

 Spin case  1   Alpha:  3   Beta:  1
 Number of excitations:                   2524
 Number of                     4 -fold excitations:                   2524

 Memory requirements /Mbyte/:
               Minimal        Optimal
 Real*8:         13.8830        13.8869
 Integer:         3.7478
 Total:          17.6308        17.6347


 ************************ 2018-11-05 11:21:39 *************************
 Executing mrcc...

 **********************************************************************
 CCSDT(Q) calculation


 Allocation of   13.9 Mbytes of memory...
 Number of spinorbitals:  44
 Number of alpha electrons:  3
 Number of beta  electrons:  1
 Spin multiplicity: 2
 z-component of spin:  1.0
 Spatial symmetry: 4
 Convergence criterion:  1.0E-07
 Construction of occupation graphs...
 Number of 0-fold excitations: 1
 Number of 1-fold excitations: 16
 Number of 2-fold excitations: 237
 Number of 3-fold excitations: 1446
 Total number of determinants: 1700
 Calculation of coupling coefficients...
 Initial cluster amplitudes are generated.
 Length of intermediate file (Mbytes):       0.7
 Reading integral list from unit 55...
 Sorting integrals...
 Sorting integrals...
 Sorting integrals...
 Sorting integrals...
 Energy of reference determinant [au]:      -5.328959728873
 Calculation of MP denominators...

 Starting CC iteration...
 ======================================================================
 Norm of residual vector:     0.38854419
 CPU time [min]:     0.004                   Wall time [min]:     0.005

 Iteration  1  CC energy:    -5.38950572  Energy decrease:   0.06054599
 ======================================================================
 Norm of residual vector:     0.11288170
 CPU time [min]:     0.005                   Wall time [min]:     0.006

 Iteration  2  CC energy:    -5.40960424  Energy decrease:   0.02009852
 ======================================================================
 Norm of residual vector:     0.03171786
 CPU time [min]:     0.006                   Wall time [min]:     0.007

 Iteration  3  CC energy:    -5.41301843  Energy decrease:   0.00341419
 ======================================================================
 Norm of residual vector:     0.00817211
 CPU time [min]:     0.007                   Wall time [min]:     0.008

 Iteration  4  CC energy:    -5.41362302  Energy decrease:   0.00060459
 ======================================================================
 Norm of residual vector:     0.00238022
 CPU time [min]:     0.009                   Wall time [min]:     0.010

 Iteration  5  CC energy:    -5.41360138  Energy decrease:   0.00002164
 ======================================================================
 Norm of residual vector:     0.00069274
 CPU time [min]:     0.010                   Wall time [min]:     0.011

 Iteration  6  CC energy:    -5.41358684  Energy decrease:   0.00001454
 ======================================================================
 Norm of residual vector:     0.00019915
 CPU time [min]:     0.011                   Wall time [min]:     0.012

 Iteration  7  CC energy:    -5.41359673  Energy decrease:   0.00000989
 ======================================================================
 Norm of residual vector:     0.00006626
 CPU time [min]:     0.013                   Wall time [min]:     0.014

 Iteration  8  CC energy:    -5.41359583  Energy decrease:   0.00000090
 ======================================================================
 Norm of residual vector:     0.00002300
 CPU time [min]:     0.014                   Wall time [min]:     0.015

 Iteration  9  CC energy:    -5.41359527  Energy decrease:   0.00000056
 ======================================================================
 Norm of residual vector:     0.00000620
 CPU time [min]:     0.015                   Wall time [min]:     0.016

 Iteration 10  CC energy:    -5.41359554  Energy decrease:   0.00000027
 ======================================================================
 Norm of residual vector:     0.00000189
 CPU time [min]:     0.017                   Wall time [min]:     0.018

 Iteration 11  CC energy:    -5.41359550  Energy decrease:   0.00000004
 ======================================================================
 Norm of residual vector:     0.00000061
 CPU time [min]:     0.018                   Wall time [min]:     0.019

 Iteration 12  CC energy:    -5.41359550  Energy decrease:   0.00000001
 ======================================================================
 Norm of residual vector:     0.00000020
 CPU time [min]:     0.019                   Wall time [min]:     0.020

 Iteration 13  CC energy:    -5.41359550  Energy decrease:   0.00000001
 ======================================================================
 Norm of residual vector:     0.00000006
 CPU time [min]:     0.020                   Wall time [min]:     0.021

 Iteration 14  CC energy:    -5.41359550  Energy decrease:   1.1790E-09
 ======================================================================

 Iteration has converged in 14 steps.

 Final results:
 Total CCSDT energy [au]:             -5.413595502632
 Total MP2 energy [au]:               -5.389505719811

 Perturbative corrections are calculated...
 ======================================================================
 Spin case  1   Alpha:  3   Beta:  1
 Number of excitations:        2524
 CPU time [min]:     0.031                   Wall time [min]:     0.032
 ======================================================================
 Number of 4-fold excitations: 2524
 CPU time [min]:     0.031                   Wall time [min]:     0.032

 Total CCSDT[Q] energy [au]:          -5.413614385895
 Total CCSDT(Q) energy [au]:          -5.413624848690

 ************************ 2018-11-05 11:21:42 *************************
                      Normal termination of mrcc.
 **********************************************************************
 !CCSDT STATE 1.4 Energy               -5.413595502632
 !MP2 STATE 1.4 Energy                 -5.389505719811
 !CCSDT[Q] STATE 1.4 Energy            -5.413614385895
 !CCSDT(Q) STATE 1.4 Energy            -5.413624848690
 
 CPU-time for MRCC:              1.9 sec
 Elapsed-time for MRCC:          7.4 sec

 Variable memory set to 8000000000 words,  buffer space   230000 words



 **********************************************************************************************************************************
 DATASETS  * FILE   NREC   LENGTH (MB)   RECORD NAMES
              1      21       19.13       500      610      700      900      950      970     1000      129      960     1100   
                                          VAR    BASINP    GEOM    SYMINP    ZMAT    AOBASIS   BASIS     P2S    ABASIS      S 
                                         1400     1410     1420     1200     1210     1080     1600     1650     1300     1700   
                                         EKIN       V       ECP      H0       H01     AOSYM     SMH    MOLCAS    ERIS     OPER   
                                         1380   
                                         JKOP   

              2       7       10.24       700     1000      520     4202     5202     2101     2200   
                                         GEOM     BASIS   MCVARS     RHF     MCSCF     RHF      UHF  

 PROGRAMS   *        TOTAL      MRCC       UHF       RHF     MULTI       RHF       INT
 CPU TIMES  *         4.17      1.92      0.00      0.00      0.02      0.04      2.04
 REAL TIME  *        27.60 SEC
 DISK USED  *        33.51 MB      
 **********************************************************************************************************************************
 SETTING POSTHF(I)      =        -5.41362485  AU                              
                                                                                                                                                                                                                                                                

       SCF           POSTHF       EKIN          POT
    -5.32895973   -5.41362485   3.31094880   -3.13410528
                                                  

 CCSDT(Q)/USERDEF energy=     -5.413624848690

        CCSDT(Q)        RHF-SCF         MULTI           RHF-SCF 
     -5.41362485     -5.32895973     -5.32895973     -5.32901824
 **********************************************************************************************************************************
 Variable memory released
