
 Primary working directories    : /global/cscratch1/sd/aannabe
 Secondary working directories  : /global/cscratch1/sd/aannabe
 Wavefunction directory         : /global/homes/a/aannabe/wfu/
 Main file repository           : /global/cscratch1/sd/aannabe/

 SHA1      : 2873118e99aab1bc19f5b6fc1784693c06d15c95
 NAME      : 2015.1.8
 ARCHNAME  : linux/x86_64
 FC        : /opt/cray/pe/craype/2.5.5/bin/ftn
 BLASLIB   : -Wl,-_start-group /opt/intel/compilers_and_libraries_2016.3.210/linux/mkl/lib/intel64/libmkl_intel_ilp64.a /opt/intel/compilers_and_libraries_2016.3.210/linux/mkl/lib/intel64/libmkl_intel_thread.a /opt/intel/compilers_and_libraries_2016.3.210/linux/mkl/lib/intel64/libmkl_core.a -Wl,-_end-group
 id        : lbl

 Nodes     nprocs
 nid00510     1

 Using customized tuning parameters: mindgm=8; mindgv=16; mindgc=4; mindgr=1; noblas=0; minvec=7
 default implementation of scratch files=df  

 ***,C
 memory,8,g
 gthresh,twoint=1.e-12
 
 gprint,basis,orbitals
 gexpec,ekin,pot
 
 angstrom
 geometry={
 1                                                                               ! Number of atoms
 C 0.0 0.0 0.0
 }
 
 basis={
 Including file /global/homes/a/aannabe/docs/accurate/BFD_Kh/pps/C.pp
 Including file /global/homes/a/aannabe/docs/accurate/BFD_Kh/basis/aug-cc-pVnZ/C_tz.basis
 }
 
 {rhf
  start,atden
  wf,4,4,2
  occ,1,1,1,0,0,0,0,0
  open,1.2,1.3
  save,4202.2
 }
 {multi
  start,4202.2
  occ,1,1,1,0,1,0,0
  closed,1,0,0,0,0,0,0,0
  wf,4,4,2;state,1
  wf,4,6,2;state,1
  wf,4,7,2;state,1
  natorb,ci,print
  orbital,5202.2
 }
 {rhf,nitord=1,maxit=0
  start,5202.2
  wf,4,4,2
  occ,1,1,1,0,0,0,0,0
  open,1.2,1.3
 }
 scf(i)=energy
 
 _CC_NORM_MAX=2.0
  !NOTE: Perturbative MRCC works only with UHF reference. So, here we will trick MRCC by doing zero UHF iteration right after ROHF.
 
 {uhf
 maxit,0
 }
 scf(i)=energy
 
 {mrcc,method=CCSDT(Q)
 orbital,ignore_error=1                                                          !Ignore the fact that UHF WF is not converged
 maxit,100
 core
 }
 posthf(i)=energy
 
 table,scf,posthf,ekin,pot
 save,3.csv,new
 
 

 Variables initialized (889), CPU time= 0.00 sec
 Commands  initialized (702), CPU time= 0.02 sec, 572 directives.
 Default parameters read. Elapsed time= 0.15 sec

 Checking input...
 Passed
1


                                         ***  PROGRAM SYSTEM MOLPRO  ***
                                       Copyright, TTI GmbH Stuttgart, 2015
                                    Version 2015.1 linked Sep  7 2016 23:09:38


 **********************************************************************************************************************************
 LABEL *   C                                                                             
  64 bit serial version                                                                  DATE: 05-Nov-18          TIME: 11:22:01  
 **********************************************************************************************************************************

 SHA1:             2873118e99aab1bc19f5b6fc1784693c06d15c95
 **********************************************************************************************************************************

 THRESHOLDS:

 ZERO    =  1.00D-12  ONEINT  =  1.00D-12  TWOINT  =  1.00D-12  PREFAC  =  1.00D-14  LOCALI  =  1.00D-09  EORDER  =  1.00D-04
 ENERGY  =  0.00D+00  ETEST   =  0.00D+00  EDENS   =  0.00D+00  THRDEDEF=  1.00D-06  GRADIENT=  1.00D-02  STEP    =  1.00D-03
 ORBITAL =  1.00D-05  CIVEC   =  1.00D-05  COEFF   =  1.00D-04  PRINTCI =  5.00D-02  PUNCHCI =  9.90D+01  OPTGRAD =  3.00D-04
 OPTENERG=  1.00D-06  OPTSTEP =  3.00D-04  THRGRAD =  1.00D-10  COMPRESS=  1.00D-11  VARMIN  =  1.00D-07  VARMAX  =  1.00D-03
 THRDOUB =  0.00D+00  THRDIV  =  1.00D-05  THRRED  =  1.00D-07  THRPSP  =  1.00D+00  THRDC   =  1.00D-10  THRCS   =  1.00D-10
 THRNRM  =  1.00D-08  THREQ   =  0.00D+00  THRDE   =  1.00D+00  THRREF  =  1.00D-05  SPARFAC =  1.00D+00  THRDLP  =  1.00D-07
 THRDIA  =  1.00D-10  THRDLS  =  1.00D-07  THRGPS  =  0.00D+00  THRKEX  =  0.00D+00  THRDIS  =  2.00D-01  THRVAR  =  1.00D-10
 THRLOC  =  1.00D-06  THRGAP  =  1.00D-06  THRLOCT = -1.00D+00  THRGAPT = -1.00D+00  THRORB  =  1.00D-06  THRMLTP =  0.00D+00
 THRCPQCI=  1.00D-10  KEXTA   =  0.00D+00  THRCOARS=  0.00D+00  SYMTOL  =  1.00D-06  GRADTOL =  1.00D-06  THROVL  =  1.00D-08
 THRORTH =  1.00D-08  GRID    =  1.00D-06  GRIDMAX =  1.00D-03  DTMAX   =  0.00D+00  THROCCDE=  1.00D-01  THROCCDE=  1.00D-01



 ZUNIT=ANG
 

Geometry recognized as XYZ


 Variable memory set to 8000000000 words,  buffer space   230000 words

 SETTING BASIS          =    USERDEF


 Recomputing integrals since basis changed


 Using spherical harmonics



 PROGRAM * SEWARD (Integral evaluation for generally contracted gaussian basis sets)     Author: Roland Lindh, 1990

 Geometry written to block  1 of record 700

 Orientation using atomic masses  
 Molecule type: Atom
 Symmetry elements: X,Y,Z
 Rotational constants:       0.0000000      0.0000000      0.0000000 GHz  (calculated with average atomic masses)

 Point group  D2h 



 ATOMIC COORDINATES

 NR  ATOM    CHARGE       X              Y              Z

   1  C       4.00    0.000000000    0.000000000    0.000000000


          C   CORE POTENTIAL

          p POTENTIAL

 POWERS             1              3              2
 EXPONENTIALS   8.359738       4.483619       3.938313    
 COEFFICIENTS   4.000000       33.43895      -19.17537    

          s - p POTENTIAL

 POWERS             2
 EXPONENTIALS   5.029916    
 COEFFICIENTS   22.55164    


 BASIS DATA

   Nr Sym  Nuc  Type         Exponents   Contraction coefficients

    1.1 Ag    1  1s           0.051344     0.013991
                              0.102619     0.169852
                              0.205100     0.397529
                              0.409924     0.380369
                              0.819297     0.180113
                              1.637494    -0.033512
                              3.272791    -0.121499
                              6.541187     0.015176
                             13.073594    -0.000705
    2.1 Ag    1  1s           0.053120     1.000000
    3.1 Ag    1  1s           0.132800     1.000000
    4.1 Ag    1  1s           0.921552     1.000000
    5.1 Ag    1  3d0          0.131794     1.000000
    6.1 Ag    1  3d2+         0.131794     1.000000
    7.1 Ag    1  3d0          0.329486     1.000000
    8.1 Ag    1  3d2+         0.329486     1.000000
    9.1 Ag    1  3d0          1.141611     1.000000
   10.1 Ag    1  3d2+         1.141611     1.000000
    1.2 B3u   1  2px          0.029281     0.001787
                              0.058547     0.050426
                              0.117063     0.191634
                              0.234064     0.302667
                              0.468003     0.289868
                              0.935757     0.210979
                              1.871016     0.112024
                              3.741035     0.054425
                              7.480076     0.021931
    2.2 B3u   1  2px          0.050709     1.000000
    3.2 B3u   1  2px          0.126772     1.000000
    4.2 B3u   1  2px          0.376742     1.000000
    5.2 B3u   1  4f1+         0.309394     1.000000
    6.2 B3u   1  4f3+         0.309394     1.000000
    7.2 B3u   1  4f1+         0.773485     1.000000
    8.2 B3u   1  4f3+         0.773485     1.000000
    1.3 B2u   1  2py          0.029281     0.001787
                              0.058547     0.050426
                              0.117063     0.191634
                              0.234064     0.302667
                              0.468003     0.289868
                              0.935757     0.210979
                              1.871016     0.112024
                              3.741035     0.054425
                              7.480076     0.021931
    2.3 B2u   1  2py          0.050709     1.000000
    3.3 B2u   1  2py          0.126772     1.000000
    4.3 B2u   1  2py          0.376742     1.000000
    5.3 B2u   1  4f1-         0.309394     1.000000
    6.3 B2u   1  4f3-         0.309394     1.000000
    7.3 B2u   1  4f1-         0.773485     1.000000
    8.3 B2u   1  4f3-         0.773485     1.000000
    1.4 B1g   1  3d2-         0.131794     1.000000
    2.4 B1g   1  3d2-         0.329486     1.000000
    3.4 B1g   1  3d2-         1.141611     1.000000
    1.5 B1u   1  2pz          0.029281     0.001787
                              0.058547     0.050426
                              0.117063     0.191634
                              0.234064     0.302667
                              0.468003     0.289868
                              0.935757     0.210979
                              1.871016     0.112024
                              3.741035     0.054425
                              7.480076     0.021931
    2.5 B1u   1  2pz          0.050709     1.000000
    3.5 B1u   1  2pz          0.126772     1.000000
    4.5 B1u   1  2pz          0.376742     1.000000
    5.5 B1u   1  4f0          0.309394     1.000000
    6.5 B1u   1  4f2+         0.309394     1.000000
    7.5 B1u   1  4f0          0.773485     1.000000
    8.5 B1u   1  4f2+         0.773485     1.000000
    1.6 B2g   1  3d1+         0.131794     1.000000
    2.6 B2g   1  3d1+         0.329486     1.000000
    3.6 B2g   1  3d1+         1.141611     1.000000
    1.7 B3g   1  3d1-         0.131794     1.000000
    2.7 B3g   1  3d1-         0.329486     1.000000
    3.7 B3g   1  3d1-         1.141611     1.000000
    1.8 Au    1  4f2-         0.309394     1.000000
    2.8 Au    1  4f2-         0.773485     1.000000

 NUCLEAR CHARGE:                    4
 NUMBER OF PRIMITIVE AOS:          86
 NUMBER OF SYMMETRY AOS:           77
 NUMBER OF CONTRACTIONS:           45   (  10Ag  +   8B3u +   8B2u +   3B1g +   8B1u +   3B2g +   3B3g +   2Au  )
 NUMBER OF CORE ORBITALS:           0   (   0Ag  +   0B3u +   0B2u +   0B1g +   0B1u +   0B2g +   0B3g +   0Au  )
 NUMBER OF VALENCE ORBITALS:        4   (   1Ag  +   1B3u +   1B2u +   0B1g +   1B1u +   0B2g +   0B3g +   0Au  )


 NUCLEAR REPULSION ENERGY    0.00000000

 EXTRA SYMMETRY OF AOS IN SYMMETRY 1:   1 1 1 1 2 3 2 3 2 3
 EXTRA SYMMETRY OF AOS IN SYMMETRY 2:   1 1 1 1 2 3 2 3
 EXTRA SYMMETRY OF AOS IN SYMMETRY 3:   1 1 1 1 2 3 2 3
 EXTRA SYMMETRY OF AOS IN SYMMETRY 5:   1 1 1 1 2 3 2 3

 Eigenvalues of metric

         1 0.152E-01 0.150E+00 0.201E+00 0.201E+00 0.755E+00 0.831E+00 0.831E+00 0.197E+01
         2 0.372E-01 0.119E+00 0.367E+00 0.367E+00 0.810E+00 0.163E+01 0.163E+01 0.303E+01
         3 0.372E-01 0.119E+00 0.367E+00 0.367E+00 0.810E+00 0.163E+01 0.163E+01 0.303E+01
         4 0.201E+00 0.831E+00 0.197E+01
         5 0.372E-01 0.119E+00 0.367E+00 0.367E+00 0.810E+00 0.163E+01 0.163E+01 0.303E+01
         6 0.201E+00 0.831E+00 0.197E+01
         7 0.201E+00 0.831E+00 0.197E+01
         8 0.367E+00 0.163E+01


 Contracted 2-electron integrals neglected if value below      1.0D-12
 AO integral compression algorithm  1   Integral accuracy      1.0D-12

     1.049 MB (compressed) written to integral file ( 96.5%)


 NUMBER OF SORTED TWO-ELECTRON INTEGRALS:      75808.     BUFFER LENGTH:  32768
 NUMBER OF SEGMENTS:   1  SEGMENT LENGTH:      75808      RECORD LENGTH: 524288

 Memory used in sort:       0.63 MW

 SORT1 READ      155797. AND WROTE       61548. INTEGRALS IN      1 RECORDS. CPU TIME:     0.00 SEC, REAL TIME:     0.01 SEC
 SORT2 READ       61548. AND WROTE       75808. INTEGRALS IN      4 RECORDS. CPU TIME:     0.02 SEC, REAL TIME:     0.03 SEC

 FILE SIZES:   FILE 1:    20.2 MBYTE,  FILE 4:     4.2 MBYTE,   TOTAL:     24.4 MBYTE

 OPERATOR DM      FOR CENTER  0  COORDINATES:    0.000000    0.000000    0.000000
 OPERATOR EKIN    FOR CENTER  0  COORDINATES:    0.000000    0.000000    0.000000
 OPERATOR POT     FOR CENTER  0  COORDINATES:    0.000000    0.000000    0.000000


 **********************************************************************************************************************************
 DATASETS  * FILE   NREC   LENGTH (MB)   RECORD NAMES
              1      20       19.61       500      610      700      900      950      970     1000      129      960     1100   
                                          VAR    BASINP    GEOM    SYMINP    ZMAT    AOBASIS   BASIS     P2S    ABASIS      S 
                                         1400     1410     1420     1200     1210     1080     1600     1650     1300     1700   
                                         EKIN       V       ECP      H0       H01     AOSYM     SMH    MOLCAS    ERIS     OPER   

 PROGRAMS   *        TOTAL       INT
 CPU TIMES  *         2.32      2.19
 REAL TIME  *        13.73 SEC
 DISK USED  *        24.67 MB      
 **********************************************************************************************************************************


 PROGRAM * RHF-SCF (OPEN SHELL)       Authors: W. Meyer, H.-J. Werner


 NUMBER OF ELECTRONS:       3+    1-    SPACE SYMMETRY=4    SPIN SYMMETRY: Triplet 
 CONVERGENCE THRESHOLDS:    1.00E-05 (Density)    1.00E-07 (Energy)
 MAX. NUMBER OF ITERATIONS:       60
 INTERPOLATION TYPE:            DIIS
 INTERPOLATION STEPS:              2 (START)      1 (STEP)
 LEVEL SHIFTS:                 -0.60 (CLOSED) -0.30 (OPEN) 


 Singly occupied orbitals:      1.2       1.3

   Atom=C  basis=ECP2MWB_GUESS     lmin=0  lmax=1

 Orbital guess generated from atomic densities. Full valence occupancy:    1   1   1   0   1   0   0   0


 Molecular orbital dump at record        4202.2

 ITERATION    DDIFF          GRAD             ENERGY        2-EL.EN.            DIPOLE MOMENTS         DIIS   ORB.
    1      0.000D+00      0.000D+00        -5.29421061      5.554259    0.00000    0.00000    0.00000    0    start
    2      0.000D+00      0.227D-01        -5.32428478      5.924483    0.00000    0.00000    0.00000    1    diag,B
    3      0.284D-01      0.596D-02        -5.32830855      6.054557    0.00000    0.00000    0.00000    2    diag,B
    4      0.857D-02      0.218D-02        -5.32897296      6.094125    0.00000    0.00000    0.00000    3    diag,B
    5      0.345D-02      0.660D-03        -5.32902726      6.101053    0.00000    0.00000    0.00000    4    diag,B
    6      0.260D-02      0.773D-04        -5.32902783      6.101851    0.00000    0.00000    0.00000    5    diag,B
    7      0.149D-03      0.312D-04        -5.32902791      6.101676    0.00000    0.00000    0.00000    6    fixocc
    8      0.647D-04      0.568D-05        -5.32902791      6.101697    0.00000    0.00000    0.00000    7    diag,B
    9      0.117D-04      0.681D-06        -5.32902791      6.101708    0.00000    0.00000    0.00000    8    diag,B
   10      0.170D-05      0.202D-06        -5.32902791      6.101705    0.00000    0.00000    0.00000    0    orth

 Final alpha occupancy:   1   1   1   0   0   0   0   0
 Final beta  occupancy:   1   0   0   0   0   0   0   0

 !RHF STATE 1.4 Energy                 -5.329027909442
 Nuclear energy                         0.00000000
 One-electron energy                   -8.37988044
 Two-electron energy                    3.05085253
 Virial quotient                       -1.60958045
 !RHF STATE 1.4 Dipole moment           0.00000000     0.00000000     0.00000000
 Dipole moment /Debye                   0.00000000     0.00000000     0.00000000
 

 !RHF expec          <1.4|EKIN|1.4>     3.310817998052
 
 !RHF expec           <1.4|POT|1.4>    -3.134066559904

 ELECTRON ORBITALS
 =================


   Orb  Occ    Energy  Couls-En    Coefficients

                                   1 1s      1 1s      1 1s      1 1s      1 3d0     1 3d2+    1 3d0     1 3d2+    1 3d0     1 3d2+ 


   1.1   2    -0.7058   -2.9801  1.000057 -0.000032 -0.000072  0.000020 -0.004135  0.000000 -0.001629 -0.000000 -0.001194  0.000000

                                   1 2px     1 2px     1 2px     1 2px     1 4f1+    1 4f3+    1 4f1+    1 4f3+ 

   1.2   +    -0.4333   -2.3489  0.999930  0.000020  0.000072  0.000005 -0.000009  0.000000  0.000060 -0.000000

                                   1 2py     1 2py     1 2py     1 2py     1 4f1-    1 4f3-    1 4f1-    1 4f3- 

   1.3   +    -0.4333   -2.3489  0.999930  0.000020  0.000072  0.000005 -0.000009 -0.000000  0.000060  0.000000

 HOMO      1.2    -0.433336 =     -11.7917eV
 LUMO      1.5     0.014544 =       0.3958eV
 LUMO-HOMO         0.447880 =      12.1874eV


 **********************************************************************************************************************************
 DATASETS  * FILE   NREC   LENGTH (MB)   RECORD NAMES
              1      20       19.61       500      610      700      900      950      970     1000      129      960     1100   
                                          VAR    BASINP    GEOM    SYMINP    ZMAT    AOBASIS   BASIS     P2S    ABASIS      S 
                                         1400     1410     1420     1200     1210     1080     1600     1650     1300     1700   
                                         EKIN       V       ECP      H0       H01     AOSYM     SMH    MOLCAS    ERIS     OPER   

              2       4        2.76       700     1000      520     4202   
                                         GEOM     BASIS   MCVARS     RHF  

 PROGRAMS   *        TOTAL       RHF       INT
 CPU TIMES  *         2.36      0.03      2.19
 REAL TIME  *        13.93 SEC
 DISK USED  *        24.67 MB      
 **********************************************************************************************************************************


 PROGRAM * MULTI (Direct Multiconfiguration SCF)       Authors: P.J. Knowles, H.-J. Werner (1984)     S.T. Elbert (1988)


 Number of closed-shell orbitals:   1 (   1   0   0   0   0   0   0   0 )
 Number of active  orbitals:        3 (   0   1   1   0   1   0   0   0 )
 Number of external orbitals:      41 (   9   7   7   3   7   3   3   2 )

 State symmetry 1

 Number of electrons:     2    Spin symmetry=Triplet   Space symmetry=4
 Number of states:        1
 Number of CSFs:          1   (1 determinants, 3 intermediate states)

 State symmetry 2

 Number of electrons:     2    Spin symmetry=Triplet   Space symmetry=6
 Number of states:        1
 Number of CSFs:          1   (1 determinants, 3 intermediate states)

 State symmetry 3

 Number of electrons:     2    Spin symmetry=Triplet   Space symmetry=7
 Number of states:        1
 Number of CSFs:          1   (1 determinants, 3 intermediate states)

 Molecular orbitals read from record     4202.2  Type=RHF/CANONICAL (state 1.4)
 *** IN SYMMETRY 1 ORBITAL  1 SYMMETRY CONTAMINATION OF 0.691D-02 HAS BEEN REMOVED

 EXTRA SYMMETRY OF MOS IN SYMMETRY 1:   1 1 3 2 1 3 2 3 2 1
 *** IN SYMMETRY 2 ORBITAL  1 SYMMETRY CONTAMINATION OF 0.690D-04 HAS BEEN REMOVED
 EXTRA SYMMETRY OF MOS IN SYMMETRY 2:   1 1 1 2 3 1 2 3
 *** IN SYMMETRY 3 ORBITAL  1 SYMMETRY CONTAMINATION OF 0.690D-04 HAS BEEN REMOVED
 EXTRA SYMMETRY OF MOS IN SYMMETRY 3:   1 1 1 2 3 1 2 3
 *** IN SYMMETRY 5 ORBITAL  1 SYMMETRY CONTAMINATION OF 0.211D-02 HAS BEEN REMOVED
 EXTRA SYMMETRY OF MOS IN SYMMETRY 5:   1 1 1 2 3 1 2 3

 Wavefunction dump at record             5202.2

 Convergence thresholds  0.10E-01 (gradient)  0.10E-05 (energy)  0.10E-02 (step length)

 Weight factors for state symmetry  1:    0.33333
 Weight factors for state symmetry  2:    0.33333
 Weight factors for state symmetry  3:    0.33333

 Number of orbital rotations:       30   (     0 Core/Active      9 Core/Virtual   0 Active/Active     21 Active/Virtual)
 Total number of variables:         33


 ITER. MIC  NCI  NEG     ENERGY(VAR)     ENERGY(PROJ)   ENERGY CHANGE     GRAD(0)  GRAD(ORB)   GRAD(CI)     STEP       TIME

   1   29   12    0      -5.28189952      -5.32905029   -0.04715077    0.12219494 0.00000000 0.00000000  0.43D+00      0.01
   2   15   12    0      -5.32886952      -5.32895957   -0.00009005    0.01244057 0.00000000 0.00000000  0.12D-01      0.01
   3   15   12    0      -5.32895973      -5.32895973   -0.00000000    0.00003653 0.00000000 0.00000000  0.30D-04      0.02

 ** WVFN ****  CONVERGENCE REACHED, FINAL GRADIENT:  0.31D-09



 Results for state 1.4
 =====================

 !MCSCF STATE 1.4 Energy               -5.328959728949
 Nuclear energy                         0.00000000
 Kinetic energy                         3.31092724
 One electron energy                   -8.37998982
 Two electron energy                    3.05103009
 Virial ratio                           2.60950675

 !MCSCF STATE 1.4 Dipole moment         0.00000000     0.00000000     0.00000000
 Dipole moment /Debye                   0.00000000     0.00000000     0.00000000



 Results for state 1.6
 =====================

 !MCSCF STATE 1.6 Energy               -5.328959728949
 Nuclear energy                         0.00000000
 Kinetic energy                         3.31092724
 One electron energy                   -8.37998982
 Two electron energy                    3.05103009
 Virial ratio                           2.60950675

 !MCSCF STATE 1.6 Dipole moment         0.00000000     0.00000000     0.00000000
 Dipole moment /Debye                   0.00000000     0.00000000     0.00000000



 Results for state 1.7
 =====================

 !MCSCF STATE 1.7 Energy               -5.328959728949
 Nuclear energy                         0.00000000
 Kinetic energy                         3.31092724
 One electron energy                   -8.37998982
 Two electron energy                    3.05103009
 Virial ratio                           2.60950675

 !MCSCF STATE 1.7 Dipole moment         0.00000000     0.00000000     0.00000000
 Dipole moment /Debye                   0.00000000     0.00000000     0.00000000

 State-averaged charge density matrix saved on record  5202.2 (density set 1)

 !MCSCF expec        <1.4|EKIN|1.4>     3.310927239249
 !MCSCF expec        <1.6|EKIN|1.6>     3.310927238821
 !MCSCF expec        <1.7|EKIN|1.7>     3.310927238821

 !MCSCF expec         <1.4|POT|1.4>    -3.134100867110
 !MCSCF expec         <1.6|POT|1.6>    -3.134100866973
 !MCSCF expec         <1.7|POT|1.7>    -3.134100866973


 NATURAL ORBITALS (state averaged)
 =================================

   Orb     Occ        Energy       Coefficients

                                   1 1s      1 1s      1 1s      1 1s      1 3d0     1 3d2+    1 3d0     1 3d2+    1 3d0     1 3d2+ 


   1.1  2.00000    -0.705698     0.999993 -0.000006  0.000011  0.000001  0.000000  0.000000  0.000000  0.000000  0.000000  0.000000

                                   1 2px     1 2px     1 2px     1 2px     1 4f1+    1 4f3+    1 4f1+    1 4f3+ 

   1.2  0.66667    -0.058034     0.999987  0.000004 -0.000007  0.000017  0.000000  0.000000  0.000000  0.000000

                                   1 2py     1 2py     1 2py     1 2py     1 4f1-    1 4f3-    1 4f1-    1 4f3- 

   1.3  0.66667    -0.058034     0.999987  0.000004 -0.000007  0.000017  0.000000  0.000000  0.000000  0.000000

                                   1 2pz     1 2pz     1 2pz     1 2pz     1 4f0     1 4f2+    1 4f0     1 4f2+ 

   1.5  0.66667    -0.058034     0.999987  0.000004 -0.000007  0.000017  0.000000  0.000000  0.000000  0.000000
 

 EXTRA SYMMETRY OF MOS IN SYMMETRY 1:   1 1 2 3 1 3 2 2 3 1
 EXTRA SYMMETRY OF MOS IN SYMMETRY 2:   1 1 1 3 2 1 2 3
 EXTRA SYMMETRY OF MOS IN SYMMETRY 3:   1 1 1 3 2 1 2 3
 EXTRA SYMMETRY OF MOS IN SYMMETRY 5:   1 1 1 3 2 1 2 3

 Natural orbital dump (state averaged) at molpro section  5202.2    (Orbital set 2)


 CI vector for state symmetry 1
 ==============================

 a a 0           1.0000000

 TOTAL ENERGIES                        -5.32895973

 CI vector for state symmetry 2
 ==============================

 a 0 a           1.0000000

 TOTAL ENERGIES                        -5.32895973

 CI vector for state symmetry 3
 ==============================

 0 a a           1.0000000

 TOTAL ENERGIES                        -5.32895973



 **********************************************************************************************************************************
 DATASETS  * FILE   NREC   LENGTH (MB)   RECORD NAMES
              1      21       19.65       500      610      700      900      950      970     1000      129      960     1100   
                                          VAR    BASINP    GEOM    SYMINP    ZMAT    AOBASIS   BASIS     P2S    ABASIS      S 
                                         1400     1410     1420     1200     1210     1080     1600     1650     1300     1700   
                                         EKIN       V       ECP      H0       H01     AOSYM     SMH    MOLCAS    ERIS     OPER   
                                         1380   
                                         JKOP   

              2       5        5.26       700     1000      520     4202     5202   
                                         GEOM     BASIS   MCVARS     RHF     MCSCF   

 PROGRAMS   *        TOTAL     MULTI       RHF       INT
 CPU TIMES  *         2.40      0.04      0.03      2.19
 REAL TIME  *        14.75 SEC
 DISK USED  *        34.12 MB      
 **********************************************************************************************************************************


 PROGRAM * RHF-SCF (OPEN SHELL)       Authors: W. Meyer, H.-J. Werner


 NUMBER OF ELECTRONS:       3+    1-    SPACE SYMMETRY=4    SPIN SYMMETRY: Triplet 
 CONVERGENCE THRESHOLDS:    1.00E-05 (Density)    1.00E-07 (Energy)
 MAX. NUMBER OF ITERATIONS:        0
 INTERPOLATION TYPE:            DIIS
 INTERPOLATION STEPS:              2 (START)      1 (STEP)
 LEVEL SHIFTS:                 -0.60 (CLOSED) -0.30 (OPEN) 


 Singly occupied orbitals:      1.2       1.3
 Molecular orbitals read from record     5202.2  Type=MCSCF/NATURAL (state averaged)

 Molecular orbital dump at record        2101.2

 ITERATION    DDIFF          GRAD             ENERGY        2-EL.EN.            DIPOLE MOMENTS         DIIS   ORB.
    1      0.000D+00      0.000D+00        -5.32895973      6.102060    0.00000    0.00000    0.00000    0    start

 Final alpha occupancy:   1   1   1   0   0   0   0   0
 Final beta  occupancy:   1   0   0   0   0   0   0   0

 !RHF STATE 1.4 Energy                 -5.328959728949
 Nuclear energy                         0.00000000
 One-electron energy                   -8.37998982
 Two-electron energy                    3.05103009
 Virial quotient                       -1.60950675
 !RHF STATE 1.4 Dipole moment           0.00000000     0.00000000     0.00000000
 Dipole moment /Debye                   0.00000000     0.00000000     0.00000000
 

 !RHF expec          <1.4|EKIN|1.4>     3.310927239249
 
 !RHF expec           <1.4|POT|1.4>    -3.134100867110

 ELECTRON ORBITALS
 =================


   Orb  Occ    Energy  Couls-En    Coefficients

                                   1 1s      1 1s      1 1s      1 1s      1 3d0     1 3d2+    1 3d0     1 3d2+    1 3d0     1 3d2+ 


   1.1   2    -0.7057   -2.9800  0.999993 -0.000006  0.000011  0.000001  0.000000  0.000000  0.000000  0.000000  0.000000  0.000000

                                   1 2px     1 2px     1 2px     1 2px     1 4f1+    1 4f3+    1 4f1+    1 4f3+ 

   1.2   +    -0.0580   -1.9737  0.999987  0.000004 -0.000007  0.000017  0.000000  0.000000  0.000000  0.000000

                                   1 2py     1 2py     1 2py     1 2py     1 4f1-    1 4f3-    1 4f1-    1 4f3- 

   1.3   +    -0.0580   -1.9737  0.999987  0.000004 -0.000007  0.000017  0.000000  0.000000  0.000000  0.000000

 HOMO      1.2    -0.058034 =      -1.5792eV
 LUMO      1.5    -0.058034 =      -1.5792eV
 LUMO-HOMO        -0.000000 =      -0.0000eV


 **********************************************************************************************************************************
 DATASETS  * FILE   NREC   LENGTH (MB)   RECORD NAMES
              1      21       19.65       500      610      700      900      950      970     1000      129      960     1100   
                                          VAR    BASINP    GEOM    SYMINP    ZMAT    AOBASIS   BASIS     P2S    ABASIS      S 
                                         1400     1410     1420     1200     1210     1080     1600     1650     1300     1700   
                                         EKIN       V       ECP      H0       H01     AOSYM     SMH    MOLCAS    ERIS     OPER   
                                         1380   
                                         JKOP   

              2       6        7.77       700     1000      520     4202     5202     2101   
                                         GEOM     BASIS   MCVARS     RHF     MCSCF     RHF  

 PROGRAMS   *        TOTAL       RHF     MULTI       RHF       INT
 CPU TIMES  *         2.43      0.01      0.04      0.03      2.19
 REAL TIME  *        14.90 SEC
 DISK USED  *        34.12 MB      
 **********************************************************************************************************************************
 SETTING SCF(I)         =        -5.32895973  AU                              
 SETTING _CC_NORM_MAX   =         2.00000000                                  


 PROGRAM * UHF-SCF       Authors: W. Meyer, H.-J. Werner


 NUMBER OF ELECTRONS:       3+    1-    SPACE SYMMETRY=4    SPIN SYMMETRY: Triplet 
 CONVERGENCE THRESHOLDS:    1.00E-05 (Density)    1.00E-07 (Energy)
 MAX. NUMBER OF ITERATIONS:        0
 INTERPOLATION TYPE:            DIIS
 INTERPOLATION STEPS:              2 (START)      1 (STEP)
 LEVEL SHIFTS:                  0.20 (ALPHA)   0.20 (BETA) 



 Molecular orbitals read from record     2101.2  Type=RHF/CANONICAL (state 1.4)

 Molecular orbital dump at record        2200.2

 Initial alpha occupation   1   1   1   0   0   0   0   0
 Initial beta  occupation   1   0   0   0   0   0   0   0

 ITERATION    DDIFF          GRAD             ENERGY        2-EL.EN.            DIPOLE MOMENTS         DIIS
    1      0.000D+00      0.000D+00        -5.32895973      6.102060    0.00000    0.00000    0.00000    0
 
 Final alpha occupancy:   1   1   1   0   0   0   0   0
 Final beta  occupancy:   1   0   0   0   0   0   0   0

 !UHF STATE 1.4 Energy                 -5.328959728949
 Nuclear energy                         0.00000000
 One-electron energy                   -8.37998982
 Two-electron energy                    3.05103009
 Virial quotient                       -1.60950675
 !UHF STATE 1.4 Dipole moment           0.00000000     0.00000000     0.00000000
 Dipole moment /Debye                   0.00000000     0.00000000     0.00000000
 

 !UHF expec          <1.4|EKIN|1.4>     3.310927239249
 
 !UHF expec           <1.4|POT|1.4>    -3.134100867110

 ELECTRON ORBITALS FOR POSITIVE SPIN
 ===================================


   Orb  Occ    Energy  Couls-En    Coefficients

                                   1 1s      1 1s      1 1s      1 1s      1 3d0     1 3d2+    1 3d0     1 3d2+    1 3d0     1 3d2+ 


   1.1   +    -0.7057   -2.9800  0.999993 -0.000006  0.000011  0.000001  0.000000  0.000000  0.000000  0.000000  0.000000  0.000000

                                   1 2px     1 2px     1 2px     1 2px     1 4f1+    1 4f3+    1 4f1+    1 4f3+ 

   1.2   +    -0.0580   -1.9737  0.999987  0.000004 -0.000007  0.000017  0.000000  0.000000  0.000000  0.000000

                                   1 2py     1 2py     1 2py     1 2py     1 4f1-    1 4f3-    1 4f1-    1 4f3- 

   1.3   +    -0.0580   -1.9737  0.999987  0.000004 -0.000007  0.000017  0.000000  0.000000  0.000000  0.000000

 ELECTRON ORBITALS FOR NEGATIVE SPIN
 ===================================


   Orb  Occ    Energy  Couls-En    Coefficients

                                   1 1s      1 1s      1 1s      1 1s      1 3d0     1 3d2+    1 3d0     1 3d2+    1 3d0     1 3d2+ 


   1.1   -    -0.7057   -2.9800  0.999993 -0.000006  0.000011  0.000001  0.000000  0.000000  0.000000  0.000000  0.000000  0.000000

 HOMO      1.2    -0.058034 =      -1.5792eV
 LUMO      1.5    -0.058034 =      -1.5792eV
 LUMO-HOMO        -0.000000 =      -0.0000eV

 EXPECTATION VALUE OF S**2:             2.00000000

 Occupation number threshold for canonical orbitals:  1.999000 (occupied),  0.001000 (virtual)

 Number of pseudo-canonical orbitals per symmetry:    1   0   0   0   0   0   0   0
 Number of active natural orbitals per symmetry:      0   1   1   0   0   0   0   0

 NATURAL CHARGE ORBITALS
 =======================


   Orb     Occ        Energy       Coefficients

                                   1 1s      1 1s      1 1s      1 1s      1 3d0     1 3d2+    1 3d0     1 3d2+    1 3d0     1 3d2+ 


   1.1  2.00000    -0.705698     0.999993 -0.000006  0.000011  0.000001  0.000000  0.000000  0.000000  0.000000  0.000000  0.000000

                                   1 2px     1 2px     1 2px     1 2px     1 4f1+    1 4f3+    1 4f1+    1 4f3+ 

   1.2  1.00000    -0.129884     0.999987  0.000004 -0.000007  0.000017  0.000000  0.000000  0.000000  0.000000

                                   1 2py     1 2py     1 2py     1 2py     1 4f1-    1 4f3-    1 4f1-    1 4f3- 

   1.3  1.00000    -0.129884     0.999987  0.000004 -0.000007  0.000017  0.000000  0.000000  0.000000  0.000000

 Natural orbitals saved to record    2200.2 (Orbital set 3)

 Orbital spaces for UNO-CAS (Min. occupation: 0.020  Max. occupation: 1.980):

 Closed:        1   0   0   0   0   0   0   0
 Active:        0   1   1   0   0   0   0   0

 No convergence



 **********************************************************************************************************************************
 DATASETS  * FILE   NREC   LENGTH (MB)   RECORD NAMES
              1      21       19.65       500      610      700      900      950      970     1000      129      960     1100   
                                          VAR    BASINP    GEOM    SYMINP    ZMAT    AOBASIS   BASIS     P2S    ABASIS      S 
                                         1400     1410     1420     1200     1210     1080     1600     1650     1300     1700   
                                         EKIN       V       ECP      H0       H01     AOSYM     SMH    MOLCAS    ERIS     OPER   
                                         1380   
                                         JKOP   

              2       7       10.28       700     1000      520     4202     5202     2101     2200   
                                         GEOM     BASIS   MCVARS     RHF     MCSCF     RHF      UHF  

 PROGRAMS   *        TOTAL       UHF       RHF     MULTI       RHF       INT
 CPU TIMES  *         2.45      0.02      0.01      0.04      0.03      2.19
 REAL TIME  *        15.05 SEC
 DISK USED  *        34.12 MB      
 **********************************************************************************************************************************
 SETTING SCF(I)         =        -5.32895973  AU                              


 PROGRAM * MRCC (General Multireference Coupled Cluster)    Author: M. Kallay, 2000-2005

 ***  Initialisation ***

   0 Spin projections
 
 Molecular orbitals read from record     2200.2  Type=UHF/ALPHA (state 1.4)

 ?Warning: UHF not converged
 Molecular orbitals read from record     2200.2  Type=UHF/BETA (state 1.4)

 ?Warning: UHF not converged
 
 Frozen orbitals:              0 (  0  0  0  0  0  0  0  0)
 Active orbitals:             45 ( 10  8  8  3  8  3  3  2)
 Active electrons:             4
 Spin quantum number:          1.0

 Transformed integrals will be written to file mrcc_4826/fort.55

 Load integrals                2.5 sec
 Transform integrals           2.5 sec
 Storage for integrals:         426551
 Remaining memory:           *********

 Core energy:               0.00000000
 
 MRCC Input:
     4     0     0     0     3     0     0     4     0     0     0     1     1     0     0     7     0     0   0.000     0   64000
  ex.lev,nsing,ntrip, rest,method,dens,conver,symm, diag, CS ,spatial, HF, ndoub,nacto,nactv, tol, maxex, sacc, freq,  dboc,   mem
  2  0  0  0  0  0  0  0  0  0  1  0  0  0  0  0  0  0  1  0  0  0  0  0  0  0  0  0  0  0  0  0  0  0  0  0  0  0  0  0  0  0  0  0  0
 MRCC Input end
 Variable memory released
 MRCC now being run, temporary output in /global/cscratch1/sd/aannabe/mrcc_4826/mrcc.out
 **********************************************************************
                          MRCC program system
 **********************************************************************

                              Written by
  Mihaly Kallay, Zoltan Rolik, Jozsef Csontos, Peter Nagy, Gyula Samu,
      David Mester, Jozsef Csoka, Bernat Szabo, Istvan Ladjanszki,
       Lorant Szegedy, Bence Ladoczki, Klara Petrov, Mate Farkas,
                    Pal D. Mezei, and Bence Hegely

        Department of Physical Chemistry and Materials Science
            Budapest University of Technology and Economics
                  Budapest P.O.Box 91, H-1521 Hungary

                              www.mrcc.hu

                       Release date: May 23, 2018

 ************************ 2018-11-05 11:22:24 *************************
 Executing goldstone...

 Generation of CC equations in terms of H and T...
 Generation of antisymmetrized Goldstone diagrams...
 Number of diagrams in T^1 equations:    15
 Number of diagrams in T^2 equations:    38
 Number of diagrams in T^3 equations:    49
 Number of diagrams in T^4 equations:     5
 Translation of diagrams to factorized equations...
 Optimizing intermediate calculation...
 Number of floating-point operations per iteration step:   4.0982E+08
 Probable CPU time per iteration step (hours):      0.00
 Required memory (Mbytes):     448.7
 Number of intermediates:                                  80
 Number of intermediates to be stored:                     32
 Length of intermediate file (Mbytes):       8.4

 ************************ 2018-11-05 11:22:25 *************************
 Executing xmrcc...

 **********************************************************************
 CC(3)(4) calculation


 Allocation of 448.7 Mbytes of memory...
 Number of spinorbitals:                    90
 Number of alpha electrons:                        3
 Number of beta electrons:                         1
 Spin multiplicity:                     2
 z-component of spin:  1.0
 Spatial symmetry:                      4
 Convergence criterion:  1.0E-07
 Construction of occupation graphs...
 Number of                     0 -fold excitations:                      1
 Number of                     1 -fold excitations:                     32
 Number of                     2 -fold excitations:                   1097
 Number of                     3 -fold excitations:                  15607
 Total number of configurations:                  16737
 Calculation of coupling coefficients...
 Length of intermediate file (Mbytes):       6.7

 ======================================================================

 Spin case  1   Alpha:  3   Beta:  1
 Number of excitations:                  62872
 Number of                     4 -fold excitations:                  62872

 Memory requirements /Mbyte/:
               Minimal        Optimal
 Real*8:         23.0082        31.3201
 Integer:         6.5905
 Total:          29.5986        37.9106


 ************************ 2018-11-05 11:22:26 *************************
 Executing mrcc...

 **********************************************************************
 CCSDT(Q) calculation


 Allocation of   31.3 Mbytes of memory...
 Number of spinorbitals:  90
 Number of alpha electrons:  3
 Number of beta  electrons:  1
 Spin multiplicity: 2
 z-component of spin:  1.0
 Spatial symmetry: 4
 Convergence criterion:  1.0E-07
 Construction of occupation graphs...
 Number of 0-fold excitations: 1
 Number of 1-fold excitations: 32
 Number of 2-fold excitations: 1097
 Number of 3-fold excitations: 15607
 Total number of determinants: 16737
 Calculation of coupling coefficients...
 Initial cluster amplitudes are generated.
 Length of intermediate file (Mbytes):       6.7
 Reading integral list from unit 55...
 Sorting integrals...
 Sorting integrals...
 Sorting integrals...
 Sorting integrals...
 Energy of reference determinant [au]:      -5.328959728949
 Calculation of MP denominators...

 Starting CC iteration...
 ======================================================================
 Norm of residual vector:     0.50625477
 CPU time [min]:     0.028                   Wall time [min]:     0.029

 Iteration  1  CC energy:    -5.40621661  Energy decrease:   0.07725688
 ======================================================================
 Norm of residual vector:     0.13284126
 CPU time [min]:     0.039                   Wall time [min]:     0.042

 Iteration  2  CC energy:    -5.42300225  Energy decrease:   0.01678564
 ======================================================================
 Norm of residual vector:     0.03864205
 CPU time [min]:     0.051                   Wall time [min]:     0.055

 Iteration  3  CC energy:    -5.42869230  Energy decrease:   0.00569005
 ======================================================================
 Norm of residual vector:     0.01186362
 CPU time [min]:     0.063                   Wall time [min]:     0.067

 Iteration  4  CC energy:    -5.42910986  Energy decrease:   0.00041756
 ======================================================================
 Norm of residual vector:     0.00303133
 CPU time [min]:     0.074                   Wall time [min]:     0.079

 Iteration  5  CC energy:    -5.42918095  Energy decrease:   0.00007109
 ======================================================================
 Norm of residual vector:     0.00085617
 CPU time [min]:     0.086                   Wall time [min]:     0.091

 Iteration  6  CC energy:    -5.42917239  Energy decrease:   0.00000855
 ======================================================================
 Norm of residual vector:     0.00028927
 CPU time [min]:     0.098                   Wall time [min]:     0.103

 Iteration  7  CC energy:    -5.42917043  Energy decrease:   0.00000196
 ======================================================================
 Norm of residual vector:     0.00010217
 CPU time [min]:     0.110                   Wall time [min]:     0.116

 Iteration  8  CC energy:    -5.42917377  Energy decrease:   0.00000335
 ======================================================================
 Norm of residual vector:     0.00003307
 CPU time [min]:     0.121                   Wall time [min]:     0.128

 Iteration  9  CC energy:    -5.42917291  Energy decrease:   0.00000086
 ======================================================================
 Norm of residual vector:     0.00001120
 CPU time [min]:     0.133                   Wall time [min]:     0.139

 Iteration 10  CC energy:    -5.42917276  Energy decrease:   0.00000015
 ======================================================================
 Norm of residual vector:     0.00000365
 CPU time [min]:     0.145                   Wall time [min]:     0.152

 Iteration 11  CC energy:    -5.42917288  Energy decrease:   0.00000012
 ======================================================================
 Norm of residual vector:     0.00000102
 CPU time [min]:     0.157                   Wall time [min]:     0.164

 Iteration 12  CC energy:    -5.42917287  Energy decrease:   0.00000001
 ======================================================================
 Norm of residual vector:     0.00000029
 CPU time [min]:     0.169                   Wall time [min]:     0.176

 Iteration 13  CC energy:    -5.42917286  Energy decrease:   0.00000001
 ======================================================================
 Norm of residual vector:     0.00000008
 CPU time [min]:     0.180                   Wall time [min]:     0.188

 Iteration 14  CC energy:    -5.42917287  Energy decrease:   1.3639E-09
 ======================================================================

 Iteration has converged in 14 steps.

 Final results:
 Total CCSDT energy [au]:             -5.429172866006
 Total MP2 energy [au]:               -5.406216608092

 Perturbative corrections are calculated...
 ======================================================================
 Spin case  1   Alpha:  3   Beta:  1
 Number of excitations:        62872
 CPU time [min]:     0.520                   Wall time [min]:     0.529
 ======================================================================
 Number of 4-fold excitations: 62872
 CPU time [min]:     0.520                   Wall time [min]:     0.529

 Total CCSDT[Q] energy [au]:          -5.429189616195
 Total CCSDT(Q) energy [au]:          -5.429214730357

 ************************ 2018-11-05 11:22:58 *************************
                      Normal termination of mrcc.
 **********************************************************************
 !CCSDT STATE 1.4 Energy               -5.429172866006
 !MP2 STATE 1.4 Energy                 -5.406216608092
 !CCSDT[Q] STATE 1.4 Energy            -5.429189616195
 !CCSDT(Q) STATE 1.4 Energy            -5.429214730357
 
 CPU-time for MRCC:             31.2 sec
 Elapsed-time for MRCC:         35.8 sec

 Variable memory set to 8000000000 words,  buffer space   230000 words



 **********************************************************************************************************************************
 DATASETS  * FILE   NREC   LENGTH (MB)   RECORD NAMES
              1      21       19.65       500      610      700      900      950      970     1000      129      960     1100   
                                          VAR    BASINP    GEOM    SYMINP    ZMAT    AOBASIS   BASIS     P2S    ABASIS      S 
                                         1400     1410     1420     1200     1210     1080     1600     1650     1300     1700   
                                         EKIN       V       ECP      H0       H01     AOSYM     SMH    MOLCAS    ERIS     OPER   
                                         1380   
                                         JKOP   

              2       7       10.28       700     1000      520     4202     5202     2101     2200   
                                         GEOM     BASIS   MCVARS     RHF     MCSCF     RHF      UHF  

 PROGRAMS   *        TOTAL      MRCC       UHF       RHF     MULTI       RHF       INT
 CPU TIMES  *        34.68     32.23      0.02      0.01      0.04      0.03      2.19
 REAL TIME  *        57.42 SEC
 DISK USED  *        34.12 MB      
 **********************************************************************************************************************************
 SETTING POSTHF(I)      =        -5.42921473  AU                              
                                                                                                                                                                                                                                                                

       SCF           POSTHF       EKIN          POT
    -5.32895973   -5.42921473   3.31092724   -3.13410087
                                                  

 CCSDT(Q)/USERDEF energy=     -5.429214730357

        CCSDT(Q)        RHF-SCF         MULTI           RHF-SCF 
     -5.42921473     -5.32895973     -5.32895973     -5.32902791
 **********************************************************************************************************************************
 Variable memory released
