
 Primary working directories    : /global/cscratch1/sd/aannabe
 Secondary working directories  : /global/cscratch1/sd/aannabe
 Wavefunction directory         : /global/homes/a/aannabe/wfu/
 Main file repository           : /global/cscratch1/sd/aannabe/

 SHA1      : 2873118e99aab1bc19f5b6fc1784693c06d15c95
 NAME      : 2015.1.8
 ARCHNAME  : linux/x86_64
 FC        : /opt/cray/pe/craype/2.5.5/bin/ftn
 BLASLIB   : -Wl,-_start-group /opt/intel/compilers_and_libraries_2016.3.210/linux/mkl/lib/intel64/libmkl_intel_ilp64.a /opt/intel/compilers_and_libraries_2016.3.210/linux/mkl/lib/intel64/libmkl_intel_thread.a /opt/intel/compilers_and_libraries_2016.3.210/linux/mkl/lib/intel64/libmkl_core.a -Wl,-_end-group
 id        : lbl

 Nodes     nprocs
 nid00457     1
 Number of processes for MPI-2 version of Molpro:   nprocs(total)=    2   nprocs(compute)=    1   nprocs(helper)=    1

 Using customized tuning parameters: mindgm=8; mindgv=16; mindgc=4; mindgr=1; noblas=0; minvec=7
 default implementation of scratch files=df  

 ***,O
 memory,4,g
 gthresh,twoint=1.e-12
 
 print,basis,orbitals
 
 angstrom
 geometry={
 1                                                                               ! Number of atoms
 O 0.0 0.0 0.0
 }
 
 basis={
 Including file /global/homes/a/aannabe/docs/totals/pps/O.pp
 Including file /global/homes/a/aannabe/docs/totals/basis/aug-cc-pVnZ/O_6z.basis
 }
 
 {rhf
 wf,6,7,2
 occ,1,1,1,0,1,0,0,0
                                                                                 !open,1.3
 closed,1,1,0,0,0,0,0,0
                                                                                 !sym,
 }
 
  !NOTE: Perturbative MRCC works only with UHF reference. So, here we will trick MRCC by doing zero UHF iteration right after ROHF.
 
 {uhf
 wf,6,7,2
 occ,1,1,1,0,1,0,0,0
                                                                                 !open,1.3
 closed,1,1,0,0,0,0,0,0
                                                                                 !sym,
 maxit,0
 }
 scf(i)=energy
 
 {mrcc,method=CCSDT(Q)
 orbital,ignore_error=1                                                          !Ignore the fact that UHF WF is not converged
 maxit,100
 core
 }
 posthf(i)=energy
 
 table,scf,posthf
 save,6z.csv
 
 

 Variables initialized (889), CPU time= 0.00 sec
 Commands  initialized (702), CPU time= 0.01 sec, 572 directives.
 Default parameters read. Elapsed time= 0.68 sec

 Checking input...
 Passed
1


                                         ***  PROGRAM SYSTEM MOLPRO  ***
                                       Copyright, TTI GmbH Stuttgart, 2015
                                    Version 2015.1 linked Sep  7 2016 23:09:38


 **********************************************************************************************************************************
 LABEL *   O                                                                             
  64 bit serial version                                                                  DATE: 31-May-18          TIME: 09:59:32  
 **********************************************************************************************************************************

 SHA1:             2873118e99aab1bc19f5b6fc1784693c06d15c95
 **********************************************************************************************************************************

 THRESHOLDS:

 ZERO    =  1.00D-12  ONEINT  =  1.00D-12  TWOINT  =  1.00D-12  PREFAC  =  1.00D-14  LOCALI  =  1.00D-09  EORDER  =  1.00D-04
 ENERGY  =  0.00D+00  ETEST   =  0.00D+00  EDENS   =  0.00D+00  THRDEDEF=  1.00D-06  GRADIENT=  1.00D-02  STEP    =  1.00D-03
 ORBITAL =  1.00D-05  CIVEC   =  1.00D-05  COEFF   =  1.00D-04  PRINTCI =  5.00D-02  PUNCHCI =  9.90D+01  OPTGRAD =  3.00D-04
 OPTENERG=  1.00D-06  OPTSTEP =  3.00D-04  THRGRAD =  1.00D-10  COMPRESS=  1.00D-11  VARMIN  =  1.00D-07  VARMAX  =  1.00D-03
 THRDOUB =  0.00D+00  THRDIV  =  1.00D-05  THRRED  =  1.00D-07  THRPSP  =  1.00D+00  THRDC   =  1.00D-10  THRCS   =  1.00D-10
 THRNRM  =  1.00D-08  THREQ   =  0.00D+00  THRDE   =  1.00D+00  THRREF  =  1.00D-05  SPARFAC =  1.00D+00  THRDLP  =  1.00D-07
 THRDIA  =  1.00D-10  THRDLS  =  1.00D-07  THRGPS  =  0.00D+00  THRKEX  =  0.00D+00  THRDIS  =  2.00D-01  THRVAR  =  1.00D-10
 THRLOC  =  1.00D-06  THRGAP  =  1.00D-06  THRLOCT = -1.00D+00  THRGAPT = -1.00D+00  THRORB  =  1.00D-06  THRMLTP =  0.00D+00
 THRCPQCI=  1.00D-10  KEXTA   =  0.00D+00  THRCOARS=  0.00D+00  SYMTOL  =  1.00D-06  GRADTOL =  1.00D-06  THROVL  =  1.00D-08
 THRORTH =  1.00D-08  GRID    =  1.00D-06  GRIDMAX =  1.00D-03  DTMAX   =  0.00D+00  THROCCDE=  1.00D-01  THROCCDE=  1.00D-01



 ZUNIT=ANG
 

Geometry recognized as XYZ


 Variable memory set to 4000000000 words,  buffer space   230000 words

 SETTING BASIS          =    USERDEF


 Recomputing integrals since basis changed


 Using spherical harmonics



 PROGRAM * SEWARD (Integral evaluation for generally contracted gaussian basis sets)     Author: Roland Lindh, 1990

 Geometry written to block  1 of record 700

 Orientation using atomic masses  
 Molecule type: Atom
 Symmetry elements: X,Y,Z
 Rotational constants:       0.0000000      0.0000000      0.0000000 GHz  (calculated with average atomic masses)

 Point group  D2h 



 ATOMIC COORDINATES

 NR  ATOM    CHARGE       X              Y              Z

   1  O       6.00    0.000000000    0.000000000    0.000000000


          O   CORE POTENTIAL

          p POTENTIAL

 POWERS             1              3              2
 EXPONENTIALS   12.30997       14.76962       13.71419    
 COEFFICIENTS   6.000000       73.85984      -47.87600    

          s - p POTENTIAL

 POWERS             2
 EXPONENTIALS   13.65512    
 COEFFICIENTS   85.86406    


 BASIS DATA

   Nr Sym  Nuc  Type         Exponents   Contraction coefficients

    1.1 Ag    1  1s          54.775216    -0.001244
                             25.616801     0.010733
                             11.980245     0.001889
                              6.992317    -0.174254
                              2.620277     0.001762
                              1.225429     0.316185
                              0.577797     0.451202
                              0.268022     0.312153
                              0.125346     0.051117
    2.1 Ag    1  1s           0.068010     1.000000
    3.1 Ag    1  1s           0.149139     1.000000
    4.1 Ag    1  1s           0.327046     1.000000
    5.1 Ag    1  1s           0.717177     1.000000
    6.1 Ag    1  1s           1.572691     1.000000
    7.1 Ag    1  1s           3.448744     1.000000
    8.1 Ag    1  3d0          0.133870     1.000000
    9.1 Ag    1  3d2+         0.133870     1.000000
   10.1 Ag    1  3d0          0.312769     1.000000
   11.1 Ag    1  3d2+         0.312769     1.000000
   12.1 Ag    1  3d0          0.730740     1.000000
   13.1 Ag    1  3d2+         0.730740     1.000000
   14.1 Ag    1  3d0          1.707271     1.000000
   15.1 Ag    1  3d2+         1.707271     1.000000
   16.1 Ag    1  3d0          3.988796     1.000000
   17.1 Ag    1  3d2+         3.988796     1.000000
   18.1 Ag    1  3d0          9.319256     1.000000
   19.1 Ag    1  3d2+         9.319256     1.000000
   20.1 Ag    1  5g0          0.401280     1.000000
   21.1 Ag    1  5g4+         0.401280     1.000000
   22.1 Ag    1  5g2+         0.401280     1.000000
   23.1 Ag    1  5g0          0.933959     1.000000
   24.1 Ag    1  5g4+         0.933959     1.000000
   25.1 Ag    1  5g2+         0.933959     1.000000
   26.1 Ag    1  5g0          2.173744     1.000000
   27.1 Ag    1  5g4+         2.173744     1.000000
   28.1 Ag    1  5g2+         2.173744     1.000000
   29.1 Ag    1  5g0          5.059282     1.000000
   30.1 Ag    1  5g4+         5.059282     1.000000
   31.1 Ag    1  5g2+         5.059282     1.000000
   32.1 Ag    1  7i6+         1.106427     1.000000
   33.1 Ag    1  7i4+         1.106427     1.000000
   34.1 Ag    1  7i2+         1.106427     1.000000
   35.1 Ag    1  7i0          1.106427     1.000000
   36.1 Ag    1  7i6+         2.766067     1.000000
   37.1 Ag    1  7i4+         2.766067     1.000000
   38.1 Ag    1  7i2+         2.766067     1.000000
   39.1 Ag    1  7i0          2.766067     1.000000
    1.2 B3u   1  2px         22.217266     0.010487
                             10.747550     0.036644
                              5.315785     0.080367
                              2.660761     0.162701
                              1.331816     0.237779
                              0.678626     0.281142
                              0.333673     0.264319
                              0.167017     0.146601
                              0.083598     0.045815
    2.2 B3u   1  2px          0.047473     1.000000
    3.2 B3u   1  2px          0.112440     1.000000
    4.2 B3u   1  2px          0.266314     1.000000
    5.2 B3u   1  2px          0.630764     1.000000
    6.2 B3u   1  2px          1.493963     1.000000
    7.2 B3u   1  2px          3.538449     1.000000
    8.2 B3u   1  4f1+         0.205575     1.000000
    9.2 B3u   1  4f3+         0.205575     1.000000
   10.2 B3u   1  4f1+         0.461949     1.000000
   11.2 B3u   1  4f3+         0.461949     1.000000
   12.2 B3u   1  4f1+         1.038050     1.000000
   13.2 B3u   1  4f3+         1.038050     1.000000
   14.2 B3u   1  4f1+         2.332611     1.000000
   15.2 B3u   1  4f3+         2.332611     1.000000
   16.2 B3u   1  4f1+         5.241631     1.000000
   17.2 B3u   1  4f3+         5.241631     1.000000
   18.2 B3u   1  6h1+         0.621111     1.000000
   19.2 B3u   1  6h3+         0.621111     1.000000
   20.2 B3u   1  6h5+         0.621111     1.000000
   21.2 B3u   1  6h1+         1.524901     1.000000
   22.2 B3u   1  6h3+         1.524901     1.000000
   23.2 B3u   1  6h5+         1.524901     1.000000
   24.2 B3u   1  6h1+         3.743813     1.000000
   25.2 B3u   1  6h3+         3.743813     1.000000
   26.2 B3u   1  6h5+         3.743813     1.000000
    1.3 B2u   1  2py         22.217266     0.010487
                             10.747550     0.036644
                              5.315785     0.080367
                              2.660761     0.162701
                              1.331816     0.237779
                              0.678626     0.281142
                              0.333673     0.264319
                              0.167017     0.146601
                              0.083598     0.045815
    2.3 B2u   1  2py          0.047473     1.000000
    3.3 B2u   1  2py          0.112440     1.000000
    4.3 B2u   1  2py          0.266314     1.000000
    5.3 B2u   1  2py          0.630764     1.000000
    6.3 B2u   1  2py          1.493963     1.000000
    7.3 B2u   1  2py          3.538449     1.000000
    8.3 B2u   1  4f1-         0.205575     1.000000
    9.3 B2u   1  4f3-         0.205575     1.000000
   10.3 B2u   1  4f1-         0.461949     1.000000
   11.3 B2u   1  4f3-         0.461949     1.000000
   12.3 B2u   1  4f1-         1.038050     1.000000
   13.3 B2u   1  4f3-         1.038050     1.000000
   14.3 B2u   1  4f1-         2.332611     1.000000
   15.3 B2u   1  4f3-         2.332611     1.000000
   16.3 B2u   1  4f1-         5.241631     1.000000
   17.3 B2u   1  4f3-         5.241631     1.000000
   18.3 B2u   1  6h1-         0.621111     1.000000
   19.3 B2u   1  6h3-         0.621111     1.000000
   20.3 B2u   1  6h5-         0.621111     1.000000
   21.3 B2u   1  6h1-         1.524901     1.000000
   22.3 B2u   1  6h3-         1.524901     1.000000
   23.3 B2u   1  6h5-         1.524901     1.000000
   24.3 B2u   1  6h1-         3.743813     1.000000
   25.3 B2u   1  6h3-         3.743813     1.000000
   26.3 B2u   1  6h5-         3.743813     1.000000
    1.4 B1g   1  3d2-         0.133870     1.000000
    2.4 B1g   1  3d2-         0.312769     1.000000
    3.4 B1g   1  3d2-         0.730740     1.000000
    4.4 B1g   1  3d2-         1.707271     1.000000
    5.4 B1g   1  3d2-         3.988796     1.000000
    6.4 B1g   1  3d2-         9.319256     1.000000
    7.4 B1g   1  5g2-         0.401280     1.000000
    8.4 B1g   1  5g4-         0.401280     1.000000
    9.4 B1g   1  5g2-         0.933959     1.000000
   10.4 B1g   1  5g4-         0.933959     1.000000
   11.4 B1g   1  5g2-         2.173744     1.000000
   12.4 B1g   1  5g4-         2.173744     1.000000
   13.4 B1g   1  5g2-         5.059282     1.000000
   14.4 B1g   1  5g4-         5.059282     1.000000
   15.4 B1g   1  7i2-         1.106427     1.000000
   16.4 B1g   1  7i6-         1.106427     1.000000
   17.4 B1g   1  7i4-         1.106427     1.000000
   18.4 B1g   1  7i2-         2.766067     1.000000
   19.4 B1g   1  7i6-         2.766067     1.000000
   20.4 B1g   1  7i4-         2.766067     1.000000
    1.5 B1u   1  2pz         22.217266     0.010487
                             10.747550     0.036644
                              5.315785     0.080367
                              2.660761     0.162701
                              1.331816     0.237779
                              0.678626     0.281142
                              0.333673     0.264319
                              0.167017     0.146601
                              0.083598     0.045815
    2.5 B1u   1  2pz          0.047473     1.000000
    3.5 B1u   1  2pz          0.112440     1.000000
    4.5 B1u   1  2pz          0.266314     1.000000
    5.5 B1u   1  2pz          0.630764     1.000000
    6.5 B1u   1  2pz          1.493963     1.000000
    7.5 B1u   1  2pz          3.538449     1.000000
    8.5 B1u   1  4f0          0.205575     1.000000
    9.5 B1u   1  4f2+         0.205575     1.000000
   10.5 B1u   1  4f0          0.461949     1.000000
   11.5 B1u   1  4f2+         0.461949     1.000000
   12.5 B1u   1  4f0          1.038050     1.000000
   13.5 B1u   1  4f2+         1.038050     1.000000
   14.5 B1u   1  4f0          2.332611     1.000000
   15.5 B1u   1  4f2+         2.332611     1.000000
   16.5 B1u   1  4f0          5.241631     1.000000
   17.5 B1u   1  4f2+         5.241631     1.000000
   18.5 B1u   1  6h2+         0.621111     1.000000
   19.5 B1u   1  6h4+         0.621111     1.000000
   20.5 B1u   1  6h0          0.621111     1.000000
   21.5 B1u   1  6h2+         1.524901     1.000000
   22.5 B1u   1  6h4+         1.524901     1.000000
   23.5 B1u   1  6h0          1.524901     1.000000
   24.5 B1u   1  6h2+         3.743813     1.000000
   25.5 B1u   1  6h4+         3.743813     1.000000
   26.5 B1u   1  6h0          3.743813     1.000000
    1.6 B2g   1  3d1+         0.133870     1.000000
    2.6 B2g   1  3d1+         0.312769     1.000000
    3.6 B2g   1  3d1+         0.730740     1.000000
    4.6 B2g   1  3d1+         1.707271     1.000000
    5.6 B2g   1  3d1+         3.988796     1.000000
    6.6 B2g   1  3d1+         9.319256     1.000000
    7.6 B2g   1  5g1+         0.401280     1.000000
    8.6 B2g   1  5g3+         0.401280     1.000000
    9.6 B2g   1  5g1+         0.933959     1.000000
   10.6 B2g   1  5g3+         0.933959     1.000000
   11.6 B2g   1  5g1+         2.173744     1.000000
   12.6 B2g   1  5g3+         2.173744     1.000000
   13.6 B2g   1  5g1+         5.059282     1.000000
   14.6 B2g   1  5g3+         5.059282     1.000000
   15.6 B2g   1  7i5+         1.106427     1.000000
   16.6 B2g   1  7i3+         1.106427     1.000000
   17.6 B2g   1  7i1+         1.106427     1.000000
   18.6 B2g   1  7i5+         2.766067     1.000000
   19.6 B2g   1  7i3+         2.766067     1.000000
   20.6 B2g   1  7i1+         2.766067     1.000000
    1.7 B3g   1  3d1-         0.133870     1.000000
    2.7 B3g   1  3d1-         0.312769     1.000000
    3.7 B3g   1  3d1-         0.730740     1.000000
    4.7 B3g   1  3d1-         1.707271     1.000000
    5.7 B3g   1  3d1-         3.988796     1.000000
    6.7 B3g   1  3d1-         9.319256     1.000000
    7.7 B3g   1  5g1-         0.401280     1.000000
    8.7 B3g   1  5g3-         0.401280     1.000000
    9.7 B3g   1  5g1-         0.933959     1.000000
   10.7 B3g   1  5g3-         0.933959     1.000000
   11.7 B3g   1  5g1-         2.173744     1.000000
   12.7 B3g   1  5g3-         2.173744     1.000000
   13.7 B3g   1  5g1-         5.059282     1.000000
   14.7 B3g   1  5g3-         5.059282     1.000000
   15.7 B3g   1  7i5-         1.106427     1.000000
   16.7 B3g   1  7i3-         1.106427     1.000000
   17.7 B3g   1  7i1-         1.106427     1.000000
   18.7 B3g   1  7i5-         2.766067     1.000000
   19.7 B3g   1  7i3-         2.766067     1.000000
   20.7 B3g   1  7i1-         2.766067     1.000000
    1.8 Au    1  4f2-         0.205575     1.000000
    2.8 Au    1  4f2-         0.461949     1.000000
    3.8 Au    1  4f2-         1.038050     1.000000
    4.8 Au    1  4f2-         2.332611     1.000000
    5.8 Au    1  4f2-         5.241631     1.000000
    6.8 Au    1  6h4-         0.621111     1.000000
    7.8 Au    1  6h2-         0.621111     1.000000
    8.8 Au    1  6h4-         1.524901     1.000000
    9.8 Au    1  6h2-         1.524901     1.000000
   10.8 Au    1  6h4-         3.743813     1.000000
   11.8 Au    1  6h2-         3.743813     1.000000

 NUCLEAR CHARGE:                    6
 NUMBER OF PRIMITIVE AOS:         325
 NUMBER OF SYMMETRY AOS:          220
 NUMBER OF CONTRACTIONS:          188   (  39Ag  +  26B3u +  26B2u +  20B1g +  26B1u +  20B2g +  20B3g +  11Au  )
 NUMBER OF CORE ORBITALS:           0   (   0Ag  +   0B3u +   0B2u +   0B1g +   0B1u +   0B2g +   0B3g +   0Au  )
 NUMBER OF VALENCE ORBITALS:        4   (   1Ag  +   1B3u +   1B2u +   0B1g +   1B1u +   0B2g +   0B3g +   0Au  )


 NUCLEAR REPULSION ENERGY    0.00000000

 EXTRA SYMMETRY OF AOS IN SYMMETRY 1:   1 1 1 1 1 1 1 2 3 2   3 2 3 2 3 2 3 2 3 4   5 6 4 5 6 4 5 6 4 5   6 7 8 910 7 8 910
 EXTRA SYMMETRY OF AOS IN SYMMETRY 2:   1 1 1 1 1 1 1 2 3 2   3 2 3 2 3 2 3 4 5 6   4 5 6 4 5 6
 EXTRA SYMMETRY OF AOS IN SYMMETRY 3:   1 1 1 1 1 1 1 2 3 2   3 2 3 2 3 2 3 4 5 6   4 5 6 4 5 6
 EXTRA SYMMETRY OF AOS IN SYMMETRY 4:   1 1 1 1 1 1 2 3 2 3   2 3 2 3 4 5 6 4 5 6
 EXTRA SYMMETRY OF AOS IN SYMMETRY 5:   1 1 1 1 1 1 1 2 3 2   3 2 3 2 3 2 3 4 5 6   4 5 6 4 5 6
 EXTRA SYMMETRY OF AOS IN SYMMETRY 6:   1 1 1 1 1 1 2 3 2 3   2 3 2 3 4 5 6 4 5 6
 EXTRA SYMMETRY OF AOS IN SYMMETRY 7:   1 1 1 1 1 1 2 3 2 3   2 3 2 3 4 5 6 4 5 6
 EXTRA SYMMETRY OF AOS IN SYMMETRY 8:   1 1 1 1 1 2 3 2 3 2   3

 Eigenvalues of metric

         1 0.483E-03 0.255E-02 0.158E-01 0.303E-01 0.303E-01 0.869E-01 0.110E+00 0.110E+00
         2 0.110E-02 0.144E-01 0.558E-01 0.558E-01 0.636E-01 0.217E+00 0.217E+00 0.231E+00
         3 0.110E-02 0.144E-01 0.558E-01 0.558E-01 0.636E-01 0.217E+00 0.217E+00 0.231E+00
         4 0.303E-01 0.110E+00 0.137E+00 0.137E+00 0.337E+00 0.479E+00 0.479E+00 0.533E+00
         5 0.110E-02 0.144E-01 0.558E-01 0.558E-01 0.636E-01 0.217E+00 0.217E+00 0.231E+00
         6 0.303E-01 0.110E+00 0.137E+00 0.137E+00 0.337E+00 0.479E+00 0.479E+00 0.533E+00
         7 0.303E-01 0.110E+00 0.137E+00 0.137E+00 0.337E+00 0.479E+00 0.479E+00 0.533E+00
         8 0.558E-01 0.217E+00 0.297E+00 0.297E+00 0.654E+00 0.903E+00 0.903E+00 0.151E+01


 Contracted 2-electron integrals neglected if value below      1.0D-12
 AO integral compression algorithm  1   Integral accuracy      1.0D-12

     121.897 MB (compressed) written to integral file ( 48.0%)


 NUMBER OF SORTED TWO-ELECTRON INTEGRALS:   20212815.     BUFFER LENGTH:  32768
 NUMBER OF SEGMENTS:   2  SEGMENT LENGTH:   15998787      RECORD LENGTH: 524288

 Memory used in sort:      16.56 MW

 SORT1 READ    31710950. AND WROTE    13213985. INTEGRALS IN     39 RECORDS. CPU TIME:     1.08 SEC, REAL TIME:     1.30 SEC
 SORT2 READ    13213985. AND WROTE    20212815. INTEGRALS IN    465 RECORDS. CPU TIME:     0.67 SEC, REAL TIME:     0.90 SEC

 FILE SIZES:   FILE 1:   141.8 MBYTE,  FILE 4:   163.6 MBYTE,   TOTAL:    305.4 MBYTE

 OPERATOR DM      FOR CENTER  0  COORDINATES:    0.000000    0.000000    0.000000


 **********************************************************************************************************************************
 DATASETS  * FILE   NREC   LENGTH (MB)   RECORD NAMES
              1      20       98.22       500      610      700      900      950      970     1000      129      960     1100   
                                          VAR    BASINP    GEOM    SYMINP    ZMAT    AOBASIS   BASIS     P2S    ABASIS      S 
                                         1400     1410     1420     1200     1210     1080     1600     1650     1300     1700   
                                           T        V       ECP      H0       H01     AOSYM     SMH    MOLCAS    ERIS     OPER   

 PROGRAMS   *        TOTAL       INT
 CPU TIMES  *         7.45      7.35
 REAL TIME  *        13.17 SEC
 DISK USED  *       305.74 MB      
 **********************************************************************************************************************************


 PROGRAM * RHF-SCF (OPEN SHELL)       Authors: W. Meyer, H.-J. Werner


 NUMBER OF ELECTRONS:       4+    2-    SPACE SYMMETRY=7    SPIN SYMMETRY: Triplet 
 CONVERGENCE THRESHOLDS:    1.00E-05 (Density)    1.00E-07 (Energy)
 MAX. NUMBER OF ITERATIONS:       60
 INTERPOLATION TYPE:            DIIS
 INTERPOLATION STEPS:              2 (START)      1 (STEP)
 LEVEL SHIFTS:                 -0.60 (CLOSED) -0.30 (OPEN) 

 Number of closed-shell orbitals:    2 (   1   1   0   0   0   0   0   0 )
 Number of open-shell orbitals:      2 (   0   0   1   0   1   0   0   0 )



   Atom=O  basis=ECP2MWB_GUESS     lmin=0  lmax=1

 Orbital guess generated from atomic densities. Full valence occupancy:    1   1   1   0   1   0   0   0


 Molecular orbital dump at record        2100.2

 ITERATION    DDIFF          GRAD             ENERGY        2-EL.EN.            DIPOLE MOMENTS         DIIS   ORB.
    1      0.000D+00      0.000D+00       -15.66291182     20.337919    0.00000    0.00000    0.00000    0    start
    2      0.000D+00      0.134D-01       -15.68807990     21.190421    0.00000    0.00000    0.00000    1    diag,B
    3      0.685D-02      0.316D-02       -15.68937593     21.223081    0.00000    0.00000    0.00000    2    diag,B
    4      0.128D-02      0.122D-02       -15.68976181     21.254225    0.00000    0.00000    0.00000    3    diag,B
    5      0.750D-03      0.310D-03       -15.68979275     21.259321    0.00000    0.00000    0.00000    4    diag,B
    6      0.261D-03      0.609D-04       -15.68979377     21.258523    0.00000    0.00000    0.00000    5    diag,B
    7      0.595D-04      0.155D-04       -15.68979384     21.258319    0.00000    0.00000    0.00000    6    fixocc
    8      0.235D-04      0.336D-05       -15.68979385     21.258257    0.00000    0.00000    0.00000    7    diag,B
    9      0.529D-05      0.775D-06       -15.68979385     21.258255    0.00000    0.00000    0.00000    0    orth

 Final alpha occupancy:   1   1   1   0   1   0   0   0
 Final beta  occupancy:   1   1   0   0   0   0   0   0

 !RHF STATE 1.7 Energy                -15.689793848270
 Nuclear energy                         0.00000000
 One-electron energy                  -26.31892121
 Two-electron energy                   10.62912736
 Virial quotient                       -1.32456402
 !RHF STATE 1.7 Dipole moment           0.00000000     0.00000000     0.00000000
 Dipole moment /Debye                   0.00000000     0.00000000     0.00000000

 ELECTRON ORBITALS
 =================


   Orb  Occ    Energy  Couls-En    Coefficients

                                   1 1s      1 1s      1 1s      1 1s      1 1s      1 1s      1 1s      1 3d0     1 3d2+    1 3d0  
                                   1 3d2+    1 3d0     1 3d2+    1 3d0     1 3d2+    1 3d0     1 3d2+    1 3d0     1 3d2+    1 5g0  
                                   1 5g4+    1 5g2+    1 5g0     1 5g4+    1 5g2+    1 5g0     1 5g4+    1 5g2+    1 5g0     1 5g4+ 
                                   1 5g2+    1 7i6+    1 7i4+    1 7i2+    1 7i0     1 7i6+    1 7i4+    1 7i2+    1 7i0  

   1.1   2    -1.2598   -6.0752  0.996945  0.002567 -0.005416  0.007603 -0.003750  0.003926 -0.001734 -0.000591  0.001023 -0.001523
                                 0.002638 -0.000430  0.000745 -0.000062  0.000107 -0.000266  0.000461 -0.000121  0.000209 -0.000008
                                -0.000017  0.000013 -0.000002 -0.000004  0.000003 -0.000000 -0.000000  0.000000 -0.000000 -0.000000
                                 0.000000 -0.000000  0.000000 -0.000000  0.000000 -0.000000  0.000000 -0.000000  0.000000

                                   1 2px     1 2px     1 2px     1 2px     1 2px     1 2px     1 2px     1 4f1+    1 4f3+    1 4f1+ 
                                   1 4f3+    1 4f1+    1 4f3+    1 4f1+    1 4f3+    1 4f1+    1 4f3+    1 6h1+    1 6h3+    1 6h5+ 
                                   1 6h1+    1 6h3+    1 6h5+    1 6h1+    1 6h3+    1 6h5+ 

   1.2   2    -0.5672   -4.6952  1.000051  0.000420 -0.000920  0.000343 -0.000030  0.000102 -0.000035  0.000642 -0.000829  0.001388
                                -0.001792  0.001548 -0.001999  0.000714 -0.000922  0.000215 -0.000278  0.000008 -0.000009  0.000012
                                 0.000006 -0.000006  0.000008  0.000001 -0.000002  0.000002

                                   1 2py     1 2py     1 2py     1 2py     1 2py     1 2py     1 2py     1 4f1-    1 4f3-    1 4f1- 
                                   1 4f3-    1 4f1-    1 4f3-    1 4f1-    1 4f3-    1 4f1-    1 4f3-    1 6h1-    1 6h3-    1 6h5- 
                                   1 6h1-    1 6h3-    1 6h5-    1 6h1-    1 6h3-    1 6h5- 

   1.3   +    -0.7034   -4.9194  1.033098 -0.003980 -0.041084 -0.029761  0.006780  0.007609  0.000795  0.000287 -0.001113  0.000864
                                -0.003347  0.001112 -0.004306  0.000548 -0.002124  0.000163 -0.000633  0.000006 -0.000018  0.000040
                                 0.000005 -0.000017  0.000038  0.000002 -0.000005  0.000011

                                   1 2pz     1 2pz     1 2pz     1 2pz     1 2pz     1 2pz     1 2pz     1 4f0     1 4f2+    1 4f0  
                                   1 4f2+    1 4f0     1 4f2+    1 4f0     1 4f2+    1 4f0     1 4f2+    1 6h2+    1 6h4+    1 6h0  
                                   1 6h2+    1 6h4+    1 6h0     1 6h2+    1 6h4+    1 6h0  

   1.5   +    -0.7034   -4.9194  1.033098 -0.003980 -0.041084 -0.029761  0.006780  0.007609  0.000795  0.000704 -0.000909  0.002117
                                -0.002733  0.002723 -0.003516  0.001343 -0.001734  0.000400 -0.000517 -0.000029  0.000025  0.000021
                                -0.000028  0.000024  0.000020 -0.000008  0.000007  0.000006

 HOMO      1.2    -0.567219 =     -15.4348eV
 LUMO      2.3     0.104463 =       2.8426eV
 LUMO-HOMO         0.671682 =      18.2774eV


 **********************************************************************************************************************************
 DATASETS  * FILE   NREC   LENGTH (MB)   RECORD NAMES
              1      20       98.22       500      610      700      900      950      970     1000      129      960     1100   
                                          VAR    BASINP    GEOM    SYMINP    ZMAT    AOBASIS   BASIS     P2S    ABASIS      S 
                                         1400     1410     1420     1200     1210     1080     1600     1650     1300     1700   
                                           T        V       ECP      H0       H01     AOSYM     SMH    MOLCAS    ERIS     OPER   

              2       4        2.92       700     1000      520     2100   
                                         GEOM     BASIS   MCVARS     RHF  

 PROGRAMS   *        TOTAL       RHF       INT
 CPU TIMES  *         8.08      0.62      7.35
 REAL TIME  *        14.60 SEC
 DISK USED  *       305.74 MB      
 **********************************************************************************************************************************


 PROGRAM * UHF-SCF       Authors: W. Meyer, H.-J. Werner


 NUMBER OF ELECTRONS:       4+    2-    SPACE SYMMETRY=7    SPIN SYMMETRY: Triplet 
 CONVERGENCE THRESHOLDS:    1.00E-05 (Density)    1.00E-07 (Energy)
 MAX. NUMBER OF ITERATIONS:        0
 INTERPOLATION TYPE:            DIIS
 INTERPOLATION STEPS:              2 (START)      1 (STEP)
 LEVEL SHIFTS:                  0.20 (ALPHA)   0.20 (BETA) 

 Number of closed-shell orbitals:    2 (   1   1   0   0   0   0   0   0 )
 Number of open-shell orbitals:      2 (   0   0   1   0   1   0   0   0 )


 Molecular orbitals read from record     2100.2  Type=RHF/CANONICAL (state 1.7)

 Molecular orbital dump at record        2200.2

 Initial alpha occupation   1   1   1   0   1   0   0   0
 Initial beta  occupation   1   1   0   0   0   0   0   0

 ITERATION    DDIFF          GRAD             ENERGY        2-EL.EN.            DIPOLE MOMENTS         DIIS
    1      0.000D+00      0.000D+00       -15.68979385     21.258255    0.00000    0.00000    0.00000    0
 
 Final alpha occupancy:   1   1   1   0   1   0   0   0
 Final beta  occupancy:   1   1   0   0   0   0   0   0

 !UHF STATE 1.7 Energy                -15.689793848270
 Nuclear energy                         0.00000000
 One-electron energy                  -26.31892121
 Two-electron energy                   10.62912736
 Virial quotient                       -1.32456402
 !UHF STATE 1.7 Dipole moment           0.00000000     0.00000000     0.00000000
 Dipole moment /Debye                   0.00000000     0.00000000     0.00000000

 ELECTRON ORBITALS FOR POSITIVE SPIN
 ===================================


   Orb  Occ    Energy  Couls-En    Coefficients

                                   1 1s      1 1s      1 1s      1 1s      1 1s      1 1s      1 1s      1 3d0     1 3d2+    1 3d0  
                                   1 3d2+    1 3d0     1 3d2+    1 3d0     1 3d2+    1 3d0     1 3d2+    1 3d0     1 3d2+    1 5g0  
                                   1 5g4+    1 5g2+    1 5g0     1 5g4+    1 5g2+    1 5g0     1 5g4+    1 5g2+    1 5g0     1 5g4+ 
                                   1 5g2+    1 7i6+    1 7i4+    1 7i2+    1 7i0     1 7i6+    1 7i4+    1 7i2+    1 7i0  

   1.1   +    -1.2598   -6.0752  0.996945  0.002567 -0.005416  0.007603 -0.003750  0.003926 -0.001734 -0.000591  0.001023 -0.001523
                                 0.002638 -0.000430  0.000745 -0.000062  0.000107 -0.000266  0.000461 -0.000121  0.000209 -0.000008
                                -0.000017  0.000013 -0.000002 -0.000004  0.000003 -0.000000 -0.000000  0.000000 -0.000000 -0.000000
                                 0.000000 -0.000000  0.000000 -0.000000  0.000000 -0.000000  0.000000 -0.000000  0.000000

                                   1 2px     1 2px     1 2px     1 2px     1 2px     1 2px     1 2px     1 4f1+    1 4f3+    1 4f1+ 
                                   1 4f3+    1 4f1+    1 4f3+    1 4f1+    1 4f3+    1 4f1+    1 4f3+    1 6h1+    1 6h3+    1 6h5+ 
                                   1 6h1+    1 6h3+    1 6h5+    1 6h1+    1 6h3+    1 6h5+ 

   1.2   +    -0.5672   -4.6952  1.000051  0.000420 -0.000920  0.000343 -0.000030  0.000102 -0.000035  0.000642 -0.000829  0.001388
                                -0.001792  0.001548 -0.001999  0.000714 -0.000922  0.000215 -0.000278  0.000008 -0.000009  0.000012
                                 0.000006 -0.000006  0.000008  0.000001 -0.000002  0.000002

                                   1 2py     1 2py     1 2py     1 2py     1 2py     1 2py     1 2py     1 4f1-    1 4f3-    1 4f1- 
                                   1 4f3-    1 4f1-    1 4f3-    1 4f1-    1 4f3-    1 4f1-    1 4f3-    1 6h1-    1 6h3-    1 6h5- 
                                   1 6h1-    1 6h3-    1 6h5-    1 6h1-    1 6h3-    1 6h5- 

   1.3   +    -0.7034   -4.9194  1.033098 -0.003980 -0.041084 -0.029761  0.006780  0.007609  0.000795  0.000287 -0.001113  0.000864
                                -0.003347  0.001112 -0.004306  0.000548 -0.002124  0.000163 -0.000633  0.000006 -0.000018  0.000040
                                 0.000005 -0.000017  0.000038  0.000002 -0.000005  0.000011

                                   1 2pz     1 2pz     1 2pz     1 2pz     1 2pz     1 2pz     1 2pz     1 4f0     1 4f2+    1 4f0  
                                   1 4f2+    1 4f0     1 4f2+    1 4f0     1 4f2+    1 4f0     1 4f2+    1 6h2+    1 6h4+    1 6h0  
                                   1 6h2+    1 6h4+    1 6h0     1 6h2+    1 6h4+    1 6h0  

   1.5   +    -0.7034   -4.9194  1.033098 -0.003980 -0.041084 -0.029761  0.006780  0.007609  0.000795  0.000704 -0.000909  0.002117
                                -0.002733  0.002723 -0.003516  0.001343 -0.001734  0.000400 -0.000517 -0.000029  0.000025  0.000021
                                -0.000028  0.000024  0.000020 -0.000008  0.000007  0.000006

 ELECTRON ORBITALS FOR NEGATIVE SPIN
 ===================================


   Orb  Occ    Energy  Couls-En    Coefficients

                                   1 1s      1 1s      1 1s      1 1s      1 1s      1 1s      1 1s      1 3d0     1 3d2+    1 3d0  
                                   1 3d2+    1 3d0     1 3d2+    1 3d0     1 3d2+    1 3d0     1 3d2+    1 3d0     1 3d2+    1 5g0  
                                   1 5g4+    1 5g2+    1 5g0     1 5g4+    1 5g2+    1 5g0     1 5g4+    1 5g2+    1 5g0     1 5g4+ 
                                   1 5g2+    1 7i6+    1 7i4+    1 7i2+    1 7i0     1 7i6+    1 7i4+    1 7i2+    1 7i0  

   1.1   -    -1.2598   -6.0752  0.996945  0.002567 -0.005416  0.007603 -0.003750  0.003926 -0.001734 -0.000591  0.001023 -0.001523
                                 0.002638 -0.000430  0.000745 -0.000062  0.000107 -0.000266  0.000461 -0.000121  0.000209 -0.000008
                                -0.000017  0.000013 -0.000002 -0.000004  0.000003 -0.000000 -0.000000  0.000000 -0.000000 -0.000000
                                 0.000000 -0.000000  0.000000 -0.000000  0.000000 -0.000000  0.000000 -0.000000  0.000000

                                   1 2px     1 2px     1 2px     1 2px     1 2px     1 2px     1 2px     1 4f1+    1 4f3+    1 4f1+ 
                                   1 4f3+    1 4f1+    1 4f3+    1 4f1+    1 4f3+    1 4f1+    1 4f3+    1 6h1+    1 6h3+    1 6h5+ 
                                   1 6h1+    1 6h3+    1 6h5+    1 6h1+    1 6h3+    1 6h5+ 

   1.2   -    -0.5672   -4.6952  1.000051  0.000420 -0.000920  0.000343 -0.000030  0.000102 -0.000035  0.000642 -0.000829  0.001388
                                -0.001792  0.001548 -0.001999  0.000714 -0.000922  0.000215 -0.000278  0.000008 -0.000009  0.000012
                                 0.000006 -0.000006  0.000008  0.000001 -0.000002  0.000002

 HOMO      1.2    -0.567219 =     -15.4348eV
 LUMO     -1.3    -0.703357 =     -19.1393eV
 LUMO-HOMO        -0.136138 =      -3.7045eV

 EXPECTATION VALUE OF S**2:             2.00000000

 Occupation number threshold for canonical orbitals:  1.999000 (occupied),  0.001000 (virtual)

 Number of pseudo-canonical orbitals per symmetry:    1   1   0   0   0   0   0   0
 Number of active natural orbitals per symmetry:      0   0   1   0   1   0   0   0

 NATURAL CHARGE ORBITALS
 =======================


   Orb     Occ        Energy       Coefficients

                                   1 1s      1 1s      1 1s      1 1s      1 1s      1 1s      1 1s      1 3d0     1 3d2+    1 3d0  
                                   1 3d2+    1 3d0     1 3d2+    1 3d0     1 3d2+    1 3d0     1 3d2+    1 3d0     1 3d2+    1 5g0  
                                   1 5g4+    1 5g2+    1 5g0     1 5g4+    1 5g2+    1 5g0     1 5g4+    1 5g2+    1 5g0     1 5g4+ 
                                   1 5g2+    1 7i6+    1 7i4+    1 7i2+    1 7i0     1 7i6+    1 7i4+    1 7i2+    1 7i0  

   1.1  2.00000    -1.259756     0.996945  0.002567 -0.005416  0.007603 -0.003750  0.003926 -0.001734 -0.000591  0.001023 -0.001523
                                 0.002638 -0.000430  0.000745 -0.000062  0.000107 -0.000266  0.000461 -0.000121  0.000209 -0.000008
                                -0.000017  0.000013 -0.000002 -0.000004  0.000003 -0.000000 -0.000000  0.000000 -0.000000 -0.000000
                                 0.000000 -0.000000  0.000000 -0.000000  0.000000 -0.000000  0.000000 -0.000000  0.000000

                                   1 2px     1 2px     1 2px     1 2px     1 2px     1 2px     1 2px     1 4f1+    1 4f3+    1 4f1+ 
                                   1 4f3+    1 4f1+    1 4f3+    1 4f1+    1 4f3+    1 4f1+    1 4f3+    1 6h1+    1 6h3+    1 6h5+ 
                                   1 6h1+    1 6h3+    1 6h5+    1 6h1+    1 6h3+    1 6h5+ 

   1.2  2.00000    -0.567219     1.000051  0.000420 -0.000920  0.000343 -0.000030  0.000102 -0.000035  0.000642 -0.000829  0.001388
                                -0.001792  0.001548 -0.001999  0.000714 -0.000922  0.000215 -0.000278  0.000008 -0.000009  0.000012
                                 0.000006 -0.000006  0.000008  0.000001 -0.000002  0.000002

                                   1 2py     1 2py     1 2py     1 2py     1 2py     1 2py     1 2py     1 4f1-    1 4f3-    1 4f1- 
                                   1 4f3-    1 4f1-    1 4f3-    1 4f1-    1 4f3-    1 4f1-    1 4f3-    1 6h1-    1 6h3-    1 6h5- 
                                   1 6h1-    1 6h3-    1 6h5-    1 6h1-    1 6h3-    1 6h5- 

   1.3  1.00000    -0.267423     1.033098 -0.003980 -0.041084 -0.029761  0.006780  0.007609  0.000795  0.000287 -0.001113  0.000864
                                -0.003347  0.001112 -0.004306  0.000548 -0.002124  0.000163 -0.000633  0.000006 -0.000018  0.000040
                                 0.000005 -0.000017  0.000038  0.000002 -0.000005  0.000011

                                   1 2pz     1 2pz     1 2pz     1 2pz     1 2pz     1 2pz     1 2pz     1 4f0     1 4f2+    1 4f0  
                                   1 4f2+    1 4f0     1 4f2+    1 4f0     1 4f2+    1 4f0     1 4f2+    1 6h2+    1 6h4+    1 6h0  
                                   1 6h2+    1 6h4+    1 6h0     1 6h2+    1 6h4+    1 6h0  

   1.5  1.00000    -0.267423     1.033098 -0.003980 -0.041084 -0.029761  0.006780  0.007609  0.000795  0.000704 -0.000909  0.002117
                                -0.002733  0.002723 -0.003516  0.001343 -0.001734  0.000400 -0.000517 -0.000029  0.000025  0.000021
                                -0.000028  0.000024  0.000020 -0.000008  0.000007  0.000006

 Natural orbitals saved to record    2200.2 (Orbital set 3)

 Orbital spaces for UNO-CAS (Min. occupation: 0.020  Max. occupation: 1.980):

 Closed:        1   1   0   0   0   0   0   0
 Active:        0   0   1   0   1   0   0   0

 No convergence



 **********************************************************************************************************************************
 DATASETS  * FILE   NREC   LENGTH (MB)   RECORD NAMES
              1      20       98.22       500      610      700      900      950      970     1000      129      960     1100   
                                          VAR    BASINP    GEOM    SYMINP    ZMAT    AOBASIS   BASIS     P2S    ABASIS      S 
                                         1400     1410     1420     1200     1210     1080     1600     1650     1300     1700   
                                           T        V       ECP      H0       H01     AOSYM     SMH    MOLCAS    ERIS     OPER   

              2       5        5.69       700     1000      520     2100     2200   
                                         GEOM     BASIS   MCVARS     RHF      UHF  

 PROGRAMS   *        TOTAL       UHF       RHF       INT
 CPU TIMES  *         8.16      0.08      0.62      7.35
 REAL TIME  *        14.88 SEC
 DISK USED  *       305.74 MB      
 **********************************************************************************************************************************
 SETTING SCF(I)         =       -15.68979385  AU                              


 PROGRAM * MRCC (General Multireference Coupled Cluster)    Author: M. Kallay, 2000-2005

 ***  Initialisation ***

   0 Spin projections
 
 Molecular orbitals read from record     2200.2  Type=UHF/ALPHA (state 1.7)

 ?Warning: UHF not converged
 Molecular orbitals read from record     2200.2  Type=UHF/BETA (state 1.7)

 ?Warning: UHF not converged
 
 Frozen orbitals:              0 (  0  0  0  0  0  0  0  0)
 Active orbitals:            188 ( 39 26 26 20 26 20 20 11)
 Active electrons:             6
 Spin quantum number:          1.0

 Transformed integrals will be written to file mrcc_52330/fort.55

 Load integrals                8.7 sec
 Transform integrals          19.9 sec
 Storage for integrals:      119071012
 Remaining memory:           *********

 Core energy:               0.00000000
 
 MRCC Input:
     4     0     0     0     3     0     0     7     0     0     0     1     1     0     0     7     0     0   0.000     0   32000
  ex.lev,nsing,ntrip, rest,method,dens,conver,symm, diag, CS ,spatial, HF, ndoub,nacto,nactv, tol, maxex, sacc, freq,  dboc,   mem
  2  0  0  0  0  0  0  0  0  0  0  0  0  0  0  0  0  0  0  0  0  0  0  0  0  0  0  0  0  0  0  0  0  0  0  0  0  0  0  2  0  0  0  0  0  0  0  0  0  0  0  0  0  0  0  0  0  0  0  0  0  0  0  0  0  1  0  0  0  0  0  0  0  0  0  0  0  0  0  0  0  0  0  0  0  0  0  0  0  0  0  0  0  0  0  0  0  0  0  0  0  0  0  0  0  0  0  0  0  0  0  1  0  0  0  0  0  0  0  0  0  0  0  0  0  0  0  0  0  0  0  0  0  0  0  0  0  0  0  0  0  0  0  0  0  0  0  0  0  0  0  0  0  0  0  0  0  0  0  0  0  0  0  0  0  0  0  0  0  0  0  0  0  0  0  0  0  0  0  0  0  0  0  0  0  0  0  0
 MRCC Input end
 Variable memory released
 MRCC now being run, temporary output in /global/cscratch1/sd/aannabe/mrcc_52330/mrcc.out
 **********************************************************************
                          MRCC program system
 **********************************************************************

                              Written by
  Mihaly Kallay, Zoltan Rolik, Jozsef Csontos, Peter Nagy, Gyula Samu,
      David Mester, Jozsef Csoka, Bernat Szabo, Istvan Ladjanszki,
       Lorant Szegedy, Bence Ladoczki, Klara Petrov, Mate Farkas,
                    Pal D. Mezei, and Bence Hegely

        Department of Physical Chemistry and Materials Science
            Budapest University of Technology and Economics
                  Budapest P.O.Box 91, H-1521 Hungary

                              www.mrcc.hu

                       Release date: May 23, 2018

 ************************ 2018-05-31 10:12:23 *************************
 Executing goldstone...

 Generation of CC equations in terms of H and T...
 Generation of antisymmetrized Goldstone diagrams...
 Number of diagrams in T^1 equations:    15
 Number of diagrams in T^2 equations:    38
 Number of diagrams in T^3 equations:    49
 Number of diagrams in T^4 equations:     5
 Translation of diagrams to factorized equations...
 Optimizing intermediate calculation...
 Number of floating-point operations per iteration step:   3.9954E+12
 Probable CPU time per iteration step (hours):     39.95
 Required memory (Mbytes):  152519.1
 Number of intermediates:                                  79
 Number of intermediates to be stored:                     32
 Length of intermediate file (Mbytes):    2454.7

 ************************ 2018-05-31 10:12:25 *************************
 Executing xmrcc...

 **********************************************************************
 CC(3)(4) calculation


 Allocation of****** Mbytes of memory...
 Number of spinorbitals:                   376
 Number of alpha electrons:                        4
 Number of beta electrons:                         2
 Spin multiplicity:                     2
 z-component of spin:  1.0
 Spatial symmetry:                      7
 Convergence criterion:  1.0E-07
 Construction of occupation graphs...
 Number of                     0 -fold excitations:                      1
 Number of                     1 -fold excitations:                    176
 Number of                     2 -fold excitations:                  50148
 Number of                     3 -fold excitations:                6791476
 Total number of configurations:                6841801
 Calculation of coupling coefficients...
 Length of intermediate file (Mbytes):    1850.1

 ======================================================================

 Spin case  1   Alpha:  2   Beta:  2
 Number of excitations:              217249194
 Spin case  2   Alpha:  3   Beta:  1
 Number of excitations:              189896528
 Spin case  3   Alpha:  4   Beta:  0
 Number of excitations:                5778276
 Number of                     4 -fold excitations:              412923998

 Memory requirements /Mbyte/:
               Minimal        Optimal
 Real*8:       3948.7500      9531.1702
 Integer:       261.7832
 Total:        4210.5332      9792.9534


 ************************ 2018-05-31 10:13:11 *************************
 Executing mrcc...

 **********************************************************************
 CCSDT(Q) calculation


 OpenMP parallel version is running.
 Number of CPUs:   1
 Allocation of 9531.2 Mbytes of memory...
 Number of spinorbitals: 376
 Number of alpha electrons:  4
 Number of beta  electrons:  2
 Spin multiplicity: 2
 z-component of spin:  1.0
 Spatial symmetry: 7
 Convergence criterion:  1.0E-07
 Construction of occupation graphs...
 Number of 0-fold excitations: 1
 Number of 1-fold excitations: 176
 Number of 2-fold excitations: 50148
 Number of 3-fold excitations: 6791476
 Total number of determinants: 6841801
 Calculation of coupling coefficients...
 Initial cluster amplitudes are generated.
 Length of intermediate file (Mbytes):    1850.1
 Reading integral list from unit 55...
 Sorting integrals...
 Sorting integrals...
 Sorting integrals...
 Sorting integrals...
 Energy of reference determinant [au]:     -15.689793848270
 Calculation of MP denominators...

 Starting CC iteration...
 ======================================================================
 Norm of residual vector:     1.24890319
 CPU time [min]:     6.621                   Wall time [min]:     6.625

 Iteration  1  CC energy:   -15.86599359  Energy decrease:   0.17619974
 ======================================================================
 Norm of residual vector:     0.25684073
 CPU time [min]:    10.402                   Wall time [min]:    10.412

 Iteration  2  CC energy:   -15.87444639  Energy decrease:   0.00845280
 ======================================================================
 Norm of residual vector:     0.05216602
 CPU time [min]:    14.501                   Wall time [min]:    14.515

 Iteration  3  CC energy:   -15.88131307  Energy decrease:   0.00686668
 ======================================================================
 Norm of residual vector:     0.01486558
 CPU time [min]:    18.877                   Wall time [min]:    18.894

 Iteration  4  CC energy:   -15.88213338  Energy decrease:   0.00082032
 ======================================================================
 Norm of residual vector:     0.00700522
 CPU time [min]:    22.742                   Wall time [min]:    22.762

 Iteration  5  CC energy:   -15.88187147  Energy decrease:   0.00026191
 ======================================================================
 Norm of residual vector:     0.00319066
 CPU time [min]:    27.128                   Wall time [min]:    27.152

 Iteration  6  CC energy:   -15.88187919  Energy decrease:   0.00000772
 ======================================================================
 Norm of residual vector:     0.00154466
 CPU time [min]:    32.111                   Wall time [min]:    32.139

 Iteration  7  CC energy:   -15.88192489  Energy decrease:   0.00004569
 ======================================================================
 Norm of residual vector:     0.00071505
 CPU time [min]:    35.719                   Wall time [min]:    35.750

 Iteration  8  CC energy:   -15.88192948  Energy decrease:   0.00000459
 ======================================================================
 Norm of residual vector:     0.00029075
 CPU time [min]:    39.284                   Wall time [min]:    39.319

 Iteration  9  CC energy:   -15.88192861  Energy decrease:   0.00000087
 ======================================================================
 Norm of residual vector:     0.00012368
 CPU time [min]:    42.849                   Wall time [min]:    42.887

 Iteration 10  CC energy:   -15.88192970  Energy decrease:   0.00000109
 ======================================================================
 Norm of residual vector:     0.00005561
 CPU time [min]:    46.428                   Wall time [min]:    46.471

 Iteration 11  CC energy:   -15.88192971  Energy decrease:   0.00000001
 ======================================================================
 Norm of residual vector:     0.00002153
 CPU time [min]:    50.008                   Wall time [min]:    50.055

 Iteration 12  CC energy:   -15.88192942  Energy decrease:   0.00000029
 ======================================================================
 Norm of residual vector:     0.00000846
 CPU time [min]:    53.568                   Wall time [min]:    53.678

 Iteration 13  CC energy:   -15.88192944  Energy decrease:   0.00000001
 ======================================================================
 Norm of residual vector:     0.00000284
 CPU time [min]:    57.138                   Wall time [min]:    57.320

 Iteration 14  CC energy:   -15.88192947  Energy decrease:   0.00000003
 ======================================================================
 Norm of residual vector:     0.00000095
 CPU time [min]:    60.725                   Wall time [min]:    60.941

 Iteration 15  CC energy:   -15.88192946  Energy decrease:   0.00000001
 ======================================================================
 Norm of residual vector:     0.00000035
 CPU time [min]:    64.434                   Wall time [min]:    64.658

 Iteration 16  CC energy:   -15.88192946  Energy decrease:   0.00000001
 ======================================================================
 Norm of residual vector:     0.00000012
 CPU time [min]:    68.142                   Wall time [min]:    68.380

 Iteration 17  CC energy:   -15.88192946  Energy decrease:   2.1814E-09
 ======================================================================
 Norm of residual vector:     0.00000004
 CPU time [min]:    72.403                   Wall time [min]:    72.648

 Iteration 18  CC energy:   -15.88192946  Energy decrease:   3.3307E-10
 ======================================================================

 Iteration has converged in 18 steps.

 Final results:
 Total CCSDT energy [au]:            -15.881929458976
 Total MP2 energy [au]:              -15.865993586103

 Perturbative corrections are calculated...
 ======================================================================
 Spin case  1   Alpha:  2   Beta:  2
 Number of excitations:        217249194
 CPU time [min]:  1185.220                   Wall time [min]:  1185.438
 ======================================================================
 Spin case  2   Alpha:  3   Beta:  1
 Number of excitations:        189896528
 CPU time [min]:  1950.516                   Wall time [min]:  1950.778
 ======================================================================
 Spin case  3   Alpha:  4   Beta:  0
 Number of excitations:        5778276
 CPU time [min]:  2037.409                   Wall time [min]:  2037.695
 ======================================================================
 Number of 4-fold excitations: 412923998
 CPU time [min]:  2037.409                   Wall time [min]:  2037.717

 Total CCSDT[Q] energy [au]:         -15.881912091252
 Total CCSDT(Q) energy [au]:         -15.882012076868

 ************************ 2018-06-01 20:10:56 *************************
                      Normal termination of mrcc.
 **********************************************************************
 !CCSDT STATE 1.7 Energy              -15.881929458976
 !MP2 STATE 1.7 Energy                -15.865993586103
 !CCSDT[Q] STATE 1.7 Energy           -15.881912091252
 !CCSDT(Q) STATE 1.7 Energy           -15.882012076868
 
 CPU-time for MRCC:         122244.5 sec
 Elapsed-time for MRCC:     122315.9 sec

 Variable memory set to 4000000000 words,  buffer space   230000 words



 **********************************************************************************************************************************
 DATASETS  * FILE   NREC   LENGTH (MB)   RECORD NAMES
              1      20       98.22       500      610      700      900      950      970     1000      129      960     1100   
                                          VAR    BASINP    GEOM    SYMINP    ZMAT    AOBASIS   BASIS     P2S    ABASIS      S 
                                         1400     1410     1420     1200     1210     1080     1600     1650     1300     1700   
                                           T        V       ECP      H0       H01     AOSYM     SMH    MOLCAS    ERIS     OPER   

              2       5        5.69       700     1000      520     2100     2200   
                                         GEOM     BASIS   MCVARS     RHF      UHF  

 PROGRAMS   *        TOTAL      MRCC       UHF       RHF       INT
 CPU TIMES  *    122624.85 122616.70      0.08      0.62      7.35
 REAL TIME  *    123085.40 SEC
 DISK USED  *       305.74 MB      
 **********************************************************************************************************************************
 SETTING POSTHF(I)      =       -15.88201208  AU                              
                                                                                                                                                                                                                                                                

        SCF            POSTHF
    -15.68979385   -15.88201208
                                                  

 CCSDT(Q)/USERDEF energy=    -15.882012076868

        CCSDT(Q)        RHF-SCF 
    -15.88201208    -15.68979385
 **********************************************************************************************************************************
 Variable memory released
