
 Primary working directories    : /global/cscratch1/sd/aannabe
 Secondary working directories  : /global/cscratch1/sd/aannabe
 Wavefunction directory         : /global/homes/a/aannabe/wfu/
 Main file repository           : /global/cscratch1/sd/aannabe/

 SHA1      : 2873118e99aab1bc19f5b6fc1784693c06d15c95
 NAME      : 2015.1.8
 ARCHNAME  : linux/x86_64
 FC        : /opt/cray/pe/craype/2.5.5/bin/ftn
 BLASLIB   : -Wl,-_start-group /opt/intel/compilers_and_libraries_2016.3.210/linux/mkl/lib/intel64/libmkl_intel_ilp64.a /opt/intel/compilers_and_libraries_2016.3.210/linux/mkl/lib/intel64/libmkl_intel_thread.a /opt/intel/compilers_and_libraries_2016.3.210/linux/mkl/lib/intel64/libmkl_core.a -Wl,-_end-group
 id        : lbl

 Nodes     nprocs
 nid00496     1

 Using customized tuning parameters: mindgm=8; mindgv=16; mindgc=4; mindgr=1; noblas=0; minvec=7
 default implementation of scratch files=df  

 ***,B
 memory,8,g
 gthresh,twoint=1.e-12
 
 gprint,basis,orbitals
 gexpec,ekin,pot
 
 angstrom
 geometry={
 1                                                                               ! Number of atoms
 B 0.0 0.0 0.0
 }
 
 basis={
 Including file /global/homes/a/aannabe/docs/totals/pps/B.pp
 Including file /global/homes/a/aannabe/docs/totals/basis/aug-cc-pVnZ/B_tz.basis
 }
 
 {hf
 wf,3,2,1
 occ,1,1,0,0,0,0,0,0
 open,1.2
                                                                                 !closed,1,0,0,0,0,0,0,0
                                                                                 !sym,
 }
 scf(i)=energy
 
 _CC_NORM_MAX=2.0
  !NOTE: Perturbative MRCC works only with UHF reference. So, here we will trick MRCC by doing zero UHF iteration right after ROHF.
 
 {uhf
 wf,3,2,1
 occ,1,1,0,0,0,0,0,0
 open,1.2
                                                                                 !closed,1,0,0,0,0,0,0,0
                                                                                 !sym,
 maxit,0
 }
 scf(i)=energy
 
 {mrcc,method=CCSDT(Q)
 orbital,ignore_error=1                                                          !Ignore the fact that UHF WF is not converged
 maxit,100
 core
 }
 posthf(i)=energy
 
 table,scf,posthf,ekin,pot
 save,3.csv,new
 
 

 Variables initialized (889), CPU time= 0.00 sec
 Commands  initialized (702), CPU time= 0.01 sec, 572 directives.
 Default parameters read. Elapsed time= 0.13 sec

 Checking input...
 Passed
1


                                         ***  PROGRAM SYSTEM MOLPRO  ***
                                       Copyright, TTI GmbH Stuttgart, 2015
                                    Version 2015.1 linked Sep  7 2016 23:09:38


 **********************************************************************************************************************************
 LABEL *   B                                                                             
  64 bit serial version                                                                  DATE: 15-Jun-18          TIME: 16:17:32  
 **********************************************************************************************************************************

 SHA1:             2873118e99aab1bc19f5b6fc1784693c06d15c95
 **********************************************************************************************************************************

 THRESHOLDS:

 ZERO    =  1.00D-12  ONEINT  =  1.00D-12  TWOINT  =  1.00D-12  PREFAC  =  1.00D-14  LOCALI  =  1.00D-09  EORDER  =  1.00D-04
 ENERGY  =  0.00D+00  ETEST   =  0.00D+00  EDENS   =  0.00D+00  THRDEDEF=  1.00D-06  GRADIENT=  1.00D-02  STEP    =  1.00D-03
 ORBITAL =  1.00D-05  CIVEC   =  1.00D-05  COEFF   =  1.00D-04  PRINTCI =  5.00D-02  PUNCHCI =  9.90D+01  OPTGRAD =  3.00D-04
 OPTENERG=  1.00D-06  OPTSTEP =  3.00D-04  THRGRAD =  1.00D-10  COMPRESS=  1.00D-11  VARMIN  =  1.00D-07  VARMAX  =  1.00D-03
 THRDOUB =  0.00D+00  THRDIV  =  1.00D-05  THRRED  =  1.00D-07  THRPSP  =  1.00D+00  THRDC   =  1.00D-10  THRCS   =  1.00D-10
 THRNRM  =  1.00D-08  THREQ   =  0.00D+00  THRDE   =  1.00D+00  THRREF  =  1.00D-05  SPARFAC =  1.00D+00  THRDLP  =  1.00D-07
 THRDIA  =  1.00D-10  THRDLS  =  1.00D-07  THRGPS  =  0.00D+00  THRKEX  =  0.00D+00  THRDIS  =  2.00D-01  THRVAR  =  1.00D-10
 THRLOC  =  1.00D-06  THRGAP  =  1.00D-06  THRLOCT = -1.00D+00  THRGAPT = -1.00D+00  THRORB  =  1.00D-06  THRMLTP =  0.00D+00
 THRCPQCI=  1.00D-10  KEXTA   =  0.00D+00  THRCOARS=  0.00D+00  SYMTOL  =  1.00D-06  GRADTOL =  1.00D-06  THROVL  =  1.00D-08
 THRORTH =  1.00D-08  GRID    =  1.00D-06  GRIDMAX =  1.00D-03  DTMAX   =  0.00D+00  THROCCDE=  1.00D-01  THROCCDE=  1.00D-01



 ZUNIT=ANG
 

Geometry recognized as XYZ


 Variable memory set to 8000000000 words,  buffer space   230000 words

 SETTING BASIS          =    USERDEF


 Recomputing integrals since basis changed


 Using spherical harmonics



 PROGRAM * SEWARD (Integral evaluation for generally contracted gaussian basis sets)     Author: Roland Lindh, 1990

 Geometry written to block  1 of record 700

 Orientation using atomic masses  
 Molecule type: Atom
 Symmetry elements: X,Y,Z
 Rotational constants:       0.0000000      0.0000000      0.0000000 GHz  (calculated with average atomic masses)

 Point group  D2h 



 ATOMIC COORDINATES

 NR  ATOM    CHARGE       X              Y              Z

   1  B       3.00    0.000000000    0.000000000    0.000000000


          B   CORE POTENTIAL

          p POTENTIAL

 POWERS             1              3              2
 EXPONENTIALS   31.49298       22.56509       8.646690    
 COEFFICIENTS   3.000000       94.47895      -9.748000    

          s - p POTENTIAL

 POWERS             2
 EXPONENTIALS   4.062460    
 COEFFICIENTS   20.74800    


 BASIS DATA

   Nr Sym  Nuc  Type         Exponents   Contraction coefficients

    1.1 Ag    1  1s          11.760500    -0.003676
                              5.150520     0.025052
                              2.578276    -0.124923
                              1.290648    -0.066287
                              0.646080     0.100734
                              0.323418     0.337549
                              0.161898     0.430843
                              0.081044     0.248656
                              0.040569     0.031730
    2.1 Ag    1  1s           0.626026     1.000000
    3.1 Ag    1  1s           0.092094     1.000000
    4.1 Ag    1  1s           0.036838     1.000000
    5.1 Ag    1  3d0          0.699153     1.000000
    6.1 Ag    1  3d2+         0.699153     1.000000
    7.1 Ag    1  3d0          0.207316     1.000000
    8.1 Ag    1  3d2+         0.207316     1.000000
    9.1 Ag    1  3d0          0.082926     1.000000
   10.1 Ag    1  3d2+         0.082926     1.000000
    1.2 B3u   1  2px          7.470701     0.004740
                              3.735743     0.037601
                              1.868068     0.051060
                              0.934132     0.145659
                              0.467115     0.223793
                              0.233582     0.319947
                              0.116803     0.285019
                              0.058408     0.144881
                              0.029207     0.017696
    2.2 B3u   1  2px          0.235016     1.000000
    3.2 B3u   1  2px          0.082056     1.000000
    4.2 B3u   1  2px          0.032822     1.000000
    5.2 B3u   1  4f1+         0.478872     1.000000
    6.2 B3u   1  4f3+         0.478872     1.000000
    7.2 B3u   1  4f1+         0.191549     1.000000
    8.2 B3u   1  4f3+         0.191549     1.000000
    1.3 B2u   1  2py          7.470701     0.004740
                              3.735743     0.037601
                              1.868068     0.051060
                              0.934132     0.145659
                              0.467115     0.223793
                              0.233582     0.319947
                              0.116803     0.285019
                              0.058408     0.144881
                              0.029207     0.017696
    2.3 B2u   1  2py          0.235016     1.000000
    3.3 B2u   1  2py          0.082056     1.000000
    4.3 B2u   1  2py          0.032822     1.000000
    5.3 B2u   1  4f1-         0.478872     1.000000
    6.3 B2u   1  4f3-         0.478872     1.000000
    7.3 B2u   1  4f1-         0.191549     1.000000
    8.3 B2u   1  4f3-         0.191549     1.000000
    1.4 B1g   1  3d2-         0.699153     1.000000
    2.4 B1g   1  3d2-         0.207316     1.000000
    3.4 B1g   1  3d2-         0.082926     1.000000
    1.5 B1u   1  2pz          7.470701     0.004740
                              3.735743     0.037601
                              1.868068     0.051060
                              0.934132     0.145659
                              0.467115     0.223793
                              0.233582     0.319947
                              0.116803     0.285019
                              0.058408     0.144881
                              0.029207     0.017696
    2.5 B1u   1  2pz          0.235016     1.000000
    3.5 B1u   1  2pz          0.082056     1.000000
    4.5 B1u   1  2pz          0.032822     1.000000
    5.5 B1u   1  4f0          0.478872     1.000000
    6.5 B1u   1  4f2+         0.478872     1.000000
    7.5 B1u   1  4f0          0.191549     1.000000
    8.5 B1u   1  4f2+         0.191549     1.000000
    1.6 B2g   1  3d1+         0.699153     1.000000
    2.6 B2g   1  3d1+         0.207316     1.000000
    3.6 B2g   1  3d1+         0.082926     1.000000
    1.7 B3g   1  3d1-         0.699153     1.000000
    2.7 B3g   1  3d1-         0.207316     1.000000
    3.7 B3g   1  3d1-         0.082926     1.000000
    1.8 Au    1  4f2-         0.478872     1.000000
    2.8 Au    1  4f2-         0.191549     1.000000

 NUCLEAR CHARGE:                    3
 NUMBER OF PRIMITIVE AOS:          86
 NUMBER OF SYMMETRY AOS:           77
 NUMBER OF CONTRACTIONS:           45   (  10Ag  +   8B3u +   8B2u +   3B1g +   8B1u +   3B2g +   3B3g +   2Au  )
 NUMBER OF CORE ORBITALS:           0   (   0Ag  +   0B3u +   0B2u +   0B1g +   0B1u +   0B2g +   0B3g +   0Au  )
 NUMBER OF VALENCE ORBITALS:        4   (   1Ag  +   1B3u +   1B2u +   0B1g +   1B1u +   0B2g +   0B3g +   0Au  )


 NUCLEAR REPULSION ENERGY    0.00000000

 EXTRA SYMMETRY OF AOS IN SYMMETRY 1:   1 1 1 1 2 3 2 3 2 3
 EXTRA SYMMETRY OF AOS IN SYMMETRY 2:   1 1 1 1 2 3 2 3
 EXTRA SYMMETRY OF AOS IN SYMMETRY 3:   1 1 1 1 2 3 2 3
 EXTRA SYMMETRY OF AOS IN SYMMETRY 5:   1 1 1 1 2 3 2 3

 Eigenvalues of metric

         1 0.159E-01 0.155E+00 0.196E+00 0.196E+00 0.739E+00 0.823E+00 0.823E+00 0.198E+01
         2 0.339E-01 0.113E+00 0.367E+00 0.367E+00 0.787E+00 0.163E+01 0.163E+01 0.307E+01
         3 0.339E-01 0.113E+00 0.367E+00 0.367E+00 0.787E+00 0.163E+01 0.163E+01 0.307E+01
         4 0.196E+00 0.823E+00 0.198E+01
         5 0.339E-01 0.113E+00 0.367E+00 0.367E+00 0.787E+00 0.163E+01 0.163E+01 0.307E+01
         6 0.196E+00 0.823E+00 0.198E+01
         7 0.196E+00 0.823E+00 0.198E+01
         8 0.367E+00 0.163E+01


 Contracted 2-electron integrals neglected if value below      1.0D-12
 AO integral compression algorithm  1   Integral accuracy      1.0D-12

     1.049 MB (compressed) written to integral file ( 92.5%)


 NUMBER OF SORTED TWO-ELECTRON INTEGRALS:      75808.     BUFFER LENGTH:  32768
 NUMBER OF SEGMENTS:   1  SEGMENT LENGTH:      75808      RECORD LENGTH: 524288

 Memory used in sort:       0.63 MW

 SORT1 READ      155797. AND WROTE       61548. INTEGRALS IN      1 RECORDS. CPU TIME:     0.00 SEC, REAL TIME:     0.01 SEC
 SORT2 READ       61548. AND WROTE       75808. INTEGRALS IN      4 RECORDS. CPU TIME:     0.02 SEC, REAL TIME:     0.03 SEC

 FILE SIZES:   FILE 1:    20.2 MBYTE,  FILE 4:     4.2 MBYTE,   TOTAL:     24.4 MBYTE

 OPERATOR DM      FOR CENTER  0  COORDINATES:    0.000000    0.000000    0.000000
 OPERATOR EKIN    FOR CENTER  0  COORDINATES:    0.000000    0.000000    0.000000
 OPERATOR POT     FOR CENTER  0  COORDINATES:    0.000000    0.000000    0.000000


 **********************************************************************************************************************************
 DATASETS  * FILE   NREC   LENGTH (MB)   RECORD NAMES
              1      20       19.60       500      610      700      900      950      970     1000      129      960     1100   
                                          VAR    BASINP    GEOM    SYMINP    ZMAT    AOBASIS   BASIS     P2S    ABASIS      S 
                                         1400     1410     1420     1200     1210     1080     1600     1650     1300     1700   
                                         EKIN       V       ECP      H0       H01     AOSYM     SMH    MOLCAS    ERIS     OPER   

 PROGRAMS   *        TOTAL       INT
 CPU TIMES  *         2.06      1.96
 REAL TIME  *        12.39 SEC
 DISK USED  *        24.67 MB      
 **********************************************************************************************************************************


 PROGRAM * RHF-SCF (OPEN SHELL)       Authors: W. Meyer, H.-J. Werner


 NUMBER OF ELECTRONS:       2+    1-    SPACE SYMMETRY=2    SPIN SYMMETRY: Doublet 
 CONVERGENCE THRESHOLDS:    1.00E-05 (Density)    1.00E-07 (Energy)
 MAX. NUMBER OF ITERATIONS:       60
 INTERPOLATION TYPE:            DIIS
 INTERPOLATION STEPS:              2 (START)      1 (STEP)
 LEVEL SHIFTS:                 -0.60 (CLOSED) -0.30 (OPEN) 


 Singly occupied orbitals:      1.2

   Atom=B  basis=ECP2MWB_GUESS     lmin=0  lmax=1

 Orbital guess generated from atomic densities. Full valence occupancy:    1   1   1   0   1   0   0   0


 Molecular orbital dump at record        2100.2

 ITERATION    DDIFF          GRAD             ENERGY        2-EL.EN.            DIPOLE MOMENTS         DIIS   ORB.
    1      0.000D+00      0.000D+00        -2.51353244      2.212992    0.00000    0.00000    0.00000    0    start
    2      0.000D+00      0.155D-01        -2.53017137      2.341996    0.00000    0.00000    0.00000    1    diag,B
    3      0.221D-01      0.693D-02        -2.53714430      2.435335    0.00000    0.00000    0.00000    2    diag,B
    4      0.148D-01      0.307D-02        -2.53905708      2.471528    0.00000    0.00000    0.00000    3    diag,B
    5      0.842D-02      0.120D-02        -2.53929291      2.479462    0.00000    0.00000    0.00000    4    diag,B
    6      0.578D-02      0.251D-03        -2.53929876      2.480406    0.00000    0.00000    0.00000    5    diag,B
    7      0.753D-03      0.956D-04        -2.53929949      2.479974    0.00000    0.00000    0.00000    6    fixocc
    8      0.266D-03      0.166D-04        -2.53929951      2.479979    0.00000    0.00000    0.00000    7    diag,B
    9      0.440D-04      0.303D-05        -2.53929951      2.479998    0.00000    0.00000    0.00000    8    diag,B
   10      0.126D-04      0.153D-05        -2.53929951      2.479987    0.00000    0.00000    0.00000    9    orth
   11      0.412D-05      0.154D-06        -2.53929951      2.479987    0.00000    0.00000    0.00000    0    orth

 Final alpha occupancy:   1   1   0   0   0   0   0   0
 Final beta  occupancy:   1   0   0   0   0   0   0   0

 !RHF STATE 1.2 Energy                 -2.539299514384
 Nuclear energy                         0.00000000
 One-electron energy                   -3.77929300
 Two-electron energy                    1.23999349
 Virial quotient                       -1.93324022
 !RHF STATE 1.2 Dipole moment           0.00000000     0.00000000     0.00000000
 Dipole moment /Debye                   0.00000000     0.00000000     0.00000000
 

 !RHF expec          <1.2|EKIN|1.2>     1.313494040759
 
 !RHF expec           <1.2|POT|1.2>    -1.840508016062

 ELECTRON ORBITALS
 =================


   Orb  Occ    Energy  Couls-En    Coefficients

                                   1 1s      1 1s      1 1s      1 1s      1 3d0     1 3d2+    1 3d0     1 3d2+    1 3d0     1 3d2+ 


   1.1   2    -0.4938   -1.8371  1.000114  0.000035 -0.000134 -0.000058 -0.000614  0.001063 -0.001078  0.001867 -0.002657  0.004602

                                   1 2px     1 2px     1 2px     1 2px     1 4f1+    1 4f3+    1 4f1+    1 4f3+ 

   1.2   +    -0.3118   -1.4045  0.999755 -0.000065  0.000401 -0.000022  0.000072 -0.000093 -0.000015  0.000020

 HOMO      1.2    -0.311751 =      -8.4832eV
 LUMO      1.3     0.026966 =       0.7338eV
 LUMO-HOMO         0.338718 =       9.2170eV


 **********************************************************************************************************************************
 DATASETS  * FILE   NREC   LENGTH (MB)   RECORD NAMES
              1      20       19.60       500      610      700      900      950      970     1000      129      960     1100   
                                          VAR    BASINP    GEOM    SYMINP    ZMAT    AOBASIS   BASIS     P2S    ABASIS      S 
                                         1400     1410     1420     1200     1210     1080     1600     1650     1300     1700   
                                         EKIN       V       ECP      H0       H01     AOSYM     SMH    MOLCAS    ERIS     OPER   

              2       4        2.76       700     1000      520     2100   
                                         GEOM     BASIS   MCVARS     RHF  

 PROGRAMS   *        TOTAL        HF       INT
 CPU TIMES  *         2.11      0.06      1.96
 REAL TIME  *        12.56 SEC
 DISK USED  *        24.67 MB      
 **********************************************************************************************************************************
 SETTING SCF(I)         =        -2.53929951  AU                              
 SETTING _CC_NORM_MAX   =         2.00000000                                  


 PROGRAM * UHF-SCF       Authors: W. Meyer, H.-J. Werner


 NUMBER OF ELECTRONS:       2+    1-    SPACE SYMMETRY=2    SPIN SYMMETRY: Doublet 
 CONVERGENCE THRESHOLDS:    1.00E-05 (Density)    1.00E-07 (Energy)
 MAX. NUMBER OF ITERATIONS:        0
 INTERPOLATION TYPE:            DIIS
 INTERPOLATION STEPS:              2 (START)      1 (STEP)
 LEVEL SHIFTS:                  0.20 (ALPHA)   0.20 (BETA) 


 Singly occupied orbitals:      1.2
 Molecular orbitals read from record     2100.2  Type=RHF/CANONICAL (state 1.2)

 Molecular orbital dump at record        2200.2

 Initial alpha occupation   1   1   0   0   0   0   0   0
 Initial beta  occupation   1   0   0   0   0   0   0   0

 ITERATION    DDIFF          GRAD             ENERGY        2-EL.EN.            DIPOLE MOMENTS         DIIS
    1      0.000D+00      0.000D+00        -2.53929951      2.479987    0.00000    0.00000    0.00000    0
 
 Final alpha occupancy:   1   1   0   0   0   0   0   0
 Final beta  occupancy:   1   0   0   0   0   0   0   0

 !UHF STATE 1.2 Energy                 -2.539299514384
 Nuclear energy                         0.00000000
 One-electron energy                   -3.77929300
 Two-electron energy                    1.23999349
 Virial quotient                       -1.93324022
 !UHF STATE 1.2 Dipole moment           0.00000000     0.00000000     0.00000000
 Dipole moment /Debye                   0.00000000     0.00000000     0.00000000
 

 !UHF expec          <1.2|EKIN|1.2>     1.313494040759
 
 !UHF expec           <1.2|POT|1.2>    -1.840508016062

 ELECTRON ORBITALS FOR POSITIVE SPIN
 ===================================


   Orb  Occ    Energy  Couls-En    Coefficients

                                   1 1s      1 1s      1 1s      1 1s      1 3d0     1 3d2+    1 3d0     1 3d2+    1 3d0     1 3d2+ 


   1.1   +    -0.4938   -1.8371  1.000114  0.000035 -0.000134 -0.000058 -0.000614  0.001063 -0.001078  0.001867 -0.002657  0.004602

                                   1 2px     1 2px     1 2px     1 2px     1 4f1+    1 4f3+    1 4f1+    1 4f3+ 

   1.2   +    -0.3118   -1.4045  0.999755 -0.000065  0.000401 -0.000022  0.000072 -0.000093 -0.000015  0.000020

 ELECTRON ORBITALS FOR NEGATIVE SPIN
 ===================================


   Orb  Occ    Energy  Couls-En    Coefficients

                                   1 1s      1 1s      1 1s      1 1s      1 3d0     1 3d2+    1 3d0     1 3d2+    1 3d0     1 3d2+ 


   1.1   -    -0.4938   -1.8371  1.000114  0.000035 -0.000134 -0.000058 -0.000614  0.001063 -0.001078  0.001867 -0.002657  0.004602

 HOMO      1.2    -0.311751 =      -8.4832eV
 LUMO     -1.2    -0.311751 =      -8.4832eV
 LUMO-HOMO         0.000000 =       0.0000eV

 EXPECTATION VALUE OF S**2:             0.75000000

 Occupation number threshold for canonical orbitals:  1.999000 (occupied),  0.001000 (virtual)

 Number of pseudo-canonical orbitals per symmetry:    1   0   0   0   0   0   0   0
 Number of active natural orbitals per symmetry:      0   1   0   0   0   0   0   0

 NATURAL CHARGE ORBITALS
 =======================


   Orb     Occ        Energy       Coefficients

                                   1 1s      1 1s      1 1s      1 1s      1 3d0     1 3d2+    1 3d0     1 3d2+    1 3d0     1 3d2+ 


   1.1  2.00000    -0.493777     1.000114  0.000035 -0.000134 -0.000058 -0.000614  0.001063 -0.001078  0.001867 -0.002657  0.004602

                                   1 2px     1 2px     1 2px     1 2px     1 4f1+    1 4f3+    1 4f1+    1 4f3+ 

   1.2  1.00000    -0.087029     0.999755 -0.000065  0.000401 -0.000022  0.000072 -0.000093 -0.000015  0.000020

 Natural orbitals saved to record    2200.2 (Orbital set 3)

 Orbital spaces for UNO-CAS (Min. occupation: 0.020  Max. occupation: 1.980):

 Closed:        1   0   0   0   0   0   0   0
 Active:        0   1   0   0   0   0   0   0

 No convergence



 **********************************************************************************************************************************
 DATASETS  * FILE   NREC   LENGTH (MB)   RECORD NAMES
              1      20       19.60       500      610      700      900      950      970     1000      129      960     1100   
                                          VAR    BASINP    GEOM    SYMINP    ZMAT    AOBASIS   BASIS     P2S    ABASIS      S 
                                         1400     1410     1420     1200     1210     1080     1600     1650     1300     1700   
                                         EKIN       V       ECP      H0       H01     AOSYM     SMH    MOLCAS    ERIS     OPER   

              2       5        5.27       700     1000      520     2100     2200   
                                         GEOM     BASIS   MCVARS     RHF      UHF  

 PROGRAMS   *        TOTAL       UHF        HF       INT
 CPU TIMES  *         2.13      0.02      0.06      1.96
 REAL TIME  *        12.68 SEC
 DISK USED  *        24.95 MB      
 **********************************************************************************************************************************
 SETTING SCF(I)         =        -2.53929951  AU                              


 PROGRAM * MRCC (General Multireference Coupled Cluster)    Author: M. Kallay, 2000-2005

 ***  Initialisation ***

   0 Spin projections
 
 Molecular orbitals read from record     2200.2  Type=UHF/ALPHA (state 1.2)

 ?Warning: UHF not converged
 Molecular orbitals read from record     2200.2  Type=UHF/BETA (state 1.2)

 ?Warning: UHF not converged
 
 Frozen orbitals:              0 (  0  0  0  0  0  0  0  0)
 Active orbitals:             45 ( 10  8  8  3  8  3  3  2)
 Active electrons:             3
 Spin quantum number:          0.5

 Transformed integrals will be written to file mrcc_36388/fort.55

 Load integrals                2.1 sec
 Transform integrals           2.2 sec
 Storage for integrals:         426551
 Remaining memory:           *********

 Core energy:               0.00000000
 
 MRCC Input:
     4     0     0     0     3     0     0     2     0     0     0     1     1     0     0     7     0     0   0.000     0   64000
  ex.lev,nsing,ntrip, rest,method,dens,conver,symm, diag, CS ,spatial, HF, ndoub,nacto,nactv, tol, maxex, sacc, freq,  dboc,   mem
  2  0  0  0  0  0  0  0  0  0  1  0  0  0  0  0  0  0  0  0  0  0  0  0  0  0  0  0  0  0  0  0  0  0  0  0  0  0  0  0  0  0  0  0  0
 MRCC Input end
 Variable memory released
 MRCC now being run, temporary output in /global/cscratch1/sd/aannabe/mrcc_36388/mrcc.out
 **********************************************************************
                          MRCC program system
 **********************************************************************

                              Written by
  Mihaly Kallay, Zoltan Rolik, Jozsef Csontos, Peter Nagy, Gyula Samu,
      David Mester, Jozsef Csoka, Bernat Szabo, Istvan Ladjanszki,
       Lorant Szegedy, Bence Ladoczki, Klara Petrov, Mate Farkas,
                    Pal D. Mezei, and Bence Hegely

        Department of Physical Chemistry and Materials Science
            Budapest University of Technology and Economics
                  Budapest P.O.Box 91, H-1521 Hungary

                              www.mrcc.hu

                       Release date: May 23, 2018

 ************************ 2018-06-15 16:17:52 *************************
 Executing goldstone...

 Generation of CC equations in terms of H and T...
 Generation of antisymmetrized Goldstone diagrams...
 Number of diagrams in T^1 equations:    15
 Number of diagrams in T^2 equations:    33
 Number of diagrams in T^3 equations:     2
 Translation of diagrams to factorized equations...
 Optimizing intermediate calculation...
 Number of floating-point operations per iteration step:   4.1040E+06
 Probable CPU time per iteration step (hours):      0.00
 Required memory (Mbytes):     468.4
 Number of intermediates:                                  48
 Number of intermediates to be stored:                     20
 Length of intermediate file (Mbytes):       7.7

 ************************ 2018-06-15 16:17:53 *************************
 Executing xmrcc...

 **********************************************************************
 CC(2)(3) calculation


 Allocation of 468.4 Mbytes of memory...
 Number of spinorbitals:                    90
 Number of alpha electrons:                        2
 Number of beta electrons:                         1
 Spin multiplicity:                     2
 z-component of spin:  0.5
 Spatial symmetry:                      2
 Convergence criterion:  1.0E-07
 Construction of occupation graphs...
 Number of                     0 -fold excitations:                      1
 Number of                     1 -fold excitations:                     25
 Number of                     2 -fold excitations:                    656
 Total number of configurations:                    682
 Calculation of coupling coefficients...
 Length of intermediate file (Mbytes):       6.1

 ======================================================================

 Spin case  1   Alpha:  2   Beta:  1
 Number of excitations:                   4992
 Number of                     3 -fold excitations:                   4992

 Memory requirements /Mbyte/:
               Minimal        Optimal
 Real*8:          6.3190        31.3201
 Integer:         3.6012
 Total:           9.9203        34.9213


 ************************ 2018-06-15 16:17:53 *************************
 Executing mrcc...

 **********************************************************************
 CCSDT(T) calculation


 OpenMP parallel version is running.
 Number of CPUs:   1
 Allocation of   31.3 Mbytes of memory...
 Number of spinorbitals:  90
 Number of alpha electrons:  2
 Number of beta  electrons:  1
 Spin multiplicity: 2
 z-component of spin:  0.5
 Spatial symmetry: 2
 Convergence criterion:  1.0E-07
 Construction of occupation graphs...
 Number of 0-fold excitations: 1
 Number of 1-fold excitations: 25
 Number of 2-fold excitations: 656
 Total number of determinants: 682
 Calculation of coupling coefficients...
 Initial cluster amplitudes are generated.
 Length of intermediate file (Mbytes):       6.1
 Reading integral list from unit 55...
 Sorting integrals...
 Sorting integrals...
 Sorting integrals...
 Sorting integrals...
 Energy of reference determinant [au]:      -2.539299514384
 Calculation of MP denominators...

 Starting CC iteration...
 ======================================================================
 Norm of residual vector:     0.32584936
 CPU time [min]:     0.015                   Wall time [min]:     0.015

 Iteration  1  CC energy:    -2.59065752  Energy decrease:   0.05135801
 ======================================================================
 Norm of residual vector:     0.08611917
 CPU time [min]:     0.019                   Wall time [min]:     0.019

 Iteration  2  CC energy:    -2.60641788  Energy decrease:   0.01576036
 ======================================================================
 Norm of residual vector:     0.02965748
 CPU time [min]:     0.023                   Wall time [min]:     0.024

 Iteration  3  CC energy:    -2.61035300  Energy decrease:   0.00393512
 ======================================================================
 Norm of residual vector:     0.00737601
 CPU time [min]:     0.027                   Wall time [min]:     0.028

 Iteration  4  CC energy:    -2.61101446  Energy decrease:   0.00066146
 ======================================================================
 Norm of residual vector:     0.00149053
 CPU time [min]:     0.031                   Wall time [min]:     0.033

 Iteration  5  CC energy:    -2.61097991  Energy decrease:   0.00003456
 ======================================================================
 Norm of residual vector:     0.00032569
 CPU time [min]:     0.036                   Wall time [min]:     0.038

 Iteration  6  CC energy:    -2.61098975  Energy decrease:   0.00000984
 ======================================================================
 Norm of residual vector:     0.00008674
 CPU time [min]:     0.040                   Wall time [min]:     0.044

 Iteration  7  CC energy:    -2.61098973  Energy decrease:   0.00000002
 ======================================================================
 Norm of residual vector:     0.00002460
 CPU time [min]:     0.044                   Wall time [min]:     0.049

 Iteration  8  CC energy:    -2.61098982  Energy decrease:   0.00000009
 ======================================================================
 Norm of residual vector:     0.00000545
 CPU time [min]:     0.048                   Wall time [min]:     0.054

 Iteration  9  CC energy:    -2.61098989  Energy decrease:   0.00000007
 ======================================================================
 Norm of residual vector:     0.00000126
 CPU time [min]:     0.052                   Wall time [min]:     0.058

 Iteration 10  CC energy:    -2.61098984  Energy decrease:   0.00000005
 ======================================================================
 Norm of residual vector:     0.00000039
 CPU time [min]:     0.056                   Wall time [min]:     0.063

 Iteration 11  CC energy:    -2.61098985  Energy decrease:   0.00000001
 ======================================================================
 Norm of residual vector:     0.00000011
 CPU time [min]:     0.060                   Wall time [min]:     0.068

 Iteration 12  CC energy:    -2.61098985  Energy decrease:   1.2798E-10
 ======================================================================
 Norm of residual vector:     0.00000003
 CPU time [min]:     0.064                   Wall time [min]:     0.072

 Iteration 13  CC energy:    -2.61098985  Energy decrease:   2.2201E-10
 ======================================================================

 Iteration has converged in 13 steps.

 Final results:
 Total CCSDT energy [au]:             -2.610989854420
 Total MP2 energy [au]:               -2.590657521393

 Perturbative corrections are calculated...
 ======================================================================
 Spin case  1   Alpha:  2   Beta:  1
 Number of excitations:        4992
 CPU time [min]:     0.067                   Wall time [min]:     0.076
 ======================================================================
 Number of 3-fold excitations: 4992
 CPU time [min]:     0.067                   Wall time [min]:     0.076

 Total CCSD[T] energy [au]:           -2.612532675603
 Total CCSD(T) energy [au]:           -2.612552145316

 ************************ 2018-06-15 16:17:58 *************************
                      Normal termination of mrcc.
 **********************************************************************
 !CCSDT STATE 1.2 Energy               -2.610989854420
 !MP2 STATE 1.2 Energy                 -2.590657521393
 !CCSD[T] STATE 1.2 Energy             -2.612532675603
 !CCSD(T) STATE 1.2 Energy             -2.612552145316
 
 CPU-time for MRCC:              4.0 sec
 Elapsed-time for MRCC:          6.9 sec

 Variable memory set to 8000000000 words,  buffer space   230000 words



 **********************************************************************************************************************************
 DATASETS  * FILE   NREC   LENGTH (MB)   RECORD NAMES
              1      20       19.60       500      610      700      900      950      970     1000      129      960     1100   
                                          VAR    BASINP    GEOM    SYMINP    ZMAT    AOBASIS   BASIS     P2S    ABASIS      S 
                                         1400     1410     1420     1200     1210     1080     1600     1650     1300     1700   
                                         EKIN       V       ECP      H0       H01     AOSYM     SMH    MOLCAS    ERIS     OPER   

              2       5        5.27       700     1000      520     2100     2200   
                                         GEOM     BASIS   MCVARS     RHF      UHF  

 PROGRAMS   *        TOTAL      MRCC       UHF        HF       INT
 CPU TIMES  *         7.16      5.03      0.02      0.06      1.96
 REAL TIME  *        25.62 SEC
 DISK USED  *        24.95 MB      
 **********************************************************************************************************************************
 SETTING POSTHF(I)      =        -2.61255215  AU                              
                                                                                                                                                                                                                                                                

       SCF           POSTHF       EKIN          POT
    -2.53929951   -2.61255215   1.31349404   -1.84050802
                                                  

 CCSD(T)/USERDEF energy=     -2.612552145316

        CCSD(T)         UHF-SCF         HF-SCF  
     -2.61255215     -2.53929951     -2.53929951
 **********************************************************************************************************************************
 Variable memory released
