
 Primary working directories    : /global/cscratch1/sd/aannabe
 Secondary working directories  : /global/cscratch1/sd/aannabe
 Wavefunction directory         : /global/homes/a/aannabe/wfu/
 Main file repository           : /global/cscratch1/sd/aannabe/

 SHA1      : 2873118e99aab1bc19f5b6fc1784693c06d15c95
 NAME      : 2015.1.8
 ARCHNAME  : linux/x86_64
 FC        : /opt/cray/pe/craype/2.5.5/bin/ftn
 BLASLIB   : -Wl,-_start-group /opt/intel/compilers_and_libraries_2016.3.210/linux/mkl/lib/intel64/libmkl_intel_ilp64.a /opt/intel/compilers_and_libraries_2016.3.210/linux/mkl/lib/intel64/libmkl_intel_thread.a /opt/intel/compilers_and_libraries_2016.3.210/linux/mkl/lib/intel64/libmkl_core.a -Wl,-_end-group
 id        : lbl

 Nodes     nprocs
 nid00496     1

 Using customized tuning parameters: mindgm=8; mindgv=16; mindgc=4; mindgr=1; noblas=0; minvec=7
 default implementation of scratch files=df  

 ***,B
 memory,8,g
 gthresh,twoint=1.e-12
 
 gprint,basis,orbitals
 gexpec,ekin,pot
 
 angstrom
 geometry={
 1                                                                               ! Number of atoms
 B 0.0 0.0 0.0
 }
 
 basis={
 Including file /global/homes/a/aannabe/docs/totals/pps/B.pp
 Including file /global/homes/a/aannabe/docs/totals/basis/aug-cc-pVnZ/B_qz.basis
 }
 
 {hf
 wf,3,2,1
 occ,1,1,0,0,0,0,0,0
 open,1.2
                                                                                 !closed,1,0,0,0,0,0,0,0
                                                                                 !sym,
 }
 scf(i)=energy
 
 _CC_NORM_MAX=2.0
  !NOTE: Perturbative MRCC works only with UHF reference. So, here we will trick MRCC by doing zero UHF iteration right after ROHF.
 
 {uhf
 wf,3,2,1
 occ,1,1,0,0,0,0,0,0
 open,1.2
                                                                                 !closed,1,0,0,0,0,0,0,0
                                                                                 !sym,
 maxit,0
 }
 scf(i)=energy
 
 {mrcc,method=CCSDT(Q)
 orbital,ignore_error=1                                                          !Ignore the fact that UHF WF is not converged
 maxit,100
 core
 }
 posthf(i)=energy
 
 table,scf,posthf,ekin,pot
 save,4.csv,new
 
 

 Variables initialized (889), CPU time= 0.00 sec
 Commands  initialized (702), CPU time= 0.01 sec, 572 directives.
 Default parameters read. Elapsed time= 0.13 sec

 Checking input...
 Passed
1


                                         ***  PROGRAM SYSTEM MOLPRO  ***
                                       Copyright, TTI GmbH Stuttgart, 2015
                                    Version 2015.1 linked Sep  7 2016 23:09:38


 **********************************************************************************************************************************
 LABEL *   B                                                                             
  64 bit serial version                                                                  DATE: 15-Jun-18          TIME: 16:18:05  
 **********************************************************************************************************************************

 SHA1:             2873118e99aab1bc19f5b6fc1784693c06d15c95
 **********************************************************************************************************************************

 THRESHOLDS:

 ZERO    =  1.00D-12  ONEINT  =  1.00D-12  TWOINT  =  1.00D-12  PREFAC  =  1.00D-14  LOCALI  =  1.00D-09  EORDER  =  1.00D-04
 ENERGY  =  0.00D+00  ETEST   =  0.00D+00  EDENS   =  0.00D+00  THRDEDEF=  1.00D-06  GRADIENT=  1.00D-02  STEP    =  1.00D-03
 ORBITAL =  1.00D-05  CIVEC   =  1.00D-05  COEFF   =  1.00D-04  PRINTCI =  5.00D-02  PUNCHCI =  9.90D+01  OPTGRAD =  3.00D-04
 OPTENERG=  1.00D-06  OPTSTEP =  3.00D-04  THRGRAD =  1.00D-10  COMPRESS=  1.00D-11  VARMIN  =  1.00D-07  VARMAX  =  1.00D-03
 THRDOUB =  0.00D+00  THRDIV  =  1.00D-05  THRRED  =  1.00D-07  THRPSP  =  1.00D+00  THRDC   =  1.00D-10  THRCS   =  1.00D-10
 THRNRM  =  1.00D-08  THREQ   =  0.00D+00  THRDE   =  1.00D+00  THRREF  =  1.00D-05  SPARFAC =  1.00D+00  THRDLP  =  1.00D-07
 THRDIA  =  1.00D-10  THRDLS  =  1.00D-07  THRGPS  =  0.00D+00  THRKEX  =  0.00D+00  THRDIS  =  2.00D-01  THRVAR  =  1.00D-10
 THRLOC  =  1.00D-06  THRGAP  =  1.00D-06  THRLOCT = -1.00D+00  THRGAPT = -1.00D+00  THRORB  =  1.00D-06  THRMLTP =  0.00D+00
 THRCPQCI=  1.00D-10  KEXTA   =  0.00D+00  THRCOARS=  0.00D+00  SYMTOL  =  1.00D-06  GRADTOL =  1.00D-06  THROVL  =  1.00D-08
 THRORTH =  1.00D-08  GRID    =  1.00D-06  GRIDMAX =  1.00D-03  DTMAX   =  0.00D+00  THROCCDE=  1.00D-01  THROCCDE=  1.00D-01



 ZUNIT=ANG
 

Geometry recognized as XYZ


 Variable memory set to 8000000000 words,  buffer space   230000 words

 SETTING BASIS          =    USERDEF


 Recomputing integrals since basis changed


 Using spherical harmonics



 PROGRAM * SEWARD (Integral evaluation for generally contracted gaussian basis sets)     Author: Roland Lindh, 1990

 Geometry written to block  1 of record 700

 Orientation using atomic masses  
 Molecule type: Atom
 Symmetry elements: X,Y,Z
 Rotational constants:       0.0000000      0.0000000      0.0000000 GHz  (calculated with average atomic masses)

 Point group  D2h 



 ATOMIC COORDINATES

 NR  ATOM    CHARGE       X              Y              Z

   1  B       3.00    0.000000000    0.000000000    0.000000000


          B   CORE POTENTIAL

          p POTENTIAL

 POWERS             1              3              2
 EXPONENTIALS   31.49298       22.56509       8.646690    
 COEFFICIENTS   3.000000       94.47895      -9.748000    

          s - p POTENTIAL

 POWERS             2
 EXPONENTIALS   4.062460    
 COEFFICIENTS   20.74800    


 BASIS DATA

   Nr Sym  Nuc  Type         Exponents   Contraction coefficients

    1.1 Ag    1  1s          11.760500    -0.003676
                              5.150520     0.025052
                              2.578276    -0.124923
                              1.290648    -0.066287
                              0.646080     0.100734
                              0.323418     0.337549
                              0.161898     0.430843
                              0.081044     0.248656
                              0.040569     0.031730
    2.1 Ag    1  1s           0.422217     1.000000
    3.1 Ag    1  1s           0.305133     1.000000
    4.1 Ag    1  1s           0.082968     1.000000
    5.1 Ag    1  1s           0.033187     1.000000
    6.1 Ag    1  3d0          1.142614     1.000000
    7.1 Ag    1  3d2+         1.142614     1.000000
    8.1 Ag    1  3d0          0.410733     1.000000
    9.1 Ag    1  3d2+         0.410733     1.000000
   10.1 Ag    1  3d0          0.149100     1.000000
   11.1 Ag    1  3d2+         0.149100     1.000000
   12.1 Ag    1  3d0          0.059640     1.000000
   13.1 Ag    1  3d2+         0.059640     1.000000
   14.1 Ag    1  5g0          0.710746     1.000000
   15.1 Ag    1  5g4+         0.710746     1.000000
   16.1 Ag    1  5g2+         0.710746     1.000000
   17.1 Ag    1  5g0          0.284298     1.000000
   18.1 Ag    1  5g4+         0.284298     1.000000
   19.1 Ag    1  5g2+         0.284298     1.000000
    1.2 B3u   1  2px          7.470701     0.004740
                              3.735743     0.037601
                              1.868068     0.051060
                              0.934132     0.145659
                              0.467115     0.223793
                              0.233582     0.319947
                              0.116803     0.285019
                              0.058408     0.144881
                              0.029207     0.017696
    2.2 B3u   1  2px          0.447031     1.000000
    3.2 B3u   1  2px          0.196614     1.000000
    4.2 B3u   1  2px          0.066445     1.000000
    5.2 B3u   1  2px          0.026578     1.000000
    6.2 B3u   1  4f1+         0.870011     1.000000
    7.2 B3u   1  4f3+         0.870011     1.000000
    8.2 B3u   1  4f1+         0.315902     1.000000
    9.2 B3u   1  4f3+         0.315902     1.000000
   10.2 B3u   1  4f1+         0.126361     1.000000
   11.2 B3u   1  4f3+         0.126361     1.000000
    1.3 B2u   1  2py          7.470701     0.004740
                              3.735743     0.037601
                              1.868068     0.051060
                              0.934132     0.145659
                              0.467115     0.223793
                              0.233582     0.319947
                              0.116803     0.285019
                              0.058408     0.144881
                              0.029207     0.017696
    2.3 B2u   1  2py          0.447031     1.000000
    3.3 B2u   1  2py          0.196614     1.000000
    4.3 B2u   1  2py          0.066445     1.000000
    5.3 B2u   1  2py          0.026578     1.000000
    6.3 B2u   1  4f1-         0.870011     1.000000
    7.3 B2u   1  4f3-         0.870011     1.000000
    8.3 B2u   1  4f1-         0.315902     1.000000
    9.3 B2u   1  4f3-         0.315902     1.000000
   10.3 B2u   1  4f1-         0.126361     1.000000
   11.3 B2u   1  4f3-         0.126361     1.000000
    1.4 B1g   1  3d2-         1.142614     1.000000
    2.4 B1g   1  3d2-         0.410733     1.000000
    3.4 B1g   1  3d2-         0.149100     1.000000
    4.4 B1g   1  3d2-         0.059640     1.000000
    5.4 B1g   1  5g2-         0.710746     1.000000
    6.4 B1g   1  5g4-         0.710746     1.000000
    7.4 B1g   1  5g2-         0.284298     1.000000
    8.4 B1g   1  5g4-         0.284298     1.000000
    1.5 B1u   1  2pz          7.470701     0.004740
                              3.735743     0.037601
                              1.868068     0.051060
                              0.934132     0.145659
                              0.467115     0.223793
                              0.233582     0.319947
                              0.116803     0.285019
                              0.058408     0.144881
                              0.029207     0.017696
    2.5 B1u   1  2pz          0.447031     1.000000
    3.5 B1u   1  2pz          0.196614     1.000000
    4.5 B1u   1  2pz          0.066445     1.000000
    5.5 B1u   1  2pz          0.026578     1.000000
    6.5 B1u   1  4f0          0.870011     1.000000
    7.5 B1u   1  4f2+         0.870011     1.000000
    8.5 B1u   1  4f0          0.315902     1.000000
    9.5 B1u   1  4f2+         0.315902     1.000000
   10.5 B1u   1  4f0          0.126361     1.000000
   11.5 B1u   1  4f2+         0.126361     1.000000
    1.6 B2g   1  3d1+         1.142614     1.000000
    2.6 B2g   1  3d1+         0.410733     1.000000
    3.6 B2g   1  3d1+         0.149100     1.000000
    4.6 B2g   1  3d1+         0.059640     1.000000
    5.6 B2g   1  5g1+         0.710746     1.000000
    6.6 B2g   1  5g3+         0.710746     1.000000
    7.6 B2g   1  5g1+         0.284298     1.000000
    8.6 B2g   1  5g3+         0.284298     1.000000
    1.7 B3g   1  3d1-         1.142614     1.000000
    2.7 B3g   1  3d1-         0.410733     1.000000
    3.7 B3g   1  3d1-         0.149100     1.000000
    4.7 B3g   1  3d1-         0.059640     1.000000
    5.7 B3g   1  5g1-         0.710746     1.000000
    6.7 B3g   1  5g3-         0.710746     1.000000
    7.7 B3g   1  5g1-         0.284298     1.000000
    8.7 B3g   1  5g3-         0.284298     1.000000
    1.8 Au    1  4f2-         0.870011     1.000000
    2.8 Au    1  4f2-         0.315902     1.000000
    3.8 Au    1  4f2-         0.126361     1.000000

 NUCLEAR CHARGE:                    3
 NUMBER OF PRIMITIVE AOS:         136
 NUMBER OF SYMMETRY AOS:          111
 NUMBER OF CONTRACTIONS:           79   (  19Ag  +  11B3u +  11B2u +   8B1g +  11B1u +   8B2g +   8B3g +   3Au  )
 NUMBER OF CORE ORBITALS:           0   (   0Ag  +   0B3u +   0B2u +   0B1g +   0B1u +   0B2g +   0B3g +   0Au  )
 NUMBER OF VALENCE ORBITALS:        4   (   1Ag  +   1B3u +   1B2u +   0B1g +   1B1u +   0B2g +   0B3g +   0Au  )


 NUCLEAR REPULSION ENERGY    0.00000000

 EXTRA SYMMETRY OF AOS IN SYMMETRY 1:   1 1 1 1 1 2 3 2 3 2   3 2 3 4 5 6 4 5 6
 EXTRA SYMMETRY OF AOS IN SYMMETRY 2:   1 1 1 1 1 2 3 2 3 2   3
 EXTRA SYMMETRY OF AOS IN SYMMETRY 3:   1 1 1 1 1 2 3 2 3 2   3
 EXTRA SYMMETRY OF AOS IN SYMMETRY 4:   1 1 1 1 2 3 2 3
 EXTRA SYMMETRY OF AOS IN SYMMETRY 5:   1 1 1 1 1 2 3 2 3 2   3
 EXTRA SYMMETRY OF AOS IN SYMMETRY 6:   1 1 1 1 2 3 2 3
 EXTRA SYMMETRY OF AOS IN SYMMETRY 7:   1 1 1 1 2 3 2 3

 Eigenvalues of metric

         1 0.142E-02 0.138E-01 0.108E+00 0.108E+00 0.112E+00 0.407E+00 0.407E+00 0.428E+00
         2 0.105E-01 0.559E-01 0.221E+00 0.221E+00 0.242E+00 0.841E+00 0.841E+00 0.116E+01
         3 0.105E-01 0.559E-01 0.221E+00 0.221E+00 0.242E+00 0.841E+00 0.841E+00 0.116E+01
         4 0.108E+00 0.407E+00 0.428E+00 0.428E+00 0.119E+01 0.157E+01 0.157E+01 0.230E+01
         5 0.105E-01 0.559E-01 0.221E+00 0.221E+00 0.242E+00 0.841E+00 0.841E+00 0.116E+01
         6 0.108E+00 0.407E+00 0.428E+00 0.428E+00 0.119E+01 0.157E+01 0.157E+01 0.230E+01
         7 0.108E+00 0.407E+00 0.428E+00 0.428E+00 0.119E+01 0.157E+01 0.157E+01 0.230E+01
         8 0.221E+00 0.841E+00 0.194E+01


 Contracted 2-electron integrals neglected if value below      1.0D-12
 AO integral compression algorithm  1   Integral accuracy      1.0D-12

     6.291 MB (compressed) written to integral file ( 65.5%)


 NUMBER OF SORTED TWO-ELECTRON INTEGRALS:     665704.     BUFFER LENGTH:  32768
 NUMBER OF SEGMENTS:   1  SEGMENT LENGTH:     665704      RECORD LENGTH: 524288

 Memory used in sort:       1.22 MW

 SORT1 READ     1222209. AND WROTE      500866. INTEGRALS IN      2 RECORDS. CPU TIME:     0.04 SEC, REAL TIME:     0.05 SEC
 SORT2 READ      500866. AND WROTE      665704. INTEGRALS IN     24 RECORDS. CPU TIME:     0.05 SEC, REAL TIME:     0.10 SEC

 FILE SIZES:   FILE 1:    25.5 MBYTE,  FILE 4:     8.4 MBYTE,   TOTAL:     33.9 MBYTE

 OPERATOR DM      FOR CENTER  0  COORDINATES:    0.000000    0.000000    0.000000
 OPERATOR EKIN    FOR CENTER  0  COORDINATES:    0.000000    0.000000    0.000000
 OPERATOR POT     FOR CENTER  0  COORDINATES:    0.000000    0.000000    0.000000


 **********************************************************************************************************************************
 DATASETS  * FILE   NREC   LENGTH (MB)   RECORD NAMES
              1      20       22.67       500      610      700      900      950      970     1000      129      960     1100   
                                          VAR    BASINP    GEOM    SYMINP    ZMAT    AOBASIS   BASIS     P2S    ABASIS      S 
                                         1400     1410     1420     1200     1210     1080     1600     1650     1300     1700   
                                         EKIN       V       ECP      H0       H01     AOSYM     SMH    MOLCAS    ERIS     OPER   

 PROGRAMS   *        TOTAL       INT
 CPU TIMES  *         2.38      2.27
 REAL TIME  *        12.98 SEC
 DISK USED  *        34.23 MB      
 **********************************************************************************************************************************


 PROGRAM * RHF-SCF (OPEN SHELL)       Authors: W. Meyer, H.-J. Werner


 NUMBER OF ELECTRONS:       2+    1-    SPACE SYMMETRY=2    SPIN SYMMETRY: Doublet 
 CONVERGENCE THRESHOLDS:    1.00E-05 (Density)    1.00E-07 (Energy)
 MAX. NUMBER OF ITERATIONS:       60
 INTERPOLATION TYPE:            DIIS
 INTERPOLATION STEPS:              2 (START)      1 (STEP)
 LEVEL SHIFTS:                 -0.60 (CLOSED) -0.30 (OPEN) 


 Singly occupied orbitals:      1.2

   Atom=B  basis=ECP2MWB_GUESS     lmin=0  lmax=1

 Orbital guess generated from atomic densities. Full valence occupancy:    1   1   1   0   1   0   0   0


 Molecular orbital dump at record        2100.2

 ITERATION    DDIFF          GRAD             ENERGY        2-EL.EN.            DIPOLE MOMENTS         DIIS   ORB.
    1      0.000D+00      0.000D+00        -2.51233846      2.205293    0.00000    0.00000    0.00000    0    start
    2      0.000D+00      0.119D-01        -2.52962947      2.337947    0.00000    0.00000    0.00000    1    diag,B
    3      0.131D-01      0.532D-02        -2.53695654      2.433099    0.00000    0.00000    0.00000    2    diag,B
    4      0.795D-02      0.243D-02        -2.53912303      2.474510    0.00000    0.00000    0.00000    3    diag,B
    5      0.681D-02      0.824D-03        -2.53929132      2.478669    0.00000    0.00000    0.00000    4    diag,B
    6      0.237D-02      0.229D-03        -2.53930319      2.480173    0.00000    0.00000    0.00000    5    diag,B
    7      0.689D-03      0.716D-04        -2.53930393      2.479931    0.00000    0.00000    0.00000    6    fixocc
    8      0.152D-03      0.176D-04        -2.53930397      2.479987    0.00000    0.00000    0.00000    7    diag,B
    9      0.797D-04      0.250D-05        -2.53930397      2.479989    0.00000    0.00000    0.00000    8    diag,B
   10      0.528D-05      0.791D-06        -2.53930397      2.479986    0.00000    0.00000    0.00000    0    orth

 Final alpha occupancy:   1   1   0   0   0   0   0   0
 Final beta  occupancy:   1   0   0   0   0   0   0   0

 !RHF STATE 1.2 Energy                 -2.539303974955
 Nuclear energy                         0.00000000
 One-electron energy                   -3.77929702
 Two-electron energy                    1.23999305
 Virial quotient                       -1.93315397
 !RHF STATE 1.2 Dipole moment           0.00000000     0.00000000     0.00000000
 Dipole moment /Debye                   0.00000000     0.00000000     0.00000000
 

 !RHF expec          <1.2|EKIN|1.2>     1.313554957406
 
 !RHF expec           <1.2|POT|1.2>    -1.840528270925

 ELECTRON ORBITALS
 =================


   Orb  Occ    Energy  Couls-En    Coefficients

                                   1 1s      1 1s      1 1s      1 1s      1 1s      1 3d0     1 3d2+    1 3d0     1 3d2+    1 3d0  
                                   1 3d2+    1 3d0     1 3d2+    1 5g0     1 5g4+    1 5g2+    1 5g0     1 5g4+    1 5g2+ 

   1.1   2    -0.4938   -1.8371  1.000131  0.000108 -0.000088 -0.000166 -0.000022 -0.000684  0.001185  0.000098 -0.000169 -0.002598
                                 0.004500 -0.001307  0.002264 -0.000002 -0.000004  0.000003 -0.000022 -0.000043  0.000032

                                   1 2px     1 2px     1 2px     1 2px     1 2px     1 4f1+    1 4f3+    1 4f1+    1 4f3+    1 4f1+ 
                                   1 4f3+ 

   1.2   +    -0.3118   -1.4045  0.999793  0.000051 -0.000135  0.000416 -0.000030  0.000023 -0.000030  0.000076 -0.000098 -0.000063
                                 0.000081

 HOMO      1.2    -0.311759 =      -8.4834eV
 LUMO      1.3     0.024609 =       0.6696eV
 LUMO-HOMO         0.336368 =       9.1530eV


 **********************************************************************************************************************************
 DATASETS  * FILE   NREC   LENGTH (MB)   RECORD NAMES
              1      20       22.67       500      610      700      900      950      970     1000      129      960     1100   
                                          VAR    BASINP    GEOM    SYMINP    ZMAT    AOBASIS   BASIS     P2S    ABASIS      S 
                                         1400     1410     1420     1200     1210     1080     1600     1650     1300     1700   
                                         EKIN       V       ECP      H0       H01     AOSYM     SMH    MOLCAS    ERIS     OPER   

              2       4        2.78       700     1000      520     2100   
                                         GEOM     BASIS   MCVARS     RHF  

 PROGRAMS   *        TOTAL        HF       INT
 CPU TIMES  *         2.45      0.07      2.27
 REAL TIME  *        13.18 SEC
 DISK USED  *        34.23 MB      
 **********************************************************************************************************************************
 SETTING SCF(I)         =        -2.53930397  AU                              
 SETTING _CC_NORM_MAX   =         2.00000000                                  


 PROGRAM * UHF-SCF       Authors: W. Meyer, H.-J. Werner


 NUMBER OF ELECTRONS:       2+    1-    SPACE SYMMETRY=2    SPIN SYMMETRY: Doublet 
 CONVERGENCE THRESHOLDS:    1.00E-05 (Density)    1.00E-07 (Energy)
 MAX. NUMBER OF ITERATIONS:        0
 INTERPOLATION TYPE:            DIIS
 INTERPOLATION STEPS:              2 (START)      1 (STEP)
 LEVEL SHIFTS:                  0.20 (ALPHA)   0.20 (BETA) 


 Singly occupied orbitals:      1.2
 Molecular orbitals read from record     2100.2  Type=RHF/CANONICAL (state 1.2)

 Molecular orbital dump at record        2200.2

 Initial alpha occupation   1   1   0   0   0   0   0   0
 Initial beta  occupation   1   0   0   0   0   0   0   0

 ITERATION    DDIFF          GRAD             ENERGY        2-EL.EN.            DIPOLE MOMENTS         DIIS
    1      0.000D+00      0.000D+00        -2.53930397      2.479986    0.00000    0.00000    0.00000    0
 
 Final alpha occupancy:   1   1   0   0   0   0   0   0
 Final beta  occupancy:   1   0   0   0   0   0   0   0

 !UHF STATE 1.2 Energy                 -2.539303974955
 Nuclear energy                         0.00000000
 One-electron energy                   -3.77929702
 Two-electron energy                    1.23999305
 Virial quotient                       -1.93315397
 !UHF STATE 1.2 Dipole moment           0.00000000     0.00000000     0.00000000
 Dipole moment /Debye                   0.00000000     0.00000000     0.00000000
 

 !UHF expec          <1.2|EKIN|1.2>     1.313554957406
 
 !UHF expec           <1.2|POT|1.2>    -1.840528270925

 ELECTRON ORBITALS FOR POSITIVE SPIN
 ===================================


   Orb  Occ    Energy  Couls-En    Coefficients

                                   1 1s      1 1s      1 1s      1 1s      1 1s      1 3d0     1 3d2+    1 3d0     1 3d2+    1 3d0  
                                   1 3d2+    1 3d0     1 3d2+    1 5g0     1 5g4+    1 5g2+    1 5g0     1 5g4+    1 5g2+ 

   1.1   +    -0.4938   -1.8371  1.000131  0.000108 -0.000088 -0.000166 -0.000022 -0.000684  0.001185  0.000098 -0.000169 -0.002598
                                 0.004500 -0.001307  0.002264 -0.000002 -0.000004  0.000003 -0.000022 -0.000043  0.000032

                                   1 2px     1 2px     1 2px     1 2px     1 2px     1 4f1+    1 4f3+    1 4f1+    1 4f3+    1 4f1+ 
                                   1 4f3+ 

   1.2   +    -0.3118   -1.4045  0.999793  0.000051 -0.000135  0.000416 -0.000030  0.000023 -0.000030  0.000076 -0.000098 -0.000063
                                 0.000081

 ELECTRON ORBITALS FOR NEGATIVE SPIN
 ===================================


   Orb  Occ    Energy  Couls-En    Coefficients

                                   1 1s      1 1s      1 1s      1 1s      1 1s      1 3d0     1 3d2+    1 3d0     1 3d2+    1 3d0  
                                   1 3d2+    1 3d0     1 3d2+    1 5g0     1 5g4+    1 5g2+    1 5g0     1 5g4+    1 5g2+ 

   1.1   -    -0.4938   -1.8371  1.000131  0.000108 -0.000088 -0.000166 -0.000022 -0.000684  0.001185  0.000098 -0.000169 -0.002598
                                 0.004500 -0.001307  0.002264 -0.000002 -0.000004  0.000003 -0.000022 -0.000043  0.000032

 HOMO      1.2    -0.311759 =      -8.4834eV
 LUMO     -1.2    -0.311759 =      -8.4834eV
 LUMO-HOMO         0.000000 =       0.0000eV

 EXPECTATION VALUE OF S**2:             0.75000000

 Occupation number threshold for canonical orbitals:  1.999000 (occupied),  0.001000 (virtual)

 Number of pseudo-canonical orbitals per symmetry:    1   0   0   0   0   0   0   0
 Number of active natural orbitals per symmetry:      0   1   0   0   0   0   0   0

 NATURAL CHARGE ORBITALS
 =======================


   Orb     Occ        Energy       Coefficients

                                   1 1s      1 1s      1 1s      1 1s      1 1s      1 3d0     1 3d2+    1 3d0     1 3d2+    1 3d0  
                                   1 3d2+    1 3d0     1 3d2+    1 5g0     1 5g4+    1 5g2+    1 5g0     1 5g4+    1 5g2+ 

   1.1  2.00000    -0.493775     1.000131  0.000108 -0.000088 -0.000166 -0.000022 -0.000684  0.001185  0.000098 -0.000169 -0.002598
                                 0.004500 -0.001307  0.002264 -0.000002 -0.000004  0.000003 -0.000022 -0.000043  0.000032

                                   1 2px     1 2px     1 2px     1 2px     1 2px     1 4f1+    1 4f3+    1 4f1+    1 4f3+    1 4f1+ 
                                   1 4f3+ 

   1.2  1.00000    -0.087034     0.999793  0.000051 -0.000135  0.000416 -0.000030  0.000023 -0.000030  0.000076 -0.000098 -0.000063
                                 0.000081

 Natural orbitals saved to record    2200.2 (Orbital set 3)

 Orbital spaces for UNO-CAS (Min. occupation: 0.020  Max. occupation: 1.980):

 Closed:        1   0   0   0   0   0   0   0
 Active:        0   1   0   0   0   0   0   0

 No convergence



 **********************************************************************************************************************************
 DATASETS  * FILE   NREC   LENGTH (MB)   RECORD NAMES
              1      20       22.67       500      610      700      900      950      970     1000      129      960     1100   
                                          VAR    BASINP    GEOM    SYMINP    ZMAT    AOBASIS   BASIS     P2S    ABASIS      S 
                                         1400     1410     1420     1200     1210     1080     1600     1650     1300     1700   
                                         EKIN       V       ECP      H0       H01     AOSYM     SMH    MOLCAS    ERIS     OPER   

              2       5        5.33       700     1000      520     2100     2200   
                                         GEOM     BASIS   MCVARS     RHF      UHF  

 PROGRAMS   *        TOTAL       UHF        HF       INT
 CPU TIMES  *         2.47      0.01      0.07      2.27
 REAL TIME  *        13.28 SEC
 DISK USED  *        34.23 MB      
 **********************************************************************************************************************************
 SETTING SCF(I)         =        -2.53930397  AU                              


 PROGRAM * MRCC (General Multireference Coupled Cluster)    Author: M. Kallay, 2000-2005

 ***  Initialisation ***

   0 Spin projections
 
 Molecular orbitals read from record     2200.2  Type=UHF/ALPHA (state 1.2)

 ?Warning: UHF not converged
 Molecular orbitals read from record     2200.2  Type=UHF/BETA (state 1.2)

 ?Warning: UHF not converged
 
 Frozen orbitals:              0 (  0  0  0  0  0  0  0  0)
 Active orbitals:             79 ( 19 11 11  8 11  8  8  3)
 Active electrons:             3
 Spin quantum number:          0.5

 Transformed integrals will be written to file mrcc_36611/fort.55

 Load integrals                2.5 sec
 Transform integrals           2.9 sec
 Storage for integrals:        3835052
 Remaining memory:           *********

 Core energy:               0.00000000
 
 MRCC Input:
     4     0     0     0     3     0     0     2     0     0     0     1     1     0     0     7     0     0   0.000     0   64000
  ex.lev,nsing,ntrip, rest,method,dens,conver,symm, diag, CS ,spatial, HF, ndoub,nacto,nactv, tol, maxex, sacc, freq,  dboc,   mem
  2  0  0  0  0  0  0  0  0  0  0  0  0  0  0  0  0  0  0  1  0  0  0  0  0  0  0  0  0  0  0  0  0  0  0  0  0  0  0  0  0  0  0  0  0  0  0  0  0  0  0  0  0  0  0  0  0  0  0  0  0  0  0  0  0  0  0  0  0  0  0  0  0  0  0  0  0  0  0
 MRCC Input end
 Variable memory released
 MRCC now being run, temporary output in /global/cscratch1/sd/aannabe/mrcc_36611/mrcc.out
 **********************************************************************
                          MRCC program system
 **********************************************************************

                              Written by
  Mihaly Kallay, Zoltan Rolik, Jozsef Csontos, Peter Nagy, Gyula Samu,
      David Mester, Jozsef Csoka, Bernat Szabo, Istvan Ladjanszki,
       Lorant Szegedy, Bence Ladoczki, Klara Petrov, Mate Farkas,
                    Pal D. Mezei, and Bence Hegely

        Department of Physical Chemistry and Materials Science
            Budapest University of Technology and Economics
                  Budapest P.O.Box 91, H-1521 Hungary

                              www.mrcc.hu

                       Release date: May 23, 2018

 ************************ 2018-06-15 16:19:12 *************************
 Executing goldstone...

 Generation of CC equations in terms of H and T...
 Generation of antisymmetrized Goldstone diagrams...
 Number of diagrams in T^1 equations:    15
 Number of diagrams in T^2 equations:    33
 Number of diagrams in T^3 equations:     2
 Translation of diagrams to factorized equations...
 Optimizing intermediate calculation...
 Number of floating-point operations per iteration step:   3.9506E+07
 Probable CPU time per iteration step (hours):      0.00
 Required memory (Mbytes):    4701.1
 Number of intermediates:                                  48
 Number of intermediates to be stored:                     20
 Length of intermediate file (Mbytes):      73.5

 ************************ 2018-06-15 16:19:12 *************************
 Executing xmrcc...

 **********************************************************************
 CC(2)(3) calculation


 Allocation of4701.1 Mbytes of memory...
 Number of spinorbitals:                   158
 Number of alpha electrons:                        2
 Number of beta electrons:                         1
 Spin multiplicity:                     2
 z-component of spin:  0.5
 Spatial symmetry:                      2
 Convergence criterion:  1.0E-07
 Construction of occupation graphs...
 Number of                     0 -fold excitations:                      1
 Number of                     1 -fold excitations:                     46
 Number of                     2 -fold excitations:                   2035
 Total number of configurations:                   2082
 Calculation of coupling coefficients...
 Length of intermediate file (Mbytes):      56.0

 ======================================================================

 Spin case  1   Alpha:  2   Beta:  1
 Number of excitations:                  28704
 Number of                     3 -fold excitations:                  28704

 Memory requirements /Mbyte/:
               Minimal        Optimal
 Real*8:         35.6078       297.2647
 Integer:         4.1237
 Total:          39.7315       301.3884


 ************************ 2018-06-15 16:19:13 *************************
 Executing mrcc...

 **********************************************************************
 CCSDT(T) calculation


 OpenMP parallel version is running.
 Number of CPUs:   1
 Allocation of  297.3 Mbytes of memory...
 Number of spinorbitals: 158
 Number of alpha electrons:  2
 Number of beta  electrons:  1
 Spin multiplicity: 2
 z-component of spin:  0.5
 Spatial symmetry: 2
 Convergence criterion:  1.0E-07
 Construction of occupation graphs...
 Number of 0-fold excitations: 1
 Number of 1-fold excitations: 46
 Number of 2-fold excitations: 2035
 Total number of determinants: 2082
 Calculation of coupling coefficients...
 Initial cluster amplitudes are generated.
 Length of intermediate file (Mbytes):      56.0
 Reading integral list from unit 55...
 Sorting integrals...
 Sorting integrals...
 Sorting integrals...
 Sorting integrals...
 Energy of reference determinant [au]:      -2.539303974955
 Calculation of MP denominators...

 Starting CC iteration...
 ======================================================================
 Norm of residual vector:     0.35572957
 CPU time [min]:     0.137                   Wall time [min]:     0.139

 Iteration  1  CC energy:    -2.59365168  Energy decrease:   0.05434771
 ======================================================================
 Norm of residual vector:     0.09276358
 CPU time [min]:     0.174                   Wall time [min]:     0.177

 Iteration  2  CC energy:    -2.60701902  Energy decrease:   0.01336734
 ======================================================================
 Norm of residual vector:     0.03023271
 CPU time [min]:     0.212                   Wall time [min]:     0.214

 Iteration  3  CC energy:    -2.61194027  Energy decrease:   0.00492125
 ======================================================================
 Norm of residual vector:     0.00860638
 CPU time [min]:     0.249                   Wall time [min]:     0.251

 Iteration  4  CC energy:    -2.61239701  Energy decrease:   0.00045674
 ======================================================================
 Norm of residual vector:     0.00174889
 CPU time [min]:     0.286                   Wall time [min]:     0.288

 Iteration  5  CC energy:    -2.61247705  Energy decrease:   0.00008004
 ======================================================================
 Norm of residual vector:     0.00038958
 CPU time [min]:     0.322                   Wall time [min]:     0.325

 Iteration  6  CC energy:    -2.61246390  Energy decrease:   0.00001315
 ======================================================================
 Norm of residual vector:     0.00010658
 CPU time [min]:     0.360                   Wall time [min]:     0.363

 Iteration  7  CC energy:    -2.61246755  Energy decrease:   0.00000365
 ======================================================================
 Norm of residual vector:     0.00002830
 CPU time [min]:     0.398                   Wall time [min]:     0.400

 Iteration  8  CC energy:    -2.61246753  Energy decrease:   0.00000002
 ======================================================================
 Norm of residual vector:     0.00000747
 CPU time [min]:     0.435                   Wall time [min]:     0.438

 Iteration  9  CC energy:    -2.61246727  Energy decrease:   0.00000026
 ======================================================================
 Norm of residual vector:     0.00000174
 CPU time [min]:     0.473                   Wall time [min]:     0.476

 Iteration 10  CC energy:    -2.61246731  Energy decrease:   0.00000004
 ======================================================================
 Norm of residual vector:     0.00000042
 CPU time [min]:     0.511                   Wall time [min]:     0.514

 Iteration 11  CC energy:    -2.61246730  Energy decrease:   0.00000001
 ======================================================================
 Norm of residual vector:     0.00000014
 CPU time [min]:     0.548                   Wall time [min]:     0.551

 Iteration 12  CC energy:    -2.61246731  Energy decrease:   1.5338E-09
 ======================================================================
 Norm of residual vector:     0.00000004
 CPU time [min]:     0.586                   Wall time [min]:     0.589

 Iteration 13  CC energy:    -2.61246731  Energy decrease:   5.1864E-10
 ======================================================================

 Iteration has converged in 13 steps.

 Final results:
 Total CCSDT energy [au]:             -2.612467306195
 Total MP2 energy [au]:               -2.593651683481

 Perturbative corrections are calculated...
 ======================================================================
 Spin case  1   Alpha:  2   Beta:  1
 Number of excitations:        28704
 CPU time [min]:     0.601                   Wall time [min]:     0.604
 ======================================================================
 Number of 3-fold excitations: 28704
 CPU time [min]:     0.601                   Wall time [min]:     0.604

 Total CCSD[T] energy [au]:           -2.614132344022
 Total CCSD(T) energy [au]:           -2.614152423399

 ************************ 2018-06-15 16:19:49 *************************
                      Normal termination of mrcc.
 **********************************************************************
 !CCSDT STATE 1.2 Energy               -2.612467306195
 !MP2 STATE 1.2 Energy                 -2.593651683481
 !CCSD[T] STATE 1.2 Energy             -2.614132344022
 !CCSD(T) STATE 1.2 Energy             -2.614152423399
 
 CPU-time for MRCC:             36.1 sec
 Elapsed-time for MRCC:         38.9 sec

 Variable memory set to 8000000000 words,  buffer space   230000 words



 **********************************************************************************************************************************
 DATASETS  * FILE   NREC   LENGTH (MB)   RECORD NAMES
              1      20       22.67       500      610      700      900      950      970     1000      129      960     1100   
                                          VAR    BASINP    GEOM    SYMINP    ZMAT    AOBASIS   BASIS     P2S    ABASIS      S 
                                         1400     1410     1420     1200     1210     1080     1600     1650     1300     1700   
                                         EKIN       V       ECP      H0       H01     AOSYM     SMH    MOLCAS    ERIS     OPER   

              2       5        5.33       700     1000      520     2100     2200   
                                         GEOM     BASIS   MCVARS     RHF      UHF  

 PROGRAMS   *        TOTAL      MRCC       UHF        HF       INT
 CPU TIMES  *        48.18     45.71      0.01      0.07      2.27
 REAL TIME  *       104.31 SEC
 DISK USED  *        34.23 MB      
 **********************************************************************************************************************************
 SETTING POSTHF(I)      =        -2.61415242  AU                              
                                                                                                                                                                                                                                                                

       SCF           POSTHF       EKIN          POT
    -2.53930397   -2.61415242   1.31355496   -1.84052827
                                                  

 CCSD(T)/USERDEF energy=     -2.614152423399

        CCSD(T)         HF-SCF  
     -2.61415242     -2.53930397
 **********************************************************************************************************************************
 Variable memory released
