
 Primary working directories    : /global/cscratch1/sd/aannabe
 Secondary working directories  : /global/cscratch1/sd/aannabe
 Wavefunction directory         : /global/homes/a/aannabe/wfu/
 Main file repository           : /global/cscratch1/sd/aannabe/

 SHA1      : 2873118e99aab1bc19f5b6fc1784693c06d15c95
 NAME      : 2015.1.8
 ARCHNAME  : linux/x86_64
 FC        : /opt/cray/pe/craype/2.5.5/bin/ftn
 BLASLIB   : -Wl,-_start-group /opt/intel/compilers_and_libraries_2016.3.210/linux/mkl/lib/intel64/libmkl_intel_ilp64.a /opt/intel/compilers_and_libraries_2016.3.210/linux/mkl/lib/intel64/libmkl_intel_thread.a /opt/intel/compilers_and_libraries_2016.3.210/linux/mkl/lib/intel64/libmkl_core.a -Wl,-_end-group
 id        : lbl

 Nodes     nprocs
 nid00461     1

 Using customized tuning parameters: mindgm=8; mindgv=16; mindgc=4; mindgr=1; noblas=0; minvec=7
 default implementation of scratch files=df  

 ***,P
 memory,8,g
 gthresh,twoint=1.e-12
 
 gprint,basis,orbitals
 gexpec,ekin,pot
 
 angstrom
 geometry={
 1                                                                               ! Number of atoms
 P 0.0 0.0 0.0
 }
 
 basis={
 Including file /global/homes/a/aannabe/docs/totals/pps/P.pp
 Including file /global/homes/a/aannabe/docs/totals/basis/aug-cc-pVnZ/P_5z.basis
 }
 
 {hf
 wf,5,8,3
 occ,1,1,1,0,1,0,0,0
                                                                                 !open,1.3
 closed,1,0,0,0,0,0,0,0
                                                                                 !sym,
 }
 scf(i)=energy
 
 _CC_NORM_MAX=2.0
  !NOTE: Perturbative MRCC works only with UHF reference. So, here we will trick MRCC by doing zero UHF iteration right after ROHF.
 
 {uhf
 wf,5,8,3
 occ,1,1,1,0,1,0,0,0
                                                                                 !open,1.3
 closed,1,0,0,0,0,0,0,0
                                                                                 !sym,
 maxit,0
 }
 scf(i)=energy
 
 {mrcc,method=CCSDT(Q)
 orbital,ignore_error=1                                                          !Ignore the fact that UHF WF is not converged
 maxit,100
 core
 }
 posthf(i)=energy
 
 table,scf,posthf,ekin,pot
 save,5.csv,new
 
 

 Variables initialized (889), CPU time= 0.00 sec
 Commands  initialized (702), CPU time= 0.00 sec, 572 directives.
 Default parameters read. Elapsed time= 0.11 sec

 Checking input...
 Passed
1


                                         ***  PROGRAM SYSTEM MOLPRO  ***
                                       Copyright, TTI GmbH Stuttgart, 2015
                                    Version 2015.1 linked Sep  7 2016 23:09:38


 **********************************************************************************************************************************
 LABEL *   P                                                                             
  64 bit serial version                                                                  DATE: 05-Oct-18          TIME: 11:07:19  
 **********************************************************************************************************************************

 SHA1:             2873118e99aab1bc19f5b6fc1784693c06d15c95
 **********************************************************************************************************************************

 THRESHOLDS:

 ZERO    =  1.00D-12  ONEINT  =  1.00D-12  TWOINT  =  1.00D-12  PREFAC  =  1.00D-14  LOCALI  =  1.00D-09  EORDER  =  1.00D-04
 ENERGY  =  0.00D+00  ETEST   =  0.00D+00  EDENS   =  0.00D+00  THRDEDEF=  1.00D-06  GRADIENT=  1.00D-02  STEP    =  1.00D-03
 ORBITAL =  1.00D-05  CIVEC   =  1.00D-05  COEFF   =  1.00D-04  PRINTCI =  5.00D-02  PUNCHCI =  9.90D+01  OPTGRAD =  3.00D-04
 OPTENERG=  1.00D-06  OPTSTEP =  3.00D-04  THRGRAD =  1.00D-10  COMPRESS=  1.00D-11  VARMIN  =  1.00D-07  VARMAX  =  1.00D-03
 THRDOUB =  0.00D+00  THRDIV  =  1.00D-05  THRRED  =  1.00D-07  THRPSP  =  1.00D+00  THRDC   =  1.00D-10  THRCS   =  1.00D-10
 THRNRM  =  1.00D-08  THREQ   =  0.00D+00  THRDE   =  1.00D+00  THRREF  =  1.00D-05  SPARFAC =  1.00D+00  THRDLP  =  1.00D-07
 THRDIA  =  1.00D-10  THRDLS  =  1.00D-07  THRGPS  =  0.00D+00  THRKEX  =  0.00D+00  THRDIS  =  2.00D-01  THRVAR  =  1.00D-10
 THRLOC  =  1.00D-06  THRGAP  =  1.00D-06  THRLOCT = -1.00D+00  THRGAPT = -1.00D+00  THRORB  =  1.00D-06  THRMLTP =  0.00D+00
 THRCPQCI=  1.00D-10  KEXTA   =  0.00D+00  THRCOARS=  0.00D+00  SYMTOL  =  1.00D-06  GRADTOL =  1.00D-06  THROVL  =  1.00D-08
 THRORTH =  1.00D-08  GRID    =  1.00D-06  GRIDMAX =  1.00D-03  DTMAX   =  0.00D+00  THROCCDE=  1.00D-01  THROCCDE=  1.00D-01



 ZUNIT=ANG
 

Geometry recognized as XYZ


 Variable memory set to 8000000000 words,  buffer space   230000 words

 SETTING BASIS          =    USERDEF


 Recomputing integrals since basis changed


 Using spherical harmonics



 PROGRAM * SEWARD (Integral evaluation for generally contracted gaussian basis sets)     Author: Roland Lindh, 1990

 Geometry written to block  1 of record 700

 Orientation using atomic masses  
 Molecule type: Atom
 Symmetry elements: X,Y,Z
 Rotational constants:       0.0000000      0.0000000      0.0000000 GHz  (calculated with average atomic masses)

 Point group  D2h 



 ATOMIC COORDINATES

 NR  ATOM    CHARGE       X              Y              Z

   1  P       5.00    0.000000000    0.000000000    0.000000000


          P   CORE POTENTIAL

          d POTENTIAL

 POWERS             1              3              2
 EXPONENTIALS   5.872694       9.891298       4.692469    
 COEFFICIENTS   5.000000       29.36347      -17.01114    

          s - d POTENTIAL

 POWERS             2              2
 EXPONENTIALS   12.09133       3.044535    
 COEFFICIENTS   15.25938       31.70792    

          p - d POTENTIAL

 POWERS             2              2
 EXPONENTIALS   4.310884       2.426903    
 COEFFICIENTS   7.747190       13.93253    


 BASIS DATA

   Nr Sym  Nuc  Type         Exponents   Contraction coefficients

    1.1 Ag    1  1s           5.054268     0.001781
                              3.094719     0.077653
                              1.894891    -0.312344
                              1.160239    -0.045804
                              0.710412    -0.029427
                              0.434984     0.318560
                              0.266340     0.309169
                              0.163080     0.376899
                              0.099853     0.152113
                              0.061140     0.054943
    2.1 Ag    1  1s           0.880402     1.000000
    3.1 Ag    1  1s           0.402152     1.000000
    4.1 Ag    1  1s           0.183696     1.000000
    5.1 Ag    1  1s           0.083909     1.000000
    6.1 Ag    1  1s           0.033844     1.000000
    7.1 Ag    1  3d0          2.631593     1.000000
    8.1 Ag    1  3d2+         2.631593     1.000000
    9.1 Ag    1  3d0          1.041129     1.000000
   10.1 Ag    1  3d2+         1.041129     1.000000
   11.1 Ag    1  3d0          0.411898     1.000000
   12.1 Ag    1  3d2+         0.411898     1.000000
   13.1 Ag    1  3d0          0.162958     1.000000
   14.1 Ag    1  3d2+         0.162958     1.000000
   15.1 Ag    1  3d0          0.059481     1.000000
   16.1 Ag    1  3d2+         0.059481     1.000000
   17.1 Ag    1  5g0          0.912065     1.000000
   18.1 Ag    1  5g4+         0.912065     1.000000
   19.1 Ag    1  5g2+         0.912065     1.000000
   20.1 Ag    1  5g0          0.408483     1.000000
   21.1 Ag    1  5g4+         0.408483     1.000000
   22.1 Ag    1  5g2+         0.408483     1.000000
   23.1 Ag    1  5g0          0.178650     1.000000
   24.1 Ag    1  5g4+         0.178650     1.000000
   25.1 Ag    1  5g2+         0.178650     1.000000
    1.2 B3u   1  2px          5.861284    -0.003160
                              3.406365     0.007462
                              1.979655    -0.060893
                              1.150503     0.015297
                              0.668631     0.123431
                              0.388584     0.257276
                              0.225831     0.305131
                              0.131245     0.276016
                              0.076275     0.134133
                              0.044328     0.040073
    2.2 B3u   1  2px          1.818940     1.000000
    3.2 B3u   1  2px          0.887311     1.000000
    4.2 B3u   1  2px          0.432846     1.000000
    5.2 B3u   1  2px          0.211150     1.000000
    6.2 B3u   1  2px          0.027376     1.000000
    7.2 B3u   1  4f1+         1.006219     1.000000
    8.2 B3u   1  4f3+         1.006219     1.000000
    9.2 B3u   1  4f1+         0.473918     1.000000
   10.2 B3u   1  4f3+         0.473918     1.000000
   11.2 B3u   1  4f1+         0.223210     1.000000
   12.2 B3u   1  4f3+         0.223210     1.000000
   13.2 B3u   1  4f1+         0.089747     1.000000
   14.2 B3u   1  4f3+         0.089747     1.000000
   15.2 B3u   1  6h1+         0.739580     1.000000
   16.2 B3u   1  6h3+         0.739580     1.000000
   17.2 B3u   1  6h5+         0.739580     1.000000
   18.2 B3u   1  6h1+         0.358149     1.000000
   19.2 B3u   1  6h3+         0.358149     1.000000
   20.2 B3u   1  6h5+         0.358149     1.000000
    1.3 B2u   1  2py          5.861284    -0.003160
                              3.406365     0.007462
                              1.979655    -0.060893
                              1.150503     0.015297
                              0.668631     0.123431
                              0.388584     0.257276
                              0.225831     0.305131
                              0.131245     0.276016
                              0.076275     0.134133
                              0.044328     0.040073
    2.3 B2u   1  2py          1.818940     1.000000
    3.3 B2u   1  2py          0.887311     1.000000
    4.3 B2u   1  2py          0.432846     1.000000
    5.3 B2u   1  2py          0.211150     1.000000
    6.3 B2u   1  2py          0.027376     1.000000
    7.3 B2u   1  4f1-         1.006219     1.000000
    8.3 B2u   1  4f3-         1.006219     1.000000
    9.3 B2u   1  4f1-         0.473918     1.000000
   10.3 B2u   1  4f3-         0.473918     1.000000
   11.3 B2u   1  4f1-         0.223210     1.000000
   12.3 B2u   1  4f3-         0.223210     1.000000
   13.3 B2u   1  4f1-         0.089747     1.000000
   14.3 B2u   1  4f3-         0.089747     1.000000
   15.3 B2u   1  6h1-         0.739580     1.000000
   16.3 B2u   1  6h3-         0.739580     1.000000
   17.3 B2u   1  6h5-         0.739580     1.000000
   18.3 B2u   1  6h1-         0.358149     1.000000
   19.3 B2u   1  6h3-         0.358149     1.000000
   20.3 B2u   1  6h5-         0.358149     1.000000
    1.4 B1g   1  3d2-         2.631593     1.000000
    2.4 B1g   1  3d2-         1.041129     1.000000
    3.4 B1g   1  3d2-         0.411898     1.000000
    4.4 B1g   1  3d2-         0.162958     1.000000
    5.4 B1g   1  3d2-         0.059481     1.000000
    6.4 B1g   1  5g2-         0.912065     1.000000
    7.4 B1g   1  5g4-         0.912065     1.000000
    8.4 B1g   1  5g2-         0.408483     1.000000
    9.4 B1g   1  5g4-         0.408483     1.000000
   10.4 B1g   1  5g2-         0.178650     1.000000
   11.4 B1g   1  5g4-         0.178650     1.000000
    1.5 B1u   1  2pz          5.861284    -0.003160
                              3.406365     0.007462
                              1.979655    -0.060893
                              1.150503     0.015297
                              0.668631     0.123431
                              0.388584     0.257276
                              0.225831     0.305131
                              0.131245     0.276016
                              0.076275     0.134133
                              0.044328     0.040073
    2.5 B1u   1  2pz          1.818940     1.000000
    3.5 B1u   1  2pz          0.887311     1.000000
    4.5 B1u   1  2pz          0.432846     1.000000
    5.5 B1u   1  2pz          0.211150     1.000000
    6.5 B1u   1  2pz          0.027376     1.000000
    7.5 B1u   1  4f0          1.006219     1.000000
    8.5 B1u   1  4f2+         1.006219     1.000000
    9.5 B1u   1  4f0          0.473918     1.000000
   10.5 B1u   1  4f2+         0.473918     1.000000
   11.5 B1u   1  4f0          0.223210     1.000000
   12.5 B1u   1  4f2+         0.223210     1.000000
   13.5 B1u   1  4f0          0.089747     1.000000
   14.5 B1u   1  4f2+         0.089747     1.000000
   15.5 B1u   1  6h2+         0.739580     1.000000
   16.5 B1u   1  6h4+         0.739580     1.000000
   17.5 B1u   1  6h0          0.739580     1.000000
   18.5 B1u   1  6h2+         0.358149     1.000000
   19.5 B1u   1  6h4+         0.358149     1.000000
   20.5 B1u   1  6h0          0.358149     1.000000
    1.6 B2g   1  3d1+         2.631593     1.000000
    2.6 B2g   1  3d1+         1.041129     1.000000
    3.6 B2g   1  3d1+         0.411898     1.000000
    4.6 B2g   1  3d1+         0.162958     1.000000
    5.6 B2g   1  3d1+         0.059481     1.000000
    6.6 B2g   1  5g1+         0.912065     1.000000
    7.6 B2g   1  5g3+         0.912065     1.000000
    8.6 B2g   1  5g1+         0.408483     1.000000
    9.6 B2g   1  5g3+         0.408483     1.000000
   10.6 B2g   1  5g1+         0.178650     1.000000
   11.6 B2g   1  5g3+         0.178650     1.000000
    1.7 B3g   1  3d1-         2.631593     1.000000
    2.7 B3g   1  3d1-         1.041129     1.000000
    3.7 B3g   1  3d1-         0.411898     1.000000
    4.7 B3g   1  3d1-         0.162958     1.000000
    5.7 B3g   1  3d1-         0.059481     1.000000
    6.7 B3g   1  5g1-         0.912065     1.000000
    7.7 B3g   1  5g3-         0.912065     1.000000
    8.7 B3g   1  5g1-         0.408483     1.000000
    9.7 B3g   1  5g3-         0.408483     1.000000
   10.7 B3g   1  5g1-         0.178650     1.000000
   11.7 B3g   1  5g3-         0.178650     1.000000
    1.8 Au    1  4f2-         1.006219     1.000000
    2.8 Au    1  4f2-         0.473918     1.000000
    3.8 Au    1  4f2-         0.223210     1.000000
    4.8 Au    1  4f2-         0.089747     1.000000
    5.8 Au    1  6h4-         0.739580     1.000000
    6.8 Au    1  6h2-         0.739580     1.000000
    7.8 Au    1  6h4-         0.358149     1.000000
    8.8 Au    1  6h2-         0.358149     1.000000

 NUCLEAR CHARGE:                    5
 NUMBER OF PRIMITIVE AOS:         217
 NUMBER OF SYMMETRY AOS:          162
 NUMBER OF CONTRACTIONS:          126   (  25Ag  +  20B3u +  20B2u +  11B1g +  20B1u +  11B2g +  11B3g +   8Au  )
 NUMBER OF CORE ORBITALS:           0   (   0Ag  +   0B3u +   0B2u +   0B1g +   0B1u +   0B2g +   0B3g +   0Au  )
 NUMBER OF VALENCE ORBITALS:        4   (   1Ag  +   1B3u +   1B2u +   0B1g +   1B1u +   0B2g +   0B3g +   0Au  )


 NUCLEAR REPULSION ENERGY    0.00000000

 EXTRA SYMMETRY OF AOS IN SYMMETRY 1:   1 1 1 1 1 1 2 3 2 3   2 3 2 3 2 3 4 5 6 4   5 6 4 5 6
 EXTRA SYMMETRY OF AOS IN SYMMETRY 2:   1 1 1 1 1 1 2 3 2 3   2 3 2 3 4 5 6 4 5 6
 EXTRA SYMMETRY OF AOS IN SYMMETRY 3:   1 1 1 1 1 1 2 3 2 3   2 3 2 3 4 5 6 4 5 6
 EXTRA SYMMETRY OF AOS IN SYMMETRY 4:   1 1 1 1 1 2 3 2 3 2   3
 EXTRA SYMMETRY OF AOS IN SYMMETRY 5:   1 1 1 1 1 1 2 3 2 3   2 3 2 3 4 5 6 4 5 6
 EXTRA SYMMETRY OF AOS IN SYMMETRY 6:   1 1 1 1 1 2 3 2 3 2   3
 EXTRA SYMMETRY OF AOS IN SYMMETRY 7:   1 1 1 1 1 2 3 2 3 2   3
 EXTRA SYMMETRY OF AOS IN SYMMETRY 8:   1 1 1 1 2 3 2 3

 Eigenvalues of metric

         1 0.757E-03 0.511E-02 0.457E-01 0.652E-01 0.652E-01 0.184E+00 0.184E+00 0.184E+00
         2 0.342E-02 0.176E-01 0.716E-01 0.716E-01 0.138E+00 0.342E+00 0.342E+00 0.342E+00
         3 0.342E-02 0.176E-01 0.716E-01 0.716E-01 0.138E+00 0.342E+00 0.342E+00 0.342E+00
         4 0.652E-01 0.184E+00 0.184E+00 0.240E+00 0.673E+00 0.809E+00 0.809E+00 0.148E+01
         5 0.342E-02 0.176E-01 0.716E-01 0.716E-01 0.138E+00 0.342E+00 0.342E+00 0.342E+00
         6 0.652E-01 0.184E+00 0.184E+00 0.240E+00 0.673E+00 0.809E+00 0.809E+00 0.148E+01
         7 0.652E-01 0.184E+00 0.184E+00 0.240E+00 0.673E+00 0.809E+00 0.809E+00 0.148E+01
         8 0.716E-01 0.342E+00 0.342E+00 0.383E+00 0.112E+01 0.166E+01 0.166E+01 0.242E+01


 Contracted 2-electron integrals neglected if value below      1.0D-12
 AO integral compression algorithm  1   Integral accuracy      1.0D-12

     29.622 MB (compressed) written to integral file ( 53.0%)


 NUMBER OF SORTED TWO-ELECTRON INTEGRALS:    4156552.     BUFFER LENGTH:  32768
 NUMBER OF SEGMENTS:   1  SEGMENT LENGTH:    4156552      RECORD LENGTH: 524288

 Memory used in sort:       4.71 MW

 SORT1 READ     6989366. AND WROTE     2907704. INTEGRALS IN      9 RECORDS. CPU TIME:     0.16 SEC, REAL TIME:     0.24 SEC
 SORT2 READ     2907704. AND WROTE     4156552. INTEGRALS IN    113 RECORDS. CPU TIME:     0.16 SEC, REAL TIME:     0.30 SEC

 FILE SIZES:   FILE 1:    49.1 MBYTE,  FILE 4:    37.8 MBYTE,   TOTAL:     86.9 MBYTE

 OPERATOR DM      FOR CENTER  0  COORDINATES:    0.000000    0.000000    0.000000
 OPERATOR EKIN    FOR CENTER  0  COORDINATES:    0.000000    0.000000    0.000000
 OPERATOR POT     FOR CENTER  0  COORDINATES:    0.000000    0.000000    0.000000


 **********************************************************************************************************************************
 DATASETS  * FILE   NREC   LENGTH (MB)   RECORD NAMES
              1      20       37.24       500      610      700      900      950      970     1000      129      960     1100   
                                          VAR    BASINP    GEOM    SYMINP    ZMAT    AOBASIS   BASIS     P2S    ABASIS      S 
                                         1400     1410     1420     1200     1210     1080     1600     1650     1300     1700   
                                         EKIN       V       ECP      H0       H01     AOSYM     SMH    MOLCAS    ERIS     OPER   

 PROGRAMS   *        TOTAL       INT
 CPU TIMES  *         2.90      2.80
 REAL TIME  *        12.29 SEC
 DISK USED  *        87.17 MB      
 **********************************************************************************************************************************


 PROGRAM * RHF-SCF (OPEN SHELL)       Authors: W. Meyer, H.-J. Werner


 NUMBER OF ELECTRONS:       4+    1-    SPACE SYMMETRY=8    SPIN SYMMETRY: Quartet 
 CONVERGENCE THRESHOLDS:    1.00E-05 (Density)    1.00E-07 (Energy)
 MAX. NUMBER OF ITERATIONS:       60
 INTERPOLATION TYPE:            DIIS
 INTERPOLATION STEPS:              2 (START)      1 (STEP)
 LEVEL SHIFTS:                 -0.60 (CLOSED) -0.30 (OPEN) 

 Number of closed-shell orbitals:    1 (   1   0   0   0   0   0   0   0 )
 Number of open-shell orbitals:      3 (   0   1   1   0   1   0   0   0 )



   Atom=P  basis=ECP10MWB_GUESS    lmin=0  lmax=1

 Orbital guess generated from atomic densities. Full valence occupancy:    1   1   1   0   1   0   0   0


 Molecular orbital dump at record        2100.2

 ITERATION    DDIFF          GRAD             ENERGY        2-EL.EN.            DIPOLE MOMENTS         DIIS   ORB.
    1      0.000D+00      0.000D+00        -6.32617036      7.184628    0.00000    0.00000    0.00000    0    start
    2      0.000D+00      0.570D-02        -6.33798932      7.399098    0.00000    0.00000    0.00000    1    diag,B
    3      0.209D-01      0.209D-02        -6.34057319      7.502479    0.00000    0.00000    0.00000    2    diag,B
    4      0.105D-01      0.814D-03        -6.34095257      7.532826    0.00000    0.00000    0.00000    3    diag,B
    5      0.351D-02      0.182D-03        -6.34096578      7.533901    0.00000    0.00000    0.00000    4    diag,B
    6      0.559D-03      0.426D-04        -6.34096641      7.534433    0.00000    0.00000    0.00000    5    diag,B
    7      0.226D-03      0.777D-05        -6.34096643      7.534253    0.00000    0.00000    0.00000    6    fixocc
    8      0.418D-04      0.183D-05        -6.34096643      7.534270    0.00000    0.00000    0.00000    7    diag,B
    9      0.160D-04      0.552D-06        -6.34096643      7.534255    0.00000    0.00000    0.00000    8    diag,B
   10      0.153D-05      0.879D-07        -6.34096643      7.534254    0.00000    0.00000    0.00000    0    orth

 Final alpha occupancy:   1   1   1   0   1   0   0   0
 Final beta  occupancy:   1   0   0   0   0   0   0   0

 !RHF STATE 1.8 Energy                 -6.340966426860
 Nuclear energy                         0.00000000
 One-electron energy                  -10.10809352
 Two-electron energy                    3.76712709
 Virial quotient                       -2.69267968
 !RHF STATE 1.8 Dipole moment           0.00000000     0.00000000     0.00000000
 Dipole moment /Debye                   0.00000000     0.00000000     0.00000000
 

 !RHF expec          <1.8|EKIN|1.8>     2.354890737447
 
 !RHF expec           <1.8|POT|1.8>    -2.719087584338

 ELECTRON ORBITALS
 =================


   Orb  Occ    Energy  Couls-En    Coefficients

                                   1 1s      1 1s      1 1s      1 1s      1 1s      1 1s      1 3d0     1 3d2+    1 3d0     1 3d2+ 
                                   1 3d0     1 3d2+    1 3d0     1 3d2+    1 3d0     1 3d2+    1 5g0     1 5g4+    1 5g2+    1 5g0  
                                   1 5g4+    1 5g2+    1 5g0     1 5g4+    1 5g2+ 

   1.1   2    -0.6989   -2.9915  1.000031  0.000031 -0.000084  0.000111 -0.000150  0.000077  0.000000 -0.000000  0.000000  0.000000
                                 0.000000 -0.000000  0.000000  0.000000 -0.000000  0.000000  0.000000 -0.000000  0.000000 -0.000000
                                 0.000000 -0.000000  0.000000 -0.000000 -0.000000

                                   1 2px     1 2px     1 2px     1 2px     1 2px     1 2px     1 4f1+    1 4f3+    1 4f1+    1 4f3+ 
                                   1 4f1+    1 4f3+    1 4f1+    1 4f3+    1 6h1+    1 6h3+    1 6h5+    1 6h1+    1 6h3+    1 6h5+ 


   1.2   +    -0.3920   -2.2330  0.999549 -0.000035  0.000064  0.000066  0.000313  0.000137  0.000000 -0.000000 -0.000000  0.000000
                                 0.000000 -0.000000 -0.000000  0.000000 -0.000000 -0.000000  0.000000  0.000000  0.000000 -0.000000

                                   1 2py     1 2py     1 2py     1 2py     1 2py     1 2py     1 4f1-    1 4f3-    1 4f1-    1 4f3- 
                                   1 4f1-    1 4f3-    1 4f1-    1 4f3-    1 6h1-    1 6h3-    1 6h5-    1 6h1-    1 6h3-    1 6h5- 


   1.3   +    -0.3920   -2.2330  0.999549 -0.000035  0.000064  0.000066  0.000313  0.000137  0.000000  0.000000 -0.000000 -0.000000
                                 0.000000  0.000000 -0.000000 -0.000000 -0.000000  0.000000  0.000000  0.000000 -0.000000 -0.000000

                                   1 2pz     1 2pz     1 2pz     1 2pz     1 2pz     1 2pz     1 4f0     1 4f2+    1 4f0     1 4f2+ 
                                   1 4f0     1 4f2+    1 4f0     1 4f2+    1 6h2+    1 6h4+    1 6h0     1 6h2+    1 6h4+    1 6h0  


   1.5   +    -0.3920   -2.2330  0.999549 -0.000035  0.000064  0.000066  0.000313  0.000137  0.000000  0.000000 -0.000000 -0.000000
                                 0.000000 -0.000000 -0.000000  0.000000 -0.000000  0.000000 -0.000000 -0.000000 -0.000000  0.000000

 HOMO      1.2    -0.391984 =     -10.6664eV
 LUMO      2.1     0.058280 =       1.5859eV
 LUMO-HOMO         0.450264 =      12.2523eV


 **********************************************************************************************************************************
 DATASETS  * FILE   NREC   LENGTH (MB)   RECORD NAMES
              1      20       37.24       500      610      700      900      950      970     1000      129      960     1100   
                                          VAR    BASINP    GEOM    SYMINP    ZMAT    AOBASIS   BASIS     P2S    ABASIS      S 
                                         1400     1410     1420     1200     1210     1080     1600     1650     1300     1700   
                                         EKIN       V       ECP      H0       H01     AOSYM     SMH    MOLCAS    ERIS     OPER   

              2       4        2.83       700     1000      520     2100   
                                         GEOM     BASIS   MCVARS     RHF  

 PROGRAMS   *        TOTAL        HF       INT
 CPU TIMES  *         3.08      0.18      2.80
 REAL TIME  *        12.67 SEC
 DISK USED  *        87.17 MB      
 **********************************************************************************************************************************
 SETTING SCF(I)         =        -6.34096643  AU                              
 SETTING _CC_NORM_MAX   =         2.00000000                                  


 PROGRAM * UHF-SCF       Authors: W. Meyer, H.-J. Werner


 NUMBER OF ELECTRONS:       4+    1-    SPACE SYMMETRY=8    SPIN SYMMETRY: Quartet 
 CONVERGENCE THRESHOLDS:    1.00E-05 (Density)    1.00E-07 (Energy)
 MAX. NUMBER OF ITERATIONS:        0
 INTERPOLATION TYPE:            DIIS
 INTERPOLATION STEPS:              2 (START)      1 (STEP)
 LEVEL SHIFTS:                  0.20 (ALPHA)   0.20 (BETA) 

 Number of closed-shell orbitals:    1 (   1   0   0   0   0   0   0   0 )
 Number of open-shell orbitals:      3 (   0   1   1   0   1   0   0   0 )


 Molecular orbitals read from record     2100.2  Type=RHF/CANONICAL (state 1.8)

 Molecular orbital dump at record        2200.2

 Initial alpha occupation   1   1   1   0   1   0   0   0
 Initial beta  occupation   1   0   0   0   0   0   0   0

 ITERATION    DDIFF          GRAD             ENERGY        2-EL.EN.            DIPOLE MOMENTS         DIIS
    1      0.000D+00      0.000D+00        -6.34096643      7.534254    0.00000    0.00000    0.00000    0
 
 Final alpha occupancy:   1   1   1   0   1   0   0   0
 Final beta  occupancy:   1   0   0   0   0   0   0   0

 !UHF STATE 1.8 Energy                 -6.340966426860
 Nuclear energy                         0.00000000
 One-electron energy                  -10.10809352
 Two-electron energy                    3.76712709
 Virial quotient                       -2.69267968
 !UHF STATE 1.8 Dipole moment           0.00000000     0.00000000     0.00000000
 Dipole moment /Debye                   0.00000000     0.00000000     0.00000000
 

 !UHF expec          <1.8|EKIN|1.8>     2.354890737447
 
 !UHF expec           <1.8|POT|1.8>    -2.719087584338

 ELECTRON ORBITALS FOR POSITIVE SPIN
 ===================================


   Orb  Occ    Energy  Couls-En    Coefficients

                                   1 1s      1 1s      1 1s      1 1s      1 1s      1 1s      1 3d0     1 3d2+    1 3d0     1 3d2+ 
                                   1 3d0     1 3d2+    1 3d0     1 3d2+    1 3d0     1 3d2+    1 5g0     1 5g4+    1 5g2+    1 5g0  
                                   1 5g4+    1 5g2+    1 5g0     1 5g4+    1 5g2+ 

   1.1   +    -0.6989   -2.9915  1.000031  0.000031 -0.000084  0.000111 -0.000150  0.000077  0.000000 -0.000000  0.000000  0.000000
                                 0.000000 -0.000000  0.000000  0.000000 -0.000000  0.000000  0.000000 -0.000000  0.000000 -0.000000
                                 0.000000 -0.000000  0.000000 -0.000000 -0.000000

                                   1 2px     1 2px     1 2px     1 2px     1 2px     1 2px     1 4f1+    1 4f3+    1 4f1+    1 4f3+ 
                                   1 4f1+    1 4f3+    1 4f1+    1 4f3+    1 6h1+    1 6h3+    1 6h5+    1 6h1+    1 6h3+    1 6h5+ 


   1.2   +    -0.3920   -2.2330  0.999549 -0.000035  0.000064  0.000066  0.000313  0.000137  0.000000 -0.000000 -0.000000  0.000000
                                 0.000000 -0.000000 -0.000000  0.000000 -0.000000 -0.000000  0.000000  0.000000  0.000000 -0.000000

                                   1 2py     1 2py     1 2py     1 2py     1 2py     1 2py     1 4f1-    1 4f3-    1 4f1-    1 4f3- 
                                   1 4f1-    1 4f3-    1 4f1-    1 4f3-    1 6h1-    1 6h3-    1 6h5-    1 6h1-    1 6h3-    1 6h5- 


   1.3   +    -0.3920   -2.2330  0.999549 -0.000035  0.000064  0.000066  0.000313  0.000137  0.000000  0.000000 -0.000000 -0.000000
                                 0.000000  0.000000 -0.000000 -0.000000 -0.000000  0.000000  0.000000  0.000000 -0.000000 -0.000000

                                   1 2pz     1 2pz     1 2pz     1 2pz     1 2pz     1 2pz     1 4f0     1 4f2+    1 4f0     1 4f2+ 
                                   1 4f0     1 4f2+    1 4f0     1 4f2+    1 6h2+    1 6h4+    1 6h0     1 6h2+    1 6h4+    1 6h0  


   1.5   +    -0.3920   -2.2330  0.999549 -0.000035  0.000064  0.000066  0.000313  0.000137  0.000000  0.000000 -0.000000 -0.000000
                                 0.000000 -0.000000 -0.000000  0.000000 -0.000000  0.000000 -0.000000 -0.000000 -0.000000  0.000000

 ELECTRON ORBITALS FOR NEGATIVE SPIN
 ===================================


   Orb  Occ    Energy  Couls-En    Coefficients

                                   1 1s      1 1s      1 1s      1 1s      1 1s      1 1s      1 3d0     1 3d2+    1 3d0     1 3d2+ 
                                   1 3d0     1 3d2+    1 3d0     1 3d2+    1 3d0     1 3d2+    1 5g0     1 5g4+    1 5g2+    1 5g0  
                                   1 5g4+    1 5g2+    1 5g0     1 5g4+    1 5g2+ 

   1.1   -    -0.6989   -2.9915  1.000031  0.000031 -0.000084  0.000111 -0.000150  0.000077  0.000000 -0.000000  0.000000  0.000000
                                 0.000000 -0.000000  0.000000  0.000000 -0.000000  0.000000  0.000000 -0.000000  0.000000 -0.000000
                                 0.000000 -0.000000  0.000000 -0.000000 -0.000000

 HOMO      1.2    -0.391984 =     -10.6664eV
 LUMO     -1.2    -0.391984 =     -10.6664eV
 LUMO-HOMO         0.000000 =       0.0000eV

 EXPECTATION VALUE OF S**2:             3.75000000

 Occupation number threshold for canonical orbitals:  1.999000 (occupied),  0.001000 (virtual)

 Number of pseudo-canonical orbitals per symmetry:    1   0   0   0   0   0   0   0
 Number of active natural orbitals per symmetry:      0   1   1   0   1   0   0   0

 NATURAL CHARGE ORBITALS
 =======================


   Orb     Occ        Energy       Coefficients

                                   1 1s      1 1s      1 1s      1 1s      1 1s      1 1s      1 3d0     1 3d2+    1 3d0     1 3d2+ 
                                   1 3d0     1 3d2+    1 3d0     1 3d2+    1 3d0     1 3d2+    1 5g0     1 5g4+    1 5g2+    1 5g0  
                                   1 5g4+    1 5g2+    1 5g0     1 5g4+    1 5g2+ 

   1.1  2.00000    -0.698943     1.000031  0.000031 -0.000084  0.000111 -0.000150  0.000077  0.000000 -0.000000  0.000000  0.000000
                                 0.000000 -0.000000  0.000000  0.000000 -0.000000  0.000000  0.000000 -0.000000  0.000000 -0.000000
                                 0.000000 -0.000000  0.000000 -0.000000 -0.000000

                                   1 2px     1 2px     1 2px     1 2px     1 2px     1 2px     1 4f1+    1 4f3+    1 4f1+    1 4f3+ 
                                   1 4f1+    1 4f3+    1 4f1+    1 4f3+    1 6h1+    1 6h3+    1 6h5+    1 6h1+    1 6h3+    1 6h5+ 


   1.2  1.00000    -0.156992     0.999549 -0.000035  0.000064  0.000066  0.000313  0.000137  0.000000 -0.000000 -0.000000  0.000000
                                 0.000000 -0.000000 -0.000000  0.000000 -0.000000 -0.000000  0.000000  0.000000  0.000000 -0.000000

                                   1 2py     1 2py     1 2py     1 2py     1 2py     1 2py     1 4f1-    1 4f3-    1 4f1-    1 4f3- 
                                   1 4f1-    1 4f3-    1 4f1-    1 4f3-    1 6h1-    1 6h3-    1 6h5-    1 6h1-    1 6h3-    1 6h5- 


   1.3  1.00000    -0.156992     0.999549 -0.000035  0.000064  0.000066  0.000313  0.000137  0.000000  0.000000 -0.000000 -0.000000
                                 0.000000  0.000000 -0.000000 -0.000000 -0.000000  0.000000  0.000000  0.000000 -0.000000 -0.000000

                                   1 2pz     1 2pz     1 2pz     1 2pz     1 2pz     1 2pz     1 4f0     1 4f2+    1 4f0     1 4f2+ 
                                   1 4f0     1 4f2+    1 4f0     1 4f2+    1 6h2+    1 6h4+    1 6h0     1 6h2+    1 6h4+    1 6h0  


   1.5  1.00000    -0.156992     0.999549 -0.000035  0.000064  0.000066  0.000313  0.000137  0.000000  0.000000 -0.000000 -0.000000
                                 0.000000 -0.000000 -0.000000  0.000000 -0.000000  0.000000 -0.000000 -0.000000 -0.000000  0.000000

 Natural orbitals saved to record    2200.2 (Orbital set 3)

 Orbital spaces for UNO-CAS (Min. occupation: 0.020  Max. occupation: 1.980):

 Closed:        1   0   0   0   0   0   0   0
 Active:        0   1   1   0   1   0   0   0

 No convergence



 **********************************************************************************************************************************
 DATASETS  * FILE   NREC   LENGTH (MB)   RECORD NAMES
              1      20       37.24       500      610      700      900      950      970     1000      129      960     1100   
                                          VAR    BASINP    GEOM    SYMINP    ZMAT    AOBASIS   BASIS     P2S    ABASIS      S 
                                         1400     1410     1420     1200     1210     1080     1600     1650     1300     1700   
                                         EKIN       V       ECP      H0       H01     AOSYM     SMH    MOLCAS    ERIS     OPER   

              2       5        5.45       700     1000      520     2100     2200   
                                         GEOM     BASIS   MCVARS     RHF      UHF  

 PROGRAMS   *        TOTAL       UHF        HF       INT
 CPU TIMES  *         3.12      0.04      0.18      2.80
 REAL TIME  *        12.82 SEC
 DISK USED  *        87.17 MB      
 **********************************************************************************************************************************
 SETTING SCF(I)         =        -6.34096643  AU                              


 PROGRAM * MRCC (General Multireference Coupled Cluster)    Author: M. Kallay, 2000-2005

 ***  Initialisation ***

   0 Spin projections
 
 Molecular orbitals read from record     2200.2  Type=UHF/ALPHA (state 1.8)

 ?Warning: UHF not converged
 Molecular orbitals read from record     2200.2  Type=UHF/BETA (state 1.8)

 ?Warning: UHF not converged
 
 Frozen orbitals:              0 (  0  0  0  0  0  0  0  0)
 Active orbitals:            126 ( 25 20 20 11 20 11 11  8)
 Active electrons:             5
 Spin quantum number:          1.5

 Transformed integrals will be written to file mrcc_10736/fort.55

 Load integrals                3.1 sec
 Transform integrals           5.1 sec
 Storage for integrals:       24278327
 Remaining memory:           *********

 Core energy:               0.00000000
 
 MRCC Input:
     4     0     0     0     3     0     0     8     0     0     0     1     1     0     0     7     0     0   0.000     0   64000
  ex.lev,nsing,ntrip, rest,method,dens,conver,symm, diag, CS ,spatial, HF, ndoub,nacto,nactv, tol, maxex, sacc, freq,  dboc,   mem
  2  0  0  0  0  0  0  0  0  0  0  0  0  0  0  0  0  0  0  0  0  0  0  0  0  1  0  0  0  0  0  0  0  0  0  0  0  0  0  0  0  0  0  0  0  1  0  0  0  0  0  0  0  0  0  0  0  0  0  0  0  0  0  0  0  0  0  0  0  0  0  0  0  0  0  0  1  0  0  0  0  0  0  0  0  0  0  0  0  0  0  0  0  0  0  0  0  0  0  0  0  0  0  0  0  0  0  0  0  0  0  0  0  0  0  0  0  0  0  0  0  0  0  0  0  0
 MRCC Input end
 Variable memory released
 MRCC now being run, temporary output in /global/cscratch1/sd/aannabe/mrcc_10736/mrcc.out
 **********************************************************************
                          MRCC program system
 **********************************************************************

                              Written by
  Mihaly Kallay, Zoltan Rolik, Jozsef Csontos, Peter Nagy, Gyula Samu,
      David Mester, Jozsef Csoka, Bernat Szabo, Istvan Ladjanszki,
       Lorant Szegedy, Bence Ladoczki, Klara Petrov, Mate Farkas,
                    Pal D. Mezei, and Bence Hegely

        Department of Physical Chemistry and Materials Science
            Budapest University of Technology and Economics
                  Budapest P.O.Box 91, H-1521 Hungary

                              www.mrcc.hu

                       Release date: May 23, 2018

 ************************ 2018-10-05 11:12:11 *************************
 Executing goldstone...

 Generation of CC equations in terms of H and T...
 Generation of antisymmetrized Goldstone diagrams...
 Number of diagrams in T^1 equations:    15
 Number of diagrams in T^2 equations:    38
 Number of diagrams in T^3 equations:    49
 Number of diagrams in T^4 equations:     5
 Translation of diagrams to factorized equations...
 Optimizing intermediate calculation...
 Number of floating-point operations per iteration step:   2.2471E+11
 Probable CPU time per iteration step (hours):      2.25
 Required memory (Mbytes):   30320.9
 Number of intermediates:                                  80
 Number of intermediates to be stored:                     32
 Length of intermediate file (Mbytes):     497.7

 ************************ 2018-10-05 11:12:12 *************************
 Executing xmrcc...

 **********************************************************************
 CC(3)(4) calculation


 Allocation of****** Mbytes of memory...
 Number of spinorbitals:                   252
 Number of alpha electrons:                        4
 Number of beta electrons:                         1
 Spin multiplicity:                     2
 z-component of spin:  1.5
 Spatial symmetry:                      8
 Convergence criterion:  1.0E-07
 Construction of occupation graphs...
 Number of                     0 -fold excitations:                      1
 Number of                     1 -fold excitations:                    105
 Number of                     2 -fold excitations:                  13633
 Number of                     3 -fold excitations:                 839097
 Total number of configurations:                 852836
 Calculation of coupling coefficients...
 Length of intermediate file (Mbytes):     375.6

 ======================================================================

 Spin case  1   Alpha:  3   Beta:  1
 Number of excitations:               18435500
 Spin case  2   Alpha:  4   Beta:  0
 Number of excitations:                1099202
 Number of                     4 -fold excitations:               19534702

 Memory requirements /Mbyte/:
               Minimal        Optimal
 Real*8:        788.5721      1923.2150
 Integer:        78.3539
 Total:         866.9260      2001.5690


 ************************ 2018-10-05 11:12:22 *************************
 Executing mrcc...

 **********************************************************************
 CCSDT(Q) calculation


 OpenMP parallel version is running.
 Number of CPUs:   1
 Allocation of 1923.2 Mbytes of memory...
 Number of spinorbitals: 252
 Number of alpha electrons:  4
 Number of beta  electrons:  1
 Spin multiplicity: 2
 z-component of spin:  1.5
 Spatial symmetry: 8
 Convergence criterion:  1.0E-07
 Construction of occupation graphs...
 Number of 0-fold excitations: 1
 Number of 1-fold excitations: 105
 Number of 2-fold excitations: 13633
 Number of 3-fold excitations: 839097
 Total number of determinants: 852836
 Calculation of coupling coefficients...
 Initial cluster amplitudes are generated.
 Length of intermediate file (Mbytes):     375.6
 Reading integral list from unit 55...
 Sorting integrals...
 Sorting integrals...
 Sorting integrals...
 Sorting integrals...
 Energy of reference determinant [au]:      -6.340966426860
 Calculation of MP denominators...

 Starting CC iteration...
 ======================================================================
 Norm of residual vector:     0.51174762
 CPU time [min]:     1.044                   Wall time [min]:     1.064

 Iteration  1  CC energy:    -6.44014521  Energy decrease:   0.09917878
 ======================================================================
 Norm of residual vector:     0.16067749
 CPU time [min]:     1.496                   Wall time [min]:     1.537

 Iteration  2  CC energy:    -6.44970186  Energy decrease:   0.00955666
 ======================================================================
 Norm of residual vector:     0.04483705
 CPU time [min]:     1.982                   Wall time [min]:     2.029

 Iteration  3  CC energy:    -6.45824622  Energy decrease:   0.00854436
 ======================================================================
 Norm of residual vector:     0.00982278
 CPU time [min]:     2.443                   Wall time [min]:     2.497

 Iteration  4  CC energy:    -6.45829828  Energy decrease:   0.00005207
 ======================================================================
 Norm of residual vector:     0.00245843
 CPU time [min]:     2.912                   Wall time [min]:     2.970

 Iteration  5  CC energy:    -6.45836794  Energy decrease:   0.00006965
 ======================================================================
 Norm of residual vector:     0.00067100
 CPU time [min]:     3.378                   Wall time [min]:     3.443

 Iteration  6  CC energy:    -6.45837876  Energy decrease:   0.00001082
 ======================================================================
 Norm of residual vector:     0.00018095
 CPU time [min]:     3.839                   Wall time [min]:     3.910

 Iteration  7  CC energy:    -6.45836806  Energy decrease:   0.00001070
 ======================================================================
 Norm of residual vector:     0.00004729
 CPU time [min]:     4.303                   Wall time [min]:     4.378

 Iteration  8  CC energy:    -6.45836876  Energy decrease:   0.00000069
 ======================================================================
 Norm of residual vector:     0.00001432
 CPU time [min]:     4.769                   Wall time [min]:     4.849

 Iteration  9  CC energy:    -6.45836947  Energy decrease:   0.00000071
 ======================================================================
 Norm of residual vector:     0.00000482
 CPU time [min]:     5.257                   Wall time [min]:     5.344

 Iteration 10  CC energy:    -6.45836928  Energy decrease:   0.00000018
 ======================================================================
 Norm of residual vector:     0.00000167
 CPU time [min]:     5.724                   Wall time [min]:     5.818

 Iteration 11  CC energy:    -6.45836924  Energy decrease:   0.00000004
 ======================================================================
 Norm of residual vector:     0.00000056
 CPU time [min]:     6.194                   Wall time [min]:     6.293

 Iteration 12  CC energy:    -6.45836928  Energy decrease:   0.00000004
 ======================================================================
 Norm of residual vector:     0.00000014
 CPU time [min]:     6.662                   Wall time [min]:     6.768

 Iteration 13  CC energy:    -6.45836927  Energy decrease:   0.00000001
 ======================================================================
 Norm of residual vector:     0.00000004
 CPU time [min]:     7.116                   Wall time [min]:     7.228

 Iteration 14  CC energy:    -6.45836927  Energy decrease:   6.8310E-10
 ======================================================================

 Iteration has converged in 14 steps.

 Final results:
 Total CCSDT energy [au]:             -6.458369273271
 Total MP2 energy [au]:               -6.440145207510

 Perturbative corrections are calculated...
 ======================================================================
 Spin case  1   Alpha:  3   Beta:  1
 Number of excitations:        18435500
 CPU time [min]:    66.257                   Wall time [min]:    66.371
 ======================================================================
 Spin case  2   Alpha:  4   Beta:  0
 Number of excitations:        1099202
 CPU time [min]:    75.914                   Wall time [min]:    76.032
 ======================================================================
 Number of 4-fold excitations: 19534702
 CPU time [min]:    75.914                   Wall time [min]:    76.035

 Total CCSDT[Q] energy [au]:          -6.458422084124
 Total CCSDT(Q) energy [au]:          -6.458558253011

 ************************ 2018-10-05 12:28:25 *************************
                      Normal termination of mrcc.
 **********************************************************************
 !CCSDT STATE 1.8 Energy               -6.458369273271
 !MP2 STATE 1.8 Energy                 -6.440145207510
 !CCSDT[Q] STATE 1.8 Energy            -6.458422084124
 !CCSDT(Q) STATE 1.8 Energy            -6.458558253011
 
 CPU-time for MRCC:           4554.8 sec
 Elapsed-time for MRCC:       4575.8 sec

 Variable memory set to 8000000000 words,  buffer space   230000 words



 **********************************************************************************************************************************
 DATASETS  * FILE   NREC   LENGTH (MB)   RECORD NAMES
              1      20       37.24       500      610      700      900      950      970     1000      129      960     1100   
                                          VAR    BASINP    GEOM    SYMINP    ZMAT    AOBASIS   BASIS     P2S    ABASIS      S 
                                         1400     1410     1420     1200     1210     1080     1600     1650     1300     1700   
                                         EKIN       V       ECP      H0       H01     AOSYM     SMH    MOLCAS    ERIS     OPER   

              2       5        5.45       700     1000      520     2100     2200   
                                         GEOM     BASIS   MCVARS     RHF      UHF  

 PROGRAMS   *        TOTAL      MRCC       UHF        HF       INT
 CPU TIMES  *      4607.73   4604.61      0.04      0.18      2.80
 REAL TIME  *      4867.16 SEC
 DISK USED  *        87.17 MB      
 **********************************************************************************************************************************
 SETTING POSTHF(I)      =        -6.45855825  AU                              
                                                                                                                                                                                                                                                                

       SCF           POSTHF       EKIN          POT
    -6.34096643   -6.45855825   2.35489074   -2.71908758
                                                  

 CCSDT(Q)/USERDEF energy=     -6.458558253011

        CCSDT(Q)        UHF-SCF         HF-SCF  
     -6.45855825     -6.34096643     -6.34096643
 **********************************************************************************************************************************
 Variable memory released
