
 Primary working directories    : /global/cscratch1/sd/aannabe
 Secondary working directories  : /global/cscratch1/sd/aannabe
 Wavefunction directory         : /global/homes/a/aannabe/wfu/
 Main file repository           : /global/cscratch1/sd/aannabe/

 SHA1      : 2873118e99aab1bc19f5b6fc1784693c06d15c95
 NAME      : 2015.1.8
 ARCHNAME  : linux/x86_64
 FC        : /opt/cray/pe/craype/2.5.5/bin/ftn
 BLASLIB   : -Wl,-_start-group /opt/intel/compilers_and_libraries_2016.3.210/linux/mkl/lib/intel64/libmkl_intel_ilp64.a /opt/intel/compilers_and_libraries_2016.3.210/linux/mkl/lib/intel64/libmkl_intel_thread.a /opt/intel/compilers_and_libraries_2016.3.210/linux/mkl/lib/intel64/libmkl_core.a -Wl,-_end-group
 id        : lbl

 Nodes     nprocs
 nid00478     1

 Using customized tuning parameters: mindgm=8; mindgv=16; mindgc=4; mindgr=1; noblas=0; minvec=7
 default implementation of scratch files=df  

 ***,O
 memory,8,g
 gthresh,twoint=1.e-12
 
 gprint,basis,orbitals
 gexpec,ekin,pot
 
 angstrom
 geometry={
 1                                                                               ! Number of atoms
 O 0.0 0.0 0.0
 }
 
 basis={
 Including file /global/homes/a/aannabe/docs/accurate/ccECP_Kh/pps/O.pp
 Including file /global/homes/a/aannabe/docs/accurate/ccECP_Kh/basis/aug-cc-pVnZ/O_dz.basis
 }
 
 {rhf
  start,atden
  wf,6,7,2
  occ,1,1,1,0,1,0,0,0
  open,1.3,1.5
  orbital,4202.2
 }
 {multi
  maxiter,40
  start,4202.2
  occ,1,1,1,0,1,0,0,0
  closed,1,0,0,0,0,0,0
  wf,6,4,2;state,1
  wf,6,6,2;state,1
  wf,6,7,2;state,1
  natorb,ci,print
  orbital,5202.2
 }
 {rhf,nitord=1,maxit=0
  start,5202.2
  wf,6,7,2
  occ,1,1,1,0,1,0,0,0
  open,1.3,1.5
 }
 
 scf(i)=energy
 
 _CC_NORM_MAX=2.0
  !NOTE: Perturbative MRCC works only with UHF reference. So, here we will trick MRCC by doing zero UHF iteration right after ROHF.
 
 {uhf
 maxit,0
 }
 scf(i)=energy
 
 {mrcc,method=CCSDT(Q)
 orbital,ignore_error=1                                                          !Ignore the fact that UHF WF is not converged
 maxit,100
 core
 }
 posthf(i)=energy
 
 table,scf,posthf,ekin,pot
 save,2.csv,new
 
 

 Variables initialized (889), CPU time= 0.01 sec
 Commands  initialized (702), CPU time= 0.01 sec, 572 directives.
 Default parameters read. Elapsed time= 0.51 sec

 Checking input...
 Passed
1


                                         ***  PROGRAM SYSTEM MOLPRO  ***
                                       Copyright, TTI GmbH Stuttgart, 2015
                                    Version 2015.1 linked Sep  7 2016 23:09:38


 **********************************************************************************************************************************
 LABEL *   O                                                                             
  64 bit serial version                                                                  DATE: 30-Oct-18          TIME: 13:22:39  
 **********************************************************************************************************************************

 SHA1:             2873118e99aab1bc19f5b6fc1784693c06d15c95
 **********************************************************************************************************************************

 THRESHOLDS:

 ZERO    =  1.00D-12  ONEINT  =  1.00D-12  TWOINT  =  1.00D-12  PREFAC  =  1.00D-14  LOCALI  =  1.00D-09  EORDER  =  1.00D-04
 ENERGY  =  0.00D+00  ETEST   =  0.00D+00  EDENS   =  0.00D+00  THRDEDEF=  1.00D-06  GRADIENT=  1.00D-02  STEP    =  1.00D-03
 ORBITAL =  1.00D-05  CIVEC   =  1.00D-05  COEFF   =  1.00D-04  PRINTCI =  5.00D-02  PUNCHCI =  9.90D+01  OPTGRAD =  3.00D-04
 OPTENERG=  1.00D-06  OPTSTEP =  3.00D-04  THRGRAD =  1.00D-10  COMPRESS=  1.00D-11  VARMIN  =  1.00D-07  VARMAX  =  1.00D-03
 THRDOUB =  0.00D+00  THRDIV  =  1.00D-05  THRRED  =  1.00D-07  THRPSP  =  1.00D+00  THRDC   =  1.00D-10  THRCS   =  1.00D-10
 THRNRM  =  1.00D-08  THREQ   =  0.00D+00  THRDE   =  1.00D+00  THRREF  =  1.00D-05  SPARFAC =  1.00D+00  THRDLP  =  1.00D-07
 THRDIA  =  1.00D-10  THRDLS  =  1.00D-07  THRGPS  =  0.00D+00  THRKEX  =  0.00D+00  THRDIS  =  2.00D-01  THRVAR  =  1.00D-10
 THRLOC  =  1.00D-06  THRGAP  =  1.00D-06  THRLOCT = -1.00D+00  THRGAPT = -1.00D+00  THRORB  =  1.00D-06  THRMLTP =  0.00D+00
 THRCPQCI=  1.00D-10  KEXTA   =  0.00D+00  THRCOARS=  0.00D+00  SYMTOL  =  1.00D-06  GRADTOL =  1.00D-06  THROVL  =  1.00D-08
 THRORTH =  1.00D-08  GRID    =  1.00D-06  GRIDMAX =  1.00D-03  DTMAX   =  0.00D+00  THROCCDE=  1.00D-01  THROCCDE=  1.00D-01



 ZUNIT=ANG
 

Geometry recognized as XYZ


 Variable memory set to 8000000000 words,  buffer space   230000 words

 SETTING BASIS          =    USERDEF


 Recomputing integrals since basis changed


 Using spherical harmonics



 PROGRAM * SEWARD (Integral evaluation for generally contracted gaussian basis sets)     Author: Roland Lindh, 1990

 Geometry written to block  1 of record 700

 Orientation using atomic masses  
 Molecule type: Atom
 Symmetry elements: X,Y,Z
 Rotational constants:       0.0000000      0.0000000      0.0000000 GHz  (calculated with average atomic masses)

 Point group  D2h 



 ATOMIC COORDINATES

 NR  ATOM    CHARGE       X              Y              Z

   1  O       6.00    0.000000000    0.000000000    0.000000000


          O   CORE POTENTIAL

          p POTENTIAL

 POWERS             1              3              2
 EXPONENTIALS   12.30997       14.76962       13.71419    
 COEFFICIENTS   6.000000       73.85984      -47.87600    

          s - p POTENTIAL

 POWERS             2
 EXPONENTIALS   13.65512    
 COEFFICIENTS   85.86406    


 BASIS DATA

   Nr Sym  Nuc  Type         Exponents   Contraction coefficients

    1.1 Ag    1  1s          54.775216    -0.001244
                             25.616801     0.010733
                             11.980245     0.001889
                              6.992317    -0.174254
                              2.620277     0.001762
                              1.225429     0.316185
                              0.577797     0.451202
                              0.268022     0.312153
                              0.125346     0.051117
    2.1 Ag    1  1s           0.258551     1.000000
    3.1 Ag    1  1s           0.103420     1.000000
    4.1 Ag    1  3d0          1.232753     1.000000
    5.1 Ag    1  3d2+         1.232753     1.000000
    6.1 Ag    1  3d0          0.493101     1.000000
    7.1 Ag    1  3d2+         0.493101     1.000000
    1.2 B3u   1  2px         22.217266     0.010487
                             10.747550     0.036644
                              5.315785     0.080367
                              2.660761     0.162701
                              1.331816     0.237779
                              0.678626     0.281142
                              0.333673     0.264319
                              0.167017     0.146601
                              0.083598     0.045815
    2.2 B3u   1  2px          0.267865     1.000000
    3.2 B3u   1  2px          0.107146     1.000000
    1.3 B2u   1  2py         22.217266     0.010487
                             10.747550     0.036644
                              5.315785     0.080367
                              2.660761     0.162701
                              1.331816     0.237779
                              0.678626     0.281142
                              0.333673     0.264319
                              0.167017     0.146601
                              0.083598     0.045815
    2.3 B2u   1  2py          0.267865     1.000000
    3.3 B2u   1  2py          0.107146     1.000000
    1.4 B1g   1  3d2-         1.232753     1.000000
    2.4 B1g   1  3d2-         0.493101     1.000000
    1.5 B1u   1  2pz         22.217266     0.010487
                             10.747550     0.036644
                              5.315785     0.080367
                              2.660761     0.162701
                              1.331816     0.237779
                              0.678626     0.281142
                              0.333673     0.264319
                              0.167017     0.146601
                              0.083598     0.045815
    2.5 B1u   1  2pz          0.267865     1.000000
    3.5 B1u   1  2pz          0.107146     1.000000
    1.6 B2g   1  3d1+         1.232753     1.000000
    2.6 B2g   1  3d1+         0.493101     1.000000
    1.7 B3g   1  3d1-         1.232753     1.000000
    2.7 B3g   1  3d1-         0.493101     1.000000

 NUCLEAR CHARGE:                    6
 NUMBER OF PRIMITIVE AOS:          56
 NUMBER OF SYMMETRY AOS:           54
 NUMBER OF CONTRACTIONS:           22   (   7Ag  +   3B3u +   3B2u +   2B1g +   3B1u +   2B2g +   2B3g +   0Au  )
 NUMBER OF CORE ORBITALS:           0   (   0Ag  +   0B3u +   0B2u +   0B1g +   0B1u +   0B2g +   0B3g +   0Au  )
 NUMBER OF VALENCE ORBITALS:        4   (   1Ag  +   1B3u +   1B2u +   0B1g +   1B1u +   0B2g +   0B3g +   0Au  )


 NUCLEAR REPULSION ENERGY    0.00000000

 EXTRA SYMMETRY OF AOS IN SYMMETRY 1:   1 1 1 2 3 2 3

 Eigenvalues of metric

         1 0.290E-01 0.299E+00 0.299E+00 0.311E+00 0.170E+01 0.170E+01 0.266E+01
         2 0.114E+00 0.462E+00 0.242E+01
         3 0.114E+00 0.462E+00 0.242E+01
         4 0.299E+00 0.170E+01
         5 0.114E+00 0.462E+00 0.242E+01
         6 0.299E+00 0.170E+01
         7 0.299E+00 0.170E+01


 Contracted 2-electron integrals neglected if value below      1.0D-12
 AO integral compression algorithm  1   Integral accuracy      1.0D-12

     0.262 MB (compressed) written to integral file (100.0%)


 NUMBER OF SORTED TWO-ELECTRON INTEGRALS:       5272.     BUFFER LENGTH:  32768
 NUMBER OF SEGMENTS:   1  SEGMENT LENGTH:       5272      RECORD LENGTH: 524288

 Memory used in sort:       0.56 MW

 SORT1 READ       12220. AND WROTE        4734. INTEGRALS IN      1 RECORDS. CPU TIME:     0.00 SEC, REAL TIME:     0.01 SEC
 SORT2 READ        4734. AND WROTE        5272. INTEGRALS IN      1 RECORDS. CPU TIME:     0.01 SEC, REAL TIME:     0.02 SEC

 FILE SIZES:   FILE 1:    19.3 MBYTE,  FILE 4:     4.2 MBYTE,   TOTAL:     23.6 MBYTE

 OPERATOR DM      FOR CENTER  0  COORDINATES:    0.000000    0.000000    0.000000
 OPERATOR EKIN    FOR CENTER  0  COORDINATES:    0.000000    0.000000    0.000000
 OPERATOR POT     FOR CENTER  0  COORDINATES:    0.000000    0.000000    0.000000


 **********************************************************************************************************************************
 DATASETS  * FILE   NREC   LENGTH (MB)   RECORD NAMES
              1      20       19.12       500      610      700      900      950      970     1000      129      960     1100   
                                          VAR    BASINP    GEOM    SYMINP    ZMAT    AOBASIS   BASIS     P2S    ABASIS      S 
                                         1400     1410     1420     1200     1210     1080     1600     1650     1300     1700   
                                         EKIN       V       ECP      H0       H01     AOSYM     SMH    MOLCAS    ERIS     OPER   

 PROGRAMS   *        TOTAL       INT
 CPU TIMES  *         2.32      2.18
 REAL TIME  *        24.49 SEC
 DISK USED  *        23.83 MB      
 **********************************************************************************************************************************


 PROGRAM * RHF-SCF (OPEN SHELL)       Authors: W. Meyer, H.-J. Werner


 NUMBER OF ELECTRONS:       4+    2-    SPACE SYMMETRY=7    SPIN SYMMETRY: Triplet 
 CONVERGENCE THRESHOLDS:    1.00E-05 (Density)    1.00E-07 (Energy)
 MAX. NUMBER OF ITERATIONS:       60
 INTERPOLATION TYPE:            DIIS
 INTERPOLATION STEPS:              2 (START)      1 (STEP)
 LEVEL SHIFTS:                 -0.60 (CLOSED) -0.30 (OPEN) 


 Singly occupied orbitals:      1.3       1.5

   Atom=O  basis=ECP2MWB_GUESS     lmin=0  lmax=1

 Orbital guess generated from atomic densities. Full valence occupancy:    1   1   1   0   1   0   0   0


 Molecular orbital dump at record        4202.2

 ITERATION    DDIFF          GRAD             ENERGY        2-EL.EN.            DIPOLE MOMENTS         DIIS   ORB.
    1      0.000D+00      0.000D+00       -15.66968013     20.487989    0.00000    0.00000    0.00000    0    start
    2      0.000D+00      0.299D-01       -15.68750318     21.183309    0.00000    0.00000    0.00000    1    diag,B
    3      0.384D-01      0.585D-02       -15.68845514     21.238893    0.00000    0.00000    0.00000    2    diag,B
    4      0.741D-02      0.283D-02       -15.68873478     21.262239    0.00000    0.00000    0.00000    3    diag,B
    5      0.604D-02      0.507D-03       -15.68874329     21.262299    0.00000    0.00000    0.00000    4    diag,B
    6      0.117D-02      0.110D-03       -15.68874379     21.260646    0.00000    0.00000    0.00000    5    diag,B
    7      0.283D-03      0.183D-04       -15.68874380     21.260886    0.00000    0.00000    0.00000    6    fixocc
    8      0.365D-04      0.576D-05       -15.68874380     21.260803    0.00000    0.00000    0.00000    7    diag,B
    9      0.107D-04      0.423D-06       -15.68874380     21.260803    0.00000    0.00000    0.00000    8    diag,B
   10      0.591D-06      0.134D-06       -15.68874380     21.260805    0.00000    0.00000    0.00000    0    orth

 Final alpha occupancy:   1   1   1   0   1   0   0
 Final beta  occupancy:   1   1   0   0   0   0   0

 !RHF STATE 1.7 Energy                -15.688743799249
 Nuclear energy                         0.00000000
 One-electron energy                  -26.31914620
 Two-electron energy                   10.63040240
 Virial quotient                       -1.32257798
 !RHF STATE 1.7 Dipole moment           0.00000000     0.00000000     0.00000000
 Dipole moment /Debye                   0.00000000     0.00000000     0.00000000
 

 !RHF expec          <1.7|EKIN|1.7>    11.862244863034
 
 !RHF expec           <1.7|POT|1.7>    -6.544358028163

 ELECTRON ORBITALS
 =================


   Orb  Occ    Energy  Couls-En    Coefficients

                                   1 1s      1 1s      1 1s      1 3d0     1 3d2+    1 3d0     1 3d2+ 

   1.1   2    -1.2599   -6.0752  0.999941 -0.000061  0.000157  0.000027 -0.000046 -0.001829  0.003167

                                   1 2px     1 2px     1 2px  

   1.2   2    -0.5658   -4.6931  0.999683  0.000439 -0.000074

                                   1 2py     1 2py     1 2py  

   1.3   +    -0.7035   -4.9204  1.050012 -0.031781 -0.047659

                                   1 2pz     1 2pz     1 2pz  

   1.5   +    -0.7035   -4.9204  1.050012 -0.031781 -0.047659

 HOMO      1.2    -0.565846 =     -15.3975eV
 LUMO      2.1     0.220823 =       6.0089eV
 LUMO-HOMO         0.786669 =      21.4064eV


 **********************************************************************************************************************************
 DATASETS  * FILE   NREC   LENGTH (MB)   RECORD NAMES
              1      20       19.12       500      610      700      900      950      970     1000      129      960     1100   
                                          VAR    BASINP    GEOM    SYMINP    ZMAT    AOBASIS   BASIS     P2S    ABASIS      S 
                                         1400     1410     1420     1200     1210     1080     1600     1650     1300     1700   
                                         EKIN       V       ECP      H0       H01     AOSYM     SMH    MOLCAS    ERIS     OPER   

              2       4        2.75       700     1000      520     4202   
                                         GEOM     BASIS   MCVARS     RHF  

 PROGRAMS   *        TOTAL       RHF       INT
 CPU TIMES  *         2.38      0.06      2.18
 REAL TIME  *        24.83 SEC
 DISK USED  *        23.83 MB      
 **********************************************************************************************************************************


 PROGRAM * MULTI (Direct Multiconfiguration SCF)       Authors: P.J. Knowles, H.-J. Werner (1984)     S.T. Elbert (1988)


 Number of closed-shell orbitals:   1 (   1   0   0   0   0   0   0   0 )
 Number of active  orbitals:        3 (   0   1   1   0   1   0   0   0 )
 Number of external orbitals:      18 (   6   2   2   2   2   2   2   0 )

 State symmetry 1

 Number of electrons:     4    Spin symmetry=Triplet   Space symmetry=4
 Number of states:        1
 Number of CSFs:          1   (1 determinants, 3 intermediate states)

 State symmetry 2

 Number of electrons:     4    Spin symmetry=Triplet   Space symmetry=6
 Number of states:        1
 Number of CSFs:          1   (1 determinants, 3 intermediate states)

 State symmetry 3

 Number of electrons:     4    Spin symmetry=Triplet   Space symmetry=7
 Number of states:        1
 Number of CSFs:          1   (1 determinants, 3 intermediate states)

 Iteration controls:
             1  2  3  4  5  6  7  8  9 10 11 12 13 14 15 16 17 18 19 20 21 22 23 24 25 26 27 28 29 30 31 32 33 34 35 36 37 38 39
 DIAGCI      T  T  T  T  T  T  T  T  T  T  T  T  T  T  T  T  T  T  T  T  T  T  T  T  T  T  T  T  T  T  T  T  T  T  T  T  T  T  T
 WERNER      T  T  T  T  T  T  T  T  T  T  T  T  T  T  T  T  T  T  T  T  T  T  T  T  T  T  T  T  T  T  T  T  T  T  T  T  T  T  T
 INTERNAL    F  T  T  T  T  T  T  T  T  T  T  T  T  T  T  T  T  T  T  T  T  T  T  T  T  T  T  T  T  T  T  T  T  T  T  T  T  T  T

 Molecular orbitals read from record     4202.2  Type=RHF/CANONICAL (state 1.7)
 *** IN SYMMETRY 1 ORBITAL  1 SYMMETRY CONTAMINATION OF 0.504D-02 HAS BEEN REMOVED

 EXTRA SYMMETRY OF MOS IN SYMMETRY 1:   1 1 2 3 1 2 3

 Wavefunction dump at record             5202.2

 Convergence thresholds  0.10E-01 (gradient)  0.10E-05 (energy)  0.10E-02 (step length)

 Weight factors for state symmetry  1:    0.33333
 Weight factors for state symmetry  2:    0.33333
 Weight factors for state symmetry  3:    0.33333

 Number of orbital rotations:       12   (     0 Core/Active      6 Core/Virtual   0 Active/Active      6 Active/Virtual)
 Total number of variables:         15


 ITER. MIC  NCI  NEG     ENERGY(VAR)     ENERGY(PROJ)   ENERGY CHANGE     GRAD(0)  GRAD(ORB)   GRAD(CI)     STEP       TIME

   1   22   12    0     -15.68449633     -15.68673375   -0.00223742    0.05403651 0.00000000 0.00000000  0.47D-01      0.02
   2   15   12    0     -15.68674477     -15.68674493   -0.00000016    0.00055983 0.00000000 0.00000000  0.35D-03      0.04
   3   14   12    0     -15.68674493     -15.68674493    0.00000000    0.00000005 0.00000000 0.00000000  0.28D-07      0.05

 ** WVFN ****  CONVERGENCE REACHED, FINAL GRADIENT:  0.47D-14



 Results for state 1.4
 =====================

 !MCSCF STATE 1.4 Energy              -15.686744931762
 Nuclear energy                         0.00000000
 Kinetic energy                        11.86001287
 One electron energy                  -26.32541813
 Two electron energy                   10.63867320
 Virial ratio                           2.32265834

 !MCSCF STATE 1.4 Dipole moment         0.00000000     0.00000000     0.00000000
 Dipole moment /Debye                   0.00000000     0.00000000     0.00000000



 Results for state 1.6
 =====================

 !MCSCF STATE 1.6 Energy              -15.686744931762
 Nuclear energy                         0.00000000
 Kinetic energy                        11.86001287
 One electron energy                  -26.32541813
 Two electron energy                   10.63867320
 Virial ratio                           2.32265834

 !MCSCF STATE 1.6 Dipole moment         0.00000000     0.00000000     0.00000000
 Dipole moment /Debye                   0.00000000     0.00000000     0.00000000



 Results for state 1.7
 =====================

 !MCSCF STATE 1.7 Energy              -15.686744931762
 Nuclear energy                         0.00000000
 Kinetic energy                        11.86001287
 One electron energy                  -26.32541813
 Two electron energy                   10.63867320
 Virial ratio                           2.32265834

 !MCSCF STATE 1.7 Dipole moment         0.00000000     0.00000000     0.00000000
 Dipole moment /Debye                   0.00000000     0.00000000     0.00000000

 State-averaged charge density matrix saved on record  5202.2 (density set 1)

 !MCSCF expec        <1.4|EKIN|1.4>    11.860012873973
 !MCSCF expec        <1.6|EKIN|1.6>    11.860012873973
 !MCSCF expec        <1.7|EKIN|1.7>    11.860012873973

 !MCSCF expec         <1.4|POT|1.4>    -6.545043570910
 !MCSCF expec         <1.6|POT|1.6>    -6.545043570910
 !MCSCF expec         <1.7|POT|1.7>    -6.545043570910


 NATURAL ORBITALS (state averaged)
 =================================

   Orb     Occ        Energy       Coefficients

                                   1 1s      1 1s      1 1s      1 3d0     1 3d2+    1 3d0     1 3d2+ 

   1.1  2.00000    -1.259075     0.999710  0.000150  0.000216  0.000000  0.000000  0.000000  0.000000

                                   1 2px     1 2px     1 2px  

   1.2  1.33333    -0.369919     1.024650 -0.013756 -0.025717

                                   1 2py     1 2py     1 2py  

   1.3  1.33333    -0.369919     1.024650 -0.013756 -0.025717

                                   1 2pz     1 2pz     1 2pz  

   1.5  1.33333    -0.369919     1.024650 -0.013756 -0.025717
 

 Natural orbital dump (state averaged) at molpro section  5202.2    (Orbital set 2)


 CI vector for state symmetry 1
 ==============================

 a a 2           1.0000000

 TOTAL ENERGIES                       -15.68674493

 CI vector for state symmetry 2
 ==============================

 a 2 a           1.0000000

 TOTAL ENERGIES                       -15.68674493

 CI vector for state symmetry 3
 ==============================

 2 a a           1.0000000

 TOTAL ENERGIES                       -15.68674493



 **********************************************************************************************************************************
 DATASETS  * FILE   NREC   LENGTH (MB)   RECORD NAMES
              1      21       19.13       500      610      700      900      950      970     1000      129      960     1100   
                                          VAR    BASINP    GEOM    SYMINP    ZMAT    AOBASIS   BASIS     P2S    ABASIS      S 
                                         1400     1410     1420     1200     1210     1080     1600     1650     1300     1700   
                                         EKIN       V       ECP      H0       H01     AOSYM     SMH    MOLCAS    ERIS     OPER   
                                         1380   
                                         JKOP   

              2       5        5.24       700     1000      520     4202     5202   
                                         GEOM     BASIS   MCVARS     RHF     MCSCF   

 PROGRAMS   *        TOTAL     MULTI       RHF       INT
 CPU TIMES  *         2.45      0.07      0.06      2.18
 REAL TIME  *        25.77 SEC
 DISK USED  *        33.51 MB      
 **********************************************************************************************************************************


 PROGRAM * RHF-SCF (OPEN SHELL)       Authors: W. Meyer, H.-J. Werner


 NUMBER OF ELECTRONS:       4+    2-    SPACE SYMMETRY=7    SPIN SYMMETRY: Triplet 
 CONVERGENCE THRESHOLDS:    1.00E-05 (Density)    1.00E-07 (Energy)
 MAX. NUMBER OF ITERATIONS:        0
 INTERPOLATION TYPE:            DIIS
 INTERPOLATION STEPS:              2 (START)      1 (STEP)
 LEVEL SHIFTS:                 -0.60 (CLOSED) -0.30 (OPEN) 


 Singly occupied orbitals:      1.3       1.5
 Molecular orbitals read from record     5202.2  Type=MCSCF/NATURAL (state averaged)

 Molecular orbital dump at record        2101.2

 ITERATION    DDIFF          GRAD             ENERGY        2-EL.EN.            DIPOLE MOMENTS         DIIS   ORB.
    1      0.000D+00      0.000D+00       -15.68674493     21.277346    0.00000    0.00000    0.00000    0    start

 Final alpha occupancy:   1   1   1   0   1   0   0
 Final beta  occupancy:   1   1   0   0   0   0   0

 !RHF STATE 1.7 Energy                -15.686744931762
 Nuclear energy                         0.00000000
 One-electron energy                  -26.32541813
 Two-electron energy                   10.63867320
 Virial quotient                       -1.32265834
 !RHF STATE 1.7 Dipole moment           0.00000000     0.00000000     0.00000000
 Dipole moment /Debye                   0.00000000     0.00000000     0.00000000
 

 !RHF expec          <1.7|EKIN|1.7>    11.860012873973
 
 !RHF expec           <1.7|POT|1.7>    -6.545043570910

 ELECTRON ORBITALS
 =================


   Orb  Occ    Energy  Couls-En    Coefficients

                                   1 1s      1 1s      1 1s      1 3d0     1 3d2+    1 3d0     1 3d2+ 

   1.1   2    -1.2591   -6.0743  0.999710  0.000150  0.000216  0.000000  0.000000  0.000000  0.000000

                                   1 2px     1 2px     1 2px  

   1.2   2    -0.3699   -4.5437  1.024650 -0.013756 -0.025717

                                   1 2py     1 2py     1 2py  

   1.3   +    -0.3699   -4.5437  1.024650 -0.013756 -0.025717

                                   1 2pz     1 2pz     1 2pz  

   1.5   +    -0.3699   -4.5437  1.024650 -0.013756 -0.025717

 HOMO      1.2    -0.369919 =     -10.0660eV
 LUMO      2.1     0.232759 =       6.3337eV
 LUMO-HOMO         0.602678 =      16.3997eV


 **********************************************************************************************************************************
 DATASETS  * FILE   NREC   LENGTH (MB)   RECORD NAMES
              1      21       19.13       500      610      700      900      950      970     1000      129      960     1100   
                                          VAR    BASINP    GEOM    SYMINP    ZMAT    AOBASIS   BASIS     P2S    ABASIS      S 
                                         1400     1410     1420     1200     1210     1080     1600     1650     1300     1700   
                                         EKIN       V       ECP      H0       H01     AOSYM     SMH    MOLCAS    ERIS     OPER   
                                         1380   
                                         JKOP   

              2       6        7.74       700     1000      520     4202     5202     2101   
                                         GEOM     BASIS   MCVARS     RHF     MCSCF     RHF  

 PROGRAMS   *        TOTAL       RHF     MULTI       RHF       INT
 CPU TIMES  *         2.47      0.01      0.07      0.06      2.18
 REAL TIME  *        25.86 SEC
 DISK USED  *        33.51 MB      
 **********************************************************************************************************************************
 SETTING SCF(I)         =       -15.68674493  AU                              
 SETTING _CC_NORM_MAX   =         2.00000000                                  


 PROGRAM * UHF-SCF       Authors: W. Meyer, H.-J. Werner


 NUMBER OF ELECTRONS:       4+    2-    SPACE SYMMETRY=7    SPIN SYMMETRY: Triplet 
 CONVERGENCE THRESHOLDS:    1.00E-05 (Density)    1.00E-07 (Energy)
 MAX. NUMBER OF ITERATIONS:        0
 INTERPOLATION TYPE:            DIIS
 INTERPOLATION STEPS:              2 (START)      1 (STEP)
 LEVEL SHIFTS:                  0.20 (ALPHA)   0.20 (BETA) 



 Molecular orbitals read from record     2101.2  Type=RHF/CANONICAL (state 1.7)

 Molecular orbital dump at record        2200.2

 Initial alpha occupation   1   1   1   0   1   0   0
 Initial beta  occupation   1   1   0   0   0   0   0

 ITERATION    DDIFF          GRAD             ENERGY        2-EL.EN.            DIPOLE MOMENTS         DIIS
    1      0.000D+00      0.000D+00       -15.68674493     21.277346    0.00000    0.00000    0.00000    0
 
 Final alpha occupancy:   1   1   1   0   1   0   0
 Final beta  occupancy:   1   1   0   0   0   0   0

 !UHF STATE 1.7 Energy                -15.686744931762
 Nuclear energy                         0.00000000
 One-electron energy                  -26.32541813
 Two-electron energy                   10.63867320
 Virial quotient                       -1.32265834
 !UHF STATE 1.7 Dipole moment           0.00000000     0.00000000     0.00000000
 Dipole moment /Debye                   0.00000000     0.00000000     0.00000000
 

 !UHF expec          <1.7|EKIN|1.7>    11.860012873973
 
 !UHF expec           <1.7|POT|1.7>    -6.545043570910

 ELECTRON ORBITALS FOR POSITIVE SPIN
 ===================================


   Orb  Occ    Energy  Couls-En    Coefficients

                                   1 1s      1 1s      1 1s      1 3d0     1 3d2+    1 3d0     1 3d2+ 

   1.1   +    -1.2591   -6.0743  0.999710  0.000150  0.000216  0.000000  0.000000  0.000000  0.000000

                                   1 2px     1 2px     1 2px  

   1.2   +    -0.3699   -4.5437  1.024650 -0.013756 -0.025717

                                   1 2py     1 2py     1 2py  

   1.3   +    -0.3699   -4.5437  1.024650 -0.013756 -0.025717

                                   1 2pz     1 2pz     1 2pz  

   1.5   +    -0.3699   -4.5437  1.024650 -0.013756 -0.025717

 ELECTRON ORBITALS FOR NEGATIVE SPIN
 ===================================


   Orb  Occ    Energy  Couls-En    Coefficients

                                   1 1s      1 1s      1 1s      1 3d0     1 3d2+    1 3d0     1 3d2+ 

   1.1   -    -1.2591   -6.0743  0.999710  0.000150  0.000216  0.000000  0.000000  0.000000  0.000000

                                   1 2px     1 2px     1 2px  

   1.2   -    -0.3699   -4.5437  1.024650 -0.013756 -0.025717

 HOMO      1.2    -0.369919 =     -10.0660eV
 LUMO     -1.3    -0.369919 =     -10.0660eV
 LUMO-HOMO         0.000000 =       0.0000eV

 EXPECTATION VALUE OF S**2:             2.00000000

 Occupation number threshold for canonical orbitals:  1.999000 (occupied),  0.001000 (virtual)

 Number of pseudo-canonical orbitals per symmetry:    1   1   0   0   0   0   0
 Number of active natural orbitals per symmetry:      0   0   1   0   1   0   0

 NATURAL CHARGE ORBITALS
 =======================


   Orb     Occ        Energy       Coefficients

                                   1 1s      1 1s      1 1s      1 3d0     1 3d2+    1 3d0     1 3d2+ 

   1.1  2.00000    -1.259075     0.999710  0.000150  0.000216  0.000000  0.000000  0.000000  0.000000

                                   1 2px     1 2px     1 2px  

   1.2  2.00000    -0.369919     1.024650 -0.013756 -0.025717

                                   1 2py     1 2py     1 2py  

   1.3  1.00000    -0.268922     1.024650 -0.013756 -0.025717

                                   1 2pz     1 2pz     1 2pz  

   1.5  1.00000    -0.268922     1.024650 -0.013756 -0.025717

 Natural orbitals saved to record    2200.2 (Orbital set 3)

 Orbital spaces for UNO-CAS (Min. occupation: 0.020  Max. occupation: 1.980):

 Closed:        1   1   0   0   0   0   0
 Active:        0   0   1   0   1   0   0

 No convergence



 **********************************************************************************************************************************
 DATASETS  * FILE   NREC   LENGTH (MB)   RECORD NAMES
              1      21       19.13       500      610      700      900      950      970     1000      129      960     1100   
                                          VAR    BASINP    GEOM    SYMINP    ZMAT    AOBASIS   BASIS     P2S    ABASIS      S 
                                         1400     1410     1420     1200     1210     1080     1600     1650     1300     1700   
                                         EKIN       V       ECP      H0       H01     AOSYM     SMH    MOLCAS    ERIS     OPER   
                                         1380   
                                         JKOP   

              2       7       10.24       700     1000      520     4202     5202     2101     2200   
                                         GEOM     BASIS   MCVARS     RHF     MCSCF     RHF      UHF  

 PROGRAMS   *        TOTAL       UHF       RHF     MULTI       RHF       INT
 CPU TIMES  *         2.50      0.02      0.01      0.07      0.06      2.18
 REAL TIME  *        26.03 SEC
 DISK USED  *        33.51 MB      
 **********************************************************************************************************************************
 SETTING SCF(I)         =       -15.68674493  AU                              


 PROGRAM * MRCC (General Multireference Coupled Cluster)    Author: M. Kallay, 2000-2005

 ***  Initialisation ***

   0 Spin projections
 
 Molecular orbitals read from record     2200.2  Type=UHF/ALPHA (state 1.7)

 ?Warning: UHF not converged
 Molecular orbitals read from record     2200.2  Type=UHF/BETA (state 1.7)

 ?Warning: UHF not converged
 
 Frozen orbitals:              0 (  0  0  0  0  0  0  0  0)
 Active orbitals:             22 (  7  3  3  2  3  2  2  0)
 Active electrons:             6
 Spin quantum number:          1.0

 Transformed integrals will be written to file mrcc_44265/fort.55

 Load integrals                2.5 sec
 Transform integrals           2.5 sec
 Storage for integrals:          28961
 Remaining memory:           *********

 Core energy:               0.00000000
 
 MRCC Input:
     4     0     0     0     3     0     0     7     0     0     0     1     1     0     0     7     0     0   0.000     0   64000
  ex.lev,nsing,ntrip, rest,method,dens,conver,symm, diag, CS ,spatial, HF, ndoub,nacto,nactv, tol, maxex, sacc, freq,  dboc,   mem
  2  0  0  0  0  0  0  2  0  0  1  0  0  0  0  1  0  0  0  0  0  0
 MRCC Input end
 Variable memory released
 MRCC now being run, temporary output in /global/cscratch1/sd/aannabe/mrcc_44265/mrcc.out
 **********************************************************************
                          MRCC program system
 **********************************************************************

                              Written by
  Mihaly Kallay, Zoltan Rolik, Jozsef Csontos, Peter Nagy, Gyula Samu,
      David Mester, Jozsef Csoka, Bernat Szabo, Istvan Ladjanszki,
       Lorant Szegedy, Bence Ladoczki, Klara Petrov, Mate Farkas,
                    Pal D. Mezei, and Bence Hegely

        Department of Physical Chemistry and Materials Science
            Budapest University of Technology and Economics
                  Budapest P.O.Box 91, H-1521 Hungary

                              www.mrcc.hu

                       Release date: May 23, 2018

 ************************ 2018-10-30 13:23:07 *************************
 Executing goldstone...

 Generation of CC equations in terms of H and T...
 Generation of antisymmetrized Goldstone diagrams...
 Number of diagrams in T^1 equations:    15
 Number of diagrams in T^2 equations:    38
 Number of diagrams in T^3 equations:    49
 Number of diagrams in T^4 equations:     5
 Translation of diagrams to factorized equations...
 Optimizing intermediate calculation...
 Number of floating-point operations per iteration step:   5.3097E+07
 Probable CPU time per iteration step (hours):      0.00
 Required memory (Mbytes):      17.7
 Number of intermediates:                                  79
 Number of intermediates to be stored:                     32
 Length of intermediate file (Mbytes):       0.7

 ************************ 2018-10-30 13:23:07 *************************
 Executing xmrcc...

 **********************************************************************
 CC(3)(4) calculation


 Allocation of 100.0 Mbytes of memory...
 Number of spinorbitals:                    44
 Number of alpha electrons:                        4
 Number of beta electrons:                         2
 Spin multiplicity:                     2
 z-component of spin:  1.0
 Spatial symmetry:                      7
 Convergence criterion:  1.0E-07
 Construction of occupation graphs...
 Number of                     0 -fold excitations:                      1
 Number of                     1 -fold excitations:                     20
 Number of                     2 -fold excitations:                    540
 Number of                     3 -fold excitations:                   6704
 Total number of configurations:                   7265
 Calculation of coupling coefficients...
 Length of intermediate file (Mbytes):       0.8

 ======================================================================

 Spin case  1   Alpha:  2   Beta:  2
 Number of excitations:                  21813
 Spin case  2   Alpha:  3   Beta:  1
 Number of excitations:                  16416
 Spin case  3   Alpha:  4   Beta:  0
 Number of excitations:                    420
 Number of                     4 -fold excitations:                  38649

 Memory requirements /Mbyte/:
               Minimal        Optimal
 Real*8:         19.0827        19.0827
 Integer:         3.7368
 Total:          22.8195        22.8195


 ************************ 2018-10-30 13:23:08 *************************
 Executing mrcc...

 **********************************************************************
 CCSDT(Q) calculation


 Allocation of   19.1 Mbytes of memory...
 Number of spinorbitals:  44
 Number of alpha electrons:  4
 Number of beta  electrons:  2
 Spin multiplicity: 2
 z-component of spin:  1.0
 Spatial symmetry: 7
 Convergence criterion:  1.0E-07
 Construction of occupation graphs...
 Number of 0-fold excitations: 1
 Number of 1-fold excitations: 20
 Number of 2-fold excitations: 540
 Number of 3-fold excitations: 6704
 Total number of determinants: 7265
 Calculation of coupling coefficients...
 Initial cluster amplitudes are generated.
 Length of intermediate file (Mbytes):       0.8
 Reading integral list from unit 55...
 Sorting integrals...
 Sorting integrals...
 Sorting integrals...
 Sorting integrals...
 Energy of reference determinant [au]:     -15.686744931762
 Calculation of MP denominators...

 Starting CC iteration...
 ======================================================================
 Norm of residual vector:     0.74250913
 CPU time [min]:     0.007                   Wall time [min]:     0.007

 Iteration  1  CC energy:   -15.79746093  Energy decrease:   0.11071600
 ======================================================================
 Norm of residual vector:     0.13960817
 CPU time [min]:     0.010                   Wall time [min]:     0.010

 Iteration  2  CC energy:   -15.81303110  Energy decrease:   0.01557017
 ======================================================================
 Norm of residual vector:     0.03587107
 CPU time [min]:     0.013                   Wall time [min]:     0.013

 Iteration  3  CC energy:   -15.81702638  Energy decrease:   0.00399528
 ======================================================================
 Norm of residual vector:     0.01287444
 CPU time [min]:     0.016                   Wall time [min]:     0.016

 Iteration  4  CC energy:   -15.81773497  Energy decrease:   0.00070859
 ======================================================================
 Norm of residual vector:     0.00576487
 CPU time [min]:     0.019                   Wall time [min]:     0.019

 Iteration  5  CC energy:   -15.81763849  Energy decrease:   0.00009648
 ======================================================================
 Norm of residual vector:     0.00270243
 CPU time [min]:     0.021                   Wall time [min]:     0.022

 Iteration  6  CC energy:   -15.81764282  Energy decrease:   0.00000434
 ======================================================================
 Norm of residual vector:     0.00122572
 CPU time [min]:     0.024                   Wall time [min]:     0.025

 Iteration  7  CC energy:   -15.81769123  Energy decrease:   0.00004840
 ======================================================================
 Norm of residual vector:     0.00037414
 CPU time [min]:     0.027                   Wall time [min]:     0.028

 Iteration  8  CC energy:   -15.81769639  Energy decrease:   0.00000516
 ======================================================================
 Norm of residual vector:     0.00011968
 CPU time [min]:     0.030                   Wall time [min]:     0.031

 Iteration  9  CC energy:   -15.81769565  Energy decrease:   0.00000074
 ======================================================================
 Norm of residual vector:     0.00003308
 CPU time [min]:     0.034                   Wall time [min]:     0.034

 Iteration 10  CC energy:   -15.81769572  Energy decrease:   0.00000007
 ======================================================================
 Norm of residual vector:     0.00001080
 CPU time [min]:     0.037                   Wall time [min]:     0.037

 Iteration 11  CC energy:   -15.81769570  Energy decrease:   0.00000002
 ======================================================================
 Norm of residual vector:     0.00000354
 CPU time [min]:     0.040                   Wall time [min]:     0.040

 Iteration 12  CC energy:   -15.81769568  Energy decrease:   0.00000002
 ======================================================================
 Norm of residual vector:     0.00000109
 CPU time [min]:     0.043                   Wall time [min]:     0.043

 Iteration 13  CC energy:   -15.81769567  Energy decrease:   0.00000001
 ======================================================================
 Norm of residual vector:     0.00000034
 CPU time [min]:     0.046                   Wall time [min]:     0.047

 Iteration 14  CC energy:   -15.81769567  Energy decrease:   1.0350E-09
 ======================================================================
 Norm of residual vector:     0.00000011
 CPU time [min]:     0.049                   Wall time [min]:     0.050

 Iteration 15  CC energy:   -15.81769567  Energy decrease:   6.0299E-10
 ======================================================================
 Norm of residual vector:     0.00000004
 CPU time [min]:     0.052                   Wall time [min]:     0.053

 Iteration 16  CC energy:   -15.81769567  Energy decrease:   3.6506E-11
 ======================================================================

 Iteration has converged in 16 steps.

 Final results:
 Total CCSDT energy [au]:            -15.817695670172
 Total MP2 energy [au]:              -15.797460931450

 Perturbative corrections are calculated...
 ======================================================================
 Spin case  1   Alpha:  2   Beta:  2
 Number of excitations:        21813
 CPU time [min]:     0.091                   Wall time [min]:     0.092
 ======================================================================
 Spin case  2   Alpha:  3   Beta:  1
 Number of excitations:        16416
 CPU time [min]:     0.114                   Wall time [min]:     0.115
 ======================================================================
 Spin case  3   Alpha:  4   Beta:  0
 Number of excitations:        420
 CPU time [min]:     0.116                   Wall time [min]:     0.117
 ======================================================================
 Number of 4-fold excitations: 38649
 CPU time [min]:     0.116                   Wall time [min]:     0.117

 Total CCSDT[Q] energy [au]:         -15.817672707554
 Total CCSDT(Q) energy [au]:         -15.817724174366

 ************************ 2018-10-30 13:23:16 *************************
                      Normal termination of mrcc.
 **********************************************************************
 !CCSDT STATE 1.7 Energy              -15.817695670172
 !MP2 STATE 1.7 Energy                -15.797460931450
 !CCSDT[Q] STATE 1.7 Energy           -15.817672707554
 !CCSDT(Q) STATE 1.7 Energy           -15.817724174366
 
 CPU-time for MRCC:              7.0 sec
 Elapsed-time for MRCC:         12.7 sec

 Variable memory set to 8000000000 words,  buffer space   230000 words



 **********************************************************************************************************************************
 DATASETS  * FILE   NREC   LENGTH (MB)   RECORD NAMES
              1      21       19.13       500      610      700      900      950      970     1000      129      960     1100   
                                          VAR    BASINP    GEOM    SYMINP    ZMAT    AOBASIS   BASIS     P2S    ABASIS      S 
                                         1400     1410     1420     1200     1210     1080     1600     1650     1300     1700   
                                         EKIN       V       ECP      H0       H01     AOSYM     SMH    MOLCAS    ERIS     OPER   
                                         1380   
                                         JKOP   

              2       7       10.24       700     1000      520     4202     5202     2101     2200   
                                         GEOM     BASIS   MCVARS     RHF     MCSCF     RHF      UHF  

 PROGRAMS   *        TOTAL      MRCC       UHF       RHF     MULTI       RHF       INT
 CPU TIMES  *         9.52      7.02      0.02      0.01      0.07      0.06      2.18
 REAL TIME  *        39.41 SEC
 DISK USED  *        33.51 MB      
 **********************************************************************************************************************************
 SETTING POSTHF(I)      =       -15.81772417  AU                              
                                                                                                                                                                                                                                                                

        SCF            POSTHF        EKIN          POT
    -15.68674493   -15.81772417   11.86001287   -6.54504357
                                                  

 CCSDT(Q)/USERDEF energy=    -15.817724174366

        CCSDT(Q)        MULTI           RHF-SCF 
    -15.81772417    -15.68674493    -15.68874380
 **********************************************************************************************************************************
 Variable memory released
