
 Primary working directories    : /global/cscratch1/sd/aannabe
 Secondary working directories  : /global/cscratch1/sd/aannabe
 Wavefunction directory         : /global/homes/a/aannabe/wfu/
 Main file repository           : /global/cscratch1/sd/aannabe/

 SHA1      : 2873118e99aab1bc19f5b6fc1784693c06d15c95
 NAME      : 2015.1.8
 ARCHNAME  : linux/x86_64
 FC        : /opt/cray/pe/craype/2.5.5/bin/ftn
 BLASLIB   : -Wl,-_start-group /opt/intel/compilers_and_libraries_2016.3.210/linux/mkl/lib/intel64/libmkl_intel_ilp64.a /opt/intel/compilers_and_libraries_2016.3.210/linux/mkl/lib/intel64/libmkl_intel_thread.a /opt/intel/compilers_and_libraries_2016.3.210/linux/mkl/lib/intel64/libmkl_core.a -Wl,-_end-group
 id        : lbl

 Nodes     nprocs
 nid00478     1

 Using customized tuning parameters: mindgm=8; mindgv=16; mindgc=4; mindgr=1; noblas=0; minvec=7
 default implementation of scratch files=df  

 ***,O
 memory,8,g
 gthresh,twoint=1.e-12
 
 gprint,basis,orbitals
 gexpec,ekin,pot
 
 angstrom
 geometry={
 1                                                                               ! Number of atoms
 O 0.0 0.0 0.0
 }
 
 basis={
 Including file /global/homes/a/aannabe/docs/accurate/ccECP_Kh/pps/O.pp
 Including file /global/homes/a/aannabe/docs/accurate/ccECP_Kh/basis/aug-cc-pVnZ/O_tz.basis
 }
 
 {rhf
  start,atden
  wf,6,7,2
  occ,1,1,1,0,1,0,0,0
  open,1.3,1.5
  orbital,4202.2
 }
 {multi
  maxiter,40
  start,4202.2
  occ,1,1,1,0,1,0,0,0
  closed,1,0,0,0,0,0,0
  wf,6,4,2;state,1
  wf,6,6,2;state,1
  wf,6,7,2;state,1
  natorb,ci,print
  orbital,5202.2
 }
 {rhf,nitord=1,maxit=0
  start,5202.2
  wf,6,7,2
  occ,1,1,1,0,1,0,0,0
  open,1.3,1.5
 }
 
 scf(i)=energy
 
 _CC_NORM_MAX=2.0
  !NOTE: Perturbative MRCC works only with UHF reference. So, here we will trick MRCC by doing zero UHF iteration right after ROHF.
 
 {uhf
 maxit,0
 }
 scf(i)=energy
 
 {mrcc,method=CCSDT(Q)
 orbital,ignore_error=1                                                          !Ignore the fact that UHF WF is not converged
 maxit,100
 core
 }
 posthf(i)=energy
 
 table,scf,posthf,ekin,pot
 save,3.csv,new
 
 

 Variables initialized (889), CPU time= 0.00 sec
 Commands  initialized (702), CPU time= 0.01 sec, 572 directives.
 Default parameters read. Elapsed time= 0.26 sec

 Checking input...
 Passed
1


                                         ***  PROGRAM SYSTEM MOLPRO  ***
                                       Copyright, TTI GmbH Stuttgart, 2015
                                    Version 2015.1 linked Sep  7 2016 23:09:38


 **********************************************************************************************************************************
 LABEL *   O                                                                             
  64 bit serial version                                                                  DATE: 30-Oct-18          TIME: 13:23:28  
 **********************************************************************************************************************************

 SHA1:             2873118e99aab1bc19f5b6fc1784693c06d15c95
 **********************************************************************************************************************************

 THRESHOLDS:

 ZERO    =  1.00D-12  ONEINT  =  1.00D-12  TWOINT  =  1.00D-12  PREFAC  =  1.00D-14  LOCALI  =  1.00D-09  EORDER  =  1.00D-04
 ENERGY  =  0.00D+00  ETEST   =  0.00D+00  EDENS   =  0.00D+00  THRDEDEF=  1.00D-06  GRADIENT=  1.00D-02  STEP    =  1.00D-03
 ORBITAL =  1.00D-05  CIVEC   =  1.00D-05  COEFF   =  1.00D-04  PRINTCI =  5.00D-02  PUNCHCI =  9.90D+01  OPTGRAD =  3.00D-04
 OPTENERG=  1.00D-06  OPTSTEP =  3.00D-04  THRGRAD =  1.00D-10  COMPRESS=  1.00D-11  VARMIN  =  1.00D-07  VARMAX  =  1.00D-03
 THRDOUB =  0.00D+00  THRDIV  =  1.00D-05  THRRED  =  1.00D-07  THRPSP  =  1.00D+00  THRDC   =  1.00D-10  THRCS   =  1.00D-10
 THRNRM  =  1.00D-08  THREQ   =  0.00D+00  THRDE   =  1.00D+00  THRREF  =  1.00D-05  SPARFAC =  1.00D+00  THRDLP  =  1.00D-07
 THRDIA  =  1.00D-10  THRDLS  =  1.00D-07  THRGPS  =  0.00D+00  THRKEX  =  0.00D+00  THRDIS  =  2.00D-01  THRVAR  =  1.00D-10
 THRLOC  =  1.00D-06  THRGAP  =  1.00D-06  THRLOCT = -1.00D+00  THRGAPT = -1.00D+00  THRORB  =  1.00D-06  THRMLTP =  0.00D+00
 THRCPQCI=  1.00D-10  KEXTA   =  0.00D+00  THRCOARS=  0.00D+00  SYMTOL  =  1.00D-06  GRADTOL =  1.00D-06  THROVL  =  1.00D-08
 THRORTH =  1.00D-08  GRID    =  1.00D-06  GRIDMAX =  1.00D-03  DTMAX   =  0.00D+00  THROCCDE=  1.00D-01  THROCCDE=  1.00D-01



 ZUNIT=ANG
 

Geometry recognized as XYZ


 Variable memory set to 8000000000 words,  buffer space   230000 words

 SETTING BASIS          =    USERDEF


 Recomputing integrals since basis changed


 Using spherical harmonics



 PROGRAM * SEWARD (Integral evaluation for generally contracted gaussian basis sets)     Author: Roland Lindh, 1990

 Geometry written to block  1 of record 700

 Orientation using atomic masses  
 Molecule type: Atom
 Symmetry elements: X,Y,Z
 Rotational constants:       0.0000000      0.0000000      0.0000000 GHz  (calculated with average atomic masses)

 Point group  D2h 



 ATOMIC COORDINATES

 NR  ATOM    CHARGE       X              Y              Z

   1  O       6.00    0.000000000    0.000000000    0.000000000


          O   CORE POTENTIAL

          p POTENTIAL

 POWERS             1              3              2
 EXPONENTIALS   12.30997       14.76962       13.71419    
 COEFFICIENTS   6.000000       73.85984      -47.87600    

          s - p POTENTIAL

 POWERS             2
 EXPONENTIALS   13.65512    
 COEFFICIENTS   85.86406    


 BASIS DATA

   Nr Sym  Nuc  Type         Exponents   Contraction coefficients

    1.1 Ag    1  1s          54.775216    -0.001244
                             25.616801     0.010733
                             11.980245     0.001889
                              6.992317    -0.174254
                              2.620277     0.001762
                              1.225429     0.316185
                              0.577797     0.451202
                              0.268022     0.312153
                              0.125346     0.051117
    2.1 Ag    1  1s           1.686633     1.000000
    3.1 Ag    1  1s           0.237997     1.000000
    4.1 Ag    1  1s           0.095199     1.000000
    5.1 Ag    1  3d0          2.404278     1.000000
    6.1 Ag    1  3d2+         2.404278     1.000000
    7.1 Ag    1  3d0          0.669340     1.000000
    8.1 Ag    1  3d2+         0.669340     1.000000
    9.1 Ag    1  3d0          0.267736     1.000000
   10.1 Ag    1  3d2+         0.267736     1.000000
    1.2 B3u   1  2px         22.217266     0.010487
                             10.747550     0.036644
                              5.315785     0.080367
                              2.660761     0.162701
                              1.331816     0.237779
                              0.678626     0.281142
                              0.333673     0.264319
                              0.167017     0.146601
                              0.083598     0.045815
    2.2 B3u   1  2px          0.600621     1.000000
    3.2 B3u   1  2px          0.184696     1.000000
    4.2 B3u   1  2px          0.073878     1.000000
    5.2 B3u   1  4f1+         1.423104     1.000000
    6.2 B3u   1  4f3+         1.423104     1.000000
    7.2 B3u   1  4f1+         0.569242     1.000000
    8.2 B3u   1  4f3+         0.569242     1.000000
    1.3 B2u   1  2py         22.217266     0.010487
                             10.747550     0.036644
                              5.315785     0.080367
                              2.660761     0.162701
                              1.331816     0.237779
                              0.678626     0.281142
                              0.333673     0.264319
                              0.167017     0.146601
                              0.083598     0.045815
    2.3 B2u   1  2py          0.600621     1.000000
    3.3 B2u   1  2py          0.184696     1.000000
    4.3 B2u   1  2py          0.073878     1.000000
    5.3 B2u   1  4f1-         1.423104     1.000000
    6.3 B2u   1  4f3-         1.423104     1.000000
    7.3 B2u   1  4f1-         0.569242     1.000000
    8.3 B2u   1  4f3-         0.569242     1.000000
    1.4 B1g   1  3d2-         2.404278     1.000000
    2.4 B1g   1  3d2-         0.669340     1.000000
    3.4 B1g   1  3d2-         0.267736     1.000000
    1.5 B1u   1  2pz         22.217266     0.010487
                             10.747550     0.036644
                              5.315785     0.080367
                              2.660761     0.162701
                              1.331816     0.237779
                              0.678626     0.281142
                              0.333673     0.264319
                              0.167017     0.146601
                              0.083598     0.045815
    2.5 B1u   1  2pz          0.600621     1.000000
    3.5 B1u   1  2pz          0.184696     1.000000
    4.5 B1u   1  2pz          0.073878     1.000000
    5.5 B1u   1  4f0          1.423104     1.000000
    6.5 B1u   1  4f2+         1.423104     1.000000
    7.5 B1u   1  4f0          0.569242     1.000000
    8.5 B1u   1  4f2+         0.569242     1.000000
    1.6 B2g   1  3d1+         2.404278     1.000000
    2.6 B2g   1  3d1+         0.669340     1.000000
    3.6 B2g   1  3d1+         0.267736     1.000000
    1.7 B3g   1  3d1-         2.404278     1.000000
    2.7 B3g   1  3d1-         0.669340     1.000000
    3.7 B3g   1  3d1-         0.267736     1.000000
    1.8 Au    1  4f2-         1.423104     1.000000
    2.8 Au    1  4f2-         0.569242     1.000000

 NUCLEAR CHARGE:                    6
 NUMBER OF PRIMITIVE AOS:          86
 NUMBER OF SYMMETRY AOS:           77
 NUMBER OF CONTRACTIONS:           45   (  10Ag  +   8B3u +   8B2u +   3B1g +   8B1u +   3B2g +   3B3g +   2Au  )
 NUMBER OF CORE ORBITALS:           0   (   0Ag  +   0B3u +   0B2u +   0B1g +   0B1u +   0B2g +   0B3g +   0Au  )
 NUMBER OF VALENCE ORBITALS:        4   (   1Ag  +   1B3u +   1B2u +   0B1g +   1B1u +   0B2g +   0B3g +   0Au  )


 NUCLEAR REPULSION ENERGY    0.00000000

 EXTRA SYMMETRY OF AOS IN SYMMETRY 1:   1 1 1 1 2 3 2 3 2 3
 EXTRA SYMMETRY OF AOS IN SYMMETRY 2:   1 1 1 1 2 3 2 3
 EXTRA SYMMETRY OF AOS IN SYMMETRY 3:   1 1 1 1 2 3 2 3
 EXTRA SYMMETRY OF AOS IN SYMMETRY 5:   1 1 1 1 2 3 2 3

 Eigenvalues of metric

         1 0.211E-01 0.156E+00 0.207E+00 0.207E+00 0.767E+00 0.841E+00 0.841E+00 0.195E+01
         2 0.545E-01 0.137E+00 0.367E+00 0.367E+00 0.876E+00 0.163E+01 0.163E+01 0.293E+01
         3 0.545E-01 0.137E+00 0.367E+00 0.367E+00 0.876E+00 0.163E+01 0.163E+01 0.293E+01
         4 0.207E+00 0.841E+00 0.195E+01
         5 0.545E-01 0.137E+00 0.367E+00 0.367E+00 0.876E+00 0.163E+01 0.163E+01 0.293E+01
         6 0.207E+00 0.841E+00 0.195E+01
         7 0.207E+00 0.841E+00 0.195E+01
         8 0.367E+00 0.163E+01


 Contracted 2-electron integrals neglected if value below      1.0D-12
 AO integral compression algorithm  1   Integral accuracy      1.0D-12

     1.049 MB (compressed) written to integral file ( 98.5%)


 NUMBER OF SORTED TWO-ELECTRON INTEGRALS:      75808.     BUFFER LENGTH:  32768
 NUMBER OF SEGMENTS:   1  SEGMENT LENGTH:      75808      RECORD LENGTH: 524288

 Memory used in sort:       0.63 MW

 SORT1 READ      155797. AND WROTE       61548. INTEGRALS IN      1 RECORDS. CPU TIME:     0.01 SEC, REAL TIME:     0.02 SEC
 SORT2 READ       61548. AND WROTE       75808. INTEGRALS IN      4 RECORDS. CPU TIME:     0.03 SEC, REAL TIME:     0.03 SEC

 FILE SIZES:   FILE 1:    20.2 MBYTE,  FILE 4:     4.2 MBYTE,   TOTAL:     24.4 MBYTE

 OPERATOR DM      FOR CENTER  0  COORDINATES:    0.000000    0.000000    0.000000
 OPERATOR EKIN    FOR CENTER  0  COORDINATES:    0.000000    0.000000    0.000000
 OPERATOR POT     FOR CENTER  0  COORDINATES:    0.000000    0.000000    0.000000


 **********************************************************************************************************************************
 DATASETS  * FILE   NREC   LENGTH (MB)   RECORD NAMES
              1      20       19.61       500      610      700      900      950      970     1000      129      960     1100   
                                          VAR    BASINP    GEOM    SYMINP    ZMAT    AOBASIS   BASIS     P2S    ABASIS      S 
                                         1400     1410     1420     1200     1210     1080     1600     1650     1300     1700   
                                         EKIN       V       ECP      H0       H01     AOSYM     SMH    MOLCAS    ERIS     OPER   

 PROGRAMS   *        TOTAL       INT
 CPU TIMES  *         2.22      2.10
 REAL TIME  *        15.43 SEC
 DISK USED  *        24.67 MB      
 **********************************************************************************************************************************


 PROGRAM * RHF-SCF (OPEN SHELL)       Authors: W. Meyer, H.-J. Werner


 NUMBER OF ELECTRONS:       4+    2-    SPACE SYMMETRY=7    SPIN SYMMETRY: Triplet 
 CONVERGENCE THRESHOLDS:    1.00E-05 (Density)    1.00E-07 (Energy)
 MAX. NUMBER OF ITERATIONS:       60
 INTERPOLATION TYPE:            DIIS
 INTERPOLATION STEPS:              2 (START)      1 (STEP)
 LEVEL SHIFTS:                 -0.60 (CLOSED) -0.30 (OPEN) 


 Singly occupied orbitals:      1.3       1.5

   Atom=O  basis=ECP2MWB_GUESS     lmin=0  lmax=1

 Orbital guess generated from atomic densities. Full valence occupancy:    1   1   1   0   1   0   0   0


 Molecular orbital dump at record        4202.2

 ITERATION    DDIFF          GRAD             ENERGY        2-EL.EN.            DIPOLE MOMENTS         DIIS   ORB.
    1      0.000D+00      0.000D+00       -15.66259864     20.332181    0.00000    0.00000    0.00000    0    start
    2      0.000D+00      0.249D-01       -15.68794089     21.188481    0.00000    0.00000    0.00000    1    diag,B
    3      0.285D-01      0.593D-02       -15.68923191     21.222454    0.00000    0.00000    0.00000    2    diag,B
    4      0.384D-02      0.232D-02       -15.68961388     21.253068    0.00000    0.00000    0.00000    3    diag,B
    5      0.293D-02      0.585D-03       -15.68964342     21.258215    0.00000    0.00000    0.00000    4    diag,B
    6      0.109D-02      0.118D-03       -15.68964437     21.257286    0.00000    0.00000    0.00000    5    diag,B
    7      0.222D-03      0.238D-04       -15.68964442     21.257191    0.00000    0.00000    0.00000    6    fixocc
    8      0.462D-04      0.635D-05       -15.68964442     21.257111    0.00000    0.00000    0.00000    7    diag,B
    9      0.126D-04      0.152D-05       -15.68964442     21.257098    0.00000    0.00000    0.00000    8    diag,B
   10      0.312D-05      0.283D-06       -15.68964442     21.257096    0.00000    0.00000    0.00000    0    orth

 Final alpha occupancy:   1   1   1   0   1   0   0   0
 Final beta  occupancy:   1   1   0   0   0   0   0   0

 !RHF STATE 1.7 Energy                -15.689644422565
 Nuclear energy                         0.00000000
 One-electron energy                  -26.31819225
 Two-electron energy                   10.62854783
 Virial quotient                       -1.32380091
 !RHF STATE 1.7 Dipole moment           0.00000000     0.00000000     0.00000000
 Dipole moment /Debye                   0.00000000     0.00000000     0.00000000
 

 !RHF expec          <1.7|EKIN|1.7>    11.851966765335
 
 !RHF expec           <1.7|POT|1.7>    -6.542597343957

 ELECTRON ORBITALS
 =================


   Orb  Occ    Energy  Couls-En    Coefficients

                                   1 1s      1 1s      1 1s      1 1s      1 3d0     1 3d2+    1 3d0     1 3d2+    1 3d0     1 3d2+ 


   1.1   2    -1.2599   -6.0754  1.000091  0.000031 -0.000253  0.000158 -0.000447  0.000775 -0.000299  0.000517 -0.002009  0.003480

                                   1 2px     1 2px     1 2px     1 2px     1 4f1+    1 4f3+    1 4f1+    1 4f3+ 

   1.2   2    -0.5673   -4.6954  1.000039  0.000262 -0.000282 -0.000232  0.001809 -0.002335  0.001873 -0.002418

                                   1 2py     1 2py     1 2py     1 2py     1 4f1-    1 4f3-    1 4f1-    1 4f3- 

   1.3   +    -0.7034   -4.9189  1.045875  0.001595 -0.057172 -0.019601  0.001373 -0.005316  0.001130 -0.004377

                                   1 2pz     1 2pz     1 2pz     1 2pz     1 4f0     1 4f2+    1 4f0     1 4f2+ 

   1.5   +    -0.7034   -4.9189  1.045875  0.001595 -0.057172 -0.019601  0.003362 -0.004340  0.002768 -0.003574

 HOMO      1.2    -0.567274 =     -15.4363eV
 LUMO      2.3     0.179081 =       4.8731eV
 LUMO-HOMO         0.746355 =      20.3094eV


 **********************************************************************************************************************************
 DATASETS  * FILE   NREC   LENGTH (MB)   RECORD NAMES
              1      20       19.61       500      610      700      900      950      970     1000      129      960     1100   
                                          VAR    BASINP    GEOM    SYMINP    ZMAT    AOBASIS   BASIS     P2S    ABASIS      S 
                                         1400     1410     1420     1200     1210     1080     1600     1650     1300     1700   
                                         EKIN       V       ECP      H0       H01     AOSYM     SMH    MOLCAS    ERIS     OPER   

              2       4        2.76       700     1000      520     4202   
                                         GEOM     BASIS   MCVARS     RHF  

 PROGRAMS   *        TOTAL       RHF       INT
 CPU TIMES  *         2.26      0.03      2.10
 REAL TIME  *        15.62 SEC
 DISK USED  *        24.67 MB      
 **********************************************************************************************************************************


 PROGRAM * MULTI (Direct Multiconfiguration SCF)       Authors: P.J. Knowles, H.-J. Werner (1984)     S.T. Elbert (1988)


 Number of closed-shell orbitals:   1 (   1   0   0   0   0   0   0   0 )
 Number of active  orbitals:        3 (   0   1   1   0   1   0   0   0 )
 Number of external orbitals:      41 (   9   7   7   3   7   3   3   2 )

 State symmetry 1

 Number of electrons:     4    Spin symmetry=Triplet   Space symmetry=4
 Number of states:        1
 Number of CSFs:          1   (1 determinants, 3 intermediate states)

 State symmetry 2

 Number of electrons:     4    Spin symmetry=Triplet   Space symmetry=6
 Number of states:        1
 Number of CSFs:          1   (1 determinants, 3 intermediate states)

 State symmetry 3

 Number of electrons:     4    Spin symmetry=Triplet   Space symmetry=7
 Number of states:        1
 Number of CSFs:          1   (1 determinants, 3 intermediate states)

 Iteration controls:
             1  2  3  4  5  6  7  8  9 10 11 12 13 14 15 16 17 18 19 20 21 22 23 24 25 26 27 28 29 30 31 32 33 34 35 36 37 38 39
 DIAGCI      T  T  T  T  T  T  T  T  T  T  T  T  T  T  T  T  T  T  T  T  T  T  T  T  T  T  T  T  T  T  T  T  T  T  T  T  T  T  T
 WERNER      T  T  T  T  T  T  T  T  T  T  T  T  T  T  T  T  T  T  T  T  T  T  T  T  T  T  T  T  T  T  T  T  T  T  T  T  T  T  T
 INTERNAL    F  T  T  T  T  T  T  T  T  T  T  T  T  T  T  T  T  T  T  T  T  T  T  T  T  T  T  T  T  T  T  T  T  T  T  T  T  T  T

 Molecular orbitals read from record     4202.2  Type=RHF/CANONICAL (state 1.7)
 *** IN SYMMETRY 1 ORBITAL  1 SYMMETRY CONTAMINATION OF 0.747D-02 HAS BEEN REMOVED

 EXTRA SYMMETRY OF MOS IN SYMMETRY 1:   1 1 2 3 1 2 3 2 3 1
 *** IN SYMMETRY 2 ORBITAL  1 SYMMETRY CONTAMINATION OF 0.836D-02 HAS BEEN REMOVED
 EXTRA SYMMETRY OF MOS IN SYMMETRY 2:   1 1 1 2 3 1 2 3
 *** IN SYMMETRY 3 ORBITAL  1 SYMMETRY CONTAMINATION OF 0.107D-01 HAS BEEN REMOVED
 EXTRA SYMMETRY OF MOS IN SYMMETRY 3:   1 1 1 2 3 1 2 3
 *** IN SYMMETRY 5 ORBITAL  1 SYMMETRY CONTAMINATION OF 0.123D-01 HAS BEEN REMOVED
 EXTRA SYMMETRY OF MOS IN SYMMETRY 5:   1 1 1 2 3 1 2 3

 Wavefunction dump at record             5202.2

 Convergence thresholds  0.10E-01 (gradient)  0.10E-05 (energy)  0.10E-02 (step length)

 Weight factors for state symmetry  1:    0.33333
 Weight factors for state symmetry  2:    0.33333
 Weight factors for state symmetry  3:    0.33333

 Number of orbital rotations:       30   (     0 Core/Active      9 Core/Virtual   0 Active/Active     21 Active/Virtual)
 Total number of variables:         33


 ITER. MIC  NCI  NEG     ENERGY(VAR)     ENERGY(PROJ)   ENERGY CHANGE     GRAD(0)  GRAD(ORB)   GRAD(CI)     STEP       TIME

   1   24   12    0     -15.68454758     -15.68674493   -0.00219735    0.05304594 0.00000000 0.00000000  0.47D-01      0.03
   2   15   12    0     -15.68675499     -15.68675514   -0.00000015    0.00057248 0.00000000 0.00000000  0.33D-03      0.05
   3   15   12    0     -15.68675514     -15.68675514    0.00000000    0.00000006 0.00000000 0.00000000  0.27D-07      0.06

 ** WVFN ****  CONVERGENCE REACHED, FINAL GRADIENT:  0.56D-14



 Results for state 1.4
 =====================

 !MCSCF STATE 1.4 Energy              -15.686755138762
 Nuclear energy                         0.00000000
 Kinetic energy                        11.84968046
 One electron energy                  -26.32504459
 Two electron energy                   10.63828945
 Virial ratio                           2.32381250

 !MCSCF STATE 1.4 Dipole moment         0.00000000     0.00000000     0.00000000
 Dipole moment /Debye                   0.00000000     0.00000000     0.00000000



 Results for state 1.6
 =====================

 !MCSCF STATE 1.6 Energy              -15.686755138762
 Nuclear energy                         0.00000000
 Kinetic energy                        11.84968046
 One electron energy                  -26.32504459
 Two electron energy                   10.63828945
 Virial ratio                           2.32381250

 !MCSCF STATE 1.6 Dipole moment         0.00000000     0.00000000     0.00000000
 Dipole moment /Debye                   0.00000000     0.00000000     0.00000000



 Results for state 1.7
 =====================

 !MCSCF STATE 1.7 Energy              -15.686755138762
 Nuclear energy                         0.00000000
 Kinetic energy                        11.84968046
 One electron energy                  -26.32504459
 Two electron energy                   10.63828945
 Virial ratio                           2.32381250

 !MCSCF STATE 1.7 Dipole moment         0.00000000     0.00000000     0.00000000
 Dipole moment /Debye                   0.00000000     0.00000000     0.00000000

 State-averaged charge density matrix saved on record  5202.2 (density set 1)

 !MCSCF expec        <1.4|EKIN|1.4>    11.849680457912
 !MCSCF expec        <1.6|EKIN|1.6>    11.849680457912
 !MCSCF expec        <1.7|EKIN|1.7>    11.849680457912

 !MCSCF expec         <1.4|POT|1.4>    -6.543317790272
 !MCSCF expec         <1.6|POT|1.6>    -6.543317790272
 !MCSCF expec         <1.7|POT|1.7>    -6.543317790272


 NATURAL ORBITALS (state averaged)
 =================================

   Orb     Occ        Energy       Coefficients

                                   1 1s      1 1s      1 1s      1 1s      1 3d0     1 3d2+    1 3d0     1 3d2+    1 3d0     1 3d2+ 


   1.1  2.00000    -1.259165     0.999879 -0.000017  0.000009  0.000188  0.000000  0.000000  0.000000  0.000000  0.000000  0.000000

                                   1 2px     1 2px     1 2px     1 2px     1 4f1+    1 4f3+    1 4f1+    1 4f3+ 

   1.2  1.33333    -0.369982     1.022772  0.001332 -0.027493 -0.011527  0.000000  0.000000  0.000000  0.000000

                                   1 2py     1 2py     1 2py     1 2py     1 4f1-    1 4f3-    1 4f1-    1 4f3- 

   1.3  1.33333    -0.369982     1.022772  0.001332 -0.027493 -0.011527  0.000000  0.000000  0.000000  0.000000

                                   1 2pz     1 2pz     1 2pz     1 2pz     1 4f0     1 4f2+    1 4f0     1 4f2+ 

   1.5  1.33333    -0.369982     1.022772  0.001332 -0.027493 -0.011527  0.000000  0.000000  0.000000  0.000000
 

 EXTRA SYMMETRY OF MOS IN SYMMETRY 1:   1 1 3 2 1 2 3 3 2 1

 Natural orbital dump (state averaged) at molpro section  5202.2    (Orbital set 2)


 CI vector for state symmetry 1
 ==============================

 a a 2           1.0000000

 TOTAL ENERGIES                       -15.68675514

 CI vector for state symmetry 2
 ==============================

 a 2 a           1.0000000

 TOTAL ENERGIES                       -15.68675514

 CI vector for state symmetry 3
 ==============================

 2 a a           1.0000000

 TOTAL ENERGIES                       -15.68675514



 **********************************************************************************************************************************
 DATASETS  * FILE   NREC   LENGTH (MB)   RECORD NAMES
              1      21       19.65       500      610      700      900      950      970     1000      129      960     1100   
                                          VAR    BASINP    GEOM    SYMINP    ZMAT    AOBASIS   BASIS     P2S    ABASIS      S 
                                         1400     1410     1420     1200     1210     1080     1600     1650     1300     1700   
                                         EKIN       V       ECP      H0       H01     AOSYM     SMH    MOLCAS    ERIS     OPER   
                                         1380   
                                         JKOP   

              2       5        5.26       700     1000      520     4202     5202   
                                         GEOM     BASIS   MCVARS     RHF     MCSCF   

 PROGRAMS   *        TOTAL     MULTI       RHF       INT
 CPU TIMES  *         2.34      0.09      0.03      2.10
 REAL TIME  *        17.59 SEC
 DISK USED  *        34.13 MB      
 **********************************************************************************************************************************


 PROGRAM * RHF-SCF (OPEN SHELL)       Authors: W. Meyer, H.-J. Werner


 NUMBER OF ELECTRONS:       4+    2-    SPACE SYMMETRY=7    SPIN SYMMETRY: Triplet 
 CONVERGENCE THRESHOLDS:    1.00E-05 (Density)    1.00E-07 (Energy)
 MAX. NUMBER OF ITERATIONS:        0
 INTERPOLATION TYPE:            DIIS
 INTERPOLATION STEPS:              2 (START)      1 (STEP)
 LEVEL SHIFTS:                 -0.60 (CLOSED) -0.30 (OPEN) 


 Singly occupied orbitals:      1.3       1.5
 Molecular orbitals read from record     5202.2  Type=MCSCF/NATURAL (state averaged)

 Molecular orbital dump at record        2101.2

 ITERATION    DDIFF          GRAD             ENERGY        2-EL.EN.            DIPOLE MOMENTS         DIIS   ORB.
    1      0.000D+00      0.000D+00       -15.68675514     21.276579    0.00000    0.00000    0.00000    0    start

 Final alpha occupancy:   1   1   1   0   1   0   0   0
 Final beta  occupancy:   1   1   0   0   0   0   0   0

 !RHF STATE 1.7 Energy                -15.686755138762
 Nuclear energy                         0.00000000
 One-electron energy                  -26.32504459
 Two-electron energy                   10.63828945
 Virial quotient                       -1.32381250
 !RHF STATE 1.7 Dipole moment           0.00000000     0.00000000     0.00000000
 Dipole moment /Debye                   0.00000000     0.00000000     0.00000000
 

 !RHF expec          <1.7|EKIN|1.7>    11.849680457912
 
 !RHF expec           <1.7|POT|1.7>    -6.543317790272

 ELECTRON ORBITALS
 =================


   Orb  Occ    Energy  Couls-En    Coefficients

                                   1 1s      1 1s      1 1s      1 1s      1 3d0     1 3d2+    1 3d0     1 3d2+    1 3d0     1 3d2+ 


   1.1   2    -1.2592   -6.0745  0.999879 -0.000017  0.000009  0.000188  0.000000  0.000000  0.000000  0.000000  0.000000  0.000000

                                   1 2px     1 2px     1 2px     1 2px     1 4f1+    1 4f3+    1 4f1+    1 4f3+ 

   1.2   2    -0.3700   -4.5436  1.022772  0.001332 -0.027493 -0.011527  0.000000  0.000000  0.000000  0.000000

                                   1 2py     1 2py     1 2py     1 2py     1 4f1-    1 4f3-    1 4f1-    1 4f3- 

   1.3   +    -0.3700   -4.5436  1.022772  0.001332 -0.027493 -0.011527  0.000000  0.000000  0.000000  0.000000

                                   1 2pz     1 2pz     1 2pz     1 2pz     1 4f0     1 4f2+    1 4f0     1 4f2+ 

   1.5   +    -0.3700   -4.5436  1.022772  0.001332 -0.027493 -0.011527  0.000000  0.000000  0.000000  0.000000

 HOMO      1.2    -0.369982 =     -10.0677eV
 LUMO      2.2     0.189442 =       5.1550eV
 LUMO-HOMO         0.559424 =      15.2227eV


 **********************************************************************************************************************************
 DATASETS  * FILE   NREC   LENGTH (MB)   RECORD NAMES
              1      21       19.65       500      610      700      900      950      970     1000      129      960     1100   
                                          VAR    BASINP    GEOM    SYMINP    ZMAT    AOBASIS   BASIS     P2S    ABASIS      S 
                                         1400     1410     1420     1200     1210     1080     1600     1650     1300     1700   
                                         EKIN       V       ECP      H0       H01     AOSYM     SMH    MOLCAS    ERIS     OPER   
                                         1380   
                                         JKOP   

              2       6        7.77       700     1000      520     4202     5202     2101   
                                         GEOM     BASIS   MCVARS     RHF     MCSCF     RHF  

 PROGRAMS   *        TOTAL       RHF     MULTI       RHF       INT
 CPU TIMES  *         2.37      0.03      0.09      0.03      2.10
 REAL TIME  *        17.73 SEC
 DISK USED  *        34.13 MB      
 **********************************************************************************************************************************
 SETTING SCF(I)         =       -15.68675514  AU                              
 SETTING _CC_NORM_MAX   =         2.00000000                                  


 PROGRAM * UHF-SCF       Authors: W. Meyer, H.-J. Werner


 NUMBER OF ELECTRONS:       4+    2-    SPACE SYMMETRY=7    SPIN SYMMETRY: Triplet 
 CONVERGENCE THRESHOLDS:    1.00E-05 (Density)    1.00E-07 (Energy)
 MAX. NUMBER OF ITERATIONS:        0
 INTERPOLATION TYPE:            DIIS
 INTERPOLATION STEPS:              2 (START)      1 (STEP)
 LEVEL SHIFTS:                  0.20 (ALPHA)   0.20 (BETA) 



 Molecular orbitals read from record     2101.2  Type=RHF/CANONICAL (state 1.7)

 Molecular orbital dump at record        2200.2

 Initial alpha occupation   1   1   1   0   1   0   0   0
 Initial beta  occupation   1   1   0   0   0   0   0   0

 ITERATION    DDIFF          GRAD             ENERGY        2-EL.EN.            DIPOLE MOMENTS         DIIS
    1      0.000D+00      0.000D+00       -15.68675514     21.276579    0.00000    0.00000    0.00000    0
 
 Final alpha occupancy:   1   1   1   0   1   0   0   0
 Final beta  occupancy:   1   1   0   0   0   0   0   0

 !UHF STATE 1.7 Energy                -15.686755138762
 Nuclear energy                         0.00000000
 One-electron energy                  -26.32504459
 Two-electron energy                   10.63828945
 Virial quotient                       -1.32381250
 !UHF STATE 1.7 Dipole moment           0.00000000     0.00000000     0.00000000
 Dipole moment /Debye                   0.00000000     0.00000000     0.00000000
 

 !UHF expec          <1.7|EKIN|1.7>    11.849680457912
 
 !UHF expec           <1.7|POT|1.7>    -6.543317790272

 ELECTRON ORBITALS FOR POSITIVE SPIN
 ===================================


   Orb  Occ    Energy  Couls-En    Coefficients

                                   1 1s      1 1s      1 1s      1 1s      1 3d0     1 3d2+    1 3d0     1 3d2+    1 3d0     1 3d2+ 


   1.1   +    -1.2592   -6.0745  0.999879 -0.000017  0.000009  0.000188  0.000000  0.000000  0.000000  0.000000  0.000000  0.000000

                                   1 2px     1 2px     1 2px     1 2px     1 4f1+    1 4f3+    1 4f1+    1 4f3+ 

   1.2   +    -0.3700   -4.5436  1.022772  0.001332 -0.027493 -0.011527  0.000000  0.000000  0.000000  0.000000

                                   1 2py     1 2py     1 2py     1 2py     1 4f1-    1 4f3-    1 4f1-    1 4f3- 

   1.3   +    -0.3700   -4.5436  1.022772  0.001332 -0.027493 -0.011527  0.000000  0.000000  0.000000  0.000000

                                   1 2pz     1 2pz     1 2pz     1 2pz     1 4f0     1 4f2+    1 4f0     1 4f2+ 

   1.5   +    -0.3700   -4.5436  1.022772  0.001332 -0.027493 -0.011527  0.000000  0.000000  0.000000  0.000000

 ELECTRON ORBITALS FOR NEGATIVE SPIN
 ===================================


   Orb  Occ    Energy  Couls-En    Coefficients

                                   1 1s      1 1s      1 1s      1 1s      1 3d0     1 3d2+    1 3d0     1 3d2+    1 3d0     1 3d2+ 


   1.1   -    -1.2592   -6.0745  0.999879 -0.000017  0.000009  0.000188  0.000000  0.000000  0.000000  0.000000  0.000000  0.000000

                                   1 2px     1 2px     1 2px     1 2px     1 4f1+    1 4f3+    1 4f1+    1 4f3+ 

   1.2   -    -0.3700   -4.5436  1.022772  0.001332 -0.027493 -0.011527  0.000000  0.000000  0.000000  0.000000

 HOMO      1.2    -0.369982 =     -10.0677eV
 LUMO     -1.3    -0.369982 =     -10.0677eV
 LUMO-HOMO        -0.000000 =      -0.0000eV

 EXPECTATION VALUE OF S**2:             2.00000000

 Occupation number threshold for canonical orbitals:  1.999000 (occupied),  0.001000 (virtual)

 Number of pseudo-canonical orbitals per symmetry:    1   1   0   0   0   0   0   0
 Number of active natural orbitals per symmetry:      0   0   1   0   1   0   0   0

 NATURAL CHARGE ORBITALS
 =======================


   Orb     Occ        Energy       Coefficients

                                   1 1s      1 1s      1 1s      1 1s      1 3d0     1 3d2+    1 3d0     1 3d2+    1 3d0     1 3d2+ 


   1.1  2.00000    -1.259165     0.999879 -0.000017  0.000009  0.000188  0.000000  0.000000  0.000000  0.000000  0.000000  0.000000

                                   1 2px     1 2px     1 2px     1 2px     1 4f1+    1 4f3+    1 4f1+    1 4f3+ 

   1.2  2.00000    -0.369982     1.022772  0.001332 -0.027493 -0.011527  0.000000  0.000000  0.000000  0.000000

                                   1 2py     1 2py     1 2py     1 2py     1 4f1-    1 4f3-    1 4f1-    1 4f3- 

   1.3  1.00000    -0.269002     1.022772  0.001332 -0.027493 -0.011527  0.000000  0.000000  0.000000  0.000000

                                   1 2pz     1 2pz     1 2pz     1 2pz     1 4f0     1 4f2+    1 4f0     1 4f2+ 

   1.5  1.00000    -0.269002     1.022772  0.001332 -0.027493 -0.011527  0.000000  0.000000  0.000000  0.000000

 Natural orbitals saved to record    2200.2 (Orbital set 3)

 Orbital spaces for UNO-CAS (Min. occupation: 0.020  Max. occupation: 1.980):

 Closed:        1   1   0   0   0   0   0   0
 Active:        0   0   1   0   1   0   0   0

 No convergence



 **********************************************************************************************************************************
 DATASETS  * FILE   NREC   LENGTH (MB)   RECORD NAMES
              1      21       19.65       500      610      700      900      950      970     1000      129      960     1100   
                                          VAR    BASINP    GEOM    SYMINP    ZMAT    AOBASIS   BASIS     P2S    ABASIS      S 
                                         1400     1410     1420     1200     1210     1080     1600     1650     1300     1700   
                                         EKIN       V       ECP      H0       H01     AOSYM     SMH    MOLCAS    ERIS     OPER   
                                         1380   
                                         JKOP   

              2       7       10.28       700     1000      520     4202     5202     2101     2200   
                                         GEOM     BASIS   MCVARS     RHF     MCSCF     RHF      UHF  

 PROGRAMS   *        TOTAL       UHF       RHF     MULTI       RHF       INT
 CPU TIMES  *         2.39      0.02      0.03      0.09      0.03      2.10
 REAL TIME  *        23.10 SEC
 DISK USED  *        34.13 MB      
 **********************************************************************************************************************************
 SETTING SCF(I)         =       -15.68675514  AU                              


 PROGRAM * MRCC (General Multireference Coupled Cluster)    Author: M. Kallay, 2000-2005

 ***  Initialisation ***

   0 Spin projections
 
 Molecular orbitals read from record     2200.2  Type=UHF/ALPHA (state 1.7)

 ?Warning: UHF not converged
 Molecular orbitals read from record     2200.2  Type=UHF/BETA (state 1.7)

 ?Warning: UHF not converged
 
 Frozen orbitals:              0 (  0  0  0  0  0  0  0  0)
 Active orbitals:             45 ( 10  8  8  3  8  3  3  2)
 Active electrons:             6
 Spin quantum number:          1.0

 Transformed integrals will be written to file mrcc_44503/fort.55

 Load integrals                2.4 sec
 Transform integrals           2.5 sec
 Storage for integrals:         426551
 Remaining memory:           *********

 Core energy:               0.00000000
 
 MRCC Input:
     4     0     0     0     3     0     0     7     0     0     0     1     1     0     0     7     0     0   0.000     0   64000
  ex.lev,nsing,ntrip, rest,method,dens,conver,symm, diag, CS ,spatial, HF, ndoub,nacto,nactv, tol, maxex, sacc, freq,  dboc,   mem
  2  0  0  0  0  0  0  0  0  0  2  0  0  0  0  0  0  0  1  0  0  0  0  0  0  0  0  0  0  1  0  0  0  0  0  0  0  0  0  0  0  0  0  0  0
 MRCC Input end
 Variable memory released
 MRCC now being run, temporary output in /global/cscratch1/sd/aannabe/mrcc_44503/mrcc.out
 **********************************************************************
                          MRCC program system
 **********************************************************************

                              Written by
  Mihaly Kallay, Zoltan Rolik, Jozsef Csontos, Peter Nagy, Gyula Samu,
      David Mester, Jozsef Csoka, Bernat Szabo, Istvan Ladjanszki,
       Lorant Szegedy, Bence Ladoczki, Klara Petrov, Mate Farkas,
                    Pal D. Mezei, and Bence Hegely

        Department of Physical Chemistry and Materials Science
            Budapest University of Technology and Economics
                  Budapest P.O.Box 91, H-1521 Hungary

                              www.mrcc.hu

                       Release date: May 23, 2018

 ************************ 2018-10-30 13:24:09 *************************
 Executing goldstone...

 Generation of CC equations in terms of H and T...
 Generation of antisymmetrized Goldstone diagrams...
 Number of diagrams in T^1 equations:    15
 Number of diagrams in T^2 equations:    38
 Number of diagrams in T^3 equations:    49
 Number of diagrams in T^4 equations:     5
 Translation of diagrams to factorized equations...
 Optimizing intermediate calculation...
 Number of floating-point operations per iteration step:   2.5549E+09
 Probable CPU time per iteration step (hours):      0.03
 Required memory (Mbytes):     411.2
 Number of intermediates:                                  79
 Number of intermediates to be stored:                     32
 Length of intermediate file (Mbytes):       9.2

 ************************ 2018-10-30 13:24:10 *************************
 Executing xmrcc...

 **********************************************************************
 CC(3)(4) calculation


 Allocation of 411.2 Mbytes of memory...
 Number of spinorbitals:                    90
 Number of alpha electrons:                        4
 Number of beta electrons:                         2
 Spin multiplicity:                     2
 z-component of spin:  1.0
 Spatial symmetry:                      7
 Convergence criterion:  1.0E-07
 Construction of occupation graphs...
 Number of                     0 -fold excitations:                      1
 Number of                     1 -fold excitations:                     46
 Number of                     2 -fold excitations:                   2631
 Number of                     3 -fold excitations:                  76779
 Total number of configurations:                  79457
 Calculation of coupling coefficients...
 Length of intermediate file (Mbytes):       7.3

 ======================================================================

 Spin case  1   Alpha:  2   Beta:  2
 Number of excitations:                 555450
 Spin case  2   Alpha:  3   Beta:  1
 Number of excitations:                 458380
 Spin case  3   Alpha:  4   Beta:  0
 Number of excitations:                  12879
 Number of                     4 -fold excitations:                1026709

 Memory requirements /Mbyte/:
               Minimal        Optimal
 Real*8:         29.0294        31.3201
 Integer:         6.5179
 Total:          35.5472        37.8380


 ************************ 2018-10-30 13:24:13 *************************
 Executing mrcc...

 **********************************************************************
 CCSDT(Q) calculation


 Allocation of   31.3 Mbytes of memory...
 Number of spinorbitals:  90
 Number of alpha electrons:  4
 Number of beta  electrons:  2
 Spin multiplicity: 2
 z-component of spin:  1.0
 Spatial symmetry: 7
 Convergence criterion:  1.0E-07
 Construction of occupation graphs...
 Number of 0-fold excitations: 1
 Number of 1-fold excitations: 46
 Number of 2-fold excitations: 2631
 Number of 3-fold excitations: 76779
 Total number of determinants: 79457
 Calculation of coupling coefficients...
 Initial cluster amplitudes are generated.
 Length of intermediate file (Mbytes):       7.3
 Reading integral list from unit 55...
 Sorting integrals...
 Sorting integrals...
 Sorting integrals...
 Sorting integrals...
 Energy of reference determinant [au]:     -15.686755138762
 Calculation of MP denominators...

 Starting CC iteration...
 ======================================================================
 Norm of residual vector:     1.00584261
 CPU time [min]:     0.045                   Wall time [min]:     0.045

 Iteration  1  CC energy:   -15.84062221  Energy decrease:   0.15386707
 ======================================================================
 Norm of residual vector:     0.19690022
 CPU time [min]:     0.071                   Wall time [min]:     0.073

 Iteration  2  CC energy:   -15.85645942  Energy decrease:   0.01583722
 ======================================================================
 Norm of residual vector:     0.04335755
 CPU time [min]:     0.097                   Wall time [min]:     0.102

 Iteration  3  CC energy:   -15.86255645  Energy decrease:   0.00609702
 ======================================================================
 Norm of residual vector:     0.01439256
 CPU time [min]:     0.124                   Wall time [min]:     0.129

 Iteration  4  CC energy:   -15.86326142  Energy decrease:   0.00070498
 ======================================================================
 Norm of residual vector:     0.00664840
 CPU time [min]:     0.150                   Wall time [min]:     0.156

 Iteration  5  CC energy:   -15.86297640  Energy decrease:   0.00028503
 ======================================================================
 Norm of residual vector:     0.00313383
 CPU time [min]:     0.177                   Wall time [min]:     0.183

 Iteration  6  CC energy:   -15.86299754  Energy decrease:   0.00002114
 ======================================================================
 Norm of residual vector:     0.00152332
 CPU time [min]:     0.203                   Wall time [min]:     0.210

 Iteration  7  CC energy:   -15.86304900  Energy decrease:   0.00005146
 ======================================================================
 Norm of residual vector:     0.00063898
 CPU time [min]:     0.230                   Wall time [min]:     0.237

 Iteration  8  CC energy:   -15.86305065  Energy decrease:   0.00000165
 ======================================================================
 Norm of residual vector:     0.00022034
 CPU time [min]:     0.258                   Wall time [min]:     0.265

 Iteration  9  CC energy:   -15.86305274  Energy decrease:   0.00000210
 ======================================================================
 Norm of residual vector:     0.00007806
 CPU time [min]:     0.285                   Wall time [min]:     0.292

 Iteration 10  CC energy:   -15.86305325  Energy decrease:   0.00000051
 ======================================================================
 Norm of residual vector:     0.00002709
 CPU time [min]:     0.312                   Wall time [min]:     0.320

 Iteration 11  CC energy:   -15.86305279  Energy decrease:   0.00000046
 ======================================================================
 Norm of residual vector:     0.00000860
 CPU time [min]:     0.339                   Wall time [min]:     0.348

 Iteration 12  CC energy:   -15.86305282  Energy decrease:   0.00000003
 ======================================================================
 Norm of residual vector:     0.00000321
 CPU time [min]:     0.367                   Wall time [min]:     0.375

 Iteration 13  CC energy:   -15.86305285  Energy decrease:   0.00000002
 ======================================================================
 Norm of residual vector:     0.00000107
 CPU time [min]:     0.395                   Wall time [min]:     0.404

 Iteration 14  CC energy:   -15.86305282  Energy decrease:   0.00000003
 ======================================================================
 Norm of residual vector:     0.00000035
 CPU time [min]:     0.423                   Wall time [min]:     0.432

 Iteration 15  CC energy:   -15.86305281  Energy decrease:   0.00000001
 ======================================================================
 Norm of residual vector:     0.00000014
 CPU time [min]:     0.451                   Wall time [min]:     0.461

 Iteration 16  CC energy:   -15.86305282  Energy decrease:   2.4778E-09
 ======================================================================
 Norm of residual vector:     0.00000005
 CPU time [min]:     0.476                   Wall time [min]:     0.487

 Iteration 17  CC energy:   -15.86305282  Energy decrease:   8.8143E-12
 ======================================================================

 Iteration has converged in 17 steps.

 Final results:
 Total CCSDT energy [au]:            -15.863052816914
 Total MP2 energy [au]:              -15.840622208149

 Perturbative corrections are calculated...
 ======================================================================
 Spin case  1   Alpha:  2   Beta:  2
 Number of excitations:        555450
 CPU time [min]:     2.026                   Wall time [min]:     2.039
 ======================================================================
 Spin case  2   Alpha:  3   Beta:  1
 Number of excitations:        458380
 CPU time [min]:     3.002                   Wall time [min]:     3.024
 ======================================================================
 Spin case  3   Alpha:  4   Beta:  0
 Number of excitations:        12879
 CPU time [min]:     3.075                   Wall time [min]:     3.097
 ======================================================================
 Number of 4-fold excitations: 1026709
 CPU time [min]:     3.075                   Wall time [min]:     3.097

 Total CCSDT[Q] energy [au]:         -15.863033615142
 Total CCSDT(Q) energy [au]:         -15.863117923309

 ************************ 2018-10-30 13:27:22 *************************
                      Normal termination of mrcc.
 **********************************************************************
 !CCSDT STATE 1.7 Energy              -15.863052816914
 !MP2 STATE 1.7 Energy                -15.840622208149
 !CCSDT[Q] STATE 1.7 Energy           -15.863033615142
 !CCSDT(Q) STATE 1.7 Energy           -15.863117923309
 
 CPU-time for MRCC:            184.5 sec
 Elapsed-time for MRCC:        199.6 sec

 Variable memory set to 8000000000 words,  buffer space   230000 words



 **********************************************************************************************************************************
 DATASETS  * FILE   NREC   LENGTH (MB)   RECORD NAMES
              1      21       19.65       500      610      700      900      950      970     1000      129      960     1100   
                                          VAR    BASINP    GEOM    SYMINP    ZMAT    AOBASIS   BASIS     P2S    ABASIS      S 
                                         1400     1410     1420     1200     1210     1080     1600     1650     1300     1700   
                                         EKIN       V       ECP      H0       H01     AOSYM     SMH    MOLCAS    ERIS     OPER   
                                         1380   
                                         JKOP   

              2       7       10.28       700     1000      520     4202     5202     2101     2200   
                                         GEOM     BASIS   MCVARS     RHF     MCSCF     RHF      UHF  

 PROGRAMS   *        TOTAL      MRCC       UHF       RHF     MULTI       RHF       INT
 CPU TIMES  *       188.08    185.68      0.02      0.03      0.09      0.03      2.10
 REAL TIME  *       235.05 SEC
 DISK USED  *        34.13 MB      
 **********************************************************************************************************************************
 SETTING POSTHF(I)      =       -15.86311792  AU                              
                                                                                                                                                                                                                                                                

        SCF            POSTHF        EKIN          POT
    -15.68675514   -15.86311792   11.84968046   -6.54331779
                                                  

 CCSDT(Q)/USERDEF energy=    -15.863117923309

        CCSDT(Q)        RHF-SCF         MULTI           RHF-SCF 
    -15.86311792    -15.68675514    -15.68675514    -15.68964442
 **********************************************************************************************************************************
 Variable memory released
