
 Primary working directories    : /global/cscratch1/sd/aannabe
 Secondary working directories  : /global/cscratch1/sd/aannabe
 Wavefunction directory         : /global/homes/a/aannabe/wfu/
 Main file repository           : /global/cscratch1/sd/aannabe/

 SHA1      : 2873118e99aab1bc19f5b6fc1784693c06d15c95
 NAME      : 2015.1.8
 ARCHNAME  : linux/x86_64
 FC        : /opt/cray/pe/craype/2.5.5/bin/ftn
 BLASLIB   : -Wl,-_start-group /opt/intel/compilers_and_libraries_2016.3.210/linux/mkl/lib/intel64/libmkl_intel_ilp64.a /opt/intel/compilers_and_libraries_2016.3.210/linux/mkl/lib/intel64/libmkl_intel_thread.a /opt/intel/compilers_and_libraries_2016.3.210/linux/mkl/lib/intel64/libmkl_core.a -Wl,-_end-group
 id        : lbl

 Nodes     nprocs
 nid00478     1

 Using customized tuning parameters: mindgm=8; mindgv=16; mindgc=4; mindgr=1; noblas=0; minvec=7
 default implementation of scratch files=df  

 ***,O
 memory,8,g
 gthresh,twoint=1.e-12
 
 gprint,basis,orbitals
 gexpec,ekin,pot
 
 angstrom
 geometry={
 1                                                                               ! Number of atoms
 O 0.0 0.0 0.0
 }
 
 basis={
 Including file /global/homes/a/aannabe/docs/accurate/ccECP_Kh/pps/O.pp
 Including file /global/homes/a/aannabe/docs/accurate/ccECP_Kh/basis/aug-cc-pVnZ/O_5z.basis
 }
 
 {rhf
  start,atden
  wf,6,7,2
  occ,1,1,1,0,1,0,0,0
  open,1.3,1.5
  orbital,4202.2
 }
 {multi
  maxiter,40
  start,4202.2
  occ,1,1,1,0,1,0,0,0
  closed,1,0,0,0,0,0,0
  wf,6,4,2;state,1
  wf,6,6,2;state,1
  wf,6,7,2;state,1
  natorb,ci,print
  orbital,5202.2
 }
 {rhf,nitord=1,maxit=0
  start,5202.2
  wf,6,7,2
  occ,1,1,1,0,1,0,0,0
  open,1.3,1.5
 }
 
 scf(i)=energy
 
 _CC_NORM_MAX=2.0
  !NOTE: Perturbative MRCC works only with UHF reference. So, here we will trick MRCC by doing zero UHF iteration right after ROHF.
 
 {uhf
 maxit,0
 }
 scf(i)=energy
 
 {mrcc,method=CCSDT(Q)
 orbital,ignore_error=1                                                          !Ignore the fact that UHF WF is not converged
 maxit,100
 core
 }
 posthf(i)=energy
 
 table,scf,posthf,ekin,pot
 save,5.csv,new
 
 

 Variables initialized (889), CPU time= 0.00 sec
 Commands  initialized (702), CPU time= 0.01 sec, 572 directives.
 Default parameters read. Elapsed time= 0.16 sec

 Checking input...
 Passed
1


                                         ***  PROGRAM SYSTEM MOLPRO  ***
                                       Copyright, TTI GmbH Stuttgart, 2015
                                    Version 2015.1 linked Sep  7 2016 23:09:38


 **********************************************************************************************************************************
 LABEL *   O                                                                             
  64 bit serial version                                                                  DATE: 30-Oct-18          TIME: 14:06:17  
 **********************************************************************************************************************************

 SHA1:             2873118e99aab1bc19f5b6fc1784693c06d15c95
 **********************************************************************************************************************************

 THRESHOLDS:

 ZERO    =  1.00D-12  ONEINT  =  1.00D-12  TWOINT  =  1.00D-12  PREFAC  =  1.00D-14  LOCALI  =  1.00D-09  EORDER  =  1.00D-04
 ENERGY  =  0.00D+00  ETEST   =  0.00D+00  EDENS   =  0.00D+00  THRDEDEF=  1.00D-06  GRADIENT=  1.00D-02  STEP    =  1.00D-03
 ORBITAL =  1.00D-05  CIVEC   =  1.00D-05  COEFF   =  1.00D-04  PRINTCI =  5.00D-02  PUNCHCI =  9.90D+01  OPTGRAD =  3.00D-04
 OPTENERG=  1.00D-06  OPTSTEP =  3.00D-04  THRGRAD =  1.00D-10  COMPRESS=  1.00D-11  VARMIN  =  1.00D-07  VARMAX  =  1.00D-03
 THRDOUB =  0.00D+00  THRDIV  =  1.00D-05  THRRED  =  1.00D-07  THRPSP  =  1.00D+00  THRDC   =  1.00D-10  THRCS   =  1.00D-10
 THRNRM  =  1.00D-08  THREQ   =  0.00D+00  THRDE   =  1.00D+00  THRREF  =  1.00D-05  SPARFAC =  1.00D+00  THRDLP  =  1.00D-07
 THRDIA  =  1.00D-10  THRDLS  =  1.00D-07  THRGPS  =  0.00D+00  THRKEX  =  0.00D+00  THRDIS  =  2.00D-01  THRVAR  =  1.00D-10
 THRLOC  =  1.00D-06  THRGAP  =  1.00D-06  THRLOCT = -1.00D+00  THRGAPT = -1.00D+00  THRORB  =  1.00D-06  THRMLTP =  0.00D+00
 THRCPQCI=  1.00D-10  KEXTA   =  0.00D+00  THRCOARS=  0.00D+00  SYMTOL  =  1.00D-06  GRADTOL =  1.00D-06  THROVL  =  1.00D-08
 THRORTH =  1.00D-08  GRID    =  1.00D-06  GRIDMAX =  1.00D-03  DTMAX   =  0.00D+00  THROCCDE=  1.00D-01  THROCCDE=  1.00D-01



 ZUNIT=ANG
 

Geometry recognized as XYZ


 Variable memory set to 8000000000 words,  buffer space   230000 words

 SETTING BASIS          =    USERDEF


 Recomputing integrals since basis changed


 Using spherical harmonics



 PROGRAM * SEWARD (Integral evaluation for generally contracted gaussian basis sets)     Author: Roland Lindh, 1990

 Geometry written to block  1 of record 700

 Orientation using atomic masses  
 Molecule type: Atom
 Symmetry elements: X,Y,Z
 Rotational constants:       0.0000000      0.0000000      0.0000000 GHz  (calculated with average atomic masses)

 Point group  D2h 



 ATOMIC COORDINATES

 NR  ATOM    CHARGE       X              Y              Z

   1  O       6.00    0.000000000    0.000000000    0.000000000


          O   CORE POTENTIAL

          p POTENTIAL

 POWERS             1              3              2
 EXPONENTIALS   12.30997       14.76962       13.71419    
 COEFFICIENTS   6.000000       73.85984      -47.87600    

          s - p POTENTIAL

 POWERS             2
 EXPONENTIALS   13.65512    
 COEFFICIENTS   85.86406    


 BASIS DATA

   Nr Sym  Nuc  Type         Exponents   Contraction coefficients

    1.1 Ag    1  1s          54.775216    -0.001244
                             25.616801     0.010733
                             11.980245     0.001889
                              6.992317    -0.174254
                              2.620277     0.001762
                              1.225429     0.316185
                              0.577797     0.451202
                              0.268022     0.312153
                              0.125346     0.051117
    2.1 Ag    1  1s           1.937532     1.000000
    3.1 Ag    1  1s           0.935157     1.000000
    4.1 Ag    1  1s           0.384526     1.000000
    5.1 Ag    1  1s           0.160664     1.000000
    6.1 Ag    1  1s           0.064266     1.000000
    7.1 Ag    1  3d0          4.292433     1.000000
    8.1 Ag    1  3d2+         4.292433     1.000000
    9.1 Ag    1  3d0          2.823972     1.000000
   10.1 Ag    1  3d2+         2.823972     1.000000
   11.1 Ag    1  3d0          1.174596     1.000000
   12.1 Ag    1  3d2+         1.174596     1.000000
   13.1 Ag    1  3d0          0.401152     1.000000
   14.1 Ag    1  3d2+         0.401152     1.000000
   15.1 Ag    1  3d0          0.160461     1.000000
   16.1 Ag    1  3d2+         0.160461     1.000000
   17.1 Ag    1  5g0          3.584495     1.000000
   18.1 Ag    1  5g4+         3.584495     1.000000
   19.1 Ag    1  5g2+         3.584495     1.000000
   20.1 Ag    1  5g0          1.207657     1.000000
   21.1 Ag    1  5g4+         1.207657     1.000000
   22.1 Ag    1  5g2+         1.207657     1.000000
   23.1 Ag    1  5g0          0.483063     1.000000
   24.1 Ag    1  5g4+         0.483063     1.000000
   25.1 Ag    1  5g2+         0.483063     1.000000
    1.2 B3u   1  2px         22.217266     0.010487
                             10.747550     0.036644
                              5.315785     0.080367
                              2.660761     0.162701
                              1.331816     0.237779
                              0.678626     0.281142
                              0.333673     0.264319
                              0.167017     0.146601
                              0.083598     0.045815
    2.2 B3u   1  2px          1.589967     1.000000
    3.2 B3u   1  2px          1.178227     1.000000
    4.2 B3u   1  2px          0.372674     1.000000
    5.2 B3u   1  2px          0.130580     1.000000
    6.2 B3u   1  2px          0.052232     1.000000
    7.2 B3u   1  4f1+         3.223721     1.000000
    8.2 B3u   1  4f3+         3.223721     1.000000
    9.2 B3u   1  4f1+         2.006788     1.000000
   10.2 B3u   1  4f3+         2.006788     1.000000
   11.2 B3u   1  4f1+         0.708666     1.000000
   12.2 B3u   1  4f3+         0.708666     1.000000
   13.2 B3u   1  4f1+         0.283466     1.000000
   14.2 B3u   1  4f3+         0.283466     1.000000
   15.2 B3u   1  6h1+         2.615818     1.000000
   16.2 B3u   1  6h3+         2.615818     1.000000
   17.2 B3u   1  6h5+         2.615818     1.000000
   18.2 B3u   1  6h1+         1.046327     1.000000
   19.2 B3u   1  6h3+         1.046327     1.000000
   20.2 B3u   1  6h5+         1.046327     1.000000
    1.3 B2u   1  2py         22.217266     0.010487
                             10.747550     0.036644
                              5.315785     0.080367
                              2.660761     0.162701
                              1.331816     0.237779
                              0.678626     0.281142
                              0.333673     0.264319
                              0.167017     0.146601
                              0.083598     0.045815
    2.3 B2u   1  2py          1.589967     1.000000
    3.3 B2u   1  2py          1.178227     1.000000
    4.3 B2u   1  2py          0.372674     1.000000
    5.3 B2u   1  2py          0.130580     1.000000
    6.3 B2u   1  2py          0.052232     1.000000
    7.3 B2u   1  4f1-         3.223721     1.000000
    8.3 B2u   1  4f3-         3.223721     1.000000
    9.3 B2u   1  4f1-         2.006788     1.000000
   10.3 B2u   1  4f3-         2.006788     1.000000
   11.3 B2u   1  4f1-         0.708666     1.000000
   12.3 B2u   1  4f3-         0.708666     1.000000
   13.3 B2u   1  4f1-         0.283466     1.000000
   14.3 B2u   1  4f3-         0.283466     1.000000
   15.3 B2u   1  6h1-         2.615818     1.000000
   16.3 B2u   1  6h3-         2.615818     1.000000
   17.3 B2u   1  6h5-         2.615818     1.000000
   18.3 B2u   1  6h1-         1.046327     1.000000
   19.3 B2u   1  6h3-         1.046327     1.000000
   20.3 B2u   1  6h5-         1.046327     1.000000
    1.4 B1g   1  3d2-         4.292433     1.000000
    2.4 B1g   1  3d2-         2.823972     1.000000
    3.4 B1g   1  3d2-         1.174596     1.000000
    4.4 B1g   1  3d2-         0.401152     1.000000
    5.4 B1g   1  3d2-         0.160461     1.000000
    6.4 B1g   1  5g2-         3.584495     1.000000
    7.4 B1g   1  5g4-         3.584495     1.000000
    8.4 B1g   1  5g2-         1.207657     1.000000
    9.4 B1g   1  5g4-         1.207657     1.000000
   10.4 B1g   1  5g2-         0.483063     1.000000
   11.4 B1g   1  5g4-         0.483063     1.000000
    1.5 B1u   1  2pz         22.217266     0.010487
                             10.747550     0.036644
                              5.315785     0.080367
                              2.660761     0.162701
                              1.331816     0.237779
                              0.678626     0.281142
                              0.333673     0.264319
                              0.167017     0.146601
                              0.083598     0.045815
    2.5 B1u   1  2pz          1.589967     1.000000
    3.5 B1u   1  2pz          1.178227     1.000000
    4.5 B1u   1  2pz          0.372674     1.000000
    5.5 B1u   1  2pz          0.130580     1.000000
    6.5 B1u   1  2pz          0.052232     1.000000
    7.5 B1u   1  4f0          3.223721     1.000000
    8.5 B1u   1  4f2+         3.223721     1.000000
    9.5 B1u   1  4f0          2.006788     1.000000
   10.5 B1u   1  4f2+         2.006788     1.000000
   11.5 B1u   1  4f0          0.708666     1.000000
   12.5 B1u   1  4f2+         0.708666     1.000000
   13.5 B1u   1  4f0          0.283466     1.000000
   14.5 B1u   1  4f2+         0.283466     1.000000
   15.5 B1u   1  6h2+         2.615818     1.000000
   16.5 B1u   1  6h4+         2.615818     1.000000
   17.5 B1u   1  6h0          2.615818     1.000000
   18.5 B1u   1  6h2+         1.046327     1.000000
   19.5 B1u   1  6h4+         1.046327     1.000000
   20.5 B1u   1  6h0          1.046327     1.000000
    1.6 B2g   1  3d1+         4.292433     1.000000
    2.6 B2g   1  3d1+         2.823972     1.000000
    3.6 B2g   1  3d1+         1.174596     1.000000
    4.6 B2g   1  3d1+         0.401152     1.000000
    5.6 B2g   1  3d1+         0.160461     1.000000
    6.6 B2g   1  5g1+         3.584495     1.000000
    7.6 B2g   1  5g3+         3.584495     1.000000
    8.6 B2g   1  5g1+         1.207657     1.000000
    9.6 B2g   1  5g3+         1.207657     1.000000
   10.6 B2g   1  5g1+         0.483063     1.000000
   11.6 B2g   1  5g3+         0.483063     1.000000
    1.7 B3g   1  3d1-         4.292433     1.000000
    2.7 B3g   1  3d1-         2.823972     1.000000
    3.7 B3g   1  3d1-         1.174596     1.000000
    4.7 B3g   1  3d1-         0.401152     1.000000
    5.7 B3g   1  3d1-         0.160461     1.000000
    6.7 B3g   1  5g1-         3.584495     1.000000
    7.7 B3g   1  5g3-         3.584495     1.000000
    8.7 B3g   1  5g1-         1.207657     1.000000
    9.7 B3g   1  5g3-         1.207657     1.000000
   10.7 B3g   1  5g1-         0.483063     1.000000
   11.7 B3g   1  5g3-         0.483063     1.000000
    1.8 Au    1  4f2-         3.223721     1.000000
    2.8 Au    1  4f2-         2.006788     1.000000
    3.8 Au    1  4f2-         0.708666     1.000000
    4.8 Au    1  4f2-         0.283466     1.000000
    5.8 Au    1  6h4-         2.615818     1.000000
    6.8 Au    1  6h2-         2.615818     1.000000
    7.8 Au    1  6h4-         1.046327     1.000000
    8.8 Au    1  6h2-         1.046327     1.000000

 NUCLEAR CHARGE:                    6
 NUMBER OF PRIMITIVE AOS:         213
 NUMBER OF SYMMETRY AOS:          158
 NUMBER OF CONTRACTIONS:          126   (  25Ag  +  20B3u +  20B2u +  11B1g +  20B1u +  11B2g +  11B3g +   8Au  )
 NUMBER OF CORE ORBITALS:           0   (   0Ag  +   0B3u +   0B2u +   0B1g +   0B1u +   0B2g +   0B3g +   0Au  )
 NUMBER OF VALENCE ORBITALS:        4   (   1Ag  +   1B3u +   1B2u +   0B1g +   1B1u +   0B2g +   0B3g +   0Au  )


 NUCLEAR REPULSION ENERGY    0.00000000

 EXTRA SYMMETRY OF AOS IN SYMMETRY 1:   1 1 1 1 1 1 2 3 2 3   2 3 2 3 2 3 4 5 6 4   5 6 4 5 6
 EXTRA SYMMETRY OF AOS IN SYMMETRY 2:   1 1 1 1 1 1 2 3 2 3   2 3 2 3 4 5 6 4 5 6
 EXTRA SYMMETRY OF AOS IN SYMMETRY 3:   1 1 1 1 1 1 2 3 2 3   2 3 2 3 4 5 6 4 5 6
 EXTRA SYMMETRY OF AOS IN SYMMETRY 4:   1 1 1 1 1 2 3 2 3 2   3
 EXTRA SYMMETRY OF AOS IN SYMMETRY 5:   1 1 1 1 1 1 2 3 2 3   2 3 2 3 4 5 6 4 5 6
 EXTRA SYMMETRY OF AOS IN SYMMETRY 6:   1 1 1 1 1 2 3 2 3 2   3
 EXTRA SYMMETRY OF AOS IN SYMMETRY 7:   1 1 1 1 1 2 3 2 3 2   3
 EXTRA SYMMETRY OF AOS IN SYMMETRY 8:   1 1 1 1 2 3 2 3

 Eigenvalues of metric

         1 0.256E-02 0.845E-02 0.225E-01 0.225E-01 0.513E-01 0.148E+00 0.148E+00 0.291E+00
         2 0.418E-02 0.192E-01 0.611E-01 0.611E-01 0.841E-01 0.329E+00 0.329E+00 0.441E+00
         3 0.418E-02 0.192E-01 0.611E-01 0.611E-01 0.841E-01 0.329E+00 0.329E+00 0.441E+00
         4 0.225E-01 0.148E+00 0.309E+00 0.309E+00 0.522E+00 0.911E+00 0.911E+00 0.157E+01
         5 0.418E-02 0.192E-01 0.611E-01 0.611E-01 0.841E-01 0.329E+00 0.329E+00 0.441E+00
         6 0.225E-01 0.148E+00 0.309E+00 0.309E+00 0.522E+00 0.911E+00 0.911E+00 0.157E+01
         7 0.225E-01 0.148E+00 0.309E+00 0.309E+00 0.522E+00 0.911E+00 0.911E+00 0.157E+01
         8 0.611E-01 0.329E+00 0.483E+00 0.483E+00 0.126E+01 0.152E+01 0.152E+01 0.235E+01


 Contracted 2-electron integrals neglected if value below      1.0D-12
 AO integral compression algorithm  1   Integral accuracy      1.0D-12

     31.982 MB (compressed) written to integral file ( 57.5%)


 NUMBER OF SORTED TWO-ELECTRON INTEGRALS:    4156552.     BUFFER LENGTH:  32768
 NUMBER OF SEGMENTS:   1  SEGMENT LENGTH:    4156552      RECORD LENGTH: 524288

 Memory used in sort:       4.71 MW

 SORT1 READ     6989366. AND WROTE     2907704. INTEGRALS IN      9 RECORDS. CPU TIME:     0.24 SEC, REAL TIME:     0.33 SEC
 SORT2 READ     2907704. AND WROTE     4156552. INTEGRALS IN    122 RECORDS. CPU TIME:     0.27 SEC, REAL TIME:     0.43 SEC

 FILE SIZES:   FILE 1:    51.4 MBYTE,  FILE 4:    37.8 MBYTE,   TOTAL:     89.2 MBYTE

 OPERATOR DM      FOR CENTER  0  COORDINATES:    0.000000    0.000000    0.000000
 OPERATOR EKIN    FOR CENTER  0  COORDINATES:    0.000000    0.000000    0.000000
 OPERATOR POT     FOR CENTER  0  COORDINATES:    0.000000    0.000000    0.000000


 **********************************************************************************************************************************
 DATASETS  * FILE   NREC   LENGTH (MB)   RECORD NAMES
              1      20       38.64       500      610      700      900      950      970     1000      129      960     1100   
                                          VAR    BASINP    GEOM    SYMINP    ZMAT    AOBASIS   BASIS     P2S    ABASIS      S 
                                         1400     1410     1420     1200     1210     1080     1600     1650     1300     1700   
                                         EKIN       V       ECP      H0       H01     AOSYM     SMH    MOLCAS    ERIS     OPER   

 PROGRAMS   *        TOTAL       INT
 CPU TIMES  *         4.15      4.02
 REAL TIME  *        17.17 SEC
 DISK USED  *        89.53 MB      
 **********************************************************************************************************************************


 PROGRAM * RHF-SCF (OPEN SHELL)       Authors: W. Meyer, H.-J. Werner


 NUMBER OF ELECTRONS:       4+    2-    SPACE SYMMETRY=7    SPIN SYMMETRY: Triplet 
 CONVERGENCE THRESHOLDS:    1.00E-05 (Density)    1.00E-07 (Energy)
 MAX. NUMBER OF ITERATIONS:       60
 INTERPOLATION TYPE:            DIIS
 INTERPOLATION STEPS:              2 (START)      1 (STEP)
 LEVEL SHIFTS:                 -0.60 (CLOSED) -0.30 (OPEN) 


 Singly occupied orbitals:      1.3       1.5

   Atom=O  basis=ECP2MWB_GUESS     lmin=0  lmax=1

 Orbital guess generated from atomic densities. Full valence occupancy:    1   1   1   0   1   0   0   0


 Molecular orbital dump at record        4202.2

 ITERATION    DDIFF          GRAD             ENERGY        2-EL.EN.            DIPOLE MOMENTS         DIIS   ORB.
    1      0.000D+00      0.000D+00       -15.66342153     20.348326    0.00000    0.00000    0.00000    0    start
    2      0.000D+00      0.155D-01       -15.68807375     21.190759    0.00000    0.00000    0.00000    1    diag,B
    3      0.107D-01      0.369D-02       -15.68935751     21.223065    0.00000    0.00000    0.00000    2    diag,B
    4      0.187D-02      0.143D-02       -15.68974221     21.253904    0.00000    0.00000    0.00000    3    diag,B
    5      0.112D-02      0.364D-03       -15.68977291     21.259071    0.00000    0.00000    0.00000    4    diag,B
    6      0.379D-03      0.716D-04       -15.68977394     21.258166    0.00000    0.00000    0.00000    5    diag,B
    7      0.983D-04      0.174D-04       -15.68977400     21.257974    0.00000    0.00000    0.00000    6    fixocc
    8      0.278D-04      0.384D-05       -15.68977400     21.257924    0.00000    0.00000    0.00000    7    diag,B
    9      0.568D-05      0.970D-06       -15.68977400     21.257922    0.00000    0.00000    0.00000    0    orth

 Final alpha occupancy:   1   1   1   0   1   0   0   0
 Final beta  occupancy:   1   1   0   0   0   0   0   0

 !RHF STATE 1.7 Energy                -15.689774004830
 Nuclear energy                         0.00000000
 One-electron energy                  -26.31873480
 Two-electron energy                   10.62896080
 Virial quotient                       -1.32451306
 !RHF STATE 1.7 Dipole moment           0.00000000     0.00000000     0.00000000
 Dipole moment /Debye                   0.00000000     0.00000000     0.00000000
 

 !RHF expec          <1.7|EKIN|1.7>    11.845692219453
 
 !RHF expec           <1.7|POT|1.7>    -6.541724806681

 ELECTRON ORBITALS
 =================


   Orb  Occ    Energy  Couls-En    Coefficients

                                   1 1s      1 1s      1 1s      1 1s      1 1s      1 1s      1 3d0     1 3d2+    1 3d0     1 3d2+ 
                                   1 3d0     1 3d2+    1 3d0     1 3d2+    1 3d0     1 3d2+    1 5g0     1 5g4+    1 5g2+    1 5g0  
                                   1 5g4+    1 5g2+    1 5g0     1 5g4+    1 5g2+ 

   1.1   2    -1.2598   -6.0752  1.000710  0.000861 -0.002340  0.002522 -0.002999  0.001460 -0.000538  0.000931  0.000243 -0.000421
                                -0.000301  0.000521 -0.001367  0.002368 -0.001007  0.001745 -0.000000 -0.000001  0.000000 -0.000001
                                -0.000002  0.000001 -0.000009 -0.000018  0.000013

                                   1 2px     1 2px     1 2px     1 2px     1 2px     1 2px     1 4f1+    1 4f3+    1 4f1+    1 4f3+ 
                                   1 4f1+    1 4f3+    1 4f1+    1 4f3+    1 6h1+    1 6h3+    1 6h5+    1 6h1+    1 6h3+    1 6h5+ 


   1.2   2    -0.5672   -4.6953  0.999922  0.000181 -0.000084  0.000355 -0.000653  0.000194  0.000380 -0.000490  0.000899 -0.001161
                                 0.002077 -0.002681  0.001023 -0.001321  0.000003 -0.000003  0.000004  0.000009 -0.000010  0.000014

                                   1 2py     1 2py     1 2py     1 2py     1 2py     1 2py     1 4f1-    1 4f3-    1 4f1-    1 4f3- 
                                   1 4f1-    1 4f3-    1 4f1-    1 4f3-    1 6h1-    1 6h3-    1 6h5-    1 6h1-    1 6h3-    1 6h5- 


   1.3   +    -0.7034   -4.9193  1.036801 -0.000346  0.011661 -0.016623 -0.053383 -0.005470  0.000293 -0.001137  0.000672 -0.002604
                                 0.001441 -0.005582  0.000497 -0.001926  0.000003 -0.000009  0.000021  0.000007 -0.000024  0.000053

                                   1 2pz     1 2pz     1 2pz     1 2pz     1 2pz     1 2pz     1 4f0     1 4f2+    1 4f0     1 4f2+ 
                                   1 4f0     1 4f2+    1 4f0     1 4f2+    1 6h2+    1 6h4+    1 6h0     1 6h2+    1 6h4+    1 6h0  


   1.5   +    -0.7034   -4.9193  1.036801 -0.000346  0.011661 -0.016623 -0.053383 -0.005470  0.000719 -0.000928  0.001647 -0.002126
                                 0.003531 -0.004558  0.001218 -0.001573 -0.000015  0.000013  0.000011 -0.000039  0.000034  0.000029

 HOMO      1.2    -0.567248 =     -15.4356eV
 LUMO      2.1     0.111316 =       3.0291eV
 LUMO-HOMO         0.678564 =      18.4647eV


 **********************************************************************************************************************************
 DATASETS  * FILE   NREC   LENGTH (MB)   RECORD NAMES
              1      20       38.64       500      610      700      900      950      970     1000      129      960     1100   
                                          VAR    BASINP    GEOM    SYMINP    ZMAT    AOBASIS   BASIS     P2S    ABASIS      S 
                                         1400     1410     1420     1200     1210     1080     1600     1650     1300     1700   
                                         EKIN       V       ECP      H0       H01     AOSYM     SMH    MOLCAS    ERIS     OPER   

              2       4        2.83       700     1000      520     4202   
                                         GEOM     BASIS   MCVARS     RHF  

 PROGRAMS   *        TOTAL       RHF       INT
 CPU TIMES  *         4.39      0.24      4.02
 REAL TIME  *        17.54 SEC
 DISK USED  *        89.53 MB      
 **********************************************************************************************************************************


 PROGRAM * MULTI (Direct Multiconfiguration SCF)       Authors: P.J. Knowles, H.-J. Werner (1984)     S.T. Elbert (1988)


 Number of closed-shell orbitals:   1 (   1   0   0   0   0   0   0   0 )
 Number of active  orbitals:        3 (   0   1   1   0   1   0   0   0 )
 Number of external orbitals:     122 (  24  19  19  11  19  11  11   8 )

 State symmetry 1

 Number of electrons:     4    Spin symmetry=Triplet   Space symmetry=4
 Number of states:        1
 Number of CSFs:          1   (1 determinants, 3 intermediate states)

 State symmetry 2

 Number of electrons:     4    Spin symmetry=Triplet   Space symmetry=6
 Number of states:        1
 Number of CSFs:          1   (1 determinants, 3 intermediate states)

 State symmetry 3

 Number of electrons:     4    Spin symmetry=Triplet   Space symmetry=7
 Number of states:        1
 Number of CSFs:          1   (1 determinants, 3 intermediate states)

 Iteration controls:
             1  2  3  4  5  6  7  8  9 10 11 12 13 14 15 16 17 18 19 20 21 22 23 24 25 26 27 28 29 30 31 32 33 34 35 36 37 38 39
 DIAGCI      T  T  T  T  T  T  T  T  T  T  T  T  T  T  T  T  T  T  T  T  T  T  T  T  T  T  T  T  T  T  T  T  T  T  T  T  T  T  T
 WERNER      T  T  T  T  T  T  T  T  T  T  T  T  T  T  T  T  T  T  T  T  T  T  T  T  T  T  T  T  T  T  T  T  T  T  T  T  T  T  T
 INTERNAL    F  T  T  T  T  T  T  T  T  T  T  T  T  T  T  T  T  T  T  T  T  T  T  T  T  T  T  T  T  T  T  T  T  T  T  T  T  T  T

 Molecular orbitals read from record     4202.2  Type=RHF/CANONICAL (state 1.7)
 *** IN SYMMETRY 1 ORBITAL  1 SYMMETRY CONTAMINATION OF 0.930D-02 HAS BEEN REMOVED

 EXTRA SYMMETRY OF MOS IN SYMMETRY 1:   1 1 2 3 1 2 3 1 4 5   6 2 3 4 5 6 1 2 3 4   5 6 2 3 1
 *** IN SYMMETRY 2 ORBITAL  1 SYMMETRY CONTAMINATION OF 0.996D-02 HAS BEEN REMOVED
 EXTRA SYMMETRY OF MOS IN SYMMETRY 2:   1 1 1 2 3 1 2 3 1 5   6 4 2 3 1 5 6 4 2 3
 *** IN SYMMETRY 3 ORBITAL  1 SYMMETRY CONTAMINATION OF 0.125D-01 HAS BEEN REMOVED
 EXTRA SYMMETRY OF MOS IN SYMMETRY 3:   1 1 1 2 3 1 2 3 1 4   5 6 2 3 1 4 5 6 2 3
 EXTRA SYMMETRY OF MOS IN SYMMETRY 4:   1 1 2 3 1 2 3 1 2 3   1
 *** IN SYMMETRY 5 ORBITAL  1 SYMMETRY CONTAMINATION OF 0.144D-01 HAS BEEN REMOVED
 EXTRA SYMMETRY OF MOS IN SYMMETRY 5:   1 1 1 2 3 1 2 3 1 6   5 4 2 3 1 6 5 4 2 3
 EXTRA SYMMETRY OF MOS IN SYMMETRY 6:   1 1 3 2 1 3 2 1 3 2   1
 EXTRA SYMMETRY OF MOS IN SYMMETRY 7:   1 1 2 3 1 2 3 1 2 3   1
 EXTRA SYMMETRY OF MOS IN SYMMETRY 8:   1 1 3 2 1 3 2 1

 Wavefunction dump at record             5202.2

 Convergence thresholds  0.10E-01 (gradient)  0.10E-05 (energy)  0.10E-02 (step length)

 Weight factors for state symmetry  1:    0.33333
 Weight factors for state symmetry  2:    0.33333
 Weight factors for state symmetry  3:    0.33333

 Number of orbital rotations:       81   (     0 Core/Active     24 Core/Virtual   0 Active/Active     57 Active/Virtual)
 Total number of variables:         84


 ITER. MIC  NCI  NEG     ENERGY(VAR)     ENERGY(PROJ)   ENERGY CHANGE     GRAD(0)  GRAD(ORB)   GRAD(CI)     STEP       TIME

   1   23   12    0     -15.68453158     -15.68677101   -0.00223943    0.05758121 0.00000000 0.00000000  0.47D-01      0.05
   2   15   12    0     -15.68678131     -15.68678146   -0.00000015    0.00058209 0.00000000 0.00000000  0.34D-03      0.09
   3   15   12    0     -15.68678146     -15.68678146   -0.00000000    0.00000006 0.00000000 0.00000000  0.28D-07      0.12

 ** WVFN ****  CONVERGENCE REACHED, FINAL GRADIENT:  0.36D-13



 Results for state 1.4
 =====================

 !MCSCF STATE 1.4 Energy              -15.686781462945
 Nuclear energy                         0.00000000
 Kinetic energy                        11.84347378
 One electron energy                  -26.32540705
 Two electron energy                   10.63862559
 Virial ratio                           2.32450848

 !MCSCF STATE 1.4 Dipole moment         0.00000000     0.00000000     0.00000000
 Dipole moment /Debye                   0.00000000     0.00000000     0.00000000



 Results for state 1.6
 =====================

 !MCSCF STATE 1.6 Energy              -15.686781462945
 Nuclear energy                         0.00000000
 Kinetic energy                        11.84347378
 One electron energy                  -26.32540705
 Two electron energy                   10.63862559
 Virial ratio                           2.32450848

 !MCSCF STATE 1.6 Dipole moment         0.00000000     0.00000000     0.00000000
 Dipole moment /Debye                   0.00000000     0.00000000     0.00000000



 Results for state 1.7
 =====================

 !MCSCF STATE 1.7 Energy              -15.686781462945
 Nuclear energy                         0.00000000
 Kinetic energy                        11.84347378
 One electron energy                  -26.32540705
 Two electron energy                   10.63862559
 Virial ratio                           2.32450848

 !MCSCF STATE 1.7 Dipole moment         0.00000000     0.00000000     0.00000000
 Dipole moment /Debye                   0.00000000     0.00000000     0.00000000

 State-averaged charge density matrix saved on record  5202.2 (density set 1)

 !MCSCF expec        <1.4|EKIN|1.4>    11.843473776734
 !MCSCF expec        <1.6|EKIN|1.6>    11.843473776734
 !MCSCF expec        <1.7|EKIN|1.7>    11.843473776734

 !MCSCF expec         <1.4|POT|1.4>    -6.542428070573
 !MCSCF expec         <1.6|POT|1.6>    -6.542428070573
 !MCSCF expec         <1.7|POT|1.7>    -6.542428070573


 NATURAL ORBITALS (state averaged)
 =================================

   Orb     Occ        Energy       Coefficients

                                   1 1s      1 1s      1 1s      1 1s      1 1s      1 1s      1 3d0     1 3d2+    1 3d0     1 3d2+ 
                                   1 3d0     1 3d2+    1 3d0     1 3d2+    1 3d0     1 3d2+    1 5g0     1 5g4+    1 5g2+    1 5g0  
                                   1 5g4+    1 5g2+    1 5g0     1 5g4+    1 5g2+ 

   1.1  2.00000    -1.259103     1.000611  0.000904 -0.002520  0.002624 -0.002782  0.001404  0.000000  0.000000  0.000000  0.000000
                                 0.000000  0.000000  0.000000  0.000000  0.000000  0.000000  0.000000  0.000000  0.000000  0.000000
                                 0.000000  0.000000  0.000000  0.000000  0.000000

                                   1 2px     1 2px     1 2px     1 2px     1 2px     1 2px     1 4f1+    1 4f3+    1 4f1+    1 4f3+ 
                                   1 4f1+    1 4f3+    1 4f1+    1 4f3+    1 6h1+    1 6h3+    1 6h5+    1 6h1+    1 6h3+    1 6h5+ 


   1.2  1.33333    -0.369914     1.018533 -0.000089  0.005409 -0.006937 -0.027324 -0.003569  0.000000  0.000000  0.000000  0.000000
                                 0.000000  0.000000  0.000000  0.000000  0.000000  0.000000  0.000000  0.000000  0.000000  0.000000

                                   1 2py     1 2py     1 2py     1 2py     1 2py     1 2py     1 4f1-    1 4f3-    1 4f1-    1 4f3- 
                                   1 4f1-    1 4f3-    1 4f1-    1 4f3-    1 6h1-    1 6h3-    1 6h5-    1 6h1-    1 6h3-    1 6h5- 


   1.3  1.33333    -0.369914     1.018533 -0.000089  0.005409 -0.006937 -0.027324 -0.003569  0.000000  0.000000  0.000000  0.000000
                                 0.000000  0.000000  0.000000  0.000000  0.000000  0.000000  0.000000  0.000000  0.000000  0.000000

                                   1 2pz     1 2pz     1 2pz     1 2pz     1 2pz     1 2pz     1 4f0     1 4f2+    1 4f0     1 4f2+ 
                                   1 4f0     1 4f2+    1 4f0     1 4f2+    1 6h2+    1 6h4+    1 6h0     1 6h2+    1 6h4+    1 6h0  


   1.5  1.33333    -0.369914     1.018533 -0.000089  0.005409 -0.006937 -0.027324 -0.003569  0.000000  0.000000  0.000000  0.000000
                                 0.000000  0.000000  0.000000  0.000000  0.000000  0.000000  0.000000  0.000000  0.000000  0.000000
 

 EXTRA SYMMETRY OF MOS IN SYMMETRY 1:   1 1 2 3 1 2 3 1 6 4   5 2 3 5 6 4 1 3 2 4   5 6 2 3 1
 EXTRA SYMMETRY OF MOS IN SYMMETRY 2:   1 1 1 3 2 1 2 3 1 5   4 6 2 3 1 5 4 6 2 3
 EXTRA SYMMETRY OF MOS IN SYMMETRY 3:   1 1 1 3 2 1 2 3 1 5   4 6 2 3 1 5 4 6 2 3
 EXTRA SYMMETRY OF MOS IN SYMMETRY 4:   1 1 2 3 1 3 2 1 3 2   1
 EXTRA SYMMETRY OF MOS IN SYMMETRY 5:   1 1 1 3 2 1 2 3 1 6   4 5 2 3 1 6 4 5 3 2
 EXTRA SYMMETRY OF MOS IN SYMMETRY 7:   1 1 3 2 1 3 2 1 3 2   1

 Natural orbital dump (state averaged) at molpro section  5202.2    (Orbital set 2)


 CI vector for state symmetry 1
 ==============================

 a a 2           1.0000000

 TOTAL ENERGIES                       -15.68678146

 CI vector for state symmetry 2
 ==============================

 a 2 a           1.0000000

 TOTAL ENERGIES                       -15.68678146

 CI vector for state symmetry 3
 ==============================

 2 a a           1.0000000

 TOTAL ENERGIES                       -15.68678146



 **********************************************************************************************************************************
 DATASETS  * FILE   NREC   LENGTH (MB)   RECORD NAMES
              1      21       38.94       500      610      700      900      950      970     1000      129      960     1100   
                                          VAR    BASINP    GEOM    SYMINP    ZMAT    AOBASIS   BASIS     P2S    ABASIS      S 
                                         1400     1410     1420     1200     1210     1080     1600     1650     1300     1700   
                                         EKIN       V       ECP      H0       H01     AOSYM     SMH    MOLCAS    ERIS     OPER   
                                         1380   
                                         JKOP   

              2       5        5.40       700     1000      520     4202     5202   
                                         GEOM     BASIS   MCVARS     RHF     MCSCF   

 PROGRAMS   *        TOTAL     MULTI       RHF       INT
 CPU TIMES  *         4.58      0.19      0.24      4.02
 REAL TIME  *        18.65 SEC
 DISK USED  *        89.53 MB      
 **********************************************************************************************************************************


 PROGRAM * RHF-SCF (OPEN SHELL)       Authors: W. Meyer, H.-J. Werner


 NUMBER OF ELECTRONS:       4+    2-    SPACE SYMMETRY=7    SPIN SYMMETRY: Triplet 
 CONVERGENCE THRESHOLDS:    1.00E-05 (Density)    1.00E-07 (Energy)
 MAX. NUMBER OF ITERATIONS:        0
 INTERPOLATION TYPE:            DIIS
 INTERPOLATION STEPS:              2 (START)      1 (STEP)
 LEVEL SHIFTS:                 -0.60 (CLOSED) -0.30 (OPEN) 


 Singly occupied orbitals:      1.3       1.5
 Molecular orbitals read from record     5202.2  Type=MCSCF/NATURAL (state averaged)

 Molecular orbital dump at record        2101.2

 ITERATION    DDIFF          GRAD             ENERGY        2-EL.EN.            DIPOLE MOMENTS         DIIS   ORB.
    1      0.000D+00      0.000D+00       -15.68678146     21.277251    0.00000    0.00000    0.00000    0    start

 Final alpha occupancy:   1   1   1   0   1   0   0   0
 Final beta  occupancy:   1   1   0   0   0   0   0   0

 !RHF STATE 1.7 Energy                -15.686781462945
 Nuclear energy                         0.00000000
 One-electron energy                  -26.32540705
 Two-electron energy                   10.63862559
 Virial quotient                       -1.32450848
 !RHF STATE 1.7 Dipole moment           0.00000000     0.00000000     0.00000000
 Dipole moment /Debye                   0.00000000     0.00000000     0.00000000
 

 !RHF expec          <1.7|EKIN|1.7>    11.843473776734
 
 !RHF expec           <1.7|POT|1.7>    -6.542428070573

 ELECTRON ORBITALS
 =================


   Orb  Occ    Energy  Couls-En    Coefficients

                                   1 1s      1 1s      1 1s      1 1s      1 1s      1 1s      1 3d0     1 3d2+    1 3d0     1 3d2+ 
                                   1 3d0     1 3d2+    1 3d0     1 3d2+    1 3d0     1 3d2+    1 5g0     1 5g4+    1 5g2+    1 5g0  
                                   1 5g4+    1 5g2+    1 5g0     1 5g4+    1 5g2+ 

   1.1   2    -1.2591   -6.0744  1.000611  0.000904 -0.002520  0.002624 -0.002782  0.001404  0.000000  0.000000  0.000000  0.000000
                                 0.000000  0.000000  0.000000  0.000000  0.000000  0.000000  0.000000  0.000000  0.000000  0.000000
                                 0.000000  0.000000  0.000000  0.000000  0.000000

                                   1 2px     1 2px     1 2px     1 2px     1 2px     1 2px     1 4f1+    1 4f3+    1 4f1+    1 4f3+ 
                                   1 4f1+    1 4f3+    1 4f1+    1 4f3+    1 6h1+    1 6h3+    1 6h5+    1 6h1+    1 6h3+    1 6h5+ 


   1.2   2    -0.3699   -4.5436  1.018533 -0.000089  0.005409 -0.006937 -0.027324 -0.003569  0.000000  0.000000  0.000000  0.000000
                                 0.000000  0.000000  0.000000  0.000000  0.000000  0.000000  0.000000  0.000000  0.000000  0.000000

                                   1 2py     1 2py     1 2py     1 2py     1 2py     1 2py     1 4f1-    1 4f3-    1 4f1-    1 4f3- 
                                   1 4f1-    1 4f3-    1 4f1-    1 4f3-    1 6h1-    1 6h3-    1 6h5-    1 6h1-    1 6h3-    1 6h5- 


   1.3   +    -0.3699   -4.5436  1.018533 -0.000089  0.005409 -0.006937 -0.027324 -0.003569  0.000000  0.000000  0.000000  0.000000
                                 0.000000  0.000000  0.000000  0.000000  0.000000  0.000000  0.000000  0.000000  0.000000  0.000000

                                   1 2pz     1 2pz     1 2pz     1 2pz     1 2pz     1 2pz     1 4f0     1 4f2+    1 4f0     1 4f2+ 
                                   1 4f0     1 4f2+    1 4f0     1 4f2+    1 6h2+    1 6h4+    1 6h0     1 6h2+    1 6h4+    1 6h0  


   1.5   +    -0.3699   -4.5436  1.018533 -0.000089  0.005409 -0.006937 -0.027324 -0.003569  0.000000  0.000000  0.000000  0.000000
                                 0.000000  0.000000  0.000000  0.000000  0.000000  0.000000  0.000000  0.000000  0.000000  0.000000

 HOMO      1.2    -0.369914 =     -10.0659eV
 LUMO      2.1     0.115731 =       3.1492eV
 LUMO-HOMO         0.485645 =      13.2151eV


 **********************************************************************************************************************************
 DATASETS  * FILE   NREC   LENGTH (MB)   RECORD NAMES
              1      21       38.94       500      610      700      900      950      970     1000      129      960     1100   
                                          VAR    BASINP    GEOM    SYMINP    ZMAT    AOBASIS   BASIS     P2S    ABASIS      S 
                                         1400     1410     1420     1200     1210     1080     1600     1650     1300     1700   
                                         EKIN       V       ECP      H0       H01     AOSYM     SMH    MOLCAS    ERIS     OPER   
                                         1380   
                                         JKOP   

              2       6        8.00       700     1000      520     4202     5202     2101   
                                         GEOM     BASIS   MCVARS     RHF     MCSCF     RHF  

 PROGRAMS   *        TOTAL       RHF     MULTI       RHF       INT
 CPU TIMES  *         4.61      0.03      0.19      0.24      4.02
 REAL TIME  *        18.77 SEC
 DISK USED  *        89.53 MB      
 **********************************************************************************************************************************
 SETTING SCF(I)         =       -15.68678146  AU                              
 SETTING _CC_NORM_MAX   =         2.00000000                                  


 PROGRAM * UHF-SCF       Authors: W. Meyer, H.-J. Werner


 NUMBER OF ELECTRONS:       4+    2-    SPACE SYMMETRY=7    SPIN SYMMETRY: Triplet 
 CONVERGENCE THRESHOLDS:    1.00E-05 (Density)    1.00E-07 (Energy)
 MAX. NUMBER OF ITERATIONS:        0
 INTERPOLATION TYPE:            DIIS
 INTERPOLATION STEPS:              2 (START)      1 (STEP)
 LEVEL SHIFTS:                  0.20 (ALPHA)   0.20 (BETA) 



 Molecular orbitals read from record     2101.2  Type=RHF/CANONICAL (state 1.7)

 Molecular orbital dump at record        2200.2

 Initial alpha occupation   1   1   1   0   1   0   0   0
 Initial beta  occupation   1   1   0   0   0   0   0   0

 ITERATION    DDIFF          GRAD             ENERGY        2-EL.EN.            DIPOLE MOMENTS         DIIS
    1      0.000D+00      0.000D+00       -15.68678146     21.277251    0.00000    0.00000    0.00000    0
 
 Final alpha occupancy:   1   1   1   0   1   0   0   0
 Final beta  occupancy:   1   1   0   0   0   0   0   0

 !UHF STATE 1.7 Energy                -15.686781462945
 Nuclear energy                         0.00000000
 One-electron energy                  -26.32540705
 Two-electron energy                   10.63862559
 Virial quotient                       -1.32450848
 !UHF STATE 1.7 Dipole moment           0.00000000     0.00000000     0.00000000
 Dipole moment /Debye                   0.00000000     0.00000000     0.00000000
 

 !UHF expec          <1.7|EKIN|1.7>    11.843473776734
 
 !UHF expec           <1.7|POT|1.7>    -6.542428070573

 ELECTRON ORBITALS FOR POSITIVE SPIN
 ===================================


   Orb  Occ    Energy  Couls-En    Coefficients

                                   1 1s      1 1s      1 1s      1 1s      1 1s      1 1s      1 3d0     1 3d2+    1 3d0     1 3d2+ 
                                   1 3d0     1 3d2+    1 3d0     1 3d2+    1 3d0     1 3d2+    1 5g0     1 5g4+    1 5g2+    1 5g0  
                                   1 5g4+    1 5g2+    1 5g0     1 5g4+    1 5g2+ 

   1.1   +    -1.2591   -6.0744  1.000611  0.000904 -0.002520  0.002624 -0.002782  0.001404  0.000000  0.000000  0.000000  0.000000
                                 0.000000  0.000000  0.000000  0.000000  0.000000  0.000000  0.000000  0.000000  0.000000  0.000000
                                 0.000000  0.000000  0.000000  0.000000  0.000000

                                   1 2px     1 2px     1 2px     1 2px     1 2px     1 2px     1 4f1+    1 4f3+    1 4f1+    1 4f3+ 
                                   1 4f1+    1 4f3+    1 4f1+    1 4f3+    1 6h1+    1 6h3+    1 6h5+    1 6h1+    1 6h3+    1 6h5+ 


   1.2   +    -0.3699   -4.5436  1.018533 -0.000089  0.005409 -0.006937 -0.027324 -0.003569  0.000000  0.000000  0.000000  0.000000
                                 0.000000  0.000000  0.000000  0.000000  0.000000  0.000000  0.000000  0.000000  0.000000  0.000000

                                   1 2py     1 2py     1 2py     1 2py     1 2py     1 2py     1 4f1-    1 4f3-    1 4f1-    1 4f3- 
                                   1 4f1-    1 4f3-    1 4f1-    1 4f3-    1 6h1-    1 6h3-    1 6h5-    1 6h1-    1 6h3-    1 6h5- 


   1.3   +    -0.3699   -4.5436  1.018533 -0.000089  0.005409 -0.006937 -0.027324 -0.003569  0.000000  0.000000  0.000000  0.000000
                                 0.000000  0.000000  0.000000  0.000000  0.000000  0.000000  0.000000  0.000000  0.000000  0.000000

                                   1 2pz     1 2pz     1 2pz     1 2pz     1 2pz     1 2pz     1 4f0     1 4f2+    1 4f0     1 4f2+ 
                                   1 4f0     1 4f2+    1 4f0     1 4f2+    1 6h2+    1 6h4+    1 6h0     1 6h2+    1 6h4+    1 6h0  


   1.5   +    -0.3699   -4.5436  1.018533 -0.000089  0.005409 -0.006937 -0.027324 -0.003569  0.000000  0.000000  0.000000  0.000000
                                 0.000000  0.000000  0.000000  0.000000  0.000000  0.000000  0.000000  0.000000  0.000000  0.000000

 ELECTRON ORBITALS FOR NEGATIVE SPIN
 ===================================


   Orb  Occ    Energy  Couls-En    Coefficients

                                   1 1s      1 1s      1 1s      1 1s      1 1s      1 1s      1 3d0     1 3d2+    1 3d0     1 3d2+ 
                                   1 3d0     1 3d2+    1 3d0     1 3d2+    1 3d0     1 3d2+    1 5g0     1 5g4+    1 5g2+    1 5g0  
                                   1 5g4+    1 5g2+    1 5g0     1 5g4+    1 5g2+ 

   1.1   -    -1.2591   -6.0744  1.000611  0.000904 -0.002520  0.002624 -0.002782  0.001404  0.000000  0.000000  0.000000  0.000000
                                 0.000000  0.000000  0.000000  0.000000  0.000000  0.000000  0.000000  0.000000  0.000000  0.000000
                                 0.000000  0.000000  0.000000  0.000000  0.000000

                                   1 2px     1 2px     1 2px     1 2px     1 2px     1 2px     1 4f1+    1 4f3+    1 4f1+    1 4f3+ 
                                   1 4f1+    1 4f3+    1 4f1+    1 4f3+    1 6h1+    1 6h3+    1 6h5+    1 6h1+    1 6h3+    1 6h5+ 


   1.2   -    -0.3699   -4.5436  1.018533 -0.000089  0.005409 -0.006937 -0.027324 -0.003569  0.000000  0.000000  0.000000  0.000000
                                 0.000000  0.000000  0.000000  0.000000  0.000000  0.000000  0.000000  0.000000  0.000000  0.000000

 HOMO      1.2    -0.369914 =     -10.0659eV
 LUMO     -1.3    -0.369914 =     -10.0659eV
 LUMO-HOMO        -0.000000 =      -0.0000eV

 EXPECTATION VALUE OF S**2:             2.00000000

 Occupation number threshold for canonical orbitals:  1.999000 (occupied),  0.001000 (virtual)

 Number of pseudo-canonical orbitals per symmetry:    1   1   0   0   0   0   0   0
 Number of active natural orbitals per symmetry:      0   0   1   0   1   0   0   0

 NATURAL CHARGE ORBITALS
 =======================


   Orb     Occ        Energy       Coefficients

                                   1 1s      1 1s      1 1s      1 1s      1 1s      1 1s      1 3d0     1 3d2+    1 3d0     1 3d2+ 
                                   1 3d0     1 3d2+    1 3d0     1 3d2+    1 3d0     1 3d2+    1 5g0     1 5g4+    1 5g2+    1 5g0  
                                   1 5g4+    1 5g2+    1 5g0     1 5g4+    1 5g2+ 

   1.1  2.00000    -1.259103     1.000611  0.000904 -0.002520  0.002624 -0.002782  0.001404  0.000000  0.000000  0.000000  0.000000
                                 0.000000  0.000000  0.000000  0.000000  0.000000  0.000000  0.000000  0.000000  0.000000  0.000000
                                 0.000000  0.000000  0.000000  0.000000  0.000000

                                   1 2px     1 2px     1 2px     1 2px     1 2px     1 2px     1 4f1+    1 4f3+    1 4f1+    1 4f3+ 
                                   1 4f1+    1 4f3+    1 4f1+    1 4f3+    1 6h1+    1 6h3+    1 6h5+    1 6h1+    1 6h3+    1 6h5+ 


   1.2  2.00000    -0.369914     1.018533 -0.000089  0.005409 -0.006937 -0.027324 -0.003569  0.000000  0.000000  0.000000  0.000000
                                 0.000000  0.000000  0.000000  0.000000  0.000000  0.000000  0.000000  0.000000  0.000000  0.000000

                                   1 2py     1 2py     1 2py     1 2py     1 2py     1 2py     1 4f1-    1 4f3-    1 4f1-    1 4f3- 
                                   1 4f1-    1 4f3-    1 4f1-    1 4f3-    1 6h1-    1 6h3-    1 6h5-    1 6h1-    1 6h3-    1 6h5- 


   1.3  1.00000    -0.268936     1.018533 -0.000089  0.005409 -0.006937 -0.027324 -0.003569  0.000000  0.000000  0.000000  0.000000
                                 0.000000  0.000000  0.000000  0.000000  0.000000  0.000000  0.000000  0.000000  0.000000  0.000000

                                   1 2pz     1 2pz     1 2pz     1 2pz     1 2pz     1 2pz     1 4f0     1 4f2+    1 4f0     1 4f2+ 
                                   1 4f0     1 4f2+    1 4f0     1 4f2+    1 6h2+    1 6h4+    1 6h0     1 6h2+    1 6h4+    1 6h0  


   1.5  1.00000    -0.268936     1.018533 -0.000089  0.005409 -0.006937 -0.027324 -0.003569  0.000000  0.000000  0.000000  0.000000
                                 0.000000  0.000000  0.000000  0.000000  0.000000  0.000000  0.000000  0.000000  0.000000  0.000000

 Natural orbitals saved to record    2200.2 (Orbital set 3)

 Orbital spaces for UNO-CAS (Min. occupation: 0.020  Max. occupation: 1.980):

 Closed:        1   1   0   0   0   0   0   0
 Active:        0   0   1   0   1   0   0   0

 No convergence



 **********************************************************************************************************************************
 DATASETS  * FILE   NREC   LENGTH (MB)   RECORD NAMES
              1      21       38.94       500      610      700      900      950      970     1000      129      960     1100   
                                          VAR    BASINP    GEOM    SYMINP    ZMAT    AOBASIS   BASIS     P2S    ABASIS      S 
                                         1400     1410     1420     1200     1210     1080     1600     1650     1300     1700   
                                         EKIN       V       ECP      H0       H01     AOSYM     SMH    MOLCAS    ERIS     OPER   
                                         1380   
                                         JKOP   

              2       7       10.62       700     1000      520     4202     5202     2101     2200   
                                         GEOM     BASIS   MCVARS     RHF     MCSCF     RHF      UHF  

 PROGRAMS   *        TOTAL       UHF       RHF     MULTI       RHF       INT
 CPU TIMES  *         4.66      0.04      0.03      0.19      0.24      4.02
 REAL TIME  *        18.95 SEC
 DISK USED  *        89.53 MB      
 **********************************************************************************************************************************
 SETTING SCF(I)         =       -15.68678146  AU                              


 PROGRAM * MRCC (General Multireference Coupled Cluster)    Author: M. Kallay, 2000-2005

 ***  Initialisation ***

   0 Spin projections
 
 Molecular orbitals read from record     2200.2  Type=UHF/ALPHA (state 1.7)

 ?Warning: UHF not converged
 Molecular orbitals read from record     2200.2  Type=UHF/BETA (state 1.7)

 ?Warning: UHF not converged
 
 Frozen orbitals:              0 (  0  0  0  0  0  0  0  0)
 Active orbitals:            126 ( 25 20 20 11 20 11 11  8)
 Active electrons:             6
 Spin quantum number:          1.0

 Transformed integrals will be written to file mrcc_46630/fort.55

 Load integrals                4.7 sec
 Transform integrals           7.4 sec
 Storage for integrals:       24278327
 Remaining memory:           *********

 Core energy:               0.00000000
 
 MRCC Input:
     4     0     0     0     3     0     0     7     0     0     0     1     1     0     0     7     0     0   0.000     0   64000
  ex.lev,nsing,ntrip, rest,method,dens,conver,symm, diag, CS ,spatial, HF, ndoub,nacto,nactv, tol, maxex, sacc, freq,  dboc,   mem
  2  0  0  0  0  0  0  0  0  0  0  0  0  0  0  0  0  0  0  0  0  0  0  0  0  2  0  0  0  0  0  0  0  0  0  0  0  0  0  0  0  0  0  0  0  1  0  0  0  0  0  0  0  0  0  0  0  0  0  0  0  0  0  0  0  0  0  0  0  0  0  0  0  0  0  0  1  0  0  0  0  0  0  0  0  0  0  0  0  0  0  0  0  0  0  0  0  0  0  0  0  0  0  0  0  0  0  0  0  0  0  0  0  0  0  0  0  0  0  0  0  0  0  0  0  0
 MRCC Input end
 Variable memory released
 MRCC now being run, temporary output in /global/cscratch1/sd/aannabe/mrcc_46630/mrcc.out
 **********************************************************************
                          MRCC program system
 **********************************************************************

                              Written by
  Mihaly Kallay, Zoltan Rolik, Jozsef Csontos, Peter Nagy, Gyula Samu,
      David Mester, Jozsef Csoka, Bernat Szabo, Istvan Ladjanszki,
       Lorant Szegedy, Bence Ladoczki, Klara Petrov, Mate Farkas,
                    Pal D. Mezei, and Bence Hegely

        Department of Physical Chemistry and Materials Science
            Budapest University of Technology and Economics
                  Budapest P.O.Box 91, H-1521 Hungary

                              www.mrcc.hu

                       Release date: May 23, 2018

 ************************ 2018-10-30 14:13:19 *************************
 Executing goldstone...

 Generation of CC equations in terms of H and T...
 Generation of antisymmetrized Goldstone diagrams...
 Number of diagrams in T^1 equations:    15
 Number of diagrams in T^2 equations:    38
 Number of diagrams in T^3 equations:    49
 Number of diagrams in T^4 equations:     5
 Translation of diagrams to factorized equations...
 Optimizing intermediate calculation...
 Number of floating-point operations per iteration step:   5.2358E+11
 Probable CPU time per iteration step (hours):      5.24
 Required memory (Mbytes):   29863.8
 Number of intermediates:                                  79
 Number of intermediates to be stored:                     32
 Length of intermediate file (Mbytes):     503.7

 ************************ 2018-10-30 14:13:20 *************************
 Executing xmrcc...

 **********************************************************************
 CC(3)(4) calculation


 Allocation of****** Mbytes of memory...
 Number of spinorbitals:                   252
 Number of alpha electrons:                        4
 Number of beta electrons:                         2
 Spin multiplicity:                     2
 z-component of spin:  1.0
 Spatial symmetry:                      7
 Convergence criterion:  1.0E-07
 Construction of occupation graphs...
 Number of                     0 -fold excitations:                      1
 Number of                     1 -fold excitations:                    124
 Number of                     2 -fold excitations:                  22268
 Number of                     3 -fold excitations:                1986216
 Total number of configurations:                2008609
 Calculation of coupling coefficients...
 Length of intermediate file (Mbytes):     381.0

 ======================================================================

 Spin case  1   Alpha:  2   Beta:  2
 Number of excitations:               42216485
 Spin case  2   Alpha:  3   Beta:  1
 Number of excitations:               36589408
 Spin case  3   Alpha:  4   Beta:  0
 Number of excitations:                1099202
 Number of                     4 -fold excitations:               79905095

 Memory requirements /Mbyte/:
               Minimal        Optimal
 Real*8:        786.3175      1923.2150
 Integer:        79.5111
 Total:         865.8286      2002.7261


 ************************ 2018-10-30 14:13:36 *************************
 Executing mrcc...

 **********************************************************************
 CCSDT(Q) calculation


 Allocation of 1923.2 Mbytes of memory...
 Number of spinorbitals: 252
 Number of alpha electrons:  4
 Number of beta  electrons:  2
 Spin multiplicity: 2
 z-component of spin:  1.0
 Spatial symmetry: 7
 Convergence criterion:  1.0E-07
 Construction of occupation graphs...
 Number of 0-fold excitations: 1
 Number of 1-fold excitations: 124
 Number of 2-fold excitations: 22268
 Number of 3-fold excitations: 1986216
 Total number of determinants: 2008609
 Calculation of coupling coefficients...
 Initial cluster amplitudes are generated.
 Length of intermediate file (Mbytes):     381.0
 Reading integral list from unit 55...
 Sorting integrals...
 Sorting integrals...
 Sorting integrals...
 Sorting integrals...
 Energy of reference determinant [au]:     -15.686781462945
 Calculation of MP denominators...

 Starting CC iteration...
 ======================================================================
 Norm of residual vector:     1.21056368
 CPU time [min]:     1.839                   Wall time [min]:     1.840

 Iteration  1  CC energy:   -15.86048485  Energy decrease:   0.17370339
 ======================================================================
 Norm of residual vector:     0.24215418
 CPU time [min]:     2.684                   Wall time [min]:     2.704

 Iteration  2  CC energy:   -15.87258312  Energy decrease:   0.01209827
 ======================================================================
 Norm of residual vector:     0.05019195
 CPU time [min]:     3.720                   Wall time [min]:     3.815

 Iteration  3  CC energy:   -15.87965291  Energy decrease:   0.00706978
 ======================================================================
 Norm of residual vector:     0.01530347
 CPU time [min]:     4.843                   Wall time [min]:     4.943

 Iteration  4  CC energy:   -15.88035713  Energy decrease:   0.00070422
 ======================================================================
 Norm of residual vector:     0.00719041
 CPU time [min]:     5.962                   Wall time [min]:     6.067

 Iteration  5  CC energy:   -15.88001946  Energy decrease:   0.00033767
 ======================================================================
 Norm of residual vector:     0.00329009
 CPU time [min]:     7.078                   Wall time [min]:     7.185

 Iteration  6  CC energy:   -15.88003980  Energy decrease:   0.00002034
 ======================================================================
 Norm of residual vector:     0.00158279
 CPU time [min]:     8.210                   Wall time [min]:     8.330

 Iteration  7  CC energy:   -15.88008582  Energy decrease:   0.00004602
 ======================================================================
 Norm of residual vector:     0.00075357
 CPU time [min]:     9.338                   Wall time [min]:     9.459

 Iteration  8  CC energy:   -15.88009041  Energy decrease:   0.00000459
 ======================================================================
 Norm of residual vector:     0.00029999
 CPU time [min]:    10.295                   Wall time [min]:    10.418

 Iteration  9  CC energy:   -15.88009157  Energy decrease:   0.00000116
 ======================================================================
 Norm of residual vector:     0.00011878
 CPU time [min]:    11.176                   Wall time [min]:    11.300

 Iteration 10  CC energy:   -15.88009264  Energy decrease:   0.00000107
 ======================================================================
 Norm of residual vector:     0.00005016
 CPU time [min]:    12.000                   Wall time [min]:    12.190

 Iteration 11  CC energy:   -15.88009231  Energy decrease:   0.00000033
 ======================================================================
 Norm of residual vector:     0.00001867
 CPU time [min]:    13.152                   Wall time [min]:    13.360

 Iteration 12  CC energy:   -15.88009212  Energy decrease:   0.00000019
 ======================================================================
 Norm of residual vector:     0.00000727
 CPU time [min]:    14.301                   Wall time [min]:    14.510

 Iteration 13  CC energy:   -15.88009217  Energy decrease:   0.00000004
 ======================================================================
 Norm of residual vector:     0.00000245
 CPU time [min]:    15.454                   Wall time [min]:    15.664

 Iteration 14  CC energy:   -15.88009217  Energy decrease:   3.6534E-09
 ======================================================================
 Norm of residual vector:     0.00000080
 CPU time [min]:    16.611                   Wall time [min]:    16.839

 Iteration 15  CC energy:   -15.88009215  Energy decrease:   0.00000002
 ======================================================================
 Norm of residual vector:     0.00000026
 CPU time [min]:    17.860                   Wall time [min]:    18.088

 Iteration 16  CC energy:   -15.88009215  Energy decrease:   3.0369E-09
 ======================================================================
 Norm of residual vector:     0.00000008
 CPU time [min]:    18.966                   Wall time [min]:    19.197

 Iteration 17  CC energy:   -15.88009215  Energy decrease:   1.4200E-09
 ======================================================================

 Iteration has converged in 17 steps.

 Final results:
 Total CCSDT energy [au]:            -15.880092152870
 Total MP2 energy [au]:              -15.860484851374

 Perturbative corrections are calculated...
 ======================================================================
 Spin case  1   Alpha:  2   Beta:  2
 Number of excitations:        42216485
 CPU time [min]:   187.350                   Wall time [min]:   187.589
 ======================================================================
 Spin case  2   Alpha:  3   Beta:  1
 Number of excitations:        36589408
 CPU time [min]:   307.146                   Wall time [min]:   307.406
 ======================================================================
 Spin case  3   Alpha:  4   Beta:  0
 Number of excitations:        1099202
 CPU time [min]:   319.890                   Wall time [min]:   320.163
 ======================================================================
 Number of 4-fold excitations: 79905095
 CPU time [min]:   319.890                   Wall time [min]:   320.165

 Total CCSDT[Q] energy [au]:         -15.880074118193
 Total CCSDT(Q) energy [au]:         -15.880173235428

 ************************ 2018-10-30 19:33:47 *************************
                      Normal termination of mrcc.
 **********************************************************************
 !CCSDT STATE 1.7 Energy              -15.880092152870
 !MP2 STATE 1.7 Energy                -15.860484851374
 !CCSDT[Q] STATE 1.7 Energy           -15.880074118193
 !CCSDT(Q) STATE 1.7 Energy           -15.880173235428
 
 CPU-time for MRCC:          19193.4 sec
 Elapsed-time for MRCC:      19232.6 sec

 Variable memory set to 8000000000 words,  buffer space   230000 words



 **********************************************************************************************************************************
 DATASETS  * FILE   NREC   LENGTH (MB)   RECORD NAMES
              1      21       38.94       500      610      700      900      950      970     1000      129      960     1100   
                                          VAR    BASINP    GEOM    SYMINP    ZMAT    AOBASIS   BASIS     P2S    ABASIS      S 
                                         1400     1410     1420     1200     1210     1080     1600     1650     1300     1700   
                                         EKIN       V       ECP      H0       H01     AOSYM     SMH    MOLCAS    ERIS     OPER   
                                         1380   
                                         JKOP   

              2       7       10.62       700     1000      520     4202     5202     2101     2200   
                                         GEOM     BASIS   MCVARS     RHF     MCSCF     RHF      UHF  

 PROGRAMS   *        TOTAL      MRCC       UHF       RHF     MULTI       RHF       INT
 CPU TIMES  *     19282.27  19277.61      0.04      0.03      0.19      0.24      4.02
 REAL TIME  *     19650.80 SEC
 DISK USED  *        89.53 MB      
 **********************************************************************************************************************************
 SETTING POSTHF(I)      =       -15.88017324  AU                              
                                                                                                                                                                                                                                                                

        SCF            POSTHF        EKIN          POT
    -15.68678146   -15.88017324   11.84347378   -6.54242807
                                                  

 CCSDT(Q)/USERDEF energy=    -15.880173235428

        CCSDT(Q)        RHF-SCF         MULTI           RHF-SCF 
    -15.88017324    -15.68678146    -15.68678146    -15.68977400
 **********************************************************************************************************************************
 Variable memory released
