
 Primary working directories    : /global/cscratch1/sd/aannabe
 Secondary working directories  : /global/cscratch1/sd/aannabe
 Wavefunction directory         : /global/homes/a/aannabe/wfu/
 Main file repository           : /global/cscratch1/sd/aannabe/

 SHA1      : 2873118e99aab1bc19f5b6fc1784693c06d15c95
 NAME      : 2015.1.8
 ARCHNAME  : linux/x86_64
 FC        : /opt/cray/pe/craype/2.5.5/bin/ftn
 BLASLIB   : -Wl,-_start-group /opt/intel/compilers_and_libraries_2016.3.210/linux/mkl/lib/intel64/libmkl_intel_ilp64.a /opt/intel/compilers_and_libraries_2016.3.210/linux/mkl/lib/intel64/libmkl_intel_thread.a /opt/intel/compilers_and_libraries_2016.3.210/linux/mkl/lib/intel64/libmkl_core.a -Wl,-_end-group
 id        : lbl

 Nodes     nprocs
 nid00478     1

 Using customized tuning parameters: mindgm=8; mindgv=16; mindgc=4; mindgr=1; noblas=0; minvec=7
 default implementation of scratch files=df  

 ***,O
 memory,8,g
 gthresh,twoint=1.e-12
 
 gprint,basis,orbitals
 gexpec,ekin,pot
 
 angstrom
 geometry={
 1                                                                               ! Number of atoms
 O 0.0 0.0 0.0
 }
 
 basis={
 Including file /global/homes/a/aannabe/docs/accurate/ccECP_Kh/pps/O.pp
 Including file /global/homes/a/aannabe/docs/accurate/ccECP_Kh/basis/aug-cc-pVnZ/O_6z.basis
 }
 
 {rhf
  start,atden
  wf,6,7,2
  occ,1,1,1,0,1,0,0,0
  open,1.3,1.5
  orbital,4202.2
 }
 {multi
  maxiter,40
  start,4202.2
  occ,1,1,1,0,1,0,0,0
  closed,1,0,0,0,0,0,0
  wf,6,4,2;state,1
  wf,6,6,2;state,1
  wf,6,7,2;state,1
  natorb,ci,print
  orbital,5202.2
 }
 {rhf,nitord=1,maxit=0
  start,5202.2
  wf,6,7,2
  occ,1,1,1,0,1,0,0,0
  open,1.3,1.5
 }
 
 scf(i)=energy
 
 _CC_NORM_MAX=2.0
  !NOTE: Perturbative MRCC works only with UHF reference. So, here we will trick MRCC by doing zero UHF iteration right after ROHF.
 
 {uhf
 maxit,0
 }
 scf(i)=energy
 
 {mrcc,method=CCSDT(Q)
 orbital,ignore_error=1                                                          !Ignore the fact that UHF WF is not converged
 maxit,100
 core
 }
 posthf(i)=energy
 
 table,scf,posthf,ekin,pot
 save,6.csv,new
 
 

 Variables initialized (889), CPU time= 0.00 sec
 Commands  initialized (702), CPU time= 0.01 sec, 572 directives.
 Default parameters read. Elapsed time= 0.20 sec

 Checking input...
 Passed
1


                                         ***  PROGRAM SYSTEM MOLPRO  ***
                                       Copyright, TTI GmbH Stuttgart, 2015
                                    Version 2015.1 linked Sep  7 2016 23:09:38


 **********************************************************************************************************************************
 LABEL *   O                                                                             
  64 bit serial version                                                                  DATE: 30-Oct-18          TIME: 19:33:57  
 **********************************************************************************************************************************

 SHA1:             2873118e99aab1bc19f5b6fc1784693c06d15c95
 **********************************************************************************************************************************

 THRESHOLDS:

 ZERO    =  1.00D-12  ONEINT  =  1.00D-12  TWOINT  =  1.00D-12  PREFAC  =  1.00D-14  LOCALI  =  1.00D-09  EORDER  =  1.00D-04
 ENERGY  =  0.00D+00  ETEST   =  0.00D+00  EDENS   =  0.00D+00  THRDEDEF=  1.00D-06  GRADIENT=  1.00D-02  STEP    =  1.00D-03
 ORBITAL =  1.00D-05  CIVEC   =  1.00D-05  COEFF   =  1.00D-04  PRINTCI =  5.00D-02  PUNCHCI =  9.90D+01  OPTGRAD =  3.00D-04
 OPTENERG=  1.00D-06  OPTSTEP =  3.00D-04  THRGRAD =  1.00D-10  COMPRESS=  1.00D-11  VARMIN  =  1.00D-07  VARMAX  =  1.00D-03
 THRDOUB =  0.00D+00  THRDIV  =  1.00D-05  THRRED  =  1.00D-07  THRPSP  =  1.00D+00  THRDC   =  1.00D-10  THRCS   =  1.00D-10
 THRNRM  =  1.00D-08  THREQ   =  0.00D+00  THRDE   =  1.00D+00  THRREF  =  1.00D-05  SPARFAC =  1.00D+00  THRDLP  =  1.00D-07
 THRDIA  =  1.00D-10  THRDLS  =  1.00D-07  THRGPS  =  0.00D+00  THRKEX  =  0.00D+00  THRDIS  =  2.00D-01  THRVAR  =  1.00D-10
 THRLOC  =  1.00D-06  THRGAP  =  1.00D-06  THRLOCT = -1.00D+00  THRGAPT = -1.00D+00  THRORB  =  1.00D-06  THRMLTP =  0.00D+00
 THRCPQCI=  1.00D-10  KEXTA   =  0.00D+00  THRCOARS=  0.00D+00  SYMTOL  =  1.00D-06  GRADTOL =  1.00D-06  THROVL  =  1.00D-08
 THRORTH =  1.00D-08  GRID    =  1.00D-06  GRIDMAX =  1.00D-03  DTMAX   =  0.00D+00  THROCCDE=  1.00D-01  THROCCDE=  1.00D-01



 ZUNIT=ANG
 

Geometry recognized as XYZ


 Variable memory set to 8000000000 words,  buffer space   230000 words

 SETTING BASIS          =    USERDEF


 Recomputing integrals since basis changed


 Using spherical harmonics



 PROGRAM * SEWARD (Integral evaluation for generally contracted gaussian basis sets)     Author: Roland Lindh, 1990

 Geometry written to block  1 of record 700

 Orientation using atomic masses  
 Molecule type: Atom
 Symmetry elements: X,Y,Z
 Rotational constants:       0.0000000      0.0000000      0.0000000 GHz  (calculated with average atomic masses)

 Point group  D2h 



 ATOMIC COORDINATES

 NR  ATOM    CHARGE       X              Y              Z

   1  O       6.00    0.000000000    0.000000000    0.000000000


          O   CORE POTENTIAL

          p POTENTIAL

 POWERS             1              3              2
 EXPONENTIALS   12.30997       14.76962       13.71419    
 COEFFICIENTS   6.000000       73.85984      -47.87600    

          s - p POTENTIAL

 POWERS             2
 EXPONENTIALS   13.65512    
 COEFFICIENTS   85.86406    


 BASIS DATA

   Nr Sym  Nuc  Type         Exponents   Contraction coefficients

    1.1 Ag    1  1s          54.775216    -0.001244
                             25.616801     0.010733
                             11.980245     0.001889
                              6.992317    -0.174254
                              2.620277     0.001762
                              1.225429     0.316185
                              0.577797     0.451202
                              0.268022     0.312153
                              0.125346     0.051117
    2.1 Ag    1  1s           0.058176     1.000000
    3.1 Ag    1  1s           0.145441     1.000000
    4.1 Ag    1  1s           0.333864     1.000000
    5.1 Ag    1  1s           0.806429     1.000000
    6.1 Ag    1  1s           1.558348     1.000000
    7.1 Ag    1  1s           3.469851     1.000000
    8.1 Ag    1  3d0          0.124218     1.000000
    9.1 Ag    1  3d2+         0.124218     1.000000
   10.1 Ag    1  3d0          0.310544     1.000000
   11.1 Ag    1  3d2+         0.310544     1.000000
   12.1 Ag    1  3d0          0.812582     1.000000
   13.1 Ag    1  3d2+         0.812582     1.000000
   14.1 Ag    1  3d0          1.841428     1.000000
   15.1 Ag    1  3d2+         1.841428     1.000000
   16.1 Ag    1  3d0          3.616739     1.000000
   17.1 Ag    1  3d2+         3.616739     1.000000
   18.1 Ag    1  3d0          8.822160     1.000000
   19.1 Ag    1  3d2+         8.822160     1.000000
   20.1 Ag    1  5g0          0.371860     1.000000
   21.1 Ag    1  5g4+         0.371860     1.000000
   22.1 Ag    1  5g2+         0.371860     1.000000
   23.1 Ag    1  5g0          0.929650     1.000000
   24.1 Ag    1  5g4+         0.929650     1.000000
   25.1 Ag    1  5g2+         0.929650     1.000000
   26.1 Ag    1  5g0          2.276202     1.000000
   27.1 Ag    1  5g4+         2.276202     1.000000
   28.1 Ag    1  5g2+         2.276202     1.000000
   29.1 Ag    1  5g0          4.891044     1.000000
   30.1 Ag    1  5g4+         4.891044     1.000000
   31.1 Ag    1  5g2+         4.891044     1.000000
   32.1 Ag    1  7i6+         1.110376     1.000000
   33.1 Ag    1  7i4+         1.110376     1.000000
   34.1 Ag    1  7i2+         1.110376     1.000000
   35.1 Ag    1  7i0          1.110376     1.000000
   36.1 Ag    1  7i6+         2.775940     1.000000
   37.1 Ag    1  7i4+         2.775940     1.000000
   38.1 Ag    1  7i2+         2.775940     1.000000
   39.1 Ag    1  7i0          2.775940     1.000000
    1.2 B3u   1  2px         22.217266     0.010487
                             10.747550     0.036644
                              5.315785     0.080367
                              2.660761     0.162701
                              1.331816     0.237779
                              0.678626     0.281142
                              0.333673     0.264319
                              0.167017     0.146601
                              0.083598     0.045815
    2.2 B3u   1  2px          0.045907     1.000000
    3.2 B3u   1  2px          0.114767     1.000000
    4.2 B3u   1  2px          0.305038     1.000000
    5.2 B3u   1  2px          0.738398     1.000000
    6.2 B3u   1  2px          1.898287     1.000000
    7.2 B3u   1  2px          2.934324     1.000000
    8.2 B3u   1  4f1+         0.184120     1.000000
    9.2 B3u   1  4f3+         0.184120     1.000000
   10.2 B3u   1  4f1+         0.460301     1.000000
   11.2 B3u   1  4f3+         0.460301     1.000000
   12.2 B3u   1  4f1+         1.159656     1.000000
   13.2 B3u   1  4f3+         1.159656     1.000000
   14.2 B3u   1  4f1+         2.456740     1.000000
   15.2 B3u   1  4f3+         2.456740     1.000000
   16.2 B3u   1  4f1+         5.203369     1.000000
   17.2 B3u   1  4f3+         5.203369     1.000000
   18.2 B3u   1  6h1+         0.606104     1.000000
   19.2 B3u   1  6h3+         0.606104     1.000000
   20.2 B3u   1  6h5+         0.606104     1.000000
   21.2 B3u   1  6h1+         1.515261     1.000000
   22.2 B3u   1  6h3+         1.515261     1.000000
   23.2 B3u   1  6h5+         1.515261     1.000000
   24.2 B3u   1  6h1+         3.725190     1.000000
   25.2 B3u   1  6h3+         3.725190     1.000000
   26.2 B3u   1  6h5+         3.725190     1.000000
    1.3 B2u   1  2py         22.217266     0.010487
                             10.747550     0.036644
                              5.315785     0.080367
                              2.660761     0.162701
                              1.331816     0.237779
                              0.678626     0.281142
                              0.333673     0.264319
                              0.167017     0.146601
                              0.083598     0.045815
    2.3 B2u   1  2py          0.045907     1.000000
    3.3 B2u   1  2py          0.114767     1.000000
    4.3 B2u   1  2py          0.305038     1.000000
    5.3 B2u   1  2py          0.738398     1.000000
    6.3 B2u   1  2py          1.898287     1.000000
    7.3 B2u   1  2py          2.934324     1.000000
    8.3 B2u   1  4f1-         0.184120     1.000000
    9.3 B2u   1  4f3-         0.184120     1.000000
   10.3 B2u   1  4f1-         0.460301     1.000000
   11.3 B2u   1  4f3-         0.460301     1.000000
   12.3 B2u   1  4f1-         1.159656     1.000000
   13.3 B2u   1  4f3-         1.159656     1.000000
   14.3 B2u   1  4f1-         2.456740     1.000000
   15.3 B2u   1  4f3-         2.456740     1.000000
   16.3 B2u   1  4f1-         5.203369     1.000000
   17.3 B2u   1  4f3-         5.203369     1.000000
   18.3 B2u   1  6h1-         0.606104     1.000000
   19.3 B2u   1  6h3-         0.606104     1.000000
   20.3 B2u   1  6h5-         0.606104     1.000000
   21.3 B2u   1  6h1-         1.515261     1.000000
   22.3 B2u   1  6h3-         1.515261     1.000000
   23.3 B2u   1  6h5-         1.515261     1.000000
   24.3 B2u   1  6h1-         3.725190     1.000000
   25.3 B2u   1  6h3-         3.725190     1.000000
   26.3 B2u   1  6h5-         3.725190     1.000000
    1.4 B1g   1  3d2-         0.124218     1.000000
    2.4 B1g   1  3d2-         0.310544     1.000000
    3.4 B1g   1  3d2-         0.812582     1.000000
    4.4 B1g   1  3d2-         1.841428     1.000000
    5.4 B1g   1  3d2-         3.616739     1.000000
    6.4 B1g   1  3d2-         8.822160     1.000000
    7.4 B1g   1  5g2-         0.371860     1.000000
    8.4 B1g   1  5g4-         0.371860     1.000000
    9.4 B1g   1  5g2-         0.929650     1.000000
   10.4 B1g   1  5g4-         0.929650     1.000000
   11.4 B1g   1  5g2-         2.276202     1.000000
   12.4 B1g   1  5g4-         2.276202     1.000000
   13.4 B1g   1  5g2-         4.891044     1.000000
   14.4 B1g   1  5g4-         4.891044     1.000000
   15.4 B1g   1  7i2-         1.110376     1.000000
   16.4 B1g   1  7i6-         1.110376     1.000000
   17.4 B1g   1  7i4-         1.110376     1.000000
   18.4 B1g   1  7i2-         2.775940     1.000000
   19.4 B1g   1  7i6-         2.775940     1.000000
   20.4 B1g   1  7i4-         2.775940     1.000000
    1.5 B1u   1  2pz         22.217266     0.010487
                             10.747550     0.036644
                              5.315785     0.080367
                              2.660761     0.162701
                              1.331816     0.237779
                              0.678626     0.281142
                              0.333673     0.264319
                              0.167017     0.146601
                              0.083598     0.045815
    2.5 B1u   1  2pz          0.045907     1.000000
    3.5 B1u   1  2pz          0.114767     1.000000
    4.5 B1u   1  2pz          0.305038     1.000000
    5.5 B1u   1  2pz          0.738398     1.000000
    6.5 B1u   1  2pz          1.898287     1.000000
    7.5 B1u   1  2pz          2.934324     1.000000
    8.5 B1u   1  4f0          0.184120     1.000000
    9.5 B1u   1  4f2+         0.184120     1.000000
   10.5 B1u   1  4f0          0.460301     1.000000
   11.5 B1u   1  4f2+         0.460301     1.000000
   12.5 B1u   1  4f0          1.159656     1.000000
   13.5 B1u   1  4f2+         1.159656     1.000000
   14.5 B1u   1  4f0          2.456740     1.000000
   15.5 B1u   1  4f2+         2.456740     1.000000
   16.5 B1u   1  4f0          5.203369     1.000000
   17.5 B1u   1  4f2+         5.203369     1.000000
   18.5 B1u   1  6h2+         0.606104     1.000000
   19.5 B1u   1  6h4+         0.606104     1.000000
   20.5 B1u   1  6h0          0.606104     1.000000
   21.5 B1u   1  6h2+         1.515261     1.000000
   22.5 B1u   1  6h4+         1.515261     1.000000
   23.5 B1u   1  6h0          1.515261     1.000000
   24.5 B1u   1  6h2+         3.725190     1.000000
   25.5 B1u   1  6h4+         3.725190     1.000000
   26.5 B1u   1  6h0          3.725190     1.000000
    1.6 B2g   1  3d1+         0.124218     1.000000
    2.6 B2g   1  3d1+         0.310544     1.000000
    3.6 B2g   1  3d1+         0.812582     1.000000
    4.6 B2g   1  3d1+         1.841428     1.000000
    5.6 B2g   1  3d1+         3.616739     1.000000
    6.6 B2g   1  3d1+         8.822160     1.000000
    7.6 B2g   1  5g1+         0.371860     1.000000
    8.6 B2g   1  5g3+         0.371860     1.000000
    9.6 B2g   1  5g1+         0.929650     1.000000
   10.6 B2g   1  5g3+         0.929650     1.000000
   11.6 B2g   1  5g1+         2.276202     1.000000
   12.6 B2g   1  5g3+         2.276202     1.000000
   13.6 B2g   1  5g1+         4.891044     1.000000
   14.6 B2g   1  5g3+         4.891044     1.000000
   15.6 B2g   1  7i5+         1.110376     1.000000
   16.6 B2g   1  7i3+         1.110376     1.000000
   17.6 B2g   1  7i1+         1.110376     1.000000
   18.6 B2g   1  7i5+         2.775940     1.000000
   19.6 B2g   1  7i3+         2.775940     1.000000
   20.6 B2g   1  7i1+         2.775940     1.000000
    1.7 B3g   1  3d1-         0.124218     1.000000
    2.7 B3g   1  3d1-         0.310544     1.000000
    3.7 B3g   1  3d1-         0.812582     1.000000
    4.7 B3g   1  3d1-         1.841428     1.000000
    5.7 B3g   1  3d1-         3.616739     1.000000
    6.7 B3g   1  3d1-         8.822160     1.000000
    7.7 B3g   1  5g1-         0.371860     1.000000
    8.7 B3g   1  5g3-         0.371860     1.000000
    9.7 B3g   1  5g1-         0.929650     1.000000
   10.7 B3g   1  5g3-         0.929650     1.000000
   11.7 B3g   1  5g1-         2.276202     1.000000
   12.7 B3g   1  5g3-         2.276202     1.000000
   13.7 B3g   1  5g1-         4.891044     1.000000
   14.7 B3g   1  5g3-         4.891044     1.000000
   15.7 B3g   1  7i5-         1.110376     1.000000
   16.7 B3g   1  7i3-         1.110376     1.000000
   17.7 B3g   1  7i1-         1.110376     1.000000
   18.7 B3g   1  7i5-         2.775940     1.000000
   19.7 B3g   1  7i3-         2.775940     1.000000
   20.7 B3g   1  7i1-         2.775940     1.000000
    1.8 Au    1  4f2-         0.184120     1.000000
    2.8 Au    1  4f2-         0.460301     1.000000
    3.8 Au    1  4f2-         1.159656     1.000000
    4.8 Au    1  4f2-         2.456740     1.000000
    5.8 Au    1  4f2-         5.203369     1.000000
    6.8 Au    1  6h4-         0.606104     1.000000
    7.8 Au    1  6h2-         0.606104     1.000000
    8.8 Au    1  6h4-         1.515261     1.000000
    9.8 Au    1  6h2-         1.515261     1.000000
   10.8 Au    1  6h4-         3.725190     1.000000
   11.8 Au    1  6h2-         3.725190     1.000000

 NUCLEAR CHARGE:                    6
 NUMBER OF PRIMITIVE AOS:         325
 NUMBER OF SYMMETRY AOS:          220
 NUMBER OF CONTRACTIONS:          188   (  39Ag  +  26B3u +  26B2u +  20B1g +  26B1u +  20B2g +  20B3g +  11Au  )
 NUMBER OF CORE ORBITALS:           0   (   0Ag  +   0B3u +   0B2u +   0B1g +   0B1u +   0B2g +   0B3g +   0Au  )
 NUMBER OF VALENCE ORBITALS:        4   (   1Ag  +   1B3u +   1B2u +   0B1g +   1B1u +   0B2g +   0B3g +   0Au  )


 NUCLEAR REPULSION ENERGY    0.00000000

 EXTRA SYMMETRY OF AOS IN SYMMETRY 1:   1 1 1 1 1 1 1 2 3 2   3 2 3 2 3 2 3 2 3 4   5 6 4 5 6 4 5 6 4 5   6 7 8 910 7 8 910
 EXTRA SYMMETRY OF AOS IN SYMMETRY 2:   1 1 1 1 1 1 1 2 3 2   3 2 3 2 3 2 3 4 5 6   4 5 6 4 5 6
 EXTRA SYMMETRY OF AOS IN SYMMETRY 3:   1 1 1 1 1 1 1 2 3 2   3 2 3 2 3 2 3 4 5 6   4 5 6 4 5 6
 EXTRA SYMMETRY OF AOS IN SYMMETRY 4:   1 1 1 1 1 1 2 3 2 3   2 3 2 3 4 5 6 4 5 6
 EXTRA SYMMETRY OF AOS IN SYMMETRY 5:   1 1 1 1 1 1 1 2 3 2   3 2 3 2 3 2 3 4 5 6   4 5 6 4 5 6
 EXTRA SYMMETRY OF AOS IN SYMMETRY 6:   1 1 1 1 1 1 2 3 2 3   2 3 2 3 4 5 6 4 5 6
 EXTRA SYMMETRY OF AOS IN SYMMETRY 7:   1 1 1 1 1 1 2 3 2 3   2 3 2 3 4 5 6 4 5 6
 EXTRA SYMMETRY OF AOS IN SYMMETRY 8:   1 1 1 1 1 2 3 2 3 2   3

 Eigenvalues of metric

         1 0.492E-03 0.294E-02 0.178E-01 0.240E-01 0.240E-01 0.106E+00 0.117E+00 0.117E+00
         2 0.151E-02 0.116E-01 0.473E-01 0.597E-01 0.597E-01 0.191E+00 0.243E+00 0.243E+00
         3 0.151E-02 0.116E-01 0.473E-01 0.597E-01 0.597E-01 0.191E+00 0.243E+00 0.243E+00
         4 0.240E-01 0.117E+00 0.145E+00 0.145E+00 0.350E+00 0.480E+00 0.480E+00 0.533E+00
         5 0.151E-02 0.116E-01 0.473E-01 0.597E-01 0.597E-01 0.191E+00 0.243E+00 0.243E+00
         6 0.240E-01 0.117E+00 0.145E+00 0.145E+00 0.350E+00 0.480E+00 0.480E+00 0.533E+00
         7 0.240E-01 0.117E+00 0.145E+00 0.145E+00 0.350E+00 0.480E+00 0.480E+00 0.533E+00
         8 0.597E-01 0.243E+00 0.305E+00 0.305E+00 0.670E+00 0.907E+00 0.907E+00 0.150E+01


 Contracted 2-electron integrals neglected if value below      1.0D-12
 AO integral compression algorithm  1   Integral accuracy      1.0D-12

     121.373 MB (compressed) written to integral file ( 47.8%)


 NUMBER OF SORTED TWO-ELECTRON INTEGRALS:   20212815.     BUFFER LENGTH:  32768
 NUMBER OF SEGMENTS:   2  SEGMENT LENGTH:   15998787      RECORD LENGTH: 524288

 Memory used in sort:      16.56 MW

 SORT1 READ    31710950. AND WROTE    13213985. INTEGRALS IN     39 RECORDS. CPU TIME:     1.20 SEC, REAL TIME:     1.64 SEC
 SORT2 READ    13213985. AND WROTE    20212815. INTEGRALS IN    463 RECORDS. CPU TIME:     0.77 SEC, REAL TIME:     1.34 SEC

 FILE SIZES:   FILE 1:   141.3 MBYTE,  FILE 4:   163.6 MBYTE,   TOTAL:    304.9 MBYTE

 OPERATOR DM      FOR CENTER  0  COORDINATES:    0.000000    0.000000    0.000000
 OPERATOR EKIN    FOR CENTER  0  COORDINATES:    0.000000    0.000000    0.000000
 OPERATOR POT     FOR CENTER  0  COORDINATES:    0.000000    0.000000    0.000000


 **********************************************************************************************************************************
 DATASETS  * FILE   NREC   LENGTH (MB)   RECORD NAMES
              1      20       97.89       500      610      700      900      950      970     1000      129      960     1100   
                                          VAR    BASINP    GEOM    SYMINP    ZMAT    AOBASIS   BASIS     P2S    ABASIS      S 
                                         1400     1410     1420     1200     1210     1080     1600     1650     1300     1700   
                                         EKIN       V       ECP      H0       H01     AOSYM     SMH    MOLCAS    ERIS     OPER   

 PROGRAMS   *        TOTAL       INT
 CPU TIMES  *        10.44     10.29
 REAL TIME  *        25.09 SEC
 DISK USED  *       305.22 MB      
 **********************************************************************************************************************************


 PROGRAM * RHF-SCF (OPEN SHELL)       Authors: W. Meyer, H.-J. Werner


 NUMBER OF ELECTRONS:       4+    2-    SPACE SYMMETRY=7    SPIN SYMMETRY: Triplet 
 CONVERGENCE THRESHOLDS:    1.00E-05 (Density)    1.00E-07 (Energy)
 MAX. NUMBER OF ITERATIONS:       60
 INTERPOLATION TYPE:            DIIS
 INTERPOLATION STEPS:              2 (START)      1 (STEP)
 LEVEL SHIFTS:                 -0.60 (CLOSED) -0.30 (OPEN) 


 Singly occupied orbitals:      1.3       1.5

   Atom=O  basis=ECP2MWB_GUESS     lmin=0  lmax=1

 Orbital guess generated from atomic densities. Full valence occupancy:    1   1   1   0   1   0   0   0


 Molecular orbital dump at record        4202.2

 ITERATION    DDIFF          GRAD             ENERGY        2-EL.EN.            DIPOLE MOMENTS         DIIS   ORB.
    1      0.000D+00      0.000D+00       -15.66294322     20.338538    0.00000    0.00000    0.00000    0    start
    2      0.000D+00      0.134D-01       -15.68808094     21.190534    0.00000    0.00000    0.00000    1    diag,B
    3      0.696D-02      0.315D-02       -15.68937412     21.223047    0.00000    0.00000    0.00000    2    diag,B
    4      0.130D-02      0.121D-02       -15.68975994     21.254089    0.00000    0.00000    0.00000    3    diag,B
    5      0.759D-03      0.310D-03       -15.68979094     21.259255    0.00000    0.00000    0.00000    4    diag,B
    6      0.264D-03      0.603D-04       -15.68979194     21.258447    0.00000    0.00000    0.00000    5    diag,B
    7      0.584D-04      0.159D-04       -15.68979202     21.258226    0.00000    0.00000    0.00000    6    fixocc
    8      0.236D-04      0.320D-05       -15.68979202     21.258170    0.00000    0.00000    0.00000    7    diag,B
    9      0.447D-05      0.775D-06       -15.68979202     21.258169    0.00000    0.00000    0.00000    0    orth

 Final alpha occupancy:   1   1   1   0   1   0   0   0
 Final beta  occupancy:   1   1   0   0   0   0   0   0

 !RHF STATE 1.7 Energy                -15.689792023866
 Nuclear energy                         0.00000000
 One-electron energy                  -26.31887636
 Two-electron energy                   10.62908433
 Virial quotient                       -1.32456674
 !RHF STATE 1.7 Dipole moment           0.00000000     0.00000000     0.00000000
 Dipole moment /Debye                   0.00000000     0.00000000     0.00000000
 

 !RHF expec          <1.7|EKIN|1.7>    11.845225729268
 
 !RHF expec           <1.7|POT|1.7>    -6.541631379387

 ELECTRON ORBITALS
 =================


   Orb  Occ    Energy  Couls-En    Coefficients

                                   1 1s      1 1s      1 1s      1 1s      1 1s      1 1s      1 1s      1 3d0     1 3d2+    1 3d0  
                                   1 3d2+    1 3d0     1 3d2+    1 3d0     1 3d2+    1 3d0     1 3d2+    1 3d0     1 3d2+    1 5g0  
                                   1 5g4+    1 5g2+    1 5g0     1 5g4+    1 5g2+    1 5g0     1 5g4+    1 5g2+    1 5g0     1 5g4+ 
                                   1 5g2+    1 7i6+    1 7i4+    1 7i2+    1 7i0     1 7i6+    1 7i4+    1 7i2+    1 7i0  

   1.1   2    -1.2598   -6.0752  0.996844  0.001936 -0.004056  0.006510 -0.003674  0.004371 -0.001793 -0.000533  0.000924 -0.001626
                                 0.002816 -0.000432  0.000748  0.000014 -0.000024 -0.000281  0.000487 -0.000140  0.000242 -0.000008
                                -0.000016  0.000012 -0.000003 -0.000006  0.000004  0.000000  0.000000 -0.000000 -0.000000 -0.000001
                                 0.000000 -0.000000  0.000000 -0.000000  0.000000 -0.000000  0.000000 -0.000000  0.000000

                                   1 2px     1 2px     1 2px     1 2px     1 2px     1 2px     1 2px     1 4f1+    1 4f3+    1 4f1+ 
                                   1 4f3+    1 4f1+    1 4f3+    1 4f1+    1 4f3+    1 4f1+    1 4f3+    1 6h1+    1 6h3+    1 6h5+ 
                                   1 6h1+    1 6h3+    1 6h5+    1 6h1+    1 6h3+    1 6h5+ 

   1.2   2    -0.5672   -4.6952  1.000130  0.000390 -0.000872  0.000324 -0.000110  0.000188 -0.000135  0.000533 -0.000688  0.001661
                                -0.002144  0.001548 -0.001998  0.000551 -0.000711  0.000226 -0.000291  0.000008 -0.000009  0.000011
                                 0.000006 -0.000006  0.000009  0.000001 -0.000002  0.000002

                                   1 2py     1 2py     1 2py     1 2py     1 2py     1 2py     1 2py     1 4f1-    1 4f3-    1 4f1- 
                                   1 4f3-    1 4f1-    1 4f3-    1 4f1-    1 4f3-    1 4f1-    1 4f3-    1 6h1-    1 6h3-    1 6h5- 
                                   1 6h1-    1 6h3-    1 6h5-    1 6h1-    1 6h3-    1 6h5- 

   1.3   +    -0.7034   -4.9194  1.033640 -0.003110 -0.046052 -0.027449  0.011055  0.005068  0.000237  0.000219 -0.000849  0.001037
                                -0.004018  0.001122 -0.004344  0.000426 -0.001651  0.000171 -0.000662  0.000005 -0.000018  0.000040
                                 0.000005 -0.000017  0.000039  0.000002 -0.000005  0.000011

                                   1 2pz     1 2pz     1 2pz     1 2pz     1 2pz     1 2pz     1 2pz     1 4f0     1 4f2+    1 4f0  
                                   1 4f2+    1 4f0     1 4f2+    1 4f0     1 4f2+    1 4f0     1 4f2+    1 6h2+    1 6h4+    1 6h0  
                                   1 6h2+    1 6h4+    1 6h0     1 6h2+    1 6h4+    1 6h0  

   1.5   +    -0.7034   -4.9194  1.033640 -0.003110 -0.046052 -0.027449  0.011055  0.005068  0.000237  0.000537 -0.000694  0.002541
                                -0.003281  0.002748 -0.003547  0.001044 -0.001348  0.000419 -0.000540 -0.000029  0.000025  0.000021
                                -0.000028  0.000024  0.000021 -0.000008  0.000007  0.000006

 HOMO      1.2    -0.567229 =     -15.4351eV
 LUMO      2.1     0.097333 =       2.6486eV
 LUMO-HOMO         0.664562 =      18.0837eV


 **********************************************************************************************************************************
 DATASETS  * FILE   NREC   LENGTH (MB)   RECORD NAMES
              1      20       97.89       500      610      700      900      950      970     1000      129      960     1100   
                                          VAR    BASINP    GEOM    SYMINP    ZMAT    AOBASIS   BASIS     P2S    ABASIS      S 
                                         1400     1410     1420     1200     1210     1080     1600     1650     1300     1700   
                                         EKIN       V       ECP      H0       H01     AOSYM     SMH    MOLCAS    ERIS     OPER   

              2       4        2.92       700     1000      520     4202   
                                         GEOM     BASIS   MCVARS     RHF  

 PROGRAMS   *        TOTAL       RHF       INT
 CPU TIMES  *        11.11      0.67     10.29
 REAL TIME  *        26.13 SEC
 DISK USED  *       305.22 MB      
 **********************************************************************************************************************************


 PROGRAM * MULTI (Direct Multiconfiguration SCF)       Authors: P.J. Knowles, H.-J. Werner (1984)     S.T. Elbert (1988)


 Number of closed-shell orbitals:   1 (   1   0   0   0   0   0   0   0 )
 Number of active  orbitals:        3 (   0   1   1   0   1   0   0   0 )
 Number of external orbitals:     184 (  38  25  25  20  25  20  20  11 )

 State symmetry 1

 Number of electrons:     4    Spin symmetry=Triplet   Space symmetry=4
 Number of states:        1
 Number of CSFs:          1   (1 determinants, 3 intermediate states)

 State symmetry 2

 Number of electrons:     4    Spin symmetry=Triplet   Space symmetry=6
 Number of states:        1
 Number of CSFs:          1   (1 determinants, 3 intermediate states)

 State symmetry 3

 Number of electrons:     4    Spin symmetry=Triplet   Space symmetry=7
 Number of states:        1
 Number of CSFs:          1   (1 determinants, 3 intermediate states)

 Iteration controls:
             1  2  3  4  5  6  7  8  9 10 11 12 13 14 15 16 17 18 19 20 21 22 23 24 25 26 27 28 29 30 31 32 33 34 35 36 37 38 39
 DIAGCI      T  T  T  T  T  T  T  T  T  T  T  T  T  T  T  T  T  T  T  T  T  T  T  T  T  T  T  T  T  T  T  T  T  T  T  T  T  T  T
 WERNER      T  T  T  T  T  T  T  T  T  T  T  T  T  T  T  T  T  T  T  T  T  T  T  T  T  T  T  T  T  T  T  T  T  T  T  T  T  T  T
 INTERNAL    F  T  T  T  T  T  T  T  T  T  T  T  T  T  T  T  T  T  T  T  T  T  T  T  T  T  T  T  T  T  T  T  T  T  T  T  T  T  T

 Molecular orbitals read from record     4202.2  Type=RHF/CANONICAL (state 1.7)
 *** IN SYMMETRY 1 ORBITAL  1 SYMMETRY CONTAMINATION OF 0.810D-02 HAS BEEN REMOVED

 EXTRA SYMMETRY OF MOS IN SYMMETRY 1:   1 1 2 3 1 2 3 1 4 5   6 2 3 4 5 6 1 2 3 9   8 710 4 5 6 1 2 3 9   8 710 4 5 6 2 3 1
 *** IN SYMMETRY 2 ORBITAL  1 SYMMETRY CONTAMINATION OF 0.103D-01 HAS BEEN REMOVED
 EXTRA SYMMETRY OF MOS IN SYMMETRY 2:   1 1 1 2 3 1 2 3 5 6   4 1 2 3 5 6 4 1 2 3   1 5 6 4 2 3
 *** IN SYMMETRY 3 ORBITAL  1 SYMMETRY CONTAMINATION OF 0.128D-01 HAS BEEN REMOVED
 EXTRA SYMMETRY OF MOS IN SYMMETRY 3:   1 1 1 2 3 1 2 3 4 5   6 1 2 3 4 5 6 1 2 3   1 4 5 6 2 3
 EXTRA SYMMETRY OF MOS IN SYMMETRY 4:   1 1 2 3 1 2 3 1 4 6   5 2 3 1 4 6 5 2 3 1
 *** IN SYMMETRY 5 ORBITAL  1 SYMMETRY CONTAMINATION OF 0.148D-01 HAS BEEN REMOVED
 EXTRA SYMMETRY OF MOS IN SYMMETRY 5:   1 1 1 2 3 1 2 3 6 5   4 1 2 3 6 5 4 1 2 3   1 6 5 4 2 3
 EXTRA SYMMETRY OF MOS IN SYMMETRY 6:   1 1 3 2 1 3 2 1 5 4   6 3 2 1 5 4 6 3 2 1
 EXTRA SYMMETRY OF MOS IN SYMMETRY 7:   1 1 2 3 1 2 3 1 6 5   4 2 3 1 6 5 4 2 3 1
 EXTRA SYMMETRY OF MOS IN SYMMETRY 8:   1 1 3 2 1 3 2 1 3 2   1

 Wavefunction dump at record             5202.2

 Convergence thresholds  0.10E-01 (gradient)  0.10E-05 (energy)  0.10E-02 (step length)

 Weight factors for state symmetry  1:    0.33333
 Weight factors for state symmetry  2:    0.33333
 Weight factors for state symmetry  3:    0.33333

 Number of orbital rotations:      113   (     0 Core/Active     38 Core/Virtual   0 Active/Active     75 Active/Virtual)
 Total number of variables:        116


 ITER. MIC  NCI  NEG     ENERGY(VAR)     ENERGY(PROJ)   ENERGY CHANGE     GRAD(0)  GRAD(ORB)   GRAD(CI)     STEP       TIME

   1   23   12    0     -15.68453112     -15.68677649   -0.00224537    0.05802439 0.00000000 0.00000000  0.47D-01      0.18
   2   15   12    0     -15.68678683     -15.68678698   -0.00000015    0.00058344 0.00000000 0.00000000  0.34D-03      0.37
   3   15   12    0     -15.68678698     -15.68678698   -0.00000000    0.00000006 0.00000000 0.00000000  0.28D-07      0.52

 ** WVFN ****  CONVERGENCE REACHED, FINAL GRADIENT:  0.92D-13



 Results for state 1.4
 =====================

 !MCSCF STATE 1.4 Energy              -15.686786980584
 Nuclear energy                         0.00000000
 Kinetic energy                        11.84298318
 One electron energy                  -26.32551465
 Two electron energy                   10.63872767
 Virial ratio                           2.32456381

 !MCSCF STATE 1.4 Dipole moment         0.00000000     0.00000000     0.00000000
 Dipole moment /Debye                   0.00000000     0.00000000     0.00000000



 Results for state 1.6
 =====================

 !MCSCF STATE 1.6 Energy              -15.686786980584
 Nuclear energy                         0.00000000
 Kinetic energy                        11.84298318
 One electron energy                  -26.32551465
 Two electron energy                   10.63872767
 Virial ratio                           2.32456381

 !MCSCF STATE 1.6 Dipole moment         0.00000000     0.00000000     0.00000000
 Dipole moment /Debye                   0.00000000     0.00000000     0.00000000



 Results for state 1.7
 =====================

 !MCSCF STATE 1.7 Energy              -15.686786980584
 Nuclear energy                         0.00000000
 Kinetic energy                        11.84298318
 One electron energy                  -26.32551465
 Two electron energy                   10.63872767
 Virial ratio                           2.32456381

 !MCSCF STATE 1.7 Dipole moment         0.00000000     0.00000000     0.00000000
 Dipole moment /Debye                   0.00000000     0.00000000     0.00000000

 State-averaged charge density matrix saved on record  5202.2 (density set 1)

 !MCSCF expec        <1.4|EKIN|1.4>    11.842983179242
 !MCSCF expec        <1.6|EKIN|1.6>    11.842983179242
 !MCSCF expec        <1.7|EKIN|1.7>    11.842983179242

 !MCSCF expec         <1.4|POT|1.4>    -6.542325321070
 !MCSCF expec         <1.6|POT|1.6>    -6.542325321070
 !MCSCF expec         <1.7|POT|1.7>    -6.542325321070


 NATURAL ORBITALS (state averaged)
 =================================

   Orb     Occ        Energy       Coefficients

                                   1 1s      1 1s      1 1s      1 1s      1 1s      1 1s      1 1s      1 3d0     1 3d2+    1 3d0  
                                   1 3d2+    1 3d0     1 3d2+    1 3d0     1 3d2+    1 3d0     1 3d2+    1 3d0     1 3d2+    1 5g0  
                                   1 5g4+    1 5g2+    1 5g0     1 5g4+    1 5g2+    1 5g0     1 5g4+    1 5g2+    1 5g0     1 5g4+ 
                                   1 5g2+    1 7i6+    1 7i4+    1 7i2+    1 7i0     1 7i6+    1 7i4+    1 7i2+    1 7i0  

   1.1  2.00000    -1.259081     0.996726  0.001888 -0.003904  0.006706 -0.003875  0.004417 -0.001796  0.000000  0.000000  0.000000
                                 0.000000  0.000000  0.000000  0.000000  0.000000  0.000000  0.000000  0.000000  0.000000  0.000000
                                 0.000000  0.000000  0.000000  0.000000  0.000000  0.000000  0.000000  0.000000  0.000000  0.000000
                                 0.000000  0.000000  0.000000  0.000000  0.000000  0.000000  0.000000  0.000000  0.000000

                                   1 2px     1 2px     1 2px     1 2px     1 2px     1 2px     1 2px     1 4f1+    1 4f3+    1 4f1+ 
                                   1 4f3+    1 4f1+    1 4f3+    1 4f1+    1 4f3+    1 4f1+    1 4f3+    1 6h1+    1 6h3+    1 6h5+ 
                                   1 6h1+    1 6h3+    1 6h5+    1 6h1+    1 6h3+    1 6h5+ 

   1.2  1.33333    -0.369895     1.017140 -0.002007 -0.024303 -0.012200  0.005289  0.002390  0.000074  0.000000  0.000000  0.000000
                                 0.000000  0.000000  0.000000  0.000000  0.000000  0.000000  0.000000  0.000000  0.000000  0.000000
                                 0.000000  0.000000  0.000000  0.000000  0.000000  0.000000

                                   1 2py     1 2py     1 2py     1 2py     1 2py     1 2py     1 2py     1 4f1-    1 4f3-    1 4f1- 
                                   1 4f3-    1 4f1-    1 4f3-    1 4f1-    1 4f3-    1 4f1-    1 4f3-    1 6h1-    1 6h3-    1 6h5- 
                                   1 6h1-    1 6h3-    1 6h5-    1 6h1-    1 6h3-    1 6h5- 

   1.3  1.33333    -0.369895     1.017140 -0.002007 -0.024303 -0.012200  0.005289  0.002390  0.000074  0.000000  0.000000  0.000000
                                 0.000000  0.000000  0.000000  0.000000  0.000000  0.000000  0.000000  0.000000  0.000000  0.000000
                                 0.000000  0.000000  0.000000  0.000000  0.000000  0.000000

                                   1 2pz     1 2pz     1 2pz     1 2pz     1 2pz     1 2pz     1 2pz     1 4f0     1 4f2+    1 4f0  
                                   1 4f2+    1 4f0     1 4f2+    1 4f0     1 4f2+    1 4f0     1 4f2+    1 6h2+    1 6h4+    1 6h0  
                                   1 6h2+    1 6h4+    1 6h0     1 6h2+    1 6h4+    1 6h0  

   1.5  1.33333    -0.369895     1.017140 -0.002007 -0.024303 -0.012200  0.005289  0.002390  0.000074  0.000000  0.000000  0.000000
                                 0.000000  0.000000  0.000000  0.000000  0.000000  0.000000  0.000000  0.000000  0.000000  0.000000
                                 0.000000  0.000000  0.000000  0.000000  0.000000  0.000000
 

 EXTRA SYMMETRY OF MOS IN SYMMETRY 1:   1 1 3 2 1 3 2 1 6 5   4 3 2 6 4 5 1 3 2 8   910 7 6 4 5 1 3 2 8   910 7 6 4 5 2 3 1
 EXTRA SYMMETRY OF MOS IN SYMMETRY 2:   1 1 1 3 2 1 2 3 5 6   4 1 2 3 4 5 6 1 2 3   1 6 5 4 2 3
 EXTRA SYMMETRY OF MOS IN SYMMETRY 3:   1 1 1 3 2 1 2 3 5 6   4 1 2 3 4 5 6 1 2 3   1 6 5 4 2 3
 EXTRA SYMMETRY OF MOS IN SYMMETRY 4:   1 1 2 3 1 2 3 1 6 4   5 2 3 1 6 4 5 2 3 1
 EXTRA SYMMETRY OF MOS IN SYMMETRY 5:   1 1 1 3 2 1 2 3 4 5   6 1 2 3 4 5 6 1 2 3   1 4 6 5 2 3
 EXTRA SYMMETRY OF MOS IN SYMMETRY 6:   1 1 3 2 1 3 2 1 6 5   4 3 2 1 6 5 4 3 2 1
 EXTRA SYMMETRY OF MOS IN SYMMETRY 7:   1 1 3 2 1 3 2 1 6 5   4 3 2 1 6 5 4 3 2 1

 Natural orbital dump (state averaged) at molpro section  5202.2    (Orbital set 2)


 CI vector for state symmetry 1
 ==============================

 a a 2           1.0000000

 TOTAL ENERGIES                       -15.68678698

 CI vector for state symmetry 2
 ==============================

 a 2 a           1.0000000

 TOTAL ENERGIES                       -15.68678698

 CI vector for state symmetry 3
 ==============================

 2 a a           1.0000000

 TOTAL ENERGIES                       -15.68678698



 **********************************************************************************************************************************
 DATASETS  * FILE   NREC   LENGTH (MB)   RECORD NAMES
              1      21       98.53       500      610      700      900      950      970     1000      129      960     1100   
                                          VAR    BASINP    GEOM    SYMINP    ZMAT    AOBASIS   BASIS     P2S    ABASIS      S 
                                         1400     1410     1420     1200     1210     1080     1600     1650     1300     1700   
                                         EKIN       V       ECP      H0       H01     AOSYM     SMH    MOLCAS    ERIS     OPER   
                                         1380   
                                         JKOP   

              2       5        5.60       700     1000      520     4202     5202   
                                         GEOM     BASIS   MCVARS     RHF     MCSCF   

 PROGRAMS   *        TOTAL     MULTI       RHF       INT
 CPU TIMES  *        11.82      0.70      0.67     10.29
 REAL TIME  *        28.23 SEC
 DISK USED  *       305.22 MB      
 **********************************************************************************************************************************


 PROGRAM * RHF-SCF (OPEN SHELL)       Authors: W. Meyer, H.-J. Werner


 NUMBER OF ELECTRONS:       4+    2-    SPACE SYMMETRY=7    SPIN SYMMETRY: Triplet 
 CONVERGENCE THRESHOLDS:    1.00E-05 (Density)    1.00E-07 (Energy)
 MAX. NUMBER OF ITERATIONS:        0
 INTERPOLATION TYPE:            DIIS
 INTERPOLATION STEPS:              2 (START)      1 (STEP)
 LEVEL SHIFTS:                 -0.60 (CLOSED) -0.30 (OPEN) 


 Singly occupied orbitals:      1.3       1.5
 Molecular orbitals read from record     5202.2  Type=MCSCF/NATURAL (state averaged)

 Molecular orbital dump at record        2101.2

 ITERATION    DDIFF          GRAD             ENERGY        2-EL.EN.            DIPOLE MOMENTS         DIIS   ORB.
    1      0.000D+00      0.000D+00       -15.68678698     21.277455    0.00000    0.00000    0.00000    0    start

 Final alpha occupancy:   1   1   1   0   1   0   0   0
 Final beta  occupancy:   1   1   0   0   0   0   0   0

 !RHF STATE 1.7 Energy                -15.686786980584
 Nuclear energy                         0.00000000
 One-electron energy                  -26.32551465
 Two-electron energy                   10.63872767
 Virial quotient                       -1.32456381
 !RHF STATE 1.7 Dipole moment           0.00000000     0.00000000     0.00000000
 Dipole moment /Debye                   0.00000000     0.00000000     0.00000000
 

 !RHF expec          <1.7|EKIN|1.7>    11.842983179242
 
 !RHF expec           <1.7|POT|1.7>    -6.542325321070

 ELECTRON ORBITALS
 =================


   Orb  Occ    Energy  Couls-En    Coefficients

                                   1 1s      1 1s      1 1s      1 1s      1 1s      1 1s      1 1s      1 3d0     1 3d2+    1 3d0  
                                   1 3d2+    1 3d0     1 3d2+    1 3d0     1 3d2+    1 3d0     1 3d2+    1 3d0     1 3d2+    1 5g0  
                                   1 5g4+    1 5g2+    1 5g0     1 5g4+    1 5g2+    1 5g0     1 5g4+    1 5g2+    1 5g0     1 5g4+ 
                                   1 5g2+    1 7i6+    1 7i4+    1 7i2+    1 7i0     1 7i6+    1 7i4+    1 7i2+    1 7i0  

   1.1   2    -1.2591   -6.0744  0.996726  0.001888 -0.003904  0.006706 -0.003875  0.004417 -0.001796  0.000000  0.000000  0.000000
                                 0.000000  0.000000  0.000000  0.000000  0.000000  0.000000  0.000000  0.000000  0.000000  0.000000
                                 0.000000  0.000000  0.000000  0.000000  0.000000  0.000000  0.000000  0.000000  0.000000  0.000000
                                 0.000000  0.000000  0.000000  0.000000  0.000000  0.000000  0.000000  0.000000  0.000000

                                   1 2px     1 2px     1 2px     1 2px     1 2px     1 2px     1 2px     1 4f1+    1 4f3+    1 4f1+ 
                                   1 4f3+    1 4f1+    1 4f3+    1 4f1+    1 4f3+    1 4f1+    1 4f3+    1 6h1+    1 6h3+    1 6h5+ 
                                   1 6h1+    1 6h3+    1 6h5+    1 6h1+    1 6h3+    1 6h5+ 

   1.2   2    -0.3699   -4.5436  1.017140 -0.002007 -0.024303 -0.012200  0.005289  0.002390  0.000074  0.000000  0.000000  0.000000
                                 0.000000  0.000000  0.000000  0.000000  0.000000  0.000000  0.000000  0.000000  0.000000  0.000000
                                 0.000000  0.000000  0.000000  0.000000  0.000000  0.000000

                                   1 2py     1 2py     1 2py     1 2py     1 2py     1 2py     1 2py     1 4f1-    1 4f3-    1 4f1- 
                                   1 4f3-    1 4f1-    1 4f3-    1 4f1-    1 4f3-    1 4f1-    1 4f3-    1 6h1-    1 6h3-    1 6h5- 
                                   1 6h1-    1 6h3-    1 6h5-    1 6h1-    1 6h3-    1 6h5- 

   1.3   +    -0.3699   -4.5436  1.017140 -0.002007 -0.024303 -0.012200  0.005289  0.002390  0.000074  0.000000  0.000000  0.000000
                                 0.000000  0.000000  0.000000  0.000000  0.000000  0.000000  0.000000  0.000000  0.000000  0.000000
                                 0.000000  0.000000  0.000000  0.000000  0.000000  0.000000

                                   1 2pz     1 2pz     1 2pz     1 2pz     1 2pz     1 2pz     1 2pz     1 4f0     1 4f2+    1 4f0  
                                   1 4f2+    1 4f0     1 4f2+    1 4f0     1 4f2+    1 4f0     1 4f2+    1 6h2+    1 6h4+    1 6h0  
                                   1 6h2+    1 6h4+    1 6h0     1 6h2+    1 6h4+    1 6h0  

   1.5   +    -0.3699   -4.5436  1.017140 -0.002007 -0.024303 -0.012200  0.005289  0.002390  0.000074  0.000000  0.000000  0.000000
                                 0.000000  0.000000  0.000000  0.000000  0.000000  0.000000  0.000000  0.000000  0.000000  0.000000
                                 0.000000  0.000000  0.000000  0.000000  0.000000  0.000000

 HOMO      1.2    -0.369895 =     -10.0654eV
 LUMO      2.1     0.101051 =       2.7497eV
 LUMO-HOMO         0.470946 =      12.8151eV


 **********************************************************************************************************************************
 DATASETS  * FILE   NREC   LENGTH (MB)   RECORD NAMES
              1      21       98.53       500      610      700      900      950      970     1000      129      960     1100   
                                          VAR    BASINP    GEOM    SYMINP    ZMAT    AOBASIS   BASIS     P2S    ABASIS      S 
                                         1400     1410     1420     1200     1210     1080     1600     1650     1300     1700   
                                         EKIN       V       ECP      H0       H01     AOSYM     SMH    MOLCAS    ERIS     OPER   
                                         1380   
                                         JKOP   

              2       6        8.31       700     1000      520     4202     5202     2101   
                                         GEOM     BASIS   MCVARS     RHF     MCSCF     RHF  

 PROGRAMS   *        TOTAL       RHF     MULTI       RHF       INT
 CPU TIMES  *        11.90      0.08      0.70      0.67     10.29
 REAL TIME  *        28.45 SEC
 DISK USED  *       305.22 MB      
 **********************************************************************************************************************************
 SETTING SCF(I)         =       -15.68678698  AU                              
 SETTING _CC_NORM_MAX   =         2.00000000                                  


 PROGRAM * UHF-SCF       Authors: W. Meyer, H.-J. Werner


 NUMBER OF ELECTRONS:       4+    2-    SPACE SYMMETRY=7    SPIN SYMMETRY: Triplet 
 CONVERGENCE THRESHOLDS:    1.00E-05 (Density)    1.00E-07 (Energy)
 MAX. NUMBER OF ITERATIONS:        0
 INTERPOLATION TYPE:            DIIS
 INTERPOLATION STEPS:              2 (START)      1 (STEP)
 LEVEL SHIFTS:                  0.20 (ALPHA)   0.20 (BETA) 



 Molecular orbitals read from record     2101.2  Type=RHF/CANONICAL (state 1.7)

 Molecular orbital dump at record        2200.2

 Initial alpha occupation   1   1   1   0   1   0   0   0
 Initial beta  occupation   1   1   0   0   0   0   0   0

 ITERATION    DDIFF          GRAD             ENERGY        2-EL.EN.            DIPOLE MOMENTS         DIIS
    1      0.000D+00      0.000D+00       -15.68678698     21.277455    0.00000    0.00000    0.00000    0
 
 Final alpha occupancy:   1   1   1   0   1   0   0   0
 Final beta  occupancy:   1   1   0   0   0   0   0   0

 !UHF STATE 1.7 Energy                -15.686786980584
 Nuclear energy                         0.00000000
 One-electron energy                  -26.32551465
 Two-electron energy                   10.63872767
 Virial quotient                       -1.32456381
 !UHF STATE 1.7 Dipole moment           0.00000000     0.00000000     0.00000000
 Dipole moment /Debye                   0.00000000     0.00000000     0.00000000
 

 !UHF expec          <1.7|EKIN|1.7>    11.842983179242
 
 !UHF expec           <1.7|POT|1.7>    -6.542325321070

 ELECTRON ORBITALS FOR POSITIVE SPIN
 ===================================


   Orb  Occ    Energy  Couls-En    Coefficients

                                   1 1s      1 1s      1 1s      1 1s      1 1s      1 1s      1 1s      1 3d0     1 3d2+    1 3d0  
                                   1 3d2+    1 3d0     1 3d2+    1 3d0     1 3d2+    1 3d0     1 3d2+    1 3d0     1 3d2+    1 5g0  
                                   1 5g4+    1 5g2+    1 5g0     1 5g4+    1 5g2+    1 5g0     1 5g4+    1 5g2+    1 5g0     1 5g4+ 
                                   1 5g2+    1 7i6+    1 7i4+    1 7i2+    1 7i0     1 7i6+    1 7i4+    1 7i2+    1 7i0  

   1.1   +    -1.2591   -6.0744  0.996726  0.001888 -0.003904  0.006706 -0.003875  0.004417 -0.001796  0.000000  0.000000  0.000000
                                 0.000000  0.000000  0.000000  0.000000  0.000000  0.000000  0.000000  0.000000  0.000000  0.000000
                                 0.000000  0.000000  0.000000  0.000000  0.000000  0.000000  0.000000  0.000000  0.000000  0.000000
                                 0.000000  0.000000  0.000000  0.000000  0.000000  0.000000  0.000000  0.000000  0.000000

                                   1 2px     1 2px     1 2px     1 2px     1 2px     1 2px     1 2px     1 4f1+    1 4f3+    1 4f1+ 
                                   1 4f3+    1 4f1+    1 4f3+    1 4f1+    1 4f3+    1 4f1+    1 4f3+    1 6h1+    1 6h3+    1 6h5+ 
                                   1 6h1+    1 6h3+    1 6h5+    1 6h1+    1 6h3+    1 6h5+ 

   1.2   +    -0.3699   -4.5436  1.017140 -0.002007 -0.024303 -0.012200  0.005289  0.002390  0.000074  0.000000  0.000000  0.000000
                                 0.000000  0.000000  0.000000  0.000000  0.000000  0.000000  0.000000  0.000000  0.000000  0.000000
                                 0.000000  0.000000  0.000000  0.000000  0.000000  0.000000

                                   1 2py     1 2py     1 2py     1 2py     1 2py     1 2py     1 2py     1 4f1-    1 4f3-    1 4f1- 
                                   1 4f3-    1 4f1-    1 4f3-    1 4f1-    1 4f3-    1 4f1-    1 4f3-    1 6h1-    1 6h3-    1 6h5- 
                                   1 6h1-    1 6h3-    1 6h5-    1 6h1-    1 6h3-    1 6h5- 

   1.3   +    -0.3699   -4.5436  1.017140 -0.002007 -0.024303 -0.012200  0.005289  0.002390  0.000074  0.000000  0.000000  0.000000
                                 0.000000  0.000000  0.000000  0.000000  0.000000  0.000000  0.000000  0.000000  0.000000  0.000000
                                 0.000000  0.000000  0.000000  0.000000  0.000000  0.000000

                                   1 2pz     1 2pz     1 2pz     1 2pz     1 2pz     1 2pz     1 2pz     1 4f0     1 4f2+    1 4f0  
                                   1 4f2+    1 4f0     1 4f2+    1 4f0     1 4f2+    1 4f0     1 4f2+    1 6h2+    1 6h4+    1 6h0  
                                   1 6h2+    1 6h4+    1 6h0     1 6h2+    1 6h4+    1 6h0  

   1.5   +    -0.3699   -4.5436  1.017140 -0.002007 -0.024303 -0.012200  0.005289  0.002390  0.000074  0.000000  0.000000  0.000000
                                 0.000000  0.000000  0.000000  0.000000  0.000000  0.000000  0.000000  0.000000  0.000000  0.000000
                                 0.000000  0.000000  0.000000  0.000000  0.000000  0.000000

 ELECTRON ORBITALS FOR NEGATIVE SPIN
 ===================================


   Orb  Occ    Energy  Couls-En    Coefficients

                                   1 1s      1 1s      1 1s      1 1s      1 1s      1 1s      1 1s      1 3d0     1 3d2+    1 3d0  
                                   1 3d2+    1 3d0     1 3d2+    1 3d0     1 3d2+    1 3d0     1 3d2+    1 3d0     1 3d2+    1 5g0  
                                   1 5g4+    1 5g2+    1 5g0     1 5g4+    1 5g2+    1 5g0     1 5g4+    1 5g2+    1 5g0     1 5g4+ 
                                   1 5g2+    1 7i6+    1 7i4+    1 7i2+    1 7i0     1 7i6+    1 7i4+    1 7i2+    1 7i0  

   1.1   -    -1.2591   -6.0744  0.996726  0.001888 -0.003904  0.006706 -0.003875  0.004417 -0.001796  0.000000  0.000000  0.000000
                                 0.000000  0.000000  0.000000  0.000000  0.000000  0.000000  0.000000  0.000000  0.000000  0.000000
                                 0.000000  0.000000  0.000000  0.000000  0.000000  0.000000  0.000000  0.000000  0.000000  0.000000
                                 0.000000  0.000000  0.000000  0.000000  0.000000  0.000000  0.000000  0.000000  0.000000

                                   1 2px     1 2px     1 2px     1 2px     1 2px     1 2px     1 2px     1 4f1+    1 4f3+    1 4f1+ 
                                   1 4f3+    1 4f1+    1 4f3+    1 4f1+    1 4f3+    1 4f1+    1 4f3+    1 6h1+    1 6h3+    1 6h5+ 
                                   1 6h1+    1 6h3+    1 6h5+    1 6h1+    1 6h3+    1 6h5+ 

   1.2   -    -0.3699   -4.5436  1.017140 -0.002007 -0.024303 -0.012200  0.005289  0.002390  0.000074  0.000000  0.000000  0.000000
                                 0.000000  0.000000  0.000000  0.000000  0.000000  0.000000  0.000000  0.000000  0.000000  0.000000
                                 0.000000  0.000000  0.000000  0.000000  0.000000  0.000000

 HOMO      1.2    -0.369895 =     -10.0654eV
 LUMO     -1.3    -0.369895 =     -10.0654eV
 LUMO-HOMO         0.000000 =       0.0000eV

 EXPECTATION VALUE OF S**2:             2.00000000

 Occupation number threshold for canonical orbitals:  1.999000 (occupied),  0.001000 (virtual)

 Number of pseudo-canonical orbitals per symmetry:    1   1   0   0   0   0   0   0
 Number of active natural orbitals per symmetry:      0   0   1   0   1   0   0   0

 NATURAL CHARGE ORBITALS
 =======================


   Orb     Occ        Energy       Coefficients

                                   1 1s      1 1s      1 1s      1 1s      1 1s      1 1s      1 1s      1 3d0     1 3d2+    1 3d0  
                                   1 3d2+    1 3d0     1 3d2+    1 3d0     1 3d2+    1 3d0     1 3d2+    1 3d0     1 3d2+    1 5g0  
                                   1 5g4+    1 5g2+    1 5g0     1 5g4+    1 5g2+    1 5g0     1 5g4+    1 5g2+    1 5g0     1 5g4+ 
                                   1 5g2+    1 7i6+    1 7i4+    1 7i2+    1 7i0     1 7i6+    1 7i4+    1 7i2+    1 7i0  

   1.1  2.00000    -1.259081     0.996726  0.001888 -0.003904  0.006706 -0.003875  0.004417 -0.001796  0.000000  0.000000  0.000000
                                 0.000000  0.000000  0.000000  0.000000  0.000000  0.000000  0.000000  0.000000  0.000000  0.000000
                                 0.000000  0.000000  0.000000  0.000000  0.000000  0.000000  0.000000  0.000000  0.000000  0.000000
                                 0.000000  0.000000  0.000000  0.000000  0.000000  0.000000  0.000000  0.000000  0.000000

                                   1 2px     1 2px     1 2px     1 2px     1 2px     1 2px     1 2px     1 4f1+    1 4f3+    1 4f1+ 
                                   1 4f3+    1 4f1+    1 4f3+    1 4f1+    1 4f3+    1 4f1+    1 4f3+    1 6h1+    1 6h3+    1 6h5+ 
                                   1 6h1+    1 6h3+    1 6h5+    1 6h1+    1 6h3+    1 6h5+ 

   1.2  2.00000    -0.369895     1.017140 -0.002007 -0.024303 -0.012200  0.005289  0.002390  0.000074  0.000000  0.000000  0.000000
                                 0.000000  0.000000  0.000000  0.000000  0.000000  0.000000  0.000000  0.000000  0.000000  0.000000
                                 0.000000  0.000000  0.000000  0.000000  0.000000  0.000000

                                   1 2py     1 2py     1 2py     1 2py     1 2py     1 2py     1 2py     1 4f1-    1 4f3-    1 4f1- 
                                   1 4f3-    1 4f1-    1 4f3-    1 4f1-    1 4f3-    1 4f1-    1 4f3-    1 6h1-    1 6h3-    1 6h5- 
                                   1 6h1-    1 6h3-    1 6h5-    1 6h1-    1 6h3-    1 6h5- 

   1.3  1.00000    -0.268915     1.017140 -0.002007 -0.024303 -0.012200  0.005289  0.002390  0.000074  0.000000  0.000000  0.000000
                                 0.000000  0.000000  0.000000  0.000000  0.000000  0.000000  0.000000  0.000000  0.000000  0.000000
                                 0.000000  0.000000  0.000000  0.000000  0.000000  0.000000

                                   1 2pz     1 2pz     1 2pz     1 2pz     1 2pz     1 2pz     1 2pz     1 4f0     1 4f2+    1 4f0  
                                   1 4f2+    1 4f0     1 4f2+    1 4f0     1 4f2+    1 4f0     1 4f2+    1 6h2+    1 6h4+    1 6h0  
                                   1 6h2+    1 6h4+    1 6h0     1 6h2+    1 6h4+    1 6h0  

   1.5  1.00000    -0.268915     1.017140 -0.002007 -0.024303 -0.012200  0.005289  0.002390  0.000074  0.000000  0.000000  0.000000
                                 0.000000  0.000000  0.000000  0.000000  0.000000  0.000000  0.000000  0.000000  0.000000  0.000000
                                 0.000000  0.000000  0.000000  0.000000  0.000000  0.000000

 Natural orbitals saved to record    2200.2 (Orbital set 3)

 Orbital spaces for UNO-CAS (Min. occupation: 0.020  Max. occupation: 1.980):

 Closed:        1   1   0   0   0   0   0   0
 Active:        0   0   1   0   1   0   0   0

 No convergence



 **********************************************************************************************************************************
 DATASETS  * FILE   NREC   LENGTH (MB)   RECORD NAMES
              1      21       98.53       500      610      700      900      950      970     1000      129      960     1100   
                                          VAR    BASINP    GEOM    SYMINP    ZMAT    AOBASIS   BASIS     P2S    ABASIS      S 
                                         1400     1410     1420     1200     1210     1080     1600     1650     1300     1700   
                                         EKIN       V       ECP      H0       H01     AOSYM     SMH    MOLCAS    ERIS     OPER   
                                         1380   
                                         JKOP   

              2       7       11.08       700     1000      520     4202     5202     2101     2200   
                                         GEOM     BASIS   MCVARS     RHF     MCSCF     RHF      UHF  

 PROGRAMS   *        TOTAL       UHF       RHF     MULTI       RHF       INT
 CPU TIMES  *        12.00      0.09      0.08      0.70      0.67     10.29
 REAL TIME  *        28.74 SEC
 DISK USED  *       305.22 MB      
 **********************************************************************************************************************************
 SETTING SCF(I)         =       -15.68678698  AU                              


 PROGRAM * MRCC (General Multireference Coupled Cluster)    Author: M. Kallay, 2000-2005

 ***  Initialisation ***

   0 Spin projections
 
 Molecular orbitals read from record     2200.2  Type=UHF/ALPHA (state 1.7)

 ?Warning: UHF not converged
 Molecular orbitals read from record     2200.2  Type=UHF/BETA (state 1.7)

 ?Warning: UHF not converged
 
 Frozen orbitals:              0 (  0  0  0  0  0  0  0  0)
 Active orbitals:            188 ( 39 26 26 20 26 20 20 11)
 Active electrons:             6
 Spin quantum number:          1.0

 Transformed integrals will be written to file mrcc_51364/fort.55

 Load integrals               12.0 sec
 Transform integrals          25.3 sec
 Storage for integrals:      119071012
 Remaining memory:           *********

 Core energy:               0.00000000
 
 MRCC Input:
     4     0     0     0     3     0     0     7     0     0     0     1     1     0     0     7     0     0   0.000     0   64000
  ex.lev,nsing,ntrip, rest,method,dens,conver,symm, diag, CS ,spatial, HF, ndoub,nacto,nactv, tol, maxex, sacc, freq,  dboc,   mem
  2  0  0  0  0  0  0  0  0  0  0  0  0  0  0  0  0  0  0  0  0  0  0  0  0  0  0  0  0  0  0  0  0  0  0  0  0  0  0  2  0  0  0  0  0  0  0  0  0  0  0  0  0  0  0  0  0  0  0  0  0  0  0  0  0  1  0  0  0  0  0  0  0  0  0  0  0  0  0  0  0  0  0  0  0  0  0  0  0  0  0  0  0  0  0  0  0  0  0  0  0  0  0  0  0  0  0  0  0  0  0  1  0  0  0  0  0  0  0  0  0  0  0  0  0  0  0  0  0  0  0  0  0  0  0  0  0  0  0  0  0  0  0  0  0  0  0  0  0  0  0  0  0  0  0  0  0  0  0  0  0  0  0  0  0  0  0  0  0  0  0  0  0  0  0  0  0  0  0  0  0  0  0  0  0  0  0  0
 MRCC Input end
 Variable memory released
 MRCC now being run, temporary output in /global/cscratch1/sd/aannabe/mrcc_51364/mrcc.out
 **********************************************************************
                          MRCC program system
 **********************************************************************

                              Written by
  Mihaly Kallay, Zoltan Rolik, Jozsef Csontos, Peter Nagy, Gyula Samu,
      David Mester, Jozsef Csoka, Bernat Szabo, Istvan Ladjanszki,
       Lorant Szegedy, Bence Ladoczki, Klara Petrov, Mate Farkas,
                    Pal D. Mezei, and Bence Hegely

        Department of Physical Chemistry and Materials Science
            Budapest University of Technology and Economics
                  Budapest P.O.Box 91, H-1521 Hungary

                              www.mrcc.hu

                       Release date: May 23, 2018

 ************************ 2018-10-30 20:08:01 *************************
 Executing goldstone...

 Generation of CC equations in terms of H and T...
 Generation of antisymmetrized Goldstone diagrams...
 Number of diagrams in T^1 equations:    15
 Number of diagrams in T^2 equations:    38
 Number of diagrams in T^3 equations:    49
 Number of diagrams in T^4 equations:     5
 Translation of diagrams to factorized equations...
 Optimizing intermediate calculation...
 Number of floating-point operations per iteration step:   3.9954E+12
 Probable CPU time per iteration step (hours):     39.95
 Required memory (Mbytes):  152519.1
 Number of intermediates:                                  79
 Number of intermediates to be stored:                     32
 Length of intermediate file (Mbytes):    2454.7

 ************************ 2018-10-30 20:08:01 *************************
 Executing xmrcc...

 **********************************************************************
 CC(3)(4) calculation


 Allocation of****** Mbytes of memory...
 Number of spinorbitals:                   376
 Number of alpha electrons:                        4
 Number of beta electrons:                         2
 Spin multiplicity:                     2
 z-component of spin:  1.0
 Spatial symmetry:                      7
 Convergence criterion:  1.0E-07
 Construction of occupation graphs...
 Number of                     0 -fold excitations:                      1
 Number of                     1 -fold excitations:                    176
 Number of                     2 -fold excitations:                  50148
 Number of                     3 -fold excitations:                6791476
 Total number of configurations:                6841801
 Calculation of coupling coefficients...
 Length of intermediate file (Mbytes):    1850.1

 ======================================================================

 Spin case  1   Alpha:  2   Beta:  2
 Number of excitations:              217249194
 Spin case  2   Alpha:  3   Beta:  1
 Number of excitations:              189896528
 Spin case  3   Alpha:  4   Beta:  0
 Number of excitations:                5778276
 Number of                     4 -fold excitations:              412923998

 Memory requirements /Mbyte/:
               Minimal        Optimal
 Real*8:       3948.7500      9531.1702
 Integer:       261.7832
 Total:        4210.5332      9792.9534


 ************************ 2018-10-30 20:08:59 *************************
 Executing mrcc...

 **********************************************************************
 CCSDT(Q) calculation


 Allocation of 9531.2 Mbytes of memory...
 Number of spinorbitals: 376
 Number of alpha electrons:  4
 Number of beta  electrons:  2
 Spin multiplicity: 2
 z-component of spin:  1.0
 Spatial symmetry: 7
 Convergence criterion:  1.0E-07
 Construction of occupation graphs...
 Number of 0-fold excitations: 1
 Number of 1-fold excitations: 176
 Number of 2-fold excitations: 50148
 Number of 3-fold excitations: 6791476
 Total number of determinants: 6841801
 Calculation of coupling coefficients...
 Initial cluster amplitudes are generated.
 Length of intermediate file (Mbytes):    1850.1
 Reading integral list from unit 55...
 Sorting integrals...
 Sorting integrals...
 Sorting integrals...
 Sorting integrals...
 Energy of reference determinant [au]:     -15.686786980584
 Calculation of MP denominators...

 Starting CC iteration...
 ======================================================================
 Norm of residual vector:     1.25607205
 CPU time [min]:     9.696                   Wall time [min]:     9.799

 Iteration  1  CC energy:   -15.86308748  Energy decrease:   0.17630050
 ======================================================================
 Norm of residual vector:     0.25626312
 CPU time [min]:    14.389                   Wall time [min]:    14.614

 Iteration  2  CC energy:   -15.87428148  Energy decrease:   0.01119400
 ======================================================================
 Norm of residual vector:     0.05276025
 CPU time [min]:    20.346                   Wall time [min]:    20.602

 Iteration  3  CC energy:   -15.88156356  Energy decrease:   0.00728208
 ======================================================================
 Norm of residual vector:     0.01552929
 CPU time [min]:    25.365                   Wall time [min]:    25.625

 Iteration  4  CC energy:   -15.88227474  Energy decrease:   0.00071118
 ======================================================================
 Norm of residual vector:     0.00740235
 CPU time [min]:    30.833                   Wall time [min]:    31.238

 Iteration  5  CC energy:   -15.88193111  Energy decrease:   0.00034363
 ======================================================================
 Norm of residual vector:     0.00336724
 CPU time [min]:    36.078                   Wall time [min]:    36.486

 Iteration  6  CC energy:   -15.88194755  Energy decrease:   0.00001644
 ======================================================================
 Norm of residual vector:     0.00163258
 CPU time [min]:    41.470                   Wall time [min]:    42.049

 Iteration  7  CC energy:   -15.88199533  Energy decrease:   0.00004778
 ======================================================================
 Norm of residual vector:     0.00077859
 CPU time [min]:    47.154                   Wall time [min]:    47.735

 Iteration  8  CC energy:   -15.88199993  Energy decrease:   0.00000460
 ======================================================================
 Norm of residual vector:     0.00031935
 CPU time [min]:    52.388                   Wall time [min]:    53.113

 Iteration  9  CC energy:   -15.88200060  Energy decrease:   0.00000067
 ======================================================================
 Norm of residual vector:     0.00013150
 CPU time [min]:    58.177                   Wall time [min]:    58.976

 Iteration 10  CC energy:   -15.88200207  Energy decrease:   0.00000146
 ======================================================================
 Norm of residual vector:     0.00005695
 CPU time [min]:    63.630                   Wall time [min]:    64.577

 Iteration 11  CC energy:   -15.88200190  Energy decrease:   0.00000017
 ======================================================================
 Norm of residual vector:     0.00002270
 CPU time [min]:    69.408                   Wall time [min]:    70.421

 Iteration 12  CC energy:   -15.88200160  Energy decrease:   0.00000030
 ======================================================================
 Norm of residual vector:     0.00000949
 CPU time [min]:    74.217                   Wall time [min]:    75.364

 Iteration 13  CC energy:   -15.88200162  Energy decrease:   0.00000003
 ======================================================================
 Norm of residual vector:     0.00000319
 CPU time [min]:    80.050                   Wall time [min]:    81.262

 Iteration 14  CC energy:   -15.88200165  Energy decrease:   0.00000003
 ======================================================================
 Norm of residual vector:     0.00000106
 CPU time [min]:    85.389                   Wall time [min]:    86.615

 Iteration 15  CC energy:   -15.88200163  Energy decrease:   0.00000002
 ======================================================================
 Norm of residual vector:     0.00000036
 CPU time [min]:    90.986                   Wall time [min]:    92.345

 Iteration 16  CC energy:   -15.88200162  Energy decrease:   0.00000001
 ======================================================================
 Norm of residual vector:     0.00000012
 CPU time [min]:    96.525                   Wall time [min]:    97.887

 Iteration 17  CC energy:   -15.88200163  Energy decrease:   2.2464E-09
 ======================================================================
 Norm of residual vector:     0.00000004
 CPU time [min]:   101.668                   Wall time [min]:   103.090

 Iteration 18  CC energy:   -15.88200163  Energy decrease:   5.2063E-10
 ======================================================================

 Iteration has converged in 18 steps.

 Final results:
 Total CCSDT energy [au]:            -15.882001625858
 Total MP2 energy [au]:              -15.863087484650

 Perturbative corrections are calculated...
 ======================================================================
 Spin case  1   Alpha:  2   Beta:  2
 Number of excitations:        217249194
 CPU time [min]:  1202.280                   Wall time [min]:  1203.826
 ======================================================================
 Spin case  2   Alpha:  3   Beta:  1
 Number of excitations:        189896528
 CPU time [min]:  2023.986                   Wall time [min]:  2025.574
 ======================================================================
 Spin case  3   Alpha:  4   Beta:  0
 Number of excitations:        5778276
 CPU time [min]:  2114.204                   Wall time [min]:  2115.838
 ======================================================================
 Number of 4-fold excitations: 412923998
 CPU time [min]:  2114.204                   Wall time [min]:  2115.849

 Total CCSDT[Q] energy [au]:         -15.881983215961
 Total CCSDT(Q) energy [au]:         -15.882083832933

 ************************ 2018-11-01 07:24:52 *************************
                      Normal termination of mrcc.
 **********************************************************************
 !CCSDT STATE 1.7 Energy              -15.882001625858
 !MP2 STATE 1.7 Energy                -15.863087484650
 !CCSDT[Q] STATE 1.7 Energy           -15.881983215961
 !CCSDT(Q) STATE 1.7 Energy           -15.882083832933
 
 CPU-time for MRCC:         126852.2 sec
 Elapsed-time for MRCC:     127025.0 sec

 Variable memory set to 8000000000 words,  buffer space   230000 words



 **********************************************************************************************************************************
 DATASETS  * FILE   NREC   LENGTH (MB)   RECORD NAMES
              1      21       98.53       500      610      700      900      950      970     1000      129      960     1100   
                                          VAR    BASINP    GEOM    SYMINP    ZMAT    AOBASIS   BASIS     P2S    ABASIS      S 
                                         1400     1410     1420     1200     1210     1080     1600     1650     1300     1700   
                                         EKIN       V       ECP      H0       H01     AOSYM     SMH    MOLCAS    ERIS     OPER   
                                         1380   
                                         JKOP   

              2       7       11.08       700     1000      520     4202     5202     2101     2200   
                                         GEOM     BASIS   MCVARS     RHF     MCSCF     RHF      UHF  

 PROGRAMS   *        TOTAL      MRCC       UHF       RHF     MULTI       RHF       INT
 CPU TIMES  *    127357.18 127345.18      0.09      0.08      0.70      0.67     10.29
 REAL TIME  *    129067.38 SEC
 DISK USED  *       305.22 MB      
 **********************************************************************************************************************************
 SETTING POSTHF(I)      =       -15.88208383  AU                              
                                                                                                                                                                                                                                                                

        SCF            POSTHF        EKIN          POT
    -15.68678698   -15.88208383   11.84298318   -6.54232532
                                                  

 CCSDT(Q)/USERDEF energy=    -15.882083832933

        CCSDT(Q)        MULTI           RHF-SCF 
    -15.88208383    -15.68678698    -15.68979202
 **********************************************************************************************************************************
 Variable memory released
