
 Primary working directories    : /global/cscratch1/sd/aannabe
 Secondary working directories  : /global/cscratch1/sd/aannabe
 Wavefunction directory         : /global/homes/a/aannabe/wfu/
 Main file repository           : /global/cscratch1/sd/aannabe/

 SHA1      : 2873118e99aab1bc19f5b6fc1784693c06d15c95
 NAME      : 2015.1.8
 ARCHNAME  : linux/x86_64
 FC        : /opt/cray/pe/craype/2.5.5/bin/ftn
 BLASLIB   : -Wl,-_start-group /opt/intel/compilers_and_libraries_2016.3.210/linux/mkl/lib/intel64/libmkl_intel_ilp64.a /opt/intel/compilers_and_libraries_2016.3.210/linux/mkl/lib/intel64/libmkl_intel_thread.a /opt/intel/compilers_and_libraries_2016.3.210/linux/mkl/lib/intel64/libmkl_core.a -Wl,-_end-group
 id        : lbl

 Nodes     nprocs
 nid00459     1

 Using customized tuning parameters: mindgm=8; mindgv=16; mindgc=4; mindgr=1; noblas=0; minvec=7
 default implementation of scratch files=df  

 ***,Si
 memory,8,g
 gthresh,twoint=1.e-12
 
 gprint,basis,orbitals
 gexpec,ekin,pot
 
 angstrom
 geometry={
 1                                                                               ! Number of atoms
 Si 0.0 0.0 0.0
 }
 
 basis={
 Including file /global/homes/a/aannabe/docs/totals/pps/Si.pp
 Including file /global/homes/a/aannabe/docs/totals/basis/aug-cc-pVnZ/Si_qz.basis
 }
 
 {hf
 wf,4,6,2
 occ,1,1,0,0,1,0,0,0
                                                                                 !open,1.2,1.5
 closed,1,0,0,0,0,0,0,0
                                                                                 !sym,
 }
 scf(i)=energy
 
 _CC_NORM_MAX=2.0
  !NOTE: Perturbative MRCC works only with UHF reference. So, here we will trick MRCC by doing zero UHF iteration right after ROHF.
 
 {uhf
 wf,4,6,2
 occ,1,1,0,0,1,0,0,0
                                                                                 !open,1.2,1.5
 closed,1,0,0,0,0,0,0,0
                                                                                 !sym,
 maxit,0
 }
 scf(i)=energy
 
 {mrcc,method=CCSDT(Q)
 orbital,ignore_error=1                                                          !Ignore the fact that UHF WF is not converged
 maxit,100
 core
 }
 posthf(i)=energy
 
 table,scf,posthf,ekin,pot
 save,4.csv,new
 
 

 Variables initialized (889), CPU time= 0.01 sec
 Commands  initialized (702), CPU time= 0.01 sec, 572 directives.
 Default parameters read. Elapsed time= 0.13 sec

 Checking input...
 Passed
1


                                         ***  PROGRAM SYSTEM MOLPRO  ***
                                       Copyright, TTI GmbH Stuttgart, 2015
                                    Version 2015.1 linked Sep  7 2016 23:09:38


 **********************************************************************************************************************************
 LABEL *   Si                                                                            
  64 bit serial version                                                                  DATE: 05-Oct-18          TIME: 10:58:48  
 **********************************************************************************************************************************

 SHA1:             2873118e99aab1bc19f5b6fc1784693c06d15c95
 **********************************************************************************************************************************

 THRESHOLDS:

 ZERO    =  1.00D-12  ONEINT  =  1.00D-12  TWOINT  =  1.00D-12  PREFAC  =  1.00D-14  LOCALI  =  1.00D-09  EORDER  =  1.00D-04
 ENERGY  =  0.00D+00  ETEST   =  0.00D+00  EDENS   =  0.00D+00  THRDEDEF=  1.00D-06  GRADIENT=  1.00D-02  STEP    =  1.00D-03
 ORBITAL =  1.00D-05  CIVEC   =  1.00D-05  COEFF   =  1.00D-04  PRINTCI =  5.00D-02  PUNCHCI =  9.90D+01  OPTGRAD =  3.00D-04
 OPTENERG=  1.00D-06  OPTSTEP =  3.00D-04  THRGRAD =  1.00D-10  COMPRESS=  1.00D-11  VARMIN  =  1.00D-07  VARMAX  =  1.00D-03
 THRDOUB =  0.00D+00  THRDIV  =  1.00D-05  THRRED  =  1.00D-07  THRPSP  =  1.00D+00  THRDC   =  1.00D-10  THRCS   =  1.00D-10
 THRNRM  =  1.00D-08  THREQ   =  0.00D+00  THRDE   =  1.00D+00  THRREF  =  1.00D-05  SPARFAC =  1.00D+00  THRDLP  =  1.00D-07
 THRDIA  =  1.00D-10  THRDLS  =  1.00D-07  THRGPS  =  0.00D+00  THRKEX  =  0.00D+00  THRDIS  =  2.00D-01  THRVAR  =  1.00D-10
 THRLOC  =  1.00D-06  THRGAP  =  1.00D-06  THRLOCT = -1.00D+00  THRGAPT = -1.00D+00  THRORB  =  1.00D-06  THRMLTP =  0.00D+00
 THRCPQCI=  1.00D-10  KEXTA   =  0.00D+00  THRCOARS=  0.00D+00  SYMTOL  =  1.00D-06  GRADTOL =  1.00D-06  THROVL  =  1.00D-08
 THRORTH =  1.00D-08  GRID    =  1.00D-06  GRIDMAX =  1.00D-03  DTMAX   =  0.00D+00  THROCCDE=  1.00D-01  THROCCDE=  1.00D-01



 ZUNIT=ANG
 

Geometry recognized as XYZ


 Variable memory set to 8000000000 words,  buffer space   230000 words

 SETTING BASIS          =    USERDEF


 Recomputing integrals since basis changed


 Using spherical harmonics



 PROGRAM * SEWARD (Integral evaluation for generally contracted gaussian basis sets)     Author: Roland Lindh, 1990

 Geometry written to block  1 of record 700

 Orientation using atomic masses  
 Molecule type: Atom
 Symmetry elements: X,Y,Z
 Rotational constants:       0.0000000      0.0000000      0.0000000 GHz  (calculated with average atomic masses)

 Point group  D2h 



 ATOMIC COORDINATES

 NR  ATOM    CHARGE       X              Y              Z

   1  SI      4.00    0.000000000    0.000000000    0.000000000


          SI  CORE POTENTIAL

          d POTENTIAL

 POWERS             1              3              2
 EXPONENTIALS   5.168316       8.861690       3.933474    
 COEFFICIENTS   4.000000       20.67326      -14.81817    

          s - d POTENTIAL

 POWERS             2              2
 EXPONENTIALS   9.447023       2.553812    
 COEFFICIENTS   14.83276       26.34966    

          p - d POTENTIAL

 POWERS             2              2
 EXPONENTIALS   3.660001       1.903653    
 COEFFICIENTS   7.621400       10.33158    


 BASIS DATA

   Nr Sym  Nuc  Type         Exponents   Contraction coefficients

    1.1 Ag    1  1s           9.998274     0.002894
                              5.517644    -0.014523
                              3.044965     0.077634
                              1.680393    -0.224022
                              0.927341    -0.149080
                              0.511762     0.085944
                              0.282421     0.355394
                              0.155857     0.445219
                              0.086011     0.267230
                              0.047466     0.060787
    2.1 Ag    1  1s           0.488504     1.000000
    3.1 Ag    1  1s           0.199457     1.000000
    4.1 Ag    1  1s           0.081439     1.000000
    5.1 Ag    1  1s           0.034983     1.000000
    6.1 Ag    1  3d0          0.997003     1.000000
    7.1 Ag    1  3d2+         0.997003     1.000000
    8.1 Ag    1  3d0          0.365942     1.000000
    9.1 Ag    1  3d2+         0.365942     1.000000
   10.1 Ag    1  3d0          0.134316     1.000000
   11.1 Ag    1  3d2+         0.134316     1.000000
   12.1 Ag    1  3d0          0.046497     1.000000
   13.1 Ag    1  3d2+         0.046497     1.000000
   14.1 Ag    1  5g0          0.459547     1.000000
   15.1 Ag    1  5g4+         0.459547     1.000000
   16.1 Ag    1  5g2+         0.459547     1.000000
   17.1 Ag    1  5g0          0.207380     1.000000
   18.1 Ag    1  5g4+         0.207380     1.000000
   19.1 Ag    1  5g2+         0.207380     1.000000
    1.2 B3u   1  2px          5.027868    -0.003242
                              2.867751     0.010649
                              1.635683    -0.049761
                              0.932947    -0.000017
                              0.532126     0.106060
                              0.303509     0.236202
                              0.173113     0.310665
                              0.098739     0.294696
                              0.056318     0.153898
                              0.032122     0.042337
    2.2 B3u   1  2px          1.225790     1.000000
    3.2 B3u   1  2px          0.501364     1.000000
    4.2 B3u   1  2px          0.205064     1.000000
    5.2 B3u   1  2px          0.025472     1.000000
    6.2 B3u   1  4f1+         0.549116     1.000000
    7.2 B3u   1  4f3+         0.549116     1.000000
    8.2 B3u   1  4f1+         0.214998     1.000000
    9.2 B3u   1  4f3+         0.214998     1.000000
   10.2 B3u   1  4f1+         0.086852     1.000000
   11.2 B3u   1  4f3+         0.086852     1.000000
    1.3 B2u   1  2py          5.027868    -0.003242
                              2.867751     0.010649
                              1.635683    -0.049761
                              0.932947    -0.000017
                              0.532126     0.106060
                              0.303509     0.236202
                              0.173113     0.310665
                              0.098739     0.294696
                              0.056318     0.153898
                              0.032122     0.042337
    2.3 B2u   1  2py          1.225790     1.000000
    3.3 B2u   1  2py          0.501364     1.000000
    4.3 B2u   1  2py          0.205064     1.000000
    5.3 B2u   1  2py          0.025472     1.000000
    6.3 B2u   1  4f1-         0.549116     1.000000
    7.3 B2u   1  4f3-         0.549116     1.000000
    8.3 B2u   1  4f1-         0.214998     1.000000
    9.3 B2u   1  4f3-         0.214998     1.000000
   10.3 B2u   1  4f1-         0.086852     1.000000
   11.3 B2u   1  4f3-         0.086852     1.000000
    1.4 B1g   1  3d2-         0.997003     1.000000
    2.4 B1g   1  3d2-         0.365942     1.000000
    3.4 B1g   1  3d2-         0.134316     1.000000
    4.4 B1g   1  3d2-         0.046497     1.000000
    5.4 B1g   1  5g2-         0.459547     1.000000
    6.4 B1g   1  5g4-         0.459547     1.000000
    7.4 B1g   1  5g2-         0.207380     1.000000
    8.4 B1g   1  5g4-         0.207380     1.000000
    1.5 B1u   1  2pz          5.027868    -0.003242
                              2.867751     0.010649
                              1.635683    -0.049761
                              0.932947    -0.000017
                              0.532126     0.106060
                              0.303509     0.236202
                              0.173113     0.310665
                              0.098739     0.294696
                              0.056318     0.153898
                              0.032122     0.042337
    2.5 B1u   1  2pz          1.225790     1.000000
    3.5 B1u   1  2pz          0.501364     1.000000
    4.5 B1u   1  2pz          0.205064     1.000000
    5.5 B1u   1  2pz          0.025472     1.000000
    6.5 B1u   1  4f0          0.549116     1.000000
    7.5 B1u   1  4f2+         0.549116     1.000000
    8.5 B1u   1  4f0          0.214998     1.000000
    9.5 B1u   1  4f2+         0.214998     1.000000
   10.5 B1u   1  4f0          0.086852     1.000000
   11.5 B1u   1  4f2+         0.086852     1.000000
    1.6 B2g   1  3d1+         0.997003     1.000000
    2.6 B2g   1  3d1+         0.365942     1.000000
    3.6 B2g   1  3d1+         0.134316     1.000000
    4.6 B2g   1  3d1+         0.046497     1.000000
    5.6 B2g   1  5g1+         0.459547     1.000000
    6.6 B2g   1  5g3+         0.459547     1.000000
    7.6 B2g   1  5g1+         0.207380     1.000000
    8.6 B2g   1  5g3+         0.207380     1.000000
    1.7 B3g   1  3d1-         0.997003     1.000000
    2.7 B3g   1  3d1-         0.365942     1.000000
    3.7 B3g   1  3d1-         0.134316     1.000000
    4.7 B3g   1  3d1-         0.046497     1.000000
    5.7 B3g   1  5g1-         0.459547     1.000000
    6.7 B3g   1  5g3-         0.459547     1.000000
    7.7 B3g   1  5g1-         0.207380     1.000000
    8.7 B3g   1  5g3-         0.207380     1.000000
    1.8 Au    1  4f2-         0.549116     1.000000
    2.8 Au    1  4f2-         0.214998     1.000000
    3.8 Au    1  4f2-         0.086852     1.000000

 NUCLEAR CHARGE:                    4
 NUMBER OF PRIMITIVE AOS:         140
 NUMBER OF SYMMETRY AOS:          115
 NUMBER OF CONTRACTIONS:           79   (  19Ag  +  11B3u +  11B2u +   8B1g +  11B1u +   8B2g +   8B3g +   3Au  )
 NUMBER OF CORE ORBITALS:           0   (   0Ag  +   0B3u +   0B2u +   0B1g +   0B1u +   0B2g +   0B3g +   0Au  )
 NUMBER OF VALENCE ORBITALS:        4   (   1Ag  +   1B3u +   1B2u +   0B1g +   1B1u +   0B2g +   0B3g +   0Au  )


 NUCLEAR REPULSION ENERGY    0.00000000

 EXTRA SYMMETRY OF AOS IN SYMMETRY 1:   1 1 1 1 1 2 3 2 3 2   3 2 3 4 5 6 4 5 6
 EXTRA SYMMETRY OF AOS IN SYMMETRY 2:   1 1 1 1 1 2 3 2 3 2   3
 EXTRA SYMMETRY OF AOS IN SYMMETRY 3:   1 1 1 1 1 2 3 2 3 2   3
 EXTRA SYMMETRY OF AOS IN SYMMETRY 4:   1 1 1 1 2 3 2 3
 EXTRA SYMMETRY OF AOS IN SYMMETRY 5:   1 1 1 1 1 2 3 2 3 2   3
 EXTRA SYMMETRY OF AOS IN SYMMETRY 6:   1 1 1 1 2 3 2 3
 EXTRA SYMMETRY OF AOS IN SYMMETRY 7:   1 1 1 1 2 3 2 3

 Eigenvalues of metric

         1 0.362E-02 0.202E-01 0.122E+00 0.122E+00 0.178E+00 0.346E+00 0.346E+00 0.346E+00
         2 0.116E-01 0.850E-01 0.196E+00 0.196E+00 0.587E+00 0.816E+00 0.816E+00 0.116E+01
         3 0.116E-01 0.850E-01 0.196E+00 0.196E+00 0.587E+00 0.816E+00 0.816E+00 0.116E+01
         4 0.122E+00 0.346E+00 0.346E+00 0.448E+00 0.118E+01 0.165E+01 0.165E+01 0.225E+01
         5 0.116E-01 0.850E-01 0.196E+00 0.196E+00 0.587E+00 0.816E+00 0.816E+00 0.116E+01
         6 0.122E+00 0.346E+00 0.346E+00 0.448E+00 0.118E+01 0.165E+01 0.165E+01 0.225E+01
         7 0.122E+00 0.346E+00 0.346E+00 0.448E+00 0.118E+01 0.165E+01 0.165E+01 0.225E+01
         8 0.196E+00 0.816E+00 0.199E+01


 Contracted 2-electron integrals neglected if value below      1.0D-12
 AO integral compression algorithm  1   Integral accuracy      1.0D-12

     6.029 MB (compressed) written to integral file ( 61.9%)


 NUMBER OF SORTED TWO-ELECTRON INTEGRALS:     665704.     BUFFER LENGTH:  32768
 NUMBER OF SEGMENTS:   1  SEGMENT LENGTH:     665704      RECORD LENGTH: 524288

 Memory used in sort:       1.22 MW

 SORT1 READ     1222209. AND WROTE      500866. INTEGRALS IN      2 RECORDS. CPU TIME:     0.03 SEC, REAL TIME:     0.05 SEC
 SORT2 READ      500866. AND WROTE      665704. INTEGRALS IN     23 RECORDS. CPU TIME:     0.07 SEC, REAL TIME:     0.10 SEC

 FILE SIZES:   FILE 1:    25.3 MBYTE,  FILE 4:     8.4 MBYTE,   TOTAL:     33.7 MBYTE

 OPERATOR DM      FOR CENTER  0  COORDINATES:    0.000000    0.000000    0.000000
 OPERATOR EKIN    FOR CENTER  0  COORDINATES:    0.000000    0.000000    0.000000
 OPERATOR POT     FOR CENTER  0  COORDINATES:    0.000000    0.000000    0.000000


 **********************************************************************************************************************************
 DATASETS  * FILE   NREC   LENGTH (MB)   RECORD NAMES
              1      20       22.51       500      610      700      900      950      970     1000      129      960     1100   
                                          VAR    BASINP    GEOM    SYMINP    ZMAT    AOBASIS   BASIS     P2S    ABASIS      S 
                                         1400     1410     1420     1200     1210     1080     1600     1650     1300     1700   
                                         EKIN       V       ECP      H0       H01     AOSYM     SMH    MOLCAS    ERIS     OPER   

 PROGRAMS   *        TOTAL       INT
 CPU TIMES  *         2.31      2.19
 REAL TIME  *        12.63 SEC
 DISK USED  *        33.97 MB      
 **********************************************************************************************************************************


 PROGRAM * RHF-SCF (OPEN SHELL)       Authors: W. Meyer, H.-J. Werner


 NUMBER OF ELECTRONS:       3+    1-    SPACE SYMMETRY=6    SPIN SYMMETRY: Triplet 
 CONVERGENCE THRESHOLDS:    1.00E-05 (Density)    1.00E-07 (Energy)
 MAX. NUMBER OF ITERATIONS:       60
 INTERPOLATION TYPE:            DIIS
 INTERPOLATION STEPS:              2 (START)      1 (STEP)
 LEVEL SHIFTS:                 -0.60 (CLOSED) -0.30 (OPEN) 

 Number of closed-shell orbitals:    1 (   1   0   0   0   0   0   0   0 )
 Number of open-shell orbitals:      2 (   0   1   0   0   1   0   0   0 )



   Atom=SI basis=ECP10MWB_GUESS    lmin=0  lmax=1

 Orbital guess generated from atomic densities. Full valence occupancy:    1   1   1   0   1   0   0   0


 Molecular orbital dump at record        2100.2

 ITERATION    DDIFF          GRAD             ENERGY        2-EL.EN.            DIPOLE MOMENTS         DIIS   ORB.
    1      0.000D+00      0.000D+00        -3.66022358      3.768723    0.00000    0.00000    0.00000    0    start
    2      0.000D+00      0.610D-02        -3.66858610      3.880047    0.00000    0.00000    0.00000    1    diag,B
    3      0.117D-01      0.287D-02        -3.67188546      3.960785    0.00000    0.00000    0.00000    2    diag,B
    4      0.654D-02      0.122D-02        -3.67252999      3.989700    0.00000    0.00000    0.00000    3    diag,B
    5      0.382D-02      0.305D-03        -3.67255203      3.990107    0.00000    0.00000    0.00000    4    diag,B
    6      0.178D-02      0.471D-04        -3.67255256      3.990968    0.00000    0.00000    0.00000    5    diag,B
    7      0.101D-03      0.194D-04        -3.67255262      3.990759    0.00000    0.00000    0.00000    6    fixocc
    8      0.615D-04      0.391D-05        -3.67255262      3.990781    0.00000    0.00000    0.00000    7    diag,B
    9      0.220D-04      0.539D-06        -3.67255262      3.990780    0.00000    0.00000    0.00000    8    diag,B
   10      0.184D-05      0.653D-07        -3.67255262      3.990779    0.00000    0.00000    0.00000    0    orth

 Final alpha occupancy:   1   1   0   0   1   0   0   0
 Final beta  occupancy:   1   0   0   0   0   0   0   0

 !RHF STATE 1.6 Energy                 -3.672552621440
 Nuclear energy                         0.00000000
 One-electron energy                   -5.66794220
 Two-electron energy                    1.99538958
 Virial quotient                       -2.76358057
 !RHF STATE 1.6 Dipole moment           0.00000000     0.00000000     0.00000000
 Dipole moment /Debye                   0.00000000     0.00000000     0.00000000
 

 !RHF expec          <1.6|EKIN|1.6>     1.328911001615
 
 !RHF expec           <1.6|POT|1.6>    -1.912889045840

 ELECTRON ORBITALS
 =================


   Orb  Occ    Energy  Couls-En    Coefficients

                                   1 1s      1 1s      1 1s      1 1s      1 1s      1 3d0     1 3d2+    1 3d0     1 3d2+    1 3d0  
                                   1 3d2+    1 3d0     1 3d2+    1 5g0     1 5g4+    1 5g2+    1 5g0     1 5g4+    1 5g2+ 

   1.1   2    -0.5415   -2.1380  1.000022 -0.000064  0.000300 -0.000395  0.000106  0.000431  0.000747 -0.000755 -0.001308  0.003342
                                 0.005788  0.001428  0.002473  0.000001  0.000001  0.000001 -0.000033 -0.000065 -0.000049

                                   1 2px     1 2px     1 2px     1 2px     1 2px     1 4f1+    1 4f3+    1 4f1+    1 4f3+    1 4f1+ 
                                   1 4f3+ 

   1.2   +    -0.2971   -1.5346  1.000116  0.000014 -0.000030 -0.000138  0.000064 -0.000015 -0.000058 -0.000023 -0.000091  0.000029
                                 0.000113

                                   1 2pz     1 2pz     1 2pz     1 2pz     1 2pz     1 4f0     1 4f2+    1 4f0     1 4f2+    1 4f0  
                                   1 4f2+ 

   1.5   +    -0.2971   -1.5346  1.000116  0.000014 -0.000030 -0.000138  0.000064 -0.000037 -0.000048 -0.000058 -0.000074  0.000071
                                 0.000092

 HOMO      1.2    -0.297075 =      -8.0838eV
 LUMO      1.3    -0.017160 =      -0.4670eV
 LUMO-HOMO         0.279914 =       7.6169eV


 **********************************************************************************************************************************
 DATASETS  * FILE   NREC   LENGTH (MB)   RECORD NAMES
              1      20       22.51       500      610      700      900      950      970     1000      129      960     1100   
                                          VAR    BASINP    GEOM    SYMINP    ZMAT    AOBASIS   BASIS     P2S    ABASIS      S 
                                         1400     1410     1420     1200     1210     1080     1600     1650     1300     1700   
                                         EKIN       V       ECP      H0       H01     AOSYM     SMH    MOLCAS    ERIS     OPER   

              2       4        2.78       700     1000      520     2100   
                                         GEOM     BASIS   MCVARS     RHF  

 PROGRAMS   *        TOTAL        HF       INT
 CPU TIMES  *         2.39      0.09      2.19
 REAL TIME  *        12.83 SEC
 DISK USED  *        33.97 MB      
 **********************************************************************************************************************************
 SETTING SCF(I)         =        -3.67255262  AU                              
 SETTING _CC_NORM_MAX   =         2.00000000                                  


 PROGRAM * UHF-SCF       Authors: W. Meyer, H.-J. Werner


 NUMBER OF ELECTRONS:       3+    1-    SPACE SYMMETRY=6    SPIN SYMMETRY: Triplet 
 CONVERGENCE THRESHOLDS:    1.00E-05 (Density)    1.00E-07 (Energy)
 MAX. NUMBER OF ITERATIONS:        0
 INTERPOLATION TYPE:            DIIS
 INTERPOLATION STEPS:              2 (START)      1 (STEP)
 LEVEL SHIFTS:                  0.20 (ALPHA)   0.20 (BETA) 

 Number of closed-shell orbitals:    1 (   1   0   0   0   0   0   0   0 )
 Number of open-shell orbitals:      2 (   0   1   0   0   1   0   0   0 )


 Molecular orbitals read from record     2100.2  Type=RHF/CANONICAL (state 1.6)

 Molecular orbital dump at record        2200.2

 Initial alpha occupation   1   1   0   0   1   0   0   0
 Initial beta  occupation   1   0   0   0   0   0   0   0

 ITERATION    DDIFF          GRAD             ENERGY        2-EL.EN.            DIPOLE MOMENTS         DIIS
    1      0.000D+00      0.000D+00        -3.67255262      3.990779    0.00000    0.00000    0.00000    0
 
 Final alpha occupancy:   1   1   0   0   1   0   0   0
 Final beta  occupancy:   1   0   0   0   0   0   0   0

 !UHF STATE 1.6 Energy                 -3.672552621440
 Nuclear energy                         0.00000000
 One-electron energy                   -5.66794220
 Two-electron energy                    1.99538958
 Virial quotient                       -2.76358057
 !UHF STATE 1.6 Dipole moment           0.00000000     0.00000000     0.00000000
 Dipole moment /Debye                   0.00000000     0.00000000     0.00000000
 

 !UHF expec          <1.6|EKIN|1.6>     1.328911001615
 
 !UHF expec           <1.6|POT|1.6>    -1.912889045840

 ELECTRON ORBITALS FOR POSITIVE SPIN
 ===================================


   Orb  Occ    Energy  Couls-En    Coefficients

                                   1 1s      1 1s      1 1s      1 1s      1 1s      1 3d0     1 3d2+    1 3d0     1 3d2+    1 3d0  
                                   1 3d2+    1 3d0     1 3d2+    1 5g0     1 5g4+    1 5g2+    1 5g0     1 5g4+    1 5g2+ 

   1.1   +    -0.5415   -2.1380  1.000022 -0.000064  0.000300 -0.000395  0.000106  0.000431  0.000747 -0.000755 -0.001308  0.003342
                                 0.005788  0.001428  0.002473  0.000001  0.000001  0.000001 -0.000033 -0.000065 -0.000049

                                   1 2px     1 2px     1 2px     1 2px     1 2px     1 4f1+    1 4f3+    1 4f1+    1 4f3+    1 4f1+ 
                                   1 4f3+ 

   1.2   +    -0.2971   -1.5346  1.000116  0.000014 -0.000030 -0.000138  0.000064 -0.000015 -0.000058 -0.000023 -0.000091  0.000029
                                 0.000113

                                   1 2pz     1 2pz     1 2pz     1 2pz     1 2pz     1 4f0     1 4f2+    1 4f0     1 4f2+    1 4f0  
                                   1 4f2+ 

   1.5   +    -0.2971   -1.5346  1.000116  0.000014 -0.000030 -0.000138  0.000064 -0.000037 -0.000048 -0.000058 -0.000074  0.000071
                                 0.000092

 ELECTRON ORBITALS FOR NEGATIVE SPIN
 ===================================


   Orb  Occ    Energy  Couls-En    Coefficients

                                   1 1s      1 1s      1 1s      1 1s      1 1s      1 3d0     1 3d2+    1 3d0     1 3d2+    1 3d0  
                                   1 3d2+    1 3d0     1 3d2+    1 5g0     1 5g4+    1 5g2+    1 5g0     1 5g4+    1 5g2+ 

   1.1   -    -0.5415   -2.1380  1.000022 -0.000064  0.000300 -0.000395  0.000106  0.000431  0.000747 -0.000755 -0.001308  0.003342
                                 0.005788  0.001428  0.002473  0.000001  0.000001  0.000001 -0.000033 -0.000065 -0.000049

 HOMO      1.2    -0.297075 =      -8.0838eV
 LUMO     -1.2    -0.297075 =      -8.0838eV
 LUMO-HOMO         0.000000 =       0.0000eV

 EXPECTATION VALUE OF S**2:             2.00000000

 Occupation number threshold for canonical orbitals:  1.999000 (occupied),  0.001000 (virtual)

 Number of pseudo-canonical orbitals per symmetry:    1   0   0   0   0   0   0   0
 Number of active natural orbitals per symmetry:      0   1   0   0   1   0   0   0

 NATURAL CHARGE ORBITALS
 =======================


   Orb     Occ        Energy       Coefficients

                                   1 1s      1 1s      1 1s      1 1s      1 1s      1 3d0     1 3d2+    1 3d0     1 3d2+    1 3d0  
                                   1 3d2+    1 3d0     1 3d2+    1 5g0     1 5g4+    1 5g2+    1 5g0     1 5g4+    1 5g2+ 

   1.1  2.00000    -0.541507     1.000022 -0.000064  0.000300 -0.000395  0.000106  0.000431  0.000747 -0.000755 -0.001308  0.003342
                                 0.005788  0.001428  0.002473  0.000001  0.000001  0.000001 -0.000033 -0.000065 -0.000049

                                   1 2px     1 2px     1 2px     1 2px     1 2px     1 4f1+    1 4f3+    1 4f1+    1 4f3+    1 4f1+ 
                                   1 4f3+ 

   1.2  1.00000    -0.108926     1.000116  0.000014 -0.000030 -0.000138  0.000064 -0.000015 -0.000058 -0.000023 -0.000091  0.000029
                                 0.000113

                                   1 2pz     1 2pz     1 2pz     1 2pz     1 2pz     1 4f0     1 4f2+    1 4f0     1 4f2+    1 4f0  
                                   1 4f2+ 

   1.5  1.00000    -0.108926     1.000116  0.000014 -0.000030 -0.000138  0.000064 -0.000037 -0.000048 -0.000058 -0.000074  0.000071
                                 0.000092

 Natural orbitals saved to record    2200.2 (Orbital set 3)

 Orbital spaces for UNO-CAS (Min. occupation: 0.020  Max. occupation: 1.980):

 Closed:        1   0   0   0   0   0   0   0
 Active:        0   1   0   0   1   0   0   0

 No convergence



 **********************************************************************************************************************************
 DATASETS  * FILE   NREC   LENGTH (MB)   RECORD NAMES
              1      20       22.51       500      610      700      900      950      970     1000      129      960     1100   
                                          VAR    BASINP    GEOM    SYMINP    ZMAT    AOBASIS   BASIS     P2S    ABASIS      S 
                                         1400     1410     1420     1200     1210     1080     1600     1650     1300     1700   
                                         EKIN       V       ECP      H0       H01     AOSYM     SMH    MOLCAS    ERIS     OPER   

              2       5        5.33       700     1000      520     2100     2200   
                                         GEOM     BASIS   MCVARS     RHF      UHF  

 PROGRAMS   *        TOTAL       UHF        HF       INT
 CPU TIMES  *         2.41      0.02      0.09      2.19
 REAL TIME  *        13.00 SEC
 DISK USED  *        33.97 MB      
 **********************************************************************************************************************************
 SETTING SCF(I)         =        -3.67255262  AU                              


 PROGRAM * MRCC (General Multireference Coupled Cluster)    Author: M. Kallay, 2000-2005

 ***  Initialisation ***

   0 Spin projections
 
 Molecular orbitals read from record     2200.2  Type=UHF/ALPHA (state 1.6)

 ?Warning: UHF not converged
 Molecular orbitals read from record     2200.2  Type=UHF/BETA (state 1.6)

 ?Warning: UHF not converged
 
 Frozen orbitals:              0 (  0  0  0  0  0  0  0  0)
 Active orbitals:             79 ( 19 11 11  8 11  8  8  3)
 Active electrons:             4
 Spin quantum number:          1.0

 Transformed integrals will be written to file mrcc_40741/fort.55

 Load integrals                2.4 sec
 Transform integrals           2.8 sec
 Storage for integrals:        3835052
 Remaining memory:           *********

 Core energy:               0.00000000
 
 MRCC Input:
     4     0     0     0     3     0     0     6     0     0     0     1     1     0     0     7     0     0   0.000     0   64000
  ex.lev,nsing,ntrip, rest,method,dens,conver,symm, diag, CS ,spatial, HF, ndoub,nacto,nactv, tol, maxex, sacc, freq,  dboc,   mem
  2  0  0  0  0  0  0  0  0  0  0  0  0  0  0  0  0  0  0  1  0  0  0  0  0  0  0  0  0  0  0  0  0  0  0  0  0  0  0  0  0  0  0  0  0  0  0  0  0  1  0  0  0  0  0  0  0  0  0  0  0  0  0  0  0  0  0  0  0  0  0  0  0  0  0  0  0  0  0
 MRCC Input end
 Variable memory released
 MRCC now being run, temporary output in /global/cscratch1/sd/aannabe/mrcc_40741/mrcc.out
 **********************************************************************
                          MRCC program system
 **********************************************************************

                              Written by
  Mihaly Kallay, Zoltan Rolik, Jozsef Csontos, Peter Nagy, Gyula Samu,
      David Mester, Jozsef Csoka, Bernat Szabo, Istvan Ladjanszki,
       Lorant Szegedy, Bence Ladoczki, Klara Petrov, Mate Farkas,
                    Pal D. Mezei, and Bence Hegely

        Department of Physical Chemistry and Materials Science
            Budapest University of Technology and Economics
                  Budapest P.O.Box 91, H-1521 Hungary

                              www.mrcc.hu

                       Release date: May 23, 2018

 ************************ 2018-10-05 10:59:53 *************************
 Executing goldstone...

 Generation of CC equations in terms of H and T...
 Generation of antisymmetrized Goldstone diagrams...
 Number of diagrams in T^1 equations:    15
 Number of diagrams in T^2 equations:    38
 Number of diagrams in T^3 equations:    49
 Number of diagrams in T^4 equations:     5
 Translation of diagrams to factorized equations...
 Optimizing intermediate calculation...
 Number of floating-point operations per iteration step:   7.1953E+09
 Probable CPU time per iteration step (hours):      0.07
 Required memory (Mbytes):    4588.5
 Number of intermediates:                                  80
 Number of intermediates to be stored:                     32
 Length of intermediate file (Mbytes):      77.4

 ************************ 2018-10-05 10:59:53 *************************
 Executing xmrcc...

 **********************************************************************
 CC(3)(4) calculation


 Allocation of4588.5 Mbytes of memory...
 Number of spinorbitals:                   158
 Number of alpha electrons:                        3
 Number of beta electrons:                         1
 Spin multiplicity:                     2
 z-component of spin:  1.0
 Spatial symmetry:                      6
 Convergence criterion:  1.0E-07
 Construction of occupation graphs...
 Number of                     0 -fold excitations:                      1
 Number of                     1 -fold excitations:                     56
 Number of                     2 -fold excitations:                   3491
 Number of                     3 -fold excitations:                  92140
 Total number of configurations:                  95688
 Calculation of coupling coefficients...
 Length of intermediate file (Mbytes):      58.9

 ======================================================================

 Spin case  1   Alpha:  3   Beta:  1
 Number of excitations:                 684122
 Number of                     4 -fold excitations:                 684122

 Memory requirements /Mbyte/:
               Minimal        Optimal
 Real*8:        129.4662       297.2647
 Integer:        21.7145
 Total:         151.1808       318.9792


 ************************ 2018-10-05 10:59:55 *************************
 Executing mrcc...

 **********************************************************************
 CCSDT(Q) calculation


 OpenMP parallel version is running.
 Number of CPUs:   1
 Allocation of  297.3 Mbytes of memory...
 Number of spinorbitals: 158
 Number of alpha electrons:  3
 Number of beta  electrons:  1
 Spin multiplicity: 2
 z-component of spin:  1.0
 Spatial symmetry: 6
 Convergence criterion:  1.0E-07
 Construction of occupation graphs...
 Number of 0-fold excitations: 1
 Number of 1-fold excitations: 56
 Number of 2-fold excitations: 3491
 Number of 3-fold excitations: 92140
 Total number of determinants: 95688
 Calculation of coupling coefficients...
 Initial cluster amplitudes are generated.
 Length of intermediate file (Mbytes):      58.9
 Reading integral list from unit 55...
 Sorting integrals...
 Sorting integrals...
 Sorting integrals...
 Sorting integrals...
 Energy of reference determinant [au]:      -3.672552621440
 Calculation of MP denominators...

 Starting CC iteration...
 ======================================================================
 Norm of residual vector:     0.36539628
 CPU time [min]:     0.175                   Wall time [min]:     0.176

 Iteration  1  CC energy:    -3.74174551  Energy decrease:   0.06919289
 ======================================================================
 Norm of residual vector:     0.11265062
 CPU time [min]:     0.246                   Wall time [min]:     0.247

 Iteration  2  CC energy:    -3.75310152  Energy decrease:   0.01135601
 ======================================================================
 Norm of residual vector:     0.03657274
 CPU time [min]:     0.318                   Wall time [min]:     0.319

 Iteration  3  CC energy:    -3.76007967  Energy decrease:   0.00697816
 ======================================================================
 Norm of residual vector:     0.01013021
 CPU time [min]:     0.390                   Wall time [min]:     0.390

 Iteration  4  CC energy:    -3.76027061  Energy decrease:   0.00019094
 ======================================================================
 Norm of residual vector:     0.00296047
 CPU time [min]:     0.462                   Wall time [min]:     0.462

 Iteration  5  CC energy:    -3.76044649  Energy decrease:   0.00017588
 ======================================================================
 Norm of residual vector:     0.00093197
 CPU time [min]:     0.533                   Wall time [min]:     0.534

 Iteration  6  CC energy:    -3.76041675  Energy decrease:   0.00002974
 ======================================================================
 Norm of residual vector:     0.00027717
 CPU time [min]:     0.607                   Wall time [min]:     0.607

 Iteration  7  CC energy:    -3.76041169  Energy decrease:   0.00000506
 ======================================================================
 Norm of residual vector:     0.00009199
 CPU time [min]:     0.679                   Wall time [min]:     0.686

 Iteration  8  CC energy:    -3.76041486  Energy decrease:   0.00000317
 ======================================================================
 Norm of residual vector:     0.00003256
 CPU time [min]:     0.752                   Wall time [min]:     0.758

 Iteration  9  CC energy:    -3.76041502  Energy decrease:   0.00000016
 ======================================================================
 Norm of residual vector:     0.00001173
 CPU time [min]:     0.824                   Wall time [min]:     0.831

 Iteration 10  CC energy:    -3.76041464  Energy decrease:   0.00000038
 ======================================================================
 Norm of residual vector:     0.00000412
 CPU time [min]:     0.897                   Wall time [min]:     0.903

 Iteration 11  CC energy:    -3.76041475  Energy decrease:   0.00000011
 ======================================================================
 Norm of residual vector:     0.00000145
 CPU time [min]:     0.970                   Wall time [min]:     0.976

 Iteration 12  CC energy:    -3.76041476  Energy decrease:   0.00000001
 ======================================================================
 Norm of residual vector:     0.00000046
 CPU time [min]:     1.042                   Wall time [min]:     1.048

 Iteration 13  CC energy:    -3.76041474  Energy decrease:   0.00000002
 ======================================================================
 Norm of residual vector:     0.00000013
 CPU time [min]:     1.115                   Wall time [min]:     1.121

 Iteration 14  CC energy:    -3.76041475  Energy decrease:   0.00000001
 ======================================================================
 Norm of residual vector:     0.00000004
 CPU time [min]:     1.186                   Wall time [min]:     1.192

 Iteration 15  CC energy:    -3.76041475  Energy decrease:   3.5836E-10
 ======================================================================

 Iteration has converged in 15 steps.

 Final results:
 Total CCSDT energy [au]:             -3.760414746448
 Total MP2 energy [au]:               -3.741745510001

 Perturbative corrections are calculated...
 ======================================================================
 Spin case  1   Alpha:  3   Beta:  1
 Number of excitations:        684122
 CPU time [min]:     5.110                   Wall time [min]:     5.116
 ======================================================================
 Number of 4-fold excitations: 684122
 CPU time [min]:     5.110                   Wall time [min]:     5.117

 Total CCSDT[Q] energy [au]:          -3.760444022415
 Total CCSDT(Q) energy [au]:          -3.760498484107

 ************************ 2018-10-05 11:05:02 *************************
                      Normal termination of mrcc.
 **********************************************************************
 !CCSDT STATE 1.6 Energy               -3.760414746448
 !MP2 STATE 1.6 Energy                 -3.741745510001
 !CCSDT[Q] STATE 1.6 Energy            -3.760444022415
 !CCSDT(Q) STATE 1.6 Energy            -3.760498484107
 
 CPU-time for MRCC:            306.6 sec
 Elapsed-time for MRCC:        310.9 sec

 Variable memory set to 8000000000 words,  buffer space   230000 words



 **********************************************************************************************************************************
 DATASETS  * FILE   NREC   LENGTH (MB)   RECORD NAMES
              1      20       22.51       500      610      700      900      950      970     1000      129      960     1100   
                                          VAR    BASINP    GEOM    SYMINP    ZMAT    AOBASIS   BASIS     P2S    ABASIS      S 
                                         1400     1410     1420     1200     1210     1080     1600     1650     1300     1700   
                                         EKIN       V       ECP      H0       H01     AOSYM     SMH    MOLCAS    ERIS     OPER   

              2       5        5.33       700     1000      520     2100     2200   
                                         GEOM     BASIS   MCVARS     RHF      UHF  

 PROGRAMS   *        TOTAL      MRCC       UHF        HF       INT
 CPU TIMES  *       317.56    315.15      0.02      0.09      2.19
 REAL TIME  *       374.19 SEC
 DISK USED  *        33.97 MB      
 **********************************************************************************************************************************
 SETTING POSTHF(I)      =        -3.76049848  AU                              
                                                                                                                                                                                                                                                                

       SCF           POSTHF       EKIN          POT
    -3.67255262   -3.76049848   1.32891100   -1.91288905
                                                  

 CCSDT(Q)/USERDEF energy=     -3.760498484107

        CCSDT(Q)        HF-SCF  
     -3.76049848     -3.67255262
 **********************************************************************************************************************************
 Variable memory released
