
 Primary working directories    : /global/cscratch1/sd/aannabe
 Secondary working directories  : /global/cscratch1/sd/aannabe
 Wavefunction directory         : /global/homes/a/aannabe/wfu/
 Main file repository           : /global/cscratch1/sd/aannabe/

 SHA1      : 2873118e99aab1bc19f5b6fc1784693c06d15c95
 NAME      : 2015.1.8
 ARCHNAME  : linux/x86_64
 FC        : /opt/cray/pe/craype/2.5.5/bin/ftn
 BLASLIB   : -Wl,-_start-group /opt/intel/compilers_and_libraries_2016.3.210/linux/mkl/lib/intel64/libmkl_intel_ilp64.a /opt/intel/compilers_and_libraries_2016.3.210/linux/mkl/lib/intel64/libmkl_intel_thread.a /opt/intel/compilers_and_libraries_2016.3.210/linux/mkl/lib/intel64/libmkl_core.a -Wl,-_end-group
 id        : lbl

 Nodes     nprocs
 nid00465     1

 Using customized tuning parameters: mindgm=8; mindgv=16; mindgc=4; mindgr=1; noblas=0; minvec=7
 default implementation of scratch files=df  

 ***,O
 memory,8,g
 gthresh,twoint=1.e-12
 
 gprint,basis,orbitals
 gexpec,ekin,pot
 
 angstrom
 geometry={
 1                                                                               ! Number of atoms
 O 0.0 0.0 0.0
 }
 
 basis={
 Including file /global/homes/a/aannabe/docs/totals_bfd/pps/O.pp
 Including file /global/homes/a/aannabe/docs/totals_bfd/basis/aug-cc-pVnZ/O_qz.basis
 }
 
 {hf
 wf,6,7,2
 occ,1,1,1,0,1,0,0,0
                                                                                 !open,1.3
 closed,1,1,0,0,0,0,0,0
                                                                                 !sym,
 }
 scf(i)=energy
 
 _CC_NORM_MAX=2.0
  !NOTE: Perturbative MRCC works only with UHF reference. So, here we will trick MRCC by doing zero UHF iteration right after ROHF.
 
 {uhf
 wf,6,7,2
 occ,1,1,1,0,1,0,0,0
                                                                                 !open,1.3
 closed,1,1,0,0,0,0,0,0
                                                                                 !sym,
 maxit,0
 }
 scf(i)=energy
 
 {mrcc,method=CCSDT(Q)
 orbital,ignore_error=1                                                          !Ignore the fact that UHF WF is not converged
 maxit,100
 core
 }
 posthf(i)=energy
 
 table,scf,posthf,ekin,pot
 save,4.csv,new
 
 

 Variables initialized (889), CPU time= 0.00 sec
 Commands  initialized (702), CPU time= 0.01 sec, 572 directives.
 Default parameters read. Elapsed time= 0.10 sec

 Checking input...
 Passed
1


                                         ***  PROGRAM SYSTEM MOLPRO  ***
                                       Copyright, TTI GmbH Stuttgart, 2015
                                    Version 2015.1 linked Sep  7 2016 23:09:38


 **********************************************************************************************************************************
 LABEL *   O                                                                             
  64 bit serial version                                                                  DATE: 20-Jun-18          TIME: 13:57:16  
 **********************************************************************************************************************************

 SHA1:             2873118e99aab1bc19f5b6fc1784693c06d15c95
 **********************************************************************************************************************************

 THRESHOLDS:

 ZERO    =  1.00D-12  ONEINT  =  1.00D-12  TWOINT  =  1.00D-12  PREFAC  =  1.00D-14  LOCALI  =  1.00D-09  EORDER  =  1.00D-04
 ENERGY  =  0.00D+00  ETEST   =  0.00D+00  EDENS   =  0.00D+00  THRDEDEF=  1.00D-06  GRADIENT=  1.00D-02  STEP    =  1.00D-03
 ORBITAL =  1.00D-05  CIVEC   =  1.00D-05  COEFF   =  1.00D-04  PRINTCI =  5.00D-02  PUNCHCI =  9.90D+01  OPTGRAD =  3.00D-04
 OPTENERG=  1.00D-06  OPTSTEP =  3.00D-04  THRGRAD =  1.00D-10  COMPRESS=  1.00D-11  VARMIN  =  1.00D-07  VARMAX  =  1.00D-03
 THRDOUB =  0.00D+00  THRDIV  =  1.00D-05  THRRED  =  1.00D-07  THRPSP  =  1.00D+00  THRDC   =  1.00D-10  THRCS   =  1.00D-10
 THRNRM  =  1.00D-08  THREQ   =  0.00D+00  THRDE   =  1.00D+00  THRREF  =  1.00D-05  SPARFAC =  1.00D+00  THRDLP  =  1.00D-07
 THRDIA  =  1.00D-10  THRDLS  =  1.00D-07  THRGPS  =  0.00D+00  THRKEX  =  0.00D+00  THRDIS  =  2.00D-01  THRVAR  =  1.00D-10
 THRLOC  =  1.00D-06  THRGAP  =  1.00D-06  THRLOCT = -1.00D+00  THRGAPT = -1.00D+00  THRORB  =  1.00D-06  THRMLTP =  0.00D+00
 THRCPQCI=  1.00D-10  KEXTA   =  0.00D+00  THRCOARS=  0.00D+00  SYMTOL  =  1.00D-06  GRADTOL =  1.00D-06  THROVL  =  1.00D-08
 THRORTH =  1.00D-08  GRID    =  1.00D-06  GRIDMAX =  1.00D-03  DTMAX   =  0.00D+00  THROCCDE=  1.00D-01  THROCCDE=  1.00D-01



 ZUNIT=ANG
 

Geometry recognized as XYZ


 Variable memory set to 8000000000 words,  buffer space   230000 words

 SETTING BASIS          =    USERDEF


 Recomputing integrals since basis changed


 Using spherical harmonics



 PROGRAM * SEWARD (Integral evaluation for generally contracted gaussian basis sets)     Author: Roland Lindh, 1990

 Geometry written to block  1 of record 700

 Orientation using atomic masses  
 Molecule type: Atom
 Symmetry elements: X,Y,Z
 Rotational constants:       0.0000000      0.0000000      0.0000000 GHz  (calculated with average atomic masses)

 Point group  D2h 



 ATOMIC COORDINATES

 NR  ATOM    CHARGE       X              Y              Z

   1  O       6.00    0.000000000    0.000000000    0.000000000


          O   CORE POTENTIAL

          p POTENTIAL

 POWERS             1              3              2
 EXPONENTIALS   9.297939       8.864922       8.629257    
 COEFFICIENTS   6.000000       55.78763      -38.81978    

          s - p POTENTIAL

 POWERS             2
 EXPONENTIALS   8.719245    
 COEFFICIENTS   38.41914    


 BASIS DATA

   Nr Sym  Nuc  Type         Exponents   Contraction coefficients

    1.1 Ag    1  1s           0.125346     0.055741
                              0.268022     0.304848
                              0.573098     0.453752
                              1.225429     0.295926
                              2.620277     0.019567
                              5.602818    -0.128627
                             11.980245     0.012024
                             25.616801     0.000407
                             54.775216    -0.000076
    2.1 Ag    1  1s           0.089752     1.000000
    3.1 Ag    1  1s           0.224380     1.000000
    4.1 Ag    1  1s           0.843157     1.000000
    5.1 Ag    1  1s           1.351771     1.000000
    6.1 Ag    1  3d0          0.182284     1.000000
    7.1 Ag    1  3d2+         0.182284     1.000000
    8.1 Ag    1  3d0          0.455711     1.000000
    9.1 Ag    1  3d2+         0.455711     1.000000
   10.1 Ag    1  3d0          1.344331     1.000000
   11.1 Ag    1  3d2+         1.344331     1.000000
   12.1 Ag    1  3d0          4.008867     1.000000
   13.1 Ag    1  3d2+         4.008867     1.000000
   14.1 Ag    1  5g0          0.703632     1.000000
   15.1 Ag    1  5g4+         0.703632     1.000000
   16.1 Ag    1  5g2+         0.703632     1.000000
   17.1 Ag    1  5g0          1.759081     1.000000
   18.1 Ag    1  5g4+         1.759081     1.000000
   19.1 Ag    1  5g2+         1.759081     1.000000
    1.2 B3u   1  2px          0.083598     0.044958
                              0.167017     0.150175
                              0.333673     0.255999
                              0.666627     0.281879
                              1.331816     0.242835
                              2.660761     0.161134
                              5.315785     0.082308
                             10.620108     0.039899
                             21.217318     0.004679
    2.2 B3u   1  2px          0.059425     1.000000
    3.2 B3u   1  2px          0.148562     1.000000
    4.2 B3u   1  2px          0.452364     1.000000
    5.2 B3u   1  2px          1.106737     1.000000
    6.2 B3u   1  4f1+         0.350516     1.000000
    7.2 B3u   1  4f3+         0.350516     1.000000
    8.2 B3u   1  4f1+         0.876289     1.000000
    9.2 B3u   1  4f3+         0.876289     1.000000
   10.2 B3u   1  4f1+         2.763115     1.000000
   11.2 B3u   1  4f3+         2.763115     1.000000
    1.3 B2u   1  2py          0.083598     0.044958
                              0.167017     0.150175
                              0.333673     0.255999
                              0.666627     0.281879
                              1.331816     0.242835
                              2.660761     0.161134
                              5.315785     0.082308
                             10.620108     0.039899
                             21.217318     0.004679
    2.3 B2u   1  2py          0.059425     1.000000
    3.3 B2u   1  2py          0.148562     1.000000
    4.3 B2u   1  2py          0.452364     1.000000
    5.3 B2u   1  2py          1.106737     1.000000
    6.3 B2u   1  4f1-         0.350516     1.000000
    7.3 B2u   1  4f3-         0.350516     1.000000
    8.3 B2u   1  4f1-         0.876289     1.000000
    9.3 B2u   1  4f3-         0.876289     1.000000
   10.3 B2u   1  4f1-         2.763115     1.000000
   11.3 B2u   1  4f3-         2.763115     1.000000
    1.4 B1g   1  3d2-         0.182284     1.000000
    2.4 B1g   1  3d2-         0.455711     1.000000
    3.4 B1g   1  3d2-         1.344331     1.000000
    4.4 B1g   1  3d2-         4.008867     1.000000
    5.4 B1g   1  5g2-         0.703632     1.000000
    6.4 B1g   1  5g4-         0.703632     1.000000
    7.4 B1g   1  5g2-         1.759081     1.000000
    8.4 B1g   1  5g4-         1.759081     1.000000
    1.5 B1u   1  2pz          0.083598     0.044958
                              0.167017     0.150175
                              0.333673     0.255999
                              0.666627     0.281879
                              1.331816     0.242835
                              2.660761     0.161134
                              5.315785     0.082308
                             10.620108     0.039899
                             21.217318     0.004679
    2.5 B1u   1  2pz          0.059425     1.000000
    3.5 B1u   1  2pz          0.148562     1.000000
    4.5 B1u   1  2pz          0.452364     1.000000
    5.5 B1u   1  2pz          1.106737     1.000000
    6.5 B1u   1  4f0          0.350516     1.000000
    7.5 B1u   1  4f2+         0.350516     1.000000
    8.5 B1u   1  4f0          0.876289     1.000000
    9.5 B1u   1  4f2+         0.876289     1.000000
   10.5 B1u   1  4f0          2.763115     1.000000
   11.5 B1u   1  4f2+         2.763115     1.000000
    1.6 B2g   1  3d1+         0.182284     1.000000
    2.6 B2g   1  3d1+         0.455711     1.000000
    3.6 B2g   1  3d1+         1.344331     1.000000
    4.6 B2g   1  3d1+         4.008867     1.000000
    5.6 B2g   1  5g1+         0.703632     1.000000
    6.6 B2g   1  5g3+         0.703632     1.000000
    7.6 B2g   1  5g1+         1.759081     1.000000
    8.6 B2g   1  5g3+         1.759081     1.000000
    1.7 B3g   1  3d1-         0.182284     1.000000
    2.7 B3g   1  3d1-         0.455711     1.000000
    3.7 B3g   1  3d1-         1.344331     1.000000
    4.7 B3g   1  3d1-         4.008867     1.000000
    5.7 B3g   1  5g1-         0.703632     1.000000
    6.7 B3g   1  5g3-         0.703632     1.000000
    7.7 B3g   1  5g1-         1.759081     1.000000
    8.7 B3g   1  5g3-         1.759081     1.000000
    1.8 Au    1  4f2-         0.350516     1.000000
    2.8 Au    1  4f2-         0.876289     1.000000
    3.8 Au    1  4f2-         2.763115     1.000000

 NUCLEAR CHARGE:                    6
 NUMBER OF PRIMITIVE AOS:         136
 NUMBER OF SYMMETRY AOS:          111
 NUMBER OF CONTRACTIONS:           79   (  19Ag  +  11B3u +  11B2u +   8B1g +  11B1u +   8B2g +   8B3g +   3Au  )
 NUMBER OF CORE ORBITALS:           0   (   0Ag  +   0B3u +   0B2u +   0B1g +   0B1u +   0B2g +   0B3g +   0Au  )
 NUMBER OF VALENCE ORBITALS:        4   (   1Ag  +   1B3u +   1B2u +   0B1g +   1B1u +   0B2g +   0B3g +   0Au  )


 NUCLEAR REPULSION ENERGY    0.00000000

 EXTRA SYMMETRY OF AOS IN SYMMETRY 1:   1 1 1 1 1 2 3 2 3 2   3 2 3 4 5 6 4 5 6
 EXTRA SYMMETRY OF AOS IN SYMMETRY 2:   1 1 1 1 1 2 3 2 3 2   3
 EXTRA SYMMETRY OF AOS IN SYMMETRY 3:   1 1 1 1 1 2 3 2 3 2   3
 EXTRA SYMMETRY OF AOS IN SYMMETRY 4:   1 1 1 1 2 3 2 3
 EXTRA SYMMETRY OF AOS IN SYMMETRY 5:   1 1 1 1 1 2 3 2 3 2   3
 EXTRA SYMMETRY OF AOS IN SYMMETRY 6:   1 1 1 1 2 3 2 3
 EXTRA SYMMETRY OF AOS IN SYMMETRY 7:   1 1 1 1 2 3 2 3

 Eigenvalues of metric

         1 0.109E-02 0.169E-01 0.122E+00 0.128E+00 0.128E+00 0.428E+00 0.428E+00 0.428E+00
         2 0.201E-01 0.691E-01 0.255E+00 0.255E+00 0.266E+00 0.877E+00 0.877E+00 0.122E+01
         3 0.201E-01 0.691E-01 0.255E+00 0.255E+00 0.266E+00 0.877E+00 0.877E+00 0.122E+01
         4 0.128E+00 0.428E+00 0.428E+00 0.435E+00 0.121E+01 0.157E+01 0.157E+01 0.223E+01
         5 0.201E-01 0.691E-01 0.255E+00 0.255E+00 0.266E+00 0.877E+00 0.877E+00 0.122E+01
         6 0.128E+00 0.428E+00 0.428E+00 0.435E+00 0.121E+01 0.157E+01 0.157E+01 0.223E+01
         7 0.128E+00 0.428E+00 0.428E+00 0.435E+00 0.121E+01 0.157E+01 0.157E+01 0.223E+01
         8 0.255E+00 0.877E+00 0.187E+01


 Contracted 2-electron integrals neglected if value below      1.0D-12
 AO integral compression algorithm  1   Integral accuracy      1.0D-12

     6.554 MB (compressed) written to integral file ( 69.6%)


 NUMBER OF SORTED TWO-ELECTRON INTEGRALS:     665704.     BUFFER LENGTH:  32768
 NUMBER OF SEGMENTS:   1  SEGMENT LENGTH:     665704      RECORD LENGTH: 524288

 Memory used in sort:       1.22 MW

 SORT1 READ     1222209. AND WROTE      500866. INTEGRALS IN      2 RECORDS. CPU TIME:     0.03 SEC, REAL TIME:     0.09 SEC
 SORT2 READ      500866. AND WROTE      665704. INTEGRALS IN     25 RECORDS. CPU TIME:     0.04 SEC, REAL TIME:     0.09 SEC

 FILE SIZES:   FILE 1:    25.8 MBYTE,  FILE 4:     8.4 MBYTE,   TOTAL:     34.2 MBYTE

 OPERATOR DM      FOR CENTER  0  COORDINATES:    0.000000    0.000000    0.000000
 OPERATOR EKIN    FOR CENTER  0  COORDINATES:    0.000000    0.000000    0.000000
 OPERATOR POT     FOR CENTER  0  COORDINATES:    0.000000    0.000000    0.000000


 **********************************************************************************************************************************
 DATASETS  * FILE   NREC   LENGTH (MB)   RECORD NAMES
              1      20       22.81       500      610      700      900      950      970     1000      129      960     1100   
                                          VAR    BASINP    GEOM    SYMINP    ZMAT    AOBASIS   BASIS     P2S    ABASIS      S 
                                         1400     1410     1420     1200     1210     1080     1600     1650     1300     1700   
                                         EKIN       V       ECP      H0       H01     AOSYM     SMH    MOLCAS    ERIS     OPER   

 PROGRAMS   *        TOTAL       INT
 CPU TIMES  *         1.91      1.81
 REAL TIME  *        10.43 SEC
 DISK USED  *        34.49 MB      
 **********************************************************************************************************************************


 PROGRAM * RHF-SCF (OPEN SHELL)       Authors: W. Meyer, H.-J. Werner


 NUMBER OF ELECTRONS:       4+    2-    SPACE SYMMETRY=7    SPIN SYMMETRY: Triplet 
 CONVERGENCE THRESHOLDS:    1.00E-05 (Density)    1.00E-07 (Energy)
 MAX. NUMBER OF ITERATIONS:       60
 INTERPOLATION TYPE:            DIIS
 INTERPOLATION STEPS:              2 (START)      1 (STEP)
 LEVEL SHIFTS:                 -0.60 (CLOSED) -0.30 (OPEN) 

 Number of closed-shell orbitals:    2 (   1   1   0   0   0   0   0   0 )
 Number of open-shell orbitals:      2 (   0   0   1   0   1   0   0   0 )



   Atom=O  basis=ECP2MWB_GUESS     lmin=0  lmax=1

 Orbital guess generated from atomic densities. Full valence occupancy:    1   1   1   0   1   0   0   0


 Molecular orbital dump at record        2100.2

 ITERATION    DDIFF          GRAD             ENERGY        2-EL.EN.            DIPOLE MOMENTS         DIIS   ORB.
    1      0.000D+00      0.000D+00       -15.68650749     20.542386    0.00000    0.00000    0.00000    0    start
    2      0.000D+00      0.182D-01       -15.70695000     21.316582    0.00000    0.00000    0.00000    1    diag,B
    3      0.137D-01      0.444D-02       -15.70808273     21.338788    0.00000    0.00000    0.00000    2    diag,B
    4      0.265D-02      0.177D-02       -15.70845208     21.367140    0.00000    0.00000    0.00000    3    diag,B
    5      0.169D-02      0.449D-03       -15.70848037     21.370802    0.00000    0.00000    0.00000    4    diag,B
    6      0.587D-03      0.871D-04       -15.70848128     21.369585    0.00000    0.00000    0.00000    5    diag,B
    7      0.140D-03      0.205D-04       -15.70848134     21.369431    0.00000    0.00000    0.00000    6    fixocc
    8      0.335D-04      0.547D-05       -15.70848134     21.369345    0.00000    0.00000    0.00000    7    diag,B
    9      0.721D-05      0.158D-05       -15.70848134     21.369347    0.00000    0.00000    0.00000    0    orth

 Final alpha occupancy:   1   1   1   0   1   0   0   0
 Final beta  occupancy:   1   1   0   0   0   0   0   0

 !RHF STATE 1.7 Energy                -15.708481339994
 Nuclear energy                         0.00000000
 One-electron energy                  -26.39315493
 Two-electron energy                   10.68467359
 Virial quotient                       -1.35321557
 !RHF STATE 1.7 Dipole moment           0.00000000     0.00000000     0.00000000
 Dipole moment /Debye                   0.00000000     0.00000000     0.00000000
 

 !RHF expec          <1.7|EKIN|1.7>    11.608262379515
 
 !RHF expec           <1.7|POT|1.7>    -6.640598031230

 ELECTRON ORBITALS
 =================


   Orb  Occ    Energy  Couls-En    Coefficients

                                   1 1s      1 1s      1 1s      1 1s      1 1s      1 3d0     1 3d2+    1 3d0     1 3d2+    1 3d0  
                                   1 3d2+    1 3d0     1 3d2+    1 5g0     1 5g4+    1 5g2+    1 5g0     1 5g4+    1 5g2+ 

   1.1   2    -1.2427   -6.0706  1.000088  0.000052 -0.000116 -0.000051  0.000022 -0.001217  0.002108 -0.001275  0.002209 -0.000109
                                 0.000189 -0.000405  0.000702 -0.000008 -0.000017  0.000013  0.000000  0.000001 -0.000000

                                   1 2px     1 2px     1 2px     1 2px     1 2px     1 4f1+    1 4f3+    1 4f1+    1 4f3+    1 4f1+ 
                                   1 4f3+ 

   1.2   2    -0.5664   -4.7059  1.000039  0.000090 -0.000512  0.000195  0.000070  0.001382 -0.001784  0.001976 -0.002551  0.000941
                                -0.001215

                                   1 2py     1 2py     1 2py     1 2py     1 2py     1 4f1-    1 4f3-    1 4f1-    1 4f3-    1 4f1- 
                                   1 4f3- 

   1.3   +    -0.7029   -4.9319  1.037691 -0.010793 -0.054033 -0.012820  0.012120  0.000739 -0.002863  0.001418 -0.005490  0.000715
                                -0.002770

                                   1 2pz     1 2pz     1 2pz     1 2pz     1 2pz     1 4f0     1 4f2+    1 4f0     1 4f2+    1 4f0  
                                   1 4f2+ 

   1.5   +    -0.7029   -4.9319  1.037691 -0.010793 -0.054033 -0.012820  0.012120  0.001810 -0.002337  0.003472 -0.004483  0.001752
                                -0.002262

 HOMO      1.2    -0.566354 =     -15.4113eV
 LUMO      2.3     0.138889 =       3.7794eV
 LUMO-HOMO         0.705243 =      19.1906eV


 **********************************************************************************************************************************
 DATASETS  * FILE   NREC   LENGTH (MB)   RECORD NAMES
              1      20       22.81       500      610      700      900      950      970     1000      129      960     1100   
                                          VAR    BASINP    GEOM    SYMINP    ZMAT    AOBASIS   BASIS     P2S    ABASIS      S 
                                         1400     1410     1420     1200     1210     1080     1600     1650     1300     1700   
                                         EKIN       V       ECP      H0       H01     AOSYM     SMH    MOLCAS    ERIS     OPER   

              2       4        2.78       700     1000      520     2100   
                                         GEOM     BASIS   MCVARS     RHF  

 PROGRAMS   *        TOTAL        HF       INT
 CPU TIMES  *         1.98      0.07      1.81
 REAL TIME  *        10.58 SEC
 DISK USED  *        34.49 MB      
 **********************************************************************************************************************************
 SETTING SCF(I)         =       -15.70848134  AU                              
 SETTING _CC_NORM_MAX   =         2.00000000                                  


 PROGRAM * UHF-SCF       Authors: W. Meyer, H.-J. Werner


 NUMBER OF ELECTRONS:       4+    2-    SPACE SYMMETRY=7    SPIN SYMMETRY: Triplet 
 CONVERGENCE THRESHOLDS:    1.00E-05 (Density)    1.00E-07 (Energy)
 MAX. NUMBER OF ITERATIONS:        0
 INTERPOLATION TYPE:            DIIS
 INTERPOLATION STEPS:              2 (START)      1 (STEP)
 LEVEL SHIFTS:                  0.20 (ALPHA)   0.20 (BETA) 

 Number of closed-shell orbitals:    2 (   1   1   0   0   0   0   0   0 )
 Number of open-shell orbitals:      2 (   0   0   1   0   1   0   0   0 )


 Molecular orbitals read from record     2100.2  Type=RHF/CANONICAL (state 1.7)

 Molecular orbital dump at record        2200.2

 Initial alpha occupation   1   1   1   0   1   0   0   0
 Initial beta  occupation   1   1   0   0   0   0   0   0

 ITERATION    DDIFF          GRAD             ENERGY        2-EL.EN.            DIPOLE MOMENTS         DIIS
    1      0.000D+00      0.000D+00       -15.70848134     21.369347    0.00000    0.00000    0.00000    0
 
 Final alpha occupancy:   1   1   1   0   1   0   0   0
 Final beta  occupancy:   1   1   0   0   0   0   0   0

 !UHF STATE 1.7 Energy                -15.708481339994
 Nuclear energy                         0.00000000
 One-electron energy                  -26.39315493
 Two-electron energy                   10.68467359
 Virial quotient                       -1.35321557
 !UHF STATE 1.7 Dipole moment           0.00000000     0.00000000     0.00000000
 Dipole moment /Debye                   0.00000000     0.00000000     0.00000000
 

 !UHF expec          <1.7|EKIN|1.7>    11.608262379515
 
 !UHF expec           <1.7|POT|1.7>    -6.640598031230

 ELECTRON ORBITALS FOR POSITIVE SPIN
 ===================================


   Orb  Occ    Energy  Couls-En    Coefficients

                                   1 1s      1 1s      1 1s      1 1s      1 1s      1 3d0     1 3d2+    1 3d0     1 3d2+    1 3d0  
                                   1 3d2+    1 3d0     1 3d2+    1 5g0     1 5g4+    1 5g2+    1 5g0     1 5g4+    1 5g2+ 

   1.1   +    -1.2427   -6.0706  1.000088  0.000052 -0.000116 -0.000051  0.000022 -0.001217  0.002108 -0.001275  0.002209 -0.000109
                                 0.000189 -0.000405  0.000702 -0.000008 -0.000017  0.000013  0.000000  0.000001 -0.000000

                                   1 2px     1 2px     1 2px     1 2px     1 2px     1 4f1+    1 4f3+    1 4f1+    1 4f3+    1 4f1+ 
                                   1 4f3+ 

   1.2   +    -0.5664   -4.7059  1.000039  0.000090 -0.000512  0.000195  0.000070  0.001382 -0.001784  0.001976 -0.002551  0.000941
                                -0.001215

                                   1 2py     1 2py     1 2py     1 2py     1 2py     1 4f1-    1 4f3-    1 4f1-    1 4f3-    1 4f1- 
                                   1 4f3- 

   1.3   +    -0.7029   -4.9319  1.037691 -0.010793 -0.054033 -0.012820  0.012120  0.000739 -0.002863  0.001418 -0.005490  0.000715
                                -0.002770

                                   1 2pz     1 2pz     1 2pz     1 2pz     1 2pz     1 4f0     1 4f2+    1 4f0     1 4f2+    1 4f0  
                                   1 4f2+ 

   1.5   +    -0.7029   -4.9319  1.037691 -0.010793 -0.054033 -0.012820  0.012120  0.001810 -0.002337  0.003472 -0.004483  0.001752
                                -0.002262

 ELECTRON ORBITALS FOR NEGATIVE SPIN
 ===================================


   Orb  Occ    Energy  Couls-En    Coefficients

                                   1 1s      1 1s      1 1s      1 1s      1 1s      1 3d0     1 3d2+    1 3d0     1 3d2+    1 3d0  
                                   1 3d2+    1 3d0     1 3d2+    1 5g0     1 5g4+    1 5g2+    1 5g0     1 5g4+    1 5g2+ 

   1.1   -    -1.2427   -6.0706  1.000088  0.000052 -0.000116 -0.000051  0.000022 -0.001217  0.002108 -0.001275  0.002209 -0.000109
                                 0.000189 -0.000405  0.000702 -0.000008 -0.000017  0.000013  0.000000  0.000001 -0.000000

                                   1 2px     1 2px     1 2px     1 2px     1 2px     1 4f1+    1 4f3+    1 4f1+    1 4f3+    1 4f1+ 
                                   1 4f3+ 

   1.2   -    -0.5664   -4.7059  1.000039  0.000090 -0.000512  0.000195  0.000070  0.001382 -0.001784  0.001976 -0.002551  0.000941
                                -0.001215

 HOMO      1.2    -0.566354 =     -15.4113eV
 LUMO     -1.3    -0.702861 =     -19.1258eV
 LUMO-HOMO        -0.136507 =      -3.7145eV

 EXPECTATION VALUE OF S**2:             2.00000000

 Occupation number threshold for canonical orbitals:  1.999000 (occupied),  0.001000 (virtual)

 Number of pseudo-canonical orbitals per symmetry:    1   1   0   0   0   0   0   0
 Number of active natural orbitals per symmetry:      0   0   1   0   1   0   0   0

 NATURAL CHARGE ORBITALS
 =======================


   Orb     Occ        Energy       Coefficients

                                   1 1s      1 1s      1 1s      1 1s      1 1s      1 3d0     1 3d2+    1 3d0     1 3d2+    1 3d0  
                                   1 3d2+    1 3d0     1 3d2+    1 5g0     1 5g4+    1 5g2+    1 5g0     1 5g4+    1 5g2+ 

   1.1  2.00000    -1.242689     1.000088  0.000052 -0.000116 -0.000051  0.000022 -0.001217  0.002108 -0.001275  0.002209 -0.000109
                                 0.000189 -0.000405  0.000702 -0.000008 -0.000017  0.000013  0.000000  0.000001 -0.000000

                                   1 2px     1 2px     1 2px     1 2px     1 2px     1 4f1+    1 4f3+    1 4f1+    1 4f3+    1 4f1+ 
                                   1 4f3+ 

   1.2  2.00000    -0.566354     1.000039  0.000090 -0.000512  0.000195  0.000070  0.001382 -0.001784  0.001976 -0.002551  0.000941
                                -0.001215

                                   1 2py     1 2py     1 2py     1 2py     1 2py     1 4f1-    1 4f3-    1 4f1-    1 4f3-    1 4f1- 
                                   1 4f3- 

   1.3  1.00000    -0.266301     1.037691 -0.010793 -0.054033 -0.012820  0.012120  0.000739 -0.002863  0.001418 -0.005490  0.000715
                                -0.002770

                                   1 2pz     1 2pz     1 2pz     1 2pz     1 2pz     1 4f0     1 4f2+    1 4f0     1 4f2+    1 4f0  
                                   1 4f2+ 

   1.5  1.00000    -0.266301     1.037691 -0.010793 -0.054033 -0.012820  0.012120  0.001810 -0.002337  0.003472 -0.004483  0.001752
                                -0.002262

 Natural orbitals saved to record    2200.2 (Orbital set 3)

 Orbital spaces for UNO-CAS (Min. occupation: 0.020  Max. occupation: 1.980):

 Closed:        1   1   0   0   0   0   0   0
 Active:        0   0   1   0   1   0   0   0

 No convergence



 **********************************************************************************************************************************
 DATASETS  * FILE   NREC   LENGTH (MB)   RECORD NAMES
              1      20       22.81       500      610      700      900      950      970     1000      129      960     1100   
                                          VAR    BASINP    GEOM    SYMINP    ZMAT    AOBASIS   BASIS     P2S    ABASIS      S 
                                         1400     1410     1420     1200     1210     1080     1600     1650     1300     1700   
                                         EKIN       V       ECP      H0       H01     AOSYM     SMH    MOLCAS    ERIS     OPER   

              2       5        5.33       700     1000      520     2100     2200   
                                         GEOM     BASIS   MCVARS     RHF      UHF  

 PROGRAMS   *        TOTAL       UHF        HF       INT
 CPU TIMES  *         1.99      0.01      0.07      1.81
 REAL TIME  *        10.71 SEC
 DISK USED  *        34.49 MB      
 **********************************************************************************************************************************
 SETTING SCF(I)         =       -15.70848134  AU                              


 PROGRAM * MRCC (General Multireference Coupled Cluster)    Author: M. Kallay, 2000-2005

 ***  Initialisation ***

   0 Spin projections
 
 Molecular orbitals read from record     2200.2  Type=UHF/ALPHA (state 1.7)

 ?Warning: UHF not converged
 Molecular orbitals read from record     2200.2  Type=UHF/BETA (state 1.7)

 ?Warning: UHF not converged
 
 Frozen orbitals:              0 (  0  0  0  0  0  0  0  0)
 Active orbitals:             79 ( 19 11 11  8 11  8  8  3)
 Active electrons:             6
 Spin quantum number:          1.0

 Transformed integrals will be written to file mrcc_21829/fort.55

 Load integrals                2.0 sec
 Transform integrals           2.3 sec
 Storage for integrals:        3835052
 Remaining memory:           *********

 Core energy:               0.00000000
 
 MRCC Input:
     4     0     0     0     3     0     0     7     0     0     0     1     1     0     0     7     0     0   0.000     0   64000
  ex.lev,nsing,ntrip, rest,method,dens,conver,symm, diag, CS ,spatial, HF, ndoub,nacto,nactv, tol, maxex, sacc, freq,  dboc,   mem
  2  0  0  0  0  0  0  0  0  0  0  0  0  0  0  0  0  0  0  2  0  0  0  0  0  0  0  0  0  0  1  0  0  0  0  0  0  0  0  0  0  0  0  0  0  0  0  0  0  1  0  0  0  0  0  0  0  0  0  0  0  0  0  0  0  0  0  0  0  0  0  0  0  0  0  0  0  0  0
 MRCC Input end
 Variable memory released
 MRCC now being run, temporary output in /global/cscratch1/sd/aannabe/mrcc_21829/mrcc.out
 **********************************************************************
                          MRCC program system
 **********************************************************************

                              Written by
  Mihaly Kallay, Zoltan Rolik, Jozsef Csontos, Peter Nagy, Gyula Samu,
      David Mester, Jozsef Csoka, Bernat Szabo, Istvan Ladjanszki,
       Lorant Szegedy, Bence Ladoczki, Klara Petrov, Mate Farkas,
                    Pal D. Mezei, and Bence Hegely

        Department of Physical Chemistry and Materials Science
            Budapest University of Technology and Economics
                  Budapest P.O.Box 91, H-1521 Hungary

                              www.mrcc.hu

                       Release date: May 23, 2018

 ************************ 2018-06-20 13:58:07 *************************
 Executing goldstone...

 Generation of CC equations in terms of H and T...
 Generation of antisymmetrized Goldstone diagrams...
 Number of diagrams in T^1 equations:    15
 Number of diagrams in T^2 equations:    38
 Number of diagrams in T^3 equations:    49
 Number of diagrams in T^4 equations:     5
 Translation of diagrams to factorized equations...
 Optimizing intermediate calculation...
 Number of floating-point operations per iteration step:   4.7913E+10
 Probable CPU time per iteration step (hours):      0.48
 Required memory (Mbytes):    4369.9
 Number of intermediates:                                  79
 Number of intermediates to be stored:                     32
 Length of intermediate file (Mbytes):      80.5

 ************************ 2018-06-20 13:58:08 *************************
 Executing xmrcc...

 **********************************************************************
 CC(3)(4) calculation


 Allocation of4369.9 Mbytes of memory...
 Number of spinorbitals:                   158
 Number of alpha electrons:                        4
 Number of beta electrons:                         2
 Spin multiplicity:                     2
 z-component of spin:  1.0
 Spatial symmetry:                      7
 Convergence criterion:  1.0E-07
 Construction of occupation graphs...
 Number of                     0 -fold excitations:                      1
 Number of                     1 -fold excitations:                     76
 Number of                     2 -fold excitations:                   8550
 Number of                     3 -fold excitations:                 464089
 Total number of configurations:                 472716
 Calculation of coupling coefficients...
 Length of intermediate file (Mbytes):      61.4

 ======================================================================

 Spin case  1   Alpha:  2   Beta:  2
 Number of excitations:                6089985
 Spin case  2   Alpha:  3   Beta:  1
 Number of excitations:                5196246
 Spin case  3   Alpha:  4   Beta:  0
 Number of excitations:                 152628
 Number of                     4 -fold excitations:               11438859

 Memory requirements /Mbyte/:
               Minimal        Optimal
 Real*8:        127.6612       297.2647
 Integer:        21.4621
 Total:         149.1233       318.7268


 ************************ 2018-06-20 13:58:09 *************************
 Executing mrcc...

 **********************************************************************
 CCSDT(Q) calculation


 OpenMP parallel version is running.
 Number of CPUs:   1
 Allocation of  297.3 Mbytes of memory...
 Number of spinorbitals: 158
 Number of alpha electrons:  4
 Number of beta  electrons:  2
 Spin multiplicity: 2
 z-component of spin:  1.0
 Spatial symmetry: 7
 Convergence criterion:  1.0E-07
 Construction of occupation graphs...
 Number of 0-fold excitations: 1
 Number of 1-fold excitations: 76
 Number of 2-fold excitations: 8550
 Number of 3-fold excitations: 464089
 Total number of determinants: 472716
 Calculation of coupling coefficients...
 Initial cluster amplitudes are generated.
 Length of intermediate file (Mbytes):      61.4
 Reading integral list from unit 55...
 Sorting integrals...
 Sorting integrals...
 Sorting integrals...
 Sorting integrals...
 Energy of reference determinant [au]:     -15.708481339994
 Calculation of MP denominators...

 Starting CC iteration...
 ======================================================================
 Norm of residual vector:     1.14068997
 CPU time [min]:     0.200                   Wall time [min]:     0.210

 Iteration  1  CC energy:   -15.88070797  Energy decrease:   0.17222663
 ======================================================================
 Norm of residual vector:     0.23085560
 CPU time [min]:     0.309                   Wall time [min]:     0.318

 Iteration  2  CC energy:   -15.89159314  Energy decrease:   0.01088517
 ======================================================================
 Norm of residual vector:     0.04886998
 CPU time [min]:     0.423                   Wall time [min]:     0.434

 Iteration  3  CC energy:   -15.89837140  Energy decrease:   0.00677826
 ======================================================================
 Norm of residual vector:     0.01504875
 CPU time [min]:     0.536                   Wall time [min]:     0.546

 Iteration  4  CC energy:   -15.89922732  Energy decrease:   0.00085592
 ======================================================================
 Norm of residual vector:     0.00692351
 CPU time [min]:     0.649                   Wall time [min]:     0.662

 Iteration  5  CC energy:   -15.89896777  Energy decrease:   0.00025955
 ======================================================================
 Norm of residual vector:     0.00320441
 CPU time [min]:     0.763                   Wall time [min]:     0.775

 Iteration  6  CC energy:   -15.89897652  Energy decrease:   0.00000875
 ======================================================================
 Norm of residual vector:     0.00155372
 CPU time [min]:     0.876                   Wall time [min]:     0.889

 Iteration  7  CC energy:   -15.89902530  Energy decrease:   0.00004878
 ======================================================================
 Norm of residual vector:     0.00069928
 CPU time [min]:     0.991                   Wall time [min]:     1.004

 Iteration  8  CC energy:   -15.89902954  Energy decrease:   0.00000425
 ======================================================================
 Norm of residual vector:     0.00026975
 CPU time [min]:     1.106                   Wall time [min]:     1.119

 Iteration  9  CC energy:   -15.89902979  Energy decrease:   0.00000024
 ======================================================================
 Norm of residual vector:     0.00010765
 CPU time [min]:     1.221                   Wall time [min]:     1.234

 Iteration 10  CC energy:   -15.89903043  Energy decrease:   0.00000064
 ======================================================================
 Norm of residual vector:     0.00004461
 CPU time [min]:     1.337                   Wall time [min]:     1.350

 Iteration 11  CC energy:   -15.89903009  Energy decrease:   0.00000035
 ======================================================================
 Norm of residual vector:     0.00001501
 CPU time [min]:     1.453                   Wall time [min]:     1.466

 Iteration 12  CC energy:   -15.89902999  Energy decrease:   0.00000010
 ======================================================================
 Norm of residual vector:     0.00000503
 CPU time [min]:     1.569                   Wall time [min]:     1.582

 Iteration 13  CC energy:   -15.89903003  Energy decrease:   0.00000004
 ======================================================================
 Norm of residual vector:     0.00000169
 CPU time [min]:     1.685                   Wall time [min]:     1.698

 Iteration 14  CC energy:   -15.89903003  Energy decrease:   0.00000001
 ======================================================================
 Norm of residual vector:     0.00000056
 CPU time [min]:     1.803                   Wall time [min]:     1.817

 Iteration 15  CC energy:   -15.89903002  Energy decrease:   0.00000001
 ======================================================================
 Norm of residual vector:     0.00000020
 CPU time [min]:     1.920                   Wall time [min]:     1.935

 Iteration 16  CC energy:   -15.89903002  Energy decrease:   8.2922E-10
 ======================================================================
 Norm of residual vector:     0.00000007
 CPU time [min]:     2.030                   Wall time [min]:     2.045

 Iteration 17  CC energy:   -15.89903002  Energy decrease:   9.5977E-10
 ======================================================================

 Iteration has converged in 17 steps.

 Final results:
 Total CCSDT energy [au]:            -15.899030017506
 Total MP2 energy [au]:              -15.880707974188

 Perturbative corrections are calculated...
 ======================================================================
 Spin case  1   Alpha:  2   Beta:  2
 Number of excitations:        6089985
 CPU time [min]:    14.475                   Wall time [min]:    14.490
 ======================================================================
 Spin case  2   Alpha:  3   Beta:  1
 Number of excitations:        5196246
 CPU time [min]:    24.601                   Wall time [min]:    24.616
 ======================================================================
 Spin case  3   Alpha:  4   Beta:  0
 Number of excitations:        152628
 CPU time [min]:    25.631                   Wall time [min]:    25.654
 ======================================================================
 Number of 4-fold excitations: 11438859
 CPU time [min]:    25.631                   Wall time [min]:    25.655

 Total CCSDT[Q] energy [au]:         -15.899012468095
 Total CCSDT(Q) energy [au]:         -15.899114320957

 ************************ 2018-06-20 14:23:49 *************************
                      Normal termination of mrcc.
 **********************************************************************
 !CCSDT STATE 1.7 Energy              -15.899030017506
 !MP2 STATE 1.7 Energy                -15.880707974188
 !CCSDT[Q] STATE 1.7 Energy           -15.899012468095
 !CCSDT(Q) STATE 1.7 Energy           -15.899114320957
 
 CPU-time for MRCC:           1537.9 sec
 Elapsed-time for MRCC:       1542.7 sec

 Variable memory set to 8000000000 words,  buffer space   230000 words



 **********************************************************************************************************************************
 DATASETS  * FILE   NREC   LENGTH (MB)   RECORD NAMES
              1      20       22.81       500      610      700      900      950      970     1000      129      960     1100   
                                          VAR    BASINP    GEOM    SYMINP    ZMAT    AOBASIS   BASIS     P2S    ABASIS      S 
                                         1400     1410     1420     1200     1210     1080     1600     1650     1300     1700   
                                         EKIN       V       ECP      H0       H01     AOSYM     SMH    MOLCAS    ERIS     OPER   

              2       5        5.33       700     1000      520     2100     2200   
                                         GEOM     BASIS   MCVARS     RHF      UHF  

 PROGRAMS   *        TOTAL      MRCC       UHF        HF       INT
 CPU TIMES  *      1546.74   1544.75      0.01      0.07      1.81
 REAL TIME  *      1593.42 SEC
 DISK USED  *        34.49 MB      
 **********************************************************************************************************************************
 SETTING POSTHF(I)      =       -15.89911432  AU                              
                                                                                                                                                                                                                                                                

        SCF            POSTHF        EKIN          POT
    -15.70848134   -15.89911432   11.60826238   -6.64059803
                                                  

 CCSDT(Q)/USERDEF energy=    -15.899114320957

        CCSDT(Q)        UHF-SCF         HF-SCF  
    -15.89911432    -15.70848134    -15.70848134
 **********************************************************************************************************************************
 Variable memory released
