
 Primary working directories    : /global/cscratch1/sd/aannabe
 Secondary working directories  : /global/cscratch1/sd/aannabe
 Wavefunction directory         : /global/homes/a/aannabe/wfu/
 Main file repository           : /global/cscratch1/sd/aannabe/

 SHA1      : 2873118e99aab1bc19f5b6fc1784693c06d15c95
 NAME      : 2015.1.8
 ARCHNAME  : linux/x86_64
 FC        : /opt/cray/pe/craype/2.5.5/bin/ftn
 BLASLIB   : -Wl,-_start-group /opt/intel/compilers_and_libraries_2016.3.210/linux/mkl/lib/intel64/libmkl_intel_ilp64.a /opt/intel/compilers_and_libraries_2016.3.210/linux/mkl/lib/intel64/libmkl_intel_thread.a /opt/intel/compilers_and_libraries_2016.3.210/linux/mkl/lib/intel64/libmkl_core.a -Wl,-_end-group
 id        : lbl

 Nodes     nprocs
 nid00465     1

 Using customized tuning parameters: mindgm=8; mindgv=16; mindgc=4; mindgr=1; noblas=0; minvec=7
 default implementation of scratch files=df  

 ***,O
 memory,8,g
 gthresh,twoint=1.e-12
 
 gprint,basis,orbitals
 gexpec,ekin,pot
 
 angstrom
 geometry={
 1                                                                               ! Number of atoms
 O 0.0 0.0 0.0
 }
 
 basis={
 Including file /global/homes/a/aannabe/docs/totals_bfd/pps/O.pp
 Including file /global/homes/a/aannabe/docs/totals_bfd/basis/aug-cc-pVnZ/O_5z.basis
 }
 
 {hf
 wf,6,7,2
 occ,1,1,1,0,1,0,0,0
                                                                                 !open,1.3
 closed,1,1,0,0,0,0,0,0
                                                                                 !sym,
 }
 scf(i)=energy
 
 _CC_NORM_MAX=2.0
  !NOTE: Perturbative MRCC works only with UHF reference. So, here we will trick MRCC by doing zero UHF iteration right after ROHF.
 
 {uhf
 wf,6,7,2
 occ,1,1,1,0,1,0,0,0
                                                                                 !open,1.3
 closed,1,1,0,0,0,0,0,0
                                                                                 !sym,
 maxit,0
 }
 scf(i)=energy
 
 {mrcc,method=CCSDT(Q)
 orbital,ignore_error=1                                                          !Ignore the fact that UHF WF is not converged
 maxit,100
 core
 }
 posthf(i)=energy
 
 table,scf,posthf,ekin,pot
 save,5.csv,new
 
 

 Variables initialized (889), CPU time= 0.01 sec
 Commands  initialized (702), CPU time= 0.00 sec, 572 directives.
 Default parameters read. Elapsed time= 0.12 sec

 Checking input...
 Passed
1


                                         ***  PROGRAM SYSTEM MOLPRO  ***
                                       Copyright, TTI GmbH Stuttgart, 2015
                                    Version 2015.1 linked Sep  7 2016 23:09:38


 **********************************************************************************************************************************
 LABEL *   O                                                                             
  64 bit serial version                                                                  DATE: 20-Jun-18          TIME: 14:24:26  
 **********************************************************************************************************************************

 SHA1:             2873118e99aab1bc19f5b6fc1784693c06d15c95
 **********************************************************************************************************************************

 THRESHOLDS:

 ZERO    =  1.00D-12  ONEINT  =  1.00D-12  TWOINT  =  1.00D-12  PREFAC  =  1.00D-14  LOCALI  =  1.00D-09  EORDER  =  1.00D-04
 ENERGY  =  0.00D+00  ETEST   =  0.00D+00  EDENS   =  0.00D+00  THRDEDEF=  1.00D-06  GRADIENT=  1.00D-02  STEP    =  1.00D-03
 ORBITAL =  1.00D-05  CIVEC   =  1.00D-05  COEFF   =  1.00D-04  PRINTCI =  5.00D-02  PUNCHCI =  9.90D+01  OPTGRAD =  3.00D-04
 OPTENERG=  1.00D-06  OPTSTEP =  3.00D-04  THRGRAD =  1.00D-10  COMPRESS=  1.00D-11  VARMIN  =  1.00D-07  VARMAX  =  1.00D-03
 THRDOUB =  0.00D+00  THRDIV  =  1.00D-05  THRRED  =  1.00D-07  THRPSP  =  1.00D+00  THRDC   =  1.00D-10  THRCS   =  1.00D-10
 THRNRM  =  1.00D-08  THREQ   =  0.00D+00  THRDE   =  1.00D+00  THRREF  =  1.00D-05  SPARFAC =  1.00D+00  THRDLP  =  1.00D-07
 THRDIA  =  1.00D-10  THRDLS  =  1.00D-07  THRGPS  =  0.00D+00  THRKEX  =  0.00D+00  THRDIS  =  2.00D-01  THRVAR  =  1.00D-10
 THRLOC  =  1.00D-06  THRGAP  =  1.00D-06  THRLOCT = -1.00D+00  THRGAPT = -1.00D+00  THRORB  =  1.00D-06  THRMLTP =  0.00D+00
 THRCPQCI=  1.00D-10  KEXTA   =  0.00D+00  THRCOARS=  0.00D+00  SYMTOL  =  1.00D-06  GRADTOL =  1.00D-06  THROVL  =  1.00D-08
 THRORTH =  1.00D-08  GRID    =  1.00D-06  GRIDMAX =  1.00D-03  DTMAX   =  0.00D+00  THROCCDE=  1.00D-01  THROCCDE=  1.00D-01



 ZUNIT=ANG
 

Geometry recognized as XYZ


 Variable memory set to 8000000000 words,  buffer space   230000 words

 SETTING BASIS          =    USERDEF


 Recomputing integrals since basis changed


 Using spherical harmonics



 PROGRAM * SEWARD (Integral evaluation for generally contracted gaussian basis sets)     Author: Roland Lindh, 1990

 Geometry written to block  1 of record 700

 Orientation using atomic masses  
 Molecule type: Atom
 Symmetry elements: X,Y,Z
 Rotational constants:       0.0000000      0.0000000      0.0000000 GHz  (calculated with average atomic masses)

 Point group  D2h 



 ATOMIC COORDINATES

 NR  ATOM    CHARGE       X              Y              Z

   1  O       6.00    0.000000000    0.000000000    0.000000000


          O   CORE POTENTIAL

          p POTENTIAL

 POWERS             1              3              2
 EXPONENTIALS   9.297939       8.864922       8.629257    
 COEFFICIENTS   6.000000       55.78763      -38.81978    

          s - p POTENTIAL

 POWERS             2
 EXPONENTIALS   8.719245    
 COEFFICIENTS   38.41914    


 BASIS DATA

   Nr Sym  Nuc  Type         Exponents   Contraction coefficients

    1.1 Ag    1  1s           0.125346     0.055741
                              0.268022     0.304848
                              0.573098     0.453752
                              1.225429     0.295926
                              2.620277     0.019567
                              5.602818    -0.128627
                             11.980245     0.012024
                             25.616801     0.000407
                             54.775216    -0.000076
    2.1 Ag    1  1s           0.064266     1.000000
    3.1 Ag    1  1s           0.160664     1.000000
    4.1 Ag    1  1s           0.384526     1.000000
    5.1 Ag    1  1s           0.935157     1.000000
    6.1 Ag    1  1s           1.937532     1.000000
    7.1 Ag    1  3d0          0.160461     1.000000
    8.1 Ag    1  3d2+         0.160461     1.000000
    9.1 Ag    1  3d0          0.401152     1.000000
   10.1 Ag    1  3d2+         0.401152     1.000000
   11.1 Ag    1  3d0          1.174596     1.000000
   12.1 Ag    1  3d2+         1.174596     1.000000
   13.1 Ag    1  3d0          2.823972     1.000000
   14.1 Ag    1  3d2+         2.823972     1.000000
   15.1 Ag    1  3d0          4.292433     1.000000
   16.1 Ag    1  3d2+         4.292433     1.000000
   17.1 Ag    1  5g0          0.483063     1.000000
   18.1 Ag    1  5g4+         0.483063     1.000000
   19.1 Ag    1  5g2+         0.483063     1.000000
   20.1 Ag    1  5g0          1.207657     1.000000
   21.1 Ag    1  5g4+         1.207657     1.000000
   22.1 Ag    1  5g2+         1.207657     1.000000
   23.1 Ag    1  5g0          3.584495     1.000000
   24.1 Ag    1  5g4+         3.584495     1.000000
   25.1 Ag    1  5g2+         3.584495     1.000000
    1.2 B3u   1  2px          0.083598     0.044958
                              0.167017     0.150175
                              0.333673     0.255999
                              0.666627     0.281879
                              1.331816     0.242835
                              2.660761     0.161134
                              5.315785     0.082308
                             10.620108     0.039899
                             21.217318     0.004679
    2.2 B3u   1  2px          0.052232     1.000000
    3.2 B3u   1  2px          0.130580     1.000000
    4.2 B3u   1  2px          0.372674     1.000000
    5.2 B3u   1  2px          1.178227     1.000000
    6.2 B3u   1  2px          1.589967     1.000000
    7.2 B3u   1  4f1+         0.283466     1.000000
    8.2 B3u   1  4f3+         0.283466     1.000000
    9.2 B3u   1  4f1+         0.708666     1.000000
   10.2 B3u   1  4f3+         0.708666     1.000000
   11.2 B3u   1  4f1+         2.006788     1.000000
   12.2 B3u   1  4f3+         2.006788     1.000000
   13.2 B3u   1  4f1+         3.223721     1.000000
   14.2 B3u   1  4f3+         3.223721     1.000000
   15.2 B3u   1  6h1+         1.046327     1.000000
   16.2 B3u   1  6h3+         1.046327     1.000000
   17.2 B3u   1  6h5+         1.046327     1.000000
   18.2 B3u   1  6h1+         2.615818     1.000000
   19.2 B3u   1  6h3+         2.615818     1.000000
   20.2 B3u   1  6h5+         2.615818     1.000000
    1.3 B2u   1  2py          0.083598     0.044958
                              0.167017     0.150175
                              0.333673     0.255999
                              0.666627     0.281879
                              1.331816     0.242835
                              2.660761     0.161134
                              5.315785     0.082308
                             10.620108     0.039899
                             21.217318     0.004679
    2.3 B2u   1  2py          0.052232     1.000000
    3.3 B2u   1  2py          0.130580     1.000000
    4.3 B2u   1  2py          0.372674     1.000000
    5.3 B2u   1  2py          1.178227     1.000000
    6.3 B2u   1  2py          1.589967     1.000000
    7.3 B2u   1  4f1-         0.283466     1.000000
    8.3 B2u   1  4f3-         0.283466     1.000000
    9.3 B2u   1  4f1-         0.708666     1.000000
   10.3 B2u   1  4f3-         0.708666     1.000000
   11.3 B2u   1  4f1-         2.006788     1.000000
   12.3 B2u   1  4f3-         2.006788     1.000000
   13.3 B2u   1  4f1-         3.223721     1.000000
   14.3 B2u   1  4f3-         3.223721     1.000000
   15.3 B2u   1  6h1-         1.046327     1.000000
   16.3 B2u   1  6h3-         1.046327     1.000000
   17.3 B2u   1  6h5-         1.046327     1.000000
   18.3 B2u   1  6h1-         2.615818     1.000000
   19.3 B2u   1  6h3-         2.615818     1.000000
   20.3 B2u   1  6h5-         2.615818     1.000000
    1.4 B1g   1  3d2-         0.160461     1.000000
    2.4 B1g   1  3d2-         0.401152     1.000000
    3.4 B1g   1  3d2-         1.174596     1.000000
    4.4 B1g   1  3d2-         2.823972     1.000000
    5.4 B1g   1  3d2-         4.292433     1.000000
    6.4 B1g   1  5g2-         0.483063     1.000000
    7.4 B1g   1  5g4-         0.483063     1.000000
    8.4 B1g   1  5g2-         1.207657     1.000000
    9.4 B1g   1  5g4-         1.207657     1.000000
   10.4 B1g   1  5g2-         3.584495     1.000000
   11.4 B1g   1  5g4-         3.584495     1.000000
    1.5 B1u   1  2pz          0.083598     0.044958
                              0.167017     0.150175
                              0.333673     0.255999
                              0.666627     0.281879
                              1.331816     0.242835
                              2.660761     0.161134
                              5.315785     0.082308
                             10.620108     0.039899
                             21.217318     0.004679
    2.5 B1u   1  2pz          0.052232     1.000000
    3.5 B1u   1  2pz          0.130580     1.000000
    4.5 B1u   1  2pz          0.372674     1.000000
    5.5 B1u   1  2pz          1.178227     1.000000
    6.5 B1u   1  2pz          1.589967     1.000000
    7.5 B1u   1  4f0          0.283466     1.000000
    8.5 B1u   1  4f2+         0.283466     1.000000
    9.5 B1u   1  4f0          0.708666     1.000000
   10.5 B1u   1  4f2+         0.708666     1.000000
   11.5 B1u   1  4f0          2.006788     1.000000
   12.5 B1u   1  4f2+         2.006788     1.000000
   13.5 B1u   1  4f0          3.223721     1.000000
   14.5 B1u   1  4f2+         3.223721     1.000000
   15.5 B1u   1  6h2+         1.046327     1.000000
   16.5 B1u   1  6h4+         1.046327     1.000000
   17.5 B1u   1  6h0          1.046327     1.000000
   18.5 B1u   1  6h2+         2.615818     1.000000
   19.5 B1u   1  6h4+         2.615818     1.000000
   20.5 B1u   1  6h0          2.615818     1.000000
    1.6 B2g   1  3d1+         0.160461     1.000000
    2.6 B2g   1  3d1+         0.401152     1.000000
    3.6 B2g   1  3d1+         1.174596     1.000000
    4.6 B2g   1  3d1+         2.823972     1.000000
    5.6 B2g   1  3d1+         4.292433     1.000000
    6.6 B2g   1  5g1+         0.483063     1.000000
    7.6 B2g   1  5g3+         0.483063     1.000000
    8.6 B2g   1  5g1+         1.207657     1.000000
    9.6 B2g   1  5g3+         1.207657     1.000000
   10.6 B2g   1  5g1+         3.584495     1.000000
   11.6 B2g   1  5g3+         3.584495     1.000000
    1.7 B3g   1  3d1-         0.160461     1.000000
    2.7 B3g   1  3d1-         0.401152     1.000000
    3.7 B3g   1  3d1-         1.174596     1.000000
    4.7 B3g   1  3d1-         2.823972     1.000000
    5.7 B3g   1  3d1-         4.292433     1.000000
    6.7 B3g   1  5g1-         0.483063     1.000000
    7.7 B3g   1  5g3-         0.483063     1.000000
    8.7 B3g   1  5g1-         1.207657     1.000000
    9.7 B3g   1  5g3-         1.207657     1.000000
   10.7 B3g   1  5g1-         3.584495     1.000000
   11.7 B3g   1  5g3-         3.584495     1.000000
    1.8 Au    1  4f2-         0.283466     1.000000
    2.8 Au    1  4f2-         0.708666     1.000000
    3.8 Au    1  4f2-         2.006788     1.000000
    4.8 Au    1  4f2-         3.223721     1.000000
    5.8 Au    1  6h4-         1.046327     1.000000
    6.8 Au    1  6h2-         1.046327     1.000000
    7.8 Au    1  6h4-         2.615818     1.000000
    8.8 Au    1  6h2-         2.615818     1.000000

 NUCLEAR CHARGE:                    6
 NUMBER OF PRIMITIVE AOS:         213
 NUMBER OF SYMMETRY AOS:          158
 NUMBER OF CONTRACTIONS:          126   (  25Ag  +  20B3u +  20B2u +  11B1g +  20B1u +  11B2g +  11B3g +   8Au  )
 NUMBER OF CORE ORBITALS:           0   (   0Ag  +   0B3u +   0B2u +   0B1g +   0B1u +   0B2g +   0B3g +   0Au  )
 NUMBER OF VALENCE ORBITALS:        4   (   1Ag  +   1B3u +   1B2u +   0B1g +   1B1u +   0B2g +   0B3g +   0Au  )


 NUCLEAR REPULSION ENERGY    0.00000000

 EXTRA SYMMETRY OF AOS IN SYMMETRY 1:   1 1 1 1 1 1 2 3 2 3   2 3 2 3 2 3 4 5 6 4   5 6 4 5 6
 EXTRA SYMMETRY OF AOS IN SYMMETRY 2:   1 1 1 1 1 1 2 3 2 3   2 3 2 3 4 5 6 4 5 6
 EXTRA SYMMETRY OF AOS IN SYMMETRY 3:   1 1 1 1 1 1 2 3 2 3   2 3 2 3 4 5 6 4 5 6
 EXTRA SYMMETRY OF AOS IN SYMMETRY 4:   1 1 1 1 1 2 3 2 3 2   3
 EXTRA SYMMETRY OF AOS IN SYMMETRY 5:   1 1 1 1 1 1 2 3 2 3   2 3 2 3 4 5 6 4 5 6
 EXTRA SYMMETRY OF AOS IN SYMMETRY 6:   1 1 1 1 1 2 3 2 3 2   3
 EXTRA SYMMETRY OF AOS IN SYMMETRY 7:   1 1 1 1 1 2 3 2 3 2   3
 EXTRA SYMMETRY OF AOS IN SYMMETRY 8:   1 1 1 1 2 3 2 3

 Eigenvalues of metric

         1 0.958E-03 0.693E-02 0.225E-01 0.225E-01 0.480E-01 0.148E+00 0.148E+00 0.282E+00
         2 0.412E-02 0.193E-01 0.611E-01 0.611E-01 0.841E-01 0.329E+00 0.329E+00 0.441E+00
         3 0.412E-02 0.193E-01 0.611E-01 0.611E-01 0.841E-01 0.329E+00 0.329E+00 0.441E+00
         4 0.225E-01 0.148E+00 0.309E+00 0.309E+00 0.522E+00 0.911E+00 0.911E+00 0.157E+01
         5 0.412E-02 0.193E-01 0.611E-01 0.611E-01 0.841E-01 0.329E+00 0.329E+00 0.441E+00
         6 0.225E-01 0.148E+00 0.309E+00 0.309E+00 0.522E+00 0.911E+00 0.911E+00 0.157E+01
         7 0.225E-01 0.148E+00 0.309E+00 0.309E+00 0.522E+00 0.911E+00 0.911E+00 0.157E+01
         8 0.611E-01 0.329E+00 0.483E+00 0.483E+00 0.126E+01 0.152E+01 0.152E+01 0.235E+01


 Contracted 2-electron integrals neglected if value below      1.0D-12
 AO integral compression algorithm  1   Integral accuracy      1.0D-12

     31.982 MB (compressed) written to integral file ( 57.5%)


 NUMBER OF SORTED TWO-ELECTRON INTEGRALS:    4156552.     BUFFER LENGTH:  32768
 NUMBER OF SEGMENTS:   1  SEGMENT LENGTH:    4156552      RECORD LENGTH: 524288

 Memory used in sort:       4.71 MW

 SORT1 READ     6989366. AND WROTE     2907704. INTEGRALS IN      9 RECORDS. CPU TIME:     0.19 SEC, REAL TIME:     0.29 SEC
 SORT2 READ     2907704. AND WROTE     4156552. INTEGRALS IN    122 RECORDS. CPU TIME:     0.16 SEC, REAL TIME:     0.32 SEC

 FILE SIZES:   FILE 1:    51.4 MBYTE,  FILE 4:    37.8 MBYTE,   TOTAL:     89.2 MBYTE

 OPERATOR DM      FOR CENTER  0  COORDINATES:    0.000000    0.000000    0.000000
 OPERATOR EKIN    FOR CENTER  0  COORDINATES:    0.000000    0.000000    0.000000
 OPERATOR POT     FOR CENTER  0  COORDINATES:    0.000000    0.000000    0.000000


 **********************************************************************************************************************************
 DATASETS  * FILE   NREC   LENGTH (MB)   RECORD NAMES
              1      20       38.64       500      610      700      900      950      970     1000      129      960     1100   
                                          VAR    BASINP    GEOM    SYMINP    ZMAT    AOBASIS   BASIS     P2S    ABASIS      S 
                                         1400     1410     1420     1200     1210     1080     1600     1650     1300     1700   
                                         EKIN       V       ECP      H0       H01     AOSYM     SMH    MOLCAS    ERIS     OPER   

 PROGRAMS   *        TOTAL       INT
 CPU TIMES  *         3.17      3.07
 REAL TIME  *        13.32 SEC
 DISK USED  *        89.53 MB      
 **********************************************************************************************************************************


 PROGRAM * RHF-SCF (OPEN SHELL)       Authors: W. Meyer, H.-J. Werner


 NUMBER OF ELECTRONS:       4+    2-    SPACE SYMMETRY=7    SPIN SYMMETRY: Triplet 
 CONVERGENCE THRESHOLDS:    1.00E-05 (Density)    1.00E-07 (Energy)
 MAX. NUMBER OF ITERATIONS:       60
 INTERPOLATION TYPE:            DIIS
 INTERPOLATION STEPS:              2 (START)      1 (STEP)
 LEVEL SHIFTS:                 -0.60 (CLOSED) -0.30 (OPEN) 

 Number of closed-shell orbitals:    2 (   1   1   0   0   0   0   0   0 )
 Number of open-shell orbitals:      2 (   0   0   1   0   1   0   0   0 )



   Atom=O  basis=ECP2MWB_GUESS     lmin=0  lmax=1

 Orbital guess generated from atomic densities. Full valence occupancy:    1   1   1   0   1   0   0   0


 Molecular orbital dump at record        2100.2

 ITERATION    DDIFF          GRAD             ENERGY        2-EL.EN.            DIPOLE MOMENTS         DIIS   ORB.
    1      0.000D+00      0.000D+00       -15.68685103     20.550665    0.00000    0.00000    0.00000    0    start
    2      0.000D+00      0.139D-01       -15.70695306     21.317195    0.00000    0.00000    0.00000    1    diag,B
    3      0.880D-02      0.341D-02       -15.70808097     21.338899    0.00000    0.00000    0.00000    2    diag,B
    4      0.173D-02      0.136D-02       -15.70845031     21.366950    0.00000    0.00000    0.00000    3    diag,B
    5      0.110D-02      0.347D-03       -15.70847880     21.370795    0.00000    0.00000    0.00000    4    diag,B
    6      0.370D-03      0.710D-04       -15.70847984     21.369619    0.00000    0.00000    0.00000    5    diag,B
    7      0.977D-04      0.174D-04       -15.70847991     21.369390    0.00000    0.00000    0.00000    6    fixocc
    8      0.251D-04      0.442D-05       -15.70847991     21.369313    0.00000    0.00000    0.00000    7    diag,B
    9      0.624D-05      0.113D-05       -15.70847991     21.369313    0.00000    0.00000    0.00000    0    orth

 Final alpha occupancy:   1   1   1   0   1   0   0   0
 Final beta  occupancy:   1   1   0   0   0   0   0   0

 !RHF STATE 1.7 Energy                -15.708479914772
 Nuclear energy                         0.00000000
 One-electron energy                  -26.39313650
 Two-electron energy                   10.68465658
 Virial quotient                       -1.35319736
 !RHF STATE 1.7 Dipole moment           0.00000000     0.00000000     0.00000000
 Dipole moment /Debye                   0.00000000     0.00000000     0.00000000
 

 !RHF expec          <1.7|EKIN|1.7>    11.608417485069
 
 !RHF expec           <1.7|POT|1.7>    -6.640620342163

 ELECTRON ORBITALS
 =================


   Orb  Occ    Energy  Couls-En    Coefficients

                                   1 1s      1 1s      1 1s      1 1s      1 1s      1 1s      1 3d0     1 3d2+    1 3d0     1 3d2+ 
                                   1 3d0     1 3d2+    1 3d0     1 3d2+    1 3d0     1 3d2+    1 5g0     1 5g4+    1 5g2+    1 5g0  
                                   1 5g4+    1 5g2+    1 5g0     1 5g4+    1 5g2+ 

   1.1   2    -1.2427   -6.0706  1.000175  0.000271 -0.000539  0.000357 -0.000351  0.000111 -0.001013  0.001755 -0.001377  0.002385
                                -0.000326  0.000564  0.000167 -0.000289 -0.000490  0.000849 -0.000009 -0.000018  0.000014 -0.000001
                                -0.000002  0.000001 -0.000000 -0.000001  0.000000

                                   1 2px     1 2px     1 2px     1 2px     1 2px     1 2px     1 4f1+    1 4f3+    1 4f1+    1 4f3+ 
                                   1 4f1+    1 4f3+    1 4f1+    1 4f3+    1 6h1+    1 6h3+    1 6h5+    1 6h1+    1 6h3+    1 6h5+ 


   1.2   2    -0.5664   -4.7060  1.000028  0.000348 -0.000784  0.000284  0.000080 -0.000010  0.001023 -0.001320  0.002076 -0.002680
                                 0.000890 -0.001149  0.000388 -0.000500  0.000009 -0.000010  0.000014  0.000003 -0.000003  0.000004

                                   1 2py     1 2py     1 2py     1 2py     1 2py     1 2py     1 4f1-    1 4f3-    1 4f1-    1 4f3- 
                                   1 4f1-    1 4f3-    1 4f1-    1 4f3-    1 6h1-    1 6h3-    1 6h5-    1 6h1-    1 6h3-    1 6h5- 


   1.3   +    -0.7029   -4.9319  1.037415 -0.005352 -0.053883 -0.016972  0.011638 -0.000417  0.000495 -0.001918  0.001440 -0.005577
                                 0.000666 -0.002578  0.000300 -0.001161  0.000007 -0.000024  0.000053  0.000003 -0.000009  0.000021

                                   1 2pz     1 2pz     1 2pz     1 2pz     1 2pz     1 2pz     1 4f0     1 4f2+    1 4f0     1 4f2+ 
                                   1 4f0     1 4f2+    1 4f0     1 4f2+    1 6h2+    1 6h4+    1 6h0     1 6h2+    1 6h4+    1 6h0  


   1.5   +    -0.7029   -4.9319  1.037415 -0.005352 -0.053883 -0.016972  0.011638 -0.000417  0.001213 -0.001566  0.003527 -0.004553
                                 0.001631 -0.002105  0.000734 -0.000948 -0.000039  0.000034  0.000028 -0.000015  0.000013  0.000011

 HOMO      1.2    -0.566359 =     -15.4114eV
 LUMO      2.1     0.110728 =       3.0131eV
 LUMO-HOMO         0.677087 =      18.4245eV


 **********************************************************************************************************************************
 DATASETS  * FILE   NREC   LENGTH (MB)   RECORD NAMES
              1      20       38.64       500      610      700      900      950      970     1000      129      960     1100   
                                          VAR    BASINP    GEOM    SYMINP    ZMAT    AOBASIS   BASIS     P2S    ABASIS      S 
                                         1400     1410     1420     1200     1210     1080     1600     1650     1300     1700   
                                         EKIN       V       ECP      H0       H01     AOSYM     SMH    MOLCAS    ERIS     OPER   

              2       4        2.83       700     1000      520     2100   
                                         GEOM     BASIS   MCVARS     RHF  

 PROGRAMS   *        TOTAL        HF       INT
 CPU TIMES  *         3.35      0.18      3.07
 REAL TIME  *        13.64 SEC
 DISK USED  *        89.53 MB      
 **********************************************************************************************************************************
 SETTING SCF(I)         =       -15.70847991  AU                              
 SETTING _CC_NORM_MAX   =         2.00000000                                  


 PROGRAM * UHF-SCF       Authors: W. Meyer, H.-J. Werner


 NUMBER OF ELECTRONS:       4+    2-    SPACE SYMMETRY=7    SPIN SYMMETRY: Triplet 
 CONVERGENCE THRESHOLDS:    1.00E-05 (Density)    1.00E-07 (Energy)
 MAX. NUMBER OF ITERATIONS:        0
 INTERPOLATION TYPE:            DIIS
 INTERPOLATION STEPS:              2 (START)      1 (STEP)
 LEVEL SHIFTS:                  0.20 (ALPHA)   0.20 (BETA) 

 Number of closed-shell orbitals:    2 (   1   1   0   0   0   0   0   0 )
 Number of open-shell orbitals:      2 (   0   0   1   0   1   0   0   0 )


 Molecular orbitals read from record     2100.2  Type=RHF/CANONICAL (state 1.7)

 Molecular orbital dump at record        2200.2

 Initial alpha occupation   1   1   1   0   1   0   0   0
 Initial beta  occupation   1   1   0   0   0   0   0   0

 ITERATION    DDIFF          GRAD             ENERGY        2-EL.EN.            DIPOLE MOMENTS         DIIS
    1      0.000D+00      0.000D+00       -15.70847991     21.369313    0.00000    0.00000    0.00000    0
 
 Final alpha occupancy:   1   1   1   0   1   0   0   0
 Final beta  occupancy:   1   1   0   0   0   0   0   0

 !UHF STATE 1.7 Energy                -15.708479914772
 Nuclear energy                         0.00000000
 One-electron energy                  -26.39313650
 Two-electron energy                   10.68465658
 Virial quotient                       -1.35319736
 !UHF STATE 1.7 Dipole moment           0.00000000     0.00000000     0.00000000
 Dipole moment /Debye                   0.00000000     0.00000000     0.00000000
 

 !UHF expec          <1.7|EKIN|1.7>    11.608417485069
 
 !UHF expec           <1.7|POT|1.7>    -6.640620342163

 ELECTRON ORBITALS FOR POSITIVE SPIN
 ===================================


   Orb  Occ    Energy  Couls-En    Coefficients

                                   1 1s      1 1s      1 1s      1 1s      1 1s      1 1s      1 3d0     1 3d2+    1 3d0     1 3d2+ 
                                   1 3d0     1 3d2+    1 3d0     1 3d2+    1 3d0     1 3d2+    1 5g0     1 5g4+    1 5g2+    1 5g0  
                                   1 5g4+    1 5g2+    1 5g0     1 5g4+    1 5g2+ 

   1.1   +    -1.2427   -6.0706  1.000175  0.000271 -0.000539  0.000357 -0.000351  0.000111 -0.001013  0.001755 -0.001377  0.002385
                                -0.000326  0.000564  0.000167 -0.000289 -0.000490  0.000849 -0.000009 -0.000018  0.000014 -0.000001
                                -0.000002  0.000001 -0.000000 -0.000001  0.000000

                                   1 2px     1 2px     1 2px     1 2px     1 2px     1 2px     1 4f1+    1 4f3+    1 4f1+    1 4f3+ 
                                   1 4f1+    1 4f3+    1 4f1+    1 4f3+    1 6h1+    1 6h3+    1 6h5+    1 6h1+    1 6h3+    1 6h5+ 


   1.2   +    -0.5664   -4.7060  1.000028  0.000348 -0.000784  0.000284  0.000080 -0.000010  0.001023 -0.001320  0.002076 -0.002680
                                 0.000890 -0.001149  0.000388 -0.000500  0.000009 -0.000010  0.000014  0.000003 -0.000003  0.000004

                                   1 2py     1 2py     1 2py     1 2py     1 2py     1 2py     1 4f1-    1 4f3-    1 4f1-    1 4f3- 
                                   1 4f1-    1 4f3-    1 4f1-    1 4f3-    1 6h1-    1 6h3-    1 6h5-    1 6h1-    1 6h3-    1 6h5- 


   1.3   +    -0.7029   -4.9319  1.037415 -0.005352 -0.053883 -0.016972  0.011638 -0.000417  0.000495 -0.001918  0.001440 -0.005577
                                 0.000666 -0.002578  0.000300 -0.001161  0.000007 -0.000024  0.000053  0.000003 -0.000009  0.000021

                                   1 2pz     1 2pz     1 2pz     1 2pz     1 2pz     1 2pz     1 4f0     1 4f2+    1 4f0     1 4f2+ 
                                   1 4f0     1 4f2+    1 4f0     1 4f2+    1 6h2+    1 6h4+    1 6h0     1 6h2+    1 6h4+    1 6h0  


   1.5   +    -0.7029   -4.9319  1.037415 -0.005352 -0.053883 -0.016972  0.011638 -0.000417  0.001213 -0.001566  0.003527 -0.004553
                                 0.001631 -0.002105  0.000734 -0.000948 -0.000039  0.000034  0.000028 -0.000015  0.000013  0.000011

 ELECTRON ORBITALS FOR NEGATIVE SPIN
 ===================================


   Orb  Occ    Energy  Couls-En    Coefficients

                                   1 1s      1 1s      1 1s      1 1s      1 1s      1 1s      1 3d0     1 3d2+    1 3d0     1 3d2+ 
                                   1 3d0     1 3d2+    1 3d0     1 3d2+    1 3d0     1 3d2+    1 5g0     1 5g4+    1 5g2+    1 5g0  
                                   1 5g4+    1 5g2+    1 5g0     1 5g4+    1 5g2+ 

   1.1   -    -1.2427   -6.0706  1.000175  0.000271 -0.000539  0.000357 -0.000351  0.000111 -0.001013  0.001755 -0.001377  0.002385
                                -0.000326  0.000564  0.000167 -0.000289 -0.000490  0.000849 -0.000009 -0.000018  0.000014 -0.000001
                                -0.000002  0.000001 -0.000000 -0.000001  0.000000

                                   1 2px     1 2px     1 2px     1 2px     1 2px     1 2px     1 4f1+    1 4f3+    1 4f1+    1 4f3+ 
                                   1 4f1+    1 4f3+    1 4f1+    1 4f3+    1 6h1+    1 6h3+    1 6h5+    1 6h1+    1 6h3+    1 6h5+ 


   1.2   -    -0.5664   -4.7060  1.000028  0.000348 -0.000784  0.000284  0.000080 -0.000010  0.001023 -0.001320  0.002076 -0.002680
                                 0.000890 -0.001149  0.000388 -0.000500  0.000009 -0.000010  0.000014  0.000003 -0.000003  0.000004

 HOMO      1.2    -0.566359 =     -15.4114eV
 LUMO     -1.3    -0.702861 =     -19.1258eV
 LUMO-HOMO        -0.136503 =      -3.7144eV

 EXPECTATION VALUE OF S**2:             2.00000000

 Occupation number threshold for canonical orbitals:  1.999000 (occupied),  0.001000 (virtual)

 Number of pseudo-canonical orbitals per symmetry:    1   1   0   0   0   0   0   0
 Number of active natural orbitals per symmetry:      0   0   1   0   1   0   0   0

 NATURAL CHARGE ORBITALS
 =======================


   Orb     Occ        Energy       Coefficients

                                   1 1s      1 1s      1 1s      1 1s      1 1s      1 1s      1 3d0     1 3d2+    1 3d0     1 3d2+ 
                                   1 3d0     1 3d2+    1 3d0     1 3d2+    1 3d0     1 3d2+    1 5g0     1 5g4+    1 5g2+    1 5g0  
                                   1 5g4+    1 5g2+    1 5g0     1 5g4+    1 5g2+ 

   1.1  2.00000    -1.242692     1.000175  0.000271 -0.000539  0.000357 -0.000351  0.000111 -0.001013  0.001755 -0.001377  0.002385
                                -0.000326  0.000564  0.000167 -0.000289 -0.000490  0.000849 -0.000009 -0.000018  0.000014 -0.000001
                                -0.000002  0.000001 -0.000000 -0.000001  0.000000

                                   1 2px     1 2px     1 2px     1 2px     1 2px     1 2px     1 4f1+    1 4f3+    1 4f1+    1 4f3+ 
                                   1 4f1+    1 4f3+    1 4f1+    1 4f3+    1 6h1+    1 6h3+    1 6h5+    1 6h1+    1 6h3+    1 6h5+ 


   1.2  2.00000    -0.566359     1.000028  0.000348 -0.000784  0.000284  0.000080 -0.000010  0.001023 -0.001320  0.002076 -0.002680
                                 0.000890 -0.001149  0.000388 -0.000500  0.000009 -0.000010  0.000014  0.000003 -0.000003  0.000004

                                   1 2py     1 2py     1 2py     1 2py     1 2py     1 2py     1 4f1-    1 4f3-    1 4f1-    1 4f3- 
                                   1 4f1-    1 4f3-    1 4f1-    1 4f3-    1 6h1-    1 6h3-    1 6h5-    1 6h1-    1 6h3-    1 6h5- 


   1.3  1.00000    -0.266306     1.037415 -0.005352 -0.053883 -0.016972  0.011638 -0.000417  0.000495 -0.001918  0.001440 -0.005577
                                 0.000666 -0.002578  0.000300 -0.001161  0.000007 -0.000024  0.000053  0.000003 -0.000009  0.000021

                                   1 2pz     1 2pz     1 2pz     1 2pz     1 2pz     1 2pz     1 4f0     1 4f2+    1 4f0     1 4f2+ 
                                   1 4f0     1 4f2+    1 4f0     1 4f2+    1 6h2+    1 6h4+    1 6h0     1 6h2+    1 6h4+    1 6h0  


   1.5  1.00000    -0.266306     1.037415 -0.005352 -0.053883 -0.016972  0.011638 -0.000417  0.001213 -0.001566  0.003527 -0.004553
                                 0.001631 -0.002105  0.000734 -0.000948 -0.000039  0.000034  0.000028 -0.000015  0.000013  0.000011

 Natural orbitals saved to record    2200.2 (Orbital set 3)

 Orbital spaces for UNO-CAS (Min. occupation: 0.020  Max. occupation: 1.980):

 Closed:        1   1   0   0   0   0   0   0
 Active:        0   0   1   0   1   0   0   0

 No convergence



 **********************************************************************************************************************************
 DATASETS  * FILE   NREC   LENGTH (MB)   RECORD NAMES
              1      20       38.64       500      610      700      900      950      970     1000      129      960     1100   
                                          VAR    BASINP    GEOM    SYMINP    ZMAT    AOBASIS   BASIS     P2S    ABASIS      S 
                                         1400     1410     1420     1200     1210     1080     1600     1650     1300     1700   
                                         EKIN       V       ECP      H0       H01     AOSYM     SMH    MOLCAS    ERIS     OPER   

              2       5        5.45       700     1000      520     2100     2200   
                                         GEOM     BASIS   MCVARS     RHF      UHF  

 PROGRAMS   *        TOTAL       UHF        HF       INT
 CPU TIMES  *         3.37      0.02      0.18      3.07
 REAL TIME  *        13.90 SEC
 DISK USED  *        89.53 MB      
 **********************************************************************************************************************************
 SETTING SCF(I)         =       -15.70847991  AU                              


 PROGRAM * MRCC (General Multireference Coupled Cluster)    Author: M. Kallay, 2000-2005

 ***  Initialisation ***

   0 Spin projections
 
 Molecular orbitals read from record     2200.2  Type=UHF/ALPHA (state 1.7)

 ?Warning: UHF not converged
 Molecular orbitals read from record     2200.2  Type=UHF/BETA (state 1.7)

 ?Warning: UHF not converged
 
 Frozen orbitals:              0 (  0  0  0  0  0  0  0  0)
 Active orbitals:            126 ( 25 20 20 11 20 11 11  8)
 Active electrons:             6
 Spin quantum number:          1.0

 Transformed integrals will be written to file mrcc_26830/fort.55

 Load integrals                3.4 sec
 Transform integrals           5.6 sec
 Storage for integrals:       24278327
 Remaining memory:           *********

 Core energy:               0.00000000
 
 MRCC Input:
     4     0     0     0     3     0     0     7     0     0     0     1     1     0     0     7     0     0   0.000     0   64000
  ex.lev,nsing,ntrip, rest,method,dens,conver,symm, diag, CS ,spatial, HF, ndoub,nacto,nactv, tol, maxex, sacc, freq,  dboc,   mem
  2  0  0  0  0  0  0  0  0  0  0  0  0  0  0  0  0  0  0  0  0  0  0  0  0  2  0  0  0  0  0  0  0  0  0  0  0  0  0  0  0  0  0  0  0  1  0  0  0  0  0  0  0  0  0  0  0  0  0  0  0  0  0  0  0  0  0  0  0  0  0  0  0  0  0  0  1  0  0  0  0  0  0  0  0  0  0  0  0  0  0  0  0  0  0  0  0  0  0  0  0  0  0  0  0  0  0  0  0  0  0  0  0  0  0  0  0  0  0  0  0  0  0  0  0  0
 MRCC Input end
 Variable memory released
 MRCC now being run, temporary output in /global/cscratch1/sd/aannabe/mrcc_26830/mrcc.out
 **********************************************************************
                          MRCC program system
 **********************************************************************

                              Written by
  Mihaly Kallay, Zoltan Rolik, Jozsef Csontos, Peter Nagy, Gyula Samu,
      David Mester, Jozsef Csoka, Bernat Szabo, Istvan Ladjanszki,
       Lorant Szegedy, Bence Ladoczki, Klara Petrov, Mate Farkas,
                    Pal D. Mezei, and Bence Hegely

        Department of Physical Chemistry and Materials Science
            Budapest University of Technology and Economics
                  Budapest P.O.Box 91, H-1521 Hungary

                              www.mrcc.hu

                       Release date: May 23, 2018

 ************************ 2018-06-20 14:29:07 *************************
 Executing goldstone...

 Generation of CC equations in terms of H and T...
 Generation of antisymmetrized Goldstone diagrams...
 Number of diagrams in T^1 equations:    15
 Number of diagrams in T^2 equations:    38
 Number of diagrams in T^3 equations:    49
 Number of diagrams in T^4 equations:     5
 Translation of diagrams to factorized equations...
 Optimizing intermediate calculation...
 Number of floating-point operations per iteration step:   5.2358E+11
 Probable CPU time per iteration step (hours):      5.24
 Required memory (Mbytes):   29863.8
 Number of intermediates:                                  79
 Number of intermediates to be stored:                     32
 Length of intermediate file (Mbytes):     503.7

 ************************ 2018-06-20 14:29:07 *************************
 Executing xmrcc...

 **********************************************************************
 CC(3)(4) calculation


 Allocation of****** Mbytes of memory...
 Number of spinorbitals:                   252
 Number of alpha electrons:                        4
 Number of beta electrons:                         2
 Spin multiplicity:                     2
 z-component of spin:  1.0
 Spatial symmetry:                      7
 Convergence criterion:  1.0E-07
 Construction of occupation graphs...
 Number of                     0 -fold excitations:                      1
 Number of                     1 -fold excitations:                    124
 Number of                     2 -fold excitations:                  22268
 Number of                     3 -fold excitations:                1986216
 Total number of configurations:                2008609
 Calculation of coupling coefficients...
 Length of intermediate file (Mbytes):     381.0

 ======================================================================

 Spin case  1   Alpha:  2   Beta:  2
 Number of excitations:               42216485
 Spin case  2   Alpha:  3   Beta:  1
 Number of excitations:               36589408
 Spin case  3   Alpha:  4   Beta:  0
 Number of excitations:                1099202
 Number of                     4 -fold excitations:               79905095

 Memory requirements /Mbyte/:
               Minimal        Optimal
 Real*8:        786.3175      1923.2150
 Integer:        79.5111
 Total:         865.8286      2002.7261


 ************************ 2018-06-20 14:29:16 *************************
 Executing mrcc...

 **********************************************************************
 CCSDT(Q) calculation


 OpenMP parallel version is running.
 Number of CPUs:   1
 Allocation of 1923.2 Mbytes of memory...
 Number of spinorbitals: 252
 Number of alpha electrons:  4
 Number of beta  electrons:  2
 Spin multiplicity: 2
 z-component of spin:  1.0
 Spatial symmetry: 7
 Convergence criterion:  1.0E-07
 Construction of occupation graphs...
 Number of 0-fold excitations: 1
 Number of 1-fold excitations: 124
 Number of 2-fold excitations: 22268
 Number of 3-fold excitations: 1986216
 Total number of determinants: 2008609
 Calculation of coupling coefficients...
 Initial cluster amplitudes are generated.
 Length of intermediate file (Mbytes):     381.0
 Reading integral list from unit 55...
 Sorting integrals...
 Sorting integrals...
 Sorting integrals...
 Sorting integrals...
 Energy of reference determinant [au]:     -15.708479914772
 Calculation of MP denominators...

 Starting CC iteration...
 ======================================================================
 Norm of residual vector:     1.21602902
 CPU time [min]:     1.191                   Wall time [min]:     1.217

 Iteration  1  CC energy:   -15.88612751  Energy decrease:   0.17764759
 ======================================================================
 Norm of residual vector:     0.24893078
 CPU time [min]:     1.803                   Wall time [min]:     1.832

 Iteration  2  CC energy:   -15.89532122  Energy decrease:   0.00919371
 ======================================================================
 Norm of residual vector:     0.05149099
 CPU time [min]:     2.437                   Wall time [min]:     2.470

 Iteration  3  CC energy:   -15.90232466  Energy decrease:   0.00700343
 ======================================================================
 Norm of residual vector:     0.01521479
 CPU time [min]:     3.071                   Wall time [min]:     3.105

 Iteration  4  CC energy:   -15.90319656  Energy decrease:   0.00087190
 ======================================================================
 Norm of residual vector:     0.00707494
 CPU time [min]:     3.711                   Wall time [min]:     3.746

 Iteration  5  CC energy:   -15.90292767  Energy decrease:   0.00026889
 ======================================================================
 Norm of residual vector:     0.00323914
 CPU time [min]:     4.352                   Wall time [min]:     4.414

 Iteration  6  CC energy:   -15.90293369  Energy decrease:   0.00000602
 ======================================================================
 Norm of residual vector:     0.00157577
 CPU time [min]:     5.089                   Wall time [min]:     5.155

 Iteration  7  CC energy:   -15.90298221  Energy decrease:   0.00004852
 ======================================================================
 Norm of residual vector:     0.00073031
 CPU time [min]:     5.992                   Wall time [min]:     6.061

 Iteration  8  CC energy:   -15.90298770  Energy decrease:   0.00000549
 ======================================================================
 Norm of residual vector:     0.00029111
 CPU time [min]:     6.889                   Wall time [min]:     6.962

 Iteration  9  CC energy:   -15.90298702  Energy decrease:   0.00000068
 ======================================================================
 Norm of residual vector:     0.00012001
 CPU time [min]:     7.754                   Wall time [min]:     7.829

 Iteration 10  CC energy:   -15.90298794  Energy decrease:   0.00000092
 ======================================================================
 Norm of residual vector:     0.00005284
 CPU time [min]:     8.534                   Wall time [min]:     8.612

 Iteration 11  CC energy:   -15.90298779  Energy decrease:   0.00000015
 ======================================================================
 Norm of residual vector:     0.00001907
 CPU time [min]:     9.286                   Wall time [min]:     9.366

 Iteration 12  CC energy:   -15.90298756  Energy decrease:   0.00000023
 ======================================================================
 Norm of residual vector:     0.00000686
 CPU time [min]:     9.982                   Wall time [min]:    10.065

 Iteration 13  CC energy:   -15.90298760  Energy decrease:   0.00000004
 ======================================================================
 Norm of residual vector:     0.00000227
 CPU time [min]:    10.640                   Wall time [min]:    10.735

 Iteration 14  CC energy:   -15.90298762  Energy decrease:   0.00000002
 ======================================================================
 Norm of residual vector:     0.00000077
 CPU time [min]:    11.297                   Wall time [min]:    11.397

 Iteration 15  CC energy:   -15.90298760  Energy decrease:   0.00000001
 ======================================================================
 Norm of residual vector:     0.00000027
 CPU time [min]:    11.956                   Wall time [min]:    12.060

 Iteration 16  CC energy:   -15.90298760  Energy decrease:   2.0678E-09
 ======================================================================
 Norm of residual vector:     0.00000009
 CPU time [min]:    12.584                   Wall time [min]:    12.689

 Iteration 17  CC energy:   -15.90298760  Energy decrease:   1.5362E-09
 ======================================================================

 Iteration has converged in 17 steps.

 Final results:
 Total CCSDT energy [au]:            -15.902987603593
 Total MP2 energy [au]:              -15.886127509636

 Perturbative corrections are calculated...
 ======================================================================
 Spin case  1   Alpha:  2   Beta:  2
 Number of excitations:        42216485
 CPU time [min]:   135.398                   Wall time [min]:   135.509
 ======================================================================
 Spin case  2   Alpha:  3   Beta:  1
 Number of excitations:        36589408
 CPU time [min]:   232.176                   Wall time [min]:   232.299
 ======================================================================
 Spin case  3   Alpha:  4   Beta:  0
 Number of excitations:        1099202
 CPU time [min]:   242.850                   Wall time [min]:   242.984
 ======================================================================
 Number of 4-fold excitations: 79905095
 CPU time [min]:   242.850                   Wall time [min]:   242.985

 Total CCSDT[Q] energy [au]:         -15.902972042339
 Total CCSDT(Q) energy [au]:         -15.903076353845

 ************************ 2018-06-20 18:32:15 *************************
                      Normal termination of mrcc.
 **********************************************************************
 !CCSDT STATE 1.7 Energy              -15.902987603593
 !MP2 STATE 1.7 Energy                -15.886127509636
 !CCSDT[Q] STATE 1.7 Energy           -15.902972042339
 !CCSDT(Q) STATE 1.7 Energy           -15.903076353845
 
 CPU-time for MRCC:          14571.0 sec
 Elapsed-time for MRCC:      14589.8 sec

 Variable memory set to 8000000000 words,  buffer space   230000 words



 **********************************************************************************************************************************
 DATASETS  * FILE   NREC   LENGTH (MB)   RECORD NAMES
              1      20       38.64       500      610      700      900      950      970     1000      129      960     1100   
                                          VAR    BASINP    GEOM    SYMINP    ZMAT    AOBASIS   BASIS     P2S    ABASIS      S 
                                         1400     1410     1420     1200     1210     1080     1600     1650     1300     1700   
                                         EKIN       V       ECP      H0       H01     AOSYM     SMH    MOLCAS    ERIS     OPER   

              2       5        5.45       700     1000      520     2100     2200   
                                         GEOM     BASIS   MCVARS     RHF      UHF  

 PROGRAMS   *        TOTAL      MRCC       UHF        HF       INT
 CPU TIMES  *     14623.98  14620.61      0.02      0.18      3.07
 REAL TIME  *     14869.48 SEC
 DISK USED  *        89.53 MB      
 **********************************************************************************************************************************
 SETTING POSTHF(I)      =       -15.90307635  AU                              
                                                                                                                                                                                                                                                                

        SCF            POSTHF        EKIN          POT
    -15.70847991   -15.90307635   11.60841749   -6.64062034
                                                  

 CCSDT(Q)/USERDEF energy=    -15.903076353845

        CCSDT(Q)        HF-SCF  
    -15.90307635    -15.70847991
 **********************************************************************************************************************************
 Variable memory released
