
 Primary working directories    : /global/cscratch1/sd/aannabe
 Secondary working directories  : /global/cscratch1/sd/aannabe
 Wavefunction directory         : /global/homes/a/aannabe/wfu/
 Main file repository           : /global/cscratch1/sd/aannabe/

 SHA1      : 2873118e99aab1bc19f5b6fc1784693c06d15c95
 NAME      : 2015.1.8
 ARCHNAME  : linux/x86_64
 FC        : /opt/cray/pe/craype/2.5.5/bin/ftn
 BLASLIB   : -Wl,-_start-group /opt/intel/compilers_and_libraries_2016.3.210/linux/mkl/lib/intel64/libmkl_intel_ilp64.a /opt/intel/compilers_and_libraries_2016.3.210/linux/mkl/lib/intel64/libmkl_intel_thread.a /opt/intel/compilers_and_libraries_2016.3.210/linux/mkl/lib/intel64/libmkl_core.a -Wl,-_end-group
 id        : lbl

 Nodes     nprocs
 nid00483     1

 Using customized tuning parameters: mindgm=8; mindgv=16; mindgc=4; mindgr=1; noblas=0; minvec=7
 default implementation of scratch files=df  

 ***,Al
 memory,8,g
 gthresh,twoint=1.e-12
 
 gprint,basis,orbitals
 gexpec,ekin,pot
 
 angstrom
 geometry={
 1                                                                               ! Number of atoms
 Al 0.0 0.0 0.0
 }
 
 basis={
 Including file /global/homes/a/aannabe/docs/accurate/ccECP_Kh/pps/Al.pp
 Including file /global/homes/a/aannabe/docs/accurate/ccECP_Kh/basis/aug-cc-pVnZ/Al_tz.basis
 }
 
 {rhf
  start,atden
  wf,3,2,1
  occ,1,1,0,0,0,0,0,0
  open,1.2
  save,4202.2
 }
 {multi
  start,4202.2
  occ,1,1,1,0,1,0,0
  closed,1,0,0,0,0,0,0,0
  wf,3,2,1;state,1
  wf,3,3,1;state,1
  wf,3,5,1;state,1
  natorb,ci,print
  orbital,5202.2
 }
 {rhf,nitord=1,maxit=0
  start,5202.2
  wf,3,2,1
  occ,1,1,0,0,0,0,0,0
  open,1.2
 }
 
 scf(i)=energy
 
 _CC_NORM_MAX=2.0
  !NOTE: Perturbative MRCC works only with UHF reference. So, here we will trick MRCC by doing zero UHF iteration right after ROHF.
 
 {uhf
 maxit,0
 }
 scf(i)=energy
 
 {mrcc,method=CCSDT(Q)
 orbital,ignore_error=1                                                          !Ignore the fact that UHF WF is not converged
 maxit,100
 core
 }
 posthf(i)=energy
 
 table,scf,posthf,ekin,pot
 save,3.csv,new
 
 

 Variables initialized (889), CPU time= 0.01 sec
 Commands  initialized (702), CPU time= 0.01 sec, 572 directives.
 Default parameters read. Elapsed time= 0.18 sec

 Checking input...
 Passed
1


                                         ***  PROGRAM SYSTEM MOLPRO  ***
                                       Copyright, TTI GmbH Stuttgart, 2015
                                    Version 2015.1 linked Sep  7 2016 23:09:38


 **********************************************************************************************************************************
 LABEL *   Al                                                                            
  64 bit serial version                                                                  DATE: 30-Oct-18          TIME: 18:58:20  
 **********************************************************************************************************************************

 SHA1:             2873118e99aab1bc19f5b6fc1784693c06d15c95
 **********************************************************************************************************************************

 THRESHOLDS:

 ZERO    =  1.00D-12  ONEINT  =  1.00D-12  TWOINT  =  1.00D-12  PREFAC  =  1.00D-14  LOCALI  =  1.00D-09  EORDER  =  1.00D-04
 ENERGY  =  0.00D+00  ETEST   =  0.00D+00  EDENS   =  0.00D+00  THRDEDEF=  1.00D-06  GRADIENT=  1.00D-02  STEP    =  1.00D-03
 ORBITAL =  1.00D-05  CIVEC   =  1.00D-05  COEFF   =  1.00D-04  PRINTCI =  5.00D-02  PUNCHCI =  9.90D+01  OPTGRAD =  3.00D-04
 OPTENERG=  1.00D-06  OPTSTEP =  3.00D-04  THRGRAD =  1.00D-10  COMPRESS=  1.00D-11  VARMIN  =  1.00D-07  VARMAX  =  1.00D-03
 THRDOUB =  0.00D+00  THRDIV  =  1.00D-05  THRRED  =  1.00D-07  THRPSP  =  1.00D+00  THRDC   =  1.00D-10  THRCS   =  1.00D-10
 THRNRM  =  1.00D-08  THREQ   =  0.00D+00  THRDE   =  1.00D+00  THRREF  =  1.00D-05  SPARFAC =  1.00D+00  THRDLP  =  1.00D-07
 THRDIA  =  1.00D-10  THRDLS  =  1.00D-07  THRGPS  =  0.00D+00  THRKEX  =  0.00D+00  THRDIS  =  2.00D-01  THRVAR  =  1.00D-10
 THRLOC  =  1.00D-06  THRGAP  =  1.00D-06  THRLOCT = -1.00D+00  THRGAPT = -1.00D+00  THRORB  =  1.00D-06  THRMLTP =  0.00D+00
 THRCPQCI=  1.00D-10  KEXTA   =  0.00D+00  THRCOARS=  0.00D+00  SYMTOL  =  1.00D-06  GRADTOL =  1.00D-06  THROVL  =  1.00D-08
 THRORTH =  1.00D-08  GRID    =  1.00D-06  GRIDMAX =  1.00D-03  DTMAX   =  0.00D+00  THROCCDE=  1.00D-01  THROCCDE=  1.00D-01



 ZUNIT=ANG
 

Geometry recognized as XYZ


 Variable memory set to 8000000000 words,  buffer space   230000 words

 SETTING BASIS          =    USERDEF


 Recomputing integrals since basis changed


 Using spherical harmonics



 PROGRAM * SEWARD (Integral evaluation for generally contracted gaussian basis sets)     Author: Roland Lindh, 1990

 Geometry written to block  1 of record 700

 Orientation using atomic masses  
 Molecule type: Atom
 Symmetry elements: X,Y,Z
 Rotational constants:       0.0000000      0.0000000      0.0000000 GHz  (calculated with average atomic masses)

 Point group  D2h 



 ATOMIC COORDINATES

 NR  ATOM    CHARGE       X              Y              Z

   1  AL      3.00    0.000000000    0.000000000    0.000000000


          AL  CORE POTENTIAL

          d POTENTIAL

 POWERS             1              3              2
 EXPONENTIALS   5.073893       8.607001       3.027490    
 COEFFICIENTS   3.000000       15.22168      -11.16568    

          s - d POTENTIAL

 POWERS             2              2
 EXPONENTIALS   7.863954       2.061358    
 COEFFICIENTS   14.87951       20.74686    

          p - d POTENTIAL

 POWERS             2              2
 EXPONENTIALS   3.125175       1.414930    
 COEFFICIENTS   7.786227       7.109015    


 BASIS DATA

   Nr Sym  Nuc  Type         Exponents   Contraction coefficients

    1.1 Ag    1  1s           8.257944     0.003287
                              4.514245    -0.017168
                              2.467734     0.069766
                              1.348998    -0.183475
                              0.737436    -0.147133
                              0.403123     0.046882
                              0.220369     0.308423
                              0.120466     0.451564
                              0.065853     0.302904
                              0.035999     0.079545
    2.1 Ag    1  1s           0.384847     1.000000
    3.1 Ag    1  1s           0.064802     1.000000
    4.1 Ag    1  1s           0.031410     1.000000
    5.1 Ag    1  3d0          0.354021     1.000000
    6.1 Ag    1  3d2+         0.354021     1.000000
    7.1 Ag    1  3d0          0.114469     1.000000
    8.1 Ag    1  3d2+         0.114469     1.000000
    9.1 Ag    1  3d0          0.037038     1.000000
   10.1 Ag    1  3d2+         0.037038     1.000000
    1.2 B3u   1  2px          1.570603    -0.002645
                              0.977752    -0.037850
                              0.608683     0.006636
                              0.378925     0.089291
                              0.235893     0.134421
                              0.146851     0.256105
                              0.091420     0.238970
                              0.056912     0.260677
                              0.035429     0.112350
                              0.022056     0.052665
    2.2 B3u   1  2px          0.276146     1.000000
    3.2 B3u   1  2px          0.045973     1.000000
    4.2 B3u   1  2px          0.013480     1.000000
    5.2 B3u   1  4f1+         0.256594     1.000000
    6.2 B3u   1  4f3+         0.256594     1.000000
    7.2 B3u   1  4f1+         0.089824     1.000000
    8.2 B3u   1  4f3+         0.089824     1.000000
    1.3 B2u   1  2py          1.570603    -0.002645
                              0.977752    -0.037850
                              0.608683     0.006636
                              0.378925     0.089291
                              0.235893     0.134421
                              0.146851     0.256105
                              0.091420     0.238970
                              0.056912     0.260677
                              0.035429     0.112350
                              0.022056     0.052665
    2.3 B2u   1  2py          0.276146     1.000000
    3.3 B2u   1  2py          0.045973     1.000000
    4.3 B2u   1  2py          0.013480     1.000000
    5.3 B2u   1  4f1-         0.256594     1.000000
    6.3 B2u   1  4f3-         0.256594     1.000000
    7.3 B2u   1  4f1-         0.089824     1.000000
    8.3 B2u   1  4f3-         0.089824     1.000000
    1.4 B1g   1  3d2-         0.354021     1.000000
    2.4 B1g   1  3d2-         0.114469     1.000000
    3.4 B1g   1  3d2-         0.037038     1.000000
    1.5 B1u   1  2pz          1.570603    -0.002645
                              0.977752    -0.037850
                              0.608683     0.006636
                              0.378925     0.089291
                              0.235893     0.134421
                              0.146851     0.256105
                              0.091420     0.238970
                              0.056912     0.260677
                              0.035429     0.112350
                              0.022056     0.052665
    2.5 B1u   1  2pz          0.276146     1.000000
    3.5 B1u   1  2pz          0.045973     1.000000
    4.5 B1u   1  2pz          0.013480     1.000000
    5.5 B1u   1  4f0          0.256594     1.000000
    6.5 B1u   1  4f2+         0.256594     1.000000
    7.5 B1u   1  4f0          0.089824     1.000000
    8.5 B1u   1  4f2+         0.089824     1.000000
    1.6 B2g   1  3d1+         0.354021     1.000000
    2.6 B2g   1  3d1+         0.114469     1.000000
    3.6 B2g   1  3d1+         0.037038     1.000000
    1.7 B3g   1  3d1-         0.354021     1.000000
    2.7 B3g   1  3d1-         0.114469     1.000000
    3.7 B3g   1  3d1-         0.037038     1.000000
    1.8 Au    1  4f2-         0.256594     1.000000
    2.8 Au    1  4f2-         0.089824     1.000000

 NUCLEAR CHARGE:                    3
 NUMBER OF PRIMITIVE AOS:          90
 NUMBER OF SYMMETRY AOS:           81
 NUMBER OF CONTRACTIONS:           45   (  10Ag  +   8B3u +   8B2u +   3B1g +   8B1u +   3B2g +   3B3g +   2Au  )
 NUMBER OF CORE ORBITALS:           0   (   0Ag  +   0B3u +   0B2u +   0B1g +   0B1u +   0B2g +   0B3g +   0Au  )
 NUMBER OF VALENCE ORBITALS:        4   (   1Ag  +   1B3u +   1B2u +   0B1g +   1B1u +   0B2g +   0B3g +   0Au  )


 NUCLEAR REPULSION ENERGY    0.00000000

 EXTRA SYMMETRY OF AOS IN SYMMETRY 1:   1 1 1 1 2 3 2 3 2 3
 EXTRA SYMMETRY OF AOS IN SYMMETRY 2:   1 1 1 1 2 3 2 3
 EXTRA SYMMETRY OF AOS IN SYMMETRY 3:   1 1 1 1 2 3 2 3
 EXTRA SYMMETRY OF AOS IN SYMMETRY 5:   1 1 1 1 2 3 2 3

 Eigenvalues of metric

         1 0.138E-01 0.130E+00 0.241E+00 0.241E+00 0.659E+00 0.846E+00 0.846E+00 0.191E+01
         2 0.148E-01 0.318E+00 0.447E+00 0.447E+00 0.973E+00 0.155E+01 0.155E+01 0.269E+01
         3 0.148E-01 0.318E+00 0.447E+00 0.447E+00 0.973E+00 0.155E+01 0.155E+01 0.269E+01
         4 0.241E+00 0.846E+00 0.191E+01
         5 0.148E-01 0.318E+00 0.447E+00 0.447E+00 0.973E+00 0.155E+01 0.155E+01 0.269E+01
         6 0.241E+00 0.846E+00 0.191E+01
         7 0.241E+00 0.846E+00 0.191E+01
         8 0.447E+00 0.155E+01


 Contracted 2-electron integrals neglected if value below      1.0D-12
 AO integral compression algorithm  1   Integral accuracy      1.0D-12

     1.049 MB (compressed) written to integral file ( 77.9%)


 NUMBER OF SORTED TWO-ELECTRON INTEGRALS:      75808.     BUFFER LENGTH:  32768
 NUMBER OF SEGMENTS:   1  SEGMENT LENGTH:      75808      RECORD LENGTH: 524288

 Memory used in sort:       0.63 MW

 SORT1 READ      155797. AND WROTE       61548. INTEGRALS IN      1 RECORDS. CPU TIME:     0.01 SEC, REAL TIME:     0.02 SEC
 SORT2 READ       61548. AND WROTE       75808. INTEGRALS IN      4 RECORDS. CPU TIME:     0.03 SEC, REAL TIME:     0.03 SEC

 FILE SIZES:   FILE 1:    20.2 MBYTE,  FILE 4:     4.2 MBYTE,   TOTAL:     24.4 MBYTE

 OPERATOR DM      FOR CENTER  0  COORDINATES:    0.000000    0.000000    0.000000
 OPERATOR EKIN    FOR CENTER  0  COORDINATES:    0.000000    0.000000    0.000000
 OPERATOR POT     FOR CENTER  0  COORDINATES:    0.000000    0.000000    0.000000


 **********************************************************************************************************************************
 DATASETS  * FILE   NREC   LENGTH (MB)   RECORD NAMES
              1      20       19.57       500      610      700      900      950      970     1000      129      960     1100   
                                          VAR    BASINP    GEOM    SYMINP    ZMAT    AOBASIS   BASIS     P2S    ABASIS      S 
                                         1400     1410     1420     1200     1210     1080     1600     1650     1300     1700   
                                         EKIN       V       ECP      H0       H01     AOSYM     SMH    MOLCAS    ERIS     OPER   

 PROGRAMS   *        TOTAL       INT
 CPU TIMES  *         2.28      2.15
 REAL TIME  *        13.35 SEC
 DISK USED  *        24.67 MB      
 **********************************************************************************************************************************


 PROGRAM * RHF-SCF (OPEN SHELL)       Authors: W. Meyer, H.-J. Werner


 NUMBER OF ELECTRONS:       2+    1-    SPACE SYMMETRY=2    SPIN SYMMETRY: Doublet 
 CONVERGENCE THRESHOLDS:    1.00E-05 (Density)    1.00E-07 (Energy)
 MAX. NUMBER OF ITERATIONS:       60
 INTERPOLATION TYPE:            DIIS
 INTERPOLATION STEPS:              2 (START)      1 (STEP)
 LEVEL SHIFTS:                 -0.60 (CLOSED) -0.30 (OPEN) 


 Singly occupied orbitals:      1.2

   Atom=AL basis=ECP10MWB_GUESS    lmin=0  lmax=1

 Orbital guess generated from atomic densities. Full valence occupancy:    1   1   1   0   1   0   0   0


 Molecular orbital dump at record        4202.2

 ITERATION    DDIFF          GRAD             ENERGY        2-EL.EN.            DIPOLE MOMENTS         DIIS   ORB.
    1      0.000D+00      0.000D+00        -1.86837221      1.642112    0.00000    0.00000    0.00000    0    start
    2      0.000D+00      0.579D-02        -1.87257206      1.683832    0.00000    0.00000    0.00000    1    diag,B
    3      0.119D-01      0.355D-02        -1.87594540      1.732815    0.00000    0.00000    0.00000    2    diag,B
    4      0.154D-01      0.174D-02        -1.87699466      1.754911    0.00000    0.00000    0.00000    3    diag,B
    5      0.118D-01      0.599D-03        -1.87708249      1.758730    0.00000    0.00000    0.00000    4    diag,B
    6      0.389D-02      0.173D-03        -1.87708618      1.759160    0.00000    0.00000    0.00000    5    diag,B
    7      0.742D-03      0.527D-04        -1.87708644      1.758861    0.00000    0.00000    0.00000    6    fixocc
    8      0.230D-03      0.108D-04        -1.87708645      1.758926    0.00000    0.00000    0.00000    7    diag,B
    9      0.112D-03      0.207D-05        -1.87708645      1.758936    0.00000    0.00000    0.00000    8    diag,B
   10      0.162D-04      0.106D-05        -1.87708645      1.758932    0.00000    0.00000    0.00000    9    orth
   11      0.631D-05      0.780D-07        -1.87708645      1.758932    0.00000    0.00000    0.00000    0    orth

 Final alpha occupancy:   1   1   0   0   0   0   0   0
 Final beta  occupancy:   1   0   0   0   0   0   0   0

 !RHF STATE 1.2 Energy                 -1.877086453624
 Nuclear energy                         0.00000000
 One-electron energy                   -2.75655268
 Two-electron energy                    0.87946622
 Virial quotient                       -2.92517212
 !RHF STATE 1.2 Dipole moment           0.00000000     0.00000000     0.00000000
 Dipole moment /Debye                   0.00000000     0.00000000     0.00000000
 

 !RHF expec          <1.2|EKIN|1.2>     0.641701197891
 
 !RHF expec           <1.2|POT|1.2>    -1.245923697950

 ELECTRON ORBITALS
 =================


   Orb  Occ    Energy  Couls-En    Coefficients

                                   1 1s      1 1s      1 1s      1 1s      1 3d0     1 3d2+    1 3d0     1 3d2+    1 3d0     1 3d2+ 


   1.1   2    -0.3939   -1.4017  1.000204  0.000061 -0.000203 -0.000123  0.000668 -0.001157 -0.002692  0.004663 -0.003178  0.005504

                                   1 2px     1 2px     1 2px     1 2px     1 4f1+    1 4f3+    1 4f1+    1 4f3+ 

   1.2   +    -0.2098   -0.9507  0.999658 -0.000001  0.000304  0.000167  0.000113 -0.000146 -0.000062  0.000081

 HOMO      1.2    -0.209794 =      -5.7088eV
 LUMO      1.3     0.007397 =       0.2013eV
 LUMO-HOMO         0.217191 =       5.9101eV


 **********************************************************************************************************************************
 DATASETS  * FILE   NREC   LENGTH (MB)   RECORD NAMES
              1      20       19.57       500      610      700      900      950      970     1000      129      960     1100   
                                          VAR    BASINP    GEOM    SYMINP    ZMAT    AOBASIS   BASIS     P2S    ABASIS      S 
                                         1400     1410     1420     1200     1210     1080     1600     1650     1300     1700   
                                         EKIN       V       ECP      H0       H01     AOSYM     SMH    MOLCAS    ERIS     OPER   

              2       4        2.76       700     1000      520     4202   
                                         GEOM     BASIS   MCVARS     RHF  

 PROGRAMS   *        TOTAL       RHF       INT
 CPU TIMES  *         2.33      0.06      2.15
 REAL TIME  *        13.61 SEC
 DISK USED  *        24.67 MB      
 **********************************************************************************************************************************


 PROGRAM * MULTI (Direct Multiconfiguration SCF)       Authors: P.J. Knowles, H.-J. Werner (1984)     S.T. Elbert (1988)


 Number of closed-shell orbitals:   1 (   1   0   0   0   0   0   0   0 )
 Number of active  orbitals:        3 (   0   1   1   0   1   0   0   0 )
 Number of external orbitals:      41 (   9   7   7   3   7   3   3   2 )

 State symmetry 1

 Number of electrons:     1    Spin symmetry=Doublet   Space symmetry=2
 Number of states:        1
 Number of CSFs:          1   (1 determinants, 3 intermediate states)

 State symmetry 2

 Number of electrons:     1    Spin symmetry=Doublet   Space symmetry=3
 Number of states:        1
 Number of CSFs:          1   (1 determinants, 3 intermediate states)

 State symmetry 3

 Number of electrons:     1    Spin symmetry=Doublet   Space symmetry=5
 Number of states:        1
 Number of CSFs:          1   (1 determinants, 3 intermediate states)

 Molecular orbitals read from record     4202.2  Type=RHF/CANONICAL (state 1.2)
 *** IN SYMMETRY 1 ORBITAL  1 SYMMETRY CONTAMINATION OF 0.175D-01 HAS BEEN REMOVED

 EXTRA SYMMETRY OF MOS IN SYMMETRY 1:   1 1 3 2 3 2 1 2 3 1
 *** IN SYMMETRY 2 ORBITAL  1 SYMMETRY CONTAMINATION OF 0.402D-03 HAS BEEN REMOVED
 EXTRA SYMMETRY OF MOS IN SYMMETRY 2:   1 1 1 2 3 1 2 3
 *** IN SYMMETRY 3 ORBITAL  1 SYMMETRY CONTAMINATION OF 0.448D-02 HAS BEEN REMOVED
 EXTRA SYMMETRY OF MOS IN SYMMETRY 3:   1 1 1 2 3 1 2 3
 *** IN SYMMETRY 5 ORBITAL  1 SYMMETRY CONTAMINATION OF 0.516D-02 HAS BEEN REMOVED
 EXTRA SYMMETRY OF MOS IN SYMMETRY 5:   1 1 1 2 3 1 2 3

 Wavefunction dump at record             5202.2

 Convergence thresholds  0.10E-01 (gradient)  0.10E-05 (energy)  0.10E-02 (step length)

 Weight factors for state symmetry  1:    0.33333
 Weight factors for state symmetry  2:    0.33333
 Weight factors for state symmetry  3:    0.33333

 Number of orbital rotations:       30   (     0 Core/Active      9 Core/Virtual   0 Active/Active     21 Active/Virtual)
 Total number of variables:         33


 ITER. MIC  NCI  NEG     ENERGY(VAR)     ENERGY(PROJ)   ENERGY CHANGE     GRAD(0)  GRAD(ORB)   GRAD(CI)     STEP       TIME

   1   32   12    0      -1.84885437      -1.87704613   -0.02819177    0.04404927 0.00000000 0.00000000  0.76D+00      0.01
   2   15   12    0      -1.87696716      -1.87700759   -0.00004043    0.00670419 0.00000000 0.00000000  0.73D-02      0.02
   3   15   12    0      -1.87700762      -1.87700762   -0.00000000    0.00000995 0.00000000 0.00000000  0.24D-04      0.02

 ** WVFN ****  CONVERGENCE REACHED, FINAL GRADIENT:  0.42D-10



 Results for state 1.2
 =====================

 !MCSCF STATE 1.2 Energy               -1.877007621817
 Nuclear energy                         0.00000000
 Kinetic energy                         0.64167743
 One electron energy                   -2.75666194
 Two electron energy                    0.87965432
 Virial ratio                           3.92515761

 !MCSCF STATE 1.2 Dipole moment         0.00000000     0.00000000     0.00000000
 Dipole moment /Debye                   0.00000000     0.00000000     0.00000000



 Results for state 1.3
 =====================

 !MCSCF STATE 1.3 Energy               -1.877007621817
 Nuclear energy                         0.00000000
 Kinetic energy                         0.64167743
 One electron energy                   -2.75666194
 Two electron energy                    0.87965432
 Virial ratio                           3.92515761

 !MCSCF STATE 1.3 Dipole moment         0.00000000     0.00000000     0.00000000
 Dipole moment /Debye                   0.00000000     0.00000000     0.00000000



 Results for state 1.5
 =====================

 !MCSCF STATE 1.5 Energy               -1.877007621817
 Nuclear energy                         0.00000000
 Kinetic energy                         0.64167743
 One electron energy                   -2.75666194
 Two electron energy                    0.87965432
 Virial ratio                           3.92515761

 !MCSCF STATE 1.5 Dipole moment         0.00000000     0.00000000     0.00000000
 Dipole moment /Debye                   0.00000000     0.00000000     0.00000000

 State-averaged charge density matrix saved on record  5202.2 (density set 1)

 !MCSCF expec        <1.2|EKIN|1.2>     0.641677430418
 !MCSCF expec        <1.3|EKIN|1.3>     0.641677430422
 !MCSCF expec        <1.5|EKIN|1.5>     0.641677430422

 !MCSCF expec         <1.2|POT|1.2>    -1.245944850266
 !MCSCF expec         <1.3|POT|1.3>    -1.245944850269
 !MCSCF expec         <1.5|POT|1.5>    -1.245944850269


 NATURAL ORBITALS (state averaged)
 =================================

   Orb     Occ        Energy       Coefficients

                                   1 1s      1 1s      1 1s      1 1s      1 3d0     1 3d2+    1 3d0     1 3d2+    1 3d0     1 3d2+ 


   1.1  2.00000    -0.393853     1.000021  0.000009 -0.000073  0.000055  0.000000  0.000000  0.000000  0.000000  0.000000  0.000000

                                   1 2px     1 2px     1 2px     1 2px     1 4f1+    1 4f3+    1 4f1+    1 4f3+ 

   1.2  0.33333     0.001395     1.000042 -0.000016 -0.000080  0.000090  0.000000  0.000000  0.000000  0.000000

                                   1 2py     1 2py     1 2py     1 2py     1 4f1-    1 4f3-    1 4f1-    1 4f3- 

   1.3  0.33333     0.001395     1.000042 -0.000016 -0.000080  0.000090  0.000000  0.000000  0.000000  0.000000

                                   1 2pz     1 2pz     1 2pz     1 2pz     1 4f0     1 4f2+    1 4f0     1 4f2+ 

   1.5  0.33333     0.001395     1.000042 -0.000016 -0.000080  0.000090  0.000000  0.000000  0.000000  0.000000
 

 EXTRA SYMMETRY OF MOS IN SYMMETRY 1:   1 1 2 3 2 3 1 2 3 1
 EXTRA SYMMETRY OF MOS IN SYMMETRY 2:   1 1 1 3 2 1 3 2
 EXTRA SYMMETRY OF MOS IN SYMMETRY 3:   1 1 1 3 2 1 3 2
 EXTRA SYMMETRY OF MOS IN SYMMETRY 5:   1 1 1 2 3 1 3 2

 Natural orbital dump (state averaged) at molpro section  5202.2    (Orbital set 2)


 CI vector for state symmetry 1
 ==============================

 a 0 0           1.0000000

 TOTAL ENERGIES                        -1.87700762

 CI vector for state symmetry 2
 ==============================

 0 a 0           1.0000000

 TOTAL ENERGIES                        -1.87700762

 CI vector for state symmetry 3
 ==============================

 0 0 a           1.0000000

 TOTAL ENERGIES                        -1.87700762



 **********************************************************************************************************************************
 DATASETS  * FILE   NREC   LENGTH (MB)   RECORD NAMES
              1      21       19.61       500      610      700      900      950      970     1000      129      960     1100   
                                          VAR    BASINP    GEOM    SYMINP    ZMAT    AOBASIS   BASIS     P2S    ABASIS      S 
                                         1400     1410     1420     1200     1210     1080     1600     1650     1300     1700   
                                         EKIN       V       ECP      H0       H01     AOSYM     SMH    MOLCAS    ERIS     OPER   
                                         1380   
                                         JKOP   

              2       5        5.26       700     1000      520     4202     5202   
                                         GEOM     BASIS   MCVARS     RHF     MCSCF   

 PROGRAMS   *        TOTAL     MULTI       RHF       INT
 CPU TIMES  *         2.38      0.04      0.06      2.15
 REAL TIME  *        15.05 SEC
 DISK USED  *        34.08 MB      
 **********************************************************************************************************************************


 PROGRAM * RHF-SCF (OPEN SHELL)       Authors: W. Meyer, H.-J. Werner


 NUMBER OF ELECTRONS:       2+    1-    SPACE SYMMETRY=2    SPIN SYMMETRY: Doublet 
 CONVERGENCE THRESHOLDS:    1.00E-05 (Density)    1.00E-07 (Energy)
 MAX. NUMBER OF ITERATIONS:        0
 INTERPOLATION TYPE:            DIIS
 INTERPOLATION STEPS:              2 (START)      1 (STEP)
 LEVEL SHIFTS:                 -0.60 (CLOSED) -0.30 (OPEN) 


 Singly occupied orbitals:      1.2
 Molecular orbitals read from record     5202.2  Type=MCSCF/NATURAL (state averaged)

 Molecular orbital dump at record        2101.2

 ITERATION    DDIFF          GRAD             ENERGY        2-EL.EN.            DIPOLE MOMENTS         DIIS   ORB.
    1      0.000D+00      0.000D+00        -1.87700762      1.759309    0.00000    0.00000    0.00000    0    start

 Final alpha occupancy:   1   1   0   0   0   0   0   0
 Final beta  occupancy:   1   0   0   0   0   0   0   0

 !RHF STATE 1.2 Energy                 -1.877007621817
 Nuclear energy                         0.00000000
 One-electron energy                   -2.75666194
 Two-electron energy                    0.87965432
 Virial quotient                       -2.92515761
 !RHF STATE 1.2 Dipole moment           0.00000000     0.00000000     0.00000000
 Dipole moment /Debye                   0.00000000     0.00000000     0.00000000
 

 !RHF expec          <1.2|EKIN|1.2>     0.641677430418
 
 !RHF expec           <1.2|POT|1.2>    -1.245944850266

 ELECTRON ORBITALS
 =================


   Orb  Occ    Energy  Couls-En    Coefficients

                                   1 1s      1 1s      1 1s      1 1s      1 3d0     1 3d2+    1 3d0     1 3d2+    1 3d0     1 3d2+ 


   1.1   2    -0.3939   -1.4017  1.000021  0.000009 -0.000073  0.000055  0.000000  0.000000  0.000000  0.000000  0.000000  0.000000

                                   1 2px     1 2px     1 2px     1 2px     1 4f1+    1 4f3+    1 4f1+    1 4f3+ 

   1.2   +     0.0014   -0.7396  1.000042 -0.000016 -0.000080  0.000090  0.000000  0.000000  0.000000  0.000000

 HOMO      1.2     0.001395 =       0.0380eV
 LUMO      1.3     0.001395 =       0.0380eV
 LUMO-HOMO         0.000000 =       0.0000eV


 **********************************************************************************************************************************
 DATASETS  * FILE   NREC   LENGTH (MB)   RECORD NAMES
              1      21       19.61       500      610      700      900      950      970     1000      129      960     1100   
                                          VAR    BASINP    GEOM    SYMINP    ZMAT    AOBASIS   BASIS     P2S    ABASIS      S 
                                         1400     1410     1420     1200     1210     1080     1600     1650     1300     1700   
                                         EKIN       V       ECP      H0       H01     AOSYM     SMH    MOLCAS    ERIS     OPER   
                                         1380   
                                         JKOP   

              2       6        7.77       700     1000      520     4202     5202     2101   
                                         GEOM     BASIS   MCVARS     RHF     MCSCF     RHF  

 PROGRAMS   *        TOTAL       RHF     MULTI       RHF       INT
 CPU TIMES  *         2.40      0.02      0.04      0.06      2.15
 REAL TIME  *        15.29 SEC
 DISK USED  *        34.08 MB      
 **********************************************************************************************************************************
 SETTING SCF(I)         =        -1.87700762  AU                              
 SETTING _CC_NORM_MAX   =         2.00000000                                  


 PROGRAM * UHF-SCF       Authors: W. Meyer, H.-J. Werner


 NUMBER OF ELECTRONS:       2+    1-    SPACE SYMMETRY=2    SPIN SYMMETRY: Doublet 
 CONVERGENCE THRESHOLDS:    1.00E-05 (Density)    1.00E-07 (Energy)
 MAX. NUMBER OF ITERATIONS:        0
 INTERPOLATION TYPE:            DIIS
 INTERPOLATION STEPS:              2 (START)      1 (STEP)
 LEVEL SHIFTS:                  0.20 (ALPHA)   0.20 (BETA) 



 Molecular orbitals read from record     2101.2  Type=RHF/CANONICAL (state 1.2)

 Molecular orbital dump at record        2200.2

 Initial alpha occupation   1   1   0   0   0   0   0   0
 Initial beta  occupation   1   0   0   0   0   0   0   0

 ITERATION    DDIFF          GRAD             ENERGY        2-EL.EN.            DIPOLE MOMENTS         DIIS
    1      0.000D+00      0.000D+00        -1.87700762      1.759309    0.00000    0.00000    0.00000    0
 
 Final alpha occupancy:   1   1   0   0   0   0   0   0
 Final beta  occupancy:   1   0   0   0   0   0   0   0

 !UHF STATE 1.2 Energy                 -1.877007621817
 Nuclear energy                         0.00000000
 One-electron energy                   -2.75666194
 Two-electron energy                    0.87965432
 Virial quotient                       -2.92515761
 !UHF STATE 1.2 Dipole moment           0.00000000     0.00000000     0.00000000
 Dipole moment /Debye                   0.00000000     0.00000000     0.00000000
 

 !UHF expec          <1.2|EKIN|1.2>     0.641677430418
 
 !UHF expec           <1.2|POT|1.2>    -1.245944850266

 ELECTRON ORBITALS FOR POSITIVE SPIN
 ===================================


   Orb  Occ    Energy  Couls-En    Coefficients

                                   1 1s      1 1s      1 1s      1 1s      1 3d0     1 3d2+    1 3d0     1 3d2+    1 3d0     1 3d2+ 


   1.1   +    -0.3939   -1.4017  1.000021  0.000009 -0.000073  0.000055  0.000000  0.000000  0.000000  0.000000  0.000000  0.000000

                                   1 2px     1 2px     1 2px     1 2px     1 4f1+    1 4f3+    1 4f1+    1 4f3+ 

   1.2   +     0.0014   -0.7396  1.000042 -0.000016 -0.000080  0.000090  0.000000  0.000000  0.000000  0.000000

 ELECTRON ORBITALS FOR NEGATIVE SPIN
 ===================================


   Orb  Occ    Energy  Couls-En    Coefficients

                                   1 1s      1 1s      1 1s      1 1s      1 3d0     1 3d2+    1 3d0     1 3d2+    1 3d0     1 3d2+ 


   1.1   -    -0.3939   -1.4017  1.000021  0.000009 -0.000073  0.000055  0.000000  0.000000  0.000000  0.000000  0.000000  0.000000

 HOMO      1.2     0.001395 =       0.0380eV
 LUMO      1.3     0.001395 =       0.0380eV
 LUMO-HOMO         0.000000 =       0.0000eV

 EXPECTATION VALUE OF S**2:             0.75000000

 Occupation number threshold for canonical orbitals:  1.999000 (occupied),  0.001000 (virtual)

 Number of pseudo-canonical orbitals per symmetry:    1   0   0   0   0   0   0   0
 Number of active natural orbitals per symmetry:      0   1   0   0   0   0   0   0

 NATURAL CHARGE ORBITALS
 =======================


   Orb     Occ        Energy       Coefficients

                                   1 1s      1 1s      1 1s      1 1s      1 3d0     1 3d2+    1 3d0     1 3d2+    1 3d0     1 3d2+ 


   1.1  2.00000    -0.393853     1.000021  0.000009 -0.000073  0.000055  0.000000  0.000000  0.000000  0.000000  0.000000  0.000000

                                   1 2px     1 2px     1 2px     1 2px     1 4f1+    1 4f3+    1 4f1+    1 4f3+ 

   1.2  1.00000    -0.066917     1.000042 -0.000016 -0.000080  0.000090  0.000000  0.000000  0.000000  0.000000

 Natural orbitals saved to record    2200.2 (Orbital set 3)

 Orbital spaces for UNO-CAS (Min. occupation: 0.020  Max. occupation: 1.980):

 Closed:        1   0   0   0   0   0   0   0
 Active:        0   1   0   0   0   0   0   0

 No convergence



 **********************************************************************************************************************************
 DATASETS  * FILE   NREC   LENGTH (MB)   RECORD NAMES
              1      21       19.61       500      610      700      900      950      970     1000      129      960     1100   
                                          VAR    BASINP    GEOM    SYMINP    ZMAT    AOBASIS   BASIS     P2S    ABASIS      S 
                                         1400     1410     1420     1200     1210     1080     1600     1650     1300     1700   
                                         EKIN       V       ECP      H0       H01     AOSYM     SMH    MOLCAS    ERIS     OPER   
                                         1380   
                                         JKOP   

              2       7       10.28       700     1000      520     4202     5202     2101     2200   
                                         GEOM     BASIS   MCVARS     RHF     MCSCF     RHF      UHF  

 PROGRAMS   *        TOTAL       UHF       RHF     MULTI       RHF       INT
 CPU TIMES  *         2.42      0.02      0.02      0.04      0.06      2.15
 REAL TIME  *        15.49 SEC
 DISK USED  *        34.08 MB      
 **********************************************************************************************************************************
 SETTING SCF(I)         =        -1.87700762  AU                              


 PROGRAM * MRCC (General Multireference Coupled Cluster)    Author: M. Kallay, 2000-2005

 ***  Initialisation ***

   0 Spin projections
 
 Molecular orbitals read from record     2200.2  Type=UHF/ALPHA (state 1.2)

 ?Warning: UHF not converged
 Molecular orbitals read from record     2200.2  Type=UHF/BETA (state 1.2)

 ?Warning: UHF not converged
 
 Frozen orbitals:              0 (  0  0  0  0  0  0  0  0)
 Active orbitals:             45 ( 10  8  8  3  8  3  3  2)
 Active electrons:             3
 Spin quantum number:          0.5

 Transformed integrals will be written to file mrcc_41888/fort.55

 Load integrals                2.4 sec
 Transform integrals           2.5 sec
 Storage for integrals:         426551
 Remaining memory:           *********

 Core energy:               0.00000000
 
 MRCC Input:
     4     0     0     0     3     0     0     2     0     0     0     1     1     0     0     7     0     0   0.000     0   64000
  ex.lev,nsing,ntrip, rest,method,dens,conver,symm, diag, CS ,spatial, HF, ndoub,nacto,nactv, tol, maxex, sacc, freq,  dboc,   mem
  2  0  0  0  0  0  0  0  0  0  1  0  0  0  0  0  0  0  0  0  0  0  0  0  0  0  0  0  0  0  0  0  0  0  0  0  0  0  0  0  0  0  0  0  0
 MRCC Input end
 Variable memory released
 MRCC now being run, temporary output in /global/cscratch1/sd/aannabe/mrcc_41888/mrcc.out
 **********************************************************************
                          MRCC program system
 **********************************************************************

                              Written by
  Mihaly Kallay, Zoltan Rolik, Jozsef Csontos, Peter Nagy, Gyula Samu,
      David Mester, Jozsef Csoka, Bernat Szabo, Istvan Ladjanszki,
       Lorant Szegedy, Bence Ladoczki, Klara Petrov, Mate Farkas,
                    Pal D. Mezei, and Bence Hegely

        Department of Physical Chemistry and Materials Science
            Budapest University of Technology and Economics
                  Budapest P.O.Box 91, H-1521 Hungary

                              www.mrcc.hu

                       Release date: May 23, 2018

 ************************ 2018-10-30 18:58:43 *************************
 Executing goldstone...

 Generation of CC equations in terms of H and T...
 Generation of antisymmetrized Goldstone diagrams...
 Number of diagrams in T^1 equations:    15
 Number of diagrams in T^2 equations:    33
 Number of diagrams in T^3 equations:     2
 Translation of diagrams to factorized equations...
 Optimizing intermediate calculation...
 Number of floating-point operations per iteration step:   4.1040E+06
 Probable CPU time per iteration step (hours):      0.00
 Required memory (Mbytes):     468.4
 Number of intermediates:                                  48
 Number of intermediates to be stored:                     20
 Length of intermediate file (Mbytes):       7.7

 ************************ 2018-10-30 18:58:43 *************************
 Executing xmrcc...

 **********************************************************************
 CC(2)(3) calculation


 Allocation of 468.4 Mbytes of memory...
 Number of spinorbitals:                    90
 Number of alpha electrons:                        2
 Number of beta electrons:                         1
 Spin multiplicity:                     2
 z-component of spin:  0.5
 Spatial symmetry:                      2
 Convergence criterion:  1.0E-07
 Construction of occupation graphs...
 Number of                     0 -fold excitations:                      1
 Number of                     1 -fold excitations:                     25
 Number of                     2 -fold excitations:                    656
 Total number of configurations:                    682
 Calculation of coupling coefficients...
 Length of intermediate file (Mbytes):       6.1

 ======================================================================

 Spin case  1   Alpha:  2   Beta:  1
 Number of excitations:                   4992
 Number of                     3 -fold excitations:                   4992

 Memory requirements /Mbyte/:
               Minimal        Optimal
 Real*8:          6.3190        31.3201
 Integer:         3.6012
 Total:           9.9203        34.9213


 ************************ 2018-10-30 18:58:44 *************************
 Executing mrcc...

 **********************************************************************
 CCSDT(T) calculation


 Allocation of   31.3 Mbytes of memory...
 Number of spinorbitals:  90
 Number of alpha electrons:  2
 Number of beta  electrons:  1
 Spin multiplicity: 2
 z-component of spin:  0.5
 Spatial symmetry: 2
 Convergence criterion:  1.0E-07
 Construction of occupation graphs...
 Number of 0-fold excitations: 1
 Number of 1-fold excitations: 25
 Number of 2-fold excitations: 656
 Total number of determinants: 682
 Calculation of coupling coefficients...
 Initial cluster amplitudes are generated.
 Length of intermediate file (Mbytes):       6.1
 Reading integral list from unit 55...
 Sorting integrals...
 Sorting integrals...
 Sorting integrals...
 Sorting integrals...
 Energy of reference determinant [au]:      -1.877007621817
 Calculation of MP denominators...

 Starting CC iteration...
 ======================================================================
 Norm of residual vector:     0.23889105
 CPU time [min]:     0.017                   Wall time [min]:     0.018

 Iteration  1  CC energy:    -1.92077850  Energy decrease:   0.04377088
 ======================================================================
 Norm of residual vector:     0.05696958
 CPU time [min]:     0.021                   Wall time [min]:     0.024

 Iteration  2  CC energy:    -1.93137982  Energy decrease:   0.01060132
 ======================================================================
 Norm of residual vector:     0.01774589
 CPU time [min]:     0.026                   Wall time [min]:     0.029

 Iteration  3  CC energy:    -1.93342041  Energy decrease:   0.00204060
 ======================================================================
 Norm of residual vector:     0.00474410
 CPU time [min]:     0.031                   Wall time [min]:     0.034

 Iteration  4  CC energy:    -1.93384874  Energy decrease:   0.00042833
 ======================================================================
 Norm of residual vector:     0.00109867
 CPU time [min]:     0.036                   Wall time [min]:     0.039

 Iteration  5  CC energy:    -1.93381495  Energy decrease:   0.00003379
 ======================================================================
 Norm of residual vector:     0.00022975
 CPU time [min]:     0.041                   Wall time [min]:     0.044

 Iteration  6  CC energy:    -1.93382018  Energy decrease:   0.00000523
 ======================================================================
 Norm of residual vector:     0.00004893
 CPU time [min]:     0.046                   Wall time [min]:     0.049

 Iteration  7  CC energy:    -1.93381910  Energy decrease:   0.00000108
 ======================================================================
 Norm of residual vector:     0.00001365
 CPU time [min]:     0.050                   Wall time [min]:     0.054

 Iteration  8  CC energy:    -1.93381916  Energy decrease:   0.00000006
 ======================================================================
 Norm of residual vector:     0.00000392
 CPU time [min]:     0.055                   Wall time [min]:     0.059

 Iteration  9  CC energy:    -1.93381924  Energy decrease:   0.00000007
 ======================================================================
 Norm of residual vector:     0.00000109
 CPU time [min]:     0.060                   Wall time [min]:     0.064

 Iteration 10  CC energy:    -1.93381919  Energy decrease:   0.00000005
 ======================================================================
 Norm of residual vector:     0.00000027
 CPU time [min]:     0.065                   Wall time [min]:     0.070

 Iteration 11  CC energy:    -1.93381919  Energy decrease:   0.00000001
 ======================================================================
 Norm of residual vector:     0.00000006
 CPU time [min]:     0.069                   Wall time [min]:     0.075

 Iteration 12  CC energy:    -1.93381919  Energy decrease:   2.5941E-10
 ======================================================================

 Iteration has converged in 12 steps.

 Final results:
 Total CCSDT energy [au]:             -1.933819193076
 Total MP2 energy [au]:               -1.920778496850

 Perturbative corrections are calculated...
 ======================================================================
 Spin case  1   Alpha:  2   Beta:  1
 Number of excitations:        4992
 CPU time [min]:     0.072                   Wall time [min]:     0.077
 ======================================================================
 Number of 3-fold excitations: 4992
 CPU time [min]:     0.072                   Wall time [min]:     0.077

 Total CCSD[T] energy [au]:           -1.935240297734
 Total CCSD(T) energy [au]:           -1.935276409258

 ************************ 2018-10-30 18:58:50 *************************
                      Normal termination of mrcc.
 **********************************************************************
 !CCSDT STATE 1.2 Energy               -1.933819193076
 !MP2 STATE 1.2 Energy                 -1.920778496850
 !CCSD[T] STATE 1.2 Energy             -1.935240297734
 !CCSD(T) STATE 1.2 Energy             -1.935276409258
 
 CPU-time for MRCC:              4.3 sec
 Elapsed-time for MRCC:          9.4 sec

 Variable memory set to 8000000000 words,  buffer space   230000 words



 **********************************************************************************************************************************
 DATASETS  * FILE   NREC   LENGTH (MB)   RECORD NAMES
              1      21       19.61       500      610      700      900      950      970     1000      129      960     1100   
                                          VAR    BASINP    GEOM    SYMINP    ZMAT    AOBASIS   BASIS     P2S    ABASIS      S 
                                         1400     1410     1420     1200     1210     1080     1600     1650     1300     1700   
                                         EKIN       V       ECP      H0       H01     AOSYM     SMH    MOLCAS    ERIS     OPER   
                                         1380   
                                         JKOP   

              2       7       10.28       700     1000      520     4202     5202     2101     2200   
                                         GEOM     BASIS   MCVARS     RHF     MCSCF     RHF      UHF  

 PROGRAMS   *        TOTAL      MRCC       UHF       RHF     MULTI       RHF       INT
 CPU TIMES  *         7.69      5.27      0.02      0.02      0.04      0.06      2.15
 REAL TIME  *        31.03 SEC
 DISK USED  *        34.08 MB      
 **********************************************************************************************************************************
 SETTING POSTHF(I)      =        -1.93527641  AU                              
                                                                                                                                                                                                                                                                

       SCF           POSTHF       EKIN          POT
    -1.87700762   -1.93527641   0.64167743   -1.24594485
                                                  

 CCSD(T)/USERDEF energy=     -1.935276409258

        CCSD(T)         RHF-SCF         MULTI           RHF-SCF 
     -1.93527641     -1.87700762     -1.87700762     -1.87708645
 **********************************************************************************************************************************
 Variable memory released
