
 Primary working directories    : /global/cscratch1/sd/aannabe
 Secondary working directories  : /global/cscratch1/sd/aannabe
 Wavefunction directory         : /global/homes/a/aannabe/wfu/
 Main file repository           : /global/cscratch1/sd/aannabe/

 SHA1      : 19cd028119e0e09f93f0674bd8af7968d9b3eff6
 NAME      : 2015.1.36
 ARCHNAME  : linux/x86_64
 FC        : /opt/cray/pe/craype/2.5.14/bin/ftn
 BLASLIB   : -L/opt/intel/compilers_and_libraries_2018.1.163/linux/mkl/lib/intel64 -Wl,-_start-group -lmkl_intel_ilp64 -lmkl_intel_thread -lmkl_core -Wl,-_end-group -liomp5
 id        : lbl

 Nodes     nprocs
 nid00468     1

 Using customized tuning parameters: mindgm=7; mindgv=16; mindgc=1; mindgr=1; noblas=0; minvec=7
 default implementation of scratch files=df  

 ***,Ge
 memory,8,g
 gthresh,twoint=1.e-12
 
 gprint,basis,orbitals
 gexpec,ekin,pot
 
 angstrom
 geometry={
 1                                                                               ! Number of atoms
 Ge 0.0 0.0 0.0
 }
 
 basis={
 
 Including file /global/homes/a/aannabe/repos/pseudopotentiallibrary/recipes/Ge/ccECP/Ge.ccECP.molpro
 
                                   !include,/global/homes/a/aannabe/repos/pseudopotentiallibrary/recipes/Ge/ccECP/Ge.cc-pVTZ.molpro
                                  !include,/global/homes/a/aannabe/repos/pseudopotentiallibrary/recipes/Ge/ccECP/Ge.cc-pCVTZ.molpro
 Including file /global/homes/a/aannabe/repos/pseudopotentiallibrary/recipes/Ge/ccECP/Ge.aug-cc-pVTZ.molpro
 
 
 }
 
 
 {rhf
  start,atden
  wf,4,6,2
  occ,1,1,0,0,1,0,0,0
  open,1.2,1.5
  save,4202.2
 }
 {multi
  start,4202.2
  occ,1,1,1,0,1,0,0
  closed,1,0,0,0,0,0,0,0
  wf,4,4,2;state,1
  wf,4,6,2;state,1
  wf,4,7,2;state,1
  natorb,ci,print
  orbital,5202.2
 }
 {rhf,nitord=1,maxit=0
  start,5202.2
  wf,4,6,2
  occ,1,1,0,0,1,0,0,0
  open,1.2,1.5
 }
 
 scf(i)=energy
 
 _CC_NORM_MAX=2.0
  !NOTE: Perturbative MRCC works only with UHF reference. So, here we will trick MRCC by doing zero UHF iteration right after ROHF.
 
 {uhf
 maxit,0
 }
 scf(i)=energy
 
 {mrcc,method=CCSDT(Q)
 orbital,ignore_error=1                                                          !Ignore the fact that UHF WF is not converged
 maxit,100
 core
 }
 posthf(i)=energy
 
 table,scf,posthf,ekin,pot
 save,3.csv,new
 
 

 Variables initialized (889), CPU time= 0.00 sec
 Commands  initialized (702), CPU time= 0.01 sec, 572 directives.
 Default parameters read. Elapsed time= 0.09 sec

 Checking input...
 Passed
1


                                         ***  PROGRAM SYSTEM MOLPRO  ***
                                       Copyright, TTI GmbH Stuttgart, 2015
                                    Version 2015.1 linked Dec 29 2018 15:55:43


 **********************************************************************************************************************************
 LABEL *   Ge                                                                            
  64 bit serial version                                                                  DATE: 25-Jun-19          TIME: 12:29:20  
 **********************************************************************************************************************************

 SHA1:             19cd028119e0e09f93f0674bd8af7968d9b3eff6
 **********************************************************************************************************************************

 THRESHOLDS:

 ZERO    =  1.00D-12  ONEINT  =  1.00D-12  TWOINT  =  1.00D-12  PREFAC  =  1.00D-14  LOCALI  =  1.00D-09  EORDER  =  1.00D-04
 ENERGY  =  0.00D+00  ETEST   =  0.00D+00  EDENS   =  0.00D+00  THRDEDEF=  1.00D-06  GRADIENT=  1.00D-02  STEP    =  1.00D-03
 ORBITAL =  1.00D-05  CIVEC   =  1.00D-05  COEFF   =  1.00D-04  PRINTCI =  5.00D-02  PUNCHCI =  9.90D+01  OPTGRAD =  3.00D-04
 OPTENERG=  1.00D-06  OPTSTEP =  3.00D-04  THRGRAD =  1.00D-10  COMPRESS=  1.00D-11  VARMIN  =  1.00D-07  VARMAX  =  1.00D-03
 THRDOUB =  0.00D+00  THRDIV  =  1.00D-05  THRRED  =  1.00D-07  THRPSP  =  1.00D+00  THRDC   =  1.00D-10  THRCS   =  1.00D-10
 THRNRM  =  1.00D-08  THREQ   =  0.00D+00  THRDE   =  1.00D+00  THRREF  =  1.00D-05  SPARFAC =  1.00D+00  THRDLP  =  1.00D-07
 THRDIA  =  1.00D-10  THRDLS  =  1.00D-07  THRGPS  =  0.00D+00  THRKEX  =  0.00D+00  THRDIS  =  2.00D-01  THRVAR  =  1.00D-10
 THRLOC  =  1.00D-06  THRGAP  =  1.00D-06  THRLOCT = -1.00D+00  THRGAPT = -1.00D+00  THRORB  =  1.00D-06  THRMLTP =  0.00D+00
 THRCPQCI=  1.00D-10  KEXTA   =  0.00D+00  THRCOARS=  0.00D+00  SYMTOL  =  1.00D-06  GRADTOL =  1.00D-06  THROVL  =  1.00D-08
 THRORTH =  1.00D-08  GRID    =  1.00D-06  GRIDMAX =  1.00D-03  DTMAX   =  0.00D+00  THROCCDE=  1.00D-01  THROCCDE=  1.00D-01



 ZUNIT=ANG
 

Geometry recognized as XYZ


 Variable memory set to 8000000000 words,  buffer space   230000 words

 SETTING BASIS          =    USERDEF


 Recomputing integrals since basis changed


 Using spherical harmonics



 PROGRAM * SEWARD (Integral evaluation for generally contracted gaussian basis sets)     Author: Roland Lindh, 1990

 Geometry written to block  1 of record 700

 Orientation using atomic masses  
 Molecule type: Atom
 Symmetry elements: X,Y,Z
 Rotational constants:       0.0000000      0.0000000      0.0000000 GHz  (calculated with average atomic masses)

 Point group  D2h 



 ATOMIC COORDINATES

 NR  ATOM    CHARGE       X              Y              Z

   1  GE      4.00    0.000000000    0.000000000    0.000000000


          GE  CORE POTENTIAL

          f POTENTIAL

 POWERS             1              3              2              2
 EXPONENTIALS   1.478963       3.188906       1.927439       1.545539    
 COEFFICIENTS   4.000000       5.915851      -12.03371       1.283543    

          s - f POTENTIAL

 POWERS             2              2
 EXPONENTIALS   2.894474       1.550340    
 COEFFICIENTS   43.26543      -1.909340    

          p - f POTENTIAL

 POWERS             2              2
 EXPONENTIALS   2.986529       1.283381    
 COEFFICIENTS   35.26301      0.9634399    

          d - f POTENTIAL

 POWERS             2              2
 EXPONENTIALS   1.043001      0.5545627    
 COEFFICIENTS   2.339019      0.5413807    


 BASIS DATA

   Nr Sym  Nuc  Type         Exponents   Contraction coefficients

    1.1 Ag    1  1s          46.470485    -0.000229
                             20.357328     0.001574
                              8.917936    -0.011345
                              3.906681     0.098972
                              1.711400    -0.331545
                              0.749713    -0.094809
                              0.328427     0.438933
                              0.143874     0.596777
                              0.063027     0.186251
    2.1 Ag    1  1s           0.487752     1.000000
    3.1 Ag    1  1s           0.093287     1.000000
    4.1 Ag    1  1s           0.037315     1.000000
    5.1 Ag    1  3d0          0.398162     1.000000
    6.1 Ag    1  3d2+         0.398162     1.000000
    7.1 Ag    1  3d0          0.145611     1.000000
    8.1 Ag    1  3d2+         0.145611     1.000000
    9.1 Ag    1  3d0          0.058244     1.000000
   10.1 Ag    1  3d2+         0.058244     1.000000
    1.2 B3u   1  2px         22.641155     0.000052
                             10.174686    -0.000675
                              4.572392     0.011276
                              2.054783    -0.074628
                              0.923397    -0.012070
                              0.414964     0.216919
                              0.186480     0.438735
                              0.083802     0.385126
                              0.037660     0.108074
    2.2 B3u   1  2px          0.106229     1.000000
    3.2 B3u   1  2px          0.045719     1.000000
    4.2 B3u   1  2px          0.018288     1.000000
    5.2 B3u   1  4f1+         0.357699     1.000000
    6.2 B3u   1  4f3+         0.357699     1.000000
    7.2 B3u   1  4f1+         0.143080     1.000000
    8.2 B3u   1  4f3+         0.143080     1.000000
    1.3 B2u   1  2py         22.641155     0.000052
                             10.174686    -0.000675
                              4.572392     0.011276
                              2.054783    -0.074628
                              0.923397    -0.012070
                              0.414964     0.216919
                              0.186480     0.438735
                              0.083802     0.385126
                              0.037660     0.108074
    2.3 B2u   1  2py          0.106229     1.000000
    3.3 B2u   1  2py          0.045719     1.000000
    4.3 B2u   1  2py          0.018288     1.000000
    5.3 B2u   1  4f1-         0.357699     1.000000
    6.3 B2u   1  4f3-         0.357699     1.000000
    7.3 B2u   1  4f1-         0.143080     1.000000
    8.3 B2u   1  4f3-         0.143080     1.000000
    1.4 B1g   1  3d2-         0.398162     1.000000
    2.4 B1g   1  3d2-         0.145611     1.000000
    3.4 B1g   1  3d2-         0.058244     1.000000
    1.5 B1u   1  2pz         22.641155     0.000052
                             10.174686    -0.000675
                              4.572392     0.011276
                              2.054783    -0.074628
                              0.923397    -0.012070
                              0.414964     0.216919
                              0.186480     0.438735
                              0.083802     0.385126
                              0.037660     0.108074
    2.5 B1u   1  2pz          0.106229     1.000000
    3.5 B1u   1  2pz          0.045719     1.000000
    4.5 B1u   1  2pz          0.018288     1.000000
    5.5 B1u   1  4f0          0.357699     1.000000
    6.5 B1u   1  4f2+         0.357699     1.000000
    7.5 B1u   1  4f0          0.143080     1.000000
    8.5 B1u   1  4f2+         0.143080     1.000000
    1.6 B2g   1  3d1+         0.398162     1.000000
    2.6 B2g   1  3d1+         0.145611     1.000000
    3.6 B2g   1  3d1+         0.058244     1.000000
    1.7 B3g   1  3d1-         0.398162     1.000000
    2.7 B3g   1  3d1-         0.145611     1.000000
    3.7 B3g   1  3d1-         0.058244     1.000000
    1.8 Au    1  4f2-         0.357699     1.000000
    2.8 Au    1  4f2-         0.143080     1.000000

 NUCLEAR CHARGE:                    4
 NUMBER OF PRIMITIVE AOS:          86
 NUMBER OF SYMMETRY AOS:           77
 NUMBER OF CONTRACTIONS:           45   (  10Ag  +   8B3u +   8B2u +   3B1g +   8B1u +   3B2g +   3B3g +   2Au  )
 NUMBER OF CORE ORBITALS:           0   (   0Ag  +   0B3u +   0B2u +   0B1g +   0B1u +   0B2g +   0B3g +   0Au  )
 NUMBER OF VALENCE ORBITALS:        4   (   1Ag  +   1B3u +   1B2u +   0B1g +   1B1u +   0B2g +   0B3g +   0Au  )


 NUCLEAR REPULSION ENERGY    0.00000000

 EXTRA SYMMETRY OF AOS IN SYMMETRY 1:   1 1 1 1 2 3 2 3 2 3
 EXTRA SYMMETRY OF AOS IN SYMMETRY 2:   1 1 1 1 2 3 2 3
 EXTRA SYMMETRY OF AOS IN SYMMETRY 3:   1 1 1 1 2 3 2 3
 EXTRA SYMMETRY OF AOS IN SYMMETRY 5:   1 1 1 1 2 3 2 3

 Eigenvalues of metric

         1 0.205E-01 0.155E+00 0.155E+00 0.167E+00 0.654E+00 0.758E+00 0.758E+00 0.209E+01
         2 0.198E-01 0.108E+00 0.367E+00 0.367E+00 0.771E+00 0.163E+01 0.163E+01 0.310E+01
         3 0.198E-01 0.108E+00 0.367E+00 0.367E+00 0.771E+00 0.163E+01 0.163E+01 0.310E+01
         4 0.155E+00 0.758E+00 0.209E+01
         5 0.198E-01 0.108E+00 0.367E+00 0.367E+00 0.771E+00 0.163E+01 0.163E+01 0.310E+01
         6 0.155E+00 0.758E+00 0.209E+01
         7 0.155E+00 0.758E+00 0.209E+01
         8 0.367E+00 0.163E+01


 Contracted 2-electron integrals neglected if value below      1.0D-12
 AO integral compression algorithm  1   Integral accuracy      1.0D-12

     1.049 MB (compressed) written to integral file ( 89.8%)


 NUMBER OF SORTED TWO-ELECTRON INTEGRALS:      75808.     BUFFER LENGTH:  32768
 NUMBER OF SEGMENTS:   1  SEGMENT LENGTH:      75808      RECORD LENGTH: 524288

 Memory used in sort:       0.63 MW

 SORT1 READ      155797. AND WROTE       61548. INTEGRALS IN      1 RECORDS. CPU TIME:     0.00 SEC, REAL TIME:     0.01 SEC
 SORT2 READ       61548. AND WROTE       75808. INTEGRALS IN      4 RECORDS. CPU TIME:     0.02 SEC, REAL TIME:     0.03 SEC

 FILE SIZES:   FILE 1:    21.0 MBYTE,  FILE 4:     4.2 MBYTE,   TOTAL:     25.2 MBYTE

 OPERATOR DM      FOR CENTER  0  COORDINATES:    0.000000    0.000000    0.000000
 OPERATOR EKIN    FOR CENTER  0  COORDINATES:    0.000000    0.000000    0.000000
 OPERATOR POT     FOR CENTER  0  COORDINATES:    0.000000    0.000000    0.000000


 **********************************************************************************************************************************
 DATASETS  * FILE   NREC   LENGTH (MB)   RECORD NAMES
              1      20       20.39       500      610      700      900      950      970     1000      129      960     1100   
                                          VAR    BASINP    GEOM    SYMINP    ZMAT    AOBASIS   BASIS     P2S    ABASIS      S 
                                         1400     1410     1420     1200     1210     1080     1600     1650     1300     1700   
                                         EKIN       V       ECP      H0       H01     AOSYM     SMH    MOLCAS    ERIS     OPER   

 PROGRAMS   *        TOTAL       INT
 CPU TIMES  *         1.89      1.79
 REAL TIME  *        13.22 SEC
 DISK USED  *        25.47 MB      
 **********************************************************************************************************************************


 PROGRAM * RHF-SCF (OPEN SHELL)       Authors: W. Meyer, H.-J. Werner


 NUMBER OF ELECTRONS:       3+    1-    SPACE SYMMETRY=6    SPIN SYMMETRY: Triplet 
 CONVERGENCE THRESHOLDS:    1.00E-05 (Density)    1.00E-07 (Energy)
 MAX. NUMBER OF ITERATIONS:       60
 INTERPOLATION TYPE:            DIIS
 INTERPOLATION STEPS:              2 (START)      1 (STEP)
 LEVEL SHIFTS:                 -0.60 (CLOSED) -0.30 (OPEN) 


 Singly occupied orbitals:      1.2       1.5

   Atom=GE basis=ECP28MDF_GUESS    lmin=0  lmax=1

 Orbital guess generated from atomic densities. Full valence occupancy:    1   1   1   0   1   0   0   0


 Molecular orbital dump at record        4202.2

 ITERATION    DDIFF          GRAD             ENERGY        2-EL.EN.            DIPOLE MOMENTS         DIIS   ORB.
    1      0.000D+00      0.000D+00        -3.64830169      3.677477    0.00000    0.00000    0.00000    0    start
    2      0.000D+00      0.863D-02        -3.65910463      3.801076    0.00000    0.00000    0.00000    1    diag,B
    3      0.194D-01      0.422D-02        -3.66371950      3.889982    0.00000    0.00000    0.00000    2    diag,B
    4      0.128D-01      0.200D-02        -3.66483109      3.928176    0.00000    0.00000    0.00000    3    diag,B
    5      0.737D-02      0.615D-03        -3.66489976      3.933258    0.00000    0.00000    0.00000    4    diag,B
    6      0.266D-02      0.122D-03        -3.66490171      3.932781    0.00000    0.00000    0.00000    5    diag,B
    7      0.643D-03      0.230D-04        -3.66490176      3.932791    0.00000    0.00000    0.00000    6    fixocc
    8      0.900D-04      0.264D-05        -3.66490176      3.932793    0.00000    0.00000    0.00000    7    diag,B
    9      0.143D-04      0.106D-05        -3.66490176      3.932792    0.00000    0.00000    0.00000    8    diag,B
   10      0.570D-05      0.127D-06        -3.66490176      3.932792    0.00000    0.00000    0.00000    0    orth

 Final alpha occupancy:   1   1   0   0   1   0   0   0
 Final beta  occupancy:   1   0   0   0   0   0   0   0

 !RHF STATE 1.6 Energy                 -3.664901764210
 Nuclear energy                         0.00000000
 One-electron energy                   -5.63129755
 Two-electron energy                    1.96639578
 Virial quotient                       -2.66853764
 !RHF STATE 1.6 Dipole moment           0.00000000     0.00000000     0.00000000
 Dipole moment /Debye                   0.00000000     0.00000000     0.00000000
 

 !RHF expec          <1.6|EKIN|1.6>     1.373374581548
 
 !RHF expec           <1.6|POT|1.6>    -1.867837581190

 ELECTRON ORBITALS
 =================


   Orb  Occ    Energy  Couls-En    Coefficients

                                   1 1s      1 1s      1 1s      1 1s      1 3d0     1 3d2+    1 3d0     1 3d2+    1 3d0     1 3d2+ 


   1.1   2    -0.5631   -2.1735  1.000292  0.000142 -0.000724  0.000366 -0.000798 -0.001382  0.002578  0.004466  0.002147  0.003718

                                   1 2px     1 2px     1 2px     1 2px     1 4f1+    1 4f3+    1 4f1+    1 4f3+ 

   1.2   +    -0.2861   -1.4914  0.999543  0.000770 -0.000850  0.000837 -0.000029 -0.000111  0.000022  0.000085

                                   1 2pz     1 2pz     1 2pz     1 2pz     1 4f0     1 4f2+    1 4f0     1 4f2+ 

   1.5   +    -0.2861   -1.4914  0.999543  0.000770 -0.000850  0.000837 -0.000070 -0.000090  0.000054  0.000069

 HOMO      1.2    -0.286115 =      -7.7856eV
 LUMO      1.3    -0.015725 =      -0.4279eV
 LUMO-HOMO         0.270390 =       7.3577eV


 **********************************************************************************************************************************
 DATASETS  * FILE   NREC   LENGTH (MB)   RECORD NAMES
              1      20       20.39       500      610      700      900      950      970     1000      129      960     1100   
                                          VAR    BASINP    GEOM    SYMINP    ZMAT    AOBASIS   BASIS     P2S    ABASIS      S 
                                         1400     1410     1420     1200     1210     1080     1600     1650     1300     1700   
                                         EKIN       V       ECP      H0       H01     AOSYM     SMH    MOLCAS    ERIS     OPER   

              2       4        2.76       700     1000      520     4202   
                                         GEOM     BASIS   MCVARS     RHF  

 PROGRAMS   *        TOTAL       RHF       INT
 CPU TIMES  *         1.93      0.04      1.79
 REAL TIME  *        13.49 SEC
 DISK USED  *        25.47 MB      
 **********************************************************************************************************************************


 PROGRAM * MULTI (Direct Multiconfiguration SCF)       Authors: P.J. Knowles, H.-J. Werner (1984)     S.T. Elbert (1988)


 Number of closed-shell orbitals:   1 (   1   0   0   0   0   0   0   0 )
 Number of active  orbitals:        3 (   0   1   1   0   1   0   0   0 )
 Number of external orbitals:      41 (   9   7   7   3   7   3   3   2 )

 State symmetry 1

 Number of electrons:     2    Spin symmetry=Triplet   Space symmetry=4
 Number of states:        1
 Number of CSFs:          1   (1 determinants, 3 intermediate states)

 State symmetry 2

 Number of electrons:     2    Spin symmetry=Triplet   Space symmetry=6
 Number of states:        1
 Number of CSFs:          1   (1 determinants, 3 intermediate states)

 State symmetry 3

 Number of electrons:     2    Spin symmetry=Triplet   Space symmetry=7
 Number of states:        1
 Number of CSFs:          1   (1 determinants, 3 intermediate states)

 Molecular orbitals read from record     4202.2  Type=RHF/CANONICAL (state 1.6)
 *** IN SYMMETRY 1 ORBITAL  1 SYMMETRY CONTAMINATION OF 0.148D-01 HAS BEEN REMOVED

 EXTRA SYMMETRY OF MOS IN SYMMETRY 1:   1 1 2 3 2 3 1 3 2 1
 *** IN SYMMETRY 2 ORBITAL  1 SYMMETRY CONTAMINATION OF 0.245D-03 HAS BEEN REMOVED
 EXTRA SYMMETRY OF MOS IN SYMMETRY 2:   1 1 1 3 2 1 3 2
 *** IN SYMMETRY 3 ORBITAL  1 SYMMETRY CONTAMINATION OF 0.433D-02 HAS BEEN REMOVED
 EXTRA SYMMETRY OF MOS IN SYMMETRY 3:   1 1 1 3 2 1 3 2
 *** IN SYMMETRY 5 ORBITAL  1 SYMMETRY CONTAMINATION OF 0.283D-03 HAS BEEN REMOVED
 EXTRA SYMMETRY OF MOS IN SYMMETRY 5:   1 1 1 3 2 1 3 2

 Wavefunction dump at record             5202.2

 Convergence thresholds  0.10E-01 (gradient)  0.10E-05 (energy)  0.10E-02 (step length)

 Weight factors for state symmetry  1:    0.33333
 Weight factors for state symmetry  2:    0.33333
 Weight factors for state symmetry  3:    0.33333

 Number of orbital rotations:       30   (     0 Core/Active      9 Core/Virtual   0 Active/Active     21 Active/Virtual)
 Total number of variables:         33


 ITER. MIC  NCI  NEG     ENERGY(VAR)     ENERGY(PROJ)   ENERGY CHANGE     GRAD(0)  GRAD(ORB)   GRAD(CI)     STEP       TIME

   1   20   12    0      -3.64744647      -3.66483192   -0.01738546    0.05408905 0.00000000 0.00000000  0.34D+00      0.01
   2   15   12    0      -3.66481607      -3.66482408   -0.00000801    0.00264139 0.00000000 0.00000000  0.52D-02      0.02
   3   15   12    0      -3.66482408      -3.66482408   -0.00000000    0.00000247 0.00000000 0.00000000  0.36D-05      0.03

 ** WVFN ****  CONVERGENCE REACHED, FINAL GRADIENT:  0.20D-11



 Results for state 1.4
 =====================

 !MCSCF STATE 1.4 Energy               -3.664824080267
 Nuclear energy                         0.00000000
 Kinetic energy                         1.37334859
 One electron energy                   -5.63140790
 Two electron energy                    1.96658382
 Virial ratio                           3.66853157

 !MCSCF STATE 1.4 Dipole moment         0.00000000     0.00000000     0.00000000
 Dipole moment /Debye                   0.00000000     0.00000000     0.00000000



 Results for state 1.6
 =====================

 !MCSCF STATE 1.6 Energy               -3.664824080267
 Nuclear energy                         0.00000000
 Kinetic energy                         1.37334859
 One electron energy                   -5.63140790
 Two electron energy                    1.96658382
 Virial ratio                           3.66853157

 !MCSCF STATE 1.6 Dipole moment         0.00000000     0.00000000     0.00000000
 Dipole moment /Debye                   0.00000000     0.00000000     0.00000000



 Results for state 1.7
 =====================

 !MCSCF STATE 1.7 Energy               -3.664824080267
 Nuclear energy                         0.00000000
 Kinetic energy                         1.37334859
 One electron energy                   -5.63140790
 Two electron energy                    1.96658382
 Virial ratio                           3.66853157

 !MCSCF STATE 1.7 Dipole moment         0.00000000     0.00000000     0.00000000
 Dipole moment /Debye                   0.00000000     0.00000000     0.00000000

 State-averaged charge density matrix saved on record  5202.2 (density set 1)

 !MCSCF expec        <1.4|EKIN|1.4>     1.373348594070
 !MCSCF expec        <1.6|EKIN|1.6>     1.373348594071
 !MCSCF expec        <1.7|EKIN|1.7>     1.373348594070

 !MCSCF expec         <1.4|POT|1.4>    -1.867853781282
 !MCSCF expec         <1.6|POT|1.6>    -1.867853781282
 !MCSCF expec         <1.7|POT|1.7>    -1.867853781282


 NATURAL ORBITALS (state averaged)
 =================================

   Orb     Occ        Energy       Coefficients

                                   1 1s      1 1s      1 1s      1 1s      1 3d0     1 3d2+    1 3d0     1 3d2+    1 3d0     1 3d2+ 


   1.1  2.00000    -0.563083     1.000166  0.000094 -0.000598  0.000459  0.000000  0.000000  0.000000  0.000000  0.000000  0.000000

                                   1 2px     1 2px     1 2px     1 2px     1 4f1+    1 4f3+    1 4f1+    1 4f3+ 

   1.2  0.66667    -0.062885     0.999688  0.000711 -0.000977  0.000858  0.000000  0.000000  0.000000  0.000000

                                   1 2py     1 2py     1 2py     1 2py     1 4f1-    1 4f3-    1 4f1-    1 4f3- 

   1.3  0.66667    -0.062885     0.999688  0.000711 -0.000977  0.000858  0.000000  0.000000  0.000000  0.000000

                                   1 2pz     1 2pz     1 2pz     1 2pz     1 4f0     1 4f2+    1 4f0     1 4f2+ 

   1.5  0.66667    -0.062885     0.999688  0.000711 -0.000977  0.000858  0.000000  0.000000  0.000000  0.000000
 

 EXTRA SYMMETRY OF MOS IN SYMMETRY 1:   1 1 2 3 2 3 1 2 3 1
 EXTRA SYMMETRY OF MOS IN SYMMETRY 2:   1 1 1 2 3 1 2 3
 EXTRA SYMMETRY OF MOS IN SYMMETRY 3:   1 1 1 2 3 1 2 3
 EXTRA SYMMETRY OF MOS IN SYMMETRY 5:   1 1 1 2 3 1 2 3

 Natural orbital dump (state averaged) at molpro section  5202.2    (Orbital set 2)


 CI vector for state symmetry 1
 ==============================

 a a 0           1.0000000

 TOTAL ENERGIES                        -3.66482408

 CI vector for state symmetry 2
 ==============================

 a 0 a           1.0000000

 TOTAL ENERGIES                        -3.66482408

 CI vector for state symmetry 3
 ==============================

 0 a a           1.0000000

 TOTAL ENERGIES                        -3.66482408



 **********************************************************************************************************************************
 DATASETS  * FILE   NREC   LENGTH (MB)   RECORD NAMES
              1      21       20.43       500      610      700      900      950      970     1000      129      960     1100   
                                          VAR    BASINP    GEOM    SYMINP    ZMAT    AOBASIS   BASIS     P2S    ABASIS      S 
                                         1400     1410     1420     1200     1210     1080     1600     1650     1300     1700   
                                         EKIN       V       ECP      H0       H01     AOSYM     SMH    MOLCAS    ERIS     OPER   
                                         1380   
                                         JKOP   

              2       5        5.26       700     1000      520     4202     5202   
                                         GEOM     BASIS   MCVARS     RHF     MCSCF   

 PROGRAMS   *        TOTAL     MULTI       RHF       INT
 CPU TIMES  *         1.97      0.04      0.04      1.79
 REAL TIME  *        15.10 SEC
 DISK USED  *        34.90 MB      
 **********************************************************************************************************************************


 PROGRAM * RHF-SCF (OPEN SHELL)       Authors: W. Meyer, H.-J. Werner


 NUMBER OF ELECTRONS:       3+    1-    SPACE SYMMETRY=6    SPIN SYMMETRY: Triplet 
 CONVERGENCE THRESHOLDS:    1.00E-05 (Density)    1.00E-07 (Energy)
 MAX. NUMBER OF ITERATIONS:        0
 INTERPOLATION TYPE:            DIIS
 INTERPOLATION STEPS:              2 (START)      1 (STEP)
 LEVEL SHIFTS:                 -0.60 (CLOSED) -0.30 (OPEN) 


 Singly occupied orbitals:      1.2       1.5
 Molecular orbitals read from record     5202.2  Type=MCSCF/NATURAL (state averaged)

 Molecular orbital dump at record        2101.2

 ITERATION    DDIFF          GRAD             ENERGY        2-EL.EN.            DIPOLE MOMENTS         DIIS   ORB.
    1      0.000D+00      0.000D+00        -3.66482408      3.933168    0.00000    0.00000    0.00000    0    start

 Final alpha occupancy:   1   1   0   0   1   0   0   0
 Final beta  occupancy:   1   0   0   0   0   0   0   0

 !RHF STATE 1.6 Energy                 -3.664824080267
 Nuclear energy                         0.00000000
 One-electron energy                   -5.63140790
 Two-electron energy                    1.96658382
 Virial quotient                       -2.66853157
 !RHF STATE 1.6 Dipole moment           0.00000000     0.00000000     0.00000000
 Dipole moment /Debye                   0.00000000     0.00000000     0.00000000
 

 !RHF expec          <1.6|EKIN|1.6>     1.373348594071
 
 !RHF expec           <1.6|POT|1.6>    -1.867853781282

 ELECTRON ORBITALS
 =================


   Orb  Occ    Energy  Couls-En    Coefficients

                                   1 1s      1 1s      1 1s      1 1s      1 3d0     1 3d2+    1 3d0     1 3d2+    1 3d0     1 3d2+ 


   1.1   2    -0.5631   -2.1735  1.000166  0.000094 -0.000598  0.000459  0.000000  0.000000  0.000000  0.000000  0.000000  0.000000

                                   1 2px     1 2px     1 2px     1 2px     1 4f1+    1 4f3+    1 4f1+    1 4f3+ 

   1.2   +    -0.0629   -1.2682  0.999688  0.000711 -0.000977  0.000858  0.000000  0.000000  0.000000  0.000000

                                   1 2pz     1 2pz     1 2pz     1 2pz     1 4f0     1 4f2+    1 4f0     1 4f2+ 

   1.5   +    -0.0629   -1.2682  0.999688  0.000711 -0.000977  0.000858  0.000000  0.000000  0.000000  0.000000

 HOMO      1.2    -0.062885 =      -1.7112eV
 LUMO      1.3    -0.062885 =      -1.7112eV
 LUMO-HOMO        -0.000000 =      -0.0000eV


 **********************************************************************************************************************************
 DATASETS  * FILE   NREC   LENGTH (MB)   RECORD NAMES
              1      21       20.43       500      610      700      900      950      970     1000      129      960     1100   
                                          VAR    BASINP    GEOM    SYMINP    ZMAT    AOBASIS   BASIS     P2S    ABASIS      S 
                                         1400     1410     1420     1200     1210     1080     1600     1650     1300     1700   
                                         EKIN       V       ECP      H0       H01     AOSYM     SMH    MOLCAS    ERIS     OPER   
                                         1380   
                                         JKOP   

              2       6        7.77       700     1000      520     4202     5202     2101   
                                         GEOM     BASIS   MCVARS     RHF     MCSCF     RHF  

 PROGRAMS   *        TOTAL       RHF     MULTI       RHF       INT
 CPU TIMES  *         1.99      0.01      0.04      0.04      1.79
 REAL TIME  *        15.28 SEC
 DISK USED  *        34.90 MB      
 **********************************************************************************************************************************
 SETTING SCF(I)         =        -3.66482408  AU                              
 SETTING _CC_NORM_MAX   =         2.00000000                                  


 PROGRAM * UHF-SCF       Authors: W. Meyer, H.-J. Werner


 NUMBER OF ELECTRONS:       3+    1-    SPACE SYMMETRY=6    SPIN SYMMETRY: Triplet 
 CONVERGENCE THRESHOLDS:    1.00E-05 (Density)    1.00E-07 (Energy)
 MAX. NUMBER OF ITERATIONS:        0
 INTERPOLATION TYPE:            DIIS
 INTERPOLATION STEPS:              2 (START)      1 (STEP)
 LEVEL SHIFTS:                  0.20 (ALPHA)   0.20 (BETA) 



 Molecular orbitals read from record     2101.2  Type=RHF/CANONICAL (state 1.6)

 Molecular orbital dump at record        2200.2

 Initial alpha occupation   1   1   0   0   1   0   0   0
 Initial beta  occupation   1   0   0   0   0   0   0   0

 ITERATION    DDIFF          GRAD             ENERGY        2-EL.EN.            DIPOLE MOMENTS         DIIS
    1      0.000D+00      0.000D+00        -3.66482408      3.933168    0.00000    0.00000    0.00000    0
 
 Final alpha occupancy:   1   1   0   0   1   0   0   0
 Final beta  occupancy:   1   0   0   0   0   0   0   0

 !UHF STATE 1.6 Energy                 -3.664824080267
 Nuclear energy                         0.00000000
 One-electron energy                   -5.63140790
 Two-electron energy                    1.96658382
 Virial quotient                       -2.66853157
 !UHF STATE 1.6 Dipole moment           0.00000000     0.00000000     0.00000000
 Dipole moment /Debye                   0.00000000     0.00000000     0.00000000
 

 !UHF expec          <1.6|EKIN|1.6>     1.373348594071
 
 !UHF expec           <1.6|POT|1.6>    -1.867853781282

 ELECTRON ORBITALS FOR POSITIVE SPIN
 ===================================


   Orb  Occ    Energy  Couls-En    Coefficients

                                   1 1s      1 1s      1 1s      1 1s      1 3d0     1 3d2+    1 3d0     1 3d2+    1 3d0     1 3d2+ 


   1.1   +    -0.5631   -2.1735  1.000166  0.000094 -0.000598  0.000459  0.000000  0.000000  0.000000  0.000000  0.000000  0.000000

                                   1 2px     1 2px     1 2px     1 2px     1 4f1+    1 4f3+    1 4f1+    1 4f3+ 

   1.2   +    -0.0629   -1.2682  0.999688  0.000711 -0.000977  0.000858  0.000000  0.000000  0.000000  0.000000

                                   1 2pz     1 2pz     1 2pz     1 2pz     1 4f0     1 4f2+    1 4f0     1 4f2+ 

   1.5   +    -0.0629   -1.2682  0.999688  0.000711 -0.000977  0.000858  0.000000  0.000000  0.000000  0.000000

 ELECTRON ORBITALS FOR NEGATIVE SPIN
 ===================================


   Orb  Occ    Energy  Couls-En    Coefficients

                                   1 1s      1 1s      1 1s      1 1s      1 3d0     1 3d2+    1 3d0     1 3d2+    1 3d0     1 3d2+ 


   1.1   -    -0.5631   -2.1735  1.000166  0.000094 -0.000598  0.000459  0.000000  0.000000  0.000000  0.000000  0.000000  0.000000

 HOMO      1.2    -0.062885 =      -1.7112eV
 LUMO      1.3    -0.062885 =      -1.7112eV
 LUMO-HOMO        -0.000000 =      -0.0000eV

 EXPECTATION VALUE OF S**2:             2.00000000

 Occupation number threshold for canonical orbitals:  1.999000 (occupied),  0.001000 (virtual)

 Number of pseudo-canonical orbitals per symmetry:    1   0   0   0   0   0   0   0
 Number of active natural orbitals per symmetry:      0   1   0   0   1   0   0   0

 NATURAL CHARGE ORBITALS
 =======================


   Orb     Occ        Energy       Coefficients

                                   1 1s      1 1s      1 1s      1 1s      1 3d0     1 3d2+    1 3d0     1 3d2+    1 3d0     1 3d2+ 


   1.1  2.00000    -0.563083     1.000166  0.000094 -0.000598  0.000459  0.000000  0.000000  0.000000  0.000000  0.000000  0.000000

                                   1 2px     1 2px     1 2px     1 2px     1 4f1+    1 4f3+    1 4f1+    1 4f3+ 

   1.2  1.00000    -0.103722     0.999688  0.000711 -0.000977  0.000858  0.000000  0.000000  0.000000  0.000000

                                   1 2pz     1 2pz     1 2pz     1 2pz     1 4f0     1 4f2+    1 4f0     1 4f2+ 

   1.5  1.00000    -0.103722     0.999688  0.000711 -0.000977  0.000858  0.000000  0.000000  0.000000  0.000000

 Natural orbitals saved to record    2200.2 (Orbital set 3)

 Orbital spaces for UNO-CAS (Min. occupation: 0.020  Max. occupation: 1.980):

 Closed:        1   0   0   0   0   0   0   0
 Active:        0   1   0   0   1   0   0   0

 No convergence



 **********************************************************************************************************************************
 DATASETS  * FILE   NREC   LENGTH (MB)   RECORD NAMES
              1      21       20.43       500      610      700      900      950      970     1000      129      960     1100   
                                          VAR    BASINP    GEOM    SYMINP    ZMAT    AOBASIS   BASIS     P2S    ABASIS      S 
                                         1400     1410     1420     1200     1210     1080     1600     1650     1300     1700   
                                         EKIN       V       ECP      H0       H01     AOSYM     SMH    MOLCAS    ERIS     OPER   
                                         1380   
                                         JKOP   

              2       7       10.28       700     1000      520     4202     5202     2101     2200   
                                         GEOM     BASIS   MCVARS     RHF     MCSCF     RHF      UHF  

 PROGRAMS   *        TOTAL       UHF       RHF     MULTI       RHF       INT
 CPU TIMES  *         2.00      0.02      0.01      0.04      0.04      1.79
 REAL TIME  *        15.52 SEC
 DISK USED  *        34.90 MB      
 **********************************************************************************************************************************
 SETTING SCF(I)         =        -3.66482408  AU                              


 PROGRAM * MRCC (General Multireference Coupled Cluster)    Author: M. Kallay, 2000-2005

 ***  Initialisation ***

   0 Spin projections
 
 Molecular orbitals read from record     2200.2  Type=UHF/ALPHA (state 1.6)

 ?Warning: UHF not converged
 Molecular orbitals read from record     2200.2  Type=UHF/BETA (state 1.6)

 ?Warning: UHF not converged
 
 Frozen orbitals:              0 (  0  0  0  0  0  0  0  0)
 Active orbitals:             45 ( 10  8  8  3  8  3  3  2)
 Active electrons:             4
 Spin quantum number:          1.0

 Transformed integrals will be written to file mrcc_59639/fort.55

 Load integrals                2.0 sec
 Transform integrals           2.1 sec
 Storage for integrals:         426551
 Remaining memory:           *********

 Core energy:               0.00000000
 
 MRCC Input:
     4     0     0     0     3     0     0     6     0     0     0     1     1     0     0     7     0     0   0.000     0   64000
  ex.lev,nsing,ntrip, rest,method,dens,conver,symm, diag, CS ,spatial, HF, ndoub,nacto,nactv, tol, maxex, sacc, freq,  dboc,   mem
  2  0  0  0  0  0  0  0  0  0  1  0  0  0  0  0  0  0  0  0  0  0  0  0  0  0  0  0  0  1  0  0  0  0  0  0  0  0  0  0  0  0  0  0  0
 MRCC Input end
 Variable memory released
 MRCC now being run, temporary output in /global/cscratch1/sd/aannabe/mrcc_59639/mrcc.out
 **********************************************************************
                          MRCC program system
 **********************************************************************

                              Written by
  Mihaly Kallay, Zoltan Rolik, Jozsef Csontos, Peter Nagy, Gyula Samu,
      David Mester, Jozsef Csoka, Bernat Szabo, Istvan Ladjanszki,
       Lorant Szegedy, Bence Ladoczki, Klara Petrov, Mate Farkas,
                    Pal D. Mezei, and Bence Hegely

        Department of Physical Chemistry and Materials Science
            Budapest University of Technology and Economics
                  Budapest P.O.Box 91, H-1521 Hungary

                              www.mrcc.hu

                       Release date: May 23, 2018

 ************************ 2019-06-25 12:29:42 *************************
 Executing goldstone...

 Generation of CC equations in terms of H and T...
 Generation of antisymmetrized Goldstone diagrams...
 Number of diagrams in T^1 equations:    15
 Number of diagrams in T^2 equations:    38
 Number of diagrams in T^3 equations:    49
 Number of diagrams in T^4 equations:     5
 Translation of diagrams to factorized equations...
 Optimizing intermediate calculation...
 Number of floating-point operations per iteration step:   4.0982E+08
 Probable CPU time per iteration step (hours):      0.00
 Required memory (Mbytes):     448.7
 Number of intermediates:                                  80
 Number of intermediates to be stored:                     32
 Length of intermediate file (Mbytes):       8.4

 ************************ 2019-06-25 12:29:43 *************************
 Executing xmrcc...

 **********************************************************************
 CC(3)(4) calculation


 Allocation of 448.7 Mbytes of memory...
 Number of spinorbitals:                    90
 Number of alpha electrons:                        3
 Number of beta electrons:                         1
 Spin multiplicity:                     2
 z-component of spin:  1.0
 Spatial symmetry:                      6
 Convergence criterion:  1.0E-07
 Construction of occupation graphs...
 Number of                     0 -fold excitations:                      1
 Number of                     1 -fold excitations:                     32
 Number of                     2 -fold excitations:                   1097
 Number of                     3 -fold excitations:                  15607
 Total number of configurations:                  16737
 Calculation of coupling coefficients...
 Length of intermediate file (Mbytes):       6.7

 ======================================================================

 Spin case  1   Alpha:  3   Beta:  1
 Number of excitations:                  62872
 Number of                     4 -fold excitations:                  62872

 Memory requirements /Mbyte/:
               Minimal        Optimal
 Real*8:         23.0082        31.3201
 Integer:         6.5905
 Total:          29.5986        37.9106


 ************************ 2019-06-25 12:29:44 *************************
 Executing mrcc...

 **********************************************************************
 CCSDT(Q) calculation


 Allocation of   31.3 Mbytes of memory...
 Number of spinorbitals:  90
 Number of alpha electrons:  3
 Number of beta  electrons:  1
 Spin multiplicity: 2
 z-component of spin:  1.0
 Spatial symmetry: 6
 Convergence criterion:  1.0E-07
 Construction of occupation graphs...
 Number of 0-fold excitations: 1
 Number of 1-fold excitations: 32
 Number of 2-fold excitations: 1097
 Number of 3-fold excitations: 15607
 Total number of determinants: 16737
 Calculation of coupling coefficients...
 Initial cluster amplitudes are generated.
 Length of intermediate file (Mbytes):       6.7
 Reading integral list from unit 55...
 Sorting integrals...
 Sorting integrals...
 Sorting integrals...
 Sorting integrals...
 Energy of reference determinant [au]:      -3.664824080267
 Calculation of MP denominators...

 Starting CC iteration...
 ======================================================================
 Norm of residual vector:     0.33046691
 CPU time [min]:     0.019                   Wall time [min]:     0.023

 Iteration  1  CC energy:    -3.72359682  Energy decrease:   0.05877273
 ======================================================================
 Norm of residual vector:     0.09242393
 CPU time [min]:     0.027                   Wall time [min]:     0.031

 Iteration  2  CC energy:    -3.73547071  Energy decrease:   0.01187390
 ======================================================================
 Norm of residual vector:     0.02673755
 CPU time [min]:     0.035                   Wall time [min]:     0.040

 Iteration  3  CC energy:    -3.73975619  Energy decrease:   0.00428547
 ======================================================================
 Norm of residual vector:     0.00663666
 CPU time [min]:     0.043                   Wall time [min]:     0.049

 Iteration  4  CC energy:    -3.73992087  Energy decrease:   0.00016469
 ======================================================================
 Norm of residual vector:     0.00169943
 CPU time [min]:     0.052                   Wall time [min]:     0.059

 Iteration  5  CC energy:    -3.73997853  Energy decrease:   0.00005766
 ======================================================================
 Norm of residual vector:     0.00049307
 CPU time [min]:     0.060                   Wall time [min]:     0.068

 Iteration  6  CC energy:    -3.73995675  Energy decrease:   0.00002178
 ======================================================================
 Norm of residual vector:     0.00013806
 CPU time [min]:     0.068                   Wall time [min]:     0.078

 Iteration  7  CC energy:    -3.73995920  Energy decrease:   0.00000245
 ======================================================================
 Norm of residual vector:     0.00004389
 CPU time [min]:     0.076                   Wall time [min]:     0.086

 Iteration  8  CC energy:    -3.73996047  Energy decrease:   0.00000127
 ======================================================================
 Norm of residual vector:     0.00001362
 CPU time [min]:     0.084                   Wall time [min]:     0.096

 Iteration  9  CC energy:    -3.73995997  Energy decrease:   0.00000050
 ======================================================================
 Norm of residual vector:     0.00000450
 CPU time [min]:     0.093                   Wall time [min]:     0.105

 Iteration 10  CC energy:    -3.73996004  Energy decrease:   0.00000007
 ======================================================================
 Norm of residual vector:     0.00000141
 CPU time [min]:     0.101                   Wall time [min]:     0.114

 Iteration 11  CC energy:    -3.73996007  Energy decrease:   0.00000002
 ======================================================================
 Norm of residual vector:     0.00000042
 CPU time [min]:     0.109                   Wall time [min]:     0.124

 Iteration 12  CC energy:    -3.73996005  Energy decrease:   0.00000002
 ======================================================================
 Norm of residual vector:     0.00000012
 CPU time [min]:     0.118                   Wall time [min]:     0.133

 Iteration 13  CC energy:    -3.73996005  Energy decrease:   4.0379E-09
 ======================================================================
 Norm of residual vector:     0.00000003
 CPU time [min]:     0.126                   Wall time [min]:     0.142

 Iteration 14  CC energy:    -3.73996005  Energy decrease:   6.6831E-11
 ======================================================================

 Iteration has converged in 14 steps.

 Final results:
 Total CCSDT energy [au]:             -3.739960052581
 Total MP2 energy [au]:               -3.723596815197

 Perturbative corrections are calculated...
 ======================================================================
 Spin case  1   Alpha:  3   Beta:  1
 Number of excitations:        62872
 CPU time [min]:     0.373                   Wall time [min]:     0.390
 ======================================================================
 Number of 4-fold excitations: 62872
 CPU time [min]:     0.373                   Wall time [min]:     0.390

 Total CCSDT[Q] energy [au]:          -3.739978025660
 Total CCSDT(Q) energy [au]:          -3.740006228419

 ************************ 2019-06-25 12:30:12 *************************
                      Normal termination of mrcc.
 **********************************************************************
 !CCSDT STATE 1.6 Energy               -3.739960052581
 !MP2 STATE 1.6 Energy                 -3.723596815197
 !CCSDT[Q] STATE 1.6 Energy            -3.739978025660
 !CCSDT(Q) STATE 1.6 Energy            -3.740006228419
 
 CPU-time for MRCC:             22.4 sec
 Elapsed-time for MRCC:         32.4 sec

 Variable memory set to 8000000000 words,  buffer space   230000 words



 **********************************************************************************************************************************
 DATASETS  * FILE   NREC   LENGTH (MB)   RECORD NAMES
              1      21       20.43       500      610      700      900      950      970     1000      129      960     1100   
                                          VAR    BASINP    GEOM    SYMINP    ZMAT    AOBASIS   BASIS     P2S    ABASIS      S 
                                         1400     1410     1420     1200     1210     1080     1600     1650     1300     1700   
                                         EKIN       V       ECP      H0       H01     AOSYM     SMH    MOLCAS    ERIS     OPER   
                                         1380   
                                         JKOP   

              2       7       10.28       700     1000      520     4202     5202     2101     2200   
                                         GEOM     BASIS   MCVARS     RHF     MCSCF     RHF      UHF  

 PROGRAMS   *        TOTAL      MRCC       UHF       RHF     MULTI       RHF       INT
 CPU TIMES  *        25.27     23.27      0.02      0.01      0.04      0.04      1.79
 REAL TIME  *        53.46 SEC
 DISK USED  *        34.90 MB      
 **********************************************************************************************************************************
 SETTING POSTHF(I)      =        -3.74000623  AU                              
                                                                                                                                                                                                                                                                

       SCF           POSTHF       EKIN          POT
    -3.66482408   -3.74000623   1.37334859   -1.86785378
                                                  

 CCSDT(Q)/USERDEF energy=     -3.740006228419

        CCSDT(Q)        RHF-SCF         MULTI           RHF-SCF 
     -3.74000623     -3.66482408     -3.66482408     -3.66490176
 **********************************************************************************************************************************
 Molpro calculation terminated
 Variable memory released
