
 Primary working directories    : /global/cscratch1/sd/aannabe
 Secondary working directories  : /global/cscratch1/sd/aannabe
 Wavefunction directory         : /global/homes/a/aannabe/wfu/
 Main file repository           : /global/cscratch1/sd/aannabe/

 SHA1      : 19cd028119e0e09f93f0674bd8af7968d9b3eff6
 NAME      : 2015.1.36
 ARCHNAME  : linux/x86_64
 FC        : /opt/cray/pe/craype/2.5.14/bin/ftn
 BLASLIB   : -L/opt/intel/compilers_and_libraries_2018.1.163/linux/mkl/lib/intel64 -Wl,-_start-group -lmkl_intel_ilp64 -lmkl_intel_thread -lmkl_core -Wl,-_end-group -liomp5
 id        : lbl

 Nodes     nprocs
 nid00468     1

 Using customized tuning parameters: mindgm=7; mindgv=16; mindgc=1; mindgr=1; noblas=0; minvec=7
 default implementation of scratch files=df  

 ***,Ge
 memory,8,g
 gthresh,twoint=1.e-12
 
 gprint,basis,orbitals
 gexpec,ekin,pot
 
 angstrom
 geometry={
 1                                                                               ! Number of atoms
 Ge 0.0 0.0 0.0
 }
 
 basis={
 
 Including file /global/homes/a/aannabe/repos/pseudopotentiallibrary/recipes/Ge/ccECP/Ge.ccECP.molpro
 
                                   !include,/global/homes/a/aannabe/repos/pseudopotentiallibrary/recipes/Ge/ccECP/Ge.cc-pV5Z.molpro
                                  !include,/global/homes/a/aannabe/repos/pseudopotentiallibrary/recipes/Ge/ccECP/Ge.cc-pCV5Z.molpro
 Including file /global/homes/a/aannabe/repos/pseudopotentiallibrary/recipes/Ge/ccECP/Ge.aug-cc-pV5Z.molpro
 
 
 }
 
 
 {rhf
  start,atden
  wf,4,6,2
  occ,1,1,0,0,1,0,0,0
  open,1.2,1.5
  save,4202.2
 }
 {multi
  start,4202.2
  occ,1,1,1,0,1,0,0
  closed,1,0,0,0,0,0,0,0
  wf,4,4,2;state,1
  wf,4,6,2;state,1
  wf,4,7,2;state,1
  natorb,ci,print
  orbital,5202.2
 }
 {rhf,nitord=1,maxit=0
  start,5202.2
  wf,4,6,2
  occ,1,1,0,0,1,0,0,0
  open,1.2,1.5
 }
 
 scf(i)=energy
 
 _CC_NORM_MAX=2.0
  !NOTE: Perturbative MRCC works only with UHF reference. So, here we will trick MRCC by doing zero UHF iteration right after ROHF.
 
 {uhf
 maxit,0
 }
 scf(i)=energy
 
 {mrcc,method=CCSDT(Q)
 orbital,ignore_error=1                                                          !Ignore the fact that UHF WF is not converged
 maxit,100
 core
 }
 posthf(i)=energy
 
 table,scf,posthf,ekin,pot
 save,5.csv,new
 
 

 Variables initialized (889), CPU time= 0.00 sec
 Commands  initialized (702), CPU time= 0.01 sec, 572 directives.
 Default parameters read. Elapsed time= 0.14 sec

 Checking input...
 Passed
1


                                         ***  PROGRAM SYSTEM MOLPRO  ***
                                       Copyright, TTI GmbH Stuttgart, 2015
                                    Version 2015.1 linked Dec 29 2018 15:55:43


 **********************************************************************************************************************************
 LABEL *   Ge                                                                            
  64 bit serial version                                                                  DATE: 25-Jun-19          TIME: 12:36:02  
 **********************************************************************************************************************************

 SHA1:             19cd028119e0e09f93f0674bd8af7968d9b3eff6
 **********************************************************************************************************************************

 THRESHOLDS:

 ZERO    =  1.00D-12  ONEINT  =  1.00D-12  TWOINT  =  1.00D-12  PREFAC  =  1.00D-14  LOCALI  =  1.00D-09  EORDER  =  1.00D-04
 ENERGY  =  0.00D+00  ETEST   =  0.00D+00  EDENS   =  0.00D+00  THRDEDEF=  1.00D-06  GRADIENT=  1.00D-02  STEP    =  1.00D-03
 ORBITAL =  1.00D-05  CIVEC   =  1.00D-05  COEFF   =  1.00D-04  PRINTCI =  5.00D-02  PUNCHCI =  9.90D+01  OPTGRAD =  3.00D-04
 OPTENERG=  1.00D-06  OPTSTEP =  3.00D-04  THRGRAD =  1.00D-10  COMPRESS=  1.00D-11  VARMIN  =  1.00D-07  VARMAX  =  1.00D-03
 THRDOUB =  0.00D+00  THRDIV  =  1.00D-05  THRRED  =  1.00D-07  THRPSP  =  1.00D+00  THRDC   =  1.00D-10  THRCS   =  1.00D-10
 THRNRM  =  1.00D-08  THREQ   =  0.00D+00  THRDE   =  1.00D+00  THRREF  =  1.00D-05  SPARFAC =  1.00D+00  THRDLP  =  1.00D-07
 THRDIA  =  1.00D-10  THRDLS  =  1.00D-07  THRGPS  =  0.00D+00  THRKEX  =  0.00D+00  THRDIS  =  2.00D-01  THRVAR  =  1.00D-10
 THRLOC  =  1.00D-06  THRGAP  =  1.00D-06  THRLOCT = -1.00D+00  THRGAPT = -1.00D+00  THRORB  =  1.00D-06  THRMLTP =  0.00D+00
 THRCPQCI=  1.00D-10  KEXTA   =  0.00D+00  THRCOARS=  0.00D+00  SYMTOL  =  1.00D-06  GRADTOL =  1.00D-06  THROVL  =  1.00D-08
 THRORTH =  1.00D-08  GRID    =  1.00D-06  GRIDMAX =  1.00D-03  DTMAX   =  0.00D+00  THROCCDE=  1.00D-01  THROCCDE=  1.00D-01



 ZUNIT=ANG
 

Geometry recognized as XYZ


 Variable memory set to 8000000000 words,  buffer space   230000 words

 SETTING BASIS          =    USERDEF


 Recomputing integrals since basis changed


 Using spherical harmonics



 PROGRAM * SEWARD (Integral evaluation for generally contracted gaussian basis sets)     Author: Roland Lindh, 1990

 Geometry written to block  1 of record 700

 Orientation using atomic masses  
 Molecule type: Atom
 Symmetry elements: X,Y,Z
 Rotational constants:       0.0000000      0.0000000      0.0000000 GHz  (calculated with average atomic masses)

 Point group  D2h 



 ATOMIC COORDINATES

 NR  ATOM    CHARGE       X              Y              Z

   1  GE      4.00    0.000000000    0.000000000    0.000000000


          GE  CORE POTENTIAL

          f POTENTIAL

 POWERS             1              3              2              2
 EXPONENTIALS   1.478963       3.188906       1.927439       1.545539    
 COEFFICIENTS   4.000000       5.915851      -12.03371       1.283543    

          s - f POTENTIAL

 POWERS             2              2
 EXPONENTIALS   2.894474       1.550340    
 COEFFICIENTS   43.26543      -1.909340    

          p - f POTENTIAL

 POWERS             2              2
 EXPONENTIALS   2.986529       1.283381    
 COEFFICIENTS   35.26301      0.9634399    

          d - f POTENTIAL

 POWERS             2              2
 EXPONENTIALS   1.043001      0.5545627    
 COEFFICIENTS   2.339019      0.5413807    


 BASIS DATA

   Nr Sym  Nuc  Type         Exponents   Contraction coefficients

    1.1 Ag    1  1s          46.470485    -0.000229
                             20.357328     0.001574
                              8.917936    -0.011345
                              3.906681     0.098972
                              1.711400    -0.331545
                              0.749713    -0.094809
                              0.328427     0.438933
                              0.143874     0.596777
                              0.063027     0.186251
    2.1 Ag    1  1s           0.565850     1.000000
    3.1 Ag    1  1s           0.283882     1.000000
    4.1 Ag    1  1s           0.142421     1.000000
    5.1 Ag    1  1s           0.071451     1.000000
    6.1 Ag    1  1s           0.028580     1.000000
    7.1 Ag    1  3d0          0.647917     1.000000
    8.1 Ag    1  3d2+         0.647917     1.000000
    9.1 Ag    1  3d0          0.338926     1.000000
   10.1 Ag    1  3d2+         0.338926     1.000000
   11.1 Ag    1  3d0          0.177293     1.000000
   12.1 Ag    1  3d2+         0.177293     1.000000
   13.1 Ag    1  3d0          0.092742     1.000000
   14.1 Ag    1  3d2+         0.092742     1.000000
   15.1 Ag    1  3d0          0.037097     1.000000
   16.1 Ag    1  3d2+         0.037097     1.000000
   17.1 Ag    1  5g0          0.710421     1.000000
   18.1 Ag    1  5g4+         0.710421     1.000000
   19.1 Ag    1  5g2+         0.710421     1.000000
   20.1 Ag    1  5g0          0.329953     1.000000
   21.1 Ag    1  5g4+         0.329953     1.000000
   22.1 Ag    1  5g2+         0.329953     1.000000
   23.1 Ag    1  5g0          0.131981     1.000000
   24.1 Ag    1  5g4+         0.131981     1.000000
   25.1 Ag    1  5g2+         0.131981     1.000000
    1.2 B3u   1  2px         22.641155     0.000052
                             10.174686    -0.000675
                              4.572392     0.011276
                              2.054783    -0.074628
                              0.923397    -0.012070
                              0.414964     0.216919
                              0.186480     0.438735
                              0.083802     0.385126
                              0.037660     0.108074
    2.2 B3u   1  2px          0.705223     1.000000
    3.2 B3u   1  2px          0.294310     1.000000
    4.2 B3u   1  2px          0.122824     1.000000
    5.2 B3u   1  2px          0.051258     1.000000
    6.2 B3u   1  2px          0.020503     1.000000
    7.2 B3u   1  4f1+         0.718181     1.000000
    8.2 B3u   1  4f3+         0.718181     1.000000
    9.2 B3u   1  4f1+         0.355812     1.000000
   10.2 B3u   1  4f3+         0.355812     1.000000
   11.2 B3u   1  4f1+         0.176282     1.000000
   12.2 B3u   1  4f3+         0.176282     1.000000
   13.2 B3u   1  4f1+         0.070513     1.000000
   14.2 B3u   1  4f3+         0.070513     1.000000
   15.2 B3u   1  6h1+         0.597954     1.000000
   16.2 B3u   1  6h3+         0.597954     1.000000
   17.2 B3u   1  6h5+         0.597954     1.000000
   18.2 B3u   1  6h1+         0.239182     1.000000
   19.2 B3u   1  6h3+         0.239182     1.000000
   20.2 B3u   1  6h5+         0.239182     1.000000
    1.3 B2u   1  2py         22.641155     0.000052
                             10.174686    -0.000675
                              4.572392     0.011276
                              2.054783    -0.074628
                              0.923397    -0.012070
                              0.414964     0.216919
                              0.186480     0.438735
                              0.083802     0.385126
                              0.037660     0.108074
    2.3 B2u   1  2py          0.705223     1.000000
    3.3 B2u   1  2py          0.294310     1.000000
    4.3 B2u   1  2py          0.122824     1.000000
    5.3 B2u   1  2py          0.051258     1.000000
    6.3 B2u   1  2py          0.020503     1.000000
    7.3 B2u   1  4f1-         0.718181     1.000000
    8.3 B2u   1  4f3-         0.718181     1.000000
    9.3 B2u   1  4f1-         0.355812     1.000000
   10.3 B2u   1  4f3-         0.355812     1.000000
   11.3 B2u   1  4f1-         0.176282     1.000000
   12.3 B2u   1  4f3-         0.176282     1.000000
   13.3 B2u   1  4f1-         0.070513     1.000000
   14.3 B2u   1  4f3-         0.070513     1.000000
   15.3 B2u   1  6h1-         0.597954     1.000000
   16.3 B2u   1  6h3-         0.597954     1.000000
   17.3 B2u   1  6h5-         0.597954     1.000000
   18.3 B2u   1  6h1-         0.239182     1.000000
   19.3 B2u   1  6h3-         0.239182     1.000000
   20.3 B2u   1  6h5-         0.239182     1.000000
    1.4 B1g   1  3d2-         0.647917     1.000000
    2.4 B1g   1  3d2-         0.338926     1.000000
    3.4 B1g   1  3d2-         0.177293     1.000000
    4.4 B1g   1  3d2-         0.092742     1.000000
    5.4 B1g   1  3d2-         0.037097     1.000000
    6.4 B1g   1  5g2-         0.710421     1.000000
    7.4 B1g   1  5g4-         0.710421     1.000000
    8.4 B1g   1  5g2-         0.329953     1.000000
    9.4 B1g   1  5g4-         0.329953     1.000000
   10.4 B1g   1  5g2-         0.131981     1.000000
   11.4 B1g   1  5g4-         0.131981     1.000000
    1.5 B1u   1  2pz         22.641155     0.000052
                             10.174686    -0.000675
                              4.572392     0.011276
                              2.054783    -0.074628
                              0.923397    -0.012070
                              0.414964     0.216919
                              0.186480     0.438735
                              0.083802     0.385126
                              0.037660     0.108074
    2.5 B1u   1  2pz          0.705223     1.000000
    3.5 B1u   1  2pz          0.294310     1.000000
    4.5 B1u   1  2pz          0.122824     1.000000
    5.5 B1u   1  2pz          0.051258     1.000000
    6.5 B1u   1  2pz          0.020503     1.000000
    7.5 B1u   1  4f0          0.718181     1.000000
    8.5 B1u   1  4f2+         0.718181     1.000000
    9.5 B1u   1  4f0          0.355812     1.000000
   10.5 B1u   1  4f2+         0.355812     1.000000
   11.5 B1u   1  4f0          0.176282     1.000000
   12.5 B1u   1  4f2+         0.176282     1.000000
   13.5 B1u   1  4f0          0.070513     1.000000
   14.5 B1u   1  4f2+         0.070513     1.000000
   15.5 B1u   1  6h2+         0.597954     1.000000
   16.5 B1u   1  6h4+         0.597954     1.000000
   17.5 B1u   1  6h0          0.597954     1.000000
   18.5 B1u   1  6h2+         0.239182     1.000000
   19.5 B1u   1  6h4+         0.239182     1.000000
   20.5 B1u   1  6h0          0.239182     1.000000
    1.6 B2g   1  3d1+         0.647917     1.000000
    2.6 B2g   1  3d1+         0.338926     1.000000
    3.6 B2g   1  3d1+         0.177293     1.000000
    4.6 B2g   1  3d1+         0.092742     1.000000
    5.6 B2g   1  3d1+         0.037097     1.000000
    6.6 B2g   1  5g1+         0.710421     1.000000
    7.6 B2g   1  5g3+         0.710421     1.000000
    8.6 B2g   1  5g1+         0.329953     1.000000
    9.6 B2g   1  5g3+         0.329953     1.000000
   10.6 B2g   1  5g1+         0.131981     1.000000
   11.6 B2g   1  5g3+         0.131981     1.000000
    1.7 B3g   1  3d1-         0.647917     1.000000
    2.7 B3g   1  3d1-         0.338926     1.000000
    3.7 B3g   1  3d1-         0.177293     1.000000
    4.7 B3g   1  3d1-         0.092742     1.000000
    5.7 B3g   1  3d1-         0.037097     1.000000
    6.7 B3g   1  5g1-         0.710421     1.000000
    7.7 B3g   1  5g3-         0.710421     1.000000
    8.7 B3g   1  5g1-         0.329953     1.000000
    9.7 B3g   1  5g3-         0.329953     1.000000
   10.7 B3g   1  5g1-         0.131981     1.000000
   11.7 B3g   1  5g3-         0.131981     1.000000
    1.8 Au    1  4f2-         0.718181     1.000000
    2.8 Au    1  4f2-         0.355812     1.000000
    3.8 Au    1  4f2-         0.176282     1.000000
    4.8 Au    1  4f2-         0.070513     1.000000
    5.8 Au    1  6h4-         0.597954     1.000000
    6.8 Au    1  6h2-         0.597954     1.000000
    7.8 Au    1  6h4-         0.239182     1.000000
    8.8 Au    1  6h2-         0.239182     1.000000

 NUCLEAR CHARGE:                    4
 NUMBER OF PRIMITIVE AOS:         213
 NUMBER OF SYMMETRY AOS:          158
 NUMBER OF CONTRACTIONS:          126   (  25Ag  +  20B3u +  20B2u +  11B1g +  20B1u +  11B2g +  11B3g +   8Au  )
 NUMBER OF CORE ORBITALS:           0   (   0Ag  +   0B3u +   0B2u +   0B1g +   0B1u +   0B2g +   0B3g +   0Au  )
 NUMBER OF VALENCE ORBITALS:        4   (   1Ag  +   1B3u +   1B2u +   0B1g +   1B1u +   0B2g +   0B3g +   0Au  )


 NUCLEAR REPULSION ENERGY    0.00000000

 EXTRA SYMMETRY OF AOS IN SYMMETRY 1:   1 1 1 1 1 1 2 3 2 3   2 3 2 3 2 3 4 5 6 4   5 6 4 5 6
 EXTRA SYMMETRY OF AOS IN SYMMETRY 2:   1 1 1 1 1 1 2 3 2 3   2 3 2 3 4 5 6 4 5 6
 EXTRA SYMMETRY OF AOS IN SYMMETRY 3:   1 1 1 1 1 1 2 3 2 3   2 3 2 3 4 5 6 4 5 6
 EXTRA SYMMETRY OF AOS IN SYMMETRY 4:   1 1 1 1 1 2 3 2 3 2   3
 EXTRA SYMMETRY OF AOS IN SYMMETRY 5:   1 1 1 1 1 1 2 3 2 3   2 3 2 3 4 5 6 4 5 6
 EXTRA SYMMETRY OF AOS IN SYMMETRY 6:   1 1 1 1 1 2 3 2 3 2   3
 EXTRA SYMMETRY OF AOS IN SYMMETRY 7:   1 1 1 1 1 2 3 2 3 2   3
 EXTRA SYMMETRY OF AOS IN SYMMETRY 8:   1 1 1 1 2 3 2 3

 Eigenvalues of metric

         1 0.952E-03 0.545E-02 0.116E-01 0.116E-01 0.380E-01 0.994E-01 0.994E-01 0.197E+00
         2 0.102E-02 0.227E-01 0.573E-01 0.573E-01 0.121E+00 0.359E+00 0.359E+00 0.483E+00
         3 0.102E-02 0.227E-01 0.573E-01 0.573E-01 0.121E+00 0.359E+00 0.359E+00 0.483E+00
         4 0.116E-01 0.994E-01 0.197E+00 0.197E+00 0.458E+00 0.829E+00 0.829E+00 0.132E+01
         5 0.102E-02 0.227E-01 0.573E-01 0.573E-01 0.121E+00 0.359E+00 0.359E+00 0.483E+00
         6 0.116E-01 0.994E-01 0.197E+00 0.197E+00 0.458E+00 0.829E+00 0.829E+00 0.132E+01
         7 0.116E-01 0.994E-01 0.197E+00 0.197E+00 0.458E+00 0.829E+00 0.829E+00 0.132E+01
         8 0.573E-01 0.359E+00 0.483E+00 0.483E+00 0.109E+01 0.152E+01 0.152E+01 0.249E+01


 Contracted 2-electron integrals neglected if value below      1.0D-12
 AO integral compression algorithm  1   Integral accuracy      1.0D-12

     30.147 MB (compressed) written to integral file ( 53.9%)


 NUMBER OF SORTED TWO-ELECTRON INTEGRALS:    4156552.     BUFFER LENGTH:  32768
 NUMBER OF SEGMENTS:   1  SEGMENT LENGTH:    4156552      RECORD LENGTH: 524288

 Memory used in sort:       4.71 MW

 SORT1 READ     6989366. AND WROTE     2907704. INTEGRALS IN      9 RECORDS. CPU TIME:     0.22 SEC, REAL TIME:     0.32 SEC
 SORT2 READ     2907704. AND WROTE     4156552. INTEGRALS IN    115 RECORDS. CPU TIME:     0.22 SEC, REAL TIME:     0.40 SEC

 FILE SIZES:   FILE 1:    50.4 MBYTE,  FILE 4:    37.8 MBYTE,   TOTAL:     88.2 MBYTE

 OPERATOR DM      FOR CENTER  0  COORDINATES:    0.000000    0.000000    0.000000
 OPERATOR EKIN    FOR CENTER  0  COORDINATES:    0.000000    0.000000    0.000000
 OPERATOR POT     FOR CENTER  0  COORDINATES:    0.000000    0.000000    0.000000


 **********************************************************************************************************************************
 DATASETS  * FILE   NREC   LENGTH (MB)   RECORD NAMES
              1      20       38.44       500      610      700      900      950      970     1000      129      960     1100   
                                          VAR    BASINP    GEOM    SYMINP    ZMAT    AOBASIS   BASIS     P2S    ABASIS      S 
                                         1400     1410     1420     1200     1210     1080     1600     1650     1300     1700   
                                         EKIN       V       ECP      H0       H01     AOSYM     SMH    MOLCAS    ERIS     OPER   

 PROGRAMS   *        TOTAL       INT
 CPU TIMES  *         3.97      3.82
 REAL TIME  *        16.12 SEC
 DISK USED  *        88.49 MB      
 **********************************************************************************************************************************


 PROGRAM * RHF-SCF (OPEN SHELL)       Authors: W. Meyer, H.-J. Werner


 NUMBER OF ELECTRONS:       3+    1-    SPACE SYMMETRY=6    SPIN SYMMETRY: Triplet 
 CONVERGENCE THRESHOLDS:    1.00E-05 (Density)    1.00E-07 (Energy)
 MAX. NUMBER OF ITERATIONS:       60
 INTERPOLATION TYPE:            DIIS
 INTERPOLATION STEPS:              2 (START)      1 (STEP)
 LEVEL SHIFTS:                 -0.60 (CLOSED) -0.30 (OPEN) 


 Singly occupied orbitals:      1.2       1.5

   Atom=GE basis=ECP28MDF_GUESS    lmin=0  lmax=1

 Orbital guess generated from atomic densities. Full valence occupancy:    1   1   1   0   1   0   0   0


 Molecular orbital dump at record        4202.2

 ITERATION    DDIFF          GRAD             ENERGY        2-EL.EN.            DIPOLE MOMENTS         DIIS   ORB.
    1      0.000D+00      0.000D+00        -3.64816748      3.675538    0.00000    0.00000    0.00000    0    start
    2      0.000D+00      0.531D-02        -3.65906466      3.800152    0.00000    0.00000    0.00000    1    diag,B
    3      0.601D-02      0.259D-02        -3.66368462      3.889048    0.00000    0.00000    0.00000    2    diag,B
    4      0.427D-02      0.124D-02        -3.66483034      3.928834    0.00000    0.00000    0.00000    3    diag,B
    5      0.296D-02      0.381D-03        -3.66489950      3.932940    0.00000    0.00000    0.00000    4    diag,B
    6      0.869D-03      0.963D-04        -3.66490246      3.932871    0.00000    0.00000    0.00000    5    diag,B
    7      0.392D-03      0.202D-04        -3.66490255      3.932837    0.00000    0.00000    0.00000    6    fixocc
    8      0.118D-03      0.444D-05        -3.66490256      3.932807    0.00000    0.00000    0.00000    7    diag,B
    9      0.180D-04      0.898D-06        -3.66490256      3.932819    0.00000    0.00000    0.00000    8    diag,B
   10      0.476D-05      0.138D-06        -3.66490256      3.932819    0.00000    0.00000    0.00000    0    orth

 Final alpha occupancy:   1   1   0   0   1   0   0   0
 Final beta  occupancy:   1   0   0   0   0   0   0   0

 !RHF STATE 1.6 Energy                 -3.664902556669
 Nuclear energy                         0.00000000
 One-electron energy                   -5.63131196
 Two-electron energy                    1.96640941
 Virial quotient                       -2.66853540
 !RHF STATE 1.6 Dipole moment           0.00000000     0.00000000     0.00000000
 Dipole moment /Debye                   0.00000000     0.00000000     0.00000000
 

 !RHF expec          <1.6|EKIN|1.6>     1.373376032778
 
 !RHF expec           <1.6|POT|1.6>    -1.867833643630

 ELECTRON ORBITALS
 =================


   Orb  Occ    Energy  Couls-En    Coefficients

                                   1 1s      1 1s      1 1s      1 1s      1 1s      1 1s      1 3d0     1 3d2+    1 3d0     1 3d2+ 
                                   1 3d0     1 3d2+    1 3d0     1 3d2+    1 3d0     1 3d2+    1 5g0     1 5g4+    1 5g2+    1 5g0  
                                   1 5g4+    1 5g2+    1 5g0     1 5g4+    1 5g2+ 

   1.1   2    -0.5631   -2.1735  1.000144  0.000323 -0.001397  0.003043 -0.003448  0.001522  0.000182  0.000314 -0.001251 -0.002167
                                 0.001554  0.002691  0.002872  0.004974  0.000596  0.001032  0.000002  0.000004  0.000003 -0.000010
                                -0.000020 -0.000015 -0.000030 -0.000058 -0.000044

                                   1 2px     1 2px     1 2px     1 2px     1 2px     1 2px     1 4f1+    1 4f3+    1 4f1+    1 4f3+ 
                                   1 4f1+    1 4f3+    1 4f1+    1 4f3+    1 6h1+    1 6h3+    1 6h5+    1 6h1+    1 6h3+    1 6h5+ 


   1.2   +    -0.2861   -1.4914  1.000216  0.000122 -0.000502  0.000578 -0.000958  0.000756 -0.000002 -0.000007 -0.000024 -0.000092
                                 0.000004  0.000015  0.000027  0.000106  0.000000  0.000000  0.000000 -0.000000 -0.000001 -0.000001

                                   1 2pz     1 2pz     1 2pz     1 2pz     1 2pz     1 2pz     1 4f0     1 4f2+    1 4f0     1 4f2+ 
                                   1 4f0     1 4f2+    1 4f0     1 4f2+    1 6h2+    1 6h4+    1 6h0     1 6h2+    1 6h4+    1 6h0  


   1.5   +    -0.2861   -1.4914  1.000216  0.000122 -0.000502  0.000578 -0.000958  0.000756 -0.000004 -0.000006 -0.000058 -0.000075
                                 0.000009  0.000012  0.000067  0.000086  0.000000  0.000000  0.000000 -0.000001 -0.000001 -0.000001

 HOMO      1.2    -0.286110 =      -7.7854eV
 LUMO      1.3    -0.015807 =      -0.4301eV
 LUMO-HOMO         0.270303 =       7.3553eV


 **********************************************************************************************************************************
 DATASETS  * FILE   NREC   LENGTH (MB)   RECORD NAMES
              1      20       38.44       500      610      700      900      950      970     1000      129      960     1100   
                                          VAR    BASINP    GEOM    SYMINP    ZMAT    AOBASIS   BASIS     P2S    ABASIS      S 
                                         1400     1410     1420     1200     1210     1080     1600     1650     1300     1700   
                                         EKIN       V       ECP      H0       H01     AOSYM     SMH    MOLCAS    ERIS     OPER   

              2       4        2.83       700     1000      520     4202   
                                         GEOM     BASIS   MCVARS     RHF  

 PROGRAMS   *        TOTAL       RHF       INT
 CPU TIMES  *         4.20      0.23      3.82
 REAL TIME  *        16.63 SEC
 DISK USED  *        88.49 MB      
 **********************************************************************************************************************************


 PROGRAM * MULTI (Direct Multiconfiguration SCF)       Authors: P.J. Knowles, H.-J. Werner (1984)     S.T. Elbert (1988)


 Number of closed-shell orbitals:   1 (   1   0   0   0   0   0   0   0 )
 Number of active  orbitals:        3 (   0   1   1   0   1   0   0   0 )
 Number of external orbitals:     122 (  24  19  19  11  19  11  11   8 )

 State symmetry 1

 Number of electrons:     2    Spin symmetry=Triplet   Space symmetry=4
 Number of states:        1
 Number of CSFs:          1   (1 determinants, 3 intermediate states)

 State symmetry 2

 Number of electrons:     2    Spin symmetry=Triplet   Space symmetry=6
 Number of states:        1
 Number of CSFs:          1   (1 determinants, 3 intermediate states)

 State symmetry 3

 Number of electrons:     2    Spin symmetry=Triplet   Space symmetry=7
 Number of states:        1
 Number of CSFs:          1   (1 determinants, 3 intermediate states)

 Molecular orbitals read from record     4202.2  Type=RHF/CANONICAL (state 1.6)
 *** IN SYMMETRY 1 ORBITAL  1 SYMMETRY CONTAMINATION OF 0.173D-01 HAS BEEN REMOVED

 EXTRA SYMMETRY OF MOS IN SYMMETRY 1:   1 1 3 2 1 2 3 5 4 6   2 3 1 3 2 5 4 6 1 3   2 5 4 6 1
 *** IN SYMMETRY 2 ORBITAL  1 SYMMETRY CONTAMINATION OF 0.278D-03 HAS BEEN REMOVED
 EXTRA SYMMETRY OF MOS IN SYMMETRY 2:   1 1 1 3 2 3 2 1 6 5   4 3 2 1 3 2 6 5 4 1
 *** IN SYMMETRY 3 ORBITAL  1 SYMMETRY CONTAMINATION OF 0.841D-02 HAS BEEN REMOVED
 EXTRA SYMMETRY OF MOS IN SYMMETRY 3:   1 1 1 3 2 3 2 1 6 4   5 3 2 1 3 2 6 4 5 1
 EXTRA SYMMETRY OF MOS IN SYMMETRY 4:   1 1 3 2 1 1 3 2 1 3   2
 *** IN SYMMETRY 5 ORBITAL  1 SYMMETRY CONTAMINATION OF 0.320D-03 HAS BEEN REMOVED
 EXTRA SYMMETRY OF MOS IN SYMMETRY 5:   1 1 1 3 2 3 2 1 4 5   6 3 2 1 3 2 4 5 6 1
 EXTRA SYMMETRY OF MOS IN SYMMETRY 6:   1 1 3 2 1 1 3 2 1 3   2
 EXTRA SYMMETRY OF MOS IN SYMMETRY 7:   1 1 2 3 1 1 2 3 1 2   3
 EXTRA SYMMETRY OF MOS IN SYMMETRY 8:   1 1 2 3 1 1 2 3

 Wavefunction dump at record             5202.2

 Convergence thresholds  0.10E-01 (gradient)  0.10E-05 (energy)  0.10E-02 (step length)

 Weight factors for state symmetry  1:    0.33333
 Weight factors for state symmetry  2:    0.33333
 Weight factors for state symmetry  3:    0.33333

 Number of orbital rotations:       81   (     0 Core/Active     24 Core/Virtual   0 Active/Active     57 Active/Virtual)
 Total number of variables:         84


 ITER. MIC  NCI  NEG     ENERGY(VAR)     ENERGY(PROJ)   ENERGY CHANGE     GRAD(0)  GRAD(ORB)   GRAD(CI)     STEP       TIME

   1   20   12    0      -3.64782167      -3.66483245   -0.01701078    0.05387215 0.00000000 0.00000000  0.34D+00      0.06
   2   15   12    0      -3.66481590      -3.66482426   -0.00000836    0.00272503 0.00000000 0.00000000  0.52D-02      0.09
   3   15   12    0      -3.66482426      -3.66482426   -0.00000000    0.00000273 0.00000000 0.00000000  0.40D-05      0.14

 ** WVFN ****  CONVERGENCE REACHED, FINAL GRADIENT:  0.25D-11



 Results for state 1.4
 =====================

 !MCSCF STATE 1.4 Energy               -3.664824264868
 Nuclear energy                         0.00000000
 Kinetic energy                         1.37335122
 One electron energy                   -5.63142221
 Two electron energy                    1.96659795
 Virial ratio                           3.66852659

 !MCSCF STATE 1.4 Dipole moment         0.00000000     0.00000000     0.00000000
 Dipole moment /Debye                   0.00000000     0.00000000     0.00000000



 Results for state 1.6
 =====================

 !MCSCF STATE 1.6 Energy               -3.664824264868
 Nuclear energy                         0.00000000
 Kinetic energy                         1.37335122
 One electron energy                   -5.63142221
 Two electron energy                    1.96659795
 Virial ratio                           3.66852659

 !MCSCF STATE 1.6 Dipole moment         0.00000000     0.00000000     0.00000000
 Dipole moment /Debye                   0.00000000     0.00000000     0.00000000



 Results for state 1.7
 =====================

 !MCSCF STATE 1.7 Energy               -3.664824264868
 Nuclear energy                         0.00000000
 Kinetic energy                         1.37335122
 One electron energy                   -5.63142221
 Two electron energy                    1.96659795
 Virial ratio                           3.66852659

 !MCSCF STATE 1.7 Dipole moment         0.00000000     0.00000000     0.00000000
 Dipole moment /Debye                   0.00000000     0.00000000     0.00000000

 State-averaged charge density matrix saved on record  5202.2 (density set 1)

 !MCSCF expec        <1.4|EKIN|1.4>     1.373351223929
 !MCSCF expec        <1.6|EKIN|1.6>     1.373351223930
 !MCSCF expec        <1.7|EKIN|1.7>     1.373351223929

 !MCSCF expec         <1.4|POT|1.4>    -1.867852450859
 !MCSCF expec         <1.6|POT|1.6>    -1.867852450860
 !MCSCF expec         <1.7|POT|1.7>    -1.867852450859


 NATURAL ORBITALS (state averaged)
 =================================

   Orb     Occ        Energy       Coefficients

                                   1 1s      1 1s      1 1s      1 1s      1 1s      1 1s      1 3d0     1 3d2+    1 3d0     1 3d2+ 
                                   1 3d0     1 3d2+    1 3d0     1 3d2+    1 3d0     1 3d2+    1 5g0     1 5g4+    1 5g2+    1 5g0  
                                   1 5g4+    1 5g2+    1 5g0     1 5g4+    1 5g2+ 

   1.1  2.00000    -0.563081     1.000129  0.000399 -0.001570  0.002990 -0.003225  0.001521  0.000000  0.000000  0.000000  0.000000
                                 0.000000  0.000000  0.000000  0.000000  0.000000  0.000000  0.000000  0.000000  0.000000  0.000000
                                 0.000000  0.000000  0.000000  0.000000  0.000000

                                   1 2px     1 2px     1 2px     1 2px     1 2px     1 2px     1 4f1+    1 4f3+    1 4f1+    1 4f3+ 
                                   1 4f1+    1 4f3+    1 4f1+    1 4f3+    1 6h1+    1 6h3+    1 6h5+    1 6h1+    1 6h3+    1 6h5+ 


   1.2  0.66667    -0.062882     1.000241  0.000100 -0.000415  0.000562 -0.001061  0.000775  0.000000  0.000000  0.000000  0.000000
                                 0.000000  0.000000  0.000000  0.000000  0.000000  0.000000  0.000000  0.000000  0.000000  0.000000

                                   1 2py     1 2py     1 2py     1 2py     1 2py     1 2py     1 4f1-    1 4f3-    1 4f1-    1 4f3- 
                                   1 4f1-    1 4f3-    1 4f1-    1 4f3-    1 6h1-    1 6h3-    1 6h5-    1 6h1-    1 6h3-    1 6h5- 


   1.3  0.66667    -0.062882     1.000241  0.000100 -0.000415  0.000562 -0.001061  0.000775  0.000000  0.000000  0.000000  0.000000
                                 0.000000  0.000000  0.000000  0.000000  0.000000  0.000000  0.000000  0.000000  0.000000  0.000000

                                   1 2pz     1 2pz     1 2pz     1 2pz     1 2pz     1 2pz     1 4f0     1 4f2+    1 4f0     1 4f2+ 
                                   1 4f0     1 4f2+    1 4f0     1 4f2+    1 6h2+    1 6h4+    1 6h0     1 6h2+    1 6h4+    1 6h0  


   1.5  0.66667    -0.062882     1.000241  0.000100 -0.000415  0.000562 -0.001061  0.000775  0.000000  0.000000  0.000000  0.000000
                                 0.000000  0.000000  0.000000  0.000000  0.000000  0.000000  0.000000  0.000000  0.000000  0.000000
 

 EXTRA SYMMETRY OF MOS IN SYMMETRY 1:   1 1 3 2 1 3 2 6 5 4   3 2 1 3 2 5 6 4 1 3   2 6 5 4 1
 EXTRA SYMMETRY OF MOS IN SYMMETRY 2:   1 1 1 3 2 2 3 1 5 4   6 2 3 1 2 3 5 4 6 1
 EXTRA SYMMETRY OF MOS IN SYMMETRY 3:   1 1 1 3 2 2 3 1 5 4   6 2 3 1 2 3 5 4 6 1
 EXTRA SYMMETRY OF MOS IN SYMMETRY 4:   1 1 2 3 1 1 3 2 1 2   3
 EXTRA SYMMETRY OF MOS IN SYMMETRY 5:   1 1 1 3 2 3 2 1 6 4   5 3 2 1 3 2 6 4 5 1
 EXTRA SYMMETRY OF MOS IN SYMMETRY 6:   1 1 2 3 1 1 2 3 1 3   2
 EXTRA SYMMETRY OF MOS IN SYMMETRY 7:   1 1 2 3 1 1 2 3 1 3   2
 EXTRA SYMMETRY OF MOS IN SYMMETRY 8:   1 1 3 2 1 1 3 2

 Natural orbital dump (state averaged) at molpro section  5202.2    (Orbital set 2)


 CI vector for state symmetry 1
 ==============================

 a a 0           1.0000000

 TOTAL ENERGIES                        -3.66482426

 CI vector for state symmetry 2
 ==============================

 a 0 a           1.0000000

 TOTAL ENERGIES                        -3.66482426

 CI vector for state symmetry 3
 ==============================

 0 a a           1.0000000

 TOTAL ENERGIES                        -3.66482426



 **********************************************************************************************************************************
 DATASETS  * FILE   NREC   LENGTH (MB)   RECORD NAMES
              1      21       38.73       500      610      700      900      950      970     1000      129      960     1100   
                                          VAR    BASINP    GEOM    SYMINP    ZMAT    AOBASIS   BASIS     P2S    ABASIS      S 
                                         1400     1410     1420     1200     1210     1080     1600     1650     1300     1700   
                                         EKIN       V       ECP      H0       H01     AOSYM     SMH    MOLCAS    ERIS     OPER   
                                         1380   
                                         JKOP   

              2       5        5.40       700     1000      520     4202     5202   
                                         GEOM     BASIS   MCVARS     RHF     MCSCF   

 PROGRAMS   *        TOTAL     MULTI       RHF       INT
 CPU TIMES  *         4.40      0.20      0.23      3.82
 REAL TIME  *        18.15 SEC
 DISK USED  *        88.49 MB      
 **********************************************************************************************************************************


 PROGRAM * RHF-SCF (OPEN SHELL)       Authors: W. Meyer, H.-J. Werner


 NUMBER OF ELECTRONS:       3+    1-    SPACE SYMMETRY=6    SPIN SYMMETRY: Triplet 
 CONVERGENCE THRESHOLDS:    1.00E-05 (Density)    1.00E-07 (Energy)
 MAX. NUMBER OF ITERATIONS:        0
 INTERPOLATION TYPE:            DIIS
 INTERPOLATION STEPS:              2 (START)      1 (STEP)
 LEVEL SHIFTS:                 -0.60 (CLOSED) -0.30 (OPEN) 


 Singly occupied orbitals:      1.2       1.5
 Molecular orbitals read from record     5202.2  Type=MCSCF/NATURAL (state averaged)

 Molecular orbital dump at record        2101.2

 ITERATION    DDIFF          GRAD             ENERGY        2-EL.EN.            DIPOLE MOMENTS         DIIS   ORB.
    1      0.000D+00      0.000D+00        -3.66482426      3.933196    0.00000    0.00000    0.00000    0    start

 Final alpha occupancy:   1   1   0   0   1   0   0   0
 Final beta  occupancy:   1   0   0   0   0   0   0   0

 !RHF STATE 1.6 Energy                 -3.664824264868
 Nuclear energy                         0.00000000
 One-electron energy                   -5.63142221
 Two-electron energy                    1.96659795
 Virial quotient                       -2.66852659
 !RHF STATE 1.6 Dipole moment           0.00000000     0.00000000     0.00000000
 Dipole moment /Debye                   0.00000000     0.00000000     0.00000000
 

 !RHF expec          <1.6|EKIN|1.6>     1.373351223930
 
 !RHF expec           <1.6|POT|1.6>    -1.867852450860

 ELECTRON ORBITALS
 =================


   Orb  Occ    Energy  Couls-En    Coefficients

                                   1 1s      1 1s      1 1s      1 1s      1 1s      1 1s      1 3d0     1 3d2+    1 3d0     1 3d2+ 
                                   1 3d0     1 3d2+    1 3d0     1 3d2+    1 3d0     1 3d2+    1 5g0     1 5g4+    1 5g2+    1 5g0  
                                   1 5g4+    1 5g2+    1 5g0     1 5g4+    1 5g2+ 

   1.1   2    -0.5631   -2.1735  1.000129  0.000399 -0.001570  0.002990 -0.003225  0.001521  0.000000  0.000000  0.000000  0.000000
                                 0.000000  0.000000  0.000000  0.000000  0.000000  0.000000  0.000000  0.000000  0.000000  0.000000
                                 0.000000  0.000000  0.000000  0.000000  0.000000

                                   1 2px     1 2px     1 2px     1 2px     1 2px     1 2px     1 4f1+    1 4f3+    1 4f1+    1 4f3+ 
                                   1 4f1+    1 4f3+    1 4f1+    1 4f3+    1 6h1+    1 6h3+    1 6h5+    1 6h1+    1 6h3+    1 6h5+ 


   1.2   +    -0.0629   -1.2682  1.000241  0.000100 -0.000415  0.000562 -0.001061  0.000775  0.000000  0.000000  0.000000  0.000000
                                 0.000000  0.000000  0.000000  0.000000  0.000000  0.000000  0.000000  0.000000  0.000000  0.000000

                                   1 2pz     1 2pz     1 2pz     1 2pz     1 2pz     1 2pz     1 4f0     1 4f2+    1 4f0     1 4f2+ 
                                   1 4f0     1 4f2+    1 4f0     1 4f2+    1 6h2+    1 6h4+    1 6h0     1 6h2+    1 6h4+    1 6h0  


   1.5   +    -0.0629   -1.2682  1.000241  0.000100 -0.000415  0.000562 -0.001061  0.000775  0.000000  0.000000  0.000000  0.000000
                                 0.000000  0.000000  0.000000  0.000000  0.000000  0.000000  0.000000  0.000000  0.000000  0.000000

 HOMO      1.2    -0.062882 =      -1.7111eV
 LUMO      1.3    -0.062882 =      -1.7111eV
 LUMO-HOMO        -0.000000 =      -0.0000eV


 **********************************************************************************************************************************
 DATASETS  * FILE   NREC   LENGTH (MB)   RECORD NAMES
              1      21       38.73       500      610      700      900      950      970     1000      129      960     1100   
                                          VAR    BASINP    GEOM    SYMINP    ZMAT    AOBASIS   BASIS     P2S    ABASIS      S 
                                         1400     1410     1420     1200     1210     1080     1600     1650     1300     1700   
                                         EKIN       V       ECP      H0       H01     AOSYM     SMH    MOLCAS    ERIS     OPER   
                                         1380   
                                         JKOP   

              2       6        8.00       700     1000      520     4202     5202     2101   
                                         GEOM     BASIS   MCVARS     RHF     MCSCF     RHF  

 PROGRAMS   *        TOTAL       RHF     MULTI       RHF       INT
 CPU TIMES  *         4.44      0.03      0.20      0.23      3.82
 REAL TIME  *        18.58 SEC
 DISK USED  *        88.49 MB      
 **********************************************************************************************************************************
 SETTING SCF(I)         =        -3.66482426  AU                              
 SETTING _CC_NORM_MAX   =         2.00000000                                  


 PROGRAM * UHF-SCF       Authors: W. Meyer, H.-J. Werner


 NUMBER OF ELECTRONS:       3+    1-    SPACE SYMMETRY=6    SPIN SYMMETRY: Triplet 
 CONVERGENCE THRESHOLDS:    1.00E-05 (Density)    1.00E-07 (Energy)
 MAX. NUMBER OF ITERATIONS:        0
 INTERPOLATION TYPE:            DIIS
 INTERPOLATION STEPS:              2 (START)      1 (STEP)
 LEVEL SHIFTS:                  0.20 (ALPHA)   0.20 (BETA) 



 Molecular orbitals read from record     2101.2  Type=RHF/CANONICAL (state 1.6)

 Molecular orbital dump at record        2200.2

 Initial alpha occupation   1   1   0   0   1   0   0   0
 Initial beta  occupation   1   0   0   0   0   0   0   0

 ITERATION    DDIFF          GRAD             ENERGY        2-EL.EN.            DIPOLE MOMENTS         DIIS
    1      0.000D+00      0.000D+00        -3.66482426      3.933196    0.00000    0.00000    0.00000    0
 
 Final alpha occupancy:   1   1   0   0   1   0   0   0
 Final beta  occupancy:   1   0   0   0   0   0   0   0

 !UHF STATE 1.6 Energy                 -3.664824264868
 Nuclear energy                         0.00000000
 One-electron energy                   -5.63142221
 Two-electron energy                    1.96659795
 Virial quotient                       -2.66852659
 !UHF STATE 1.6 Dipole moment           0.00000000     0.00000000     0.00000000
 Dipole moment /Debye                   0.00000000     0.00000000     0.00000000
 

 !UHF expec          <1.6|EKIN|1.6>     1.373351223930
 
 !UHF expec           <1.6|POT|1.6>    -1.867852450860

 ELECTRON ORBITALS FOR POSITIVE SPIN
 ===================================


   Orb  Occ    Energy  Couls-En    Coefficients

                                   1 1s      1 1s      1 1s      1 1s      1 1s      1 1s      1 3d0     1 3d2+    1 3d0     1 3d2+ 
                                   1 3d0     1 3d2+    1 3d0     1 3d2+    1 3d0     1 3d2+    1 5g0     1 5g4+    1 5g2+    1 5g0  
                                   1 5g4+    1 5g2+    1 5g0     1 5g4+    1 5g2+ 

   1.1   +    -0.5631   -2.1735  1.000129  0.000399 -0.001570  0.002990 -0.003225  0.001521  0.000000  0.000000  0.000000  0.000000
                                 0.000000  0.000000  0.000000  0.000000  0.000000  0.000000  0.000000  0.000000  0.000000  0.000000
                                 0.000000  0.000000  0.000000  0.000000  0.000000

                                   1 2px     1 2px     1 2px     1 2px     1 2px     1 2px     1 4f1+    1 4f3+    1 4f1+    1 4f3+ 
                                   1 4f1+    1 4f3+    1 4f1+    1 4f3+    1 6h1+    1 6h3+    1 6h5+    1 6h1+    1 6h3+    1 6h5+ 


   1.2   +    -0.0629   -1.2682  1.000241  0.000100 -0.000415  0.000562 -0.001061  0.000775  0.000000  0.000000  0.000000  0.000000
                                 0.000000  0.000000  0.000000  0.000000  0.000000  0.000000  0.000000  0.000000  0.000000  0.000000

                                   1 2pz     1 2pz     1 2pz     1 2pz     1 2pz     1 2pz     1 4f0     1 4f2+    1 4f0     1 4f2+ 
                                   1 4f0     1 4f2+    1 4f0     1 4f2+    1 6h2+    1 6h4+    1 6h0     1 6h2+    1 6h4+    1 6h0  


   1.5   +    -0.0629   -1.2682  1.000241  0.000100 -0.000415  0.000562 -0.001061  0.000775  0.000000  0.000000  0.000000  0.000000
                                 0.000000  0.000000  0.000000  0.000000  0.000000  0.000000  0.000000  0.000000  0.000000  0.000000

 ELECTRON ORBITALS FOR NEGATIVE SPIN
 ===================================


   Orb  Occ    Energy  Couls-En    Coefficients

                                   1 1s      1 1s      1 1s      1 1s      1 1s      1 1s      1 3d0     1 3d2+    1 3d0     1 3d2+ 
                                   1 3d0     1 3d2+    1 3d0     1 3d2+    1 3d0     1 3d2+    1 5g0     1 5g4+    1 5g2+    1 5g0  
                                   1 5g4+    1 5g2+    1 5g0     1 5g4+    1 5g2+ 

   1.1   -    -0.5631   -2.1735  1.000129  0.000399 -0.001570  0.002990 -0.003225  0.001521  0.000000  0.000000  0.000000  0.000000
                                 0.000000  0.000000  0.000000  0.000000  0.000000  0.000000  0.000000  0.000000  0.000000  0.000000
                                 0.000000  0.000000  0.000000  0.000000  0.000000

 HOMO      1.2    -0.062882 =      -1.7111eV
 LUMO      1.3    -0.062882 =      -1.7111eV
 LUMO-HOMO        -0.000000 =      -0.0000eV

 EXPECTATION VALUE OF S**2:             2.00000000

 Occupation number threshold for canonical orbitals:  1.999000 (occupied),  0.001000 (virtual)

 Number of pseudo-canonical orbitals per symmetry:    1   0   0   0   0   0   0   0
 Number of active natural orbitals per symmetry:      0   1   0   0   1   0   0   0

 NATURAL CHARGE ORBITALS
 =======================


   Orb     Occ        Energy       Coefficients

                                   1 1s      1 1s      1 1s      1 1s      1 1s      1 1s      1 3d0     1 3d2+    1 3d0     1 3d2+ 
                                   1 3d0     1 3d2+    1 3d0     1 3d2+    1 3d0     1 3d2+    1 5g0     1 5g4+    1 5g2+    1 5g0  
                                   1 5g4+    1 5g2+    1 5g0     1 5g4+    1 5g2+ 

   1.1  2.00000    -0.563081     1.000129  0.000399 -0.001570  0.002990 -0.003225  0.001521  0.000000  0.000000  0.000000  0.000000
                                 0.000000  0.000000  0.000000  0.000000  0.000000  0.000000  0.000000  0.000000  0.000000  0.000000
                                 0.000000  0.000000  0.000000  0.000000  0.000000

                                   1 2px     1 2px     1 2px     1 2px     1 2px     1 2px     1 4f1+    1 4f3+    1 4f1+    1 4f3+ 
                                   1 4f1+    1 4f3+    1 4f1+    1 4f3+    1 6h1+    1 6h3+    1 6h5+    1 6h1+    1 6h3+    1 6h5+ 


   1.2  1.00000    -0.103719     1.000241  0.000100 -0.000415  0.000562 -0.001061  0.000775  0.000000  0.000000  0.000000  0.000000
                                 0.000000  0.000000  0.000000  0.000000  0.000000  0.000000  0.000000  0.000000  0.000000  0.000000

                                   1 2pz     1 2pz     1 2pz     1 2pz     1 2pz     1 2pz     1 4f0     1 4f2+    1 4f0     1 4f2+ 
                                   1 4f0     1 4f2+    1 4f0     1 4f2+    1 6h2+    1 6h4+    1 6h0     1 6h2+    1 6h4+    1 6h0  


   1.5  1.00000    -0.103719     1.000241  0.000100 -0.000415  0.000562 -0.001061  0.000775  0.000000  0.000000  0.000000  0.000000
                                 0.000000  0.000000  0.000000  0.000000  0.000000  0.000000  0.000000  0.000000  0.000000  0.000000

 Natural orbitals saved to record    2200.2 (Orbital set 3)

 Orbital spaces for UNO-CAS (Min. occupation: 0.020  Max. occupation: 1.980):

 Closed:        1   0   0   0   0   0   0   0
 Active:        0   1   0   0   1   0   0   0

 No convergence



 **********************************************************************************************************************************
 DATASETS  * FILE   NREC   LENGTH (MB)   RECORD NAMES
              1      21       38.73       500      610      700      900      950      970     1000      129      960     1100   
                                          VAR    BASINP    GEOM    SYMINP    ZMAT    AOBASIS   BASIS     P2S    ABASIS      S 
                                         1400     1410     1420     1200     1210     1080     1600     1650     1300     1700   
                                         EKIN       V       ECP      H0       H01     AOSYM     SMH    MOLCAS    ERIS     OPER   
                                         1380   
                                         JKOP   

              2       7       10.62       700     1000      520     4202     5202     2101     2200   
                                         GEOM     BASIS   MCVARS     RHF     MCSCF     RHF      UHF  

 PROGRAMS   *        TOTAL       UHF       RHF     MULTI       RHF       INT
 CPU TIMES  *         4.48      0.04      0.03      0.20      0.23      3.82
 REAL TIME  *        18.97 SEC
 DISK USED  *        88.49 MB      
 **********************************************************************************************************************************
 SETTING SCF(I)         =        -3.66482426  AU                              


 PROGRAM * MRCC (General Multireference Coupled Cluster)    Author: M. Kallay, 2000-2005

 ***  Initialisation ***

   0 Spin projections
 
 Molecular orbitals read from record     2200.2  Type=UHF/ALPHA (state 1.6)

 ?Warning: UHF not converged
 Molecular orbitals read from record     2200.2  Type=UHF/BETA (state 1.6)

 ?Warning: UHF not converged
 
 Frozen orbitals:              0 (  0  0  0  0  0  0  0  0)
 Active orbitals:            126 ( 25 20 20 11 20 11 11  8)
 Active electrons:             4
 Spin quantum number:          1.0

 Transformed integrals will be written to file mrcc_61309/fort.55

 Load integrals                4.5 sec
 Transform integrals           7.2 sec
 Storage for integrals:       24278327
 Remaining memory:           *********

 Core energy:               0.00000000
 
 MRCC Input:
     4     0     0     0     3     0     0     6     0     0     0     1     1     0     0     7     0     0   0.000     0   64000
  ex.lev,nsing,ntrip, rest,method,dens,conver,symm, diag, CS ,spatial, HF, ndoub,nacto,nactv, tol, maxex, sacc, freq,  dboc,   mem
  2  0  0  0  0  0  0  0  0  0  0  0  0  0  0  0  0  0  0  0  0  0  0  0  0  1  0  0  0  0  0  0  0  0  0  0  0  0  0  0  0  0  0  0  0  0  0  0  0  0  0  0  0  0  0  0  0  0  0  0  0  0  0  0  0  0  0  0  0  0  0  0  0  0  0  0  1  0  0  0  0  0  0  0  0  0  0  0  0  0  0  0  0  0  0  0  0  0  0  0  0  0  0  0  0  0  0  0  0  0  0  0  0  0  0  0  0  0  0  0  0  0  0  0  0  0
 MRCC Input end
 Variable memory released
 MRCC now being run, temporary output in /global/cscratch1/sd/aannabe/mrcc_61309/mrcc.out
 **********************************************************************
                          MRCC program system
 **********************************************************************

                              Written by
  Mihaly Kallay, Zoltan Rolik, Jozsef Csontos, Peter Nagy, Gyula Samu,
      David Mester, Jozsef Csoka, Bernat Szabo, Istvan Ladjanszki,
       Lorant Szegedy, Bence Ladoczki, Klara Petrov, Mate Farkas,
                    Pal D. Mezei, and Bence Hegely

        Department of Physical Chemistry and Materials Science
            Budapest University of Technology and Economics
                  Budapest P.O.Box 91, H-1521 Hungary

                              www.mrcc.hu

                       Release date: May 23, 2018

 ************************ 2019-06-25 12:41:39 *************************
 Executing goldstone...

 Generation of CC equations in terms of H and T...
 Generation of antisymmetrized Goldstone diagrams...
 Number of diagrams in T^1 equations:    15
 Number of diagrams in T^2 equations:    38
 Number of diagrams in T^3 equations:    49
 Number of diagrams in T^4 equations:     5
 Translation of diagrams to factorized equations...
 Optimizing intermediate calculation...
 Number of floating-point operations per iteration step:   7.6150E+10
 Probable CPU time per iteration step (hours):      0.76
 Required memory (Mbytes):   30783.6
 Number of intermediates:                                  80
 Number of intermediates to be stored:                     32
 Length of intermediate file (Mbytes):     492.9

 ************************ 2019-06-25 12:41:45 *************************
 Executing xmrcc...

 **********************************************************************
 CC(3)(4) calculation


 Allocation of****** Mbytes of memory...
 Number of spinorbitals:                   252
 Number of alpha electrons:                        3
 Number of beta electrons:                         1
 Spin multiplicity:                     2
 z-component of spin:  1.0
 Spatial symmetry:                      6
 Convergence criterion:  1.0E-07
 Construction of occupation graphs...
 Number of                     0 -fold excitations:                      1
 Number of                     1 -fold excitations:                     86
 Number of                     2 -fold excitations:                   8977
 Number of                     3 -fold excitations:                 389714
 Total number of configurations:                 398778
 Calculation of coupling coefficients...
 Length of intermediate file (Mbytes):     372.0

 ======================================================================

 Spin case  1   Alpha:  3   Beta:  1
 Number of excitations:                4723078
 Number of                     4 -fold excitations:                4723078

 Memory requirements /Mbyte/:
               Minimal        Optimal
 Real*8:        802.7682      1923.2150
 Integer:        80.1863
 Total:         882.9545      2003.4013


 ************************ 2019-06-25 12:41:53 *************************
 Executing mrcc...

 **********************************************************************
 CCSDT(Q) calculation


 Allocation of 1923.2 Mbytes of memory...
 Number of spinorbitals: 252
 Number of alpha electrons:  3
 Number of beta  electrons:  1
 Spin multiplicity: 2
 z-component of spin:  1.0
 Spatial symmetry: 6
 Convergence criterion:  1.0E-07
 Construction of occupation graphs...
 Number of 0-fold excitations: 1
 Number of 1-fold excitations: 86
 Number of 2-fold excitations: 8977
 Number of 3-fold excitations: 389714
 Total number of determinants: 398778
 Calculation of coupling coefficients...
 Initial cluster amplitudes are generated.
 Length of intermediate file (Mbytes):     372.0
 Reading integral list from unit 55...
 Sorting integrals...
 Sorting integrals...
 Sorting integrals...
 Sorting integrals...
 Energy of reference determinant [au]:      -3.664824264868
 Calculation of MP denominators...

 Starting CC iteration...
 ======================================================================
 Norm of residual vector:     0.37956742
 CPU time [min]:     1.010                   Wall time [min]:     1.030

 Iteration  1  CC energy:    -3.72970885  Energy decrease:   0.06488458
 ======================================================================
 Norm of residual vector:     0.11005268
 CPU time [min]:     1.433                   Wall time [min]:     1.460

 Iteration  2  CC energy:    -3.73804387  Energy decrease:   0.00833502
 ======================================================================
 Norm of residual vector:     0.03260540
 CPU time [min]:     1.864                   Wall time [min]:     1.898

 Iteration  3  CC energy:    -3.74369275  Energy decrease:   0.00564888
 ======================================================================
 Norm of residual vector:     0.00837035
 CPU time [min]:     2.292                   Wall time [min]:     2.332

 Iteration  4  CC energy:    -3.74375411  Energy decrease:   0.00006137
 ======================================================================
 Norm of residual vector:     0.00225312
 CPU time [min]:     2.711                   Wall time [min]:     2.754

 Iteration  5  CC energy:    -3.74384309  Energy decrease:   0.00008898
 ======================================================================
 Norm of residual vector:     0.00071057
 CPU time [min]:     3.140                   Wall time [min]:     3.188

 Iteration  6  CC energy:    -3.74384329  Energy decrease:   0.00000020
 ======================================================================
 Norm of residual vector:     0.00021991
 CPU time [min]:     3.550                   Wall time [min]:     3.605

 Iteration  7  CC energy:    -3.74383471  Energy decrease:   0.00000858
 ======================================================================
 Norm of residual vector:     0.00006861
 CPU time [min]:     3.980                   Wall time [min]:     4.039

 Iteration  8  CC energy:    -3.74383574  Energy decrease:   0.00000103
 ======================================================================
 Norm of residual vector:     0.00002194
 CPU time [min]:     4.412                   Wall time [min]:     4.478

 Iteration  9  CC energy:    -3.74383643  Energy decrease:   0.00000069
 ======================================================================
 Norm of residual vector:     0.00000766
 CPU time [min]:     4.846                   Wall time [min]:     4.919

 Iteration 10  CC energy:    -3.74383617  Energy decrease:   0.00000026
 ======================================================================
 Norm of residual vector:     0.00000266
 CPU time [min]:     5.283                   Wall time [min]:     5.363

 Iteration 11  CC energy:    -3.74383614  Energy decrease:   0.00000002
 ======================================================================
 Norm of residual vector:     0.00000093
 CPU time [min]:     5.708                   Wall time [min]:     5.794

 Iteration 12  CC energy:    -3.74383618  Energy decrease:   0.00000003
 ======================================================================
 Norm of residual vector:     0.00000029
 CPU time [min]:     6.135                   Wall time [min]:     6.225

 Iteration 13  CC energy:    -3.74383617  Energy decrease:   4.1100E-09
 ======================================================================
 Norm of residual vector:     0.00000009
 CPU time [min]:     6.545                   Wall time [min]:     6.642

 Iteration 14  CC energy:    -3.74383617  Energy decrease:   7.7074E-10
 ======================================================================

 Iteration has converged in 14 steps.

 Final results:
 Total CCSDT energy [au]:             -3.743836173604
 Total MP2 energy [au]:               -3.729708847840

 Perturbative corrections are calculated...
 ======================================================================
 Spin case  1   Alpha:  3   Beta:  1
 Number of excitations:        4723078
 CPU time [min]:    37.258                   Wall time [min]:    37.355
 ======================================================================
 Number of 4-fold excitations: 4723078
 CPU time [min]:    37.258                   Wall time [min]:    37.355

 Total CCSDT[Q] energy [au]:          -3.743853239957
 Total CCSDT(Q) energy [au]:          -3.743891992341

 ************************ 2019-06-25 13:19:16 *************************
                      Normal termination of mrcc.
 **********************************************************************
 !CCSDT STATE 1.6 Energy               -3.743836173604
 !MP2 STATE 1.6 Energy                 -3.729708847840
 !CCSDT[Q] STATE 1.6 Energy            -3.743853239957
 !CCSDT(Q) STATE 1.6 Energy            -3.743891992341
 
 CPU-time for MRCC:           2235.5 sec
 Elapsed-time for MRCC:       2259.9 sec

 Variable memory set to 8000000000 words,  buffer space   230000 words



 **********************************************************************************************************************************
 DATASETS  * FILE   NREC   LENGTH (MB)   RECORD NAMES
              1      21       38.73       500      610      700      900      950      970     1000      129      960     1100   
                                          VAR    BASINP    GEOM    SYMINP    ZMAT    AOBASIS   BASIS     P2S    ABASIS      S 
                                         1400     1410     1420     1200     1210     1080     1600     1650     1300     1700   
                                         EKIN       V       ECP      H0       H01     AOSYM     SMH    MOLCAS    ERIS     OPER   
                                         1380   
                                         JKOP   

              2       7       10.62       700     1000      520     4202     5202     2101     2200   
                                         GEOM     BASIS   MCVARS     RHF     MCSCF     RHF      UHF  

 PROGRAMS   *        TOTAL      MRCC       UHF       RHF     MULTI       RHF       INT
 CPU TIMES  *      2297.35   2292.87      0.04      0.03      0.20      0.23      3.82
 REAL TIME  *      2595.17 SEC
 DISK USED  *        88.49 MB      
 **********************************************************************************************************************************
 SETTING POSTHF(I)      =        -3.74389199  AU                              
                                                                                                                                                                                                                                                                

       SCF           POSTHF       EKIN          POT
    -3.66482426   -3.74389199   1.37335122   -1.86785245
                                                  

 CCSDT(Q)/USERDEF energy=     -3.743891992341

        CCSDT(Q)        RHF-SCF         MULTI           RHF-SCF 
     -3.74389199     -3.66482426     -3.66482426     -3.66490256
 **********************************************************************************************************************************
 Molpro calculation terminated
 Variable memory released
