
 Primary working directories    : /global/cscratch1/sd/aannabe
 Secondary working directories  : /global/cscratch1/sd/aannabe
 Wavefunction directory         : /global/homes/a/aannabe/wfu/
 Main file repository           : /global/cscratch1/sd/aannabe/

 SHA1      : 19cd028119e0e09f93f0674bd8af7968d9b3eff6
 NAME      : 2015.1.36
 ARCHNAME  : linux/x86_64
 FC        : /opt/cray/pe/craype/2.5.14/bin/ftn
 BLASLIB   : -L/opt/intel/compilers_and_libraries_2018.1.163/linux/mkl/lib/intel64 -Wl,-_start-group -lmkl_intel_ilp64 -lmkl_intel_thread -lmkl_core -Wl,-_end-group -liomp5
 id        : lbl

 Nodes     nprocs
 nid00472     3
 Number of processes for MPI-2 version of Molpro:   nprocs(total)=    4   nprocs(compute)=    3   nprocs(helper)=    1

 Using customized tuning parameters: mindgm=7; mindgv=16; mindgc=1; mindgr=1; noblas=0; minvec=7
 default implementation of scratch files=sf  

 ***,Ca
 memory,512,m
 gthresh,twoint=1.e-12
 
 gprint,basis,orbitals
 gexpec,ekin,pot
 
 angstrom
 geometry={
 1                                                                               ! Number of atoms
 Ca 0.0 0.0 0.0
 }
 
 basis={
                                                                 !include,/global/homes/a/aannabe/docs/accurate/ccECP_D2h/pps/Ca.pp
                                             !include,/global/homes/a/aannabe/docs/accurate/ccECP_D2h/basis/aug-cc-pVnZ/Ca_TZ.basis
                                                 !include,/global/homes/a/aannabe/docs/accurate/ccECP_D2h/basis/cc-pVnZ/Ca_TZ.basis
 
 Including file /global/homes/a/aannabe/repos/pseudopotentiallibrary/recipes/Ca/ccECP/Ca.ccECP.molpro
 Including file /global/homes/a/aannabe/repos/pseudopotentiallibrary/recipes/Ca/ccECP/Ca.cc-pCVTZ.molpro
 
 
 }
 
 {hf
 wf,10,1,0
 occ,2,1,1,0,1,0,0,0
 closed,2,1,1,0,1,0,0,0
 }
 scf(i)=energy
 
 _CC_NORM_MAX=2.0
 {uccsd(t)
 maxit,100
 core
 }
 posthf(i)=energy
 
 table,scf,posthf,ekin,pot
 save,3.csv,new
 
 

 Variables initialized (889), CPU time= 0.01 sec
 Commands  initialized (702), CPU time= 0.01 sec, 572 directives.
 Default parameters read. Elapsed time= 0.16 sec

 Checking input...
 Passed
1


                                         ***  PROGRAM SYSTEM MOLPRO  ***
                                       Copyright, TTI GmbH Stuttgart, 2015
                                    Version 2015.1 linked Dec 29 2018 15:55:43


 **********************************************************************************************************************************
 LABEL *   Ca                                                                            
  64 bit mpp version                                                                     DATE: 07-Feb-19          TIME: 15:10:47  
 **********************************************************************************************************************************

 SHA1:             19cd028119e0e09f93f0674bd8af7968d9b3eff6
 **********************************************************************************************************************************

 THRESHOLDS:

 ZERO    =  1.00D-12  ONEINT  =  1.00D-12  TWOINT  =  1.00D-12  PREFAC  =  1.00D-14  LOCALI  =  1.00D-09  EORDER  =  1.00D-04
 ENERGY  =  0.00D+00  ETEST   =  0.00D+00  EDENS   =  0.00D+00  THRDEDEF=  1.00D-06  GRADIENT=  1.00D-02  STEP    =  1.00D-03
 ORBITAL =  1.00D-05  CIVEC   =  1.00D-05  COEFF   =  1.00D-04  PRINTCI =  5.00D-02  PUNCHCI =  9.90D+01  OPTGRAD =  3.00D-04
 OPTENERG=  1.00D-06  OPTSTEP =  3.00D-04  THRGRAD =  1.00D-10  COMPRESS=  1.00D-11  VARMIN  =  1.00D-07  VARMAX  =  1.00D-03
 THRDOUB =  0.00D+00  THRDIV  =  1.00D-05  THRRED  =  1.00D-07  THRPSP  =  1.00D+00  THRDC   =  1.00D-10  THRCS   =  1.00D-10
 THRNRM  =  1.00D-08  THREQ   =  0.00D+00  THRDE   =  1.00D+00  THRREF  =  1.00D-05  SPARFAC =  1.00D+00  THRDLP  =  1.00D-07
 THRDIA  =  1.00D-10  THRDLS  =  1.00D-07  THRGPS  =  0.00D+00  THRKEX  =  0.00D+00  THRDIS  =  2.00D-01  THRVAR  =  1.00D-10
 THRLOC  =  1.00D-06  THRGAP  =  1.00D-06  THRLOCT = -1.00D+00  THRGAPT = -1.00D+00  THRORB  =  1.00D-06  THRMLTP =  0.00D+00
 THRCPQCI=  1.00D-10  KEXTA   =  0.00D+00  THRCOARS=  0.00D+00  SYMTOL  =  1.00D-06  GRADTOL =  1.00D-06  THROVL  =  1.00D-08
 THRORTH =  1.00D-08  GRID    =  1.00D-06  GRIDMAX =  1.00D-03  DTMAX   =  0.00D+00  THROCCDE=  1.00D-01  THROCCDE=  1.00D-01



 ZUNIT=ANG
 

Geometry recognized as XYZ


 Variable memory set to  512000000 words,  buffer space   230000 words

 SETTING BASIS          =    USERDEF


 Recomputing integrals since basis changed


 Using spherical harmonics



 PROGRAM * SEWARD (Integral evaluation for generally contracted gaussian basis sets)     Author: Roland Lindh, 1990

 Geometry written to block  1 of record 700

 Orientation using atomic masses  
 Molecule type: Atom
 Symmetry elements: X,Y,Z
 Rotational constants:       0.0000000      0.0000000      0.0000000 GHz  (calculated with average atomic masses)

 Point group  D2h 



 ATOMIC COORDINATES

 NR  ATOM    CHARGE       X              Y              Z

   1  CA     10.00    0.000000000    0.000000000    0.000000000


          CA  CORE POTENTIAL

          d POTENTIAL

 POWERS             1              3              2              2
 EXPONENTIALS   7.041332       14.01445       13.76936       4.717260    
 COEFFICIENTS   10.00000       70.41332      -92.87298      -5.753568    

          s - d POTENTIAL

 POWERS             2              2
 EXPONENTIALS   11.24017       5.353612    
 COEFFICIENTS   149.3026       23.75933    

          p - d POTENTIAL

 POWERS             2              2
 EXPONENTIALS   13.06655       4.027485    
 COEFFICIENTS   99.20411       13.45216    


 BASIS DATA

   Nr Sym  Nuc  Type         Exponents   Contraction coefficients

    1.1 Ag    1  1s          38.909972     0.000945   -0.000183
    2.1 Ag                   20.573489    -0.017709    0.004255
                             10.878148     0.143493   -0.037277
                              5.751777    -0.280351    0.077047
                              3.041228    -0.288477    0.078223
                              1.608037     0.172486   -0.051753
                              0.850243     0.552901   -0.174623
                              0.449563     0.467699   -0.253263
                              0.237704     0.099292   -0.160610
                              0.125685     0.006651    0.126548
                              0.066456    -0.001926    0.464877
                              0.035138     0.000961    0.478401
                              0.018579    -0.000244    0.156430
    3.1 Ag    1  1s           0.090426     1.000000
    4.1 Ag    1  1s           0.042935     1.000000
    5.1 Ag    1  1s           0.019981     1.000000
    6.1 Ag    1  1s           0.561250     1.000000
    7.1 Ag    1  1s           0.957624     1.000000
    8.1 Ag    1  1s           1.633930     1.000000
    9.1 Ag    1  3d0         28.997930     0.002278
                             13.712713     0.011973
                              6.484549     0.022732
                              3.066452     0.069977
                              1.450082     0.125887
                              0.685723     0.175971
                              0.324269     0.209627
                              0.153342     0.256615
                              0.072513     0.288741
                              0.034291     0.224779
                              0.016216     0.082948
   10.1 Ag    1  3d2+        28.997930     0.002278
                             13.712713     0.011973
                              6.484549     0.022732
                              3.066452     0.069977
                              1.450082     0.125887
                              0.685723     0.175971
                              0.324269     0.209627
                              0.153342     0.256615
                              0.072513     0.288741
                              0.034291     0.224779
                              0.016216     0.082948
   11.1 Ag    1  3d0          0.127163     1.000000
   12.1 Ag    1  3d2+         0.127163     1.000000
   13.1 Ag    1  3d0          0.038262     1.000000
   14.1 Ag    1  3d2+         0.038262     1.000000
   15.1 Ag    1  3d0          0.475378     1.000000
   16.1 Ag    1  3d2+         0.475378     1.000000
   17.1 Ag    1  3d0          1.277696     1.000000
   18.1 Ag    1  3d2+         1.277696     1.000000
    1.2 B3u   1  2px         31.519451    -0.000131    0.000021
    2.2 B3u                  15.831494     0.005811   -0.001246
                              7.951795    -0.044610    0.010111
                              3.994003    -0.042392    0.008943
                              2.006096     0.180288   -0.044587
                              1.007616     0.407474   -0.096275
                              0.506102     0.386467   -0.113007
                              0.254203     0.154522   -0.065333
                              0.127681     0.017068    0.146809
                              0.064131     0.003160    0.441198
                              0.032211    -0.000225    0.427632
                              0.016179     0.000168    0.125197
    3.2 B3u   1  2px          0.125510     1.000000
    4.2 B3u   1  2px          0.053549     1.000000
    5.2 B3u   1  2px          0.022081     1.000000
    6.2 B3u   1  2px          0.471583     1.000000
    7.2 B3u   1  2px          1.045363     1.000000
    8.2 B3u   1  2px          2.317268     1.000000
    9.2 B3u   1  4f1+         0.136800     1.000000
   10.2 B3u   1  4f3+         0.136800     1.000000
   11.2 B3u   1  4f1+         1.454974     1.000000
   12.2 B3u   1  4f3+         1.454974     1.000000
    1.3 B2u   1  2py         31.519451    -0.000131    0.000021
    2.3 B2u                  15.831494     0.005811   -0.001246
                              7.951795    -0.044610    0.010111
                              3.994003    -0.042392    0.008943
                              2.006096     0.180288   -0.044587
                              1.007616     0.407474   -0.096275
                              0.506102     0.386467   -0.113007
                              0.254203     0.154522   -0.065333
                              0.127681     0.017068    0.146809
                              0.064131     0.003160    0.441198
                              0.032211    -0.000225    0.427632
                              0.016179     0.000168    0.125197
    3.3 B2u   1  2py          0.125510     1.000000
    4.3 B2u   1  2py          0.053549     1.000000
    5.3 B2u   1  2py          0.022081     1.000000
    6.3 B2u   1  2py          0.471583     1.000000
    7.3 B2u   1  2py          1.045363     1.000000
    8.3 B2u   1  2py          2.317268     1.000000
    9.3 B2u   1  4f1-         0.136800     1.000000
   10.3 B2u   1  4f3-         0.136800     1.000000
   11.3 B2u   1  4f1-         1.454974     1.000000
   12.3 B2u   1  4f3-         1.454974     1.000000
    1.4 B1g   1  3d2-        28.997930     0.002278
                             13.712713     0.011973
                              6.484549     0.022732
                              3.066452     0.069977
                              1.450082     0.125887
                              0.685723     0.175971
                              0.324269     0.209627
                              0.153342     0.256615
                              0.072513     0.288741
                              0.034291     0.224779
                              0.016216     0.082948
    2.4 B1g   1  3d2-         0.127163     1.000000
    3.4 B1g   1  3d2-         0.038262     1.000000
    4.4 B1g   1  3d2-         0.475378     1.000000
    5.4 B1g   1  3d2-         1.277696     1.000000
    1.5 B1u   1  2pz         31.519451    -0.000131    0.000021
    2.5 B1u                  15.831494     0.005811   -0.001246
                              7.951795    -0.044610    0.010111
                              3.994003    -0.042392    0.008943
                              2.006096     0.180288   -0.044587
                              1.007616     0.407474   -0.096275
                              0.506102     0.386467   -0.113007
                              0.254203     0.154522   -0.065333
                              0.127681     0.017068    0.146809
                              0.064131     0.003160    0.441198
                              0.032211    -0.000225    0.427632
                              0.016179     0.000168    0.125197
    3.5 B1u   1  2pz          0.125510     1.000000
    4.5 B1u   1  2pz          0.053549     1.000000
    5.5 B1u   1  2pz          0.022081     1.000000
    6.5 B1u   1  2pz          0.471583     1.000000
    7.5 B1u   1  2pz          1.045363     1.000000
    8.5 B1u   1  2pz          2.317268     1.000000
    9.5 B1u   1  4f0          0.136800     1.000000
   10.5 B1u   1  4f2+         0.136800     1.000000
   11.5 B1u   1  4f0          1.454974     1.000000
   12.5 B1u   1  4f2+         1.454974     1.000000
    1.6 B2g   1  3d1+        28.997930     0.002278
                             13.712713     0.011973
                              6.484549     0.022732
                              3.066452     0.069977
                              1.450082     0.125887
                              0.685723     0.175971
                              0.324269     0.209627
                              0.153342     0.256615
                              0.072513     0.288741
                              0.034291     0.224779
                              0.016216     0.082948
    2.6 B2g   1  3d1+         0.127163     1.000000
    3.6 B2g   1  3d1+         0.038262     1.000000
    4.6 B2g   1  3d1+         0.475378     1.000000
    5.6 B2g   1  3d1+         1.277696     1.000000
    1.7 B3g   1  3d1-        28.997930     0.002278
                             13.712713     0.011973
                              6.484549     0.022732
                              3.066452     0.069977
                              1.450082     0.125887
                              0.685723     0.175971
                              0.324269     0.209627
                              0.153342     0.256615
                              0.072513     0.288741
                              0.034291     0.224779
                              0.016216     0.082948
    2.7 B3g   1  3d1-         0.127163     1.000000
    3.7 B3g   1  3d1-         0.038262     1.000000
    4.7 B3g   1  3d1-         0.475378     1.000000
    5.7 B3g   1  3d1-         1.277696     1.000000
    1.8 Au    1  4f2-         0.136800     1.000000
    2.8 Au    1  4f2-         1.454974     1.000000

 NUCLEAR CHARGE:                   10
 NUMBER OF PRIMITIVE AOS:         183
 NUMBER OF SYMMETRY AOS:          162
 NUMBER OF CONTRACTIONS:           71   (  18Ag  +  12B3u +  12B2u +   5B1g +  12B1u +   5B2g +   5B3g +   2Au  )
 NUMBER OF CORE ORBITALS:           4   (   1Ag  +   1B3u +   1B2u +   0B1g +   1B1u +   0B2g +   0B3g +   0Au  )
 NUMBER OF VALENCE ORBITALS:        1   (   1Ag  +   0B3u +   0B2u +   0B1g +   0B1u +   0B2g +   0B3g +   0Au  )


 NUCLEAR REPULSION ENERGY    0.00000000

 EXTRA SYMMETRY OF AOS IN SYMMETRY 1:   1 1 1 1 1 1 1 1 2 3   2 3 2 3 2 3 2 3
 EXTRA SYMMETRY OF AOS IN SYMMETRY 2:   1 1 1 1 1 1 1 1 2 3   2 3
 EXTRA SYMMETRY OF AOS IN SYMMETRY 3:   1 1 1 1 1 1 1 1 2 3   2 3
 EXTRA SYMMETRY OF AOS IN SYMMETRY 5:   1 1 1 1 1 1 1 1 2 3   2 3

 Eigenvalues of metric

         1 0.359E-04 0.138E-02 0.565E-02 0.565E-02 0.793E-02 0.176E-01 0.194E+00 0.199E+00
         2 0.165E-04 0.115E-02 0.255E-01 0.679E-01 0.323E+00 0.714E+00 0.926E+00 0.926E+00
         3 0.165E-04 0.115E-02 0.255E-01 0.679E-01 0.323E+00 0.714E+00 0.926E+00 0.926E+00
         4 0.565E-02 0.199E+00 0.497E+00 0.130E+01 0.299E+01
         5 0.165E-04 0.115E-02 0.255E-01 0.679E-01 0.323E+00 0.714E+00 0.926E+00 0.926E+00
         6 0.565E-02 0.199E+00 0.497E+00 0.130E+01 0.299E+01
         7 0.565E-02 0.199E+00 0.497E+00 0.130E+01 0.299E+01
         8 0.926E+00 0.107E+01


 Contracted 2-electron integrals neglected if value below      1.0D-12
 AO integral compression algorithm  1   Integral accuracy      1.0D-12

     5.505 MB (compressed) written to integral file ( 73.1%)

     Node minimum: 1.311 MB, node maximum: 2.359 MB


 NUMBER OF SORTED TWO-ELECTRON INTEGRALS:     152130.     BUFFER LENGTH:  32768
 NUMBER OF SEGMENTS:   1  SEGMENT LENGTH:     152130      RECORD LENGTH: 524288

 Memory used in sort:       0.71 MW

 SORT1 READ      946933. AND WROTE      126737. INTEGRALS IN      1 RECORDS. CPU TIME:     0.03 SEC, REAL TIME:     0.16 SEC
 SORT2 READ      373936. AND WROTE      450861. INTEGRALS IN     21 RECORDS. CPU TIME:     0.02 SEC, REAL TIME:     0.04 SEC

 Node minimum:      149290.  Node maximum:      152130. integrals

 OPERATOR DM      FOR CENTER  0  COORDINATES:    0.000000    0.000000    0.000000
 OPERATOR EKIN    FOR CENTER  0  COORDINATES:    0.000000    0.000000    0.000000
 OPERATOR POT     FOR CENTER  0  COORDINATES:    0.000000    0.000000    0.000000


 **********************************************************************************************************************************
 DATASETS  * FILE   NREC   LENGTH (MB)   RECORD NAMES
              1      19       19.94       500      610      700      900      950      970     1000      129      960     1100   
                                          VAR    BASINP    GEOM    SYMINP    ZMAT    AOBASIS   BASIS     P2S    ABASIS      S 
                                         1400     1410     1420     1200     1210     1080     1600     1650     1700   
                                         EKIN       V       ECP      H0       H01     AOSYM     SMH    MOLCAS    OPER   

 PROGRAMS   *        TOTAL       INT
 CPU TIMES  *         1.90      1.70
 REAL TIME  *         3.49 SEC
 DISK USED  *        15.30 MB      
 GA USED    *         0.00 MB       (max)       0.00 MB       (current)
 **********************************************************************************************************************************


 PROGRAM * RHF-SCF (CLOSED SHELL)       Authors: W. Meyer, H.-J. Werner


 NUMBER OF ELECTRONS:       5+    5-    SPACE SYMMETRY=1    SPIN SYMMETRY: Singlet 
 CONVERGENCE THRESHOLDS:    1.00E-05 (Density)    1.00E-07 (Energy)
 MAX. NUMBER OF ITERATIONS:       60
 INTERPOLATION TYPE:            DIIS
 INTERPOLATION STEPS:              2 (START)      1 (STEP)
 LEVEL SHIFTS:                  0.00 (CLOSED)  0.00 (OPEN) 

 Number of closed-shell orbitals:    5 (   2   1   1   0   1   0   0   0 )



   Atom=CA basis=ECP10MDF_GUESS    lmin=0  lmax=1

 Orbital guess generated from atomic densities. Full valence occupancy:    2   1   1   0   1   0   0   0


 Molecular orbital dump at record        2100.2

 ITERATION    DDIFF          GRAD             ENERGY        2-EL.EN.            DIPOLE MOMENTS         DIIS   ORB.
    1      0.000D+00      0.000D+00       -36.34969801     46.649888    0.00000    0.00000    0.00000    0    start
    2      0.000D+00      0.936D-03       -36.34973308     46.687224    0.00000    0.00000    0.00000    1    diag
    3      0.579D-02      0.161D-03       -36.34973407     46.680260    0.00000    0.00000    0.00000    2    diag
    4      0.541D-03      0.211D-04       -36.34973413     46.679612    0.00000    0.00000    0.00000    3    diag
    5      0.168D-03      0.406D-05       -36.34973414     46.679199    0.00000    0.00000    0.00000    4    diag
    6      0.248D-04      0.475D-06       -36.34973414     46.679130    0.00000    0.00000    0.00000    5    diag
    7      0.623D-05      0.573D-07       -36.34973414     46.679126    0.00000    0.00000    0.00000    0    orth

 Final occupancy:   2   1   1   0   1   0   0   0

 !RHF STATE 1.1 Energy                -36.349734137836
 Nuclear energy                         0.00000000
 One-electron energy                  -59.68929731
 Two-electron energy                   23.33956317
 Virial quotient                       -2.70639876
 !RHF STATE 1.1 Dipole moment           0.00000000     0.00000000     0.00000000
 Dipole moment /Debye                   0.00000000     0.00000000     0.00000000
 

 !RHF expec          <1.1|EKIN|1.1>    13.431034120447
 
 !RHF expec           <1.1|POT|1.1>    -7.946879310298

 ELECTRON ORBITALS
 =================


   Orb  Occ    Energy  Couls-En    Coefficients

                                   1 1s      1 1s      1 1s      1 1s      1 1s      1 1s      1 1s      1 1s      1 3d0     1 3d2+ 
                                   1 3d0     1 3d2+    1 3d0     1 3d2+    1 3d0     1 3d2+    1 3d0     1 3d2+ 

   1.1   2    -2.2832   -9.7935  1.000537  0.001590 -0.000446 -0.001069 -0.000346  0.000564 -0.000523  0.000235  0.000000  0.000000
                                -0.000000 -0.000000 -0.000000 -0.000000 -0.000000 -0.000000 -0.000000  0.000000

   2.1   2    -0.1958   -2.7935 -0.000084  0.999677 -0.000039  0.000424 -0.000044 -0.000042 -0.000021  0.000011 -0.000000 -0.000000
                                 0.000000  0.000000  0.000000  0.000000  0.000000 -0.000000  0.000000  0.000000

                                   1 2px     1 2px     1 2px     1 2px     1 2px     1 2px     1 2px     1 2px     1 4f1+    1 4f3+ 
                                   1 4f1+    1 4f3+ 

   1.2   2    -1.3420   -7.9209  1.000279  0.001322 -0.000207 -0.000837 -0.000445  0.000066  0.000015  0.000004 -0.000000  0.000000
                                 0.000000  0.000000

                                   1 2py     1 2py     1 2py     1 2py     1 2py     1 2py     1 2py     1 2py     1 4f1-    1 4f3- 
                                   1 4f1-    1 4f3- 

   1.3   2    -1.3420   -7.9209  1.000279  0.001322 -0.000207 -0.000837 -0.000445  0.000066  0.000015  0.000004 -0.000000 -0.000000
                                 0.000000 -0.000000

                                   1 2pz     1 2pz     1 2pz     1 2pz     1 2pz     1 2pz     1 2pz     1 2pz     1 4f0     1 4f2+ 
                                   1 4f0     1 4f2+ 

   1.5   2    -1.3420   -7.9209  1.000279  0.001322 -0.000207 -0.000837 -0.000445  0.000066  0.000015  0.000004 -0.000000  0.000000
                                 0.000000 -0.000000

 HOMO      2.1    -0.195784 =      -5.3275eV
 LUMO      2.2     0.019610 =       0.5336eV
 LUMO-HOMO         0.215393 =       5.8612eV


 **********************************************************************************************************************************
 DATASETS  * FILE   NREC   LENGTH (MB)   RECORD NAMES
              1      19       19.94       500      610      700      900      950      970     1000      129      960     1100   
                                          VAR    BASINP    GEOM    SYMINP    ZMAT    AOBASIS   BASIS     P2S    ABASIS      S 
                                         1400     1410     1420     1200     1210     1080     1600     1650     1700   
                                         EKIN       V       ECP      H0       H01     AOSYM     SMH    MOLCAS    OPER   

              2       4        2.77       700     1000      520     2100   
                                         GEOM     BASIS   MCVARS     RHF  

 PROGRAMS   *        TOTAL        HF       INT
 CPU TIMES  *         1.99      0.10      1.70
 REAL TIME  *         3.70 SEC
 DISK USED  *        83.76 MB      
 SF USED    *         0.00 MB      
 GA USED    *         0.00 MB       (max)       0.00 MB       (current)
 **********************************************************************************************************************************
 SETTING SCF(I)         =       -36.34973414  AU                              
 SETTING _CC_NORM_MAX   =         2.00000000                                  


 PROGRAM * CCSD (Unrestricted open-shell coupled cluster)     Authors: C. Hampel, H.-J. Werner, 1991, M. Deegan, P.J. Knowles, 1992


 Convergence thresholds:  THRVAR = 1.00D-08  THRDEN = 1.00D-06

 CCSD(T)     terms to be evaluated (factor= 1.000)


 Number of closed-shell orbitals:   5 (   2   1   1   0   1   0   0   0 )
 Number of external orbitals:      66 (  16  11  11   5  11   5   5   2 )

 Memory could be reduced to 0.82 Mwords without degradation in triples

 Number of N-1 electron functions:              10
 Number of N-2 electron functions:              45
 Number of singly external CSFs:               130
 Number of doubly external CSFs:             20638
 Total number of CSFs:                       20768

 Molecular orbitals read from record     2100.2  Type=RHF/CANONICAL (state 1.1)

 Integral transformation finished. Total CPU:   0.01 sec, npass=  1  Memory used:   0.14 MW

 Starting RMP2 calculation

 ITER.      SQ.NORM     CORR.ENERGY   TOTAL ENERGY   ENERGY CHANGE        DEN1      VAR(S)    VAR(P)  DIIS     TIME
   1      1.09382524    -0.29386503   -36.64359916    -0.29386503    -0.00156068  0.40D-13  0.14D-02  1  1     0.03
   2      1.09789136    -0.29557172   -36.64530586    -0.00170669    -0.00004063  0.39D-14  0.58D-04  2  2     0.03
   3      1.09887901    -0.29581080   -36.64554494    -0.00023908    -0.00000017  0.89D-16  0.21D-06  3  3     0.03
   4      1.09890835    -0.29581458   -36.64554872    -0.00000378    -0.00000000  0.45D-17  0.37D-08  4  4     0.03
   5      1.09890912    -0.29581456   -36.64554870     0.00000002    -0.00000000  0.14D-18  0.21D-10  5  5     0.04

 Norm of t1 vector:      0.00000086      S-energy:    -0.00000000      T1 diagnostic:  0.00000019
 Norm of t2 vector:      0.31449821      P-energy:    -0.29581456
                                         Alpha-Beta:  -0.22125630
                                         Alpha-Alpha: -0.03727913
                                         Beta-Beta:   -0.03727913

 Spin contamination <S**2-Sz**2-Sz>     0.00000000
  Reference energy                    -36.349734137836
  RHF-RMP2 correlation energy          -0.295814564033
 !RHF-RMP2 energy                     -36.645548701869

 Starting UCCSD calculation

 ITER.      SQ.NORM     CORR.ENERGY   TOTAL ENERGY   ENERGY CHANGE        DEN1      VAR(S)    VAR(P)  DIIS     TIME
   1      1.10374980    -0.30576961   -36.65550375    -0.30576961    -0.00721466  0.15D-02  0.35D-02  1  1     0.07
   2      1.12132922    -0.31351035   -36.66324449    -0.00774074    -0.00069889  0.28D-03  0.61D-03  2  2     0.08
   3      1.13261876    -0.31540570   -36.66513984    -0.00189535    -0.00010846  0.55D-04  0.10D-03  3  3     0.10
   4      1.13881691    -0.31619630   -36.66593044    -0.00079060    -0.00001232  0.43D-05  0.12D-04  4  4     0.12
   5      1.14096990    -0.31638938   -36.66612352    -0.00019308    -0.00000137  0.12D-06  0.15D-05  5  5     0.14
   6      1.14140541    -0.31641751   -36.66615165    -0.00002813    -0.00000026  0.15D-07  0.29D-06  6  6     0.16
   7      1.14152423    -0.31642423   -36.66615837    -0.00000672    -0.00000003  0.13D-07  0.20D-07  6  1     0.17
   8      1.14152197    -0.31642266   -36.66615680     0.00000157    -0.00000000  0.22D-08  0.10D-08  6  2     0.19
   9      1.14152114    -0.31642286   -36.66615700    -0.00000020    -0.00000000  0.41D-09  0.19D-09  6  3     0.20

 Norm of t1 vector:      0.08981772      S-energy:     0.00000001      T1 diagnostic:  0.02008385
                                                                       D1 diagnostic:  0.06326932
 Norm of t2 vector:      0.36531346      P-energy:    -0.31642288
                                         Alpha-Beta:  -0.24574240
                                         Alpha-Alpha: -0.03534024
                                         Beta-Beta:   -0.03534024

 Singles amplitudes (print threshold =  0.500E-01):

         I         SYM. A    A   T(IA) [Alpha-Alpha]

         2         1         1     -0.05287551
 
         I         SYM. A    A   T(IA) [Beta-Beta]

         2         1         1     -0.05287551

 Doubles amplitudes (print threshold =  0.500E-01):

         I         J         SYM. A    SYM. B    A         B      T(IJ, AB) [Alpha-Beta]

         2         2         2         2         1         1     -0.08487533
         2         2         2         2         1         2     -0.06219434
         2         2         2         2         2         1     -0.06219434
         2         2         3         3         1         1     -0.08487533
         2         2         3         3         1         2     -0.06219434
         2         2         3         3         2         1     -0.06219434
         2         2         5         5         1         1     -0.08487533
         2         2         5         5         1         2     -0.06219434
         2         2         5         5         2         1     -0.06219434

 Spin contamination <S**2-Sz**2-Sz>     0.00000000

 Memory could be reduced to 0.83 Mwords without degradation in triples
 

  Correlated core orbitals:             1.1       1.2       1.3       1.5
  Orbital energies:                    -2.2832   -1.3420   -1.3420   -1.3420
 
  UCCSD core-core energy               -0.261960084328
  UCCSD core-valence energy            -0.029327983986
  UCCSD valence correlation energy     -0.025134796246
 

 RESULTS
 =======

  Reference energy                    -36.349734137836
  UCCSD singles energy                  0.000000012589
  UCCSD pair energy                    -0.316422877150
  UCCSD correlation energy             -0.316422864561
  Triples (T) contribution             -0.010497274475
  Total correlation energy             -0.326920139036
 
  RHF-UCCSD energy                    -36.666157002397
  RHF-UCCSD[T] energy                 -36.676961020009
  RHF-UCCSD-T energy                  -36.676609567833
 !RHF-UCCSD(T) energy                 -36.676654276872

 Program statistics:

 Available memory in ccsd:               511999650
 Min. memory needed in ccsd:                 78653
 Max. memory used in ccsd:                  101232
 Max. memory used in cckext:                118446 ( 9 integral passes)
 Max. memory used in cckint:                144064 ( 1 integral passes)



 **********************************************************************************************************************************
 DATASETS  * FILE   NREC   LENGTH (MB)   RECORD NAMES
              1      19       19.94       500      610      700      900      950      970     1000      129      960     1100   
                                          VAR    BASINP    GEOM    SYMINP    ZMAT    AOBASIS   BASIS     P2S    ABASIS      S 
                                         1400     1410     1420     1200     1210     1080     1600     1650     1700   
                                         EKIN       V       ECP      H0       H01     AOSYM     SMH    MOLCAS    OPER   

              2       4        2.77       700     1000      520     2100   
                                         GEOM     BASIS   MCVARS     RHF  

 PROGRAMS   *        TOTAL  UCCSD(T)        HF       INT
 CPU TIMES  *         2.37      0.36      0.10      1.70
 REAL TIME  *         4.85 SEC
 DISK USED  *        91.26 MB      
 SF USED    *         7.04 MB      
 GA USED    *         0.00 MB       (max)       0.00 MB       (current)
 **********************************************************************************************************************************
 SETTING POSTHF(I)      =       -36.67665428  AU                              
                                                                                                                                                                                                                                                                

        SCF            POSTHF        EKIN          POT
    -36.34973414   -36.67665428   13.43103412   -7.94687931
                                                  

 UCCSD(T)/USERDEF energy=    -36.676654276872

        UCCSD(T)        HF-SCF  
    -36.67665428    -36.34973414
 **********************************************************************************************************************************
 Molpro calculation terminated
 Variable memory released
