
 Primary working directories    : /global/cscratch1/sd/aannabe
 Secondary working directories  : /global/cscratch1/sd/aannabe
 Wavefunction directory         : /global/homes/a/aannabe/wfu/
 Main file repository           : /global/cscratch1/sd/aannabe/

 SHA1      : 2873118e99aab1bc19f5b6fc1784693c06d15c95
 NAME      : 2015.1.8
 ARCHNAME  : linux/x86_64
 FC        : /opt/cray/pe/craype/2.5.5/bin/ftn
 BLASLIB   : -Wl,-_start-group /opt/intel/compilers_and_libraries_2016.3.210/linux/mkl/lib/intel64/libmkl_intel_ilp64.a /opt/intel/compilers_and_libraries_2016.3.210/linux/mkl/lib/intel64/libmkl_intel_thread.a /opt/intel/compilers_and_libraries_2016.3.210/linux/mkl/lib/intel64/libmkl_core.a -Wl,-_end-group
 id        : lbl

 Nodes     nprocs
 nid00521     1

 Using customized tuning parameters: mindgm=8; mindgv=16; mindgc=4; mindgr=1; noblas=0; minvec=7
 default implementation of scratch files=df  

 ***,Al
 memory,8,g
 gthresh,twoint=1.e-12
 
 gprint,basis,orbitals
 gexpec,ekin,pot
 
 angstrom
 geometry={
 1                                                                               ! Number of atoms
 Al 0.0 0.0 0.0
 }
 
 basis={
 Including file /global/homes/a/aannabe/docs/totals/pps/Al.pp
 Including file /global/homes/a/aannabe/docs/totals/basis/aug-cc-pVnZ/Al_qz.basis
 }
 
 {hf
 wf,3,2,1
 occ,1,1,0,0,0,0,0,0
                                                                                 !open,1.2
 closed,1,0,0,0,0,0,0,0
                                                                                 !sym,
 }
 scf(i)=energy
 
 _CC_NORM_MAX=2.0
  !NOTE: Perturbative MRCC works only with UHF reference. So, here we will trick MRCC by doing zero UHF iteration right after ROHF.
 
 {uhf
 wf,3,2,1
 occ,1,1,0,0,0,0,0,0
                                                                                 !open,1.2
 closed,1,0,0,0,0,0,0,0
                                                                                 !sym,
 maxit,0
 }
 scf(i)=energy
 
 {mrcc,method=CCSDT(Q)
 orbital,ignore_error=1                                                          !Ignore the fact that UHF WF is not converged
 maxit,100
 core
 }
 posthf(i)=energy
 
 table,scf,posthf,ekin,pot
 save,4.csv,new
 
 

 Variables initialized (889), CPU time= 0.00 sec
 Commands  initialized (702), CPU time= 0.01 sec, 572 directives.
 Default parameters read. Elapsed time= 0.15 sec

 Checking input...
 Passed
1


                                         ***  PROGRAM SYSTEM MOLPRO  ***
                                       Copyright, TTI GmbH Stuttgart, 2015
                                    Version 2015.1 linked Sep  7 2016 23:09:38


 **********************************************************************************************************************************
 LABEL *   Al                                                                            
  64 bit serial version                                                                  DATE: 05-Oct-18          TIME: 10:58:38  
 **********************************************************************************************************************************

 SHA1:             2873118e99aab1bc19f5b6fc1784693c06d15c95
 **********************************************************************************************************************************

 THRESHOLDS:

 ZERO    =  1.00D-12  ONEINT  =  1.00D-12  TWOINT  =  1.00D-12  PREFAC  =  1.00D-14  LOCALI  =  1.00D-09  EORDER  =  1.00D-04
 ENERGY  =  0.00D+00  ETEST   =  0.00D+00  EDENS   =  0.00D+00  THRDEDEF=  1.00D-06  GRADIENT=  1.00D-02  STEP    =  1.00D-03
 ORBITAL =  1.00D-05  CIVEC   =  1.00D-05  COEFF   =  1.00D-04  PRINTCI =  5.00D-02  PUNCHCI =  9.90D+01  OPTGRAD =  3.00D-04
 OPTENERG=  1.00D-06  OPTSTEP =  3.00D-04  THRGRAD =  1.00D-10  COMPRESS=  1.00D-11  VARMIN  =  1.00D-07  VARMAX  =  1.00D-03
 THRDOUB =  0.00D+00  THRDIV  =  1.00D-05  THRRED  =  1.00D-07  THRPSP  =  1.00D+00  THRDC   =  1.00D-10  THRCS   =  1.00D-10
 THRNRM  =  1.00D-08  THREQ   =  0.00D+00  THRDE   =  1.00D+00  THRREF  =  1.00D-05  SPARFAC =  1.00D+00  THRDLP  =  1.00D-07
 THRDIA  =  1.00D-10  THRDLS  =  1.00D-07  THRGPS  =  0.00D+00  THRKEX  =  0.00D+00  THRDIS  =  2.00D-01  THRVAR  =  1.00D-10
 THRLOC  =  1.00D-06  THRGAP  =  1.00D-06  THRLOCT = -1.00D+00  THRGAPT = -1.00D+00  THRORB  =  1.00D-06  THRMLTP =  0.00D+00
 THRCPQCI=  1.00D-10  KEXTA   =  0.00D+00  THRCOARS=  0.00D+00  SYMTOL  =  1.00D-06  GRADTOL =  1.00D-06  THROVL  =  1.00D-08
 THRORTH =  1.00D-08  GRID    =  1.00D-06  GRIDMAX =  1.00D-03  DTMAX   =  0.00D+00  THROCCDE=  1.00D-01  THROCCDE=  1.00D-01



 ZUNIT=ANG
 

Geometry recognized as XYZ


 Variable memory set to 8000000000 words,  buffer space   230000 words

 SETTING BASIS          =    USERDEF


 Recomputing integrals since basis changed


 Using spherical harmonics



 PROGRAM * SEWARD (Integral evaluation for generally contracted gaussian basis sets)     Author: Roland Lindh, 1990

 Geometry written to block  1 of record 700

 Orientation using atomic masses  
 Molecule type: Atom
 Symmetry elements: X,Y,Z
 Rotational constants:       0.0000000      0.0000000      0.0000000 GHz  (calculated with average atomic masses)

 Point group  D2h 



 ATOMIC COORDINATES

 NR  ATOM    CHARGE       X              Y              Z

   1  AL      3.00    0.000000000    0.000000000    0.000000000


          AL  CORE POTENTIAL

          d POTENTIAL

 POWERS             1              3              2
 EXPONENTIALS   5.073893       8.607001       3.027490    
 COEFFICIENTS   3.000000       15.22168      -11.16568    

          s - d POTENTIAL

 POWERS             2              2
 EXPONENTIALS   7.863954       2.061358    
 COEFFICIENTS   14.87951       20.74686    

          p - d POTENTIAL

 POWERS             2              2
 EXPONENTIALS   3.125175       1.414930    
 COEFFICIENTS   7.786227       7.109015    


 BASIS DATA

   Nr Sym  Nuc  Type         Exponents   Contraction coefficients

    1.1 Ag    1  1s           8.257944     0.003287
                              4.514245    -0.017168
                              2.467734     0.069766
                              1.348998    -0.183475
                              0.737436    -0.147133
                              0.403123     0.046882
                              0.220369     0.308423
                              0.120466     0.451564
                              0.065853     0.302904
                              0.035999     0.079545
    2.1 Ag    1  1s           0.347290     1.000000
    3.1 Ag    1  1s           0.142082     1.000000
    4.1 Ag    1  1s           0.058128     1.000000
    5.1 Ag    1  1s           0.025443     1.000000
    6.1 Ag    1  3d0          0.641818     1.000000
    7.1 Ag    1  3d2+         0.641818     1.000000
    8.1 Ag    1  3d0          0.240140     1.000000
    9.1 Ag    1  3d2+         0.240140     1.000000
   10.1 Ag    1  3d0          0.089850     1.000000
   11.1 Ag    1  3d2+         0.089850     1.000000
   12.1 Ag    1  3d0          0.032712     1.000000
   13.1 Ag    1  3d2+         0.032712     1.000000
   14.1 Ag    1  5g0          0.351808     1.000000
   15.1 Ag    1  5g4+         0.351808     1.000000
   16.1 Ag    1  5g2+         0.351808     1.000000
   17.1 Ag    1  5g0          0.147657     1.000000
   18.1 Ag    1  5g4+         0.147657     1.000000
   19.1 Ag    1  5g2+         0.147657     1.000000
    1.2 B3u   1  2px          1.570603    -0.002645
                              0.977752    -0.037850
                              0.608683     0.006636
                              0.378925     0.089291
                              0.235893     0.134421
                              0.146851     0.256105
                              0.091420     0.238970
                              0.056912     0.260677
                              0.035429     0.112350
                              0.022056     0.052665
    2.2 B3u   1  2px          0.868497     1.000000
    3.2 B3u   1  2px          0.350263     1.000000
    4.2 B3u   1  2px          0.141260     1.000000
    5.2 B3u   1  2px          0.058377     1.000000
    6.2 B3u   1  4f1+         0.407281     1.000000
    7.2 B3u   1  4f3+         0.407281     1.000000
    8.2 B3u   1  4f1+         0.159215     1.000000
    9.2 B3u   1  4f3+         0.159215     1.000000
   10.2 B3u   1  4f1+         0.061594     1.000000
   11.2 B3u   1  4f3+         0.061594     1.000000
    1.3 B2u   1  2py          1.570603    -0.002645
                              0.977752    -0.037850
                              0.608683     0.006636
                              0.378925     0.089291
                              0.235893     0.134421
                              0.146851     0.256105
                              0.091420     0.238970
                              0.056912     0.260677
                              0.035429     0.112350
                              0.022056     0.052665
    2.3 B2u   1  2py          0.868497     1.000000
    3.3 B2u   1  2py          0.350263     1.000000
    4.3 B2u   1  2py          0.141260     1.000000
    5.3 B2u   1  2py          0.058377     1.000000
    6.3 B2u   1  4f1-         0.407281     1.000000
    7.3 B2u   1  4f3-         0.407281     1.000000
    8.3 B2u   1  4f1-         0.159215     1.000000
    9.3 B2u   1  4f3-         0.159215     1.000000
   10.3 B2u   1  4f1-         0.061594     1.000000
   11.3 B2u   1  4f3-         0.061594     1.000000
    1.4 B1g   1  3d2-         0.641818     1.000000
    2.4 B1g   1  3d2-         0.240140     1.000000
    3.4 B1g   1  3d2-         0.089850     1.000000
    4.4 B1g   1  3d2-         0.032712     1.000000
    5.4 B1g   1  5g2-         0.351808     1.000000
    6.4 B1g   1  5g4-         0.351808     1.000000
    7.4 B1g   1  5g2-         0.147657     1.000000
    8.4 B1g   1  5g4-         0.147657     1.000000
    1.5 B1u   1  2pz          1.570603    -0.002645
                              0.977752    -0.037850
                              0.608683     0.006636
                              0.378925     0.089291
                              0.235893     0.134421
                              0.146851     0.256105
                              0.091420     0.238970
                              0.056912     0.260677
                              0.035429     0.112350
                              0.022056     0.052665
    2.5 B1u   1  2pz          0.868497     1.000000
    3.5 B1u   1  2pz          0.350263     1.000000
    4.5 B1u   1  2pz          0.141260     1.000000
    5.5 B1u   1  2pz          0.058377     1.000000
    6.5 B1u   1  4f0          0.407281     1.000000
    7.5 B1u   1  4f2+         0.407281     1.000000
    8.5 B1u   1  4f0          0.159215     1.000000
    9.5 B1u   1  4f2+         0.159215     1.000000
   10.5 B1u   1  4f0          0.061594     1.000000
   11.5 B1u   1  4f2+         0.061594     1.000000
    1.6 B2g   1  3d1+         0.641818     1.000000
    2.6 B2g   1  3d1+         0.240140     1.000000
    3.6 B2g   1  3d1+         0.089850     1.000000
    4.6 B2g   1  3d1+         0.032712     1.000000
    5.6 B2g   1  5g1+         0.351808     1.000000
    6.6 B2g   1  5g3+         0.351808     1.000000
    7.6 B2g   1  5g1+         0.147657     1.000000
    8.6 B2g   1  5g3+         0.147657     1.000000
    1.7 B3g   1  3d1-         0.641818     1.000000
    2.7 B3g   1  3d1-         0.240140     1.000000
    3.7 B3g   1  3d1-         0.089850     1.000000
    4.7 B3g   1  3d1-         0.032712     1.000000
    5.7 B3g   1  5g1-         0.351808     1.000000
    6.7 B3g   1  5g3-         0.351808     1.000000
    7.7 B3g   1  5g1-         0.147657     1.000000
    8.7 B3g   1  5g3-         0.147657     1.000000
    1.8 Au    1  4f2-         0.407281     1.000000
    2.8 Au    1  4f2-         0.159215     1.000000
    3.8 Au    1  4f2-         0.061594     1.000000

 NUCLEAR CHARGE:                    3
 NUMBER OF PRIMITIVE AOS:         140
 NUMBER OF SYMMETRY AOS:          115
 NUMBER OF CONTRACTIONS:           79   (  19Ag  +  11B3u +  11B2u +   8B1g +  11B1u +   8B2g +   8B3g +   3Au  )
 NUMBER OF CORE ORBITALS:           0   (   0Ag  +   0B3u +   0B2u +   0B1g +   0B1u +   0B2g +   0B3g +   0Au  )
 NUMBER OF VALENCE ORBITALS:        4   (   1Ag  +   1B3u +   1B2u +   0B1g +   1B1u +   0B2g +   0B3g +   0Au  )


 NUCLEAR REPULSION ENERGY    0.00000000

 EXTRA SYMMETRY OF AOS IN SYMMETRY 1:   1 1 1 1 1 2 3 2 3 2   3 2 3 4 5 6 4 5 6
 EXTRA SYMMETRY OF AOS IN SYMMETRY 2:   1 1 1 1 1 2 3 2 3 2   3
 EXTRA SYMMETRY OF AOS IN SYMMETRY 3:   1 1 1 1 1 2 3 2 3 2   3
 EXTRA SYMMETRY OF AOS IN SYMMETRY 4:   1 1 1 1 2 3 2 3
 EXTRA SYMMETRY OF AOS IN SYMMETRY 5:   1 1 1 1 1 2 3 2 3 2   3
 EXTRA SYMMETRY OF AOS IN SYMMETRY 6:   1 1 1 1 2 3 2 3
 EXTRA SYMMETRY OF AOS IN SYMMETRY 7:   1 1 1 1 2 3 2 3

 Eigenvalues of metric

         1 0.383E-02 0.191E-01 0.110E+00 0.110E+00 0.170E+00 0.395E+00 0.395E+00 0.395E+00
         2 0.155E-02 0.405E-01 0.210E+00 0.210E+00 0.244E+00 0.829E+00 0.829E+00 0.115E+01
         3 0.155E-02 0.405E-01 0.210E+00 0.210E+00 0.244E+00 0.829E+00 0.829E+00 0.115E+01
         4 0.110E+00 0.395E+00 0.395E+00 0.424E+00 0.117E+01 0.160E+01 0.160E+01 0.229E+01
         5 0.155E-02 0.405E-01 0.210E+00 0.210E+00 0.244E+00 0.829E+00 0.829E+00 0.115E+01
         6 0.110E+00 0.395E+00 0.395E+00 0.424E+00 0.117E+01 0.160E+01 0.160E+01 0.229E+01
         7 0.110E+00 0.395E+00 0.395E+00 0.424E+00 0.117E+01 0.160E+01 0.160E+01 0.229E+01
         8 0.210E+00 0.829E+00 0.196E+01


 Contracted 2-electron integrals neglected if value below      1.0D-12
 AO integral compression algorithm  1   Integral accuracy      1.0D-12

     6.029 MB (compressed) written to integral file ( 61.3%)


 NUMBER OF SORTED TWO-ELECTRON INTEGRALS:     665704.     BUFFER LENGTH:  32768
 NUMBER OF SEGMENTS:   1  SEGMENT LENGTH:     665704      RECORD LENGTH: 524288

 Memory used in sort:       1.22 MW

 SORT1 READ     1222209. AND WROTE      500866. INTEGRALS IN      2 RECORDS. CPU TIME:     0.03 SEC, REAL TIME:     0.07 SEC
 SORT2 READ      500866. AND WROTE      665704. INTEGRALS IN     23 RECORDS. CPU TIME:     0.06 SEC, REAL TIME:     0.11 SEC

 FILE SIZES:   FILE 1:    25.3 MBYTE,  FILE 4:     8.4 MBYTE,   TOTAL:     33.7 MBYTE

 OPERATOR DM      FOR CENTER  0  COORDINATES:    0.000000    0.000000    0.000000
 OPERATOR EKIN    FOR CENTER  0  COORDINATES:    0.000000    0.000000    0.000000
 OPERATOR POT     FOR CENTER  0  COORDINATES:    0.000000    0.000000    0.000000


 **********************************************************************************************************************************
 DATASETS  * FILE   NREC   LENGTH (MB)   RECORD NAMES
              1      20       22.50       500      610      700      900      950      970     1000      129      960     1100   
                                          VAR    BASINP    GEOM    SYMINP    ZMAT    AOBASIS   BASIS     P2S    ABASIS      S 
                                         1400     1410     1420     1200     1210     1080     1600     1650     1300     1700   
                                         EKIN       V       ECP      H0       H01     AOSYM     SMH    MOLCAS    ERIS     OPER   

 PROGRAMS   *        TOTAL       INT
 CPU TIMES  *         2.51      2.37
 REAL TIME  *        13.59 SEC
 DISK USED  *        33.97 MB      
 **********************************************************************************************************************************


 PROGRAM * RHF-SCF (OPEN SHELL)       Authors: W. Meyer, H.-J. Werner


 NUMBER OF ELECTRONS:       2+    1-    SPACE SYMMETRY=2    SPIN SYMMETRY: Doublet 
 CONVERGENCE THRESHOLDS:    1.00E-05 (Density)    1.00E-07 (Energy)
 MAX. NUMBER OF ITERATIONS:       60
 INTERPOLATION TYPE:            DIIS
 INTERPOLATION STEPS:              2 (START)      1 (STEP)
 LEVEL SHIFTS:                 -0.60 (CLOSED) -0.30 (OPEN) 

 Number of closed-shell orbitals:    1 (   1   0   0   0   0   0   0   0 )
 Number of open-shell orbitals:      1 (   0   1   0   0   0   0   0   0 )



   Atom=AL basis=ECP10MWB_GUESS    lmin=0  lmax=1

 Orbital guess generated from atomic densities. Full valence occupancy:    1   1   1   0   1   0   0   0


 Molecular orbital dump at record        2100.2

 ITERATION    DDIFF          GRAD             ENERGY        2-EL.EN.            DIPOLE MOMENTS         DIIS   ORB.
    1      0.000D+00      0.000D+00        -1.86961151      1.652909    0.00000    0.00000    0.00000    0    start
    2      0.000D+00      0.421D-02        -1.87335206      1.691121    0.00000    0.00000    0.00000    1    diag,B
    3      0.196D+00      0.255D-02        -1.87622061      1.735686    0.00000    0.00000    0.00000    2    diag,B
    4      0.218D+00      0.121D-02        -1.87703313      1.756254    0.00000    0.00000    0.00000    3    diag,B
    5      0.113D+00      0.407D-03        -1.87708527      1.758268    0.00000    0.00000    0.00000    4    diag,B
    6      0.185D-01      0.133D-03        -1.87708980      1.759016    0.00000    0.00000    0.00000    5    diag,B
    7      0.484D-02      0.389D-04        -1.87709008      1.758842    0.00000    0.00000    0.00000    6    fixocc
    8      0.293D-03      0.104D-04        -1.87709009      1.758933    0.00000    0.00000    0.00000    7    diag,B
    9      0.103D-03      0.185D-05        -1.87709009      1.758930    0.00000    0.00000    0.00000    8    diag,B
   10      0.283D-04      0.479D-06        -1.87709009      1.758927    0.00000    0.00000    0.00000    9    orth
   11      0.249D-04      0.207D-06        -1.87709009      1.758928    0.00000    0.00000    0.00000    9    diag,B
   12      0.982D-06      0.532D-07        -1.87709009      1.758928    0.00000    0.00000    0.00000    0    orth

 Final alpha occupancy:   1   1   0   0   0   0   0   0
 Final beta  occupancy:   1   0   0   0   0   0   0   0

 !RHF STATE 1.2 Energy                 -1.877090093371
 Nuclear energy                         0.00000000
 One-electron energy                   -2.75655401
 Two-electron energy                    0.87946392
 Virial quotient                       -2.92513701
 !RHF STATE 1.2 Dipole moment           0.00000000     0.00000000     0.00000000
 Dipole moment /Debye                   0.00000000     0.00000000     0.00000000
 

 !RHF expec          <1.2|EKIN|1.2>     0.641710144874
 
 !RHF expec           <1.2|POT|1.2>    -1.245924025950

 ELECTRON ORBITALS
 =================


   Orb  Occ    Energy  Couls-En    Coefficients

                                   1 1s      1 1s      1 1s      1 1s      1 1s      1 3d0     1 3d2+    1 3d0     1 3d2+    1 3d0  
                                   1 3d2+    1 3d0     1 3d2+    1 5g0     1 5g4+    1 5g2+    1 5g0     1 5g4+    1 5g2+ 

   1.1   2    -0.3939   -1.4017  1.000015 -0.000125  0.000542 -0.000677  0.000194 -0.000316  0.000547  0.001143 -0.001980 -0.004225
                                 0.007318 -0.001873  0.003244  0.000004  0.000009 -0.000007 -0.000050 -0.000099  0.000075

                                   1 2px     1 2px     1 2px     1 2px     1 2px     1 4f1+    1 4f3+    1 4f1+    1 4f3+    1 4f1+ 
                                   1 4f3+ 

   1.2   +    -0.2098   -0.9507  1.000480  0.000032 -0.000074 -0.000557  0.000095  0.000045 -0.000059  0.000101 -0.000131 -0.000140
                                 0.000180

 HOMO      1.2    -0.209800 =      -5.7090eV
 LUMO      1.3     0.010781 =       0.2934eV
 LUMO-HOMO         0.220582 =       6.0023eV


 **********************************************************************************************************************************
 DATASETS  * FILE   NREC   LENGTH (MB)   RECORD NAMES
              1      20       22.50       500      610      700      900      950      970     1000      129      960     1100   
                                          VAR    BASINP    GEOM    SYMINP    ZMAT    AOBASIS   BASIS     P2S    ABASIS      S 
                                         1400     1410     1420     1200     1210     1080     1600     1650     1300     1700   
                                         EKIN       V       ECP      H0       H01     AOSYM     SMH    MOLCAS    ERIS     OPER   

              2       4        2.78       700     1000      520     2100   
                                         GEOM     BASIS   MCVARS     RHF  

 PROGRAMS   *        TOTAL        HF       INT
 CPU TIMES  *         2.60      0.09      2.37
 REAL TIME  *        14.14 SEC
 DISK USED  *        33.97 MB      
 **********************************************************************************************************************************
 SETTING SCF(I)         =        -1.87709009  AU                              
 SETTING _CC_NORM_MAX   =         2.00000000                                  


 PROGRAM * UHF-SCF       Authors: W. Meyer, H.-J. Werner


 NUMBER OF ELECTRONS:       2+    1-    SPACE SYMMETRY=2    SPIN SYMMETRY: Doublet 
 CONVERGENCE THRESHOLDS:    1.00E-05 (Density)    1.00E-07 (Energy)
 MAX. NUMBER OF ITERATIONS:        0
 INTERPOLATION TYPE:            DIIS
 INTERPOLATION STEPS:              2 (START)      1 (STEP)
 LEVEL SHIFTS:                  0.20 (ALPHA)   0.20 (BETA) 

 Number of closed-shell orbitals:    1 (   1   0   0   0   0   0   0   0 )
 Number of open-shell orbitals:      1 (   0   1   0   0   0   0   0   0 )


 Molecular orbitals read from record     2100.2  Type=RHF/CANONICAL (state 1.2)

 Molecular orbital dump at record        2200.2

 Initial alpha occupation   1   1   0   0   0   0   0   0
 Initial beta  occupation   1   0   0   0   0   0   0   0

 ITERATION    DDIFF          GRAD             ENERGY        2-EL.EN.            DIPOLE MOMENTS         DIIS
    1      0.000D+00      0.000D+00        -1.87709009      1.758928    0.00000    0.00000    0.00000    0
 
 Final alpha occupancy:   1   1   0   0   0   0   0   0
 Final beta  occupancy:   1   0   0   0   0   0   0   0

 !UHF STATE 1.2 Energy                 -1.877090093371
 Nuclear energy                         0.00000000
 One-electron energy                   -2.75655401
 Two-electron energy                    0.87946392
 Virial quotient                       -2.92513701
 !UHF STATE 1.2 Dipole moment           0.00000000     0.00000000     0.00000000
 Dipole moment /Debye                   0.00000000     0.00000000     0.00000000
 

 !UHF expec          <1.2|EKIN|1.2>     0.641710144874
 
 !UHF expec           <1.2|POT|1.2>    -1.245924025950

 ELECTRON ORBITALS FOR POSITIVE SPIN
 ===================================


   Orb  Occ    Energy  Couls-En    Coefficients

                                   1 1s      1 1s      1 1s      1 1s      1 1s      1 3d0     1 3d2+    1 3d0     1 3d2+    1 3d0  
                                   1 3d2+    1 3d0     1 3d2+    1 5g0     1 5g4+    1 5g2+    1 5g0     1 5g4+    1 5g2+ 

   1.1   +    -0.3939   -1.4017  1.000015 -0.000125  0.000542 -0.000677  0.000194 -0.000316  0.000547  0.001143 -0.001980 -0.004225
                                 0.007318 -0.001873  0.003244  0.000004  0.000009 -0.000007 -0.000050 -0.000099  0.000075

                                   1 2px     1 2px     1 2px     1 2px     1 2px     1 4f1+    1 4f3+    1 4f1+    1 4f3+    1 4f1+ 
                                   1 4f3+ 

   1.2   +    -0.2098   -0.9507  1.000480  0.000032 -0.000074 -0.000557  0.000095  0.000045 -0.000059  0.000101 -0.000131 -0.000140
                                 0.000180

 ELECTRON ORBITALS FOR NEGATIVE SPIN
 ===================================


   Orb  Occ    Energy  Couls-En    Coefficients

                                   1 1s      1 1s      1 1s      1 1s      1 1s      1 3d0     1 3d2+    1 3d0     1 3d2+    1 3d0  
                                   1 3d2+    1 3d0     1 3d2+    1 5g0     1 5g4+    1 5g2+    1 5g0     1 5g4+    1 5g2+ 

   1.1   -    -0.3939   -1.4017  1.000015 -0.000125  0.000542 -0.000677  0.000194 -0.000316  0.000547  0.001143 -0.001980 -0.004225
                                 0.007318 -0.001873  0.003244  0.000004  0.000009 -0.000007 -0.000050 -0.000099  0.000075

 HOMO      1.2    -0.209800 =      -5.7090eV
 LUMO     -1.2    -0.209800 =      -5.7090eV
 LUMO-HOMO         0.000000 =       0.0000eV

 EXPECTATION VALUE OF S**2:             0.75000000

 Occupation number threshold for canonical orbitals:  1.999000 (occupied),  0.001000 (virtual)

 Number of pseudo-canonical orbitals per symmetry:    1   0   0   0   0   0   0   0
 Number of active natural orbitals per symmetry:      0   1   0   0   0   0   0   0

 NATURAL CHARGE ORBITALS
 =======================


   Orb     Occ        Energy       Coefficients

                                   1 1s      1 1s      1 1s      1 1s      1 1s      1 3d0     1 3d2+    1 3d0     1 3d2+    1 3d0  
                                   1 3d2+    1 3d0     1 3d2+    1 5g0     1 5g4+    1 5g2+    1 5g0     1 5g4+    1 5g2+ 

   1.1  2.00000    -0.393913     1.000015 -0.000125  0.000542 -0.000677  0.000194 -0.000316  0.000547  0.001143 -0.001980 -0.004225
                                 0.007318 -0.001873  0.003244  0.000004  0.000009 -0.000007 -0.000050 -0.000099  0.000075

                                   1 2px     1 2px     1 2px     1 2px     1 2px     1 4f1+    1 4f3+    1 4f1+    1 4f3+    1 4f1+ 
                                   1 4f3+ 

   1.2  1.00000    -0.067100     1.000480  0.000032 -0.000074 -0.000557  0.000095  0.000045 -0.000059  0.000101 -0.000131 -0.000140
                                 0.000180

 Natural orbitals saved to record    2200.2 (Orbital set 3)

 Orbital spaces for UNO-CAS (Min. occupation: 0.020  Max. occupation: 1.980):

 Closed:        1   0   0   0   0   0   0   0
 Active:        0   1   0   0   0   0   0   0

 No convergence



 **********************************************************************************************************************************
 DATASETS  * FILE   NREC   LENGTH (MB)   RECORD NAMES
              1      20       22.50       500      610      700      900      950      970     1000      129      960     1100   
                                          VAR    BASINP    GEOM    SYMINP    ZMAT    AOBASIS   BASIS     P2S    ABASIS      S 
                                         1400     1410     1420     1200     1210     1080     1600     1650     1300     1700   
                                         EKIN       V       ECP      H0       H01     AOSYM     SMH    MOLCAS    ERIS     OPER   

              2       5        5.33       700     1000      520     2100     2200   
                                         GEOM     BASIS   MCVARS     RHF      UHF  

 PROGRAMS   *        TOTAL       UHF        HF       INT
 CPU TIMES  *         2.61      0.01      0.09      2.37
 REAL TIME  *        14.37 SEC
 DISK USED  *        33.97 MB      
 **********************************************************************************************************************************
 SETTING SCF(I)         =        -1.87709009  AU                              


 PROGRAM * MRCC (General Multireference Coupled Cluster)    Author: M. Kallay, 2000-2005

 ***  Initialisation ***

   0 Spin projections
 
 Molecular orbitals read from record     2200.2  Type=UHF/ALPHA (state 1.2)

 ?Warning: UHF not converged
 Molecular orbitals read from record     2200.2  Type=UHF/BETA (state 1.2)

 ?Warning: UHF not converged
 
 Frozen orbitals:              0 (  0  0  0  0  0  0  0  0)
 Active orbitals:             79 ( 19 11 11  8 11  8  8  3)
 Active electrons:             3
 Spin quantum number:          0.5

 Transformed integrals will be written to file mrcc_27432/fort.55

 Load integrals                2.6 sec
 Transform integrals           3.0 sec
 Storage for integrals:        3835052
 Remaining memory:           *********

 Core energy:               0.00000000
 
 MRCC Input:
     4     0     0     0     3     0     0     2     0     0     0     1     1     0     0     7     0     0   0.000     0   64000
  ex.lev,nsing,ntrip, rest,method,dens,conver,symm, diag, CS ,spatial, HF, ndoub,nacto,nactv, tol, maxex, sacc, freq,  dboc,   mem
  2  0  0  0  0  0  0  0  0  0  0  0  0  0  0  0  0  0  0  1  0  0  0  0  0  0  0  0  0  0  0  0  0  0  0  0  0  0  0  0  0  0  0  0  0  0  0  0  0  0  0  0  0  0  0  0  0  0  0  0  0  0  0  0  0  0  0  0  0  0  0  0  0  0  0  0  0  0  0
 MRCC Input end
 Variable memory released
 MRCC now being run, temporary output in /global/cscratch1/sd/aannabe/mrcc_27432/mrcc.out
 **********************************************************************
                          MRCC program system
 **********************************************************************

                              Written by
  Mihaly Kallay, Zoltan Rolik, Jozsef Csontos, Peter Nagy, Gyula Samu,
      David Mester, Jozsef Csoka, Bernat Szabo, Istvan Ladjanszki,
       Lorant Szegedy, Bence Ladoczki, Klara Petrov, Mate Farkas,
                    Pal D. Mezei, and Bence Hegely

        Department of Physical Chemistry and Materials Science
            Budapest University of Technology and Economics
                  Budapest P.O.Box 91, H-1521 Hungary

                              www.mrcc.hu

                       Release date: May 23, 2018

 ************************ 2018-10-05 10:59:52 *************************
 Executing goldstone...

 Generation of CC equations in terms of H and T...
 Generation of antisymmetrized Goldstone diagrams...
 Number of diagrams in T^1 equations:    15
 Number of diagrams in T^2 equations:    33
 Number of diagrams in T^3 equations:     2
 Translation of diagrams to factorized equations...
 Optimizing intermediate calculation...
 Number of floating-point operations per iteration step:   3.9506E+07
 Probable CPU time per iteration step (hours):      0.00
 Required memory (Mbytes):    4701.1
 Number of intermediates:                                  48
 Number of intermediates to be stored:                     20
 Length of intermediate file (Mbytes):      73.5

 ************************ 2018-10-05 10:59:52 *************************
 Executing xmrcc...

 **********************************************************************
 CC(2)(3) calculation


 Allocation of4701.1 Mbytes of memory...
 Number of spinorbitals:                   158
 Number of alpha electrons:                        2
 Number of beta electrons:                         1
 Spin multiplicity:                     2
 z-component of spin:  0.5
 Spatial symmetry:                      2
 Convergence criterion:  1.0E-07
 Construction of occupation graphs...
 Number of                     0 -fold excitations:                      1
 Number of                     1 -fold excitations:                     46
 Number of                     2 -fold excitations:                   2035
 Total number of configurations:                   2082
 Calculation of coupling coefficients...
 Length of intermediate file (Mbytes):      56.0

 ======================================================================

 Spin case  1   Alpha:  2   Beta:  1
 Number of excitations:                  28704
 Number of                     3 -fold excitations:                  28704

 Memory requirements /Mbyte/:
               Minimal        Optimal
 Real*8:         35.6078       297.2647
 Integer:         4.1237
 Total:          39.7315       301.3884


 ************************ 2018-10-05 10:59:53 *************************
 Executing mrcc...

 **********************************************************************
 CCSDT(T) calculation


 OpenMP parallel version is running.
 Number of CPUs:   1
 Allocation of  297.3 Mbytes of memory...
 Number of spinorbitals: 158
 Number of alpha electrons:  2
 Number of beta  electrons:  1
 Spin multiplicity: 2
 z-component of spin:  0.5
 Spatial symmetry: 2
 Convergence criterion:  1.0E-07
 Construction of occupation graphs...
 Number of 0-fold excitations: 1
 Number of 1-fold excitations: 46
 Number of 2-fold excitations: 2035
 Total number of determinants: 2082
 Calculation of coupling coefficients...
 Initial cluster amplitudes are generated.
 Length of intermediate file (Mbytes):      56.0
 Reading integral list from unit 55...
 Sorting integrals...
 Sorting integrals...
 Sorting integrals...
 Sorting integrals...
 Energy of reference determinant [au]:      -1.877090093371
 Calculation of MP denominators...

 Starting CC iteration...
 ======================================================================
 Norm of residual vector:     0.25743324
 CPU time [min]:     0.142                   Wall time [min]:     0.143

 Iteration  1  CC energy:    -1.92223272  Energy decrease:   0.04514263
 ======================================================================
 Norm of residual vector:     0.06534232
 CPU time [min]:     0.182                   Wall time [min]:     0.183

 Iteration  2  CC energy:    -1.93122105  Energy decrease:   0.00898833
 ======================================================================
 Norm of residual vector:     0.02048030
 CPU time [min]:     0.222                   Wall time [min]:     0.223

 Iteration  3  CC energy:    -1.93450970  Energy decrease:   0.00328865
 ======================================================================
 Norm of residual vector:     0.00569978
 CPU time [min]:     0.263                   Wall time [min]:     0.263

 Iteration  4  CC energy:    -1.93477418  Energy decrease:   0.00026448
 ======================================================================
 Norm of residual vector:     0.00131252
 CPU time [min]:     0.303                   Wall time [min]:     0.304

 Iteration  5  CC energy:    -1.93482772  Energy decrease:   0.00005353
 ======================================================================
 Norm of residual vector:     0.00031881
 CPU time [min]:     0.344                   Wall time [min]:     0.344

 Iteration  6  CC energy:    -1.93481862  Energy decrease:   0.00000910
 ======================================================================
 Norm of residual vector:     0.00006567
 CPU time [min]:     0.384                   Wall time [min]:     0.385

 Iteration  7  CC energy:    -1.93482089  Energy decrease:   0.00000227
 ======================================================================
 Norm of residual vector:     0.00001607
 CPU time [min]:     0.425                   Wall time [min]:     0.425

 Iteration  8  CC energy:    -1.93482066  Energy decrease:   0.00000023
 ======================================================================
 Norm of residual vector:     0.00000454
 CPU time [min]:     0.465                   Wall time [min]:     0.465

 Iteration  9  CC energy:    -1.93482062  Energy decrease:   0.00000004
 ======================================================================
 Norm of residual vector:     0.00000114
 CPU time [min]:     0.506                   Wall time [min]:     0.506

 Iteration 10  CC energy:    -1.93482064  Energy decrease:   0.00000002
 ======================================================================
 Norm of residual vector:     0.00000028
 CPU time [min]:     0.546                   Wall time [min]:     0.547

 Iteration 11  CC energy:    -1.93482062  Energy decrease:   0.00000001
 ======================================================================
 Norm of residual vector:     0.00000008
 CPU time [min]:     0.587                   Wall time [min]:     0.587

 Iteration 12  CC energy:    -1.93482062  Energy decrease:   1.1220E-09
 ======================================================================

 Iteration has converged in 12 steps.

 Final results:
 Total CCSDT energy [au]:             -1.934820623379
 Total MP2 energy [au]:               -1.922232721466

 Perturbative corrections are calculated...
 ======================================================================
 Spin case  1   Alpha:  2   Beta:  1
 Number of excitations:        28704
 CPU time [min]:     0.603                   Wall time [min]:     0.604
 ======================================================================
 Number of 3-fold excitations: 28704
 CPU time [min]:     0.603                   Wall time [min]:     0.604

 Total CCSD[T] energy [au]:           -1.936346319078
 Total CCSD(T) energy [au]:           -1.936374613710

 ************************ 2018-10-05 11:00:30 *************************
                      Normal termination of mrcc.
 **********************************************************************
 !CCSDT STATE 1.2 Energy               -1.934820623379
 !MP2 STATE 1.2 Energy                 -1.922232721466
 !CCSD[T] STATE 1.2 Energy             -1.936346319078
 !CCSD(T) STATE 1.2 Energy             -1.936374613710
 
 CPU-time for MRCC:             36.2 sec
 Elapsed-time for MRCC:         40.5 sec

 Variable memory set to 8000000000 words,  buffer space   230000 words



 **********************************************************************************************************************************
 DATASETS  * FILE   NREC   LENGTH (MB)   RECORD NAMES
              1      20       22.50       500      610      700      900      950      970     1000      129      960     1100   
                                          VAR    BASINP    GEOM    SYMINP    ZMAT    AOBASIS   BASIS     P2S    ABASIS      S 
                                         1400     1410     1420     1200     1210     1080     1600     1650     1300     1700   
                                         EKIN       V       ECP      H0       H01     AOSYM     SMH    MOLCAS    ERIS     OPER   

              2       5        5.33       700     1000      520     2100     2200   
                                         GEOM     BASIS   MCVARS     RHF      UHF  

 PROGRAMS   *        TOTAL      MRCC       UHF        HF       INT
 CPU TIMES  *        48.77     46.16      0.01      0.09      2.37
 REAL TIME  *       113.13 SEC
 DISK USED  *        33.97 MB      
 **********************************************************************************************************************************
 SETTING POSTHF(I)      =        -1.93637461  AU                              
                                                                                                                                                                                                                                                                

       SCF           POSTHF       EKIN          POT
    -1.87709009   -1.93637461   0.64171014   -1.24592403
                                                  

 CCSD(T)/USERDEF energy=     -1.936374613710

        CCSD(T)         HF-SCF  
     -1.93637461     -1.87709009
 **********************************************************************************************************************************
 Variable memory released
