
 Primary working directories    : /global/cscratch1/sd/aannabe
 Secondary working directories  : /global/cscratch1/sd/aannabe
 Wavefunction directory         : /global/homes/a/aannabe/wfu/
 Main file repository           : /global/cscratch1/sd/aannabe/

 SHA1      : 2873118e99aab1bc19f5b6fc1784693c06d15c95
 NAME      : 2015.1.8
 ARCHNAME  : linux/x86_64
 FC        : /opt/cray/pe/craype/2.5.5/bin/ftn
 BLASLIB   : -Wl,-_start-group /opt/intel/compilers_and_libraries_2016.3.210/linux/mkl/lib/intel64/libmkl_intel_ilp64.a /opt/intel/compilers_and_libraries_2016.3.210/linux/mkl/lib/intel64/libmkl_intel_thread.a /opt/intel/compilers_and_libraries_2016.3.210/linux/mkl/lib/intel64/libmkl_core.a -Wl,-_end-group
 id        : lbl

 Nodes     nprocs
 nid00521     1

 Using customized tuning parameters: mindgm=8; mindgv=16; mindgc=4; mindgr=1; noblas=0; minvec=7
 default implementation of scratch files=df  

 ***,Al
 memory,8,g
 gthresh,twoint=1.e-12
 
 gprint,basis,orbitals
 gexpec,ekin,pot
 
 angstrom
 geometry={
 1                                                                               ! Number of atoms
 Al 0.0 0.0 0.0
 }
 
 basis={
 Including file /global/homes/a/aannabe/docs/totals/pps/Al.pp
 Including file /global/homes/a/aannabe/docs/totals/basis/aug-cc-pVnZ/Al_5z.basis
 }
 
 {hf
 wf,3,2,1
 occ,1,1,0,0,0,0,0,0
                                                                                 !open,1.2
 closed,1,0,0,0,0,0,0,0
                                                                                 !sym,
 }
 scf(i)=energy
 
 _CC_NORM_MAX=2.0
  !NOTE: Perturbative MRCC works only with UHF reference. So, here we will trick MRCC by doing zero UHF iteration right after ROHF.
 
 {uhf
 wf,3,2,1
 occ,1,1,0,0,0,0,0,0
                                                                                 !open,1.2
 closed,1,0,0,0,0,0,0,0
                                                                                 !sym,
 maxit,0
 }
 scf(i)=energy
 
 {mrcc,method=CCSDT(Q)
 orbital,ignore_error=1                                                          !Ignore the fact that UHF WF is not converged
 maxit,100
 core
 }
 posthf(i)=energy
 
 table,scf,posthf,ekin,pot
 save,5.csv,new
 
 

 Variables initialized (889), CPU time= 0.01 sec
 Commands  initialized (702), CPU time= 0.01 sec, 572 directives.
 Default parameters read. Elapsed time= 0.33 sec

 Checking input...
 Passed
1


                                         ***  PROGRAM SYSTEM MOLPRO  ***
                                       Copyright, TTI GmbH Stuttgart, 2015
                                    Version 2015.1 linked Sep  7 2016 23:09:38


 **********************************************************************************************************************************
 LABEL *   Al                                                                            
  64 bit serial version                                                                  DATE: 05-Oct-18          TIME: 11:00:52  
 **********************************************************************************************************************************

 SHA1:             2873118e99aab1bc19f5b6fc1784693c06d15c95
 **********************************************************************************************************************************

 THRESHOLDS:

 ZERO    =  1.00D-12  ONEINT  =  1.00D-12  TWOINT  =  1.00D-12  PREFAC  =  1.00D-14  LOCALI  =  1.00D-09  EORDER  =  1.00D-04
 ENERGY  =  0.00D+00  ETEST   =  0.00D+00  EDENS   =  0.00D+00  THRDEDEF=  1.00D-06  GRADIENT=  1.00D-02  STEP    =  1.00D-03
 ORBITAL =  1.00D-05  CIVEC   =  1.00D-05  COEFF   =  1.00D-04  PRINTCI =  5.00D-02  PUNCHCI =  9.90D+01  OPTGRAD =  3.00D-04
 OPTENERG=  1.00D-06  OPTSTEP =  3.00D-04  THRGRAD =  1.00D-10  COMPRESS=  1.00D-11  VARMIN  =  1.00D-07  VARMAX  =  1.00D-03
 THRDOUB =  0.00D+00  THRDIV  =  1.00D-05  THRRED  =  1.00D-07  THRPSP  =  1.00D+00  THRDC   =  1.00D-10  THRCS   =  1.00D-10
 THRNRM  =  1.00D-08  THREQ   =  0.00D+00  THRDE   =  1.00D+00  THRREF  =  1.00D-05  SPARFAC =  1.00D+00  THRDLP  =  1.00D-07
 THRDIA  =  1.00D-10  THRDLS  =  1.00D-07  THRGPS  =  0.00D+00  THRKEX  =  0.00D+00  THRDIS  =  2.00D-01  THRVAR  =  1.00D-10
 THRLOC  =  1.00D-06  THRGAP  =  1.00D-06  THRLOCT = -1.00D+00  THRGAPT = -1.00D+00  THRORB  =  1.00D-06  THRMLTP =  0.00D+00
 THRCPQCI=  1.00D-10  KEXTA   =  0.00D+00  THRCOARS=  0.00D+00  SYMTOL  =  1.00D-06  GRADTOL =  1.00D-06  THROVL  =  1.00D-08
 THRORTH =  1.00D-08  GRID    =  1.00D-06  GRIDMAX =  1.00D-03  DTMAX   =  0.00D+00  THROCCDE=  1.00D-01  THROCCDE=  1.00D-01



 ZUNIT=ANG
 

Geometry recognized as XYZ


 Variable memory set to 8000000000 words,  buffer space   230000 words

 SETTING BASIS          =    USERDEF


 Recomputing integrals since basis changed


 Using spherical harmonics



 PROGRAM * SEWARD (Integral evaluation for generally contracted gaussian basis sets)     Author: Roland Lindh, 1990

 Geometry written to block  1 of record 700

 Orientation using atomic masses  
 Molecule type: Atom
 Symmetry elements: X,Y,Z
 Rotational constants:       0.0000000      0.0000000      0.0000000 GHz  (calculated with average atomic masses)

 Point group  D2h 



 ATOMIC COORDINATES

 NR  ATOM    CHARGE       X              Y              Z

   1  AL      3.00    0.000000000    0.000000000    0.000000000


          AL  CORE POTENTIAL

          d POTENTIAL

 POWERS             1              3              2
 EXPONENTIALS   5.073893       8.607001       3.027490    
 COEFFICIENTS   3.000000       15.22168      -11.16568    

          s - d POTENTIAL

 POWERS             2              2
 EXPONENTIALS   7.863954       2.061358    
 COEFFICIENTS   14.87951       20.74686    

          p - d POTENTIAL

 POWERS             2              2
 EXPONENTIALS   3.125175       1.414930    
 COEFFICIENTS   7.786227       7.109015    


 BASIS DATA

   Nr Sym  Nuc  Type         Exponents   Contraction coefficients

    1.1 Ag    1  1s           8.257944     0.003287
                              4.514245    -0.017168
                              2.467734     0.069766
                              1.348998    -0.183475
                              0.737436    -0.147133
                              0.403123     0.046882
                              0.220369     0.308423
                              0.120466     0.451564
                              0.065853     0.302904
                              0.035999     0.079545
    2.1 Ag    1  1s           0.967736     1.000000
    3.1 Ag    1  1s           0.379373     1.000000
    4.1 Ag    1  1s           0.148722     1.000000
    5.1 Ag    1  1s           0.058302     1.000000
    6.1 Ag    1  1s           0.024250     1.000000
    7.1 Ag    1  3d0          1.586180     1.000000
    8.1 Ag    1  3d2+         1.586180     1.000000
    9.1 Ag    1  3d0          0.603516     1.000000
   10.1 Ag    1  3d2+         0.603516     1.000000
   11.1 Ag    1  3d0          0.229628     1.000000
   12.1 Ag    1  3d2+         0.229628     1.000000
   13.1 Ag    1  3d0          0.087370     1.000000
   14.1 Ag    1  3d2+         0.087370     1.000000
   15.1 Ag    1  3d0          0.031509     1.000000
   16.1 Ag    1  3d2+         0.031509     1.000000
   17.1 Ag    1  5g0          0.535941     1.000000
   18.1 Ag    1  5g4+         0.535941     1.000000
   19.1 Ag    1  5g2+         0.535941     1.000000
   20.1 Ag    1  5g0          0.243699     1.000000
   21.1 Ag    1  5g4+         0.243699     1.000000
   22.1 Ag    1  5g2+         0.243699     1.000000
   23.1 Ag    1  5g0          0.104421     1.000000
   24.1 Ag    1  5g4+         0.104421     1.000000
   25.1 Ag    1  5g2+         0.104421     1.000000
    1.2 B3u   1  2px          1.570603    -0.002645
                              0.977752    -0.037850
                              0.608683     0.006636
                              0.378925     0.089291
                              0.235893     0.134421
                              0.146851     0.256105
                              0.091420     0.238970
                              0.056912     0.260677
                              0.035429     0.112350
                              0.022056     0.052665
    2.2 B3u   1  2px          0.951381     1.000000
    3.2 B3u   1  2px          0.456240     1.000000
    4.2 B3u   1  2px          0.218792     1.000000
    5.2 B3u   1  2px          0.104923     1.000000
    6.2 B3u   1  2px          0.046262     1.000000
    7.2 B3u   1  4f1+         0.546132     1.000000
    8.2 B3u   1  4f3+         0.546132     1.000000
    9.2 B3u   1  4f1+         0.262335     1.000000
   10.2 B3u   1  4f3+         0.262335     1.000000
   11.2 B3u   1  4f1+         0.126013     1.000000
   12.2 B3u   1  4f3+         0.126013     1.000000
   13.2 B3u   1  4f1+         0.050636     1.000000
   14.2 B3u   1  4f3+         0.050636     1.000000
   15.2 B3u   1  6h1+         0.443982     1.000000
   16.2 B3u   1  6h3+         0.443982     1.000000
   17.2 B3u   1  6h5+         0.443982     1.000000
   18.2 B3u   1  6h1+         0.216180     1.000000
   19.2 B3u   1  6h3+         0.216180     1.000000
   20.2 B3u   1  6h5+         0.216180     1.000000
    1.3 B2u   1  2py          1.570603    -0.002645
                              0.977752    -0.037850
                              0.608683     0.006636
                              0.378925     0.089291
                              0.235893     0.134421
                              0.146851     0.256105
                              0.091420     0.238970
                              0.056912     0.260677
                              0.035429     0.112350
                              0.022056     0.052665
    2.3 B2u   1  2py          0.951381     1.000000
    3.3 B2u   1  2py          0.456240     1.000000
    4.3 B2u   1  2py          0.218792     1.000000
    5.3 B2u   1  2py          0.104923     1.000000
    6.3 B2u   1  2py          0.046262     1.000000
    7.3 B2u   1  4f1-         0.546132     1.000000
    8.3 B2u   1  4f3-         0.546132     1.000000
    9.3 B2u   1  4f1-         0.262335     1.000000
   10.3 B2u   1  4f3-         0.262335     1.000000
   11.3 B2u   1  4f1-         0.126013     1.000000
   12.3 B2u   1  4f3-         0.126013     1.000000
   13.3 B2u   1  4f1-         0.050636     1.000000
   14.3 B2u   1  4f3-         0.050636     1.000000
   15.3 B2u   1  6h1-         0.443982     1.000000
   16.3 B2u   1  6h3-         0.443982     1.000000
   17.3 B2u   1  6h5-         0.443982     1.000000
   18.3 B2u   1  6h1-         0.216180     1.000000
   19.3 B2u   1  6h3-         0.216180     1.000000
   20.3 B2u   1  6h5-         0.216180     1.000000
    1.4 B1g   1  3d2-         1.586180     1.000000
    2.4 B1g   1  3d2-         0.603516     1.000000
    3.4 B1g   1  3d2-         0.229628     1.000000
    4.4 B1g   1  3d2-         0.087370     1.000000
    5.4 B1g   1  3d2-         0.031509     1.000000
    6.4 B1g   1  5g2-         0.535941     1.000000
    7.4 B1g   1  5g4-         0.535941     1.000000
    8.4 B1g   1  5g2-         0.243699     1.000000
    9.4 B1g   1  5g4-         0.243699     1.000000
   10.4 B1g   1  5g2-         0.104421     1.000000
   11.4 B1g   1  5g4-         0.104421     1.000000
    1.5 B1u   1  2pz          1.570603    -0.002645
                              0.977752    -0.037850
                              0.608683     0.006636
                              0.378925     0.089291
                              0.235893     0.134421
                              0.146851     0.256105
                              0.091420     0.238970
                              0.056912     0.260677
                              0.035429     0.112350
                              0.022056     0.052665
    2.5 B1u   1  2pz          0.951381     1.000000
    3.5 B1u   1  2pz          0.456240     1.000000
    4.5 B1u   1  2pz          0.218792     1.000000
    5.5 B1u   1  2pz          0.104923     1.000000
    6.5 B1u   1  2pz          0.046262     1.000000
    7.5 B1u   1  4f0          0.546132     1.000000
    8.5 B1u   1  4f2+         0.546132     1.000000
    9.5 B1u   1  4f0          0.262335     1.000000
   10.5 B1u   1  4f2+         0.262335     1.000000
   11.5 B1u   1  4f0          0.126013     1.000000
   12.5 B1u   1  4f2+         0.126013     1.000000
   13.5 B1u   1  4f0          0.050636     1.000000
   14.5 B1u   1  4f2+         0.050636     1.000000
   15.5 B1u   1  6h2+         0.443982     1.000000
   16.5 B1u   1  6h4+         0.443982     1.000000
   17.5 B1u   1  6h0          0.443982     1.000000
   18.5 B1u   1  6h2+         0.216180     1.000000
   19.5 B1u   1  6h4+         0.216180     1.000000
   20.5 B1u   1  6h0          0.216180     1.000000
    1.6 B2g   1  3d1+         1.586180     1.000000
    2.6 B2g   1  3d1+         0.603516     1.000000
    3.6 B2g   1  3d1+         0.229628     1.000000
    4.6 B2g   1  3d1+         0.087370     1.000000
    5.6 B2g   1  3d1+         0.031509     1.000000
    6.6 B2g   1  5g1+         0.535941     1.000000
    7.6 B2g   1  5g3+         0.535941     1.000000
    8.6 B2g   1  5g1+         0.243699     1.000000
    9.6 B2g   1  5g3+         0.243699     1.000000
   10.6 B2g   1  5g1+         0.104421     1.000000
   11.6 B2g   1  5g3+         0.104421     1.000000
    1.7 B3g   1  3d1-         1.586180     1.000000
    2.7 B3g   1  3d1-         0.603516     1.000000
    3.7 B3g   1  3d1-         0.229628     1.000000
    4.7 B3g   1  3d1-         0.087370     1.000000
    5.7 B3g   1  3d1-         0.031509     1.000000
    6.7 B3g   1  5g1-         0.535941     1.000000
    7.7 B3g   1  5g3-         0.535941     1.000000
    8.7 B3g   1  5g1-         0.243699     1.000000
    9.7 B3g   1  5g3-         0.243699     1.000000
   10.7 B3g   1  5g1-         0.104421     1.000000
   11.7 B3g   1  5g3-         0.104421     1.000000
    1.8 Au    1  4f2-         0.546132     1.000000
    2.8 Au    1  4f2-         0.262335     1.000000
    3.8 Au    1  4f2-         0.126013     1.000000
    4.8 Au    1  4f2-         0.050636     1.000000
    5.8 Au    1  6h4-         0.443982     1.000000
    6.8 Au    1  6h2-         0.443982     1.000000
    7.8 Au    1  6h4-         0.216180     1.000000
    8.8 Au    1  6h2-         0.216180     1.000000

 NUCLEAR CHARGE:                    3
 NUMBER OF PRIMITIVE AOS:         217
 NUMBER OF SYMMETRY AOS:          162
 NUMBER OF CONTRACTIONS:          126   (  25Ag  +  20B3u +  20B2u +  11B1g +  20B1u +  11B2g +  11B3g +   8Au  )
 NUMBER OF CORE ORBITALS:           0   (   0Ag  +   0B3u +   0B2u +   0B1g +   0B1u +   0B2g +   0B3g +   0Au  )
 NUMBER OF VALENCE ORBITALS:        4   (   1Ag  +   1B3u +   1B2u +   0B1g +   1B1u +   0B2g +   0B3g +   0Au  )


 NUCLEAR REPULSION ENERGY    0.00000000

 EXTRA SYMMETRY OF AOS IN SYMMETRY 1:   1 1 1 1 1 1 2 3 2 3   2 3 2 3 2 3 4 5 6 4   5 6 4 5 6
 EXTRA SYMMETRY OF AOS IN SYMMETRY 2:   1 1 1 1 1 1 2 3 2 3   2 3 2 3 4 5 6 4 5 6
 EXTRA SYMMETRY OF AOS IN SYMMETRY 3:   1 1 1 1 1 1 2 3 2 3   2 3 2 3 4 5 6 4 5 6
 EXTRA SYMMETRY OF AOS IN SYMMETRY 4:   1 1 1 1 1 2 3 2 3 2   3
 EXTRA SYMMETRY OF AOS IN SYMMETRY 5:   1 1 1 1 1 1 2 3 2 3   2 3 2 3 4 5 6 4 5 6
 EXTRA SYMMETRY OF AOS IN SYMMETRY 6:   1 1 1 1 1 2 3 2 3 2   3
 EXTRA SYMMETRY OF AOS IN SYMMETRY 7:   1 1 1 1 1 2 3 2 3 2   3
 EXTRA SYMMETRY OF AOS IN SYMMETRY 8:   1 1 1 1 2 3 2 3

 Eigenvalues of metric

         1 0.201E-04 0.993E-02 0.602E-01 0.773E-01 0.773E-01 0.185E+00 0.185E+00 0.185E+00
         2 0.307E-03 0.894E-02 0.658E-01 0.658E-01 0.693E-01 0.338E+00 0.338E+00 0.338E+00
         3 0.307E-03 0.894E-02 0.658E-01 0.658E-01 0.693E-01 0.338E+00 0.338E+00 0.338E+00
         4 0.773E-01 0.185E+00 0.185E+00 0.260E+00 0.698E+00 0.811E+00 0.811E+00 0.149E+01
         5 0.307E-03 0.894E-02 0.658E-01 0.658E-01 0.693E-01 0.338E+00 0.338E+00 0.338E+00
         6 0.773E-01 0.185E+00 0.185E+00 0.260E+00 0.698E+00 0.811E+00 0.811E+00 0.149E+01
         7 0.773E-01 0.185E+00 0.185E+00 0.260E+00 0.698E+00 0.811E+00 0.811E+00 0.149E+01
         8 0.658E-01 0.338E+00 0.338E+00 0.373E+00 0.111E+01 0.166E+01 0.166E+01 0.245E+01


 Contracted 2-electron integrals neglected if value below      1.0D-12
 AO integral compression algorithm  1   Integral accuracy      1.0D-12

     28.574 MB (compressed) written to integral file ( 51.5%)


 NUMBER OF SORTED TWO-ELECTRON INTEGRALS:    4156552.     BUFFER LENGTH:  32768
 NUMBER OF SEGMENTS:   1  SEGMENT LENGTH:    4156552      RECORD LENGTH: 524288

 Memory used in sort:       4.71 MW

 SORT1 READ     6989366. AND WROTE     2907704. INTEGRALS IN      9 RECORDS. CPU TIME:     0.22 SEC, REAL TIME:     0.33 SEC
 SORT2 READ     2907704. AND WROTE     4156552. INTEGRALS IN    109 RECORDS. CPU TIME:     0.18 SEC, REAL TIME:     0.38 SEC

 FILE SIZES:   FILE 1:    48.0 MBYTE,  FILE 4:    37.8 MBYTE,   TOTAL:     85.8 MBYTE

 OPERATOR DM      FOR CENTER  0  COORDINATES:    0.000000    0.000000    0.000000
 OPERATOR EKIN    FOR CENTER  0  COORDINATES:    0.000000    0.000000    0.000000
 OPERATOR POT     FOR CENTER  0  COORDINATES:    0.000000    0.000000    0.000000


 **********************************************************************************************************************************
 DATASETS  * FILE   NREC   LENGTH (MB)   RECORD NAMES
              1      20       36.72       500      610      700      900      950      970     1000      129      960     1100   
                                          VAR    BASINP    GEOM    SYMINP    ZMAT    AOBASIS   BASIS     P2S    ABASIS      S 
                                         1400     1410     1420     1200     1210     1080     1600     1650     1300     1700   
                                         EKIN       V       ECP      H0       H01     AOSYM     SMH    MOLCAS    ERIS     OPER   

 PROGRAMS   *        TOTAL       INT
 CPU TIMES  *         3.90      3.76
 REAL TIME  *        15.52 SEC
 DISK USED  *        86.12 MB      
 **********************************************************************************************************************************


 PROGRAM * RHF-SCF (OPEN SHELL)       Authors: W. Meyer, H.-J. Werner


 NUMBER OF ELECTRONS:       2+    1-    SPACE SYMMETRY=2    SPIN SYMMETRY: Doublet 
 CONVERGENCE THRESHOLDS:    1.00E-05 (Density)    1.00E-07 (Energy)
 MAX. NUMBER OF ITERATIONS:       60
 INTERPOLATION TYPE:            DIIS
 INTERPOLATION STEPS:              2 (START)      1 (STEP)
 LEVEL SHIFTS:                 -0.60 (CLOSED) -0.30 (OPEN) 

 Number of closed-shell orbitals:    1 (   1   0   0   0   0   0   0   0 )
 Number of open-shell orbitals:      1 (   0   1   0   0   0   0   0   0 )



   Atom=AL basis=ECP10MWB_GUESS    lmin=0  lmax=1

 Orbital guess generated from atomic densities. Full valence occupancy:    1   1   1   0   1   0   0   0


 Molecular orbital dump at record        2100.2

 ITERATION    DDIFF          GRAD             ENERGY        2-EL.EN.            DIPOLE MOMENTS         DIIS   ORB.
    1      0.000D+00      0.000D+00        -1.86896465      1.646648    0.00000    0.00000    0.00000    0    start
    2      0.000D+00      0.348D-02        -1.87293490      1.686644    0.00000    0.00000    0.00000    1    diag,B
    3      0.379D+00      0.212D-02        -1.87604440      1.733083    0.00000    0.00000    0.00000    2    diag,B
    4      0.411D+00      0.104D-02        -1.87701694      1.755806    0.00000    0.00000    0.00000    3    diag,B
    5      0.207D+00      0.360D-03        -1.87708520      1.758157    0.00000    0.00000    0.00000    4    diag,B
    6      0.322D-01      0.106D-03        -1.87709004      1.759007    0.00000    0.00000    0.00000    5    diag,B
    7      0.705D-02      0.342D-04        -1.87709034      1.758891    0.00000    0.00000    0.00000    6    fixocc
    8      0.746D-04      0.135D-04        -1.87709039      1.758936    0.00000    0.00000    0.00000    7    diag,B
    9      0.899D-04      0.902D-06        -1.87709039      1.758929    0.00000    0.00000    0.00000    8    diag,B
   10      0.381D-04      0.297D-06        -1.87709039      1.758930    0.00000    0.00000    0.00000    9    orth
   11      0.798D-05      0.986D-07        -1.87709039      1.758930    0.00000    0.00000    0.00000    0    orth

 Final alpha occupancy:   1   1   0   0   0   0   0   0
 Final beta  occupancy:   1   0   0   0   0   0   0   0

 !RHF STATE 1.2 Energy                 -1.877090387957
 Nuclear energy                         0.00000000
 One-electron energy                   -2.75655523
 Two-electron energy                    0.87946484
 Virial quotient                       -2.92509612
 !RHF STATE 1.2 Dipole moment           0.00000000     0.00000000     0.00000000
 Dipole moment /Debye                   0.00000000     0.00000000     0.00000000
 

 !RHF expec          <1.2|EKIN|1.2>     0.641719215117
 
 !RHF expec           <1.2|POT|1.2>    -1.245924226546

 ELECTRON ORBITALS
 =================


   Orb  Occ    Energy  Couls-En    Coefficients

                                   1 1s      1 1s      1 1s      1 1s      1 1s      1 1s      1 3d0     1 3d2+    1 3d0     1 3d2+ 
                                   1 3d0     1 3d2+    1 3d0     1 3d2+    1 3d0     1 3d2+    1 5g0     1 5g4+    1 5g2+    1 5g0  
                                   1 5g4+    1 5g2+    1 5g0     1 5g4+    1 5g2+ 

   1.1   2    -0.3939   -1.4017  1.001347  0.000334 -0.000221 -0.000420 -0.001140  0.000166 -0.000147  0.000255 -0.000148  0.000256
                                 0.001002 -0.001735 -0.004316  0.007476 -0.001735  0.003005  0.000001  0.000002 -0.000001 -0.000008
                                -0.000017  0.000013 -0.000048 -0.000095  0.000072

                                   1 2px     1 2px     1 2px     1 2px     1 2px     1 2px     1 4f1+    1 4f3+    1 4f1+    1 4f3+ 
                                   1 4f1+    1 4f3+    1 4f1+    1 4f3+    1 6h1+    1 6h3+    1 6h5+    1 6h1+    1 6h3+    1 6h5+ 


   1.2   +    -0.2098   -0.9507  0.998958 -0.000056  0.000157  0.000060  0.000292  0.000720  0.000005 -0.000006  0.000098 -0.000127
                                 0.000016 -0.000021 -0.000118  0.000152  0.000000 -0.000000  0.000001 -0.000002  0.000002 -0.000002

 HOMO      1.2    -0.209802 =      -5.7090eV
 LUMO      1.3     0.009185 =       0.2499eV
 LUMO-HOMO         0.218986 =       5.9589eV


 **********************************************************************************************************************************
 DATASETS  * FILE   NREC   LENGTH (MB)   RECORD NAMES
              1      20       36.72       500      610      700      900      950      970     1000      129      960     1100   
                                          VAR    BASINP    GEOM    SYMINP    ZMAT    AOBASIS   BASIS     P2S    ABASIS      S 
                                         1400     1410     1420     1200     1210     1080     1600     1650     1300     1700   
                                         EKIN       V       ECP      H0       H01     AOSYM     SMH    MOLCAS    ERIS     OPER   

              2       4        2.83       700     1000      520     2100   
                                         GEOM     BASIS   MCVARS     RHF  

 PROGRAMS   *        TOTAL        HF       INT
 CPU TIMES  *         4.12      0.22      3.76
 REAL TIME  *        16.08 SEC
 DISK USED  *        86.12 MB      
 **********************************************************************************************************************************
 SETTING SCF(I)         =        -1.87709039  AU                              
 SETTING _CC_NORM_MAX   =         2.00000000                                  


 PROGRAM * UHF-SCF       Authors: W. Meyer, H.-J. Werner


 NUMBER OF ELECTRONS:       2+    1-    SPACE SYMMETRY=2    SPIN SYMMETRY: Doublet 
 CONVERGENCE THRESHOLDS:    1.00E-05 (Density)    1.00E-07 (Energy)
 MAX. NUMBER OF ITERATIONS:        0
 INTERPOLATION TYPE:            DIIS
 INTERPOLATION STEPS:              2 (START)      1 (STEP)
 LEVEL SHIFTS:                  0.20 (ALPHA)   0.20 (BETA) 

 Number of closed-shell orbitals:    1 (   1   0   0   0   0   0   0   0 )
 Number of open-shell orbitals:      1 (   0   1   0   0   0   0   0   0 )


 Molecular orbitals read from record     2100.2  Type=RHF/CANONICAL (state 1.2)

 Molecular orbital dump at record        2200.2

 Initial alpha occupation   1   1   0   0   0   0   0   0
 Initial beta  occupation   1   0   0   0   0   0   0   0

 ITERATION    DDIFF          GRAD             ENERGY        2-EL.EN.            DIPOLE MOMENTS         DIIS
    1      0.000D+00      0.000D+00        -1.87709039      1.758930    0.00000    0.00000    0.00000    0
 
 Final alpha occupancy:   1   1   0   0   0   0   0   0
 Final beta  occupancy:   1   0   0   0   0   0   0   0

 !UHF STATE 1.2 Energy                 -1.877090387957
 Nuclear energy                         0.00000000
 One-electron energy                   -2.75655523
 Two-electron energy                    0.87946484
 Virial quotient                       -2.92509612
 !UHF STATE 1.2 Dipole moment           0.00000000     0.00000000     0.00000000
 Dipole moment /Debye                   0.00000000     0.00000000     0.00000000
 

 !UHF expec          <1.2|EKIN|1.2>     0.641719215117
 
 !UHF expec           <1.2|POT|1.2>    -1.245924226546

 ELECTRON ORBITALS FOR POSITIVE SPIN
 ===================================


   Orb  Occ    Energy  Couls-En    Coefficients

                                   1 1s      1 1s      1 1s      1 1s      1 1s      1 1s      1 3d0     1 3d2+    1 3d0     1 3d2+ 
                                   1 3d0     1 3d2+    1 3d0     1 3d2+    1 3d0     1 3d2+    1 5g0     1 5g4+    1 5g2+    1 5g0  
                                   1 5g4+    1 5g2+    1 5g0     1 5g4+    1 5g2+ 

   1.1   +    -0.3939   -1.4017  1.001347  0.000334 -0.000221 -0.000420 -0.001140  0.000166 -0.000147  0.000255 -0.000148  0.000256
                                 0.001002 -0.001735 -0.004316  0.007476 -0.001735  0.003005  0.000001  0.000002 -0.000001 -0.000008
                                -0.000017  0.000013 -0.000048 -0.000095  0.000072

                                   1 2px     1 2px     1 2px     1 2px     1 2px     1 2px     1 4f1+    1 4f3+    1 4f1+    1 4f3+ 
                                   1 4f1+    1 4f3+    1 4f1+    1 4f3+    1 6h1+    1 6h3+    1 6h5+    1 6h1+    1 6h3+    1 6h5+ 


   1.2   +    -0.2098   -0.9507  0.998958 -0.000056  0.000157  0.000060  0.000292  0.000720  0.000005 -0.000006  0.000098 -0.000127
                                 0.000016 -0.000021 -0.000118  0.000152  0.000000 -0.000000  0.000001 -0.000002  0.000002 -0.000002

 ELECTRON ORBITALS FOR NEGATIVE SPIN
 ===================================


   Orb  Occ    Energy  Couls-En    Coefficients

                                   1 1s      1 1s      1 1s      1 1s      1 1s      1 1s      1 3d0     1 3d2+    1 3d0     1 3d2+ 
                                   1 3d0     1 3d2+    1 3d0     1 3d2+    1 3d0     1 3d2+    1 5g0     1 5g4+    1 5g2+    1 5g0  
                                   1 5g4+    1 5g2+    1 5g0     1 5g4+    1 5g2+ 

   1.1   -    -0.3939   -1.4017  1.001347  0.000334 -0.000221 -0.000420 -0.001140  0.000166 -0.000147  0.000255 -0.000148  0.000256
                                 0.001002 -0.001735 -0.004316  0.007476 -0.001735  0.003005  0.000001  0.000002 -0.000001 -0.000008
                                -0.000017  0.000013 -0.000048 -0.000095  0.000072

 HOMO      1.2    -0.209802 =      -5.7090eV
 LUMO     -1.2    -0.209802 =      -5.7090eV
 LUMO-HOMO         0.000000 =       0.0000eV

 EXPECTATION VALUE OF S**2:             0.75000000

 Occupation number threshold for canonical orbitals:  1.999000 (occupied),  0.001000 (virtual)

 Number of pseudo-canonical orbitals per symmetry:    1   0   0   0   0   0   0   0
 Number of active natural orbitals per symmetry:      0   1   0   0   0   0   0   0

 NATURAL CHARGE ORBITALS
 =======================


   Orb     Occ        Energy       Coefficients

                                   1 1s      1 1s      1 1s      1 1s      1 1s      1 1s      1 3d0     1 3d2+    1 3d0     1 3d2+ 
                                   1 3d0     1 3d2+    1 3d0     1 3d2+    1 3d0     1 3d2+    1 5g0     1 5g4+    1 5g2+    1 5g0  
                                   1 5g4+    1 5g2+    1 5g0     1 5g4+    1 5g2+ 

   1.1  2.00000    -0.393912     1.001347  0.000334 -0.000221 -0.000420 -0.001140  0.000166 -0.000147  0.000255 -0.000148  0.000256
                                 0.001002 -0.001735 -0.004316  0.007476 -0.001735  0.003005  0.000001  0.000002 -0.000001 -0.000008
                                -0.000017  0.000013 -0.000048 -0.000095  0.000072

                                   1 2px     1 2px     1 2px     1 2px     1 2px     1 2px     1 4f1+    1 4f3+    1 4f1+    1 4f3+ 
                                   1 4f1+    1 4f3+    1 4f1+    1 4f3+    1 6h1+    1 6h3+    1 6h5+    1 6h1+    1 6h3+    1 6h5+ 


   1.2  1.00000    -0.067100     0.998958 -0.000056  0.000157  0.000060  0.000292  0.000720  0.000005 -0.000006  0.000098 -0.000127
                                 0.000016 -0.000021 -0.000118  0.000152  0.000000 -0.000000  0.000001 -0.000002  0.000002 -0.000002

 Natural orbitals saved to record    2200.2 (Orbital set 3)

 Orbital spaces for UNO-CAS (Min. occupation: 0.020  Max. occupation: 1.980):

 Closed:        1   0   0   0   0   0   0   0
 Active:        0   1   0   0   0   0   0   0

 No convergence



 **********************************************************************************************************************************
 DATASETS  * FILE   NREC   LENGTH (MB)   RECORD NAMES
              1      20       36.72       500      610      700      900      950      970     1000      129      960     1100   
                                          VAR    BASINP    GEOM    SYMINP    ZMAT    AOBASIS   BASIS     P2S    ABASIS      S 
                                         1400     1410     1420     1200     1210     1080     1600     1650     1300     1700   
                                         EKIN       V       ECP      H0       H01     AOSYM     SMH    MOLCAS    ERIS     OPER   

              2       5        5.45       700     1000      520     2100     2200   
                                         GEOM     BASIS   MCVARS     RHF      UHF  

 PROGRAMS   *        TOTAL       UHF        HF       INT
 CPU TIMES  *         4.15      0.02      0.22      3.76
 REAL TIME  *        16.30 SEC
 DISK USED  *        86.12 MB      
 **********************************************************************************************************************************
 SETTING SCF(I)         =        -1.87709039  AU                              


 PROGRAM * MRCC (General Multireference Coupled Cluster)    Author: M. Kallay, 2000-2005

 ***  Initialisation ***

   0 Spin projections
 
 Molecular orbitals read from record     2200.2  Type=UHF/ALPHA (state 1.2)

 ?Warning: UHF not converged
 Molecular orbitals read from record     2200.2  Type=UHF/BETA (state 1.2)

 ?Warning: UHF not converged
 
 Frozen orbitals:              0 (  0  0  0  0  0  0  0  0)
 Active orbitals:            126 ( 25 20 20 11 20 11 11  8)
 Active electrons:             3
 Spin quantum number:          0.5

 Transformed integrals will be written to file mrcc_29081/fort.55

 Load integrals                4.2 sec
 Transform integrals           6.7 sec
 Storage for integrals:       24278327
 Remaining memory:           *********

 Core energy:               0.00000000
 
 MRCC Input:
     4     0     0     0     3     0     0     2     0     0     0     1     1     0     0     7     0     0   0.000     0   64000
  ex.lev,nsing,ntrip, rest,method,dens,conver,symm, diag, CS ,spatial, HF, ndoub,nacto,nactv, tol, maxex, sacc, freq,  dboc,   mem
  2  0  0  0  0  0  0  0  0  0  0  0  0  0  0  0  0  0  0  0  0  0  0  0  0  1  0  0  0  0  0  0  0  0  0  0  0  0  0  0  0  0  0  0  0  0  0  0  0  0  0  0  0  0  0  0  0  0  0  0  0  0  0  0  0  0  0  0  0  0  0  0  0  0  0  0  0  0  0  0  0  0  0  0  0  0  0  0  0  0  0  0  0  0  0  0  0  0  0  0  0  0  0  0  0  0  0  0  0  0  0  0  0  0  0  0  0  0  0  0  0  0  0  0  0  0
 MRCC Input end
 Variable memory released
 MRCC now being run, temporary output in /global/cscratch1/sd/aannabe/mrcc_29081/mrcc.out
 **********************************************************************
                          MRCC program system
 **********************************************************************

                              Written by
  Mihaly Kallay, Zoltan Rolik, Jozsef Csontos, Peter Nagy, Gyula Samu,
      David Mester, Jozsef Csoka, Bernat Szabo, Istvan Ladjanszki,
       Lorant Szegedy, Bence Ladoczki, Klara Petrov, Mate Farkas,
                    Pal D. Mezei, and Bence Hegely

        Department of Physical Chemistry and Materials Science
            Budapest University of Technology and Economics
                  Budapest P.O.Box 91, H-1521 Hungary

                              www.mrcc.hu

                       Release date: May 23, 2018

 ************************ 2018-10-05 11:07:25 *************************
 Executing goldstone...

 Generation of CC equations in terms of H and T...
 Generation of antisymmetrized Goldstone diagrams...
 Number of diagrams in T^1 equations:    15
 Number of diagrams in T^2 equations:    33
 Number of diagrams in T^3 equations:     2
 Translation of diagrams to factorized equations...
 Optimizing intermediate calculation...
 Number of floating-point operations per iteration step:   2.5727E+08
 Probable CPU time per iteration step (hours):      0.00
 Required memory (Mbytes):   31251.9
 Number of intermediates:                                  48
 Number of intermediates to be stored:                     20
 Length of intermediate file (Mbytes):     477.2

 ************************ 2018-10-05 11:07:26 *************************
 Executing xmrcc...

 **********************************************************************
 CC(2)(3) calculation


 Allocation of****** Mbytes of memory...
 Number of spinorbitals:                   252
 Number of alpha electrons:                        2
 Number of beta electrons:                         1
 Spin multiplicity:                     2
 z-component of spin:  0.5
 Spatial symmetry:                      2
 Convergence criterion:  1.0E-07
 Construction of occupation graphs...
 Number of                     0 -fold excitations:                      1
 Number of                     1 -fold excitations:                     67
 Number of                     2 -fold excitations:                   5159
 Total number of configurations:                   5227
 Calculation of coupling coefficients...
 Length of intermediate file (Mbytes):     360.9

 ======================================================================

 Spin case  1   Alpha:  2   Beta:  1
 Number of excitations:                 119697
 Number of                     3 -fold excitations:                 119697

 Memory requirements /Mbyte/:
               Minimal        Optimal
 Real*8:        233.9746      1923.2150
 Integer:         5.3106
 Total:         239.2852      1928.5256


 ************************ 2018-10-05 11:07:29 *************************
 Executing mrcc...

 **********************************************************************
 CCSDT(T) calculation


 OpenMP parallel version is running.
 Number of CPUs:   1
 Allocation of 1923.2 Mbytes of memory...
 Number of spinorbitals: 252
 Number of alpha electrons:  2
 Number of beta  electrons:  1
 Spin multiplicity: 2
 z-component of spin:  0.5
 Spatial symmetry: 2
 Convergence criterion:  1.0E-07
 Construction of occupation graphs...
 Number of 0-fold excitations: 1
 Number of 1-fold excitations: 67
 Number of 2-fold excitations: 5159
 Total number of determinants: 5227
 Calculation of coupling coefficients...
 Initial cluster amplitudes are generated.
 Length of intermediate file (Mbytes):     360.9
 Reading integral list from unit 55...
 Sorting integrals...
 Sorting integrals...
 Sorting integrals...
 Sorting integrals...
 Energy of reference determinant [au]:      -1.877090387957
 Calculation of MP denominators...

 Starting CC iteration...
 ======================================================================
 Norm of residual vector:     0.26883335
 CPU time [min]:     0.937                   Wall time [min]:     0.939

 Iteration  1  CC energy:    -1.92318357  Energy decrease:   0.04609318
 ======================================================================
 Norm of residual vector:     0.07406735
 CPU time [min]:     1.198                   Wall time [min]:     1.204

 Iteration  2  CC energy:    -1.93103316  Energy decrease:   0.00784959
 ======================================================================
 Norm of residual vector:     0.02148663
 CPU time [min]:     1.458                   Wall time [min]:     1.466

 Iteration  3  CC energy:    -1.93491799  Energy decrease:   0.00388483
 ======================================================================
 Norm of residual vector:     0.00622842
 CPU time [min]:     1.719                   Wall time [min]:     1.729

 Iteration  4  CC energy:    -1.93502382  Energy decrease:   0.00010583
 ======================================================================
 Norm of residual vector:     0.00149961
 CPU time [min]:     1.980                   Wall time [min]:     1.993

 Iteration  5  CC energy:    -1.93514484  Energy decrease:   0.00012103
 ======================================================================
 Norm of residual vector:     0.00036627
 CPU time [min]:     2.241                   Wall time [min]:     2.258

 Iteration  6  CC energy:    -1.93513116  Energy decrease:   0.00001368
 ======================================================================
 Norm of residual vector:     0.00008211
 CPU time [min]:     2.502                   Wall time [min]:     2.522

 Iteration  7  CC energy:    -1.93512941  Energy decrease:   0.00000175
 ======================================================================
 Norm of residual vector:     0.00001997
 CPU time [min]:     2.763                   Wall time [min]:     2.787

 Iteration  8  CC energy:    -1.93513101  Energy decrease:   0.00000160
 ======================================================================
 Norm of residual vector:     0.00000550
 CPU time [min]:     3.025                   Wall time [min]:     3.052

 Iteration  9  CC energy:    -1.93513053  Energy decrease:   0.00000048
 ======================================================================
 Norm of residual vector:     0.00000137
 CPU time [min]:     3.287                   Wall time [min]:     3.316

 Iteration 10  CC energy:    -1.93513054  Energy decrease:   0.00000001
 ======================================================================
 Norm of residual vector:     0.00000035
 CPU time [min]:     3.548                   Wall time [min]:     3.581

 Iteration 11  CC energy:    -1.93513056  Energy decrease:   0.00000002
 ======================================================================
 Norm of residual vector:     0.00000011
 CPU time [min]:     3.810                   Wall time [min]:     3.844

 Iteration 12  CC energy:    -1.93513055  Energy decrease:   0.00000001
 ======================================================================
 Norm of residual vector:     0.00000003
 CPU time [min]:     4.071                   Wall time [min]:     4.114

 Iteration 13  CC energy:    -1.93513055  Energy decrease:   9.6198E-10
 ======================================================================

 Iteration has converged in 13 steps.

 Final results:
 Total CCSDT energy [au]:             -1.935130549188
 Total MP2 energy [au]:               -1.923183569377

 Perturbative corrections are calculated...
 ======================================================================
 Spin case  1   Alpha:  2   Beta:  1
 Number of excitations:        119697
 CPU time [min]:     4.144                   Wall time [min]:     4.187
 ======================================================================
 Number of 3-fold excitations: 119697
 CPU time [min]:     4.144                   Wall time [min]:     4.187

 Total CCSD[T] energy [au]:           -1.936692849020
 Total CCSD(T) energy [au]:           -1.936722448928

 ************************ 2018-10-05 11:11:43 *************************
                      Normal termination of mrcc.
 **********************************************************************
 !CCSDT STATE 1.2 Energy               -1.935130549188
 !MP2 STATE 1.2 Energy                 -1.923183569377
 !CCSD[T] STATE 1.2 Energy             -1.936692849020
 !CCSD(T) STATE 1.2 Energy             -1.936722448928
 
 CPU-time for MRCC:            248.6 sec
 Elapsed-time for MRCC:        260.9 sec

 Variable memory set to 8000000000 words,  buffer space   230000 words



 **********************************************************************************************************************************
 DATASETS  * FILE   NREC   LENGTH (MB)   RECORD NAMES
              1      20       36.72       500      610      700      900      950      970     1000      129      960     1100   
                                          VAR    BASINP    GEOM    SYMINP    ZMAT    AOBASIS   BASIS     P2S    ABASIS      S 
                                         1400     1410     1420     1200     1210     1080     1600     1650     1300     1700   
                                         EKIN       V       ECP      H0       H01     AOSYM     SMH    MOLCAS    ERIS     OPER   

              2       5        5.45       700     1000      520     2100     2200   
                                         GEOM     BASIS   MCVARS     RHF      UHF  

 PROGRAMS   *        TOTAL      MRCC       UHF        HF       INT
 CPU TIMES  *       325.35    321.18      0.02      0.22      3.76
 REAL TIME  *       652.94 SEC
 DISK USED  *        86.12 MB      
 **********************************************************************************************************************************
 SETTING POSTHF(I)      =        -1.93672245  AU                              
                                                                                                                                                                                                                                                                

       SCF           POSTHF       EKIN          POT
    -1.87709039   -1.93672245   0.64171922   -1.24592423
                                                  

 CCSD(T)/USERDEF energy=     -1.936722448928

        CCSD(T)         HF-SCF  
     -1.93672245     -1.87709039
 **********************************************************************************************************************************
 Variable memory released
