
 Primary working directories    : /global/cscratch1/sd/aannabe
 Secondary working directories  : /global/cscratch1/sd/aannabe
 Wavefunction directory         : /global/homes/a/aannabe/wfu/
 Main file repository           : /global/cscratch1/sd/aannabe/

 SHA1      : 19cd028119e0e09f93f0674bd8af7968d9b3eff6
 NAME      : 2015.1.36
 ARCHNAME  : linux/x86_64
 FC        : /opt/cray/pe/craype/2.5.14/bin/ftn
 BLASLIB   : -L/opt/intel/compilers_and_libraries_2018.1.163/linux/mkl/lib/intel64 -Wl,-_start-group -lmkl_intel_ilp64 -lmkl_intel_thread -lmkl_core -Wl,-_end-group -liomp5
 id        : lbl

 Nodes     nprocs
 nid00497     1

 Using customized tuning parameters: mindgm=7; mindgv=16; mindgc=1; mindgr=1; noblas=0; minvec=7
 default implementation of scratch files=df  

 ***,Ge
 memory,8,g
 gthresh,twoint=1.e-12
 
 gprint,basis,orbitals
 gexpec,ekin,pot
 
 angstrom
 geometry={
 1                                                                               ! Number of atoms
 Ge 0.0 0.0 0.0
 }
 
 basis={
 
 Including file /global/homes/a/aannabe/repos/pseudopotentiallibrary/recipes/Ge/ccECP/Ge.ccECP.molpro
 
                                   !include,/global/homes/a/aannabe/repos/pseudopotentiallibrary/recipes/Ge/ccECP/Ge.cc-pV6Z.molpro
                                  !include,/global/homes/a/aannabe/repos/pseudopotentiallibrary/recipes/Ge/ccECP/Ge.cc-pCV6Z.molpro
 Including file /global/homes/a/aannabe/repos/pseudopotentiallibrary/recipes/Ge/ccECP/Ge.aug-cc-pV6Z.molpro
 
 
 }
 
 {hf
 wf,4,6,2
 occ,1,1,0,0,1,0,0,0
                                                                                 !open,1.2,1.5
 closed,1,0,0,0,0,0,0,0
                                                                                 !sym,
 }
 scf(i)=energy
 
 _CC_NORM_MAX=2.0
  !NOTE: Perturbative MRCC works only with UHF reference. So, here we will trick MRCC by doing zero UHF iteration right after ROHF.
 
 {uhf
 wf,4,6,2
 occ,1,1,0,0,1,0,0,0
                                                                                 !open,1.2,1.5
 closed,1,0,0,0,0,0,0,0
                                                                                 !sym,
 maxit,0
 }
 scf(i)=energy
 
 {mrcc,method=CCSDT(Q),dir=mrccdir                                               !,restart=1
 orbital,ignore_error=1                                                          !Ignore the fact that UHF WF is not converged
 maxit,100
 core
 }
 posthf(i)=energy
 
 table,scf,posthf,ekin,pot
 save,6.csv,new
 
 

 Variables initialized (889), CPU time= 0.01 sec
 Commands  initialized (702), CPU time= 0.01 sec, 572 directives.
 Default parameters read. Elapsed time= 0.14 sec

 Checking input...
 Passed
1


                                         ***  PROGRAM SYSTEM MOLPRO  ***
                                       Copyright, TTI GmbH Stuttgart, 2015
                                    Version 2015.1 linked Dec 29 2018 15:55:43


 **********************************************************************************************************************************
 LABEL *   Ge                                                                            
  64 bit serial version                                                                  DATE: 25-Jun-19          TIME: 12:49:42  
 **********************************************************************************************************************************

 SHA1:             19cd028119e0e09f93f0674bd8af7968d9b3eff6
 **********************************************************************************************************************************

 THRESHOLDS:

 ZERO    =  1.00D-12  ONEINT  =  1.00D-12  TWOINT  =  1.00D-12  PREFAC  =  1.00D-14  LOCALI  =  1.00D-09  EORDER  =  1.00D-04
 ENERGY  =  0.00D+00  ETEST   =  0.00D+00  EDENS   =  0.00D+00  THRDEDEF=  1.00D-06  GRADIENT=  1.00D-02  STEP    =  1.00D-03
 ORBITAL =  1.00D-05  CIVEC   =  1.00D-05  COEFF   =  1.00D-04  PRINTCI =  5.00D-02  PUNCHCI =  9.90D+01  OPTGRAD =  3.00D-04
 OPTENERG=  1.00D-06  OPTSTEP =  3.00D-04  THRGRAD =  1.00D-10  COMPRESS=  1.00D-11  VARMIN  =  1.00D-07  VARMAX  =  1.00D-03
 THRDOUB =  0.00D+00  THRDIV  =  1.00D-05  THRRED  =  1.00D-07  THRPSP  =  1.00D+00  THRDC   =  1.00D-10  THRCS   =  1.00D-10
 THRNRM  =  1.00D-08  THREQ   =  0.00D+00  THRDE   =  1.00D+00  THRREF  =  1.00D-05  SPARFAC =  1.00D+00  THRDLP  =  1.00D-07
 THRDIA  =  1.00D-10  THRDLS  =  1.00D-07  THRGPS  =  0.00D+00  THRKEX  =  0.00D+00  THRDIS  =  2.00D-01  THRVAR  =  1.00D-10
 THRLOC  =  1.00D-06  THRGAP  =  1.00D-06  THRLOCT = -1.00D+00  THRGAPT = -1.00D+00  THRORB  =  1.00D-06  THRMLTP =  0.00D+00
 THRCPQCI=  1.00D-10  KEXTA   =  0.00D+00  THRCOARS=  0.00D+00  SYMTOL  =  1.00D-06  GRADTOL =  1.00D-06  THROVL  =  1.00D-08
 THRORTH =  1.00D-08  GRID    =  1.00D-06  GRIDMAX =  1.00D-03  DTMAX   =  0.00D+00  THROCCDE=  1.00D-01  THROCCDE=  1.00D-01



 ZUNIT=ANG
 

Geometry recognized as XYZ


 Variable memory set to 8000000000 words,  buffer space   230000 words

 SETTING BASIS          =    USERDEF


 Recomputing integrals since basis changed


 Using spherical harmonics



 PROGRAM * SEWARD (Integral evaluation for generally contracted gaussian basis sets)     Author: Roland Lindh, 1990

 Geometry written to block  1 of record 700

 Orientation using atomic masses  
 Molecule type: Atom
 Symmetry elements: X,Y,Z
 Rotational constants:       0.0000000      0.0000000      0.0000000 GHz  (calculated with average atomic masses)

 Point group  D2h 



 ATOMIC COORDINATES

 NR  ATOM    CHARGE       X              Y              Z

   1  GE      4.00    0.000000000    0.000000000    0.000000000


          GE  CORE POTENTIAL

          f POTENTIAL

 POWERS             1              3              2              2
 EXPONENTIALS   1.478963       3.188906       1.927439       1.545539    
 COEFFICIENTS   4.000000       5.915851      -12.03371       1.283543    

          s - f POTENTIAL

 POWERS             2              2
 EXPONENTIALS   2.894474       1.550340    
 COEFFICIENTS   43.26543      -1.909340    

          p - f POTENTIAL

 POWERS             2              2
 EXPONENTIALS   2.986529       1.283381    
 COEFFICIENTS   35.26301      0.9634399    

          d - f POTENTIAL

 POWERS             2              2
 EXPONENTIALS   1.043001      0.5545627    
 COEFFICIENTS   2.339019      0.5413807    


 BASIS DATA

   Nr Sym  Nuc  Type         Exponents   Contraction coefficients

    1.1 Ag    1  1s          46.470485    -0.000229
                             20.357328     0.001574
                              8.917936    -0.011345
                              3.906681     0.098972
                              1.711400    -0.331545
                              0.749713    -0.094809
                              0.328427     0.438933
                              0.143874     0.596777
                              0.063027     0.186251
    2.1 Ag    1  1s           1.568997     1.000000
    3.1 Ag    1  1s           0.726886     1.000000
    4.1 Ag    1  1s           0.336753     1.000000
    5.1 Ag    1  1s           0.156011     1.000000
    6.1 Ag    1  1s           0.072277     1.000000
    7.1 Ag    1  1s           0.028911     1.000000
    8.1 Ag    1  3d0          1.625185     1.000000
    9.1 Ag    1  3d2+         1.625185     1.000000
   10.1 Ag    1  3d0          0.793375     1.000000
   11.1 Ag    1  3d2+         0.793375     1.000000
   12.1 Ag    1  3d0          0.387306     1.000000
   13.1 Ag    1  3d2+         0.387306     1.000000
   14.1 Ag    1  3d0          0.189073     1.000000
   15.1 Ag    1  3d2+         0.189073     1.000000
   16.1 Ag    1  3d0          0.092301     1.000000
   17.1 Ag    1  3d2+         0.092301     1.000000
   18.1 Ag    1  3d0          0.036920     1.000000
   19.1 Ag    1  3d2+         0.036920     1.000000
   20.1 Ag    1  5g0          0.924495     1.000000
   21.1 Ag    1  5g4+         0.924495     1.000000
   22.1 Ag    1  5g2+         0.924495     1.000000
   23.1 Ag    1  5g0          0.503029     1.000000
   24.1 Ag    1  5g4+         0.503029     1.000000
   25.1 Ag    1  5g2+         0.503029     1.000000
   26.1 Ag    1  5g0          0.273704     1.000000
   27.1 Ag    1  5g4+         0.273704     1.000000
   28.1 Ag    1  5g2+         0.273704     1.000000
   29.1 Ag    1  5g0          0.109482     1.000000
   30.1 Ag    1  5g4+         0.109482     1.000000
   31.1 Ag    1  5g2+         0.109482     1.000000
   32.1 Ag    1  7i6+         0.780603     1.000000
   33.1 Ag    1  7i4+         0.780603     1.000000
   34.1 Ag    1  7i2+         0.780603     1.000000
   35.1 Ag    1  7i0          0.780603     1.000000
   36.1 Ag    1  7i6+         0.312241     1.000000
   37.1 Ag    1  7i4+         0.312241     1.000000
   38.1 Ag    1  7i2+         0.312241     1.000000
   39.1 Ag    1  7i0          0.312241     1.000000
    1.2 B3u   1  2px         22.641155     0.000052
                             10.174686    -0.000675
                              4.572392     0.011276
                              2.054783    -0.074628
                              0.923397    -0.012070
                              0.414964     0.216919
                              0.186480     0.438735
                              0.083802     0.385126
                              0.037660     0.108074
    2.2 B3u   1  2px          0.991895     1.000000
    3.2 B3u   1  2px          0.450546     1.000000
    4.2 B3u   1  2px          0.204650     1.000000
    5.2 B3u   1  2px          0.092958     1.000000
    6.2 B3u   1  2px          0.042224     1.000000
    7.2 B3u   1  2px          0.016890     1.000000
    8.2 B3u   1  4f1+         0.838223     1.000000
    9.2 B3u   1  4f3+         0.838223     1.000000
   10.2 B3u   1  4f1+         0.475035     1.000000
   11.2 B3u   1  4f3+         0.475035     1.000000
   12.2 B3u   1  4f1+         0.269210     1.000000
   13.2 B3u   1  4f3+         0.269210     1.000000
   14.2 B3u   1  4f1+         0.152566     1.000000
   15.2 B3u   1  4f3+         0.152566     1.000000
   16.2 B3u   1  4f1+         0.061026     1.000000
   17.2 B3u   1  4f3+         0.061026     1.000000
   18.2 B3u   1  6h1+         0.848005     1.000000
   19.2 B3u   1  6h3+         0.848005     1.000000
   20.2 B3u   1  6h5+         0.848005     1.000000
   21.2 B3u   1  6h1+         0.448090     1.000000
   22.2 B3u   1  6h3+         0.448090     1.000000
   23.2 B3u   1  6h5+         0.448090     1.000000
   24.2 B3u   1  6h1+         0.179236     1.000000
   25.2 B3u   1  6h3+         0.179236     1.000000
   26.2 B3u   1  6h5+         0.179236     1.000000
    1.3 B2u   1  2py         22.641155     0.000052
                             10.174686    -0.000675
                              4.572392     0.011276
                              2.054783    -0.074628
                              0.923397    -0.012070
                              0.414964     0.216919
                              0.186480     0.438735
                              0.083802     0.385126
                              0.037660     0.108074
    2.3 B2u   1  2py          0.991895     1.000000
    3.3 B2u   1  2py          0.450546     1.000000
    4.3 B2u   1  2py          0.204650     1.000000
    5.3 B2u   1  2py          0.092958     1.000000
    6.3 B2u   1  2py          0.042224     1.000000
    7.3 B2u   1  2py          0.016890     1.000000
    8.3 B2u   1  4f1-         0.838223     1.000000
    9.3 B2u   1  4f3-         0.838223     1.000000
   10.3 B2u   1  4f1-         0.475035     1.000000
   11.3 B2u   1  4f3-         0.475035     1.000000
   12.3 B2u   1  4f1-         0.269210     1.000000
   13.3 B2u   1  4f3-         0.269210     1.000000
   14.3 B2u   1  4f1-         0.152566     1.000000
   15.3 B2u   1  4f3-         0.152566     1.000000
   16.3 B2u   1  4f1-         0.061026     1.000000
   17.3 B2u   1  4f3-         0.061026     1.000000
   18.3 B2u   1  6h1-         0.848005     1.000000
   19.3 B2u   1  6h3-         0.848005     1.000000
   20.3 B2u   1  6h5-         0.848005     1.000000
   21.3 B2u   1  6h1-         0.448090     1.000000
   22.3 B2u   1  6h3-         0.448090     1.000000
   23.3 B2u   1  6h5-         0.448090     1.000000
   24.3 B2u   1  6h1-         0.179236     1.000000
   25.3 B2u   1  6h3-         0.179236     1.000000
   26.3 B2u   1  6h5-         0.179236     1.000000
    1.4 B1g   1  3d2-         1.625185     1.000000
    2.4 B1g   1  3d2-         0.793375     1.000000
    3.4 B1g   1  3d2-         0.387306     1.000000
    4.4 B1g   1  3d2-         0.189073     1.000000
    5.4 B1g   1  3d2-         0.092301     1.000000
    6.4 B1g   1  3d2-         0.036920     1.000000
    7.4 B1g   1  5g2-         0.924495     1.000000
    8.4 B1g   1  5g4-         0.924495     1.000000
    9.4 B1g   1  5g2-         0.503029     1.000000
   10.4 B1g   1  5g4-         0.503029     1.000000
   11.4 B1g   1  5g2-         0.273704     1.000000
   12.4 B1g   1  5g4-         0.273704     1.000000
   13.4 B1g   1  5g2-         0.109482     1.000000
   14.4 B1g   1  5g4-         0.109482     1.000000
   15.4 B1g   1  7i2-         0.780603     1.000000
   16.4 B1g   1  7i6-         0.780603     1.000000
   17.4 B1g   1  7i4-         0.780603     1.000000
   18.4 B1g   1  7i2-         0.312241     1.000000
   19.4 B1g   1  7i6-         0.312241     1.000000
   20.4 B1g   1  7i4-         0.312241     1.000000
    1.5 B1u   1  2pz         22.641155     0.000052
                             10.174686    -0.000675
                              4.572392     0.011276
                              2.054783    -0.074628
                              0.923397    -0.012070
                              0.414964     0.216919
                              0.186480     0.438735
                              0.083802     0.385126
                              0.037660     0.108074
    2.5 B1u   1  2pz          0.991895     1.000000
    3.5 B1u   1  2pz          0.450546     1.000000
    4.5 B1u   1  2pz          0.204650     1.000000
    5.5 B1u   1  2pz          0.092958     1.000000
    6.5 B1u   1  2pz          0.042224     1.000000
    7.5 B1u   1  2pz          0.016890     1.000000
    8.5 B1u   1  4f0          0.838223     1.000000
    9.5 B1u   1  4f2+         0.838223     1.000000
   10.5 B1u   1  4f0          0.475035     1.000000
   11.5 B1u   1  4f2+         0.475035     1.000000
   12.5 B1u   1  4f0          0.269210     1.000000
   13.5 B1u   1  4f2+         0.269210     1.000000
   14.5 B1u   1  4f0          0.152566     1.000000
   15.5 B1u   1  4f2+         0.152566     1.000000
   16.5 B1u   1  4f0          0.061026     1.000000
   17.5 B1u   1  4f2+         0.061026     1.000000
   18.5 B1u   1  6h2+         0.848005     1.000000
   19.5 B1u   1  6h4+         0.848005     1.000000
   20.5 B1u   1  6h0          0.848005     1.000000
   21.5 B1u   1  6h2+         0.448090     1.000000
   22.5 B1u   1  6h4+         0.448090     1.000000
   23.5 B1u   1  6h0          0.448090     1.000000
   24.5 B1u   1  6h2+         0.179236     1.000000
   25.5 B1u   1  6h4+         0.179236     1.000000
   26.5 B1u   1  6h0          0.179236     1.000000
    1.6 B2g   1  3d1+         1.625185     1.000000
    2.6 B2g   1  3d1+         0.793375     1.000000
    3.6 B2g   1  3d1+         0.387306     1.000000
    4.6 B2g   1  3d1+         0.189073     1.000000
    5.6 B2g   1  3d1+         0.092301     1.000000
    6.6 B2g   1  3d1+         0.036920     1.000000
    7.6 B2g   1  5g1+         0.924495     1.000000
    8.6 B2g   1  5g3+         0.924495     1.000000
    9.6 B2g   1  5g1+         0.503029     1.000000
   10.6 B2g   1  5g3+         0.503029     1.000000
   11.6 B2g   1  5g1+         0.273704     1.000000
   12.6 B2g   1  5g3+         0.273704     1.000000
   13.6 B2g   1  5g1+         0.109482     1.000000
   14.6 B2g   1  5g3+         0.109482     1.000000
   15.6 B2g   1  7i5+         0.780603     1.000000
   16.6 B2g   1  7i3+         0.780603     1.000000
   17.6 B2g   1  7i1+         0.780603     1.000000
   18.6 B2g   1  7i5+         0.312241     1.000000
   19.6 B2g   1  7i3+         0.312241     1.000000
   20.6 B2g   1  7i1+         0.312241     1.000000
    1.7 B3g   1  3d1-         1.625185     1.000000
    2.7 B3g   1  3d1-         0.793375     1.000000
    3.7 B3g   1  3d1-         0.387306     1.000000
    4.7 B3g   1  3d1-         0.189073     1.000000
    5.7 B3g   1  3d1-         0.092301     1.000000
    6.7 B3g   1  3d1-         0.036920     1.000000
    7.7 B3g   1  5g1-         0.924495     1.000000
    8.7 B3g   1  5g3-         0.924495     1.000000
    9.7 B3g   1  5g1-         0.503029     1.000000
   10.7 B3g   1  5g3-         0.503029     1.000000
   11.7 B3g   1  5g1-         0.273704     1.000000
   12.7 B3g   1  5g3-         0.273704     1.000000
   13.7 B3g   1  5g1-         0.109482     1.000000
   14.7 B3g   1  5g3-         0.109482     1.000000
   15.7 B3g   1  7i5-         0.780603     1.000000
   16.7 B3g   1  7i3-         0.780603     1.000000
   17.7 B3g   1  7i1-         0.780603     1.000000
   18.7 B3g   1  7i5-         0.312241     1.000000
   19.7 B3g   1  7i3-         0.312241     1.000000
   20.7 B3g   1  7i1-         0.312241     1.000000
    1.8 Au    1  4f2-         0.838223     1.000000
    2.8 Au    1  4f2-         0.475035     1.000000
    3.8 Au    1  4f2-         0.269210     1.000000
    4.8 Au    1  4f2-         0.152566     1.000000
    5.8 Au    1  4f2-         0.061026     1.000000
    6.8 Au    1  6h4-         0.848005     1.000000
    7.8 Au    1  6h2-         0.848005     1.000000
    8.8 Au    1  6h4-         0.448090     1.000000
    9.8 Au    1  6h2-         0.448090     1.000000
   10.8 Au    1  6h4-         0.179236     1.000000
   11.8 Au    1  6h2-         0.179236     1.000000

 NUCLEAR CHARGE:                    4
 NUMBER OF PRIMITIVE AOS:         325
 NUMBER OF SYMMETRY AOS:          220
 NUMBER OF CONTRACTIONS:          188   (  39Ag  +  26B3u +  26B2u +  20B1g +  26B1u +  20B2g +  20B3g +  11Au  )
 NUMBER OF CORE ORBITALS:           0   (   0Ag  +   0B3u +   0B2u +   0B1g +   0B1u +   0B2g +   0B3g +   0Au  )
 NUMBER OF VALENCE ORBITALS:        4   (   1Ag  +   1B3u +   1B2u +   0B1g +   1B1u +   0B2g +   0B3g +   0Au  )


 NUCLEAR REPULSION ENERGY    0.00000000

 EXTRA SYMMETRY OF AOS IN SYMMETRY 1:   1 1 1 1 1 1 1 2 3 2   3 2 3 2 3 2 3 2 3 4   5 6 4 5 6 4 5 6 4 5   6 7 8 910 7 8 910
 EXTRA SYMMETRY OF AOS IN SYMMETRY 2:   1 1 1 1 1 1 1 2 3 2   3 2 3 2 3 2 3 4 5 6   4 5 6 4 5 6
 EXTRA SYMMETRY OF AOS IN SYMMETRY 3:   1 1 1 1 1 1 1 2 3 2   3 2 3 2 3 2 3 4 5 6   4 5 6 4 5 6
 EXTRA SYMMETRY OF AOS IN SYMMETRY 4:   1 1 1 1 1 1 2 3 2 3   2 3 2 3 4 5 6 4 5 6
 EXTRA SYMMETRY OF AOS IN SYMMETRY 5:   1 1 1 1 1 1 1 2 3 2   3 2 3 2 3 2 3 4 5 6   4 5 6 4 5 6
 EXTRA SYMMETRY OF AOS IN SYMMETRY 6:   1 1 1 1 1 1 2 3 2 3   2 3 2 3 4 5 6 4 5 6
 EXTRA SYMMETRY OF AOS IN SYMMETRY 7:   1 1 1 1 1 1 2 3 2 3   2 3 2 3 4 5 6 4 5 6
 EXTRA SYMMETRY OF AOS IN SYMMETRY 8:   1 1 1 1 1 2 3 2 3 2   3

 Eigenvalues of metric

         1 0.235E-03 0.220E-02 0.123E-01 0.123E-01 0.170E-01 0.527E-01 0.527E-01 0.527E-01
         2 0.237E-03 0.901E-02 0.111E-01 0.111E-01 0.493E-01 0.108E+00 0.108E+00 0.185E+00
         3 0.237E-03 0.901E-02 0.111E-01 0.111E-01 0.493E-01 0.108E+00 0.108E+00 0.185E+00
         4 0.123E-01 0.527E-01 0.527E-01 0.684E-01 0.268E+00 0.381E+00 0.381E+00 0.533E+00
         5 0.237E-03 0.901E-02 0.111E-01 0.111E-01 0.493E-01 0.108E+00 0.108E+00 0.185E+00
         6 0.123E-01 0.527E-01 0.527E-01 0.684E-01 0.268E+00 0.381E+00 0.381E+00 0.533E+00
         7 0.123E-01 0.527E-01 0.527E-01 0.684E-01 0.268E+00 0.381E+00 0.381E+00 0.533E+00
         8 0.111E-01 0.108E+00 0.185E+00 0.185E+00 0.508E+00 0.843E+00 0.843E+00 0.131E+01


 Contracted 2-electron integrals neglected if value below      1.0D-12
 AO integral compression algorithm  1   Integral accuracy      1.0D-12

     117.703 MB (compressed) written to integral file ( 46.4%)


 NUMBER OF SORTED TWO-ELECTRON INTEGRALS:   20212815.     BUFFER LENGTH:  32768
 NUMBER OF SEGMENTS:   2  SEGMENT LENGTH:   15998787      RECORD LENGTH: 524288

 Memory used in sort:      16.56 MW

 SORT1 READ    31710950. AND WROTE    13213985. INTEGRALS IN     39 RECORDS. CPU TIME:     0.73 SEC, REAL TIME:     1.00 SEC
 SORT2 READ    13213985. AND WROTE    20212815. INTEGRALS IN    449 RECORDS. CPU TIME:     0.46 SEC, REAL TIME:     0.88 SEC

 FILE SIZES:   FILE 1:   138.4 MBYTE,  FILE 4:   163.6 MBYTE,   TOTAL:    302.0 MBYTE

 OPERATOR DM      FOR CENTER  0  COORDINATES:    0.000000    0.000000    0.000000
 OPERATOR EKIN    FOR CENTER  0  COORDINATES:    0.000000    0.000000    0.000000
 OPERATOR POT     FOR CENTER  0  COORDINATES:    0.000000    0.000000    0.000000


 **********************************************************************************************************************************
 DATASETS  * FILE   NREC   LENGTH (MB)   RECORD NAMES
              1      20       96.61       500      610      700      900      950      970     1000      129      960     1100   
                                          VAR    BASINP    GEOM    SYMINP    ZMAT    AOBASIS   BASIS     P2S    ABASIS      S 
                                         1400     1410     1420     1200     1210     1080     1600     1650     1300     1700   
                                         EKIN       V       ECP      H0       H01     AOSYM     SMH    MOLCAS    ERIS     OPER   

 PROGRAMS   *        TOTAL       INT
 CPU TIMES  *         6.94      6.86
 REAL TIME  *        17.29 SEC
 DISK USED  *       302.35 MB      
 **********************************************************************************************************************************


 PROGRAM * RHF-SCF (OPEN SHELL)       Authors: W. Meyer, H.-J. Werner


 NUMBER OF ELECTRONS:       3+    1-    SPACE SYMMETRY=6    SPIN SYMMETRY: Triplet 
 CONVERGENCE THRESHOLDS:    1.00E-05 (Density)    1.00E-07 (Energy)
 MAX. NUMBER OF ITERATIONS:       60
 INTERPOLATION TYPE:            DIIS
 INTERPOLATION STEPS:              2 (START)      1 (STEP)
 LEVEL SHIFTS:                 -0.60 (CLOSED) -0.30 (OPEN) 

 Number of closed-shell orbitals:    1 (   1   0   0   0   0   0   0   0 )
 Number of open-shell orbitals:      2 (   0   1   0   0   1   0   0   0 )



   Atom=GE basis=ECP28MDF_GUESS    lmin=0  lmax=1

 Orbital guess generated from atomic densities. Full valence occupancy:    1   1   1   0   1   0   0   0


 Molecular orbital dump at record        2100.2

 ITERATION    DDIFF          GRAD             ENERGY        2-EL.EN.            DIPOLE MOMENTS         DIIS   ORB.
    1      0.000D+00      0.000D+00        -3.64813037      3.675233    0.00000    0.00000    0.00000    0    start
    2      0.000D+00      0.446D-02        -3.65905459      3.800033    0.00000    0.00000    0.00000    1    diag,B
    3      0.400D-02      0.217D-02        -3.66369805      3.889540    0.00000    0.00000    0.00000    2    diag,B
    4      0.302D-02      0.104D-02        -3.66483972      3.929506    0.00000    0.00000    0.00000    3    diag,B
    5      0.190D-02      0.304D-03        -3.66489989      3.932892    0.00000    0.00000    0.00000    4    diag,B
    6      0.555D-03      0.797D-04        -3.66490275      3.932877    0.00000    0.00000    0.00000    5    diag,B
    7      0.244D-03      0.166D-04        -3.66490285      3.932839    0.00000    0.00000    0.00000    6    fixocc
    8      0.553D-04      0.452D-05        -3.66490286      3.932814    0.00000    0.00000    0.00000    7    diag,B
    9      0.117D-04      0.131D-05        -3.66490286      3.932815    0.00000    0.00000    0.00000    8    diag,B
   10      0.535D-05      0.167D-06        -3.66490286      3.932815    0.00000    0.00000    0.00000    0    orth

 Final alpha occupancy:   1   1   0   0   1   0   0   0
 Final beta  occupancy:   1   0   0   0   0   0   0   0

 !RHF STATE 1.6 Energy                 -3.664902857299
 Nuclear energy                         0.00000000
 One-electron energy                   -5.63131038
 Two-electron energy                    1.96640752
 Virial quotient                       -2.66853519
 !RHF STATE 1.6 Dipole moment           0.00000000     0.00000000     0.00000000
 Dipole moment /Debye                   0.00000000     0.00000000     0.00000000
 

 !RHF expec          <1.6|EKIN|1.6>     1.373376253357
 
 !RHF expec           <1.6|POT|1.6>    -1.867834893891

 ELECTRON ORBITALS
 =================


   Orb  Occ    Energy  Couls-En    Coefficients

                                   1 1s      1 1s      1 1s      1 1s      1 1s      1 1s      1 1s      1 3d0     1 3d2+    1 3d0  
                                   1 3d2+    1 3d0     1 3d2+    1 3d0     1 3d2+    1 3d0     1 3d2+    1 3d0     1 3d2+    1 5g0  
                                   1 5g4+    1 5g2+    1 5g0     1 5g4+    1 5g2+    1 5g0     1 5g4+    1 5g2+    1 5g0     1 5g4+ 
                                   1 5g2+    1 7i6+    1 7i4+    1 7i2+    1 7i0     1 7i6+    1 7i4+    1 7i2+    1 7i0  

   1.1   2    -0.5631   -2.1735  1.000562 -0.000052  0.000760 -0.001886  0.002700 -0.003332  0.001481  0.000079  0.000137  0.000102
                                 0.000176 -0.000992 -0.001719  0.001109  0.001921  0.003165  0.005482  0.000513  0.000889 -0.000001
                                -0.000002 -0.000002  0.000006  0.000012  0.000009 -0.000021 -0.000041 -0.000031 -0.000023 -0.000045
                                -0.000034 -0.000000 -0.000000 -0.000000 -0.000000  0.000000  0.000000  0.000000  0.000000

                                   1 2px     1 2px     1 2px     1 2px     1 2px     1 2px     1 2px     1 4f1+    1 4f3+    1 4f1+ 
                                   1 4f3+    1 4f1+    1 4f3+    1 4f1+    1 4f3+    1 4f1+    1 4f3+    1 6h1+    1 6h3+    1 6h5+ 
                                   1 6h1+    1 6h3+    1 6h5+    1 6h1+    1 6h3+    1 6h5+ 

   1.2   +    -0.2861   -1.4914  0.999139 -0.000176  0.000523 -0.000506  0.001724 -0.001433  0.001114 -0.000001 -0.000004 -0.000009
                                -0.000034 -0.000023 -0.000088  0.000016  0.000064  0.000022  0.000086  0.000000  0.000000  0.000000
                                -0.000000 -0.000000 -0.000000 -0.000000 -0.000001 -0.000002

                                   1 2pz     1 2pz     1 2pz     1 2pz     1 2pz     1 2pz     1 2pz     1 4f0     1 4f2+    1 4f0  
                                   1 4f2+    1 4f0     1 4f2+    1 4f0     1 4f2+    1 4f0     1 4f2+    1 6h2+    1 6h4+    1 6h0  
                                   1 6h2+    1 6h4+    1 6h0     1 6h2+    1 6h4+    1 6h0  

   1.5   +    -0.2861   -1.4914  0.999139 -0.000176  0.000523 -0.000506  0.001724 -0.001433  0.001114 -0.000002 -0.000003 -0.000022
                                -0.000028 -0.000055 -0.000072  0.000040  0.000052  0.000055  0.000070  0.000000  0.000000  0.000000
                                -0.000000 -0.000000 -0.000000 -0.000001 -0.000001 -0.000001

 HOMO      1.2    -0.286110 =      -7.7855eV
 LUMO      1.3    -0.015904 =      -0.4328eV
 LUMO-HOMO         0.270206 =       7.3527eV


 **********************************************************************************************************************************
 DATASETS  * FILE   NREC   LENGTH (MB)   RECORD NAMES
              1      20       96.61       500      610      700      900      950      970     1000      129      960     1100   
                                          VAR    BASINP    GEOM    SYMINP    ZMAT    AOBASIS   BASIS     P2S    ABASIS      S 
                                         1400     1410     1420     1200     1210     1080     1600     1650     1300     1700   
                                         EKIN       V       ECP      H0       H01     AOSYM     SMH    MOLCAS    ERIS     OPER   

              2       4        2.92       700     1000      520     2100   
                                         GEOM     BASIS   MCVARS     RHF  

 PROGRAMS   *        TOTAL        HF       INT
 CPU TIMES  *         7.53      0.59      6.86
 REAL TIME  *        18.05 SEC
 DISK USED  *       302.35 MB      
 **********************************************************************************************************************************
 SETTING SCF(I)         =        -3.66490286  AU                              
 SETTING _CC_NORM_MAX   =         2.00000000                                  


 PROGRAM * UHF-SCF       Authors: W. Meyer, H.-J. Werner


 NUMBER OF ELECTRONS:       3+    1-    SPACE SYMMETRY=6    SPIN SYMMETRY: Triplet 
 CONVERGENCE THRESHOLDS:    1.00E-05 (Density)    1.00E-07 (Energy)
 MAX. NUMBER OF ITERATIONS:        0
 INTERPOLATION TYPE:            DIIS
 INTERPOLATION STEPS:              2 (START)      1 (STEP)
 LEVEL SHIFTS:                  0.20 (ALPHA)   0.20 (BETA) 

 Number of closed-shell orbitals:    1 (   1   0   0   0   0   0   0   0 )
 Number of open-shell orbitals:      2 (   0   1   0   0   1   0   0   0 )


 Molecular orbitals read from record     2100.2  Type=RHF/CANONICAL (state 1.6)

 Molecular orbital dump at record        2200.2

 Initial alpha occupation   1   1   0   0   1   0   0   0
 Initial beta  occupation   1   0   0   0   0   0   0   0

 ITERATION    DDIFF          GRAD             ENERGY        2-EL.EN.            DIPOLE MOMENTS         DIIS
    1      0.000D+00      0.000D+00        -3.66490286      3.932815    0.00000    0.00000    0.00000    0
 
 Final alpha occupancy:   1   1   0   0   1   0   0   0
 Final beta  occupancy:   1   0   0   0   0   0   0   0

 !UHF STATE 1.6 Energy                 -3.664902857299
 Nuclear energy                         0.00000000
 One-electron energy                   -5.63131038
 Two-electron energy                    1.96640752
 Virial quotient                       -2.66853519
 !UHF STATE 1.6 Dipole moment           0.00000000     0.00000000     0.00000000
 Dipole moment /Debye                   0.00000000     0.00000000     0.00000000
 

 !UHF expec          <1.6|EKIN|1.6>     1.373376253357
 
 !UHF expec           <1.6|POT|1.6>    -1.867834893891

 ELECTRON ORBITALS FOR POSITIVE SPIN
 ===================================


   Orb  Occ    Energy  Couls-En    Coefficients

                                   1 1s      1 1s      1 1s      1 1s      1 1s      1 1s      1 1s      1 3d0     1 3d2+    1 3d0  
                                   1 3d2+    1 3d0     1 3d2+    1 3d0     1 3d2+    1 3d0     1 3d2+    1 3d0     1 3d2+    1 5g0  
                                   1 5g4+    1 5g2+    1 5g0     1 5g4+    1 5g2+    1 5g0     1 5g4+    1 5g2+    1 5g0     1 5g4+ 
                                   1 5g2+    1 7i6+    1 7i4+    1 7i2+    1 7i0     1 7i6+    1 7i4+    1 7i2+    1 7i0  

   1.1   +    -0.5631   -2.1735  1.000562 -0.000052  0.000760 -0.001886  0.002700 -0.003332  0.001481  0.000079  0.000137  0.000102
                                 0.000176 -0.000992 -0.001719  0.001109  0.001921  0.003165  0.005482  0.000513  0.000889 -0.000001
                                -0.000002 -0.000002  0.000006  0.000012  0.000009 -0.000021 -0.000041 -0.000031 -0.000023 -0.000045
                                -0.000034 -0.000000 -0.000000 -0.000000 -0.000000  0.000000  0.000000  0.000000  0.000000

                                   1 2px     1 2px     1 2px     1 2px     1 2px     1 2px     1 2px     1 4f1+    1 4f3+    1 4f1+ 
                                   1 4f3+    1 4f1+    1 4f3+    1 4f1+    1 4f3+    1 4f1+    1 4f3+    1 6h1+    1 6h3+    1 6h5+ 
                                   1 6h1+    1 6h3+    1 6h5+    1 6h1+    1 6h3+    1 6h5+ 

   1.2   +    -0.2861   -1.4914  0.999139 -0.000176  0.000523 -0.000506  0.001724 -0.001433  0.001114 -0.000001 -0.000004 -0.000009
                                -0.000034 -0.000023 -0.000088  0.000016  0.000064  0.000022  0.000086  0.000000  0.000000  0.000000
                                -0.000000 -0.000000 -0.000000 -0.000000 -0.000001 -0.000002

                                   1 2pz     1 2pz     1 2pz     1 2pz     1 2pz     1 2pz     1 2pz     1 4f0     1 4f2+    1 4f0  
                                   1 4f2+    1 4f0     1 4f2+    1 4f0     1 4f2+    1 4f0     1 4f2+    1 6h2+    1 6h4+    1 6h0  
                                   1 6h2+    1 6h4+    1 6h0     1 6h2+    1 6h4+    1 6h0  

   1.5   +    -0.2861   -1.4914  0.999139 -0.000176  0.000523 -0.000506  0.001724 -0.001433  0.001114 -0.000002 -0.000003 -0.000022
                                -0.000028 -0.000055 -0.000072  0.000040  0.000052  0.000055  0.000070  0.000000  0.000000  0.000000
                                -0.000000 -0.000000 -0.000000 -0.000001 -0.000001 -0.000001

 ELECTRON ORBITALS FOR NEGATIVE SPIN
 ===================================


   Orb  Occ    Energy  Couls-En    Coefficients

                                   1 1s      1 1s      1 1s      1 1s      1 1s      1 1s      1 1s      1 3d0     1 3d2+    1 3d0  
                                   1 3d2+    1 3d0     1 3d2+    1 3d0     1 3d2+    1 3d0     1 3d2+    1 3d0     1 3d2+    1 5g0  
                                   1 5g4+    1 5g2+    1 5g0     1 5g4+    1 5g2+    1 5g0     1 5g4+    1 5g2+    1 5g0     1 5g4+ 
                                   1 5g2+    1 7i6+    1 7i4+    1 7i2+    1 7i0     1 7i6+    1 7i4+    1 7i2+    1 7i0  

   1.1   -    -0.5631   -2.1735  1.000562 -0.000052  0.000760 -0.001886  0.002700 -0.003332  0.001481  0.000079  0.000137  0.000102
                                 0.000176 -0.000992 -0.001719  0.001109  0.001921  0.003165  0.005482  0.000513  0.000889 -0.000001
                                -0.000002 -0.000002  0.000006  0.000012  0.000009 -0.000021 -0.000041 -0.000031 -0.000023 -0.000045
                                -0.000034 -0.000000 -0.000000 -0.000000 -0.000000  0.000000  0.000000  0.000000  0.000000

 HOMO      1.2    -0.286110 =      -7.7855eV
 LUMO     -1.2    -0.286110 =      -7.7855eV
 LUMO-HOMO         0.000000 =       0.0000eV

 EXPECTATION VALUE OF S**2:             2.00000000

 Occupation number threshold for canonical orbitals:  1.999000 (occupied),  0.001000 (virtual)

 Number of pseudo-canonical orbitals per symmetry:    1   0   0   0   0   0   0   0
 Number of active natural orbitals per symmetry:      0   1   0   0   1   0   0   0

 NATURAL CHARGE ORBITALS
 =======================


   Orb     Occ        Energy       Coefficients

                                   1 1s      1 1s      1 1s      1 1s      1 1s      1 1s      1 1s      1 3d0     1 3d2+    1 3d0  
                                   1 3d2+    1 3d0     1 3d2+    1 3d0     1 3d2+    1 3d0     1 3d2+    1 3d0     1 3d2+    1 5g0  
                                   1 5g4+    1 5g2+    1 5g0     1 5g4+    1 5g2+    1 5g0     1 5g4+    1 5g2+    1 5g0     1 5g4+ 
                                   1 5g2+    1 7i6+    1 7i4+    1 7i2+    1 7i0     1 7i6+    1 7i4+    1 7i2+    1 7i0  

   1.1  2.00000    -0.563137     1.000562 -0.000052  0.000760 -0.001886  0.002700 -0.003332  0.001481  0.000079  0.000137  0.000102
                                 0.000176 -0.000992 -0.001719  0.001109  0.001921  0.003165  0.005482  0.000513  0.000889 -0.000001
                                -0.000002 -0.000002  0.000006  0.000012  0.000009 -0.000021 -0.000041 -0.000031 -0.000023 -0.000045
                                -0.000034 -0.000000 -0.000000 -0.000000 -0.000000  0.000000  0.000000  0.000000  0.000000

                                   1 2px     1 2px     1 2px     1 2px     1 2px     1 2px     1 2px     1 4f1+    1 4f3+    1 4f1+ 
                                   1 4f3+    1 4f1+    1 4f3+    1 4f1+    1 4f3+    1 4f1+    1 4f3+    1 6h1+    1 6h3+    1 6h5+ 
                                   1 6h1+    1 6h3+    1 6h5+    1 6h1+    1 6h3+    1 6h5+ 

   1.2  1.00000    -0.103812     0.999139 -0.000176  0.000523 -0.000506  0.001724 -0.001433  0.001114 -0.000001 -0.000004 -0.000009
                                -0.000034 -0.000023 -0.000088  0.000016  0.000064  0.000022  0.000086  0.000000  0.000000  0.000000
                                -0.000000 -0.000000 -0.000000 -0.000000 -0.000001 -0.000002

                                   1 2pz     1 2pz     1 2pz     1 2pz     1 2pz     1 2pz     1 2pz     1 4f0     1 4f2+    1 4f0  
                                   1 4f2+    1 4f0     1 4f2+    1 4f0     1 4f2+    1 4f0     1 4f2+    1 6h2+    1 6h4+    1 6h0  
                                   1 6h2+    1 6h4+    1 6h0     1 6h2+    1 6h4+    1 6h0  

   1.5  1.00000    -0.103812     0.999139 -0.000176  0.000523 -0.000506  0.001724 -0.001433  0.001114 -0.000002 -0.000003 -0.000022
                                -0.000028 -0.000055 -0.000072  0.000040  0.000052  0.000055  0.000070  0.000000  0.000000  0.000000
                                -0.000000 -0.000000 -0.000000 -0.000001 -0.000001 -0.000001

 Natural orbitals saved to record    2200.2 (Orbital set 3)

 Orbital spaces for UNO-CAS (Min. occupation: 0.020  Max. occupation: 1.980):

 Closed:        1   0   0   0   0   0   0   0
 Active:        0   1   0   0   1   0   0   0

 No convergence



 **********************************************************************************************************************************
 DATASETS  * FILE   NREC   LENGTH (MB)   RECORD NAMES
              1      20       96.61       500      610      700      900      950      970     1000      129      960     1100   
                                          VAR    BASINP    GEOM    SYMINP    ZMAT    AOBASIS   BASIS     P2S    ABASIS      S 
                                         1400     1410     1420     1200     1210     1080     1600     1650     1300     1700   
                                         EKIN       V       ECP      H0       H01     AOSYM     SMH    MOLCAS    ERIS     OPER   

              2       5        5.69       700     1000      520     2100     2200   
                                         GEOM     BASIS   MCVARS     RHF      UHF  

 PROGRAMS   *        TOTAL       UHF        HF       INT
 CPU TIMES  *         7.60      0.07      0.59      6.86
 REAL TIME  *        18.25 SEC
 DISK USED  *       302.35 MB      
 **********************************************************************************************************************************
 SETTING SCF(I)         =        -3.66490286  AU                              


 PROGRAM * MRCC (General Multireference Coupled Cluster)    Author: M. Kallay, 2000-2005

 ***  Initialisation ***

   0 Spin projections
 
 Molecular orbitals read from record     2200.2  Type=UHF/ALPHA (state 1.6)

 ?Warning: UHF not converged
 Molecular orbitals read from record     2200.2  Type=UHF/BETA (state 1.6)

 ?Warning: UHF not converged
 
 Frozen orbitals:              0 (  0  0  0  0  0  0  0  0)
 Active orbitals:            188 ( 39 26 26 20 26 20 20 11)
 Active electrons:             4
 Spin quantum number:          1.0

 Transformed integrals will be written to file mrccdir/mrcc_6866/fort.55

 Load integrals                7.6 sec
 Transform integrals          17.1 sec
 Storage for integrals:      119071012
 Remaining memory:           *********

 Core energy:               0.00000000
 
 MRCC Input:
     4     0     0     0     3     0     0     6     0     0     0     1     1     0     0     7     0     0   0.000     0   64000
  ex.lev,nsing,ntrip, rest,method,dens,conver,symm, diag, CS ,spatial, HF, ndoub,nacto,nactv, tol, maxex, sacc, freq,  dboc,   mem
  2  0  0  0  0  0  0  0  0  0  0  0  0  0  0  0  0  0  0  0  0  0  0  0  0  0  0  0  0  0  0  0  0  0  0  0  0  0  0  1  0  0  0  0  0  0  0  0  0  0  0  0  0  0  0  0  0  0  0  0  0  0  0  0  0  0  0  0  0  0  0  0  0  0  0  0  0  0  0  0  0  0  0  0  0  0  0  0  0  0  0  0  0  0  0  0  0  0  0  0  0  0  0  0  0  0  0  0  0  0  0  1  0  0  0  0  0  0  0  0  0  0  0  0  0  0  0  0  0  0  0  0  0  0  0  0  0  0  0  0  0  0  0  0  0  0  0  0  0  0  0  0  0  0  0  0  0  0  0  0  0  0  0  0  0  0  0  0  0  0  0  0  0  0  0  0  0  0  0  0  0  0  0  0  0  0  0  0
 MRCC Input end
 Variable memory released
 MRCC now being run, temporary output in /global/cscratch1/sd/aannabe/mrccdir/mrcc_6866/mrcc.out
 **********************************************************************
                          MRCC program system
 **********************************************************************

                              Written by
  Mihaly Kallay, Zoltan Rolik, Jozsef Csontos, Peter Nagy, Gyula Samu,
      David Mester, Jozsef Csoka, Bernat Szabo, Istvan Ladjanszki,
       Lorant Szegedy, Bence Ladoczki, Klara Petrov, Mate Farkas,
                    Pal D. Mezei, and Bence Hegely

        Department of Physical Chemistry and Materials Science
            Budapest University of Technology and Economics
                  Budapest P.O.Box 91, H-1521 Hungary

                              www.mrcc.hu

                       Release date: May 23, 2018

 ************************ 2019-06-25 13:13:12 *************************
 Executing goldstone...

 Generation of CC equations in terms of H and T...
 Generation of antisymmetrized Goldstone diagrams...
 Number of diagrams in T^1 equations:    15
 Number of diagrams in T^2 equations:    38
 Number of diagrams in T^3 equations:    49
 Number of diagrams in T^4 equations:     5
 Translation of diagrams to factorized equations...
 Optimizing intermediate calculation...
 Number of floating-point operations per iteration step:   5.7097E+11
 Probable CPU time per iteration step (hours):      5.71
 Required memory (Mbytes):  155635.9
 Number of intermediates:                                  80
 Number of intermediates to be stored:                     32
 Length of intermediate file (Mbytes):    2422.2

 ************************ 2019-06-25 13:13:13 *************************
 Executing xmrcc...

 **********************************************************************
 CC(3)(4) calculation


 Allocation of****** Mbytes of memory...
 Number of spinorbitals:                   376
 Number of alpha electrons:                        3
 Number of beta electrons:                         1
 Spin multiplicity:                     2
 z-component of spin:  1.0
 Spatial symmetry:                      6
 Convergence criterion:  1.0E-07
 Construction of occupation graphs...
 Number of                     0 -fold excitations:                      1
 Number of                     1 -fold excitations:                    126
 Number of                     2 -fold excitations:                  20068
 Number of                     3 -fold excitations:                1323950
 Total number of configurations:                1344145
 Calculation of coupling coefficients...
 Length of intermediate file (Mbytes):    1822.8

 ======================================================================

 Spin case  1   Alpha:  3   Beta:  1
 Number of excitations:               24251915
 Number of                     4 -fold excitations:               24251915

 Memory requirements /Mbyte/:
               Minimal        Optimal
 Real*8:       4012.0013      9531.1702
 Integer:       263.3254
 Total:        4275.3267      9794.4956


 ************************ 2019-06-25 13:13:35 *************************
 Executing mrcc...

 **********************************************************************
 CCSDT(Q) calculation


 Allocation of 9531.2 Mbytes of memory...
 Number of spinorbitals: 376
 Number of alpha electrons:  3
 Number of beta  electrons:  1
 Spin multiplicity: 2
 z-component of spin:  1.0
 Spatial symmetry: 6
 Convergence criterion:  1.0E-07
 Construction of occupation graphs...
 Number of 0-fold excitations: 1
 Number of 1-fold excitations: 126
 Number of 2-fold excitations: 20068
 Number of 3-fold excitations: 1323950
 Total number of determinants: 1344145
 Calculation of coupling coefficients...
 Initial cluster amplitudes are generated.
 Length of intermediate file (Mbytes):    1822.8
 Reading integral list from unit 55...
 Sorting integrals...
 Sorting integrals...
 Sorting integrals...
 Sorting integrals...
 Energy of reference determinant [au]:      -3.664902857299
 Calculation of MP denominators...

 Starting CC iteration...
 ======================================================================
 Norm of residual vector:     0.39191363
 CPU time [min]:     4.724                   Wall time [min]:     4.746

 Iteration  1  CC energy:    -3.73092491  Energy decrease:   0.06602205
 ======================================================================
 Norm of residual vector:     0.11817173
 CPU time [min]:     6.631                   Wall time [min]:     6.659

 Iteration  2  CC energy:    -3.73800796  Energy decrease:   0.00708305
 ======================================================================
 Norm of residual vector:     0.03519082
 CPU time [min]:     8.580                   Wall time [min]:     8.615

 Iteration  3  CC energy:    -3.74402947  Energy decrease:   0.00602151
 ======================================================================
 Norm of residual vector:     0.00935789
 CPU time [min]:    10.563                   Wall time [min]:    10.608

 Iteration  4  CC energy:    -3.74407215  Energy decrease:   0.00004267
 ======================================================================
 Norm of residual vector:     0.00263007
 CPU time [min]:    12.551                   Wall time [min]:    12.602

 Iteration  5  CC energy:    -3.74415717  Energy decrease:   0.00008502
 ======================================================================
 Norm of residual vector:     0.00082506
 CPU time [min]:    14.530                   Wall time [min]:    14.586

 Iteration  6  CC energy:    -3.74417221  Energy decrease:   0.00001504
 ======================================================================
 Norm of residual vector:     0.00025930
 CPU time [min]:    16.508                   Wall time [min]:    16.569

 Iteration  7  CC energy:    -3.74416087  Energy decrease:   0.00001133
 ======================================================================
 Norm of residual vector:     0.00007847
 CPU time [min]:    18.488                   Wall time [min]:    18.557

 Iteration  8  CC energy:    -3.74416068  Energy decrease:   0.00000019
 ======================================================================
 Norm of residual vector:     0.00002617
 CPU time [min]:    20.466                   Wall time [min]:    20.548

 Iteration  9  CC energy:    -3.74416197  Energy decrease:   0.00000129
 ======================================================================
 Norm of residual vector:     0.00000921
 CPU time [min]:    22.459                   Wall time [min]:    22.548

 Iteration 10  CC energy:    -3.74416172  Energy decrease:   0.00000026
 ======================================================================
 Norm of residual vector:     0.00000319
 CPU time [min]:    24.413                   Wall time [min]:    24.513

 Iteration 11  CC energy:    -3.74416160  Energy decrease:   0.00000011
 ======================================================================
 Norm of residual vector:     0.00000113
 CPU time [min]:    26.398                   Wall time [min]:    26.506

 Iteration 12  CC energy:    -3.74416166  Energy decrease:   0.00000005
 ======================================================================
 Norm of residual vector:     0.00000038
 CPU time [min]:    28.389                   Wall time [min]:    28.501

 Iteration 13  CC energy:    -3.74416166  Energy decrease:   2.9536E-09
 ======================================================================
 Norm of residual vector:     0.00000011
 CPU time [min]:    30.376                   Wall time [min]:    30.497

 Iteration 14  CC energy:    -3.74416165  Energy decrease:   0.00000001
 ======================================================================
 Norm of residual vector:     0.00000003
 CPU time [min]:    32.339                   Wall time [min]:    32.465

 Iteration 15  CC energy:    -3.74416166  Energy decrease:   7.4321E-10
 ======================================================================

 Iteration has converged in 15 steps.

 Final results:
 Total CCSDT energy [au]:             -3.744161655278
 Total MP2 energy [au]:               -3.730924910523

 Perturbative corrections are calculated...
 ======================================================================
 Spin case  1   Alpha:  3   Beta:  1
 Number of excitations:        24251915
 CPU time [min]:   257.671                   Wall time [min]:   257.814
 ======================================================================
 Number of 4-fold excitations: 24251915
 CPU time [min]:   257.671                   Wall time [min]:   257.827

 Total CCSDT[Q] energy [au]:          -3.744178455854
 Total CCSDT(Q) energy [au]:          -3.744218088679

 ************************ 2019-06-25 17:31:26 *************************
                      Normal termination of mrcc.
 **********************************************************************
 !CCSDT STATE 1.6 Energy               -3.744161655278
 !MP2 STATE 1.6 Energy                 -3.730924910523
 !CCSDT[Q] STATE 1.6 Energy            -3.744178455854
 !CCSDT(Q) STATE 1.6 Energy            -3.744218088679
 
 CPU-time for MRCC:          15460.3 sec
 Elapsed-time for MRCC:      15498.9 sec

 Variable memory set to 8000000000 words,  buffer space   230000 words



 **********************************************************************************************************************************
 DATASETS  * FILE   NREC   LENGTH (MB)   RECORD NAMES
              1      20       96.61       500      610      700      900      950      970     1000      129      960     1100   
                                          VAR    BASINP    GEOM    SYMINP    ZMAT    AOBASIS   BASIS     P2S    ABASIS      S 
                                         1400     1410     1420     1200     1210     1080     1600     1650     1300     1700   
                                         EKIN       V       ECP      H0       H01     AOSYM     SMH    MOLCAS    ERIS     OPER   

              2       5        5.69       700     1000      520     2100     2200   
                                         GEOM     BASIS   MCVARS     RHF      UHF  

 PROGRAMS   *        TOTAL      MRCC       UHF        HF       INT
 CPU TIMES  *     15772.39  15764.78      0.07      0.59      6.86
 REAL TIME  *     16905.83 SEC
 DISK USED  *       302.35 MB      
 **********************************************************************************************************************************
 SETTING POSTHF(I)      =        -3.74421809  AU                              
                                                                                                                                                                                                                                                                

       SCF           POSTHF       EKIN          POT
    -3.66490286   -3.74421809   1.37337625   -1.86783489
                                                  

 CCSDT(Q)/USERDEF energy=     -3.744218088679

        CCSDT(Q)        UHF-SCF         HF-SCF  
     -3.74421809     -3.66490286     -3.66490286
 **********************************************************************************************************************************
 Molpro calculation terminated
 Variable memory released
